segmentnr	original	analyzed	translated
['ZH_T49_2039_003:0986a02_0']	ä¸‰åœ‹éºäº‹å·ç¬¬ä¸‰	ä¸‰åœ‹éºäº‹å·ç¬¬ä¸‰	Samguk yusa, Volume 3
['ZH_T49_2039_003:0986a04_0']	3 èˆˆæ³•èˆˆæ³•ç¬¬ä¸‰	3 èˆˆæ³•èˆˆæ³•ç¬¬ä¸‰	Chapter 3: Propagation of the Dharma, Propagation of the Dharma, third.
['ZH_T49_2039_003:0986a05_0']	é †é“è‚‡éº—é †é“è‚‡éº—é“å…¬ä¹‹æ¬¡ã€‚äº¦æœ‰æ³•æ·±ç¾©æ·µæ›‡åš´ä¹‹æµã€‚ç›¸ç¹¼è€Œèˆˆæ•™ã€‚ğ¤‹¦å¤å‚³ç„¡æ–‡ã€‚ä»Š	é †é“è‚‡éº—é †é“è‚‡éº—é“å…¬ä¹‹æ¬¡ã€‚äº¦æœ‰æ³•æ·±ç¾©æ·µæ›‡åš´ä¹‹æµã€‚ç›¸ç¹¼è€Œèˆˆæ•™ã€‚ğ¤‹¦å¤å‚³ç„¡æ–‡ã€‚ä»Š	Sun Daozhao of the Later Yan, Sun Daozhao of the Later Yan, the next to Dao Gong. There were also those who were as deep in Dharma as Fashan and Tanyan. They succeeded in propagating the teachings. The ancient records have no text. Now
['ZH_T49_2039_003:0986a06_5']	äº¦ä¸æ•¢ç·¨æ¬¡ã€‚	äº¦ä¸æ•¢ç·¨æ¬¡ã€‚	I also dare not arrange them in order.
['ZH_T49_2039_003:0986a07_5', 'ZH_T49_2039_003:0986a07_16']	è©³è¦‹åƒ§å‚³é«˜éº—æœ¬è¨˜äº‘ã€‚ğŸ”½å°ç¸æ—ç‹å³ä½äºŒå¹´å£¬ç”³ã€‚	è©³è¦‹åƒ§å‚³é«˜éº—æœ¬è¨˜äº‘ã€‚ å°ç¸æ—ç‹å³ä½äºŒå¹´å£¬ç”³ã€‚	The Gaogouli National Records say:ğŸ”½In the second year of the reign of King Saro of Goguryeo, Renchen year.
['ZH_T49_2039_003:0986a08_13']	ä¹ƒæ±æ™‰å’¸å®‰äºŒå¹´å­æ­¦å¸å³ä½ä¹‹å¹´ä¹Ÿã€‚	ä¹ƒæ±æ™‰å’¸å®‰äºŒå¹´å­æ­¦å¸å³ä½ä¹‹å¹´ä¹Ÿã€‚	It was the year of Xian'an in the Eastern Jin, and the year Emperor Xiaowu of the Jin Dynasty ascended the throne.
['ZH_T49_2039_003:0986a09_6']	å‰ç§¦ç¬¦å …é£ä½¿åŠåƒ§é †é“ã€‚	å‰ç§¦ç¬¦å …é£ä½¿åŠåƒ§é †é“ã€‚	Fu Jian of the Former Qin sent envoys and monks Sun Dao.
['ZH_T49_2039_003:0986a09_17']	é€ä½›åƒç¶“æ–‡æ™‚å …éƒ½é—œä¸­ã€‚	é€ä½›åƒç¶“æ–‡æ™‚å …éƒ½é—œä¸­ã€‚	To deliver Buddhist images and scriptures. At that time, Jian's capital was in Guanzhong.
['ZH_T49_2039_003:0986a09_21']	å³é•·å®‰ã€‚	å³é•·å®‰ã€‚	It was Chang'an.
['ZH_T49_2039_003:0986a10_2']	åˆå››å¹´ç”²æˆŒã€‚	åˆå››å¹´ç”²æˆŒã€‚	Again, in the fourth year, Jiyou year.
['ZH_T49_2039_003:0986a10_8']	é˜¿é“ä¾†è‡ªæ™‰ã€‚	é˜¿é“ä¾†è‡ªæ™‰ã€‚	Ado came from the Jin Dynasty.
['ZH_T49_2039_003:0986a10_15']	æ˜å¹´ä¹™äº¥äºŒæœˆã€‚	æ˜å¹´ä¹™äº¥äºŒæœˆã€‚	The following year, Yihai year, the second month.
['ZH_T49_2039_003:0986a11_4']	å‰µè‚–é–€å¯ºä»¥ç½®é †é“ã€‚	å‰µè‚–é–€å¯ºä»¥ç½®é †é“ã€‚	He established Xiaomen Temple to place Sun Dao.
['ZH_T49_2039_003:0986a11_15']	åˆå‰µä¼Šå¼—è˜­å¯ºä»¥ç½®é˜¿é“ã€‚	åˆå‰µä¼Šå¼—è˜­å¯ºä»¥ç½®é˜¿é“ã€‚	He also established Yifolan Temple to place Ado.
['ZH_T49_2039_003:0986a12_4']	æ­¤é«˜éº—ä½›æ³•ä¹‹å§‹ã€‚	æ­¤é«˜éº—ä½›æ³•ä¹‹å§‹ã€‚	This is the beginning of Buddhism in Goguryeo.
['ZH_T49_2039_003:0986a12_17']	åƒ§å‚³ä½œäºŒé“ä¾†è‡ªé­äº‘è€…èª¤çŸ£ã€‚	åƒ§å‚³ä½œäºŒé“ä¾†è‡ªé­äº‘è€…èª¤çŸ£ã€‚	The monk's biography says that two monks came from Wei, which is a mistake.
['ZH_T49_2039_003:0986a13_6']	å¯¦è‡ªå‰ç§¦è€Œä¾†ã€‚	å¯¦è‡ªå‰ç§¦è€Œä¾†ã€‚	It is true that it has been so since the Qin dynasty.
['ZH_T49_2039_003:0986a13_15']	åˆäº‘è‚–é–€å¯ºä»Šèˆˆåœ‹ã€‚	åˆäº‘è‚–é–€å¯ºä»Šèˆˆåœ‹ã€‚	It also says that the temple now called Heungguk was originally called Simuksa.
['ZH_T49_2039_003:0986a14_7']	ä¼Šå¼—è˜­å¯ºä»Šèˆˆç¦è€…äº¦èª¤ã€‚	ä¼Šå¼—è˜­å¯ºä»Šèˆˆç¦è€…äº¦èª¤ã€‚	It is also a mistake to say that the temple now called Heungbok was originally called Ibeollam.
['ZH_T49_2039_003:0986a14_15']	æŒ‰éº—æ™‚éƒ½å®‰å¸‚åŸã€‚	æŒ‰éº—æ™‚éƒ½å®‰å¸‚åŸã€‚	According to the period of Goguryeo, the capital was located in Ansicheng.
['ZH_T49_2039_003:0986a15_2']	ä¸€åå®‰ä¸å¿½ã€‚	ä¸€åå®‰ä¸å¿½ã€‚	It was also called Andinghul.
['ZH_T49_2039_003:0986a15_14']	åœ¨é¼æ°´ä¹‹åŒ—é¼æ°´ä¸€åé´¨æ·¥ã€‚	åœ¨é¼æ°´ä¹‹åŒ—é¼æ°´ä¸€åé´¨æ·¥ã€‚	It is located north of Liaoshui, which is also called Yalu.
['ZH_T49_2039_003:0986a16_1']	ä»Šäº‘å®‰æ°‘æ±Ÿã€‚	ä»Šäº‘å®‰æ°‘æ±Ÿã€‚	It is now called Anminjiang.
['ZH_T49_2039_003:0986a16_11']	è±ˆæœ‰æ¾äº¬ä¹‹èˆˆåœ‹å¯ºåã€‚	è±ˆæœ‰æ¾äº¬ä¹‹èˆˆåœ‹å¯ºåã€‚	How could there be a temple called Heungguk in Songgyungwan?
['ZH_T49_2039_003:0986a16_14']	è®šæ›°ã€‚	è®šæ›°ã€‚	Praise:
['ZH_T49_2039_003:0986a17_0']	é´¨æ·¥æ˜¥æ·±æ¸šè‰é®®ã€€ã€€ç™½æ²™é·—é·ºç­‰é–‘çœ 	é´¨æ·¥æ˜¥æ·±æ¸šè‰é®®ã€€ã€€ç™½æ²™é·—é·ºç­‰é–‘çœ 	The reeds are lush and the white sand gulls and herons sleep peacefully by the Yalu River in spring.
['ZH_T49_2039_003:0986a18_0']	å¿½é©šæŸ”æ«“ä¸€è²é ã€€ã€€ä½•è™•æ¼èˆŸå®¢åˆ°çƒŸ	å¿½é©šæŸ”æ«“ä¸€è²é ã€€ã€€ä½•è™•æ¼èˆŸå®¢åˆ°çƒŸ	Suddenly startled by the sound of a boat far away, where is the fishing boat coming from in the mist?
['ZH_T49_2039_003:0986a20_5']	é›£é™€é—¢æ¿Ÿé›£é™€é—¢æ¿Ÿç™¾æ¿Ÿæœ¬è¨˜äº‘ã€‚	é›£é™€é—¢æ¿Ÿé›£é™€é—¢æ¿Ÿç™¾æ¿Ÿæœ¬è¨˜äº‘ã€‚	Nanda's Record of the Opening of the Yalu River says:
['ZH_T49_2039_003:0986a21_9']	ç¬¬åäº”åƒ§å‚³äº‘åå››èª¤ó±Ÿ‘æµç‹å³ä½ç”²ç”³æ±æ™‰å­æ­¦å¸å¤§å…ƒä¹å¹´ã€‚	ç¬¬åäº”åƒ§å‚³äº‘åå››èª¤ó±Ÿ‘æµç‹å³ä½ç”²ç”³æ±æ™‰å­æ­¦å¸å¤§å…ƒä¹å¹´ã€‚	The 15th monk biography says 14 is a mistake. King Yuri ascended the throne in Jiachen, the 9th year of the great Yuan period of Emperor Xiaowu of the Eastern Jin Dynasty.
['ZH_T49_2039_003:0986a21_19']	èƒ¡åƒ§æ‘©ç¾…é›£é™€è‡³è‡ªæ™‰ã€‚	èƒ¡åƒ§æ‘©ç¾…é›£é™€è‡³è‡ªæ™‰ã€‚	The Hu monk Marananda came from the Jin Dynasty.
['ZH_T49_2039_003:0986a22_1']	è¿ç½®å®®ä¸­ç¦®æ•¬ã€‚	è¿ç½®å®®ä¸­ç¦®æ•¬ã€‚	He was welcomed and placed in the palace with respect.
['ZH_T49_2039_003:0986a22_6']	æ˜å¹´ä¹™é…‰ã€‚	æ˜å¹´ä¹™é…‰ã€‚	The following year, Yiyou.
['ZH_T49_2039_003:0986a22_16']	å‰µä½›å¯ºæ–¼æ–°éƒ½æ¼¢å±±å·ã€‚	å‰µä½›å¯ºæ–¼æ–°éƒ½æ¼¢å±±å·ã€‚	He built a Buddhist temple in the new capital, Hansan-ju.
['ZH_T49_2039_003:0986a23_1']	åº¦åƒ§åäººã€‚	åº¦åƒ§åäººã€‚	Ten monks were ordained.
['ZH_T49_2039_003:0986a23_9']	æ­¤ç™¾æ¿Ÿä½›æ³•ä¹‹å§‹ã€‚	æ­¤ç™¾æ¿Ÿä½›æ³•ä¹‹å§‹ã€‚	This is the beginning of Buddhism in Baekje.
['ZH_T49_2039_003:0986a24_4']	åˆé˜¿è˜ç‹å³ä½å¤§å…ƒåä¸ƒå¹´äºŒæœˆã€‚	åˆé˜¿è˜ç‹å³ä½å¤§å…ƒåä¸ƒå¹´äºŒæœˆã€‚	Also, in the second month of the 17th year of the reign of King Asin,
['ZH_T49_2039_003:0986a24_13']	ä¸‹æ•™å´‡ä¿¡ä½›æ³•æ±‚ç¦ã€‚	ä¸‹æ•™å´‡ä¿¡ä½›æ³•æ±‚ç¦ã€‚	the king issued a decree to revere and believe in Buddhism and seek blessings.
['ZH_T49_2039_003:0986a24_18']	æ‘©ç¾…é›£é™€ã€‚	æ‘©ç¾…é›£é™€ã€‚	MÄra-nandÄ.
['ZH_T49_2039_003:0986a25_10']	è­¯äº‘ç«¥å­¸å…¶ç•°è¿¹è©³è¦‹åƒ§å‚³ã€‚	è­¯äº‘ç«¥å­¸å…¶ç•°è¿¹è©³è¦‹åƒ§å‚³ã€‚	Translated as child-student, his unusual deeds are detailed in the biographies of monks.
['ZH_T49_2039_003:0986a25_13']	è®šæ›°ã€‚	è®šæ›°ã€‚	Praise says:
['ZH_T49_2039_003:0986a26_0']	å¤©é€ å¾ä¾†è‰æ˜§é–“ã€€ã€€å¤§éƒ½ç‚ºä¼ä¹Ÿæ‡‰é›£	å¤©é€ å¾ä¾†è‰æ˜§é–“ã€€ã€€å¤§éƒ½ç‚ºä¼ä¹Ÿæ‡‰é›£	From heaven's creation, there was a gap of obscurity, but in general, it was difficult to be a performer.
['ZH_T49_2039_003:0986a27_0']	ç¿ç¿è‡ªè§£å‘ˆæ­Œèˆã€€ã€€å¼•å¾—å‚äººå€Ÿçœ¼çœ‹	ç¿ç¿è‡ªè§£å‘ˆæ­Œèˆã€€ã€€å¼•å¾—å‚äººå€Ÿçœ¼çœ‹	The old man himself knew how to present singing and dancing, and attracted others to watch with their eyes.
['ZH_T49_2039_003:0986a28_12']	é˜¿é“åŸºç¾…é˜¿é“åŸºç¾…ä¸€ä½œæˆ‘é“ã€‚	é˜¿é“åŸºç¾…é˜¿é“åŸºç¾…ä¸€ä½œæˆ‘é“ã€‚	A-do Ki-ra A-do Ki-ra (also written as Na-do).
['ZH_T49_2039_003:0986a29_7']	åˆé˜¿é ­æ–°ç¾…æœ¬è¨˜ç¬¬å››äº‘ã€‚	åˆé˜¿é ­æ–°ç¾…æœ¬è¨˜ç¬¬å››äº‘ã€‚	The fourth chapter of the original record of Silla says:
['ZH_T49_2039_003:0986a29_15']	ç¬¬åä¹è¨¥ç¥—ç‹æ™‚ã€‚	ç¬¬åä¹è¨¥ç¥—ç‹æ™‚ã€‚	During the time of the 19th King Nulli of Goguryeo.
['ZH_T49_2039_003:0986b01_9']	æ²™é–€å¢¨èƒ¡å­è‡ªé«˜éº—è‡³ä¸€å–„éƒ¡ã€‚	æ²™é–€å¢¨èƒ¡å­è‡ªé«˜éº—è‡³ä¸€å–„éƒ¡ã€‚	Monk Mok Hu-ja came from Goguryeo to Isan-gun.
['ZH_T49_2039_003:0986b01_18']	éƒ¡äººæ¯›ç¦®æˆ–ä½œæ¯›ç¥¿ã€‚	éƒ¡äººæ¯›ç¦®æˆ–ä½œæ¯›ç¥¿ã€‚	The people of the county, Mao Li (also written as Mao Rok),
['ZH_T49_2039_003:0986b02_5']	æ–¼å®¶ä¸­ä½œå €å®¤å®‰ç½®ã€‚	æ–¼å®¶ä¸­ä½œå €å®¤å®‰ç½®ã€‚	built a pit room in his house and placed him there.
['ZH_T49_2039_003:0986b02_22']	æ™‚æ¢é£ä½¿è³œè¡£è‘—é¦™ç‰©é«˜å¾—ç›¸è© å²è©©äº‘ã€‚	æ™‚æ¢é£ä½¿è³œè¡£è‘—é¦™ç‰©é«˜å¾—ç›¸è© å²è©©äº‘ã€‚	At that time, Liang sent an envoy to give him clothes and incense, and Gao De wrote a historical poem in praise:
['ZH_T49_2039_003:0986b03_7']	æ¢é£ä½¿åƒ§æ›°å…ƒè¡¨ã€‚	æ¢é£ä½¿åƒ§æ›°å…ƒè¡¨ã€‚	Liang sent an envoy, a monk named Yuan Biao,
['ZH_T49_2039_003:0986b03_15']	å®£é€æºŸæª€åŠç¶“åƒã€‚	å®£é€æºŸæª€åŠç¶“åƒã€‚	to proclaim and send Myrrh and sandalwood, as well as scriptures and images.
['ZH_T49_2039_003:0986b03_27']	å›è‡£ä¸çŸ¥å…¶é¦™åèˆ‡å…¶æ‰€ç”¨ã€‚	å›è‡£ä¸çŸ¥å…¶é¦™åèˆ‡å…¶æ‰€ç”¨ã€‚	The ruler and his ministers did not know the name of the incense or its use.
['ZH_T49_2039_003:0986b04_7']	é£äººé½é¦™éå•åœ‹ä¸­ã€‚	é£äººé½é¦™éå•åœ‹ä¸­ã€‚	They sent someone to carry the incense and inquire throughout the country.
['ZH_T49_2039_003:0986b04_14']	å¢¨èƒ¡å­è¦‹ä¹‹æ›°ã€‚	å¢¨èƒ¡å­è¦‹ä¹‹æ›°ã€‚	Mo Huzi saw it and said,
['ZH_T49_2039_003:0986b05_1']	æ­¤ä¹‹è¬‚é¦™ä¹Ÿã€‚	æ­¤ä¹‹è¬‚é¦™ä¹Ÿã€‚	This is called incense.
['ZH_T49_2039_003:0986b05_9']	ç„šä¹‹å‰‡é¦™æ°£èŠ¬é¦¥ã€‚	ç„šä¹‹å‰‡é¦™æ°£èŠ¬é¦¥ã€‚	When burned, it emits a fragrant aroma.
['ZH_T49_2039_003:0986b05_17']	æ‰€ä»¥é”èª æ–¼ç¥è–ã€‚	æ‰€ä»¥é”èª æ–¼ç¥è–ã€‚	It is used to convey sincerity to the spiritual sages.
['ZH_T49_2039_003:0986b06_6']	ç¥è–æœªæœ‰éæ–¼ä¸‰å¯¶ã€‚	ç¥è–æœªæœ‰éæ–¼ä¸‰å¯¶ã€‚	There is no spiritual sage who surpasses the Three Jewels.
['ZH_T49_2039_003:0986b06_12']	è‹¥ç‡’æ­¤ç™¼é¡˜ã€‚	è‹¥ç‡’æ­¤ç™¼é¡˜ã€‚	If you burn this and make a vow,
['ZH_T49_2039_003:0986b07_3']	å‰‡å¿…æœ‰éˆæ‡‰è¨¥ç¥—åœ¨æ™‰å®‹ä¹‹ä¸–ã€‚	å‰‡å¿…æœ‰éˆæ‡‰è¨¥ç¥—åœ¨æ™‰å®‹ä¹‹ä¸–ã€‚	there will surely be a spiritual response. Nengji was in the Jin and Song dynasties,
['ZH_T49_2039_003:0986b07_9']	è€Œäº‘æ¢é£ä½¿ã€‚	è€Œäº‘æ¢é£ä½¿ã€‚	but it says Liang sent an envoy.
['ZH_T49_2039_003:0986b07_12']	æèª¤ã€‚	æèª¤ã€‚	I'm afraid it's a mistake.
['ZH_T49_2039_003:0986b07_18']	æ™‚ç‹å¥³ç—…é©ã€‚	æ™‚ç‹å¥³ç—…é©ã€‚	At that time, the king's daughter was on the verge of death.
['ZH_T49_2039_003:0986b07_24']	ä½¿å¬å¢¨èƒ¡å­ã€‚	ä½¿å¬å¢¨èƒ¡å­ã€‚	He sent for Mo Huzi.
['ZH_T49_2039_003:0986b08_1']	ç„šé¦™è¡¨èª“ã€‚	ç„šé¦™è¡¨èª“ã€‚	He burned incense and made a vow.
['ZH_T49_2039_003:0986b08_8']	ç‹å¥³ä¹‹ç—…å°‹æ„ˆã€‚	ç‹å¥³ä¹‹ç—…å°‹æ„ˆã€‚	The king's daughter's illness soon healed.
['ZH_T49_2039_003:0986b08_15']	ç‹å–œåšåŠ è³šè²ºã€‚	ç‹å–œåšåŠ è³šè²ºã€‚	The king was delighted and generously rewarded him.
['ZH_T49_2039_003:0986b09_2']	ä¿„è€Œä¸çŸ¥æ‰€æ­¸ã€‚	ä¿„è€Œä¸çŸ¥æ‰€æ­¸ã€‚	Soon after, he did not know where he went.
['ZH_T49_2039_003:0986b09_12']	åˆè‡³äºŒåä¸€æ¯˜è™•ç‹æ™‚ã€‚	åˆè‡³äºŒåä¸€æ¯˜è™•ç‹æ™‚ã€‚	Again, at the time of King Biqiu,
['ZH_T49_2039_003:0986b09_18']	æœ‰æˆ‘é“å’Œå°šã€‚	æœ‰æˆ‘é“å’Œå°šã€‚	there was a monk named Wo Dao.
['ZH_T49_2039_003:0986b10_4']	èˆ‡ä¾è€…ä¸‰äººã€‚	èˆ‡ä¾è€…ä¸‰äººã€‚	Together with three attendants,
['ZH_T49_2039_003:0986b10_10']	äº¦ä¾†æ¯›ç¦®å®¶ã€‚	äº¦ä¾†æ¯›ç¦®å®¶ã€‚	he also came to Mao Li's house.
['ZH_T49_2039_003:0986b10_17']	å„€è¡¨ä¼¼å¢¨èƒ¡å­ã€‚	å„€è¡¨ä¼¼å¢¨èƒ¡å­ã€‚	His appearance was similar to Mo Huzi.
['ZH_T49_2039_003:0986b11_1']	ä½æ•¸å¹´ã€‚	ä½æ•¸å¹´ã€‚	He stayed for several years.
['ZH_T49_2039_003:0986b11_6']	ç„¡ç–¾è€Œçµ‚ã€‚	ç„¡ç–¾è€Œçµ‚ã€‚	He died without illness.
['ZH_T49_2039_003:0986b11_14']	å…¶ä¾è€…ä¸‰äººç•™ä½ã€‚	å…¶ä¾è€…ä¸‰äººç•™ä½ã€‚	The three attendants stayed behind.
['ZH_T49_2039_003:0986b11_19']	è¬›è®€ç¶“å¾‹ã€‚	è¬›è®€ç¶“å¾‹ã€‚	They lectured on and read the sutras and vinaya.
['ZH_T49_2039_003:0986b12_17']	å¾€å¾€æœ‰ä¿¡å¥‰è€…æœ‰æ³¨äº‘èˆ‡æœ¬ç¢‘åŠè«¸å‚³è¨˜æ®Šç•°ã€‚	å¾€å¾€æœ‰ä¿¡å¥‰è€…æœ‰æ³¨äº‘èˆ‡æœ¬ç¢‘åŠè«¸å‚³è¨˜æ®Šç•°ã€‚	There were often those who had faith and made offerings. Note: It is very different from the original stele and various records.
['ZH_T49_2039_003:0986b12_26']	åˆé«˜åƒ§å‚³äº‘è¥¿ç«ºäººã€‚	åˆé«˜åƒ§å‚³äº‘è¥¿ç«ºäººã€‚	The Gaoseng zhuan also says he was from the Western Regions.
['ZH_T49_2039_003:0986b12_32']	æˆ–äº‘å¾å³ä¾†ã€‚	æˆ–äº‘å¾å³ä¾†ã€‚	Some say he came from Wu.
['ZH_T49_2039_003:0986b13_4']	æŒ‰æˆ‘é“æœ¬ç¢‘äº‘ã€‚	æŒ‰æˆ‘é“æœ¬ç¢‘äº‘ã€‚	According to my Daoben stele:
['ZH_T49_2039_003:0986b13_11']	æˆ‘é“é«˜éº—äººä¹Ÿã€‚	æˆ‘é“é«˜éº—äººä¹Ÿã€‚	I, Daoben, am from Goguryeo.
['ZH_T49_2039_003:0986b13_16']	æ¯é«˜é“å¯§ã€‚	æ¯é«˜é“å¯§ã€‚	My mother is Gao Daoning.
['ZH_T49_2039_003:0986b13_20']	æ­£å§‹é–“ã€‚	æ­£å§‹é–“ã€‚	During the Zhengshi period.
['ZH_T49_2039_003:0986b14_7']	æ›¹é­äººæˆ‘å§“æˆ‘ä¹Ÿã€‚	æ›¹é­äººæˆ‘å§“æˆ‘ä¹Ÿã€‚	The Cao Wei people, my surname is also Gao.
['ZH_T49_2039_003:0986b14_14']	å´›æ‘©å¥‰ä½¿å¥éº—ã€‚	å´›æ‘©å¥‰ä½¿å¥éº—ã€‚	Jiumoluo was sent on a mission to Goguryeo.
['ZH_T49_2039_003:0986b14_19']	ç§ä¹‹è€Œé‚„ã€‚	ç§ä¹‹è€Œé‚„ã€‚	He secretly had relations with her and returned.
['ZH_T49_2039_003:0986b15_3']	å› è€Œæœ‰å¨ ã€‚	å› è€Œæœ‰å¨ ã€‚	And thus she became pregnant.
['ZH_T49_2039_003:0986b15_8']	å¸«ç”Ÿäº”æ­²ã€‚	å¸«ç”Ÿäº”æ­²ã€‚	When the master was five years old,
['ZH_T49_2039_003:0986b15_14']	å…¶æ¯ä»¤å‡ºå®¶ã€‚	å…¶æ¯ä»¤å‡ºå®¶ã€‚	his mother ordered him to leave home.
['ZH_T49_2039_003:0986b15_20']	å¹´åå…­æ­¸é­ã€‚	å¹´åå…­æ­¸é­ã€‚	At sixteen he returned to Wei.
['ZH_T49_2039_003:0986b16_4']	çœè¦²å´›æ‘©ã€‚	çœè¦²å´›æ‘©ã€‚	To visit and pay respects to Jiumoluo.
['ZH_T49_2039_003:0986b16_14']	æŠ•ç„å½°å’Œå°šè¬›ä¸‹å°±æ¥­ã€‚	æŠ•ç„å½°å’Œå°šè¬›ä¸‹å°±æ¥­ã€‚	He joined the lecture assembly of Master Xuanzhang to study.
['ZH_T49_2039_003:0986b17_4']	å¹´åä¹åˆæ­¸å¯§æ–¼æ¯ã€‚	å¹´åä¹åˆæ­¸å¯§æ–¼æ¯ã€‚	At nineteen he returned to his mother's home.
['ZH_T49_2039_003:0986b17_8']	æ¯è¬‚æ›°ã€‚	æ¯è¬‚æ›°ã€‚	His mother said to him:
['ZH_T49_2039_003:0986b17_17']	æ­¤åœ‹äºä»Šä¸çŸ¥ä½›æ³•ã€‚	æ­¤åœ‹äºä»Šä¸çŸ¥ä½›æ³•ã€‚	This country still does not know the Buddha Dharma.
['ZH_T49_2039_003:0986b18_10']	çˆ¾å¾Œä¸‰åƒé¤˜æœˆé›æ—æœ‰è–ç‹å‡ºã€‚	çˆ¾å¾Œä¸‰åƒé¤˜æœˆé›æ—æœ‰è–ç‹å‡ºã€‚	After three thousand and more months, there will be a sage king in Gyerim.
['ZH_T49_2039_003:0986b18_15']	å¤§èˆˆä½›æ•™ã€‚	å¤§èˆˆä½›æ•™ã€‚	He will greatly promote Buddhism.
['ZH_T49_2039_003:0986b19_8']	å…¶äº¬éƒ½å…§æœ‰ä¸ƒè™•ä¼½è—ä¹‹å¢Ÿã€‚	å…¶äº¬éƒ½å…§æœ‰ä¸ƒè™•ä¼½è—ä¹‹å¢Ÿã€‚	Within the capital city, there were the ruins of seven places of temples.
['ZH_T49_2039_003:0986b20_2']	ä¸€æ›°é‡‘æ©‹æ±å¤©é¡æ—ä»Šèˆˆè¼ªå¯ºã€‚	ä¸€æ›°é‡‘æ©‹æ±å¤©é¡æ—ä»Šèˆˆè¼ªå¯ºã€‚	The first is the site of the temple in the Tianjing Forest east of the Golden Bridge, now the Xinglun Temple.
['ZH_T49_2039_003:0986b20_10']	é‡‘æ©‹è¬‚è¥¿å·ä¹‹æ©‹ã€‚	é‡‘æ©‹è¬‚è¥¿å·ä¹‹æ©‹ã€‚	The Golden Bridge refers to the bridge in Xichuan.
['ZH_T49_2039_003:0986b20_18']	ä¿—è¨›å‘¼äº‘æ¾æ©‹ä¹Ÿã€‚	ä¿—è¨›å‘¼äº‘æ¾æ©‹ä¹Ÿã€‚	The common people mistakenly call it the Song Bridge.
['ZH_T49_2039_003:0986b20_25']	å¯ºè‡ªæˆ‘é“å§‹åŸºã€‚	å¯ºè‡ªæˆ‘é“å§‹åŸºã€‚	The temple began to be built from my path.
['ZH_T49_2039_003:0986b20_29']	è€Œä¸­ç™ˆã€‚	è€Œä¸­ç™ˆã€‚	But it was destroyed in the middle.
['ZH_T49_2039_003:0986b20_38']	è‡³æ³•èˆˆç‹ä¸æœªè‰å‰µã€‚	è‡³æ³•èˆˆç‹ä¸æœªè‰å‰µã€‚	In the Dingyou year of King Fuheng's reign, it was started again.
['ZH_T49_2039_003:0986b20_43']	ä¹™å¯å¤§é–‹ã€‚	ä¹™å¯å¤§é–‹ã€‚	In the Yiyou year, it was greatly opened.
['ZH_T49_2039_003:0986b21_3']	çœŸèˆˆç‹ç•¢æˆã€‚	çœŸèˆˆç‹ç•¢æˆã€‚	In the Gengxu year of King Zhenxing's reign, it was completed.
['ZH_T49_2039_003:0986b21_13']	äºŒæ›°ä¸‰å·å²ä»Šæ°¸èˆˆå¯ºã€‚	äºŒæ›°ä¸‰å·å²ä»Šæ°¸èˆˆå¯ºã€‚	The second is at the fork of the three rivers, now the Yongxing Temple.
['ZH_T49_2039_003:0986b21_20']	èˆ‡èˆˆè¼ªé–‹åŒä»£ã€‚	èˆ‡èˆˆè¼ªé–‹åŒä»£ã€‚	It was opened at the same time as the Xinglun Temple.
['ZH_T49_2039_003:0986b22_2']	ä¸‰æ›°é¾å®®å—ä»Šçš‡é¾å¯ºã€‚	ä¸‰æ›°é¾å®®å—ä»Šçš‡é¾å¯ºã€‚	The third is south of the Dragon Palace, now the Huanglong Temple.
['ZH_T49_2039_003:0986b22_10']	çœŸèˆˆç‹ç™¸é…‰å§‹é–‹ã€‚	çœŸèˆˆç‹ç™¸é…‰å§‹é–‹ã€‚	It was opened in the Guiyou year of King Zhenxing's reign.
['ZH_T49_2039_003:0986b22_20']	å››æ›°é¾å®®åŒ—ä»ŠèŠ¬çš‡å¯ºã€‚	å››æ›°é¾å®®åŒ—ä»ŠèŠ¬çš‡å¯ºã€‚	The fourth is north of the Dragon Palace, now the Fenhuang Temple.
['ZH_T49_2039_003:0986b22_27']	å–„å¾·ç”²åˆå§‹é–‹ã€‚	å–„å¾·ç”²åˆå§‹é–‹ã€‚	It was opened in the Jiawu year of Shande's reign.
['ZH_T49_2039_003:0986b23_6']	äº”æ›°æ²™å·å°¾ä»Šéˆå¦™å¯ºã€‚	äº”æ›°æ²™å·å°¾ä»Šéˆå¦™å¯ºã€‚	The fifth is at the end of Shachuan, now the Lingmiao Temple.
['ZH_T49_2039_003:0986b23_14']	å–„å¾·ç‹ä¹™æœªå§‹é–‹ã€‚	å–„å¾·ç‹ä¹™æœªå§‹é–‹ã€‚	It was opened in the Yiwei year of Shande Wang's reign.
['ZH_T49_2039_003:0986b23_24']	å…­æ›°ç¥éŠæ—ä»Šå¤©ç‹å¯ºã€‚	å…­æ›°ç¥éŠæ—ä»Šå¤©ç‹å¯ºã€‚	The sixth is in the Shenyou Forest, now the Tianwang Temple.
['ZH_T49_2039_003:0986b23_31']	æ–‡æ­¦ç‹å·±å¯é–‹ã€‚	æ–‡æ­¦ç‹å·±å¯é–‹ã€‚	It was opened in the Jiayin year of Wumuwu Wang's reign.
['ZH_T49_2039_003:0986b24_17']	ä¸ƒæ›°å©¿è«‹ç”°ä»Šæ›‡åš´å¯ºçš†å‰ä½›æ™‚ä¼½è—ä¹‹å¢Ÿã€‚	ä¸ƒæ›°å©¿è«‹ç”°ä»Šæ›‡åš´å¯ºçš†å‰ä½›æ™‚ä¼½è—ä¹‹å¢Ÿã€‚	The seventh is at the field requested by the son-in-law, now the Tumeng Temple. All of these were the ruins of temples from the time of the previous Buddha.
['ZH_T49_2039_003:0986b25_4']	æ³•æ°´é•·æµä¹‹åœ°ã€‚	æ³•æ°´é•·æµä¹‹åœ°ã€‚	The land where the long flowing water of the Dharma is.
['ZH_T49_2039_003:0986b25_13']	çˆ¾æ­¸å½¼è€Œæ’­æšå¤§æ•™ã€‚	çˆ¾æ­¸å½¼è€Œæ’­æšå¤§æ•™ã€‚	You return to them and spread the great teaching.
['ZH_T49_2039_003:0986b26_2']	ç•¶æ±åš®æ–¼é‡‹ç¥€çŸ£ã€‚	ç•¶æ±åš®æ–¼é‡‹ç¥€çŸ£ã€‚	You will face east towards the shrine of Shakyamuni.
['ZH_T49_2039_003:0986b26_9']	é“ç¨Ÿæ•™è‡³é›æ—ã€‚	é“ç¨Ÿæ•™è‡³é›æ—ã€‚	The Way received the teaching and arrived in Goguryeo.
['ZH_T49_2039_003:0986b26_16']	å¯“æ­¢ç‹åŸè¥¿é‡Œã€‚	å¯“æ­¢ç‹åŸè¥¿é‡Œã€‚	He stayed in a house to the west of the royal city.
['ZH_T49_2039_003:0986b27_1']	ä»Šåš´èŠå¯ºã€‚	ä»Šåš´èŠå¯ºã€‚	Now it is Yeomjangsa Temple.
['ZH_T49_2039_003:0986b27_14']	äºæ™‚æœ«é››ç‹å³ä½äºŒå¹´ç™¸æœªä¹Ÿã€‚	äºæ™‚æœ«é››ç‹å³ä½äºŒå¹´ç™¸æœªä¹Ÿã€‚	At that time, King Malhuna ascended the throne in the second year, the Guiwei year.
['ZH_T49_2039_003:0986b28_2']	è©£é—•è«‹è¡Œæ•™æ³•ã€‚	è©£é—•è«‹è¡Œæ•™æ³•ã€‚	He visited the palace and requested to practice the teaching.
['ZH_T49_2039_003:0986b28_11']	ä¸–ä»¥å‰æ‰€æœªè¦‹ç‚ºå«Œã€‚	ä¸–ä»¥å‰æ‰€æœªè¦‹ç‚ºå«Œã€‚	The world disliked what had not been seen before.
['ZH_T49_2039_003:0986b28_18']	è‡³æœ‰å°‡æ®ºä¹‹è€…ã€‚	è‡³æœ‰å°‡æ®ºä¹‹è€…ã€‚	There were even those who wanted to kill him.
