segmentnr	original	analyzed	folio	translated
['ZH_T38_1767_007:0077b28_17']	åˆä¸€åˆé¡˜ç‚ºè«¸è©è–©èªªå¾®å¦™è«¸è¡Œç­‰ï¼Œå‰å•é•·å£½æœï¼Œæœå¿…æœ‰å› ï¼Œå› å³æ˜¯è¡Œï¼Œæ•…çŸ¥æ­¤åˆè«‹ç­”éå»æ³•é–€ã€‚	åˆä¸€åˆé¡˜ç‚ºè«¸è©è–©èªªå¾®å¦™è«¸è¡Œç­‰ï¼Œå‰å•é•·å£½æœï¼Œæœå¿…æœ‰å› ï¼Œå› å³æ˜¯è¡Œï¼Œæ•…çŸ¥æ­¤åˆè«‹ç­”éå»æ³•é–€ã€‚	007	The first verse wishes to speak the subtle practices, etc., for the bodhisattvas. The previous question asked about the fruition of long life. Fruition must have a cause. The cause is precisely the practice. Therefore, this verse is known to request an answer to the Dharma door of the past.
['ZH_T38_1767_007:0077c01_1']	æ¬¡ä¸€è¡Œè«‹ç­”ç¾åœ¨ï¼Œå‰å•äº‘ä½•é–‹ç¥•å¯†ï¼Œæ­¤ä¸­è«‹ç­”å®‰æ¨‚æ€§ã€‚	æ¬¡ä¸€è¡Œè«‹ç­”ç¾åœ¨ï¼Œå‰å•äº‘ä½•é–‹ç¥•å¯†ï¼Œæ­¤ä¸­è«‹ç­”å®‰æ¨‚æ€§ã€‚	007	Next, one line requests an answer to the present. The previous question asked how to reveal the secret. Here, it requests an answer to the nature of bliss.
['ZH_T38_1767_007:0077c01_17']	å®‰æ¨‚æ€§ç”±ä¾†æœªé–‹ï¼Œæ•…çŸ¥æ˜¯è«‹ç­”ç¾åœ¨ã€‚	å®‰æ¨‚æ€§ç”±ä¾†æœªé–‹ï¼Œæ•…çŸ¥æ˜¯è«‹ç­”ç¾åœ¨ã€‚	007	The nature of bliss has not been revealed for a long time. Therefore, it is known to be a request for an answer to the present.
['ZH_T38_1767_007:0077c03_6']	å¾Œå…©åˆè«‹ç­”æœªä¾†ï¼Œä¸Šå•å»£å¤§ä¾æ­¢ï¼Œæ­¤è«‹ç­”æœªä¾†æ³•é–€ï¼Œç”šè‡ªåˆ†æ˜ã€‚	å¾Œå…©åˆè«‹ç­”æœªä¾†ï¼Œä¸Šå•å»£å¤§ä¾æ­¢ï¼Œæ­¤è«‹ç­”æœªä¾†æ³•é–€ï¼Œç”šè‡ªåˆ†æ˜ã€‚	007	The last two verses request answers for the future. The previous question was about the vast support, and this request is for answers to the Dharma gates of the future, which are very clear.
['ZH_T38_1767_007:0077c04_1']	å·²åˆ—å•æ•¸çµè«‹æ–‡ç«Ÿï¼Œæ¬¡ç¤ºç­”æ–‡è™•ã€‚	å·²åˆ—å•æ•¸çµè«‹æ–‡ç«Ÿï¼Œæ¬¡ç¤ºç­”æ–‡è™•ã€‚	007	Having already listed the number of questions and concluded the request, next it shows the location of the answer text.
['ZH_T38_1767_007:0077c05_3']	äº‘ä½•å¾—é•·å£½ï¼Œå‡¡å››å•ï¼Œæ­¤å“ä¸‹æ–‡åŠã€ˆé‡‘å‰›èº«å“ã€‰ç­”ã€‚	äº‘ä½•å¾—é•·å£½ï¼Œå‡¡å››å•ï¼Œæ­¤å“ä¸‹æ–‡åŠã€ˆé‡‘å‰›èº«å“ã€‰ç­”ã€‚	007	How to attain long life? There are four questions. The text below this chapter and the Diamond Body Chapter answer this.
['ZH_T38_1767_007:0077c06_1']	äº‘ä½•æ–¼æ­¤ç¶“ç©¶ç«Ÿåˆ°å½¼å²¸ï¼Œã€ˆåå­—åŠŸå¾·å“ã€‰ç­”ã€‚	äº‘ä½•æ–¼æ­¤ç¶“ç©¶ç«Ÿåˆ°å½¼å²¸ï¼Œã€ˆåå­—åŠŸå¾·å“ã€‰ç­”ã€‚	007	How to ultimately reach the other shore in this sutra? The chapter on the merits of names answers this.
['ZH_T38_1767_007:0077c06_14']	é¡˜ä½›é–‹å¾®å¯†ï¼Œã€ˆå››ç›¸å“ã€‰ç­”ã€‚	é¡˜ä½›é–‹å¾®å¯†ï¼Œã€ˆå››ç›¸å“ã€‰ç­”ã€‚	007	May the Buddha open the subtle and secret. The chapter on the four appearances answers this.
['ZH_T38_1767_007:0077c07_16']	äº‘ä½•å¾—å»£å¤§ç‚ºçœ¾ä½œä¾æ­¢ã€å¯¦éç¾…æ¼¢ç­‰ï¼Œã€ˆå››ä¾å“ã€‰ç­”ã€‚	äº‘ä½•å¾—å»£å¤§ç‚ºçœ¾ä½œä¾æ­¢ã€å¯¦éç¾…æ¼¢ç­‰ï¼Œã€ˆå››ä¾å“ã€‰ç­”ã€‚	007	How to attain vastness and become a support for the multitude, truly not being an arhat, etc. The chapter on the four reliances answers this.
['ZH_T38_1767_007:0077c08_10']	äº‘ä½•çŸ¥å¤©é­”å‡¡å…©å•ï¼Œã€ˆé‚ªæ­£å“ã€‰ç­”ã€‚	äº‘ä½•çŸ¥å¤©é­”å‡¡å…©å•ï¼Œã€ˆé‚ªæ­£å“ã€‰ç­”ã€‚	007	How to know the heavenly demons? There are two questions. The chapter on the false and correct answers this.
['ZH_T38_1767_007:0077c09_6']	äº‘ä½•è«¸èª¿å¾¡å¿ƒå–œèªªçœŸè«¦ï¼Œã€ˆå››è«¦å“ã€‰ç­”ã€‚	äº‘ä½•è«¸èª¿å¾¡å¿ƒå–œèªªçœŸè«¦ï¼Œã€ˆå››è«¦å“ã€‰ç­”ã€‚	007	How do the well-tamed minds joyfully speak of the true reality? The chapter on the four truths answers this.
['ZH_T38_1767_007:0077c09_19']	æ¼”èªªå››é¡›å€’ï¼Œã€ˆå››å€’å“ã€‰ç­”ã€‚	æ¼”èªªå››é¡›å€’ï¼Œã€ˆå››å€’å“ã€‰ç­”ã€‚	007	Explaining the four inversions. The chapter on the four inversions answers this.
['ZH_T38_1767_007:0077c10_15']	äº‘ä½•ä½œå–„æ¥­èƒ½è¦‹é›£è¦‹æ€§ï¼Œä¸¦ã€ˆå¦‚ä¾†æ€§å“ã€‰ç­”ã€‚	äº‘ä½•ä½œå–„æ¥­èƒ½è¦‹é›£è¦‹æ€§ï¼Œä¸¦ã€ˆå¦‚ä¾†æ€§å“ã€‰ç­”ã€‚	007	How to create good karma and see the difficult-to-see nature? The chapter on the nature of the Tathagata answers this.
['ZH_T38_1767_007:0077c11_6']	äº‘ä½•è§£æ»¿å­—ï¼Œã€ˆæ–‡å­—å“ã€‰ç­”ã€‚	äº‘ä½•è§£æ»¿å­—ï¼Œã€ˆæ–‡å­—å“ã€‰ç­”ã€‚	007	How to understand the full character, the Chapter on Letters answers.
['ZH_T38_1767_007:0077c11_19']	äº‘ä½•å…±è–è¡Œï¼Œã€ˆé³¥å–»å“ã€‰ç­”ã€‚	äº‘ä½•å…±è–è¡Œï¼Œã€ˆé³¥å–»å“ã€‰ç­”ã€‚	007	How to practice together with the sages, the Chapter on the Parable of the Birds answers.
['ZH_T38_1767_007:0077c12_17']	äº‘ä½•å¦‚æ—¥æœˆå¤ªç™½èˆ‡æ­²æ˜Ÿï¼Œã€ˆæœˆå–»å“ã€‰ç­”åäº”å•ç«Ÿã€‚	äº‘ä½•å¦‚æ—¥æœˆå¤ªç™½èˆ‡æ­²æ˜Ÿï¼Œã€ˆæœˆå–»å“ã€‰ç­”åäº”å•ç«Ÿã€‚	007	How to be like the sun, moon, Venus, and Mars, the Chapter on the Parable of the Moon answers the fifteen questions.
['ZH_T38_1767_007:0077c13_12']	äº‘ä½•æœªç™¼å¿ƒä¸‹æœ‰åäºŒå•ï¼Œçš†ã€ˆè©è–©å“ã€‰ç­”ã€‚	äº‘ä½•æœªç™¼å¿ƒä¸‹æœ‰åäºŒå•ï¼Œçš†ã€ˆè©è–©å“ã€‰ç­”ã€‚	007	How to not give rise to the mind of enlightenment and below has twelve questions, all answered in the Chapter on Bodhisattvas.
['ZH_T38_1767_007:0077c14_6']	äº‘ä½•æœªç™¼å¿ƒï¼Œå¤¢è¦‹ç¾…å‰åªä»¤ç™¼å¿ƒç­”ã€‚	äº‘ä½•æœªç™¼å¿ƒï¼Œå¤¢è¦‹ç¾…å‰åªä»¤ç™¼å¿ƒç­”ã€‚	007	How to not give rise to the mind of enlightenment, dreaming of a rÄká¹£asa urging one to give rise to the mind of enlightenment, the answer.
['ZH_T38_1767_007:0077c15_2']	äº‘ä½•æ–¼å¤§çœ¾è€Œå¾—ç„¡æ‰€ç•ï¼Œä¸‰åˆç­”ã€‚	äº‘ä½•æ–¼å¤§çœ¾è€Œå¾—ç„¡æ‰€ç•ï¼Œä¸‰åˆç­”ã€‚	007	How to be fearless in the great assembly, three verses answer.
['ZH_T38_1767_007:0077c15_13']	äº‘ä½•è™•æ¿ä¸–ï¼Œå››è¯å–»ç­”ã€‚	äº‘ä½•è™•æ¿ä¸–ï¼Œå››è¯å–»ç­”ã€‚	007	How to dwell in the turbid world, the four flower parables answer.
['ZH_T38_1767_007:0077c16_6']	äº‘ä½•è™•ç…©æƒ±ï¼Œé†«å¸«ç­‰åå››è­¬ç­”ã€‚	äº‘ä½•è™•ç…©æƒ±ï¼Œé†«å¸«ç­‰åå››è­¬ç­”ã€‚	007	How to dwell in afflictions, the fourteen parables such as the physician answer.
['ZH_T38_1767_007:0077c17_4']	ç”Ÿæ­»å¤§æµ·ä¸­äº‘ä½•ä½œèˆ¹å¸«ï¼Œé¢¨ç‹å››è­¬ç­”ã€‚	ç”Ÿæ­»å¤§æµ·ä¸­äº‘ä½•ä½œèˆ¹å¸«ï¼Œé¢¨ç‹å››è­¬ç­”ã€‚	007	In the great ocean of birth and death, how to be a boatman, the four parables of the wind king answer.
['ZH_T38_1767_007:0077c18_10']	äº‘ä½•æ¨ç”Ÿæ­»å¦‚è›‡è„«æ•…çš®ï¼Œé‡‘å¸«å…©è­¬ç­”é¾èƒ½è„«éª¨å¯è­¬æ¶…æ§ƒã€‚	äº‘ä½•æ¨ç”Ÿæ­»å¦‚è›‡è„«æ•…çš®ï¼Œé‡‘å¸«å…©è­¬ç­”é¾èƒ½è„«éª¨å¯è­¬æ¶…æ§ƒã€‚	007	How to abandon birth and death like a snake shedding its skin, the two parables of the goldsmith answer. The dragon's ability to shed its bones can be used as a parable for nirvÄá¹‡a.
['ZH_T38_1767_007:0077c18_23']	äº‘ä½•è§€ä¸‰å¯¶ï¼Œè´ç¾…é–»æµ®æ¨¹ç­”ã€‚	äº‘ä½•è§€ä¸‰å¯¶ï¼Œè´ç¾…é–»æµ®æ¨¹ç­”ã€‚	007	How to contemplate the Three Jewels, the Amala and JambÅ« tree answer.
['ZH_T38_1767_007:0077c19_14']	ä¸‰ä¹˜è‹¥ç„¡æ€§ï¼Œæ–‡æ®Šé¨°ç–‘ï¼Œæœ¬ç„¡åˆç­”ã€‚	ä¸‰ä¹˜è‹¥ç„¡æ€§ï¼Œæ–‡æ®Šé¨°ç–‘ï¼Œæœ¬ç„¡åˆç­”ã€‚	007	If the three vehicles have no nature, Manjushri raises doubts, and the original verse answers.
['ZH_T38_1767_007:0077c20_12']	äº‘ä½•è«¸è©è–©è€Œå¾—ä¸å£çœ¾ï¼Œèˆ‰è­·æ³•å› ç·£ç­”ã€‚	äº‘ä½•è«¸è©è–©è€Œå¾—ä¸å£çœ¾ï¼Œèˆ‰è­·æ³•å› ç·£ç­”ã€‚	007	How can bodhisattvas attain an indestructible assembly? Raising the cause and condition of protecting the Dharma to answer.
['ZH_T38_1767_007:0077c21_14']	äº‘ä½•ç‚ºç”Ÿç›²è€Œä½œçœ¼ç›®å°ï¼Œå¦‚äººå£çˆ½ä¸çŸ¥å…­å‘³ç­”ã€‚	äº‘ä½•ç‚ºç”Ÿç›²è€Œä½œçœ¼ç›®å°ï¼Œå¦‚äººå£çˆ½ä¸çŸ¥å…­å‘³ç­”ã€‚	007	How can one be an eye-guide for the congenitally blind? Like a person with a speech impediment who does not know the six flavors, the answer.
['ZH_T38_1767_007:0077c22_11']	äº‘ä½•ç¤ºå¤šé ­ï¼Œå¸¸ç‚ºçœ¾ç”Ÿè€Œä½œçˆ¶æ¯ç­”ã€‚	äº‘ä½•ç¤ºå¤šé ­ï¼Œå¸¸ç‚ºçœ¾ç”Ÿè€Œä½œçˆ¶æ¯ç­”ã€‚	007	How does one show many heads, always acting as parents for sentient beings? The answer.
['ZH_T38_1767_007:0077c23_13']	äº‘ä½•èªªæ³•è€…å¢é•·å¦‚æœˆåˆï¼Œå¦‚äººæœ‰å­å§‹ç”Ÿå…­æœˆç­”ã€‚	äº‘ä½•èªªæ³•è€…å¢é•·å¦‚æœˆåˆï¼Œå¦‚äººæœ‰å­å§‹ç”Ÿå…­æœˆç­”ã€‚	007	How does one who expounds the Dharma grow like the waxing moon? Like a person who has a child born six months ago, the answer.
['ZH_T38_1767_007:0077c24_18']	äº‘ä½•å¾©ç¤ºç¾ç©¶ç«Ÿæ–¼æ¶…æ§ƒï¼Œå‡¡ä¸ƒå•ï¼Œçš†ã€ˆå¤§çœ¾å•å“ã€‰ç­”ã€‚	äº‘ä½•å¾©ç¤ºç¾ç©¶ç«Ÿæ–¼æ¶…æ§ƒï¼Œå‡¡ä¸ƒå•ï¼Œçš†ã€ˆå¤§çœ¾å•å“ã€‰ç­”ã€‚	007	How does one again manifest the ultimate in nirvana? There are seven questions, all answered in the chapter on the assembly's questions.
['ZH_T38_1767_007:0077c25_12']	äº‘ä½•å¾©ç¤ºç¾ç©¶ç«Ÿæ–¼æ¶…æ§ƒï¼Œæ”¾å…‰å¥‰ä¾›ç­”ã€‚	äº‘ä½•å¾©ç¤ºç¾ç©¶ç«Ÿæ–¼æ¶…æ§ƒï¼Œæ”¾å…‰å¥‰ä¾›ç­”ã€‚	007	How does one again manifest the ultimate in nirvana? Emitting light and making offerings, the answer.
['ZH_T38_1767_007:0077c27_16']	äº‘ä½•å‹‡é€²è€…çŸ¥äººå¤©é­”é“ï¼Œè‹¥æœ‰æ¯”ä¸˜èƒ½ä»¥å¦‚ä¾†èª“é¡˜è€Œç™¼é¡˜è€…æ–¼ä¸–æœ€å‹ï¼Œä¸èƒ½è§€äº†å¸¸è€…æ˜¯æ—ƒé™€ç¾…ç­”ã€‚	äº‘ä½•å‹‡é€²è€…çŸ¥äººå¤©é­”é“ï¼Œè‹¥æœ‰æ¯”ä¸˜èƒ½ä»¥å¦‚ä¾†èª“é¡˜è€Œç™¼é¡˜è€…æ–¼ä¸–æœ€å‹ï¼Œä¸èƒ½è§€äº†å¸¸è€…æ˜¯æ—ƒé™€ç¾…ç­”ã€‚	007	How does one who is courageous and diligent know the paths of humans, gods, and demons? If there is a bhiká¹£u who can make a vow with the TathÄgata's vow, he is the most supreme in the world, but one who cannot contemplate permanence is a caá¹‡á¸Äla, the answer.
['ZH_T38_1767_007:0077c28_16']	äº‘ä½•çŸ¥æ³•æ€§è€Œå—æ–¼æ³•æ¨‚ï¼ŒèªªäºŒåä¸€è¡Œåˆç­”ã€‚	äº‘ä½•çŸ¥æ³•æ€§è€Œå—æ–¼æ³•æ¨‚ï¼ŒèªªäºŒåä¸€è¡Œåˆç­”ã€‚	007	How does one know the nature of dharmas and experience the joy of the Dharma? The twenty-one lines of verse answer this.
['ZH_T38_1767_007:0077c29_13']	äº‘ä½•è«¸è©è–©é é›¢ä¸€åˆ‡ç—…ï¼Œä¸‰ç—…äººç­”ã€‚	äº‘ä½•è«¸è©è–©é é›¢ä¸€åˆ‡ç—…ï¼Œä¸‰ç—…äººç­”ã€‚	007	How do bodhisattvas distance themselves from all illnesses? The three sick people answer this.
['ZH_T38_1767_007:0078a01_18']	äº‘ä½•ç‚ºçœ¾ç”Ÿæ¼”èªªæ–¼ç¥•å¯†ï¼Œå»£é‡‹è«¸æœ‰é¤˜åˆï¼Œä»¥ç„¡é¤˜åˆç­”ã€‚	äº‘ä½•ç‚ºçœ¾ç”Ÿæ¼”èªªæ–¼ç¥•å¯†ï¼Œå»£é‡‹è«¸æœ‰é¤˜åˆï¼Œä»¥ç„¡é¤˜åˆç­”ã€‚	007	How does one expound the secret for sentient beings? The extensive explanation of the verses with remainder uses the verses without remainder to answer.
['ZH_T38_1767_007:0078a03_1']	äº‘ä½•èªªç•¢ç«ŸåŠèˆ‡ä¸ç•¢ç«Ÿï¼Œç”¨äº‘ä½•åç‚ºç„¡é¤˜ç¾©è€¶ï¼Ÿ	äº‘ä½•èªªç•¢ç«ŸåŠèˆ‡ä¸ç•¢ç«Ÿï¼Œç”¨äº‘ä½•åç‚ºç„¡é¤˜ç¾©è€¶ï¼Ÿ	007	How does one speak of the ultimate and the non-ultimate? What is called the meaning of no remainder?
['ZH_T38_1767_007:0078a03_10']	äº‘ä½•å¾©åä¸€åˆ‡ç¾©ä¹ï¼Ÿ	äº‘ä½•å¾©åä¸€åˆ‡ç¾©ä¹ï¼Ÿ	007	What is also called the meaning of all?
['ZH_T38_1767_007:0078a04_12']	å”¯é™¤åŠ©é“å¸¸æ¨‚æˆ‘æ·¨å–„æ³•ï¼Œå…¶é¤˜ä¸€åˆ‡çš†åæœ‰é¤˜ç­”ã€‚	å”¯é™¤åŠ©é“å¸¸æ¨‚æˆ‘æ·¨å–„æ³•ï¼Œå…¶é¤˜ä¸€åˆ‡çš†åæœ‰é¤˜ç­”ã€‚	007	Excluding only the wholesome dharmas of the aids to enlightenment that are constantly joyful, blissful, self-possessed, and pure, the rest are all called having remainder.
['ZH_T38_1767_007:0078a05_17']	äº‘ä½•è€Œå¾—è¿‘æœ€å‹ç„¡ä¸Šé“ï¼Œäº¦å–å‰è«¸è©è–©é é›¢ä¸€åˆ‡ç—…ç­”ã€‚	äº‘ä½•è€Œå¾—è¿‘æœ€å‹ç„¡ä¸Šé“ï¼Œäº¦å–å‰è«¸è©è–©é é›¢ä¸€åˆ‡ç—…ç­”ã€‚	007	How does one attain closeness to the supreme and unsurpassed path? It also takes the previous answer of the bodhisattvas distancing themselves from all illnesses.
['ZH_T38_1767_007:0078a06_17']	ä¸Šä¸‰ç¨®ç—…äººå¾—æ»…ç½ªå¾Œè¿‘ç„¡ä¸Šé“ï¼Œå…¼ç­”æ­¤å•ã€‚	ä¸Šä¸‰ç¨®ç—…äººå¾—æ»…ç½ªå¾Œè¿‘ç„¡ä¸Šé“ï¼Œå…¼ç­”æ­¤å•ã€‚	007	The three kinds of sick people attain the eradication of offenses and subsequently draw near to the unsurpassed path, and this question is answered in combination.
['ZH_T38_1767_007:0078a07_17']	è‹¥æœ‰ç—…äººè‹¥é‡ä¸é‡æ‚‰å¾—å·®è€…ï¼Œæ­¤å»ä½›æœ€è¿‘ï¼›	è‹¥æœ‰ç—…äººè‹¥é‡ä¸é‡æ‚‰å¾—å·®è€…ï¼Œæ­¤å»ä½›æœ€è¿‘ï¼›	007	If there are sick people who are cured whether they encounter [treatment] or not, they are closest to the Buddha;
['ZH_T38_1767_007:0078a08_13']	è‹¥é‡å³å·®ã€ä¸é‡ä¸å·®ï¼Œæ­¤å‰‡æ¬¡è¿‘ï¼›	è‹¥é‡å³å·®ã€ä¸é‡ä¸å·®ï¼Œæ­¤å‰‡æ¬¡è¿‘ï¼›	007	if they are cured upon encountering [treatment] but not if they do not encounter it, they are next closest;
['ZH_T38_1767_007:0078a09_6']	è‹¥é‡ä¸é‡çš†ä¸å·®è€…ï¼Œæ­¤å»ä½›é ã€‚	è‹¥é‡ä¸é‡çš†ä¸å·®è€…ï¼Œæ­¤å»ä½›é ã€‚	007	If one does not meet the Buddha and still cannot be cured, then one is far from the Buddha.
['ZH_T38_1767_007:0078a10_3']	åˆäº‘å–å¤§çœ¾ç™¼å¿ƒã€å¦‚ä¾†æˆè¨˜ä»¥ç­”æ­¤å•ã€‚	åˆäº‘å–å¤§çœ¾ç™¼å¿ƒã€å¦‚ä¾†æˆè¨˜ä»¥ç­”æ­¤å•ã€‚	007	It is also said that taking the great assembly's arousal of the mind and the TathÄgata's bestowal of predictions answers this question.
['ZH_T38_1767_007:0078a10_13']	ä»Šå¼•åè­‰ï¼Œæ˜ç­”å•ç«Ÿã€‚	ä»Šå¼•åè­‰ï¼Œæ˜ç­”å•ç«Ÿã€‚	007	Now, citing ten proofs, it is clear that the question has been answered.
['ZH_T38_1767_007:0078a11_19']	ä¸€è€…åˆä¸­èˆˆå•æ¬¡ç¬¬è€Œä¾†ï¼Œé•·è¡Œç›¸å°æ¬¡ç¬¬è€Œç­”ï¼Œæ•…çŸ¥ç­”å•ç›¡ã€‚	ä¸€è€…åˆä¸­èˆˆå•æ¬¡ç¬¬è€Œä¾†ï¼Œé•·è¡Œç›¸å°æ¬¡ç¬¬è€Œç­”ï¼Œæ•…çŸ¥ç­”å•ç›¡ã€‚	007	First, the questions in the verse come in sequence, and the prose answers correspond in sequence, so it is known that the question has been answered in its entirety.
['ZH_T38_1767_007:0078a12_12']	äºŒè€…åˆä¸­è¨­å•ç«Ÿï¼Œå³è‡ªè¬™äº‘ï¼š	äºŒè€…åˆä¸­è¨­å•ç«Ÿï¼Œå³è‡ªè¬™äº‘ï¼š	007	Second, after finishing the questions in the verse, he immediately humbled himself, saying:
['ZH_T38_1767_007:0078a14_1']	ç”šæ·±å¾®å¦™å®‰æ¨‚æ€§ç­‰éæˆ‘æ‰€çŸ¥ï¼Œè«‹æ–¼å¦‚ä¾†ç‚ºè«¸è©è–©è‡ªæ¼”èªªä¹‹ã€‚	ç”šæ·±å¾®å¦™å®‰æ¨‚æ€§ç­‰éæˆ‘æ‰€çŸ¥ï¼Œè«‹æ–¼å¦‚ä¾†ç‚ºè«¸è©è–©è‡ªæ¼”èªªä¹‹ã€‚	007	The nature of profound, subtle, and blissful peace and so forth is not known to me. I request the TathÄgata to expound it himself for the bodhisattvas.
['ZH_T38_1767_007:0078a14_11']	è‹¥å¾æ­¤æ„ï¼ŒçŸ¥ç­”å•ç›¡ã€‚	è‹¥å¾æ­¤æ„ï¼ŒçŸ¥ç­”å•ç›¡ã€‚	007	If one understands this meaning, one knows that the question has been answered in its entirety.
['ZH_T38_1767_007:0078a15_2']	ä¸‰è€…ç­”è‹¥æœªç›¡ï¼Œä¸æ‡‰è¬æ©ã€‚	ä¸‰è€…ç­”è‹¥æœªç›¡ï¼Œä¸æ‡‰è¬æ©ã€‚	007	Third, if the answer is not yet complete, one should not express gratitude.
['ZH_T38_1767_007:0078a16_7']	ç­”å•æ—¢ç«Ÿï¼Œæ™‚çœ¾å¾—ç›Šï¼Œèµ·ç¦®ç‡’é¦™æ•£è¯ä¾›é¤Šï¼Œæ•…çŸ¥ç­”å•ç›¡ã€‚	ç­”å•æ—¢ç«Ÿï¼Œæ™‚çœ¾å¾—ç›Šï¼Œèµ·ç¦®ç‡’é¦™æ•£è¯ä¾›é¤Šï¼Œæ•…çŸ¥ç­”å•ç›¡ã€‚	007	Since the assembly benefited from the answer and arose to pay homage, burn incense, scatter flowers, and make offerings, it is known that the question has been answered in its entirety.
['ZH_T38_1767_007:0078a17_13']	å››è€…ä¸Šä¾†å¬çœ¾é›²é›†æ…‡æ‡ƒå‹¸å•ç­”ï¼Œè‹¥æœªç«Ÿï¼Œå¯§å¾—å€šè‡¥æ¶…æ§ƒï¼Ÿ	å››è€…ä¸Šä¾†å¬çœ¾é›²é›†æ…‡æ‡ƒå‹¸å•ç­”ï¼Œè‹¥æœªç«Ÿï¼Œå¯§å¾—å€šè‡¥æ¶…æ§ƒï¼Ÿ	007	Fourth, if the assembly was not yet called to gather and the earnest encouragement to ask questions and answer them was not yet complete, how could one lie on one's right side and rest in nirvÄá¹‡a?
['ZH_T38_1767_007:0078a18_3']	æ—¢å³è„‡æ¯è¨€ï¼ŒçŸ¥ç­”å•ç›¡ã€‚	æ—¢å³è„‡æ¯è¨€ï¼ŒçŸ¥ç­”å•ç›¡ã€‚	007	Since he rested on his right side, it is known that the question has been answered in its entirety.
['ZH_T38_1767_007:0078a18_20']	äº”è€…ä»˜å›‘æ–‡æ®Šï¼Œå¯¢è€Œç„¡èªªï¼Œå¤§çœ¾é‡è«‹ã€‚	äº”è€…ä»˜å›‘æ–‡æ®Šï¼Œå¯¢è€Œç„¡èªªï¼Œå¤§çœ¾é‡è«‹ã€‚	007	Fifth, entrusting to MaÃ±juÅ›rÄ«, lying down without speaking, the great assembly requesting again.
['ZH_T38_1767_007:0078a19_19']	æ—¢å—è«‹å·²ï¼ŒåŠ è¶ºèæ‡Œæ–¹è«‡äº”è¡Œï¼Œæ•…çŸ¥ç­”å•ç›¡ã€‚	æ—¢å—è«‹å·²ï¼ŒåŠ è¶ºèæ‡Œæ–¹è«‡äº”è¡Œï¼Œæ•…çŸ¥ç­”å•ç›¡ã€‚	007	Having accepted the request, cross-legged, relaxed and at ease, just about to discuss the five aspects, therefore knowing the answers to the questions are complete.
['ZH_T38_1767_007:0078a20_16']	å…­è€…å°å‘Šå¾·ç‹ï¼Œè³“ä¸»æœ‰ç•°ï¼ŒçŸ¥ç­”å•ç›¡ã€‚	å…­è€…å°å‘Šå¾·ç‹ï¼Œè³“ä¸»æœ‰ç•°ï¼ŒçŸ¥ç­”å•ç›¡ã€‚	007	Sixth, addressing King Virtuous, guest and host are different, knowing the answers to the questions are complete.
['ZH_T38_1767_007:0078a21_13']	ä¸ƒè€…å¸«å­æ›´å•ï¼Œå•äººæ—¢åˆ¥ï¼ŒçŸ¥ç­”å•ç›¡ã€‚	ä¸ƒè€…å¸«å­æ›´å•ï¼Œå•äººæ—¢åˆ¥ï¼ŒçŸ¥ç­”å•ç›¡ã€‚	007	Seventh, the lion asking again, the questioner is different, knowing the answers to the questions are complete.
['ZH_T38_1767_007:0078a23_10']	å…«è€…æ–‡äº‘å¦‚ä¾†åˆé–‹æ¶…æ§ƒç¶“æ™‚èªªæœ‰ä¸‰ç¨®äººï¼Œä¸‰ç¨®äººä¹ƒæ˜¯ç­”å•ä¹‹æœ«ï¼Œå¯¦éå‰µèªªä¹‹åˆã€‚	å…«è€…æ–‡äº‘å¦‚ä¾†åˆé–‹æ¶…æ§ƒç¶“æ™‚èªªæœ‰ä¸‰ç¨®äººï¼Œä¸‰ç¨®äººä¹ƒæ˜¯ç­”å•ä¹‹æœ«ï¼Œå¯¦éå‰µèªªä¹‹åˆã€‚	007	Eighth, the text says that when the TathÄgata first opened the Nirvana Sutra, he spoke of three kinds of people. The three kinds of people are indeed the end of the answers to the questions, not the beginning of the original teaching.
['ZH_T38_1767_007:0078a24_8']	ä»Šäº‘åˆé–‹ä¹ƒæ˜¯å¾Œèªªä¹‹åˆï¼Œéåˆèªªä¹‹åˆï¼›	ä»Šäº‘åˆé–‹ä¹ƒæ˜¯å¾Œèªªä¹‹åˆï¼Œéåˆèªªä¹‹åˆï¼›	007	Now saying the first opening is the beginning of the later teaching, not the beginning of the first teaching;
['ZH_T38_1767_007:0078a25_2']	æ—¢æœ‰åˆèªªå¾Œèªªä¸åŒï¼ŒçŸ¥ç­”å•ç›¡ã€‚	æ—¢æœ‰åˆèªªå¾Œèªªä¸åŒï¼ŒçŸ¥ç­”å•ç›¡ã€‚	007	Since there is a difference between the first teaching and the later teaching, knowing the answers to the questions are complete.
['ZH_T38_1767_007:0078a26_6']	ä¹è€…å‰å•å¤šç­”å·å°‘ï¼Œå¾Œå•å°‘ä¸æ‡‰ç­”å·å¤šï¼ŒçŸ¥ç­”å•ç›¡ã€‚	ä¹è€…å‰å•å¤šç­”å·å°‘ï¼Œå¾Œå•å°‘ä¸æ‡‰ç­”å·å¤šï¼ŒçŸ¥ç­”å•ç›¡ã€‚	007	Ninth, the previous questions have many answers and few scrolls, the later questions have few and should not have many scrolls of answers, knowing the answers to the questions are complete.
['ZH_T38_1767_007:0078a28_8']	åè€…æ²³è¥¿é¢å°æ¢µæ–‡å£æ±ºã€æ›‡è®–æŒ‡æˆï¼Œæ®·å‹¤è¦ªèªªåä¹åˆæ˜¯å•å¾Œå››åˆéå•ï¼Œæ–¯äººä¸ä¿¡ï¼Œå­°å¯ä¿¡è€¶ï¼Ÿ	åè€…æ²³è¥¿é¢å°æ¢µæ–‡å£æ±ºã€æ›‡è®–æŒ‡æˆï¼Œæ®·å‹¤è¦ªèªªåä¹åˆæ˜¯å•å¾Œå››åˆéå•ï¼Œæ–¯äººä¸ä¿¡ï¼Œå­°å¯ä¿¡è€¶ï¼Ÿ	007	Tenth, facing the Sanskrit text in the west, orally deciding, with Dharmaraká¹£a's instruction, earnestly personally explaining that the last nineteen verses are questions and the last four verses are not questions, this person does not believe, who can be believed?
['ZH_T38_1767_007:0078a28_21']	ã€Œçˆ¾æ™‚ä½›è®šã€ä¸‹ï¼Œç¬¬ä¸‰ä½›ç­”ã€‚	ã€Œçˆ¾æ™‚ä½›è®šã€ä¸‹ï¼Œç¬¬ä¸‰ä½›ç­”ã€‚	007	At that time the Buddha praised - the third, the Buddha's answer.
['ZH_T38_1767_007:0078a29_1']	åˆäºŒï¼š	åˆäºŒï¼š	007	Also two:
