segmentnr	original	analyzed	translated
['ZH_T35_1735_059:0953c05_4']	æ‹å­—ï¼Œå³é›¢è«¸è« è«ï¼Œç„¡å¾€ç„¡ä¾†è¡Œä½åè‡¥ï¼Œè¬‚ä»¥å¸¸è§€å­—è¼ªæ•…ã€‚	æ‹å­—ï¼Œå³é›¢è«¸è« è«ï¼Œç„¡å¾€ç„¡ä¾†è¡Œä½åè‡¥ï¼Œè¬‚ä»¥å¸¸è§€å­—è¼ªæ•…ã€‚	The letter Ã±a represents being free from all disputes, without going or coming, walking, standing, sitting, or lying down, which means always contemplating the wheel of letters.
['ZH_T35_1735_059:0953c05_14']	å¨‘é —å­—ï¼Œå³éæ»¿æœå ±ã€‚	å¨‘é —å­—ï¼Œå³éæ»¿æœå ±ã€‚	The letter á¹£a represents the fruit of being filled everywhere.
['ZH_T35_1735_059:0953c06_3']	å¨‘è¿¦å­—ï¼Œå³ç©èšè˜Šæ€§ã€‚	å¨‘è¿¦å­—ï¼Œå³ç©èšè˜Šæ€§ã€‚	The letter sa represents the nature of being accumulated and aggregated.
['ZH_T35_1735_059:0953c06_13']	ä¹Ÿå¨‘å­—ï¼Œå³è¡°è€æ€§ç›¸ã€‚	ä¹Ÿå¨‘å­—ï¼Œå³è¡°è€æ€§ç›¸ã€‚	The letter ya represents the characteristics of aging and decay.
['ZH_T35_1735_059:0953c07_18']	å®¤è€…å­—ï¼Œå³èšé›†è¶³è¿¹ï¼Œè¬‚èšé›†å³ä¸€åˆ‡çœ¾ç”Ÿï¼Œæ³•é›·å³æ˜¯è¶³è¿¹ã€‚	å®¤è€…å­—ï¼Œå³èšé›†è¶³è¿¹ï¼Œè¬‚èšé›†å³ä¸€åˆ‡çœ¾ç”Ÿï¼Œæ³•é›·å³æ˜¯è¶³è¿¹ã€‚	The letter Å›a represents the accumulated footprints, which means that the accumulated are all sentient beings, and the Dharma thunder is the footprints.
['ZH_T35_1735_059:0953c08_19']	ä¾˜å­—ï¼Œå³ç›¸é©…è¿«æ€§ï¼Œè¬‚ç„¡æˆ‘æ›‰ä¹‹ï¼Œå³ç‚ºé©…è¿«ã€‚	ä¾˜å­—ï¼Œå³ç›¸é©…è¿«æ€§ï¼Œè¬‚ç„¡æˆ‘æ›‰ä¹‹ï¼Œå³ç‚ºé©…è¿«ã€‚	The letter ja represents the nature of driving each other, which means that if one understands selflessness, it becomes driving.
['ZH_T35_1735_059:0953c10_1']	é™€å­—ï¼Œå³ç©¶ç«Ÿè™•ï¼Œæ‰€è¬‚æ­¤ç©¶ç«Ÿè™•ï¼Œå«è—ä¸€åˆ‡æ³•è¼ªã€‚	é™€å­—ï¼Œå³ç©¶ç«Ÿè™•ï¼Œæ‰€è¬‚æ­¤ç©¶ç«Ÿè™•ï¼Œå«è—ä¸€åˆ‡æ³•è¼ªã€‚	The letter á¸ha represents the ultimate place, which is to say that this ultimate place contains all Dharma wheels.
['ZH_T35_1735_059:0953c10_14']	ç„¶æ–°è­¯ä¹ƒæ˜¯èŒ¶å­—ï¼Œå»è²å¼•ä¹‹ã€‚	ç„¶æ–°è­¯ä¹ƒæ˜¯èŒ¶å­—ï¼Œå»è²å¼•ä¹‹ã€‚	However, the new translation is the syllable cha with the departing tone.
['ZH_T35_1735_059:0953c12_4']	ä¸Šä¾†å¾å¨‘ä¸Šå­—ä¾†ï¼Œçš†ä¸Šæœ‰ã€Œæ‚Ÿä¸€åˆ‡æ³•ã€ã€ä¸‹æœ‰ã€Œä¸å¯å¾—è¨€ã€ï¼Œä»Šä¸¦ç•¥ä¹‹ï¼›	ä¸Šä¾†å¾å¨‘ä¸Šå­—ä¾†ï¼Œçš†ä¸Šæœ‰ã€Œæ‚Ÿä¸€åˆ‡æ³•ã€ã€ä¸‹æœ‰ã€Œä¸å¯å¾—è¨€ã€ï¼Œä»Šä¸¦ç•¥ä¹‹ï¼›	From the syllable sa above, all have realizing all dharmas above and cannot be expressed below, but now they are abbreviated;
['ZH_T35_1735_059:0953c12_14']	è‹¥å…·ï¼Œçš†å¦‚ç‘Ÿå’å­—è€³ã€‚	è‹¥å…·ï¼Œçš†å¦‚ç‘Ÿå’å­—è€³ã€‚	if complete, they are all like the syllable sa.
['ZH_T35_1735_059:0953c13_14']	å…¶ä¸­é›£è€…å·²é‡‹ï¼Œé¤˜ä»¥ç¶“ç–ç›¸å°ï¼Œæ–‡ä¸¦å¯çŸ¥ã€‚	å…¶ä¸­é›£è€…å·²é‡‹ï¼Œé¤˜ä»¥ç¶“ç–ç›¸å°ï¼Œæ–‡ä¸¦å¯çŸ¥ã€‚	The difficult ones among them have already been explained, and the rest can be understood from the sutra and commentary.
['ZH_T35_1735_059:0953c14_14']	æ›´æœ‰å°æœƒåŠä¿®è§€å„€æ‰€å¾—åŠŸå¾·ï¼Œä¸¦åˆ¥ç« å…·ä¹Ÿã€‚	æ›´æœ‰å°æœƒåŠä¿®è§€å„€æ‰€å¾—åŠŸå¾·ï¼Œä¸¦åˆ¥ç« å…·ä¹Ÿã€‚	There are also other correspondences and the merits obtained from cultivating the contemplation, which are all in the separate chapters.
['ZH_T35_1735_059:0953c15_12']	çµäº‘å››åäºŒé–€è€…ï¼Œè¬‚è¡¨å››åäºŒä½æ•…ã€‚	çµäº‘å››åäºŒé–€è€…ï¼Œè¬‚è¡¨å››åäºŒä½æ•…ã€‚	The conclusion states forty-two gates because it represents the forty-two stages.
['ZH_T35_1735_059:0953c16_11']	æ•…ã€Šæ™ºè«–ã€‹ä¸­è«¸ä½åœ“èï¼Œæ˜åˆé˜¿å…·å¾Œè«¸å­—ã€‚	æ•…ã€Šæ™ºè«–ã€‹ä¸­è«¸ä½åœ“èï¼Œæ˜åˆé˜¿å…·å¾Œè«¸å­—ã€‚	Therefore, in the Treatise on the Great Perfection of Wisdom, the various stages are perfectly integrated, and it clarifies that the initial a contains all the subsequent syllables.
['ZH_T35_1735_059:0953c18_15']	ç¬¬å››è¬™æ¨ä¸­ï¼Œæ¨å‹å³å°±å…¶æ‰€çŸ¥çœ¾è—å¯„å‹æ¨ä¹‹ï¼Œä¸æ¨ä¸–ä¿—çš†èˆ‡å¯¦ç›¸ä¸ç›¸é•èƒŒï¼ŒæœƒåŒèˆ¬è‹¥ä¹‹é–€ã€‚	ç¬¬å››è¬™æ¨ä¸­ï¼Œæ¨å‹å³å°±å…¶æ‰€çŸ¥çœ¾è—å¯„å‹æ¨ä¹‹ï¼Œä¸æ¨ä¸–ä¿—çš†èˆ‡å¯¦ç›¸ä¸ç›¸é•èƒŒï¼ŒæœƒåŒèˆ¬è‹¥ä¹‹é–€ã€‚	In the fourth section on humility and recommendation, the superiority is based on the knowledge of various skills, and the superiority is recommended through them. Not abandoning worldly affairs, they are all in harmony with the truth of dharmas, and the same as the gate of prajÃ±Ä.
['ZH_T35_1735_059:0953c20_3']	äº”æŒ‡å¾Œä¸­ï¼Œå©†æ€›é‚£è€…ï¼Œæ­¤äº‘å¢ç›Šï¼Œä»¥ç„¡ç›¡ä¸‰æ˜§èƒ½å‡ºç”Ÿæ•…ã€‚	äº”æŒ‡å¾Œä¸­ï¼Œå©†æ€›é‚£è€…ï¼Œæ­¤äº‘å¢ç›Šï¼Œä»¥ç„¡ç›¡ä¸‰æ˜§èƒ½å‡ºç”Ÿæ•…ã€‚	The fifth finger is the middle one, and bhadrapada means increasing benefit, because the inexhaustible samÄdhi is able to give rise to [benefits].
['ZH_T35_1735_059:0953c20_14']	å‹åè³¢å‹è€…ï¼Œè³¢çŒ¶ç›´å–„ã€‚	å‹åè³¢å‹è€…ï¼Œè³¢çŒ¶ç›´å–„ã€‚	The friend named Virtuous Excellence means virtuous and also upright and good.
['ZH_T35_1735_059:0953c21_5']	ç„¡ä¾é“å ´ï¼Œç›´å–„ä¹‹æœ€æ•…ã€‚	ç„¡ä¾é“å ´ï¼Œç›´å–„ä¹‹æœ€æ•…ã€‚	The field of enlightenment without reliance is the utmost in upright goodness.
['ZH_T35_1735_059:0953c22_2']	ç¬¬å››è³¢å‹å„ªå©†å¤·ï¼Œå¹»æ™ºç„¡ä¾å–„å‹ã€‚	ç¬¬å››è³¢å‹å„ªå©†å¤·ï¼Œå¹»æ™ºç„¡ä¾å–„å‹ã€‚	The fourth virtuous upÄsikÄ is a good friend of illusory wisdom without reliance.
['ZH_T35_1735_059:0953c22_7']	åˆäºŒå¯çŸ¥ã€‚	åˆäºŒå¯çŸ¥ã€‚	The first two are understandable.
['ZH_T35_1735_059:0953c23_1']	ä¸‰ã€Œè³¢å‹ç­”ã€ä¸‹æˆå·²æ³•é–€ï¼Œä¸­äºŒï¼š	ä¸‰ã€Œè³¢å‹ç­”ã€ä¸‹æˆå·²æ³•é–€ï¼Œä¸­äºŒï¼š	Third, under Virtuous Excellence's reply, she bestows her own Dharma door, which has two parts:
['ZH_T35_1735_059:0953c23_11']	åˆå¾—è§£è„«ã€å¾Œå¾—ä¸‰æ˜§ã€‚	åˆå¾—è§£è„«ã€å¾Œå¾—ä¸‰æ˜§ã€‚	First, attaining liberation; later, attaining samÄdhi.
['ZH_T35_1735_059:0953c24_8']	ä»Šåˆï¼Œç›´å°±ç¶“æ–‡ï¼Œå…§å¤–ç„¡ä¾å³æ˜¯é“å ´ã€‚	ä»Šåˆï¼Œç›´å°±ç¶“æ–‡ï¼Œå…§å¤–ç„¡ä¾å³æ˜¯é“å ´ã€‚	Now, at the beginning, directly in the text, the internal and external without reliance is precisely the field of enlightenment.
['ZH_T35_1735_059:0953c24_12']	è³¢é¦–äº‘ï¼š	è³¢é¦–äº‘ï¼š	Zhizhe says:
['ZH_T35_1735_059:0953c25_4']	ã€Œæ¢µåé‚£é˜¿è³´è€¶æ›¼èŒ¶ç¾…ã€‚	ã€Œæ¢µåé‚£é˜¿è³´è€¶æ›¼èŒ¶ç¾…ã€‚	The Sanskrit name is nÄ Älaya maá¹‡á¸ala.
['ZH_T35_1735_059:0953c25_15', 'ZH_T35_1735_059:0953c26_7']	é‚£è€…ï¼Œæ­¤äº‘ç„¡ä¹Ÿã€ä¸ä¹Ÿã€‚ğŸ”½é˜¿è³´è€¶ï¼Œäº‘ä¾è™•ä¹Ÿã€ä¾æ­¢ä¹Ÿã€‚	é‚£è€…ï¼Œæ­¤äº‘ç„¡ä¹Ÿã€ä¸ä¹Ÿã€‚ é˜¿è³´è€¶ï¼Œäº‘ä¾è™•ä¹Ÿã€ä¾æ­¢ä¹Ÿã€‚	NÄ means nonexistent and not.ğŸ”½Ä€laya means place of reliance and basis of reliance.
['ZH_T35_1735_059:0953c26_20']	æ›¼èŒ¶ç¾…ï¼Œäº‘é“å ´ä¹Ÿã€åœ“å ´ä¹Ÿã€‚	æ›¼èŒ¶ç¾…ï¼Œäº‘é“å ´ä¹Ÿã€åœ“å ´ä¹Ÿã€‚	Maá¹‡á¸ala means field of enlightenment and circular field.
['ZH_T35_1735_059:0953c29_1']	è¬‚ç„¡é˜¿è³´è€¶æŸ“åˆ†ä¾è™•ï¼Œè€Œæœ‰æ·¨åˆ†åœ“å ´ï¼Œå‡ºç”Ÿå‹å¾·ä¸å¯çª®ç›¡ï¼Œå³è½‰ä¾ç©¶ç«Ÿï¼Œé¡¯å¾·ç„¡ç›¡æ•…ä¹Ÿã€‚	è¬‚ç„¡é˜¿è³´è€¶æŸ“åˆ†ä¾è™•ï¼Œè€Œæœ‰æ·¨åˆ†åœ“å ´ï¼Œå‡ºç”Ÿå‹å¾·ä¸å¯çª®ç›¡ï¼Œå³è½‰ä¾ç©¶ç«Ÿï¼Œé¡¯å¾·ç„¡ç›¡æ•…ä¹Ÿã€‚	It means that there is no defiled aspect of the Älaya consciousness as a basis, but there is the pure aspect as the perfect ground, giving rise to supreme virtues that are inexhaustible. This is precisely the ultimate transformation of the basis, manifesting virtues that are inexhaustible.
['ZH_T35_1735_059:0953c29_11']	ã€ä¸‹äºŒå¥å³äºŒåˆ©ä¹‹ç”¨ã€‚	ã€ä¸‹äºŒå¥å³äºŒåˆ©ä¹‹ç”¨ã€‚	The two phrases below are the functions of the two benefits.
['ZH_T35_1735_059:0954a01_12']	å¾Œå¾—ä¸‰æ˜§ï¼Œå…ˆåã€å¾Œã€Œéå½¼ã€ä¸‹ç”¨ï¼Œå³ç‚ºé‡‹åã€‚	å¾Œå¾—ä¸‰æ˜§ï¼Œå…ˆåã€å¾Œã€Œéå½¼ã€ä¸‹ç”¨ï¼Œå³ç‚ºé‡‹åã€‚	The subsequent attainment of samÄdhi first has the name, and then the function below not that is used to explain the name.
['ZH_T35_1735_059:0954a01_19']	æ–¼ä¸­ï¼Œåˆæ€æ¿«ï¼›	æ–¼ä¸­ï¼Œåˆæ€æ¿«ï¼›	In it, the first distinguishes the erroneous;
['ZH_T35_1735_059:0954a03_6']	å¾Œã€Œä»¥èƒ½ã€ä¸‹é¡¯æ˜¯ï¼Œè¬‚é«”å‰‡é›™è¶…ç›¡åŠç„¡ç›¡ï¼Œä½†å¾ç”¨å‡ºç”Ÿèªªç„¡ç›¡è€³ã€‚	å¾Œã€Œä»¥èƒ½ã€ä¸‹é¡¯æ˜¯ï¼Œè¬‚é«”å‰‡é›™è¶…ç›¡åŠç„¡ç›¡ï¼Œä½†å¾ç”¨å‡ºç”Ÿèªªç„¡ç›¡è€³ã€‚	The latter reveals the correct from because it can, meaning that the essence transcends both exhaustion and inexhaustibility, but it is only said to be inexhaustible from the perspective of giving rise to it from function.
['ZH_T35_1735_059:0954a04_14']	ç„¶å‰‡äºŒé–€ç›¸æˆç„¡ä¾é“å ´å³ç©ºå¦‚ä¾†è—ï¼Œç„¡ç›¡ä¸‰æ˜§å³æ˜¯ä¸ç©ºã€‚	ç„¶å‰‡äºŒé–€ç›¸æˆç„¡ä¾é“å ´å³ç©ºå¦‚ä¾†è—ï¼Œç„¡ç›¡ä¸‰æ˜§å³æ˜¯ä¸ç©ºã€‚	Then the two gates mutually support each other. The basisless site is the empty tathÄgatagarbha, and the inexhaustible samÄdhi is the non-empty one.
['ZH_T35_1735_059:0954a05_18']	è¦å¿ƒç„¡ä¾ã€å¥‘æ–¼æœ¬ç©ºï¼Œæ–¹è¦‹ä¸ç©ºå…·æ€§åŠŸå¾·ï¼Œæ•…äº‘å‡ºç”Ÿã€‚	è¦å¿ƒç„¡ä¾ã€å¥‘æ–¼æœ¬ç©ºï¼Œæ–¹è¦‹ä¸ç©ºå…·æ€§åŠŸå¾·ï¼Œæ•…äº‘å‡ºç”Ÿã€‚	It is necessary for the mind to be without a basis and accord with the original emptiness in order to see the non-empty endowed with the nature's merits, thus it is called giving rise to.
['ZH_T35_1735_059:0954a06_13']	æ™ºæ€§çœ¼ç­‰æ¯å¦„é¡¯å‡ºï¼Œæ•…æ›°å‡ºç”Ÿã€‚	æ™ºæ€§çœ¼ç­‰æ¯å¦„é¡¯å‡ºï¼Œæ•…æ›°å‡ºç”Ÿã€‚	The nature of wisdom, eyes, and so forth, cease delusion and manifest, thus it is called giving rise to.
['ZH_T35_1735_059:0954a07_4']	å‡ºéæœ¬ç„¡ï¼ŒçŒ¶ç¨±æ™ºæ€§ã€‚	å‡ºéæœ¬ç„¡ï¼ŒçŒ¶ç¨±æ™ºæ€§ã€‚	Giving rise to does not mean originally non-existent, it is still called the nature of wisdom.
['ZH_T35_1735_059:0954a08_13']	æŒ‡å¾Œäº‘æ²ƒç”°è€…ï¼Œæ˜¯å—å¤©ç«ºè¿‘æ°´æ²ƒæ½¤æ•…ï¼Œé¡¯ç„¡å¿µå®šæ°´èƒ½æ»‹é•·æ•…ã€‚	æŒ‡å¾Œäº‘æ²ƒç”°è€…ï¼Œæ˜¯å—å¤©ç«ºè¿‘æ°´æ²ƒæ½¤æ•…ï¼Œé¡¯ç„¡å¿µå®šæ°´èƒ½æ»‹é•·æ•…ã€‚	The later text refers to the fertile field as the southern India near the water, which is fertile and moist, manifesting the water of mindfulness-free concentration that can nourish and grow.
['ZH_T35_1735_059:0954a09_19']	é•·è€…åå …å›ºè§£è„«è€…ï¼Œç„¡è‘—æ¸…æ·¨ï¼Œæƒ‘ä¸èƒ½å£ï¼Œå³è§£è„«æ•…ã€‚	é•·è€…åå …å›ºè§£è„«è€…ï¼Œç„¡è‘—æ¸…æ·¨ï¼Œæƒ‘ä¸èƒ½å£ï¼Œå³è§£è„«æ•…ã€‚	The elder named Firm Liberation is unattached and pure, and afflictions cannot destroy it, which is liberation.
['ZH_T35_1735_059:0954a10_13']	ç¬¬äº”å …å›ºé•·è€…ï¼Œå¹»æ™ºç„¡è‘—å–„å‹ã€‚	ç¬¬äº”å …å›ºé•·è€…ï¼Œå¹»æ™ºç„¡è‘—å–„å‹ã€‚	The fifth elder, Firm, is a good friend of illusory wisdom without attachment.
['ZH_T35_1735_059:0954a11_3']	ç¤ºæ³•é–€ä¸­ï¼Œå…ˆé¡¯åã€‚	ç¤ºæ³•é–€ä¸­ï¼Œå…ˆé¡¯åã€‚	In the demonstration of the Dharma gate, first the name is revealed.
['ZH_T35_1735_059:0954a11_13']	ç„¡è‘—ç´„å¢ƒï¼Œé›¢æ‰€çŸ¥æ•…ã€‚	ç„¡è‘—ç´„å¢ƒï¼Œé›¢æ‰€çŸ¥æ•…ã€‚	Non-attachment is based on the object, because it is free from what is to be known.
['ZH_T35_1735_059:0954a12_8']	ç„¡å¿µç´„å¿ƒï¼Œå¿ƒé«”é›¢å¿µæ•…ç„¡ç…©æƒ±ã€‚	ç„¡å¿µç´„å¿ƒï¼Œå¿ƒé«”é›¢å¿µæ•…ç„¡ç…©æƒ±ã€‚	Mindfulness-free is based on the mind, because the essence of the mind is free from thoughts, so there are no afflictions.
['ZH_T35_1735_059:0954a13_6']	äºŒéšœæ°¸ç›¡æ˜¯æ›°æ¸…æ·¨ï¼Œæ·¨å‰‡èƒ½åš´æ³•èº«ã€‚	äºŒéšœæ°¸ç›¡æ˜¯æ›°æ¸…æ·¨ï¼Œæ·¨å‰‡èƒ½åš´æ³•èº«ã€‚	The complete exhaustion of the two hindrances is called purity, and purity can adorn the Dharma body.
['ZH_T35_1735_059:0954a13_16']	å¾Œã€Œæˆ‘è‡ªå¾—ã€ä¸‹å½°ç”¨ã€‚	å¾Œã€Œæˆ‘è‡ªå¾—ã€ä¸‹å½°ç”¨ã€‚	Later, after I myself attain, the function is revealed.
['ZH_T35_1735_059:0954a14_16']	æ—¢äºŒéšœä¸ç”Ÿï¼Œå‰‡ç„¡æ„›è¦‹ï¼Œæ•…ç„¡æ±‚æ±‚æ³•ç„¡å­ç„¡ä¼‘ã€‚	æ—¢äºŒéšœä¸ç”Ÿï¼Œå‰‡ç„¡æ„›è¦‹ï¼Œæ•…ç„¡æ±‚æ±‚æ³•ç„¡å­ç„¡ä¼‘ã€‚	Since the two hindrances do not arise, there is no love or views, so there is no seeking, seeking the Dharma without weariness or rest.
['ZH_T35_1735_059:0954a15_11']	ç¬¬å…­å¦™æœˆé•·è€…ï¼Œå¹»æ™ºæ™ºå…‰å–„å‹ã€‚	ç¬¬å…­å¦™æœˆé•·è€…ï¼Œå¹»æ™ºæ™ºå…‰å–„å‹ã€‚	The sixth elder, Wonderful Moon, is a good friend of the light of wisdom of illusory wisdom.
['ZH_T35_1735_059:0954a16_1']	çœŸæ™ºå»“å¦„ï¼Œåç‚ºæ·¨æ™ºã€‚	çœŸæ™ºå»“å¦„ï¼Œåç‚ºæ·¨æ™ºã€‚	True wisdom eradicates delusion, called pure wisdom.
['ZH_T35_1735_059:0954a16_11']	å¾Œæ™ºç…§æ³•ï¼Œåç‚ºæ™ºå…‰ã€‚	å¾Œæ™ºç…§æ³•ï¼Œåç‚ºæ™ºå…‰ã€‚	Later wisdom illuminates phenomena, called the light of wisdom.
['ZH_T35_1735_059:0954a17_7']	èƒ½æ·¨èƒ½å…‰ï¼Œè‹¥ç§‹ç©ºæ»¿æœˆï¼Œæ•…åå¦™æœˆã€‚	èƒ½æ·¨èƒ½å…‰ï¼Œè‹¥ç§‹ç©ºæ»¿æœˆï¼Œæ•…åå¦™æœˆã€‚	It can purify and illuminate, like the full moon in an autumn sky, thus it is called Sublime Moon.
['ZH_T35_1735_059:0954a18_3']	ç¬¬ä¸ƒç„¡å‹è»é•·è€…ï¼Œå¹»æ™ºç„¡ç›¡ç›¸å–„å‹ã€‚	ç¬¬ä¸ƒç„¡å‹è»é•·è€…ï¼Œå¹»æ™ºç„¡ç›¡ç›¸å–„å‹ã€‚	The seventh is the elder Anantavarma, a good friend of illusory wisdom and inexhaustible characteristics.
['ZH_T35_1735_059:0954a18_19']	æ³•é–€ä¹‹åï¼Œå³æ‰€æˆå¾·ç›¸ï¼Œç„¡çª®ç›¡æ•…ã€‚	æ³•é–€ä¹‹åï¼Œå³æ‰€æˆå¾·ç›¸ï¼Œç„¡çª®ç›¡æ•…ã€‚	The name of the Dharma gate is the accomplished virtue and characteristics, which are inexhaustible.
['ZH_T35_1735_059:0954a19_10']	ã€Œæˆ‘ä»¥è­‰ã€ä¸‹ä»¥ç”¨é‡‹åã€‚	ã€Œæˆ‘ä»¥è­‰ã€ä¸‹ä»¥ç”¨é‡‹åã€‚	I have realized and below uses the function to explain the name.
['ZH_T35_1735_059:0954a20_1']	å¾—ç„¡ç›¡è—ï¼Œè¬‚èè«¸å¦™æ³•ã€‚	å¾—ç„¡ç›¡è—ï¼Œè¬‚èè«¸å¦™æ³•ã€‚	Obtaining the inexhaustible treasury refers to hearing all the wonderful Dharma.
['ZH_T35_1735_059:0954a21_2']	åˆè«¸å¿ƒå¢ƒç„¡éä½›æ³•æ•…ï¼Œè‹¥ä½›è‹¥æ³•çš†ç„¡æœ‰ç›¡ã€‚	åˆè«¸å¿ƒå¢ƒç„¡éä½›æ³•æ•…ï¼Œè‹¥ä½›è‹¥æ³•çš†ç„¡æœ‰ç›¡ã€‚	Moreover, all mind and objects are not apart from the Buddha Dharma, therefore, whether it is the Buddha or the Dharma, they are all inexhaustible.
['ZH_T35_1735_059:0954a21_15']	æ—¢è¦‹ä½›å¾—æ³•ç„¡ç›¡ï¼Œæ•…ç„¡èƒ½å‹ã€‚	æ—¢è¦‹ä½›å¾—æ³•ç„¡ç›¡ï¼Œæ•…ç„¡èƒ½å‹ã€‚	Since seeing the Buddha and attaining the inexhaustible Dharma, there is nothing that can surpass it.
['ZH_T35_1735_059:0954a22_15']	çœ¾å¾·æ‰€èšï¼Œå¾å–»å¦‚è»ï¼Œäº¦èƒ½æ™®å‹è«¸é­”è»æ•…ã€‚	çœ¾å¾·æ‰€èšï¼Œå¾å–»å¦‚è»ï¼Œäº¦èƒ½æ™®å‹è«¸é­”è»æ•…ã€‚	The gathering of many virtues is like an army, and it can also universally conquer all demonic armies, thus it is called Invincible.
['ZH_T35_1735_059:0954a23_8']	çš†å¾é«”å‡ºæ•…ï¼ŒåŸåå‡ºç”Ÿã€‚	çš†å¾é«”å‡ºæ•…ï¼ŒåŸåå‡ºç”Ÿã€‚	All emerge from the essence, thus the city is called Emergence.
['ZH_T35_1735_059:0954a24_5']	ç¬¬å…«æœ€å¯‚éœå©†ç¾…é–€ï¼Œå¹»æ™ºèª é¡˜èªå–„å‹ã€‚	ç¬¬å…«æœ€å¯‚éœå©†ç¾…é–€ï¼Œå¹»æ™ºèª é¡˜èªå–„å‹ã€‚	The eighth is the Brahmin ParamÄrtha, a good friend of illusory wisdom and sincere vow speech.
['ZH_T35_1735_059:0954a24_13']	æˆæ³•ä¸­ï¼Œå…ˆæ¨™åã€‚	æˆæ³•ä¸­ï¼Œå…ˆæ¨™åã€‚	In bestowing the Dharma, he first presents the name.
['ZH_T35_1735_059:0954a24_18']	æœ‰äºŒç¾©æ•…ï¼š	æœ‰äºŒç¾©æ•…ï¼š	There are two meanings:
['ZH_T35_1735_059:0954a25_6']	ä¸€å§‹çµ‚ç„¡å¦„æ•…ã€‚	ä¸€å§‹çµ‚ç„¡å¦„æ•…ã€‚	First, there is no falsehood from beginning to end.
['ZH_T35_1735_059:0954a26_9']	å¦‚å¾åˆç™¼å¿ƒç«‹å¼˜èª“è¨€ï¼Œå¿…å¦‚è¨€è¡Œï¼Œä¸ä¹–å…ˆèªæ•…ã€‚	å¦‚å¾åˆç™¼å¿ƒç«‹å¼˜èª“è¨€ï¼Œå¿…å¦‚è¨€è¡Œï¼Œä¸ä¹–å…ˆèªæ•…ã€‚	It is like from the initial arousal of the mind establishing a great vow, one must act in accordance with the words, not deviating from one's previous speech.
['ZH_T35_1735_059:0954a27_14']	äºŒè€…éš¨è¡Œä¸è™›æ•…ï¼Œå¦‚å¿è¾±ä»™äººï¼Œè¨€æˆ‘ä¸ç‹ï¼Œä»¤èº«é‚„å¾©ã€‚	äºŒè€…éš¨è¡Œä¸è™›æ•…ï¼Œå¦‚å¿è¾±ä»™äººï¼Œè¨€æˆ‘ä¸ç‹ï¼Œä»¤èº«é‚„å¾©ã€‚	Second, because the practice is not empty, like the ká¹£ÄntivÄdin sage, who said, I am not angry, and caused his body to be restored.
['ZH_T35_1735_059:0954a28_11']	å¾Œã€Œéå»ã€ä¸‹ä»¥ç”¨é‡‹åï¼Œå³å¦‚æ¬¡é‡‹å‰äºŒç¾©ã€‚	å¾Œã€Œéå»ã€ä¸‹ä»¥ç”¨é‡‹åï¼Œå³å¦‚æ¬¡é‡‹å‰äºŒç¾©ã€‚	Later, below in the past, using to explain the name, immediately explains the previous two meanings.
['ZH_T35_1735_059:0954a29_2']	è™›èª‘è¨€æ¯ï¼Œæ•…äº‘å¯‚éœã€‚	è™›èª‘è¨€æ¯ï¼Œæ•…äº‘å¯‚éœã€‚	Deceitful speech ceases, therefore it is called tranquil.
['ZH_T35_1735_059:0954a29_9']	å¯‚éœå³ç‚ºæ·¨è¡Œã€‚	å¯‚éœå³ç‚ºæ·¨è¡Œã€‚	Tranquility is precisely pure conduct.
['ZH_T35_1735_059:0954b01_13']	è¨€è¡Œï¼Œå›å­ä¹‹æ¨æ©Ÿï¼Œè‹Ÿèƒ½èª å¯¦ï¼Œæ–¯å‰‡å¯æ³•ï¼Œæ•…åŸåç‚ºæ³•ã€‚	è¨€è¡Œï¼Œå›å­ä¹‹æ¨æ©Ÿï¼Œè‹Ÿèƒ½èª å¯¦ï¼Œæ–¯å‰‡å¯æ³•ï¼Œæ•…åŸåç‚ºæ³•ã€‚	Speech and action are the pivot of a gentleman. If one can be sincere and truthful, then this can be emulated, therefore the city is called Dharma.
['ZH_T35_1735_059:0954b03_3']	æŒ‡å¾Œäº‘å¦™æ„è¯é–€è€…ï¼Œå¦™æ„è¯è€…å³è˜‡æ»¿é‚£è¯ï¼Œå…¶åŸé–€å´æœ‰ä¹‹æ•…ã€‚	æŒ‡å¾Œäº‘å¦™æ„è¯é–€è€…ï¼Œå¦™æ„è¯è€…å³è˜‡æ»¿é‚£è¯ï¼Œå…¶åŸé–€å´æœ‰ä¹‹æ•…ã€‚	Pointing to the later, it says the gate of the wondrous intention flower. The wondrous intention flower is the same as the somanÄsa flower, because it exists beside the city gate.
['ZH_T35_1735_059:0954b04_7']	äº¦åœ¨å—å¤©ï¼Œç•¶å—å…¶è¨“ï¼Œå¾—æ±‚å‹ä¹‹å¦™æ„ã€å‹å› ä¹‹è¯æ•…ã€‚	äº¦åœ¨å—å¤©ï¼Œç•¶å—å…¶è¨“ï¼Œå¾—æ±‚å‹ä¹‹å¦™æ„ã€å‹å› ä¹‹è¯æ•…ã€‚	It is also in the south, one should receive its teachings, attain the wondrous intention of seeking friends and the flower of superior causes.
['ZH_T35_1735_059:0954b05_2']	ç«¥å­è¡¨æ–¼æ·¨æ™ºï¼Œæ™ºå‰‡è¬å¾·ç”±ç”Ÿã€‚	ç«¥å­è¡¨æ–¼æ·¨æ™ºï¼Œæ™ºå‰‡è¬å¾·ç”±ç”Ÿã€‚	The youth represents pure wisdom, wisdom then gives rise to myriad virtues.
['ZH_T35_1735_059:0954b05_16']	ç«¥å¥³è¡¨æ–¼æ·¨æ‚²ï¼Œæ‚²ç‚ºçœ¾å¾·ä¹‹æœ¬ã€‚	ç«¥å¥³è¡¨æ–¼æ·¨æ‚²ï¼Œæ‚²ç‚ºçœ¾å¾·ä¹‹æœ¬ã€‚	The maiden represents pure compassion, compassion is the root of myriad virtues.
['ZH_T35_1735_059:0954b06_9']	ä»¥æ‚²æ™ºç›¸å°æ•…ï¼ŒäºŒäººåŒæœƒã€‚	ä»¥æ‚²æ™ºç›¸å°æ•…ï¼ŒäºŒäººåŒæœƒã€‚	Because of the mutual guidance of compassion and wisdom, the two people meet together.
['ZH_T35_1735_059:0954b06_19']	æœƒç·£ä¹‹çµ‚ï¼Œæ­¤äºŒæ»¿æ•…ã€‚	æœƒç·£ä¹‹çµ‚ï¼Œæ­¤äºŒæ»¿æ•…ã€‚	At the end of gathering conditions, these two are fulfilled.
['ZH_T35_1735_059:0954b07_17']	å°‡è¦‹æ…ˆæ°ï¼Œç´¹ä½›ä½æ•…å·²ä¸‹å…¥ç¬¬ä¸ƒåä¸ƒç¶“ã€‚	å°‡è¦‹æ…ˆæ°ï¼Œç´¹ä½›ä½æ•…å·²ä¸‹å…¥ç¬¬ä¸ƒåä¸ƒç¶“ã€‚	About to see Maitreya, inheriting the Buddha's position, below this enters the seventy-seventh chapter.
['ZH_T35_1735_059:0954b08_8']	ç¬¬ä¹å¾·ç”Ÿï¼Œæœ‰å¾·å¹»æ™ºæ­¸å¹»é–€å–„å‹ã€‚	ç¬¬ä¹å¾·ç”Ÿï¼Œæœ‰å¾·å¹»æ™ºæ­¸å¹»é–€å–„å‹ã€‚	The ninth virtuous one, the virtuous one of illusory wisdom, returns to the gate of illusion, a good friend.
['ZH_T35_1735_059:0954b08_15']	ç¬¬ä¸€ä¾æ•™è¶£æ±‚ã€‚	ç¬¬ä¸€ä¾æ•™è¶£æ±‚ã€‚	The first is relying on the teachings and seeking.
