segmentnr	original	analyzed	folio	translated
['ZH_T02_0113_001:0506b01_6']	è‹¥æ…§å¼Ÿå­è‡ªå¿µæˆ’å¾·ï¼Œä½›æ‰€æ–½æˆ’ä¸å¯çŠ¯ã€ä¸å¯è¼•ã€ä¸å¯æ¯€ã€ä¸å¯å¼„ã€ä¸å¯è©¦ï¼Œæ…§è€…å¾æˆ’å¾—å®šï¼Œå¾å®šä¾¿é›¢æ„›ï¼Œæ„ä¸è‘—ä¸–é–“ï¼Œè­¬å¦‚çŸ³ç ´çµ‚ä¸å¾©åˆã€‚	è‹¥æ…§å¼Ÿå­è‡ªå¿µæˆ’å¾·ï¼Œä½›æ‰€æ–½æˆ’ä¸å¯çŠ¯ã€ä¸å¯è¼•ã€ä¸å¯æ¯€ã€ä¸å¯å¼„ã€ä¸å¯è©¦ï¼Œæ…§è€…å¾æˆ’å¾—å®šï¼Œå¾å®šä¾¿é›¢æ„›ï¼Œæ„ä¸è‘—ä¸–é–“ï¼Œè­¬å¦‚çŸ³ç ´çµ‚ä¸å¾©åˆã€‚	001	If a wise disciple reflects on the virtue of precepts, the precepts bestowed by the Buddha cannot be transgressed, cannot be taken lightly, cannot be violated, cannot be ridiculed, and cannot be tested. The wise attain concentration from the precepts, and following concentration, they depart from craving, and their minds do not cling to the world, just as a broken stone can never be joined again.
['ZH_T02_0113_001:0506b01_9']	é›£æï¼	é›£æï¼	001	Nanda!
['ZH_T02_0113_001:0506b04_1']	æ˜¯æ™‚æ…§å¼Ÿå­æ„ä¸è‘—è²ªæ¬²ã€ä¸è‘—ç‹æšã€ä¸è‘—æ„šç™¡ã€ä¾¿ç‚ºç›´æ„ï¼Œæ…§å¼Ÿå­æ„å·²ç›´ï¼Œå·²ç›´æ„ä¾¿å¾—ç¾©ã€ä¾¿å¾—æ³•ã€ä¾¿è¦‹æ³•ã€ä¾¿å¤§æ¨‚å–œï¼›	æ˜¯æ™‚æ…§å¼Ÿå­æ„ä¸è‘—è²ªæ¬²ã€ä¸è‘—ç‹æšã€ä¸è‘—æ„šç™¡ã€ä¾¿ç‚ºç›´æ„ï¼Œæ…§å¼Ÿå­æ„å·²ç›´ï¼Œå·²ç›´æ„ä¾¿å¾—ç¾©ã€ä¾¿å¾—æ³•ã€ä¾¿è¦‹æ³•ã€ä¾¿å¤§æ¨‚å–œï¼›	001	At that time, the wise disciple's mind is not attached to greed, anger, or delusion, and becomes upright. The wise disciple's mind being upright, he attains the meaning, attains the Dharma, sees the Dharma, and greatly delights in it.
['ZH_T02_0113_001:0506b04_13']	å·²å–œä¾¿ç”Ÿæ¨‚ï¼Œå¾æ¨‚ä¾¿èº«æ»…ï¼›	å·²å–œä¾¿ç”Ÿæ¨‚ï¼Œå¾æ¨‚ä¾¿èº«æ»…ï¼›	001	From delight, bliss arises. From bliss, the body is extinguished.
['ZH_T02_0113_001:0506b05_3']	èº«å·²æ»…ä¾¿å¾—å®‰éš±æ„ï¼›	èº«å·²æ»…ä¾¿å¾—å®‰éš±æ„ï¼›	001	From the extinction of the body, one attains peace of mind.
['ZH_T02_0113_001:0506b07_1']	å¾å®‰éš±ä¾¿å¾—å®šï¼Œå¾å®šä¾¿å¦‚çŸ¥å¦‚è¦‹ï¼Œæ˜¯ç‚ºè‹¦è«¦ï¼Œæ˜¯ç‚ºç¿’ï¼Œæ˜¯ç‚ºç›¡ï¼Œæ˜¯ç‚ºè‹¦æ»…å‘é“è€…è«¦ã€‚	å¾å®‰éš±ä¾¿å¾—å®šï¼Œå¾å®šä¾¿å¦‚çŸ¥å¦‚è¦‹ï¼Œæ˜¯ç‚ºè‹¦è«¦ï¼Œæ˜¯ç‚ºç¿’ï¼Œæ˜¯ç‚ºç›¡ï¼Œæ˜¯ç‚ºè‹¦æ»…å‘é“è€…è«¦ã€‚	001	From peace, one attains concentration. From concentration, one knows and sees as it is. This is the truth of suffering, this is the accumulation, this is the cessation, and this is the noble truth of the path leading to the cessation of suffering.
['ZH_T02_0113_001:0506b07_4']	é›£æï¼	é›£æï¼	001	Nanda!
['ZH_T02_0113_001:0506b09_5']	è‹¥æ…§å¼Ÿå­åœ¨é‚ªä¸­ç‚ºç›´å¿µï¼Œæœ‰æ¨æ„ä¾¿ç‚ºæ¨ï¼Œæ„æœ‰æ‰€è‘—ä¾¿ä¸å—ï¼Œæ˜¯ç‚ºæ…§å¼Ÿå­æ¨‚é“è¿¹ï¼Œç‚ºå¸¸å¿µæˆ’å¾·ã€‚	è‹¥æ…§å¼Ÿå­åœ¨é‚ªä¸­ç‚ºç›´å¿µï¼Œæœ‰æ¨æ„ä¾¿ç‚ºæ¨ï¼Œæ„æœ‰æ‰€è‘—ä¾¿ä¸å—ï¼Œæ˜¯ç‚ºæ…§å¼Ÿå­æ¨‚é“è¿¹ï¼Œç‚ºå¸¸å¿µæˆ’å¾·ã€‚	001	If a wise disciple has crooked thoughts in crookedness, has a hateful mind, then he abandons it. If the mind is attached, he does not accept it. This is called a wise disciple who delights in the path and always contemplates the virtue of precepts.
['ZH_T02_0113_001:0506b09_8']	é›£æï¼	é›£æï¼	001	Nanda!
['ZH_T02_0113_001:0506b12_10']	è‹¥æ…§å¼Ÿå­è‡ªå¿µæ–½èˆ‡ä¹‹å¾·ï¼Œå¿«å“‰æˆ‘å·²å¾—ä½œäººï¼Œæ–¼æ…³è²ªä¹‹ä¸­èƒ½è‡ªæ‹”ï¼Œç„¡æœ‰å«‰ä¹‹æ„ï¼Œç‚ºå¸¸æ¨‚èˆ‡ç‚ºä¿¡æ‰€èˆ‡ï¼Œå¾Œå¿…ç•¶å¾—å°‘æ–½æ‰€å¾—ç„¡é‡ï¼Œå¾æ–½å¾—ç„¡ç‚ºã€‚	è‹¥æ…§å¼Ÿå­è‡ªå¿µæ–½èˆ‡ä¹‹å¾·ï¼Œå¿«å“‰æˆ‘å·²å¾—ä½œäººï¼Œæ–¼æ…³è²ªä¹‹ä¸­èƒ½è‡ªæ‹”ï¼Œç„¡æœ‰å«‰ä¹‹æ„ï¼Œç‚ºå¸¸æ¨‚èˆ‡ç‚ºä¿¡æ‰€èˆ‡ï¼Œå¾Œå¿…ç•¶å¾—å°‘æ–½æ‰€å¾—ç„¡é‡ï¼Œå¾æ–½å¾—ç„¡ç‚ºã€‚	001	If a wise disciple reflects on the virtue of giving, they will think, 'How wonderful! I have already become a human, and am able to pull myself out of stinginess and greed, without any jealous thoughts. I always enjoy giving and give with faith, and later I will certainly obtain immeasurable rewards from giving a little. From giving, I attain the unconditioned.'
['ZH_T02_0113_001:0506b12_13']	é›£æï¼	é›£æï¼	001	Nanda!
['ZH_T02_0113_001:0506b13_19']	æ˜¯æ™‚æ…§å¼Ÿå­æ„ä¸è‘—è²ªæ¬²ã€ä¸è‘—ç‹æšã€ä¸è‘—æ„šç™¡ï¼Œä¾¿ç‚ºç›´æ„ï¼›	æ˜¯æ™‚æ…§å¼Ÿå­æ„ä¸è‘—è²ªæ¬²ã€ä¸è‘—ç‹æšã€ä¸è‘—æ„šç™¡ï¼Œä¾¿ç‚ºç›´æ„ï¼›	001	At that time, the wise disciple's mind is not attached to desire, anger, or ignorance, and thus becomes upright;
['ZH_T02_0113_001:0506b15_6']	æ…§å¼Ÿå­æ„å·²ç›´ï¼Œå·²ç›´æ„ä¾¿å¾—ç¾©ã€ä¾¿å¾—æ³•ã€ä¾¿è¦‹æ³•ã€ä¾¿å¤§æ¨‚å–œï¼›	æ…§å¼Ÿå­æ„å·²ç›´ï¼Œå·²ç›´æ„ä¾¿å¾—ç¾©ã€ä¾¿å¾—æ³•ã€ä¾¿è¦‹æ³•ã€ä¾¿å¤§æ¨‚å–œï¼›	001	The wise disciple's mind having become upright, they then attain the meaning, attain the Dharma, see the Dharma, and greatly rejoice;
['ZH_T02_0113_001:0506b16_7']	å·²å–œä¾¿ç”Ÿæ¨‚ï¼Œå¾æ¨‚ä¾¿èº«æ»…ï¼Œèº«å·²æ»…ä¾¿å¾—å®‰éš±æ„ï¼›	å·²å–œä¾¿ç”Ÿæ¨‚ï¼Œå¾æ¨‚ä¾¿èº«æ»…ï¼Œèº«å·²æ»…ä¾¿å¾—å®‰éš±æ„ï¼›	001	Having rejoiced, they then give rise to bliss, from bliss their body is extinguished, and their body having been extinguished they attain mental ease;
['ZH_T02_0113_001:0506b18_5']	å¾å®‰éš±ä¾¿å¾—å®šï¼Œå¾å®šä¾¿å¦‚çŸ¥å¦‚è¦‹ï¼Œæ˜¯ç‚ºè‹¦è«¦ï¼Œæ˜¯ç‚ºç¿’ï¼Œæ˜¯ç‚ºç›¡ï¼Œæ˜¯ç‚ºè‹¦æ»…å‘é“è€…è«¦ã€‚	å¾å®‰éš±ä¾¿å¾—å®šï¼Œå¾å®šä¾¿å¦‚çŸ¥å¦‚è¦‹ï¼Œæ˜¯ç‚ºè‹¦è«¦ï¼Œæ˜¯ç‚ºç¿’ï¼Œæ˜¯ç‚ºç›¡ï¼Œæ˜¯ç‚ºè‹¦æ»…å‘é“è€…è«¦ã€‚	001	From mental ease they attain concentration, from concentration they then know and see as it is, this is the truth of suffering, this is the truth of its arising, this is the truth of its cessation, this is the truth of the path leading to the cessation of suffering.
['ZH_T02_0113_001:0506b18_8']	é›£æï¼	é›£æï¼	001	Nanda!
['ZH_T02_0113_001:0506b20_12']	è‹¥æ…§å¼Ÿå­åœ¨é‚ªä¸­ç‚ºç›´å¿µï¼Œæœ‰æ¨æ„ä¾¿ç‚ºæ¨ï¼Œæ„æœ‰æ‰€è‘—ä¾¿ä¸å—ï¼Œæ˜¯ç‚ºæ…§å¼Ÿå­æ¨‚é“è¿¹ï¼Œç‚ºå¸¸å¿µæ–½èˆ‡ä¹‹å¾·ã€‚	è‹¥æ…§å¼Ÿå­åœ¨é‚ªä¸­ç‚ºç›´å¿µï¼Œæœ‰æ¨æ„ä¾¿ç‚ºæ¨ï¼Œæ„æœ‰æ‰€è‘—ä¾¿ä¸å—ï¼Œæ˜¯ç‚ºæ…§å¼Ÿå­æ¨‚é“è¿¹ï¼Œç‚ºå¸¸å¿µæ–½èˆ‡ä¹‹å¾·ã€‚	001	If a wise disciple, while in the midst of evil, thinks of what is straight, has a hateful mind and immediately abandons it, has something to which the mind clings and does not accept it, this is called a wise disciple who delights in the path, and always thinks of the virtue of giving.
['ZH_T02_0113_001:0506b21_3']	ã€Œé›£æï¼	ã€Œé›£æï¼	001	Nandi!
['ZH_T02_0113_001:0506b23_10']	è‹¥æ…§å¼Ÿå­å¿µè«¸å¤©å¾·ï¼Œç¬¬ä¸€ç…§é ­æ‘©è³´ï¼Œç¬¬äºŒå¿‰åˆ©ï¼Œç¬¬ä¸‰è±”ï¼Œç¬¬å››å…œè¡“ï¼Œç¬¬äº”æ³¥æ…¢ç¾…æï¼Œç¬¬å…­èˆ¬æ³¥è¿·é™€æƒ’èˆæƒ’æã€‚	è‹¥æ…§å¼Ÿå­å¿µè«¸å¤©å¾·ï¼Œç¬¬ä¸€ç…§é ­æ‘©è³´ï¼Œç¬¬äºŒå¿‰åˆ©ï¼Œç¬¬ä¸‰è±”ï¼Œç¬¬å››å…œè¡“ï¼Œç¬¬äº”æ³¥æ…¢ç¾…æï¼Œç¬¬å…­èˆ¬æ³¥è¿·é™€æƒ’èˆæƒ’æã€‚	001	If a wise disciple thinks of the virtue of the various heavens, the first is Tuá¹£ita, the second is TrÄyastriá¹ƒÅ›a, the third is YÄma, the fourth is NirmÄá¹‡arati, the fifth is ParanirmitavaÅ›avartin, the sixth is BrahmakÄyika.
['ZH_T02_0113_001:0506b26_3']	è‹¥å¾ä¿¡ã€è‹¥å¾æ¸…æ·¨ã€è‹¥å¾èã€è‹¥å¾æ–½ã€è‹¥å¾æ…§ï¼Œå„æœ‰è¡Œå¾—ä¸Šæ˜¯å…­å¤©ï¼Œæˆ‘äº¦èƒ½è¡Œäº”æ³•ï¼Œè‹¥ä¿¡ã€æˆ’ã€èã€æ–½ã€æ…§ï¼Œå¾æ˜¯å› ç·£å¾—ç”Ÿå¤©ä¸Šã€‚	è‹¥å¾ä¿¡ã€è‹¥å¾æ¸…æ·¨ã€è‹¥å¾èã€è‹¥å¾æ–½ã€è‹¥å¾æ…§ï¼Œå„æœ‰è¡Œå¾—ä¸Šæ˜¯å…­å¤©ï¼Œæˆ‘äº¦èƒ½è¡Œäº”æ³•ï¼Œè‹¥ä¿¡ã€æˆ’ã€èã€æ–½ã€æ…§ï¼Œå¾æ˜¯å› ç·£å¾—ç”Ÿå¤©ä¸Šã€‚	001	If one follows faith, purity, hearing, giving, or wisdom, each has practices that attain these six heavens. I am also able to practice the five dharmas of faith, precepts, hearing, giving, and wisdom. By these causes and conditions, I will be reborn in the heavens.
['ZH_T02_0113_001:0506b26_6']	é›£æï¼	é›£æï¼	001	Nandi!
['ZH_T02_0113_001:0506b27_12']	æ˜¯æ™‚æ…§å¼Ÿå­æ„ï¼Œä¸è‘—è²ªæ¬²ã€ä¸è‘—ç‹æšã€ä¸è‘—æ„šç™¡ï¼Œä¾¿ç‚ºç›´æ„ï¼›	æ˜¯æ™‚æ…§å¼Ÿå­æ„ï¼Œä¸è‘—è²ªæ¬²ã€ä¸è‘—ç‹æšã€ä¸è‘—æ„šç™¡ï¼Œä¾¿ç‚ºç›´æ„ï¼›	001	At that time, the wise disciple's mind is not attached to desire, not attached to anger, and not attached to delusion, and thus becomes a straight mind;
['ZH_T02_0113_001:0506b28_18']	æ…§å¼Ÿå­æ„å·²ç›´ï¼Œå·²ç›´æ„ä¾¿å¾—ç¾©ã€ä¾¿å¾—æ³•ã€ä¾¿è¦‹æ³•ã€ä¾¿å¤§æ¨‚å–œï¼›	æ…§å¼Ÿå­æ„å·²ç›´ï¼Œå·²ç›´æ„ä¾¿å¾—ç¾©ã€ä¾¿å¾—æ³•ã€ä¾¿è¦‹æ³•ã€ä¾¿å¤§æ¨‚å–œï¼›	001	The disciple of wisdom has already straightened his mind, and with a straightened mind he obtains the meaning, obtains the Dharma, sees the Dharma, and greatly delights;
['ZH_T02_0113_001:0506b29_9']	å·²å–œä¾¿ç”Ÿæ¨‚ï¼Œå¾æ¨‚ä¾¿èº«æ»…ï¼›	å·²å–œä¾¿ç”Ÿæ¨‚ï¼Œå¾æ¨‚ä¾¿èº«æ»…ï¼›	001	With delight, he gives rise to joy, from joy he attains physical cessation;
['ZH_T02_0113_001:0506c01_5']	èº«å·²æ»…ä¾¿å¾—å®‰éš±æ„ï¼Œå¾å®‰éš±ä¾¿å¾—å®šï¼›	èº«å·²æ»…ä¾¿å¾—å®‰éš±æ„ï¼Œå¾å®‰éš±ä¾¿å¾—å®šï¼›	001	With the cessation of the body, he attains a peaceful mind, from peace he attains concentration;
['ZH_T02_0113_001:0506c02_14']	å¾å®šä¾¿å¦‚çŸ¥å¦‚è¦‹ï¼Œæ˜¯ç‚ºè‹¦è«¦æ˜¯ç‚ºç¿’ï¼Œæ˜¯ç‚ºç›¡æ˜¯ç‚ºè‹¦æ»…å‘é“è€…è«¦ã€‚	å¾å®šä¾¿å¦‚çŸ¥å¦‚è¦‹ï¼Œæ˜¯ç‚ºè‹¦è«¦æ˜¯ç‚ºç¿’ï¼Œæ˜¯ç‚ºç›¡æ˜¯ç‚ºè‹¦æ»…å‘é“è€…è«¦ã€‚	001	From concentration, he knows as it is and sees as it is, this is the truth of suffering, this is the truth of accumulation, this is the truth of cessation, this is the truth of the path leading to the cessation of suffering.
['ZH_T02_0113_001:0506c02_17']	é›£æï¼	é›£æï¼	001	Nanda!
['ZH_T02_0113_001:0506c05_2']	è‹¥æ…§å¼Ÿå­åœ¨é‚ªä¸­ç‚ºç›´å¿µï¼Œæœ‰æ¨æ„ä¾¿ç‚ºæ¨ï¼Œæ„æœ‰æ‰€è‘—ä¾¿ä¸å—ï¼Œæ˜¯ç‚ºæ…§å¼Ÿå­æ¨‚é“è¿¹ï¼Œç‚ºå¸¸å¿µè«¸å¤©å¾·ã€‚	è‹¥æ…§å¼Ÿå­åœ¨é‚ªä¸­ç‚ºç›´å¿µï¼Œæœ‰æ¨æ„ä¾¿ç‚ºæ¨ï¼Œæ„æœ‰æ‰€è‘—ä¾¿ä¸å—ï¼Œæ˜¯ç‚ºæ…§å¼Ÿå­æ¨‚é“è¿¹ï¼Œç‚ºå¸¸å¿µè«¸å¤©å¾·ã€‚	001	If a disciple of wisdom has crooked thoughts in crookedness, has hateful thoughts and immediately abandons them, has attached thoughts and does not accept them, this is called a disciple of wisdom who delights in the path and always thinks of the virtues of the gods.
['ZH_T02_0113_001:0506c05_8']	ã€ä½›èªªå¦‚æ˜¯ã€‚	ã€ä½›èªªå¦‚æ˜¯ã€‚	001	The Buddha spoke like this.
['ZH_T02_0113_001:0506c06_14']	é›£æé‡‹å¤§æ­¡å–œå—ï¼Œè‘—æ„å¸¸è¡Œæ˜¯å…­å¿µï¼Œèµ·åæŒé ­é¢è‘—ä½›è¶³ç¦®ã€‚	é›£æé‡‹å¤§æ­¡å–œå—ï¼Œè‘—æ„å¸¸è¡Œæ˜¯å…­å¿µï¼Œèµ·åæŒé ­é¢è‘—ä½›è¶³ç¦®ã€‚	001	Nanda ÅšÄkyamuni greatly rejoiced and accepted it. He always practiced these six recollections, and when he got up and sat, he held his head and bowed at the Buddha's feet in reverence.
['ZH_T02_0113_001:0506c07_100']	ä½›èªªé›£æé‡‹ç¶“	ä½›èªªé›£æé‡‹ç¶“	001	The Buddha Speaks the SÅ«tra of Nanda ÅšÄkyamuni
