segmentnr	original	analyzed	translated
['ZH_T10_0294_003:0869a06_14']	ã€Œå–„å“‰ï¼Œå–„å“‰ï¼	ã€Œå–„å“‰ï¼Œå–„å“‰ï¼	Excellent, excellent!
['ZH_T10_0294_003:0869a06_18']	å–„ç”·å­ï¼	å–„ç”·å­ï¼	Good man!
['ZH_T10_0294_003:0869a08_12']	ä¹ƒèƒ½å¦‚æ˜¯æ±‚å–„çŸ¥è­˜ï¼Œè©£å–„çŸ¥è­˜ï¼Œè¦ªè¿‘ä¾›é¤Šå–„çŸ¥è­˜è€…ï¼Œå³æ˜¯è©æï¼Œæ±‚å–„çŸ¥è­˜æ˜¯å¤§ç²¾é€²ã€‚	ä¹ƒèƒ½å¦‚æ˜¯æ±‚å–„çŸ¥è­˜ï¼Œè©£å–„çŸ¥è­˜ï¼Œè¦ªè¿‘ä¾›é¤Šå–„çŸ¥è­˜è€…ï¼Œå³æ˜¯è©æï¼Œæ±‚å–„çŸ¥è­˜æ˜¯å¤§ç²¾é€²ã€‚	Those who are able to seek good and wise advisors in this way, visit good and wise advisors, and draw near to and make offerings to good and wise advisors, that is bodhi. Seeking good and wise advisors is great diligence.
['ZH_T10_0294_003:0869a08_16']	å–„ç”·å­ï¼	å–„ç”·å­ï¼	Good man!
['ZH_T10_0294_003:0869a10_19']	å–„çŸ¥è­˜è€…é›£è¦‹é›£é‡ï¼Œå–„çŸ¥è­˜åŠ›ä¸å¯ç ´å£ï¼Œå–„çŸ¥è­˜è€…æ™®éŠåæ–¹ï¼Œé™¤æ»…ç”Ÿæ­»ï¼Œæ‚‰æ–·ç…©æƒ±ï¼Œèƒ½æˆè¾¯æ‰ã€‚	å–„çŸ¥è­˜è€…é›£è¦‹é›£é‡ï¼Œå–„çŸ¥è­˜åŠ›ä¸å¯ç ´å£ï¼Œå–„çŸ¥è­˜è€…æ™®éŠåæ–¹ï¼Œé™¤æ»…ç”Ÿæ­»ï¼Œæ‚‰æ–·ç…©æƒ±ï¼Œèƒ½æˆè¾¯æ‰ã€‚	Good and virtuous friends are difficult to see and difficult to encounter. The power of good and virtuous friends is indestructible. Good and virtuous friends roam everywhere in the ten directions, eliminating birth and death, completely cutting off afflictions, and are able to accomplish eloquence.
['ZH_T10_0294_003:0869a11_18']	å–„çŸ¥è­˜è€…ï¼Œæ·±å…¥ä¸€åˆ‡ç„¡é‡å¤§äº‹ï¼ŒèŠåš´æ­£é †é“ã€‚	å–„çŸ¥è­˜è€…ï¼Œæ·±å…¥ä¸€åˆ‡ç„¡é‡å¤§äº‹ï¼ŒèŠåš´æ­£é †é“ã€‚	Good and virtuous friends deeply enter all immeasurable great matters, adorning and conforming to the path.
['ZH_T10_0294_003:0869a13_13']	å–„çŸ¥è­˜è€…ï¼Œæ‚‰æ˜¯æ™®ç¾æ³•é–€ï¼Œèƒ½ä»¤ä¸€åˆ‡å¾—ç„¡éšœç¤™ï¼Œä¸é›¢æœ¬è™•ï¼Œéè‡³åæ–¹ä¸€åˆ‡ä½›æ‰€ã€‚	å–„çŸ¥è­˜è€…ï¼Œæ‚‰æ˜¯æ™®ç¾æ³•é–€ï¼Œèƒ½ä»¤ä¸€åˆ‡å¾—ç„¡éšœç¤™ï¼Œä¸é›¢æœ¬è™•ï¼Œéè‡³åæ–¹ä¸€åˆ‡ä½›æ‰€ã€‚	Good and virtuous friends universally manifest the Dharma gate, enabling all to attain unobstructedness, not leaving their original place, and going everywhere to the abodes of all Buddhas in the ten directions.
['ZH_T10_0294_003:0869a15_11']	æ±‚å–„çŸ¥è­˜ç•¶èµ·æ˜¯æƒ³ï¼Œä¸ä¾†ã€ä¸å»ã€ä¸å‹•ã€ä¸æ–ï¼Œç„¡ä¾†å»ç›¸ï¼Œç‚ºä¸€åˆ‡æ™ºæ•‘è­·çœ¾ç”Ÿï¼Œæ‡‰æ±‚å–„å‹ã€‚	æ±‚å–„çŸ¥è­˜ç•¶èµ·æ˜¯æƒ³ï¼Œä¸ä¾†ã€ä¸å»ã€ä¸å‹•ã€ä¸æ–ï¼Œç„¡ä¾†å»ç›¸ï¼Œç‚ºä¸€åˆ‡æ™ºæ•‘è­·çœ¾ç”Ÿï¼Œæ‡‰æ±‚å–„å‹ã€‚	When seeking good and virtuous friends, one should give rise to this thought: not coming, not going, not moving, not shaking, without the characteristics of coming and going, for the sake of omniscience, to rescue and protect sentient beings, one should seek good friends.
['ZH_T10_0294_003:0869b02_18_0']	ã€çˆ¾æ™‚å–„è²¡ç«¥å­ï¼Œè¦‹å–„çŸ¥è­˜ï¼Œå³å¾—äº†çŸ¥ç„¡é‡ç„¡	ã€çˆ¾æ™‚å–„è²¡ç«¥å­ï¼Œè¦‹å–„çŸ¥è­˜ï¼Œå³å¾—äº†çŸ¥ç„¡é‡ç„¡	 At that time, the youth Sudhana, seeing good and virtuous friends, immediately attained the understanding of the ocean of immeasurable and
['ZH_T10_0294_003:0869b02_18_1']	é‚Šè«¸å¤§é¡˜æµ·ï¼Œå¾—ä¸€åˆ‡æ™ºï¼Œé¥’ç›Šçœ¾ç”Ÿï¼Œè¦ªè¿‘å–„å‹	é‚Šè«¸å¤§é¡˜æµ·ï¼Œå¾—ä¸€åˆ‡æ™ºï¼Œé¥’ç›Šçœ¾ç”Ÿï¼Œè¦ªè¿‘å–„å‹	boundless great vows, attained omniscience, benefited sentient beings, and closely attended good friends.
['ZH_T10_0294_003:0869b02_18_2', 'ZH_T10_0294_003:0869b02_18_3']	ï¼Œç‚ºè«¸çœ¾ç”Ÿç„¡é‡ç„¡æ•¸æ’æ²™å¾®å¡µä¸–ç•Œæµ·ï¼Œç›¡æ­¤ä¸–ğŸ”½ç•Œæµ·ï¼Œç›¡æ­¤ä¸–ç•Œé‚Šéš›ï¼Œå¾©éæ˜¯æ•¸ç„¡é‡ç„¡é‚Šä¸å¯	ï¼Œç‚ºè«¸çœ¾ç”Ÿç„¡é‡ç„¡æ•¸æ’æ²™å¾®å¡µä¸–ç•Œæµ·ï¼Œç›¡æ­¤ä¸– ç•Œæµ·ï¼Œç›¡æ­¤ä¸–ç•Œé‚Šéš›ï¼Œå¾©éæ˜¯æ•¸ç„¡é‡ç„¡é‚Šä¸å¯	For the sake of sentient beings in the immeasurable, innumerable, and vast worlds, reaching the end of this world
['ZH_T10_0294_003:0869b02_18_4']	èªªä¸å¯èªªè™•å¤§åœ°ç„ï¼Œç‚ºå½¼çœ¾ç”Ÿï¼Œèµ·æ–¼æ…ˆæ‚²ï¼Œæ­£	èªªä¸å¯èªªè™•å¤§åœ°ç„ï¼Œç‚ºå½¼çœ¾ç”Ÿï¼Œèµ·æ–¼æ…ˆæ‚²ï¼Œæ­£	and the end of this world's boundaries, and even beyond that, in the immeasurable, boundless, inexpressible, and vast hells, for those beings, giving rise to compassion,
['ZH_T10_0294_003:0869b02_18_5', 'ZH_T10_0294_003:0869b02_18_6']	å‘è©æï¼Œé™¤æ»…çœ¾ç”Ÿç„¡é‡åŠ«è‹¦ï¼Œä»¥ä¸€éŸ³è²ï¼Œæ™®éğŸ”½åæ–¹ä¸€åˆ‡ä¸–ç•Œï¼Œè¬›å®£å¦™æ³•ï¼Œè‹¥æœ‰èè€…ï¼Œæ»…ç„¡é‡	å‘è©æï¼Œé™¤æ»…çœ¾ç”Ÿç„¡é‡åŠ«è‹¦ï¼Œä»¥ä¸€éŸ³è²ï¼Œæ™®é åæ–¹ä¸€åˆ‡ä¸–ç•Œï¼Œè¬›å®£å¦™æ³•ï¼Œè‹¥æœ‰èè€…ï¼Œæ»…ç„¡é‡	Correctly facing enlightenment, eliminating the immeasurable eons of suffering for sentient beings, with a single sound, universally pervadingğŸ”½The worlds of the ten directions, expounding the wonderful Dharma. If there are those who hear it, they will eliminate the karmic hindrances of birth and death for immeasurable eons, and with great wisdom and vows,
['ZH_T10_0294_003:0869b02_18_7', 'ZH_T10_0294_003:0869b02_18_8']	åŠ«ç”Ÿæ­»ç½ªéšœï¼Œä»¥å¤§æ…§é¡˜ï¼Œè€Œè‡ªèŠåš´ï¼Œä¿®è©è–©è¡ŒğŸ”½ï¼Œæ–¼å¿µå¿µä¸­ï¼Œå¾—ä¸€åˆ‡æ™ºç›¸ï¼Œå…·ç¥é€šåŠ›ï¼Œæ–¼ä¸€åˆ‡	åŠ«ç”Ÿæ­»ç½ªéšœï¼Œä»¥å¤§æ…§é¡˜ï¼Œè€Œè‡ªèŠåš´ï¼Œä¿®è©è–©è¡Œ ï¼Œæ–¼å¿µå¿µä¸­ï¼Œå¾—ä¸€åˆ‡æ™ºç›¸ï¼Œå…·ç¥é€šåŠ›ï¼Œæ–¼ä¸€åˆ‡	Adorning themselves, cultivating bodhisattva practices,ğŸ”½In every thought, attaining the characteristics of omniscience, possessing the power of spiritual penetrations, in all places, always seeing all the buddhas and tathÄgatas,
['ZH_T10_0294_003:0869b02_18_9']	è™•ï¼Œå¸¸è¦‹ä¸€åˆ‡è«¸ä½›å¦‚ä¾†ï¼Œè¦ªè¿‘ä¾›é¤Šï¼Œç‚ºå–„çŸ¥è­˜	è™•ï¼Œå¸¸è¦‹ä¸€åˆ‡è«¸ä½›å¦‚ä¾†ï¼Œè¦ªè¿‘ä¾›é¤Šï¼Œç‚ºå–„çŸ¥è­˜	Approaching and making offerings to them, being good and wise advisors,
['ZH_T10_0294_003:0869b02_18_10']	ï¼Œä»¥ä½›èŠåš´è€Œè‡ªèŠåš´ï¼Œæ™®æ·¨ä¸‰ä¸–è«¸ä½›æ³•ç•Œï¼Œä¸	ï¼Œä»¥ä½›èŠåš´è€Œè‡ªèŠåš´ï¼Œæ™®æ·¨ä¸‰ä¸–è«¸ä½›æ³•ç•Œï¼Œä¸	Adorning themselves with the adornments of the buddhas, universally purifying the Dharma realms of the buddhas of the three times, not
['ZH_T10_0294_003:0869b02_18_11']	å…¥ç”Ÿæµã€ä¸ä½æ­»æµï¼Œå…·ä½›ç¥é€šï¼Œä¸ä½æ³•ç•Œã€ä¸	å…¥ç”Ÿæµã€ä¸ä½æ­»æµï¼Œå…·ä½›ç¥é€šï¼Œä¸ä½æ³•ç•Œã€ä¸	Entering the flow of birth, not dwelling in the flow of death, endowed with the Buddha's spiritual powers, not dwelling in the Dharma realm,
['ZH_T10_0294_003:0869b02_18_12']	é›¢æ³•ç•Œï¼Œè€Œèƒ½å¾€è©£åæ–¹ä¸–ç•Œï¼Œå……æ»¿æ³•ç•Œå–„çŸ¥è­˜	é›¢æ³•ç•Œï¼Œè€Œèƒ½å¾€è©£åæ–¹ä¸–ç•Œï¼Œå……æ»¿æ³•ç•Œå–„çŸ¥è­˜	not apart from the Dharma realm, able to go to the worlds of the ten directions, filling the Dharma realm, to the places of the good and wise advisors,
['ZH_T10_0294_003:0869b02_18_13']	æ‰€ï¼Œä¸è‘—èªè¨€ï¼Œå‰é‚£å‰é‚£é ƒï¼Œä¿®è©è–©è¡Œï¼Œæ»¿è¶³	æ‰€ï¼Œä¸è‘—èªè¨€ï¼Œå‰é‚£å‰é‚£é ƒï¼Œä¿®è©è–©è¡Œï¼Œæ»¿è¶³	not attached to language, in every instant, cultivating the bodhisattva practices, fulfilling
['ZH_T10_0294_003:0869b02_18_14', 'ZH_T10_0294_003:0869b02_18_15']	æ€§å¢ƒç•Œï¼Œæˆå°±è–©å©†è‹¥ï¼Œå…·ä¸€åˆ‡ä½›ç¥é€šéŠæˆ²ï¼ŒèŠğŸ”½åš´ä½›é“ï¼Œä»¥å¹³ç­‰æ³•ï¼Œèº«å¿ƒä¸å‹•ï¼Œæ™®æ”çœ¾ç”Ÿï¼Œå–„	æ€§å¢ƒç•Œï¼Œæˆå°±è–©å©†è‹¥ï¼Œå…·ä¸€åˆ‡ä½›ç¥é€šéŠæˆ²ï¼ŒèŠ åš´ä½›é“ï¼Œä»¥å¹³ç­‰æ³•ï¼Œèº«å¿ƒä¸å‹•ï¼Œæ™®æ”çœ¾ç”Ÿï¼Œå–„	the realm of nature, accomplishing omniscience, endowed with all the Buddha's spiritual powers and playfulness, adorning
['ZH_T10_0294_003:0869b02_18_16']	çŸ¥è­˜åŠ›ï¼Œé¡¯ç¾ä¸‰ä¸–ã€‚	çŸ¥è­˜åŠ›ï¼Œé¡¯ç¾ä¸‰ä¸–ã€‚	the Buddha's path, with the Dharma of equality, body and mind unmoving, universally gathering in sentient beings, the power of the good and wise advisors, manifesting the three times.
['ZH_T10_0294_003:0869b14_3_0']	çˆ¾æ™‚å–„è²¡ç«¥å­ï¼Œå³è©£å–œç›®è§€å¯Ÿçœ¾ç”Ÿå¤œå¤©æ‰€ï¼Œæ™‚	çˆ¾æ™‚å–„è²¡ç«¥å­ï¼Œå³è©£å–œç›®è§€å¯Ÿçœ¾ç”Ÿå¤œå¤©æ‰€ï¼Œæ™‚	At that time, the youth Sudhana went to where the night spirit Joyful Eyes Observing Sentient Beings was. At that time,
['ZH_T10_0294_003:0869b14_3_1']	å½¼å¤œå¤©ï¼Œæ–¼å¤§çœ¾ä¸­ï¼Œè™•å¯¶è“®è¯å¸«å­ä¹‹åº§ï¼Œæ­£å—	å½¼å¤œå¤©ï¼Œæ–¼å¤§çœ¾ä¸­ï¼Œè™•å¯¶è“®è¯å¸«å­ä¹‹åº§ï¼Œæ­£å—	the night spirit, in the great assembly, was sitting on a jeweled lotus flower lion seat, correctly receiving
['ZH_T10_0294_003:0869b14_3_2']	è©è–©æ™®ç¾å…‰å¹¢å–œæ·¨æ³•é–€ï¼Œä¸€åˆ‡æ¯›å­”ï¼Œå‡ºå¦™è‰²é›²	è©è–©æ™®ç¾å…‰å¹¢å–œæ·¨æ³•é–€ï¼Œä¸€åˆ‡æ¯›å­”ï¼Œå‡ºå¦™è‰²é›²	the bodhisattva's universal manifestation of the joyful and pure Dharma door of the light banner, all the pores emitting wonderful colored clouds
['ZH_T10_0294_003:0869b14_3_3']	ï¼Œå…¶æœ‰è¦‹è€…ï¼Œå–œæ‚…ç„¡å­ï¼Œä¸€ä¸€æ¯›å­”ï¼Œç¾çœ¾å¯¶é›²	ï¼Œå…¶æœ‰è¦‹è€…ï¼Œå–œæ‚…ç„¡å­ï¼Œä¸€ä¸€æ¯›å­”ï¼Œç¾çœ¾å¯¶é›²	, those who saw it were delighted without weariness, each pore manifesting clouds of various jewels
['ZH_T10_0294_003:0869b14_3_4']	ï¼Œæ‰€è¬‚æ™ºæ…§è¡Œå ±ï¼Œé¥’ç›Šçœ¾ç”Ÿï¼Œé›¢æ–¼è«è¨Ÿï¼Œä»¥å¹³	ï¼Œæ‰€è¬‚æ™ºæ…§è¡Œå ±ï¼Œé¥’ç›Šçœ¾ç”Ÿï¼Œé›¢æ–¼è«è¨Ÿï¼Œä»¥å¹³	Namely, the retribution of wisdom practice, benefiting sentient beings, leaving disputes, with an
['ZH_T10_0294_003:0869b14_3_5']	ç­‰å¿ƒï¼Œä¸è‘—è«¸æ³•ï¼Œä»¥ä¸Šå¦™æ™ºï¼Œæ”è«¸çœ¾ç”Ÿï¼Œé¡¯ç¾	ç­‰å¿ƒï¼Œä¸è‘—è«¸æ³•ï¼Œä»¥ä¸Šå¦™æ™ºï¼Œæ”è«¸çœ¾ç”Ÿï¼Œé¡¯ç¾	equal mind, not attached to dharmas, with supreme wisdom, embracing all sentient beings, manifesting
['ZH_T10_0294_003:0869b14_3_6']	ä¸‰ä¸–ï¼Œä¿®è©è–©è¡Œï¼Œå¿ƒç„¡æ…³æ‚‹ï¼Œèƒ½æ¨é›£æ¨ï¼Œæ™®æ–½	ä¸‰ä¸–ï¼Œä¿®è©è–©è¡Œï¼Œå¿ƒç„¡æ…³æ‚‹ï¼Œèƒ½æ¨é›£æ¨ï¼Œæ™®æ–½	the three times, cultivating bodhisattva practices, the mind without stinginess, able to give up what is difficult to give up, universally giving
['ZH_T10_0294_003:0869b14_3_7']	ä¸€åˆ‡ï¼Œèº«å¿ƒå¹³ç­‰ï¼Œä¸å¯æ€è­°ï¼Œä»¥å¸ƒæ–½ç¦ï¼Œæ™®æ”	ä¸€åˆ‡ï¼Œèº«å¿ƒå¹³ç­‰ï¼Œä¸å¯æ€è­°ï¼Œä»¥å¸ƒæ–½ç¦ï¼Œæ™®æ”	everything, the body and mind equal, inconceivable, with the blessings of giving, universally embracing
['ZH_T10_0294_003:0869b14_3_8']	çœ¾ç”Ÿï¼Œæ–¼è«¸çœ¾ç”Ÿï¼Œä¸èµ·æŸ“è‘—ï¼Œä¸è¦‹çœ¾ç›¸ï¼Œä¸æ¨	çœ¾ç”Ÿï¼Œæ–¼è«¸çœ¾ç”Ÿï¼Œä¸èµ·æŸ“è‘—ï¼Œä¸è¦‹çœ¾ç›¸ï¼Œä¸æ¨	sentient beings, not giving rise to attachment to sentient beings, not seeing various characteristics, not abandoning
['ZH_T10_0294_003:0869b14_3_9']	çœ¾ç”Ÿï¼Œæ‚‰å…·ä¸‰ä¸–è©è–©è‹¦è¡Œï¼Œåæ–¹ä¸–ç•Œä¸€åˆ‡çœ¾ç”Ÿ	çœ¾ç”Ÿï¼Œæ‚‰å…·ä¸‰ä¸–è©è–©è‹¦è¡Œï¼Œåæ–¹ä¸–ç•Œä¸€åˆ‡çœ¾ç”Ÿ	sentient beings, fully possessing the hardships of bodhisattvas in the three times, all sentient beings in the worlds of the ten directions
['ZH_T10_0294_003:0869b14_3_10']	ï¼Œç„¡æ˜ç¹«ç¸›ï¼Œä½ç™¡æœ‰çµï¼Œè©è–©å³ä»¥å¤§æ‚²ç¥é€šï¼Œ	ï¼Œç„¡æ˜ç¹«ç¸›ï¼Œä½ç™¡æœ‰çµï¼Œè©è–©å³ä»¥å¤§æ‚²ç¥é€šï¼Œ	, bound by ignorance, dwelling in the bonds of delusion and existence, bodhisattvas then with great compassion and spiritual powers,
['ZH_T10_0294_003:0869b14_3_11']	è§£å…¶ç¹«ç¸›ã€‚	è§£å…¶ç¹«ç¸›ã€‚	untie their bonds.
['ZH_T10_0294_003:0869b19_19']	åˆæ–¼ä¸€åˆ‡æ¯›å­”ï¼Œå‡ºç”Ÿä¸€åˆ‡çœ¾ç”Ÿæ•¸ç­‰è©è–©è‡ªåœ¨éš¨æ‡‰è®ŠåŒ–èº«é›²ï¼Œä»¥æ­¤èº«é›²å……æ»¿ä¸€åˆ‡è™›ç©ºæ³•ç•Œï¼Œæ–¼çœ¾ç”Ÿå‰ï¼Œç¤ºç¾è‰²èº«æ­£å—ä¸å‹•ï¼Œæ–¼çœ¾ç”Ÿå‰ï¼Œä¸‰æ˜§ç¥é€šè¦ºæ‚Ÿçœ¾ç”Ÿï¼Œä¸æ¨‚ä¸–é–“ï¼Œé é›¢ä¸‰ç•Œï¼Œæ»…é™¤ç”Ÿæ­»ï¼Œå¦‚é¿ç«å‘ï¼Œè€Œæ–¼ä¸€åˆ‡ï¼Œç¤ºç¾ç”Ÿæ­»ï¼Œç¾å¤©äººä¸­ç¨®ç¨®å¿«æ¨‚åŠæˆæ•—ç›¸ã€‚	åˆæ–¼ä¸€åˆ‡æ¯›å­”ï¼Œå‡ºç”Ÿä¸€åˆ‡çœ¾ç”Ÿæ•¸ç­‰è©è–©è‡ªåœ¨éš¨æ‡‰è®ŠåŒ–èº«é›²ï¼Œä»¥æ­¤èº«é›²å……æ»¿ä¸€åˆ‡è™›ç©ºæ³•ç•Œï¼Œæ–¼çœ¾ç”Ÿå‰ï¼Œç¤ºç¾è‰²èº«æ­£å—ä¸å‹•ï¼Œæ–¼çœ¾ç”Ÿå‰ï¼Œä¸‰æ˜§ç¥é€šè¦ºæ‚Ÿçœ¾ç”Ÿï¼Œä¸æ¨‚ä¸–é–“ï¼Œé é›¢ä¸‰ç•Œï¼Œæ»…é™¤ç”Ÿæ­»ï¼Œå¦‚é¿ç«å‘ï¼Œè€Œæ–¼ä¸€åˆ‡ï¼Œç¤ºç¾ç”Ÿæ­»ï¼Œç¾å¤©äººä¸­ç¨®ç¨®å¿«æ¨‚åŠæˆæ•—ç›¸ã€‚	Furthermore, from all pores, they manifested clouds of bodies that were equal in number to all sentient beings, manifesting transformations according to their faculties. With these clouds of bodies, they filled all space and the dharma realm, manifesting forms in front of sentient beings, correctly receiving and abiding in the samÄdhi of the TathÄgata's majestic lion's roar, and using the supernormal knowledge of samÄdhi to awaken sentient beings, causing them to take no pleasure in the world, to distance themselves from the three realms, to eliminate birth and death as if avoiding a pit of fire, and to manifest birth and death in all realms, manifesting various pleasures in the heavens and among humans as well as the signs of their completion and destruction.
['ZH_T10_0294_003:0869b21_3']	ç‚ºè«¸çœ¾ç”Ÿï¼Œèªªä¸æ·¨è§€ï¼Œä»¤è«¸çœ¾ç”Ÿï¼Œçš†æ‚‰ä¿®è¡Œï¼Œé™¤é¡›å€’æƒ³ã€‚	ç‚ºè«¸çœ¾ç”Ÿï¼Œèªªä¸æ·¨è§€ï¼Œä»¤è«¸çœ¾ç”Ÿï¼Œçš†æ‚‰ä¿®è¡Œï¼Œé™¤é¡›å€’æƒ³ã€‚	For the sake of sentient beings, they spoke of the contemplation of impurity, causing all sentient beings to cultivate it and eliminate inverted thoughts.
['ZH_T10_0294_003:0869b22_11']	ç‚ºè«¸çœ¾ç”Ÿï¼Œèªªæ–¼è®Šæ˜“è‹¦æƒ±ä¹‹æ³•ï¼Œä¸€åˆ‡å—èº«æœ‰ç‚ºä¹‹æ³•ï¼Œçš†æ‚‰ç„¡å¸¸ã€‚	ç‚ºè«¸çœ¾ç”Ÿï¼Œèªªæ–¼è®Šæ˜“è‹¦æƒ±ä¹‹æ³•ï¼Œä¸€åˆ‡å—èº«æœ‰ç‚ºä¹‹æ³•ï¼Œçš†æ‚‰ç„¡å¸¸ã€‚	For the sake of sentient beings, they spoke of the impermanent nature of all conditioned phenomena that undergo change and suffering, and of the fact that all bodies are subject to impermanence.
['ZH_T10_0294_003:0869b24_16']	é¡˜è«¸çœ¾ç”Ÿï¼Œæ·±å…¥ä½›å¢ƒç•Œï¼Œæ°¸é›¢ç„¡å¸¸ï¼Œä½ä¸å¯æ€è­°å°¸æ³¢ç¾…èœœï¼Œæ’å—è«¸ä½›æ¸…æ·¨ç¦æˆ’ï¼Œçµ‚ä¸æ¯€çŠ¯ï¼Œå¿ƒç„¡ç–‘æƒ‘ã€‚	é¡˜è«¸çœ¾ç”Ÿï¼Œæ·±å…¥ä½›å¢ƒç•Œï¼Œæ°¸é›¢ç„¡å¸¸ï¼Œä½ä¸å¯æ€è­°å°¸æ³¢ç¾…èœœï¼Œæ’å—è«¸ä½›æ¸…æ·¨ç¦æˆ’ï¼Œçµ‚ä¸æ¯€çŠ¯ï¼Œå¿ƒç„¡ç–‘æƒ‘ã€‚	May all sentient beings deeply enter the Buddha's realm, forever leave impermanence, abide in the inconceivable perfection of morality, always receive the pure precepts of the Buddhas, never violate them, and have no doubts in their minds.
['ZH_T10_0294_003:0869b25_14']	ç¤ºè«¸çœ¾ç”Ÿå…·è¶³ç¦æˆ’ï¼Œä»¥æˆ’é¦™ç†ä¸€åˆ‡çœ¾ç”Ÿã€‚	ç¤ºè«¸çœ¾ç”Ÿå…·è¶³ç¦æˆ’ï¼Œä»¥æˆ’é¦™ç†ä¸€åˆ‡çœ¾ç”Ÿã€‚	Show all sentient beings the complete precepts, and with the fragrance of precepts, pervade all sentient beings.
['ZH_T10_0294_003:0869c01_1']	åˆæ–¼æ¯›å­”ï¼Œå‡ºç”Ÿä¸€åˆ‡å¦™è‰²èº«é›²ï¼Œå‰²æˆªæ‰‹è¶³åŠè«¸æ”¯é«”ï¼Œæ¶æ‰“é€¼åˆ‡ï¼Œå‘µè²¬æƒ¡ç½µï¼Œå¦„è¨€èª¹è¬—ï¼Œçš†æ‚‰å¿å—ï¼Œæ–¼å½¼çœ¾ç”Ÿï¼Œä¸ç”Ÿç‹å¿ƒï¼Œä¸èµ·å®³æ„ï¼Œè®šæ­æƒ¡äººï¼Œçµ‚ä¸æ¯€çŠ¯ï¼Œèº«å¿ƒæ­æ•¬ï¼Œæ·±ç”Ÿæ©æ„›ï¼ŒçŒ¶å¦‚çˆ¶æ¯ï¼Œæ…ˆå¿µä¸€å­ã€‚	åˆæ–¼æ¯›å­”ï¼Œå‡ºç”Ÿä¸€åˆ‡å¦™è‰²èº«é›²ï¼Œå‰²æˆªæ‰‹è¶³åŠè«¸æ”¯é«”ï¼Œæ¶æ‰“é€¼åˆ‡ï¼Œå‘µè²¬æƒ¡ç½µï¼Œå¦„è¨€èª¹è¬—ï¼Œçš†æ‚‰å¿å—ï¼Œæ–¼å½¼çœ¾ç”Ÿï¼Œä¸ç”Ÿç‹å¿ƒï¼Œä¸èµ·å®³æ„ï¼Œè®šæ­æƒ¡äººï¼Œçµ‚ä¸æ¯€çŠ¯ï¼Œèº«å¿ƒæ­æ•¬ï¼Œæ·±ç”Ÿæ©æ„›ï¼ŒçŒ¶å¦‚çˆ¶æ¯ï¼Œæ…ˆå¿µä¸€å­ã€‚	Moreover, from the pores, clouds of various wonderful forms and bodies emerge. If someone cuts off their hands, feet, and other limbs, beats them, torments them, scolds them, slanders them with false words, they all endure it, and do not give rise to an angry mind or harmful thoughts towards those sentient beings. They praise evil people and never violate [the precepts]. With body and mind, they respectfully give rise to deep affection, just like parents lovingly thinking of their only child.
['ZH_T10_0294_003:0869c05_10']	é›–ä½œæ­¤è¡Œï¼Œä¸ç”Ÿæ†æ…¢è²¢é«˜ä¹‹å¿ƒï¼Œé¡¯ç¾è«¸æ³•çœŸå¦‚æ³•å¿ï¼Œå–„èƒ½å’Œåˆä¸€åˆ‡ä¸–ç•Œè«¸æƒ¡çœ¾ç”Ÿï¼Œæ·±çŸ¥ç›¡ç„¡ç›¡æ€§è™›ç©ºæ™ºæ…§ï¼Œè¡Œè©è–©å¿ï¼Œä»¥ä½›å¿ƒæ™ºï¼Œæ–·ä¸€åˆ‡ç…©æƒ±ï¼Œæ»…ä¸€åˆ‡çµç¿’ï¼Œæ‚‰èƒ½è·è² ä¸€åˆ‡ä¸–é–“é†œæƒ¡çœ¾ç”Ÿï¼Œå¦‚è­·çœ¼ç›®ï¼›	é›–ä½œæ­¤è¡Œï¼Œä¸ç”Ÿæ†æ…¢è²¢é«˜ä¹‹å¿ƒï¼Œé¡¯ç¾è«¸æ³•çœŸå¦‚æ³•å¿ï¼Œå–„èƒ½å’Œåˆä¸€åˆ‡ä¸–ç•Œè«¸æƒ¡çœ¾ç”Ÿï¼Œæ·±çŸ¥ç›¡ç„¡ç›¡æ€§è™›ç©ºæ™ºæ…§ï¼Œè¡Œè©è–©å¿ï¼Œä»¥ä½›å¿ƒæ™ºï¼Œæ–·ä¸€åˆ‡ç…©æƒ±ï¼Œæ»…ä¸€åˆ‡çµç¿’ï¼Œæ‚‰èƒ½è·è² ä¸€åˆ‡ä¸–é–“é†œæƒ¡çœ¾ç”Ÿï¼Œå¦‚è­·çœ¼ç›®ï¼›	Although engaging in these practices, they do not give rise to a mind of arrogance or self-importance, manifesting the forbearance of the suchness of all dharmas, skillfully reconciling all evil beings in the worlds, deeply understanding the wisdom of the nature of exhaustion and inexhaustibility, practicing the forbearance of bodhisattvas, with the wisdom of the Buddha's mind, severing all afflictions, extinguishing all habitual tendencies, able to bear all ugly and evil beings in the world, protecting them as if their own eyes;
['ZH_T10_0294_003:0869c06_10']	é¡˜ä¸€åˆ‡çœ¾ç”Ÿï¼Œæˆå°±è«¸ä½›é‡‘å‰›å¿å¾·ï¼Œæ·¨ç„¡ç‘•ç©¢ã€‚	é¡˜ä¸€åˆ‡çœ¾ç”Ÿï¼Œæˆå°±è«¸ä½›é‡‘å‰›å¿å¾·ï¼Œæ·¨ç„¡ç‘•ç©¢ã€‚	vowing that all beings will accomplish the vajra forbearance virtues of the buddhas, pure without flaw.
['ZH_T10_0294_003:0869c07_18']	åˆæ–¼ä¸€ä¸€æ¯›å­”ï¼Œé¡¯ç¾å¦‚ä¾†æ¸…æ·¨è‰²èº«ï¼Œéš¨æ‰€æ‡‰åº¦çœ¾ç”Ÿï¼Œçš†ä»¤å¾—è¦‹ã€‚	åˆæ–¼ä¸€ä¸€æ¯›å­”ï¼Œé¡¯ç¾å¦‚ä¾†æ¸…æ·¨è‰²èº«ï¼Œéš¨æ‰€æ‡‰åº¦çœ¾ç”Ÿï¼Œçš†ä»¤å¾—è¦‹ã€‚	Moreover, in each and every pore, manifesting the pure form body of the TathÄgata, causing all beings to be able to see according to their level of liberation.
['ZH_T10_0294_003:0869c10_7']	åˆæ–¼ä¸€ä¸€æ¯›å­”ï¼Œå‡ºç”Ÿä¸€åˆ‡è«¸è¶£ç¨®ç¨®è‰²èº«ï¼Œç¤ºç¾å‹‡çŒ›ç²¾é€²ï¼Œä»¤çœ¾ç”Ÿä¿®è¡Œï¼Œå¦‚æ•‘é ­ç„¶ï¼Œé™ä¼è«¸é­”æ€¨ï¼Œå¾—å‹ä¸é€€è½‰ã€‚	åˆæ–¼ä¸€ä¸€æ¯›å­”ï¼Œå‡ºç”Ÿä¸€åˆ‡è«¸è¶£ç¨®ç¨®è‰²èº«ï¼Œç¤ºç¾å‹‡çŒ›ç²¾é€²ï¼Œä»¤çœ¾ç”Ÿä¿®è¡Œï¼Œå¦‚æ•‘é ­ç„¶ï¼Œé™ä¼è«¸é­”æ€¨ï¼Œå¾—å‹ä¸é€€è½‰ã€‚	Moreover, in each and every pore, manifesting all kinds of form bodies of various destinies, demonstrating courageous and vigorous effort, causing beings to practice as if saving their own heads from burning, subduing the mÄras and adversaries, attaining victory without turning back.
