segmentnr	original	analyzed	translated
['ZH_T17_0721_035:0206a08_10']	æ­¤çœ¾ç”Ÿå–„å¿ƒä¿®ç¦ï¼Œä¸è«‚ä¸å¹»ï¼Œè§€æ–¼æ­£æ³•ï¼Œä»¥æ­£è¦‹å¿ƒåˆ©ç›Šä¸€åˆ‡çœ¾ç”Ÿï¼Œä¿¡ä½›æ³•åƒ§ã€‚	æ­¤çœ¾ç”Ÿå–„å¿ƒä¿®ç¦ï¼Œä¸è«‚ä¸å¹»ï¼Œè§€æ–¼æ­£æ³•ï¼Œä»¥æ­£è¦‹å¿ƒåˆ©ç›Šä¸€åˆ‡çœ¾ç”Ÿï¼Œä¿¡ä½›æ³•åƒ§ã€‚	These sentient beings cultivate merit with a wholesome mind, without flattery or deception, observe the true Dharma, and benefit all sentient beings with a mind of right view, believing in the Buddha, Dharma, and Saá¹ƒgha.
['ZH_T17_0721_035:0206a08_20']	å…¶å¿ƒæŸ”è»Ÿï¼Œä¿®è¡Œç¦æ¥­ã€‚	å…¶å¿ƒæŸ”è»Ÿï¼Œä¿®è¡Œç¦æ¥­ã€‚	Their minds are gentle, and they practice meritorious deeds.
['ZH_T17_0721_035:0206a09_17']	è‹¥æ–¼åƒ§å¯ºæˆ–è¦‹ä½›å¡”æœ‰ç ´å£è€…ï¼Œç‚ºä¹‹ä¿®æ²»ã€‚	è‹¥æ–¼åƒ§å¯ºæˆ–è¦‹ä½›å¡”æœ‰ç ´å£è€…ï¼Œç‚ºä¹‹ä¿®æ²»ã€‚	If they see a temple or a Buddha stÅ«pa that is damaged, they repair it.
['ZH_T17_0721_035:0206a10_17']	æˆ–æ™‚å¡”å¯ºç‚ºç«æ‰€ç‡’ï¼Œç«­åŠ›æ•‘è­·ï¼Œä¸æƒœèº«å‘½ã€‚	æˆ–æ™‚å¡”å¯ºç‚ºç«æ‰€ç‡’ï¼Œç«­åŠ›æ•‘è­·ï¼Œä¸æƒœèº«å‘½ã€‚	If a stÅ«pa or temple is on fire, they exhaust their strength to save it, not sparing their own lives.
['ZH_T17_0721_035:0206a11_17']	æˆ–è¦‹å¤§ç«ç„šç‡’ä½›æ³•çœ¾åƒ§çå¯¶è²¡ç‰©ï¼Œå–ªèº«æ•‘ä¹‹ã€‚	æˆ–è¦‹å¤§ç«ç„šç‡’ä½›æ³•çœ¾åƒ§çå¯¶è²¡ç‰©ï¼Œå–ªèº«æ•‘ä¹‹ã€‚	If they see a great fire burning the precious treasures, wealth, and goods of the Buddha, Dharma, and Saá¹ƒgha, they risk their lives to save it.
['ZH_T17_0721_035:0206a12_12']	æˆ–è¦‹æœ‰äººç‚ºç«æ‰€ç‡’ï¼Œå…¥ç«æ•‘ä¹‹ã€‚	æˆ–è¦‹æœ‰äººç‚ºç«æ‰€ç‡’ï¼Œå…¥ç«æ•‘ä¹‹ã€‚	If they see someone being burned by fire, they enter the fire to save them.
['ZH_T17_0721_035:0206a13_6']	ä»¥æ‚²å¿ƒæ•…ï¼Œèƒ½ä½œå¦‚æ˜¯é›£ç‚ºç¦å¾·ã€‚	ä»¥æ‚²å¿ƒæ•…ï¼Œèƒ½ä½œå¦‚æ˜¯é›£ç‚ºç¦å¾·ã€‚	Out of a compassionate mind, they are able to perform such difficult meritorious deeds.
['ZH_T17_0721_035:0206a13_15']	äº‘ä½•ä¸æ®ºåŠä¸å·ç›œï¼Ÿ	äº‘ä½•ä¸æ®ºåŠä¸å·ç›œï¼Ÿ	How do they refrain from killing and stealing?
['ZH_T17_0721_035:0206a14_20']	è‹¥è¦‹é“é‚Šéºè½ä¹‹ç‰©â€”â€”è‹¥é‡‘è‹¥éŠ€åŠé¤˜è²¡å¯¶ï¼Œå–å·²å”±ä»¤ï¼š	è‹¥è¦‹é“é‚Šéºè½ä¹‹ç‰©â€”â€”è‹¥é‡‘è‹¥éŠ€åŠé¤˜è²¡å¯¶ï¼Œå–å·²å”±ä»¤ï¼š	If they see something lost on the side of the roadâ€”whether gold, silver, or other valuablesâ€”they pick it up and announce:
['ZH_T17_0721_035:0206a15_5']	ã€æ­¤æ˜¯èª°ç‰©ï¼Ÿ	ã€æ­¤æ˜¯èª°ç‰©ï¼Ÿ	Whose belongings are these?
['ZH_T17_0721_035:0206a16_3']	ã€è‹¥æœ‰äººè¨€æ­¤æ˜¯æˆ‘ç‰©ï¼Œç•¶å•å…¶ç›¸ï¼Œå¯¦è€…ç•¶é‚„ã€‚	ã€è‹¥æœ‰äººè¨€æ­¤æ˜¯æˆ‘ç‰©ï¼Œç•¶å•å…¶ç›¸ï¼Œå¯¦è€…ç•¶é‚„ã€‚	If someone claims, These are my belongings, they should ask about the details. If it is true, they should return it.
['ZH_T17_0721_035:0206a17_16']	è‹¥ç„¡äººèªï¼Œä¸ƒæ—¥æŒè¡Œï¼Œæ—¥æ—¥å”±ä¹‹ï¼Œè‹¥ç„¡ä¸»èªï¼Œä»¥æ­¤å¯¶ç‰©ä»˜ç‹å¤§è‡£ã€å·éƒ¡ä»¤é•·ã€‚	è‹¥ç„¡äººèªï¼Œä¸ƒæ—¥æŒè¡Œï¼Œæ—¥æ—¥å”±ä¹‹ï¼Œè‹¥ç„¡ä¸»èªï¼Œä»¥æ­¤å¯¶ç‰©ä»˜ç‹å¤§è‡£ã€å·éƒ¡ä»¤é•·ã€‚	If no one claims it, keep it for seven days, proclaiming it daily. If no owner claims it, give this treasure to the king, ministers, state and county officials.
['ZH_T17_0721_035:0206a19_4']	è‹¥ç‹å¤§è‡£ã€å·éƒ¡ä»¤é•·è¦‹ç¦å¾·äººä¸å–æ­¤ç‰©ï¼Œå¾Œç•¶æŒèˆ‡ä½›æ³•çœ¾åƒ§ã€‚	è‹¥ç‹å¤§è‡£ã€å·éƒ¡ä»¤é•·è¦‹ç¦å¾·äººä¸å–æ­¤ç‰©ï¼Œå¾Œç•¶æŒèˆ‡ä½›æ³•çœ¾åƒ§ã€‚	If the king, ministers, state and county officials see a meritorious person not taking this object, they should later give it to the Buddha, Dharma and Sangha.
['ZH_T17_0721_035:0206a19_10']	æ˜¯åä¸å·ç›œã€‚	æ˜¯åä¸å·ç›œã€‚	This is called not stealing.
['ZH_T17_0721_035:0206a19_15']	äº‘ä½•ä¸æ®ºï¼Ÿ	äº‘ä½•ä¸æ®ºï¼Ÿ	What is meant by not killing?
['ZH_T17_0721_035:0206a21_3']	è‹¥è¡Œé“è·¯è¦‹è«¸è™«èŸ»èš“ã€è›¾è¦èŸ‡åŠé¤˜å°èŸ²ï¼Œæ¨é¿è«¸èŸ²ï¼Œè¡Œæ–¼é é“ã€‚	è‹¥è¡Œé“è·¯è¦‹è«¸è™«èŸ»èš“ã€è›¾è¦èŸ‡åŠé¤˜å°èŸ²ï¼Œæ¨é¿è«¸èŸ²ï¼Œè¡Œæ–¼é é“ã€‚	If walking on a road and seeing insects, ants, earthworms, moths, frogs and other small creatures, avoid them and walk on a distant path.
['ZH_T17_0721_035:0206a22_7']	ä»¥æ…ˆæ‚²å¿ƒè­·çœ¾ç”Ÿæ•…ï¼Œä¿¡æ¥­æœå ±ï¼ŒçŸ¥ç”Ÿæ­»éï¼Œè§€ç”Ÿæ»…æ³•ã€‚	ä»¥æ…ˆæ‚²å¿ƒè­·çœ¾ç”Ÿæ•…ï¼Œä¿¡æ¥­æœå ±ï¼ŒçŸ¥ç”Ÿæ­»éï¼Œè§€ç”Ÿæ»…æ³•ã€‚	With a compassionate mind, protect sentient beings, believe in the fruits of karma, know the faults of birth and death, and observe the dharma of arising and ceasing.
['ZH_T17_0721_035:0206a22_13']	æ˜¯åä¸æ®ºç”Ÿã€‚	æ˜¯åä¸æ®ºç”Ÿã€‚	This is called not killing.
['ZH_T17_0721_035:0206a24_1']	æ˜¯æŒæˆ’äººèº«å£å‘½çµ‚ç”Ÿæ–¼å–„é“ï¼Œä¸‰åä¸‰å¤©å¨å¾·ç„°è¼ªæ‰€ä½ä¹‹åœ°ã€‚	æ˜¯æŒæˆ’äººèº«å£å‘½çµ‚ç”Ÿæ–¼å–„é“ï¼Œä¸‰åä¸‰å¤©å¨å¾·ç„°è¼ªæ‰€ä½ä¹‹åœ°ã€‚	When the body of this person who upholds the precepts perishes and their life ends, they are born in a good realm, in the place where the wheel of majestic flames resides in the Heaven of the Thirty-three.
['ZH_T17_0721_035:0206a25_16']	ã€Œç”Ÿå½¼å¤©å·²ï¼Œç¬¬ä¸€å–„æ¥­ï¼Œå…¶å¨å¾·è¼ªå‘¨åŒèŠåš´ï¼Œè€Œå—å¿«æ¨‚ï¼Œä¸å¯å…·èªªï¼Œä»Šèªªå°‘åˆ†ã€‚	ã€Œç”Ÿå½¼å¤©å·²ï¼Œç¬¬ä¸€å–„æ¥­ï¼Œå…¶å¨å¾·è¼ªå‘¨åŒèŠåš´ï¼Œè€Œå—å¿«æ¨‚ï¼Œä¸å¯å…·èªªï¼Œä»Šèªªå°‘åˆ†ã€‚	Having been born in that heaven, the foremost good karma is that the wheel of majestic virtue surrounds and adorns it, and one experiences bliss that cannot be fully described. Now a small portion is explained.
['ZH_T17_0721_035:0206a27_1']	å…¶èº«å‘¨éå¨å¾·ç†¾å…‰å¦‚æ—¥ä¹‹ç…§ï¼Œè€Œä¸æ›œç›®ï¼Œä»¥å–„æ¥­æ•…ã€‚	å…¶èº«å‘¨éå¨å¾·ç†¾å…‰å¦‚æ—¥ä¹‹ç…§ï¼Œè€Œä¸æ›œç›®ï¼Œä»¥å–„æ¥­æ•…ã€‚	Their bodies are all-pervading, their majestic virtue and radiance shining like the sun, but not dazzling the eyes, due to their good karma.
['ZH_T17_0721_035:0206a28_15']	ç™¾åƒå¤©å¥³åœé¶å…¶äººè€Œå—å¿«æ¨‚ï¼Œé‡‘æ¯˜ç‰ç’ƒã€é’å› é™€å¯¶ä»¥ç‚ºå®®æ®¿ï¼ŒéŠæˆ²æ­Œèˆã€‚	ç™¾åƒå¤©å¥³åœé¶å…¶äººè€Œå—å¿«æ¨‚ï¼Œé‡‘æ¯˜ç‰ç’ƒã€é’å› é™€å¯¶ä»¥ç‚ºå®®æ®¿ï¼ŒéŠæˆ²æ­Œèˆã€‚	Hundreds of thousands of celestial maidens surround this person and experience bliss. Their palaces are made of gold, beryl, and sapphire, and they play, sing, and dance.
['ZH_T17_0721_035:0206b01_5']	å¾©æœ‰åœ’æ—ï¼ŒèŠ±å¸¸é–‹æ•·ï¼Œå¤šæœ‰çœ¾é³¥å‡ºå¦™éŸ³è²ï¼Œè¦‹è‰²èè²çš†å¯æ„›æ¨‚ã€‚	å¾©æœ‰åœ’æ—ï¼ŒèŠ±å¸¸é–‹æ•·ï¼Œå¤šæœ‰çœ¾é³¥å‡ºå¦™éŸ³è²ï¼Œè¦‹è‰²èè²çš†å¯æ„›æ¨‚ã€‚	There are also gardens and forests where flowers always bloom, and many birds sing melodious sounds. Seeing the colors and hearing the sounds are all delightful.
['ZH_T17_0721_035:0206b03_3']	å¾©æœ‰ä¸€æ—ï¼Œåæ›°é–‹åˆï¼Œè™•è™•è«¸æ—é–‹ç›®ã€é–‰ç›®å¸¸è¦‹å…‰æ˜ã€‚	å¾©æœ‰ä¸€æ—ï¼Œåæ›°é–‹åˆï¼Œè™•è™•è«¸æ—é–‹ç›®ã€é–‰ç›®å¸¸è¦‹å…‰æ˜ã€‚	There is also a forest called Opening and Closing, where in all the forests, whether one's eyes are open or closed, one always sees light.
['ZH_T17_0721_035:0206b04_2']	æ–¼æ­¤æ—ä¸­å…±è«¸å¤©å¥³éŠæˆ²å—æ¨‚ï¼Œç”Ÿå¸Œæœ‰å¿ƒã€‚	æ–¼æ­¤æ—ä¸­å…±è«¸å¤©å¥³éŠæˆ²å—æ¨‚ï¼Œç”Ÿå¸Œæœ‰å¿ƒã€‚	In this forest, one plays and experiences bliss with celestial maidens, giving rise to a sense of wonder.
['ZH_T17_0721_035:0206b05_8']	å¾©å¾€è©£æ–¼ç¥‡å¤šä¹‹æ—ï¼Œèˆ‡ç„¡é‡ç™¾åƒå¤©å¥³æ­ŒèˆéŸ³è²éŠæˆ²å±±å³¯ã€‚	å¾©å¾€è©£æ–¼ç¥‡å¤šä¹‹æ—ï¼Œèˆ‡ç„¡é‡ç™¾åƒå¤©å¥³æ­ŒèˆéŸ³è²éŠæˆ²å±±å³¯ã€‚	One then goes to the forest of Jita, where with countless hundreds of thousands of celestial maidens, one sings, dances, and plays on mountain peaks.
['ZH_T17_0721_035:0206b06_3']	ä»¥æ­ŒéŸ³æ•…ï¼Œå‡ºçœ¾éŸ¿è²çŒ¶å¦‚æ­ŒéŸ³ã€‚	ä»¥æ­ŒéŸ³æ•…ï¼Œå‡ºçœ¾éŸ¿è²çŒ¶å¦‚æ­ŒéŸ³ã€‚	Due to the singing, various sounds emerge, just like the sounds of singing.
['ZH_T17_0721_035:0206b07_12']	è‹¥æœ‰ç•°å¤©æ–¼è«¸æ—ä¸­éŠæˆ²å—æ¨‚ï¼Œèæ­¤æ­ŒéŸ³ï¼Œå³å‡ºå…¶æ—ï¼Œè‡ªç›¸è¬‚è¨€ï¼š	è‹¥æœ‰ç•°å¤©æ–¼è«¸æ—ä¸­éŠæˆ²å—æ¨‚ï¼Œèæ­¤æ­ŒéŸ³ï¼Œå³å‡ºå…¶æ—ï¼Œè‡ªç›¸è¬‚è¨€ï¼š	If there are other celestials who are playing and experiencing bliss in the forests, upon hearing this singing, they will leave the forest and say to each other:
['ZH_T17_0721_035:0206b07_18']	ã€æ˜¯ä½•ç­‰è²ï¼Ÿ	ã€æ˜¯ä½•ç­‰è²ï¼Ÿ	'What kind of sound is this?
['ZH_T17_0721_035:0206b08_5']	çŒ¶å¦‚ç¬¬äºŒé‡‹è¿¦å¤©ç‹ã€‚	çŒ¶å¦‚ç¬¬äºŒé‡‹è¿¦å¤©ç‹ã€‚	It is like a second Åšakra DevÄnÄm-Indra.'
['ZH_T17_0721_035:0206b09_13']	ã€å‡ºå·²å³è¦‹åˆç”Ÿå¤©å­ï¼Œå¤©çœ¾è¦‹ä¹‹ï¼Œç”Ÿæ­¡å–œå¿ƒå‡ºè¿å¤©å­ï¼Œç™¼å¸Œæœ‰å¿ƒã€‚	ã€å‡ºå·²å³è¦‹åˆç”Ÿå¤©å­ï¼Œå¤©çœ¾è¦‹ä¹‹ï¼Œç”Ÿæ­¡å–œå¿ƒå‡ºè¿å¤©å­ï¼Œç™¼å¸Œæœ‰å¿ƒã€‚	Having emerged, he immediately saw the newly born god. The heavenly beings saw him and joyfully welcomed the god, giving rise to a rare state of mind.
['ZH_T17_0721_035:0206b10_8']	æ—¢è¦‹å¤©å­ï¼Œçš†ç”Ÿæ­¡å–œï¼Œå‘½å¤©å­è¨€ï¼š	æ—¢è¦‹å¤©å­ï¼Œçš†ç”Ÿæ­¡å–œï¼Œå‘½å¤©å­è¨€ï¼š	Having seen the god, they all rejoiced and said to the god,
['ZH_T17_0721_035:0206b10_14']	ã€å–„ä¾†å¤©å­ï¼	ã€å–„ä¾†å¤©å­ï¼	'Welcome, god!
['ZH_T17_0721_035:0206b10_19']	æ±ä¾†æˆ‘æ‰€ã€‚	æ±ä¾†æˆ‘æ‰€ã€‚	Come to me.
['ZH_T17_0721_035:0206b11_6']	æ±æ–¼å¤©çœ¾æœ€ç‚ºæ®Šå‹ã€‚	æ±æ–¼å¤©çœ¾æœ€ç‚ºæ®Šå‹ã€‚	You are the most distinguished among the gods.
['ZH_T17_0721_035:0206b12_1']	æ–¼æ­¤å¤©ä¸­ï¼ŒçŒ¶å¦‚ç¬¬äºŒé‡‹è¿¦å¤©ç‹ã€‚	æ–¼æ­¤å¤©ä¸­ï¼ŒçŒ¶å¦‚ç¬¬äºŒé‡‹è¿¦å¤©ç‹ã€‚	In this heaven, you are like a second Åšakra DevÄnÄm-Indra.'
['ZH_T17_0721_035:0206b13_19']	ã€ã€Œçˆ¾æ™‚ï¼Œé¤˜å¤©çš†æ‚‰é€Ÿå¾€è‡³å¤©å­æ‰€ï¼Œåˆ°å·²åœé¶ã€‚	ã€ã€Œçˆ¾æ™‚ï¼Œé¤˜å¤©çš†æ‚‰é€Ÿå¾€è‡³å¤©å­æ‰€ï¼Œåˆ°å·²åœé¶ã€‚	At that time, the other gods all quickly went to where the god was, and upon arrival, surrounded him.
['ZH_T17_0721_035:0206b15_10']	æ™‚è«¸å¤©å­æ­Œèˆæˆ²ç¬‘ï¼Œå¿ƒç”Ÿæ­¡å–œåœé¶å¤©å­ï¼Œçš†å…±å¾€è©£æ­¡å–œåœ’æ—éŠæˆ²å—æ¨‚ã€‚	æ™‚è«¸å¤©å­æ­Œèˆæˆ²ç¬‘ï¼Œå¿ƒç”Ÿæ­¡å–œåœé¶å¤©å­ï¼Œçš†å…±å¾€è©£æ­¡å–œåœ’æ—éŠæˆ²å—æ¨‚ã€‚	At that time, the gods sang, danced, played, and laughed, their minds filled with joy as they surrounded the god and all went together to the Joyful Garden Grove to play and enjoy themselves.
['ZH_T17_0721_035:0206b17_14']	è«¸å¤©å¥³ç­‰åœé¶å¤©å­æ­ŒèˆéŠæˆ²ï¼Œçˆ¾æ™‚å¤©å­é ˆè‡¾è¿´é¡§ï¼Œè¦‹è«¸å¤©çœ¾çš†éš¨å…¶å¾Œï¼Œå¿ƒç”Ÿæ­¡å–œå•å¤©çœ¾è¨€ï¼š	è«¸å¤©å¥³ç­‰åœé¶å¤©å­æ­ŒèˆéŠæˆ²ï¼Œçˆ¾æ™‚å¤©å­é ˆè‡¾è¿´é¡§ï¼Œè¦‹è«¸å¤©çœ¾çš†éš¨å…¶å¾Œï¼Œå¿ƒç”Ÿæ­¡å–œå•å¤©çœ¾è¨€ï¼š	The goddesses surrounded the god, singing, dancing, and playing. At that time, the god glanced back for a moment and saw the gods all following behind him. With a joyful mind, he asked the gods,
['ZH_T17_0721_035:0206b18_1']	ã€æ¬²è‡³ä½•æ‰€ï¼Ÿ	ã€æ¬²è‡³ä½•æ‰€ï¼Ÿ	'Where do you wish to go?'
['ZH_T17_0721_035:0206b18_12']	ã€æ™‚è«¸å¤©çœ¾èªåˆç”Ÿå¤©å­ï¼š	ã€æ™‚è«¸å¤©çœ¾èªåˆç”Ÿå¤©å­ï¼š	At that time, the celestial assembly told the newly born celestial being:
['ZH_T17_0721_035:0206b19_15']	ã€ä»Šç•¶å¾€è©£æ­¡å–œåœ’æ—å¯æ„›ä¹‹è™•ï¼Œäº”æ¬²åŠŸå¾·å—æ–¼å‹æ¨‚ã€‚	ã€ä»Šç•¶å¾€è©£æ­¡å–œåœ’æ—å¯æ„›ä¹‹è™•ï¼Œäº”æ¬²åŠŸå¾·å—æ–¼å‹æ¨‚ã€‚	'Now we are going to the delightful garden grove called Joyful, where we will enjoy the supreme pleasures of the five desires.'
['ZH_T17_0721_035:0206b20_18', 'ZH_T17_0721_035:0206b22_12']	ã€çˆ¾æ™‚ï¼Œå¤©å­æœªæ›¾è¦‹æ­¤å¥‡ç‰¹åœ’æ—ï¼Œå¾è¡Œå¾€è©£æ­¡å–œåœ’æ—ã€‚ğŸ”½å…¶æ—æ™ƒæ›œå…‰æ˜æ™®ç…§çŒ¶å¦‚æ—¥è¼ªï¼Œåˆç”Ÿå¤©å­è¦‹æ­¤åœ’æ—ï¼Œå¾©ç”Ÿæ­¡å–œå…¥æ­¤æ—ä¸­ã€‚	ã€çˆ¾æ™‚ï¼Œå¤©å­æœªæ›¾è¦‹æ­¤å¥‡ç‰¹åœ’æ—ï¼Œå¾è¡Œå¾€è©£æ­¡å–œåœ’æ—ã€‚ å…¶æ—æ™ƒæ›œå…‰æ˜æ™®ç…§çŒ¶å¦‚æ—¥è¼ªï¼Œåˆç”Ÿå¤©å­è¦‹æ­¤åœ’æ—ï¼Œå¾©ç”Ÿæ­¡å–œå…¥æ­¤æ—ä¸­ã€‚	At that time, the newly born celestial being, who had never seen such a wondrous garden grove before, slowly proceeded to the Joyful garden grove.
['ZH_T17_0721_035:0206b23_8']	è¦‹æ­¤æ—æ¨¹æœ‰ç„¡é‡ç¨®ï¼Œç”šå¯æ„›æ¨‚ã€‚	è¦‹æ­¤æ—æ¨¹æœ‰ç„¡é‡ç¨®ï¼Œç”šå¯æ„›æ¨‚ã€‚	The grove was radiant and illuminated everywhere, just like the sun. The newly born celestial being saw this garden grove and felt even more joy. He entered the grove and saw that the trees were of innumerable kinds, extremely delightful.
['ZH_T17_0721_035:0206b25_2']	ä¸€æ—ä¹‹ä¸­å…·å››å¨å¾·ï¼Œç„¡é‡ç™¾åƒçœ¾é³¥éŸ³è²ï¼Œæˆ–æœ‰å‡ºæ–¼å¾®å¦™éŸ³è²ï¼Œæˆ–æœ‰å‘½è¨€ï¼š	ä¸€æ—ä¹‹ä¸­å…·å››å¨å¾·ï¼Œç„¡é‡ç™¾åƒçœ¾é³¥éŸ³è²ï¼Œæˆ–æœ‰å‡ºæ–¼å¾®å¦™éŸ³è²ï¼Œæˆ–æœ‰å‘½è¨€ï¼š	In one grove, the four powers were complete. There were the sounds of innumerable hundreds of thousands of birds, some emitting subtle sounds, and some saying:
['ZH_T17_0721_035:0206b25_8']	ã€å–„ä¾†å¤©å­ï¼	ã€å–„ä¾†å¤©å­ï¼	'Welcome, celestial being!'
['ZH_T17_0721_035:0206b26_5']	ã€æˆ–æœ‰åœé¶æ­¡å–œè¸Šèºï¼Œå¦‚æ˜¯å¤©é³¥èŠåš´åœ’æ—ã€‚	ã€æˆ–æœ‰åœé¶æ­¡å–œè¸Šèºï¼Œå¦‚æ˜¯å¤©é³¥èŠåš´åœ’æ—ã€‚	Some surrounded him, joyfully leaping and dancing. In this way, the celestial birds adorned the garden grove.
['ZH_T17_0721_035:0206b27_10']	å¾©æœ‰ç•°è™•ï¼Œæ–¼å±±è°·ä¸­ï¼Œæ²³æ°´ä¹‹è²å‡ºçœ¾å¦™éŸ³ï¼ŒçœŸé‡‘ç‚ºå²¸ã€‚	å¾©æœ‰ç•°è™•ï¼Œæ–¼å±±è°·ä¸­ï¼Œæ²³æ°´ä¹‹è²å‡ºçœ¾å¦™éŸ³ï¼ŒçœŸé‡‘ç‚ºå²¸ã€‚	In another place, in the mountain valleys, the sounds of the river waters emitted wondrous sounds, with banks made of genuine gold.
['ZH_T17_0721_035:0206b28_9']	æ–¼å…¶æ°´ä¸­å¤šæœ‰ç¨®ç¨®éµé´¨çœ¾é³¥å‡ºå¦™éŸ³è²ã€‚	æ–¼å…¶æ°´ä¸­å¤šæœ‰ç¨®ç¨®éµé´¨çœ¾é³¥å‡ºå¦™éŸ³è²ã€‚	In the water there are various geese and ducks making beautiful sounds.
['ZH_T17_0721_035:0206c01_1']	æ—¢è¦‹æ­¤æ²³ï¼Œèˆ‡ç„¡é‡å¤©å¥³åœ¨æ–¼æ²³å²¸éŠæˆ²å—æ¨‚ï¼Œäº”æ¨‚éŸ³è²æ­¡å¨›å—æ¨‚ã€‚	æ—¢è¦‹æ­¤æ²³ï¼Œèˆ‡ç„¡é‡å¤©å¥³åœ¨æ–¼æ²³å²¸éŠæˆ²å—æ¨‚ï¼Œäº”æ¨‚éŸ³è²æ­¡å¨›å—æ¨‚ã€‚	Having seen this river, he will play and enjoy pleasures with countless celestial maidens on the riverbank, with the sounds of the five types of music, and experience the pleasures of joy.
['ZH_T17_0721_035:0206c02_10']	æ—¢å—æ¨‚å·²ï¼Œå¾©å¾€è©£æ–¼å¦‚æ„æ¨¹æ—ï¼Œè¦‹å¦‚æ˜¯æ¨¹å…‰æ˜å¦‚æœˆï¼Œæˆ–è¦‹å¦‚æ—¥ã€‚	æ—¢å—æ¨‚å·²ï¼Œå¾©å¾€è©£æ–¼å¦‚æ„æ¨¹æ—ï¼Œè¦‹å¦‚æ˜¯æ¨¹å…‰æ˜å¦‚æœˆï¼Œæˆ–è¦‹å¦‚æ—¥ã€‚	Having experienced pleasure, he will then go to the forest of wish-fulfilling trees. He will see that the light of these trees is like the moon or like the sun.
['ZH_T17_0721_035:0206c03_10']	æ–°ç”Ÿå¤©å­æ–¼æ­¤æ¨¹ä¸‹å—äº”æ¬²æ¨‚ï¼Œä¸å¯å…·èªªã€‚	æ–°ç”Ÿå¤©å­æ–¼æ­¤æ¨¹ä¸‹å—äº”æ¬²æ¨‚ï¼Œä¸å¯å…·èªªã€‚	The newly born celestial being will experience the pleasures of the five desires under these trees, which cannot be fully described.
['ZH_T17_0721_035:0206c04_6']	æ—¢å—å¦‚æ˜¯ç„¡é‡æ¨‚å·²ï¼Œå‘è“®èŠ±æ± ã€‚	æ—¢å—å¦‚æ˜¯ç„¡é‡æ¨‚å·²ï¼Œå‘è“®èŠ±æ± ã€‚	Having experienced such immeasurable pleasure, he will then go to the lotus pond.
['ZH_T17_0721_035:0206c05_4']	è‡³è“®èŠ±æ± ï¼Œå¤©çœ¾åœé¶å¦‚å¥‰å¸é‡‹ï¼Œçš†ç”Ÿæ­¡å–œã€‚	è‡³è“®èŠ±æ± ï¼Œå¤©çœ¾åœé¶å¦‚å¥‰å¸é‡‹ï¼Œçš†ç”Ÿæ­¡å–œã€‚	Having arrived at the lotus pond, surrounded by celestial beings as if venerating Åšakra, he will feel great joy.
['ZH_T17_0721_035:0206c07_2']	æ–¼è“®èŠ±æ± æ—¢å—æ¨‚å·²ï¼Œå¾©å¾€è©£æ–¼é«˜èšå±±é ‚æ­ŒèˆéŠæˆ²ï¼Œå¤©å­å¤©å¥³äº’ç›¸å¨›æ¨‚ï¼Œå—äº”æ¬²æ¨‚ã€‚	æ–¼è“®èŠ±æ± æ—¢å—æ¨‚å·²ï¼Œå¾©å¾€è©£æ–¼é«˜èšå±±é ‚æ­ŒèˆéŠæˆ²ï¼Œå¤©å­å¤©å¥³äº’ç›¸å¨›æ¨‚ï¼Œå—äº”æ¬²æ¨‚ã€‚	Having experienced pleasure at the lotus pond, he will then go to the peak of High Heap Mountain to sing, dance, and play. The celestial beings and celestial maidens will entertain each other and experience the pleasures of the five desires.
['ZH_T17_0721_035:0206c08_9']	è‡³é«˜èšé ‚ï¼Œè¦‹å±±é ‚ä¸Šæœ‰è“®èŠ±æ± ï¼Œç„¡é‡çœ¾é³¥å…±è«¸å¤©çœ¾å—ç¬¬ä¸€æ¨‚ã€‚	è‡³é«˜èšé ‚ï¼Œè¦‹å±±é ‚ä¸Šæœ‰è“®èŠ±æ± ï¼Œç„¡é‡çœ¾é³¥å…±è«¸å¤©çœ¾å—ç¬¬ä¸€æ¨‚ã€‚	Having arrived at the peak of High Heap, he will see that there is a lotus pond on the peak, and countless birds will experience the foremost pleasure together with the celestial beings.
['ZH_T17_0721_035:0206c09_1']	ä»¥å–„æ¥­æ•…ï¼Œç¬¬ä¸€å¨å¾·ã€‚	ä»¥å–„æ¥­æ•…ï¼Œç¬¬ä¸€å¨å¾·ã€‚	Because of good karma, they have the greatest authority.
['ZH_T17_0721_035:0206c10_1']	å…±è«¸å¤©çœ¾æ–¼åœ’æ—ä¸­ã€å¦‚æ„æ—ä¸­ã€ä¸Šå‘³æ—ä¸­ã€‚	å…±è«¸å¤©çœ¾æ–¼åœ’æ—ä¸­ã€å¦‚æ„æ—ä¸­ã€ä¸Šå‘³æ—ä¸­ã€‚	Together with the heavenly multitudes, in the gardens and forests, in the wish-fulfilling forest, and in the forest of superior flavors.
['ZH_T17_0721_035:0206c11_1']	å¤šæœ‰çœ¾é³¥èŠåš´å…¶æ—ï¼Œæ–¼æ­¤æ—ä¸­éŠæˆ²å—æ¨‚ã€‚	å¤šæœ‰çœ¾é³¥èŠåš´å…¶æ—ï¼Œæ–¼æ­¤æ—ä¸­éŠæˆ²å—æ¨‚ã€‚	There are many birds that adorn the forest. In this forest, they play and enjoy themselves.
['ZH_T17_0721_035:0206c13_5']	æ˜¯æ™‚å¤©å­æ–¼é«˜èšå³¯ï¼Œèˆ‡è«¸å¤©çœ¾ä¹…å—æ¨‚å·²ï¼Œå¾©è§€è‡ªåœ°æ–°ç”Ÿå¤©å­ï¼Œç”Ÿå¸Œæœ‰å¿ƒï¼Œç™¾åƒå¤©çœ¾çš†å…±åœé¶ã€‚	æ˜¯æ™‚å¤©å­æ–¼é«˜èšå³¯ï¼Œèˆ‡è«¸å¤©çœ¾ä¹…å—æ¨‚å·²ï¼Œå¾©è§€è‡ªåœ°æ–°ç”Ÿå¤©å­ï¼Œç”Ÿå¸Œæœ‰å¿ƒï¼Œç™¾åƒå¤©çœ¾çš†å…±åœé¶ã€‚	At that time, the heavenly son, on the high-heap peak, having long enjoyed pleasures with the heavenly multitudes, again observes the newly born heavenly sons, giving rise to a rare mind, surrounded by hundreds of thousands of heavenly multitudes.
['ZH_T17_0721_035:0206c14_1']	å¾©èˆ‡å¤©çœ¾è©£å–„æ³•å ‚ï¼Œè¦‹å¤©å¸é‡‹ã€‚	å¾©èˆ‡å¤©çœ¾è©£å–„æ³•å ‚ï¼Œè¦‹å¤©å¸é‡‹ã€‚	Again, together with the heavenly multitudes, he goes to the hall of good dharma to see Åšakra, lord of the devas.
['ZH_T17_0721_035:0206c15_12']	ã€Œçˆ¾æ™‚ï¼Œæ–°ç”Ÿå¤©å­è‡³å–„æ³•å ‚ã€‚	ã€Œçˆ¾æ™‚ï¼Œæ–°ç”Ÿå¤©å­è‡³å–„æ³•å ‚ã€‚	At that time, the newly born heavenly son arrives at the hall of good dharma.
['ZH_T17_0721_035:0206c16_15']	è¦‹å–„æ³•å ‚ç¨®ç¨®çœ¾å¯¶ä»¥ç‚ºèŠåš´ï¼Œçœ¾å¯¶æ¬„æ¥¯ï¼Œå¦‚å‰æ‰€èªªã€‚	è¦‹å–„æ³•å ‚ç¨®ç¨®çœ¾å¯¶ä»¥ç‚ºèŠåš´ï¼Œçœ¾å¯¶æ¬„æ¥¯ï¼Œå¦‚å‰æ‰€èªªã€‚	He sees that the hall of good dharma is adorned with various jewels, and the railings are as described before.
['ZH_T17_0721_035:0206c17_16']	çˆ¾æ™‚ï¼Œé‡‹è¿¦æå©†è¦‹æ­¤å¤©å­ï¼Œå¿ƒç”Ÿæ­¡å–œè€Œèªªé Œæ›°ï¼š	çˆ¾æ™‚ï¼Œé‡‹è¿¦æå©†è¦‹æ­¤å¤©å­ï¼Œå¿ƒç”Ÿæ­¡å–œè€Œèªªé Œæ›°ï¼š	At that time, Åšakra, lord of the devas, sees this heavenly son and, his mind filled with joy, speaks a verse, saying:
['ZH_T17_0721_035:0206c18_0']	ã€Œã€ä»¥å–„æ¥­æœå ±ï¼Œã€€ã€€ä»Šç”Ÿæ–¼æ­¤åœ°ï¼Œ	ã€Œã€ä»¥å–„æ¥­æœå ±ï¼Œã€€ã€€ä»Šç”Ÿæ–¼æ­¤åœ°ï¼Œ	By the fruits of good karma, you are now born in this realm.
