segmentnr	original	analyzed	folio	translated
['ZH_T23_1442_013:0693c08_15', 'ZH_T23_1442_013:0693c08_21']	ã€æˆ‘äº¦å ±è¨€ï¼šğŸ”½ã€éæœ‰éç„¡ã€‚	ã€æˆ‘äº¦å ±è¨€ï¼š ã€éæœ‰éç„¡ã€‚	013	' I would also answer:
['ZH_T23_1442_013:0693c09_2']	ã€è‹¥æœ‰å•æˆ‘ï¼š	ã€è‹¥æœ‰å•æˆ‘ï¼š	013	'It is neither that there is nor that there is not.' If someone asks me:
['ZH_T23_1442_013:0693c09_7']	ã€ç‚ºæ˜¯è€¶ï¼Ÿ	ã€ç‚ºæ˜¯è€¶ï¼Ÿ	013	'Is it so?
['ZH_T23_1442_013:0693c09_12']	ã€æˆ‘å ±è¨€ï¼š	ã€æˆ‘å ±è¨€ï¼š	013	' I would answer:
['ZH_T23_1442_013:0693c09_15']	ã€æ˜¯ã€‚	ã€æ˜¯ã€‚	013	Yes.
['ZH_T23_1442_013:0693c09_21']	ã€ã€ç‚ºéè€¶ï¼Ÿ	ã€ã€ç‚ºéè€¶ï¼Ÿ	013	Is it not?
['ZH_T23_1442_013:0693c09_26']	ã€æˆ‘å ±è¨€ï¼š	ã€æˆ‘å ±è¨€ï¼š	013	I replied:
['ZH_T23_1442_013:0693c09_29']	ã€éã€‚	ã€éã€‚	013	'No,ğŸ”½ğŸ”½
['ZH_T23_1442_013:0693c10_5']	ã€ã€ç‚ºæ˜¯éè€¶ï¼Ÿ	ã€ã€ç‚ºæ˜¯éè€¶ï¼Ÿ	013	Is it both?
['ZH_T23_1442_013:0693c10_10', 'ZH_T23_1442_013:0693c10_14']	ã€æˆ‘å ±è¨€ï¼šğŸ”½ã€æ˜¯éã€‚	ã€æˆ‘å ±è¨€ï¼š ã€æ˜¯éã€‚	013	I replied:ğŸ”½It is both.
['ZH_T23_1442_013:0693c10_21']	ã€ã€éæ˜¯éè€¶ï¼Ÿ	ã€ã€éæ˜¯éè€¶ï¼Ÿ	013	Is it neither?
['ZH_T23_1442_013:0693c10_26']	ã€æˆ‘å ±è¨€ï¼š	ã€æˆ‘å ±è¨€ï¼š	013	I replied:
['ZH_T23_1442_013:0693c11_4']	ã€éæ˜¯éã€‚	ã€éæ˜¯éã€‚	013	It is neither.
['ZH_T23_1442_013:0693c11_17']	ã€è‹¥å•å¾Œä¸–ä¸€ç•°ï¼Œäº¦å¦‚æ˜¯ç­”ã€‚	ã€è‹¥å•å¾Œä¸–ä¸€ç•°ï¼Œäº¦å¦‚æ˜¯ç­”ã€‚	013	If asked about the oneness or difference of the afterlife, I would answer in the same way.
['ZH_T23_1442_013:0693c12_8']	ã€æ™‚å¯¦åŠ›å­èæ˜¯èªå·²ä¾¿ä½œæ˜¯å¿µï¼š	ã€æ™‚å¯¦åŠ›å­èæ˜¯èªå·²ä¾¿ä½œæ˜¯å¿µï¼š	013	At that time, when Åšreá¹‡ika heard these words, he thought:
['ZH_T23_1442_013:0693c13_19']	ã€Œæ­¤ä¹‹å¤§å¸«èƒŒæ­£è·¯è¡Œé‚ªé“ï¼ŒçŒ¶å¦‚éšªé€”å¤šæœ‰æ€–ç•ï¼Œæ™ºè€…æ‰€æ£„ä¸æ‡‰ä¿®ç¿’ã€‚	ã€Œæ­¤ä¹‹å¤§å¸«èƒŒæ­£è·¯è¡Œé‚ªé“ï¼ŒçŒ¶å¦‚éšªé€”å¤šæœ‰æ€–ç•ï¼Œæ™ºè€…æ‰€æ£„ä¸æ‡‰ä¿®ç¿’ã€‚	013	This great teacher goes against the right path and practices the wrong way, like a dangerous road with many fears, abandoned by the wise and not to be practiced.
['ZH_T23_1442_013:0693c14_4']	ã€èªªä¼½ä»–æ›°ï¼š	ã€èªªä¼½ä»–æ›°ï¼š	013	He spoke a verse, saying:
['ZH_T23_1442_013:0693c15_14']	ã€Œæƒ¡æ…§èªªæƒ¡æ³•ï¼Œã€€ã€€å¯¦æ„šç¨±å¤§å¸«ï¼›	ã€Œæƒ¡æ…§èªªæƒ¡æ³•ï¼Œã€€ã€€å¯¦æ„šç¨±å¤§å¸«ï¼›	013	Evil wisdom speaks of evil dharmas, truly foolish ones are called great teachers;
['ZH_T23_1442_013:0693c16_13']	æ­¤æ³•å°‡ç‚ºæ˜¯ï¼Œã€€ã€€ä½•è€…åéæ³•ï¼Ÿ	æ­¤æ³•å°‡ç‚ºæ˜¯ï¼Œã€€ã€€ä½•è€…åéæ³•ï¼Ÿ	013	Will this dharma be right, or which one is called non-dharma?
['ZH_T23_1442_013:0693c17_18']	ã€å¦‚æ˜¯çŸ¥å·²ï¼Œå¦‚æ“Šç©ºå™¨ä½†æœ‰è™›è²ï¼Œæ£„ä¹‹è€Œå»ã€‚	ã€å¦‚æ˜¯çŸ¥å·²ï¼Œå¦‚æ“Šç©ºå™¨ä½†æœ‰è™›è²ï¼Œæ£„ä¹‹è€Œå»ã€‚	013	Knowing this, like striking an empty vessel with only empty sounds, he abandoned it and left.
['ZH_T23_1442_013:0693c19_2']	æ™‚å¯¦åŠ›å­å¾©æ›´å¾€è©£å°¼æµé™€æ…è‹¥ä½å­æ‰€ï¼Œè€Œç™½ä¹‹æ›°ï¼š	æ™‚å¯¦åŠ›å­å¾©æ›´å¾€è©£å°¼æµé™€æ…è‹¥ä½å­æ‰€ï¼Œè€Œç™½ä¹‹æ›°ï¼š	013	At that time, RÄhula went again to the place of Nyagrodha's son and said to him:
['ZH_T23_1442_013:0693c19_6']	ã€Œå¤§å¸«ï¼	ã€Œå¤§å¸«ï¼	013	Great teacher!
['ZH_T23_1442_013:0693c19_15']	ä½•è€…æ˜¯ä»æ‰€å®—æ³•ç†ï¼Ÿ	ä½•è€…æ˜¯ä»æ‰€å®—æ³•ç†ï¼Ÿ	013	What is the principle of the Dharma that you uphold?
['ZH_T23_1442_013:0693c20_4']	æ–¼è«¸å¼Ÿå­ä»¥ä½•æ•™èª¨ï¼Ÿ	æ–¼è«¸å¼Ÿå­ä»¥ä½•æ•™èª¨ï¼Ÿ	013	How do you instruct your disciples?
['ZH_T23_1442_013:0693c20_13']	å‹¤ä¿®æ¢µè¡Œç²å¾—ä½•æœï¼Ÿ	å‹¤ä¿®æ¢µè¡Œç²å¾—ä½•æœï¼Ÿ	013	What fruits do they attain by diligently practicing pure conduct?
['ZH_T23_1442_013:0693c20_19']	ã€å½¼å¸«ç­”æ›°ï¼š	ã€å½¼å¸«ç­”æ›°ï¼š	013	That teacher replied:
['ZH_T23_1442_013:0693c21_1']	ã€Œå¤ªå­ï¼	ã€Œå¤ªå­ï¼	013	Prince!
['ZH_T23_1442_013:0693c24_15']	æˆ‘ä¹‹æ‰€å®—ï¼Œä½œå¦‚æ˜¯è¦‹ã€ä½œå¦‚æ˜¯èªªï¼Œè‹¥è«¸äººç­‰è¦‹æœ‰æ‰€å—è‹¦æ¨‚ä¹‹äº‹ï¼Œçš†ç”±å…ˆä¸–æ‰€é€ æ¥­å› ï¼Œä»¥è‹¦è¡ŒåŠ›èƒ½é™¤å®¿æ¥­ä¸é€ æ–°æ¥­ï¼Œæ±ºç”Ÿæ­»å ¤è­‰ç„¡æ¼æ³•è«¸æ¥­ä¾¿ç›¡ï¼Œè«¸æ¥­ç›¡æ•…è«¸è‹¦äº¦ç›¡ã€‚	æˆ‘ä¹‹æ‰€å®—ï¼Œä½œå¦‚æ˜¯è¦‹ã€ä½œå¦‚æ˜¯èªªï¼Œè‹¥è«¸äººç­‰è¦‹æœ‰æ‰€å—è‹¦æ¨‚ä¹‹äº‹ï¼Œçš†ç”±å…ˆä¸–æ‰€é€ æ¥­å› ï¼Œä»¥è‹¦è¡ŒåŠ›èƒ½é™¤å®¿æ¥­ä¸é€ æ–°æ¥­ï¼Œæ±ºç”Ÿæ­»å ¤è­‰ç„¡æ¼æ³•è«¸æ¥­ä¾¿ç›¡ï¼Œè«¸æ¥­ç›¡æ•…è«¸è‹¦äº¦ç›¡ã€‚	013	I uphold this view and speak thus: If people experience suffering or happiness, it is all due to the causes of karma created in past lives. By the power of ascetic practices, one can eliminate past karma and not create new karma. One can then break through the embankment of birth and death, realize the undefiled Dharma, and all karma will be exhausted. Because karma is exhausted, suffering will also be exhausted.
['ZH_T23_1442_013:0693c25_9']	ã€æ™‚å¯¦åŠ›å­èæ˜¯èªå·²ä¾¿ä½œæ˜¯å¿µï¼š	ã€æ™‚å¯¦åŠ›å­èæ˜¯èªå·²ä¾¿ä½œæ˜¯å¿µï¼š	013	When RÄhula heard these words, he thought:
['ZH_T23_1442_013:0693c27_1']	ã€Œæ­¤ä¹‹å¤§å¸«èƒŒæ­£è·¯è¡Œé‚ªé“ï¼ŒçŒ¶å¦‚éšªé€”å¤šæœ‰æ€–ç•æ™ºè€…ï¼Œæ‰€æ£„ä¸æ‡‰ä¿®ç¿’ã€‚	ã€Œæ­¤ä¹‹å¤§å¸«èƒŒæ­£è·¯è¡Œé‚ªé“ï¼ŒçŒ¶å¦‚éšªé€”å¤šæœ‰æ€–ç•æ™ºè€…ï¼Œæ‰€æ£„ä¸æ‡‰ä¿®ç¿’ã€‚	013	This great teacher goes against the right path and practices the wrong way, like a dangerous road with many fears. The wise should abandon it and not cultivate it.
['ZH_T23_1442_013:0693c27_7']	ã€èªªä¼½ä»–æ›°ï¼š	ã€èªªä¼½ä»–æ›°ï¼š	013	He spoke a verse, saying:
['ZH_T23_1442_013:0693c28_14']	ã€Œæƒ¡æ…§èªªæƒ¡æ³•ï¼Œã€€ã€€å¯¦æ„šç¨±å¤§å¸«ï¼›	ã€Œæƒ¡æ…§èªªæƒ¡æ³•ï¼Œã€€ã€€å¯¦æ„šç¨±å¤§å¸«ï¼›	013	Evil wisdom speaks of evil dharmas, truly foolish, called great teachers;
['ZH_T23_1442_013:0693c29_13']	æ­¤æ³•å°‡ç‚ºæ˜¯ï¼Œã€€ã€€ä½•è€…åéæ³•ï¼Ÿ	æ­¤æ³•å°‡ç‚ºæ˜¯ï¼Œã€€ã€€ä½•è€…åéæ³•ï¼Ÿ	013	This dharma will be so, which is called non-dharma?
['ZH_T23_1442_013:0694a01_18']	ã€å¦‚æ˜¯çŸ¥å·²ï¼Œå¦‚æ“Šç©ºå™¨ä½†æœ‰è™›è²ï¼Œæ£„ä¹‹è€Œå»ã€‚	ã€å¦‚æ˜¯çŸ¥å·²ï¼Œå¦‚æ“Šç©ºå™¨ä½†æœ‰è™›è²ï¼Œæ£„ä¹‹è€Œå»ã€‚	013	Knowing this, like striking an empty vessel with only empty sound, he abandoned it and left.
['ZH_T23_1442_013:0694a02_16']	é‚„æ­¸æœ¬å®…æ˜‡é«˜æ¨“ä¸Šï¼Œä»¥æ‰‹æ”¯é °ä½œå¦‚æ˜¯å¿µï¼š	é‚„æ­¸æœ¬å®…æ˜‡é«˜æ¨“ä¸Šï¼Œä»¥æ‰‹æ”¯é °ä½œå¦‚æ˜¯å¿µï¼š	013	Returning to his own house, he ascended to the high tower, supporting his cheeks with his hands, thinking like this:
['ZH_T23_1442_013:0694a05_11']	ã€Œæ–¼æ­¤ä¸–é–“äººå¤©é­”æ¢µæ²™é–€å©†ç¾…é–€ï¼Œé —æœ‰ä¸€äººèƒ½æŒä¸€ã€äºŒã€ä¸‰å››å¥ç¥é©—å‘ªè¡“æ˜è—¥æ–¹æ³•ï¼Œæ–¼ç”Ÿæ­»ä¸­ç„¡æ˜ç‰¢ç„ä¸ç”¨å¤šåŠŸä»¤æˆ‘å‡ºé›¢ï¼Ÿ	ã€Œæ–¼æ­¤ä¸–é–“äººå¤©é­”æ¢µæ²™é–€å©†ç¾…é–€ï¼Œé —æœ‰ä¸€äººèƒ½æŒä¸€ã€äºŒã€ä¸‰å››å¥ç¥é©—å‘ªè¡“æ˜è—¥æ–¹æ³•ï¼Œæ–¼ç”Ÿæ­»ä¸­ç„¡æ˜ç‰¢ç„ä¸ç”¨å¤šåŠŸä»¤æˆ‘å‡ºé›¢ï¼Ÿ	013	In this world, among humans, gods, demons, BrahmÄ, Å›ramaá¹‡as, and brÄhmaá¹‡as, is there anyone who can uphold one, two, three, or four sentences of divine and effective spells, clear medicine methods, without using much effort to make me escape from the prison of ignorance in birth and death?
['ZH_T23_1442_013:0694a14_16_0']	ã€è«¸ä½›å¸¸æ³•è§€å¯Ÿä¸–é–“ï¼Œç„¡ä¸è¦‹èç„¡ä¸çŸ¥è€…ï¼Œæ’	ã€è«¸ä½›å¸¸æ³•è§€å¯Ÿä¸–é–“ï¼Œç„¡ä¸è¦‹èç„¡ä¸çŸ¥è€…ï¼Œæ’	013	The constant dharma of all buddhas is to observe the world, there is nothing unseen, unheard, or unknown, always
['ZH_T23_1442_013:0694a14_16_1']	èµ·å¤§æ‚²é¥’ç›Šä¸€åˆ‡ç‚ºå¤§è­·è€…ï¼Œé›„çŒ›ç¬¬ä¸€ç„¡æœ‰äºŒè¨€	èµ·å¤§æ‚²é¥’ç›Šä¸€åˆ‡ç‚ºå¤§è­·è€…ï¼Œé›„çŒ›ç¬¬ä¸€ç„¡æœ‰äºŒè¨€	013	arousing great compassion, benefiting all, being a great protector, being the most heroic, without a second word
['ZH_T23_1442_013:0694a14_16_2']	ï¼Œä¾å®šæ…§ä½ï¼Œé¡¯ç™¼ä¸‰æ˜ï¼Œå–„ä¿®ä¸‰å­¸ï¼Œå–„èª¿ä¸‰æ¥­	ï¼Œä¾å®šæ…§ä½ï¼Œé¡¯ç™¼ä¸‰æ˜ï¼Œå–„ä¿®ä¸‰å­¸ï¼Œå–„èª¿ä¸‰æ¥­	013	, abiding in concentration and wisdom, manifesting the three kinds of clear knowledge, skillfully cultivating the three trainings, skillfully controlling the three karmas
['ZH_T23_1442_013:0694a14_16_3']	ï¼Œæ¸¡å››ç€‘æµï¼Œå®‰å››ç¥è¶³ï¼Œæ–¼é•·å¤œä¸­ä¿®å››æ”è¡Œæ¨	ï¼Œæ¸¡å››ç€‘æµï¼Œå®‰å››ç¥è¶³ï¼Œæ–¼é•·å¤œä¸­ä¿®å››æ”è¡Œæ¨	013	Crossing the four torrents, peacefully abiding in the four bases of supernatural power, practicing the four means of conversion for a long time,
['ZH_T23_1442_013:0694a14_16_4']	é™¤äº”è“‹ï¼Œé é›¢äº”æ”¯è¶…è¶Šäº”é“ï¼Œå…­æ ¹å…·è¶³å…­åº¦åœ“	é™¤äº”è“‹ï¼Œé é›¢äº”æ”¯è¶…è¶Šäº”é“ï¼Œå…­æ ¹å…·è¶³å…­åº¦åœ“	013	Abandoning the five hindrances, distancing oneself from the five branches, transcending the five destinies, with the six faculties complete, the six perfections
['ZH_T23_1442_013:0694a14_16_5']	æ»¿ï¼Œä¸ƒè²¡æ™®æ–½é–‹ä¸ƒè¦ºèŠ±ï¼Œé›¢ä¸–å…«æ³•ç¤ºå…«æ­£è·¯ï¼Œ	æ»¿ï¼Œä¸ƒè²¡æ™®æ–½é–‹ä¸ƒè¦ºèŠ±ï¼Œé›¢ä¸–å…«æ³•ç¤ºå…«æ­£è·¯ï¼Œ	013	fully accomplished, universally bestowing the seven kinds of wealth, opening the flowers of the seven factors of enlightenment, free from the eight worldly dharmas, demonstrating the eightfold right path,
['ZH_T23_1442_013:0694a14_16_6']	æ°¸æ–·ä¹çµæ˜é–‘ä¹å®šï¼Œå……æ»¿ååŠ›åèåæ–¹ï¼Œåƒè‡ª	æ°¸æ–·ä¹çµæ˜é–‘ä¹å®šï¼Œå……æ»¿ååŠ›åèåæ–¹ï¼Œåƒè‡ª	013	Permanently severing the nine bonds, clearly understanding the nine concentrations, filling the ten powers, with fame reaching the ten directions, a thousand kinds of mastery
['ZH_T23_1442_013:0694a14_16_7']	åœ¨ä¸­æœ€ç‚ºæ®Šå‹ï¼Œå¾—å››ç„¡ç•éœ‡å¤§éŸ³è²ä½œå¸«å­å¼ï¼Œ	åœ¨ä¸­æœ€ç‚ºæ®Šå‹ï¼Œå¾—å››ç„¡ç•éœ‡å¤§éŸ³è²ä½œå¸«å­å¼ï¼Œ	013	supreme among the supreme, attaining the four forms of fearlessness, emitting a great sound like the roar of a lion,
['ZH_T23_1442_013:0694a14_16_8']	æ™å¤œå…­æ™‚å¸¸ä»¥ä½›çœ¼è§€è«¸ä¸–ç•Œï¼Œèª°å¢ã€èª°æï¼Ÿ	æ™å¤œå…­æ™‚å¸¸ä»¥ä½›çœ¼è§€è«¸ä¸–ç•Œï¼Œèª°å¢ã€èª°æï¼Ÿ	013	Six times a day, day and night, always observing the worlds with the Buddha-eye, who is increasing, who is decreasing,
['ZH_T23_1442_013:0694a15_5']	èª°é­é‡è‹¦å„é›£ä¹‹äº‹ï¼Ÿ	èª°é­é‡è‹¦å„é›£ä¹‹äº‹ï¼Ÿ	013	Who is suffering from grave misfortune and difficulty,
['ZH_T23_1442_013:0694a15_10']	èª°è¶£æƒ¡é“ï¼Ÿ	èª°è¶£æƒ¡é“ï¼Ÿ	013	Who is heading towards evil destinies?
['ZH_T23_1442_013:0694a17_14']	æˆ‘ä»Šä»¥å‹æ–¹ä¾¿æ–¼ä¸‰æƒ¡é“æ‹”æ¿Ÿä»¤å‡ºï¼Œå®‰äººå¤©è¶£ä½¿ä½æ¶…æ§ƒï¼Œé™·æ¬²æ³¥è€…å¸¸æ€æ‹¯æ•‘ï¼Œç„¡è–è²¡è€…ä»¤å¾—è–è²¡ã€‚	æˆ‘ä»Šä»¥å‹æ–¹ä¾¿æ–¼ä¸‰æƒ¡é“æ‹”æ¿Ÿä»¤å‡ºï¼Œå®‰äººå¤©è¶£ä½¿ä½æ¶…æ§ƒï¼Œé™·æ¬²æ³¥è€…å¸¸æ€æ‹¯æ•‘ï¼Œç„¡è–è²¡è€…ä»¤å¾—è–è²¡ã€‚	013	I will now use the supreme skillful means to rescue and deliver from the three evil destinies, settle them in the human and heavenly realms and cause them to abide in nirvana. Those mired in desire I always think of saving, those lacking the wealth of the sages I cause to obtain the wealth of the sages.
['ZH_T23_1442_013:0694a18_4']	ä½›å‡ºä¸–é–“èª°ç•¶ç²ç›Šï¼Ÿ	ä½›å‡ºä¸–é–“èª°ç•¶ç²ç›Šï¼Ÿ	013	When the Buddha appears in the world, who will obtain benefit?
['ZH_T23_1442_013:0694a18_13']	èª°æœ‰ç„¡æ˜ç–è¦†å…¶çœ¼ï¼Ÿ	èª°æœ‰ç„¡æ˜ç–è¦†å…¶çœ¼ï¼Ÿ	013	Who is there whose eyes are covered by the cataract of ignorance?
['ZH_T23_1442_013:0694a20_11']	ä»¥å¤§æ™ºè—¥ä»¤ç›®é–‹æ˜ï¼Œç„¡å–„æ ¹è€…ä»¤ç¨®å–„æ ¹ï¼Œç¨®å–„æ ¹è€…ä»¤å…¶æˆç†Ÿï¼Œå…¶æˆç†Ÿè€…ä»¤å¾—è§£è„«ã€‚	ä»¥å¤§æ™ºè—¥ä»¤ç›®é–‹æ˜ï¼Œç„¡å–„æ ¹è€…ä»¤ç¨®å–„æ ¹ï¼Œç¨®å–„æ ¹è€…ä»¤å…¶æˆç†Ÿï¼Œå…¶æˆç†Ÿè€…ä»¤å¾—è§£è„«ã€‚	013	With the medicine of great wisdom, I will open their eyes and let them see clearly. Those without roots of goodness will be made to plant roots of goodness, those who have planted roots of goodness will be made to mature, and those who are mature will be made to attain liberation.
['ZH_T23_1442_013:0694a20_16']	å¦‚æœ‰èªªè¨€ï¼š	å¦‚æœ‰èªªè¨€ï¼š	013	As it is said:
['ZH_T23_1442_013:0694a21_14']	ã€Œå‡ä½¿å¤§æµ·æ½®ï¼Œã€€ã€€æˆ–å¤±æ–¼æœŸé™ï¼›	ã€Œå‡ä½¿å¤§æµ·æ½®ï¼Œã€€ã€€æˆ–å¤±æ–¼æœŸé™ï¼›	013	Even the tides of the great ocean may lose their appointed time;
['ZH_T23_1442_013:0694a22_13']	ä½›æ–¼æ‰€åŒ–è€…ï¼Œã€€ã€€æ¿Ÿåº¦ä¸éæ™‚ã€‚	ä½›æ–¼æ‰€åŒ–è€…ï¼Œã€€ã€€æ¿Ÿåº¦ä¸éæ™‚ã€‚	013	But the Buddha, in guiding and transforming beings, never misses the right moment.
['ZH_T23_1442_013:0694a23_13']	å¦‚æ¯æœ‰ä¸€å…’ï¼Œã€€ã€€å¸¸è­·å…¶èº«å‘½ï¼›	å¦‚æ¯æœ‰ä¸€å…’ï¼Œã€€ã€€å¸¸è­·å…¶èº«å‘½ï¼›	013	Just as a mother has only one child and always protects that child's life;
['ZH_T23_1442_013:0694a24_13']	ä½›æ–¼æ‰€åŒ–è€…ï¼Œã€€ã€€æ„å¿µéæ–¼å½¼ã€‚	ä½›æ–¼æ‰€åŒ–è€…ï¼Œã€€ã€€æ„å¿µéæ–¼å½¼ã€‚	013	The Buddha's compassion for those he guides and transforms surpasses that.
['ZH_T23_1442_013:0694a25_13']	ä½›æ–¼è«¸æœ‰æƒ…ï¼Œã€€ã€€æ…ˆå¿µä¸æ¨é›¢ï¼›	ä½›æ–¼è«¸æœ‰æƒ…ï¼Œã€€ã€€æ…ˆå¿µä¸æ¨é›¢ï¼›	013	The Buddha's loving thoughts for all beings never leave them;
['ZH_T23_1442_013:0694a26_13']	æ€æ¿Ÿå…¶è‹¦é›£ï¼Œã€€ã€€å¦‚æ¯ç‰›éš¨çŠ¢ã€‚	æ€æ¿Ÿå…¶è‹¦é›£ï¼Œã€€ã€€å¦‚æ¯ç‰›éš¨çŠ¢ã€‚	013	He thinks of saving them from suffering and difficulty, like a mother cow following her calf.
['ZH_T23_1442_013:0694a27_8']	ã€çˆ¾æ™‚ä¸–å°Šä¾¿ä½œæ˜¯å¿µï¼š	ã€çˆ¾æ™‚ä¸–å°Šä¾¿ä½œæ˜¯å¿µï¼š	013	At that time, the World-Honored One had this thought:
['ZH_T23_1442_013:0694a29_2']	ã€Œæ­¤å¯¦åŠ›å­ï¼Œæ›¾æ–¼ä½›æ‰€ç¨®è«¸å–„æ ¹ï¼ŒçŒ¶å¦‚ç†Ÿç™°å”¯å¾…éˆ¹æ±ºï¼Œä»Šæ­£æ˜¯æ™‚å ªä»»æ•™åŒ–ã€‚	ã€Œæ­¤å¯¦åŠ›å­ï¼Œæ›¾æ–¼ä½›æ‰€ç¨®è«¸å–„æ ¹ï¼ŒçŒ¶å¦‚ç†Ÿç™°å”¯å¾…éˆ¹æ±ºï¼Œä»Šæ­£æ˜¯æ™‚å ªä»»æ•™åŒ–ã€‚	013	This son of a good family has planted various roots of goodness in the Buddha's presence, like a ripe boil only waiting to be lanced. Now is the right time to guide and transform him.
['ZH_T23_1442_013:0694b01_6']	ã€å¾©è§€æ­¤äººç‚ºå—ä½›åŒ–ã€ç‚ºå¼Ÿå­åŒ–ã€ç‚ºç¥åŠ›åŒ–ã€ç‚ºå¨å„€åŒ–ï¼Ÿ	ã€å¾©è§€æ­¤äººç‚ºå—ä½›åŒ–ã€ç‚ºå¼Ÿå­åŒ–ã€ç‚ºç¥åŠ›åŒ–ã€ç‚ºå¨å„€åŒ–ï¼Ÿ	013	He further observed whether this person was being transformed by the Buddha, by the disciples, by spiritual powers, or by dignified demeanor.
['ZH_T23_1442_013:0694b01_19']	è§€çŸ¥ä¹ƒç”±å¼Ÿå­å¨å„€æ–¹èƒ½æ¿Ÿåº¦ã€‚	è§€çŸ¥ä¹ƒç”±å¼Ÿå­å¨å„€æ–¹èƒ½æ¿Ÿåº¦ã€‚	013	Observing and understanding, he then realized that it was through the dignified demeanor of the disciples that he could save and deliver [the prince].
['ZH_T23_1442_013:0694b03_5']	æ™‚é¦¬å‹è‹¾èŠ»æ–¼äººå¤©ä¸­å¨å„€æœ€å‹ï¼Œä¸–å°Šå³å‘Šé¦¬å‹è‹¾èŠ»æ›°ï¼š	æ™‚é¦¬å‹è‹¾èŠ»æ–¼äººå¤©ä¸­å¨å„€æœ€å‹ï¼Œä¸–å°Šå³å‘Šé¦¬å‹è‹¾èŠ»æ›°ï¼š	013	At that time, the monk AÅ›vajit had the most dignified demeanor among humans and gods. The World-Honored One then told the monk AÅ›vajit:
['ZH_T23_1442_013:0694b04_2']	ã€Œæ±å¯çŸ¥æ™‚ï¼Œç•¶è§€æ³¢æ³¢åœ‹ä¸­å¯¦åŠ›å¤ªå­ã€‚	ã€Œæ±å¯çŸ¥æ™‚ï¼Œç•¶è§€æ³¢æ³¢åœ‹ä¸­å¯¦åŠ›å¤ªå­ã€‚	013	You should know the time. You should observe Prince ViÅ›Äkha of the country of PÄpÄ.
['ZH_T23_1442_013:0694b07_9']	ã€æ™‚é¦¬å‹è‹¾èŠ»é»˜ç„¶å—æ•™ï¼Œæ—¢è‡³æ˜æ—¥æ—¥åˆåˆ†æ™‚åŸ·æŒè¡£é‰¢ï¼Œå…¥ç‹èˆåŸæ¬¡ç¬¬ä¹é£Ÿï¼Œé£Ÿäº‹æ—¢è¨–æ–¼é£Ÿå¾Œæ™‚èˆ‰åºŠå¸­å·²ï¼ŒåŸ·æŒè¡£é‰¢æ¼¸æ¬¡éŠè¡Œï¼Œè‡³æ³¢æ³¢åœ‹æ–¼æ°´è›­æ—ä½ã€‚	ã€æ™‚é¦¬å‹è‹¾èŠ»é»˜ç„¶å—æ•™ï¼Œæ—¢è‡³æ˜æ—¥æ—¥åˆåˆ†æ™‚åŸ·æŒè¡£é‰¢ï¼Œå…¥ç‹èˆåŸæ¬¡ç¬¬ä¹é£Ÿï¼Œé£Ÿäº‹æ—¢è¨–æ–¼é£Ÿå¾Œæ™‚èˆ‰åºŠå¸­å·²ï¼ŒåŸ·æŒè¡£é‰¢æ¼¸æ¬¡éŠè¡Œï¼Œè‡³æ³¢æ³¢åœ‹æ–¼æ°´è›­æ—ä½ã€‚	013	At that time, the monk AÅ›vajit silently accepted the instruction. The next day, at the time of the first watch, he took up his robes and bowl and entered the city of RÄjagá¹›ha to beg for food in sequence. After finishing his meal, he put away his seat and bedding, took up his robes and bowl, and gradually traveled to the country of PÄpÄ, where he stayed in the forest of leeches.
['ZH_T23_1442_013:0694b09_14']	é‚„ä»¥æ—¥åˆåˆ†æ™‚åŸ·æŒè¡£é‰¢ï¼Œå…¥æ³¢æ³¢åŸæ¬¡ç¬¬ä¹é£Ÿï¼Œèˆ‰è¶³ä¸‹è¶³è§€è¦–å±ˆä¼¸ï¼Œæ“æŒè¡£é‰¢å¨å„€é€²è¶£æ‚‰çš†è©³å¯©ã€‚	é‚„ä»¥æ—¥åˆåˆ†æ™‚åŸ·æŒè¡£é‰¢ï¼Œå…¥æ³¢æ³¢åŸæ¬¡ç¬¬ä¹é£Ÿï¼Œèˆ‰è¶³ä¸‹è¶³è§€è¦–å±ˆä¼¸ï¼Œæ“æŒè¡£é‰¢å¨å„€é€²è¶£æ‚‰çš†è©³å¯©ã€‚	013	Again, at the time of the first watch, he took up his robes and bowl and entered the city of PÄpÄ to beg for food in sequence. He observed the raising and lowering of his feet, the bending and stretching of his body, and the holding of his robes and bowl. His dignified demeanor and progress were all very careful.
['ZH_T23_1442_013:0694b11_16']	æ™‚å¯¦åŠ›å­æ–¼é«˜æ¨“ä¸Šè€Œé™è¦‹ä¹‹ï¼Œè¡Œæ­¥å®‰è©³æ›¾æ‰€æœªæœ‰ï¼Œå¨å„€é€²æ­¢ç„¡æœ‰è™§å¤±ï¼Œæ—¢é™è¦‹å·²ä½œå¦‚æ˜¯å¿µï¼š	æ™‚å¯¦åŠ›å­æ–¼é«˜æ¨“ä¸Šè€Œé™è¦‹ä¹‹ï¼Œè¡Œæ­¥å®‰è©³æ›¾æ‰€æœªæœ‰ï¼Œå¨å„€é€²æ­¢ç„¡æœ‰è™§å¤±ï¼Œæ—¢é™è¦‹å·²ä½œå¦‚æ˜¯å¿µï¼š	013	At that time, RÄhulabhadra saw him from a high building. His gait was peaceful and composed, unlike anything he had seen before. His dignified manner and deportment were without fault. Having seen him from afar, he had this thought:
['ZH_T23_1442_013:0694b12_15']	ã€Œæ–¼æ­¤åœ‹å…§è«¸å‡ºå®¶äººï¼Œæ­¤ä¹‹å¨å„€å¯¦æ‰€ä¸è¦‹ã€‚	ã€Œæ–¼æ­¤åœ‹å…§è«¸å‡ºå®¶äººï¼Œæ­¤ä¹‹å¨å„€å¯¦æ‰€ä¸è¦‹ã€‚	013	In this country, among the renunciant monks, I have never seen such dignified manner and deportment.
['ZH_T23_1442_013:0694b13_18']	ç„¶å‡ºå®¶è€…æ–¼èšè½å…§æ•´è‚…å¨å®¹ï¼Œåœ¨è˜­è‹¥ä¸­å‰‡ä¸å¦‚æ˜¯ã€‚	ç„¶å‡ºå®¶è€…æ–¼èšè½å…§æ•´è‚…å¨å®¹ï¼Œåœ¨è˜­è‹¥ä¸­å‰‡ä¸å¦‚æ˜¯ã€‚	013	However, renunciant monks in the villages are well-disciplined, but not so in the wilderness.
['ZH_T23_1442_013:0694b14_16']	ä»Šæˆ‘å®œæ‡‰ä»¤äººä¼ºå¯Ÿå±…æ—é‡è™•èƒ½å¦‚æ˜¯ä¸ï¼Ÿ	ä»Šæˆ‘å®œæ‡‰ä»¤äººä¼ºå¯Ÿå±…æ—é‡è™•èƒ½å¦‚æ˜¯ä¸ï¼Ÿ	013	Now I should have someone spy on whether those who dwell in the forest can be like this or not?
['ZH_T23_1442_013:0694b15_8']	ã€ä½œæ˜¯å¿µå·²ï¼Œå³ä»¤ä½¿è€…ï¼š	ã€ä½œæ˜¯å¿µå·²ï¼Œå³ä»¤ä½¿è€…ï¼š	013	Having had this thought, he immediately ordered a messenger:
['ZH_T23_1442_013:0694b16_15']	ã€Œéš¨æ­¤è‹¾èŠ»æ‰€è‡³ä¹‹è™•ï¼Œè‹¥å±…è˜­è‹¥ç°¡çµ•äººå¾’ï¼Œå½¼æ­¤å®¹å„€æœ‰åˆ¥ç•°ä¸ï¼Ÿ	ã€Œéš¨æ­¤è‹¾èŠ»æ‰€è‡³ä¹‹è™•ï¼Œè‹¥å±…è˜­è‹¥ç°¡çµ•äººå¾’ï¼Œå½¼æ­¤å®¹å„€æœ‰åˆ¥ç•°ä¸ï¼Ÿ	013	Follow this bhiká¹£u wherever he goes. If he dwells in the wilderness, secluded from people, is there any difference in his manner and deportment?
['ZH_T23_1442_013:0694b17_9']	ã€ä½¿è€…å¥‰æ•™éš¨é¦¬å‹å¾Œç§è§€å¯Ÿä¹‹ã€‚	ã€ä½¿è€…å¥‰æ•™éš¨é¦¬å‹å¾Œç§è§€å¯Ÿä¹‹ã€‚	013	The messenger followed MÄra's victory in secret to observe him.
