segmentnr	original	analyzed	folio	translated
['ZH_T38_1767_007:0074c19_0']	å¤§èˆ¬æ¶…æ§ƒç¶“ç–å·ç¬¬ä¸ƒ	å¤§èˆ¬æ¶…æ§ƒç¶“ç–å·ç¬¬ä¸ƒ	007	Commentary on the MahÄparinirvÄá¹‡a SÅ«tra, Scroll 7
['ZH_T38_1767_007:0074c21_0']	éš‹ç« å®‰é ‚æ³•å¸«æ’°	éš‹ç« å®‰é ‚æ³•å¸«æ’°	007	Composed by Sui Dynasty Zhangan Ding Fashi
['ZH_T38_1767_007:0074c22_0']	å”å¤©å°æ²™é–€æ¹›ç„¶å†æ²»	å”å¤©å°æ²™é–€æ¹›ç„¶å†æ²»	007	Tang Dynasty Tiantai Monk Zhanran Revised
['ZH_T38_1767_007:0074c26_3']	4 é•·å£½å“(ä¸ƒ-å…«)1é•·å£½å“å‰ä¹‹ä¸‰å“åš´è§€æ‰€å®‰ï¼Œæ­¤å“å­˜æœ¬ä½†æ”¹ã€Œå‘½ã€ç‚ºã€Œé•·ã€ã€ç§»ã€Œå£½ã€åœ¨ä¸‹ï¼Œè¥¿æ–¹èªå€’ä¸ç§»äº¦å–„ï¼Œè­¯äººå·¦å³æ‡‰ç„¡åˆ¥æ„ã€‚	4 é•·å£½å“(ä¸ƒ-å…«)1é•·å£½å“å‰ä¹‹ä¸‰å“åš´è§€æ‰€å®‰ï¼Œæ­¤å“å­˜æœ¬ä½†æ”¹ã€Œå‘½ã€ç‚ºã€Œé•·ã€ã€ç§»ã€Œå£½ã€åœ¨ä¸‹ï¼Œè¥¿æ–¹èªå€’ä¸ç§»äº¦å–„ï¼Œè­¯äººå·¦å³æ‡‰ç„¡åˆ¥æ„ã€‚	007	Chapter on Long Life (7-8), this chapter retains the original but changes life to long and moves longevity to below. The Western language is inverted, and it is also good not to move it. The translator should have no separate intention in the left and right.
['ZH_T38_1767_007:0074c26_17']	æä¾ä¸Šæ–‡ï¼Œç•¶çŸ¥å¦‚ä¾†å³æ˜¯é•·å£½ã€‚	æä¾ä¸Šæ–‡ï¼Œç•¶çŸ¥å¦‚ä¾†å³æ˜¯é•·å£½ã€‚	007	Fearing to rely on the above text, one should know that the TathÄgata is precisely long life.
['ZH_T38_1767_007:0074c28_1']	æˆ–ä¾åˆåˆã€Œäº‘ä½•å¾—é•·å£½ã€ï¼Œé•·åªæ˜¯å¸¸ï¼Œä½•ä¸ç”¨å¸¸ç‚ºåï¼Ÿ	æˆ–ä¾åˆåˆã€Œäº‘ä½•å¾—é•·å£½ã€ï¼Œé•·åªæ˜¯å¸¸ï¼Œä½•ä¸ç”¨å¸¸ç‚ºåï¼Ÿ	007	Or relying on the beginning of the verse, How can one attain long life? Long just means eternal. Why not use eternity as the name?
['ZH_T38_1767_007:0074c29_2']	æ­£è¨€ç”±å¸¸æ¨‚æˆ‘æ·¨ï¼Œç²æ­¤é•·å£½ï¼Œå¾æ‰€å¾—ç«‹åæ•…ä¹Ÿã€‚	æ­£è¨€ç”±å¸¸æ¨‚æˆ‘æ·¨ï¼Œç²æ­¤é•·å£½ï¼Œå¾æ‰€å¾—ç«‹åæ•…ä¹Ÿã€‚	007	The correct statement is that by means of permanence, bliss, self, and purity, one attains this long life. The name is established based on what is attained.
['ZH_T38_1767_007:0074c29_9']	ä»Šé‡‹é•·å£½ç‚ºå››ï¼š	ä»Šé‡‹é•·å£½ç‚ºå››ï¼š	007	Now, long life is explained in four ways:
['ZH_T38_1767_007:0075a01_10']	ä¸€åŒè«¸ä½›æ³•èº«æ™ºæ…§å£½å‘½çš†æ‚‰åŒç­‰ï¼Œæ•…è¨€é•·å£½ã€‚	ä¸€åŒè«¸ä½›æ³•èº«æ™ºæ…§å£½å‘½çš†æ‚‰åŒç­‰ï¼Œæ•…è¨€é•·å£½ã€‚	007	First, the Dharma body and wisdom of all Buddhas are all equal, therefore it is called long life.
['ZH_T38_1767_007:0075a02_4']	äºŒç”±ç‰©æ¬£é•·æƒ¡çŸ­ï¼Œå¼•ä»¤æ¨¹å–„æ•…ã€‚	äºŒç”±ç‰©æ¬£é•·æƒ¡çŸ­ï¼Œå¼•ä»¤æ¨¹å–„æ•…ã€‚	007	Second, because sentient beings delight in long life and detest short life, it attracts them to plant good roots.
['ZH_T38_1767_007:0075a03_2']	ä¸‰å°ç ´åä¿®ç„¡å¸¸ä¹‹æ‹™ï¼Œæ˜åœ“å‹ä¿®ä¹‹å¸¸ã€‚	ä¸‰å°ç ´åä¿®ç„¡å¸¸ä¹‹æ‹™ï¼Œæ˜åœ“å‹ä¿®ä¹‹å¸¸ã€‚	007	Third, it refutes biased cultivation of impermanence, and clarifies the permanence of perfect and superior cultivation.
['ZH_T38_1767_007:0075a03_13']	å››é•·çŸ­ç›¸å½¢ï¼Œæ˜¯å°æ²»é–€ã€‚	å››é•·çŸ­ç›¸å½¢ï¼Œæ˜¯å°æ²»é–€ã€‚	007	Fourth, long and short are mutually dependent, which is a counteractive approach.
['ZH_T38_1767_007:0075a04_4']	æœƒéé•·çŸ­ä¹‹é•·ï¼Œæ•…è¨€é•·å£½ã€‚	æœƒéé•·çŸ­ä¹‹é•·ï¼Œæ•…è¨€é•·å£½ã€‚	007	Uniting with the long that is neither long nor short, it is called long life.
['ZH_T38_1767_007:0075a05_3']	æ­¤æ˜¯æ¶…æ§ƒæ–½ä¸­ç¬¬ä¸‰å°è©è–©çœ¾éš¨å•è€Œæ–½ã€‚	æ­¤æ˜¯æ¶…æ§ƒæ–½ä¸­ç¬¬ä¸‰å°è©è–©çœ¾éš¨å•è€Œæ–½ã€‚	007	This is the third bestowal among the bestowal of nirvana, bestowing according to the questions of the bodhisattva assembly.
['ZH_T38_1767_007:0075a06_7']	å‡¡åå››å“ï¼Œè«¸å•ç­”ä¸­é•·å£½ç‚ºé¦–ï¼Œå¾åˆå‘½å“ï¼Œé¤˜å„éš¨ä¾¿ã€‚	å‡¡åå››å“ï¼Œè«¸å•ç­”ä¸­é•·å£½ç‚ºé¦–ï¼Œå¾åˆå‘½å“ï¼Œé¤˜å„éš¨ä¾¿ã€‚	007	There are fourteen chapters in total, with long life being the first among the various questions and answers. Starting from the chapter on life, each is according to the circumstances.
['ZH_T38_1767_007:0075a07_4']	å…¶æ–‡æœ‰å‹¸å•ã€æ­£å•ï¼Œåˆå‹¸æ¯”ä¸˜ã€æ¬¡å‹¸å¤§çœ¾ã€‚	å…¶æ–‡æœ‰å‹¸å•ã€æ­£å•ï¼Œåˆå‹¸æ¯”ä¸˜ã€æ¬¡å‹¸å¤§çœ¾ã€‚	007	The text has encouragement to ask and proper questions. First encouraging the bhiká¹£us, then encouraging the great assembly.
['ZH_T38_1767_007:0075a07_15']	åˆå‹¸æœ‰ä¸‰ï¼Œä½›æ³•è‡³ä¸‰æ•…ï¼›	åˆå‹¸æœ‰ä¸‰ï¼Œä½›æ³•è‡³ä¸‰æ•…ï¼›	007	The initial encouragement has three parts, because the Buddha's teachings reach three times;
['ZH_T38_1767_007:0075a08_2']	åˆè¡¨ä½›æ®·å‹¤æ•…ï¼›	åˆè¡¨ä½›æ®·å‹¤æ•…ï¼›	007	It also shows the Buddha's earnest concern;
['ZH_T38_1767_007:0075a08_18']	åˆåˆå‹¸é™¤ç–‘ã€äºŒå‹¸å—å¯„ã€ä¸‰å‹¸ç›Šç‰©ã€‚	åˆåˆå‹¸é™¤ç–‘ã€äºŒå‹¸å—å¯„ã€ä¸‰å‹¸ç›Šç‰©ã€‚	007	It also shows the initial encouragement to eliminate doubts, the second encouragement to accept the entrustment, and the third encouragement to benefit beings.
['ZH_T38_1767_007:0075a09_8', 'ZH_T38_1767_007:0075a09_19']	å…¶ä¸Šç–‘æ—¢ç›¡ï¼Œåˆå‹¸å‰‡é»˜ï¼›ğŸ”½æ—¢ä¸å ªå¯„ä»˜ï¼Œæ¬¡å‹¸å‰‡è¾­ï¼›	å…¶ä¸Šç–‘æ—¢ç›¡ï¼Œåˆå‹¸å‰‡é»˜ï¼› æ—¢ä¸å ªå¯„ä»˜ï¼Œæ¬¡å‹¸å‰‡è¾­ï¼›	007	Since the doubts above have been exhausted, the initial encouragement is then silent;ğŸ”½Since one is not yet able to be entrusted, the second encouragement then declines;
['ZH_T38_1767_007:0075a10_8']	æ—¢ç„¡åŒ–åŠ›ï¼Œå¾Œå‹¸å‰‡æ¨ã€‚	æ—¢ç„¡åŒ–åŠ›ï¼Œå¾Œå‹¸å‰‡æ¨ã€‚	007	Since one lacks the power of transformation, the third encouragement then promotes.
['ZH_T38_1767_007:0075a10_20']	åˆæ–‡è€…ï¼Œä½•æ•…åå‹¸å•æˆ’å¾‹ï¼Ÿ	åˆæ–‡è€…ï¼Œä½•æ•…åå‹¸å•æˆ’å¾‹ï¼Ÿ	007	Why is it that one is specifically encouraged to ask about the precepts and rules?
['ZH_T38_1767_007:0075a11_3']	æ²³è¥¿äº‘ï¼š	æ²³è¥¿äº‘ï¼š	007	The Hexi region says:
['ZH_T38_1767_007:0075a12_2']	ä½›æ³•æœ‰å…©ï¼Œä¸€ç¶“ã€äºŒå¾‹ï¼Œä¸Šå·²å•ç¶“ï¼Œä»Šå‹¸å•å¾‹ã€‚	ä½›æ³•æœ‰å…©ï¼Œä¸€ç¶“ã€äºŒå¾‹ï¼Œä¸Šå·²å•ç¶“ï¼Œä»Šå‹¸å•å¾‹ã€‚	007	The Buddha's teachings have two parts: sutras and vinaya. The above has already asked about the sutras, now it encourages asking about the vinaya.
['ZH_T38_1767_007:0075a12_7']	æ˜¯ç¾©ä¸ç„¶ã€‚	æ˜¯ç¾©ä¸ç„¶ã€‚	007	This meaning is not so.
['ZH_T38_1767_007:0075a13_6']	ç¶“æ·±å¾‹æ·ºï¼Œæ—¢èƒ½å•ç¶“ï¼Œè±ˆä¸èƒ½å•å¾‹è€Œå¾…å‹¸è€¶ï¼Ÿ	ç¶“æ·±å¾‹æ·ºï¼Œæ—¢èƒ½å•ç¶“ï¼Œè±ˆä¸èƒ½å•å¾‹è€Œå¾…å‹¸è€¶ï¼Ÿ	007	The sutras are profound and the vinaya is shallow. Since one can ask about the sutras, how can one not be able to ask about the vinaya and still wait for encouragement?
['ZH_T38_1767_007:0075a13_10']	è§€å¸«äº‘ï¼š	è§€å¸«äº‘ï¼š	007	Guanzhi says:
['ZH_T38_1767_007:0075a14_4']	å¾‹æ˜¯è²èä¹‹æœ¬ï¼Œåˆæ˜¯ä»Šç¶“ä¹‹å®—ã€‚	å¾‹æ˜¯è²èä¹‹æœ¬ï¼Œåˆæ˜¯ä»Šç¶“ä¹‹å®—ã€‚	007	The vinaya is the basis for the Å›rÄvakas and is also the main point of the present sÅ«tra.
['ZH_T38_1767_007:0075a14_19']	ä¸æ®ºç‚ºå› ï¼Œå¾—é•·å£½æœï¼Œæ•…åå‹¸å•ã€‚	ä¸æ®ºç‚ºå› ï¼Œå¾—é•·å£½æœï¼Œæ•…åå‹¸å•ã€‚	007	Not killing is the cause, and attaining the fruit of long life is the result, so it is specifically encouraged to ask about it.
['ZH_T38_1767_007:0075a15_3']	æ˜¯äº¦ä¸ç„¶ã€‚	æ˜¯äº¦ä¸ç„¶ã€‚	007	This is also not so.
['ZH_T38_1767_007:0075a16_4']	ä»Šæ¡ˆç¶“äº‘ã€Œæ–¼è«¸æˆ’å¾‹ã€ï¼Œæ˜¯å‰‡å¾‹å„€å®šé“ä¿±åç‚ºæˆ’ã€‚	ä»Šæ¡ˆç¶“äº‘ã€Œæ–¼è«¸æˆ’å¾‹ã€ï¼Œæ˜¯å‰‡å¾‹å„€å®šé“ä¿±åç‚ºæˆ’ã€‚	007	Now, according to the sÅ«tra, it says in the precepts and vinaya, which means that the precepts, concentration, and the path are all called precepts.
['ZH_T38_1767_007:0075a16_14']	è«¸èªä¸ä¸€ï¼Œè±ˆç¨å¾‹å„€ï¼Ÿ	è«¸èªä¸ä¸€ï¼Œè±ˆç¨å¾‹å„€ï¼Ÿ	007	The words are not the same, how can it be exclusively about the precepts and vinaya?
['ZH_T38_1767_007:0075a17_5']	åˆå°‡ä¸‹é©—ä¸Šï¼Œéåå‹¸å•å¾‹ã€‚	åˆå°‡ä¸‹é©—ä¸Šï¼Œéåå‹¸å•å¾‹ã€‚	007	Moreover, using the following to verify the above, it is not a biased encouragement to ask about the vinaya.
['ZH_T38_1767_007:0075a18_6']	ç©ºè€…æ…§ä¹Ÿï¼Œå¯‚è€…å®šä¹Ÿï¼Œç•¶çŸ¥å‹¸è«¸æ¯”ä¸˜å•æˆ’å®šæ…§ã€‚	ç©ºè€…æ…§ä¹Ÿï¼Œå¯‚è€…å®šä¹Ÿï¼Œç•¶çŸ¥å‹¸è«¸æ¯”ä¸˜å•æˆ’å®šæ…§ã€‚	007	Emptiness is wisdom, and tranquility is concentration. One should know that it encourages the bhiká¹£us to ask about precepts, concentration, and wisdom.
['ZH_T38_1767_007:0075a18_13']	æœ‰äººä½œäºŒè«¦æ¶ˆã€‚	æœ‰äººä½œäºŒè«¦æ¶ˆã€‚	007	Some people interpret it using the two truths.
['ZH_T38_1767_007:0075a18_18']	æ˜¯äº¦ä¸ç„¶ã€‚	æ˜¯äº¦ä¸ç„¶ã€‚	007	This is also not so.
['ZH_T38_1767_007:0075a19_8']	äºŒè«¦æ–‡æ™¦ï¼Œä¸‰è«¦æ–‡æ˜ã€‚	äºŒè«¦æ–‡æ™¦ï¼Œä¸‰è«¦æ–‡æ˜ã€‚	007	The text on the two truths is obscure, while the text on the three truths is clear.
['ZH_T38_1767_007:0075a19_11']	ä½•è€…ï¼Ÿ	ä½•è€…ï¼Ÿ	007	What is it?
['ZH_T38_1767_007:0075a21_11']	æˆ’å®šæ…§ä¸‰æ˜¯å…¥çœŸä¹‹æ¢¯éš¥å³å‹¸å•çœŸï¼Œæœ¬æ€§ç©ºå¯‚å³æ˜¯å•ä¸­ï¼Œæ˜äº†é€šé”å³æ˜¯é›™ç…§äºŒè«¦å³å‹¸å•ä¿—ã€‚	æˆ’å®šæ…§ä¸‰æ˜¯å…¥çœŸä¹‹æ¢¯éš¥å³å‹¸å•çœŸï¼Œæœ¬æ€§ç©ºå¯‚å³æ˜¯å•ä¸­ï¼Œæ˜äº†é€šé”å³æ˜¯é›™ç…§äºŒè«¦å³å‹¸å•ä¿—ã€‚	007	The three of precepts, concentration, and wisdom are the steps to enter the truth, which is the encouragement to ask about the truth. The fundamental nature of emptiness and quiescence is precisely the inquiry, and the clear understanding is precisely the simultaneous illumination of the two truths, which is the encouragement to ask about the conventional.
['ZH_T38_1767_007:0075a23_8']	åˆè¨€è«è¬‚å¦‚ä¾†å”¯ä¿®ç©ºå¯‚è€…ï¼Œå¦‚ä¾†æ—¢ä¸å°ˆä¿®çœŸä¿—ï¼Œå³æ˜¯å‹¸å•éçœŸéä¿—ç¬¬ä¸€ç¾©è«¦ã€‚	åˆè¨€è«è¬‚å¦‚ä¾†å”¯ä¿®ç©ºå¯‚è€…ï¼Œå¦‚ä¾†æ—¢ä¸å°ˆä¿®çœŸä¿—ï¼Œå³æ˜¯å‹¸å•éçœŸéä¿—ç¬¬ä¸€ç¾©è«¦ã€‚	007	Moreover, it is said, Do not think that the TathÄgata only cultivates emptiness and quiescence. Since the TathÄgata does not exclusively cultivate the true and conventional, this is the encouragement to ask about the ultimate truth that is neither true nor conventional.
['ZH_T38_1767_007:0075a23_16']	ç¬¬äºŒå†å‹¸ï¼Œç‚ºäºŒï¼š	ç¬¬äºŒå†å‹¸ï¼Œç‚ºäºŒï¼š	007	The second reiteration is in two parts:
['ZH_T38_1767_007:0075a24_1']	åˆå‹¸ã€æ¬¡è¾­ã€‚	åˆå‹¸ã€æ¬¡è¾­ã€‚	007	First, the encouragement; next, the refusal.
['ZH_T38_1767_007:0075a24_18']	å‹¸å•æˆ’å¾‹åˆè€…ï¼Œä¸€äº‘ç•¥è€³ï¼Œå…·èªªå¦‚ä¸Šã€‚	å‹¸å•æˆ’å¾‹åˆè€…ï¼Œä¸€äº‘ç•¥è€³ï¼Œå…·èªªå¦‚ä¸Šã€‚	007	As for the encouragement to ask about the precepts, some say it is brief, but the detailed explanation is as above.
['ZH_T38_1767_007:0075a25_17']	åˆå–ä¸‹æ–‡æ„ï¼Œä½›æ¬²å¯„ä»˜ï¼Œæ•…ä»¥æˆ’å¾‹è€Œç‚ºå‹¸ç«¯ã€‚	åˆå–ä¸‹æ–‡æ„ï¼Œä½›æ¬²å¯„ä»˜ï¼Œæ•…ä»¥æˆ’å¾‹è€Œç‚ºå‹¸ç«¯ã€‚	007	Moreover, taking the meaning of the following text, the Buddha wishes to entrust it, so he uses the precepts as the starting point for the encouragement.
['ZH_T38_1767_007:0075a26_15']	æ¬¡è¾­è€…ï¼Œæ—¢æ–¼æˆ’å¾‹ä¸èƒ½å•è€…ï¼Œå³è¾­ä¸å ªã€‚	æ¬¡è¾­è€…ï¼Œæ—¢æ–¼æˆ’å¾‹ä¸èƒ½å•è€…ï¼Œå³è¾­ä¸å ªã€‚	007	Next, as for the refusal, since one is unable to ask about the precepts, one refuses, saying one is not up to the task.
['ZH_T38_1767_007:0075a26_22']	æœ‰æ³•ã€è­¬ã€åˆã€‚	æœ‰æ³•ã€è­¬ã€åˆã€‚	007	There is the Dharma, parables, and synthesis.
['ZH_T38_1767_007:0075a27_4']	æ³•èªªåˆä¸‰ï¼š	æ³•èªªåˆä¸‰ï¼š	007	The Dharma explanation is also in three parts:
['ZH_T38_1767_007:0075a27_11']	æ­£è¾­ã€é‡‹ã€çµã€‚	æ­£è¾­ã€é‡‹ã€çµã€‚	007	The actual refusal, explanation, and conclusion.
['ZH_T38_1767_007:0075a28_6']	æ­£è¾­ï¼Œè¾­ç„¡æ™ºæ…§ï¼Œä¸èƒ½å•æ–¼ä¸‰è™Ÿï¼Œå¦‚æ–‡ã€‚	æ­£è¾­ï¼Œè¾­ç„¡æ™ºæ…§ï¼Œä¸èƒ½å•æ–¼ä¸‰è™Ÿï¼Œå¦‚æ–‡ã€‚	007	As for the actual refusal, refusing due to lacking wisdom, one is unable to ask about the three titles, as in the text.
['ZH_T38_1767_007:0075a29_16']	æ¬¡é‡‹è¾­ï¼Œé‡‹æ–¼ä¸‰è™Ÿçš†ä¸æ€è­°ï¼Œå¦‚ä¾†å¢ƒç•Œæ·±å¾®ä¹‹æ³•å…åŒè«¸ä½›ï¼Œæ•…è™Ÿå¦‚ä¾†ã€‚	æ¬¡é‡‹è¾­ï¼Œé‡‹æ–¼ä¸‰è™Ÿçš†ä¸æ€è­°ï¼Œå¦‚ä¾†å¢ƒç•Œæ·±å¾®ä¹‹æ³•å…åŒè«¸ä½›ï¼Œæ•…è™Ÿå¦‚ä¾†ã€‚	007	Next, explaining the words: explaining the three titles are all inconceivable. The realm of the TathÄgata is the profound and subtle Dharma, which is the same as that of all Buddhas, thus he is called the TathÄgata.
['ZH_T38_1767_007:0075b01_11']	æˆ‘ä¸èƒ½å•ï¼Œå‰‡æ˜¯è¾­ä¸Šæœ¬æ€§ç©ºå¯‚ã€‚	æˆ‘ä¸èƒ½å•ï¼Œå‰‡æ˜¯è¾­ä¸Šæœ¬æ€§ç©ºå¯‚ã€‚	007	I cannot ask, which means declining the above nature is empty and tranquil.
['ZH_T38_1767_007:0075b03_3']	æ‰€æœ‰è«¸å®šä¸å¯æ€è­°ï¼Œçª®æ–¼ç”šæ·±å¾®å¦™ç¦ªå®šï¼Œèƒ½ç‚ºä¸€åˆ‡è€Œä½œç¦ç”°ï¼Œæ•…åæ‡‰ä¾›ã€‚	æ‰€æœ‰è«¸å®šä¸å¯æ€è­°ï¼Œçª®æ–¼ç”šæ·±å¾®å¦™ç¦ªå®šï¼Œèƒ½ç‚ºä¸€åˆ‡è€Œä½œç¦ç”°ï¼Œæ•…åæ‡‰ä¾›ã€‚	007	All kinds of samÄdhi are inconceivable, exhausting the profound and subtle dhyÄna, able to be the field of blessings for all, thus called the Worthy of Offerings.
['ZH_T38_1767_007:0075b03_16']	æˆ‘ä¸èƒ½å•ï¼Œå‰‡è¾­ä¸Šæ˜äº†é€šé”ã€‚	æˆ‘ä¸èƒ½å•ï¼Œå‰‡è¾­ä¸Šæ˜äº†é€šé”ã€‚	007	I cannot ask, which means declining the above clearly penetrating.
['ZH_T38_1767_007:0075b05_10']	æ‰€æ¼”æ•™èª¨ä¸å¯æ€è­°è€…ï¼Œçª®æ–¼ä¸€åˆ‡è¨€èªªé‚Šåº•ï¼Œç¤ºå°çœ¾ç”Ÿæ˜¯é“éé“ï¼Œè™Ÿæ­£éçŸ¥ã€‚	æ‰€æ¼”æ•™èª¨ä¸å¯æ€è­°è€…ï¼Œçª®æ–¼ä¸€åˆ‡è¨€èªªé‚Šåº•ï¼Œç¤ºå°çœ¾ç”Ÿæ˜¯é“éé“ï¼Œè™Ÿæ­£éçŸ¥ã€‚	007	The teachings expounded are inconceivable, exhausting the limits of all verbal expression, showing sentient beings the right and wrong paths, called the One of Right and Universal Knowledge.
['ZH_T38_1767_007:0075b06_1']	æˆ‘ä¸èƒ½å•ï¼Œå‰‡è¾­ä¸Šæˆ’å¾‹ã€‚	æˆ‘ä¸èƒ½å•ï¼Œå‰‡è¾­ä¸Šæˆ’å¾‹ã€‚	007	I cannot ask, which means declining the above precepts and rules.
['ZH_T38_1767_007:0075b06_11']	åˆé‡‹è¾­ä¸èƒ½å•æ–¼ä¸‰è«¦ã€‚	åˆé‡‹è¾­ä¸èƒ½å•æ–¼ä¸‰è«¦ã€‚	007	Another explanation of the words: not being able to ask about the three truths.
['ZH_T38_1767_007:0075b07_2']	è«¸ä½›å¢ƒç•Œï¼Œæ˜¯ä¸èƒ½å•ä¸­ï¼›	è«¸ä½›å¢ƒç•Œï¼Œæ˜¯ä¸èƒ½å•ä¸­ï¼›	007	The realm of all Buddhas is what cannot be asked about in the middle;
['ZH_T38_1767_007:0075b07_13']	æ‰€æœ‰è«¸å®šï¼Œæ˜¯ä¸èƒ½å•çœŸï¼›	æ‰€æœ‰è«¸å®šï¼Œæ˜¯ä¸èƒ½å•çœŸï¼›	007	All kinds of samÄdhi are what cannot be asked about in the true;
['ZH_T38_1767_007:0075b08_3']	æ‰€æ¼”æ•™èª¨ï¼Œæ˜¯ä¸èƒ½å•ä¿—ã€‚	æ‰€æ¼”æ•™èª¨ï¼Œæ˜¯ä¸èƒ½å•ä¿—ã€‚	007	The teachings expounded are what cannot be asked about in the conventional.
['ZH_T38_1767_007:0075b08_18']	ä¸‰çµè¾­ä¸­äº‘ç„¡æ™ºæ…§è€…ï¼Œç„¡ä¸‰æ™ºä¹Ÿã€‚	ä¸‰çµè¾­ä¸­äº‘ç„¡æ™ºæ…§è€…ï¼Œç„¡ä¸‰æ™ºä¹Ÿã€‚	007	In the third section on parting words, it says those without wisdom lack the three knowledges.
['ZH_T38_1767_007:0075b09_5']	æ¬¡è­¬è¾­ï¼Œç‚ºå››ï¼š	æ¬¡è­¬è¾­ï¼Œç‚ºå››ï¼š	007	Next, the parable has four parts:
['ZH_T38_1767_007:0075b10_12']	ä¸€è²èä¸å ªå¯„ã€äºŒå¦‚ä¾†ä¸æ‡‰å¯„ã€ä¸‰è²èå½Šå—å¯„ã€å››å¦‚ä¾†å¤±æ‰€å¯„ã€‚	ä¸€è²èä¸å ªå¯„ã€äºŒå¦‚ä¾†ä¸æ‡‰å¯„ã€ä¸‰è²èå½Šå—å¯„ã€å››å¦‚ä¾†å¤±æ‰€å¯„ã€‚	007	First, the Å›rÄvakas are not suitable to be entrusted; second, the TathÄgata should not entrust; third, the Å›rÄvakas strongly accept the entrustment; fourth, the TathÄgata loses the entrusted.
['ZH_T38_1767_007:0075b12_15']	åˆæ˜ä¸å ªï¼Œè¨€è€äººè€…ï¼Œé–»æµ®æœå ±å°‡ç›¡ä¹‹å¹´ï¼Œè­¬è«¸è²èåäºŒç·£è§€ï¼Œæ”¯æ”¯åäºŒï¼Œå¾éè‡³ç¾æ•…ç™¾äºŒåã€‚	åˆæ˜ä¸å ªï¼Œè¨€è€äººè€…ï¼Œé–»æµ®æœå ±å°‡ç›¡ä¹‹å¹´ï¼Œè­¬è«¸è²èåäºŒç·£è§€ï¼Œæ”¯æ”¯åäºŒï¼Œå¾éè‡³ç¾æ•…ç™¾äºŒåã€‚	007	The first clarifies the unsuitability. As for the old man, the years when the fruits of retribution in JambudvÄ«pa are about to end, it is a metaphor for the Å›rÄvakas' twelve-limb dependent origination contemplation, with twelve in each limb, from the past to the present, thus one hundred and twenty.
['ZH_T38_1767_007:0075b13_17']	éç¾æ»…æ•…è€æ­»æ»…ï¼Œç„¡æ˜æ»…ä¹ƒè‡³è€æ­»æ»…æ•…å°‡å…¥æ¶…æ§ƒã€‚	éç¾æ»…æ•…è€æ­»æ»…ï¼Œç„¡æ˜æ»…ä¹ƒè‡³è€æ­»æ»…æ•…å°‡å…¥æ¶…æ§ƒã€‚	007	Because the past and present are extinguished, old age and death are extinguished. Because ignorance is extinguished up to old age and death are extinguished, one will enter nirvÄá¹‡a.
['ZH_T38_1767_007:0075b14_14']	èº«å¬°é•·ç—…è€…ï¼Œæ­£ä½¿é›–ç›¡ï¼Œç¿’æ°£å°šå­˜ã€‚	èº«å¬°é•·ç—…è€…ï¼Œæ­£ä½¿é›–ç›¡ï¼Œç¿’æ°£å°šå­˜ã€‚	007	As for the body suffering from a chronic illness, although the afflictions are exhausted, habitual tendencies still remain.
['ZH_T38_1767_007:0075b15_9']	åˆç„¡æ˜åˆ¥æƒ‘æœªä¾µä¸€æ¯«ï¼Œæ•…è¨€é•·ç—…ã€‚	åˆç„¡æ˜åˆ¥æƒ‘æœªä¾µä¸€æ¯«ï¼Œæ•…è¨€é•·ç—…ã€‚	007	Moreover, the separate afflictions of ignorance have not been harmed even a little bit, thus it is called a chronic illness.
['ZH_T38_1767_007:0075b16_5']	å¯¢è‡¥åºŠå¸­è€…ï¼Œæ²ˆç©ºæ»¯å¯‚å¤±éŠæˆ²ç¥é€šã€‚	å¯¢è‡¥åºŠå¸­è€…ï¼Œæ²ˆç©ºæ»¯å¯‚å¤±éŠæˆ²ç¥é€šã€‚	007	As for lying on a bed, sinking in emptiness and stagnating in quiescence loses the spiritual powers of play.
['ZH_T38_1767_007:0075b17_10']	ä¸èƒ½èµ·å±…è€…ï¼Œä¸èƒ½å…¥æœ‰å¦‚ä¸èƒ½èµ·ï¼Œä¸ç´¹ä¸‰å¯¶å¦‚ä¸èƒ½å±…ã€‚	ä¸èƒ½èµ·å±…è€…ï¼Œä¸èƒ½å…¥æœ‰å¦‚ä¸èƒ½èµ·ï¼Œä¸ç´¹ä¸‰å¯¶å¦‚ä¸èƒ½å±…ã€‚	007	As for being unable to get up and move around, being unable to enter existence is like being unable to get up, and not continuing the Three Jewels is like being unable to move around.
['ZH_T38_1767_007:0075b19_17']	æ°£åŠ›è™›åŠ£è€…ï¼Œç„¡å¸¸ä½å‘½å¦‚ç„¡æ°£ï¼Œç„¡ååŠ›é›„çŒ›å¦‚ç„¡åŠ›ï¼Œå°‘çœŸå¯¦æ•…åè™›ï¼Œéå‹ä¿®æ•…ååŠ£ï¼Œé¤˜å‘½ç„¡å¹¾å°‡å…¥ç°æ–·ã€‚	æ°£åŠ›è™›åŠ£è€…ï¼Œç„¡å¸¸ä½å‘½å¦‚ç„¡æ°£ï¼Œç„¡ååŠ›é›„çŒ›å¦‚ç„¡åŠ›ï¼Œå°‘çœŸå¯¦æ•…åè™›ï¼Œéå‹ä¿®æ•…ååŠ£ï¼Œé¤˜å‘½ç„¡å¹¾å°‡å…¥ç°æ–·ã€‚	007	One whose strength and vigor are weak means having no permanent abiding life, like having no breath, and lacking the ten powers and heroic courage like lacking strength. Because of little truth, it is called weak. Because of not being superior cultivation, it is called inferior. The remaining life is almost gone, about to enter into annihilation.
['ZH_T38_1767_007:0075b20_14']	æ¬¡ã€Œæœ‰ä¸€å¯Œäººè€…ã€ä¸‹ï¼Œè­¬å¦‚ä¾†ä¸æ‡‰ä»˜å›‘ã€‚	æ¬¡ã€Œæœ‰ä¸€å¯Œäººè€…ã€ä¸‹ï¼Œè­¬å¦‚ä¾†ä¸æ‡‰ä»˜å›‘ã€‚	007	Next, from There was a wealthy person below, it is a simile for the TathÄgata not entrusting [the Dharma] to others.
['ZH_T38_1767_007:0075b21_3']	æ™ºæ–·åœ“æ»¿æ•…è¨€å¯Œäººã€‚	æ™ºæ–·åœ“æ»¿æ•…è¨€å¯Œäººã€‚	007	Because of the perfection of wisdom and elimination, it is said to be a wealthy person.
['ZH_T38_1767_007:0075b22_7']	ç·£äº‹æ¬²è¡Œè€…ï¼Œé©åŒ–å¤šå‹™æ•…è¨€ç·£äº‹ï¼Œä¹˜å¦‚èµ·æ‡‰æ•…è¨€æ¬²è¡Œã€‚	ç·£äº‹æ¬²è¡Œè€…ï¼Œé©åŒ–å¤šå‹™æ•…è¨€ç·£äº‹ï¼Œä¹˜å¦‚èµ·æ‡‰æ•…è¨€æ¬²è¡Œã€‚	007	On business, about to depart means that because of adapting to the transformations, there are many tasks, so it is said to be on business. Riding the suchness to give rise to response is called about to depart.
['ZH_T38_1767_007:0075b22_17']	ä»¥ç™¾é‡‘è€…ï¼Œç™¾å¥è§£è„«ã€‚	ä»¥ç™¾é‡‘è€…ï¼Œç™¾å¥è§£è„«ã€‚	007	With a hundred gold coins means a hundred phrases of liberation.
