segmentnr	original	analyzed	folio	translated
['ZH_T38_1767_007:0076a22_8']	èƒ½å•èƒ½ç­”å…·äºŒèŠåš´ï¼Œé›™æ¨¹æ¶…æ§ƒå…¶ç¾©å¾—é¡¯ã€‚	èƒ½å•èƒ½ç­”å…·äºŒèŠåš´ï¼Œé›™æ¨¹æ¶…æ§ƒå…¶ç¾©å¾—é¡¯ã€‚	007	Being able to ask and being able to answer are both adorned, and the meaning of nirvana under the twin trees can be revealed.
['ZH_T38_1767_007:0076a24_19']	å››ã€å¦‚ä¾†æ–½ä¸»æ…ˆæ‚²ç„¡é‡ï¼Œæ†«å¿µé‚ªåƒ»å“€æ†ä¸å–„ï¼Œè‹¥èƒ½å•æ­¸å³ç”¨å¸¸è¾¯æ”è€¶ï¼Œè‹¥èƒ½å•æˆ’å³ç”¨å¸¸å‘½æ”æƒ¡ï¼Œæ¶…æ§ƒä¹‹ç”¨å¾—é¡¯ã€‚	å››ã€å¦‚ä¾†æ–½ä¸»æ…ˆæ‚²ç„¡é‡ï¼Œæ†«å¿µé‚ªåƒ»å“€æ†ä¸å–„ï¼Œè‹¥èƒ½å•æ­¸å³ç”¨å¸¸è¾¯æ”è€¶ï¼Œè‹¥èƒ½å•æˆ’å³ç”¨å¸¸å‘½æ”æƒ¡ï¼Œæ¶…æ§ƒä¹‹ç”¨å¾—é¡¯ã€‚	007	Fourth, the host of the TathÄgata's compassion is immeasurable. He pities the heterodox and takes pity on the unwholesome. If one can ask about returning, he will use his constant eloquence to embrace the heterodox. If one can ask about precepts, he will use his constant life to embrace evil. The function of nirvana can be revealed.
['ZH_T38_1767_007:0076a25_13']	ç‚ºæ­¤ç¾©æ•…ï¼Œèˆ‰æ­¤ä¸‰ç¨®ä»¥ç‚ºå•ç«¯ã€‚	ç‚ºæ­¤ç¾©æ•…ï¼Œèˆ‰æ­¤ä¸‰ç¨®ä»¥ç‚ºå•ç«¯ã€‚	007	For this meaning, these three kinds are taken as the basis for the questions.
['ZH_T38_1767_007:0076a25_15']	å•ï¼š	å•ï¼š	007	Question:
['ZH_T38_1767_007:0076a26_3']	å•ç«¯é€šå¾Œï¼Œäº¦é€šå‰ä¸ï¼Ÿ	å•ç«¯é€šå¾Œï¼Œäº¦é€šå‰ä¸ï¼Ÿ	007	Do the questions extend to the end and also to the beginning?
['ZH_T38_1767_007:0076a26_5']	ç­”ï¼š	ç­”ï¼š	007	Answer:
['ZH_T38_1767_007:0076a27_6']	å•å‘½å³æ˜¯å¸¸ä¿®ï¼Œå•è¾¯å³æ˜¯æ¨‚ä¿®ï¼Œå•æ­¸æˆ’å³æ˜¯æˆ‘ä¿®ã€‚	å•å‘½å³æ˜¯å¸¸ä¿®ï¼Œå•è¾¯å³æ˜¯æ¨‚ä¿®ï¼Œå•æ­¸æˆ’å³æ˜¯æˆ‘ä¿®ã€‚	007	Asking about life is precisely cultivating permanence, asking about eloquence is precisely cultivating bliss, and asking about returning to the precepts is precisely cultivating self.
['ZH_T38_1767_007:0076a28_14']	åˆå•å‘½å³å¸¸æ³•èº«å¾·ï¼Œå•è¾¯å³æ¨‚èˆ¬è‹¥å¾·ï¼Œå•æ­¸æˆ’å³æ·¨æˆ‘è§£è„«å¾·ã€‚	åˆå•å‘½å³å¸¸æ³•èº«å¾·ï¼Œå•è¾¯å³æ¨‚èˆ¬è‹¥å¾·ï¼Œå•æ­¸æˆ’å³æ·¨æˆ‘è§£è„«å¾·ã€‚	007	Moreover, asking about life is precisely the permanent Dharma body virtue, asking about eloquence is precisely the blissful prajÃ±Ä virtue, and asking about returning to the precepts is precisely the pure self liberation virtue.
['ZH_T38_1767_007:0076a29_19']	åˆå•å‘½å³å¸¸å‘½å¸¸è‰²å¸¸åŠ›ï¼Œå•è¾¯å³å¸¸èªï¼Œå•æ­¸æˆ’å³å¸¸å®‰ã€‚	åˆå•å‘½å³å¸¸å‘½å¸¸è‰²å¸¸åŠ›ï¼Œå•è¾¯å³å¸¸èªï¼Œå•æ­¸æˆ’å³å¸¸å®‰ã€‚	007	Moreover, asking about life is precisely the permanent life, permanent form, and permanent strength, asking about eloquence is precisely the permanent speech, and asking about returning to the precepts is precisely the permanent peace.
['ZH_T38_1767_007:0076b01_17']	åˆæ–‡äº‘ã€Œèƒ½å¦‚æ˜¯å•ï¼Œå‰‡å¤§åˆ©ç›Šä¸€åˆ‡çœ¾ç”Ÿã€‚	åˆæ–‡äº‘ã€Œèƒ½å¦‚æ˜¯å•ï¼Œå‰‡å¤§åˆ©ç›Šä¸€åˆ‡çœ¾ç”Ÿã€‚	007	Moreover, the text says, Being able to ask in this way greatly benefits all sentient beings.
['ZH_T38_1767_007:0076b02_3']	ã€å³é€šå‰é€šå¾Œã€‚	ã€å³é€šå‰é€šå¾Œã€‚	007	This includes both the past and the future.
['ZH_T38_1767_007:0076b02_15']	å•ç«¯è©²å»£ï¼Œç± æ‹¬è‹¥æ­¤äº‘äº‘ã€‚	å•ç«¯è©²å»£ï¼Œç± æ‹¬è‹¥æ­¤äº‘äº‘ã€‚	007	The question is broad and comprehensive, encompassing all of this and more.
['ZH_T38_1767_007:0076b03_1']	ç¬¬äºŒæ­£å•ï¼Œç‚ºå››ï¼š	ç¬¬äºŒæ­£å•ï¼Œç‚ºå››ï¼š	007	The second is the main question, which is divided into four parts:
['ZH_T38_1767_007:0076b03_17']	ä¸€æ¬²å•ã€äºŒè¨±å•ã€ä¸‰è¬™å•ã€å››æ­£å•ã€‚	ä¸€æ¬²å•ã€äºŒè¨±å•ã€ä¸‰è¬™å•ã€å››æ­£å•ã€‚	007	1. The desire to ask, 2. Permission to ask, 3. Humble inquiry, 4. The actual question.
['ZH_T38_1767_007:0076b04_1']	æ¬²å•åˆäºŒï¼š	æ¬²å•åˆäºŒï¼š	007	The desire to ask is further divided into two parts:
['ZH_T38_1767_007:0076b04_12']	åˆç¶“å®¶æ•˜èµ·ã€æ¬¡è‡ªå’¨ç™¼ã€‚	åˆç¶“å®¶æ•˜èµ·ã€æ¬¡è‡ªå’¨ç™¼ã€‚	007	First, the narrator's introduction, then the self-inquiry.
['ZH_T38_1767_007:0076b04_17']	æ•˜ä¸­ç‚ºå››ï¼š	æ•˜ä¸­ç‚ºå››ï¼š	007	The introduction is divided into four parts:
['ZH_T38_1767_007:0076b05_16']	ä¸€æ•˜æœ¬ä½ã€äºŒæ•˜è¿¹å®—ã€ä¸‰æ•˜æ„Ÿå°ã€å››æ•˜å¨å„€ã€‚	ä¸€æ•˜æœ¬ä½ã€äºŒæ•˜è¿¹å®—ã€ä¸‰æ•˜æ„Ÿå°ã€å››æ•˜å¨å„€ã€‚	007	First, the fundamental position, second, the traces and principles, third, the feeling and response, fourth, the deportment.
['ZH_T38_1767_007:0076b06_16']	åˆæœ¬ä½è€…ï¼Œæœ‰é€šæœ‰åˆ¥ï¼Œè©è–©é€šä½ã€ç«¥å­åˆ¥ä½ã€‚	åˆæœ¬ä½è€…ï¼Œæœ‰é€šæœ‰åˆ¥ï¼Œè©è–©é€šä½ã€ç«¥å­åˆ¥ä½ã€‚	007	The fundamental position is both general and specific. The bodhisattva position is general, while the youth position is specific.
['ZH_T38_1767_007:0076b07_9']	è«–äº‘ã€ŒåäºŒè€Œèƒ½å•è€…ï¼Œå³æœ‰å››æ„ï¼š	è«–äº‘ã€ŒåäºŒè€Œèƒ½å•è€…ï¼Œå³æœ‰å››æ„ï¼š	007	The treatise says, The one who can ask at the age of twelve has four intentions:
['ZH_T38_1767_007:0076b08_12']	ä¸€æ­£æ³•éè‰²ï¼Œä¸å¯ä»¥äººå¹¼è€Œæ£„æ–¼æ³•ï¼Œé‡æ³•é‡äººæ•…ä¹Ÿï¼›	ä¸€æ­£æ³•éè‰²ï¼Œä¸å¯ä»¥äººå¹¼è€Œæ£„æ–¼æ³•ï¼Œé‡æ³•é‡äººæ•…ä¹Ÿï¼›	007	First, the true Dharma is not form, so one cannot abandon the Dharma because of a person's youth. It is because one values the Dharma and values people.
['ZH_T38_1767_007:0076b09_7']	äºŒç”Ÿæ¯”ä¸˜å–„ï¼Œæ–¼è©è–©é“ä¿¡å¿µå …å›ºï¼›	äºŒç”Ÿæ¯”ä¸˜å–„ï¼Œæ–¼è©è–©é“ä¿¡å¿µå …å›ºï¼›	007	Second, it generates good in bhiká¹£us, firmly believing and upholding the bodhisattva path;
['ZH_T38_1767_007:0076b09_13']	ä¸‰æŠ˜ä¼é«˜å¿ƒï¼›	ä¸‰æŠ˜ä¼é«˜å¿ƒï¼›	007	Third, it subdues arrogant minds;
['ZH_T38_1767_007:0076b09_19']	å››æ˜ä½›åŠ›å¤§ã€‚	å››æ˜ä½›åŠ›å¤§ã€‚	007	Fourth, it clarifies the Buddha's great power.
['ZH_T38_1767_007:0076b10_9']	ã€è‹¥ä¾åä½ï¼Œå³ç¬¬ä¹ä½ï¼›	ã€è‹¥ä¾åä½ï¼Œå³ç¬¬ä¹ä½ï¼›	007	 If based on the ten abodes, it is the ninth abode;
['ZH_T38_1767_007:0076b11_1']	è‹¥é¡æ–‡æ®Šç«¥å­ï¼Œå³ååœ°é ‚ã€‚	è‹¥é¡æ–‡æ®Šç«¥å­ï¼Œå³ååœ°é ‚ã€‚	007	If it is like MaÃ±juÅ›rÄ«, then it is the peak of the ten grounds.
['ZH_T38_1767_007:0076b11_15']	è–ä½é›£çŸ¥ï¼Œä¸”ç”¨ååœ°é‡‹ç«¥å­ä¹Ÿã€‚	è–ä½é›£çŸ¥ï¼Œä¸”ç”¨ååœ°é‡‹ç«¥å­ä¹Ÿã€‚	007	The holy stage is difficult to know, so I will provisionally use the ten grounds to explain the youth.
['ZH_T38_1767_007:0076b12_11']	æ¬¡è¿¹å®—ä¸­è¨€å©†ç¾…é–€è€…ï¼Œè¿¹è¨—é«˜å®—å§“ã€‚	æ¬¡è¿¹å®—ä¸­è¨€å©†ç¾…é–€è€…ï¼Œè¿¹è¨—é«˜å®—å§“ã€‚	007	Next, in the trace school, the one called a brahmin is a trace of relying on a noble surname.
['ZH_T38_1767_007:0076b13_7']	å¤§è¿¦è‘‰è€…ï¼Œå¯„ç”Ÿè²´æ—ï¼Œå¦‚æ­¤é–“ç”²æ—ã€‚	å¤§è¿¦è‘‰è€…ï¼Œå¯„ç”Ÿè²´æ—ï¼Œå¦‚æ­¤é–“ç”²æ—ã€‚	007	MahÄkÄÅ›yapa is born into a noble family, like the Jia clan in China.
['ZH_T38_1767_007:0076b13_18']	ä¸‰ä»¥ä½›ç¥åŠ›è€…ï¼Œæ„Ÿå°ä¹Ÿã€‚	ä¸‰ä»¥ä½›ç¥åŠ›è€…ï¼Œæ„Ÿå°ä¹Ÿã€‚	007	Third, by the Buddha's spiritual power, it is the response.
['ZH_T38_1767_007:0076b15_6']	ç‚ºæ±ºå®šçœ¾è€Œä½œä¸Šé¦–ï¼Œæ„Ÿä½›å¨åŠ ä½œå°æšä¸»ï¼Œä»¤äº”åäºŒçœ¾åŒé£²ç”˜éœ²ã€‚	ç‚ºæ±ºå®šçœ¾è€Œä½œä¸Šé¦–ï¼Œæ„Ÿä½›å¨åŠ ä½œå°æšä¸»ï¼Œä»¤äº”åäºŒçœ¾åŒé£²ç”˜éœ²ã€‚	007	For the determined assembly, he becomes the leader, responding to the Buddha's majestic power to become the main proponent, causing the fifty-two assemblies to equally drink the sweet dew.
['ZH_T38_1767_007:0076b15_16']	éæ–¯å¤§å™¨ï¼Œå­°èƒ½ç‚ºä¹‹ï¼Ÿ	éæ–¯å¤§å™¨ï¼Œå­°èƒ½ç‚ºä¹‹ï¼Ÿ	007	If not for this great vessel, who could do it?
['ZH_T38_1767_007:0076b16_7']	å››å³å¾åº§èµ·ï¼Œæ•˜å…¶å¨å„€ã€‚	å››å³å¾åº§èµ·ï¼Œæ•˜å…¶å¨å„€ã€‚	007	Fourth, immediately rising from his seat, he describes his majestic manner.
['ZH_T38_1767_007:0076b17_8']	æ¬¡ã€Œè€Œç™½ä½›è¨€ã€ä¸‹ï¼Œè‡ªå’¨ç™¼è€…ï¼Œä½›é›–é€šå‹¸ï¼Œå¯§è¨±å•ä¸ï¼Ÿ	æ¬¡ã€Œè€Œç™½ä½›è¨€ã€ä¸‹ï¼Œè‡ªå’¨ç™¼è€…ï¼Œä½›é›–é€šå‹¸ï¼Œå¯§è¨±å•ä¸ï¼Ÿ	007	Next, below and said to the Buddha, the self-inquiry is: Although the Buddha generally encourages, how can he allow questions?
['ZH_T38_1767_007:0076b17_13']	æ˜¯æ•…æœ‰å’¨ã€‚	æ˜¯æ•…æœ‰å’¨ã€‚	007	Therefore, there is inquiry.
['ZH_T38_1767_007:0076b18_2']	æ¬¡ã€Œä½›å‘Šã€ä¸‹ï¼Œä½›è¨±ï¼Œå¦‚æ–‡ã€‚	æ¬¡ã€Œä½›å‘Šã€ä¸‹ï¼Œä½›è¨±ï¼Œå¦‚æ–‡ã€‚	007	Next, below the Buddha said, the Buddha's permission is as the text.
['ZH_T38_1767_007:0076b18_16']	ä¸‰å¾ã€Œçˆ¾æ™‚è¿¦è‘‰ã€å»ï¼Œæ˜¯è¬™å•ã€‚	ä¸‰å¾ã€Œçˆ¾æ™‚è¿¦è‘‰ã€å»ï¼Œæ˜¯è¬™å•ã€‚	007	Third, from at that time KÄÅ›yapa, it is the humble question.
['ZH_T38_1767_007:0076b18_20']	æ–‡ç‚ºä¸‰ï¼š	æ–‡ç‚ºä¸‰ï¼š	007	The text is in three parts:
['ZH_T38_1767_007:0076b19_18']	åˆå¤§å°ç‚ºä¸€é›™ã€æ¬¡é«˜å»£ç‚ºä¸€é›™ã€ä¸‰å€ŸåŠ©ç‚ºä¸€é›™ã€‚	åˆå¤§å°ç‚ºä¸€é›™ã€æ¬¡é«˜å»£ç‚ºä¸€é›™ã€ä¸‰å€ŸåŠ©ç‚ºä¸€é›™ã€‚	007	The first pair is about large and small, the next pair is about high and wide, and the last pair is about relying on assistance.
['ZH_T38_1767_007:0076b20_16']	åˆæ–‡è€…ï¼Œå¦‚ä¾†å“€æ†«å³å¤§æ…ˆæ‚²ï¼Œå¤§ä¸­ä¹‹å¤§ï¼›	åˆæ–‡è€…ï¼Œå¦‚ä¾†å“€æ†«å³å¤§æ…ˆæ‚²ï¼Œå¤§ä¸­ä¹‹å¤§ï¼›	007	In the first text, the TathÄgata's compassion is the great compassion, the greatest of the great;
['ZH_T38_1767_007:0076b21_8']	æˆ‘ä»¥èšŠèš‹å°æ™ºï¼Œå°ä¸­ä¹‹å°ã€‚	æˆ‘ä»¥èšŠèš‹å°æ™ºï¼Œå°ä¸­ä¹‹å°ã€‚	007	I have the small wisdom of a mosquito, the smallest of the small.
['ZH_T38_1767_007:0076b21_18']	ä»¥å°å•å¤§ï¼Œå¯§å¾—ç›¸ç¨±ï¼Ÿ	ä»¥å°å•å¤§ï¼Œå¯§å¾—ç›¸ç¨±ï¼Ÿ	007	Asking the great with the small, how can it be commensurate?
['ZH_T38_1767_007:0076b24_8']	æ¬¡é›™è€…ï¼Œä½›å¾·å·å·æ˜ä½›å¨é«˜ï¼Œå¸«å­é›£ä¼æ˜å…¶çœ¾å»£ï¼Œå¦‚ä¾†ä¹‹èº«çŒ¶çœŸé‡‘å‰›ï¼Œä½›è‰²å¤§æ•…æ™ºæ…§äº¦å¤§ï¼Œæ™ºæµ·åœç¹å‰‡å¤§çœ¾æ™ºå¤§ã€‚	æ¬¡é›™è€…ï¼Œä½›å¾·å·å·æ˜ä½›å¨é«˜ï¼Œå¸«å­é›£ä¼æ˜å…¶çœ¾å»£ï¼Œå¦‚ä¾†ä¹‹èº«çŒ¶çœŸé‡‘å‰›ï¼Œä½›è‰²å¤§æ•…æ™ºæ…§äº¦å¤§ï¼Œæ™ºæµ·åœç¹å‰‡å¤§çœ¾æ™ºå¤§ã€‚	007	In the second pair, the Buddha's virtues are lofty, indicating the greatness of the Buddha's dignity; the lion is difficult to subdue, indicating the vastness of the assembly. The TathÄgata's body is like true vajra, because the Buddha's appearance is great, his wisdom is also great. Surrounded by the ocean of wisdom, the great assembly's wisdom is great.
['ZH_T38_1767_007:0076b25_7']	ä½›åŠå¤§çœ¾é«˜å»£è‹¥æ–¯ï¼Œæˆ‘ä»¥èšŠèš‹ä½•èƒ½ç•¶æ­¤ï¼Ÿ	ä½›åŠå¤§çœ¾é«˜å»£è‹¥æ–¯ï¼Œæˆ‘ä»¥èšŠèš‹ä½•èƒ½ç•¶æ­¤ï¼Ÿ	007	The Buddha and the great assembly are high and wide like this, but I am like a mosquito, how can I bear this?
['ZH_T38_1767_007:0076b27_6']	ç¬¬ä¸‰é›™è€…ï¼Œè‹¥è«–å·¨ç´°ä¸è¨€è‡ªçµ•ï¼Œä»Šå‡ä½›å¨ç¥ã€å€ŸåŠ©æ™ºåŠ›å¤§çœ¾å–„æ ¹ï¼Œæ·»æˆ‘æ©Ÿè¾¯ä¹ƒèƒ½ç™¼å•ã€‚	ç¬¬ä¸‰é›™è€…ï¼Œè‹¥è«–å·¨ç´°ä¸è¨€è‡ªçµ•ï¼Œä»Šå‡ä½›å¨ç¥ã€å€ŸåŠ©æ™ºåŠ›å¤§çœ¾å–„æ ¹ï¼Œæ·»æˆ‘æ©Ÿè¾¯ä¹ƒèƒ½ç™¼å•ã€‚	007	In the third pair, if discussing the vast and the minute, it is self-evident. Now, borrowing the Buddha's majestic spiritual power, relying on the great wisdom and virtue of the great assembly, adding my eloquence, I can then ask questions.
['ZH_T38_1767_007:0076b27_19']	å››å¾ã€Œå³æ–¼ä½›å‰ã€ï¼Œæ˜¯æ­£å•ã€‚	å››å¾ã€Œå³æ–¼ä½›å‰ã€ï¼Œæ˜¯æ­£å•ã€‚	007	From then in front of the Buddha is the main question.
['ZH_T38_1767_007:0076b28_4']	èˆŠèªªä¸‰ç¨®ä¸åŒï¼š	èˆŠèªªä¸‰ç¨®ä¸åŒï¼š	007	The old explanations are not the same in three ways:
['ZH_T38_1767_007:0076b28_16']	ä¸€åˆ†åˆã€äºŒå•æ•¸ã€ä¸‰å› èµ·ã€‚	ä¸€åˆ†åˆã€äºŒå•æ•¸ã€ä¸‰å› èµ·ã€‚	007	One part is verses, two are questions and numbers, and three are causes and origins.
['ZH_T38_1767_007:0076b29_7']	åˆåˆ†åˆä¸åŒè€…ï¼Œæ²³è¥¿äº‘ï¼š	åˆåˆ†åˆä¸åŒè€…ï¼Œæ²³è¥¿äº‘ï¼š	007	As for the different parts of the verses, the Hexi says:
['ZH_T38_1767_007:0076b29_20']	å‰åä¹åˆæ˜¯å•ï¼Œå¾Œå››åˆè«‹ç­”ã€‚	å‰åä¹åˆæ˜¯å•ï¼Œå¾Œå››åˆè«‹ç­”ã€‚	007	The first nineteen verses are questions, and the last four verses request answers.
['ZH_T38_1767_007:0076c01_4']	åˆä¸€å¸«äº‘ï¼š	åˆä¸€å¸«äº‘ï¼š	007	Another teacher says:
['ZH_T38_1767_007:0076c01_18']	å‰äºŒåä¸€è¡Œæ˜¯å•ï¼Œå¾ŒäºŒè¡Œè‡ªè¬™ã€‚	å‰äºŒåä¸€è¡Œæ˜¯å•ï¼Œå¾ŒäºŒè¡Œè‡ªè¬™ã€‚	007	The first twenty-one lines are questions, and the last two lines are self-deprecating.
['ZH_T38_1767_007:0076c02_3']	åˆä¸€å¸«äº‘ï¼š	åˆä¸€å¸«äº‘ï¼š	007	Another teacher says:
['ZH_T38_1767_007:0076c02_12']	å¾å‰è‡³å¾Œç„¡éæ˜¯å•ã€‚	å¾å‰è‡³å¾Œç„¡éæ˜¯å•ã€‚	007	From the beginning to the end, there is nothing that is not a question.
['ZH_T38_1767_007:0076c02_17']	åˆä¸€å¸«äº‘ï¼š	åˆä¸€å¸«äº‘ï¼š	007	Another teacher says:
['ZH_T38_1767_007:0076c04_4']	å¾å®¹å…©å­˜ï¼Œå¾Œäº¦éå•ï¼Œä¹ƒæ˜¯è¿¦è‘‰å·§è‡´å•ä¹‹é¤˜å‹¢ï¼Œç‚ºè«¸å“ç”Ÿèµ·ã€‚	å¾å®¹å…©å­˜ï¼Œå¾Œäº¦éå•ï¼Œä¹ƒæ˜¯è¿¦è‘‰å·§è‡´å•ä¹‹é¤˜å‹¢ï¼Œç‚ºè«¸å“ç”Ÿèµ·ã€‚	007	Moderately preserving both, the end is also not a question, but it is KÄÅ›yapa's skillful remaining momentum in asking questions, which gives rise to the various chapters.
['ZH_T38_1767_007:0076c05_16']	åˆäº¦å¾—æ˜¯å•ç”šæ·±è¡Œç­‰æ˜¯å•äº”è¡Œåå¾·ï¼Œå®‰æ¨‚æ€§æ˜¯å•å¸«å­å¼è¿¦è‘‰ç­‰äº‘äº‘ã€‚	åˆäº¦å¾—æ˜¯å•ç”šæ·±è¡Œç­‰æ˜¯å•äº”è¡Œåå¾·ï¼Œå®‰æ¨‚æ€§æ˜¯å•å¸«å­å¼è¿¦è‘‰ç­‰äº‘äº‘ã€‚	007	It can also be said that asking about the profound practices and so forth is asking about the five practices and ten virtues, and the nature of bliss is asking about the lion's roar, KÄÅ›yapa, and so on.
['ZH_T38_1767_007:0076c06_11']	äºŒå•æ•¸ä¸åŒè€…ï¼Œæ¢æ­¦ä¸‰åäºŒå•ï¼›	äºŒå•æ•¸ä¸åŒè€…ï¼Œæ¢æ­¦ä¸‰åäºŒå•ï¼›	007	As for the different numbers of questions, Liang Wudi has thirty-two questions;
['ZH_T38_1767_007:0076c07_13']	æ²³è¥¿ä¸‰åå››å•ï¼Œéˆå‘³äº®ã€å†¶åŸç´ ã€èŠåš´æ—»ä¸¦ç”¨ä¹‹ï¼›	æ²³è¥¿ä¸‰åå››å•ï¼Œéˆå‘³äº®ã€å†¶åŸç´ ã€èŠåš´æ—»ä¸¦ç”¨ä¹‹ï¼›	007	Hexi has thirty-four questions, which Lingmi Liang, Yecheng Su, and Zhuangyan Min all use;
['ZH_T38_1767_007:0076c08_1']	ä¸­å¯ºå®‰ä¸‰åäº”å•ï¼›	ä¸­å¯ºå®‰ä¸‰åäº”å•ï¼›	007	Zhongsi An has thirty-five questions;
['ZH_T38_1767_007:0076c08_8']	é–‹å–„ä¸‰åå…­å•ï¼›	é–‹å–„ä¸‰åå…­å•ï¼›	007	Kaishan An has thirty-six questions;
['ZH_T38_1767_007:0076c08_15']	å…‰å®…ä¸‰åä¸ƒå•ã€‚	å…‰å®…ä¸‰åä¸ƒå•ã€‚	007	Guangzhai's thirty-seven questions.
['ZH_T38_1767_007:0076c09_6']	ä¸‰å› èµ·ä¸åŒè€…ï¼Œé–‹å–„äº‘ï¼š	ä¸‰å› èµ·ä¸åŒè€…ï¼Œé–‹å–„äº‘ï¼š	007	As for the three different causes of arising, Kaishan says:
['ZH_T38_1767_007:0076c09_18']	ä¸€ä¸€å•çš†å¾ç´”é™€å“€æ­ä¸­ç”Ÿã€‚	ä¸€ä¸€å•çš†å¾ç´”é™€å“€æ­ä¸­ç”Ÿã€‚	007	Each question arises from the lamentations of Cunda.
['ZH_T38_1767_007:0076c10_3']	å¤ªæ˜Œå®—äº‘ï¼š	å¤ªæ˜Œå®—äº‘ï¼š	007	Taichang Zong says:
['ZH_T38_1767_007:0076c10_17']	æ‚‰æ˜¯è‡¨æ™‚è‡´å•ï¼Œçš†ä¸å¾å‰æ–‡ç”Ÿã€‚	æ‚‰æ˜¯è‡¨æ™‚è‡´å•ï¼Œçš†ä¸å¾å‰æ–‡ç”Ÿã€‚	007	All are temporary questions, none arise from the previous text.
['ZH_T38_1767_007:0076c11_3']	éˆæ ¹ä»¤æ­£äº‘ï¼š	éˆæ ¹ä»¤æ­£äº‘ï¼š	007	Linggen Lingzheng says:
['ZH_T38_1767_007:0076c11_20']	æˆ–æœ‰å¾å‰ç”Ÿï¼Œæˆ–ä¸å¾å‰ç”Ÿï¼Œè±ˆå¯ä¸€ä¾‹ã€‚	æˆ–æœ‰å¾å‰ç”Ÿï¼Œæˆ–ä¸å¾å‰ç”Ÿï¼Œè±ˆå¯ä¸€ä¾‹ã€‚	007	Some arise from the previous, some do not arise from the previous, how can they be the same?
['ZH_T38_1767_007:0076c12_19']	å¾å‰ç”Ÿè€…ï¼Œäº‘ä½•å¾—é•·å£½å•ï¼Œå¾ã€ˆç´”é™€å“ã€‰ç”Ÿã€‚	å¾å‰ç”Ÿè€…ï¼Œäº‘ä½•å¾—é•·å£½å•ï¼Œå¾ã€ˆç´”é™€å“ã€‰ç”Ÿã€‚	007	As for those that arise from the previous, how does the question of attaining long life arise from the chapter on Cunda?
['ZH_T38_1767_007:0076c14_3']	ç•¶çŸ¥å¦‚ä¾†å³æ˜¯é•·å£½ï¼Œç”Ÿé‡‘å‰›èº«å•ï¼Œå¾æ³•èº«å¸¸èº«é‡‘å‰›èº«ç”Ÿã€‚	ç•¶çŸ¥å¦‚ä¾†å³æ˜¯é•·å£½ï¼Œç”Ÿé‡‘å‰›èº«å•ï¼Œå¾æ³•èº«å¸¸èº«é‡‘å‰›èº«ç”Ÿã€‚	007	Know that the TathÄgata is precisely long-lived, the question on the vajra body arises from the eternal body of the Dharma body and the vajra body.
['ZH_T38_1767_007:0076c14_20']	é¡˜ä½›é–‹å¾®å¯†ï¼Œå¾ã€Šå“€æ­å“ã€‹ç¥•å¯†è—ç”Ÿã€‚	é¡˜ä½›é–‹å¾®å¯†ï¼Œå¾ã€Šå“€æ­å“ã€‹ç¥•å¯†è—ç”Ÿã€‚	007	The Buddha opens the subtle and secret, arising from the secret treasury of the chapter on lamentations.
['ZH_T38_1767_007:0076c15_14']	äº‘ä½•å¾—å»£å¤§ï¼Œå¾è¿¦è‘‰ç‚ºçœ¾ä½œä¾æ­¢ç”Ÿã€‚	äº‘ä½•å¾—å»£å¤§ï¼Œå¾è¿¦è‘‰ç‚ºçœ¾ä½œä¾æ­¢ç”Ÿã€‚	007	How does one attain vastness, arising from KÄÅ›yapa becoming the support of the assembly?
['ZH_T38_1767_007:0076c16_4']	æœ‰å±¬ç•¶è€…å¯å¾ä¸Šç”Ÿã€‚	æœ‰å±¬ç•¶è€…å¯å¾ä¸Šç”Ÿã€‚	007	Those with a corresponding meaning can arise from above.
['ZH_T38_1767_007:0076c16_13']	ç„¡å±¬ç•¶è€…ä¸å¾ä¸Šç”Ÿã€‚	ç„¡å±¬ç•¶è€…ä¸å¾ä¸Šç”Ÿã€‚	007	Those without a corresponding meaning do not arise from above.
['ZH_T38_1767_007:0076c16_17']	èˆˆçš‡äº‘ï¼š	èˆˆçš‡äº‘ï¼š	007	Xinghuang says:
['ZH_T38_1767_007:0076c18_6']	æ­¤å•ä¸æ‡‰è¿‘è‡ªç´”é™€ï¼Œä¹ƒé€šè«–é‡‹è¿¦ä¸€åŒ–æ•™é–€å§‹è‡ªç‹å®®çµ‚ä¹é›™æ¨¹ã€‚	æ­¤å•ä¸æ‡‰è¿‘è‡ªç´”é™€ï¼Œä¹ƒé€šè«–é‡‹è¿¦ä¸€åŒ–æ•™é–€å§‹è‡ªç‹å®®çµ‚ä¹é›™æ¨¹ã€‚	007	This question should not be limited to Cunda alone, but should be discussed in a comprehensive way, starting from the royal palace to the twin trees, the teaching methods of Shakyamuni's teaching career.
['ZH_T38_1767_007:0076c18_9']	ä½•è€…ï¼Ÿ	ä½•è€…ï¼Ÿ	007	Why is it so?
['ZH_T38_1767_007:0076c19_3']	æ–‡äº‘ã€Œç”Ÿæ­»å¤§æµ·ä¸­ï¼Œäº‘ä½•ä½œèˆ¹å¸«ï¼Ÿ	æ–‡äº‘ã€Œç”Ÿæ­»å¤§æµ·ä¸­ï¼Œäº‘ä½•ä½œèˆ¹å¸«ï¼Ÿ	007	The text says, In the great ocean of birth and death, how does one become a boatman?
['ZH_T38_1767_007:0076c19_16']	ã€å³æ˜¯å•å§‹ï¼Œå³åˆæˆé“æ™‚äº‹ã€‚	ã€å³æ˜¯å•å§‹ï¼Œå³åˆæˆé“æ™‚äº‹ã€‚	007	This is asking about the beginning, the events at the time of first attaining enlightenment.
['ZH_T38_1767_007:0076c20_9']	å¾Œå•ã€Œäº‘ä½•æ¨ç”Ÿæ­»ï¼Œå¦‚è›‡è„«æ•…çš®ï¼Ÿ	å¾Œå•ã€Œäº‘ä½•æ¨ç”Ÿæ­»ï¼Œå¦‚è›‡è„«æ•…çš®ï¼Ÿ	007	Later it asks, How does one abandon birth and death, like a snake shedding its old skin?
['ZH_T38_1767_007:0076c21_2']	ã€æ­¤å³å•çµ‚ï¼Œæ˜¯æœ€å¾Œæ¶…æ§ƒæ™‚äº‹ã€‚	ã€æ­¤å³å•çµ‚ï¼Œæ˜¯æœ€å¾Œæ¶…æ§ƒæ™‚äº‹ã€‚	007	This is asking about the end, the events at the time of the final nirvana.
['ZH_T38_1767_007:0076c22_10']	ä¸­é–“æ–½åŒ–ï¼Œæ³•é–€éä¸€ï¼Œæ¬²é¡¯ç™¼å¦‚ä¾†æ–¹ä¾¿å¯†æ•™æ‡‰ä¾†æ‡‰å»ç¨®ç¨®ç¤ºç¾ã€‚	ä¸­é–“æ–½åŒ–ï¼Œæ³•é–€éä¸€ï¼Œæ¬²é¡¯ç™¼å¦‚ä¾†æ–¹ä¾¿å¯†æ•™æ‡‰ä¾†æ‡‰å»ç¨®ç¨®ç¤ºç¾ã€‚	007	In between, there are many different Dharma gates of skillful means, in order to reveal the Tathagata's expedient secret teachings, to come and go as appropriate, and to manifest in various ways.
['ZH_T38_1767_007:0076c23_10']	æ­¤æ„å®å£¯åŒ…ç¾…å»£å¤§ï¼Œå¤§æ˜è¦ºé“å›Šæ‹¬å¤ä»Šã€‚	æ­¤æ„å®å£¯åŒ…ç¾…å»£å¤§ï¼Œå¤§æ˜è¦ºé“å›Šæ‹¬å¤ä»Šã€‚	007	This intention is grand and vast, encompassing the ancient and modern.
