segmentnr	original	analyzed	translated
['ZH_T10_0294_003:0873c22_0']	åˆä½›åç„¡è«ï¼Œã€€ã€€ç¬¬äºŒç„¡ç¤™åŠ›ï¼Œ	åˆä½›åç„¡è«ï¼Œã€€ã€€ç¬¬äºŒç„¡ç¤™åŠ›ï¼Œ	The first Buddha was named No Dispute, the second was Unimpeded Power,
['ZH_T10_0294_003:0873c23_0']	ç¬¬ä¸‰æ³•ç•Œå…‰ï¼Œã€€ã€€ç¬¬å››æ¢µé«»ç‹ï¼Œ	ç¬¬ä¸‰æ³•ç•Œå…‰ï¼Œã€€ã€€ç¬¬å››æ¢µé«»ç‹ï¼Œ	The third was Dharma Realm Light, the fourth was Brahma-crest King,
['ZH_T10_0294_003:0873c24_0']	äº”æ³¢æ¨“é‚£å¤©ï¼Œã€€ã€€ç¬¬å…­çœ¾ç”Ÿæ­¸ï¼Œ	äº”æ³¢æ¨“é‚£å¤©ï¼Œã€€ã€€ç¬¬å…­çœ¾ç”Ÿæ­¸ï¼Œ	The fifth was Varuá¹‡a Deva, the sixth was Sentient Beings' Refuge,
['ZH_T10_0294_003:0873c25_0']	ä¸ƒåœ“æ»¿å¿ç‡ˆï¼Œã€€ã€€å…«å…·è¶³æ³•ç‡ˆï¼Œ	ä¸ƒåœ“æ»¿å¿ç‡ˆï¼Œã€€ã€€å…«å…·è¶³æ³•ç‡ˆï¼Œ	The seventh was Perfect Endurance Lamp, the eighth was Complete Dharma Lamp,
['ZH_T10_0294_003:0873c26_13']	ä¹å…‰æ˜åš´æµ·ï¼Œã€€ã€€ç¬¬åå¨ç¥ç‹ã€‚	ä¹å…‰æ˜åš´æµ·ï¼Œã€€ã€€ç¬¬åå¨ç¥ç‹ã€‚	The ninth was Light Adorned Ocean, the tenth was Majestic King.
['ZH_T10_0294_003:0873c27_0']	å¦‚æ˜¯ç­‰è«¸ä½›ï¼Œã€€ã€€æˆ‘çš†å·²ä¾›é¤Šï¼Œ	å¦‚æ˜¯ç­‰è«¸ä½›ï¼Œã€€ã€€æˆ‘çš†å·²ä¾›é¤Šï¼Œ	I have already made offerings to all these Buddhas,
['ZH_T10_0294_003:0873c28_13']	çŒ¶æœªè§£çœŸæ³•ï¼Œã€€ã€€éŠè¡Œä¸€åˆ‡å‰ã€‚	çŒ¶æœªè§£çœŸæ³•ï¼Œã€€ã€€éŠè¡Œä¸€åˆ‡å‰ã€‚	But still did not understand the true Dharma, wandering through all lands.
['ZH_T10_0294_003:0873c29_0']	æ¬¡ç¬¬å¾©æœ‰åŠ«ï¼Œã€€ã€€åæ›°é¦™ç‡ˆå‰ï¼Œ	æ¬¡ç¬¬å¾©æœ‰åŠ«ï¼Œã€€ã€€åæ›°é¦™ç‡ˆå‰ï¼Œ	Next, there was an eon named Fragrant Lamp Realm,
['ZH_T10_0294_003:0874a01_0']	çˆ¾æ™‚æœ‰ä¸–ç•Œï¼Œã€€ã€€åæ›°æ¸…æ·¨èµ·ï¼Œ	çˆ¾æ™‚æœ‰ä¸–ç•Œï¼Œã€€ã€€åæ›°æ¸…æ·¨èµ·ï¼Œ	At that time, there was a world called Pure Uprising,
['ZH_T10_0294_003:0874a02_0']	ä¸€å„„ä½›èˆˆä¸–ï¼Œã€€ã€€åš´æ·¨ä¸€åˆ‡åŠ«ï¼Œ	ä¸€å„„ä½›èˆˆä¸–ï¼Œã€€ã€€åš´æ·¨ä¸€åˆ‡åŠ«ï¼Œ	One billion buddhas appeared in the world, purifying the entire eon,
['ZH_T10_0294_003:0874a03_13']	å½¼ä½›æ‰€èªªæ³•ï¼Œã€€ã€€æˆ‘èæ‚‰å—æŒã€‚	å½¼ä½›æ‰€èªªæ³•ï¼Œã€€ã€€æˆ‘èæ‚‰å—æŒã€‚	The Dharma spoken by those buddhas, I heard and fully upheld.
['ZH_T10_0294_003:0874a04_0']	åˆåæ³•ç¨±ç‹ï¼Œã€€ã€€äºŒåæ³•èº«æµ·ï¼Œ	åˆåæ³•ç¨±ç‹ï¼Œã€€ã€€äºŒåæ³•èº«æµ·ï¼Œ	The first was named Dharma-Praised King, the second was named Dharma-Body Ocean,
['ZH_T10_0294_003:0874a05_0']	ä¸‰åå‹‡çŒ›é ‚ï¼Œã€€ã€€å››åŠŸå¾·æ³•ç‹ï¼Œ	ä¸‰åå‹‡çŒ›é ‚ï¼Œã€€ã€€å››åŠŸå¾·æ³•ç‹ï¼Œ	The third was named Courageous Peak, the fourth was named Meritorious Dharma King,
['ZH_T10_0294_003:0874a06_0']	ç¬¬äº”å‹æ³•é›²ï¼Œã€€ã€€å…­åå¤©é¦–å† ï¼Œ	ç¬¬äº”å‹æ³•é›²ï¼Œã€€ã€€å…­åå¤©é¦–å† ï¼Œ	The fifth was named Supreme Dharma Cloud, the sixth was named Heavenly Crown,
['ZH_T10_0294_003:0874a07_0']	ç¬¬ä¸ƒæ™ºç‚ä½›ï¼Œã€€ã€€å…«åè™›ç©ºåŠ›ï¼Œ	ç¬¬ä¸ƒæ™ºç‚ä½›ï¼Œã€€ã€€å…«åè™›ç©ºåŠ›ï¼Œ	The seventh was named Wisdom-Flame Buddha, the eighth was named Space Power,
['ZH_T10_0294_003:0874a08_13']	ä¹åæ™®å‹èµ·ï¼Œã€€ã€€ååå¦™å¾·é¦–ã€‚	ä¹åæ™®å‹èµ·ï¼Œã€€ã€€ååå¦™å¾·é¦–ã€‚	The ninth was named Universal Victory Uprising, the tenth was named Wonderful Virtue Peak.
['ZH_T10_0294_003:0874a09_13']	ä¾›é¤Šå½¼ä½›å·²ï¼Œã€€ã€€æˆå°±å…«æ­£é“ã€‚	ä¾›é¤Šå½¼ä½›å·²ï¼Œã€€ã€€æˆå°±å…«æ­£é“ã€‚	Having made offerings to those buddhas, I accomplished the eightfold right path.
['ZH_T10_0294_003:0874a10_0']	æ¬¡ç¬¬å¾©æœ‰åŠ«ï¼Œã€€ã€€åæ˜æ·¨é‡‘å‰›ï¼Œ	æ¬¡ç¬¬å¾©æœ‰åŠ«ï¼Œã€€ã€€åæ˜æ·¨é‡‘å‰›ï¼Œ	Next, there was an eon named Adamantine Pure Light,
['ZH_T10_0294_003:0874a11_0']	çˆ¾æ™‚æœ‰ä¸–ç•Œï¼Œã€€ã€€åæ›°å¯¶å¹¢ä¸»ï¼Œ	çˆ¾æ™‚æœ‰ä¸–ç•Œï¼Œã€€ã€€åæ›°å¯¶å¹¢ä¸»ï¼Œ	At that time, there was a world called Jewel Banner Sovereign,
['ZH_T10_0294_003:0874a12_0']	äº”ç™¾ä½›èˆˆä¸–ï¼Œã€€ã€€å½¼è«¸å¦‚ä¾†ç­‰ï¼Œ	äº”ç™¾ä½›èˆˆä¸–ï¼Œã€€ã€€å½¼è«¸å¦‚ä¾†ç­‰ï¼Œ	Five hundred buddhas appeared in the world, those tathÄgatas,
['ZH_T10_0294_003:0874a13_13']	æˆ‘çš†å·²ä¾›é¤Šï¼Œã€€ã€€æ±‚ç„¡ç¤™æ³•é–€ã€‚	æˆ‘çš†å·²ä¾›é¤Šï¼Œã€€ã€€æ±‚ç„¡ç¤™æ³•é–€ã€‚	I have all made offerings to them, seeking unobstructed Dharma gates.
['ZH_T10_0294_003:0874a14_0']	åˆååœ“æ»¿å¾·ï¼Œã€€ã€€ç¬¬äºŒå¯‚ç„¶éŸ³ï¼Œ	åˆååœ“æ»¿å¾·ï¼Œã€€ã€€ç¬¬äºŒå¯‚ç„¶éŸ³ï¼Œ	The first is named Perfect Virtue, the second is Silent Sound,
['ZH_T10_0294_003:0874a15_0']	ç¬¬ä¸‰åŠŸå¾·æµ·ï¼Œã€€ã€€å››æ›°å¨ç¥ç‹ï¼Œ	ç¬¬ä¸‰åŠŸå¾·æµ·ï¼Œã€€ã€€å››æ›°å¨ç¥ç‹ï¼Œ	The third is Ocean of Merits, the fourth is Majestic King,
['ZH_T10_0294_003:0874a16_0']	ç¬¬äº”æ³•æœ€ç‹ï¼Œã€€ã€€å…­åé ˆå½Œç›¸ï¼Œ	ç¬¬äº”æ³•æœ€ç‹ï¼Œã€€ã€€å…­åé ˆå½Œç›¸ï¼Œ	The fifth is Dharma Supreme King, the sixth is Mount Sumeru Appearance,
['ZH_T10_0294_003:0874a17_0']	ç¬¬ä¸ƒåæ³•ç‹ï¼Œã€€ã€€ç¬¬å…«åŠŸå¾·ç‹ï¼Œ	ç¬¬ä¸ƒåæ³•ç‹ï¼Œã€€ã€€ç¬¬å…«åŠŸå¾·ç‹ï¼Œ	The seventh is named Dharma King, the eighth is Meritorious King,
['ZH_T10_0294_003:0874a18_13']	ç¬¬ä¹åŠŸå¾·å±±ï¼Œã€€ã€€ç¬¬åå…‰æ˜ç‹ã€‚	ç¬¬ä¹åŠŸå¾·å±±ï¼Œã€€ã€€ç¬¬åå…‰æ˜ç‹ã€‚	The ninth is Meritorious Mountain, the tenth is Light King.
['ZH_T10_0294_003:0874a19_0']	å¦‚æ˜¯ç­‰è«¸ä½›ï¼Œã€€ã€€æˆ‘å·²æ‚‰ä¾›é¤Šï¼Œ	å¦‚æ˜¯ç­‰è«¸ä½›ï¼Œã€€ã€€æˆ‘å·²æ‚‰ä¾›é¤Šï¼Œ	Such Buddhas, I have all made offerings to them,
['ZH_T10_0294_003:0874a20_0']	æˆ‘çš†æ‚‰åš´æ·¨ï¼Œã€€ã€€ä¸€åˆ‡æœ€å‹é“ï¼Œ	æˆ‘çš†æ‚‰åš´æ·¨ï¼Œã€€ã€€ä¸€åˆ‡æœ€å‹é“ï¼Œ	I have all fully purified the supreme path,
['ZH_T10_0294_003:0874a21_13']	çŒ¶æœªå¾—å…·è¶³ï¼Œã€€ã€€ç©¶ç«Ÿæ·±æ³•å¿ã€‚	çŒ¶æœªå¾—å…·è¶³ï¼Œã€€ã€€ç©¶ç«Ÿæ·±æ³•å¿ã€‚	But still have not attained the ultimate profound Dharma forbearance.
['ZH_T10_0294_003:0874a22_0']	æ¬¡ç¬¬å¾©æœ‰åŠ«ï¼Œã€€ã€€åæ›°å‹ç¨±éŸ³ï¼Œ	æ¬¡ç¬¬å¾©æœ‰åŠ«ï¼Œã€€ã€€åæ›°å‹ç¨±éŸ³ï¼Œ	In sequence there was another eon, named the Sound of Supreme Renown,
['ZH_T10_0294_003:0874a23_0']	çˆ¾æ™‚æœ‰ä¸–ç•Œï¼Œã€€ã€€åæ›°å¯‚éœéŸ³ï¼Œ	çˆ¾æ™‚æœ‰ä¸–ç•Œï¼Œã€€ã€€åæ›°å¯‚éœéŸ³ï¼Œ	At that time there was a world called Sound of Tranquility,
['ZH_T10_0294_003:0874a24_0']	å…«åé‚£ç”±ä»–ï¼Œã€€ã€€è«¸ä½›èˆˆå‡ºä¸–ï¼Œ	å…«åé‚£ç”±ä»–ï¼Œã€€ã€€è«¸ä½›èˆˆå‡ºä¸–ï¼Œ	Eighty koá¹­Ä«s of Buddhas appeared in the world,
['ZH_T10_0294_003:0874a25_13']	æˆ‘å·²æ‚‰ä¾›é¤Šï¼Œã€€ã€€æ–¼å½¼ä¿®æ­£é“ã€‚	æˆ‘å·²æ‚‰ä¾›é¤Šï¼Œã€€ã€€æ–¼å½¼ä¿®æ­£é“ã€‚	I have all made offerings to them, cultivating the right path there.
['ZH_T10_0294_003:0874a26_0']	åˆä½›è™Ÿè¯èšï¼Œã€€ã€€ç¬¬äºŒæµ·è—ä½›ï¼Œ	åˆä½›è™Ÿè¯èšï¼Œã€€ã€€ç¬¬äºŒæµ·è—ä½›ï¼Œ	The first Buddha was called Flower Cluster, the second was Ocean Treasury Buddha,
['ZH_T10_0294_003:0874a27_0']	ç¬¬ä¸‰åŠŸå¾·èµ·ï¼Œã€€ã€€ç¬¬å››å¤©å‘¨ç¾…ï¼Œ	ç¬¬ä¸‰åŠŸå¾·èµ·ï¼Œã€€ã€€ç¬¬å››å¤©å‘¨ç¾…ï¼Œ	The third was Merit Arising, the fourth was Heavenly Garland,
['ZH_T10_0294_003:0874a28_0']	ç¬¬äº”æ‘©å°¼è—ï¼Œã€€ã€€å…­è™Ÿé‡‘å±±ç‹ï¼Œ	ç¬¬äº”æ‘©å°¼è—ï¼Œã€€ã€€å…­è™Ÿé‡‘å±±ç‹ï¼Œ	The fifth was Jewel Treasury, the sixth was called Golden Mountain King,
['ZH_T10_0294_003:0874a29_0']	ç¬¬ä¸ƒå¯¶èšä½›ï¼Œã€€ã€€ç¬¬å…«å¯‚éœå¹¢ï¼Œ	ç¬¬ä¸ƒå¯¶èšä½›ï¼Œã€€ã€€ç¬¬å…«å¯‚éœå¹¢ï¼Œ	The seventh Buddha was Jewel Cluster, the eighth was Silent Banner,
['ZH_T10_0294_003:0874b01_13']	ç¬¬ä¹æ³•å¹¢ä½›ï¼Œã€€ã€€ç¬¬åè™Ÿè²¡é¦–ã€‚	ç¬¬ä¹æ³•å¹¢ä½›ï¼Œã€€ã€€ç¬¬åè™Ÿè²¡é¦–ã€‚	The ninth was Dharma Banner Buddha, the tenth was called Wealth Chief.
['ZH_T10_0294_003:0874b02_13']	å¦‚æ˜¯ç­‰è«¸ä½›ï¼Œã€€ã€€æˆ‘å·²æ‚‰ä¾›é¤Šã€‚	å¦‚æ˜¯ç­‰è«¸ä½›ï¼Œã€€ã€€æˆ‘å·²æ‚‰ä¾›é¤Šã€‚	I have already made offerings to all these Buddhas.
['ZH_T10_0294_003:0874b03_0']	æ¬¡ç¬¬å¾©æœ‰åŠ«ï¼Œã€€ã€€ååƒé¦–åŠŸå¾·ï¼Œ	æ¬¡ç¬¬å¾©æœ‰åŠ«ï¼Œã€€ã€€ååƒé¦–åŠŸå¾·ï¼Œ	In the next eon, called Thousand-Peaked Merits,
['ZH_T10_0294_003:0874b04_0']	çˆ¾æ™‚æœ‰ä¸–ç•Œï¼Œã€€ã€€åæ›°å–„èŠ±ç‡ˆï¼Œ	çˆ¾æ™‚æœ‰ä¸–ç•Œï¼Œã€€ã€€åæ›°å–„èŠ±ç‡ˆï¼Œ	At that time there was a world called Good Flower Lamp,
['ZH_T10_0294_003:0874b05_0']	å…­å„„é‚£ç”±ä»–ï¼Œã€€ã€€è«¸ä½›èˆˆå‡ºä¸–ï¼Œ	å…­å„„é‚£ç”±ä»–ï¼Œã€€ã€€è«¸ä½›èˆˆå‡ºä¸–ï¼Œ	In which six koá¹­Ä«s nayutas of Buddhas appeared in the world,
['ZH_T10_0294_003:0874b06_13']	æˆ‘å·²æ›¾ä¾›é¤Šï¼Œã€€ã€€å½¼ä¸€åˆ‡è«¸ä½›ã€‚	æˆ‘å·²æ›¾ä¾›é¤Šï¼Œã€€ã€€å½¼ä¸€åˆ‡è«¸ä½›ã€‚	I have already made offerings to all those Buddhas.
['ZH_T10_0294_003:0874b07_0']	åˆä½›å¯‚éœå¹¢ï¼Œã€€ã€€ç¬¬äºŒæ™ºå°ç‹ï¼Œ	åˆä½›å¯‚éœå¹¢ï¼Œã€€ã€€ç¬¬äºŒæ™ºå°ç‹ï¼Œ	The first Buddha was Silent Banner, the second was Wisdom Seal King,
['ZH_T10_0294_003:0874b08_0']	ç¬¬ä¸‰è™Ÿç™¾ç‡ˆï¼Œã€€ã€€å››åŠŸå¾·é›²ç‹ï¼Œ	ç¬¬ä¸‰è™Ÿç™¾ç‡ˆï¼Œã€€ã€€å››åŠŸå¾·é›²ç‹ï¼Œ	The third was called Hundred Lamps, the fourth was Merit Cloud King,
['ZH_T10_0294_003:0874b09_0']	å¯‚éœå…‰æ˜ç‹ï¼Œã€€ã€€ç¬¬å…­æ˜æ·¨æ—¥ï¼Œ	å¯‚éœå…‰æ˜ç‹ï¼Œã€€ã€€ç¬¬å…­æ˜æ·¨æ—¥ï¼Œ	Silent Illumination King, the sixth was Pure Light Sun,
['ZH_T10_0294_003:0874b10_0']	ç¬¬ä¸ƒæ³•ç‡ˆç‹ï¼Œã€€ã€€å…«åŠŸå¾·é¦–ç‹ï¼Œ	ç¬¬ä¸ƒæ³•ç‡ˆç‹ï¼Œã€€ã€€å…«åŠŸå¾·é¦–ç‹ï¼Œ	The seventh was Dharma Lamp King, the eighth was Eight Merits Chief King,
['ZH_T10_0294_003:0874b11_13']	ä¹å¤©åŠŸå¾·è—ï¼Œã€€ã€€åæ™ºæ…§é›²é›·ã€‚	ä¹å¤©åŠŸå¾·è—ï¼Œã€€ã€€åæ™ºæ…§é›²é›·ã€‚	The ninth was Heavenly Merits Treasury, and the tenth was Wisdom Cloud Thunder.
['ZH_T10_0294_003:0874b12_0']	å¦‚æ˜¯ç­‰è«¸ä½›ï¼Œã€€ã€€æˆ‘çš†å·²ä¾›é¤Šï¼Œ	å¦‚æ˜¯ç­‰è«¸ä½›ï¼Œã€€ã€€æˆ‘çš†å·²ä¾›é¤Šï¼Œ	I have made offerings to all these Buddhas,
['ZH_T10_0294_003:0874b13_13']	æœªå¾—ç„¡ç”Ÿå¿ï¼Œã€€ã€€ç©¶ç«Ÿè«¸æ³•é–€ã€‚	æœªå¾—ç„¡ç”Ÿå¿ï¼Œã€€ã€€ç©¶ç«Ÿè«¸æ³•é–€ã€‚	But have not yet attained the forbearance of non-arising, or perfected all Dharma gates.
['ZH_T10_0294_003:0874b14_0']	æ¬¡ç¬¬å¾©æœ‰åŠ«ï¼Œã€€ã€€åç„¡è‘—å…‰ç‚ï¼Œ	æ¬¡ç¬¬å¾©æœ‰åŠ«ï¼Œã€€ã€€åç„¡è‘—å…‰ç‚ï¼Œ	Next, there was an eon called Unattached Light and Flame,
['ZH_T10_0294_003:0874b15_0']	çˆ¾æ™‚æœ‰ä¸–ç•Œï¼Œã€€ã€€åç„¡é‡å‹å…‰ï¼Œ	çˆ¾æ™‚æœ‰ä¸–ç•Œï¼Œã€€ã€€åç„¡é‡å‹å…‰ï¼Œ	At that time, there was a world called Immeasurable Supreme Light,
['ZH_T10_0294_003:0874b16_0']	æœ‰ä¸‰åå…­å„„ï¼Œã€€ã€€é‚£ç”±ä»–ä½›å‡ºï¼Œ	æœ‰ä¸‰åå…­å„„ï¼Œã€€ã€€é‚£ç”±ä»–ä½›å‡ºï¼Œ	In which thirty-six koá¹­Ä«s of nayutas of Buddhas appeared,
['ZH_T10_0294_003:0874b17_13']	å¦‚æ˜¯ç­‰è«¸ä½›ï¼Œã€€ã€€æˆ‘çš†å·²ä¾›é¤Šã€‚	å¦‚æ˜¯ç­‰è«¸ä½›ï¼Œã€€ã€€æˆ‘çš†å·²ä¾›é¤Šã€‚	To all these Buddhas, I have made offerings.
['ZH_T10_0294_003:0874b18_0']	åˆè™Ÿæ™®å±±ç‹ï¼Œã€€ã€€ç¬¬äºŒè™›ç©ºå¿ƒï¼Œ	åˆè™Ÿæ™®å±±ç‹ï¼Œã€€ã€€ç¬¬äºŒè™›ç©ºå¿ƒï¼Œ	The first was called Universal Mountain King, the second was Space Mind,
['ZH_T10_0294_003:0874b19_0']	ç¬¬ä¸‰è™Ÿé›†æ™ºï¼Œã€€ã€€ç¬¬å››èŠåš´è—ï¼Œ	ç¬¬ä¸‰è™Ÿé›†æ™ºï¼Œã€€ã€€ç¬¬å››èŠåš´è—ï¼Œ	The third was called Accumulated Wisdom, the fourth was Adorned Treasury,
['ZH_T10_0294_003:0874b20_0']	ç¬¬äº”æ³•æµ·éŸ³ï¼Œã€€ã€€ç¬¬å…­æŒéŸ³è²ï¼Œ	ç¬¬äº”æ³•æµ·éŸ³ï¼Œã€€ã€€ç¬¬å…­æŒéŸ³è²ï¼Œ	The fifth was Dharma Ocean Sound, the sixth was Sound-Holding,
['ZH_T10_0294_003:0874b21_0']	ç¬¬ä¸ƒåŒ–éŸ³è²ï¼Œã€€ã€€ç¬¬å…«åŒ–é›²æµ·ï¼Œ	ç¬¬ä¸ƒåŒ–éŸ³è²ï¼Œã€€ã€€ç¬¬å…«åŒ–é›²æµ·ï¼Œ	The seventh was Emanation Sound, the eighth was Emanation Cloud Ocean,
['ZH_T10_0294_003:0874b22_0']	ä¹åŠŸå¾·éŸ³æµ·ï¼Œã€€ã€€ç¬¬åå¦™éŸ³å¹¢ï¼Œ	ä¹åŠŸå¾·éŸ³æµ·ï¼Œã€€ã€€ç¬¬åå¦™éŸ³å¹¢ï¼Œ	The ninth was Merits Sound Ocean, and the tenth was Wonderful Sound Banner,
['ZH_T10_0294_003:0874b23_0']	åä¸€æ™®å¨å¾·ï¼Œã€€ã€€ç¬¬åäºŒæ³•æµ·ï¼Œ	åä¸€æ™®å¨å¾·ï¼Œã€€ã€€ç¬¬åäºŒæ³•æµ·ï¼Œ	Eleventh, Universal Majestic Virtue, twelfth, Ocean of Dharma,
['ZH_T10_0294_003:0874b24_0']	åä¸‰é›†éŸ³è²ï¼Œã€€ã€€åå››åŠŸå¾·æµ·ï¼Œ	åä¸‰é›†éŸ³è²ï¼Œã€€ã€€åå››åŠŸå¾·æµ·ï¼Œ	Thirteenth, Gathering of Sounds, fourteenth, Ocean of Merits,
['ZH_T10_0294_003:0874b25_0']	åäº”ç‡ˆæ˜é¦–ï¼Œã€€ã€€åå…­å¯¶ç‚é¦–ï¼Œ	åäº”ç‡ˆæ˜é¦–ï¼Œã€€ã€€åå…­å¯¶ç‚é¦–ï¼Œ	Fifteenth, Foremost Lamp Light, sixteenth, Foremost Jewel Flame,
['ZH_T10_0294_003:0874b26_0']	åä¸ƒç‡ˆæ˜ä½›ï¼Œã€€ã€€åå…«åŠŸå¾·ç‚ï¼Œ	åä¸ƒç‡ˆæ˜ä½›ï¼Œã€€ã€€åå…«åŠŸå¾·ç‚ï¼Œ	Seventeenth, Buddha Lamp Light, eighteenth, Meritorious Flame,
['ZH_T10_0294_003:0874b27_13']	åä¹æœˆå¤©ä½›ï¼Œã€€ã€€äºŒååŠŸå¾·å‹ã€‚	åä¹æœˆå¤©ä½›ï¼Œã€€ã€€äºŒååŠŸå¾·å‹ã€‚	Nineteenth, Moon Deity Buddha, twentieth, Meritorious Excellence.
['ZH_T10_0294_003:0874b28_13']	å½¼è«¸å¦‚ä¾†ç­‰ï¼Œã€€ã€€æˆ‘çš†å¾—å€¼é‡ã€‚	å½¼è«¸å¦‚ä¾†ç­‰ï¼Œã€€ã€€æˆ‘çš†å¾—å€¼é‡ã€‚	I have encountered all those Thus Come Ones.
['ZH_T10_0294_003:0874b29_0']	å½¼å…©è¶³ä¸–å°Šï¼Œã€€ã€€å‡ºèˆˆæ–¼ä¸–æ™‚ï¼Œ	å½¼å…©è¶³ä¸–å°Šï¼Œã€€ã€€å‡ºèˆˆæ–¼ä¸–æ™‚ï¼Œ	When those World Honored Ones with two feet appeared in the world,
['ZH_T10_0294_003:0874c01_13']	æˆ‘ç‚ºåŠŸå¾·å¤©ï¼Œã€€ã€€ä¾›é¤Šå½¼æœ€å‹ã€‚	æˆ‘ç‚ºåŠŸå¾·å¤©ï¼Œã€€ã€€ä¾›é¤Šå½¼æœ€å‹ã€‚	I became the Goddess of Merits and made offerings to that most excellent one.
['ZH_T10_0294_003:0874c02_0']	æ™‚ä½›ç‚ºæˆ‘èªªï¼Œã€€ã€€èŠåš´å¤§æµ·é¡˜ï¼Œ	æ™‚ä½›ç‚ºæˆ‘èªªï¼Œã€€ã€€èŠåš´å¤§æµ·é¡˜ï¼Œ	At that time, the Buddha spoke to me the vow to adorn the great ocean,
['ZH_T10_0294_003:0874c03_13']	é™€ç¾…å°¼å¿µåŠ›ï¼Œã€€ã€€çš†æ‚‰èƒ½å—æŒã€‚	é™€ç¾…å°¼å¿µåŠ›ï¼Œã€€ã€€çš†æ‚‰èƒ½å—æŒã€‚	The power of dhÄraá¹‡Ä« and mindfulness, all of which I was able to uphold.
['ZH_T10_0294_003:0874c04_0']	æˆ‘å¾—æ˜æ·¨çœ¼ï¼Œã€€ã€€ä¸‰æ˜§é™€ç¾…å°¼ï¼Œ	æˆ‘å¾—æ˜æ·¨çœ¼ï¼Œã€€ã€€ä¸‰æ˜§é™€ç¾…å°¼ï¼Œ	I attained the eye of clear and pure light, samÄdhi and dhÄraá¹‡Ä«,
['ZH_T10_0294_003:0874c05_0']	æ–¼ä¸€ä¸€å¿µä¸­ï¼Œã€€ã€€æ‚‰è¦‹ç„¡æ•¸å‰ï¼Œ	æ–¼ä¸€ä¸€å¿µä¸­ï¼Œã€€ã€€æ‚‰è¦‹ç„¡æ•¸å‰ï¼Œ	In each and every thought, I saw countless lands,
['ZH_T10_0294_003:0874c06_0']	å‡ºç”Ÿå¤§æ‚²è—ï¼Œã€€ã€€æ·±å…¥æ–¹ä¾¿é›²ï¼Œ	å‡ºç”Ÿå¤§æ‚²è—ï¼Œã€€ã€€æ·±å…¥æ–¹ä¾¿é›²ï¼Œ	Giving rise to the treasury of great compassion, deeply entering the cloud of skillful means,
['ZH_T10_0294_003:0874c07_13']	å¿ƒæ·¨å¦‚è™›ç©ºï¼Œã€€ã€€çš†å¾å¤¢ä¸­ç”Ÿã€‚	å¿ƒæ·¨å¦‚è™›ç©ºï¼Œã€€ã€€çš†å¾å¤¢ä¸­ç”Ÿã€‚	The mind is pure like space, all arising from dreams.
['ZH_T10_0294_003:0874c08_0']	å§‹ç™¼è©æå¿ƒï¼Œã€€ã€€å»£å¤§å¦‚è™›ç©ºï¼Œ	å§‹ç™¼è©æå¿ƒï¼Œã€€ã€€å»£å¤§å¦‚è™›ç©ºï¼Œ	First giving rise to the mind of enlightenment, vast like space,
['ZH_T10_0294_003:0874c09_13']	ç©¶ç«Ÿç„¡é‚Šéš›ï¼Œã€€ã€€ç‚ºåº¦çœ¾ç”Ÿæ•…ã€‚	ç©¶ç«Ÿç„¡é‚Šéš›ï¼Œã€€ã€€ç‚ºåº¦çœ¾ç”Ÿæ•…ã€‚	Ultimately boundless, in order to liberate sentient beings.
['ZH_T10_0294_003:0874c10_0']	ç›¡æœªä¾†éš›åŠ«ï¼Œã€€ã€€é¡˜æ±‚è«¸ä½›åŠ›ï¼Œ	ç›¡æœªä¾†éš›åŠ«ï¼Œã€€ã€€é¡˜æ±‚è«¸ä½›åŠ›ï¼Œ	Exhausting future eons, vowing to seek the Buddha's power,
['ZH_T10_0294_003:0874c11_0']	è§€å¯Ÿè«¸çœ¾ç”Ÿï¼Œã€€ã€€å¸¸æ¨‚æˆ‘æ·¨å€’ï¼Œ	è§€å¯Ÿè«¸çœ¾ç”Ÿï¼Œã€€ã€€å¸¸æ¨‚æˆ‘æ·¨å€’ï¼Œ	Observing sentient beings, always attached to self, purity,
['ZH_T10_0294_003:0874c12_0']	æ„šç™¡é—‡æ‰€è¦†ï¼Œã€€ã€€ç…©æƒ±èµ·è™›å¦„ï¼Œ	æ„šç™¡é—‡æ‰€è¦†ï¼Œã€€ã€€ç…©æƒ±èµ·è™›å¦„ï¼Œ	Covered by the darkness of ignorance, afflictions giving rise to falsehood,
['ZH_T10_0294_003:0874c13_0']	é‚ªè¦‹è²ªæ¬²ç­‰ï¼Œã€€ã€€ç„¡é‡è«¸æƒ¡æ¥­ï¼Œ	é‚ªè¦‹è²ªæ¬²ç­‰ï¼Œã€€ã€€ç„¡é‡è«¸æƒ¡æ¥­ï¼Œ	Wrong views, greed, and desire, immeasurable evil karma,
['ZH_T10_0294_003:0874c14_0']	ä¸€åˆ‡è«¸è¶£ä¸­ï¼Œã€€ã€€å…·å—ä¸å–„å ±ï¼Œ	ä¸€åˆ‡è«¸è¶£ä¸­ï¼Œã€€ã€€å…·å—ä¸å–„å ±ï¼Œ	In all destinies, fully receiving the retribution of unwholesomeness,
['ZH_T10_0294_003:0874c15_0']	ä¸€åˆ‡è«¸è¶£ä¸­ï¼Œã€€ã€€ç¨®ç¨®æ¥­å—èº«ï¼Œ	ä¸€åˆ‡è«¸è¶£ä¸­ï¼Œã€€ã€€ç¨®ç¨®æ¥­å—èº«ï¼Œ	In all destinies, various karmas receiving bodies,
['ZH_T10_0294_003:0874c16_13']	ç”Ÿè€ç—…æ­»æ‚£ï¼Œã€€ã€€ç„¡é‡è‹¦é€¼è¿«ã€‚	ç”Ÿè€ç—…æ­»æ‚£ï¼Œã€€ã€€ç„¡é‡è‹¦é€¼è¿«ã€‚	Birth, old age, sickness, and death, immeasurable suffering oppressing.
['ZH_T10_0294_003:0874c17_0']	æˆ‘ç™¼ç„¡ä¸Šå¿ƒï¼Œã€€ã€€å®‰æ¨‚è«¸çœ¾ç”Ÿï¼Œ	æˆ‘ç™¼ç„¡ä¸Šå¿ƒï¼Œã€€ã€€å®‰æ¨‚è«¸çœ¾ç”Ÿï¼Œ	I give rise to the unsurpassed mind, to bring peace and happiness to all beings,
['ZH_T10_0294_003:0874c18_0']	ä»¤è‡³è«¸ä½›æ‰€ï¼Œã€€ã€€æˆæ»¿å¦‚ä¾†åŠ›ï¼Œ	ä»¤è‡³è«¸ä½›æ‰€ï¼Œã€€ã€€æˆæ»¿å¦‚ä¾†åŠ›ï¼Œ	To enable them to reach the buddhas and fulfill the TathÄgata's power,
['ZH_T10_0294_003:0874c19_0']	æ»¿è¶³å¤§é¡˜é›²ï¼Œã€€ã€€å¸¸è¦‹ä¸€åˆ‡ä½›ï¼Œ	æ»¿è¶³å¤§é¡˜é›²ï¼Œã€€ã€€å¸¸è¦‹ä¸€åˆ‡ä½›ï¼Œ	Fulfilling the great vow-clouds, always seeing all buddhas,
['ZH_T10_0294_003:0874c20_13']	ä¿®ç¿’æ–¼æ­£é“ï¼Œã€€ã€€å…·è¶³è«¸åŠŸå¾·ã€‚	ä¿®ç¿’æ–¼æ­£é“ï¼Œã€€ã€€å…·è¶³è«¸åŠŸå¾·ã€‚	Cultivating the true path, replete with all merits.
['ZH_T10_0294_003:0874c21_0']	ä¸€å‘å»£å°ˆæ±‚ï¼Œã€€ã€€ç„¡é‡åŠŸå¾·é›²ï¼Œ	ä¸€å‘å»£å°ˆæ±‚ï¼Œã€€ã€€ç„¡é‡åŠŸå¾·é›²ï¼Œ	Single-mindedly seeking the boundless cloud of merits,
['ZH_T10_0294_003:0874c22_0']	ç¾…æ‘©ä¼½ä¸‰æ˜§ï¼Œã€€ã€€å……æ»¿è«¸æ³•ç•Œï¼Œ	ç¾…æ‘©ä¼½ä¸‰æ˜§ï¼Œã€€ã€€å……æ»¿è«¸æ³•ç•Œï¼Œ	The RÄma-gÄthÄ samÄdhi fills the Dharma realm,
['ZH_T10_0294_003:0874c23_0']	å»£å¤§æ³¢ç¾…èœœï¼Œã€€ã€€è²èåæ–¹å‰ï¼Œ	å»£å¤§æ³¢ç¾…èœœï¼Œã€€ã€€è²èåæ–¹å‰ï¼Œ	The vast pÄramitÄs heard in the lands of the ten directions,
['ZH_T10_0294_003:0874c24_0']	ä¸€åˆ‡è«¸ä½›æ‰€ï¼Œã€€ã€€èæ­¤ç¾…æ‘©ä¼½ï¼Œ	ä¸€åˆ‡è«¸ä½›æ‰€ï¼Œã€€ã€€èæ­¤ç¾…æ‘©ä¼½ï¼Œ	In the presence of all buddhas, hearing this RÄma-gÄthÄ,
['ZH_T10_0294_003:0874c25_0']	å³å…·æ™®è³¢è¡Œï¼Œã€€ã€€å…¥æ·¨æ·±æ³•ç•Œï¼Œ	å³å…·æ™®è³¢è¡Œï¼Œã€€ã€€å…¥æ·¨æ·±æ³•ç•Œï¼Œ	Immediately endowed with Samantabhadra's practices, entering the pure, profound Dharma realm,
['ZH_T10_0294_003:0874c26_0']	æ”æŒä¸€åˆ‡æ³•ï¼Œã€€ã€€æˆæ»¿ä¸€åˆ‡åœ°ï¼Œ	æ”æŒä¸€åˆ‡æ³•ï¼Œã€€ã€€æˆæ»¿ä¸€åˆ‡åœ°ï¼Œ	Embracing all dharmas, perfecting all stages,
['ZH_T10_0294_003:0874c27_0']	ä¸‰ä¸–æ–¹ä¾¿æµ·ï¼Œã€€ã€€ä¿®ç¿’ç„¡é‡è¡Œï¼Œ	ä¸‰ä¸–æ–¹ä¾¿æµ·ï¼Œã€€ã€€ä¿®ç¿’ç„¡é‡è¡Œï¼Œ	The ocean of skillful means in the three times, cultivating immeasurable practices,
