segmentnr	original	analyzed	translated
['ZH_T29_1561_001:0325c25_12']	æ–¼å½¼æ™‚ä¸­èæ³•ä¹‹çœ¾ï¼Œå„æ–¼è‡ªä¹˜ç²å¤§æ³•åˆ©ã€‚	æ–¼å½¼æ™‚ä¸­èæ³•ä¹‹çœ¾ï¼Œå„æ–¼è‡ªä¹˜ç²å¤§æ³•åˆ©ã€‚	Among the assembly that heard the Dharma at that time, each attained great Dharma benefits according to their own vehicles.
['ZH_T29_1561_001:0325c27_7']	äº”è˜Šä¸èƒ½æ”ä¸€åˆ‡æ³•ï¼Œæ˜¯æ•…ä¸ä¾äº”è˜Šè€Œèªªå…ˆæœ‰æŸ“ï¼Œå¾Œè¦å…¶æ·¨ã€‚	äº”è˜Šä¸èƒ½æ”ä¸€åˆ‡æ³•ï¼Œæ˜¯æ•…ä¸ä¾äº”è˜Šè€Œèªªå…ˆæœ‰æŸ“ï¼Œå¾Œè¦å…¶æ·¨ã€‚	The five aggregates cannot encompass all dharmas, and therefore one does not rely on the five aggregates to speak of being defiled first and then requiring purification.
['ZH_T29_1561_001:0325c28_6']	æ·¨å½¼æŸ“æ•…ï¼Œä»¥å…ˆèªªæœ‰æ¼ä¹‹æ³•ï¼Œå¾Œèªªç„¡æ¼ç„¡ç‚ºã€‚	æ·¨å½¼æŸ“æ•…ï¼Œä»¥å…ˆèªªæœ‰æ¼ä¹‹æ³•ï¼Œå¾Œèªªç„¡æ¼ç„¡ç‚ºã€‚	Because they purify that defilement, they first speak of the dharmas with outflows and then speak of the undefiled and unconditioned.
['ZH_T29_1561_001:0325c28_8']	é Œï¼š	é Œï¼š	Verse:
['ZH_T29_1561_001:0325c29_0']	è‹¾èŠ»æ„å¯‚éœï¼Œã€€ã€€æ–¼äº‹å¾—æ°¸æ–·ï¼Œ	è‹¾èŠ»æ„å¯‚éœï¼Œã€€ã€€æ–¼äº‹å¾—æ°¸æ–·ï¼Œ	The mind of the bhiká¹£u is tranquil, and he attains permanent cessation of affairs,
['ZH_T29_1561_001:0326a01_13']	èƒ½ç›¡ç”Ÿæ­»éš›ï¼Œã€€ã€€æ›´ä¸å—å¾Œæœ‰ã€‚	èƒ½ç›¡ç”Ÿæ­»éš›ï¼Œã€€ã€€æ›´ä¸å—å¾Œæœ‰ã€‚	Able to end the cycle of birth and death, and no longer accepting future existence.
