segmentnr	original	analyzed	translated
['ZH_T17_0721_035:0206c19_13']	æ–¼æ­¤å¤©ä¸–é–“ï¼Œã€€ã€€å‘½çµ‚ç•¶å¢®è½ã€‚	æ–¼æ­¤å¤©ä¸–é–“ï¼Œã€€ã€€å‘½çµ‚ç•¶å¢®è½ã€‚	In this heavenly world, when your life ends you will fall down.
['ZH_T17_0721_035:0206c20_0']	æ¥­ç›¡é‚„å¢®è½ï¼Œã€€ã€€éš¨æ¥­ä¹‹æ‰€ç”Ÿï¼Œ	æ¥­ç›¡é‚„å¢®è½ï¼Œã€€ã€€éš¨æ¥­ä¹‹æ‰€ç”Ÿï¼Œ	When karma is exhausted, one falls back, following the karma that is born.
['ZH_T17_0721_035:0206c21_13']	ä»Šè‹¥ä¿®å–„æ¥­ï¼Œã€€ã€€å¾Œä¸ç”Ÿæ‚”å¿ƒã€‚	ä»Šè‹¥ä¿®å–„æ¥­ï¼Œã€€ã€€å¾Œä¸ç”Ÿæ‚”å¿ƒã€‚	If one cultivates good karma now, one will not give rise to regret later.
['ZH_T17_0721_035:0206c22_0']	æ”¾é€¸è‘—æ¬²æ¨‚ï¼Œã€€ã€€æ¶ˆç›¡æ–¼å–„æ¥­ï¼Œ	æ”¾é€¸è‘—æ¬²æ¨‚ï¼Œã€€ã€€æ¶ˆç›¡æ–¼å–„æ¥­ï¼Œ	Careless attachment to sensual pleasures exhausts good karma.
['ZH_T17_0721_035:0206c23_13']	ä»¥æ™‚è‡ªåœ¨æ•…ï¼Œã€€ã€€æ¥­ç›¡å¢®æƒ¡é“ã€‚	ä»¥æ™‚è‡ªåœ¨æ•…ï¼Œã€€ã€€æ¥­ç›¡å¢®æƒ¡é“ã€‚	Because of the power of time, when karma is exhausted, one falls into evil realms.
['ZH_T17_0721_035:0206c24_13']	è¦‹é¤˜å¤©é€€æ²’ï¼Œã€€ã€€äº‘ä½•ä¸ç”Ÿå­ï¼Ÿ	è¦‹é¤˜å¤©é€€æ²’ï¼Œã€€ã€€äº‘ä½•ä¸ç”Ÿå­ï¼Ÿ	Seeing other gods fall, why not give rise to disgust?
['ZH_T17_0721_035:0206c25_13']	æˆ‘äº¦ç•¶å¢®è½ï¼Œã€€ã€€æ±ºå®šç„¡æœ‰ç–‘ã€‚	æˆ‘äº¦ç•¶å¢®è½ï¼Œã€€ã€€æ±ºå®šç„¡æœ‰ç–‘ã€‚	I will also fall, there is no doubt.
['ZH_T17_0721_035:0206c26_0']	è‹¥æœ‰ç•æœªä¾†ï¼Œã€€ã€€éš¨é †æ–¼æ³•è¡Œï¼Œ	è‹¥æœ‰ç•æœªä¾†ï¼Œã€€ã€€éš¨é †æ–¼æ³•è¡Œï¼Œ	If one fears the future, one follows the practice of the Dharma.
['ZH_T17_0721_035:0206c27_13']	å…¶äººå‘½çµ‚æ™‚ï¼Œã€€ã€€å‰‡ç„¡æƒ¡é“ç•ã€‚	å…¶äººå‘½çµ‚æ™‚ï¼Œã€€ã€€å‰‡ç„¡æƒ¡é“ç•ã€‚	When the life of such a person ends, there is no fear of evil realms.
['ZH_T17_0721_035:0206c28_0']	æ”¾é€¸ç„¡æ€–ç•ï¼Œã€€ã€€å…¶å¿ƒè¡Œä¸å–„ï¼Œ	æ”¾é€¸ç„¡æ€–ç•ï¼Œã€€ã€€å…¶å¿ƒè¡Œä¸å–„ï¼Œ	The careless and fearless one acts unwholesomely with the mind.
['ZH_T17_0721_035:0206c29_13']	å¾Œå¾—å¤§æ†‚æƒ±ï¼Œã€€ã€€è‡¨çµ‚ç”Ÿæ‚”ç†±ã€‚	å¾Œå¾—å¤§æ†‚æƒ±ï¼Œã€€ã€€è‡¨çµ‚ç”Ÿæ‚”ç†±ã€‚	Later, one attains great sorrow and remorse at the time of death.
['ZH_T17_0721_035:0207a01_0']	ä¸€åˆ‡è«¸å¤©çœ¾ï¼Œã€€ã€€å¿…ç•¶æœ‰é€€æ²’ï¼Œ	ä¸€åˆ‡è«¸å¤©çœ¾ï¼Œã€€ã€€å¿…ç•¶æœ‰é€€æ²’ï¼Œ	All the hosts of gods will certainly fall.
['ZH_T17_0721_035:0207a02_13']	æ—¢çŸ¥æ¬²ç„¡å¸¸ï¼Œã€€ã€€è«è¡Œæ–¼æ”¾é€¸ã€‚	æ—¢çŸ¥æ¬²ç„¡å¸¸ï¼Œã€€ã€€è«è¡Œæ–¼æ”¾é€¸ã€‚	Knowing that desires are impermanent, do not act carelessly.
['ZH_T17_0721_035:0207a03_0']	äº”æ¬²èª‘çœ¾ç”Ÿï¼Œã€€ã€€ç‚ºæ¬²ä¹‹æ‰€è¿·ï¼Œ	äº”æ¬²èª‘çœ¾ç”Ÿï¼Œã€€ã€€ç‚ºæ¬²ä¹‹æ‰€è¿·ï¼Œ	The five desires deceive sentient beings, and they are confused by desire.
['ZH_T17_0721_035:0207a04_13']	æ¬²ç¶²æ‰€çºç¸›ï¼Œã€€ã€€å¸¸å¢®æ–¼åœ°ç„ã€‚	æ¬²ç¶²æ‰€çºç¸›ï¼Œã€€ã€€å¸¸å¢®æ–¼åœ°ç„ã€‚	Bound by the net of desire, one always falls into hell.
['ZH_T17_0721_035:0207a05_0']	çŸ¥æ­¤è¡°æƒ±å·²ï¼Œã€€ã€€ç•¶ä½œè‡ªåˆ©ç›Šï¼Œ	çŸ¥æ­¤è¡°æƒ±å·²ï¼Œã€€ã€€ç•¶ä½œè‡ªåˆ©ç›Šï¼Œ	Knowing this decline and distress, one should do what benefits oneself,
['ZH_T17_0721_035:0207a06_13']	ä»¥å¿ƒèª¿ä¼æ•…ï¼Œã€€ã€€å‘½çµ‚å¿ƒä¸æ‚”ã€‚	ä»¥å¿ƒèª¿ä¼æ•…ï¼Œã€€ã€€å‘½çµ‚å¿ƒä¸æ‚”ã€‚	Because the mind is subdued, one has no regrets at the end of life.
['ZH_T17_0721_035:0207a07_0']	ç‚ºæ¬²è›‡æ‰€è«ï¼Œã€€ã€€æ¬²å¦‚æµ·æ½®æ³¢ï¼Œ	ç‚ºæ¬²è›‡æ‰€è«ï¼Œã€€ã€€æ¬²å¦‚æµ·æ½®æ³¢ï¼Œ	Bitten by the snake of desire, desire is like the waves of the ocean,
['ZH_T17_0721_035:0207a08_13']	ç™¡äººè¶£æ­»è·¯ï¼Œã€€ã€€ç‚ºæ¬²ç«æ‰€ç‡’ã€‚	ç™¡äººè¶£æ­»è·¯ï¼Œã€€ã€€ç‚ºæ¬²ç«æ‰€ç‡’ã€‚	The foolish one goes down the road to death, burned by the fire of desire.
['ZH_T17_0721_035:0207a09_0']	è¦ªæ„›åŠå…„å¼Ÿã€ã€€ã€€è¦ªå‹çš†åˆ¥é›¢ï¼Œ	è¦ªæ„›åŠå…„å¼Ÿã€ã€€ã€€è¦ªå‹çš†åˆ¥é›¢ï¼Œ	Relatives and brothers, close friends all part ways,
['ZH_T17_0721_035:0207a10_13']	æ­»æ™‚çœ¾è‹¦é›†ï¼Œã€€ã€€ä¸å¯å¾—å…·èªªã€‚	æ­»æ™‚çœ¾è‹¦é›†ï¼Œã€€ã€€ä¸å¯å¾—å…·èªªã€‚	At the time of death, the suffering is great, it cannot be fully described.
['ZH_T17_0721_035:0207a11_0']	æ­»æ™‚æ—¢è‡³å·²ï¼Œã€€ã€€çŒ¶å¦‚å¢œå±±å·–ï¼Œ	æ­»æ™‚æ—¢è‡³å·²ï¼Œã€€ã€€çŒ¶å¦‚å¢œå±±å·–ï¼Œ	When death arrives, it is like falling off a cliff,
['ZH_T17_0721_035:0207a12_13']	å¤§åŠ›ä¸å¯é¿ï¼Œã€€ã€€å°‡äººå…¥æƒ¡é“ã€‚	å¤§åŠ›ä¸å¯é¿ï¼Œã€€ã€€å°‡äººå…¥æƒ¡é“ã€‚	The great power cannot be avoided, it takes people into the evil paths.
['ZH_T17_0721_035:0207a13_0']	å¤§åŠ›åŸ·æŒäººï¼Œã€€ã€€èƒ½å£æ–¼ä¸–é–“ï¼Œ	å¤§åŠ›åŸ·æŒäººï¼Œã€€ã€€èƒ½å£æ–¼ä¸–é–“ï¼Œ	Great power holds onto people, it can destroy the world,
['ZH_T17_0721_035:0207a14_13']	å¤©çœ¾æ—¢çŸ¥å·²ï¼Œã€€ã€€ç•¶æ¨æ–¼æ”¾é€¸ã€‚	å¤©çœ¾æ—¢çŸ¥å·²ï¼Œã€€ã€€ç•¶æ¨æ–¼æ”¾é€¸ã€‚	The heavenly beings, having known this, should abandon their negligence.
['ZH_T17_0721_035:0207a15_0']	è«¸æ ¹ç”Ÿè²ªè‘—ï¼Œã€€ã€€è€Œä¸çŸ¥å­è¶³ï¼Œ	è«¸æ ¹ç”Ÿè²ªè‘—ï¼Œã€€ã€€è€Œä¸çŸ¥å­è¶³ï¼Œ	The faculties give rise to craving, yet one does not know contentment,
['ZH_T17_0721_035:0207a16_13']	æ„›å¿ƒå¸¸å¢é•·ï¼Œã€€ã€€å¦‚é…¥æ²¹æŠ•ç«ã€‚	æ„›å¿ƒå¸¸å¢é•·ï¼Œã€€ã€€å¦‚é…¥æ²¹æŠ•ç«ã€‚	The mind of love always grows, like butter and oil poured into fire.
['ZH_T17_0721_035:0207a17_0']	å¦‚æ˜¯ç¨®ç¨®é–€ï¼Œã€€ã€€å› æ„›æœ‰ä¸–é–“ï¼Œ	å¦‚æ˜¯ç¨®ç¨®é–€ï¼Œã€€ã€€å› æ„›æœ‰ä¸–é–“ï¼Œ	In this way, through various approaches, because of craving, there is the world,
['ZH_T17_0721_035:0207a18_13']	è¼ªè½‰æ–¼åœ°ç„ã€ã€€ã€€é¤“é¬¼åŠç•œç”Ÿã€‚	è¼ªè½‰æ–¼åœ°ç„ã€ã€€ã€€é¤“é¬¼åŠç•œç”Ÿã€‚	Revolving in the hells, hungry ghosts, and animals.
['ZH_T17_0721_035:0207a19_0']	ç”Ÿæ­»æ‰€æ“¾å‹•ï¼Œã€€ã€€è‹¦æƒ±è‡ªè¿·å¿ƒï¼Œ	ç”Ÿæ­»æ‰€æ“¾å‹•ï¼Œã€€ã€€è‹¦æƒ±è‡ªè¿·å¿ƒï¼Œ	Disturbed by birth and death, suffering and confusion,
['ZH_T17_0721_035:0207a20_13']	æ—¢çŸ¥èƒ½é›¢æ„›ï¼Œã€€ã€€å‰‡åˆ°ç¬¬ä¸€é“ã€‚	æ—¢çŸ¥èƒ½é›¢æ„›ï¼Œã€€ã€€å‰‡åˆ°ç¬¬ä¸€é“ã€‚	Knowing this, one can detach from craving and reach the supreme path.
['ZH_T17_0721_035:0207a21_0']	å‹‡å¥è€…æ–·æ„›ï¼Œã€€ã€€é›¢æ†‚ç„¡è‹¦æƒ±ï¼Œ	å‹‡å¥è€…æ–·æ„›ï¼Œã€€ã€€é›¢æ†‚ç„¡è‹¦æƒ±ï¼Œ	The brave and strong cut off craving, free from worries and suffering,
['ZH_T17_0721_035:0207a22_13']	å‰‡å¾—å®‰éš±çœ ï¼Œã€€ã€€ä»¥èƒ½é›¢æ„›æ•…ã€‚	å‰‡å¾—å®‰éš±çœ ï¼Œã€€ã€€ä»¥èƒ½é›¢æ„›æ•…ã€‚	And attain peaceful sleep, because they can detach from craving.
['ZH_T17_0721_035:0207a23_0']	è‹¥äººå¿ƒå¸¸æ¨‚ï¼Œã€€ã€€ä¿®è¡Œæ–¼æ™ºæ…§ï¼Œ	è‹¥äººå¿ƒå¸¸æ¨‚ï¼Œã€€ã€€ä¿®è¡Œæ–¼æ™ºæ…§ï¼Œ	If a person's mind always delights in cultivating wisdom,
['ZH_T17_0721_035:0207a24_13']	ä¸ç‚ºæ–¼ç”Ÿæ­»ï¼Œã€€ã€€æ„›ç¶²ä¹‹æ‰€ç¸›ã€‚	ä¸ç‚ºæ–¼ç”Ÿæ­»ï¼Œã€€ã€€æ„›ç¶²ä¹‹æ‰€ç¸›ã€‚	They will not be bound by the net of craving in birth and death.
['ZH_T17_0721_035:0207a25_0']	è‹¥äººå¿ƒç„¡ç›¸ï¼Œã€€ã€€å­é›¢æ–¼æ„›æ¬²ï¼Œ	è‹¥äººå¿ƒç„¡ç›¸ï¼Œã€€ã€€å­é›¢æ–¼æ„›æ¬²ï¼Œ	If a person's mind is free from characteristics, disgusted with craving and desire,
['ZH_T17_0721_035:0207a26_13']	é›¢å¢åŠæ› é‡ï¼Œã€€ã€€åˆ°å®‰æ¨‚å½¼å²¸ã€‚	é›¢å¢åŠæ› é‡ï¼Œã€€ã€€åˆ°å®‰æ¨‚å½¼å²¸ã€‚	Free from defilements and wilderness, they reach the other shore of peace and bliss.
['ZH_T17_0721_035:0207a27_0']	è‹¥äººä¸å­è‹¦ï¼Œã€€ã€€å¾—æ¨‚äº¦ä¸æ¬£ï¼Œ	è‹¥äººä¸å­è‹¦ï¼Œã€€ã€€å¾—æ¨‚äº¦ä¸æ¬£ï¼Œ	If a person is not disgusted with suffering and does not rejoice in pleasure,
['ZH_T17_0721_035:0207a28_13']	æ˜¯äººè„«è‹¦æ¨‚ï¼Œã€€ã€€èƒ½åˆ°æ¶…æ§ƒåŸã€‚	æ˜¯äººè„«è‹¦æ¨‚ï¼Œã€€ã€€èƒ½åˆ°æ¶…æ§ƒåŸã€‚	This person escapes from suffering and pleasure and can reach the city of nirvana.
['ZH_T17_0721_035:0207a29_0']	è‹¥æœ‰äººä¿®è¡Œï¼Œã€€ã€€å¸¸èµ·æ…ˆæ‚²å¿ƒï¼Œ	è‹¥æœ‰äººä¿®è¡Œï¼Œã€€ã€€å¸¸èµ·æ…ˆæ‚²å¿ƒï¼Œ	If a person practices and always arouses a compassionate mind,
['ZH_T17_0721_035:0207b01_13']	æ˜¯äººçŸ¥å› æœï¼Œã€€ã€€å‰‡èƒ½è„«è‹¦ç¶²ã€‚	æ˜¯äººçŸ¥å› æœï¼Œã€€ã€€å‰‡èƒ½è„«è‹¦ç¶²ã€‚	This person knows cause and effect, and can then escape the net of suffering.
['ZH_T17_0721_035:0207b02_0']	è‹¥äººä¸åˆ†åˆ¥ï¼Œã€€ã€€é›¢æ„åˆ†åˆ¥éï¼Œ	è‹¥äººä¸åˆ†åˆ¥ï¼Œã€€ã€€é›¢æ„åˆ†åˆ¥éï¼Œ	If a person does not discriminate, and is free from the faults of discriminating thoughts,
['ZH_T17_0721_035:0207b03_13']	æ˜¯äººé›¢çœ¾éï¼Œã€€ã€€èƒ½å¾—ç„¡ä¸Šé“ã€‚	æ˜¯äººé›¢çœ¾éï¼Œã€€ã€€èƒ½å¾—ç„¡ä¸Šé“ã€‚	This person is free from all faults and can attain the unsurpassed path.
['ZH_T17_0721_035:0207b04_0']	å’Œåˆå‰‡æœ‰é›¢ï¼Œã€€ã€€ç››è‰²å¿…æœ‰è¡°ï¼Œ	å’Œåˆå‰‡æœ‰é›¢ï¼Œã€€ã€€ç››è‰²å¿…æœ‰è¡°ï¼Œ	Where there is union, there is separation; where there is flourishing beauty, there is decay;
['ZH_T17_0721_035:0207b05_13']	æœ‰å‘½çš†æ­¸æ­»ï¼Œã€€ã€€ä¸€åˆ‡æ³•å¦‚æ˜¯ã€‚	æœ‰å‘½çš†æ­¸æ­»ï¼Œã€€ã€€ä¸€åˆ‡æ³•å¦‚æ˜¯ã€‚	Where there is life, there is death - all dharmas are like this.
['ZH_T17_0721_035:0207b06_0']	è«¸å¤©å°‡é€€æ²’ï¼Œã€€ã€€å¿µå¿µæ¬²ç¾å‰ï¼Œ	è«¸å¤©å°‡é€€æ²’ï¼Œã€€ã€€å¿µå¿µæ¬²ç¾å‰ï¼Œ	When the gods are about to fall, they think of the pleasures that will soon disappear,
['ZH_T17_0721_035:0207b07_13']	ç•¶çŸ¥å¦‚æ˜¯æ³•ï¼Œã€€ã€€è«è¡Œæ–¼æ”¾é€¸ã€‚	ç•¶çŸ¥å¦‚æ˜¯æ³•ï¼Œã€€ã€€è«è¡Œæ–¼æ”¾é€¸ã€‚	One should know that such dharmas should not be indulged in.
['ZH_T17_0721_035:0207b08_0']	æ„šäººç„¡æ–¹ä¾¿ï¼Œã€€ã€€å¸¸æ±‚æ–¼æ¬²æ¨‚ï¼Œ	æ„šäººç„¡æ–¹ä¾¿ï¼Œã€€ã€€å¸¸æ±‚æ–¼æ¬²æ¨‚ï¼Œ	Foolish people lack skillful means and always seek sensual pleasures,
['ZH_T17_0721_035:0207b09_13']	å¦‚æ²™ä¸­æ±‚æ²¹ï¼Œã€€ã€€å‰‡æ˜¯ä¸å¯å¾—ã€‚	å¦‚æ²™ä¸­æ±‚æ²¹ï¼Œã€€ã€€å‰‡æ˜¯ä¸å¯å¾—ã€‚	Like trying to get oil from sand - it is impossible.
['ZH_T17_0721_035:0207b10_0']	è‹¥äººæ¨‚æ”¾é€¸ï¼Œã€€ã€€å‰‡ä¸å¾—å®‰æ¨‚ï¼Œ	è‹¥äººæ¨‚æ”¾é€¸ï¼Œã€€ã€€å‰‡ä¸å¾—å®‰æ¨‚ï¼Œ	If a person delights in indulgence, they will not attain peace and joy,
['ZH_T17_0721_035:0207b11_13']	æ”¾é€¸å—å¤§è‹¦ï¼Œã€€ã€€å¦‚æ¨¹æ ¹å …ç‰¢ã€‚	æ”¾é€¸å—å¤§è‹¦ï¼Œã€€ã€€å¦‚æ¨¹æ ¹å …ç‰¢ã€‚	The indulgence that brings great suffering is like a tree with deep roots.
['ZH_T17_0721_035:0207b12_0']	æˆ‘ç‚ºæ±å¯¦èªªï¼Œã€€ã€€æ³•éæ³•ä¹‹ç¾©ï¼Œ	æˆ‘ç‚ºæ±å¯¦èªªï¼Œã€€ã€€æ³•éæ³•ä¹‹ç¾©ï¼Œ	I speak the truth to you - the meaning of dharma and non-dharma,
['ZH_T17_0721_035:0207b13_13']	æ±ç•¶å–„æ€æƒŸï¼Œã€€ã€€å‹¿æ–¼å¾Œç”Ÿæ‚”ã€‚	æ±ç•¶å–„æ€æƒŸï¼Œã€€ã€€å‹¿æ–¼å¾Œç”Ÿæ‚”ã€‚	You should contemplate well and do not regret it later.
['ZH_T17_0721_035:0207b14_0']	è‹¥æœ‰æ„šç™¡äººï¼Œã€€ã€€ä¸å—å–„å¸«æ•™ï¼Œ	è‹¥æœ‰æ„šç™¡äººï¼Œã€€ã€€ä¸å—å–„å¸«æ•™ï¼Œ	If there are foolish people who do not accept the teachings of good teachers,
['ZH_T17_0721_035:0207b15_13']	è‡¨çµ‚è¡°æƒ±è‡³ï¼Œã€€ã€€å¿ƒå¿…ç”Ÿæ‚”ç†±ã€‚	è‡¨çµ‚è¡°æƒ±è‡³ï¼Œã€€ã€€å¿ƒå¿…ç”Ÿæ‚”ç†±ã€‚	When the suffering of death arrives, their minds will surely give rise to remorse and distress.
['ZH_T17_0721_035:0207b16_0']	å„„åƒé‚£ç”±ä»–ï¼Œã€€ã€€ç„¡æ•¸å„„å…†è¼‰ï¼Œ	å„„åƒé‚£ç”±ä»–ï¼Œã€€ã€€ç„¡æ•¸å„„å…†è¼‰ï¼Œ	Billions and trillions of innumerable eons,
['ZH_T17_0721_035:0207b17_13']	é˜¿åƒ§ç¥‡è«¸å¤©ï¼Œã€€ã€€çš†ç‚ºæ”¾é€¸èª‘ã€‚	é˜¿åƒ§ç¥‡è«¸å¤©ï¼Œã€€ã€€çš†ç‚ºæ”¾é€¸èª‘ã€‚	The devas of incalculable numbers are all deceived by carelessness.
['ZH_T17_0721_035:0207b18_0']	ç„¡å¸¸å¤§åŠ«ç«ï¼Œã€€ã€€å°šç‡’æ­¤å±±ç‹ï¼Œ	ç„¡å¸¸å¤§åŠ«ç«ï¼Œã€€ã€€å°šç‡’æ­¤å±±ç‹ï¼Œ	The great fire of impermanence still burns this king of mountains,
['ZH_T17_0721_035:0207b19_13']	ä½•æ³è«¸å¤©èº«ï¼Œã€€ã€€å¦‚æ°´æ²«èŠ­è•‰ã€‚	ä½•æ³è«¸å¤©èº«ï¼Œã€€ã€€å¦‚æ°´æ²«èŠ­è•‰ã€‚	How much more so the bodies of the devas, which are like water bubbles and plantain trees.
['ZH_T17_0721_035:0207b20_0']	è«¸è¡Œçš†é·å‹•ï¼Œã€€ã€€ç”Ÿæ³•æ‚‰ç„¡å¸¸ï¼Œ	è«¸è¡Œçš†é·å‹•ï¼Œã€€ã€€ç”Ÿæ³•æ‚‰ç„¡å¸¸ï¼Œ	All conditioned things are in flux and change, and the phenomena of birth are all impermanent.
['ZH_T17_0721_035:0207b21_13']	å¦‚æ˜¯è«¸æ³•ä¸­ï¼Œã€€ã€€æ±‚æ¨‚ä¸å¯å¾—ã€‚	å¦‚æ˜¯è«¸æ³•ä¸­ï¼Œã€€ã€€æ±‚æ¨‚ä¸å¯å¾—ã€‚	In these phenomena, happiness cannot be found.
['ZH_T17_0721_035:0207b23_13']	ã€ã€Œå¦‚æ˜¯å¤©å¸é‡‹ç‚ºæ–°ç”Ÿå¤©å­æ–¹ä¾¿èªªåˆ©ç›Šæ³•ï¼Œæ™‚æ–°ç”Ÿå¤©å­ä»¥æ”¾é€¸æ•…ï¼Œä¸å—ä¸€è¨€ã€‚	ã€ã€Œå¦‚æ˜¯å¤©å¸é‡‹ç‚ºæ–°ç”Ÿå¤©å­æ–¹ä¾¿èªªåˆ©ç›Šæ³•ï¼Œæ™‚æ–°ç”Ÿå¤©å­ä»¥æ”¾é€¸æ•…ï¼Œä¸å—ä¸€è¨€ã€‚	' In this way, Åšakra, Lord of the Devas, skillfully teaches the Dharma of benefiting others to the newly born devas, but due to carelessness, the newly born devas do not accept even a single word.
['ZH_T17_0721_035:0207b24_8']	çˆ¾æ™‚ï¼Œå¸é‡‹çŸ¥å…¶ä¸å—ï¼Œé»˜ç„¶è€Œä½ã€‚	çˆ¾æ™‚ï¼Œå¸é‡‹çŸ¥å…¶ä¸å—ï¼Œé»˜ç„¶è€Œä½ã€‚	At that time, Åšakra, Lord of the Devas, knowing that they do not accept it, remains silent.
['ZH_T17_0721_035:0207b26_11']	æ™‚åˆç”Ÿå¤©å­åˆæŒé ‚ä¸Šï¼Œç¦®å¸é‡‹å·²ï¼Œèˆ‡è«¸å¤©çœ¾æ­ŒèˆéŠæˆ²ï¼Œç™¾çœ¾åƒçœ¾é‚„æ­¸è‡ªåœ°ï¼Œåœ’æ—èŠ±æ± è™•è™•éŠæˆ²ã€‚	æ™‚åˆç”Ÿå¤©å­åˆæŒé ‚ä¸Šï¼Œç¦®å¸é‡‹å·²ï¼Œèˆ‡è«¸å¤©çœ¾æ­ŒèˆéŠæˆ²ï¼Œç™¾çœ¾åƒçœ¾é‚„æ­¸è‡ªåœ°ï¼Œåœ’æ—èŠ±æ± è™•è™•éŠæˆ²ã€‚	At that time, the newly born celestial being joined his palms above his head, paid homage to Åšakra, and together with the celestial assembly, sang, danced, and played. Hundreds and thousands of them returned to their own realm, playing in the gardens, forests, and flower ponds everywhere.
['ZH_T17_0721_035:0207b28_14']	éè§€ä½è™•ï¼Œæµæ³‰è¯æ± èŠåš´ä¹‹è™•ï¼Œç¨®ç¨®çœ¾é³¥å…¶è²å¯æ„›ï¼Œç¨®ç¨®å±±è°·å¯¶å…‰ç„°è¼ªï¼Œèˆ‡è«¸å¤©çœ¾å—ç„¡é‡æ¨‚ã€‚	éè§€ä½è™•ï¼Œæµæ³‰è¯æ± èŠåš´ä¹‹è™•ï¼Œç¨®ç¨®çœ¾é³¥å…¶è²å¯æ„›ï¼Œç¨®ç¨®å±±è°·å¯¶å…‰ç„°è¼ªï¼Œèˆ‡è«¸å¤©çœ¾å—ç„¡é‡æ¨‚ã€‚	They thoroughly observed their dwelling places, which were adorned with flowing springs and flower ponds. The voices of various birds were delightful, and various mountain valleys and jewel-like flames were enjoyed by the celestial assembly with immeasurable bliss.
['ZH_T17_0721_035:0207c01_11']	æ”¾é€¸è¦†å¿ƒï¼Œæ„›è‘—æ…¾å¿ƒï¼Œæ…¾ç«æ‰€ç‡’ï¼Œå¾æ–¼äº”æ ¹ç”Ÿäº”ç¨®ç„°ï¼Œå¿ƒçªŸä½è™•ï¼Œä¸è¦ºè‡ªç‡’ã€‚	æ”¾é€¸è¦†å¿ƒï¼Œæ„›è‘—æ…¾å¿ƒï¼Œæ…¾ç«æ‰€ç‡’ï¼Œå¾æ–¼äº”æ ¹ç”Ÿäº”ç¨®ç„°ï¼Œå¿ƒçªŸä½è™•ï¼Œä¸è¦ºè‡ªç‡’ã€‚	The mind covered by heedlessness, attached to lustful desires, burned by the fire of desire, gave rise to five kinds of flames from the five sense faculties. Dwelling in the abode of the mind's cave, they were unaware of being burned by themselves.
['ZH_T17_0721_035:0207c02_11']	èˆ‡è«¸å¤©å¥³æ”¾é€¸éŠæˆ²ï¼Œè¦†è—æ€¨è³Šï¼Œè¬‚ç‚ºè¦ªå‹ã€‚	èˆ‡è«¸å¤©å¥³æ”¾é€¸éŠæˆ²ï¼Œè¦†è—æ€¨è³Šï¼Œè¬‚ç‚ºè¦ªå‹ã€‚	Together with the celestial maidens, they heedlessly played, concealing the enemy-like robbers, regarding them as close friends.
['ZH_T17_0721_035:0207c03_19']	å¦‚æ˜¯å—æ¨‚ä¹ƒè‡³æ„›å–„æ¥­ç›¡ï¼Œéš¨æ¥­æµè½‰ï¼Œå¢®æ–¼åœ°ç„ã€é¤“é¬¼ã€ç•œç”Ÿã€‚	å¦‚æ˜¯å—æ¨‚ä¹ƒè‡³æ„›å–„æ¥­ç›¡ï¼Œéš¨æ¥­æµè½‰ï¼Œå¢®æ–¼åœ°ç„ã€é¤“é¬¼ã€ç•œç”Ÿã€‚	In this way, they enjoyed pleasures until their good karmic actions were exhausted. Following their karmic actions, they transmigrated and fell into the hells, the realm of hungry ghosts, or the realm of animals.
['ZH_T17_0721_035:0207c06_18']	è‹¥æœ‰å–„æ¥­ç”Ÿæ–¼äººä¸­ï¼Œå¸¸å—å®‰æ¨‚ï¼Œç¬¬ä¸€ç«¯æ­£ï¼Œç„¡é‡åŠŸå¾·ï¼Œç”Ÿå¤§ç¨®å§“ï¼Œç‚ºä¸€åˆ‡äººä¹‹æ‰€æ„›å¿µï¼Œæˆ–ç‚ºäººç‹æˆ–ç‚ºå¤§è‡£ï¼Œç”Ÿè™•é•·å£½ï¼Œä¹ƒè‡³å‘½çµ‚å—æ¨‚ä¸å£ã€‚	è‹¥æœ‰å–„æ¥­ç”Ÿæ–¼äººä¸­ï¼Œå¸¸å—å®‰æ¨‚ï¼Œç¬¬ä¸€ç«¯æ­£ï¼Œç„¡é‡åŠŸå¾·ï¼Œç”Ÿå¤§ç¨®å§“ï¼Œç‚ºä¸€åˆ‡äººä¹‹æ‰€æ„›å¿µï¼Œæˆ–ç‚ºäººç‹æˆ–ç‚ºå¤§è‡£ï¼Œç”Ÿè™•é•·å£½ï¼Œä¹ƒè‡³å‘½çµ‚å—æ¨‚ä¸å£ã€‚	If there is good karma, one will be born among humans, always experiencing happiness, with supreme beauty and immeasurable virtues, born into a great and noble family, loved by all people, either as a human king or a great minister, born in a long-lived place, and until the end of life, one will experience indestructible happiness.
['ZH_T17_0721_035:0207c07_3']	ä»¥é¤˜æ¥­æ•…ã€‚	ä»¥é¤˜æ¥­æ•…ã€‚	Because of other karma.
['ZH_T17_0721_035:0207c08_20']	ã€Œå¾©æ¬¡ï¼Œæ¯”ä¸˜çŸ¥æ¥­æœå ±ï¼Œè§€ä¸‰åä¸‰å¤©æ‰€ä½ä¹‹åœ°ã€‚	ã€Œå¾©æ¬¡ï¼Œæ¯”ä¸˜çŸ¥æ¥­æœå ±ï¼Œè§€ä¸‰åä¸‰å¤©æ‰€ä½ä¹‹åœ°ã€‚	Furthermore, the bhiká¹£us know the fruits of karma and observe the abodes of the Thirty-three Celestials.
['ZH_T17_0721_035:0207c09_5']	å½¼ä»¥èæ…§è¦‹ï¼š	å½¼ä»¥èæ…§è¦‹ï¼š	They see with their wisdom of hearing:
['ZH_T17_0721_035:0207c10_1']	ä¸‰åä¸‰å¤©ç¬¬ä¸‰åä¸‰åœ°åæ›°æ¸…æ·¨ã€‚	ä¸‰åä¸‰å¤©ç¬¬ä¸‰åä¸‰åœ°åæ›°æ¸…æ·¨ã€‚	The thirty-third ground of the Thirty-three Celestials is called Purity.
['ZH_T17_0721_035:0207c10_10']	çœ¾ç”Ÿä½•æ¥­ç”Ÿæ–¼å½¼å¤©ï¼Ÿ	çœ¾ç”Ÿä½•æ¥­ç”Ÿæ–¼å½¼å¤©ï¼Ÿ	What karma do sentient beings have that causes them to be born in that heaven?
['ZH_T17_0721_035:0207c10_16']	å½¼ä»¥èæ…§è¦‹ï¼š	å½¼ä»¥èæ…§è¦‹ï¼š	They see with their wisdom of hearing:
['ZH_T17_0721_035:0207c13_6']	æ­¤çœ¾ç”Ÿä»¥å–„å¿ƒæ•…ï¼Œä¿¡æ–¼å› æœï¼ŒæŒä¸ƒç¨®æˆ’ï¼Œæ–¼ä¸€åˆ‡çœ¾ç”Ÿèµ·æ…ˆæ‚²å¿ƒï¼Œä¸è¿‘æƒ¡å‹ï¼Œä¸èˆ‡æƒ¡äººè¨€èªè«‡è«–ï¼Œå¸¸ä¿¡ä¸‰å¯¶ã€‚	æ­¤çœ¾ç”Ÿä»¥å–„å¿ƒæ•…ï¼Œä¿¡æ–¼å› æœï¼ŒæŒä¸ƒç¨®æˆ’ï¼Œæ–¼ä¸€åˆ‡çœ¾ç”Ÿèµ·æ…ˆæ‚²å¿ƒï¼Œä¸è¿‘æƒ¡å‹ï¼Œä¸èˆ‡æƒ¡äººè¨€èªè«‡è«–ï¼Œå¸¸ä¿¡ä¸‰å¯¶ã€‚	These sentient beings, due to a good mind, believe in cause and effect, uphold the seven kinds of precepts, give rise to a compassionate mind towards all sentient beings, do not associate with bad friends, do not converse with bad people, and always believe in the Three Jewels.
