segmentnr	original	analyzed	folio	translated
['ZH_T23_1442_013:0691b07_0']	æ ¹æœ¬èªªä¸€åˆ‡æœ‰éƒ¨æ¯˜å¥ˆè€¶å·	æ ¹æœ¬èªªä¸€åˆ‡æœ‰éƒ¨æ¯˜å¥ˆè€¶å·	013	MÅ«lasarvÃ¢stivÄda-vinaya
['ZH_T23_1442_013:0691b08_0']	ç¬¬åä¸‰	ç¬¬åä¸‰	013	Scroll 13
['ZH_T23_1442_013:0691b10_0']	ä¸‰è—æ³•å¸«ç¾©æ·¨å¥‰ã€€åˆ¶è­¯	ä¸‰è—æ³•å¸«ç¾©æ·¨å¥‰ã€€åˆ¶è­¯	013	Translated by Tripiá¹­aka Master Yijing under imperial order
['ZH_T23_1442_013:0691b13_1']	8 ç„¡æ ¹è¬—å­¸è™•ç„¡æ ¹è¬—å­¸è™•ç¬¬å…«çˆ¾æ™‚è–„ä¼½æ¢µåœ¨ç‹èˆåŸç¾¯è˜­é¸è¿¦æ± ç«¹æ—åœ’ä¸­ã€‚	8 ç„¡æ ¹è¬—å­¸è™•ç„¡æ ¹è¬—å­¸è™•ç¬¬å…«çˆ¾æ™‚è–„ä¼½æ¢µåœ¨ç‹èˆåŸç¾¯è˜­é¸è¿¦æ± ç«¹æ—åœ’ä¸­ã€‚	013	The section on groundless slander, the eighth section on groundless slander. At that time, the Blessed One was in the Kalandaka Bamboo Grove near RÄjagá¹›ha.
['ZH_T23_1442_013:0691b16_10']	æ™‚æ³¢æ³¢åœ‹ä¸­æœ‰ä¸€å£¯å£«å¤§è‡£åæ›°å‹è»ï¼Œå¤§å¯Œå¤šè²¡å—ç”¨è±è¶³ï¼Œæ‰€æœ‰è³‡ç”¢å¦‚æ¯˜æ²™é–€ç‹ï¼Œé›–éç‹æ—æ™‚è«¸å£¯å£«ä½œçŒé ‚æ³•æ‰¶ä»¥ç‚ºç‹ï¼Œæ–¼å‹æ—å¥³ç´ä»¥ç‚ºå¦ƒæ­¡æ¨‚è€Œä½ã€‚	æ™‚æ³¢æ³¢åœ‹ä¸­æœ‰ä¸€å£¯å£«å¤§è‡£åæ›°å‹è»ï¼Œå¤§å¯Œå¤šè²¡å—ç”¨è±è¶³ï¼Œæ‰€æœ‰è³‡ç”¢å¦‚æ¯˜æ²™é–€ç‹ï¼Œé›–éç‹æ—æ™‚è«¸å£¯å£«ä½œçŒé ‚æ³•æ‰¶ä»¥ç‚ºç‹ï¼Œæ–¼å‹æ—å¥³ç´ä»¥ç‚ºå¦ƒæ­¡æ¨‚è€Œä½ã€‚	013	At that time, in the country of PÄvÄ, there was a powerful minister named JinarÄta, who was very wealthy, had abundant possessions and enjoyments, and had as much wealth as VaiÅ›ravaá¹‡a. Although he was not of royal blood, the powerful men of the time performed the abhiá¹£eka ritual and supported him as their king. He took a wife from a noble family and lived happily.
['ZH_T23_1442_013:0691b18_10']	é›–æ·¹æ­²æœˆç«Ÿç„¡ç”·å¥³ï¼Œç‚ºæ±‚å­æ•…ç¥ˆç¦±ç¥ç¥‡ï¼Œéè«¸å¤©å»ŸåŠåŒç”Ÿå¤©ï¼Œå¸Œæœ›å¾Œå—£ä¸é‚æ‰€é¡˜ã€‚	é›–æ·¹æ­²æœˆç«Ÿç„¡ç”·å¥³ï¼Œç‚ºæ±‚å­æ•…ç¥ˆç¦±ç¥ç¥‡ï¼Œéè«¸å¤©å»ŸåŠåŒç”Ÿå¤©ï¼Œå¸Œæœ›å¾Œå—£ä¸é‚æ‰€é¡˜ã€‚	013	Although many years passed, he had no children. In order to seek a child, he prayed to the gods, visiting temples of various gods and gods born in the same world, hoping for an heir but not getting what he wished for.
['ZH_T23_1442_013:0691b18_15']	ç„¶ä¸–æœ‰äº‘ï¼š	ç„¶ä¸–æœ‰äº‘ï¼š	013	However, there is a saying in the world:
['ZH_T23_1442_013:0691b20_3']	ã€Œç”±ä¹æ±‚æ•…ä¾¿ç²å­è€…æ­¤èª è™›å¦„ï¼Œæ–¯è‹¥æ˜¯å¯¦ï¼Œäººçš†åƒå­å¦‚è½‰è¼ªç‹ã€‚	ã€Œç”±ä¹æ±‚æ•…ä¾¿ç²å­è€…æ­¤èª è™›å¦„ï¼Œæ–¯è‹¥æ˜¯å¯¦ï¼Œäººçš†åƒå­å¦‚è½‰è¼ªç‹ã€‚	013	By begging, one obtains a child. This is false. If this were true, everyone would have a thousand children like a wheel-turning king.
['ZH_T23_1442_013:0691b20_13']	ã€ç„¶ç”±ä¸‰äº‹æ–¹æœ‰å­æ¯ã€‚	ã€ç„¶ç”±ä¸‰äº‹æ–¹æœ‰å­æ¯ã€‚	013	However, children are only born due to three things.
['ZH_T23_1442_013:0691b20_18']	äº‘ä½•ç‚ºä¸‰ï¼Ÿ	äº‘ä½•ç‚ºä¸‰ï¼Ÿ	013	What are the three?
['ZH_T23_1442_013:0691b21_5']	ä¸€è€…çˆ¶æ¯äº¤æœƒäº‹ï¼›	ä¸€è€…çˆ¶æ¯äº¤æœƒäº‹ï¼›	013	First, the parents must have intercourse;
['ZH_T23_1442_013:0691b21_16']	äºŒè€…å…¶æ¯èº«æ·¨æ‡‰åˆæœ‰å¨ ï¼›	äºŒè€…å…¶æ¯èº«æ·¨æ‡‰åˆæœ‰å¨ ï¼›	013	Second, the mother's body must be pure and suitable for conception;
['ZH_T23_1442_013:0691b22_4']	ä¸‰è€…é£Ÿé¦™ç¾å‰ã€‚	ä¸‰è€…é£Ÿé¦™ç¾å‰ã€‚	013	Third, the fragrant food must be present.
['ZH_T23_1442_013:0691b24_18']	å½¼ç‹æ¥­ç·£åˆæœƒï¼Œæ™‚æœ‰ä¸€å¤©å¾å‹å¦™å¤©ä¸‹è¨—è˜Šç‹å¦ƒï¼Œæ˜¯æœ€å¾Œç”Ÿæ¨‚ä¿®å‹è¡Œï¼Œæœ‰è§£è„«æ€§è¶£å‘æ¶…æ§ƒï¼Œå­èƒŒç”Ÿæ­»æ–¼è«¸æœ‰ä¸­çš†ä¸æ¬£æ¨‚ã€‚	å½¼ç‹æ¥­ç·£åˆæœƒï¼Œæ™‚æœ‰ä¸€å¤©å¾å‹å¦™å¤©ä¸‹è¨—è˜Šç‹å¦ƒï¼Œæ˜¯æœ€å¾Œç”Ÿæ¨‚ä¿®å‹è¡Œï¼Œæœ‰è§£è„«æ€§è¶£å‘æ¶…æ§ƒï¼Œå­èƒŒç”Ÿæ­»æ–¼è«¸æœ‰ä¸­çš†ä¸æ¬£æ¨‚ã€‚	013	When the king's karmic conditions were complete, a god from the Heaven of Marvelous Joy descended and entered the queen's womb. This was his last birth. He enjoyed practicing the supreme conduct, had the nature of liberation, was heading towards nirvana, and was disgusted with samsara. He did not delight in any of the existences.
['ZH_T23_1442_013:0691b26_7']	è‹¥è°æ…§å¥³äººæœ‰äº”åˆ¥æ™ºï¼Œå»£èªªå¦‚ä¸Šï¼Œä¹ƒè‡³å¨ åœ¨å³è„‡ï¼Œå–œç™½ç‹æ›°ï¼š	è‹¥è°æ…§å¥³äººæœ‰äº”åˆ¥æ™ºï¼Œå»£èªªå¦‚ä¸Šï¼Œä¹ƒè‡³å¨ åœ¨å³è„‡ï¼Œå–œç™½ç‹æ›°ï¼š	013	If a wise woman has five kinds of wisdom, as explained above, and the fetus is in the right side, she will happily tell the king:
['ZH_T23_1442_013:0691b26_13']	ã€Œå¤§ç‹ç•¶çŸ¥ï¼	ã€Œå¤§ç‹ç•¶çŸ¥ï¼	013	Great King, you should know!
['ZH_T23_1442_013:0691b27_12']	æˆ‘æ‰€æ‡·å­•å¿…æ˜¯å…‰é¡¯å®—æ—ï¼Œç¾å±…å³è„‡æ˜¯ç”·ä¸ç–‘ã€‚	æˆ‘æ‰€æ‡·å­•å¿…æ˜¯å…‰é¡¯å®—æ—ï¼Œç¾å±…å³è„‡æ˜¯ç”·ä¸ç–‘ã€‚	013	The fetus I am carrying will surely bring glory to the family. It is now in the right side, and there is no doubt that it is a boy.ğŸ”½When the king heard this, he was overjoyed and said:
['ZH_T23_1442_013:0691b28_6']	ã€æ™‚ç‹èå·²å³å¤§æ­¡æ…¶ä½œå¦‚æ˜¯èªï¼š	ã€æ™‚ç‹èå·²å³å¤§æ­¡æ…¶ä½œå¦‚æ˜¯èªï¼š	013	Excellent! Excellent!
['ZH_T23_1442_013:0691c01_14']	ã€Œæˆ‘å¾ä¹…ä¾†å¸¸æ€ç¹¼å—£ç´¹æˆ‘æ´ªæ¥­ï¼Œæˆ‘æ—¢é•·é¤Šçµ‚æ‡·åå ±ï¼Œå»£ç‚ºæƒ æ–½ç¦åˆ©å®—è¦ªï¼Œæˆ‘æ­¿ä¸–å¾Œç¨±æšæˆ‘åè€Œç‚ºå‘ªé¡˜ï¼š	ã€Œæˆ‘å¾ä¹…ä¾†å¸¸æ€ç¹¼å—£ç´¹æˆ‘æ´ªæ¥­ï¼Œæˆ‘æ—¢é•·é¤Šçµ‚æ‡·åå ±ï¼Œå»£ç‚ºæƒ æ–½ç¦åˆ©å®—è¦ªï¼Œæˆ‘æ­¿ä¸–å¾Œç¨±æšæˆ‘åè€Œç‚ºå‘ªé¡˜ï¼š	013	I have long been thinking of someone to continue my lineage and succeed to my great enterprise. I have raised you and you will repay me in the end. Widely engage in giving and benefiting your relatives. After my death, praise my name and make aspirations, saying:
['ZH_T23_1442_013:0691c02_8']	ã€é¡˜æˆ‘çˆ¶æ¯æ‰€ç”Ÿä¹‹è™•ä»¥ç¦èŠåš´ã€‚	ã€é¡˜æˆ‘çˆ¶æ¯æ‰€ç”Ÿä¹‹è™•ä»¥ç¦èŠåš´ã€‚	013	'May the place where my parents are born be adorned with blessings.'
['ZH_T23_1442_013:0691c06_11']	ã€ã€æ˜¯æ™‚å½¼ç‹ç½®å¦ƒé«˜æ¨“éš¨æ„è€Œä½ï¼Œé©å…¶æ™‚ç¯€ä¾›çµ¦æ‰€é ˆï¼Œå¸¸ä»¤å¥³é†«ç‚ºèª¿é£²é£Ÿï¼Œå†·ç†±åˆåº¦è«¸å‘³å…·è¶³ï¼Œå¥‡å¦™ç ç“”ä»¥ç‚ºåš´é£¾ï¼Œå¦‚å¤©å©‡å¥³éŠæ­¡å–œåœ’ï¼Œå¸¸è™•åºŠåº§è¶³ä¸å±¥åœ°ï¼Œç›®ä¸è§€æƒ¡è‰²ï¼Œè€³ä¸è½æƒ¡è²ã€‚	ã€ã€æ˜¯æ™‚å½¼ç‹ç½®å¦ƒé«˜æ¨“éš¨æ„è€Œä½ï¼Œé©å…¶æ™‚ç¯€ä¾›çµ¦æ‰€é ˆï¼Œå¸¸ä»¤å¥³é†«ç‚ºèª¿é£²é£Ÿï¼Œå†·ç†±åˆåº¦è«¸å‘³å…·è¶³ï¼Œå¥‡å¦™ç ç“”ä»¥ç‚ºåš´é£¾ï¼Œå¦‚å¤©å©‡å¥³éŠæ­¡å–œåœ’ï¼Œå¸¸è™•åºŠåº§è¶³ä¸å±¥åœ°ï¼Œç›®ä¸è§€æƒ¡è‰²ï¼Œè€³ä¸è½æƒ¡è²ã€‚	013	 At that time, the king placed the queen in a high tower to live as she wished. In accordance with the season, he provided her with what she needed. He always had a female doctor regulate her diet, with cold and hot foods in proper balance and all flavors complete. She was adorned with wonderful jeweled necklaces, like a celestial maiden in the Joyous Garden. She always stayed on a bed and her feet did not touch the ground. Her eyes did not see unpleasant sights and her ears did not hear unpleasant sounds.
['ZH_T23_1442_013:0691c08_19']	ç¶“ä¹æœˆå·²ä¾¿èª•ä¸€æ¯ï¼Œé¡è²Œå¥‡ç‰¹äººæ‰€æ„›æ¨‚ï¼Œé¡å»£çœ‰é•·ã€é¼»é«˜ä¿®ç›´ã€é ‚åœ“è‹¥è“‹ã€è‰²ç¾å¦‚é‡‘ã€å‚æ‰‹éè†ï¼Œçœ¾æ‰€ç¨±æ­ã€‚	ç¶“ä¹æœˆå·²ä¾¿èª•ä¸€æ¯ï¼Œé¡è²Œå¥‡ç‰¹äººæ‰€æ„›æ¨‚ï¼Œé¡å»£çœ‰é•·ã€é¼»é«˜ä¿®ç›´ã€é ‚åœ“è‹¥è“‹ã€è‰²ç¾å¦‚é‡‘ã€å‚æ‰‹éè†ï¼Œçœ¾æ‰€ç¨±æ­ã€‚	013	After nine months had passed, she gave birth to a son. His appearance was extraordinary and he was loved by people. His forehead was broad and his eyebrows long. His nose was high and straight. The top of his head was round like a canopy. His complexion was beautiful like gold. His hanging hands reached below his knees. He was praised by the crowd.
['ZH_T23_1442_013:0691c09_17']	éä¸‰ä¸ƒæ—¥èšæœƒå®—è¦ªï¼Œå…¶çˆ¶ä»¥å…’ç¤ºè«¸è¦ªæ›°ï¼š	éä¸‰ä¸ƒæ—¥èšæœƒå®—è¦ªï¼Œå…¶çˆ¶ä»¥å…’ç¤ºè«¸è¦ªæ›°ï¼š	013	After twenty-one days, the family gathered and the father showed the child to the relatives, saying:
['ZH_T23_1442_013:0691c10_7']	ã€Œæ­¤å…’ä»Šè€…ç•¶ç«‹ä½•å­—ï¼Ÿ	ã€Œæ­¤å…’ä»Šè€…ç•¶ç«‹ä½•å­—ï¼Ÿ	013	What name should we give to this child?
['ZH_T23_1442_013:0691c11_11']	ã€å…¶å…’ç”Ÿå·²è‡ªç„¶æ·¨æ½”ï¼Œæœªé›¢åºŠè¤¥ä¸ç‚ºä¾¿åˆ©ï¼Œè«¸äººè­°æ›°ï¼š	ã€å…¶å…’ç”Ÿå·²è‡ªç„¶æ·¨æ½”ï¼Œæœªé›¢åºŠè¤¥ä¸ç‚ºä¾¿åˆ©ï¼Œè«¸äººè­°æ›°ï¼š	013	Since the child was born naturally pure and clean, not yet having soiled the bed with excrement, the people discussed:
['ZH_T23_1442_013:0691c14_14']	ã€Œä¸­åœ‹ä¹‹æ³•è‹¥å¤©ç„¶æ·¨æ½”è€…åä¹‹ç‚ºå¯¦ï¼Œç„¶æ­¤ç«¥å…’ç¨Ÿè­˜æ¸…æ·¨ï¼Œæœªé›¢åºŠè¤¥ä¾¿åˆ©ä¸ç‚ºï¼Œæ·¨æ½”éäººä¾¿æˆå¯¦ç‰©ï¼Œå¾©æ˜¯å£¯åŠ›å¤§ç‹ä¹‹å­ï¼Œæ‡‰èˆ‡ç«‹å­—åå¯¦åŠ›å­ã€‚	ã€Œä¸­åœ‹ä¹‹æ³•è‹¥å¤©ç„¶æ·¨æ½”è€…åä¹‹ç‚ºå¯¦ï¼Œç„¶æ­¤ç«¥å…’ç¨Ÿè­˜æ¸…æ·¨ï¼Œæœªé›¢åºŠè¤¥ä¾¿åˆ©ä¸ç‚ºï¼Œæ·¨æ½”éäººä¾¿æˆå¯¦ç‰©ï¼Œå¾©æ˜¯å£¯åŠ›å¤§ç‹ä¹‹å­ï¼Œæ‡‰èˆ‡ç«‹å­—åå¯¦åŠ›å­ã€‚	013	According to the law of the Central Kingdom, if one is naturally pure and clean, they are called 'real'. This child's nature and understanding are pure and clean, not yet having soiled the bed with excrement. Being purer than others, he becomes a real thing. Moreover, he is the son of King Powerful. We should name him 'Real Son'.
['ZH_T23_1442_013:0691c16_3']	ã€å…¶å¯¦åŠ›å­èª•ç”Ÿä¹‹æ—¥ï¼Œäº”ç™¾å£¯å£«å„ä¸¦ç”Ÿç”·ï¼Œéš¨å…¶å®¶æ—è€Œç«‹åå­—ã€‚	ã€å…¶å¯¦åŠ›å­èª•ç”Ÿä¹‹æ—¥ï¼Œäº”ç™¾å£¯å£«å„ä¸¦ç”Ÿç”·ï¼Œéš¨å…¶å®¶æ—è€Œç«‹åå­—ã€‚	013	 On the day Real Son was born, five hundred strong men each gave birth to a son. Following their families, names were given to them.
['ZH_T23_1442_013:0691c16_16']	æ™‚å‹è»ç‹å³ä»¥å¤ªå­æˆå…«é¤Šæ¯ï¼š	æ™‚å‹è»ç‹å³ä»¥å¤ªå­æˆå…«é¤Šæ¯ï¼š	013	At that time, King Victorious Army immediately entrusted the prince to eight wet nurses:
['ZH_T23_1442_013:0691c18_14']	äºŒä¾›ä¹³å“ºã€äºŒä½œè¤“æŒã€äºŒç‚ºæ¾¡æµ´ã€äºŒå…±æ­¡æˆ²ï¼Œçµ¦ä»¥ä¹³é…ªé†é†çŸ³èœœï¼Œé€Ÿä½¿é•·å¤§å¦‚è“®å‡ºæ± ã€‚	äºŒä¾›ä¹³å“ºã€äºŒä½œè¤“æŒã€äºŒç‚ºæ¾¡æµ´ã€äºŒå…±æ­¡æˆ²ï¼Œçµ¦ä»¥ä¹³é…ªé†é†çŸ³èœœï¼Œé€Ÿä½¿é•·å¤§å¦‚è“®å‡ºæ± ã€‚	013	two to feed him with milk, two to hold him in their arms, two to bathe him, and two to play with him. Providing him with milk, yogurt, ghee, and molasses, he quickly grew up like a lotus emerging from a pond.
['ZH_T23_1442_013:0691c19_14']	æ™‚æœ‰ç›¸å¸«æ–¼æ¯æ‡·ä¸­è¦©è¦‹å­©å­ï¼Œå³ä¾¿ç”Ÿå¿µï¼š	æ™‚æœ‰ç›¸å¸«æ–¼æ¯æ‡·ä¸­è¦©è¦‹å­©å­ï¼Œå³ä¾¿ç”Ÿå¿µï¼š	013	At that time, a physiognomist saw the child in the mother's womb and immediately thought:
['ZH_T23_1442_013:0691c21_4']	ã€Œæ­¤å­©å­è€…æ˜¯äºŒè¶³ç¦ç”°ï¼Œè‹¥äººæ–¼æ­¤å°‘èˆˆä¾›é¤Šï¼Œå½¼äººç•¶ç²å‹åŠŸå¾·åˆ©ã€‚	ã€Œæ­¤å­©å­è€…æ˜¯äºŒè¶³ç¦ç”°ï¼Œè‹¥äººæ–¼æ­¤å°‘èˆˆä¾›é¤Šï¼Œå½¼äººç•¶ç²å‹åŠŸå¾·åˆ©ã€‚	013	This child is a field of merit for the two-legged beings. If people make offerings to him, even a little, they will obtain the benefits of supreme merit.
['ZH_T23_1442_013:0691c21_14']	ã€ä½œæ˜¯å¿µå·²å‘Šä¹³æ¯æ›°ï¼š	ã€ä½œæ˜¯å¿µå·²å‘Šä¹³æ¯æ›°ï¼š	013	Having had this thought, he said to the wet nurse:
['ZH_T23_1442_013:0691c22_12']	ã€Œå¹¸è¦‹æ…ˆæ‚²æˆæˆ‘å­©å­ï¼Œæˆ‘æ¬²éš¨æƒ…å°‘æ™‚ä¾›é¤Šã€‚	ã€Œå¹¸è¦‹æ…ˆæ‚²æˆæˆ‘å­©å­ï¼Œæˆ‘æ¬²éš¨æƒ…å°‘æ™‚ä¾›é¤Šã€‚	013	Please show me your compassion and give me the child. I wish to make offerings to him for a short time as I please.
['ZH_T23_1442_013:0691c22_18']	ã€ä¹³æ¯å ±æ›°ï¼š	ã€ä¹³æ¯å ±æ›°ï¼š	013	The wet nurse replied:
['ZH_T23_1442_013:0691c23_15']	ã€Œæˆ‘æ–¼å­©å­å¯¦ç„¡è‡ªåœ¨ï¼Œæ±æ¬²å¾—è€…å¯ç™½ç‹çŸ¥ã€‚	ã€Œæˆ‘æ–¼å­©å­å¯¦ç„¡è‡ªåœ¨ï¼Œæ±æ¬²å¾—è€…å¯ç™½ç‹çŸ¥ã€‚	013	I have no control over the child. If you want to get him, you should inform the king.
['ZH_T23_1442_013:0691c24_10']	ã€æ˜¯æ™‚ç›¸å¸«è©£å¤§ç‹æ‰€ï¼Œè€Œç™½ç‹è¨€ï¼š	ã€æ˜¯æ™‚ç›¸å¸«è©£å¤§ç‹æ‰€ï¼Œè€Œç™½ç‹è¨€ï¼š	013	Then the physiognomist went to the great king and said to him:
['ZH_T23_1442_013:0691c25_17']	ã€Œç‹ä¹‹è–å­æ˜¯å‹ç¦ç”°ï¼Œè‹¥äººæ–¼æ­¤å°‘èˆˆä¾›é¤Šï¼Œå½¼äººç•¶ç²å‹åŠŸå¾·åˆ©ã€‚	ã€Œç‹ä¹‹è–å­æ˜¯å‹ç¦ç”°ï¼Œè‹¥äººæ–¼æ­¤å°‘èˆˆä¾›é¤Šï¼Œå½¼äººç•¶ç²å‹åŠŸå¾·åˆ©ã€‚	013	The king's holy son is a supreme field of merit. If people make offerings to him, even a little, they will obtain the benefits of supreme merit.
['ZH_T23_1442_013:0691c26_7']	å¹¸è¦‹æˆæˆ‘å¾®ä¼¸ä¾›é¤Šã€‚	å¹¸è¦‹æˆæˆ‘å¾®ä¼¸ä¾›é¤Šã€‚	013	Please give me the child so that I can make offerings to him.
['ZH_T23_1442_013:0691c26_13']	ã€æ™‚ç‹å ±æ›°ï¼š	ã€æ™‚ç‹å ±æ›°ï¼š	013	At that time, the king replied:
['ZH_T23_1442_013:0691c26_19']	ã€Œå¯éš¨æ±æ„ã€‚	ã€Œå¯éš¨æ±æ„ã€‚	013	You may do as you wish.
['ZH_T23_1442_013:0691c29_10']	ã€æ™‚å½¼ç›¸å¸«ä¾¿æŠ±æ­¸èˆï¼Œå…ˆæ²æµ´å·²æ¬¡å¡—å¦™é¦™ï¼Œä»¥ä¸Šåƒ¹è¡£è€Œè¦†èº«ä¸Šï¼Œä»¥é…¥èœœä¹³ç²¥ç››å¯¶å™¨ä¸­æŒä»¥å¥‰ä¸Šï¼Œæ—¢ä¾›é¤Šå·²é€æ­¸ç‹æ‰€ã€‚	ã€æ™‚å½¼ç›¸å¸«ä¾¿æŠ±æ­¸èˆï¼Œå…ˆæ²æµ´å·²æ¬¡å¡—å¦™é¦™ï¼Œä»¥ä¸Šåƒ¹è¡£è€Œè¦†èº«ä¸Šï¼Œä»¥é…¥èœœä¹³ç²¥ç››å¯¶å™¨ä¸­æŒä»¥å¥‰ä¸Šï¼Œæ—¢ä¾›é¤Šå·²é€æ­¸ç‹æ‰€ã€‚	013	The astrologer then took him back to his home, first bathing him, then applying fine incense, covering his body with expensive clothes, and filling a jeweled vessel with ghee, honey, and milk porridge to offer to him. After making offerings, he sent him back to the king.
['ZH_T23_1442_013:0692a01_12']	æ˜¯æ™‚ç«¥å­å¹´æ¼¸é•·å¤§ï¼Œå‚™æ•™æ›¸ç®—æ‰‹å°æŠ€è¡“æ‚‰çš†æ˜äº†ã€‚	æ˜¯æ™‚ç«¥å­å¹´æ¼¸é•·å¤§ï¼Œå‚™æ•™æ›¸ç®—æ‰‹å°æŠ€è¡“æ‚‰çš†æ˜äº†ã€‚	013	As the child gradually grew up, he was taught writing, calculation, hand seals, and skills, all of which he fully understood.
['ZH_T23_1442_013:0692a04_9']	åˆå‰å¸åˆ©ç‹ç¨®æ—ä¹‹æ³•ï¼Œæ‰€æœ‰æ¥­è—å’¸ä»¤ç¿’å­¸ï¼Œæ‰€è¬‚ä¹˜é¨è±¡é¦¬æ§å¾¡å…µè»Šï¼Œåˆ€å™¨å¹²æˆˆé‰¤ç´¢ä¹‹é¡ï¼Œæ‰‹è¶³å¥‡å·§æ–«å°„ä¹‹å„€ï¼Œç„¡ä¸é€šè§£ã€‚	åˆå‰å¸åˆ©ç‹ç¨®æ—ä¹‹æ³•ï¼Œæ‰€æœ‰æ¥­è—å’¸ä»¤ç¿’å­¸ï¼Œæ‰€è¬‚ä¹˜é¨è±¡é¦¬æ§å¾¡å…µè»Šï¼Œåˆ€å™¨å¹²æˆˆé‰¤ç´¢ä¹‹é¡ï¼Œæ‰‹è¶³å¥‡å·§æ–«å°„ä¹‹å„€ï¼Œç„¡ä¸é€šè§£ã€‚	013	Moreover, the law of the ká¹£atriya royal clan is that all occupations and arts should be learned, such as riding elephants and horses, controlling war chariots, knives, weapons, hooks, ropes, and so forth, and the techniques of chopping and shooting with hands and feet, all of which he fully understood.
['ZH_T23_1442_013:0692a06_15']	æ™‚åŒæ—¥ç”Ÿäº”ç™¾ç«¥å­ï¼Œå¦‚å‰æŠ€è—äº¦çš†æ˜é”ï¼Œå…¶çˆ¶çˆ¾æ™‚æ–¼æ˜¥å¤å†¬ç‚ºé€ ä¸‰æ®¿å¹¶ä¸‰è‹‘åœ’ï¼Œä¸‰ç¨®å©‡å¥³è¬‚ä¸Šä¸­ä¸‹ã€‚	æ™‚åŒæ—¥ç”Ÿäº”ç™¾ç«¥å­ï¼Œå¦‚å‰æŠ€è—äº¦çš†æ˜é”ï¼Œå…¶çˆ¶çˆ¾æ™‚æ–¼æ˜¥å¤å†¬ç‚ºé€ ä¸‰æ®¿å¹¶ä¸‰è‹‘åœ’ï¼Œä¸‰ç¨®å©‡å¥³è¬‚ä¸Šä¸­ä¸‹ã€‚	013	At that time, the five hundred children born on the same day as him also fully understood the aforementioned skills and arts. Their father then built three palaces and three gardens for them for the three seasons of spring, summer, and winter, with three kinds of court ladies, namely superior, middling, and inferior.
['ZH_T23_1442_013:0692a07_18']	å¾Œæ–¼ä¸€æ™‚å…¶å¯¦åŠ›å­æ˜‡è™•é«˜æ¨“ï¼Œå°‡è«¸ä¼å¥³å…±ç‚ºå¨›æ¨‚ã€‚	å¾Œæ–¼ä¸€æ™‚å…¶å¯¦åŠ›å­æ˜‡è™•é«˜æ¨“ï¼Œå°‡è«¸ä¼å¥³å…±ç‚ºå¨›æ¨‚ã€‚	013	Later, at one time, the son of ÅšÅ«radatta ascended to a high tower, together with court ladies, to enjoy entertainment.
['ZH_T23_1442_013:0692a09_16']	æ¯æ—¥ä¸‰æ™‚äº”ç™¾ç«¥å­å¸¸ä¾†é›†è¦‹ï¼Œæ›¾æ–¼ä»–æ—¥å…¶äº”ç™¾äººå‡ºå¤–ç•‹çµï¼Œç«Ÿæ—¥é¦³é¨ä¸€ç„¡æ‰€ç²ã€‚	æ¯æ—¥ä¸‰æ™‚äº”ç™¾ç«¥å­å¸¸ä¾†é›†è¦‹ï¼Œæ›¾æ–¼ä»–æ—¥å…¶äº”ç™¾äººå‡ºå¤–ç•‹çµï¼Œç«Ÿæ—¥é¦³é¨ä¸€ç„¡æ‰€ç²ã€‚	013	Every day at the three times, five hundred children would gather to see him. Once on another day, the five hundred people went out hunting, chasing all day without catching anything.
['ZH_T23_1442_013:0692a11_1']	é‚ä½æ—é‡æ˜æ—¥å‡ºéŠï¼Œå¤šæœ‰æ‰€å¾—è‡³æš®æ–¹é‚„ï¼Œä¾¿ç›¸è­°æ›°ï¼š	é‚ä½æ—é‡æ˜æ—¥å‡ºéŠï¼Œå¤šæœ‰æ‰€å¾—è‡³æš®æ–¹é‚„ï¼Œä¾¿ç›¸è­°æ›°ï¼š	013	They then stayed in the forest and went out to play the next day, catching many things and returning home in the evening. They discussed among themselves, saying:
['ZH_T23_1442_013:0692a11_20']	ã€Œæ—¥æ—¢å°‡æš®ç„¡ç·£èµ´é›†ï¼Œå¾…è‡³æ˜æœæ–¹è¦‹å¤ªå­ã€‚	ã€Œæ—¥æ—¢å°‡æš®ç„¡ç·£èµ´é›†ï¼Œå¾…è‡³æ˜æœæ–¹è¦‹å¤ªå­ã€‚	013	Since it is getting late, we have no chance to attend the gathering. We will see the prince tomorrow morning instead.
['ZH_T23_1442_013:0692a12_17']	ã€è‡³ç¬¬ä¸‰æ—¥çœ¾äººæ–¹è¦‹ï¼Œäºæ™‚å¤ªå­å‘Šçœ¾äººæ›°ï¼š	ã€è‡³ç¬¬ä¸‰æ—¥çœ¾äººæ–¹è¦‹ï¼Œäºæ™‚å¤ªå­å‘Šçœ¾äººæ›°ï¼š	013	On the third day, the crowd finally saw him. At that time, the prince said to the crowd:
['ZH_T23_1442_013:0692a13_16']	ã€Œä»ç­‰èˆ‡æˆ‘åŒç”Ÿå¸¸å…±éŠæˆ²ï¼Œä½•æ„ä¸‰æ—¥æ–¹ä¾†ï¼Ÿ	ã€Œä»ç­‰èˆ‡æˆ‘åŒç”Ÿå¸¸å…±éŠæˆ²ï¼Œä½•æ„ä¸‰æ—¥æ–¹ä¾†ï¼Ÿ	013	You and I were born together and always played together. Why did you come only on the third day?
['ZH_T23_1442_013:0692a13_20']	ã€ç™½è¨€ï¼š	ã€ç™½è¨€ï¼š	013	They said:
['ZH_T23_1442_013:0692a14_5']	ã€Œæˆ‘ç­‰å‡ºç•‹ã€‚	ã€Œæˆ‘ç­‰å‡ºç•‹ã€‚	013	We went out hunting.
['ZH_T23_1442_013:0692a14_8']	ã€æ›°ï¼š	ã€æ›°ï¼š	013	He said:
['ZH_T23_1442_013:0692a14_14']	ã€Œä½•è¬‚ç‚ºç•‹ï¼Ÿ	ã€Œä½•è¬‚ç‚ºç•‹ï¼Ÿ	013	What is meant by hunting?
['ZH_T23_1442_013:0692a14_17']	ã€ç­”ï¼š	ã€ç­”ï¼š	013	They replied:
['ZH_T23_1442_013:0692a14_23']	ã€Œå»£æ®ºè«¸é¹¿ã€‚	ã€Œå»£æ®ºè«¸é¹¿ã€‚	013	We killed many deer.
['ZH_T23_1442_013:0692a14_28']	ã€å¤ªå­æ›°ï¼š	ã€å¤ªå­æ›°ï¼š	013	The prince said:
['ZH_T23_1442_013:0692a15_5']	ã€Œå½¼ä½•é£²é£Ÿï¼Ÿ	ã€Œå½¼ä½•é£²é£Ÿï¼Ÿ	013	What do they eat and drink?
['ZH_T23_1442_013:0692a15_9']	ã€ç­”æ›°ï¼š	ã€ç­”æ›°ï¼š	013	They said:
['ZH_T23_1442_013:0692a15_15']	ã€Œé£²æ°´é£Ÿè‰ã€‚	ã€Œé£²æ°´é£Ÿè‰ã€‚	013	They drink water and eat grass.
['ZH_T23_1442_013:0692a16_6']	ã€ã€Œè‹¥å¦‚æ˜¯è€…ç„¡ææ–¼äººï¼Œä½•ç·£å‚·æ®ºï¼Ÿ	ã€ã€Œè‹¥å¦‚æ˜¯è€…ç„¡ææ–¼äººï¼Œä½•ç·£å‚·æ®ºï¼Ÿ	013	If that is so, they do no harm to people. Why do you injure and kill them?
['ZH_T23_1442_013:0692a16_10']	ã€ç­”æ›°ï¼š	ã€ç­”æ›°ï¼š	013	He replied:
['ZH_T23_1442_013:0692a16_21']	ã€Œè‹¥è¦‹æ®ºæ™‚ï¼Œå¿ƒç”Ÿå–œæ‚…ã€‚	ã€Œè‹¥è¦‹æ®ºæ™‚ï¼Œå¿ƒç”Ÿå–œæ‚…ã€‚	013	When I see killing, my heart is filled with joy.
['ZH_T23_1442_013:0692a17_1']	ã€å¤ªå­æ›°ï¼š	ã€å¤ªå­æ›°ï¼š	013	The prince said:
['ZH_T23_1442_013:0692a17_15']	ã€Œä»ç­‰ä¸æ‡‰è¦‹ä»–å—è‹¦å¿ƒç”Ÿæ­¡æ¨‚ã€‚	ã€Œä»ç­‰ä¸æ‡‰è¦‹ä»–å—è‹¦å¿ƒç”Ÿæ­¡æ¨‚ã€‚	013	You should not be happy when seeing others suffer.
['ZH_T23_1442_013:0692a17_21']	ã€è«¸äººè­°æ›°ï¼š	ã€è«¸äººè­°æ›°ï¼š	013	The people discussed among themselves:
