segmentnr	original	analyzed	translated
['ZH_T17_0721_035:0204b09_18']	ä¸‰åä¸‰å¤©ç¬¬ä¸‰åè™•åæ›°ä¸Šè¡Œã€‚	ä¸‰åä¸‰å¤©ç¬¬ä¸‰åè™•åæ›°ä¸Šè¡Œã€‚	The Thirty-third place of the Thirty-three Celestials is called Upper Realm.
['ZH_T17_0721_035:0204b10_8']	çœ¾ç”Ÿä½•æ¥­ç”Ÿæ–¼æ­¤å¤©ï¼Ÿ	çœ¾ç”Ÿä½•æ¥­ç”Ÿæ–¼æ­¤å¤©ï¼Ÿ	What karma do sentient beings have to be born in this heaven?
['ZH_T17_0721_035:0204b10_14']	å½¼ä»¥èæ…§è¦‹ï¼š	å½¼ä»¥èæ…§è¦‹ï¼š	They see with their wisdom of hearing:
['ZH_T17_0721_035:0204b12_2']	æœ‰çœ¾ç”Ÿé †æ³•ä¿®è¡Œï¼Œä¿¡æ¥­æœå ±ï¼Œè¡Œæ–¼æ­£è¦‹ï¼Œå¸ƒæ–½ä¿®ç¦ï¼ŒæŒä¸€åˆ†æˆ’ã€‚	æœ‰çœ¾ç”Ÿé †æ³•ä¿®è¡Œï¼Œä¿¡æ¥­æœå ±ï¼Œè¡Œæ–¼æ­£è¦‹ï¼Œå¸ƒæ–½ä¿®ç¦ï¼ŒæŒä¸€åˆ†æˆ’ã€‚	There are sentient beings who practice in accordance with the Dharma, believe in the fruits of karma, practice right views, give in order to cultivate blessings, and uphold a portion of the precepts.
['ZH_T17_0721_035:0204b12_12']	åˆæŒå¤šåˆ†ï¼Œå¾Œä¸€åˆ‡æŒã€‚	åˆæŒå¤šåˆ†ï¼Œå¾Œä¸€åˆ‡æŒã€‚	First they uphold most of them, and later they uphold all of them.
['ZH_T17_0721_035:0204b13_5']	æ–¼é“è¡Œåƒ§å¸ƒæ–½é´é‹åŠæ–½æ¾¡ç“¶ã€‚	æ–¼é“è¡Œåƒ§å¸ƒæ–½é´é‹åŠæ–½æ¾¡ç“¶ã€‚	They give boots and shoes and alms bowls to monks who travel on the road.
['ZH_T17_0721_035:0204b13_10']	ä¸æ®ºä¸ç›œã€‚	ä¸æ®ºä¸ç›œã€‚	They do not kill or steal.
['ZH_T17_0721_035:0204b14_11']	æˆ–æœ‰é‚Šåœ°å¤·äººæ‰äººæ¬²æ®ºï¼Œæ˜¯æŒæˆ’äººæ•‘è´–ä»¤è„«ã€‚	æˆ–æœ‰é‚Šåœ°å¤·äººæ‰äººæ¬²æ®ºï¼Œæ˜¯æŒæˆ’äººæ•‘è´–ä»¤è„«ã€‚	There may be barbarians in the borderlands who capture people and want to kill them, but these precept-keepers rescue and redeem them.
['ZH_T17_0721_035:0204b15_16']	è‹¥æ˜¯ç‹è€…ï¼Œæˆ–è¦‹æ› é‡å¾ä¼å¾—è²¡ï¼ŒæçŠ¯å·ç›œï¼Œä¸å—å…¶åˆ†ã€‚	è‹¥æ˜¯ç‹è€…ï¼Œæˆ–è¦‹æ› é‡å¾ä¼å¾—è²¡ï¼ŒæçŠ¯å·ç›œï¼Œä¸å—å…¶åˆ†ã€‚	If they are kings, they may see wealth obtained through conquest in the wilderness, but fearing to violate theft, they do not accept their share.
['ZH_T17_0721_035:0204b16_1']	æ˜¯åä¸ç›œã€‚	æ˜¯åä¸ç›œã€‚	This is called not stealing.
['ZH_T17_0721_035:0204b16_7']	äº‘ä½•ä¸æ®ºç”Ÿï¼Ÿ	äº‘ä½•ä¸æ®ºç”Ÿï¼Ÿ	What is meant by not killing?
['ZH_T17_0721_035:0204b17_15']	æ˜¯æŒæˆ’äººæˆ–æ˜¯ç‹è€…ï¼Œè¦‹æœ‰æƒ¡äººæ¬²ä¾†å®³å·±ï¼Œä»¥æŒæˆ’æ•…ä¸æ–·å…¶å‘½ã€‚	æ˜¯æŒæˆ’äººæˆ–æ˜¯ç‹è€…ï¼Œè¦‹æœ‰æƒ¡äººæ¬²ä¾†å®³å·±ï¼Œä»¥æŒæˆ’æ•…ä¸æ–·å…¶å‘½ã€‚	This person who upholds the precepts, whether a king or not, sees evil people who want to harm him, but because he upholds the precepts, he does not take their lives.
['ZH_T17_0721_035:0204b18_19']	å¦‚æ˜¯ä¹‹äººç•æ¥­æœå ±ï¼Œå‘½çµ‚ç”Ÿæ–¼ä¸‰åä¸‰å¤©ï¼Œåä¸Šè¡Œåœ°ã€‚	å¦‚æ˜¯ä¹‹äººç•æ¥­æœå ±ï¼Œå‘½çµ‚ç”Ÿæ–¼ä¸‰åä¸‰å¤©ï¼Œåä¸Šè¡Œåœ°ã€‚	Such a person fears the retribution of karma. When their life ends, they are born in the Heaven of the Thirty-three, in the place called Upper Realm.
['ZH_T17_0721_035:0204b22_5']	ç”Ÿæ­¤å¤©å·²ï¼Œä»¥å–„æ¥­æ•…ï¼Œä¸‰åƒå¤©å¥³ä»¥ç‚ºçµ¦ä¾ï¼Œè«¸å¤©å¥³çœ¾ç¨®ç¨®ç“”çèŠåš´å…¶èº«ï¼Œæ‰‹åŸ·ç¨®ç¨®ä¼æ¨‚ç´ç‘ŸåŠç¨®ç¨®é¦™ï¼Œç¨®ç¨®æ­Œé Œè®šæ­å¤©å­ï¼Œå‘å¤©å­æ‰€æ¬²å¿ƒè¦ªè¿‘ã€‚	ç”Ÿæ­¤å¤©å·²ï¼Œä»¥å–„æ¥­æ•…ï¼Œä¸‰åƒå¤©å¥³ä»¥ç‚ºçµ¦ä¾ï¼Œè«¸å¤©å¥³çœ¾ç¨®ç¨®ç“”çèŠåš´å…¶èº«ï¼Œæ‰‹åŸ·ç¨®ç¨®ä¼æ¨‚ç´ç‘ŸåŠç¨®ç¨®é¦™ï¼Œç¨®ç¨®æ­Œé Œè®šæ­å¤©å­ï¼Œå‘å¤©å­æ‰€æ¬²å¿ƒè¦ªè¿‘ã€‚	Having been born in this heaven, due to their good karma, three thousand celestial maidens serve them. The celestial maidens adorn their bodies with various necklaces and hold various musical instruments such as lutes and harps, as well as various fragrances. They sing various songs and praise the celestial being, wishing to draw near to him with thoughts of desire.
['ZH_T17_0721_035:0204b23_13']	å¤©å­è¦‹ä¹‹ï¼Œäº¦å‘å¤©å¥³å„å„ç”Ÿæ–¼æ­¡å–œä¹‹å¿ƒï¼Œçš†å…±å¾€è©£å¸¸æ­¡å–œåœ’ã€‚	å¤©å­è¦‹ä¹‹ï¼Œäº¦å‘å¤©å¥³å„å„ç”Ÿæ–¼æ­¡å–œä¹‹å¿ƒï¼Œçš†å…±å¾€è©£å¸¸æ­¡å–œåœ’ã€‚	When the celestial being sees them, he also feels joy towards the celestial maidens and they all go together to the Constant Joy Garden.
['ZH_T17_0721_035:0204b25_6']	å…¶æ—ä¸€åˆ‡æ¯˜ç‰ç’ƒå¯¶ã€é‡‘éŠ€ä¹‹æ¨¹ä»¥ç‚ºèŠåš´ï¼Œç¨®ç¨®æµæ³‰è“®èŠ±æ—æ± èŠåš´å…¶åœ’ã€‚	å…¶æ—ä¸€åˆ‡æ¯˜ç‰ç’ƒå¯¶ã€é‡‘éŠ€ä¹‹æ¨¹ä»¥ç‚ºèŠåš´ï¼Œç¨®ç¨®æµæ³‰è“®èŠ±æ—æ± èŠåš´å…¶åœ’ã€‚	The forest is adorned with vaiá¸Å«rya jewels, gold, and silver trees, and various streams, lotus groves, and ponds adorn the garden.
['ZH_T17_0721_035:0204b27_9']	æœ‰ç„¡é‡æ²³è€Œç‚ºèŠåš´ï¼Œç¨®ç¨®éˆ´ç¶²å½Œè¦†å…¶ä¸Šï¼Œç„¡é‡çœ¾é³¥å‘¨éèŠåš´ï¼Œå‡ºæ–¼ç„¡é‡ç¨®ç¨®ç¾å¦™å’Œé›…ä¹‹éŸ³ã€‚	æœ‰ç„¡é‡æ²³è€Œç‚ºèŠåš´ï¼Œç¨®ç¨®éˆ´ç¶²å½Œè¦†å…¶ä¸Šï¼Œç„¡é‡çœ¾é³¥å‘¨éèŠåš´ï¼Œå‡ºæ–¼ç„¡é‡ç¨®ç¨®ç¾å¦™å’Œé›…ä¹‹éŸ³ã€‚	There are innumerable rivers adorning it, and nets of various bells cover it above. Innumerable birds adorn it all around, emitting innumerable kinds of beautiful and harmonious sounds.
['ZH_T17_0721_035:0204b28_17']	å…¶æ—å¦‚æ˜¯ç¨®ç¨®èŠåš´ï¼Œå¤©å­å¤©å¥³æ–¼åœ’æ—ä¸­äº’ç›¸æ˜ ç™¼ï¼Œè½‰å¢å¦™å¥½ã€‚	å…¶æ—å¦‚æ˜¯ç¨®ç¨®èŠåš´ï¼Œå¤©å­å¤©å¥³æ–¼åœ’æ—ä¸­äº’ç›¸æ˜ ç™¼ï¼Œè½‰å¢å¦™å¥½ã€‚	The forest is adorned in this way. The gods and goddesses in the garden and forest reflect each other, becoming even more wonderful.
['ZH_T17_0721_035:0204c03_1']	æ—ä¸­æœ‰å±±ï¼Œåæ›°éŠæˆ²ï¼Œä¸ƒå¯¶æ‰€æˆï¼Œæœ‰ç„¡é‡ç¨®çœ¾è‰²å¯¶é¹¿ç«¯æ­£èŠåš´ï¼Œèµ¤è“®èŠ±å¯¶ä»¥ç‚ºå…¶è„‡ï¼ŒçœŸé‡‘ç‚ºèƒŒï¼Œç™½éŠ€ç‚ºè…¹ï¼ŒçœŸé‡‘ç‚ºé ‚ï¼ŒçŠç‘šç‚ºè¶³ï¼Œé —æ¢¨ç‚ºè§’ã€‚	æ—ä¸­æœ‰å±±ï¼Œåæ›°éŠæˆ²ï¼Œä¸ƒå¯¶æ‰€æˆï¼Œæœ‰ç„¡é‡ç¨®çœ¾è‰²å¯¶é¹¿ç«¯æ­£èŠåš´ï¼Œèµ¤è“®èŠ±å¯¶ä»¥ç‚ºå…¶è„‡ï¼ŒçœŸé‡‘ç‚ºèƒŒï¼Œç™½éŠ€ç‚ºè…¹ï¼ŒçœŸé‡‘ç‚ºé ‚ï¼ŒçŠç‘šç‚ºè¶³ï¼Œé —æ¢¨ç‚ºè§’ã€‚	In the forest there is a mountain called Playful, made of the seven treasures. There are innumerable kinds of beautiful jeweled deer, with red lotus jewels for their flanks, true gold for their backs, white silver for their bellies, true gold for their heads, coral for their feet, and crystal for their horns.
['ZH_T17_0721_035:0204c04_10']	æˆ–æœ‰ä¸€è‰²ï¼Œæ‰€è¬‚é‡‘è‰²ï¼Œæˆ–æœ‰äºŒè‰²â€”â€”é‡‘è‰²ã€éŠ€è‰²ï¼Œä¸€åˆ‡çœ¾è‰²ä»¥ç‚ºèŠåš´ã€‚	æˆ–æœ‰ä¸€è‰²ï¼Œæ‰€è¬‚é‡‘è‰²ï¼Œæˆ–æœ‰äºŒè‰²â€”â€”é‡‘è‰²ã€éŠ€è‰²ï¼Œä¸€åˆ‡çœ¾è‰²ä»¥ç‚ºèŠåš´ã€‚	Some have one color, namely golden color, and some have two colors - golden color and silver color. All kinds of colors adorn them.
['ZH_T17_0721_035:0204c06_5']	ä¸€åˆ‡è«¸é¹¿æ–¼æ—æ¨¹é–“éš¨å¤©çœ¾è¡Œï¼Œå‡ºçœ¾å¦™éŸ³å¦‚å¤©å¥³æ­Œï¼Œå¦‚æ˜¯çœ¾é¹¿æ­Œçœ¾å¦™è²ã€‚	ä¸€åˆ‡è«¸é¹¿æ–¼æ—æ¨¹é–“éš¨å¤©çœ¾è¡Œï¼Œå‡ºçœ¾å¦™éŸ³å¦‚å¤©å¥³æ­Œï¼Œå¦‚æ˜¯çœ¾é¹¿æ­Œçœ¾å¦™è²ã€‚	All the deer follow the gods among the forests and trees, emitting various wonderful sounds like the singing of heavenly maidens. The deer sing in this way with various wonderful sounds.
['ZH_T17_0721_035:0204c08_3']	æ­¤è«¸å¤©çœ¾æ—¢å—å¦‚æ˜¯ç„¡é‡æ¨‚å·²ï¼Œå¾©å¾€è©£æ–¼é ˆå½Œå±±å³¯ï¼Œæ–¼å±±å³¯ä¸­æœ‰ä¸€å¤§æ²³ï¼Œåæ›°å±±è°·ã€‚	æ­¤è«¸å¤©çœ¾æ—¢å—å¦‚æ˜¯ç„¡é‡æ¨‚å·²ï¼Œå¾©å¾€è©£æ–¼é ˆå½Œå±±å³¯ï¼Œæ–¼å±±å³¯ä¸­æœ‰ä¸€å¤§æ²³ï¼Œåæ›°å±±è°·ã€‚	After these heavenly beings have experienced such immeasurable pleasures, they go to the peak of Mount Sumeru, where there is a great river called Mountain Valley.
['ZH_T17_0721_035:0204c10_4']	ä¹˜ç¨®ç¨®æ®¿ï¼Œç¨®ç¨®ä¼æ¨‚äº”æ¨‚éŸ³è²ï¼Œå‹æ¬²å…·è¶³ï¼Œç¬¬ä¸€æ­¡å–œï¼Œå¨å¾·å…·è¶³ï¼Œå¾€è©£é ˆå½Œå±±å³¯å±±è°·æ²³æ‰€ã€‚	ä¹˜ç¨®ç¨®æ®¿ï¼Œç¨®ç¨®ä¼æ¨‚äº”æ¨‚éŸ³è²ï¼Œå‹æ¬²å…·è¶³ï¼Œç¬¬ä¸€æ­¡å–œï¼Œå¨å¾·å…·è¶³ï¼Œå¾€è©£é ˆå½Œå±±å³¯å±±è°·æ²³æ‰€ã€‚	Riding various palaces, with the sounds of the five kinds of music from various instruments, endowed with the best desires, supremely joyful, and fully majestic, they go to the river in the mountain valley on the peak of Mount Sumeru.
['ZH_T17_0721_035:0204c10_18']	æ–¼æ­¤ç¨®ç¨®æ²³å²¸ä¹‹é–“ï¼ŒéŠæˆ²å—æ¨‚ã€‚	æ–¼æ­¤ç¨®ç¨®æ²³å²¸ä¹‹é–“ï¼ŒéŠæˆ²å—æ¨‚ã€‚	Between the various river banks, they play and enjoy themselves.
['ZH_T17_0721_035:0204c12_11']	æµæ°´å²¸ä¸­ã€è“®èŠ±æ—ä¸­ã€åœ’æ—ä¹‹ä¸­æ­ŒéŸ³æ‚…è€³ï¼Œå—æ–¼æ¬²æ¨‚ï¼Œçš†ç”Ÿæ­¡å–œäº’ç›¸æ„›æ•¬ã€‚	æµæ°´å²¸ä¸­ã€è“®èŠ±æ—ä¸­ã€åœ’æ—ä¹‹ä¸­æ­ŒéŸ³æ‚…è€³ï¼Œå—æ–¼æ¬²æ¨‚ï¼Œçš†ç”Ÿæ­¡å–œäº’ç›¸æ„›æ•¬ã€‚	On the banks of the flowing waters, in the lotus groves, and in the gardens, the sounds of singing are delightful to the ears, and they experience the pleasures of desire, all giving rise to joy and mutual respect.
['ZH_T17_0721_035:0204c13_11']	å¤šæœ‰å¤©å­åŠå¤©å¥³çœ¾ï¼ŒèŠ±é¦™å¡—èº«ï¼ŒèŠ±é¬˜è²«é ‚ã€‚	å¤šæœ‰å¤©å­åŠå¤©å¥³çœ¾ï¼ŒèŠ±é¦™å¡—èº«ï¼ŒèŠ±é¬˜è²«é ‚ã€‚	There are many heavenly beings and celestial maidens, whose bodies are anointed with flowers and fragrances, and flower garlands draped over their heads.
['ZH_T17_0721_035:0204c14_11']	ä»¥å–„æ¥­æ•…ï¼Œå—å¤©å¿«æ¨‚ï¼Œä»¥æ¥­åŠ›æ•…ï¼Œéš¨é †éŠæˆ²ã€‚	ä»¥å–„æ¥­æ•…ï¼Œå—å¤©å¿«æ¨‚ï¼Œä»¥æ¥­åŠ›æ•…ï¼Œéš¨é †éŠæˆ²ã€‚	Due to their good karma, they experience heavenly bliss, and by the power of their karma, they follow and play.
['ZH_T17_0721_035:0204c16_1']	å¦‚å¤©æ‰€æ‡‰ï¼Œå—å¤©ä¹‹æ¨‚ï¼Œä¸å¯è­¬å–»ï¼Œä»Šèªªå°‘åˆ†ï¼Œä¸€åˆ‡ä¸–äººä¸èƒ½å…·èªªã€‚	å¦‚å¤©æ‰€æ‡‰ï¼Œå—å¤©ä¹‹æ¨‚ï¼Œä¸å¯è­¬å–»ï¼Œä»Šèªªå°‘åˆ†ï¼Œä¸€åˆ‡ä¸–äººä¸èƒ½å…·èªªã€‚	The pleasures they experience as gods are beyond analogy, but now a small portion is described, and all worldly people cannot fully describe them.
['ZH_T17_0721_035:0204c16_5']	ä½•ä»¥æ•…ï¼Ÿ	ä½•ä»¥æ•…ï¼Ÿ	Why is this?
['ZH_T17_0721_035:0204c16_19']	ä¸å¯è­¬å–»ï¼Œå¦‚æ˜¯å¤©æ¨‚ç„¡ç›¸ä¼¼æ•…ã€‚	ä¸å¯è­¬å–»ï¼Œå¦‚æ˜¯å¤©æ¨‚ç„¡ç›¸ä¼¼æ•…ã€‚	It is because this heavenly pleasure is incomparable and has no equivalent.
['ZH_T17_0721_035:0204c17_14']	äººä¸­æŒæˆ’ï¼Œå–„æ¥­å› æ•…ï¼Œå—å¦‚æ˜¯æ¨‚ã€‚	äººä¸­æŒæˆ’ï¼Œå–„æ¥­å› æ•…ï¼Œå—å¦‚æ˜¯æ¨‚ã€‚	Because of the causes of good karma of observing precepts among humans, one experiences such pleasures.
['ZH_T17_0721_035:0204c19_15']	æ–¼æ­¤å¤©ä¸­ï¼Œå—äº”æ¬²æ¨‚ï¼Œä¹ƒè‡³å¯æ„›å–„æ¥­ç ´å£æœ½ç›¡ï¼Œå‘½çµ‚é‚„é€€ï¼Œéš¨æ¥­æµè½‰ï¼Œå¢®æ–¼åœ°ç„ã€é¤“é¬¼ã€ç•œç”Ÿã€‚	æ–¼æ­¤å¤©ä¸­ï¼Œå—äº”æ¬²æ¨‚ï¼Œä¹ƒè‡³å¯æ„›å–„æ¥­ç ´å£æœ½ç›¡ï¼Œå‘½çµ‚é‚„é€€ï¼Œéš¨æ¥­æµè½‰ï¼Œå¢®æ–¼åœ°ç„ã€é¤“é¬¼ã€ç•œç”Ÿã€‚	In this heaven, one experiences the pleasures of the five desires until the delightful good karma is destroyed and exhausted, one's life ends and one falls back, following karma to transmigrate and fall into hell, hungry ghosts, or animals.
['ZH_T17_0721_035:0204c21_11']	è‹¥ç”Ÿäººä¸­ï¼Œç¬¬ä¸€å®‰æ¨‚ï¼Œè¿‘æ–¼å±±æ¾¤ã€å¤šæœ‰æ²³æ—åœ‹åœŸä¹‹ä¸­ï¼Œæˆ–ç‚ºå¤§ç‹æˆ–ç‚ºå¤§è‡£ï¼Œç¬¬ä¸€å¨å¾·ã€‚	è‹¥ç”Ÿäººä¸­ï¼Œç¬¬ä¸€å®‰æ¨‚ï¼Œè¿‘æ–¼å±±æ¾¤ã€å¤šæœ‰æ²³æ—åœ‹åœŸä¹‹ä¸­ï¼Œæˆ–ç‚ºå¤§ç‹æˆ–ç‚ºå¤§è‡£ï¼Œç¬¬ä¸€å¨å¾·ã€‚	If reborn among humans, one has the utmost happiness, is close to mountains and marshes, has many rivers and forests in the country, and becomes either a great king or a great minister with the utmost authority.
['ZH_T17_0721_035:0204c21_16']	ä»¥é¤˜æ¥­æ•…ã€‚	ä»¥é¤˜æ¥­æ•…ã€‚	This is due to remaining karma.
['ZH_T17_0721_035:0204c22_20']	ã€Œå¾©æ¬¡ï¼Œæ¯”ä¸˜çŸ¥æ¥­æœå ±ï¼Œè§€ä¸‰åä¸‰å¤©æ‰€ä½ä¹‹åœ°ã€‚	ã€Œå¾©æ¬¡ï¼Œæ¯”ä¸˜çŸ¥æ¥­æœå ±ï¼Œè§€ä¸‰åä¸‰å¤©æ‰€ä½ä¹‹åœ°ã€‚	Furthermore, the bhiká¹£us know the fruits of karma and contemplate the abodes of the Thirty-three Celestials.
['ZH_T17_0721_035:0204c23_5']	å½¼ä»¥èæ…§è¦‹ï¼š	å½¼ä»¥èæ…§è¦‹ï¼š	They see with their wisdom of hearing:
['ZH_T17_0721_035:0204c24_1']	ä¸‰åä¸‰å¤©ç¬¬ä¸‰åä¸€åœ°åå¨å¾·é¡ã€‚	ä¸‰åä¸‰å¤©ç¬¬ä¸‰åä¸€åœ°åå¨å¾·é¡ã€‚	The Thirty-third Ground of the Thirty-three Celestials is called Majestic Countenance.
['ZH_T17_0721_035:0204c24_10']	çœ¾ç”Ÿä½•æ¥­ç”Ÿæ–¼å½¼å¤©ï¼Ÿ	çœ¾ç”Ÿä½•æ¥­ç”Ÿæ–¼å½¼å¤©ï¼Ÿ	What karma do sentient beings have to be born in that heaven?
['ZH_T17_0721_035:0204c24_16']	å½¼ä»¥èæ…§è¦‹ï¼š	å½¼ä»¥èæ…§è¦‹ï¼š	They see with their wisdom of hearing:
['ZH_T17_0721_035:0204c27_3']	æœ‰çœ¾ç”Ÿç¬¬ä¸€æ·¨å¿ƒï¼Œå¸ƒæ–½ä¿®ç¦ï¼ŒæŒä¸ƒç¨®æˆ’ï¼Œä¸è¿‘æƒ¡å‹ï¼ŒæŒæˆ’ä¸æ¿ï¼Œè­·æŒç¦å¾·ï¼Œå¸¸å‹¤ç²¾é€²ï¼Œä¸€å¿ƒç›´å¿ƒï¼Œå¦‚ç…‰çœŸé‡‘ã€‚	æœ‰çœ¾ç”Ÿç¬¬ä¸€æ·¨å¿ƒï¼Œå¸ƒæ–½ä¿®ç¦ï¼ŒæŒä¸ƒç¨®æˆ’ï¼Œä¸è¿‘æƒ¡å‹ï¼ŒæŒæˆ’ä¸æ¿ï¼Œè­·æŒç¦å¾·ï¼Œå¸¸å‹¤ç²¾é€²ï¼Œä¸€å¿ƒç›´å¿ƒï¼Œå¦‚ç…‰çœŸé‡‘ã€‚	There are sentient beings with the utmost pure mind, who give, cultivate blessings, uphold the seven kinds of precepts, do not associate with bad friends, uphold the precepts without impurity, protect and uphold blessings and virtues, always diligently make progress, with a single-minded and upright mind, like refining true gold.
['ZH_T17_0721_035:0204c27_8']	è­·å¹¾ç¨®æˆ’ï¼Ÿ	è­·å¹¾ç¨®æˆ’ï¼Ÿ	How many kinds of precepts are upheld?
['ZH_T17_0721_035:0204c27_17']	æ‰€è¬‚ä¸æ®ºåŠä¸å·ç›œã€‚	æ‰€è¬‚ä¸æ®ºåŠä¸å·ç›œã€‚	Namely, not killing and not stealing.
['ZH_T17_0721_035:0204c28_3']	äº‘ä½•ä¸æ®ºï¼Ÿ	äº‘ä½•ä¸æ®ºï¼Ÿ	What is meant by not killing?
['ZH_T17_0721_035:0205a01_3']	è‹¥åœ‹åœŸè’äº‚äº’ç›¸æ®ºå®³ï¼Œæ˜¯æŒæˆ’äººç•ç ´æˆ’æ•…ï¼Œå¯§è‡ªæ¨å‘½ï¼Œä¸å®³ä»–äººï¼Œä¸æ•™ä»–æ®ºï¼Œæ˜¯åä¸æ®ºç”Ÿã€‚	è‹¥åœ‹åœŸè’äº‚äº’ç›¸æ®ºå®³ï¼Œæ˜¯æŒæˆ’äººç•ç ´æˆ’æ•…ï¼Œå¯§è‡ªæ¨å‘½ï¼Œä¸å®³ä»–äººï¼Œä¸æ•™ä»–æ®ºï¼Œæ˜¯åä¸æ®ºç”Ÿã€‚	If the country is in chaos and people kill each other, this precept-upholding person, fearing to break the precepts, would rather give up their own life than harm others, and does not instruct others to kill. This is called not killing living beings.
['ZH_T17_0721_035:0205a01_8']	äº‘ä½•ä¸ç›œï¼Ÿ	äº‘ä½•ä¸ç›œï¼Ÿ	What is meant by not stealing?
['ZH_T17_0721_035:0205a03_11']	è‹¥åœ‹åœŸè’å£äº‚ï¼Œä¸€åˆ‡çœ¾äººç«¶å–ä»–ç‰©ï¼Œæ˜¯æŒæˆ’äººç•ç ´æˆ’æ•…ï¼Œé£¢æ¸´å‚æ­»ï¼Œå¯§è‡ªæ¨å‘½ï¼Œä¸å–ä»–ç‰©ã€‚	è‹¥åœ‹åœŸè’å£äº‚ï¼Œä¸€åˆ‡çœ¾äººç«¶å–ä»–ç‰©ï¼Œæ˜¯æŒæˆ’äººç•ç ´æˆ’æ•…ï¼Œé£¢æ¸´å‚æ­»ï¼Œå¯§è‡ªæ¨å‘½ï¼Œä¸å–ä»–ç‰©ã€‚	If the country is in chaos and everyone competes to take others' things, this precept-upholding person, fearing to break the precepts, would rather starve to death than take others' things.
['ZH_T17_0721_035:0205a04_4']	äº‘ä½•å¸ƒæ–½ï¼Ÿ	äº‘ä½•å¸ƒæ–½ï¼Ÿ	What is meant by giving?
['ZH_T17_0721_035:0205a04_9']	æ–½ä½•ç¦ç”°ï¼Ÿ	æ–½ä½•ç¦ç”°ï¼Ÿ	To whom should blessings be given?
['ZH_T17_0721_035:0205a05_3']	è‹¥ä¾›é¤Šä½›ã€è‹¥èªªæ³•è™•è€Œæ–½èˆ‡ä¹‹ã€‚	è‹¥ä¾›é¤Šä½›ã€è‹¥èªªæ³•è™•è€Œæ–½èˆ‡ä¹‹ã€‚	If one makes offerings to the Buddha or gives to the place where the Dharma is being taught.
['ZH_T17_0721_035:0205a05_13']	ç¬¬ä¸€ä¿®å¿ƒï¼Œå…¶æ„æ­£è¦‹ã€‚	ç¬¬ä¸€ä¿®å¿ƒï¼Œå…¶æ„æ­£è¦‹ã€‚	First, cultivate the mind, with a correct view.
['ZH_T17_0721_035:0205a06_6']	æ˜¯äººå‘½çµ‚ç”Ÿæ–¼å¤©ä¸Šå¨å¾·é¡åœ°ã€‚	æ˜¯äººå‘½çµ‚ç”Ÿæ–¼å¤©ä¸Šå¨å¾·é¡åœ°ã€‚	When this person's life ends, they are reborn in the heaven of majestic countenance.
['ZH_T17_0721_035:0205a07_6']	ç”Ÿæ­¤å¤©å·²ï¼Œå¨å¾·å…‰è¼ªå‘¨éåœé¶ï¼Œç¬¬ä¸€å‹è‰²ã€‚	ç”Ÿæ­¤å¤©å·²ï¼Œå¨å¾·å…‰è¼ªå‘¨éåœé¶ï¼Œç¬¬ä¸€å‹è‰²ã€‚	Having been born in this heaven, their majestic radiance and light encircle them, with the most excellent color.
['ZH_T17_0721_035:0205a07_17']	å—ç›¸ä¼¼å› æœï¼Œä»¥å–„æ¥­æ•…ã€‚	å—ç›¸ä¼¼å› æœï¼Œä»¥å–„æ¥­æ•…ã€‚	They experience similar karmic results, due to their wholesome actions.
['ZH_T17_0721_035:0205a08_6']	äº”æ¨‚éŸ³è²ä»¥æ‚…å…¶è€³ï¼›	äº”æ¨‚éŸ³è²ä»¥æ‚…å…¶è€³ï¼›	The sounds of the five types of music delight their ears;
['ZH_T17_0721_035:0205a09_16']	å¸¸èæ›¼é™€ç¾…é¦™ã€ä¿±è³’è€¶èˆé¦™ã€é’è“®èŠ±é¦™ã€ä¸ƒå¯¶èŠ±é¦™ï¼Œä»¥æ‚…å…¶é¼»ï¼›	å¸¸èæ›¼é™€ç¾…é¦™ã€ä¿±è³’è€¶èˆé¦™ã€é’è“®èŠ±é¦™ã€ä¸ƒå¯¶èŠ±é¦™ï¼Œä»¥æ‚…å…¶é¼»ï¼›	They always smell the fragrances of mandÄra flowers, kuÅ›a grass, blue lotus flowers, and seven-jeweled flowers, which delight their noses;
['ZH_T17_0721_035:0205a10_9']	èˆŒå¾—ç¨®ç¨®ä¸Šå¦™é ˆé™€å¤©ä¸Šå‘³é£²ï¼›	èˆŒå¾—ç¨®ç¨®ä¸Šå¦™é ˆé™€å¤©ä¸Šå‘³é£²ï¼›	Their tongues experience various supreme heavenly flavors;
['ZH_T17_0721_035:0205a11_4']	ç›®è¦‹ç¨®ç¨®ä¸ƒå¯¶å±±è°·ä¸Šå¦™ä¹‹è‰²ï¼›	ç›®è¦‹ç¨®ç¨®ä¸ƒå¯¶å±±è°·ä¸Šå¦™ä¹‹è‰²ï¼›	Their eyes see various colors of the most excellent mountains and valleys made of the seven treasures;
['ZH_T17_0721_035:0205a11_18']	èº«å¾—ç¨®ç¨®å‹å¦™å¤©è¡£ï¼Œç„¡æœ‰ç¶“ç·¯ï¼›	èº«å¾—ç¨®ç¨®å‹å¦™å¤©è¡£ï¼Œç„¡æœ‰ç¶“ç·¯ï¼›	Their bodies obtain various supreme heavenly garments, without warp or weft;
['ZH_T17_0721_035:0205a12_8']	å„ªé‰¢ç¾…è¯é¦™ä»¥å¡—å…¶èº«ã€‚	å„ªé‰¢ç¾…è¯é¦™ä»¥å¡—å…¶èº«ã€‚	The fragrance of utpala flowers is used to anoint their bodies.
['ZH_T17_0721_035:0205a13_3']	å¦‚æ˜¯å¤©å­ä»¥å–„æ¥­æ•…ï¼Œå–„æœæˆå°±ã€‚	å¦‚æ˜¯å¤©å­ä»¥å–„æ¥­æ•…ï¼Œå–„æœæˆå°±ã€‚	In this way, due to the wholesome actions of this celestial son, the fruits of goodness are accomplished.
['ZH_T17_0721_035:0205a14_6']	åƒå¤©å¥³çœ¾ä»¥ç‚ºåœé¶ï¼Œåœ’æ—èŠåš´ï¼Œå…¶æ—å‹å¦™å¦‚èé‡‘è‰²ã€‚	åƒå¤©å¥³çœ¾ä»¥ç‚ºåœé¶ï¼Œåœ’æ—èŠåš´ï¼Œå…¶æ—å‹å¦™å¦‚èé‡‘è‰²ã€‚	Surrounded by a retinue of a thousand celestial maidens, the adorned garden and forest are as excellent and sublime as if they were made of molten gold.
['ZH_T17_0721_035:0205a16_7']	é‡‘éŠ€æä¸­æ‡¸ä»¥å¯¶éˆ´ï¼Œå¾®é¢¨å¹å‹•å‡ºå¦™éŸ³è²ï¼Œä»¥ç‚ºå¨›æ¨‚ï¼Œåˆèç¨®ç¨®æ­Œé Œè®šæ­ä¹‹éŸ³ï¼Œå—ç¬¬ä¸€æ¨‚ã€‚	é‡‘éŠ€æä¸­æ‡¸ä»¥å¯¶éˆ´ï¼Œå¾®é¢¨å¹å‹•å‡ºå¦™éŸ³è²ï¼Œä»¥ç‚ºå¨›æ¨‚ï¼Œåˆèç¨®ç¨®æ­Œé Œè®šæ­ä¹‹éŸ³ï¼Œå—ç¬¬ä¸€æ¨‚ã€‚	Hanging from the golden and silver branches are jeweled bells, which emit wonderful sounds when gently stirred by the breeze, providing entertainment. One also hears various songs and praises, experiencing the utmost bliss.
['ZH_T17_0721_035:0205a18_4']	å¤©é¬˜å¤©è¡£ä»¥ç‚ºèŠåš´ï¼ŒéŠæˆ²å±±è°·ï¼Œè¦‹æ–¼ç„¡é‡ç¨®ç¨®çœ¾è‰²æ¯˜ç‰ç’ƒå¯¶ã€é‡‘éŠ€é’å¯¶ã€å¤§é’å¯¶ç‹ã€‚	å¤©é¬˜å¤©è¡£ä»¥ç‚ºèŠåš´ï¼ŒéŠæˆ²å±±è°·ï¼Œè¦‹æ–¼ç„¡é‡ç¨®ç¨®çœ¾è‰²æ¯˜ç‰ç’ƒå¯¶ã€é‡‘éŠ€é’å¯¶ã€å¤§é’å¯¶ç‹ã€‚	Adorned with heavenly garlands and heavenly garments, one frolics in the valleys, beholding countless various colors of lapis lazuli, gold, silver, green jewels, and great blue king jewels.
['ZH_T17_0721_035:0205a19_1']	æ–¼é —æ¢¨å±±å³¯è‡ªè¦‹å…¶èº«ï¼ŒçŒ¶å¦‚æ˜é¡ã€‚	æ–¼é —æ¢¨å±±å³¯è‡ªè¦‹å…¶èº«ï¼ŒçŒ¶å¦‚æ˜é¡ã€‚	On the peaks of crystal mountains, one sees one's own body, like a clear mirror.
