segmentnr	original	analyzed	translated
['ZH_T49_2039_003:0997b04_2']	æ½›ç¥ˆå¾—å¹¸ã€‚	æ½›ç¥ˆå¾—å¹¸ã€‚	Secretly praying to be favored by him.
['ZH_T49_2039_003:0997b04_7']	æ–¹æ•¸å¹´é–“ã€‚	æ–¹æ•¸å¹´é–“ã€‚	In just a few years,
['ZH_T49_2039_003:0997b04_14']	å…¶å¥³å·²æœ‰é…çŸ£ã€‚	å…¶å¥³å·²æœ‰é…çŸ£ã€‚	her daughter was already married.
['ZH_T49_2039_003:0997b05_6']	åˆå¾€å ‚å‰æ€¨å¤§æ‚²ä¹‹ä¸é‚å·²ã€‚	åˆå¾€å ‚å‰æ€¨å¤§æ‚²ä¹‹ä¸é‚å·²ã€‚	She went to the hall again, blaming the Great Compassion for not fulfilling her wishes.
['ZH_T49_2039_003:0997b05_12']	å“€æ³£è‡³æ—¥æš®ã€‚	å“€æ³£è‡³æ—¥æš®ã€‚	Weeping sadly until dusk.
['ZH_T49_2039_003:0997b05_17']	æƒ…æ€å€¦æ†Šã€‚	æƒ…æ€å€¦æ†Šã€‚	Her thoughts were tired and weary.
['ZH_T49_2039_003:0997b06_2']	ä¿„æˆå‡å¯¢ã€‚	ä¿„æˆå‡å¯¢ã€‚	Suddenly she fell asleep.
['ZH_T49_2039_003:0997b06_12']	å¿½å¤¢é‡‘æ°å¨˜å®¹è±«å…¥é–€ã€‚	å¿½å¤¢é‡‘æ°å¨˜å®¹è±«å…¥é–€ã€‚	Suddenly she dreamed of Jin's mother's appearance, leisurely entering the room.
['ZH_T49_2039_003:0997b07_1']	ç²²ç„¶å•Ÿé½’è€Œè¬‚æ›°ã€‚	ç²²ç„¶å•Ÿé½’è€Œè¬‚æ›°ã€‚	Smiling and saying to her,
['ZH_T49_2039_003:0997b07_10']	å…’æ—©è­˜ä¸Šäººæ–¼åŠé¢ã€‚	å…’æ—©è­˜ä¸Šäººæ–¼åŠé¢ã€‚	I recognized the master at half a glance.
['ZH_T49_2039_003:0997b07_15']	å¿ƒä¹æ„›çŸ£ã€‚	å¿ƒä¹æ„›çŸ£ã€‚	My heart was filled with love.
['ZH_T49_2039_003:0997b07_20']	æœªç”æš«å¿˜ã€‚	æœªç”æš«å¿˜ã€‚	I never forgot him for a moment.
['ZH_T49_2039_003:0997b08_10']	è¿«æ–¼çˆ¶æ¯ä¹‹å‘½å¼·å¾äººçŸ£ã€‚	è¿«æ–¼çˆ¶æ¯ä¹‹å‘½å¼·å¾äººçŸ£ã€‚	Forced by my parents' orders, I was married to another.
['ZH_T49_2039_003:0997b09_7']	ä»Šé¡˜ç‚ºåŒç©´ä¹‹å‹æ•…ä¾†çˆ¾ä¿¡ä¹ƒé¡›å–œã€‚	ä»Šé¡˜ç‚ºåŒç©´ä¹‹å‹æ•…ä¾†çˆ¾ä¿¡ä¹ƒé¡›å–œã€‚	Now I wish to be friends buried in the same grave, so I came to you. Tiaoxin was overjoyed.
['ZH_T49_2039_003:0997b09_12']	åŒæ­¸é„‰é‡Œã€‚	åŒæ­¸é„‰é‡Œã€‚	They returned to their hometown together.
['ZH_T49_2039_003:0997b09_19']	è¨ˆæ´»å››åé¤˜éœœã€‚	è¨ˆæ´»å››åé¤˜éœœã€‚	They planned to live together for over forty years.
['ZH_T49_2039_003:0997b10_4']	æœ‰å…’æ¯äº”ã€‚	æœ‰å…’æ¯äº”ã€‚	They had five children.
['ZH_T49_2039_003:0997b10_9']	å®¶å¾’å››å£ã€‚	å®¶å¾’å››å£ã€‚	The family was destitute, with only four walls.
['ZH_T49_2039_003:0997b10_14']	è—œè—¿ä¸çµ¦ã€‚	è—œè—¿ä¸çµ¦ã€‚	Even leeks and beans were not provided.
['ZH_T49_2039_003:0997b11_1']	é‚ä¹ƒè½é­„æ‰¶æºã€‚	é‚ä¹ƒè½é­„æ‰¶æºã€‚	So he wandered about, supporting himself.
['ZH_T49_2039_003:0997b11_8']	ç³Šå…¶å£æ–¼å››æ–¹ã€‚	ç³Šå…¶å£æ–¼å››æ–¹ã€‚	He made a living by begging in all directions.
['ZH_T49_2039_003:0997b11_13']	å¦‚æ˜¯åå¹´ã€‚	å¦‚æ˜¯åå¹´ã€‚	This went on for ten years.
['ZH_T49_2039_003:0997b11_18']	å‘¨æµè‰é‡ã€‚	å‘¨æµè‰é‡ã€‚	He roamed the countryside.
['ZH_T49_2039_003:0997b12_3']	æ‡¸é¶‰ç™¾çµã€‚	æ‡¸é¶‰ç™¾çµã€‚	Even a hundred patches of ragged clothes
['ZH_T49_2039_003:0997b12_8']	äº¦ä¸æ©é«”ã€‚	äº¦ä¸æ©é«”ã€‚	did not cover his body.
['ZH_T49_2039_003:0997b12_16']	é©éæºŸå·èŸ¹ç¸£å¶ºã€‚	é©éæºŸå·èŸ¹ç¸£å¶ºã€‚	He happened to pass by Crab Ridge in Myungju.
['ZH_T49_2039_003:0997b13_6']	å¤§å…’åäº”æ­²è€…å¿½é¤§æ­»ã€‚	å¤§å…’åäº”æ­²è€…å¿½é¤§æ­»ã€‚	The eldest son, who was fifteen years old, suddenly died of starvation.
['ZH_T49_2039_003:0997b13_13']	ç—›å“­æ”¶ç˜æ–¼é“ã€‚	ç—›å“­æ”¶ç˜æ–¼é“ã€‚	He painfully cried and buried him on the road.
['ZH_T49_2039_003:0997b14_15']	å¾ç‡é¤˜å››å£åˆ°ç¾½æ›²ç¸£ä»Šç¾½ç¸£ä¹ŸçµèŒ…æ–¼è·¯å‚è€Œèˆã€‚	å¾ç‡é¤˜å››å£åˆ°ç¾½æ›²ç¸£ä»Šç¾½ç¸£ä¹ŸçµèŒ…æ–¼è·¯å‚è€Œèˆã€‚	He then led the remaining four mouths to Yugok County [present-day Yu County] and built a thatched hut by the roadside to live in.
['ZH_T49_2039_003:0997b14_21']	å¤«å©¦è€ä¸”ç—…ã€‚	å¤«å©¦è€ä¸”ç—…ã€‚	The husband and wife were old and sick.
['ZH_T49_2039_003:0997b15_4']	é£¢ä¸èƒ½èˆˆã€‚	é£¢ä¸èƒ½èˆˆã€‚	They were too hungry to get up.
['ZH_T49_2039_003:0997b15_11']	åæ­²å¥³å…’å·¡ä¹ã€‚	åæ­²å¥³å…’å·¡ä¹ã€‚	Their ten-year-old daughter went begging.
['ZH_T49_2039_003:0997b15_18']	ä¹ƒç‚ºé‡Œç†¬æ‰€å™¬ã€‚	ä¹ƒç‚ºé‡Œç†¬æ‰€å™¬ã€‚	She was bitten by a village dog.
['ZH_T49_2039_003:0997b16_4']	è™Ÿç—›è‡¥æ–¼å‰ã€‚	è™Ÿç—›è‡¥æ–¼å‰ã€‚	She cried out in pain and lay down in front of them.
['ZH_T49_2039_003:0997b16_11']	çˆ¶æ¯ç‚ºä¹‹æ­”æ¬·ã€‚	çˆ¶æ¯ç‚ºä¹‹æ­”æ¬·ã€‚	Her parents sighed for her.
['ZH_T49_2039_003:0997b16_16']	æ³£ä¸‹æ•¸è¡Œã€‚	æ³£ä¸‹æ•¸è¡Œã€‚	Tears flowed down their faces.
['ZH_T49_2039_003:0997b17_3']	å©¦ä¹ƒâ–¡æ¾æ‹­æ¶•ã€‚	å©¦ä¹ƒâ–¡æ¾æ‹­æ¶•ã€‚	The wife wiped her tears roughly.
['ZH_T49_2039_003:0997b17_9']	å€‰å’è€Œèªæ›°ã€‚	å€‰å’è€Œèªæ›°ã€‚	She spoke abruptly, saying,
['ZH_T49_2039_003:0997b17_16']	äºˆä¹‹å§‹é‡å›ä¹Ÿã€‚	äºˆä¹‹å§‹é‡å›ä¹Ÿã€‚	When I first met you,
['ZH_T49_2039_003:0997b18_1']	è‰²ç¾å¹´èŠ³ã€‚	è‰²ç¾å¹´èŠ³ã€‚	you were beautiful and young.
['ZH_T49_2039_003:0997b18_6']	è¡£è¢´ç¨ é®®ã€‚	è¡£è¢´ç¨ é®®ã€‚	Your clothes were thick and fresh.
['ZH_T49_2039_003:0997b18_16']	ä¸€å‘³ä¹‹ç”˜å¾—èˆ‡å­åˆ†ä¹‹ã€‚	ä¸€å‘³ä¹‹ç”˜å¾—èˆ‡å­åˆ†ä¹‹ã€‚	We could share the same taste of sweetness.
['ZH_T49_2039_003:0997b19_6']	æ•¸å°ºä¹‹ç…–å¾—èˆ‡å­å…±ä¹‹ã€‚	æ•¸å°ºä¹‹ç…–å¾—èˆ‡å­å…±ä¹‹ã€‚	The warmth of a few feet can be shared with my child.
['ZH_T49_2039_003:0997b19_12', 'ZH_T49_2039_003:0997b19_17']	å‡ºè™•äº”åå¹´ã€‚ğŸ”½æƒ…é¾è«é€†ã€‚	å‡ºè™•äº”åå¹´ã€‚ æƒ…é¾è«é€†ã€‚	For fifty years, we have been together.ğŸ”½Our feelings are in perfect harmony.
['ZH_T49_2039_003:0997b20_2']	æ©æ„›ç¶¢ç¹†ã€‚	æ©æ„›ç¶¢ç¹†ã€‚	Our love is intertwined.
['ZH_T49_2039_003:0997b20_7']	å¯è¬‚åšç·£ã€‚	å¯è¬‚åšç·£ã€‚	It can be said to be a thick bond.
['ZH_T49_2039_003:0997b20_12']	è‡ªæ¯”å¹´ä¾†ã€‚	è‡ªæ¯”å¹´ä¾†ã€‚	But in recent years,
['ZH_T49_2039_003:0997b20_18']	è¡°ç—…æ­²ç›Šæ·±ã€‚	è¡°ç—…æ­²ç›Šæ·±ã€‚	My illnesses have deepened with each passing year.
['ZH_T49_2039_003:0997b21_3']	é£¢å¯’æ—¥ç›Šè¿«ã€‚	é£¢å¯’æ—¥ç›Šè¿«ã€‚	Hunger and cold press in on me day by day.
['ZH_T49_2039_003:0997b21_12']	å‚èˆå£ºæ¼¿äººä¸å®¹ä¹ã€‚	å‚èˆå£ºæ¼¿äººä¸å®¹ä¹ã€‚	Neighbors do not allow me to beg for wine and water.
['ZH_T49_2039_003:0997b22_2']	åƒé–€ä¹‹æ¥é‡ä¼¼ä¸˜å±±ã€‚	åƒé–€ä¹‹æ¥é‡ä¼¼ä¸˜å±±ã€‚	The shame of a thousand doors is heavier than a mountain.
['ZH_T49_2039_003:0997b22_11']	å…’å¯’å…’é£¢æœªé‘è¨ˆè£œã€‚	å…’å¯’å…’é£¢æœªé‘è¨ˆè£œã€‚	My child is cold and hungry, without time to think of making amends.
['ZH_T49_2039_003:0997b23_3']	ä½•æš‡æœ‰æ„›æ‚…å¤«å©¦ä¹‹å¿ƒå“‰ã€‚	ä½•æš‡æœ‰æ„›æ‚…å¤«å©¦ä¹‹å¿ƒå“‰ã€‚	How can I have the heart to love and delight in my husband?
['ZH_T49_2039_003:0997b23_12']	ç´…é¡å·§ç¬‘è‰ä¸Šä¹‹éœ²ã€‚	ç´…é¡å·§ç¬‘è‰ä¸Šä¹‹éœ²ã€‚	Beautiful faces and clever smiles are dew on the grass.
['ZH_T49_2039_003:0997b24_2']	ç´„æŸèŠè˜­æŸ³çµ®é£„é¢¨ã€‚	ç´„æŸèŠè˜­æŸ³çµ®é£„é¢¨ã€‚	Controlling orchids and agarwood is like willow fluff blown by the wind.
['ZH_T49_2039_003:0997b24_9']	å›æœ‰æˆ‘è€Œç‚ºç´¯ã€‚	å›æœ‰æˆ‘è€Œç‚ºç´¯ã€‚	You have me and become burdened.
['ZH_T49_2039_003:0997b24_16']	æˆ‘ç‚ºå›è€Œè¶³æ†‚ã€‚	æˆ‘ç‚ºå›è€Œè¶³æ†‚ã€‚	I am for you and have enough worries.
['ZH_T49_2039_003:0997b25_3']	ç´°æ€æ˜”æ—¥ä¹‹æ­¡ã€‚	ç´°æ€æ˜”æ—¥ä¹‹æ­¡ã€‚	Thinking carefully of the joys of the past,
['ZH_T49_2039_003:0997b25_10']	é©ç‚ºæ†‚æ‚£æ‰€éšã€‚	é©ç‚ºæ†‚æ‚£æ‰€éšã€‚	They have just become the steps to worries and hardships.
['ZH_T49_2039_003:0997b25_19']	å›ä¹äºˆä¹å¥šè‡³æ­¤æ¥µã€‚	å›ä¹äºˆä¹å¥šè‡³æ­¤æ¥µã€‚	You and I, how did we end up here?
['ZH_T49_2039_003:0997b26_7']	èˆ‡å…¶çœ¾é³¥ä¹‹åŒé¤§ã€‚	èˆ‡å…¶çœ¾é³¥ä¹‹åŒé¤§ã€‚	Rather than being fed together with a flock of birds,
['ZH_T49_2039_003:0997b26_15']	ç„‰çŸ¥éš»é¸ä¹‹æœ‰é¡ã€‚	ç„‰çŸ¥éš»é¸ä¹‹æœ‰é¡ã€‚	How can I know that a single phoenix has a mirror?
['ZH_T49_2039_003:0997b27_1']	å¯’æ£„ç‚é™„ã€‚	å¯’æ£„ç‚é™„ã€‚	Abandoning the cold and attaching to the warm,
['ZH_T49_2039_003:0997b27_6']	æƒ…æ‰€ä¸å ªã€‚	æƒ…æ‰€ä¸å ªã€‚	Is something I cannot bear.
['ZH_T49_2039_003:0997b27_13']	ç„¶è€Œè¡Œæ­¢éäººã€‚	ç„¶è€Œè¡Œæ­¢éäººã€‚	However, my actions and stops are not human.
['ZH_T49_2039_003:0997b27_18']	é›¢åˆæœ‰æ•¸ã€‚	é›¢åˆæœ‰æ•¸ã€‚	There were several times of separation and reunion.
['ZH_T49_2039_003:0997b28_3']	è«‹å¾æ­¤è¾­ã€‚	è«‹å¾æ­¤è¾­ã€‚	Please follow this farewell.
['ZH_T49_2039_003:0997b28_9']	ä¿¡èä¹‹å¤§å–œã€‚	ä¿¡èä¹‹å¤§å–œã€‚	Xincheng heard this and was greatly delighted.
['ZH_T49_2039_003:0997b28_16']	å„åˆ†äºŒå…’å°‡è¡Œã€‚	å„åˆ†äºŒå…’å°‡è¡Œã€‚	They divided the two children and prepared to leave.
['ZH_T49_2039_003:0997b28_19']	å¥³æ›°ã€‚	å¥³æ›°ã€‚	The woman said:
['ZH_T49_2039_003:0997b29_3']	æˆ‘å‘æ¡‘æ¢“ã€‚	æˆ‘å‘æ¡‘æ¢“ã€‚	I will go back to my hometown.
['ZH_T49_2039_003:0997b29_8']	å›å…¶å—çŸ£ã€‚	å›å…¶å—çŸ£ã€‚	You will go south.
['ZH_T49_2039_003:0997b29_17']	æ–¹åˆ†æ‰‹é€²é€”è€Œå½¢é–‹ã€‚	æ–¹åˆ†æ‰‹é€²é€”è€Œå½¢é–‹ã€‚	Just as they were parting and advancing on their way, their forms separated.
['ZH_T49_2039_003:0997c01_2']	æ®˜ç‡ˆç¿³åã€‚	æ®˜ç‡ˆç¿³åã€‚	The dim lamp spit out shadows.
['ZH_T49_2039_003:0997c01_7']	å¤œè‰²å°‡é—Œã€‚	å¤œè‰²å°‡é—Œã€‚	The night was about to end.
['ZH_T49_2039_003:0997c01_14']	åŠæ—¦é¬¢é«®ç›¡ç™½ã€‚	åŠæ—¦é¬¢é«®ç›¡ç™½ã€‚	By dawn, their hair had turned completely white.
['ZH_T49_2039_003:0997c02_3']	æƒ˜æƒ˜ç„¶æ®Šç„¡äººä¸–æ„ã€‚	æƒ˜æƒ˜ç„¶æ®Šç„¡äººä¸–æ„ã€‚	They were confused and had no intention of being in the human world.
['ZH_T49_2039_003:0997c02_8']	å·²å­å‹ç”Ÿã€‚	å·²å­å‹ç”Ÿã€‚	They were already tired of the suffering of life.
['ZH_T49_2039_003:0997c02_15']	å¦‚é£«ç™¾å¹´è¾›è‹¦ã€‚	å¦‚é£«ç™¾å¹´è¾›è‹¦ã€‚	It was as if they had been enduring a hundred years of hardship.
['ZH_T49_2039_003:0997c03_4']	è²ªæŸ“ä¹‹å¿ƒæ´’ç„¶æ°·é‡‹ã€‚	è²ªæŸ“ä¹‹å¿ƒæ´’ç„¶æ°·é‡‹ã€‚	The mind of greed and attachment was suddenly released like ice melting.
['ZH_T49_2039_003:0997c03_11']	æ–¼æ˜¯æ…šå°è–å®¹ã€‚	æ–¼æ˜¯æ…šå°è–å®¹ã€‚	Then, they felt ashamed in front of the sacred image.
['ZH_T49_2039_003:0997c03_16']	æ‡ºæ»Œç„¡å·²ã€‚	æ‡ºæ»Œç„¡å·²ã€‚	They repented without end.
['ZH_T49_2039_003:0997c04_5']	æ­¸æ’¥èŸ¹å³´æ‰€åŸ‹å…’å¡šã€‚	æ­¸æ’¥èŸ¹å³´æ‰€åŸ‹å…’å¡šã€‚	They returned to the grave of the children buried at Haechiryun.
['ZH_T49_2039_003:0997c04_11']	ä¹ƒçŸ³å½Œå‹’ä¹Ÿã€‚	ä¹ƒçŸ³å½Œå‹’ä¹Ÿã€‚	It was the stone Maitreya.
['ZH_T49_2039_003:0997c04_19']	çŒæ´—å¥‰å®‰äºéš£å¯ºã€‚	çŒæ´—å¥‰å®‰äºéš£å¯ºã€‚	They washed it and enshrined it in a nearby temple.
['ZH_T49_2039_003:0997c05_6']	é‚„äº¬å¸«å…èŠä»»ã€‚	é‚„äº¬å¸«å…èŠä»»ã€‚	They returned to the capital and resigned from their official duties.
['ZH_T49_2039_003:0997c05_14']	å‚¾ç§è²¡å‰µæ·¨åœŸå¯ºã€‚	å‚¾ç§è²¡å‰µæ·¨åœŸå¯ºã€‚	They emptied their private wealth to build the Pure Land Temple.
['ZH_T49_2039_003:0997c05_19']	æ‡ƒä¿®ç™½æ¥­ã€‚	æ‡ƒä¿®ç™½æ¥­ã€‚	They diligently practiced pure deeds.
['ZH_T49_2039_003:0997c06_5', 'ZH_T49_2039_003:0997c06_8', 'ZH_T49_2039_003:0997c06_12', 'ZH_T49_2039_003:0997c06_19']	å¾Œè«çŸ¥æ‰€çµ‚ã€‚ğŸ”½è­°æ›°ã€‚ğŸ”½è®€æ­¤å‚³ã€‚ğŸ”½æ©å·è€Œè¿½ç¹¹ä¹‹ã€‚	å¾Œè«çŸ¥æ‰€çµ‚ã€‚ğŸ”½è­°æ›°ã€‚ğŸ”½è®€æ­¤å‚³ã€‚ğŸ”½æ©å·è€Œè¿½ç¹¹ä¹‹ã€‚	Later, it is unknown where they ended up.
['ZH_T49_2039_003:0997c07_7']	ä½•å¿…ä¿¡å¸«ä¹‹å¤¢ç‚ºç„¶ã€‚	ä½•å¿…ä¿¡å¸«ä¹‹å¤¢ç‚ºç„¶ã€‚	Why must you believe the master's dream to be true?
['ZH_T49_2039_003:0997c07_17']	ä»Šçš†çŸ¥å…¶äººä¸–ä¹‹ç‚ºæ¨‚ã€‚	ä»Šçš†çŸ¥å…¶äººä¸–ä¹‹ç‚ºæ¨‚ã€‚	Now everyone knows that people in the world are happy.
['ZH_T49_2039_003:0997c08_5']	æ¬£æ¬£ç„¶å½¹å½¹ç„¶ã€‚	æ¬£æ¬£ç„¶å½¹å½¹ç„¶ã€‚	Joyful and busy,
['ZH_T49_2039_003:0997c08_10']	ç‰¹æœªè¦ºçˆ¾ã€‚	ç‰¹æœªè¦ºçˆ¾ã€‚	You have simply not realized it yet.
['ZH_T49_2039_003:0997c08_17']	ä¹ƒä½œè©èª¡ä¹‹æ›°ã€‚	ä¹ƒä½œè©èª¡ä¹‹æ›°ã€‚	So I write this verse to warn you:
['ZH_T49_2039_003:0997c09_0']	å¿«é©é ˆè‡¾æ„å·²é–‘ã€€ã€€æš—å¾æ„è£è€å€‰é¡	å¿«é©é ˆè‡¾æ„å·²é–‘ã€€ã€€æš—å¾æ„è£è€å€‰é¡	Comfortable and happy for a moment, the mind is already at ease, but in the dark, one grows old with sorrow, with a haggard face.
['ZH_T49_2039_003:0997c10_0']	ä¸é ˆæ›´å¾…é»ƒç²±ç†Ÿã€€ã€€æ–¹æ‚Ÿå‹ç”Ÿä¸€å¤¢é–“	ä¸é ˆæ›´å¾…é»ƒç²±ç†Ÿã€€ã€€æ–¹æ‚Ÿå‹ç”Ÿä¸€å¤¢é–“	You don't need to wait for the yellow rice to ripen, only then will you realize that life's toil is a single dream.
['ZH_T49_2039_003:0997c11_0']	æ²»èº«è‡§å¦å…ˆèª æ„ã€€ã€€é°¥å¤¢è›¾çœ‰è³Šå¤¢è—	æ²»èº«è‡§å¦å…ˆèª æ„ã€€ã€€é°¥å¤¢è›¾çœ‰è³Šå¤¢è—	Whether one's body is well-governed or not depends first on sincerity of intention. A widower dreams of a beautiful woman, a thief dreams of hiding treasure.
['ZH_T49_2039_003:0997c12_0']	ä½•ä¼¼ç§‹ä¾†æ¸…å¤œå¤¢ã€€ã€€æ™‚æ™‚åˆçœ¼åˆ°æ¸…æ¶¼	ä½•ä¼¼ç§‹ä¾†æ¸…å¤œå¤¢ã€€ã€€æ™‚æ™‚åˆçœ¼åˆ°æ¸…æ¶¼	How is it like the dream of autumn's clear night? Time and time again, with eyes closed, one reaches coolness and clarity.
['ZH_T49_2039_003:0997c14_3']	é­šå±±ä½›å½°é­šå±±ä½›å½°å¤è¨˜äº‘ã€‚	é­šå±±ä½›å½°é­šå±±ä½›å½°å¤è¨˜äº‘ã€‚	The ancient records say:
['ZH_T49_2039_003:0997c14_14']	è¬é­šå¯ºè€…å¤ä¹‹æ…ˆæˆå±±ä¹Ÿã€‚	è¬é­šå¯ºè€…å¤ä¹‹æ…ˆæˆå±±ä¹Ÿã€‚	The Wan Fish Temple is the ancient Mount Ci Cheng.
['ZH_T49_2039_003:0997c15_6']	åˆé˜¿è€¶æ–¯å±±ç•¶ä½œæ‘©è€¶æ–¯ã€‚	åˆé˜¿è€¶æ–¯å±±ç•¶ä½œæ‘©è€¶æ–¯ã€‚	And Mount Ayesi should be Moyesi.
['ZH_T49_2039_003:0997c15_11']	æ­¤äº‘é­šä¹Ÿã€‚	æ­¤äº‘é­šä¹Ÿã€‚	This means fish.
['ZH_T49_2039_003:0997c15_17']	å‚æœ‰å‘µå›‰åœ‹ã€‚	å‚æœ‰å‘µå›‰åœ‹ã€‚	Beside it is the country of Hara.
['ZH_T49_2039_003:0997c15_25', 'ZH_T49_2039_003:0997c16_4']	æ˜”å¤©åµä¸‹äºæµ·é‚Šã€‚ğŸ”½ä½œäººå¾¡åœ‹ã€‚	æ˜”å¤©åµä¸‹äºæµ·é‚Šã€‚ ä½œäººå¾¡åœ‹ã€‚	In the past, a heavenly egg fell into the ocean.ğŸ”½It became a human who ruled the country.
['ZH_T49_2039_003:0997c16_9']	å³é¦–éœ²ç‹ã€‚	å³é¦–éœ²ç‹ã€‚	This is King Shoulu.
['ZH_T49_2039_003:0997c16_13']	ç•¶æ­¤æ™‚ã€‚	ç•¶æ­¤æ™‚ã€‚	At this time,
['ZH_T49_2039_003:0997c16_19']	å¢ƒå…§æœ‰ç‰æ± ã€‚	å¢ƒå…§æœ‰ç‰æ± ã€‚	within the borders there was a jade pond.
['ZH_T49_2039_003:0997c17_4']	æ± æœ‰æ¯’é¾ç„‰ã€‚	æ± æœ‰æ¯’é¾ç„‰ã€‚	There was a poisonous dragon in the pond.
['ZH_T49_2039_003:0997c17_13']	è¬é­šå±±æœ‰äº”ç¾…å‰å¥³ã€‚	è¬é­šå±±æœ‰äº”ç¾…å‰å¥³ã€‚	On Wan Fish Mountain, there were five rÄká¹£asÄ«s.
['ZH_T49_2039_003:0997c17_18']	å¾€ä¾†äº¤é€šã€‚	å¾€ä¾†äº¤é€šã€‚	They came and went, having intercourse.
['ZH_T49_2039_003:0997c18_4']	æ•…æ™‚é™é›»é›¨ã€‚	æ•…æ™‚é™é›»é›¨ã€‚	Therefore, they sometimes caused lightning and rain.
['ZH_T49_2039_003:0997c18_12']	æ­·å››å¹´äº”ç©€ä¸æˆã€‚	æ­·å››å¹´äº”ç©€ä¸æˆã€‚	For four years, the five grains did not ripen.
['ZH_T49_2039_003:0997c18_18']	ç‹å‘ªç¦ä¸èƒ½ã€‚	ç‹å‘ªç¦ä¸èƒ½ã€‚	The king tried to curse them but could not.
['ZH_T49_2039_003:0997c19_5']	ç¨½é¦–è«‹ä½›èªªæ³•ã€‚	ç¨½é¦–è«‹ä½›èªªæ³•ã€‚	He bowed his head and requested the Buddha to preach the Dharma.
['ZH_T49_2039_003:0997c19_18']	ç„¶å¾Œç¾…å‰å¥³å—äº”æˆ’è€Œç„¡å¾Œå®³ã€‚	ç„¶å¾Œç¾…å‰å¥³å—äº”æˆ’è€Œç„¡å¾Œå®³ã€‚	Only then did the rÄká¹£asÄ«s receive the five precepts and stop harming people.
['ZH_T49_2039_003:0997c20_12']	æ•…æ±æµ·é­šé¾é‚åŒ–ç‚ºæ»¿æ´ä¹‹çŸ³ã€‚	æ•…æ±æµ·é­šé¾é‚åŒ–ç‚ºæ»¿æ´ä¹‹çŸ³ã€‚	Therefore, the fish and dragons of the Eastern Sea were transformed into stones filling the cave.
['ZH_T49_2039_003:0997c21_7']	å„æœ‰é¾ç£¬ä¹‹è²å·²ä¸Šå¤è¨˜åˆæŒ‰ã€‚	å„æœ‰é¾ç£¬ä¹‹è²å·²ä¸Šå¤è¨˜åˆæŒ‰ã€‚	Each has the sound of a bell and a chime. The ancient records also state:
['ZH_T49_2039_003:0997c21_15']	å¤§å®šåäºŒå¹´åºšå­ã€‚	å¤§å®šåäºŒå¹´åºšå­ã€‚	In the twelfth year of the Dading era, the year of Gengzi.
['ZH_T49_2039_003:0997c22_1']	å³æ˜å®—åä¸€å¹´ä¹Ÿã€‚	å³æ˜å®—åä¸€å¹´ä¹Ÿã€‚	This was the eleventh year of the Mingzong reign.
['ZH_T49_2039_003:0997c22_7']	å§‹å‰µè¬é­šå¯ºã€‚	å§‹å‰µè¬é­šå¯ºã€‚	The Wan Fish Temple was first established.
['ZH_T49_2039_003:0997c23_3']	æ£Ÿæ¢å¯¶æ—ç‹€å¥æ‰€ç¨±å±±ä¸­å¥‡ç•°ä¹‹è¿¹ã€‚	æ£Ÿæ¢å¯¶æ—ç‹€å¥æ‰€ç¨±å±±ä¸­å¥‡ç•°ä¹‹è¿¹ã€‚	The precious forest of beams and pillars reported the extraordinary traces of the mountain.
['ZH_T49_2039_003:0997c24_1']	èˆ‡åŒ—å¤©ç«ºè¨¶ç¾…åœ‹ä½›å½±äº‹ç¬¦åŒè€…æœ‰ä¸‰ã€‚	èˆ‡åŒ—å¤©ç«ºè¨¶ç¾…åœ‹ä½›å½±äº‹ç¬¦åŒè€…æœ‰ä¸‰ã€‚	There were three things that corresponded with the Buddha's shadow story in the country of Kharoá¹£á¹­hÄ« in North India.
['ZH_T49_2039_003:0997c24_3']	ä¸€ã€‚	ä¸€ã€‚	First,
['ZH_T49_2039_003:0997c24_14']	å±±ä¹‹å´è¿‘åœ°æ¢å·ç•Œç‰æ± ã€‚	å±±ä¹‹å´è¿‘åœ°æ¢å·ç•Œç‰æ± ã€‚	near the side of the mountain, in the jade pond of the border of Yuzhou in the state of Dielang,
['ZH_T49_2039_003:0997c25_2']	äº¦æ¯’é¾æ‰€èŸ„æ˜¯ä¹Ÿã€‚	äº¦æ¯’é¾æ‰€èŸ„æ˜¯ä¹Ÿã€‚	it was also where a poisonous dragon hibernated.
['ZH_T49_2039_003:0997c25_4']	äºŒã€‚	äºŒã€‚	Second,
['ZH_T49_2039_003:0997c25_18']	æœ‰æ™‚è‡ªæ±Ÿé‚Šé›²æ°£å§‹å‡ºä¾†åˆ°å±±é ‚ã€‚	æœ‰æ™‚è‡ªæ±Ÿé‚Šé›²æ°£å§‹å‡ºä¾†åˆ°å±±é ‚ã€‚	sometimes the clouds started to come out from the riverbank and reached the top of the mountain.
['ZH_T49_2039_003:0997c26_8']	é›²ä¸­æœ‰éŸ³æ¨‚ä¹‹è²æ˜¯ä¹Ÿã€‚	é›²ä¸­æœ‰éŸ³æ¨‚ä¹‹è²æ˜¯ä¹Ÿã€‚	The sound of music in the clouds is it.
['ZH_T49_2039_003:0997c26_10']	ä¸‰ã€‚	ä¸‰ã€‚	Third,
['ZH_T49_2039_003:0997c26_18']	å½±ä¹‹è¥¿åŒ—æœ‰ç›¤çŸ³ã€‚	å½±ä¹‹è¥¿åŒ—æœ‰ç›¤çŸ³ã€‚	to the northwest of the shadow, there is a flat rock.
['ZH_T49_2039_003:0997c27_5']	å¸¸è²¯æ°´ä¸çµ•äº‘ã€‚	å¸¸è²¯æ°´ä¸çµ•äº‘ã€‚	It is said that water is always stored there without drying up.
['ZH_T49_2039_003:0997c27_16']	æ˜¯ä½›æµ£æ¿¯è¢ˆè£Ÿä¹‹åœ°æ˜¯ä¹Ÿã€‚	æ˜¯ä½›æµ£æ¿¯è¢ˆè£Ÿä¹‹åœ°æ˜¯ä¹Ÿã€‚	This is the place where the Buddha washed and rinsed his kasaya robe.
['ZH_T49_2039_003:0997c28_5']	å·²ä¸Šçš†å¯¶æ—ä¹‹èªªã€‚	å·²ä¸Šçš†å¯¶æ—ä¹‹èªªã€‚	The above are all the stories of the Precious Grove.
['ZH_T49_2039_003:0997c28_11']	ä»Šè¦ªä¾†ç»ç¦®ã€‚	ä»Šè¦ªä¾†ç»ç¦®ã€‚	Now, coming here to pay homage,
['ZH_T49_2039_003:0997c29_3']	äº¦ä¹ƒå½°å½°å¯æ•¬ä¿¡è€…æœ‰äºŒã€‚	äº¦ä¹ƒå½°å½°å¯æ•¬ä¿¡è€…æœ‰äºŒã€‚	there are also two things that can be respected and believed.
['ZH_T49_2039_003:0998a01_4']	æ´ä¸­ä¹‹çŸ³å‡¡ä¸‰åˆ†ä¹‹äºŒçš†æœ‰é‡‘ç‰ä¹‹è²æ˜¯ä¸€ä¹Ÿã€‚	æ´ä¸­ä¹‹çŸ³å‡¡ä¸‰åˆ†ä¹‹äºŒçš†æœ‰é‡‘ç‰ä¹‹è²æ˜¯ä¸€ä¹Ÿã€‚	First, two-thirds of the rocks in the cave all make the sound of gold and jade.
['ZH_T49_2039_003:0998a01_9']	é ç»å³ç¾ã€‚	é ç»å³ç¾ã€‚	If one looks from afar, they appear.
['ZH_T49_2039_003:0998a01_14']	è¿‘ç»ä¸è¦‹ã€‚	è¿‘ç»ä¸è¦‹ã€‚	If one looks up close, they are not seen.
['ZH_T49_2039_003:0998a02_3']	æˆ–è¦‹è¦”ç­‰æ˜¯ä¸€ä¹Ÿã€‚	æˆ–è¦‹è¦”ç­‰æ˜¯ä¸€ä¹Ÿã€‚	Sometimes they are seen, sometimes not.
['ZH_T49_2039_003:0998a02_12']	åŒ—å¤©ä¹‹æ–‡å…·éŒ„æ–¼å¾Œã€‚	åŒ—å¤©ä¹‹æ–‡å…·éŒ„æ–¼å¾Œã€‚	The text from the Northern Heaven is recorded below.
