segmentnr	original	analyzed	folio	translated
['ZH_T38_1767_007:0079a01_16']	ä¸€æŒ‡æœäººå› äººä»¥æ¨™æ¥­ã€äºŒæŒ‡æœæ³•å› æ³•ä»¥å‹¸æ¥­ã€ä¸‰æ˜è‡ªè¡ŒåŒ–ä»–ä»¥è­‰æ¥­ã€å››é–‹è­¬åˆè­¬ä»¥æ³æ¥­ã€äº”ç¤ºæœå ±è¯å ±ä»¥çµæ¥­ã€‚	ä¸€æŒ‡æœäººå› äººä»¥æ¨™æ¥­ã€äºŒæŒ‡æœæ³•å› æ³•ä»¥å‹¸æ¥­ã€ä¸‰æ˜è‡ªè¡ŒåŒ–ä»–ä»¥è­‰æ¥­ã€å››é–‹è­¬åˆè­¬ä»¥æ³æ¥­ã€äº”ç¤ºæœå ±è¯å ±ä»¥çµæ¥­ã€‚	007	First, using the person who attains the fruit as the cause to indicate the practice; second, using the Dharma of the fruit and the cause as the Dharma to encourage practice; third, clarifying one's own practice and benefiting others to certify the practice; fourth, opening and combining the parables to illustrate the practice; fifth, showing the karmic retribution of the flower-like retribution to conclude the practice.
['ZH_T38_1767_007:0079a02_5']	åˆæœäººè€…ï¼Œå¦‚ä¾†ã€‚	åˆæœäººè€…ï¼Œå¦‚ä¾†ã€‚	007	The first person who attains the fruit is the TathÄgata.
['ZH_T38_1767_007:0079a02_12']	å› äººè€…ï¼Œè©è–©ã€‚	å› äººè€…ï¼Œè©è–©ã€‚	007	The person who is the cause is the bodhisattva.
['ZH_T38_1767_007:0079a03_10']	è‹¥ç„¡æ­¤æ¥­ä¸åè©è–©ï¼Œä½›ç„¡æ­¤æ¥­ä¸åå¦‚ä¾†ã€‚	è‹¥ç„¡æ­¤æ¥­ä¸åè©è–©ï¼Œä½›ç„¡æ­¤æ¥­ä¸åå¦‚ä¾†ã€‚	007	If there is no such practice, one is not called a bodhisattva. The Buddha, without this practice, is not called the TathÄgata.
['ZH_T38_1767_007:0079a03_20']	æ­¤æ¥­æˆå› ï¼Œå› åè©è–©ï¼›	æ­¤æ¥­æˆå› ï¼Œå› åè©è–©ï¼›	007	This practice becomes the cause, and the cause is called the bodhisattva;
['ZH_T38_1767_007:0079a04_9']	æ­¤æ¥­æˆæœï¼Œæœåå¦‚ä¾†ã€‚	æ­¤æ¥­æˆæœï¼Œæœåå¦‚ä¾†ã€‚	007	this practice becomes the fruit, and the fruit is called the TathÄgata.
['ZH_T38_1767_007:0079a06_2']	æ¥­è‹¥å®šå› ä¸å¾—ä½œæœï¼Œæ¥­è‹¥å®šæœä¸å¾—ä½œå› ï¼Œç•¶çŸ¥æ­¤æ¥­éå› éæœã€èƒ½å› èƒ½æœã€‚	æ¥­è‹¥å®šå› ä¸å¾—ä½œæœï¼Œæ¥­è‹¥å®šæœä¸å¾—ä½œå› ï¼Œç•¶çŸ¥æ­¤æ¥­éå› éæœã€èƒ½å› èƒ½æœã€‚	007	If the practice is definitely the cause, it cannot become the fruit. If the practice is definitely the fruit, it cannot become the cause. One should know that this practice is neither cause nor effect, yet it can be both cause and effect.
['ZH_T38_1767_007:0079a08_8']	é›–èƒ½å› æœï¼Œå› æœåµå¾—ï¼Œè¨€èªé“æ–·å¿ƒè¡Œè™•æ»…ï¼Œå¦‚ä¾†å¢ƒç•Œä¸å¯æ€è­°ï¼Œç²¾é€²è©è–©äº¦ä¸èƒ½çŸ¥ï¼Œè±ˆæ˜¯å‡¡æƒ…é—‡å¿ƒåœ–åº¦ï¼Ÿ	é›–èƒ½å› æœï¼Œå› æœåµå¾—ï¼Œè¨€èªé“æ–·å¿ƒè¡Œè™•æ»…ï¼Œå¦‚ä¾†å¢ƒç•Œä¸å¯æ€è­°ï¼Œç²¾é€²è©è–©äº¦ä¸èƒ½çŸ¥ï¼Œè±ˆæ˜¯å‡¡æƒ…é—‡å¿ƒåœ–åº¦ï¼Ÿ	007	Although it can be both cause and effect, cause and effect cannot be obtained. The path of language is cut off, and the place where the mind goes is extinguished. The realm of the TathÄgata is inconceivable. Even the diligent bodhisattvas cannot know it. How can it be measured by the deluded mind and dark thoughts of ordinary beings?
['ZH_T38_1767_007:0079a08_18']	ä¸èƒ½å·²å·²ï¼Œè¼’è¿°æ‰€èã€‚	ä¸èƒ½å·²å·²ï¼Œè¼’è¿°æ‰€èã€‚	007	Unable to stop, I will simply record what I have heard.
['ZH_T38_1767_007:0079a09_7']	æ¬¡æœæ³•è€…ï¼Œè©æä¹Ÿã€‚	æ¬¡æœæ³•è€…ï¼Œè©æä¹Ÿã€‚	007	The next dharmic effect is enlightenment.
['ZH_T38_1767_007:0079a09_15']	å› æ³•è€…ï¼Œä¸‰æ…§ä¹Ÿã€‚	å› æ³•è€…ï¼Œä¸‰æ…§ä¹Ÿã€‚	007	The causal dharma is the three kinds of wisdom.
['ZH_T38_1767_007:0079a11_14']	è½æ˜¯èæ…§ã€å—æ˜¯æ€æ…§ã€è½‰ç‚ºäººèªªå³æ˜¯ä¿®æ…§ï¼Œè‹¥è©æç„¡æ­¤æ¥­ä¸å¾—æˆæœï¼Œä¸‰æ…§ç„¡æ­¤æ¥­ä¸å¾—æˆå› ã€‚	è½æ˜¯èæ…§ã€å—æ˜¯æ€æ…§ã€è½‰ç‚ºäººèªªå³æ˜¯ä¿®æ…§ï¼Œè‹¥è©æç„¡æ­¤æ¥­ä¸å¾—æˆæœï¼Œä¸‰æ…§ç„¡æ­¤æ¥­ä¸å¾—æˆå› ã€‚	007	Listening is the wisdom of hearing, receiving is the wisdom of contemplation, and turning to explain to others is the wisdom of cultivation. If enlightenment lacks this function, it cannot produce the effect. If the three kinds of wisdom lack this function, they cannot become the cause.
['ZH_T38_1767_007:0079a12_14']	è‡³é«˜ç„¡é ‚ã€è‡³å»£ç„¡æ¶¯ï¼Œå¤šæ‰€æˆå°±ï¼Œå…¶ç›¸äº‘ä½•ï¼Ÿ	è‡³é«˜ç„¡é ‚ã€è‡³å»£ç„¡æ¶¯ï¼Œå¤šæ‰€æˆå°±ï¼Œå…¶ç›¸äº‘ä½•ï¼Ÿ	007	It is lofty without a summit, vast without boundaries, and accomplishes much. What are its characteristics?
['ZH_T38_1767_007:0079a13_4']	è‹¥æ¥­èƒ½ç ´æ¥­ï¼Œæ˜¯ç‚ºç ´æ¥­ã€‚	è‹¥æ¥­èƒ½ç ´æ¥­ï¼Œæ˜¯ç‚ºç ´æ¥­ã€‚	007	If an action can destroy an action, it is called destroying action.
['ZH_T38_1767_007:0079a13_18']	å¾ç„¡ä½æ¥­ç«‹ä¸€åˆ‡æ¥­ï¼Œæ˜¯ç‚ºç«‹æ¥­ã€‚	å¾ç„¡ä½æ¥­ç«‹ä¸€åˆ‡æ¥­ï¼Œæ˜¯ç‚ºç«‹æ¥­ã€‚	007	From the action of non-abiding, all actions are established. This is called establishing action.
['ZH_T38_1767_007:0079a14_12']	éç ´éç«‹è€Œç ´è€Œç«‹ï¼Œæ˜¯ç‚ºæ­£æ¥­ã€‚	éç ´éç«‹è€Œç ´è€Œç«‹ï¼Œæ˜¯ç‚ºæ­£æ¥­ã€‚	007	Neither destroying nor establishing, yet destroying and establishing, this is the correct action.
['ZH_T38_1767_007:0079a16_8']	å¦‚æ˜¯æ­£æ¥­ï¼Œä¸å¯è¨€ä¸‰ã€ä¸å¯è¨€ä¸€ï¼Œè¨€ä¸€å‰‡å¤±ç”¨ã€è¨€ä¸‰å‰‡å‚·é«”ï¼Œå³é«”è€Œç”¨ã€å³ç”¨è€Œé«”ã€‚	å¦‚æ˜¯æ­£æ¥­ï¼Œä¸å¯è¨€ä¸‰ã€ä¸å¯è¨€ä¸€ï¼Œè¨€ä¸€å‰‡å¤±ç”¨ã€è¨€ä¸‰å‰‡å‚·é«”ï¼Œå³é«”è€Œç”¨ã€å³ç”¨è€Œé«”ã€‚	007	Such correct action cannot be said to be three, nor can it be said to be one. If it is said to be one, then its function is lost. If it is said to be three, then its essence is injured. It is the essence that is the function, and it is the function that is the essence.
['ZH_T38_1767_007:0079a17_9']	å³é«”è€Œç”¨ï¼Œæ•…è¨€æ­¤æ¥­èƒ½ç‚ºè©æä¹‹å› ï¼Œå¾—è©ææœã€‚	å³é«”è€Œç”¨ï¼Œæ•…è¨€æ­¤æ¥­èƒ½ç‚ºè©æä¹‹å› ï¼Œå¾—è©ææœã€‚	007	Because it is the essence that is the function, it is said that this action can be the cause of enlightenment and attain the effect of enlightenment.
['ZH_T38_1767_007:0079a18_17']	é“å‰é«”ç”¨å»£ç‚ºäººèªªï¼Œé“å¾Œé«”ç”¨å³ç”¨è€Œé«”ï¼Œéå› éæœã€éè‡ªéä»–ã€‚	é“å‰é«”ç”¨å»£ç‚ºäººèªªï¼Œé“å¾Œé«”ç”¨å³ç”¨è€Œé«”ï¼Œéå› éæœã€éè‡ªéä»–ã€‚	007	The essence and function before the Way are extensively explained for others, and the essence and function after the Way are the essence within the function, neither cause nor effect, neither self nor other.
['ZH_T38_1767_007:0079a19_19']	æ•…ä¸Šæ–‡äº‘ã€Œä»¥ç åŠ›æ•…æ°´å³æ¾„æ¸…ã€ï¼Œè±ˆéå³é«”è€Œç”¨ï¼Ÿ	æ•…ä¸Šæ–‡äº‘ã€Œä»¥ç åŠ›æ•…æ°´å³æ¾„æ¸…ã€ï¼Œè±ˆéå³é«”è€Œç”¨ï¼Ÿ	007	Therefore, the above text says, By the power of the pearl, the water becomes clear, isn't this the function within the essence?
['ZH_T38_1767_007:0079a20_19']	ä¸‹æ–‡äº‘ã€Œå¤§æ…ˆå¤§æ‚²åç‚ºä½›æ€§ã€ï¼Œè±ˆéå³ç”¨è€Œé«”ï¼Ÿ	ä¸‹æ–‡äº‘ã€Œå¤§æ…ˆå¤§æ‚²åç‚ºä½›æ€§ã€ï¼Œè±ˆéå³ç”¨è€Œé«”ï¼Ÿ	007	The text below says, Great kindness and great compassion are called buddha-nature, isn't this the essence within the function?
['ZH_T38_1767_007:0079a22_2']	ä¸‰å¾ã€Œå–„ç”·å­æˆ‘ä»¥ä¿®ç¿’ã€å»ï¼Œæ˜¯èˆ‰è‡ªè¡ŒåŒ–ä»–è­‰æˆæ–¼æ¥­ã€‚	ä¸‰å¾ã€Œå–„ç”·å­æˆ‘ä»¥ä¿®ç¿’ã€å»ï¼Œæ˜¯èˆ‰è‡ªè¡ŒåŒ–ä»–è­‰æˆæ–¼æ¥­ã€‚	007	Third, from Good man, I, through cultivation and practice... is using one's own practice and teaching others to prove the Dharma.
['ZH_T38_1767_007:0079a22_18']	æˆ‘ä»¥ä¿®ç¿’æ•…å¾—è©æï¼Œå³è­‰é“å‰é«”ç”¨ã€‚	æˆ‘ä»¥ä¿®ç¿’æ•…å¾—è©æï¼Œå³è­‰é“å‰é«”ç”¨ã€‚	007	I, through cultivation and practice, attained bodhi, is the proof of the essence and function before the Way.
['ZH_T38_1767_007:0079a23_14']	ä»Šå¾©ç‚ºäººå»£èªªæ­¤æ³•ï¼Œå³è­‰é“å¾Œé«”ç”¨ã€‚	ä»Šå¾©ç‚ºäººå»£èªªæ­¤æ³•ï¼Œå³è­‰é“å¾Œé«”ç”¨ã€‚	007	Now, I again extensively explain this Dharma for others, is the proof of the essence and function after the Way.
['ZH_T38_1767_007:0079a25_4']	ç„¶æˆ‘æœä¹…æˆï¼Œé“å‰ä¹‹æ¥­éå¾©ä»Šæ™‚ï¼Œæ•…çŸ¥å´æ˜éå»æ³•é–€ç­”åˆä¹‹å•ã€‚	ç„¶æˆ‘æœä¹…æˆï¼Œé“å‰ä¹‹æ¥­éå¾©ä»Šæ™‚ï¼Œæ•…çŸ¥å´æ˜éå»æ³•é–€ç­”åˆä¹‹å•ã€‚	007	However, my fruition was accomplished long ago, and the Dharma before the Way is no longer now, therefore, it is known that the past Dharma gates are clarified to answer the first question.
['ZH_T38_1767_007:0079a25_16']	å››é–‹è­¬ä¸­ï¼Œå…ˆè­¬ã€æ¬¡åˆè­¬ã€‚	å››é–‹è­¬ä¸­ï¼Œå…ˆè­¬ã€æ¬¡åˆè­¬ã€‚	007	Fourth, in the opening analogy, first the analogy, then the combination of the analogy.
['ZH_T38_1767_007:0079a26_4']	å¦‚ç‹å­è€…ï¼Œä¼¼è­¬é“å‰ã€‚	å¦‚ç‹å­è€…ï¼Œä¼¼è­¬é“å‰ã€‚	007	Like a prince is similar to the analogy before the Way.
['ZH_T38_1767_007:0079a27_8']	ç‹è­¬è©è–©ï¼Œå­è­¬ç¾¤ç”Ÿï¼ŒçŠ¯ç½ªè­¬èµ·æƒ¡å› ï¼Œç¹«ç„è­¬å—æƒ¡æœã€‚	ç‹è­¬è©è–©ï¼Œå­è­¬ç¾¤ç”Ÿï¼ŒçŠ¯ç½ªè­¬èµ·æƒ¡å› ï¼Œç¹«ç„è­¬å—æƒ¡æœã€‚	007	The king is likened to the bodhisattva, the son to the multitude of beings, committing a crime is likened to creating evil causes, being imprisoned is likened to receiving evil consequences.
['ZH_T38_1767_007:0079a28_12']	æ†æ†«è­¬å¤©æ€§ç›¸é—œï¼Œæ„›å¿µè­¬æ‹”æƒ¡å› ï¼Œèº¬è‡³ç¹«æ‰€è­¬æ‹”æƒ¡æœã€‚	æ†æ†«è­¬å¤©æ€§ç›¸é—œï¼Œæ„›å¿µè­¬æ‹”æƒ¡å› ï¼Œèº¬è‡³ç¹«æ‰€è­¬æ‹”æƒ¡æœã€‚	007	Compassion is likened to the connection of natural affinity, loving thoughts are likened to uprooting evil causes, personally going to the prison is likened to uprooting evil consequences.
['ZH_T38_1767_007:0079a29_7']	å¤«ç‹å­è€…ï¼Œå‰åˆ©ç¨®ä¹Ÿï¼Œç½ªç‚ºç„å›šï¼›	å¤«ç‹å­è€…ï¼Œå‰åˆ©ç¨®ä¹Ÿï¼Œç½ªç‚ºç„å›šï¼›	007	The prince is of the ká¹£atriya caste, yet is a criminal in prison;
['ZH_T38_1767_007:0079b02_13']	çœ¾ç”Ÿäº¦çˆ¾ï¼ŒåŒä½›ä¹‹æ€§ï¼Œç½ªæ¥­æ‰€æ‹˜æµæµªç”Ÿæ­»ï¼Œäº¦æœ‰ä½›æ€§äº¦ç„¡ä½›æ€§ï¼Œå¦‚ç‹å­æ˜¯å›šã€å›šæ˜¯ç‹å­ï¼Œç‚ºæ­¤ç¾©æ•…æ…ˆæ‚²èˆ‡æ‹”ã€‚	çœ¾ç”Ÿäº¦çˆ¾ï¼ŒåŒä½›ä¹‹æ€§ï¼Œç½ªæ¥­æ‰€æ‹˜æµæµªç”Ÿæ­»ï¼Œäº¦æœ‰ä½›æ€§äº¦ç„¡ä½›æ€§ï¼Œå¦‚ç‹å­æ˜¯å›šã€å›šæ˜¯ç‹å­ï¼Œç‚ºæ­¤ç¾©æ•…æ…ˆæ‚²èˆ‡æ‹”ã€‚	007	sentient beings are also like this, the same in buddha-nature, yet wandering in birth and death due to karmic offenses, also having buddha-nature and also lacking buddha-nature, like the prince being a prisoner and the prisoner being a prince. For this meaning, [the bodhisattva] compassionately uproots [their suffering].
['ZH_T38_1767_007:0079b03_2']	ã€Œè©è–©äº¦çˆ¾ã€ä¸‹ï¼Œåˆè­¬ã€‚	ã€Œè©è–©äº¦çˆ¾ã€ä¸‹ï¼Œåˆè­¬ã€‚	007	The bodhisattva is also like this below is the corresponding analogy.
['ZH_T38_1767_007:0079b03_9']	å‡¡èˆ‰ä¸‰æ³•åˆè­¬ï¼š	å‡¡èˆ‰ä¸‰æ³•åˆè­¬ï¼š	007	In general, three dharmas are raised to correspond with the analogy:
['ZH_T38_1767_007:0079b04_4']	åˆã€ä¸€å­åœ°åˆåŒé«”å¤§æ‚²ã€æ³å³é«”è€Œç”¨ã€‚	åˆã€ä¸€å­åœ°åˆåŒé«”å¤§æ‚²ã€æ³å³é«”è€Œç”¨ã€‚	007	First, the stage of the only child is the same in essence as great compassion, which is likened to the essence being the function.
['ZH_T38_1767_007:0079b06_4']	æ¬¡ã€å››ç„¡é‡å¿ƒæ‹”è‹¦å› èˆ‡å–„å› ã€æ‹”è‹¦æœèˆ‡æ¨‚æœï¼Œå¤§å–œæ…¶æ‚…ã€å¤§æ¨å¹³ç­‰ï¼Œæ³ç”¨ä¸é›¢é«”ï¼Œå³ç”¨è€Œé«”ã€‚	æ¬¡ã€å››ç„¡é‡å¿ƒæ‹”è‹¦å› èˆ‡å–„å› ã€æ‹”è‹¦æœèˆ‡æ¨‚æœï¼Œå¤§å–œæ…¶æ‚…ã€å¤§æ¨å¹³ç­‰ï¼Œæ³ç”¨ä¸é›¢é«”ï¼Œå³ç”¨è€Œé«”ã€‚	007	Next, the four immeasurables uproot the causes of suffering and provide the causes of goodness, uproot the results of suffering and provide the results of happiness, great joy is rejoicing, and great equanimity is impartiality, which is likened to the function not being separate from the essence, and the function being the essence.
['ZH_T38_1767_007:0079b06_15']	ä¸‰ã€å››å¼˜èª“é¡˜éç´„å››è«¦ã€‚	ä¸‰ã€å››å¼˜èª“é¡˜éç´„å››è«¦ã€‚	007	Third, the four great vows are universally based on the four truths.
['ZH_T38_1767_007:0079b08_8']	è‹¦è«¦å‰‡é€šä¸ä½†å››è¶£ï¼Œé›†è«¦äº¦é€šä¸ä½†åæƒ¡ï¼Œé“è«¦ä¸ä½†æˆ’å–„ï¼Œæ»…è«¦ä¸ä½†ç°æ–·ã€‚	è‹¦è«¦å‰‡é€šä¸ä½†å››è¶£ï¼Œé›†è«¦äº¦é€šä¸ä½†åæƒ¡ï¼Œé“è«¦ä¸ä½†æˆ’å–„ï¼Œæ»…è«¦ä¸ä½†ç°æ–·ã€‚	007	The truth of suffering is common and not just the four destinies, the truth of accumulation is also common and not just the ten evils, the truth of the path is not just precepts and goodness, and the truth of cessation is not just extinguished annihilation.
['ZH_T38_1767_007:0079b09_6']	å¼˜èª“ä¹‹å¢ƒå›Šæ‹¬å‰‡å‘¨ï¼Œæ•…ç”¨ä¸‰æ³•åˆè­¬æ³æ¥­ã€‚	å¼˜èª“ä¹‹å¢ƒå›Šæ‹¬å‰‡å‘¨ï¼Œæ•…ç”¨ä¸‰æ³•åˆè­¬æ³æ¥­ã€‚	007	The realm of the great vows encompasses all, therefore the three dharmas are used as a simile to illustrate karma.
['ZH_T38_1767_007:0079b10_15']	äº”èˆ‰äºŒå ±çµè€…ï¼Œè–äººä»¥æ…§ç‚ºå‘½ï¼Œæ™ºæ…§è‡ªåœ¨æ•…å£½å‘½é•·ï¼Œå³è­¬æœå ±ã€‚	äº”èˆ‰äºŒå ±çµè€…ï¼Œè–äººä»¥æ…§ç‚ºå‘½ï¼Œæ™ºæ…§è‡ªåœ¨æ•…å£½å‘½é•·ï¼Œå³è­¬æœå ±ã€‚	007	Fifth, the two retributions are mentioned to conclude. The sage takes wisdom as his life, because wisdom is sovereign, his lifespan is long, which is a metaphor for the fruition retribution.
['ZH_T38_1767_007:0079b11_6']	å¤©ä¸Šå—æ¨‚ï¼Œå‰‡è­¬è¯å ±äº‘äº‘ã€‚	å¤©ä¸Šå—æ¨‚ï¼Œå‰‡è­¬è¯å ±äº‘äº‘ã€‚	007	Receiving bliss in the heavens is a metaphor for the flower retribution.
['ZH_T38_1767_007:0079b12_7']	ä¸‰å¾ã€Œçˆ¾æ™‚è¿¦è‘‰ç™½ä½›ã€å»ï¼Œæ˜¯è«–ç¾©ï¼Œå‡¡å››ç•ªå•ç­”ã€‚	ä¸‰å¾ã€Œçˆ¾æ™‚è¿¦è‘‰ç™½ä½›ã€å»ï¼Œæ˜¯è«–ç¾©ï¼Œå‡¡å››ç•ªå•ç­”ã€‚	007	From At that time, KÄÅ›yapa addressed the Buddha, is the discussion of the meaning, with four rounds of questions and answers.
['ZH_T38_1767_007:0079b12_16']	åˆç•ªï¼Œå…ˆå•ã€æ¬¡ç­”ã€‚	åˆç•ªï¼Œå…ˆå•ã€æ¬¡ç­”ã€‚	007	The first round first asks, then answers.
['ZH_T38_1767_007:0079b12_21']	å•æœ‰ä¸‰æ„ï¼š	å•æœ‰ä¸‰æ„ï¼š	007	The question has three meanings:
['ZH_T38_1767_007:0079b13_13']	ä¸€è¿°ä¸è§£ã€äºŒè¬‚ä¸æ‡‰ã€ä¸‰æ­£ä½œé›£ã€‚	ä¸€è¿°ä¸è§£ã€äºŒè¬‚ä¸æ‡‰ã€ä¸‰æ­£ä½œé›£ã€‚	007	First, stating incomprehension; second, saying it should not be so; third, directly raising objections.
['ZH_T38_1767_007:0079b14_15']	ä¸è§£è€…ï¼Œé ˜é•·å£½æ¥­éå› éæœã€éè‡ªéä»–ï¼Œæ•…è¨€æ·±éš±ã€‚	ä¸è§£è€…ï¼Œé ˜é•·å£½æ¥­éå› éæœã€éè‡ªéä»–ï¼Œæ•…è¨€æ·±éš±ã€‚	007	As for incomprehension, it refers to the fact that the karma for long life is neither a cause nor a result, neither self-made nor made by others, thus it is said to be profound and hidden.
['ZH_T38_1767_007:0079b15_17']	æ¬¡ä¸æ‡‰è€…ï¼Œä¸€å­ä¹‹åœ°åŒé«”å¤§æ…ˆé«”ç„¡æ„›æšï¼Œäº‘ä½•å­æƒ³ï¼Ÿ	æ¬¡ä¸æ‡‰è€…ï¼Œä¸€å­ä¹‹åœ°åŒé«”å¤§æ…ˆé«”ç„¡æ„›æšï¼Œäº‘ä½•å­æƒ³ï¼Ÿ	007	Next, the inappropriate one: the ground of the only child, with the great compassion of the same essence, the essence is without love or anger. How can there be the thought of a child?
['ZH_T38_1767_007:0079b16_15']	è‹¥åŒå­æƒ³ï¼Œå³æ˜¯èµ·æ„›ï¼Œèµ·æ„›äº‘ä½•åŒé«”ï¼Ÿ	è‹¥åŒå­æƒ³ï¼Œå³æ˜¯èµ·æ„›ï¼Œèµ·æ„›äº‘ä½•åŒé«”ï¼Ÿ	007	If there is the thought of a child, then it is giving rise to love. How can giving rise to love be the same essence?
['ZH_T38_1767_007:0079b17_2']	åŒé«”äº‘ä½•èµ·æ„›ï¼Ÿ	åŒé«”äº‘ä½•èµ·æ„›ï¼Ÿ	007	How can the same essence give rise to love?
['ZH_T38_1767_007:0079b17_7']	æ•…äº‘ä¸æ‡‰ã€‚	æ•…äº‘ä¸æ‡‰ã€‚	007	Therefore it is said to be inappropriate.
['ZH_T38_1767_007:0079b18_11']	ä¸‰ä½œé›£è€…ï¼Œç ´æˆ’ä½œé€†æ‡‰é ˆæ²»ç½°ï¼Œæ²»ç½°ä¹–æ…ˆï¼Œäº‘ä½•ç­‰è¦–ï¼Ÿ	ä¸‰ä½œé›£è€…ï¼Œç ´æˆ’ä½œé€†æ‡‰é ˆæ²»ç½°ï¼Œæ²»ç½°ä¹–æ…ˆï¼Œäº‘ä½•ç­‰è¦–ï¼Ÿ	007	Third, the one who raises difficulties: those who break the precepts and commit grave offenses should be punished. Punishing them goes against compassion. How can they be viewed equally?
['ZH_T38_1767_007:0079b18_21']	ç­‰å‰‡ç„¡ç½°ï¼Œäº‘ä½•è¨€æ²»ï¼Ÿ	ç­‰å‰‡ç„¡ç½°ï¼Œäº‘ä½•è¨€æ²»ï¼Ÿ	007	If they are viewed equally, then there should be no punishment. How can it be said to be a punishment?
['ZH_T38_1767_007:0079b20_5']	æ²»åä¹–æ…ˆï¼Œæ…ˆä¹‹èˆ‡æ²»äºŒä¿±ä¹–é«”ï¼Œå±•è½‰æœ‰å¦¨ï¼Œé›£å¾æ­¤ç”Ÿäº‘äº‘ã€‚	æ²»åä¹–æ…ˆï¼Œæ…ˆä¹‹èˆ‡æ²»äºŒä¿±ä¹–é«”ï¼Œå±•è½‰æœ‰å¦¨ï¼Œé›£å¾æ­¤ç”Ÿäº‘äº‘ã€‚	007	Punishing them goes against compassion. Compassion and punishment both go against the essence. They are mutually obstructive. The difficulty arises from this.
['ZH_T38_1767_007:0079b20_17']	æ¬¡ä½›ä»¥ä¸€è¨€ç­”å…¶ä¸‰æ„ï¼Œäº‘ï¼š	æ¬¡ä½›ä»¥ä¸€è¨€ç­”å…¶ä¸‰æ„ï¼Œäº‘ï¼š	007	Next, the Buddha answers his three points with one statement, saying:
['ZH_T38_1767_007:0079b21_5']	æˆ‘æ–¼çœ¾ç”ŸåŒä¸€å­æƒ³ã€‚	æˆ‘æ–¼çœ¾ç”ŸåŒä¸€å­æƒ³ã€‚	007	I have the thought of the only child towards sentient beings.
['ZH_T38_1767_007:0079b21_16']	å¦‚ç¾…çºç¾…è€…ï¼ŒåŒé«”ä¹‹æ…ˆã€‚	å¦‚ç¾…çºç¾…è€…ï¼ŒåŒé«”ä¹‹æ…ˆã€‚	007	Like RÄhula, it is the compassion of the same essence.
['ZH_T38_1767_007:0079b22_10']	æ˜¯æ…ˆæ¸…æ·¨å¾®å¦™ç¬¬ä¸€ï¼ŒéæŸ“æ„›æ…ˆã€‚	æ˜¯æ…ˆæ¸…æ·¨å¾®å¦™ç¬¬ä¸€ï¼ŒéæŸ“æ„›æ…ˆã€‚	007	This compassion is pure, subtle, and supreme. It is not the compassion of defiled love.
['ZH_T38_1767_007:0079b23_3']	æ˜¯æ…ˆæ·±éš±ï¼Œéä½†é›£è§£äº¦å¾©é›£èªªã€‚	æ˜¯æ…ˆæ·±éš±ï¼Œéä½†é›£è§£äº¦å¾©é›£èªªã€‚	007	This compassion is profound and hidden. It is not only difficult to understand, but also difficult to speak of.
['ZH_T38_1767_007:0079b23_17']	å³é«”è€Œç”¨ï¼Œä¸å¦¨ç­‰è¦–å¦‚ç¾…çºç¾…ã€‚	å³é«”è€Œç”¨ï¼Œä¸å¦¨ç­‰è¦–å¦‚ç¾…çºç¾…ã€‚	007	It is the function of the essence. It does not obstruct viewing them equally like RÄhula.
['ZH_T38_1767_007:0079b24_8']	æ—¢å³é«”è€Œç”¨ï¼Œæ…ˆäº¦å¾©ç„¶ã€‚	æ—¢å³é«”è€Œç”¨ï¼Œæ…ˆäº¦å¾©ç„¶ã€‚	007	Since it is the function of the essence, compassion is also like this.
['ZH_T38_1767_007:0079b24_18']	ä¸€è¨€ç­”ä¸‰ï¼Œå…¶æ„åœ¨æ­¤ã€‚	ä¸€è¨€ç­”ä¸‰ï¼Œå…¶æ„åœ¨æ­¤ã€‚	007	One word answers three, the meaning is in this.
['ZH_T38_1767_007:0079b25_11']	ç„¶è¿¦è‘‰å•è©è–©ä¿®æ…ˆï¼Œæ­¤å•é“å‰ï¼›	ç„¶è¿¦è‘‰å•è©è–©ä¿®æ…ˆï¼Œæ­¤å•é“å‰ï¼›	007	However, KÄÅ›yapa's question about the bodhisattva cultivating compassion is a question about before the Way;
['ZH_T38_1767_007:0079b26_9']	ä½›ä»¥é“å¾Œæœæ…ˆç­”ä¹‹ï¼Œäº‘æˆ‘æ–¼çœ¾ç”Ÿäº¦ä¸€å­æƒ³ã€‚	ä½›ä»¥é“å¾Œæœæ…ˆç­”ä¹‹ï¼Œäº‘æˆ‘æ–¼çœ¾ç”Ÿäº¦ä¸€å­æƒ³ã€‚	007	The Buddha answers with the fruition compassion after the Way, saying I also have the thought of one child towards sentient beings.
['ZH_T38_1767_007:0079b26_19']	èˆ‰å¾Œç­”å‰ï¼Œå‰å¾Œä¸ç•°ã€‚	èˆ‰å¾Œç­”å‰ï¼Œå‰å¾Œä¸ç•°ã€‚	007	Citing the later to answer the former, the former and later are not different.
['ZH_T38_1767_007:0079b27_21']	æ¬¡å¾ã€Œè¿¦è‘‰å¾©ç™½ã€å»ï¼Œæ˜¯ç¬¬äºŒå•ç­”ï¼Œå…ˆå•ã€æ¬¡ç­”ã€‚	æ¬¡å¾ã€Œè¿¦è‘‰å¾©ç™½ã€å»ï¼Œæ˜¯ç¬¬äºŒå•ç­”ï¼Œå…ˆå•ã€æ¬¡ç­”ã€‚	007	Next, from KÄÅ›yapa said again is the second question and answer, first the question, then the answer.
['ZH_T38_1767_007:0079b28_8']	åˆå•ä¸­èˆ‰æ˜”äº‹é›£ä»Šç¾©ã€‚	åˆå•ä¸­èˆ‰æ˜”äº‹é›£ä»Šç¾©ã€‚	007	In the initial question, he uses an old story to challenge the current meaning.
['ZH_T38_1767_007:0079b29_9']	åŠ›å£«ç„¡æ…ˆç¢è½æˆ’ç«¥å­ï¼Œç«¥å­å‘½æ–·ï¼Œå³æ˜”äº‹ä¹Ÿã€‚	åŠ›å£«ç„¡æ…ˆç¢è½æˆ’ç«¥å­ï¼Œç«¥å­å‘½æ–·ï¼Œå³æ˜”äº‹ä¹Ÿã€‚	007	The strong man had no compassion and crushed the novice monk, the novice's life ended, this is the old story.
