segmentnr	original	analyzed	folio	translated
['ZH_T23_1442_013:0694b20_3']	æ™‚é¦¬å‹è‹¾èŠ»åŸä¸­å¾—é£Ÿï¼Œè©£æ°´è›­æ—è¡£é‰¢æ°´ç¾…ç½®ä¸€é¢å·²ï¼ŒæŒ¯å»è¡£å¡µä»¥ç¾…æ¿¾æ°´æ¾¡æ‰‹æ¿¯è¶³ï¼Œå–é»ƒè½è‘‰å¸ƒä¹‹æ–¼åœ°å´åè€Œé£Ÿã€‚	æ™‚é¦¬å‹è‹¾èŠ»åŸä¸­å¾—é£Ÿï¼Œè©£æ°´è›­æ—è¡£é‰¢æ°´ç¾…ç½®ä¸€é¢å·²ï¼ŒæŒ¯å»è¡£å¡µä»¥ç¾…æ¿¾æ°´æ¾¡æ‰‹æ¿¯è¶³ï¼Œå–é»ƒè½è‘‰å¸ƒä¹‹æ–¼åœ°å´åè€Œé£Ÿã€‚	013	At that time, the bhiká¹£u AÅ›vajit obtained food in the city and went to the leeches' forest. He placed his robe, alms bowl, and water strainer on one side, shook off the dust from his robe, filtered water with the strainer to wash his hands and feet, took some fallen yellow leaves, spread them on the ground, and sat down to eat.
['ZH_T23_1442_013:0694b21_18']	é£¯é£Ÿå·²æ”¶æ£„æ®˜è‘‰èˆ‰ç½®è¡£é‰¢ï¼Œæ›´æ´—æ‰‹è¶³çµè·è€Œåï¼Œè­¬å¦‚ç›¤é¾å¨å„€å¯‚éœæ­£èº«è€Œä½ã€‚	é£¯é£Ÿå·²æ”¶æ£„æ®˜è‘‰èˆ‰ç½®è¡£é‰¢ï¼Œæ›´æ´—æ‰‹è¶³çµè·è€Œåï¼Œè­¬å¦‚ç›¤é¾å¨å„€å¯‚éœæ­£èº«è€Œä½ã€‚	013	After finishing his meal, he discarded the remaining leaves, picked up his robe and bowl, washed his hands and feet again, sat cross-legged, and remained still like a coiled dragon, his demeanor tranquil and his body upright.
['ZH_T23_1442_013:0694b22_14']	æ™‚å½¼ä½¿äººæ—¢è§€å¯Ÿå·²ï¼Œé‚„ç™½å¤ªå­æ›°ï¼š	æ™‚å½¼ä½¿äººæ—¢è§€å¯Ÿå·²ï¼Œé‚„ç™½å¤ªå­æ›°ï¼š	013	At that time, the messenger observed this and returned to report to the prince, saying:
['ZH_T23_1442_013:0694b23_15']	ã€ŒåŸå…§è¦‹å½¼è‹¾èŠ»å¨å„€åº åºï¼Œæ—¢è‡³æ—é‡ç™¾å€å‹å‰ã€‚	ã€ŒåŸå…§è¦‹å½¼è‹¾èŠ»å¨å„€åº åºï¼Œæ—¢è‡³æ—é‡ç™¾å€å‹å‰ã€‚	013	In the city, I saw that bhiká¹£u with a dignified manner, but when he reached the forest, his appearance was a hundred times better than before.
['ZH_T23_1442_013:0694b24_5']	ã€æ™‚å¯¦åŠ›å­å‘Šå¾¡è€…æ›°ï¼š	ã€æ™‚å¯¦åŠ›å­å‘Šå¾¡è€…æ›°ï¼š	013	Then, the son of ÅšÅ«radatta said to the charioteer:
['ZH_T23_1442_013:0694b25_4']	ã€Œæ±ä»Šå®œæ‡‰é€Ÿå¯åš´é§•ï¼Œæ¬²è©£æ—æ‰€è§€å½¼è‹¾èŠ»ã€‚	ã€Œæ±ä»Šå®œæ‡‰é€Ÿå¯åš´é§•ï¼Œæ¬²è©£æ—æ‰€è§€å½¼è‹¾èŠ»ã€‚	013	You should quickly prepare the chariot now. I wish to go to the forest to observe that bhiká¹£u.
['ZH_T23_1442_013:0694b27_15']	ã€å¾¡è€…éŠœå‘½åš´æ•´é§•é§Ÿï¼Œå¤ªå­ä¹˜è»Šå°å¾è€Œå¾€ï¼Œæ—¢è‡³æ—æ‰€å¾’æ­¥è€Œè¡Œï¼Œä¾¿è©£é¦¬å‹ä½è™•ï¼Œé™è§€å°Šè€…é¦¬å‹è·è¶ºå…¥å®šï¼Œä½œå¦‚æ˜¯å¿µï¼š	ã€å¾¡è€…éŠœå‘½åš´æ•´é§•é§Ÿï¼Œå¤ªå­ä¹˜è»Šå°å¾è€Œå¾€ï¼Œæ—¢è‡³æ—æ‰€å¾’æ­¥è€Œè¡Œï¼Œä¾¿è©£é¦¬å‹ä½è™•ï¼Œé™è§€å°Šè€…é¦¬å‹è·è¶ºå…¥å®šï¼Œä½œå¦‚æ˜¯å¿µï¼š	013	The charioteer received the order and carefully prepared the four-horse carriage. The prince rode in the carriage, with attendants leading the way, and when they reached the grove, he walked on foot. He went to where Venerable AÅ›vajit was staying and saw from afar that the Venerable AÅ›vajit was sitting in meditation cross-legged. He thought like this:
['ZH_T23_1442_013:0694b28_18']	ã€Œæˆ‘ä»Šä¸æ‡‰ä»¤å½¼è‹¾èŠ»äº‚æ®Šå‹å®šï¼Œå¾…å½¼å‡ºå®šæˆ‘ç•¶å°±ç¦®ã€‚	ã€Œæˆ‘ä»Šä¸æ‡‰ä»¤å½¼è‹¾èŠ»äº‚æ®Šå‹å®šï¼Œå¾…å½¼å‡ºå®šæˆ‘ç•¶å°±ç¦®ã€‚	013	I should not disturb the excellent concentration of this bhiká¹£u now. I will wait for him to emerge from concentration and then I will go to pay homage.
['ZH_T23_1442_013:0694c02_6']	ã€ä½œæ˜¯å¿µå·²éš¨è™•è€Œä½ï¼Œæ™‚å°Šè€…é¦¬å‹è‡³æ™¡å¾Œæ™‚æ–¹å§‹å‡ºå®šï¼Œæ™‚å¯¦åŠ›å­å³æ¼¸å‰è¡Œï¼Œé ‚ç¦®é›™è¶³åœ¨ä¸€é¢ä½ï¼Œç™½è¨€ï¼š	ã€ä½œæ˜¯å¿µå·²éš¨è™•è€Œä½ï¼Œæ™‚å°Šè€…é¦¬å‹è‡³æ™¡å¾Œæ™‚æ–¹å§‹å‡ºå®šï¼Œæ™‚å¯¦åŠ›å­å³æ¼¸å‰è¡Œï¼Œé ‚ç¦®é›™è¶³åœ¨ä¸€é¢ä½ï¼Œç™½è¨€ï¼š	013	Having had this thought, he stayed where he was. At that time, Venerable AÅ›vajit emerged from concentration in the late afternoon. Then, the son of the powerful one gradually went forward, bowed at his feet, stood to one side, and said:
['ZH_T23_1442_013:0694c02_10']	ã€Œå¤§å¾·ï¼	ã€Œå¤§å¾·ï¼	013	Venerable One!
['ZH_T23_1442_013:0694c02_15']	ç‚ºæ˜¯å¤§å¸«ï¼Ÿ	ç‚ºæ˜¯å¤§å¸«ï¼Ÿ	013	Are you the great teacher?
['ZH_T23_1442_013:0694c02_20']	ç‚ºæ˜¯å¼Ÿå­ï¼Ÿ	ç‚ºæ˜¯å¼Ÿå­ï¼Ÿ	013	Or are you a disciple?
['ZH_T23_1442_013:0694c03_2']	ã€é¦¬å‹å ±è¨€ï¼š	ã€é¦¬å‹å ±è¨€ï¼š	013	AÅ›vajit replied:
['ZH_T23_1442_013:0694c03_13']	ã€Œæˆ‘æ˜¯å¼Ÿå­ï¼Œéå¤§å¸«ä¹Ÿã€‚	ã€Œæˆ‘æ˜¯å¼Ÿå­ï¼Œéå¤§å¸«ä¹Ÿã€‚	013	I am a disciple, not the great teacher.
['ZH_T23_1442_013:0694c03_19']	ã€å¾©å•ä¹‹æ›°ï¼š	ã€å¾©å•ä¹‹æ›°ï¼š	013	He further asked:
['ZH_T23_1442_013:0694c04_5']	ã€Œå¸«èˆ‡å¼Ÿå­å„ªåŠ£å¦‚ä½•ï¼Ÿ	ã€Œå¸«èˆ‡å¼Ÿå­å„ªåŠ£å¦‚ä½•ï¼Ÿ	013	How is the difference between the teacher and the disciple?
['ZH_T23_1442_013:0694c04_11']	ã€é¦¬å‹å ±æ›°ï¼š	ã€é¦¬å‹å ±æ›°ï¼š	013	AÅ›vajit replied:
['ZH_T23_1442_013:0694c04_17']	ã€Œæ¥µæœ‰å„ªåŠ£ã€‚	ã€Œæ¥µæœ‰å„ªåŠ£ã€‚	013	There is a great difference.
['ZH_T23_1442_013:0694c06_7']	å¤ªå­ç•¶çŸ¥ï¼Œå¦™é«˜å±±ç‹æ¯”ä¹èŠ¥å­ï¼Œä»¥å¤§æµ·æ°´åŒæ–¼ç‰›è·¡ï¼Œäº¦çŒ¶ç™½æ—¥ç­‰å½¼è¢å…‰ã€‚	å¤ªå­ç•¶çŸ¥ï¼Œå¦™é«˜å±±ç‹æ¯”ä¹èŠ¥å­ï¼Œä»¥å¤§æµ·æ°´åŒæ–¼ç‰›è·¡ï¼Œäº¦çŒ¶ç™½æ—¥ç­‰å½¼è¢å…‰ã€‚	013	Prince, you should know that Mount Sumeru compared to a mustard seed, the water of the great ocean compared to a cow's footprint, is also like the bright sun compared to a firefly.
['ZH_T23_1442_013:0694c06_19']	ã€äºæ™‚å…·å£½é¦¬å‹èªªä¼½ä»–æ›°ï¼š	ã€äºæ™‚å…·å£½é¦¬å‹èªªä¼½ä»–æ›°ï¼š	013	 At that time, the Venerable AÅ›vajit spoke a verse, saying:
['ZH_T23_1442_013:0694c07_14']	ã€Œå¦™é«˜æ¯”èŠ¥å­ï¼Œã€€ã€€å¤§æµ·åŒç‰›è·¡ï¼š	ã€Œå¦™é«˜æ¯”èŠ¥å­ï¼Œã€€ã€€å¤§æµ·åŒç‰›è·¡ï¼š	013	Mount Sumeru compared to a mustard seed, the great ocean compared to a cow's footprint,
['ZH_T23_1442_013:0694c08_13']	ç©ºæ–¹è—•çµ²ç©´ï¼Œã€€ã€€ç™½æ—¥æ“¬è¢å…‰ã€‚	ç©ºæ–¹è—•çµ²ç©´ï¼Œã€€ã€€ç™½æ—¥æ“¬è¢å…‰ã€‚	013	Space compared to the hole of a lotus root, the bright sun compared to a firefly.
['ZH_T23_1442_013:0694c09_13']	ä¸–é–“æ‰€æœ‰ç‰©ï¼Œã€€ã€€ä¸å¯ç‚ºè­¬å–»ï¼›	ä¸–é–“æ‰€æœ‰ç‰©ï¼Œã€€ã€€ä¸å¯ç‚ºè­¬å–»ï¼›	013	The things that exist in the world cannot be used as analogies;
['ZH_T23_1442_013:0694c10_13']	å¼Ÿå­æœ›æ–¼å¸«ï¼Œã€€ã€€å…¶äº‹äº¦å¦‚æ˜¯ã€‚	å¼Ÿå­æœ›æ–¼å¸«ï¼Œã€€ã€€å…¶äº‹äº¦å¦‚æ˜¯ã€‚	013	The relationship between disciple and teacher is also like this.
['ZH_T23_1442_013:0694c11_12']	ã€æ™‚å¯¦åŠ›å­èæ˜¯èªªå·²ä¾¿ä½œæ˜¯å¿µï¼š	ã€æ™‚å¯¦åŠ›å­èæ˜¯èªªå·²ä¾¿ä½œæ˜¯å¿µï¼š	013	At that time, when SubhÅ«ti heard this, he thought like this:
['ZH_T23_1442_013:0694c12_16']	ã€Œå¦‚è‹¾èŠ»èªªåŠŸå¾·å·®åˆ¥ï¼Œè±ˆéæ›´æœ‰å¦™è¦ºä¸–å°ŠåŠæ®Šå‹æ³•ã€‚	ã€Œå¦‚è‹¾èŠ»èªªåŠŸå¾·å·®åˆ¥ï¼Œè±ˆéæ›´æœ‰å¦™è¦ºä¸–å°ŠåŠæ®Šå‹æ³•ã€‚	013	If the merits and differences spoken by the bhiká¹£us are not the wondrously enlightened World-Honored One and the supreme Dharma,
['ZH_T23_1442_013:0694c13_6']	ã€å¦‚æ˜¯çŸ¥å·²å•é¦¬å‹æ›°ï¼š	ã€å¦‚æ˜¯çŸ¥å·²å•é¦¬å‹æ›°ï¼š	013	 Knowing this, he asked AÅ›vajit, saying:
['ZH_T23_1442_013:0694c13_10']	ã€Œå¤§å¾·ï¼	ã€Œå¤§å¾·ï¼	013	Venerable One!
['ZH_T23_1442_013:0694c14_18']	æˆ‘ä»Šé —å¾—æ–¼æ­¤å–„èªªæ³•å¾‹å‡ºå®¶åœ“å…·æˆè‹¾èŠ»æ€§ï¼Œæ–¼å¤§å¾·æ‰€ä¿®æ¢µè¡Œä¸ï¼Ÿ	æˆ‘ä»Šé —å¾—æ–¼æ­¤å–„èªªæ³•å¾‹å‡ºå®¶åœ“å…·æˆè‹¾èŠ»æ€§ï¼Œæ–¼å¤§å¾·æ‰€ä¿®æ¢µè¡Œä¸ï¼Ÿ	013	Can I now go forth, receive the full precepts, and become a bhiká¹£u in this well-spoken Dharma and Vinaya, and practice the holy life under the Venerable One?ğŸ”½AÅ›vajit replied:
['ZH_T23_1442_013:0694c15_4']	ã€é¦¬å‹å ±æ›°ï¼š	ã€é¦¬å‹å ±æ›°ï¼š	013	Good man!
['ZH_T23_1442_013:0694c15_8']	ã€Œå¤ªå­ï¼	ã€Œå¤ªå­ï¼	013	Prince!
['ZH_T23_1442_013:0694c15_17']	æ±ä¹‹çˆ¶æ¯è¦‹è½è¨±ä¸ï¼Ÿ	æ±ä¹‹çˆ¶æ¯è¦‹è½è¨±ä¸ï¼Ÿ	013	Have your parents given their permission?
['ZH_T23_1442_013:0694c16_1']	ã€å¯¦åŠ›å­æ›°ï¼š	ã€å¯¦åŠ›å­æ›°ï¼š	013	VirÅ«á¸haka said:
['ZH_T23_1442_013:0694c16_5']	ã€Œå¤§å¾·ï¼	ã€Œå¤§å¾·ï¼	013	Venerable One!
['ZH_T23_1442_013:0694c16_10']	æœªæ›¾è½è¨±ã€‚	æœªæ›¾è½è¨±ã€‚	013	They have never given their permission.
['ZH_T23_1442_013:0694c16_16']	ã€é¦¬å‹å ±æ›°ï¼š	ã€é¦¬å‹å ±æ›°ï¼š	013	AÅ›vajit replied:
['ZH_T23_1442_013:0694c17_16']	ã€Œè‹¥å¦‚ä¾†åŠå¦‚ä¾†å¼Ÿå­èˆ‡ä»–å‡ºå®¶ï¼Œçˆ¶æ¯ä¸è½ç„¡å®œè¼’åº¦ã€‚	ã€Œè‹¥å¦‚ä¾†åŠå¦‚ä¾†å¼Ÿå­èˆ‡ä»–å‡ºå®¶ï¼Œçˆ¶æ¯ä¸è½ç„¡å®œè¼’åº¦ã€‚	013	If the TathÄgata or the TathÄgata's disciples give the going forth, if the parents do not give permission, it is not suitable to ordain them.
['ZH_T23_1442_013:0694c18_2']	ã€å¯¦åŠ›å­æ›°ï¼š	ã€å¯¦åŠ›å­æ›°ï¼š	013	VirÅ«á¸haka said:
['ZH_T23_1442_013:0694c18_6']	ã€Œå¤§å¾·ï¼	ã€Œå¤§å¾·ï¼	013	Venerable One!
['ZH_T23_1442_013:0694c18_15']	æˆ‘ä»¥æ–¹ä¾¿å¿…ä»¤è¦‹è¨±ã€‚	æˆ‘ä»¥æ–¹ä¾¿å¿…ä»¤è¦‹è¨±ã€‚	013	I will use skillful means to surely make them give their permission.
['ZH_T23_1442_013:0694c18_21']	ã€é¦¬å‹å ±æ›°ï¼š	ã€é¦¬å‹å ±æ›°ï¼š	013	AÅ›vajit replied:
['ZH_T23_1442_013:0694c19_3']	ã€Œæ–¯æ¥µå–„å“‰ï¼	ã€Œæ–¯æ¥µå–„å“‰ï¼	013	This is extremely good!
['ZH_T23_1442_013:0694c20_11']	ã€æ™‚å¯¦åŠ›å­èæ˜¯èªå·²ï¼Œæ­æ•¬æ­¡å–œå¥‰è¾­è€Œå»ï¼Œä¾¿æ­¸æœ¬å®®ç™½çˆ¶æ¯æ›°ï¼š	ã€æ™‚å¯¦åŠ›å­èæ˜¯èªå·²ï¼Œæ­æ•¬æ­¡å–œå¥‰è¾­è€Œå»ï¼Œä¾¿æ­¸æœ¬å®®ç™½çˆ¶æ¯æ›°ï¼š	013	At that time, having heard these words, VirÅ«á¸haka respectfully and joyfully took leave and departed. He then returned to his own palace and said to his parents:
['ZH_T23_1442_013:0694c21_5']	ã€ŒäºŒè¦ªç•¶çŸ¥æˆ‘å·²æ­£ä¿¡ä»Šé¡˜å‡ºå®¶ã€‚	ã€ŒäºŒè¦ªç•¶çŸ¥æˆ‘å·²æ­£ä¿¡ä»Šé¡˜å‡ºå®¶ã€‚	013	Mother and Father, you should know that I have already generated the correct faith and now wish to go forth.
['ZH_T23_1442_013:0694c21_11']	ã€çˆ¶æ¯å ±æ›°ï¼š	ã€çˆ¶æ¯å ±æ›°ï¼š	013	His parents replied:
['ZH_T23_1442_013:0694c21_17']	ã€Œæ±ä»ŠçŸ¥ä¸ï¼Ÿ	ã€Œæ±ä»ŠçŸ¥ä¸ï¼Ÿ	013	Do you know now?
['ZH_T23_1442_013:0694c23_7']	æˆ‘å”¯ä¸€å­ï¼Œå¸¸æ‰€æ„›å¿µè§€è¦–ç„¡å­ï¼Œå‡ä»¤å‘½ç›¡å°šä¸æ¬²é›¢ï¼Œæ³å¾©å½¢å­˜è€Œç•¶è¦‹åˆ¥ï¼	æˆ‘å”¯ä¸€å­ï¼Œå¸¸æ‰€æ„›å¿µè§€è¦–ç„¡å­ï¼Œå‡ä»¤å‘½ç›¡å°šä¸æ¬²é›¢ï¼Œæ³å¾©å½¢å­˜è€Œç•¶è¦‹åˆ¥ï¼	013	We only have one child, whom we always love and cherish, watching without any displeasure. Even if our lives were to end, we would not want to be separated, let alone when our bodies still exist, would we be able to see you leave?
['ZH_T23_1442_013:0694c23_13']	ã€å¤ªå­ç™½æ›°ï¼š	ã€å¤ªå­ç™½æ›°ï¼š	013	The prince said:
['ZH_T23_1442_013:0694c24_10']	ã€Œè¦‹è½è€…å–„ï¼Œè‹¥ä¸è¨±è€…æˆ‘å¾ä»Šæ—¥æ›´ä¸é£²é£Ÿã€‚	ã€Œè¦‹è½è€…å–„ï¼Œè‹¥ä¸è¨±è€…æˆ‘å¾ä»Šæ—¥æ›´ä¸é£²é£Ÿã€‚	013	If you allow it, that's good. If not, from today I will not eat or drink.
['ZH_T23_1442_013:0694c25_1']	ã€é›–èæ­¤èªäº¦æœªè¦‹è½ã€‚	ã€é›–èæ­¤èªäº¦æœªè¦‹è½ã€‚	013	Although they heard this, they still did not give permission.
['ZH_T23_1442_013:0694c26_4']	æ™‚å¯¦åŠ›å­ä¸€æ—¥æ–·é£Ÿï¼Œå¦‚æ˜¯äºŒä¸‰ä¹ƒè‡³å…­æ—¥ä¸é£²ä¸é£Ÿã€‚	æ™‚å¯¦åŠ›å­ä¸€æ—¥æ–·é£Ÿï¼Œå¦‚æ˜¯äºŒä¸‰ä¹ƒè‡³å…­æ—¥ä¸é£²ä¸é£Ÿã€‚	013	At that time, RÄhula fasted for one day, and like this for two, three, up to six days without drinking or eating.
['ZH_T23_1442_013:0694c26_18']	æ™‚å½¼çˆ¶æ¯è©£å…¶å­æ‰€ï¼Œè€Œå‘Šä¹‹æ›°ï¼š	æ™‚å½¼çˆ¶æ¯è©£å…¶å­æ‰€ï¼Œè€Œå‘Šä¹‹æ›°ï¼š	013	Then his parents went to their son and said,
['ZH_T23_1442_013:0695a01_13']	ã€Œæ±è‡ªå¹¼ç«¥å¸¸å—å®‰æ¨‚ï¼Œæ–¼è«¸è‹¦äº‹æ›¾æ‰€æœªç¶“ï¼Œæ¢µè¡Œé›£ä¿®ç¨èº«é›£ä½ï¼Œéš¨å®œè‡¥å…·è˜­è‹¥é›£å±…ï¼Œè‡³ç›¡å½¢å£½çŒ›ç¸åŒè™•ï¼Œè‡³ç›¡å½¢å£½å¾ä»–ä¹é£Ÿï¼Œè‡³ç›¡å½¢å£½æ–·è«¸æ¬²æ¨‚ï¼Œè‡³ç›¡å½¢å£½æ°¸çµ•å¬‰æˆ²ã€‚	ã€Œæ±è‡ªå¹¼ç«¥å¸¸å—å®‰æ¨‚ï¼Œæ–¼è«¸è‹¦äº‹æ›¾æ‰€æœªç¶“ï¼Œæ¢µè¡Œé›£ä¿®ç¨èº«é›£ä½ï¼Œéš¨å®œè‡¥å…·è˜­è‹¥é›£å±…ï¼Œè‡³ç›¡å½¢å£½çŒ›ç¸åŒè™•ï¼Œè‡³ç›¡å½¢å£½å¾ä»–ä¹é£Ÿï¼Œè‡³ç›¡å½¢å£½æ–·è«¸æ¬²æ¨‚ï¼Œè‡³ç›¡å½¢å£½æ°¸çµ•å¬‰æˆ²ã€‚	013	You have always enjoyed comfort since you were a young child. You have never experienced hardship. The practice of asceticism is difficult to cultivate. Living alone is difficult. Bedding and bedding are difficult to live in the wilderness. For the rest of your life, you live with fierce beasts. For the rest of your life, you beg for food from others. For the rest of your life, you cut off all sexual pleasures. For the rest of your life, you completely abandon play.
['ZH_T23_1442_013:0695a01_16']	å¤ªå­ï¼	å¤ªå­ï¼	013	Crown Prince!
['ZH_T23_1442_013:0695a02_14']	æ±æ‡‰ä½æ­¤å—è«¸æ¬²æ¨‚ï¼Œéš¨æƒ…å¸ƒæ–½ä¿®è«¸ç¦æ¥­ã€‚	æ±æ‡‰ä½æ­¤å—è«¸æ¬²æ¨‚ï¼Œéš¨æƒ…å¸ƒæ–½ä¿®è«¸ç¦æ¥­ã€‚	013	You should stay here and enjoy the pleasures of the five desires, give according to your wishes, and cultivate meritorious deeds.
['ZH_T23_1442_013:0695a03_6']	ã€å¤ªå­é›–èæ˜¯èªé»˜ç„¡æ‰€å°ã€‚	ã€å¤ªå­é›–èæ˜¯èªé»˜ç„¡æ‰€å°ã€‚	013	Although the Crown Prince heard these words, he remained silent and did not respond.
['ZH_T23_1442_013:0695a05_10']	æ™‚å½¼çˆ¶æ¯ä»¤è«¸è¦ªå±¬å‹¸å¯¦åŠ›å­ï¼Œæ™‚è«¸è¦ªå±¬åŒä¾†å‹¸å–»ï¼Œå¦‚çˆ¶æ¯æ‰€è¨€æ‚‰çš†å‘èªªï¼Œç„¶å¯¦åŠ›å­é»˜ç„¶ç„¡ç­”ã€‚	æ™‚å½¼çˆ¶æ¯ä»¤è«¸è¦ªå±¬å‹¸å¯¦åŠ›å­ï¼Œæ™‚è«¸è¦ªå±¬åŒä¾†å‹¸å–»ï¼Œå¦‚çˆ¶æ¯æ‰€è¨€æ‚‰çš†å‘èªªï¼Œç„¶å¯¦åŠ›å­é»˜ç„¶ç„¡ç­”ã€‚	013	At that time, the parents had the relatives exhort Prince MahÄsthÄmaprÄpta. The relatives all came together to offer advice, telling him everything that the parents had said, but Prince MahÄsthÄmaprÄpta remained silent and did not reply.
['ZH_T23_1442_013:0695a08_2']	æ™‚å½¼çˆ¶æ¯ä»¤å¯¦åŠ›å­è¦ªå‹çŸ¥è­˜äº¦åŒå‹¸å–»ï¼Œå¦‚å‰çˆ¶æ¯æ‰€å‘Šä¹‹è¨€æ‚‰çš†å‘èªªï¼Œç„¶å¯¦åŠ›å­åŒå‰é»˜ç„¶ï¼Œç¬¬äºŒã€ç¬¬ä¸‰äº¦ç„¡è¨€ç­”ã€‚	æ™‚å½¼çˆ¶æ¯ä»¤å¯¦åŠ›å­è¦ªå‹çŸ¥è­˜äº¦åŒå‹¸å–»ï¼Œå¦‚å‰çˆ¶æ¯æ‰€å‘Šä¹‹è¨€æ‚‰çš†å‘èªªï¼Œç„¶å¯¦åŠ›å­åŒå‰é»˜ç„¶ï¼Œç¬¬äºŒã€ç¬¬ä¸‰äº¦ç„¡è¨€ç­”ã€‚	013	Then the parents had the close friends and acquaintances of Prince MahÄsthÄmaprÄpta also offer advice, telling him everything that the parents had said before, but Prince MahÄsthÄmaprÄpta remained silent as before, not replying a second or third time either.
['ZH_T23_1442_013:0695a10_4']	æ™‚å½¼çŸ¥è­˜è¦‹å…¶å …å›ºï¼Œç¬¬äºŒã€ç¬¬ä¸‰ä¸€ç„¡è¨€ç­”ï¼Œæ™‚è«¸è¦ªå‹çŸ¥å¯¦åŠ›å­å¿—æ„å …å›ºï¼Œè©£ç‹åŠå¦ƒå…·é™³æƒ…ç†ï¼š	æ™‚å½¼çŸ¥è­˜è¦‹å…¶å …å›ºï¼Œç¬¬äºŒã€ç¬¬ä¸‰ä¸€ç„¡è¨€ç­”ï¼Œæ™‚è«¸è¦ªå‹çŸ¥å¯¦åŠ›å­å¿—æ„å …å›ºï¼Œè©£ç‹åŠå¦ƒå…·é™³æƒ…ç†ï¼š	013	At that time, seeing that he was firm and did not reply a second or third time, the close friends knew that Prince MahÄsthÄmaprÄpta was determined. They went to the king and the queen to fully explain the situation:
['ZH_T23_1442_013:0695a11_5']	ã€ŒæŸç­‰æ…‡æ‡ƒèª˜å–»åŸ·å¿—ä¸ç§»ï¼Œè§€æ­¤å®¹è‰²å¿…ç„¡é€€è½‰ã€‚	ã€ŒæŸç­‰æ…‡æ‡ƒèª˜å–»åŸ·å¿—ä¸ç§»ï¼Œè§€æ­¤å®¹è‰²å¿…ç„¡é€€è½‰ã€‚	013	We have earnestly advised and exhorted him, but his determination does not waver. Judging from his appearance, he will certainly not turn back.
['ZH_T23_1442_013:0695a12_4']	ææå¤ªå­ï¼Œé¡˜å‚è½è¨±å‡ºå®¶é›¢ä¿—æ˜æ™ºå…±ç¨±ã€‚	ææå¤ªå­ï¼Œé¡˜å‚è½è¨±å‡ºå®¶é›¢ä¿—æ˜æ™ºå…±ç¨±ã€‚	013	We fear that it will harm the prince. We request that you allow him to leave the household life and go forth. The wise all praise this.
['ZH_T23_1442_013:0695a13_3']	è‹¥è¨±æ¨å®¶å…¨å…¶å£½å‘½ï¼Œå¾Œä¸æ¬£æ¨‚é‚„æ­¸æœ¬å®®ï¼›	è‹¥è¨±æ¨å®¶å…¨å…¶å£½å‘½ï¼Œå¾Œä¸æ¬£æ¨‚é‚„æ­¸æœ¬å®®ï¼›	013	If you allow him to abandon the household life, he will preserve his life. Later, if he is not happy, he can return to the palace;
['ZH_T23_1442_013:0695a13_12']	è‹¥é›¢ç”Ÿç·£æ›´ä½•æ‰€è¶£ï¼Ÿ	è‹¥é›¢ç”Ÿç·£æ›´ä½•æ‰€è¶£ï¼Ÿ	013	If you leave the conditions of birth, where else can you go?
['ZH_T23_1442_013:0695a13_18']	ã€çˆ¶æ¯å ±æ›°ï¼š	ã€çˆ¶æ¯å ±æ›°ï¼š	013	His parents replied:
['ZH_T23_1442_013:0695a14_13']	ã€Œå¿…å¦‚æ˜¯è€…ï¼Œå®œè½å‡ºå®¶ï¼Œæ»¿å…¶å¿—é¡˜ã€‚	ã€Œå¿…å¦‚æ˜¯è€…ï¼Œå®œè½å‡ºå®¶ï¼Œæ»¿å…¶å¿—é¡˜ã€‚	013	If it must be so, then we will allow you to go forth and fulfill your aspirations.
['ZH_T23_1442_013:0695a15_2']	ã€è¦ªå‹æ‰¿æ—¨å ±å¤ªå­æ›°ï¼š	ã€è¦ªå‹æ‰¿æ—¨å ±å¤ªå­æ›°ï¼š	013	The close friend, receiving the order, reported to the Crown Prince:
['ZH_T23_1442_013:0695a15_12']	ã€Œçˆ¶æ¯å‚æ…ˆè¨±ä»¤å…¥é“ã€‚	ã€Œçˆ¶æ¯å‚æ…ˆè¨±ä»¤å…¥é“ã€‚	013	Your parents have shown compassion and allowed you to enter the path.
['ZH_T23_1442_013:0695a17_13']	ã€å¯¦åŠ›èå·²æ…¶å–œå½Œå¢ï¼Œç¨åŠ é£²é£Ÿæ¼¸ç›Šåº·å¥ï¼Œè¾­é•çˆ¶æ¯è©£å½¼æ—ä¸­ï¼Œç¦®è¬é¦¬å‹è‹¾èŠ»åœ¨ä¸€é¢åï¼Œç™½è¨€ï¼š	ã€å¯¦åŠ›èå·²æ…¶å–œå½Œå¢ï¼Œç¨åŠ é£²é£Ÿæ¼¸ç›Šåº·å¥ï¼Œè¾­é•çˆ¶æ¯è©£å½¼æ—ä¸­ï¼Œç¦®è¬é¦¬å‹è‹¾èŠ»åœ¨ä¸€é¢åï¼Œç™½è¨€ï¼š	013	When SthiraÅ›raddhÄ heard this, his joy increased even more. He gradually regained his health and strength, took leave of his parents, and went to the forest. He bowed to the bhiká¹£u AÅ›vajit and sat to one side. He said:
['ZH_T23_1442_013:0695a17_17']	ã€Œå¤§å¾·ï¼	ã€Œå¤§å¾·ï¼	013	Venerable One!
['ZH_T23_1442_013:0695a19_13']	æˆ‘ä¹‹å°Šè¦ªå·²è¦‹è½è¨±ï¼Œå¹¸é¡˜æ…ˆæ‚²èˆ‡å‡ºå®¶æ³•ï¼Œé€²å—åœ“å…·æ•™ä»¥å¨å„€ï¼Œæ–¼å¤§å¾·æ‰€å–„ä¿®æ¢µè¡Œã€‚	æˆ‘ä¹‹å°Šè¦ªå·²è¦‹è½è¨±ï¼Œå¹¸é¡˜æ…ˆæ‚²èˆ‡å‡ºå®¶æ³•ï¼Œé€²å—åœ“å…·æ•™ä»¥å¨å„€ï¼Œæ–¼å¤§å¾·æ‰€å–„ä¿®æ¢µè¡Œã€‚	013	My honored parents have already given their permission. I hope you will kindly grant me the going forth, receive the full ordination, teach me the proper conduct, and I will cultivate the holy life well under the Venerable One.
['ZH_T23_1442_013:0695a20_2']	ã€æ™‚å…·å£½é¦¬å‹å ±è¨€ï¼š	ã€æ™‚å…·å£½é¦¬å‹å ±è¨€ï¼š	013	At that time, the Venerable AÅ›vajit said:
['ZH_T23_1442_013:0695a20_14']	ã€Œå¦‚æ˜¯å³èˆ‡å‡ºå®¶å¹¶å—åœ“å…·ã€‚	ã€Œå¦‚æ˜¯å³èˆ‡å‡ºå®¶å¹¶å—åœ“å…·ã€‚	013	In that case, I will immediately grant you the going forth and receive the full ordination.
['ZH_T23_1442_013:0695a20_20']	ã€å°‹å‘Šä¹‹æ›°ï¼š	ã€å°‹å‘Šä¹‹æ›°ï¼š	013	He then told him:
['ZH_T23_1442_013:0695a21_3']	ã€Œæ±ä»ŠçŸ¥ä¸ï¼Ÿ	ã€Œæ±ä»ŠçŸ¥ä¸ï¼Ÿ	013	Do you know this?
['ZH_T23_1442_013:0695a21_12']	è‹¾èŠ»ä½œæ¥­æœ‰å…¶äºŒç¨®ï¼š	è‹¾èŠ»ä½œæ¥­æœ‰å…¶äºŒç¨®ï¼š	013	The work of bhiká¹£us is of two kinds:
['ZH_T23_1442_013:0695a21_19']	è¬‚è®€èª¦ã€ä¿®å®šã€‚	è¬‚è®€èª¦ã€ä¿®å®šã€‚	013	Reciting and chanting, and cultivating samÄdhi.
['ZH_T23_1442_013:0695a22_3']	æ±ç‚ºè®€èª¦ï¼Ÿ	æ±ç‚ºè®€èª¦ï¼Ÿ	013	Are you reciting and chanting,
['ZH_T23_1442_013:0695a22_8']	ç‚ºä¿®å®šè€¶ï¼Ÿ	ç‚ºä¿®å®šè€¶ï¼Ÿ	013	or are you practicing meditation?
['ZH_T23_1442_013:0695a22_14', 'ZH_T23_1442_013:0695a22_20']	ã€ä¾¿å ±å¸«æ›°ï¼šğŸ”½ã€Œé„”æ³¢é¦±è€¶ï¼	ã€ä¾¿å ±å¸«æ›°ï¼š ã€Œé„”æ³¢é¦±è€¶ï¼	013	He then replied to his teacher,ğŸ”½Upadhyaya!
['ZH_T23_1442_013:0695a23_2']	äºŒç¨®ä¿±ä½œã€‚	äºŒç¨®ä¿±ä½œã€‚	013	I am doing both.
