segmentnr	original	analyzed	translated
['ZH_T35_1735_059:0948b25_0']	6å¤§æ–¹å»£ä½›è¯åš´ç¶“ç–å·ç¬¬äº”åä¹	6å¤§æ–¹å»£ä½›è¯åš´ç¶“ç–å·ç¬¬äº”åä¹	6Here is the corrected and aligned text:ğŸ”½Commentary on the Flower Ornament Sutra, Scroll 59
['ZH_T35_1735_059:0948b27_0']	å”æ¸…æ¶¼å±±å¤§è¯åš´å¯ºæ²™é–€æ¾„è§€æ’°	å”æ¸…æ¶¼å±±å¤§è¯åš´å¯ºæ²™é–€æ¾„è§€æ’°	Compiled by Åšramaá¹‡a Chengguan of the Great Huayan Monastery on Mount Qingliang in the Tang Dynasty
['ZH_T35_1735_059:0948b28_0']	ç¬¬ä¹åµæ¯˜å°¼æ—ç¥ï¼Œå¯„å–„æ…§åœ°ã€‚åˆäºŒå¯çŸ¥ã€‚ç¬¬ä¸‰	ç¬¬ä¹åµæ¯˜å°¼æ—ç¥ï¼Œå¯„å–„æ…§åœ°ã€‚åˆäºŒå¯çŸ¥ã€‚ç¬¬ä¸‰	The ninth, the deity of the Lumbini Grove, corresponds to the ground of skillful wisdom. The first two are understandable. The third
['ZH_T35_1735_059:0948b29_10']	ã€Œå½¼ç¥ç­”ã€ä¸‹æˆå·²æ³•ç•Œã€‚	ã€Œå½¼ç¥ç­”ã€ä¸‹æˆå·²æ³•ç•Œã€‚	The deity replied is the bestowal of her own Dharma realm.
['ZH_T35_1735_059:0948b29_14']	æ–¼ä¸­å››ï¼š	æ–¼ä¸­å››ï¼š	There are four parts to this:
['ZH_T35_1735_059:0948c01_13']	ä¸€é¡¯æ³•ç¾©ã€äºŒç«‹æ³•åã€ä¸‰æ˜æ¥­ç”¨ã€å››è¾¨æ ¹æœ¬ã€‚	ä¸€é¡¯æ³•ç¾©ã€äºŒç«‹æ³•åã€ä¸‰æ˜æ¥­ç”¨ã€å››è¾¨æ ¹æœ¬ã€‚	1. Revealing the meaning of the Dharma, 2. Establishing the name of the Dharma, 3. Clarifying its functions, 4. Revealing its fundamental basis.
['ZH_T35_1735_059:0948c01_17']	åˆä¸­äºŒï¼š	åˆä¸­äºŒï¼š	The first part has two sections:
['ZH_T35_1735_059:0948c02_5']	å…ˆé•·è¡Œã€å¾Œåˆé Œã€‚	å…ˆé•·è¡Œã€å¾Œåˆé Œã€‚	First, prose, then verses.
['ZH_T35_1735_059:0948c02_9']	å‰ä¸­å››ï¼š	å‰ä¸­å››ï¼š	The first part has four sections:
['ZH_T35_1735_059:0948c03_13']	ä¸€æ¨™æ•¸æ­å‹ã€äºŒå¾µæ•¸åˆ—åã€ä¸‰ä¾åé‡‹ç¾©ã€å››çµæ­å‹ç›Šã€‚	ä¸€æ¨™æ•¸æ­å‹ã€äºŒå¾µæ•¸åˆ—åã€ä¸‰ä¾åé‡‹ç¾©ã€å››çµæ­å‹ç›Šã€‚	1. Stating the number and praising its excellence, 2. Listing the names, 3. Explaining the meaning based on the names, 4. Concluding with praise and benefits.
['ZH_T35_1735_059:0948c04_7']	åˆä¸­ï¼Œç”Ÿå¦‚ä¾†å®¶ï¼Œå³æ­£é…¬å…¶å•ã€‚	åˆä¸­ï¼Œç”Ÿå¦‚ä¾†å®¶ï¼Œå³æ­£é…¬å…¶å•ã€‚	In the first part, being born in the family of the TathÄgatas directly answers her question.
['ZH_T35_1735_059:0948c05_1']	ç¬¬äºŒã€Œä½•ç­‰ç‚ºåã€ä¸‹å¾µæ•¸åˆ—åã€‚	ç¬¬äºŒã€Œä½•ç­‰ç‚ºåã€ä¸‹å¾µæ•¸åˆ—åã€‚	The second part, What are the ten? lists the names.
['ZH_T35_1735_059:0948c05_8']	æ­¤åé€šæ–¼å…­ä½ï¼š	æ­¤åé€šæ–¼å…­ä½ï¼š	These ten are common to the six stages:
['ZH_T35_1735_059:0948c05_13']	ä¸€ç•¶åä¿¡ï¼›	ä¸€ç•¶åä¿¡ï¼›	The first is the ten faiths;
['ZH_T35_1735_059:0948c05_18']	äºŒå³åä½ï¼›	äºŒå³åä½ï¼›	The second is the ten abodes;
['ZH_T35_1735_059:0948c06_4']	ä¸‰é€šè¡Œå‘ï¼›	ä¸‰é€šè¡Œå‘ï¼›	The third is the path of insight;
['ZH_T35_1735_059:0948c06_9']	å››æ˜¯åˆåœ°ï¼›	å››æ˜¯åˆåœ°ï¼›	The fourth is the first ground;
['ZH_T35_1735_059:0948c07_3']	äº”å¾äºŒè‡³ä¸ƒï¼Œä»¥æ˜¯åŠŸç”¨é‚Šæ•…ï¼›	äº”å¾äºŒè‡³ä¸ƒï¼Œä»¥æ˜¯åŠŸç”¨é‚Šæ•…ï¼›	The fifth is from the second to the seventh, because these are the stages of effort;
['ZH_T35_1735_059:0948c07_15']	å…­ä¸ƒçš†å…«åœ°ï¼Œç„¶å…­å³è‡ªåˆ†ï¼›	å…­ä¸ƒçš†å…«åœ°ï¼Œç„¶å…­å³è‡ªåˆ†ï¼›	The sixth and seventh are both the eighth ground, but the sixth is one's own ground;
['ZH_T35_1735_059:0948c08_4']	ä¸ƒå³å‹é€²å¾—å‹¸ä¹‹å¾Œï¼›	ä¸ƒå³å‹é€²å¾—å‹¸ä¹‹å¾Œï¼›	The seventh is the stage of progress after receiving encouragement;
['ZH_T35_1735_059:0948c08_9']	å…«å³ä¹åœ°ï¼›	å…«å³ä¹åœ°ï¼›	The eighth is the ninth ground;
['ZH_T35_1735_059:0948c08_14']	ä¹ç•¶ååœ°ï¼›	ä¹ç•¶ååœ°ï¼›	The ninth is the tenth ground;
['ZH_T35_1735_059:0948c09_4']	åå³ç­‰è¦ºå…¥å¦‚ä¾†åœ°ã€‚	åå³ç­‰è¦ºå…¥å¦‚ä¾†åœ°ã€‚	The tenth is equal enlightenment entering the ground of the TathÄgata.
['ZH_T35_1735_059:0948c09_14']	ç„¶ä¾è¡Œå¸ƒï¼Œè±é…å®šç„¶ã€‚	ç„¶ä¾è¡Œå¸ƒï¼Œè±é…å®šç„¶ã€‚	However, based on the gradual unfolding, the horizontal and vertical correspondences are definite.
['ZH_T35_1735_059:0948c10_16']	è‹¥ç´„åœ“èï¼Œåˆå¾Œé€šç”¨ï¼Œæ•…äº‘æˆå°±æ­¤æ³•å‰‡ç”Ÿå¦‚ä¾†å®¶ã€‚	è‹¥ç´„åœ“èï¼Œåˆå¾Œé€šç”¨ï¼Œæ•…äº‘æˆå°±æ­¤æ³•å‰‡ç”Ÿå¦‚ä¾†å®¶ã€‚	If based on the perfect fusion, the initial and final practices are used together, thus it is said that accomplishing this method one is born in the TathÄgata's family.
['ZH_T35_1735_059:0948c13_1']	è‹¥å®šé ˆå…·åæ–¹å¾—ç”Ÿå®¶ï¼Œä½•ä»¥æ–‡ä¸­ç¬¬äºŒç¬¬å…­çš†æœ‰ç”Ÿå®¶ï¼Œç¬¬åå¾©è¨€æ–¼ä¸‰ä¸–ä½›æ‰€å·²å—çŒé ‚ï¼Ÿ	è‹¥å®šé ˆå…·åæ–¹å¾—ç”Ÿå®¶ï¼Œä½•ä»¥æ–‡ä¸­ç¬¬äºŒç¬¬å…­çš†æœ‰ç”Ÿå®¶ï¼Œç¬¬åå¾©è¨€æ–¼ä¸‰ä¸–ä½›æ‰€å·²å—çŒé ‚ï¼Ÿ	If it is definitely necessary to possess the ten in order to be born in the family, why is it that in the text the second and sixth both speak of being born in the family, and the tenth again says that one has already received the consecration in the presence of the buddhas of the three times?
['ZH_T35_1735_059:0948c13_11']	æ•…çŸ¥é ˆè±ï¼Œç´„è­‰åˆ†ç•°ã€‚	æ•…çŸ¥é ˆè±ï¼Œç´„è­‰åˆ†ç•°ã€‚	Therefore, one should know that it is necessary to vertically distinguish based on realization.
['ZH_T35_1735_059:0948c14_15']	è‹¥å®šè±è€…ï¼Œå‰‡é•å…·åå‰‡ç”Ÿä¹‹è¨€ï¼Œæ˜¯çŸ¥é ˆæ©«ç´„åœ“èä¿®è§€ã€‚	è‹¥å®šè±è€…ï¼Œå‰‡é•å…·åå‰‡ç”Ÿä¹‹è¨€ï¼Œæ˜¯çŸ¥é ˆæ©«ç´„åœ“èä¿®è§€ã€‚	If it is definitely vertical, then it contradicts the statement that possessing the ten leads to being born in the family. Therefore, one should know that it is necessary to horizontally distinguish based on the perfect fusion of cultivation.
['ZH_T35_1735_059:0948c15_11']	ç¬¬ä¸‰ã€Œå–„ç”·å­äº‘ä½•åã€ä¸‹ä¾åé‡‹ç¾©ã€‚	ç¬¬ä¸‰ã€Œå–„ç”·å­äº‘ä½•åã€ä¸‹ä¾åé‡‹ç¾©ã€‚	The third, Good sons, what is called... and below, is the explanation of the meaning based on the names.
['ZH_T35_1735_059:0948c17_12']	ä¸€ä¸­å³ä¿¡ç™¼å¿ƒæ•…ï¼Œã€ˆè³¢é¦–å“ã€‰äº‘ã€Œå¸¸æ¬²åˆ©æ¨‚è«¸ç¾¤ç”Ÿï¼ŒèŠåš´åœ‹åœŸä¾›é¤Šä½›ã€æ•…ï¼Œæ•…æ–‡äº‘å§‹é›†å–„æ ¹ã€‚	ä¸€ä¸­å³ä¿¡ç™¼å¿ƒæ•…ï¼Œã€ˆè³¢é¦–å“ã€‰äº‘ã€Œå¸¸æ¬²åˆ©æ¨‚è«¸ç¾¤ç”Ÿï¼ŒèŠåš´åœ‹åœŸä¾›é¤Šä½›ã€æ•…ï¼Œæ•…æ–‡äº‘å§‹é›†å–„æ ¹ã€‚	The first is the initial arousal of the mind of faith, as the Virtuous Leader Chapter says: Always wishing to benefit and bring joy to all beings, adorning the lands and making offerings to the Buddhas. Therefore, the text says initially gathering wholesome roots.
['ZH_T35_1735_059:0948c18_14']	äºŒä¸­åˆä½ç™¼å¿ƒï¼Œæ–‡å…·ä¸‰å¿ƒç”Ÿå¦‚ä¾†å®¶ï¼Œäº¦åˆä½ç”Ÿå®¶ã€‚	äºŒä¸­åˆä½ç™¼å¿ƒï¼Œæ–‡å…·ä¸‰å¿ƒç”Ÿå¦‚ä¾†å®¶ï¼Œäº¦åˆä½ç”Ÿå®¶ã€‚	In the second, the initial arousal of the mind of abiding, the text is replete with the three minds, being born in the TathÄgata's family, also being born in the family of the initial abode.
['ZH_T35_1735_059:0948c19_8']	ä¸‰ä¸­åå¥ï¼Œä¸€è§€æ³•é–€æµ·æ¨™åè¡Œï¼›	ä¸‰ä¸­åå¥ï¼Œä¸€è§€æ³•é–€æµ·æ¨™åè¡Œï¼›	In the third, there are ten phrases. The first observes the ocean of Dharma gates, marking the ten practices;
['ZH_T35_1735_059:0948c20_9']	äºŒå‘ä¸€åˆ‡æ™ºæ¨™è¿´å‘ï¼Œä»¥è¡Œé¡˜ç›¸è³‡æ•…åˆç‚ºä¸€ï¼›	äºŒå‘ä¸€åˆ‡æ™ºæ¨™è¿´å‘ï¼Œä»¥è¡Œé¡˜ç›¸è³‡æ•…åˆç‚ºä¸€ï¼›	The second faces omniscience, marking the grounds ofè¿´å‘, because practice and vows mutually assist, they are combined into one;
['ZH_T35_1735_059:0948c20_15']	é¤˜å…«é€šè¡Œå‘ã€‚	é¤˜å…«é€šè¡Œå‘ã€‚	The remaining eight are common to both practice andè¿´å‘.
['ZH_T35_1735_059:0948c21_14']	å››ä¸­å¥‘ç†æ–·éšœï¼Œåæ·±æ·¨å¿ƒï¼Œå³æ·¨å¿ƒåœ°ã€‚	å››ä¸­å¥‘ç†æ–·éšœï¼Œåæ·±æ·¨å¿ƒï¼Œå³æ·¨å¿ƒåœ°ã€‚	In the fourth, the mind of profound purity, which is named so because it accords with principle and severs hindrances, is the ground of æ·¨å¿ƒåœ°.
['ZH_T35_1735_059:0948c22_4']	å·²è­‰ç†æ•…ï¼Œå …å¦‚é‡‘å‰›ï¼›	å·²è­‰ç†æ•…ï¼Œå …å¦‚é‡‘å‰›ï¼›	Because one has already realized principle, it is firm like a vajra;
['ZH_T35_1735_059:0948c22_16']	å·²å¾—é›¢ç”Ÿé“æ•…ï¼Œæ¨è«¸æœ‰è¶£ï¼›	å·²å¾—é›¢ç”Ÿé“æ•…ï¼Œæ¨è«¸æœ‰è¶£ï¼›	Because one has already attained the path of detachment from birth, one abandons all realms of existence;
['ZH_T35_1735_059:0948c23_10']	å·²ç ´äºŒéšœç¤™å±±æ•…ï¼Œç‚ºç‰©ä¾è™•ã€‚	å·²ç ´äºŒéšœç¤™å±±æ•…ï¼Œç‚ºç‰©ä¾è™•ã€‚	Because one has already shattered the mountain-like hindrances of the two obstacles, one becomes a place of reliance for beings.
['ZH_T35_1735_059:0948c24_13']	äº”ä¸­è­‰å¦‚èµ·è¡Œç‚ºå¹³ç­‰å…‰æ˜ï¼Œæˆ’å¿é€²ç­‰ç‚ºæ¬¡äº”åœ°ã€‚	äº”ä¸­è­‰å¦‚èµ·è¡Œç‚ºå¹³ç­‰å…‰æ˜ï¼Œæˆ’å¿é€²ç­‰ç‚ºæ¬¡äº”åœ°ã€‚	In the fifth, the realization of suchness and the arousal of practice as the light of equality, with precepts, patience, diligence, etc. being the next five grounds.
['ZH_T35_1735_059:0948c26_2']	ã€Œå¾—ç„¡ç¤™ã€ä¸‹å³æ˜¯ä¸ƒåœ°ï¼Œä¸ƒåœ°å¾—ç„¡ç”Ÿå¿å…‰æ˜æ•…ï¼Œå…¥ä¸€åˆ‡çœŸå¯¦æ³•ã€‚	ã€Œå¾—ç„¡ç¤™ã€ä¸‹å³æ˜¯ä¸ƒåœ°ï¼Œä¸ƒåœ°å¾—ç„¡ç”Ÿå¿å…‰æ˜æ•…ï¼Œå…¥ä¸€åˆ‡çœŸå¯¦æ³•ã€‚	Attaining unobstructedness refers to the seventh ground, because the seventh ground attains the light of acceptance of the non-arising of dharmas and enters all true dharmas.
['ZH_T35_1735_059:0948c27_1']	å…­ä¸­ä»¥å¾—ç„¡ç”Ÿå¿ã€å¥‘åŒæ³•æ€§ï¼Œç‚ºç”Ÿä½›å®¶ã€‚	å…­ä¸­ä»¥å¾—ç„¡ç”Ÿå¿ã€å¥‘åŒæ³•æ€§ï¼Œç‚ºç”Ÿä½›å®¶ã€‚	Among the six, attaining acceptance of the non-arising of dharmas and conforming with the nature of dharmas is called being born into the Buddha's family.
['ZH_T35_1735_059:0948c28_1']	é¡˜åº¦å¢ä¸Šå–„æ ¹ä¸€é«”ï¼Œæƒ‘ç­‰ä¸å‹•ï¼Œç‚ºç™½æ·¨æ³•ã€‚	é¡˜åº¦å¢ä¸Šå–„æ ¹ä¸€é«”ï¼Œæƒ‘ç­‰ä¸å‹•ï¼Œç‚ºç™½æ·¨æ³•ã€‚	The perfection of vows, the supremacy of wholesome roots, and the single essence of afflictions and so forth are unmoving, which is called the pure dharmas.
['ZH_T35_1735_059:0948c28_18']	ä¸ƒä¸­å› ä½›å‹¸èµ·èƒ½é “ä¿®è¡Œï¼Œåä½›åŠ›å…‰æ˜ã€‚	ä¸ƒä¸­å› ä½›å‹¸èµ·èƒ½é “ä¿®è¡Œï¼Œåä½›åŠ›å…‰æ˜ã€‚	Among the seven, because one is able to practice suddenly upon the Buddha's encouragement, it is called the light of the Buddha's power.
['ZH_T35_1735_059:0948c29_10']	ç„¡åŠŸç”¨ä¿®ï¼Œæ•…ç„¡ç–²å­ç­‰ã€‚	ç„¡åŠŸç”¨ä¿®ï¼Œæ•…ç„¡ç–²å­ç­‰ã€‚	Because one cultivates without effort, one is without fatigue and so forth.
['ZH_T35_1735_059:0949a01_10']	å…«ä¸­å¾ç¬¬å…«åœ°å…¥ç¬¬ä¹åœ°ï¼Œæ•…äº‘ä½ç«¥çœŸä½ã€‚	å…«ä¸­å¾ç¬¬å…«åœ°å…¥ç¬¬ä¹åœ°ï¼Œæ•…äº‘ä½ç«¥çœŸä½ã€‚	Among the eight, because one enters the ninth ground from the eighth ground, it is said to abide in the state of youth.
['ZH_T35_1735_059:0949a02_13']	è§€ä¸€åˆ‡æ™ºæ™ºé–€ï¼Œå³æ³•å¸«ä¹‹å¾·æ•…ï¼Œæ–¼ä¸‰æ€§ç­‰çš†å¦‚å¯¦çŸ¥ï¼›	è§€ä¸€åˆ‡æ™ºæ™ºé–€ï¼Œå³æ³•å¸«ä¹‹å¾·æ•…ï¼Œæ–¼ä¸‰æ€§ç­‰çš†å¦‚å¯¦çŸ¥ï¼›	Contemplating the gateway of omniscience is the virtue of a Dharma master, therefore one truly knows the three natures and so forth;
['ZH_T35_1735_059:0949a03_15']	å³äº‹çŸ¥ç†ä¹‹å¦‚å¯¦æ•…ï¼Œæ–¼æœ‰å·®åˆ¥å¢ƒå…¥ç„¡å·®åˆ¥å®šï¼›	å³äº‹çŸ¥ç†ä¹‹å¦‚å¯¦æ•…ï¼Œæ–¼æœ‰å·®åˆ¥å¢ƒå…¥ç„¡å·®åˆ¥å®šï¼›	Because one truly knows the principle in phenomena, one enters the samÄdhi of non-differentiation in differentiated objects;
['ZH_T35_1735_059:0949a04_17']	å³ç†çª®äº‹ä¹‹å¦‚å¯¦æ•…ï¼Œæ–¼ç„¡å·®åˆ¥æ³•ç¾æœ‰å·®åˆ¥æ™ºã€‚	å³ç†çª®äº‹ä¹‹å¦‚å¯¦æ•…ï¼Œæ–¼ç„¡å·®åˆ¥æ³•ç¾æœ‰å·®åˆ¥æ™ºã€‚	Because one exhausts the principle in phenomena, one manifests the wisdom of differentiation in undifferentiated dharmas.
['ZH_T35_1735_059:0949a05_4']	é¤˜å¯æº–æ€ã€‚	é¤˜å¯æº–æ€ã€‚	The rest can be understood by analogy.
['ZH_T35_1735_059:0949a07_4']	ä¹ä¸­ä»¥ä½›èŠåš´è€ŒèŠåš´ï¼Œæ•…åæ™®èŠåš´ï¼Œå·²å¾—é›¢å¢ç­‰è«¸ä¸‰æ˜§æ•…ï¼Œé›–å¾©å¸¸ç”¨è€Œå¸¸åœ¨ä¸‰æ˜§ã€‚	ä¹ä¸­ä»¥ä½›èŠåš´è€ŒèŠåš´ï¼Œæ•…åæ™®èŠåš´ï¼Œå·²å¾—é›¢å¢ç­‰è«¸ä¸‰æ˜§æ•…ï¼Œé›–å¾©å¸¸ç”¨è€Œå¸¸åœ¨ä¸‰æ˜§ã€‚	Among the nine, it is called universal adornment because it adorns with the adornments of the Buddha. Because it has already attained the samÄdhis such as freedom from defilement, although it always uses them, it is always in samÄdhi.
['ZH_T35_1735_059:0949a09_14']	åä¸­ç´„å…¶è‡ªåˆ†ç‚ºæ­¤è©è–©ï¼Œç´„å…¶å‹é€²åå…¥ä½›åœ°ï¼Œå·²å—è·ä½äº‘å—çŒé ‚ï¼Œæ™ºé½Šä½›å¢ƒäº‘çŸ¥ä¸€åˆ‡ï¼Œå¦‚ã€ˆåå®šå“ã€‰è¾¨ã€‚	åä¸­ç´„å…¶è‡ªåˆ†ç‚ºæ­¤è©è–©ï¼Œç´„å…¶å‹é€²åå…¥ä½›åœ°ï¼Œå·²å—è·ä½äº‘å—çŒé ‚ï¼Œæ™ºé½Šä½›å¢ƒäº‘çŸ¥ä¸€åˆ‡ï¼Œå¦‚ã€ˆåå®šå“ã€‰è¾¨ã€‚	Among the ten, in terms of its own stage it is called this bodhisattva, and in terms of its superior progress it is called entering the stage of the Buddha. Having already received the position, it is called receiving the consecration. The wisdom equal to the realm of the Buddha is called knowing all, as explained in the chapter on the ten samÄdhis.
['ZH_T35_1735_059:0949a10_11']	ç¬¬å››ã€Œä½›å­è‹¥è©è–©ã€ä¸‹çµæ­å‹ç›Šï¼Œå¯çŸ¥ã€‚	ç¬¬å››ã€Œä½›å­è‹¥è©è–©ã€ä¸‹çµæ­å‹ç›Šï¼Œå¯çŸ¥ã€‚	The fourth, Buddha's disciple, if a bodhisattva... and below concludes by praising the superior benefits, which can be understood.
['ZH_T35_1735_059:0949a11_5']	äºŒé‡é Œä¸­ååˆï¼Œå¦‚æ¬¡é Œå‰åæ³•ã€‚	äºŒé‡é Œä¸­ååˆï¼Œå¦‚æ¬¡é Œå‰åæ³•ã€‚	In the second, the ten verses in the double verse, they follow the ten dharmas above in order.
['ZH_T35_1735_059:0949a13_1']	ç¬¬äºŒã€Œå–„ç”·å­è©è–©å…·æ­¤ã€ä¸‹ç«‹æ³•åä¸­ï¼Œå…ˆç‰’å‰æ‰€æ˜ã€å¾Œã€Œæˆ‘å¾ç„¡é‡ã€ä¸‹æŒ‡å‰ç«‹ç›®ã€‚	ç¬¬äºŒã€Œå–„ç”·å­è©è–©å…·æ­¤ã€ä¸‹ç«‹æ³•åä¸­ï¼Œå…ˆç‰’å‰æ‰€æ˜ã€å¾Œã€Œæˆ‘å¾ç„¡é‡ã€ä¸‹æŒ‡å‰ç«‹ç›®ã€‚	The second, Good sons, the bodhisattva is endowed with this... and below establishes the name of the Dharma. First, it cites what was explained before. Later, I from immeasurable... and below points to the previous and establishes the name.
['ZH_T35_1735_059:0949a14_2']	æ©Ÿæ„Ÿä¾¿ç¾ï¼Œç„¡æ‰€æ“ç¤™ï¼Œåè‡ªåœ¨å—ç”Ÿï¼Œé€šèƒ½æ‰€ç¾ã€‚	æ©Ÿæ„Ÿä¾¿ç¾ï¼Œç„¡æ‰€æ“ç¤™ï¼Œåè‡ªåœ¨å—ç”Ÿï¼Œé€šèƒ½æ‰€ç¾ã€‚	Responding to the capacities, it manifests without obstruction, called freely receiving birth, which includes both the ability and what is manifested.
['ZH_T35_1735_059:0949a15_5']	ç¬¬ä¸‰ã€Œå–„è²¡ç™½è¨€ã€ä¸‹æ˜æ³•é–€æ¥­ç”¨ï¼Œæ–¼ä¸­å…ˆå•ã€å¾Œç­”ã€‚	ç¬¬ä¸‰ã€Œå–„è²¡ç™½è¨€ã€ä¸‹æ˜æ³•é–€æ¥­ç”¨ï¼Œæ–¼ä¸­å…ˆå•ã€å¾Œç­”ã€‚	The third, from Sudhana said below, clarifies the function of the Dharma gate. Within it, first asking, then answering.
['ZH_T35_1735_059:0949a15_17']	ç­”ä¸­ï¼ŒçŸ¥è¦‹æ­¤å¢ƒå³æ˜¯æ¥­ç”¨ã€‚	ç­”ä¸­ï¼ŒçŸ¥è¦‹æ­¤å¢ƒå³æ˜¯æ¥­ç”¨ã€‚	The answer, knowing and seeing this realm is precisely the function.
['ZH_T35_1735_059:0949a16_1']	æ–¼ä¸­äºŒï¼š	æ–¼ä¸­äºŒï¼š	Within it, there are two:
['ZH_T35_1735_059:0949a17_1']	å…ˆæ˜ä¾é¡˜å—ç”Ÿã€å¾Œã€Œç¶“æ–¼ç™¾å¹´ã€ä¸‹å¦‚æ˜”é¡˜è¦©ã€‚	å…ˆæ˜ä¾é¡˜å—ç”Ÿã€å¾Œã€Œç¶“æ–¼ç™¾å¹´ã€ä¸‹å¦‚æ˜”é¡˜è¦©ã€‚	First, clarifying relying on the vow to receive birth, later after a hundred years below, as the vow of old to see.
['ZH_T35_1735_059:0949a17_5']	æ–¼ä¸­å››ï¼š	æ–¼ä¸­å››ï¼š	Within it, there are four:
['ZH_T35_1735_059:0949a18_19']	åˆè¦©é™ç¥ç‘ç›¸ã€äºŒã€Œå–„ç”·å­æ‘©è€¶ã€ä¸‹è¦‹å‡ºåŸç¾å…‰ã€ä¸‰ã€Œæ‘©è€¶å¤«äººæ–¼ç•¢æ´›å‰ã€ä¸‹ã€‚	åˆè¦©é™ç¥ç‘ç›¸ã€äºŒã€Œå–„ç”·å­æ‘©è€¶ã€ä¸‹è¦‹å‡ºåŸç¾å…‰ã€ä¸‰ã€Œæ‘©è€¶å¤«äººæ–¼ç•¢æ´›å‰ã€ä¸‹ã€‚	First, seeing the auspicious signs of the descent of the spirit, second, from Good man, Maya below, seeing the light manifested by leaving the city, third, The Lady Maya, in the Pilaká¹£a below.
['ZH_T35_1735_059:0949a19_4']	è¦©å°‡ç”Ÿç¥è®Šã€‚	è¦©å°‡ç”Ÿç¥è®Šã€‚	Seeing the spiritual transformations of the impending birth.
['ZH_T35_1735_059:0949a19_8']	æ–¼ä¸­äºŒï¼š	æ–¼ä¸­äºŒï¼š	Within it, there are two:
['ZH_T35_1735_059:0949a19_12']	å…ˆæ¨™å¾µã€‚	å…ˆæ¨™å¾µã€‚	First, stating and enumerating.
['ZH_T35_1735_059:0949a20_2']	ç•¢æ´›å‰è€…ï¼Œæ­¤äº‘é«˜é¡¯ã€‚	ç•¢æ´›å‰è€…ï¼Œæ­¤äº‘é«˜é¡¯ã€‚	Pilaká¹£a means lofty and prominent.
['ZH_T35_1735_059:0949a20_8']	å¾Œåˆ¥é¡¯åè®Šï¼š	å¾Œåˆ¥é¡¯åè®Šï¼š	Later, separately manifesting ten transformations:
['ZH_T35_1735_059:0949a24_5']	ä¸€é›†çœ¾æ¯è‹¦ã€äºŒå·èˆ’ç„¡ç¤™ã€ä¸‰æ¯›ç¾ä½›å› ã€å››ç¾ä½›æœ¬äº‹ã€äº”ç¾è¡Œæ‰€ä¾èº«ã€å…­éç¾æ¨è¡Œã€ä¸ƒç¾å¤ä½›å—ç”Ÿåœ’æ—ã€å…«ç¾ä»Šä½›æ‰€è™•å®®æ®¿ã€ä¹å‡ºè©è–©åŒé¡ã€ååœ°ç¾è“®è¯å°‡æ‰¿è‡³è–ã€‚	ä¸€é›†çœ¾æ¯è‹¦ã€äºŒå·èˆ’ç„¡ç¤™ã€ä¸‰æ¯›ç¾ä½›å› ã€å››ç¾ä½›æœ¬äº‹ã€äº”ç¾è¡Œæ‰€ä¾èº«ã€å…­éç¾æ¨è¡Œã€ä¸ƒç¾å¤ä½›å—ç”Ÿåœ’æ—ã€å…«ç¾ä»Šä½›æ‰€è™•å®®æ®¿ã€ä¹å‡ºè©è–©åŒé¡ã€ååœ°ç¾è“®è¯å°‡æ‰¿è‡³è–ã€‚	First, gathering the assembly and ending suffering, second, rolling and unfolding without obstruction, third, manifesting the causes of the buddhas in the hairs, fourth, manifesting the past events of the buddhas, fifth, manifesting the body that is the basis of practice, sixth, universally manifesting the practice of giving up, seventh, manifesting the garden and forest where ancient buddhas took birth, eighth, manifesting the palace where the present buddhas reside, ninth, manifesting the bodhisattvas of the same kind, and tenth, the earth manifesting lotuses to receive the supreme sage.
['ZH_T35_1735_059:0949a25_1']	å››ã€Œå–„ç”·å­åµæ¯˜å°¼ã€ä¸‹æ­£è¦©èª•ç”Ÿã€‚	å››ã€Œå–„ç”·å­åµæ¯˜å°¼ã€ä¸‹æ­£è¦©èª•ç”Ÿã€‚	Fourth, Good sons, in the Lumbini Grove, he correctly beheld the birth.
['ZH_T35_1735_059:0949a25_5']	æ–¼ä¸­ä¸‰ï¼š	æ–¼ä¸­ä¸‰ï¼š	In this, there are three parts:
['ZH_T35_1735_059:0949a26_1']	åˆè¦©å¤–ç›¸ï¼Œæœ‰å››ç¨®ç›¸ï¼Œé‡‹é€šäº‹ç†ã€‚	åˆè¦©å¤–ç›¸ï¼Œæœ‰å››ç¨®ç›¸ï¼Œé‡‹é€šäº‹ç†ã€‚	First, beholding the external characteristics, there are four kinds of characteristics, explained in terms of both phenomena and principle.
['ZH_T35_1735_059:0949a27_12']	ç´„äº‹ï¼Œè¬‚ä¸€è¿´è€€æŒºç‰¹æ•…ã€äºŒé«˜é¡¯é‚•å®¹æ•…ã€ä¸‰å¨å…‰èµ«å¥•æ•…ã€å››åˆ†æ˜å¯è¦©æ•…ã€‚	ç´„äº‹ï¼Œè¬‚ä¸€è¿´è€€æŒºç‰¹æ•…ã€äºŒé«˜é¡¯é‚•å®¹æ•…ã€ä¸‰å¨å…‰èµ«å¥•æ•…ã€å››åˆ†æ˜å¯è¦©æ•…ã€‚	In terms of phenomena, it means first, the light is unique and outstanding, second, the appearance is lofty and dignified, third, the majestic light is brilliant, and fourth, it is clearly visible.
['ZH_T35_1735_059:0949b01_8']	ç´„ç†ï¼Œå‰‡ä¸€ä¾æ€§ç©ºç„¡ä½ç¾æ•…ã€äºŒä¾æ¶…æ§ƒå±±ç„¡å¿ƒå‡ºæ•…ã€ä¸‰å¤§æ…ˆé›²ä¸­ç¾ç„¡ä½ä¹‹åŒ–èº«æ•…ã€å››ç‚ºç ´çœ¾ç”Ÿç”Ÿæ­»ç„¡æ˜ä¹‹å¤§é—‡æ•…ã€‚	ç´„ç†ï¼Œå‰‡ä¸€ä¾æ€§ç©ºç„¡ä½ç¾æ•…ã€äºŒä¾æ¶…æ§ƒå±±ç„¡å¿ƒå‡ºæ•…ã€ä¸‰å¤§æ…ˆé›²ä¸­ç¾ç„¡ä½ä¹‹åŒ–èº«æ•…ã€å››ç‚ºç ´çœ¾ç”Ÿç”Ÿæ­»ç„¡æ˜ä¹‹å¤§é—‡æ•…ã€‚	In terms of principle, it means first, relying on the emptiness of nature to manifest without abiding, second, relying on the mountain of nirvana to appear without intention, third, manifesting the body of transformation that abides nowhere in the great cloud of great compassion, and fourth, in order to break through the great darkness of birth and death and ignorance of sentient beings.
['ZH_T35_1735_059:0949b02_1']	äºŒã€Œè©è–©çˆ¾æ™‚ã€ä¸‹äº†å…¶å…§å¾·ã€‚	äºŒã€Œè©è–©çˆ¾æ™‚ã€ä¸‹äº†å…¶å…§å¾·ã€‚	Second, from At that time, the Bodhisattva... it explains his inner virtues.
