segmentnr	original	analyzed	translated
['ZH_T29_1562_009:0378c15_8']	è‹¥ç„¡æ¼æ…§å·²é›¢ç…©æƒ±ï¼Œæ–¼è«¸ç„¡æ¼ç¾æ³•æ¨‚ä½æœ‰å¢ä¸ŠåŠ›ï¼Œç«‹ç¬¬ä¸‰æ ¹ã€‚	è‹¥ç„¡æ¼æ…§å·²é›¢ç…©æƒ±ï¼Œæ–¼è«¸ç„¡æ¼ç¾æ³•æ¨‚ä½æœ‰å¢ä¸ŠåŠ›ï¼Œç«‹ç¬¬ä¸‰æ ¹ã€‚	If pure understanding is already free from the passions, the power of dominance is established in the enjoyment of the present life of all pure dharmas, and therefore the third faculty is established.
['ZH_T29_1562_009:0378c16_7']	æ…§ç‚ºä¸Šé¦–ï¼Œå…·ä¸‰ç¾è§€ï¼Œæ•…ä¸”èªªæ…§ï¼Œé¤˜å…«åŠ©æˆã€‚	æ…§ç‚ºä¸Šé¦–ï¼Œå…·ä¸‰ç¾è§€ï¼Œæ•…ä¸”èªªæ…§ï¼Œé¤˜å…«åŠ©æˆã€‚	Understanding is the leader, and the three kinds of realization are complete, and therefore understanding is mentioned first, and the other eight are established as assisting it.
['ZH_T29_1562_009:0378c18_8']	ç†å¯¦æ‰€ç«‹æ ¹äº¦é€šå…·äºŒè€…ï¼Œè±ˆä¸æ­¤ä¸­å¿æ–¼è«¦ç†å·²å¾—ç¾è§€ï¼Œä¸ƒæ™ºæ–¼ä¸­é‡ç¾è§€æ•…ï¼Œéåˆæ ¹æ”ï¼›	ç†å¯¦æ‰€ç«‹æ ¹äº¦é€šå…·äºŒè€…ï¼Œè±ˆä¸æ­¤ä¸­å¿æ–¼è«¦ç†å·²å¾—ç¾è§€ï¼Œä¸ƒæ™ºæ–¼ä¸­é‡ç¾è§€æ•…ï¼Œéåˆæ ¹æ”ï¼›	If it is really the case that the faculties are established on the basis of both, why is it not the case that the faculty of acquiescence in the truths is the first of the faculties, since one has already realized the truths? The seven knowledges are the repeated realization of the truths, and therefore are not included in the first faculty.
['ZH_T29_1562_009:0378c19_7']	åˆéš”å¿æ•…ï¼Œéç¬¬äºŒæ”ï¼Œæ­¤è§£è„«é“æ‡‰ä¸åæ ¹ã€‚	åˆéš”å¿æ•…ï¼Œéç¬¬äºŒæ”ï¼Œæ­¤è§£è„«é“æ‡‰ä¸åæ ¹ã€‚	Also, because they are separated from acquiescence, they are not included in the second faculty. In that case, the path of liberation should not be called a faculty.
['ZH_T29_1562_009:0378c20_16']	å·²çŸ¥æ ¹ä¸­äº¦æœ‰è«¦ç†ï¼Œå…ˆæœªç¾è§€ä»Šç¾è§€æ•…ï¼Œå‰‡æ‰€ç«‹æ ¹æ‡‰æˆé›œäº‚ã€‚	å·²çŸ¥æ ¹ä¸­äº¦æœ‰è«¦ç†ï¼Œå…ˆæœªç¾è§€ä»Šç¾è§€æ•…ï¼Œå‰‡æ‰€ç«‹æ ¹æ‡‰æˆé›œäº‚ã€‚	Also, the faculty of perfect knowledge is also the truth, and since one realizes it for the first time, it should be included in the first faculty. In that case, the faculties that are established would be confused.
['ZH_T29_1562_009:0378c23_3']	æ­¤çš†ç„¡å¤±ï¼Œè¦‹æ™ºç¾è§€æœ‰å·®åˆ¥æ•…ï¼Œå¦‚ä¸–é–“æ…§æ–¼è«¸è–è«¦å·²å¾—ç¾è§€ï¼Œä»èªªç„¡æ¼å…ˆæœªç¾è§€ä»Šå¾—ç¾è§€ã€‚	æ­¤çš†ç„¡å¤±ï¼Œè¦‹æ™ºç¾è§€æœ‰å·®åˆ¥æ•…ï¼Œå¦‚ä¸–é–“æ…§æ–¼è«¸è–è«¦å·²å¾—ç¾è§€ï¼Œä»èªªç„¡æ¼å…ˆæœªç¾è§€ä»Šå¾—ç¾è§€ã€‚	There is no confusion, because there is a difference between seeing, knowledge, and realization. It is just as in the world, where one who has already realized the truths is said to realize for the first time the pure truths that he had not realized previously.
['ZH_T29_1562_009:0378c26_9']	åˆå¦‚è‹¦é›†é«”é›–ä¸€ç‰©ï¼Œè€Œè¡Œç›¸åˆ¥ç¾è§€æœ‰åˆ¥ï¼Œè‹¥æ–¼è«¦ç†æœªå¯©æ±ºè€…å”¯è¦‹ç¾è§€ï¼Œè‹¥å·²å¯©æ±ºæ–¹å¾—åç‚ºæ™ºè¦‹ç¾è§€ï¼Œæ•…å½¼ä¸ƒæ™ºäº¦å¾—åç‚ºå…ˆæœªç¾è§€ä»Šå¾—ç¾è§€ã€‚	åˆå¦‚è‹¦é›†é«”é›–ä¸€ç‰©ï¼Œè€Œè¡Œç›¸åˆ¥ç¾è§€æœ‰åˆ¥ï¼Œè‹¥æ–¼è«¦ç†æœªå¯©æ±ºè€…å”¯è¦‹ç¾è§€ï¼Œè‹¥å·²å¯©æ±ºæ–¹å¾—åç‚ºæ™ºè¦‹ç¾è§€ï¼Œæ•…å½¼ä¸ƒæ™ºäº¦å¾—åç‚ºå…ˆæœªç¾è§€ä»Šå¾—ç¾è§€ã€‚	Also, it is just as suffering and its cause are one thing, but their aspects are different and their realizations are different. If one has not yet ascertained and penetrated the truths, he only realizes the truths by seeing. If one has already ascertained and penetrated them, he is said to realize the truths by knowledge and seeing. Therefore the seven knowledges are said to realize for the first time the truths that were not realized previously.
['ZH_T29_1562_009:0378c28_12']	ç„¶é“é¡æ™ºç„¡åŒæ­¤å¤±ï¼Œé›–ä¸€å‰é‚£åŒæ–¼ä¸ƒæ™ºï¼Œè€Œå¾Œç›¸çºŒçš†æœ‰ç•°æ•…ï¼Œå¦‚å¾Œå¤šå¿µåå·²çŸ¥æ ¹ï¼Œéè¦‹é“ä½ã€‚	ç„¶é“é¡æ™ºç„¡åŒæ­¤å¤±ï¼Œé›–ä¸€å‰é‚£åŒæ–¼ä¸ƒæ™ºï¼Œè€Œå¾Œç›¸çºŒçš†æœ‰ç•°æ•…ï¼Œå¦‚å¾Œå¤šå¿µåå·²çŸ¥æ ¹ï¼Œéè¦‹é“ä½ã€‚	However, the knowledge of the class of the path does not have the same fault as the knowledge of suffering, etc., because although it is the same as the seven knowledges in one moment, it is different in subsequent continuity, just as the many moments after are called the faculty of having understood. It is not the case in the state of the path of insight.
['ZH_T29_1562_009:0378c29_15']	ä¸ƒæ™ºå‰é‚£æœ‰æ–¼è«¦ç†é‡ç¾è§€è€…ï¼Œæ•…æ­¤èˆ‡å½¼ä¸æ‡‰åŒä¾‹ã€‚	ä¸ƒæ™ºå‰é‚£æœ‰æ–¼è«¦ç†é‡ç¾è§€è€…ï¼Œæ•…æ­¤èˆ‡å½¼ä¸æ‡‰åŒä¾‹ã€‚	As for the one moment of the seven knowledges, there is a repeated realization of the truth, and therefore it is not the same as the knowledge of suffering, etc.
['ZH_T29_1562_009:0379a02_14']	ç„¶ç›¡æ™ºç­‰ï¼Œå¦‚åˆå‰é‚£ï¼Œç›¸çºŒäº¦çˆ¾ï¼Œçš†èƒ½ä»»æŒï¼Œé‡‘å‰›å–»å®šæ‰€å®³ç…©æƒ±ã€è«¸é›¢ç¹«å¾—ä»¤ç›¸çºŒæ•…ã€‚	ç„¶ç›¡æ™ºç­‰ï¼Œå¦‚åˆå‰é‚£ï¼Œç›¸çºŒäº¦çˆ¾ï¼Œçš†èƒ½ä»»æŒï¼Œé‡‘å‰›å–»å®šæ‰€å®³ç…©æƒ±ã€è«¸é›¢ç¹«å¾—ä»¤ç›¸çºŒæ•…ã€‚	However, the knowledge of exhaustion, etc., is like the first moment, and it is also like this in continuity, because it is all able to support the bonds of the passions that are destroyed by the diamond-like samÄdhi, and it causes the acquisition of separation from those bonds to continue.
['ZH_T29_1562_009:0379a03_4']	ç¶“ä¸»ä¸æ‡‰åŒæ­¤ç„¡å¤±ã€‚	ç¶“ä¸»ä¸æ‡‰åŒæ­¤ç„¡å¤±ã€‚	The author of the commentary should not be the same as this and not have the fault.
['ZH_T29_1562_009:0379a05_17']	åˆé“é¡æ™ºï¼Œæ–¼æ‰€è§€å¢ƒé›–ä¸€å‰é‚£æœªå¾—ç¾è§€ï¼Œè€Œæ–¼ç„¡é‡å‰é‚£é“å¢ƒå·²å¾—ç¾è§€ï¼Œæ•…å°‘å¾å¤šï¼Œæ–¼ä¸€åˆ‡å¢ƒçš†åç¾è§€ï¼Œæˆå·²çŸ¥æ ¹ã€‚	åˆé“é¡æ™ºï¼Œæ–¼æ‰€è§€å¢ƒé›–ä¸€å‰é‚£æœªå¾—ç¾è§€ï¼Œè€Œæ–¼ç„¡é‡å‰é‚£é“å¢ƒå·²å¾—ç¾è§€ï¼Œæ•…å°‘å¾å¤šï¼Œæ–¼ä¸€åˆ‡å¢ƒçš†åç¾è§€ï¼Œæˆå·²çŸ¥æ ¹ã€‚	Moreover, although the knowledge of the class of the path does not realize the truth in one moment with regard to the object that is observed, it does realize the truth in innumerable moments with regard to the path as object. Therefore, following the majority, it is said that with regard to all objects it is called realization, and it is established as the faculty of having understood.
['ZH_T29_1562_009:0379a07_11']	éåº¦å¤§æµ·æˆ–å¦™é«˜å±±ï¼Œé¤˜èŠ¥å­é‡æœªèƒ½åº¦æ•…ï¼Œå¯åæ–¼å½¼æœªå¾—åº¦è€…ï¼Œæ­¤äº¦æ‡‰ç„¶ã€‚	éåº¦å¤§æµ·æˆ–å¦™é«˜å±±ï¼Œé¤˜èŠ¥å­é‡æœªèƒ½åº¦æ•…ï¼Œå¯åæ–¼å½¼æœªå¾—åº¦è€…ï¼Œæ­¤äº¦æ‡‰ç„¶ã€‚	It is not that one has not yet crossed the great ocean or the wondrous high mountain, because one has not yet crossed the remaining measure of mustard seeds, that one can be called one who has not yet crossed them. This should be the same as that.
['ZH_T29_1562_009:0379a08_10']	è¥¿æ–¹è«¸å¸«èªªé“é¡æ™ºäº¦æ˜¯æœªçŸ¥ç•¶çŸ¥æ ¹æ”ã€‚	è¥¿æ–¹è«¸å¸«èªªé“é¡æ™ºäº¦æ˜¯æœªçŸ¥ç•¶çŸ¥æ ¹æ”ã€‚	Western masters say that the cognition of the class of suffering and the cognition of the class of origination are also included in the faculty of understanding what was not previously understood.
['ZH_T29_1562_009:0379a09_1']	è‹¥å°å½¼é‡‹ï¼Œæ­¤éå…¨ç„¡ã€‚	è‹¥å°å½¼é‡‹ï¼Œæ­¤éå…¨ç„¡ã€‚	If this is explained in relation to them, this fault is completely absent.
['ZH_T29_1562_009:0379a09_10']	æ•…æˆ‘æ‰€è¨€ç„¡å‰äºŒå¤±ã€‚	æ•…æˆ‘æ‰€è¨€ç„¡å‰äºŒå¤±ã€‚	Therefore, what I have said is free from the first two errors.
['ZH_T29_1562_009:0379a11_8']	è‹¥å¢ä¸Šæ•…ç«‹ç‚ºæ ¹è€…ï¼Œæ–¼æ„›è¦‹å“è«¸ç…©æƒ±ä¸­ï¼Œå—æƒ³äºŒæ³•æœ‰å¢ä¸Šç”¨ï¼Œæƒ³æ‡‰å¦‚å—äº¦ç«‹ç‚ºæ ¹ã€‚	è‹¥å¢ä¸Šæ•…ç«‹ç‚ºæ ¹è€…ï¼Œæ–¼æ„›è¦‹å“è«¸ç…©æƒ±ä¸­ï¼Œå—æƒ³äºŒæ³•æœ‰å¢ä¸Šç”¨ï¼Œæƒ³æ‡‰å¦‚å—äº¦ç«‹ç‚ºæ ¹ã€‚	If something is established as a faculty because it is dominant, then among the afflictions of the class of craving and the class of views, the two dharmas of feeling and conceptualization have a dominant function. Conceptualization should be established as a faculty just as feeling is.
['ZH_T29_1562_009:0379a12_12']	åˆè«¸ç…©æƒ±ï¼Œæ–¼èƒ½æå£å–„å“ç­‰ä¸­æœ‰å¢ä¸Šç”¨ï¼Œæ‡‰æˆæ ¹é«”ã€‚	åˆè«¸ç…©æƒ±ï¼Œæ–¼èƒ½æå£å–„å“ç­‰ä¸­æœ‰å¢ä¸Šç”¨ï¼Œæ‡‰æˆæ ¹é«”ã€‚	Moreover, among the afflictions, those that have a dominant function in destroying good dharmas, etc., should constitute the substance of a faculty.
['ZH_T29_1562_009:0379a14_1']	åˆæœ€å‹æ•…å»ºç«‹è«¸æ ¹ï¼Œä¸€åˆ‡æ³•ä¸­æ¶…æ§ƒæœ€å‹ï¼Œä½•ç·£ä¸ç«‹æ¶…æ§ƒç‚ºæ ¹ï¼Ÿ	åˆæœ€å‹æ•…å»ºç«‹è«¸æ ¹ï¼Œä¸€åˆ‡æ³•ä¸­æ¶…æ§ƒæœ€å‹ï¼Œä½•ç·£ä¸ç«‹æ¶…æ§ƒç‚ºæ ¹ï¼Ÿ	Moreover, the faculties are established because they are most excellent. Nirvana is most excellent among all dharmas. Why is it not established as a faculty?
['ZH_T29_1562_009:0379a15_14']	åˆè¿¦æ¯”ç¾…ï¼Œèªå…·ã€æ‰‹è¶³åŠå¤§ä¾¿è™•äº¦ç«‹ç‚ºæ ¹ï¼Œæ–¼èªåŸ·è¡ŒåŠèƒ½æ£„æ¨æœ‰å¢ä¸Šæ•…ã€‚	åˆè¿¦æ¯”ç¾…ï¼Œèªå…·ã€æ‰‹è¶³åŠå¤§ä¾¿è™•äº¦ç«‹ç‚ºæ ¹ï¼Œæ–¼èªåŸ·è¡ŒåŠèƒ½æ£„æ¨æœ‰å¢ä¸Šæ•…ã€‚	Moreover, KÄpila established speech, hands, feet, and the anus as faculties, because they have a dominant function in speaking, grasping, moving, and expelling.
['ZH_T29_1562_009:0379a16_13']	å¦‚æ˜¯ç­‰äº‹ä¸æ‡‰ç«‹æ ¹ï¼Œç”±æ‰€è¨±æ ¹æœ‰å¦‚æ˜¯ç›¸ã€‚	å¦‚æ˜¯ç­‰äº‹ä¸æ‡‰ç«‹æ ¹ï¼Œç”±æ‰€è¨±æ ¹æœ‰å¦‚æ˜¯ç›¸ã€‚	Such things should not be established as faculties, because the accepted faculties have such characteristics.
['ZH_T29_1562_009:0379a16_16']	é Œæ›°ï¼š	é Œæ›°ï¼š	Verse:
['ZH_T29_1562_009:0379a17_0']	å¿ƒæ‰€ä¾æ­¤åˆ¥ï¼Œã€€ã€€æ­¤ä½æ­¤é›œæŸ“ï¼Œ	å¿ƒæ‰€ä¾æ­¤åˆ¥ï¼Œã€€ã€€æ­¤ä½æ­¤é›œæŸ“ï¼Œ	The mind and its activities depend on this, this abides, and this is defiled,
['ZH_T29_1562_009:0379a18_13']	æ­¤è³‡ç³§æ­¤æ·¨ï¼Œã€€ã€€ç”±æ­¤é‡ç«‹æ ¹ã€‚	æ­¤è³‡ç³§æ­¤æ·¨ï¼Œã€€ã€€ç”±æ­¤é‡ç«‹æ ¹ã€‚	This is the equipment, this is the purification; by this measure the faculties are established.
['ZH_T29_1562_009:0379a19_2']	è«–æ›°ï¼š	è«–æ›°ï¼š	The treatise says:
['ZH_T29_1562_009:0379a20_1']	å¿ƒæ‰€ä¾è€…çœ¼ç­‰å…­æ ¹ï¼Œæ­¤å…§å…­è™•æ˜¯æœ‰æƒ…æœ¬ã€‚	å¿ƒæ‰€ä¾è€…çœ¼ç­‰å…­æ ¹ï¼Œæ­¤å…§å…­è™•æ˜¯æœ‰æƒ…æœ¬ã€‚	The basis of the mind is the six faculties such as the eye. These six internal bases are the basis of sentient beings.
['ZH_T29_1562_009:0379a21_1']	æ­¤ç›¸å·®åˆ¥ï¼Œç”±å¥³ç”·æ ¹ï¼Œå¾©ç”±å‘½æ ¹æ­¤ä¸€æœŸä½ã€‚	æ­¤ç›¸å·®åˆ¥ï¼Œç”±å¥³ç”·æ ¹ï¼Œå¾©ç”±å‘½æ ¹æ­¤ä¸€æœŸä½ã€‚	Their distinctions in characteristics are due to the male and female faculties. Again, due to the life faculty, they abide for a period of time.
['ZH_T29_1562_009:0379a21_11']	æ­¤æˆé›œæŸ“ï¼Œç”±äº”å—æ ¹ã€‚	æ­¤æˆé›œæŸ“ï¼Œç”±äº”å—æ ¹ã€‚	Their defilement is due to the five faculties of sensation.
['ZH_T29_1562_009:0379a22_1']	æ­¤æ·¨è³‡ç³§ï¼Œç”±ä¿¡ç­‰äº”ã€‚	æ­¤æ·¨è³‡ç³§ï¼Œç”±ä¿¡ç­‰äº”ã€‚	Their equipment for purification is due to the five faculties such as faith.
['ZH_T29_1562_009:0379a22_11']	æ­¤æˆæ¸…æ·¨ï¼Œç”±å¾Œä¸‰æ ¹ã€‚	æ­¤æˆæ¸…æ·¨ï¼Œç”±å¾Œä¸‰æ ¹ã€‚	Their attainment of purification is due to the last three faculties.
['ZH_T29_1562_009:0379a23_10']	ç”±æ­¤ç«‹æ ¹ï¼Œäº‹çš†ç©¶ç«Ÿï¼Œä¸æ‡‰æ›´ç«‹æƒ³ç­‰ç‚ºæ ¹ã€‚	ç”±æ­¤ç«‹æ ¹ï¼Œäº‹çš†ç©¶ç«Ÿï¼Œä¸æ‡‰æ›´ç«‹æƒ³ç­‰ç‚ºæ ¹ã€‚	By these, the matter of establishing the faculties is all concluded. Thought and the others should not be established as faculties.
['ZH_T29_1562_009:0379a24_8']	è«¸ç…©æƒ±ä¸­æ„›éæœ€é‡ï¼Œæ•…å”¯ç«‹å—èˆ‡å½¼ç‚ºæ ¹ã€‚	è«¸ç…©æƒ±ä¸­æ„›éæœ€é‡ï¼Œæ•…å”¯ç«‹å—èˆ‡å½¼ç‚ºæ ¹ã€‚	Among the afflictions, craving is the most serious fault, therefore only sensation is established as their faculty.
['ZH_T29_1562_009:0379a25_7']	æ„›éé‡è€…ï¼Œä»¥å¥‘ç¶“èªªæ„›èˆ‡å…­è™•ç‚ºç”Ÿå› æ•…ã€‚	æ„›éé‡è€…ï¼Œä»¥å¥‘ç¶“èªªæ„›èˆ‡å…­è™•ç‚ºç”Ÿå› æ•…ã€‚	The most serious fault of craving is because a scripture says that craving is the cause for the arising of the six sense bases.
['ZH_T29_1562_009:0379a25_12']	å¦‚å¥‘ç¶“èªªï¼š	å¦‚å¥‘ç¶“èªªï¼š	As a scripture says:
['ZH_T29_1562_009:0379a26_2']	ç”±æ„›ç‚ºå› ï¼Œå…­è™•ç”Ÿèµ·ã€‚	ç”±æ„›ç‚ºå› ï¼Œå…­è™•ç”Ÿèµ·ã€‚	Because of craving as a cause, the six sense bases arise.
['ZH_T29_1562_009:0379a28_1']	åˆæƒ³éè¦‹ç…©æƒ±ç”Ÿå› ï¼Œé¤˜å› ç™¼ç”Ÿé¡›å€’è¦‹å·²ï¼Œå¦„åˆ†åˆ¥æƒ³æŒä»¤ç›¸çºŒï¼Œé›¢æ­£å°æ²»ä¸å¯æ–·å£ã€‚	åˆæƒ³éè¦‹ç…©æƒ±ç”Ÿå› ï¼Œé¤˜å› ç™¼ç”Ÿé¡›å€’è¦‹å·²ï¼Œå¦„åˆ†åˆ¥æƒ³æŒä»¤ç›¸çºŒï¼Œé›¢æ­£å°æ²»ä¸å¯æ–·å£ã€‚	Also, conceptualization is the cause of the generation of the passions, and the other causes generate the inverted views. Once the inverted views are generated, conceptualization holds them and causes them to continue in a series. Apart from the correct antidote, they cannot be eliminated.
['ZH_T29_1562_009:0379a28_10']	æ•…èªªæ­¤æƒ³èˆ‡å½¼ç‚ºå› ã€‚	æ•…èªªæ­¤æƒ³èˆ‡å½¼ç‚ºå› ã€‚	Therefore it is said that conceptualization is the cause of the inverted views.
['ZH_T29_1562_009:0379a29_9']	å—ç‚ºæ„›å› ä¿±é€šäºŒç¨®ï¼Œå—ç‚ºéé‡ï¼Œç…©æƒ±å› æ•…ï¼›	å—ç‚ºæ„›å› ä¿±é€šäºŒç¨®ï¼Œå—ç‚ºéé‡ï¼Œç…©æƒ±å› æ•…ï¼›	Feeling is the cause of craving and is of both kinds, because feeling is the most important cause of the passions.
['ZH_T29_1562_009:0379a29_19']	é€šäºŒå› æ•…ï¼Œç¨ç«‹ç‚ºæ ¹ã€‚	é€šäºŒå› æ•…ï¼Œç¨ç«‹ç‚ºæ ¹ã€‚	Because it is of both kinds of causes, it is established as a separate faculty.
['ZH_T29_1562_009:0379b01_3']	æœ‰é¤˜å¸«è¨€ï¼š	æœ‰é¤˜å¸«è¨€ï¼š	Other masters say that
['ZH_T29_1562_009:0379b02_7']	æƒ³ç‚ºé¤˜æ³•æ‰€æ˜ å¥ªæ•…ä¸ç«‹ç‚ºæ ¹ï¼Œè¬‚è«¸å–„æƒ³ï¼Œæ­£æ…§æ˜ å¥ªï¼›	æƒ³ç‚ºé¤˜æ³•æ‰€æ˜ å¥ªæ•…ä¸ç«‹ç‚ºæ ¹ï¼Œè¬‚è«¸å–„æƒ³ï¼Œæ­£æ…§æ˜ å¥ªï¼›	conceptualization is not established as a root because it is overwhelmed by other dharmas, that is, good conceptualization is overwhelmed by correct views,
['ZH_T29_1562_009:0379b02_17']	è«¸æŸ“æ±¡æƒ³ï¼Œé¡›å€’æ˜ å¥ªã€‚	è«¸æŸ“æ±¡æƒ³ï¼Œé¡›å€’æ˜ å¥ªã€‚	and defiled conceptualization is overwhelmed by inverted views.
['ZH_T29_1562_009:0379b03_6']	éå¢ä¸Šæ•…ï¼Œä¸ç«‹ç‚ºæ ¹ã€‚	éå¢ä¸Šæ•…ï¼Œä¸ç«‹ç‚ºæ ¹ã€‚	Because it is not dominant, it is not established as a root.
['ZH_T29_1562_009:0379b04_4']	åˆè«¸ç…©æƒ±äº¦éå¢ä¸Šï¼Œå—æ–¼å…¶ä¸­æˆå¢ä¸Šæ•…ã€‚	åˆè«¸ç…©æƒ±äº¦éå¢ä¸Šï¼Œå—æ–¼å…¶ä¸­æˆå¢ä¸Šæ•…ã€‚	Also, the passions are not dominant, because feeling is dominant among them.
['ZH_T29_1562_009:0379b05_3']	å”¯å—æ–¼å½¼å¯ç«‹ç‚ºæ ¹ï¼Œæˆ–æå–„å“ã€å£æ¨‚æœäº‹ã€‚	å”¯å—æ–¼å½¼å¯ç«‹ç‚ºæ ¹ï¼Œæˆ–æå–„å“ã€å£æ¨‚æœäº‹ã€‚	Only feeling can be established as a root, because it can destroy good actions and the events that result in happiness.
['ZH_T29_1562_009:0379b05_13']	ä¸‹åŠ£é„™ç©¢ï¼Œå¦‚ä½•ç«‹æ ¹ï¼Ÿ	ä¸‹åŠ£é„™ç©¢ï¼Œå¦‚ä½•ç«‹æ ¹ï¼Ÿ	How can the inferior and contemptible be established as roots?
['ZH_T29_1562_009:0379b06_2']	æ ¹æ˜¯ä¸–é–“å¢ä¸Šæ³•æ•…ã€‚	æ ¹æ˜¯ä¸–é–“å¢ä¸Šæ³•æ•…ã€‚	Because roots are superior dharmas in the world.
['ZH_T29_1562_009:0379b07_11']	åˆæ–¼è«¸æ³•ï¼Œæ¶…æ§ƒé›–å‹ï¼Œæ»…è«¸æ ¹æ•…ä¸ç«‹ç‚ºæ ¹ï¼Œå¦‚ç ´è«¸ç“¶ç ´éç“¶é«”ã€‚	åˆæ–¼è«¸æ³•ï¼Œæ¶…æ§ƒé›–å‹ï¼Œæ»…è«¸æ ¹æ•…ä¸ç«‹ç‚ºæ ¹ï¼Œå¦‚ç ´è«¸ç“¶ç ´éç“¶é«”ã€‚	Moreover, although nirvÄá¹‡a is superior to all dharmas, it is not established as a root because it destroys the faculties, just as when pots are destroyed, the substance of the pots is not destroyed.
['ZH_T29_1562_009:0379b08_11']	åˆèªå…·ç­‰äº¦ä¸åæ ¹ï¼Œä¸å®šé›œäº‚ï¼Œå¤§éå¤±æ•…ã€‚	åˆèªå…·ç­‰äº¦ä¸åæ ¹ï¼Œä¸å®šé›œäº‚ï¼Œå¤§éå¤±æ•…ã€‚	Also, the organs of speech, etc., are not called roots, because they are indefinite and mixed, and because they are subject to great error.
['ZH_T29_1562_009:0379b09_4']	ä¸å®šå¤±è€…ï¼Œä½•ç­‰èªå…·ç«‹ç‚ºèªæ ¹ï¼Ÿ	ä¸å®šå¤±è€…ï¼Œä½•ç­‰èªå…·ç«‹ç‚ºèªæ ¹ï¼Ÿ	As for the error of indefiniteness, which organ of speech is established as the root of speech?
['ZH_T29_1562_009:0379b09_18']	èƒ½ç™¼è¨€éŸ³åç‚ºèªå…·ï¼Œæ­¤å³æ˜¯èˆŒã€‚	èƒ½ç™¼è¨€éŸ³åç‚ºèªå…·ï¼Œæ­¤å³æ˜¯èˆŒã€‚	That which can emit speech is called the organ of speech, and this is precisely the tongue.
['ZH_T29_1562_009:0379b11_6']	è‹¥çˆ¾ï¼Œå‰‡æ‡‰å°‹ä¼ºç­‰æ³•åŠèƒ½å¼•èµ·èªæ¥­è«¸é¢¨äº¦ç«‹ç‚ºæ ¹ï¼Œèƒ½ç™¼èªæ•…ã€‚	è‹¥çˆ¾ï¼Œå‰‡æ‡‰å°‹ä¼ºç­‰æ³•åŠèƒ½å¼•èµ·èªæ¥­è«¸é¢¨äº¦ç«‹ç‚ºæ ¹ï¼Œèƒ½ç™¼èªæ•…ã€‚	If that is so, then such dharmas as applied and sustained thought, and the winds that give rise to the activity of speech, should also be established as roots, because they can emit speech.
['ZH_T29_1562_009:0379b12_14']	è¬‚å°‹ä¼ºç­‰ä¾è„£é½’è…­å’½å–‰ç­‰ç·£ç™¼èµ·è¨€éŸ³ï¼Œéä½†ä¾èˆŒï¼Œç„¡ç•°å› æ•…ï¼›	è¬‚å°‹ä¼ºç­‰ä¾è„£é½’è…­å’½å–‰ç­‰ç·£ç™¼èµ·è¨€éŸ³ï¼Œéä½†ä¾èˆŒï¼Œç„¡ç•°å› æ•…ï¼›	This is because the sounds of speech are produced in dependence on the lips, teeth, palate, throat, etc., and are not dependent only on the tongue, because there is no different cause.
['ZH_T29_1562_009:0379b13_7']	åˆå°‹ä¼ºç­‰æ–¼ç™¼è¨€éŸ³æ˜¯å‹å› æ•…ï¼›	åˆå°‹ä¼ºç­‰æ–¼ç™¼è¨€éŸ³æ˜¯å‹å› æ•…ï¼›	Also, because such dharmas as applied and sustained thought are the superior causes for emitting speech.
['ZH_T29_1562_009:0379b14_16']	åˆè«¸æ‰‹è…‹ã€ç®¡çµƒæ¯ç­‰çš†èƒ½ç‚ºå› ï¼Œç™¼è¨€éŸ³æ•…ï¼Œä¸æ‡‰å”¯ç«‹èˆŒç‚ºèªæ ¹ã€‚	åˆè«¸æ‰‹è…‹ã€ç®¡çµƒæ¯ç­‰çš†èƒ½ç‚ºå› ï¼Œç™¼è¨€éŸ³æ•…ï¼Œä¸æ‡‰å”¯ç«‹èˆŒç‚ºèªæ ¹ã€‚	Also, the hands, armpits, flutes, strings, breath, etc., are all able to be the causes for emitting speech, and therefore the tongue alone should not be established as the organ of speech.
['ZH_T29_1562_009:0379b15_19']	è‹¥è¬‚äº†è‰²äº¦ç”±è¨€æ•…ï¼Œä¸æ‡‰ç¨ç«‹çœ¼ç‚ºæ ¹è€…ï¼Œç†å¿…ä¸ç„¶ã€‚	è‹¥è¬‚äº†è‰²äº¦ç”±è¨€æ•…ï¼Œä¸æ‡‰ç¨ç«‹çœ¼ç‚ºæ ¹è€…ï¼Œç†å¿…ä¸ç„¶ã€‚	If you say that one understands form because of words, and therefore the eye should not be established as a faculty, this is not reasonable.
['ZH_T29_1562_009:0379b16_17']	è«¸ç”Ÿç›²äººé›–èèªªè‰²ï¼Œä¸äº†é’ç­‰å·®åˆ¥ç›¸æ•…ã€‚	è«¸ç”Ÿç›²äººé›–èèªªè‰²ï¼Œä¸äº†é’ç­‰å·®åˆ¥ç›¸æ•…ã€‚	Even though blind people hear the word form, they do not understand the characteristics of blue, etc.
['ZH_T29_1562_009:0379b17_16']	æ‰‹æ–¼åŸ·å–ä¸æ‡‰åæ ¹ï¼Œå£ç­‰äº¦èƒ½åŸ·å–ç‰©æ•…ã€‚	æ‰‹æ–¼åŸ·å–ä¸æ‡‰åæ ¹ï¼Œå£ç­‰äº¦èƒ½åŸ·å–ç‰©æ•…ã€‚	The hand should not be called a faculty in grasping, because the mouth, etc., can also grasp things.
['ZH_T29_1562_009:0379b19_1']	è¶³æ–¼è¡Œå‹•ä¸æ‡‰åæ ¹ï¼Œè›‡é­šç­‰é¡ä¸ç”±æ–¼è¶³æœ‰è¡Œå‹•æ•…ã€‚	è¶³æ–¼è¡Œå‹•ä¸æ‡‰åæ ¹ï¼Œè›‡é­šç­‰é¡ä¸ç”±æ–¼è¶³æœ‰è¡Œå‹•æ•…ã€‚	The foot should not be called a faculty in locomotion, because snakes, fish, etc., move about without feet.
['ZH_T29_1562_009:0379b20_4']	å‡ºå¤§ä¾¿è™•æ–¼èƒ½æ£„æ¨ä¸æ‡‰åæ ¹ï¼Œå£ç­‰äº¦èƒ½æœ‰æ£„æ¨æ•…ã€‚	å‡ºå¤§ä¾¿è™•æ–¼èƒ½æ£„æ¨ä¸æ‡‰åæ ¹ï¼Œå£ç­‰äº¦èƒ½æœ‰æ£„æ¨æ•…ã€‚	The anus should not be called a faculty in excretion, because the mouth, etc., can also excrete.
