segmentnr	original	analyzed	translated
['ZH_T35_1735_059:0950a06_15']	ç¬¬ä¸‰ã€Œå–„è²¡è¨€å¤§è–ã€ä¸‹æ˜æ³•é–€æ¥­ç”¨ä¸­ï¼Œå…ˆå•ã€å¾Œç­”ã€‚	ç¬¬ä¸‰ã€Œå–„è²¡è¨€å¤§è–ã€ä¸‹æ˜æ³•é–€æ¥­ç”¨ä¸­ï¼Œå…ˆå•ã€å¾Œç­”ã€‚	The third, from Sudhana said, 'Great Sage' is the explanation of the function of the Dharma door. First, asking, then answering.
['ZH_T35_1735_059:0950a06_19']	ç­”ä¸­äºŒï¼š	ç­”ä¸­äºŒï¼š	The answer is in two parts:
['ZH_T35_1735_059:0950a07_9']	å…ˆé¡¯å»£çŸ¥ã€å¾Œé‡‹çŸ¥æ‰€ä»¥ã€‚	å…ˆé¡¯å»£çŸ¥ã€å¾Œé‡‹çŸ¥æ‰€ä»¥ã€‚	First, revealing extensive knowledge; later, explaining the reason for knowledge.
['ZH_T35_1735_059:0950a07_13']	å‰ä¸­ä¸‰ï¼š	å‰ä¸­ä¸‰ï¼š	The first part is in three parts:
['ZH_T35_1735_059:0950a08_15']	åˆçŸ¥å¨‘å©†ä¸–ç•Œã€æ¬¡é¡çŸ¥å‰æµ·ã€å¾Œåˆ¥é¡¯æ¯˜ç›§å› æœã€‚	åˆçŸ¥å¨‘å©†ä¸–ç•Œã€æ¬¡é¡çŸ¥å‰æµ·ã€å¾Œåˆ¥é¡¯æ¯˜ç›§å› æœã€‚	First, knowing the Saha world; next, analogically knowing the ocean of lands; finally, specifically revealing the cause and effect of Vairocana.
['ZH_T35_1735_059:0950a08_19']	å‰ä¸­äºŒï¼š	å‰ä¸­äºŒï¼š	The first part is in two parts:
['ZH_T35_1735_059:0950a10_1']	å…ˆçŸ¥å‰å¡µåŠ«äº‹ã€å¾Œã€Œå–„ç”·å­æ­¤å¨‘å©†ã€ä¸‹é¡ç›¡æœªä¾†ã€‚	å…ˆçŸ¥å‰å¡µåŠ«äº‹ã€å¾Œã€Œå–„ç”·å­æ­¤å¨‘å©†ã€ä¸‹é¡ç›¡æœªä¾†ã€‚	First, knowing the events of the dust motes of lands for eons; later, from Good man, this Saha world analogically exhausting the future.
['ZH_T35_1735_059:0950a10_6']	å‰ä¸­äº¦äºŒï¼š	å‰ä¸­äº¦äºŒï¼š	The first part is also in two parts:
['ZH_T35_1735_059:0950a10_15']	ä¸€çŸ¥ä¸–é–“å–„æƒ¡å› æœã€‚	ä¸€çŸ¥ä¸–é–“å–„æƒ¡å› æœã€‚	First, knowing the good and evil causes and effects of the world.
['ZH_T35_1735_059:0950a11_11']	ä¸å–„æ ¹æ‰€æ”å–„æ ¹è€…ï¼Œå¦‚ç‹å¿ƒæŒæˆ’ç­‰ã€‚	ä¸å–„æ ¹æ‰€æ”å–„æ ¹è€…ï¼Œå¦‚ç‹å¿ƒæŒæˆ’ç­‰ã€‚	The roots of goodness that are included in the roots of unwholesomeness are like those who hold precepts with an angry mind, etc.
['ZH_T35_1735_059:0950a11_16']	ä¸‹å¥é¡çŸ¥ã€‚	ä¸‹å¥é¡çŸ¥ã€‚	The following line analogically knows.
['ZH_T35_1735_059:0950a12_14']	äºŒã€Œåˆå½¼åŠ«ã€ä¸‹çŸ¥å‡ºä¸–å› æœï¼Œæ–¼ä¸­äº¦äºŒï¼š	äºŒã€Œåˆå½¼åŠ«ã€ä¸‹çŸ¥å‡ºä¸–å› æœï¼Œæ–¼ä¸­äº¦äºŒï¼š	Second, from And he knows the world-transcending causes and effects in that kalpa, he knows the world-transcending causes and effects. Within this, there are also two parts:
['ZH_T35_1735_059:0950a13_15']	å…ˆçŸ¥ä½›å› æœã€å¾Œã€Œäº¦çŸ¥å½¼ä½›çœ¾ã€ä¸‹çŸ¥ä½›çœ¾æœƒã€‚	å…ˆçŸ¥ä½›å› æœã€å¾Œã€Œäº¦çŸ¥å½¼ä½›çœ¾ã€ä¸‹çŸ¥ä½›çœ¾æœƒã€‚	First, he knows the Buddha's causes and effects; second, from He also knows the Buddha's assemblies, he knows the Buddha's assemblies.
['ZH_T35_1735_059:0950a13_20']	æ–¼ä¸­æœ‰ä¸‰ï¼š	æ–¼ä¸­æœ‰ä¸‰ï¼š	Within this, there are three parts:
['ZH_T35_1735_059:0950a15_7']	åˆçŸ¥è²èã€äºŒçŸ¥ç·£è¦ºã€ä¸‰çŸ¥è©è–©åŠå¾Œé¡ç›¡æœªä¾†ï¼Œæ–‡ä¸¦å¯çŸ¥ã€‚	åˆçŸ¥è²èã€äºŒçŸ¥ç·£è¦ºã€ä¸‰çŸ¥è©è–©åŠå¾Œé¡ç›¡æœªä¾†ï¼Œæ–‡ä¸¦å¯çŸ¥ã€‚	First, he knows the Å›rÄvakas; second, he knows the pratyekabuddhas; third, he knows the bodhisattvas and later categories that extend to the end of the future. The text is all understandable.
['ZH_T35_1735_059:0950a16_1']	ç¬¬äºŒã€Œå¦‚çŸ¥å¨‘å©†ã€ä¸‹é¡çŸ¥å‰æµ·ã€‚	ç¬¬äºŒã€Œå¦‚çŸ¥å¨‘å©†ã€ä¸‹é¡çŸ¥å‰æµ·ã€‚	Second, from Just as he knows the Saha world, he extends his knowledge to the ocean of realms.
['ZH_T35_1735_059:0950a16_5']	æ–¼ä¸­äºŒï¼š	æ–¼ä¸­äºŒï¼š	Within this, there are two parts:
['ZH_T35_1735_059:0950a16_19']	å…ˆé€šé¡¯çŸ¥å¤šã€å¾Œåˆ¥é¡¯æ‰€çŸ¥ç›¸ç‹€ã€‚	å…ˆé€šé¡¯çŸ¥å¤šã€å¾Œåˆ¥é¡¯æ‰€çŸ¥ç›¸ç‹€ã€‚	First, he generally shows that he knows many; second, he specifically shows the characteristics of what he knows.
['ZH_T35_1735_059:0950a17_15']	ä»Šåˆï¼Œæœ‰å…­é‡é¡çŸ¥ï¼Œå¾Œå¾Œå»£æ–¼å‰å‰ã€‚	ä»Šåˆï¼Œæœ‰å…­é‡é¡çŸ¥ï¼Œå¾Œå¾Œå»£æ–¼å‰å‰ã€‚	Now, there are six levels of extended knowledge, each subsequent one being more extensive than the previous.
['ZH_T35_1735_059:0950a18_18']	åˆäºŒçš†å…¨å‰æ”å¤šå‰ï¼Œè€Œåˆä½†æ”åŒé¡å‰ï¼Œæ•…äº‘å¡µæ•¸ï¼›	åˆäºŒçš†å…¨å‰æ”å¤šå‰ï¼Œè€Œåˆä½†æ”åŒé¡å‰ï¼Œæ•…äº‘å¡µæ•¸ï¼›	The first two both completely include many realms within a single realm, but the first only includes realms of the same type, so it says the number of dust motes;
['ZH_T35_1735_059:0950a19_16']	äºŒå³ç•°é¡å‰ï¼Œæ•…äº‘ä¸€åˆ‡ï¼Œä¸€åˆ‡ç¨®é¡æ•…ã€‚	äºŒå³ç•°é¡å‰ï¼Œæ•…äº‘ä¸€åˆ‡ï¼Œä¸€åˆ‡ç¨®é¡æ•…ã€‚	The second includes realms of different types, so it says all, because it includes all kinds.
['ZH_T35_1735_059:0950a20_8']	ä¸‰å³å¡µä¸­æ”å‰ï¼Œæ•…ç´°æ–¼å‰ã€‚	ä¸‰å³å¡µä¸­æ”å‰ï¼Œæ•…ç´°æ–¼å‰ã€‚	The third includes realms within dust motes, so it is more subtle than the previous.
['ZH_T35_1735_059:0950a21_17']	å››å³åä¸‰ä½›å‰å¡µæ•¸åœç¹ç•ŒåŠå»£å¤§çœ·å±¬ä¸–ç•Œï¼Œæ•…äº‘å¨‘å©†ä¸–ç•Œå¤–ç­‰ã€‚	å››å³åä¸‰ä½›å‰å¡µæ•¸åœç¹ç•ŒåŠå»£å¤§çœ·å±¬ä¸–ç•Œï¼Œæ•…äº‘å¨‘å©†ä¸–ç•Œå¤–ç­‰ã€‚	Fourth, it is surrounded by buddha-lands as numerous as the dust particles in thirteen buddha-lands, as well as vast retinue worlds, thus it says outside the Saha world and so forth.
['ZH_T35_1735_059:0950a23_3']	äº”å³æ™®ç…§åæ–¹ç†¾ç„¶å¯¶å…‰æ˜å‰ç¨®æ‰€æ”å‰ï¼Œé€šäºŒåé‡ã€‚	äº”å³æ™®ç…§åæ–¹ç†¾ç„¶å¯¶å…‰æ˜å‰ç¨®æ‰€æ”å‰ï¼Œé€šäºŒåé‡ã€‚	Fifth, it is a buddha-land included in the category of the blazing jewel light that universally illuminates the ten directions, with twenty layers in total.
['ZH_T35_1735_059:0950a23_13']	å…­å³å…¨è“®è¯è—ä¸–ç•Œæµ·ã€‚	å…­å³å…¨è“®è¯è—ä¸–ç•Œæµ·ã€‚	Sixth, it is the entire ocean of the Lotus Treasury World.
['ZH_T35_1735_059:0950a24_9']	å¾Œã€Œæ‰€è¬‚ã€ä¸‹åˆ¥é¡¯æ‰€çŸ¥ç›¸ç‹€ï¼Œæœ‰åç¨®ï¼š	å¾Œã€Œæ‰€è¬‚ã€ä¸‹åˆ¥é¡¯æ‰€çŸ¥ç›¸ç‹€ï¼Œæœ‰åç¨®ï¼š	Later, below namely, it specifically reveals the characteristics of what is known, which are of ten kinds:
['ZH_T35_1735_059:0950a24_18']	ä¸€å»£åšï¼Œå³æ‰€ä¾ç¨®ã€‚	ä¸€å»£åšï¼Œå³æ‰€ä¾ç¨®ã€‚	First, vast, which is the category it relies on.
['ZH_T35_1735_059:0950a25_10']	äºŒå®‰ç«‹ï¼Œå³å› ç·£æˆ–æ‰€ä¾ä½ã€‚	äºŒå®‰ç«‹ï¼Œå³å› ç·£æˆ–æ‰€ä¾ä½ã€‚	Second, established, which is either the causes and conditions or the basis it relies on.
['ZH_T35_1735_059:0950a25_15']	ä¸‰å³è¼ªåœã€‚	ä¸‰å³è¼ªåœã€‚	Third, it is the surrounding mountains.
['ZH_T35_1735_059:0950a26_2']	å››å³å…¶ä¸­å ´åœ°ã€‚	å››å³å…¶ä¸­å ´åœ°ã€‚	Fourth, it is the central ground within.
['ZH_T35_1735_059:0950a26_8']	äº”é«”é¡å„æ®Šã€‚	äº”é«”é¡å„æ®Šã€‚	Fifth, the substance and type are each different.
['ZH_T35_1735_059:0950a26_16']	å…­è½‰è€…ï¼Œæœ‰äºŒç¾©ï¼š	å…­è½‰è€…ï¼Œæœ‰äºŒç¾©ï¼š	Sixth, revolving has two meanings:
['ZH_T35_1735_059:0950a28_3']	ä¸€å¦‚è¼ªå´è½‰å½¢æ•…ï¼Œæ•…ã€ˆä¸–ç•Œæˆå°±å“ã€‰äº‘ã€Œæˆ–æœ‰ä¸–ç•Œéš¨è¼ªè½‰ã€ï¼›	ä¸€å¦‚è¼ªå´è½‰å½¢æ•…ï¼Œæ•…ã€ˆä¸–ç•Œæˆå°±å“ã€‰äº‘ã€Œæˆ–æœ‰ä¸–ç•Œéš¨è¼ªè½‰ã€ï¼›	First, it is like a wheel turning sideways, thus the Chapter on the Accomplishment of the World says some worlds follow the turning of the wheel;
['ZH_T35_1735_059:0950a28_10']	äºŒå³åŠ«è½‰è®Šæ•…ã€‚	äºŒå³åŠ«è½‰è®Šæ•…ã€‚	Second, it is the transformation of the kalpas.
['ZH_T35_1735_059:0950a28_16']	ä¸ƒæ‰€ä¾è“®è¯ã€‚	ä¸ƒæ‰€ä¾è“®è¯ã€‚	Seventh, the lotus it relies on.
['ZH_T35_1735_059:0950a29_2']	å…«å³å…¶ä¸­é ˆå½Œã€‚	å…«å³å…¶ä¸­é ˆå½Œã€‚	Eighth, it is the Sumeru within it.
['ZH_T35_1735_059:0950a29_8']	ä¹éš¨ç·£ç«‹ç¨±ã€‚	ä¹éš¨ç·£ç«‹ç¨±ã€‚	Ninth, establishing a name according to conditions.
['ZH_T35_1735_059:0950b01_14']	åå³çµæœå±¬å› ï¼Œè¬‚è¯è—ä¸–ç•Œæµ·æ˜¯ä½›æœ¬é¡˜æ‰€åš´ï¼Œæ•…äº‘ç”±åŠ›ã€‚	åå³çµæœå±¬å› ï¼Œè¬‚è¯è—ä¸–ç•Œæµ·æ˜¯ä½›æœ¬é¡˜æ‰€åš´ï¼Œæ•…äº‘ç”±åŠ›ã€‚	Tenth, bringing the result back to the cause, namely, the ocean of the Flower Treasury world is the Buddha's original vow, thus it is said by the power.
['ZH_T35_1735_059:0950b02_13']	ç¬¬ä¸‰ã€Œäº¦å¿µå¦‚ä¾†ã€ä¸‹åˆ¥é¡¯æ¯˜ç›§å› æœã€‚	ç¬¬ä¸‰ã€Œäº¦å¿µå¦‚ä¾†ã€ä¸‹åˆ¥é¡¯æ¯˜ç›§å› æœã€‚	Third, from also recollecting the TathÄgata below, specifically revealing the cause and effect of Vairocana.
['ZH_T35_1735_059:0950b02_17']	æ–¼ä¸­äºŒï¼š	æ–¼ä¸­äºŒï¼š	Within this, there are two parts:
['ZH_T35_1735_059:0950b03_6']	å…ˆæ˜å› ï¼Œç„¶æœ‰äºŒç¾©ï¼š	å…ˆæ˜å› ï¼Œç„¶æœ‰äºŒç¾©ï¼š	First, clarifying the cause, but there are two meanings:
['ZH_T35_1735_059:0950b04_10']	ä¸€è€…æˆä¸Šä¸Šï¼Œä½†ç¸½äº‘æœ¬é¡˜åŠ›æ•…ï¼Œä»Šåˆ¥é¡¯æˆå‰ä¹‹å› ï¼›	ä¸€è€…æˆä¸Šä¸Šï¼Œä½†ç¸½äº‘æœ¬é¡˜åŠ›æ•…ï¼Œä»Šåˆ¥é¡¯æˆå‰ä¹‹å› ï¼›	First, completing the above, but only generally saying by the power of the original vow, now specifically revealing the cause of creating the world;
['ZH_T35_1735_059:0950b05_3']	äºŒè€…é †å¾ï¼Œäº¦é€šæ­£å ±ä¹‹å› ã€‚	äºŒè€…é †å¾ï¼Œäº¦é€šæ­£å ±ä¹‹å› ã€‚	Second, following along, also generally referring to the cause of the correct reward.
['ZH_T35_1735_059:0950b05_17']	å¾Œã€Œå¾—æ–¼å¦‚ä¾†ã€ä¸‹é¡¯æœï¼Œå¯çŸ¥ã€‚	å¾Œã€Œå¾—æ–¼å¦‚ä¾†ã€ä¸‹é¡¯æœï¼Œå¯çŸ¥ã€‚	Later, from attaining the TathÄgata below, revealing the effect, which can be understood.
['ZH_T35_1735_059:0950b06_7']	ç¬¬äºŒã€Œä½•ä»¥æ•…ã€ä¸‹é‡‹çŸ¥æ‰€ä»¥ã€‚	ç¬¬äºŒã€Œä½•ä»¥æ•…ã€ä¸‹é‡‹çŸ¥æ‰€ä»¥ã€‚	Second, from why is it so below, explaining the reason for knowing.
['ZH_T35_1735_059:0950b07_7']	ç¬¬å››ã€Œå–„è²¡ç™½è¨€ã€ä¸‹é¡¯æ³•æ ¹æºï¼Œå…ˆå•ã€å¾Œç­”ã€‚	ç¬¬å››ã€Œå–„è²¡ç™½è¨€ã€ä¸‹é¡¯æ³•æ ¹æºï¼Œå…ˆå•ã€å¾Œç­”ã€‚	Fourth, from Sudhana said below, revealing the source of the Dharma. First asking, then answering.
['ZH_T35_1735_059:0950b08_13']	å•ä¸­é›–ä½†å•å¾—æ³•ä¹…è¿‘ï¼Œè€Œç¾©å·²å«ä¿®è¡Œä¹…è¿‘ï¼Œå¾—æ­¤æ³•é–€æ•…ã€‚	å•ä¸­é›–ä½†å•å¾—æ³•ä¹…è¿‘ï¼Œè€Œç¾©å·²å«ä¿®è¡Œä¹…è¿‘ï¼Œå¾—æ­¤æ³•é–€æ•…ã€‚	In the question, although only asking about the length of time of attaining the Dharma, the meaning already includes the length of time of cultivating and practicing, because of attaining this Dharma door.
['ZH_T35_1735_059:0950b08_18']	ç­”ä¸­åˆ†å››ï¼š	ç­”ä¸­åˆ†å››ï¼š	In the answer, there are four parts:
['ZH_T35_1735_059:0950b10_17']	ä¸€æ˜æœ€åˆä½›æ‰€ç™¼å¿ƒä¿®è¡Œã€äºŒæ–¼ä¸­é–“å¤šä½›ä¿®è¡Œã€ä¸‰æ­£æ˜å¾—æ³•ä¹‹æ™‚ã€å››å¤šåŠ«ä¿®ç‘©æ­¤æ³•ã€‚	ä¸€æ˜æœ€åˆä½›æ‰€ç™¼å¿ƒä¿®è¡Œã€äºŒæ–¼ä¸­é–“å¤šä½›ä¿®è¡Œã€ä¸‰æ­£æ˜å¾—æ³•ä¹‹æ™‚ã€å››å¤šåŠ«ä¿®ç‘©æ­¤æ³•ã€‚	First, clarifying the initial cultivation of the mind and practice in the Buddha's presence, second, the practice in the presence of many Buddhas in the middle, third, clarifying the time of attaining the Dharma, and fourth, cultivating and polishing this Dharma for many eons.
['ZH_T35_1735_059:0950b11_4']	åˆä¸­åˆ†äºŒï¼š	åˆä¸­åˆ†äºŒï¼š	In the beginning, it is divided into two:
['ZH_T35_1735_059:0950b11_16']	åˆæ­£é¡¯æœ¬ç·£ã€äºŒçµæœƒå¤ä»Šã€‚	åˆæ­£é¡¯æœ¬ç·£ã€äºŒçµæœƒå¤ä»Šã€‚	First, directly revealing the fundamental conditions, second, concluding the ancient and present.
['ZH_T35_1735_059:0950b12_2']	å‰ä¸­åˆ†åï¼š	å‰ä¸­åˆ†åï¼š	The former is divided into ten:
['ZH_T35_1735_059:0950b12_8']	ä¸€ç‹éƒ½æ™‚è™•ã€‚	ä¸€ç‹éƒ½æ™‚è™•ã€‚	First, the time and place of the royal capital.
['ZH_T35_1735_059:0950b13_5']	äºŒå¤ªå­è¶…å€«ï¼Œæ–¼ä¸­å…ˆå…·ç›¸ã€å¾ŒéŠè§€ã€‚	äºŒå¤ªå­è¶…å€«ï¼Œæ–¼ä¸­å…ˆå…·ç›¸ã€å¾ŒéŠè§€ã€‚	Second, the prince surpassing others, first possessing characteristics, then roaming and observing.
['ZH_T35_1735_059:0950b13_16']	ä¸‰å¯¶å¥³æ±‚æ­¸ï¼Œæ–¼ä¸­åˆ†å››ï¼š	ä¸‰å¯¶å¥³æ±‚æ­¸ï¼Œæ–¼ä¸­åˆ†å››ï¼š	Third, the precious girl seeking to return, in which there are four parts:
['ZH_T35_1735_059:0950b15_14']	ä¸€å…·å¾·ç«¯åš´ã€äºŒã€Œè¦‹å…¶ã€ä¸‹ç™½æ¯æ±‚äº‹ã€ä¸‰ã€Œå½¼é¦™ç‰™ã€ä¸‹å¤¢è¦©ä½›èˆˆã€å››ã€Œæ™‚å¦™å¾·ã€ä¸‹è‡ªé™³å¿ƒã€‚	ä¸€å…·å¾·ç«¯åš´ã€äºŒã€Œè¦‹å…¶ã€ä¸‹ç™½æ¯æ±‚äº‹ã€ä¸‰ã€Œå½¼é¦™ç‰™ã€ä¸‹å¤¢è¦©ä½›èˆˆã€å››ã€Œæ™‚å¦™å¾·ã€ä¸‹è‡ªé™³å¿ƒã€‚	First, possessing virtue and dignity, second, seeing him and below, telling her mother to seek a matter, third, that fragrant sprout and below, dreaming of seeing the Buddha's rise, fourth, at that time, Subhuti and below, expressing her own mind.
['ZH_T35_1735_059:0950b16_12']	ç¸½æœ‰ååˆï¼Œå‰ä¸‰è‡ªè¿°å¾·å ªã€å¾Œä¸ƒè®šå½¼æ±‚ç´ã€‚	ç¸½æœ‰ååˆï¼Œå‰ä¸‰è‡ªè¿°å¾·å ªã€å¾Œä¸ƒè®šå½¼æ±‚ç´ã€‚	In total there are ten verses, the first three describing her own virtue and suitability, the last seven praising him and seeking to be accepted.
['ZH_T35_1735_059:0950b17_7']	å››å¤ªå­å¯©å•ï¼Œæœ‰åäºŒåˆï¼Œåˆ†ä¸‰ï¼š	å››å¤ªå­å¯©å•ï¼Œæœ‰åäºŒåˆï¼Œåˆ†ä¸‰ï¼š	Fourth, the prince's examination, with twelve verses, divided into three:
['ZH_T35_1735_059:0950b18_9']	åˆäºŒå•å…¶å±¬ç·£ã€æ¬¡ä¸‰å¯©å…¶å…§éã€å¾Œä¸ƒé‚€å…¶é€²å–„ã€‚	åˆäºŒå•å…¶å±¬ç·£ã€æ¬¡ä¸‰å¯©å…¶å…§éã€å¾Œä¸ƒé‚€å…¶é€²å–„ã€‚	First two ask about her dependent conditions, next three examine her internal faults, and last seven invite her to cultivate goodness.
['ZH_T35_1735_059:0950b19_12']	äº”å¥³æ¯ä»£ç­”ï¼Œæ˜æœ‰å¾·ç„¡éï¼Œäº¦ä¸å±¬ç·£ï¼Œæ•…æ‡‰ç´å—ã€‚	äº”å¥³æ¯ä»£ç­”ï¼Œæ˜æœ‰å¾·ç„¡éï¼Œäº¦ä¸å±¬ç·£ï¼Œæ•…æ‡‰ç´å—ã€‚	The mother of the five daughters replied on their behalf, clarifying that they have virtue and no faults, and are also not subject to conditions, so they should be accepted.
['ZH_T35_1735_059:0950b19_20']	ä¸‰åä¸€é Œï¼Œåˆ†å…­ï¼š	ä¸‰åä¸€é Œï¼Œåˆ†å…­ï¼š	The thirty-one verses are divided into six parts:
['ZH_T35_1735_059:0950b22_16']	åˆåä¸€åˆç¸½é¡¯å ±å‹ã€æ¬¡ä¸‰åˆåˆ¥è®šç«¯åš´ã€ä¸‰æœ‰ä¸‰åˆæ˜å…¶çµ•å€«ã€å››æœ‰äº”åˆä¼èƒ½å…§æ»¿ã€äº”æœ‰å…«åˆé›¢éå…·å¾·ã€æœ«å¾Œä¸€åˆçµè®šæ‰€å®œã€‚	åˆåä¸€åˆç¸½é¡¯å ±å‹ã€æ¬¡ä¸‰åˆåˆ¥è®šç«¯åš´ã€ä¸‰æœ‰ä¸‰åˆæ˜å…¶çµ•å€«ã€å››æœ‰äº”åˆä¼èƒ½å…§æ»¿ã€äº”æœ‰å…«åˆé›¢éå…·å¾·ã€æœ«å¾Œä¸€åˆçµè®šæ‰€å®œã€‚	The first eleven verses generally show the excellence of the reward, the next three verses specifically praise the beauty, the third has three verses clarifying that she is unparalleled, the fourth has five verses on the fullness of inner skills and abilities, the fifth has eight verses on being free from faults and possessing virtues, and the last verse concludes by praising what is appropriate.
['ZH_T35_1735_059:0950b23_16']	å…­å¤ªå­é‡é‚€ï¼Œè¬‚è‹¥ä¸éšœé“ï¼Œç•¶éš¨æ±æ„ã€‚	å…­å¤ªå­é‡é‚€ï¼Œè¬‚è‹¥ä¸éšœé“ï¼Œç•¶éš¨æ±æ„ã€‚	The sixth is the prince's repeated invitation, saying that if she does not obstruct the path, he will follow her wishes.
['ZH_T35_1735_059:0950b24_6']	æ–¼ä¸­ï¼Œå…ˆé•·è¡Œï¼Œåˆ†äºŒï¼š	æ–¼ä¸­ï¼Œå…ˆé•·è¡Œï¼Œåˆ†äºŒï¼š	In this, first the prose section, divided into two parts:
['ZH_T35_1735_059:0950b25_3']	åˆè‡ªè¿°è¡Œæ·±ã€å¾Œã€Œç•¶æ–¼çˆ¾ã€ä¸‹æå…¶ç‚ºéšœã€‚	åˆè‡ªè¿°è¡Œæ·±ã€å¾Œã€Œç•¶æ–¼çˆ¾ã€ä¸‹æå…¶ç‚ºéšœã€‚	First, he describes his profound practice, and then at that time he fears it will be an obstruction.
['ZH_T35_1735_059:0950b25_12']	å¾Œåˆé Œï¼Œååˆåˆ†ä¸‰ï¼š	å¾Œåˆé Œï¼Œååˆåˆ†ä¸‰ï¼š	The later verse section, ten verses, is divided into three parts:
['ZH_T35_1735_059:0950b27_1']	åˆå…­åˆé Œå…¶è¡Œæ·±ã€æ¬¡äºŒé ŒåŠé‚€å…¶è«éšœã€å¾Œä¸€åˆåŠçµä»¤å¯©æ€ã€‚	åˆå…­åˆé Œå…¶è¡Œæ·±ã€æ¬¡äºŒé ŒåŠé‚€å…¶è«éšœã€å¾Œä¸€åˆåŠçµä»¤å¯©æ€ã€‚	The first six verses praise his profound practice, the next two and a half verses invite him not to obstruct, and the last one and a half verses conclude by urging him to carefully consider.
['ZH_T35_1735_059:0950b27_7']	ä¸ƒå¥³æ•¬é †å¾ã€‚	ä¸ƒå¥³æ•¬é †å¾ã€‚	The seventh is the respectful obedience of the daughter.
['ZH_T35_1735_059:0950b27_15']	æœ‰åå››åˆï¼Œåˆ†ä¸‰ï¼š	æœ‰åå››åˆï¼Œåˆ†ä¸‰ï¼š	There are fourteen verses, divided into three parts:
['ZH_T35_1735_059:0950b28_2']	åˆä¸‰å¿˜è‹¦çœ·å¾·ï¼›	åˆä¸‰å¿˜è‹¦çœ·å¾·ï¼›	The first three forget suffering and cherish virtue;
['ZH_T35_1735_059:0950b28_17']	æ¬¡å…­å¸ŒåŒå‹è¡Œï¼Œå³æ­£æ˜¯ç™¼è©æå¿ƒï¼›	æ¬¡å…­å¸ŒåŒå‹è¡Œï¼Œå³æ­£æ˜¯ç™¼è©æå¿ƒï¼›	The next six are the same as the superior practices, which are precisely the arousing of the bodhi mind;
['ZH_T35_1735_059:0950b29_6']	å¾Œäº”å‹¸è©£å¦‚ä¾†ã€‚	å¾Œäº”å‹¸è©£å¦‚ä¾†ã€‚	The last five exhort to approach the TathÄgata.
['ZH_T35_1735_059:0950c01_1']	å…«å¤ªå­æ”å—ï¼Œç”±æ•¬ä½›å¿ƒæ­¡æ•…ã€‚	å…«å¤ªå­æ”å—ï¼Œç”±æ•¬ä½›å¿ƒæ­¡æ•…ã€‚	The eighth is the acceptance by the eight princes, because of the joy in the mind of respect for the Buddha;
['ZH_T35_1735_059:0950c01_13']	ä¹æ¯é™³æ…¶é‚ï¼Œæ•…é‡è®šå¥³å¾·ã€‚	ä¹æ¯é™³æ…¶é‚ï¼Œæ•…é‡è®šå¥³å¾·ã€‚	The ninth is the mother's expression of the fulfillment of her hopes, and thus she praises the woman's virtues again.
['ZH_T35_1735_059:0950c01_18']	ååˆåˆ†å››ï¼š	ååˆåˆ†å››ï¼š	The tenth is in verse, divided into four parts:
['ZH_T35_1735_059:0950c03_6']	åˆä¸€æ¨™å…¶é‚å¿—ã€æ¬¡äºŒå¾·è¡Œæ‡¸åŒã€æ¬¡å››èº«èªè¶…å€«ã€å¾Œä¸‰å…§å¿ƒè˜Šå¾·ã€‚	åˆä¸€æ¨™å…¶é‚å¿—ã€æ¬¡äºŒå¾·è¡Œæ‡¸åŒã€æ¬¡å››èº«èªè¶…å€«ã€å¾Œä¸‰å…§å¿ƒè˜Šå¾·ã€‚	The first one praises the fulfillment of her aspirations, the next two are that her virtues and practices are far the same, the next four are that her body and speech surpass others, and the last three are that her inner mind is replete with virtues.
['ZH_T35_1735_059:0950c03_12']	åæ­£å…±ä¿®è¡Œã€‚	åæ­£å…±ä¿®è¡Œã€‚	The tenth is the correct practice together.
['ZH_T35_1735_059:0950c03_17']	äº¦åˆ†åæ®µï¼š	äº¦åˆ†åæ®µï¼š	It is also divided into ten sections:
['ZH_T35_1735_059:0950c09_18']	ä¸€è©£ä½›ä¾›é¤Šã€äºŒã€Œæ™‚ä½›ã€ä¸‹èç¶“å¾—æ³•ã€ä¸‰ã€Œæ™‚å½¼å¤ªå­ã€ä¸‹è¾­æ­¸ç™½çˆ¶ã€å››ã€Œçˆ¾æ™‚å¤§ç‹ã€ä¸‹ç‹å¯©æ…¶èã€äº”ã€Œä½œæ˜¯å¿µã€ä¸‹ç¦ªä½å¾€è§€ã€å…­ã€Œçˆ¾æ™‚ã€ä¸‹èç¶“å¾—æ³•ã€ä¸ƒã€Œå…¶çœ¾æœƒäººã€ä¸‹å…¼ç›Šæ™‚æœƒã€å…«ã€Œæ™‚ä½›ã€ä¸‹ä½›é‡ç¾é€šã€ä¹ã€Œæ™‚å½¼çˆ¶ç‹ã€ä¸‹çˆ¶ç‹å‡ºå®¶ä¿®è­‰æ³•é–€ã€åã€Œçˆ¾æ™‚å¤ªå­ã€ä¸‹å¤ªå­ç´¹ä½å¼˜é€šå¤§åŒ–ã€‚	ä¸€è©£ä½›ä¾›é¤Šã€äºŒã€Œæ™‚ä½›ã€ä¸‹èç¶“å¾—æ³•ã€ä¸‰ã€Œæ™‚å½¼å¤ªå­ã€ä¸‹è¾­æ­¸ç™½çˆ¶ã€å››ã€Œçˆ¾æ™‚å¤§ç‹ã€ä¸‹ç‹å¯©æ…¶èã€äº”ã€Œä½œæ˜¯å¿µã€ä¸‹ç¦ªä½å¾€è§€ã€å…­ã€Œçˆ¾æ™‚ã€ä¸‹èç¶“å¾—æ³•ã€ä¸ƒã€Œå…¶çœ¾æœƒäººã€ä¸‹å…¼ç›Šæ™‚æœƒã€å…«ã€Œæ™‚ä½›ã€ä¸‹ä½›é‡ç¾é€šã€ä¹ã€Œæ™‚å½¼çˆ¶ç‹ã€ä¸‹çˆ¶ç‹å‡ºå®¶ä¿®è­‰æ³•é–€ã€åã€Œçˆ¾æ™‚å¤ªå­ã€ä¸‹å¤ªå­ç´¹ä½å¼˜é€šå¤§åŒ–ã€‚	First, making offerings to the Buddha; second, at that time hearing the sutra and attaining the Dharma; third, at that time the prince taking leave and returning to inform his father; fourth, at that time the great king the king rejoicing upon hearing the news; fifth, having this thought abdicating the throne and going to see; sixth, at that time hearing the sutra and attaining the Dharma; seventh, the assembly benefiting those present at the time; eighth, at that time the Buddha the Buddha manifesting supernatural powers again; ninth, at that time the prince's father the prince's father leaving home and cultivating the Dharma gate; tenth, at that time the prince the prince succeeding to the throne and widely promoting the great teaching.
