segmentnr	original	analyzed	translated
['ZH_T10_0294_003:0871b02_13']	æ™ºæ³¢ç¾…èœœï¼Œç„¡è‘—ç„¡è­·ï¼Œä¸€åˆ‡æ™ºé›†è«¸ç„¡è‘—åŠ©è©æåˆ†ï¼Œæ™ºæ…§æ˜äº†ï¼Œå…·å‹é€²åœ°ï¼Œæ·±å…¥ç”šæ·±æ™ºè¡Œå¢ƒç•Œï¼Œæ˜¯åæ™ºæ³¢ç¾…èœœã€‚	æ™ºæ³¢ç¾…èœœï¼Œç„¡è‘—ç„¡è­·ï¼Œä¸€åˆ‡æ™ºé›†è«¸ç„¡è‘—åŠ©è©æåˆ†ï¼Œæ™ºæ…§æ˜äº†ï¼Œå…·å‹é€²åœ°ï¼Œæ·±å…¥ç”šæ·±æ™ºè¡Œå¢ƒç•Œï¼Œæ˜¯åæ™ºæ³¢ç¾…èœœã€‚	The perfection of wisdom, free from attachment and protection, the accumulation of all wisdom and the factors of enlightenment that assist in becoming free from attachment, clear understanding with wisdom, endowed with the stage of superior progress, deeply entering the realm of wisdom and practice, is called the perfection of wisdom.
['ZH_T10_0294_003:0871b04_20']	æ™ºæ³¢ç¾…èœœï¼Œæ·±å…¥å¾®å¦™ï¼ŒçŸ¥æ³•æ€§æ³•æ™ºï¼Œæ”å—è«¸æ³•ï¼Œéš¨é †æ™ºæ…§ï¼Œå–„çŸ¥ç¦ç”°ï¼ŒåŠéç¦ç”°ï¼Œå¦‚å¯¦ä¹‹ç›¸ï¼Œæ˜¯åæ™ºæ³¢ç¾…èœœã€‚	æ™ºæ³¢ç¾…èœœï¼Œæ·±å…¥å¾®å¦™ï¼ŒçŸ¥æ³•æ€§æ³•æ™ºï¼Œæ”å—è«¸æ³•ï¼Œéš¨é †æ™ºæ…§ï¼Œå–„çŸ¥ç¦ç”°ï¼ŒåŠéç¦ç”°ï¼Œå¦‚å¯¦ä¹‹ç›¸ï¼Œæ˜¯åæ™ºæ³¢ç¾…èœœã€‚	The perfection of wisdom, deeply entering the subtle, knowing the nature of dharmas and the wisdom of dharmas, embracing all dharmas, in accordance with wisdom, well knowing the characteristics of the true field of blessings and what is not the field of blessings, is called the perfection of wisdom.
['ZH_T10_0294_003:0871b10_2']	è«¸å¦‚ä¾†æ™ºï¼Œè¶…å‡ºä¸‰ç•Œï¼Œäº†é”ä¸‰ä¸–ï¼Œå–„çŸ¥è©è–©ä¸€åˆ‡è¡Œæ¥­ï¼Œæ™®é›†çœ¾æ™ºï¼Œç„¡æ‰€ç½£ç¤™ï¼Œäº¦çŸ¥è©è–©æ­£æ™ºä½è™•æ‡‰ä¿®æ­£è¡Œï¼Œåˆå¾©å–„çŸ¥å¾åˆç™¼å¿ƒï¼Œè¶£å‘ä¸Šåœ°ï¼Œä»¥æ–¹ä¾¿å¿ƒï¼Œå–„çŸ¥è¿´å‘ï¼Œå–„çŸ¥è«¸æ³•å¦‚ã€æ¥­å¦‚ã€å ±å¦‚ã€å–„çŸ¥æ³•è¼ªå¦‚ï¼ŒçŸ¥æ³•è¼ªå¦‚ç›¸ï¼Œæ˜¯åæ™ºæ³¢ç¾…èœœã€‚	è«¸å¦‚ä¾†æ™ºï¼Œè¶…å‡ºä¸‰ç•Œï¼Œäº†é”ä¸‰ä¸–ï¼Œå–„çŸ¥è©è–©ä¸€åˆ‡è¡Œæ¥­ï¼Œæ™®é›†çœ¾æ™ºï¼Œç„¡æ‰€ç½£ç¤™ï¼Œäº¦çŸ¥è©è–©æ­£æ™ºä½è™•æ‡‰ä¿®æ­£è¡Œï¼Œåˆå¾©å–„çŸ¥å¾åˆç™¼å¿ƒï¼Œè¶£å‘ä¸Šåœ°ï¼Œä»¥æ–¹ä¾¿å¿ƒï¼Œå–„çŸ¥è¿´å‘ï¼Œå–„çŸ¥è«¸æ³•å¦‚ã€æ¥­å¦‚ã€å ±å¦‚ã€å–„çŸ¥æ³•è¼ªå¦‚ï¼ŒçŸ¥æ³•è¼ªå¦‚ç›¸ï¼Œæ˜¯åæ™ºæ³¢ç¾…èœœã€‚	The wisdom of the TathÄgatas transcends the three realms, comprehends the three times, well knows the various karmic activities of bodhisattvas, universally gathers all wisdoms, and is unobstructed. It also knows the abode of the correct wisdom of bodhisattvas where they should cultivate correct practices. Moreover, it well knows from the initial generation of the mind to advance to the upper grounds, with a skillful mind well knowing the dedications, well knowing the suchness of all dharmas, the suchness of karma, and the suchness of retribution. It well knows the suchness of the Dharma wheel and the characteristics of the suchness of the Dharma wheel. This is called the perfection of wisdom.
['ZH_T10_0294_003:0871b19_4_0']	å‹å¦™ç„¡è‘—ï¼Œæ”å—æ­£æ³•ï¼Œæ”å—æ­£æ³•è€…ï¼Œç¸½çŸ¥ä¸€åˆ‡	å‹å¦™ç„¡è‘—ï¼Œæ”å—æ­£æ³•ï¼Œæ”å—æ­£æ³•è€…ï¼Œç¸½çŸ¥ä¸€åˆ‡	Supreme and wondrous, unattached, embracing the true Dharma. Embracing the true Dharma means comprehensively knowing all
['ZH_T10_0294_003:0871b19_4_1']	æ³•ï¼Œç¸½çŸ¥ä¸€åˆ‡æ³•è€…ï¼ŒçŸ¥æ³•å¦‚ä¾†ï¼ŒçŸ¥æ³•å¦‚å»ï¼Œå–„	æ³•ï¼Œç¸½çŸ¥ä¸€åˆ‡æ³•è€…ï¼ŒçŸ¥æ³•å¦‚ä¾†ï¼ŒçŸ¥æ³•å¦‚å»ï¼Œå–„	dharmas. Comprehending all dharmas means knowing the TathÄgata of the Dharma, knowing the suchness of the Dharma, and well
['ZH_T10_0294_003:0871b19_4_2']	çŸ¥æ¥­æ¥­å¢ƒç•Œï¼Œå–„çŸ¥å‰å‰å¢ƒç•Œï¼Œå–„çŸ¥è«¸åŠ«ï¼Œå–„çŸ¥	çŸ¥æ¥­æ¥­å¢ƒç•Œï¼Œå–„çŸ¥å‰å‰å¢ƒç•Œï¼Œå–„çŸ¥è«¸åŠ«ï¼Œå–„çŸ¥	knowing karma, the realm of karma, well knowing the realms of lands, well knowing the various kalpas, wellğŸ”½knowing the wisdom of the three times, giving rise to the wisdom of the buddhas, knowing the wisdom of the buddhas and the correct wisdom, knowing the
['ZH_T10_0294_003:0871b19_4_3']	ä¸‰ä¸–æ™ºï¼Œå‡ºç”Ÿè«¸ä½›æ™ºï¼ŒçŸ¥ä½›æ™ºç­‰æ­£æ™ºï¼ŒçŸ¥è©è–©	ä¸‰ä¸–æ™ºï¼Œå‡ºç”Ÿè«¸ä½›æ™ºï¼ŒçŸ¥ä½›æ™ºç­‰æ­£æ™ºï¼ŒçŸ¥è©è–©	bodhisattvas
['ZH_T10_0294_003:0871b19_4_4']	æ™ºï¼ŒçŸ¥è©è–©æ™ºæ™ºï¼ŒçŸ¥è©è–©ä½æ™ºï¼ŒçŸ¥è©è–©åŠŸå¾·æ™º	æ™ºï¼ŒçŸ¥è©è–©æ™ºæ™ºï¼ŒçŸ¥è©è–©ä½æ™ºï¼ŒçŸ¥è©è–©åŠŸå¾·æ™º	The wisdom of knowing the wisdom of bodhisattvas, the wisdom of knowing the abodes of bodhisattvas, the wisdom of knowing the merits of bodhisattvas
['ZH_T10_0294_003:0871b19_4_5']	æ…§æ™ºï¼ŒçŸ¥è©è–©æ·¨å¿ƒè¿´å‘æ™ºï¼ŒçŸ¥è«¸å¤§é¡˜æ™ºï¼Œè½‰æ³•	æ…§æ™ºï¼ŒçŸ¥è©è–©æ·¨å¿ƒè¿´å‘æ™ºï¼ŒçŸ¥è«¸å¤§é¡˜æ™ºï¼Œè½‰æ³•	The wisdom of discernment, the wisdom of knowing the pure dedication of bodhisattvas, the wisdom of knowing the great vows, the wisdom of turning the Dharma
['ZH_T10_0294_003:0871b19_4_6']	è¼ªæ™ºï¼ŒçŸ¥åˆ†åˆ¥æ³•æ™ºï¼Œå…¥æ³•æµ·æ™ºï¼ŒçŸ¥æ–¹ä¾¿æµ·æ™ºï¼Œ	è¼ªæ™ºï¼ŒçŸ¥åˆ†åˆ¥æ³•æ™ºï¼Œå…¥æ³•æµ·æ™ºï¼ŒçŸ¥æ–¹ä¾¿æµ·æ™ºï¼Œ	wheel, the wisdom of knowing the discrimination of dharmas, the wisdom of entering the ocean of dharmas, the wisdom of knowing the ocean of skillful means,
['ZH_T10_0294_003:0871b19_4_7']	çŸ¥æ³•æ—‹æµé™€ç¾…å°¼æ™ºï¼ŒçŸ¥è«¸æ³•è‡³è¶£æ™ºï¼ŒçŸ¥å¦‚æ˜¯ç­‰	çŸ¥æ³•æ—‹æµé™€ç¾…å°¼æ™ºï¼ŒçŸ¥è«¸æ³•è‡³è¶£æ™ºï¼ŒçŸ¥å¦‚æ˜¯ç­‰	The wisdom of knowing the dhÄraá¹‡Ä« of the flowing current of dharmas, the wisdom of knowing the ultimate destinations of all dharmas, knowing such
['ZH_T10_0294_003:0871b19_4_8']	ä¸€åˆ‡æ™ºæ³¢ç¾…èœœï¼Œæ·±é ç„¡åº•ï¼Œå»£å¤§ç„¡é‚Šï¼Œç©¶ç«Ÿç„¡	ä¸€åˆ‡æ™ºæ³¢ç¾…èœœï¼Œæ·±é ç„¡åº•ï¼Œå»£å¤§ç„¡é‚Šï¼Œç©¶ç«Ÿç„¡	All these wisdoms of the pÄramitÄs are profound and bottomless, vast and boundless, ultimately
['ZH_T10_0294_003:0871b19_4_9']	éš›ã€‚	éš›ã€‚	Endless.
['ZH_T10_0294_003:0871b21_2']	å¦‚æ˜¯å‹æ™ºåæ³¢ç¾…èœœï¼Œæ–¼ä¸€æ¯›å­”çš†æ‚‰é¡¯ç¾ï¼Œä¸€åˆ‡æ¯›å­”ï¼Œçš†æ‚‰é¡¯ç¾è«¸è®ŠåŒ–èº«ï¼ŒåŒ–åº¦çœ¾ç”Ÿã€‚	å¦‚æ˜¯å‹æ™ºåæ³¢ç¾…èœœï¼Œæ–¼ä¸€æ¯›å­”çš†æ‚‰é¡¯ç¾ï¼Œä¸€åˆ‡æ¯›å­”ï¼Œçš†æ‚‰é¡¯ç¾è«¸è®ŠåŒ–èº«ï¼ŒåŒ–åº¦çœ¾ç”Ÿã€‚	Such supreme wisdom and the ten pÄramitÄs are all manifested in a single pore, and in all pores they manifest various transformed bodies to liberate sentient beings.
['ZH_T10_0294_003:0871c21_11_0']	åˆæ–¼ä¸€åˆ‡æ¯›å­”ï¼Œå‡ºç”Ÿç„¡é‡èº«é›²ï¼Œæ‰€è¬‚é˜¿è¿¦è†©å’	åˆæ–¼ä¸€åˆ‡æ¯›å­”ï¼Œå‡ºç”Ÿç„¡é‡èº«é›²ï¼Œæ‰€è¬‚é˜¿è¿¦è†©å’	Moreover, immeasurable clouds of bodies are produced from all pores, namely the clouds of bodies of Akaniá¹£á¹­ha
['ZH_T10_0294_003:0871c21_11_1']	å¤©èº«é›²ã€æ·¨å±…å¤©èº«é›²ã€å–„ç¾å¤©èº«é›²ã€ä¸ç†±å¤©èº«	å¤©èº«é›²ã€æ·¨å±…å¤©èº«é›²ã€å–„ç¾å¤©èº«é›²ã€ä¸ç†±å¤©èº«	Heaven, the clouds of bodies of ÅšuddhÄvÄsa Heaven, the clouds of bodies of SudarÅ›ana Heaven, the clouds of bodies of Avá¹›ha Heaven,
['ZH_T10_0294_003:0871c21_11_2', 'ZH_T10_0294_003:0871c21_11_3', 'ZH_T10_0294_003:0871c21_11_4', 'ZH_T10_0294_003:0871c21_11_5', 'ZH_T10_0294_003:0871c21_11_6', 'ZH_T10_0294_003:0871c21_11_7']	é›²ã€æœå¯¦å¤©èº«é›²ã€éæ·¨å¤©èº«é›²ã€ç„¡é‡æ·¨å¤©èº«é›²ğŸ”½ã€å°‘æ·¨å¤©èº«é›²ã€æ·¨æœå¤©èº«é›²ã€å»£æœå¤©èº«é›²ã€ç„¡ğŸ”½é‡æ·¨æœå¤©èº«é›²ã€å°‘æ·¨æœå¤©èº«é›²ã€å…‰éŸ³å¤©èº«é›²ã€ğŸ”½ç„¡é‡å…‰éŸ³å¤©èº«é›²ã€å°‘å…‰éŸ³å¤©èº«é›²ã€å¤§æ¢µå¤©èº«é›²ğŸ”½ã€æ¢µè¼”å¤©èº«é›²ã€æ¢µå¯Œæ¨“é‚£å¤©èº«é›²ã€æ¢µå¯Œæ¨“å‰é‚£ğŸ”½å¤©èº«é›²ã€æ¢µå°å¤©èº«é›²ã€æ¢µè‡ªåœ¨å¤©ç‹èº«é›²ã€ä»–åŒ–	é›²ã€æœå¯¦å¤©èº«é›²ã€éæ·¨å¤©èº«é›²ã€ç„¡é‡æ·¨å¤©èº«é›² ã€å°‘æ·¨å¤©èº«é›²ã€æ·¨æœå¤©èº«é›²ã€å»£æœå¤©èº«é›²ã€ç„¡ é‡æ·¨æœå¤©èº«é›²ã€å°‘æ·¨æœå¤©èº«é›²ã€å…‰éŸ³å¤©èº«é›²ã€ ç„¡é‡å…‰éŸ³å¤©èº«é›²ã€å°‘å…‰éŸ³å¤©èº«é›²ã€å¤§æ¢µå¤©èº«é›² ã€æ¢µè¼”å¤©èº«é›²ã€æ¢µå¯Œæ¨“é‚£å¤©èº«é›²ã€æ¢µå¯Œæ¨“å‰é‚£ å¤©èº«é›²ã€æ¢µå°å¤©èº«é›²ã€æ¢µè‡ªåœ¨å¤©ç‹èº«é›²ã€ä»–åŒ–	clouds of bodies of the gods of the Heaven of the Thirty-three, clouds of bodies of the gods of the Heaven of YÄma, clouds of bodies of the gods of the Heaven of Joy, clouds of bodies of the gods of the Heaven of Delighting in Emanations, clouds of bodies of the gods of the Heaven of Transforming Others' Emanations, clouds of bodies of the gods of the Heaven of the Four Kings, clouds of bodies of the gods of the Heaven of the Thirty-three, clouds of bodies of the gods of the Heaven of YÄma, clouds of bodies of the gods of the Heaven of Joy, clouds of bodies of the gods of the Heaven of Delighting in Emanations, clouds of bodies of the gods of the Heaven of Transforming Others' Emanations, clouds of bodies of the gods of the Heaven of the Four Kings, clouds of bodies of the gods of the Heaven of the Thirty-three, clouds of bodies of the gods of the Heaven of YÄma, clouds of bodies of the gods of the Heaven of Joy, clouds of bodies of the gods of the Heaven of Delighting in Emanations, clouds of bodies of the gods of the Heaven of Transforming Others' Emanations, clouds of bodies of the gods of the Heaven of the Four Kings, clouds of bodies of the gods of the Heaven of the Thirty-three, clouds of bodies of the gods of the Heaven of YÄma, clouds of bodies of the gods of the Heaven of Joy, clouds of bodies of the gods of the Heaven of Delighting in Emanations, clouds of bodies of the gods of the Heaven of Transforming Others' Emanations, clouds of bodies of the gods of the Heaven of the Four Kings, clouds of bodies of the gods of the Heaven of the Thirty-three, clouds of bodies of the gods of the Heaven of YÄma, clouds of bodies of the gods of the Heaven of Joy, clouds of bodies of the gods of the Heaven of Delighting in Emanations, clouds of bodies of the gods of the Heaven of Transforming Others' Emanations, clouds of bodies of the gods of the Heaven of the Four Kings, clouds of bodies of the gods of the Heaven of the Thirty-three, clouds of bodies of the gods of the Heaven of YÄma, clouds of bodies of the gods of the Heaven of Joy, clouds of bodies of the gods of the Heaven of Delighting in Emanations, clouds of bodies of the gods of the Heaven of Transforming Others' Emanations, clouds of bodies of
['ZH_T10_0294_003:0871c21_11_8', 'ZH_T10_0294_003:0871c21_11_9', 'ZH_T10_0294_003:0871c21_11_10']	è‡ªåœ¨å¤©ç‹åŠå…¶å¤©å­å¤©å¥³èº«é›²ã€åŒ–æ¨‚å¤©ç‹åŒ–æ¨‚å¤©ğŸ”½å­å¤©å¥³èº«é›²ã€å…œç‡é™€å¤©ç‹å…œç‡é™€å¤©å­å¤©å¥³èº«é›²ğŸ”½ã€ç‚æ‘©å¤©ç‹åŠå…¶å¤©å­å¤©å¥³èº«é›²ã€é‡‹ææ¡“å› å¤©ç‹	è‡ªåœ¨å¤©ç‹åŠå…¶å¤©å­å¤©å¥³èº«é›²ã€åŒ–æ¨‚å¤©ç‹åŒ–æ¨‚å¤©ğŸ”½å­å¤©å¥³èº«é›²ã€å…œç‡é™€å¤©ç‹å…œç‡é™€å¤©å­å¤©å¥³èº«é›²ğŸ”½ã€ç‚æ‘©å¤©ç‹åŠå…¶å¤©å­å¤©å¥³èº«é›²ã€é‡‹ææ¡“å› å¤©ç‹	clouds of bodies of the gods of the Heaven of the Thirty-three, clouds of bodies of the gods of the Heaven of YÄma, clouds of bodies of the gods of the Heaven of Joy, clouds of bodies of the gods of the Heaven of Delighting in Emanations, clouds of bodies of the gods of the Heaven of Transforming Others' Emanations, clouds of bodies of the gods of the Heaven of the Most Delightful, clouds of bodies of the gods of the Heaven of Universal Purity, clouds of bodies of the gods of the Heaven of Vast Fruit, clouds of bodies of the gods of the Heaven of Immeasurable Purity, clouds of bodies of the gods of the Heaven of Limited Purity, clouds of bodies of the gods of the Heaven of Pure Abode, clouds of bodies of the gods of the Heaven of the Highest, clouds of bodies of the gods of the Heaven of No Hardship, clouds of bodies of the gods of the Heaven of Great Fruition, clouds of bodies of the gods of the Heaven of Universal Brightness, clouds of bodies of the gods of the Heaven of Universal Purity, clouds of bodies of the gods of the Heaven of Universal Splendor, clouds of bodies of the gods of the Heaven of Universal Light, clouds of bodies of the gods of the Heaven of Universal Purity, clouds of bodies of the gods of the Heaven of Universal Radiance, clouds of bodies of the gods of the Heaven of Universal Purity, clouds of bodies of the gods of the Heaven of Universal Radiance, clouds of bodies of the gods of the Heaven of Universal Purity, clouds of bodies of the gods of the Heaven of Universal Radiance, clouds of bodies of the gods of the Heaven of Universal Purity, clouds of bodies of the gods of the Heaven of Universal Radiance, clouds of bodies of the gods of the Heaven of Universal Purity, clouds of bodies of the gods of the Heaven of Universal Radiance, clouds of bodies of the gods of the Heaven of Universal Purity, clouds of bodies of the gods of the Heaven of Universal Radiance, clouds of bodies of the gods of the Heaven of Universal Purity, clouds of bodies of the gods of the Heaven of Universal Radiance, clouds of bodies of the gods of the Heaven of Universal Purity, clouds of bodies of the gods of the Heaven of Universal Radiance, clouds of bodies of the gods of the Heaven of Universal Purity, clouds of bodies of the gods of the Heaven of Universal Radiance, clouds of bodies of the gods of the Heaven of Universal Purity, clouds of bodies of the gods
['ZH_T10_0294_003:0871c21_11_11', 'ZH_T10_0294_003:0871c21_11_12', 'ZH_T10_0294_003:0871c21_11_13']	åŠä¸‰åäºŒè¼”è‡£å¤©å­å¤©å¥³èº«é›²ã€æé ­è³´å’å¤©ç‹åŠğŸ”½å¤©å­å¤©å¥³çœ·å±¬ä¸€åˆ‡ä¹¾é—¥å©†ç”·å¥³èº«é›²ã€æ¯˜æ¨“å‹’å‰ğŸ”½å¤©ç‹åŠå…¶çœ·å±¬å¤©å­å¤©å¥³ä¸€åˆ‡é³©æ§ƒèŒ¶ç”·å¥³èº«é›²ã€	åŠä¸‰åäºŒè¼”è‡£å¤©å­å¤©å¥³èº«é›²ã€æé ­è³´å’å¤©ç‹åŠ å¤©å­å¤©å¥³çœ·å±¬ä¸€åˆ‡ä¹¾é—¥å©†ç”·å¥³èº«é›²ã€æ¯˜æ¨“å‹’å‰ å¤©ç‹åŠå…¶çœ·å±¬å¤©å­å¤©å¥³ä¸€åˆ‡é³©æ§ƒèŒ¶ç”·å¥³èº«é›²ã€	and the cloud-like bodies of the thirty-two assisting ministers, celestial sons, and celestial maidens, the celestial king Dhá¹›tarÄá¹£á¹­ra andğŸ”½his retinue of celestial sons, celestial maidens, and the bodies of all gandharva men and women, the celestial king VirÅ«á¸hakağŸ”½and his retinue of celestial sons, celestial maidens, and the bodies of all kumbhÄá¹‡á¸a men and women,
['ZH_T10_0294_003:0871c21_11_14', 'ZH_T10_0294_003:0871c21_11_15']	æ¯˜æ¨“åšå‰å¤©ç‹åŠå…¶çœ·å±¬å¤©å­å¤©å¥³ä¸€åˆ‡é¾ç”·å¥³èº«ğŸ”½é›²ã€æ¯˜æ²™é–€å¤©ç‹åŠå…¶çœ·å±¬å¤©å­å¤©å¥³ä¸€åˆ‡å¤œå‰ç”·	æ¯˜æ¨“åšå‰å¤©ç‹åŠå…¶çœ·å±¬å¤©å­å¤©å¥³ä¸€åˆ‡é¾ç”·å¥³èº« é›²ã€æ¯˜æ²™é–€å¤©ç‹åŠå…¶çœ·å±¬å¤©å­å¤©å¥³ä¸€åˆ‡å¤œå‰ç”·	the celestial king VirÅ«pÄká¹£a and his retinue of celestial sons, celestial maidens, and the bodies of all nÄga men and women,
['ZH_T10_0294_003:0871c21_11_16']	å¥³èº«é›²ã€ç·Šé‚£ç¾…ç‹åŠä¸€åˆ‡ç·Šé‚£ç¾…ç”·å¥³èº«é›²ã€æ‘©	å¥³èº«é›²ã€ç·Šé‚£ç¾…ç‹åŠä¸€åˆ‡ç·Šé‚£ç¾…ç”·å¥³èº«é›²ã€æ‘©	the celestial king VaiÅ›ravaá¹‡a and his retinue of celestial sons, celestial maidens, and the bodies of all yaká¹£a men and women, the kiá¹ƒnara kings and the bodies of all kiá¹ƒnara men and women,
['ZH_T10_0294_003:0871c21_11_17', 'ZH_T10_0294_003:0871c21_11_18']	çºç¾…ä¼½ç‹åŠä¸€åˆ‡æ‘©çºç¾…ä¼½ç”·å¥³èº«é›²ã€è¿¦æ¨“ç¾…ç‹ğŸ”½åŠä¸€åˆ‡è¿¦æ¨“ç¾…ç”·å¥³èº«é›²ã€é˜¿ä¿®ç¾…ç‹åŠä¸€åˆ‡é˜¿ä¿®	çºç¾…ä¼½ç‹åŠä¸€åˆ‡æ‘©çºç¾…ä¼½ç”·å¥³èº«é›²ã€è¿¦æ¨“ç¾…ç‹ åŠä¸€åˆ‡è¿¦æ¨“ç¾…ç”·å¥³èº«é›²ã€é˜¿ä¿®ç¾…ç‹åŠä¸€åˆ‡é˜¿ä¿®	the mahoraga kings and the bodies of all mahoraga men and women, the garuá¸a kings
['ZH_T10_0294_003:0871c21_11_19']	ç¾…ç”·å¥³èº«é›²ã€é–»ç¾…ç‹åŠä¸€åˆ‡é–»ç¾…ç‹ç”·å¥³èº«é›²ï¼Œ	ç¾…ç”·å¥³èº«é›²ã€é–»ç¾…ç‹åŠä¸€åˆ‡é–»ç¾…ç‹ç”·å¥³èº«é›²ï¼Œ	and the bodies of all garuá¸a men and women, the asura kings and the bodies of all asura men and women, the Yama kings and the bodies of all Yama men and women,
['ZH_T10_0294_003:0871c21_11_20']	å¹¶åŠåœ°ç„æƒ¡è¶£èº«é›²ã€äººç‹èº«é›²ã€ç”·å¥³èº«é›²ã€ç«¥	å¹¶åŠåœ°ç„æƒ¡è¶£èº«é›²ã€äººç‹èº«é›²ã€ç”·å¥³èº«é›²ã€ç«¥	and the cloud-like bodies of the evil destinies of hell, the cloud-like bodies of human kings, the cloud-like bodies of men and women,
['ZH_T10_0294_003:0871c21_11_21']	ç”·ç«¥å¥³èº«é›²ï¼Œå‡ºå¦‚æ˜¯ç­‰ä¸€åˆ‡è«¸è¶£èº«é›²ï¼Œè²èè¾Ÿ	ç”·ç«¥å¥³èº«é›²ï¼Œå‡ºå¦‚æ˜¯ç­‰ä¸€åˆ‡è«¸è¶£èº«é›²ï¼Œè²èè¾Ÿ	the cloud-like bodies of young men and young women, issuing forth such cloud-like bodies from all destinies, the cloud-like bodies of Å›rÄvakas,
['ZH_T10_0294_003:0871c21_11_22']	æ”¯ä½›ä»™äººèº«é›²ã€åœ°ç¥ã€æ°´ç¥ã€ç«ç¥ã€é¢¨ç¥ã€æµ·	æ”¯ä½›ä»™äººèº«é›²ã€åœ°ç¥ã€æ°´ç¥ã€ç«ç¥ã€é¢¨ç¥ã€æµ·	pratyekabuddhas, and sages, the earth gods, water gods, fire gods, wind gods, ocean
['ZH_T10_0294_003:0871c21_11_23']	ç¥ã€æ²³ç¥ã€å±±æ—ã€æ¨¹ç¥ã€ç©€ç¥ã€å‘³ç¥ã€è—¥è‰ç¥	ç¥ã€æ²³ç¥ã€å±±æ—ã€æ¨¹ç¥ã€ç©€ç¥ã€å‘³ç¥ã€è—¥è‰ç¥	gods, river gods, mountain forest tree gods, grain gods, taste gods, medicinal herb
['ZH_T10_0294_003:0871c21_11_24']	ã€åœ’è§€ç¥ã€æ³‰æµ·ç¥ã€åŸéƒ­ç¥ã€é“å ´ç¥ã€å¤œç¥ã€	ã€åœ’è§€ç¥ã€æ³‰æµ·ç¥ã€åŸéƒ­ç¥ã€é“å ´ç¥ã€å¤œç¥ã€	gods, garden grove gods, spring ocean gods, city wall gods, enlightenment site gods, night gods,
['ZH_T10_0294_003:0871c21_11_25']	æ™ç¥ã€è™›ç©ºç¥ã€æ–¹ç¥ã€é“ç¥ã€èº«å½¢ç¥ã€æ—¥ç²¾ç¥	æ™ç¥ã€è™›ç©ºç¥ã€æ–¹ç¥ã€é“ç¥ã€èº«å½¢ç¥ã€æ—¥ç²¾ç¥	day gods, space gods, direction gods, path gods, bodily form gods, sun spirit
['ZH_T10_0294_003:0871c21_11_26', 'ZH_T10_0294_003:0871c21_11_27']	ã€è«¸é­‘é­…ç¥ã€é‡‘å‰›åŠ›å£«ç¥ã€æ­¥è¡Œç¥ï¼Œå¦‚æ˜¯ç­‰ä¸€ğŸ”½åˆ‡ç¥èº«é›²ï¼Œæ™®éåæ–¹ä¸€åˆ‡ä¸–ç•Œï¼Œç‚ºæ³•ç•Œç­‰ä¸€åˆ‡	ã€è«¸é­‘é­…ç¥ã€é‡‘å‰›åŠ›å£«ç¥ã€æ­¥è¡Œç¥ï¼Œå¦‚æ˜¯ç­‰ä¸€ åˆ‡ç¥èº«é›²ï¼Œæ™®éåæ–¹ä¸€åˆ‡ä¸–ç•Œï¼Œç‚ºæ³•ç•Œç­‰ä¸€åˆ‡	gods, all kinds of demon gods, vajra warrior gods, walking gods, such as these
['ZH_T10_0294_003:0871c21_11_28']	çœ¾ç”Ÿï¼Œç¾å–œè¦‹èº«ã€‚	çœ¾ç”Ÿï¼Œç¾å–œè¦‹èº«ã€‚	all kinds of god-body clouds, pervading the worlds of the ten directions, for the sake of all sentient beings equal to the dharma realm, manifesting bodies that are delightful to behold.
['ZH_T10_0294_003:0871c28_7']	çˆ¾æ™‚å–œç›®è§€å¯Ÿçœ¾ç”Ÿå¤œå¤©ï¼Œå¾åˆç™¼å¿ƒï¼Œæ‰€è¡ŒåŠŸå¾·ï¼Œç©é›†ç„¡é‡è«¸æ³¢ç¾…èœœï¼Œæ¬¡ç¬¬å—ç”Ÿï¼Œæ­»æ­¤ç”Ÿå½¼ï¼Œè¼ªè½‰äº”é“ï¼ŒåŠå…¶åè™Ÿï¼Œè¦ªè¿‘å–„çŸ¥è­˜ï¼Œå€¼é‡è«¸ä½›ï¼Œè¦ªè¿‘ä¾›é¤Šï¼ŒèæŒæ­£æ³•ï¼Œè¡Œè©è–©è¡Œï¼Œå¿ƒç„¡ç½£ç¤™å¾—è«¸ä¸‰æ˜§ï¼Œæ¬¡ç¬¬è§€è¦‹ä¸€åˆ‡è«¸ä½›ï¼Œè‰²èº«ç›¸å¥½ï¼Œè¦‹è«¸ä½›å‰ï¼ŒåŠè¦‹è«¸åŠ«æ¬¡ç¬¬æˆå£ï¼Œå¾—æ·¨æ™ºæ…§ï¼Œæ·±å…¥æ³•ç•Œï¼Œè§€å¯Ÿçœ¾ç”Ÿï¼ŒçŸ¥çœ¾ç”Ÿæµ·ï¼Œæ­»æ­¤ç”Ÿå½¼ï¼›	çˆ¾æ™‚å–œç›®è§€å¯Ÿçœ¾ç”Ÿå¤œå¤©ï¼Œå¾åˆç™¼å¿ƒï¼Œæ‰€è¡ŒåŠŸå¾·ï¼Œç©é›†ç„¡é‡è«¸æ³¢ç¾…èœœï¼Œæ¬¡ç¬¬å—ç”Ÿï¼Œæ­»æ­¤ç”Ÿå½¼ï¼Œè¼ªè½‰äº”é“ï¼ŒåŠå…¶åè™Ÿï¼Œè¦ªè¿‘å–„çŸ¥è­˜ï¼Œå€¼é‡è«¸ä½›ï¼Œè¦ªè¿‘ä¾›é¤Šï¼ŒèæŒæ­£æ³•ï¼Œè¡Œè©è–©è¡Œï¼Œå¿ƒç„¡ç½£ç¤™å¾—è«¸ä¸‰æ˜§ï¼Œæ¬¡ç¬¬è§€è¦‹ä¸€åˆ‡è«¸ä½›ï¼Œè‰²èº«ç›¸å¥½ï¼Œè¦‹è«¸ä½›å‰ï¼ŒåŠè¦‹è«¸åŠ«æ¬¡ç¬¬æˆå£ï¼Œå¾—æ·¨æ™ºæ…§ï¼Œæ·±å…¥æ³•ç•Œï¼Œè§€å¯Ÿçœ¾ç”Ÿï¼ŒçŸ¥çœ¾ç”Ÿæµ·ï¼Œæ­»æ­¤ç”Ÿå½¼ï¼›	At that time, the night spirit Joyful Eyes Observing Sentient Beings, from her initial generation of the mind of enlightenment, the merit she practiced, accumulating immeasurable perfections, the order in which she took rebirth, dying here and being born there, transmigrating through the five destinies, her names, the good and virtuous friends she associated with, the buddhas she encountered, the offerings she made to them, the true Dharma she upheld, the bodhisattva practices she carried out, her unobstructed mind, the various samÄdhis she attained, the order in which she saw all buddhas, their physical characteristics and marks, the buddha lands she saw, and the order in which the kalpas were formed and destroyed, she attained pure wisdom, deeply penetrated the dharma realm, observed sentient beings, and knew the ocean of sentient beings dying here and being born there;
