segmentnr	original	analyzed	translated
['ZH_T29_1562_009:0377a24_0']	é˜¿æ¯˜é”ç£¨é †æ­£ç†è«–å·ç¬¬ä¹	é˜¿æ¯˜é”ç£¨é †æ­£ç†è«–å·ç¬¬ä¹	Abhidharma-nyÄyÃ¢nusÄra Å›Ästra, fascicle 9
['ZH_T29_1562_009:0377a26_0']	å°Šè€…çœ¾è³¢é€ 	å°Šè€…çœ¾è³¢é€ 	Composed by Ä€rya-saá¹ƒghabhadra
['ZH_T29_1562_009:0377a27_0']	ä¸‰è—æ³•å¸«ç„å¥˜å¥‰ã€€è©”è­¯	ä¸‰è—æ³•å¸«ç„å¥˜å¥‰ã€€è©”è­¯	Translated by Tripiá¹­aka Master Xuanzang on imperial command
['ZH_T29_1562_009:0377a29_17']	2 è¾¯å·®åˆ¥å“1 ä¸€è¾¯å·®åˆ¥å“ç¬¬äºŒä¹‹ä¸€å¦‚æ˜¯å› ç•Œå·²åˆ—è«¸æ ¹ï¼Œä»Šæ–¼æ­¤ä¸­æ‡‰æ›´æ€æ“‡ï¼š	2 è¾¯å·®åˆ¥å“1 ä¸€è¾¯å·®åˆ¥å“ç¬¬äºŒä¹‹ä¸€å¦‚æ˜¯å› ç•Œå·²åˆ—è«¸æ ¹ï¼Œä»Šæ–¼æ­¤ä¸­æ‡‰æ›´æ€æ“‡ï¼š	Chapter 1: Distinguishing Differences, Part 1 of 2. Having listed the faculties in this way, one should now contemplate further:
['ZH_T29_1562_009:0377b01_7']	ä¸–å°Šä½•æ•…åˆ¥èªªæ ¹åï¼Ÿ	ä¸–å°Šä½•æ•…åˆ¥èªªæ ¹åï¼Ÿ	Why did the World-Honored One separately speak of the name of faculties?
['ZH_T29_1562_009:0377b02_15']	åœ¨å…§ç•Œå…¨åŠæ³•ä¸€åˆ†ï¼Œä¾å¢ä¸Šç¾©åˆ¥èªªç‚ºæ ¹ï¼Œå½¼å½¼äº‹ä¸­å¾—å¢ä¸Šæ•…ã€‚	åœ¨å…§ç•Œå…¨åŠæ³•ä¸€åˆ†ï¼Œä¾å¢ä¸Šç¾©åˆ¥èªªç‚ºæ ¹ï¼Œå½¼å½¼äº‹ä¸­å¾—å¢ä¸Šæ•…ã€‚	The entire internal realms and one part of the dharma realms are separately spoken of as faculties based on the meaning of predominance, because they attain predominance in each matter.
['ZH_T29_1562_009:0377b03_6']	æ­¤å¢ä¸Šç¾©ï¼Œç•Œç¾©é¡¯æˆã€‚	æ­¤å¢ä¸Šç¾©ï¼Œç•Œç¾©é¡¯æˆã€‚	This meaning of predominance clarifies the meaning of realms.
['ZH_T29_1562_009:0377b04_14']	ç•Œè¬‚ä¼Šåœ°æˆ–è¬‚å¿åœ°ï¼Œæœ€å‹è‡ªåœ¨æ˜¯ä¼Šåœ°ç¾©ï¼Œç…§ç¼æ˜äº†æ˜¯å¿åœ°ç¾©ã€‚	ç•Œè¬‚ä¼Šåœ°æˆ–è¬‚å¿åœ°ï¼Œæœ€å‹è‡ªåœ¨æ˜¯ä¼Šåœ°ç¾©ï¼Œç…§ç¼æ˜äº†æ˜¯å¿åœ°ç¾©ã€‚	Realm means Ä«Å›vara or ká¹£etra, the meaning of Ä«Å›vara is supreme and sovereign, the meaning of ká¹£etra is illuminating and clear.
['ZH_T29_1562_009:0377b06_3']	å”¯æ­¤ç†¾ç››å…‰é¡¯åæ ¹ï¼Œæ­¤æ„ç¸½ç¤ºäºŒåäºŒæ ¹ï¼Œæ–¼è«¸èšä¸­ä½œç”¨å¢ä¸Šã€‚	å”¯æ­¤ç†¾ç››å…‰é¡¯åæ ¹ï¼Œæ­¤æ„ç¸½ç¤ºäºŒåäºŒæ ¹ï¼Œæ–¼è«¸èšä¸­ä½œç”¨å¢ä¸Šã€‚	Only this flourishing and manifest is called a faculty. This meaning generally indicates the twenty-two faculties, whose function is predominant in various aggregates.
['ZH_T29_1562_009:0377b08_21']	è«¸æ³•ç›¸æœ›å„å„åˆ¥æœ‰å¢ä¸Šç”¨æ•…ï¼Œæ‡‰ä¸¦åæ ¹ï¼Œæ­¤æ¥µå¢ä¸Šï¼Œåˆ¥èªªç¾©æˆï¼Œå¦‚å¸«å­ç‹åŠæ‘é‚‘é•·ã€è½‰è¼ªç‹ç­‰ï¼Œæ–¼ç¸ã€æ‘é‚‘ã€å››å¤§æ´²ç­‰æ¥µå¢ä¸Šæ•…ã€‚	è«¸æ³•ç›¸æœ›å„å„åˆ¥æœ‰å¢ä¸Šç”¨æ•…ï¼Œæ‡‰ä¸¦åæ ¹ï¼Œæ­¤æ¥µå¢ä¸Šï¼Œåˆ¥èªªç¾©æˆï¼Œå¦‚å¸«å­ç‹åŠæ‘é‚‘é•·ã€è½‰è¼ªç‹ç­‰ï¼Œæ–¼ç¸ã€æ‘é‚‘ã€å››å¤§æ´²ç­‰æ¥µå¢ä¸Šæ•…ã€‚	Because each of the dharmas has a superior function with regard to the others, all should be called roots. However, only the most superior are given the name. This is like the lion king, the head of a village, or a universal monarch, who are the most superior among animals, villages, and the four continents, respectively.
['ZH_T29_1562_009:0377b09_9']	æ­¤æ¥µå¢ä¸Šï¼Œèª°æœ›æ–¼èª°ï¼Ÿ	æ­¤æ¥µå¢ä¸Šï¼Œèª°æœ›æ–¼èª°ï¼Ÿ	With regard to what are these superior functions?
['ZH_T29_1562_009:0377b09_12']	é Œæ›°ï¼š	é Œæ›°ï¼š	The verse states:
['ZH_T29_1562_009:0377b10_0']	å‚³èªªäº”æ–¼å››ï¼Œã€€ã€€å››æ ¹æ–¼äºŒç¨®ï¼Œ	å‚³èªªäº”æ–¼å››ï¼Œã€€ã€€å››æ ¹æ–¼äºŒç¨®ï¼Œ	It is said that the five are superior to the four, and the four roots are superior to the two kinds.
['ZH_T29_1562_009:0377b11_13']	äº”å…«æŸ“æ·¨ä¸­ï¼Œã€€ã€€å„åˆ¥ç‚ºå¢ä¸Šã€‚	äº”å…«æŸ“æ·¨ä¸­ï¼Œã€€ã€€å„åˆ¥ç‚ºå¢ä¸Šã€‚	The five and the eight are superior in the defiled and pure realms, respectively.
['ZH_T29_1562_009:0377b12_2']	è«–æ›°ï¼š	è«–æ›°ï¼š	The treatise states:
['ZH_T29_1562_009:0377b12_15']	éä¸€åˆ‡æ ¹ç¸½æ–¼ä¸€äº‹ç‚ºæ¥µå¢ä¸Šã€‚	éä¸€åˆ‡æ ¹ç¸½æ–¼ä¸€äº‹ç‚ºæ¥µå¢ä¸Šã€‚	Not all faculties are the most superior with regard to a single thing.
['ZH_T29_1562_009:0377b14_9']	çœ¼ç­‰äº”æ ¹å„æ–¼å››äº‹æœ‰å¢ä¸Šç”¨ï¼Œä¸€èŠåš´èº«ã€äºŒå°é¤Šèº«ã€ä¸‰ç”Ÿè­˜ç­‰ã€å››ä¸å…±äº‹ã€‚	çœ¼ç­‰äº”æ ¹å„æ–¼å››äº‹æœ‰å¢ä¸Šç”¨ï¼Œä¸€èŠåš´èº«ã€äºŒå°é¤Šèº«ã€ä¸‰ç”Ÿè­˜ç­‰ã€å››ä¸å…±äº‹ã€‚	The five faculties such as the eye each have a superior function with regard to four things: 1) adorning the body, 2) nourishing the body, 3) producing consciousness, etc., and 4) unique functions.
['ZH_T29_1562_009:0377b15_7']	èŠåš´èº«è€…ï¼Œè¬‚äº”æ ¹ä¸­éš¨é—•ä¸€æ ¹èº«é†œé™‹æ•…ã€‚	èŠåš´èº«è€…ï¼Œè¬‚äº”æ ¹ä¸­éš¨é—•ä¸€æ ¹èº«é†œé™‹æ•…ã€‚	As for adorning the body, it means that if any one of the five faculties is missing, the body is ugly.
['ZH_T29_1562_009:0377b16_11']	å°é¤Šèº«è€…ï¼Œè¬‚å› è¦‹èé¿éšªé›£æ•…ï¼ŒåŠæ–¼æ®µé£Ÿèƒ½å—ç”¨æ•…ã€‚	å°é¤Šèº«è€…ï¼Œè¬‚å› è¦‹èé¿éšªé›£æ•…ï¼ŒåŠæ–¼æ®µé£Ÿèƒ½å—ç”¨æ•…ã€‚	As for nourishing the body, it means that based on seeing and hearing, one avoids danger and difficulty, and is able to enjoy material food.
['ZH_T29_1562_009:0377b17_6']	é¦™å‘³è§¸ä¸‰çš†æˆæ®µé£Ÿï¼Œå¦‚æœ‰é Œè¨€ï¼š	é¦™å‘³è§¸ä¸‰çš†æˆæ®µé£Ÿï¼Œå¦‚æœ‰é Œè¨€ï¼š	The three of smell, taste, and touch are all categorized as food by mouthfuls. As a verse says:
['ZH_T29_1562_009:0377b18_0']	ã€Œè­¬å¦‚æ˜çœ¼äººï¼Œã€€ã€€èƒ½é¿ç¾éšªé›£ï¼Œ	ã€Œè­¬å¦‚æ˜çœ¼äººï¼Œã€€ã€€èƒ½é¿ç¾éšªé›£ï¼Œ	Just as a person with clear eyes can avoid present dangers,
['ZH_T29_1562_009:0377b19_13']	ä¸–æœ‰è°æ˜è€…ï¼Œã€€ã€€èƒ½é›¢ç•¶è‹¦æƒ¡ã€‚	ä¸–æœ‰è°æ˜è€…ï¼Œã€€ã€€èƒ½é›¢ç•¶è‹¦æƒ¡ã€‚	In the world, there are those who are wise and can avoid future suffering and evil.
['ZH_T29_1562_009:0377b20_0']	å¤šèèƒ½çŸ¥æ³•ï¼Œã€€ã€€å¤šèèƒ½é›¢ç½ªï¼Œ	å¤šèèƒ½çŸ¥æ³•ï¼Œã€€ã€€å¤šèèƒ½é›¢ç½ªï¼Œ	The learned can understand the Dharma, the learned can avoid wrongdoing,
['ZH_T29_1562_009:0377b21_13']	å¤šèæ¨ç„¡ç¾©ï¼Œã€€ã€€å¤šèå¾—æ¶…æ§ƒã€‚	å¤šèæ¨ç„¡ç¾©ï¼Œã€€ã€€å¤šèå¾—æ¶…æ§ƒã€‚	The learned abandon what is meaningless, the learned attain nirvana.
['ZH_T29_1562_009:0377b22_0']	ã€Œèº«ç”±é£Ÿä½ï¼Œã€€ã€€å‘½è¨—é£Ÿå­˜ï¼Œã€€ã€€é£Ÿå·²ä»¤å¿ƒï¼Œ	ã€Œèº«ç”±é£Ÿä½ï¼Œã€€ã€€å‘½è¨—é£Ÿå­˜ï¼Œã€€ã€€é£Ÿå·²ä»¤å¿ƒï¼Œ	The body depends on food for existence, life depends on food for preservation, after eating, it causes the mind to
['ZH_T29_1562_009:0377b23_4']	é©æ‚…å®‰æ³°ã€‚	é©æ‚…å®‰æ³°ã€‚	be comfortable and at ease.
['ZH_T29_1562_009:0377b25_3']	ã€ç”Ÿè­˜ç­‰è€…ï¼Œè¬‚ç™¼äº”è­˜åŠç›¸æ‡‰æ³•ï¼Œéš¨æ‰€ä¾æ ¹æœ‰æ˜æ˜§æ•…ã€‚	ã€ç”Ÿè­˜ç­‰è€…ï¼Œè¬‚ç™¼äº”è­˜åŠç›¸æ‡‰æ³•ï¼Œéš¨æ‰€ä¾æ ¹æœ‰æ˜æ˜§æ•…ã€‚	As for producing consciousness, etc., it refers to producing the five consciousnesses and their associated dharmas, because the clarity or obscurity of the consciousnesses depends on the faculties that support them.
['ZH_T29_1562_009:0377b26_2']	ä¸å…±äº‹è€…ï¼Œè¬‚å–è‡ªå¢ƒï¼Œè¦‹èå—…ç”è¦ºåˆ¥å¢ƒæ•…ã€‚	ä¸å…±äº‹è€…ï¼Œè¬‚å–è‡ªå¢ƒï¼Œè¦‹èå—…ç”è¦ºåˆ¥å¢ƒæ•…ã€‚	The unique function refers to apprehending its own object, because it sees, hears, smells, tastes, and cognizes its own object.
['ZH_T29_1562_009:0377b26_5']	æœ‰èªªï¼š	æœ‰èªªï¼š	Some say:
['ZH_T29_1562_009:0377b27_14']	çœ¼è€³æ–¼èƒ½å®ˆè­·ç”Ÿèº«æ³•èº«ï¼Œå¦‚å…¶æ¬¡ç¬¬æœ‰å¢ä¸Šç”¨ï¼Œå‰äºŒä¼½ä»–å³ç‚ºæ­¤è­‰ã€‚	çœ¼è€³æ–¼èƒ½å®ˆè­·ç”Ÿèº«æ³•èº«ï¼Œå¦‚å…¶æ¬¡ç¬¬æœ‰å¢ä¸Šç”¨ï¼Œå‰äºŒä¼½ä»–å³ç‚ºæ­¤è­‰ã€‚	The eye and ear have a dominant influence in protecting the body born of the elements and the Dharma body, respectively, in that order. The first two verses are evidence for this.
['ZH_T29_1562_009:0377b27_17']	æœ‰èªªï¼š	æœ‰èªªï¼š	Some say:
['ZH_T29_1562_009:0377b29_7']	çœ¼è€³ä¿±èƒ½å®ˆè­·ç”Ÿæ³•äºŒèº«ï¼Œè¦ªè¿‘å–„å£«ã€è½èæ­£æ³•ï¼Œçœ¼è€³å„ç‚ºä¸€å¢ä¸Šæ•…ã€‚	çœ¼è€³ä¿±èƒ½å®ˆè­·ç”Ÿæ³•äºŒèº«ï¼Œè¦ªè¿‘å–„å£«ã€è½èæ­£æ³•ï¼Œçœ¼è€³å„ç‚ºä¸€å¢ä¸Šæ•…ã€‚	The eyes and ears each have a dominant influence on two things: the eye and ear each have a dominant influence on the preservation of the two bodies, the physical body and the Dharma body, because they enable one to approach good people and listen to the true Dharma.
['ZH_T29_1562_009:0377c01_2']	å¥³ç”·å‘½æ„å„æ–¼äºŒäº‹æœ‰å¢ä¸Šç”¨ã€‚	å¥³ç”·å‘½æ„å„æ–¼äºŒäº‹æœ‰å¢ä¸Šç”¨ã€‚	The female, male, life, and mind faculties each have a dominant influence on two things.
['ZH_T29_1562_009:0377c02_1']	ä¸”å¥³ç”·æ ¹äºŒå¢ä¸Šè€…ï¼Œä¸€æœ‰æƒ…ç•°ã€äºŒåˆ†åˆ¥ç•°ã€‚	ä¸”å¥³ç”·æ ¹äºŒå¢ä¸Šè€…ï¼Œä¸€æœ‰æƒ…ç•°ã€äºŒåˆ†åˆ¥ç•°ã€‚	As for the two dominant influences of the female and male faculties, the first is the difference in sentient beings, and the second is the difference in discrimination.
['ZH_T29_1562_009:0377c03_9']	æœ‰æƒ…ç•°è€…ï¼ŒåŠ«åˆæœ‰æƒ…å½¢é¡çš†ç­‰ï¼ŒäºŒæ ¹ç”Ÿå·²ä¾¿æœ‰å¥³ç”·å½¢é¡å·®åˆ¥ã€‚	æœ‰æƒ…ç•°è€…ï¼ŒåŠ«åˆæœ‰æƒ…å½¢é¡çš†ç­‰ï¼ŒäºŒæ ¹ç”Ÿå·²ä¾¿æœ‰å¥³ç”·å½¢é¡å·®åˆ¥ã€‚	As for the difference in sentient beings, in the beginning of the eon, the forms and types of sentient beings were all the same. After the two faculties appeared, there were distinctions in the forms and types of females and males.
['ZH_T29_1562_009:0377c04_8']	åˆ†åˆ¥ç•°è€…ï¼Œé€²æ­¢è¨€éŸ³ä¹³æˆ¿é«»ç­‰å®‰å¸ƒå·®åˆ¥ã€‚	åˆ†åˆ¥ç•°è€…ï¼Œé€²æ­¢è¨€éŸ³ä¹³æˆ¿é«»ç­‰å®‰å¸ƒå·®åˆ¥ã€‚	As for the difference in discrimination, there are distinctions in the postures, speech, breasts, hair buns, etc. of females and males.
['ZH_T29_1562_009:0377c04_11']	æœ‰èªªï¼š	æœ‰èªªï¼š	Some say:
['ZH_T29_1562_009:0377c05_16']	å‹‡æ€¯æœ‰å·®åˆ¥æ•…åæœ‰æƒ…ç•°ï¼Œè¡£æœèŠåš´æœ‰å·®åˆ¥æ•…ååˆ†åˆ¥ç•°ã€‚	å‹‡æ€¯æœ‰å·®åˆ¥æ•…åæœ‰æƒ…ç•°ï¼Œè¡£æœèŠåš´æœ‰å·®åˆ¥æ•…ååˆ†åˆ¥ç•°ã€‚	Because there are differences in courage and fear, it is called the difference in sentient beings. Because there are differences in clothing and adornments, it is called the difference in discrimination.
['ZH_T29_1562_009:0377c05_19']	æœ‰èªªï¼š	æœ‰èªªï¼š	Some say:
['ZH_T29_1562_009:0377c08_1']	æ­¤æ–¼æŸ“æ·¨äºŒå“æœ‰å¢ä¸ŠåŠ›ï¼Œæ•…è¨€æ–¼äºŒå—ä¸å¾‹å„€èµ·ç„¡é–“æ¥­ã€æ–·å–„æ ¹æ•…ï¼Œåæ–¼æŸ“å“æœ‰å¢ä¸ŠåŠ›ï¼›	æ­¤æ–¼æŸ“æ·¨äºŒå“æœ‰å¢ä¸ŠåŠ›ï¼Œæ•…è¨€æ–¼äºŒå—ä¸å¾‹å„€èµ·ç„¡é–“æ¥­ã€æ–·å–„æ ¹æ•…ï¼Œåæ–¼æŸ“å“æœ‰å¢ä¸ŠåŠ›ï¼›	This has a dominant influence on both defiled and pure categories, therefore it is said that it has a dominant influence on the reception of unwholesome disciplines and the performance of uninterrupted evil deeds, and the severing of wholesome roots, which is called having a dominant influence on the defiled category;
['ZH_T29_1562_009:0377c09_5']	èƒ½å—å¾‹å„€ã€å…¥é“å¾—æœåŠé›¢æ¬²æ•…ï¼Œåæ–¼æ·¨å“æœ‰å¢ä¸ŠåŠ›ã€‚	èƒ½å—å¾‹å„€ã€å…¥é“å¾—æœåŠé›¢æ¬²æ•…ï¼Œåæ–¼æ·¨å“æœ‰å¢ä¸ŠåŠ›ã€‚	Because it can receive precepts, enter the path, attain the fruit, and be free from desire, it is said to have superior power in the pure category.
['ZH_T29_1562_009:0377c09_14']	æ‰‡æ‹ç­‰èº«ç„¡å¦‚æ˜¯äº‹ã€‚	æ‰‡æ‹ç­‰èº«ç„¡å¦‚æ˜¯äº‹ã€‚	The bodies of eunuchs and so forth do not have such things.
['ZH_T29_1562_009:0377c11_10']	å‘½æ ¹æ–¼äºŒæœ‰å¢ä¸Šè€…ï¼Œè¬‚ç”±æ­¤æ•…æ–½è¨­è«¸æ ¹åŠæ ¹å·®åˆ¥ï¼Œç”±æ­¤æœ‰å½¼æœ‰ã€æ­¤ç„¡å½¼ç„¡æ•…ã€‚	å‘½æ ¹æ–¼äºŒæœ‰å¢ä¸Šè€…ï¼Œè¬‚ç”±æ­¤æ•…æ–½è¨­è«¸æ ¹åŠæ ¹å·®åˆ¥ï¼Œç”±æ­¤æœ‰å½¼æœ‰ã€æ­¤ç„¡å½¼ç„¡æ•…ã€‚	As for the life faculty having superior power in two ways, it is said that because of this, the various faculties and distinctions among faculties are established. Because when this exists, they exist; when this does not exist, they do not exist.
['ZH_T29_1562_009:0377c13_1']	æˆ–æ–¼çœ¾åŒåˆ†èƒ½çºŒåŠèƒ½æŒï¼Œæ–¼ç„¡è‰²ç•Œè¦æœ‰å‘½æ ¹ï¼Œæ–¹æœ‰æ‰€ç”Ÿè™•æ±ºå®šæ•…ã€‚	æˆ–æ–¼çœ¾åŒåˆ†èƒ½çºŒåŠèƒ½æŒï¼Œæ–¼ç„¡è‰²ç•Œè¦æœ‰å‘½æ ¹ï¼Œæ–¹æœ‰æ‰€ç”Ÿè™•æ±ºå®šæ•…ã€‚	Or, in the formless realm, there must be the life faculty in order for the place of rebirth to be determined.
['ZH_T29_1562_009:0377c13_19']	å½¼èµ·è‡ªåœ°å–„æŸ“æ±¡å¿ƒæˆ–èµ·é¤˜å¿ƒï¼Œéå‘½çµ‚æ•…ã€‚	å½¼èµ·è‡ªåœ°å–„æŸ“æ±¡å¿ƒæˆ–èµ·é¤˜å¿ƒï¼Œéå‘½çµ‚æ•…ã€‚	Because it gives rise to wholesome or defiled minds of its own realm, or gives rise to other minds, but not because of death.
['ZH_T29_1562_009:0377c15_1']	æ„æ ¹æ–¼äºŒæœ‰å¢ä¸Šè€…ï¼Œè¬‚èƒ½çºŒå¾Œæœ‰åŠè‡ªåœ¨éš¨è¡Œã€‚	æ„æ ¹æ–¼äºŒæœ‰å¢ä¸Šè€…ï¼Œè¬‚èƒ½çºŒå¾Œæœ‰åŠè‡ªåœ¨éš¨è¡Œã€‚	As for the mental faculty having superior power in two ways, it is said that it can continue subsequent existence and can freely follow.
['ZH_T29_1562_009:0377c15_16']	èƒ½çºŒå¾Œæœ‰è€…ï¼Œå¦‚ä¸–å°Šå‘Šé˜¿é›£é™€è¨€ï¼š	èƒ½çºŒå¾Œæœ‰è€…ï¼Œå¦‚ä¸–å°Šå‘Šé˜¿é›£é™€è¨€ï¼š	As for being able to continue subsequent existence, it is as the World-Honored One told Ä€nanda:
['ZH_T29_1562_009:0377c16_14', 'ZH_T29_1562_009:0377c16_17']	è­˜è‹¥ä¸å…¥æ¯èƒä¸­è€…ï¼Œç²¾è¡€å¾—æˆç¾¯å‰Œè—ä¸ï¼ŸğŸ”½ä¸ä¹Ÿã€‚	è­˜è‹¥ä¸å…¥æ¯èƒä¸­è€…ï¼Œç²¾è¡€å¾—æˆç¾¯å‰Œè—ä¸ï¼Ÿ ä¸ä¹Ÿã€‚	If consciousness does not enter the mother's womb, can semen and blood form the kalala?
['ZH_T29_1562_009:0377c16_20']	ä¸–å°Šï¼	ä¸–å°Šï¼	No, World-Honored One!
['ZH_T29_1562_009:0377c17_4']	ä¹ƒè‡³å»£èªªã€‚	ä¹ƒè‡³å»£èªªã€‚	And so on, speaking in detail.
['ZH_T29_1562_009:0377c17_15']	è‡ªåœ¨éš¨è¡Œè€…ï¼Œå¦‚å¥‘ç¶“è¨€ï¼š	è‡ªåœ¨éš¨è¡Œè€…ï¼Œå¦‚å¥‘ç¶“è¨€ï¼š	As for freely following, as a sutra says:
['ZH_T29_1562_009:0377c18_0']	ã€Œå¿ƒèƒ½å°ä¸–é–“ï¼Œã€€ã€€å¿ƒèƒ½éæ”å—ï¼Œ	ã€Œå¿ƒèƒ½å°ä¸–é–“ï¼Œã€€ã€€å¿ƒèƒ½éæ”å—ï¼Œ	The mind can guide the world, the mind can universally accept,
['ZH_T29_1562_009:0377c19_13']	å¦‚æ˜¯å¿ƒä¸€æ³•ï¼Œã€€ã€€çš†è‡ªåœ¨éš¨è¡Œã€‚	å¦‚æ˜¯å¿ƒä¸€æ³•ï¼Œã€€ã€€çš†è‡ªåœ¨éš¨è¡Œã€‚	Thus, this one dharma of the mind, all freely follow it.
['ZH_T29_1562_009:0377c20_2']	ã€æœ‰èªªï¼š	ã€æœ‰èªªï¼š	Some say:
['ZH_T29_1562_009:0377c21_3']	æ„æ ¹æ–¼æŸ“æ·¨å“æœ‰å¢ä¸ŠåŠ›æ•…è¨€æ–¼äºŒï¼Œå¦‚å¥‘ç¶“è¨€ï¼š	æ„æ ¹æ–¼æŸ“æ·¨å“æœ‰å¢ä¸ŠåŠ›æ•…è¨€æ–¼äºŒï¼Œå¦‚å¥‘ç¶“è¨€ï¼š	The mental faculty has the power of predominance in both the defiled and pure categories, therefore it is said to be in both. As a scripture says:
['ZH_T29_1562_009:0377c22_2']	å¿ƒé›œæŸ“æ•…æœ‰æƒ…é›œæŸ“ï¼Œå¿ƒæ¸…æ·¨æ•…æœ‰æƒ…æ¸…æ·¨ã€‚	å¿ƒé›œæŸ“æ•…æœ‰æƒ…é›œæŸ“ï¼Œå¿ƒæ¸…æ·¨æ•…æœ‰æƒ…æ¸…æ·¨ã€‚	Because the mind is defiled, sentient beings are defiled; because the mind is purified, sentient beings are purified.
['ZH_T29_1562_009:0377c23_19']	æ¨‚ç­‰äº”å—ã€ä¿¡ç­‰å…«æ ¹ï¼Œæ–¼æŸ“æ·¨ä¸­æœ‰å¢ä¸ŠåŠ›ï¼Œè¬‚æ¨‚ç­‰äº”æ–¼æŸ“å¢ä¸Šï¼Œè²ªç­‰éš¨çœ æ‰€ä¾äº‹æ•…ã€‚	æ¨‚ç­‰äº”å—ã€ä¿¡ç­‰å…«æ ¹ï¼Œæ–¼æŸ“æ·¨ä¸­æœ‰å¢ä¸ŠåŠ›ï¼Œè¬‚æ¨‚ç­‰äº”æ–¼æŸ“å¢ä¸Šï¼Œè²ªç­‰éš¨çœ æ‰€ä¾äº‹æ•…ã€‚	The five faculties such as pleasure have the power of predominance in both defilement and purity. The five such as pleasure have the power of predominance in defilement, because they are the basis for the latent tendencies of craving, etc.
['ZH_T29_1562_009:0377c24_2']	æœ‰èªªï¼š	æœ‰èªªï¼š	Some say:
['ZH_T29_1562_009:0377c25_3']	æ­¤æ–¼æŸ“ã€æ·¨äºŒå“ä¿±æœ‰å¢ä¸Šï¼Œèªªç‚ºè€½å—œã€å‡ºé›¢ä¾æ•…ã€‚	æ­¤æ–¼æŸ“ã€æ·¨äºŒå“ä¿±æœ‰å¢ä¸Šï¼Œèªªç‚ºè€½å—œã€å‡ºé›¢ä¾æ•…ã€‚	These have the power of predominance in both the defiled and pure categories, because they are said to be the basis for indulgence and for renunciation.
['ZH_T29_1562_009:0377c25_24']	ã€æ¨‚æ•…å¿ƒå®šã€ã€ã€è‹¦ç‚ºä¿¡ä¾ã€ç­‰ï¼Œå¥‘ç¶“ä¸­èªªæ•…ã€‚	ã€æ¨‚æ•…å¿ƒå®šã€ã€ã€è‹¦ç‚ºä¿¡ä¾ã€ç­‰ï¼Œå¥‘ç¶“ä¸­èªªæ•…ã€‚	Because scriptures say, Because of pleasure, the mind is concentrated, and Suffering is the basis for faith, etc.
['ZH_T29_1562_009:0377c26_13']	ä¿¡ç­‰å…«æ ¹æ–¼æ·¨å¢ä¸Šï¼Œå¦‚å¥‘ç¶“èªªï¼š	ä¿¡ç­‰å…«æ ¹æ–¼æ·¨å¢ä¸Šï¼Œå¦‚å¥‘ç¶“èªªï¼š	The eight faculties such as faith have the power of predominance in purity, as a scripture says:
['ZH_T29_1562_009:0377c28_7']	æˆ‘è–å¼Ÿå­ï¼Œå…·ä¿¡ç‰†å¡¹ã€å…·å‹¤å‹¢åŠ›ã€å…·å¿µé˜²è¡›ï¼Œå¿ƒå®šè§£è„«ï¼Œæ…§ç‚ºåˆ€åŠï¼Œä¹ƒè‡³å»£èªªã€‚	æˆ‘è–å¼Ÿå­ï¼Œå…·ä¿¡ç‰†å¡¹ã€å…·å‹¤å‹¢åŠ›ã€å…·å¿µé˜²è¡›ï¼Œå¿ƒå®šè§£è„«ï¼Œæ…§ç‚ºåˆ€åŠï¼Œä¹ƒè‡³å»£èªªã€‚	Our holy disciples are endowed with the ramparts of faith, the power of diligence, the defense of mindfulness, the sword of wisdom in the liberation of mental concentration, and so on at length.
['ZH_T29_1562_009:0377c28_16']	æ­¤ä¸­å³æ”å¾Œä¸‰æ ¹æ•…ã€‚	æ­¤ä¸­å³æ”å¾Œä¸‰æ ¹æ•…ã€‚	Herein, the latter three faculties are included.
['ZH_T29_1562_009:0377c29_5']	å½¼æ–¼æ·¨å“å®šæœ‰å¢ä¸Šã€‚	å½¼æ–¼æ·¨å“å®šæœ‰å¢ä¸Šã€‚	Therefore, they definitely have predominance in the pure category.
['ZH_T29_1562_009:0377c29_10']	åˆå‚³èªªè¨€ï¼š	åˆå‚³èªªè¨€ï¼š	The initial transmission says:
['ZH_T29_1562_009:0377c29_15']	é¡¯æ¨‚å¾Œèªªã€‚	é¡¯æ¨‚å¾Œèªªã€‚	It is said that pleasure is manifested later.
['ZH_T29_1562_009:0378a01_1']	è¬‚æˆ–æœ‰èªªï¼š	è¬‚æˆ–æœ‰èªªï¼š	That is to say, some say:
['ZH_T29_1562_009:0378a02_15']	èƒ½å°é¤Šèº«ï¼Œéçœ¼ç­‰ç”¨ï¼Œæ˜¯è­˜å¢ä¸Šï¼Œè¦ç”±è«¸è­˜äº†é•é †å¢ƒï¼Œæ–¹èƒ½é¿éšªé›£åŠå—æ®µé£Ÿæ•…ã€‚	èƒ½å°é¤Šèº«ï¼Œéçœ¼ç­‰ç”¨ï¼Œæ˜¯è­˜å¢ä¸Šï¼Œè¦ç”±è«¸è­˜äº†é•é †å¢ƒï¼Œæ–¹èƒ½é¿éšªé›£åŠå—æ®µé£Ÿæ•…ã€‚	The function of consciousness, not that of the eye, etc., is predominant in guiding and nourishing the body, because one is able to avoid danger and accept material food only by means of the consciousnesses that perceive favorable and unfavorable objects.
['ZH_T29_1562_009:0378a05_3']	å³å½¼å¾©è¬‚èƒ½è¦‹è‰²ç­‰ä¸å…±åŠŸèƒ½äº¦éç•°è­˜ï¼Œæ•…ä¸å…±äº‹æ–¼çœ¼ç­‰æ ¹ï¼Œä¸å¯ç«‹ç‚ºåˆ¥å¢ä¸Šç”¨ï¼Œæ•…éç”±æ­¤çœ¼ç­‰æˆæ ¹ã€‚	å³å½¼å¾©è¬‚èƒ½è¦‹è‰²ç­‰ä¸å…±åŠŸèƒ½äº¦éç•°è­˜ï¼Œæ•…ä¸å…±äº‹æ–¼çœ¼ç­‰æ ¹ï¼Œä¸å¯ç«‹ç‚ºåˆ¥å¢ä¸Šç”¨ï¼Œæ•…éç”±æ­¤çœ¼ç­‰æˆæ ¹ã€‚	They also say that the unique function of seeing form, etc., is not different from consciousness, so the unique function cannot be established as a separate predominant activity for the faculties such as the eye. Therefore, the eye, etc., do not become faculties by means of this.
['ZH_T29_1562_009:0378a05_9']	è‹¥çˆ¾ï¼Œäº‘ä½•ï¼Ÿ	è‹¥çˆ¾ï¼Œäº‘ä½•ï¼Ÿ	If that is so, then what?
['ZH_T29_1562_009:0378a05_12']	é Œæ›°ï¼š	é Œæ›°ï¼š	The verse says:
['ZH_T29_1562_009:0378a06_0']	äº†è‡ªå¢ƒå¢ä¸Šï¼Œã€€ã€€ç¸½ç«‹æ–¼å…­æ ¹ï¼Œ	äº†è‡ªå¢ƒå¢ä¸Šï¼Œã€€ã€€ç¸½ç«‹æ–¼å…­æ ¹ï¼Œ	The six faculties are generally established based on the predominance of perceiving their own objects.
['ZH_T29_1562_009:0378a07_0']	å¾èº«ç«‹äºŒæ ¹ï¼Œã€€ã€€å¥³ç”·æ€§å¢ä¸Šï¼Œ	å¾èº«ç«‹äºŒæ ¹ï¼Œã€€ã€€å¥³ç”·æ€§å¢ä¸Šï¼Œ	Two faculties are established based on the body: the female and male faculties have predominance in gender.
