segmentnr	original	analyzed	translated
['ZH_T29_1562_009:0381c14_13']	ä¹å”¯ä¿®æ‰€æ–·ï¼Œã€€ã€€äº”ä¿®éä¸‰éã€‚	ä¹å”¯ä¿®æ‰€æ–·ï¼Œã€€ã€€äº”ä¿®éä¸‰éã€‚	Nine are only eliminated by cultivation, five are eliminated by cultivation and not by seeing, and three are neither.
['ZH_T29_1562_009:0381c15_2']	è«–æ›°ï¼š	è«–æ›°ï¼š	The treatise says:
['ZH_T29_1562_009:0381c15_12']	æ„å–œæ¨‚æ¨ï¼Œä¸€ä¸€é€šä¸‰ã€‚	æ„å–œæ¨‚æ¨ï¼Œä¸€ä¸€é€šä¸‰ã€‚	The faculties of thought, joy, pleasure, and indifference each have three types.
['ZH_T29_1562_009:0381c16_6']	æ†‚æ ¹å”¯é€šè¦‹ä¿®æ‰€æ–·ï¼Œéç„¡æ¼æ•…ã€‚	æ†‚æ ¹å”¯é€šè¦‹ä¿®æ‰€æ–·ï¼Œéç„¡æ¼æ•…ã€‚	The faculty of sorrow is only eliminated by seeing and cultivation, because it is not pure.
['ZH_T29_1562_009:0381c17_9']	ä¸ƒè‰²å‘½è‹¦ï¼Œå”¯ä¿®æ‰€æ–·ï¼Œæœ‰è‰²ç„¡æŸ“éå…­ç”Ÿæ•…ã€éç„¡æ¼æ•…ã€‚	ä¸ƒè‰²å‘½è‹¦ï¼Œå”¯ä¿®æ‰€æ–·ï¼Œæœ‰è‰²ç„¡æŸ“éå…­ç”Ÿæ•…ã€éç„¡æ¼æ•…ã€‚	The seven material faculties, life, and suffering are only eliminated by cultivation, because the material is not defiled, is not born from the six, is not pure.
['ZH_T29_1562_009:0381c18_12']	ä¿¡ç­‰äº”æ ¹ï¼Œæˆ–ä¿®æ‰€æ–·æˆ–éæ‰€æ–·ï¼Œé€šå–„æœ‰æ¼åŠç„¡æ¼æ•…ã€‚	ä¿¡ç­‰äº”æ ¹ï¼Œæˆ–ä¿®æ‰€æ–·æˆ–éæ‰€æ–·ï¼Œé€šå–„æœ‰æ¼åŠç„¡æ¼æ•…ã€‚	The five faculties such as faith are either eliminated by cultivation or are not eliminated, because they are good, contaminated, and pure.
['ZH_T29_1562_009:0381c19_11']	æœ€å¾Œä¸‰æ ¹å”¯éæ‰€æ–·ï¼Œçš†æ˜¯ç„¡æ¼ç„¡éæ³•æ•…ã€‚	æœ€å¾Œä¸‰æ ¹å”¯éæ‰€æ–·ï¼Œçš†æ˜¯ç„¡æ¼ç„¡éæ³•æ•…ã€‚	The last three faculties are only not eliminated, because they are all pure and without faults.
['ZH_T29_1562_009:0381c20_1']	è±ˆä¸è–é“äº¦æ‰€æ–·è€¶ï¼Ÿ	è±ˆä¸è–é“äº¦æ‰€æ–·è€¶ï¼Ÿ	Isn't the noble path also eliminated?
['ZH_T29_1562_009:0381c20_6']	å¦‚å¥‘ç¶“è¨€ï¼š	å¦‚å¥‘ç¶“è¨€ï¼š	As a sutra says:
['ZH_T29_1562_009:0381c21_4']	æ‡‰çŸ¥è–é“çŒ¶å¦‚èˆ¹ç­ï¼Œæ³•å°šæ‡‰æ–·ä½•æ³éæ³•ã€‚	æ‡‰çŸ¥è–é“çŒ¶å¦‚èˆ¹ç­ï¼Œæ³•å°šæ‡‰æ–·ä½•æ³éæ³•ã€‚	You should know that the noble path is like a boat or raft. Even the Dharma should be abandoned, let alone what is not Dharma.
['ZH_T29_1562_009:0381c22_7']	æ­¤éè¦‹ä¿®äºŒé“æ‰€æ–·ï¼Œå…¥ç„¡é¤˜ä¾æ¶…æ§ƒç•Œä½æ¨æ•…åæ–·ã€‚	æ­¤éè¦‹ä¿®äºŒé“æ‰€æ–·ï¼Œå…¥ç„¡é¤˜ä¾æ¶…æ§ƒç•Œä½æ¨æ•…åæ–·ã€‚	This is not eliminated by the two paths of seeing and cultivation, because it is abandoned when entering the state of nirvÄá¹‡a without remainder, and is therefore called eliminated.
['ZH_T29_1562_009:0381c23_15']	å·²èªªè«¸é–€ç¾©é¡å·®åˆ¥ï¼Œç•¶èªªåˆå¾—ç•°ç†Ÿè«¸æ ¹ï¼Œå¹¾ç•°ç†Ÿæ ¹ä½•ç•Œåˆå¾—ï¼Ÿ	å·²èªªè«¸é–€ç¾©é¡å·®åˆ¥ï¼Œç•¶èªªåˆå¾—ç•°ç†Ÿè«¸æ ¹ï¼Œå¹¾ç•°ç†Ÿæ ¹ä½•ç•Œåˆå¾—ï¼Ÿ	The differences in meanings and categories of the various aspects have already been explained. Next, we will explain the initial attainment of the faculties with retribution. How many faculties with retribution are initially attained in which realm?
['ZH_T29_1562_009:0381c24_14']	é ˆå•åˆå¾—ç•°ç†Ÿæ ¹è€…ï¼Œé®ç„¡æŸ“å¿ƒèƒ½çºŒç”Ÿæ•…ã€‚	é ˆå•åˆå¾—ç•°ç†Ÿæ ¹è€…ï¼Œé®ç„¡æŸ“å¿ƒèƒ½çºŒç”Ÿæ•…ã€‚	We must ask whether the first moment of the faculties that are results of retribution is obtained by one who is not yet free from desire. This is because it is impossible for a nondefiled mind to be reborn.
['ZH_T29_1562_009:0381c24_17']	é Œæ›°ï¼š	é Œæ›°ï¼š	A verse says:
['ZH_T29_1562_009:0381c25_0']	æ¬²èƒåµæ¿•ç”Ÿï¼Œã€€ã€€åˆå¾—äºŒç•°ç†Ÿï¼Œ	æ¬²èƒåµæ¿•ç”Ÿï¼Œã€€ã€€åˆå¾—äºŒç•°ç†Ÿï¼Œ	In the desire realm, those born from wombs, eggs, or moisture first obtain two faculties that are results of retribution.
['ZH_T29_1562_009:0381c26_13']	åŒ–ç”Ÿå…­ä¸ƒå…«ï¼Œã€€ã€€è‰²å…­ä¸Šå”¯å‘½ã€‚	åŒ–ç”Ÿå…­ä¸ƒå…«ï¼Œã€€ã€€è‰²å…­ä¸Šå”¯å‘½ã€‚	Those born supernaturally obtain six, seven, or eight. In the form realm, there are six. Above, there is only the faculty of life.
['ZH_T29_1562_009:0381c27_2']	è«–æ›°ï¼š	è«–æ›°ï¼š	The treatise says:
['ZH_T29_1562_009:0381c28_3']	æ¬²èƒã€åµã€æ¿•ç”Ÿåˆå—ç”Ÿä½ï¼Œå”¯å¾—èº«èˆ‡å‘½äºŒç•°ç†Ÿæ ¹ã€‚	æ¬²èƒã€åµã€æ¿•ç”Ÿåˆå—ç”Ÿä½ï¼Œå”¯å¾—èº«èˆ‡å‘½äºŒç•°ç†Ÿæ ¹ã€‚	Those born in the desire realm from wombs, eggs, or moisture first obtain only two faculties that are results of retribution, namely, the body and life faculties.
['ZH_T29_1562_009:0381c28_8']	è§€è¡Œè€…è¨€ï¼š	è§€è¡Œè€…è¨€ï¼š	YogÄcÄras say:
['ZH_T29_1562_009:0382a01_1']	æ­¤åˆç”Ÿä½äº¦æœ‰å…·å¾—çœ¼ç­‰ç¨®å­ï¼Œç„¶ä½†èº«æ ¹èƒ½ç”Ÿè‡ªè­˜ï¼Œçœ¼ç­‰ä¸çˆ¾ï¼Œæ•…å”¯èªªäºŒã€‚	æ­¤åˆç”Ÿä½äº¦æœ‰å…·å¾—çœ¼ç­‰ç¨®å­ï¼Œç„¶ä½†èº«æ ¹èƒ½ç”Ÿè‡ªè­˜ï¼Œçœ¼ç­‰ä¸çˆ¾ï¼Œæ•…å”¯èªªäºŒã€‚	At the moment of first birth, there are also seeds of the eye and other faculties, but only the body faculty can produce its own consciousness. The eye and other faculties cannot do so. Therefore, only two are mentioned.
['ZH_T29_1562_009:0382a02_1']	æˆ–ç”Ÿç›²ç­‰ï¼Œæ–¼çºŒç”Ÿæ™‚ç„¡çœ¼ç­‰æ ¹ï¼Œä½†æœ‰æ­¤äºŒã€‚	æˆ–ç”Ÿç›²ç­‰ï¼Œæ–¼çºŒç”Ÿæ™‚ç„¡çœ¼ç­‰æ ¹ï¼Œä½†æœ‰æ­¤äºŒã€‚	Or, when those born blind and others are reborn, they have only these two faculties, not the eye and other faculties.
['ZH_T29_1562_009:0382a02_6']	æ­¤è¨€éç†ã€‚	æ­¤è¨€éç†ã€‚	This statement is unreasonable.
['ZH_T29_1562_009:0382a02_11']	æ‰€ä»¥è€…ä½•ï¼Ÿ	æ‰€ä»¥è€…ä½•ï¼Ÿ	Why is it so?
['ZH_T29_1562_009:0382a04_1']	åˆçºŒç”Ÿæ™‚ç„¡äº”è­˜æ•…ï¼Œèˆ‰èƒåµæ¿•é¡¯é™¤åŒ–ç”Ÿï¼ŒåŒ–ç”Ÿè‰²æ ¹ç„¡æ¼¸èµ·æ•…ã€‚	åˆçºŒç”Ÿæ™‚ç„¡äº”è­˜æ•…ï¼Œèˆ‰èƒåµæ¿•é¡¯é™¤åŒ–ç”Ÿï¼ŒåŒ–ç”Ÿè‰²æ ¹ç„¡æ¼¸èµ·æ•…ã€‚	Because at the moment of first rebirth, there are no five consciousnesses. The phrase those born from wombs, eggs, or moisture is used to exclude those born supernaturally, because the material faculties of those born supernaturally do not arise gradually.
['ZH_T29_1562_009:0382a04_19']	æ­¤è¾¯ç•°ç†Ÿï¼Œä¸èªªæ„æ¨æ™‚å½¼å®šæŸ“éç•°ç†Ÿæ•…ã€‚	æ­¤è¾¯ç•°ç†Ÿï¼Œä¸èªªæ„æ¨æ™‚å½¼å®šæŸ“éç•°ç†Ÿæ•…ã€‚	This discussion is about results of retribution. It does not mention the mental faculty and the faculty of equanimity, because at that time, they are definitely defiled and not results of retribution.
['ZH_T29_1562_009:0382a05_13']	çˆ¾æ™‚äº¦å¾—ä¿¡ç­‰è«¸æ ¹ï¼Œéç•°ç†Ÿæ•…ã€‚	çˆ¾æ™‚äº¦å¾—ä¿¡ç­‰è«¸æ ¹ï¼Œéç•°ç†Ÿæ•…ã€‚	At that time, one also obtains the faculties of faith and so on, but because they are not retribution, they are not mentioned here.
['ZH_T29_1562_009:0382a07_3']	æ­¤ä¸­ä¸èªªç¾¯è³´è—ä½ï¼Œé›–å¾—è‰²ç­‰ç•°ç†Ÿç”Ÿæ³•è€Œé«”éæ ¹ï¼Œæ•…æ­¤ä¸èªªã€‚	æ­¤ä¸­ä¸èªªç¾¯è³´è—ä½ï¼Œé›–å¾—è‰²ç­‰ç•°ç†Ÿç”Ÿæ³•è€Œé«”éæ ¹ï¼Œæ•…æ­¤ä¸èªªã€‚	The stage of kalala is not mentioned here, because although one obtains dharmas that are retribution such as form, etc., their substance is not a faculty, and therefore they are not mentioned here.
['ZH_T29_1562_009:0382a08_11']	åŒ–ç”Ÿåˆä½å¾—å…­ä¸ƒå…«ï¼Œç„¡å½¢å¾—å…­ï¼Œå¦‚åŠ«åˆæ™‚ï¼Œå…­è¬‚çœ¼è€³é¼»èˆŒèº«å‘½ã€‚	åŒ–ç”Ÿåˆä½å¾—å…­ä¸ƒå…«ï¼Œç„¡å½¢å¾—å…­ï¼Œå¦‚åŠ«åˆæ™‚ï¼Œå…­è¬‚çœ¼è€³é¼»èˆŒèº«å‘½ã€‚	Those born supernaturally obtain six, seven, or eight faculties at the beginning, because those without sexual organs obtain six, like those at the beginning of the eon, namely, eye, ear, nose, tongue, body, and life.
['ZH_T29_1562_009:0382a09_1']	ä¸€å½¢å¾—ä¸ƒï¼Œå¦‚è«¸å¤©ç­‰ã€‚	ä¸€å½¢å¾—ä¸ƒï¼Œå¦‚è«¸å¤©ç­‰ã€‚	Those with one sexual organ obtain seven, like the celestials, etc.
['ZH_T29_1562_009:0382a09_15']	äºŒå½¢å¾—å…«ï¼Œæƒ¡è¶£å®¹æœ‰äºŒå½¢åŒ–ç”Ÿã€‚	äºŒå½¢å¾—å…«ï¼Œæƒ¡è¶£å®¹æœ‰äºŒå½¢åŒ–ç”Ÿã€‚	Those with two sexual organs obtain eight. It is possible for those in evil destinies to be born supernaturally with two sexual organs.
['ZH_T29_1562_009:0382a10_8']	è‰²åˆå¾—å…­ï¼Œå¦‚æ¬²åŒ–ç”Ÿç„¡å½¢è€…èªªã€‚	è‰²åˆå¾—å…­ï¼Œå¦‚æ¬²åŒ–ç”Ÿç„¡å½¢è€…èªªã€‚	Those born in the realm of form obtain six at the beginning, like those born supernaturally in the realm of desire who are without sexual organs.
['ZH_T29_1562_009:0382a11_16']	ä¸Šå”¯å‘½è€…ï¼Œè¬‚ç„¡è‰²ç•Œï¼Œå®šç”Ÿä¿±å‹æ•…åç‚ºä¸Šï¼Œå½¼åˆå”¯å¾—ç•°ç†Ÿå‘½æ ¹ã€‚	ä¸Šå”¯å‘½è€…ï¼Œè¬‚ç„¡è‰²ç•Œï¼Œå®šç”Ÿä¿±å‹æ•…åç‚ºä¸Šï¼Œå½¼åˆå”¯å¾—ç•°ç†Ÿå‘½æ ¹ã€‚	Those in the highest realm obtain only the life faculty. The realm of formlessness is called highest because it is superior to the other realms in terms of both samÄdhi and birth. Those born there initially obtain only the life faculty, which is retribution.
['ZH_T29_1562_009:0382a12_6']	ç”±æ­¤è­‰çŸ¥å‘½æ ¹å¯¦æœ‰ã€‚	ç”±æ­¤è­‰çŸ¥å‘½æ ¹å¯¦æœ‰ã€‚	This proves that the life faculty really exists.
['ZH_T29_1562_009:0382a13_1']	æ­¤è‹¥éæœ‰ï¼Œç‚ºå¾—ä½•æ ¹åç”Ÿç„¡è‰²ï¼Ÿ	æ­¤è‹¥éæœ‰ï¼Œç‚ºå¾—ä½•æ ¹åç”Ÿç„¡è‰²ï¼Ÿ	If it did not exist, what faculty would one obtain when one is born in the formless realm?
['ZH_T29_1562_009:0382a13_19']	éå–„æŸ“æ±¡åæ¥­æœç”Ÿï¼Œæœªå—å½¼ç”Ÿå®¹ç¾èµ·æ•…ã€‚	éå–„æŸ“æ±¡åæ¥­æœç”Ÿï¼Œæœªå—å½¼ç”Ÿå®¹ç¾èµ·æ•…ã€‚	It is not called born of action and retribution, because it is possible for it to appear in the present before one is born in that realm.
['ZH_T29_1562_009:0382a14_17']	åˆç•°ç†Ÿå¿ƒç„¡çºŒç”Ÿç†ï¼Œå”¯è¨±æŸ“å¿ƒèƒ½çºŒç”Ÿæ•…ã€‚	åˆç•°ç†Ÿå¿ƒç„¡çºŒç”Ÿç†ï¼Œå”¯è¨±æŸ“å¿ƒèƒ½çºŒç”Ÿæ•…ã€‚	Also, the reason is that a mind as retribution cannot be the cause of the first moment of consciousness in a new rebirth, because it is admitted that only a defiled mind can be the cause of rebirth.
['ZH_T29_1562_009:0382a15_16']	éå»æœªä¾†éæœ‰è«–è€…ï¼Œçˆ¾æ™‚ä¸‰ä¸–ç•°ç†Ÿçš†ç„¡ã€‚	éå»æœªä¾†éæœ‰è«–è€…ï¼Œçˆ¾æ™‚ä¸‰ä¸–ç•°ç†Ÿçš†ç„¡ã€‚	Those who maintain that past and future do not exist would have no retribution in the three time periods.
['ZH_T29_1562_009:0382a16_7']	ç•°ç†Ÿæ—¢ç„¡ï¼Œç”Ÿä¾ä½•èªªï¼Ÿ	ç•°ç†Ÿæ—¢ç„¡ï¼Œç”Ÿä¾ä½•èªªï¼Ÿ	If there is no retribution, what is the basis of birth?
['ZH_T29_1562_009:0382a17_5']	é›–é¦³å¦„è¨ˆä»¥ç«‹å·±å®—ï¼Œå¿…æ‡‰è¨±æœ‰ç”Ÿä¾å¯¦æ³•ã€‚	é›–é¦³å¦„è¨ˆä»¥ç«‹å·±å®—ï¼Œå¿…æ‡‰è¨±æœ‰ç”Ÿä¾å¯¦æ³•ã€‚	Even though they run wild in vain speculation to establish their own doctrines, they must admit that there is a real dharma that is the basis of birth.
['ZH_T29_1562_009:0382a18_4']	èªªç•°ç†Ÿæ ¹æœ€åˆå¾—å·²ï¼Œç•¶èªªæœ€å¾Œæ‰€æ»…è«¸æ ¹ã€‚	èªªç•°ç†Ÿæ ¹æœ€åˆå¾—å·²ï¼Œç•¶èªªæœ€å¾Œæ‰€æ»…è«¸æ ¹ã€‚	After discussing the faculties that are obtained first as retribution, we must discuss the faculties that are eliminated last.
['ZH_T29_1562_009:0382a18_13']	ä½•ç•Œæ­»æ™‚å¹¾æ ¹å¾Œæ»…ï¼Ÿ	ä½•ç•Œæ­»æ™‚å¹¾æ ¹å¾Œæ»…ï¼Ÿ	How many faculties are eliminated at death in the various realms?
['ZH_T29_1562_009:0382a18_16']	é Œæ›°ï¼š	é Œæ›°ï¼š	The verses of Vasubandhu say:
['ZH_T29_1562_009:0382a19_0']	æ­£æ­»æ»…è«¸æ ¹ï¼Œã€€ã€€ç„¡è‰²ä¸‰è‰²å…«ï¼Œ	æ­£æ­»æ»…è«¸æ ¹ï¼Œã€€ã€€ç„¡è‰²ä¸‰è‰²å…«ï¼Œ	At death, all the faculties cease. In the formless realm, three cease. In the realm of form, eight cease.
['ZH_T29_1562_009:0382a20_13']	æ¬²é “åä¹å…«ï¼Œã€€ã€€æ¼¸å››å–„å¢äº”ã€‚	æ¬²é “åä¹å…«ï¼Œã€€ã€€æ¼¸å››å–„å¢äº”ã€‚	In the desire realm, nineteen or eight cease suddenly. Four cease gradually. The good faculties increase by five.
['ZH_T29_1562_009:0382a21_2']	è«–æ›°ï¼š	è«–æ›°ï¼š	The commentary explains:
['ZH_T29_1562_009:0382a22_1']	ä¸”èªªæŸ“æ±¡åŠç„¡è¨˜å¿ƒæ­£å‘½çµ‚æ™‚æ ¹æ»…å¤šå°‘ã€‚	ä¸”èªªæŸ“æ±¡åŠç„¡è¨˜å¿ƒæ­£å‘½çµ‚æ™‚æ ¹æ»…å¤šå°‘ã€‚	We now discuss the number of faculties that cease at death when the mind is defiled or indeterminate.
['ZH_T29_1562_009:0382a23_8']	è¬‚ç„¡è‰²ç•Œå°‡å‘½çµ‚æ™‚ï¼Œå‘½æ„æ¨ä¸‰æ–¼æœ€å¾Œæ»…ï¼Œç„¡è‰²å”¯æœ‰æ¨å—éé¤˜ã€‚	è¬‚ç„¡è‰²ç•Œå°‡å‘½çµ‚æ™‚ï¼Œå‘½æ„æ¨ä¸‰æ–¼æœ€å¾Œæ»…ï¼Œç„¡è‰²å”¯æœ‰æ¨å—éé¤˜ã€‚	That is, when one is about to die in the formless realm, the three faculties of life, thought, and indifference cease last. In the formless realm, there is only the feeling of indifference, not the others.
['ZH_T29_1562_009:0382a23_17']	åˆç„¡è‰²è¨€é®å½¼æœ‰è‰²ã€‚	åˆç„¡è‰²è¨€é®å½¼æœ‰è‰²ã€‚	Also, the term formless excludes the existence of form.
['ZH_T29_1562_009:0382a24_3']	æœ‰é¤˜å¸«èªªï¼š	æœ‰é¤˜å¸«èªªï¼š	Other masters say:
['ZH_T29_1562_009:0382a25_6']	å½¼æœ‰è‰²æ•…ï¼Œè‹¥ä¸èªªæœ‰å¯¦ç‰©å‘½æ ¹ï¼Œä½•ç•°ç†Ÿæ–·åç„¡è‰²æ­»ï¼Ÿ	å½¼æœ‰è‰²æ•…ï¼Œè‹¥ä¸èªªæœ‰å¯¦ç‰©å‘½æ ¹ï¼Œä½•ç•°ç†Ÿæ–·åç„¡è‰²æ­»ï¼Ÿ	Because they have form. If you do not admit that there is a real entity called life faculty, what is it that is destroyed to cause the death of beings in the formless realms?
['ZH_T29_1562_009:0382a26_14']	è‹¥è¨€ç•°ç†Ÿå››è˜Šæ–·æ•…å½¼åæ­»è€…ï¼Œå–„æŸ“æ±¡å¿ƒç¾åœ¨å‰ä½æ‡‰äº¦åæ­»ã€‚	è‹¥è¨€ç•°ç†Ÿå››è˜Šæ–·æ•…å½¼åæ­»è€…ï¼Œå–„æŸ“æ±¡å¿ƒç¾åœ¨å‰ä½æ‡‰äº¦åæ­»ã€‚	If you say that death is the destruction of the four aggregates that are retribution, then when good or soiled minds are present, there should be death.
['ZH_T29_1562_009:0382a27_17']	è‹¥è¨€å½¼åœ°æ‰€å—ç•°ç†ŸçŒ¶æœªç›¡è€…ï¼Œå¦‚ä½•ä¸å—è€Œæœ‰ç›¡æœŸï¼Ÿ	è‹¥è¨€å½¼åœ°æ‰€å—ç•°ç†ŸçŒ¶æœªç›¡è€…ï¼Œå¦‚ä½•ä¸å—è€Œæœ‰ç›¡æœŸï¼Ÿ	If you say that the retribution that is being experienced in those states has not yet ended, how can it be experienced without being ended?
['ZH_T29_1562_009:0382a28_16']	å–„æŸ“æ±¡å¿ƒç¾åœ¨å‰ä½ï¼Œç•¶è¨€å½¼å—ä½•æ¥­ç•°ç†Ÿï¼Ÿ	å–„æŸ“æ±¡å¿ƒç¾åœ¨å‰ä½ï¼Œç•¶è¨€å½¼å—ä½•æ¥­ç•°ç†Ÿï¼Ÿ	When good and soiled minds are present, what kind of retribution of action is being experienced?
['ZH_T29_1562_009:0382a29_6']	éä¸ç¾å‰å¯åç‚ºå—ã€‚	éä¸ç¾å‰å¯åç‚ºå—ã€‚	It cannot be said that it is experienced without being present.
['ZH_T29_1562_009:0382b02_1']	è‹¥è¬‚æ–¼å½¼ç•°ç†Ÿç¿’æ°£æ’éš¨è½‰æ•…åç‚ºå—è€…ï¼Œç†äº¦ä¸ç„¶ï¼Œæ‰€åŸ·ç¿’æ°£éæ¥µæˆæ•…ã€‚	è‹¥è¬‚æ–¼å½¼ç•°ç†Ÿç¿’æ°£æ’éš¨è½‰æ•…åç‚ºå—è€…ï¼Œç†äº¦ä¸ç„¶ï¼Œæ‰€åŸ·ç¿’æ°£éæ¥µæˆæ•…ã€‚	If you say that it is called experienced because the perfuming of retribution continues to evolve, this is not reasonable, because the perfuming that you cling to is not established.
['ZH_T29_1562_009:0382b02_16', 'ZH_T29_1562_009:0382b03_6']	å¤ªéå¤±æ•…ï¼Œç•°ç†Ÿé›–ç›¡ï¼Œç¿’æ°£éš¨æ•…ã€‚ğŸ”½å¦‚æ¥­ç¿’æ°£ï¼Œæ‡‰ç„¡æ­»æœŸã€‚	å¤ªéå¤±æ•…ï¼Œç•°ç†Ÿé›–ç›¡ï¼Œç¿’æ°£éš¨æ•…ã€‚ å¦‚æ¥­ç¿’æ°£ï¼Œæ‡‰ç„¡æ­»æœŸã€‚	It is an extreme fallacy to say that retribution ends but perfuming continues.ğŸ”½If, like action, perfuming has no period of ending,
['ZH_T29_1562_009:0382b04_4']	è‹¥ç•°ç†Ÿç›¡ç„¡ç¿’æ°£è€…ï¼Œæ¥­äº¦ä¸æ‡‰æœ‰é¤˜ç¿’æ°£ã€‚	è‹¥ç•°ç†Ÿç›¡ç„¡ç¿’æ°£è€…ï¼Œæ¥­äº¦ä¸æ‡‰æœ‰é¤˜ç¿’æ°£ã€‚	then retribution also should not have any perfuming that remains.
['ZH_T29_1562_009:0382b05_12']	è‹¥è¨€ç¿’æ°£æœ›ç¾ç•°ç†Ÿå¦‚æˆ‘å¾—è€…ï¼Œæ‡‰å¦‚æˆ‘å¾—ç•°ç†Ÿä¸èµ·ï¼Œç¿’æ°£å‰‡ç„¡ã€‚	è‹¥è¨€ç¿’æ°£æœ›ç¾ç•°ç†Ÿå¦‚æˆ‘å¾—è€…ï¼Œæ‡‰å¦‚æˆ‘å¾—ç•°ç†Ÿä¸èµ·ï¼Œç¿’æ°£å‰‡ç„¡ã€‚	If you say that the perfuming of the present life is like the attainment of a future retribution, then it should be like the attainment of a future retribution, which does not arise, and perfuming would not exist.
['ZH_T29_1562_009:0382b06_11']	åˆéç•°ç†Ÿç¿’æ°£éš¨è½‰åå—ç•°ç†Ÿï¼Œéå½¼æ€§æ•…ã€‚	åˆéç•°ç†Ÿç¿’æ°£éš¨è½‰åå—ç•°ç†Ÿï¼Œéå½¼æ€§æ•…ã€‚	Also, the perfuming of retribution is not called the experience of retribution as it evolves, because it is not of the nature of retribution.
['ZH_T29_1562_009:0382b07_6']	åˆæ±æ‰€åŸ·ç¿’æ°£ç†ç„¡ï¼Œå¾Œç•¶å»£è¾¯ã€‚	åˆæ±æ‰€åŸ·ç¿’æ°£ç†ç„¡ï¼Œå¾Œç•¶å»£è¾¯ã€‚	Also, the principle of perfuming that you hold does not exist, as will be extensively discussed later.
['ZH_T29_1562_009:0382b09_3']	æ•…å®šæ‡‰è¨±å¾çºŒç”Ÿå¿ƒè‡³å‘½çµ‚å¿ƒåˆ¥æœ‰å¯¦æ³•ï¼Œåç‚ºç•°ç†Ÿæ’ç›¸çºŒè½‰ï¼Œå½¼è‹¥æ–·æ™‚åç„¡è‰²æ­»ã€‚	æ•…å®šæ‡‰è¨±å¾çºŒç”Ÿå¿ƒè‡³å‘½çµ‚å¿ƒåˆ¥æœ‰å¯¦æ³•ï¼Œåç‚ºç•°ç†Ÿæ’ç›¸çºŒè½‰ï¼Œå½¼è‹¥æ–·æ™‚åç„¡è‰²æ­»ã€‚	Therefore, you must definitely admit that there is a real entity apart from the mind that continues in a series from the moment of rebirth until death, called retribution, that evolves in a continuous series. When it is cut off, it is called death in the formless realm.
['ZH_T29_1562_009:0382b10_12']	è‰²ç•Œæ­»æ™‚ï¼Œå…«æ ¹å¾Œæ»…ï¼Œè¬‚çœ¼ç­‰äº”åŠå‰ä¸‰æ ¹ï¼ŒåŒ–ç”Ÿç”Ÿæ­»æ ¹ç„¡ç¼ºæ•…ã€‚	è‰²ç•Œæ­»æ™‚ï¼Œå…«æ ¹å¾Œæ»…ï¼Œè¬‚çœ¼ç­‰äº”åŠå‰ä¸‰æ ¹ï¼ŒåŒ–ç”Ÿç”Ÿæ­»æ ¹ç„¡ç¼ºæ•…ã€‚	When one dies in the realm of form, the last eight faculties to cease are the five such as eyes, plus the former three faculties. Because there is no lack of faculties in the process of birth and death in the realm of form.
['ZH_T29_1562_009:0382b11_16', 'ZH_T29_1562_009:0382b12_6']	æ¬²é “æ­»æ™‚ï¼Œåä¹å…«æ»…ï¼ŒäºŒå½¢åæ»…ï¼Œè¬‚å¥³ç”·æ ¹åŠå‰èªªå…«ï¼›ğŸ”½ä¸€å½¢ä¹æ»…ï¼Œç„¡å½¢å…«æ»…ã€‚	æ¬²é “æ­»æ™‚ï¼Œåä¹å…«æ»…ï¼ŒäºŒå½¢åæ»…ï¼Œè¬‚å¥³ç”·æ ¹åŠå‰èªªå…«ï¼› ä¸€å½¢ä¹æ»…ï¼Œç„¡å½¢å…«æ»…ã€‚	When one dies suddenly in the realm of desire, the last to cease are the nineteen faculties, i.e., the eight mentioned above, plus the two sexual faculties.
['ZH_T29_1562_009:0382b13_10']	è‹¥æ¼¸æ­»æ™‚ï¼Œèº«å‘½æ„æ¨å››æ ¹å¾Œæ»…ï¼Œæ­¤å››å¿…ç„¡å‰å¾Œæ»…ç¾©ã€‚	è‹¥æ¼¸æ­»æ™‚ï¼Œèº«å‘½æ„æ¨å››æ ¹å¾Œæ»…ï¼Œæ­¤å››å¿…ç„¡å‰å¾Œæ»…ç¾©ã€‚	When one dies gradually, the last four to cease are the body, life, mind, and indifference faculties, because these four definitely do not cease in any order.
['ZH_T29_1562_009:0382b15_16']	è‹¥åœ¨ä¸‰ç•Œï¼Œå–„å¿ƒæ­»æ™‚ä¸€åˆ‡ä½ä¸­æ•¸å„å¢äº”ï¼Œå–„å¿ƒå¿…å…·ä¿¡ç­‰æ ¹æ•…ï¼Œè¬‚æ–¼ç„¡è‰²å¢è‡³å…«æ ¹ï¼Œä¹ƒè‡³æ¬²ç•Œæ¼¸çµ‚è‡³ä¹ã€‚	è‹¥åœ¨ä¸‰ç•Œï¼Œå–„å¿ƒæ­»æ™‚ä¸€åˆ‡ä½ä¸­æ•¸å„å¢äº”ï¼Œå–„å¿ƒå¿…å…·ä¿¡ç­‰æ ¹æ•…ï¼Œè¬‚æ–¼ç„¡è‰²å¢è‡³å…«æ ¹ï¼Œä¹ƒè‡³æ¬²ç•Œæ¼¸çµ‚è‡³ä¹ã€‚	If one dies with a good mind in the three realms, in all cases the number increases by five, because a good mind must possess the faculties of faith, etc. That is, in the formless realm, it increases to eight faculties, and so on up to the desire realm, where it gradually increases to nine.
['ZH_T29_1562_009:0382b16_2']	å¾©æ‡‰æ€æ“‡ï¼š	å¾©æ‡‰æ€æ“‡ï¼š	We must further investigate:
['ZH_T29_1562_009:0382b16_16']	äºŒåäºŒæ ¹ï¼Œå¹¾èƒ½è­‰å¾—ä½•æ²™é–€æœï¼Ÿ	äºŒåäºŒæ ¹ï¼Œå¹¾èƒ½è­‰å¾—ä½•æ²™é–€æœï¼Ÿ	How many of the twenty-two faculties can attain which fruits of the Å›ramaá¹‡a?
['ZH_T29_1562_009:0382b17_15']	é›–æ²™é–€æœï¼Œéæ ¹äº¦å¾—ï¼Œæ­¤è¾¯æ ¹æ•…ä½†å•è«¸æ ¹ã€‚	é›–æ²™é–€æœï¼Œéæ ¹äº¦å¾—ï¼Œæ­¤è¾¯æ ¹æ•…ä½†å•è«¸æ ¹ã€‚	Although the fruits of the Å›ramaá¹‡a are not attained only by the faculties, we ask about the faculties because we are discussing the faculties.
['ZH_T29_1562_009:0382b17_18']	é Œæ›°ï¼š	é Œæ›°ï¼š	A verse says:
['ZH_T29_1562_009:0382b18_0']	ä¹å¾—é‚ŠäºŒæœï¼Œã€€ã€€ä¸ƒå…«ä¹ä¸­äºŒï¼Œ	ä¹å¾—é‚ŠäºŒæœï¼Œã€€ã€€ä¸ƒå…«ä¹ä¸­äºŒï¼Œ	Nine attain the two extreme fruits, seven, eight, or nine attain the two middle fruits.
