segmentnr	original	analyzed	translated
['ZH_T29_1562_009:0380a28_10']	æ˜¯æ•…è‹¦æ¨‚å„åˆ†ç‚ºäºŒï¼Œä¸è‹¦ä¸æ¨‚å”¯ç«‹ä¸€æ ¹ã€‚	æ˜¯æ•…è‹¦æ¨‚å„åˆ†ç‚ºäºŒï¼Œä¸è‹¦ä¸æ¨‚å”¯ç«‹ä¸€æ ¹ã€‚	Therefore, pain and pleasure are each divided into two, and the feeling that is neither painful nor pleasant is established as only one faculty.
['ZH_T29_1562_009:0380a29_10']	å·²é‡‹æ¨‚ç­‰è«¸å—æ ¹é«”ï¼Œä¸‰ç„¡æ¼æ ¹ä»Šæ¬¡æ‡‰é‡‹ã€‚	å·²é‡‹æ¨‚ç­‰è«¸å—æ ¹é«”ï¼Œä¸‰ç„¡æ¼æ ¹ä»Šæ¬¡æ‡‰é‡‹ã€‚	The nature of the faculties of pleasure, etc., have been explained. The three pure faculties will now be explained.
['ZH_T29_1562_009:0380b01_8']	ä¸å¯ä¸€ä¸€åˆ¥èªªå…¶é«”ï¼Œæ‡‰å°±ä¸‰é“ä¾ä¹ç¸½ç«‹ã€‚	ä¸å¯ä¸€ä¸€åˆ¥èªªå…¶é«”ï¼Œæ‡‰å°±ä¸‰é“ä¾ä¹ç¸½ç«‹ã€‚	It is impossible to explain their natures individually. They should be established in general in the three paths in reliance on the nine faculties.
['ZH_T29_1562_009:0380b02_9']	æ„æ¨‚å–œæ¨ã€ä¿¡ç­‰äº”æ ¹ï¼Œæ­¤ä¹ä¸‰é“ä¸­å³æ˜¯ä¸‰ç„¡æ¼ã€‚	æ„æ¨‚å–œæ¨ã€ä¿¡ç­‰äº”æ ¹ï¼Œæ­¤ä¹ä¸‰é“ä¸­å³æ˜¯ä¸‰ç„¡æ¼ã€‚	The mind faculty, the feelings of pleasure, joy, and indifference, and the five faculties such as faith, these nine are the three pure faculties in the three paths.
['ZH_T29_1562_009:0380b03_17']	è¬‚åœ¨è¦‹é“ï¼Œæ„ç­‰ä¹æ³•å³æ˜¯æœªçŸ¥ç•¶çŸ¥æ ¹é«”ï¼ŒæœªçŸ¥ç•¶çŸ¥è¡Œç›¸è½‰æ•…ã€‚	è¬‚åœ¨è¦‹é“ï¼Œæ„ç­‰ä¹æ³•å³æ˜¯æœªçŸ¥ç•¶çŸ¥æ ¹é«”ï¼ŒæœªçŸ¥ç•¶çŸ¥è¡Œç›¸è½‰æ•…ã€‚	That is, in the path of insight, the nine dharmas such as the mind faculty are the substance of the faculty of understanding that which has not been understood, because they operate with the mode of activity of understanding that which has not been understood.
['ZH_T29_1562_009:0380b05_16']	è‹¥åœ¨ä¿®é“ï¼Œæ„ç­‰ä¹æ³•å³æ˜¯ç¬¬äºŒå·²çŸ¥æ ¹é«”ï¼Œç‚ºæ¬²æ–·é™¤é¤˜éš¨çœ æ•…ï¼Œæ–¼å·²çŸ¥å¢ƒæ•¸å¾©äº†çŸ¥ã€‚	è‹¥åœ¨ä¿®é“ï¼Œæ„ç­‰ä¹æ³•å³æ˜¯ç¬¬äºŒå·²çŸ¥æ ¹é«”ï¼Œç‚ºæ¬²æ–·é™¤é¤˜éš¨çœ æ•…ï¼Œæ–¼å·²çŸ¥å¢ƒæ•¸å¾©äº†çŸ¥ã€‚	If one is in the path of cultivation, the nine dharmas such as intention are the essence of the second faculty of knowing, in order to eliminate the remaining latent tendencies, one repeatedly understands the known objects.
['ZH_T29_1562_009:0380b08_2']	åœ¨ç„¡å­¸é“ï¼Œæ„ç­‰ä¹æ³•å³æ˜¯ç¬¬ä¸‰å…·çŸ¥æ ¹é«”ï¼ŒçŸ¥å·±å·²çŸ¥æ•…åç‚ºçŸ¥ï¼Œç¿’çŸ¥æˆæ€§æ•…ã€æˆ–èƒ½è­·çŸ¥æ•…ï¼Œåç‚ºå…·çŸ¥ã€‚	åœ¨ç„¡å­¸é“ï¼Œæ„ç­‰ä¹æ³•å³æ˜¯ç¬¬ä¸‰å…·çŸ¥æ ¹é«”ï¼ŒçŸ¥å·±å·²çŸ¥æ•…åç‚ºçŸ¥ï¼Œç¿’çŸ¥æˆæ€§æ•…ã€æˆ–èƒ½è­·çŸ¥æ•…ï¼Œåç‚ºå…·çŸ¥ã€‚	If one is in the path of no-more-learning, the nine dharmas such as intention are the essence of the third faculty of knowing, knowing that one has already known is called knowing, cultivating knowing to form a nature is called knowing, or because one can protect knowing, it is called knowing.
['ZH_T29_1562_009:0380b09_1']	ä¹æ ¹ç›¸æ‡‰åˆæˆæ­¤äº‹ï¼Œæ•…æ„ç­‰å…«äº¦å¾—æ­¤åã€‚	ä¹æ ¹ç›¸æ‡‰åˆæˆæ­¤äº‹ï¼Œæ•…æ„ç­‰å…«äº¦å¾—æ­¤åã€‚	These nine faculties correspond to form this matter, therefore intention and the other eight also obtain this name.
['ZH_T29_1562_009:0380b10_11']	å¦‚æ˜¯æ ¹åé›–äºŒåäºŒï¼Œè€Œè«¸æ ¹é«”ä½†æœ‰åä¸ƒï¼Œå¥³ç”·äºŒæ ¹ï¼Œèº«æ ¹æ”æ•…ï¼›	å¦‚æ˜¯æ ¹åé›–äºŒåäºŒï¼Œè€Œè«¸æ ¹é«”ä½†æœ‰åä¸ƒï¼Œå¥³ç”·äºŒæ ¹ï¼Œèº«æ ¹æ”æ•…ï¼›	Although the names of these faculties are twenty-two, the actual faculties are only seventeen, because the two faculties of female and male are included in the body faculty;
['ZH_T29_1562_009:0380b11_1']	ä¸‰ç„¡æ¼æ ¹ï¼Œä¹æ ¹æ”æ•…ã€‚	ä¸‰ç„¡æ¼æ ¹ï¼Œä¹æ ¹æ”æ•…ã€‚	because the three pure faculties are included in the nine faculties.
['ZH_T29_1562_009:0380b11_19']	å¦‚æ˜¯å·²é‡‹æ ¹é«”ä¸åŒï¼Œç•¶è¾¯è«¸é–€ç¾©é¡å·®åˆ¥ã€‚	å¦‚æ˜¯å·²é‡‹æ ¹é«”ä¸åŒï¼Œç•¶è¾¯è«¸é–€ç¾©é¡å·®åˆ¥ã€‚	Thus the different essences of the faculties have been explained. Next, the distinctions in the meanings of various categories will be discussed.
['ZH_T29_1562_009:0380b12_14']	æ­¤äºŒåäºŒæ ¹ä¸­ï¼Œå¹¾æœ‰æ¼ã€å¹¾ç„¡æ¼ï¼Ÿ	æ­¤äºŒåäºŒæ ¹ä¸­ï¼Œå¹¾æœ‰æ¼ã€å¹¾ç„¡æ¼ï¼Ÿ	Among these twenty-two faculties, how many are contaminated and how many are uncontaminated?
['ZH_T29_1562_009:0380b12_17']	é Œæ›°ï¼š	é Œæ›°ï¼š	Verse:
['ZH_T29_1562_009:0380b13_0']	å”¯ç„¡æ¼å¾Œä¸‰ï¼Œã€€ã€€æœ‰è‰²å‘½æ†‚è‹¦ï¼Œ	å”¯ç„¡æ¼å¾Œä¸‰ï¼Œã€€ã€€æœ‰è‰²å‘½æ†‚è‹¦ï¼Œ	Only the last three are uncontaminated. The form faculties, life, sorrow, and suffering,
['ZH_T29_1562_009:0380b14_13']	ç•¶çŸ¥å”¯æœ‰æ¼ï¼Œã€€ã€€é€šäºŒé¤˜ä¹æ ¹ã€‚	ç•¶çŸ¥å”¯æœ‰æ¼ï¼Œã€€ã€€é€šäºŒé¤˜ä¹æ ¹ã€‚	It should be understood that only the last three roots are uncontaminated, while the remaining nine are both contaminated and uncontaminated.
['ZH_T29_1562_009:0380b15_2']	è«–æ›°ï¼š	è«–æ›°ï¼š	The treatise says:
['ZH_T29_1562_009:0380b16_2']	æ¬¡å‰æ‰€èªªæœ€å¾Œä¸‰æ ¹ï¼Œé«”å”¯ç„¡æ¼ï¼Œæ˜¯ç„¡å¢ç¾©ã€‚	æ¬¡å‰æ‰€èªªæœ€å¾Œä¸‰æ ¹ï¼Œé«”å”¯ç„¡æ¼ï¼Œæ˜¯ç„¡å¢ç¾©ã€‚	The last three roots mentioned above are only uncontaminated, which means they are free from defilements.
['ZH_T29_1562_009:0380b16_12']	å¢ä¹‹èˆ‡æ¼ï¼Œåç•°é«”åŒã€‚	å¢ä¹‹èˆ‡æ¼ï¼Œåç•°é«”åŒã€‚	Defilements and contaminations have different names but the same substance.
['ZH_T29_1562_009:0380b17_6']	ä¸ƒæœ‰è‰²æ ¹ã€å‘½åŠæ†‚è‹¦ï¼Œä¸€å‘æœ‰æ¼ã€‚	ä¸ƒæœ‰è‰²æ ¹ã€å‘½åŠæ†‚è‹¦ï¼Œä¸€å‘æœ‰æ¼ã€‚	The seven material roots, life, and sorrow and suffering are exclusively contaminated.
['ZH_T29_1562_009:0380b18_4']	ä¸ƒæœ‰è‰²è€…ï¼Œçœ¼è€³é¼»èˆŒèº«ã€å¥³ç”·æ ¹ï¼Œè‰²è˜Šæ”æ•…ã€‚	ä¸ƒæœ‰è‰²è€…ï¼Œçœ¼è€³é¼»èˆŒèº«ã€å¥³ç”·æ ¹ï¼Œè‰²è˜Šæ”æ•…ã€‚	The seven material ones refer to the eyes, ears, nose, tongue, body, female, and male roots, because they are included in the form aggregate.
['ZH_T29_1562_009:0380b19_16']	ä¹é€šäºŒè€…ï¼Œå³å‰æ‰€èªªä¸‰ç„¡æ¼æ”æ„ç­‰ä¹æ ¹åç‚ºç„¡æ¼ï¼Œé¤˜æ„ç­‰ä¹æ˜¯åæœ‰æ¼ã€‚	ä¹é€šäºŒè€…ï¼Œå³å‰æ‰€èªªä¸‰ç„¡æ¼æ”æ„ç­‰ä¹æ ¹åç‚ºç„¡æ¼ï¼Œé¤˜æ„ç­‰ä¹æ˜¯åæœ‰æ¼ã€‚	The nine that are both contaminated and uncontaminated are the three uncontaminated roots, which are the mental faculty and so on, called uncontaminated. The remaining mental faculty and so on are called contaminated.
['ZH_T29_1562_009:0380b20_2']	æœ‰é¤˜å¸«èªªï¼š	æœ‰é¤˜å¸«èªªï¼š	Other masters say:
['ZH_T29_1562_009:0380b21_1']	ä¿¡ç­‰äº”æ ¹äº¦å”¯ç„¡æ¼ï¼Œå¥‘ç¶“å”¯èªªè–æ‰€æœ‰æ•…ã€‚	ä¿¡ç­‰äº”æ ¹äº¦å”¯ç„¡æ¼ï¼Œå¥‘ç¶“å”¯èªªè–æ‰€æœ‰æ•…ã€‚	The five roots such as faith are also exclusively uncontaminated, because the scriptures only say they are possessed by the noble ones.
['ZH_T29_1562_009:0380b21_6']	åˆä¸–å°Šèªªï¼š	åˆä¸–å°Šèªªï¼š	Moreover, the World-Honored One said:
['ZH_T29_1562_009:0380b22_4']	è‹¥å…¨ç„¡æ­¤ä¿¡ç­‰äº”æ ¹ï¼Œæˆ‘èªªå½¼ä½å¤–ç•°ç”Ÿå“ã€‚	è‹¥å…¨ç„¡æ­¤ä¿¡ç­‰äº”æ ¹ï¼Œæˆ‘èªªå½¼ä½å¤–ç•°ç”Ÿå“ã€‚	If one completely lacks these five roots such as faith, I say they abide in the category of ordinary beings outside the path.
['ZH_T29_1562_009:0380b22_18']	æ­¤éèª è­‰ï¼Œä¾ç„¡æ¼æ ¹èªªæ­¤è¨€æ•…ã€‚	æ­¤éèª è­‰ï¼Œä¾ç„¡æ¼æ ¹èªªæ­¤è¨€æ•…ã€‚	This is not a valid proof, because this statement is made based on the uncontaminated roots.
['ZH_T29_1562_009:0380b23_3']	äº‘ä½•çŸ¥ç„¶ï¼Ÿ	äº‘ä½•çŸ¥ç„¶ï¼Ÿ	How do we know this?
['ZH_T29_1562_009:0380b24_7']	å…ˆä¾ç„¡æ¼ä¿¡ç­‰äº”æ ¹å»ºç«‹è«¸è–ä½å·®åˆ¥å·²ï¼Œèªªæ­¤è¨€æ•…ã€‚	å…ˆä¾ç„¡æ¼ä¿¡ç­‰äº”æ ¹å»ºç«‹è«¸è–ä½å·®åˆ¥å·²ï¼Œèªªæ­¤è¨€æ•…ã€‚	Because this statement is made after the distinctions of the holy stages have already been established based on the five faculties of faith, etc., which are uncontaminated.
['ZH_T29_1562_009:0380b25_5']	å…¨ç„¡æ­¤è€…ï¼Œæ­¤å³æ­¤å‰æ‰€èªªç„¡æ¼ä¿¡ç­‰æ ¹ç¾©ã€‚	å…¨ç„¡æ­¤è€…ï¼Œæ­¤å³æ­¤å‰æ‰€èªªç„¡æ¼ä¿¡ç­‰æ ¹ç¾©ã€‚	Those who completely lack these are the meaning of the five faculties of faith, etc., which were previously explained as uncontaminated.
['ZH_T29_1562_009:0380b26_4']	è‹¥ä¸çˆ¾è€…ï¼Œå”¯æ‡‰èªªè¨€ç„¡ä¿¡ç­‰æ ¹ï¼Œä¸æ‡‰è¨€æ­¤ã€‚	è‹¥ä¸çˆ¾è€…ï¼Œå”¯æ‡‰èªªè¨€ç„¡ä¿¡ç­‰æ ¹ï¼Œä¸æ‡‰è¨€æ­¤ã€‚	If it were not so, one would only say that they lack the faculties of faith, etc., and should not say these.
['ZH_T29_1562_009:0380b26_13']	æˆ–è«¸ç•°ç”Ÿç•¥æœ‰äºŒç¨®ï¼š	æˆ–è«¸ç•°ç”Ÿç•¥æœ‰äºŒç¨®ï¼š	Or, in general, there are two kinds of ordinary beings:
['ZH_T29_1562_009:0380b27_12']	ä¸€å…§ã€äºŒå¤–ï¼Œå…§è¬‚ä¸æ–·å–„æ ¹ï¼Œå¤–è¬‚å–„æ ¹å·²æ–·ã€‚	ä¸€å…§ã€äºŒå¤–ï¼Œå…§è¬‚ä¸æ–·å–„æ ¹ï¼Œå¤–è¬‚å–„æ ¹å·²æ–·ã€‚	those who have not severed wholesome roots and those who have already severed wholesome roots.
['ZH_T29_1562_009:0380b29_1']	ä¾å¤–ç•°ç”Ÿä½œå¦‚æ˜¯èªªï¼Œè‹¥å…¨ç„¡æ­¤ä¿¡ç­‰äº”æ ¹ï¼Œæˆ‘èªªå½¼ä½å¤–ç•°ç”Ÿå“ã€‚	ä¾å¤–ç•°ç”Ÿä½œå¦‚æ˜¯èªªï¼Œè‹¥å…¨ç„¡æ­¤ä¿¡ç­‰äº”æ ¹ï¼Œæˆ‘èªªå½¼ä½å¤–ç•°ç”Ÿå“ã€‚	This is said based on the ordinary beings who have severed wholesome roots. If they completely lack these five faculties of faith, etc., I say they abide in the class of ordinary beings who have severed wholesome roots.
['ZH_T29_1562_009:0380b29_14']	ç‚ºæœ‰å¥‘ç¶“è­‰ä¿¡ç­‰äº”é€šæœ‰æ¼ä¸ï¼Ÿ	ç‚ºæœ‰å¥‘ç¶“è­‰ä¿¡ç­‰äº”é€šæœ‰æ¼ä¸ï¼Ÿ	Is there any sÅ«tra that proves that the five faculties such as faith may be contaminated?
['ZH_T29_1562_009:0380b29_17']	äº¦æœ‰ã€‚	äº¦æœ‰ã€‚	There is.
['ZH_T29_1562_009:0380b29_20']	äº‘ä½•ï¼Ÿ	äº‘ä½•ï¼Ÿ	How so?
['ZH_T29_1562_009:0380c01_4']	è¬‚ä¸–å°Šèªªï¼š	è¬‚ä¸–å°Šèªªï¼š	It is said by the World-Honored One:
['ZH_T29_1562_009:0380c04_4']	æˆ‘è‹¥æ–¼æ­¤ä¿¡ç­‰äº”æ ¹ï¼Œæœªå¦‚å¯¦çŸ¥æ˜¯é›†æ²’å‘³éæ‚£å‡ºé›¢ï¼Œæœªèƒ½è¶…æ­¤å¤©äººä¸–é–“åŠé­”æ¢µç­‰ï¼Œä¹ƒè‡³æœªèƒ½è­‰å¾—é˜¿è€¨å¤šç¾…ä¸‰è—ä¸‰è©æï¼Œä¹ƒè‡³å»£èªªã€‚	æˆ‘è‹¥æ–¼æ­¤ä¿¡ç­‰äº”æ ¹ï¼Œæœªå¦‚å¯¦çŸ¥æ˜¯é›†æ²’å‘³éæ‚£å‡ºé›¢ï¼Œæœªèƒ½è¶…æ­¤å¤©äººä¸–é–“åŠé­”æ¢µç­‰ï¼Œä¹ƒè‡³æœªèƒ½è­‰å¾—é˜¿è€¨å¤šç¾…ä¸‰è—ä¸‰è©æï¼Œä¹ƒè‡³å»£èªªã€‚	If I do not truly understand the arising, cessation, flavor, danger, and escape of these five faculties such as faith, I will not be able to transcend this world of gods, humans, demons, BrahmÄ, and so forth, and will not be able to realize supreme perfect enlightenment, and so on, and so forth.
['ZH_T29_1562_009:0380c04_17']	éç„¡æ¼æ³•æ‡‰ä½œå¦‚æ˜¯æ¬¡ç¬¬è§€å¯Ÿã€‚	éç„¡æ¼æ³•æ‡‰ä½œå¦‚æ˜¯æ¬¡ç¬¬è§€å¯Ÿã€‚	Pure dharmas should not be contemplated in this order.
['ZH_T29_1562_009:0380c07_1']	åˆèªªä½›æœªè½‰æ³•è¼ªæ™‚ï¼Œå…ˆä»¥ä½›çœ¼éè§€ä¸–ç•Œï¼Œæœ‰è«¸æœ‰æƒ…è™•åœ¨ä¸–é–“ï¼Œæˆ–ç”Ÿæˆ–é•·ï¼Œæœ‰ä¸Šä¸­ä¸‹è«¸æ ¹å·®åˆ¥ã€‚	åˆèªªä½›æœªè½‰æ³•è¼ªæ™‚ï¼Œå…ˆä»¥ä½›çœ¼éè§€ä¸–ç•Œï¼Œæœ‰è«¸æœ‰æƒ…è™•åœ¨ä¸–é–“ï¼Œæˆ–ç”Ÿæˆ–é•·ï¼Œæœ‰ä¸Šä¸­ä¸‹è«¸æ ¹å·®åˆ¥ã€‚	It is also said that before the Buddha turned the wheel of the Dharma, he first used the Buddha eye to observe the world, and saw that there were sentient beings in the world, some born and some growing, with various superior, middling, and inferior faculties.
['ZH_T29_1562_009:0380c08_4']	æœªè½‰æ³•è¼ªä¸–é–“å·²æœ‰ç„¡æ¼æ ¹è€…ï¼Œå¦‚ä¾†å‡ºä¸–å‰‡ç‚ºå”æï¼›	æœªè½‰æ³•è¼ªä¸–é–“å·²æœ‰ç„¡æ¼æ ¹è€…ï¼Œå¦‚ä¾†å‡ºä¸–å‰‡ç‚ºå”æï¼›	If there were already pure faculties in the world before the turning of the wheel of the Dharma, then the TathÄgata's appearance in the world would be in vain;
['ZH_T29_1562_009:0380c10_2']	è‹¥æ±æ–¼æ­¤æ‰€å¼•äºŒç¶“ç•°åˆ†åˆ¥è€…ï¼Œæˆ‘ç•¶å¾©ä»¥æ®Šå‹åˆ†åˆ¥å¦‚ç†é®é£ï¼Œæ•…ä¿¡ç­‰æ ¹å®šé€šæœ‰æ¼ã€‚	è‹¥æ±æ–¼æ­¤æ‰€å¼•äºŒç¶“ç•°åˆ†åˆ¥è€…ï¼Œæˆ‘ç•¶å¾©ä»¥æ®Šå‹åˆ†åˆ¥å¦‚ç†é®é£ï¼Œæ•…ä¿¡ç­‰æ ¹å®šé€šæœ‰æ¼ã€‚	If you make a different interpretation of these two sÅ«tras that I have cited, I will further refute you with a superior interpretation in accordance with reason. Therefore, the faculties such as faith definitely include both pure and impure dharmas.
['ZH_T29_1562_009:0380c10_11']	å¦‚æ˜¯å·²èªªæœ‰æ¼ç„¡æ¼ã€‚	å¦‚æ˜¯å·²èªªæœ‰æ¼ç„¡æ¼ã€‚	Thus far, the pure and impure have been explained.
['ZH_T29_1562_009:0380c11_7']	äºŒåäºŒæ ¹ä¸­ï¼Œå¹¾æ˜¯ç•°ç†Ÿã€å¹¾éç•°ç†Ÿï¼Ÿ	äºŒåäºŒæ ¹ä¸­ï¼Œå¹¾æ˜¯ç•°ç†Ÿã€å¹¾éç•°ç†Ÿï¼Ÿ	Among the twenty-two faculties, how many are results of retribution and how many are not results of retribution?
['ZH_T29_1562_009:0380c11_10']	é Œæ›°ï¼š	é Œæ›°ï¼š	A verse [says]:
['ZH_T29_1562_009:0380c12_0']	å‘½å”¯æ˜¯ç•°ç†Ÿï¼Œã€€ã€€æ†‚åŠå¾Œå…«éï¼Œ	å‘½å”¯æ˜¯ç•°ç†Ÿï¼Œã€€ã€€æ†‚åŠå¾Œå…«éï¼Œ	Life is only karmic ripening. Worry and the last eight are not.
['ZH_T29_1562_009:0380c13_13']	è‰²æ„é¤˜å››å—ï¼Œã€€ã€€ä¸€ä¸€çš†é€šäºŒã€‚	è‰²æ„é¤˜å››å—ï¼Œã€€ã€€ä¸€ä¸€çš†é€šäºŒã€‚	Form, mind, and the other four feelings each have two aspects.
['ZH_T29_1562_009:0380c14_2']	è«–æ›°ï¼š	è«–æ›°ï¼š	The treatise says:
['ZH_T29_1562_009:0380c15_1']	ä¸”ç„¡åˆ†åˆ¥æ­¤è«¸æ ¹ä¸­ï¼Œå”¯ä¸€å‘½æ ¹å®šæ˜¯ç•°ç†Ÿã€‚	ä¸”ç„¡åˆ†åˆ¥æ­¤è«¸æ ¹ä¸­ï¼Œå”¯ä¸€å‘½æ ¹å®šæ˜¯ç•°ç†Ÿã€‚	Among these faculties, only the life faculty is definitely karmic ripening.
['ZH_T29_1562_009:0380c15_10']	å¦‚ä½•æ­¤å‘½å¯ç„¡åˆ†åˆ¥ï¼Ÿ	å¦‚ä½•æ­¤å‘½å¯ç„¡åˆ†åˆ¥ï¼Ÿ	How can this life [faculty] be without discrimination?
['ZH_T29_1562_009:0380c16_1', 'ZH_T29_1562_009:0380c17_14']	å®šæœå‘½æ ¹éç•°ç†Ÿæ•…ã€‚ğŸ”½å¦‚æ˜¯å‘½æ ¹äº¦æ˜¯ç•°ç†Ÿï¼Œå¾—é‚Šéš›å®šæ‡‰æœè‹¾èŠ»ï¼Œæ–¼åƒ§çœ¾ä¸­æˆ–åˆ¥äººæ‰€æ–½æ€æœæ•…ã€‚	å®šæœå‘½æ ¹éç•°ç†Ÿæ•…ã€‚ å¦‚æ˜¯å‘½æ ¹äº¦æ˜¯ç•°ç†Ÿï¼Œå¾—é‚Šéš›å®šæ‡‰æœè‹¾èŠ»ï¼Œæ–¼åƒ§çœ¾ä¸­æˆ–åˆ¥äººæ‰€æ–½æ€æœæ•…ã€‚	Because the life faculty of the result of meditation is not karmic ripening.
['ZH_T29_1562_009:0380c19_1']	è«¸æˆ‘èƒ½æ„Ÿå¯Œç•°ç†Ÿæ¥­ï¼Œé¡˜çš†è½‰æ‹›å£½ç•°ç†Ÿæœï¼Œæœ¬è«–èªªæ•…ã€‚	è«¸æˆ‘èƒ½æ„Ÿå¯Œç•°ç†Ÿæ¥­ï¼Œé¡˜çš†è½‰æ‹›å£½ç•°ç†Ÿæœï¼Œæœ¬è«–èªªæ•…ã€‚	In this way, the life faculty is also karmic ripening. A perfected being who has attained the concentration of the limit of the world, by the intention of giving to the Saá¹…gha or to an individual, causes the karma that would ripen as wealth to ripen instead as life. This is because the Abhidharma treatise says so.
['ZH_T29_1562_009:0380c19_5']	æœ‰é¤˜èªªï¼š	æœ‰é¤˜èªªï¼š	Some say:
['ZH_T29_1562_009:0380c20_11']	å½¼ç”±é‚Šéš›å®šåŠ›å¼•å–å‰ç”Ÿé †ä¸å®šå—æ¥­æ‰€æ„Ÿå£½å‘½ï¼Œä»¤ç¾å—ç”¨ã€‚	å½¼ç”±é‚Šéš›å®šåŠ›å¼•å–å‰ç”Ÿé †ä¸å®šå—æ¥­æ‰€æ„Ÿå£½å‘½ï¼Œä»¤ç¾å—ç”¨ã€‚	By the power of the concentration of the limit of the world, he attracts the life that was to be experienced as indeterminate in the future, and causes it to be experienced now.
['ZH_T29_1562_009:0380c23_8']	å¾©æœ‰æ¬²ä»¤é‚Šéš›å®šåŠ›å¼•å‰ç”Ÿæ¥­æ®˜ç•°ç†Ÿæœï¼Œè€Œç¶“ä¸»è¨€ç”±å‹å®šåŠ›å¼•å–æœªæ›¾è«¸æ ¹å¤§ç¨®ä½æ™‚å‹¢åˆ†ï¼Œå¦‚æ­¤å‘½æ ¹éæ˜¯ç•°ç†Ÿï¼Œé¤˜æ˜¯ç•°ç†Ÿã€‚	å¾©æœ‰æ¬²ä»¤é‚Šéš›å®šåŠ›å¼•å‰ç”Ÿæ¥­æ®˜ç•°ç†Ÿæœï¼Œè€Œç¶“ä¸»è¨€ç”±å‹å®šåŠ›å¼•å–æœªæ›¾è«¸æ ¹å¤§ç¨®ä½æ™‚å‹¢åˆ†ï¼Œå¦‚æ­¤å‘½æ ¹éæ˜¯ç•°ç†Ÿï¼Œé¤˜æ˜¯ç•°ç†Ÿã€‚	There are also those who wish to have the power of the ultimate concentration draw out the remaining results of retribution of karma from previous lives. The ÅšÄstra master says, â€œBy the power of the superior concentration, one draws out and takes the power of the duration of the life faculty of the great elements and faculties that have not yet existed. In this way, the life faculty is not a result of retribution, while the rest are results of retribution.â€
['ZH_T29_1562_009:0380c23_13']	æ­¤è¨€éç†ã€‚	æ­¤è¨€éç†ã€‚	This statement is unreasonable.
['ZH_T29_1562_009:0380c23_18']	æ‰€ä»¥è€…ä½•ï¼Ÿ	æ‰€ä»¥è€…ä½•ï¼Ÿ	Why is it so?
['ZH_T29_1562_009:0380c25_1']	ä¸”å½¼å”¯èªªè«¸æ ¹å¤§ç¨®ä½æ™‚å‹¢åˆ†åç‚ºå‘½æ ¹ï¼Œå¦‚å¾Œç•¶ç ´ã€‚	ä¸”å½¼å”¯èªªè«¸æ ¹å¤§ç¨®ä½æ™‚å‹¢åˆ†åç‚ºå‘½æ ¹ï¼Œå¦‚å¾Œç•¶ç ´ã€‚	First, he only says that the power of the duration of the great elements and faculties is called the life faculty. This will be refuted later.
['ZH_T29_1562_009:0380c25_20']	è¨­è¨±å¦‚æ˜¯ï¼Œéš¨åŸ·å½¼ç‚ºé•·é¤Šç­‰æ€§ï¼Œçš†ä¸æ‡‰ç†ã€‚	è¨­è¨±å¦‚æ˜¯ï¼Œéš¨åŸ·å½¼ç‚ºé•·é¤Šç­‰æ€§ï¼Œçš†ä¸æ‡‰ç†ã€‚	Even if we assume this is so, whether one grasps it as being due to nourishment, etc., it is unreasonable in all cases.
['ZH_T29_1562_009:0380c26_17']	ä¸”ä¸æ‡‰åŸ·æ˜¯é•·é¤Šæ€§ï¼Œå½¼èƒ½é˜²å®ˆç•°ç†Ÿæœæ•…ã€‚	ä¸”ä¸æ‡‰åŸ·æ˜¯é•·é¤Šæ€§ï¼Œå½¼èƒ½é˜²å®ˆç•°ç†Ÿæœæ•…ã€‚	First, it is unreasonable to grasp it as being due to nourishment, because it can guard the results of retribution.
['ZH_T29_1562_009:0380c28_7']	æ‰€é˜²ç•°ç†Ÿå·²è½‰ç›¡æ•…ï¼Œä¸æ‡‰ç•°ç†Ÿç›¸çºŒæ–·å·²ç¨æœ‰é•·é¤Šï¼Œå¤ªéå¤±æ•…ã€‚	æ‰€é˜²ç•°ç†Ÿå·²è½‰ç›¡æ•…ï¼Œä¸æ‡‰ç•°ç†Ÿç›¸çºŒæ–·å·²ç¨æœ‰é•·é¤Šï¼Œå¤ªéå¤±æ•…ã€‚	Because the results of retribution that are guarded have already been exhausted, it is unreasonable for the continuity of results of retribution to be severed and for there to be only nourishment, because of the error of excess.
['ZH_T29_1562_009:0381a01_4']	äº¦ä¸æ‡‰åŸ·æ˜¯ç­‰æµæ€§ï¼Œçœ¼ç­‰ç„¡åˆ¥ç­‰æµæ€§æ•…ï¼Œç„¡è¨˜éå–„ç­‰æµæœæ•…ï¼Œåˆç•Œæ‡‰æˆé›œäº‚éæ•…ã€‚	äº¦ä¸æ‡‰åŸ·æ˜¯ç­‰æµæ€§ï¼Œçœ¼ç­‰ç„¡åˆ¥ç­‰æµæ€§æ•…ï¼Œç„¡è¨˜éå–„ç­‰æµæœæ•…ï¼Œåˆç•Œæ‡‰æˆé›œäº‚éæ•…ã€‚	It is also unreasonable to grasp it as being due to the out-flowing nature, because the eye, etc., do not have a separate out-flowing nature, because the indeterminate is not a result of the out-flowing nature of the good, etc., and also because there would be the error of the realms becoming mixed up.
['ZH_T29_1562_009:0381a02_12']	äº¦ä¸æ‡‰åŸ·æ˜¯ç•°ç†Ÿæ€§ï¼Œå®šéæ¬²ç•Œç•°ç†Ÿå› æ•…ï¼Œåˆå½¼è‡ªè¨±å¦‚æ˜¯äº‹æ•…ã€‚	äº¦ä¸æ‡‰åŸ·æ˜¯ç•°ç†Ÿæ€§ï¼Œå®šéæ¬²ç•Œç•°ç†Ÿå› æ•…ï¼Œåˆå½¼è‡ªè¨±å¦‚æ˜¯äº‹æ•…ã€‚	Also, you should not maintain that it is a result of retribution, because it definitely is not a cause of retribution in the realm of desire, and because they themselves admit that it is a real entity.
['ZH_T29_1562_009:0381a04_1']	ç„¶å…¶æ‰€èªªè¿·è¬¬é›£è©³ï¼Œä»»æ›´æŒ‡é™³å½¼åä½•æ³•ï¼Œè€Œè¨€æ­¤å‘½éç•°ç†Ÿè€¶ï¼Ÿ	ç„¶å…¶æ‰€èªªè¿·è¬¬é›£è©³ï¼Œä»»æ›´æŒ‡é™³å½¼åä½•æ³•ï¼Œè€Œè¨€æ­¤å‘½éç•°ç†Ÿè€¶ï¼Ÿ	However, their explanation is confused and difficult to understand. We must ask them to point out what dharma is called life, and why they say that this life is not a result of retribution?
['ZH_T29_1562_009:0381a04_19']	å°Šè€…æ³•å‹èªªæ­¤å‘½æ ¹äº¦éç•°ç†Ÿï¼Œæ•…å½¼è«–èªªï¼š	å°Šè€…æ³•å‹èªªæ­¤å‘½æ ¹äº¦éç•°ç†Ÿï¼Œæ•…å½¼è«–èªªï¼š	The Venerable DharmapÄla says that this life faculty is also not a result of retribution. Therefore, that treatise says,
['ZH_T29_1562_009:0381a05_8']	æœ‰åä¸‰æ ¹çš†é€šäºŒç¨®ã€‚	æœ‰åä¸‰æ ¹çš†é€šäºŒç¨®ã€‚	There are thirteen faculties that are both results and also have results.
