segmentnr	original	analyzed	folio	translated
['ZH_T02_0113_001:0505b18_0']	ä½›èªªé›£æé‡‹ç¶“	ä½›èªªé›£æé‡‹ç¶“	001	The Buddha Speaks the SÅ«tra of NandÄ± ÅšÄkyamuni
['ZH_T02_0113_001:0505b20_0']	è¥¿æ™‰æ²™é–€æ³•ç‚¬è­¯	è¥¿æ™‰æ²™é–€æ³•ç‚¬è­¯	001	Translated by Åšramaá¹‡a Faju of the Western Jin
['ZH_T02_0113_001:0505b21_0']	èå¦‚æ˜¯ï¼šä¸€æ™‚ï¼Œä½›è¡Œåœ¨ä¿±èˆæ¢¨åœ‹ï¼Œæ¨¹åå°¼æ‹˜é¡ã€‚	èå¦‚æ˜¯ï¼šä¸€æ™‚ï¼Œä½›è¡Œåœ¨ä¿±èˆæ¢¨åœ‹ï¼Œæ¨¹åå°¼æ‹˜é¡ã€‚	001	Hears this sort of: once, the Buddha was walking in the country of KuÅ›inagara, under a tree called NÄ«cy.
['ZH_T02_0113_001:0505b23_17']	æ˜¯æ™‚ï¼Œå¤šèšæœƒæ¯”ä¸˜åœ¨è¿¦æ¢¨è¬›å ‚ï¼Œæ¨¹é–“æœƒåç‚ºä½›ä½œè¡£ï¼Œä»Šä½›ä¸ä¹…å¤ç«Ÿï¼Œå¤å·²ç›¡ä½›è‡ªèªªï¼š	æ˜¯æ™‚ï¼Œå¤šèšæœƒæ¯”ä¸˜åœ¨è¿¦æ¢¨è¬›å ‚ï¼Œæ¨¹é–“æœƒåç‚ºä½›ä½œè¡£ï¼Œä»Šä½›ä¸ä¹…å¤ç«Ÿï¼Œå¤å·²ç›¡ä½›è‡ªèªªï¼š	001	At that time, many monks gathered in the lecture hall of KÄli, sitting together under the trees to make robes for the Buddha. Now, before long, the Buddha will finish the summer retreat. After the summer retreat, the Buddha himself said:
['ZH_T02_0113_001:0505b24_12']	ã€Œä¸‰æœˆå·²ç«Ÿä½œè¡£å·²ï¼Œç•¶åˆ°å¤šäººè™•ã€‚	ã€Œä¸‰æœˆå·²ç«Ÿä½œè¡£å·²ï¼Œç•¶åˆ°å¤šäººè™•ã€‚	001	After three months, when the robes are finished, I will go to a place with many people.
['ZH_T02_0113_001:0505b25_18']	ã€ä¾¿é›£æé‡‹èï¼Œå¤šèšæœƒæ¯”ä¸˜åœ¨è¿¦æ¢¨è¬›å ‚æ¨¹é–“æœƒåï¼Œç‚ºä½›ä½œè¡£ã€‚	ã€ä¾¿é›£æé‡‹èï¼Œå¤šèšæœƒæ¯”ä¸˜åœ¨è¿¦æ¢¨è¬›å ‚æ¨¹é–“æœƒåï¼Œç‚ºä½›ä½œè¡£ã€‚	001	Then NandÄ± ÅšÄkyamuni heard that many monks had gathered in the lecture hall of KÄli, sitting together under the trees, making robes for the Buddha.
['ZH_T02_0113_001:0505b26_13']	ä»Šä½›ä¸ä¹…å¤ç«Ÿï¼Œå¤å·²ç›¡ä½›è‡ªèªªï¼š	ä»Šä½›ä¸ä¹…å¤ç«Ÿï¼Œå¤å·²ç›¡ä½›è‡ªèªªï¼š	001	Now, before long, the Buddha will finish the summer retreat. After the summer retreat, the Buddha himself said:
['ZH_T02_0113_001:0505b27_8', 'ZH_T02_0113_001:0505b28_15']	ã€Œä¸‰æœˆå·²ç«Ÿä½œè¡£å·²ï¼Œç•¶åˆ°å¤šäººè™•ã€‚ğŸ”½ã€é›£æé‡‹å·²èå¦‚æ˜¯ï¼Œä¾¿åˆ°ä½›æ‰€ï¼Œå·²åˆ°ç‚ºä½›è¶³ç¦®ï¼Œä¾¿åä¸€è™•ã€‚	ã€Œä¸‰æœˆå·²ç«Ÿä½œè¡£å·²ï¼Œç•¶åˆ°å¤šäººè™•ã€‚ ã€é›£æé‡‹å·²èå¦‚æ˜¯ï¼Œä¾¿åˆ°ä½›æ‰€ï¼Œå·²åˆ°ç‚ºä½›è¶³ç¦®ï¼Œä¾¿åä¸€è™•ã€‚	001	After three months, when the robes are finished, I will go to a place with many people.ğŸ”½Having heard this, NandÄ± ÅšÄkyamuni went to where the Buddha was. Having arrived, he bowed at the Buddha's feet and then sat to one side.
['ZH_T02_0113_001:0505b29_4']	å·²åï¼Œé›£æé‡‹ç™½ä½›è¨€ï¼š	å·²åï¼Œé›£æé‡‹ç™½ä½›è¨€ï¼š	001	Having sat down, NandÄ± ÅšÄkyamuni addressed the Buddha, saying:
['ZH_T02_0113_001:0505c02_4']	ã€Œå¦‚æ˜¯æˆ‘èï¼Œå¤šèšæœƒæ¯”ä¸˜åœ¨è¿¦æ¢¨è¬›å ‚æ¨¹é–“æœƒåï¼Œç‚ºä½›ä½œè¡£ï¼Œä»Šä½›ä¸ä¹…å¤ç«Ÿå·²ï¼Œå¤ç›¡ä½›è‡ªèªªï¼š	ã€Œå¦‚æ˜¯æˆ‘èï¼Œå¤šèšæœƒæ¯”ä¸˜åœ¨è¿¦æ¢¨è¬›å ‚æ¨¹é–“æœƒåï¼Œç‚ºä½›ä½œè¡£ï¼Œä»Šä½›ä¸ä¹…å¤ç«Ÿå·²ï¼Œå¤ç›¡ä½›è‡ªèªªï¼š	001	Thus have I heard. Many monks were gathered in the Karanda Bamboo Grove, sitting together under the trees, making robes for the Buddha. The Buddha will soon finish the summer retreat. When the summer is over, the Buddha himself said:
['ZH_T02_0113_001:0505c02_20']	ã€ä¸‰æœˆå·²ç«Ÿï¼Œä½œè¡£å·²ï¼Œç•¶åˆ°å¤šäººè™•ã€‚	ã€ä¸‰æœˆå·²ç«Ÿï¼Œä½œè¡£å·²ï¼Œç•¶åˆ°å¤šäººè™•ã€‚	001	'Three months have passed, the robes are finished, and I will go to where many people are.'
['ZH_T02_0113_001:0505c04_15']	ã€æˆ‘èæ˜¯å³æ„æ†‚ï¼Œæ‰€é£Ÿä¸è¦ºå‘³ï¼Œè«¸æ–¹ä¸åˆ†åˆ¥ï¼Œæ‰€èå–„æ³•ä¸å¾©å¿µï¼Œæ‰€ä½œä¸–é–“æ¥­ä¸å¾©è‘—ã€‚	ã€æˆ‘èæ˜¯å³æ„æ†‚ï¼Œæ‰€é£Ÿä¸è¦ºå‘³ï¼Œè«¸æ–¹ä¸åˆ†åˆ¥ï¼Œæ‰€èå–„æ³•ä¸å¾©å¿µï¼Œæ‰€ä½œä¸–é–“æ¥­ä¸å¾©è‘—ã€‚	001	When I heard this, I became worried and unhappy. I did not notice the taste of the food I ate, I could not distinguish the directions, I did not remember the good teachings I had heard, and I was no longer attached to worldly affairs.
['ZH_T02_0113_001:0505c05_1']	æ‰€ä»¥è€…ä½•ï¼Ÿ	æ‰€ä»¥è€…ä½•ï¼Ÿ	001	Why is this?
['ZH_T02_0113_001:0505c05_15']	ç”šä¹…ä¹ƒå¾©å¾—è¦‹ä½›å¹¶æ¸…æ·¨è¡Œæ¯”ä¸˜ã€‚	ç”šä¹…ä¹ƒå¾©å¾—è¦‹ä½›å¹¶æ¸…æ·¨è¡Œæ¯”ä¸˜ã€‚	001	It has been a long time since I last saw the Buddha and the pure-practicing monks.
['ZH_T02_0113_001:0505c06_10']	ã€é›£æé‡‹è¨€å·²ç«Ÿï¼Œä½›ä¾¿å ±é›£æï¼š	ã€é›£æé‡‹è¨€å·²ç«Ÿï¼Œä½›ä¾¿å ±é›£æï¼š	001	When Nandi the Elder had finished speaking, the Buddha replied to Nandi:
['ZH_T02_0113_001:0505c06_15']	ã€Œé‡‹é›£æï¼	ã€Œé‡‹é›£æï¼	001	Nandi the Elder!
['ZH_T02_0113_001:0505c08_10']	è‹¥è¦‹æˆ‘èº«ï¼Œè‹¥ä¸è¦‹æˆ‘èº«ï¼Œè‹¥è¦‹æ¸…æ·¨è¡Œæ¯”ä¸˜ï¼Œè‹¥ä¸è¦‹æ¸…æ·¨è¡Œæ¯”ä¸˜ï¼Œå¸¸ç•¶è¡Œå…§äº”æ³•ã€‚	è‹¥è¦‹æˆ‘èº«ï¼Œè‹¥ä¸è¦‹æˆ‘èº«ï¼Œè‹¥è¦‹æ¸…æ·¨è¡Œæ¯”ä¸˜ï¼Œè‹¥ä¸è¦‹æ¸…æ·¨è¡Œæ¯”ä¸˜ï¼Œå¸¸ç•¶è¡Œå…§äº”æ³•ã€‚	001	Whether you see my body or not, whether you see the pure-practicing monks or not, you should always practice the five inner dharmas.
['ZH_T02_0113_001:0505c08_14']	ä½•ç­‰äº”ï¼Ÿ	ä½•ç­‰äº”ï¼Ÿ	001	What are the five?
['ZH_T02_0113_001:0505c09_8']	ä¸€è€…æ„å¸¸ç•¶æœ‰ä¿¡ï¼Œæ¨ä¸ä¿¡æ„ã€‚	ä¸€è€…æ„å¸¸ç•¶æœ‰ä¿¡ï¼Œæ¨ä¸ä¿¡æ„ã€‚	001	First, the mind should always have faith and abandon faithless thoughts.
['ZH_T02_0113_001:0505c10_2']	äºŒè€…å¸¸ç•¶æ¸…æ·¨è¡Œï¼Œæ¨ä¸æ¸…æ·¨è¡Œã€‚	äºŒè€…å¸¸ç•¶æ¸…æ·¨è¡Œï¼Œæ¨ä¸æ¸…æ·¨è¡Œã€‚	001	Second, always practice purity and abandon impure practices.
['ZH_T02_0113_001:0505c10_14']	ä¸‰è€…å¸¸ç•¶æ¨‚å¸ƒæ–½ã€æ¨æ…³è²ªã€‚	ä¸‰è€…å¸¸ç•¶æ¨‚å¸ƒæ–½ã€æ¨æ…³è²ªã€‚	001	Third, always delight in giving and abandon stinginess and greed.
['ZH_T02_0113_001:0505c11_4']	å››è€…å¸¸ç•¶æœ‰æ…§ã€æ¨ç™¡ã€‚	å››è€…å¸¸ç•¶æœ‰æ…§ã€æ¨ç™¡ã€‚	001	Fourth, always be wise and abandon foolishness.
['ZH_T02_0113_001:0505c11_16']	äº”è€…å¸¸ç•¶å¤šèï¼Œè«æ¨‚ä¸èã€‚	äº”è€…å¸¸ç•¶å¤šèï¼Œè«æ¨‚ä¸èã€‚	001	Fifth, always study widely and do not delight in not hearing.
['ZH_T02_0113_001:0505c11_19']	é›£æï¼	é›£æï¼	001	Nandi!
['ZH_T02_0113_001:0505c12_3']	æ˜¯ç‚ºå…§äº”äº‹ã€‚	æ˜¯ç‚ºå…§äº”äº‹ã€‚	001	These are the five internal matters.
['ZH_T02_0113_001:0505c12_10']	å·²ç•¶å¾©æœ‰å…­å¿µã€‚	å·²ç•¶å¾©æœ‰å…­å¿µã€‚	001	You should also have six recollections.
['ZH_T02_0113_001:0505c12_14']	ä½•ç­‰å…­ï¼Ÿ	ä½•ç­‰å…­ï¼Ÿ	001	What are the six?
['ZH_T02_0113_001:0505c14_1']	ä¸€å¿µä½›ï¼ŒäºŒå¿µæ³•ï¼Œä¸‰å¿µæ¯”ä¸˜åƒ§ï¼Œå››å¿µæˆ’ï¼Œäº”å¿µæ–½èˆ‡ï¼Œå…­å¿µå¤©ã€‚	ä¸€å¿µä½›ï¼ŒäºŒå¿µæ³•ï¼Œä¸‰å¿µæ¯”ä¸˜åƒ§ï¼Œå››å¿µæˆ’ï¼Œäº”å¿µæ–½èˆ‡ï¼Œå…­å¿µå¤©ã€‚	001	First, recollecting the Buddha, second, recollecting the Dharma, third, recollecting the Sangha of bhiká¹£us, fourth, recollecting the precepts, fifth, recollecting giving, sixth, recollecting the devas.
['ZH_T02_0113_001:0505c15_3']	ã€Œé›£æï¼	ã€Œé›£æï¼	001	Nandi!
['ZH_T02_0113_001:0505c15_17']	è‹¥æ…§å¼Ÿå­å¿µä½›è«¸å¾·ï¼Œä½›ç‚ºæœ‰æ˜¯ï¼š	è‹¥æ…§å¼Ÿå­å¿µä½›è«¸å¾·ï¼Œä½›ç‚ºæœ‰æ˜¯ï¼š	001	If a wise disciple recollects the Buddha's virtues, the Buddha has these:
['ZH_T02_0113_001:0505c18_8']	ç‚ºå¦‚ä¾†ã€ç‚ºç„¡æ‰€è‘—ã€ç‚ºä¸€åˆ‡è¦ºã€ç‚ºç¥è¡Œè¶³ã€ç‚ºå·²å¿«ã€ç‚ºæœ‰ç„¡é‡ã€ç‚ºç„¡æœ‰ä¸Šã€ç‚ºç”·å­å¸«ã€ç‚ºæ³•å¾¡è€…ã€ç‚ºå¤©äººå¸«ã€ç‚ºè¦ºæœ‰æ˜¯ã€‚	ç‚ºå¦‚ä¾†ã€ç‚ºç„¡æ‰€è‘—ã€ç‚ºä¸€åˆ‡è¦ºã€ç‚ºç¥è¡Œè¶³ã€ç‚ºå·²å¿«ã€ç‚ºæœ‰ç„¡é‡ã€ç‚ºç„¡æœ‰ä¸Šã€ç‚ºç”·å­å¸«ã€ç‚ºæ³•å¾¡è€…ã€ç‚ºå¤©äººå¸«ã€ç‚ºè¦ºæœ‰æ˜¯ã€‚	001	He is the TathÄgata, the One Who Has Attained Unattachedness, the Fully Awakened One, the One with Supernatural Powers, the One Who Has Gone to Bliss, the One with Immeasurable [Virtues], the Supreme One, the Teacher of Humans and Devas, the Buddha, the One Who Has Awakened to Suchness.
['ZH_T02_0113_001:0505c20_18']	è‹¥å¤©ã€è‹¥äººã€è‹¥é­”ã€è‹¥æ¢µã€è‹¥æ²™é–€ã€è‹¥å©†ç¾…é–€ï¼Œç‚ºè‡ªæ…§è­‰èº«ç”Ÿè™•å·²ç›¡ï¼Œç‚ºå·²è‘—æ¸…æ·¨è¡Œï¼Œæ‰€ç‚ºç•¶è‡ªè­˜ï¼Œä½†æœ‰æ˜¯èº«å¾å¾Œä¸å—ã€‚	è‹¥å¤©ã€è‹¥äººã€è‹¥é­”ã€è‹¥æ¢µã€è‹¥æ²™é–€ã€è‹¥å©†ç¾…é–€ï¼Œç‚ºè‡ªæ…§è­‰èº«ç”Ÿè™•å·²ç›¡ï¼Œç‚ºå·²è‘—æ¸…æ·¨è¡Œï¼Œæ‰€ç‚ºç•¶è‡ªè­˜ï¼Œä½†æœ‰æ˜¯èº«å¾å¾Œä¸å—ã€‚	001	Whether gods, humans, demons, Brahmins, ascetics, or Brahmins, if they personally realize and end rebirth through their own wisdom, and if they have already attained pure conduct, what they should do is to personally recognize that this is the only body and they will not receive another body in the future.
['ZH_T02_0113_001:0505c21_1']	é›£æï¼	é›£æï¼	001	Nanda!
['ZH_T02_0113_001:0505c22_7']	æ˜¯æ™‚æ…§å¼Ÿå­æ„ä¸è‘—è²ªæ¬²ï¼Œä¸è‘—ç‹æšï¼Œä¸è‘—æ„šç™¡ï¼Œä¾¿ç‚ºç›´æ„ï¼›	æ˜¯æ™‚æ…§å¼Ÿå­æ„ä¸è‘—è²ªæ¬²ï¼Œä¸è‘—ç‹æšï¼Œä¸è‘—æ„šç™¡ï¼Œä¾¿ç‚ºç›´æ„ï¼›	001	At that time, the wise disciple's mind is not attached to greed, anger, or delusion, and thus becomes upright;
['ZH_T02_0113_001:0505c23_14']	æ…§å¼Ÿå­æ„å·²ç›´ï¼Œå·²ç›´æ„ä¾¿å¾—ç¾©ã€ä¾¿å¾—æ³•ã€ä¾¿è¦‹æ³•ã€ä¾¿å¤§æ¨‚å–œï¼›	æ…§å¼Ÿå­æ„å·²ç›´ï¼Œå·²ç›´æ„ä¾¿å¾—ç¾©ã€ä¾¿å¾—æ³•ã€ä¾¿è¦‹æ³•ã€ä¾¿å¤§æ¨‚å–œï¼›	001	the wise disciple's mind, having become upright, then attains the meaning, attains the Dharma, sees the Dharma, and greatly delights;
['ZH_T02_0113_001:0505c24_4']	å·²å–œä¾¿ç”Ÿæ¨‚ï¼Œå¾æ¨‚ä¾¿èº«æ»…ï¼›	å·²å–œä¾¿ç”Ÿæ¨‚ï¼Œå¾æ¨‚ä¾¿èº«æ»…ï¼›	001	having delighted, bliss arises, from bliss the body is extinguished;
['ZH_T02_0113_001:0505c24_12']	èº«å·²æ»…ä¾¿å¾—å®‰éš±ï¼›	èº«å·²æ»…ä¾¿å¾—å®‰éš±ï¼›	001	the body having been extinguished, one attains peace;
['ZH_T02_0113_001:0505c26_11']	å·²å¾—å®‰éš±ä¾¿å¾—å®šï¼Œå¾å®šä¾¿å¦‚çŸ¥å¦‚è¦‹ï¼Œæ˜¯ç‚ºè‹¦è«¦ã€æ˜¯ç‚ºç¿’ã€æ˜¯ç‚ºç›¡ã€æ˜¯ç‚ºè‹¦æ»…å‘é“è€…è«¦ã€‚	å·²å¾—å®‰éš±ä¾¿å¾—å®šï¼Œå¾å®šä¾¿å¦‚çŸ¥å¦‚è¦‹ï¼Œæ˜¯ç‚ºè‹¦è«¦ã€æ˜¯ç‚ºç¿’ã€æ˜¯ç‚ºç›¡ã€æ˜¯ç‚ºè‹¦æ»…å‘é“è€…è«¦ã€‚	001	having attained peace, one attains concentration, from concentration one knows as it is and sees as it is, this is the truth of suffering, this is the accumulation, this is the cessation, this is the path leading to the cessation of suffering.
['ZH_T02_0113_001:0505c26_14']	é›£æï¼	é›£æï¼	001	Nanda!
['ZH_T02_0113_001:0505c28_2']	è‹¥æ…§å¼Ÿå­åœ¨é‚ªä¸­ç‚ºç›´å¿µï¼Œæœ‰æ¨æ„ä¾¿ç‚ºæ¨ï¼Œæ„æœ‰æ‰€è‘—ä¾¿ä¸å—ã€‚	è‹¥æ…§å¼Ÿå­åœ¨é‚ªä¸­ç‚ºç›´å¿µï¼Œæœ‰æ¨æ„ä¾¿ç‚ºæ¨ï¼Œæ„æœ‰æ‰€è‘—ä¾¿ä¸å—ã€‚	001	If a wise disciple is in error, they should be mindful of what is correct, if they have hateful thoughts they should immediately let go of them, if their mind is attached to anything they should not accept it.
['ZH_T02_0113_001:0505c28_17']	æ˜¯ç‚ºæ…§å¼Ÿå­æ¨‚é“è¿¹ï¼Œç‚ºå¸¸å¿µä½›å¾·ã€‚	æ˜¯ç‚ºæ…§å¼Ÿå­æ¨‚é“è¿¹ï¼Œç‚ºå¸¸å¿µä½›å¾·ã€‚	001	This is how a wise disciple delights in the path and is always mindful of the Buddha's virtues.
['ZH_T02_0113_001:0505c29_3']	ã€Œé›£æï¼	ã€Œé›£æï¼	001	Nandi!
['ZH_T02_0113_001:0506a02_12']	è‹¥æ…§å¼Ÿå­å¿µæ³•å¾·ä½›æ‰€èªªï¼Œå¤§ç‚ºå®‰éš±ç‚ºå¯è¦‹ï¼Œç‚ºç„¡æ™‚å¯ç›¸æˆï¼Œå¯å¾—æŒæ…§è€…é‘½ï¼Œå¯å¾—å‡ºå¯é£½ï¼Œå¯ä¾å¾æ³•å¾—é›¢æ‰€è™•ã€‚	è‹¥æ…§å¼Ÿå­å¿µæ³•å¾·ä½›æ‰€èªªï¼Œå¤§ç‚ºå®‰éš±ç‚ºå¯è¦‹ï¼Œç‚ºç„¡æ™‚å¯ç›¸æˆï¼Œå¯å¾—æŒæ…§è€…é‘½ï¼Œå¯å¾—å‡ºå¯é£½ï¼Œå¯ä¾å¾æ³•å¾—é›¢æ‰€è™•ã€‚	001	If a wise disciple contemplates the virtues of the Dharma taught by the Buddha, it is greatly peaceful and visible, it is not something that can be transmitted to others, it can be obtained by those who hold wisdom and drill, it can be obtained and satisfied, and it can be relied upon to attain liberation from one's abode.
['ZH_T02_0113_001:0506a02_15']	é›£æï¼	é›£æï¼	001	Nandi!
['ZH_T02_0113_001:0506a04_2']	æ˜¯æ™‚æ…§å¼Ÿå­æ„ä¸è‘—è²ªæ¬²ã€ä¸è‘—ç‹æšã€ä¸è‘—æ„šç™¡ï¼Œä¾¿ç‚ºç›´å¿µï¼›	æ˜¯æ™‚æ…§å¼Ÿå­æ„ä¸è‘—è²ªæ¬²ã€ä¸è‘—ç‹æšã€ä¸è‘—æ„šç™¡ï¼Œä¾¿ç‚ºç›´å¿µï¼›	001	At that time, the wise disciple's mind is not attached to greed, not attached to anger, and not attached to delusion, and they become mindful of what is correct;
['ZH_T02_0113_001:0506a05_8']	æ…§å¼Ÿå­æ„å·²ç›´ï¼Œå·²ç›´æ„ä¾¿å¾—ç¾©ã€ä¾¿å¾—æ³•ã€ä¾¿è¦‹æ³•ã€ä¾¿å¤§æ¨‚å–œï¼›	æ…§å¼Ÿå­æ„å·²ç›´ï¼Œå·²ç›´æ„ä¾¿å¾—ç¾©ã€ä¾¿å¾—æ³•ã€ä¾¿è¦‹æ³•ã€ä¾¿å¤§æ¨‚å–œï¼›	001	The wise disciple's mind has already become correct, and with a correct mind they attain the meaning, attain the Dharma, see the Dharma, and greatly rejoice with joy;
['ZH_T02_0113_001:0506a05_20']	å·²å–œä¾¿ç”Ÿæ¨‚ï¼Œå¾æ¨‚ä¾¿èº«æ»…ï¼›	å·²å–œä¾¿ç”Ÿæ¨‚ï¼Œå¾æ¨‚ä¾¿èº«æ»…ï¼›	001	Having rejoiced, they give rise to bliss, and from bliss the body is extinguished;
['ZH_T02_0113_001:0506a06_15']	èº«å·²æ»…ä¾¿å¾—å®‰éš±æ„ï¼Œå¾å®‰éš±ä¾¿å¾—å®šï¼›	èº«å·²æ»…ä¾¿å¾—å®‰éš±æ„ï¼Œå¾å®‰éš±ä¾¿å¾—å®šï¼›	001	With the body already extinguished, they attain peace of mind, and from peace they attain concentration;
['ZH_T02_0113_001:0506a08_6']	å¾å®šä¾¿å¦‚çŸ¥å¦‚è¦‹ï¼Œæ˜¯ç‚ºè‹¦è«¦ï¼Œæ˜¯ç‚ºç¿’ï¼Œæ˜¯ç‚ºç›¡ï¼Œæ˜¯ç‚ºè‹¦æ»…å‘é“è€…è«¦ã€‚	å¾å®šä¾¿å¦‚çŸ¥å¦‚è¦‹ï¼Œæ˜¯ç‚ºè‹¦è«¦ï¼Œæ˜¯ç‚ºç¿’ï¼Œæ˜¯ç‚ºç›¡ï¼Œæ˜¯ç‚ºè‹¦æ»…å‘é“è€…è«¦ã€‚	001	From concentration, one knows and sees as it is, this is the truth of suffering, this is the accumulation, this is the cessation, this is the path leading to the cessation of suffering.
['ZH_T02_0113_001:0506a08_9']	é›£æï¼	é›£æï¼	001	Nanda!
['ZH_T02_0113_001:0506a09_17']	è‹¥æ…§å¼Ÿå­åœ¨é‚ªä¸­ç‚ºç›´å¿µï¼Œæœ‰æ¨æ„ä¾¿ç‚ºæ¨ï¼Œæ„æœ‰æ‰€è‘—ä¾¿ä¸å—ã€‚	è‹¥æ…§å¼Ÿå­åœ¨é‚ªä¸­ç‚ºç›´å¿µï¼Œæœ‰æ¨æ„ä¾¿ç‚ºæ¨ï¼Œæ„æœ‰æ‰€è‘—ä¾¿ä¸å—ã€‚	001	If a wise disciple has thoughts of crookedness in the midst of crookedness, he immediately abandons hateful thoughts, and does not accept any attachments in the mind.
['ZH_T02_0113_001:0506a10_12']	æ˜¯ç‚ºæ…§å¼Ÿå­æ¨‚é“è¿¹ï¼Œç‚ºå¸¸å¿µæ³•å¾·ã€‚	æ˜¯ç‚ºæ…§å¼Ÿå­æ¨‚é“è¿¹ï¼Œç‚ºå¸¸å¿µæ³•å¾·ã€‚	001	This is called a wise disciple who delights in the path, and always contemplates the virtues of the Dharma.
['ZH_T02_0113_001:0506a11_3']	ã€Œé›£æï¼	ã€Œé›£æï¼	001	Nanda!
['ZH_T02_0113_001:0506a13_19']	è‹¥æ…§å¼Ÿå­å¿µæ¯”ä¸˜èšå¾·ï¼Œä½›çœ¾å¼Ÿå­ç‚ºæœ‰æ¸…æ·¨ã€ç‚ºæœ‰å®šã€ç‚ºæœ‰è„«ã€ç‚ºæœ‰è„«è¦‹æ…§ã€ç‚ºæœ‰è¡Œã€ç‚ºæœ‰æ‰€å¾—ï¼Œç‚ºæ˜¯ä¸–é–“ç¦ç”°ï¼Œå°‘æ–½å¾—ç¦ç„¡æœ‰é‡ã€‚	è‹¥æ…§å¼Ÿå­å¿µæ¯”ä¸˜èšå¾·ï¼Œä½›çœ¾å¼Ÿå­ç‚ºæœ‰æ¸…æ·¨ã€ç‚ºæœ‰å®šã€ç‚ºæœ‰è„«ã€ç‚ºæœ‰è„«è¦‹æ…§ã€ç‚ºæœ‰è¡Œã€ç‚ºæœ‰æ‰€å¾—ï¼Œç‚ºæ˜¯ä¸–é–“ç¦ç”°ï¼Œå°‘æ–½å¾—ç¦ç„¡æœ‰é‡ã€‚	001	If a wise disciple contemplates the virtues of the assembly of monks, the Buddha's disciples have purity, concentration, liberation, the wisdom of liberation and insight, practice, attainment, and are the world's field of blessings, where even a small offering brings immeasurable blessings.
['ZH_T02_0113_001:0506a19_1']	è‹¥çœ¾ä¸­æœ‰é ˆé™€æ´¹ï¼Œç‚ºä¿¡æœ‰é ˆé™€æ´¹ï¼Œè‹¥çœ¾æœ‰æ–¯é™€å«ï¼Œç‚ºä¿¡æœ‰æ–¯é™€å«ï¼Œè‹¥çœ¾æœ‰é˜¿é‚£å«ï¼Œç‚ºä¿¡æœ‰é˜¿é‚£å«ï¼Œè‹¥çœ¾æœ‰é˜¿ç¾…æ¼¢ï¼Œç‚ºä¿¡æœ‰é˜¿ç¾…æ¼¢ï¼Œæ˜¯ç‚ºç”·å­ï¼Œå››é›™è³¢è€…å…«è¼©äººä¸­ç¬¬ä¸€äººä¸­ä¹‹å‰›ï¼Œç‚ºäººå¸«ã€ç‚ºäººä¸­ã€æ‡‰å—æ­æ•¬è€…ï¼Œæ˜¯ç‚ºä¸‰ç•Œä¸­æœ€äººï¼	è‹¥çœ¾ä¸­æœ‰é ˆé™€æ´¹ï¼Œç‚ºä¿¡æœ‰é ˆé™€æ´¹ï¼Œè‹¥çœ¾æœ‰æ–¯é™€å«ï¼Œç‚ºä¿¡æœ‰æ–¯é™€å«ï¼Œè‹¥çœ¾æœ‰é˜¿é‚£å«ï¼Œç‚ºä¿¡æœ‰é˜¿é‚£å«ï¼Œè‹¥çœ¾æœ‰é˜¿ç¾…æ¼¢ï¼Œç‚ºä¿¡æœ‰é˜¿ç¾…æ¼¢ï¼Œæ˜¯ç‚ºç”·å­ï¼Œå››é›™è³¢è€…å…«è¼©äººä¸­ç¬¬ä¸€äººä¸­ä¹‹å‰›ï¼Œç‚ºäººå¸«ã€ç‚ºäººä¸­ã€æ‡‰å—æ­æ•¬è€…ï¼Œæ˜¯ç‚ºä¸‰ç•Œä¸­æœ€äººï¼	001	If there are srota-Äpannas in the assembly, they believe in the existence of srota-Äpannas; if there are saká¹›d-ÄgÄmins in the assembly, they believe in the existence of saká¹›d-ÄgÄmins; if there are anÄgÄmins in the assembly, they believe in the existence of anÄgÄmins; if there are arhats in the assembly, they believe in the existence of arhats. This is the foremost person among the four pairs of noble ones and the eight types of individuals, the most manly of men, the teacher of humans, the one who should be respected among humans, the foremost person in the three realms!
['ZH_T02_0113_001:0506a19_4']	é›£æï¼	é›£æï¼	001	Nanda!
['ZH_T02_0113_001:0506a20_9']	æ˜¯æ™‚æ…§å¼Ÿå­æ„ä¸è‘—è²ªæ¬²ï¼Œä¸è‘—ç‹æšã€ä¸è‘—æ„šç™¡ï¼Œä¾¿ç‚ºç›´æ„ï¼›	æ˜¯æ™‚æ…§å¼Ÿå­æ„ä¸è‘—è²ªæ¬²ï¼Œä¸è‘—ç‹æšã€ä¸è‘—æ„šç™¡ï¼Œä¾¿ç‚ºç›´æ„ï¼›	001	At that time, the wise disciple's mind is not attached to greed, anger, or delusion, and thus becomes upright;
['ZH_T02_0113_001:0506a21_16']	æ…§å¼Ÿå­æ„å·²ç›´ï¼Œå·²ç›´æ„ä¾¿å¾—ç¾©ã€ä¾¿å¾—æ³•ã€ä¾¿è¦‹æ³•ã€ä¾¿å¤§æ¨‚å–œï¼›	æ…§å¼Ÿå­æ„å·²ç›´ï¼Œå·²ç›´æ„ä¾¿å¾—ç¾©ã€ä¾¿å¾—æ³•ã€ä¾¿è¦‹æ³•ã€ä¾¿å¤§æ¨‚å–œï¼›	001	the wise disciple's mind, having become upright, attains the truth, attains the Dharma, sees the Dharma, and greatly delights;
['ZH_T02_0113_001:0506a22_7']	å·²å–œä¾¿ç”Ÿæ¨‚ï¼Œå¾æ¨‚ä¾¿èº«æ»…ï¼›	å·²å–œä¾¿ç”Ÿæ¨‚ï¼Œå¾æ¨‚ä¾¿èº«æ»…ï¼›	001	having delighted, bliss arises, and from bliss, the body is extinguished;
['ZH_T02_0113_001:0506a22_17']	èº«å·²æ»…ï¼Œä¾¿å¾—å®‰éš±æ„ï¼›	èº«å·²æ»…ï¼Œä¾¿å¾—å®‰éš±æ„ï¼›	001	the body having been extinguished, one attains a peaceful mind;
['ZH_T02_0113_001:0506a24_14']	å¾å®‰éš±ä¾¿å¾—å®šï¼Œå¾å®šä¾¿å¦‚çŸ¥å¦‚è¦‹ï¼Œæ˜¯ç‚ºè‹¦è«¦æ˜¯ç‚ºç¿’ã€æ˜¯ç‚ºç›¡ã€æ˜¯ç‚ºè‹¦æ»…å‘é“è€…è«¦ã€‚	å¾å®‰éš±ä¾¿å¾—å®šï¼Œå¾å®šä¾¿å¦‚çŸ¥å¦‚è¦‹ï¼Œæ˜¯ç‚ºè‹¦è«¦æ˜¯ç‚ºç¿’ã€æ˜¯ç‚ºç›¡ã€æ˜¯ç‚ºè‹¦æ»…å‘é“è€…è«¦ã€‚	001	Following tranquility, one attains concentration. Following concentration, one knows and sees as they are, this is the truth of suffering, this is the truth of its origin, this is the truth of its cessation, and this is the truth of the path leading to the cessation of suffering.
['ZH_T02_0113_001:0506a24_17']	é›£æï¼	é›£æï¼	001	Nanda!
['ZH_T02_0113_001:0506a27_3']	è‹¥æ…§å¼Ÿå­åœ¨é‚ªä¸­ç‚ºç›´å¿µï¼Œæœ‰æ¨æ„ä¾¿ç‚ºæ¨ï¼Œæ„æœ‰æ‰€è‘—ä¾¿ä¸å—ï¼Œæ˜¯ç‚ºæ…§å¼Ÿå­æ¨‚é“è¿¹ï¼Œç‚ºå¸¸å¿µæ¯”ä¸˜èšå¾·ã€‚	è‹¥æ…§å¼Ÿå­åœ¨é‚ªä¸­ç‚ºç›´å¿µï¼Œæœ‰æ¨æ„ä¾¿ç‚ºæ¨ï¼Œæ„æœ‰æ‰€è‘—ä¾¿ä¸å—ï¼Œæ˜¯ç‚ºæ…§å¼Ÿå­æ¨‚é“è¿¹ï¼Œç‚ºå¸¸å¿µæ¯”ä¸˜èšå¾·ã€‚	001	If a wise disciple has thoughts of uprightness amidst wrong, abandons hateful thoughts, and does not cling to attachments, this is called a wise disciple who delights in the path and always thinks of the virtues of the assembly of monks.
['ZH_T02_0113_001:0506a27_6']	é›£æï¼	é›£æï¼	001	Nanda!
