segmentnr	original	analyzed	folio	translated
['ZH_T23_1442_013:0693a04_7']	æˆ‘ä¹‹æ‰€å®—ï¼Œä½œå¦‚æ˜¯è¦‹ã€ä½œå¦‚æ˜¯èªªï¼Œä¸€åˆ‡æœ‰æƒ…ç„¡å› ç„¡ç·£è€Œæœ‰ç…©æƒ±ï¼Œä¸€åˆ‡æœ‰æƒ…ç„¡å› ç„¡ç·£ç‚ºç…©æƒ±æ‰€é€¼ï¼Œä¸€åˆ‡æœ‰æƒ…ç„¡å› ç„¡ç·£è€Œæœ‰æ¸…æ·¨ï¼Œä¸€åˆ‡æœ‰æƒ…ç„¡å› ç„¡ç·£è€Œå¾—æ¸…æ·¨ï¼Œä¸€åˆ‡æœ‰æƒ…ç„¡å› ç„¡ç·£è€Œæœ‰ç„¡çŸ¥ï¼Œä¸€åˆ‡æœ‰æƒ…ç„¡å› ç„¡ç·£äº†ç„¡çŸ¥äº‹ï¼Œä¸€åˆ‡æœ‰æƒ…ç„¡åŠ›ç„¡å‹¤ç„¡å‹‡ç„¡é€²ç„¡è‡ªç„¡ä»–ï¼Œä¸€åˆ‡æœ‰æƒ…è«¸æœ‰å‘½è€…ç„¡æœ‰å¨å‹¢ï¼Œæ–¼å…­ç”Ÿä¸­å¸¸å—è‹¦æ¨‚ï¼Œéæ­¤ä¾¿ç„¡ã€‚	æˆ‘ä¹‹æ‰€å®—ï¼Œä½œå¦‚æ˜¯è¦‹ã€ä½œå¦‚æ˜¯èªªï¼Œä¸€åˆ‡æœ‰æƒ…ç„¡å› ç„¡ç·£è€Œæœ‰ç…©æƒ±ï¼Œä¸€åˆ‡æœ‰æƒ…ç„¡å› ç„¡ç·£ç‚ºç…©æƒ±æ‰€é€¼ï¼Œä¸€åˆ‡æœ‰æƒ…ç„¡å› ç„¡ç·£è€Œæœ‰æ¸…æ·¨ï¼Œä¸€åˆ‡æœ‰æƒ…ç„¡å› ç„¡ç·£è€Œå¾—æ¸…æ·¨ï¼Œä¸€åˆ‡æœ‰æƒ…ç„¡å› ç„¡ç·£è€Œæœ‰ç„¡çŸ¥ï¼Œä¸€åˆ‡æœ‰æƒ…ç„¡å› ç„¡ç·£äº†ç„¡çŸ¥äº‹ï¼Œä¸€åˆ‡æœ‰æƒ…ç„¡åŠ›ç„¡å‹¤ç„¡å‹‡ç„¡é€²ç„¡è‡ªç„¡ä»–ï¼Œä¸€åˆ‡æœ‰æƒ…è«¸æœ‰å‘½è€…ç„¡æœ‰å¨å‹¢ï¼Œæ–¼å…­ç”Ÿä¸­å¸¸å—è‹¦æ¨‚ï¼Œéæ­¤ä¾¿ç„¡ã€‚	013	I hold this view and speak thus: all sentient beings have afflictions without cause or condition, all sentient beings are afflicted by afflictions without cause or condition, all sentient beings have purity without cause or condition, all sentient beings attain purity without cause or condition, all sentient beings have ignorance without cause or condition, all sentient beings understand ignorant matters without cause or condition, all sentient beings have no power, no diligence, no courage, no progress, no self, no others, all sentient beings who have life have no power, and constantly experience suffering and happiness in the six destinies, and nothing beyond this.
['ZH_T23_1442_013:0693a05_1']	ã€æ™‚å¯¦åŠ›å­èæ˜¯èªå·²ä¾¿ä½œæ˜¯å¿µï¼š	ã€æ™‚å¯¦åŠ›å­èæ˜¯èªå·²ä¾¿ä½œæ˜¯å¿µï¼š	013	At that time, when Subhadra heard this, he thought:
['ZH_T23_1442_013:0693a06_11']	ã€Œæ­¤ä¹‹å¤§å¸«èƒŒæ­£è·¯è¡Œé‚ªé“ï¼ŒçŒ¶å¦‚éšªé€”æ˜¯å¯æ€–ç•ï¼Œæ™ºè€…æ‰€æ£„ä¸æ‡‰ä¿®ç¿’ã€‚	ã€Œæ­¤ä¹‹å¤§å¸«èƒŒæ­£è·¯è¡Œé‚ªé“ï¼ŒçŒ¶å¦‚éšªé€”æ˜¯å¯æ€–ç•ï¼Œæ™ºè€…æ‰€æ£„ä¸æ‡‰ä¿®ç¿’ã€‚	013	This great teacher goes against the right path and practices the wrong way, like a dangerous road that is frightening. It should be abandoned by the wise and not cultivated.
['ZH_T23_1442_013:0693a06_17']	ã€èªªä¼½ä»–æ›°ï¼š	ã€èªªä¼½ä»–æ›°ï¼š	013	He spoke a verse, saying:
['ZH_T23_1442_013:0693a07_14']	ã€Œæƒ¡æ…§èªªæƒ¡æ³•ï¼Œã€€ã€€å¯¦æ„šç¨±å¤§å¸«ï¼›	ã€Œæƒ¡æ…§èªªæƒ¡æ³•ï¼Œã€€ã€€å¯¦æ„šç¨±å¤§å¸«ï¼›	013	Evil wisdom expounds evil dharmas, truly foolish, called the Great Master;
['ZH_T23_1442_013:0693a08_13']	æ­¤æ³•å°‡ç‚ºæ˜¯ï¼Œã€€ã€€ä½•è€…åéæ³•ï¼Ÿ	æ­¤æ³•å°‡ç‚ºæ˜¯ï¼Œã€€ã€€ä½•è€…åéæ³•ï¼Ÿ	013	This dharma will be so, which is called non-dharma?
['ZH_T23_1442_013:0693a09_18']	ã€å¦‚æ˜¯çŸ¥å·²ï¼Œå¦‚æ“Šç©ºå™¨ä½†æœ‰è™›è²ï¼Œæ£„ä¹‹è€Œå»ã€‚	ã€å¦‚æ˜¯çŸ¥å·²ï¼Œå¦‚æ“Šç©ºå™¨ä½†æœ‰è™›è²ï¼Œæ£„ä¹‹è€Œå»ã€‚	013	Knowing this, like striking an empty vessel only producing empty sounds, he abandoned it and left.
['ZH_T23_1442_013:0693a11_1']	æ™‚å¯¦åŠ›å­å¾©æ›´å¾€è©£çŠé€ç§»æ¯˜å‰ŒçŸ¥å­æ‰€ï¼Œè€Œç™½ä¹‹æ›°ï¼š	æ™‚å¯¦åŠ›å­å¾©æ›´å¾€è©£çŠé€ç§»æ¯˜å‰ŒçŸ¥å­æ‰€ï¼Œè€Œç™½ä¹‹æ›°ï¼š	013	Then Åšreá¹‡iya BimbisÄra went again to SaÃ±jayÄ« Vairaá¹­á¹­Ä«putra and said to him:
['ZH_T23_1442_013:0693a11_11']	ã€Œä½•è€…æ˜¯ä»æ‰€å®—æ³•ç†ï¼Ÿ	ã€Œä½•è€…æ˜¯ä»æ‰€å®—æ³•ç†ï¼Ÿ	013	What is the principle of the dharma that you uphold?
['ZH_T23_1442_013:0693a11_20']	æ–¼è«¸å¼Ÿå­ä»¥ä½•æ•™æˆï¼Ÿ	æ–¼è«¸å¼Ÿå­ä»¥ä½•æ•™æˆï¼Ÿ	013	How do you instruct your disciples?
['ZH_T23_1442_013:0693a12_8']	å‹¤ä¿®æ¢µè¡Œç•¶ç²ä½•æœï¼Ÿ	å‹¤ä¿®æ¢µè¡Œç•¶ç²ä½•æœï¼Ÿ	013	What fruits will be obtained by diligently practicing pure conduct?
['ZH_T23_1442_013:0693a12_14']	ã€å½¼å¸«å‘Šæ›°ï¼š	ã€å½¼å¸«å‘Šæ›°ï¼š	013	That teacher said:
['ZH_T23_1442_013:0693a12_18']	ã€Œå¤ªå­ï¼	ã€Œå¤ªå­ï¼	013	Prince!
['ZH_T23_1442_013:0693a19_5']	æˆ‘ä¹‹æ‰€å®—ï¼Œä½œå¦‚æ˜¯è¦‹ã€ä½œå¦‚æ˜¯èªªï¼Œè‹¥è‡ªæ®ºæ•™ä»–æ®ºï¼Œè‡ªæ–«æ•™ä»–æ–«ï¼Œè‡ªç…®æ•™ä»–ç…®ï¼Œè‡ªç›œé‚ªè¡Œå¦„èªé£²é…’ï¼ŒåŠä»¥æ•™äººç‚ºæ®ºç­‰æ•…ï¼Œç©¿ç‰†é–‹é–å®ˆæ‰éšªé€”ï¼ŒæŒè«¸åŠè¼ªæ®ºå®³ç¾¤å“ï¼Œæ–¼å¤§åœ°ä¸Šæ‰€æœ‰æœ‰æƒ…æ‚‰çš†æ–¬æ–«ï¼Œä»¤å…¶å‘½æ–·ç‚ºå¤§è‚‰èšï¼Œå¼¶ä¼½æ²³å·²å—ä½œæ–¯æƒ¡æ¥­ï¼Œå¼¶ä¼½æ²³å·²åŒ—è¨­å¤§ç¦æœƒï¼Œä¸ç”±æ­¤æ•…æœ‰ç½ªç¦å› æ‹›ç½ªç¦å ±ã€‚	æˆ‘ä¹‹æ‰€å®—ï¼Œä½œå¦‚æ˜¯è¦‹ã€ä½œå¦‚æ˜¯èªªï¼Œè‹¥è‡ªæ®ºæ•™ä»–æ®ºï¼Œè‡ªæ–«æ•™ä»–æ–«ï¼Œè‡ªç…®æ•™ä»–ç…®ï¼Œè‡ªç›œé‚ªè¡Œå¦„èªé£²é…’ï¼ŒåŠä»¥æ•™äººç‚ºæ®ºç­‰æ•…ï¼Œç©¿ç‰†é–‹é–å®ˆæ‰éšªé€”ï¼ŒæŒè«¸åŠè¼ªæ®ºå®³ç¾¤å“ï¼Œæ–¼å¤§åœ°ä¸Šæ‰€æœ‰æœ‰æƒ…æ‚‰çš†æ–¬æ–«ï¼Œä»¤å…¶å‘½æ–·ç‚ºå¤§è‚‰èšï¼Œå¼¶ä¼½æ²³å·²å—ä½œæ–¯æƒ¡æ¥­ï¼Œå¼¶ä¼½æ²³å·²åŒ—è¨­å¤§ç¦æœƒï¼Œä¸ç”±æ­¤æ•…æœ‰ç½ªç¦å› æ‹›ç½ªç¦å ±ã€‚	013	My school holds this view and makes this statement: If one kills oneself or teaches others to kill, if one cuts oneself or teaches others to cut, if one cooks oneself or teaches others to cook, if one steals, engages in sexual misconduct, speaks falsely, or drinks alcohol, and if one teaches others to kill and so forth, then for the sake of killing and so on, one breaks through walls, opens locks, guards dangerous paths, holds various swords and wheels to kill many beings, and on the great earth, all the sentient beings are all cut down, causing their lives to be cut off to form a great mass of flesh. If one performs these evil deeds south of the Ganges River, and sets up great meritorious assemblies north of the Ganges River, it is not because of this that one will incur the causes and effects of sin and merit.
['ZH_T23_1442_013:0693a20_4']	åˆå¾©ä¸ç”±å¸ƒæ–½æŒæˆ’å°‘æ¬²çŸ¥è¶³è€Œç²ç•¶æœã€‚	åˆå¾©ä¸ç”±å¸ƒæ–½æŒæˆ’å°‘æ¬²çŸ¥è¶³è€Œç²ç•¶æœã€‚	013	Moreover, it is not because of giving, upholding precepts, having few desires, or being content that one obtains the future fruit.
['ZH_T23_1442_013:0693a20_18']	ã€æ™‚å¯¦åŠ›å­èæ˜¯èªå·²ä¾¿ä½œæ˜¯å¿µï¼š	ã€æ™‚å¯¦åŠ›å­èæ˜¯èªå·²ä¾¿ä½œæ˜¯å¿µï¼š	013	At that time, when SubhÅ«ti heard these words, he thought like this:
['ZH_T23_1442_013:0693a22_8']	ã€Œæ­¤ä¹‹å¤§å¸«èƒŒæ­£è·¯è¡Œé‚ªé“ï¼ŒçŒ¶å¦‚éšªé€”å¤šæœ‰æ€–ç•ï¼Œæ™ºè€…æ‰€æ£„ä¸æ‡‰ä¿®ç¿’ã€‚	ã€Œæ­¤ä¹‹å¤§å¸«èƒŒæ­£è·¯è¡Œé‚ªé“ï¼ŒçŒ¶å¦‚éšªé€”å¤šæœ‰æ€–ç•ï¼Œæ™ºè€…æ‰€æ£„ä¸æ‡‰ä¿®ç¿’ã€‚	013	This great teacher goes against the right path and practices the wrong path, just like a dangerous path with many fears. It should not be practiced by the wise.
['ZH_T23_1442_013:0693a22_14']	ã€èªªä¼½ä»–æ›°ï¼š	ã€èªªä¼½ä»–æ›°ï¼š	013	He spoke a verse, saying:
['ZH_T23_1442_013:0693a23_14']	ã€Œæƒ¡æ…§èªªæƒ¡æ³•ï¼Œã€€ã€€å¯¦æ„šç¨±å¤§å¸«ï¼›	ã€Œæƒ¡æ…§èªªæƒ¡æ³•ï¼Œã€€ã€€å¯¦æ„šç¨±å¤§å¸«ï¼›	013	The one with evil wisdom speaks of evil dharmas, truly foolish, yet called a great teacher;
['ZH_T23_1442_013:0693a24_13']	æ­¤æ³•å°‡ç‚ºæ˜¯ï¼Œã€€ã€€ä½•è€…åéæ³•ï¼Ÿ	æ­¤æ³•å°‡ç‚ºæ˜¯ï¼Œã€€ã€€ä½•è€…åéæ³•ï¼Ÿ	013	This dharma will be what? Which is called non-dharma?
['ZH_T23_1442_013:0693a25_18']	ã€å¦‚æ˜¯çŸ¥å·²ï¼Œå¦‚æ“Šç©ºå™¨ä½†æœ‰è™›è²ï¼Œæ£„ä¹‹è€Œå»ã€‚	ã€å¦‚æ˜¯çŸ¥å·²ï¼Œå¦‚æ“Šç©ºå™¨ä½†æœ‰è™›è²ï¼Œæ£„ä¹‹è€Œå»ã€‚	013	Knowing this, like striking an empty vessel only producing empty sounds, he abandoned it and left.
['ZH_T23_1442_013:0693a27_3']	æ™‚å¯¦åŠ›å­å¾©æ›´å¾€è©£é˜¿å¸‚å¤šé›èˆç”˜è·‹ç¾…æ‰€ï¼Œè€Œç™½ä¹‹æ›°ï¼š	æ™‚å¯¦åŠ›å­å¾©æ›´å¾€è©£é˜¿å¸‚å¤šé›èˆç”˜è·‹ç¾…æ‰€ï¼Œè€Œç™½ä¹‹æ›°ï¼š	013	Then Åšreá¹‡iya AnÄthapiá¹‡á¸ada went again to Aá¹›á¹£á¹­a-Å›Äá¹‡á¸ilya-Gautama and said to him:
['ZH_T23_1442_013:0693a27_7']	ã€Œå¤§å¸«ï¼	ã€Œå¤§å¸«ï¼	013	Great teacher!
['ZH_T23_1442_013:0693a27_16']	ä½•è€…æ˜¯ä»æ‰€å®—æ³•ç†ï¼Ÿ	ä½•è€…æ˜¯ä»æ‰€å®—æ³•ç†ï¼Ÿ	013	What is the principle of the dharma that you uphold?
['ZH_T23_1442_013:0693a28_4']	æ–¼è«¸å¼Ÿå­ä»¥ä½•æ•™èª¨ï¼Ÿ	æ–¼è«¸å¼Ÿå­ä»¥ä½•æ•™èª¨ï¼Ÿ	013	How do you instruct your disciples?
['ZH_T23_1442_013:0693a28_13']	å‹¤ä¿®æ¢µè¡Œç•¶ç²ä½•æœï¼Ÿ	å‹¤ä¿®æ¢µè¡Œç•¶ç²ä½•æœï¼Ÿ	013	What fruits will one attain by diligently practicing pure conduct?
['ZH_T23_1442_013:0693a28_19']	ã€å½¼å¸«ç­”æ›°ï¼š	ã€å½¼å¸«ç­”æ›°ï¼š	013	That teacher replied:
['ZH_T23_1442_013:0693a29_1']	ã€Œå¤ªå­ï¼	ã€Œå¤ªå­ï¼	013	Prince!
['ZH_T23_1442_013:0693b02_6']	æˆ‘ä¹‹æ‰€å®—ï¼Œä½œå¦‚æ˜¯è¦‹ã€ä½œå¦‚æ˜¯èªªï¼Œæ­¤ä¸ƒäº‹èº«ç„¡èƒ½ä½œç„¡æ‰€ä½œï¼Œç„¡èƒ½è®ŠåŒ–ç„¡æ‰€è®ŠåŒ–ï¼Œä¸å¯æå®³å…¶é«”æ’å­˜ã€‚	æˆ‘ä¹‹æ‰€å®—ï¼Œä½œå¦‚æ˜¯è¦‹ã€ä½œå¦‚æ˜¯èªªï¼Œæ­¤ä¸ƒäº‹èº«ç„¡èƒ½ä½œç„¡æ‰€ä½œï¼Œç„¡èƒ½è®ŠåŒ–ç„¡æ‰€è®ŠåŒ–ï¼Œä¸å¯æå®³å…¶é«”æ’å­˜ã€‚	013	I uphold this view and speak thus: these seven things of the body are without action, without transformation, without change, and their essence always abides, unable to be harmed.
['ZH_T23_1442_013:0693b02_11']	ä½•è¬‚ç‚ºä¸ƒï¼Ÿ	ä½•è¬‚ç‚ºä¸ƒï¼Ÿ	013	What are the seven?
['ZH_T23_1442_013:0693b07_11']	æ‰€è¬‚åœ°èº«ã€æ°´èº«ã€ç«èº«ã€é¢¨èº«ã€è‹¦èº«ã€æ¨‚èº«ã€å‘½èº«ï¼Œèšåœ¨ä¸€è™•çŒ¶å¦‚è˜†æŸï¼Œé‹å‹•è½‰è®Šäº’ä¸ç›¸æƒ±ï¼Œç½ªç¦è‹¦æ¨‚äº¦ä¸ç›¸å¿“ï¼Œå‡ä½¿æœ‰äººæ–¬æˆªä»–é¦–å½¼ç„¡è‹¦ç—›ï¼Œæ–¼å…¶èº«ä¸­å­”éš™ä¹‹å…§åˆ€åŠéš¨éä¸æå…¶å‘½ï¼Œæ–¼æ­¤å¯¦ç„¡èƒ½æ®ºæ‰€æ®ºã€èƒ½å•æ‰€å•ã€èƒ½æ†¶æ‰€æ†¶ã€‚	æ‰€è¬‚åœ°èº«ã€æ°´èº«ã€ç«èº«ã€é¢¨èº«ã€è‹¦èº«ã€æ¨‚èº«ã€å‘½èº«ï¼Œèšåœ¨ä¸€è™•çŒ¶å¦‚è˜†æŸï¼Œé‹å‹•è½‰è®Šäº’ä¸ç›¸æƒ±ï¼Œç½ªç¦è‹¦æ¨‚äº¦ä¸ç›¸å¿“ï¼Œå‡ä½¿æœ‰äººæ–¬æˆªä»–é¦–å½¼ç„¡è‹¦ç—›ï¼Œæ–¼å…¶èº«ä¸­å­”éš™ä¹‹å…§åˆ€åŠéš¨éä¸æå…¶å‘½ï¼Œæ–¼æ­¤å¯¦ç„¡èƒ½æ®ºæ‰€æ®ºã€èƒ½å•æ‰€å•ã€èƒ½æ†¶æ‰€æ†¶ã€‚	013	Namely, the earth body, water body, fire body, wind body, painful body, blissful body, and life body, gathered together like a bundle of reeds, moving and transforming without mutually harming each other. Sin, merit, suffering, and joy also do not conflict with each other. Suppose someone were to cut off another's head, they would not feel pain. Within the pores of their body, swords would pass through without harming their life. In reality, there is no killer, no one to be killed, no one to ask, no one to be asked, no one to remember, no one to be remembered.
['ZH_T23_1442_013:0693b16_10_0']	æ–¼å…¶å››æ–¹æœ‰ä¸€è¬å››åƒç·£ç”Ÿç”¢é–€ï¼Œå¾©æœ‰å…­è¬å…­åƒ	æ–¼å…¶å››æ–¹æœ‰ä¸€è¬å››åƒç·£ç”Ÿç”¢é–€ï¼Œå¾©æœ‰å…­è¬å…­åƒ	013	In the four directions, there are 14,000 channels of birth and production, and 66,600
['ZH_T23_1442_013:0693b16_10_1']	ä¹ƒè‡³äº”ä¸‰äºŒä¸€åŠæ¥­å·®åˆ¥ï¼Œåˆæœ‰å…­åäºŒè¡Œã€å…­å	ä¹ƒè‡³äº”ä¸‰äºŒä¸€åŠæ¥­å·®åˆ¥ï¼Œåˆæœ‰å…­åäºŒè¡Œã€å…­å	013	up to 3, 2, 1, and 1/2 different kinds of karma. There are also 62 kinds of conduct, 62
['ZH_T23_1442_013:0693b16_10_2']	äºŒä¸­åŠ«ã€äºŒåƒåœ°ç„ã€ä¸‰åƒè«¸æ ¹ã€ä¸‰åå…­ç²¾æ°£ï¼Œ	äºŒä¸­åŠ«ã€äºŒåƒåœ°ç„ã€ä¸‰åƒè«¸æ ¹ã€ä¸‰åå…­ç²¾æ°£ï¼Œ	013	intermediate kalpas, 2,000 hells, 3,000 faculties, and 36 kinds of vital energy,
['ZH_T23_1442_013:0693b16_10_3']	å››è¬ä¹åƒé¾æ—ï¼Œå››è¬ä¹åƒå¦™ç¿…é³¥æ—ï¼Œå››è¬ä¹åƒ	å››è¬ä¹åƒé¾æ—ï¼Œå››è¬ä¹åƒå¦™ç¿…é³¥æ—ï¼Œå››è¬ä¹åƒ	013	49,000 clans of dragons, 49,000 clans of garuá¸as, and 49,000
['ZH_T23_1442_013:0693b16_10_4', 'ZH_T23_1442_013:0693b16_10_5']	ä»¥äººé ‚éª¨é£Ÿå¤–é“ç¨®æ—ï¼Œå››è¬ä¹åƒéœ²å½¢å¤–é“ç¨®æ—ğŸ”½ï¼Œå››è¬ä¹åƒé‚ªå‘½å¤–é“ç¨®æ—ï¼Œæœ‰ä¸ƒç¨®æƒ³ã€ä¸ƒç¨®é˜¿	ä»¥äººé ‚éª¨é£Ÿå¤–é“ç¨®æ—ï¼Œå››è¬ä¹åƒéœ²å½¢å¤–é“ç¨®æ— ï¼Œå››è¬ä¹åƒé‚ªå‘½å¤–é“ç¨®æ—ï¼Œæœ‰ä¸ƒç¨®æƒ³ã€ä¸ƒç¨®é˜¿	013	The human skull eats the species of non-Buddhists, the species of forty-nine thousand naked non-Buddhists
['ZH_T23_1442_013:0693b16_10_6']	è˜‡ç¾…ã€ä¸ƒç¨®ç•¢èˆé®ã€ä¸ƒç¨®å¤©ã€ä¸ƒç¨®äººï¼Œæœ‰ä¸ƒç™¾	è˜‡ç¾…ã€ä¸ƒç¨®ç•¢èˆé®ã€ä¸ƒç¨®å¤©ã€ä¸ƒç¨®äººï¼Œæœ‰ä¸ƒç™¾	013	, the species of forty-nine thousand heterodox non-Buddhists, there are seven kinds of thoughts, seven kinds of asuras, seven kinds of piÅ›Äcas, seven kinds of gods, seven kinds of humans, there are seven hundred
['ZH_T23_1442_013:0693b16_10_7']	ä¸ƒæ± ï¼Œæœ‰ä¸ƒç™¾ä¸ƒå¤¢ï¼Œæœ‰ä¸ƒç™¾ä¸ƒå²¸ï¼Œæœ‰ä¸ƒç™¾ä¸ƒå³¯	ä¸ƒæ± ï¼Œæœ‰ä¸ƒç™¾ä¸ƒå¤¢ï¼Œæœ‰ä¸ƒç™¾ä¸ƒå²¸ï¼Œæœ‰ä¸ƒç™¾ä¸ƒå³¯	013	and seven ponds, there are seven hundred and seven dreams, there are seven hundred and seven banks, there are seven hundred and seven peaks
['ZH_T23_1442_013:0693b16_10_8']	ä¸ƒç¨®å‹ç”Ÿï¼Œåç¨®å¢é•·å…«å¤§äººåœ°ã€‚	ä¸ƒç¨®å‹ç”Ÿï¼Œåç¨®å¢é•·å…«å¤§äººåœ°ã€‚	013	seven kinds of superior births, ten kinds of growth, and the eight stages of great men.
['ZH_T23_1442_013:0693b17_11']	å¦‚æ˜¯ç¶“æ–¼å…«è¬å››åƒå¤§åŠ«ï¼Œæ‰€æœ‰æ„šæ™ºçš†ç›¡è‹¦é‚Šã€‚	å¦‚æ˜¯ç¶“æ–¼å…«è¬å››åƒå¤§åŠ«ï¼Œæ‰€æœ‰æ„šæ™ºçš†ç›¡è‹¦é‚Šã€‚	013	Thus, for eighty-four thousand great kalpas, all the foolish and wise reach the end of suffering.
['ZH_T23_1442_013:0693b20_9']	è­¬å¦‚æœ‰äººä»¥ç´°çµ²ç¸ˆæ“²è™›ç©ºä¸­é‚„å¢®äºåœ°ï¼Œå¦‚æ˜¯æ„šæ™ºç¶“å…«è¬å››åƒå¤§åŠ«è¼ªè¿´å¾€å¾©ç›¡è‹¦é‚Šéš›ï¼Œæ–¼æ­¤ä¸–é–“å¯¦ç„¡æ²™é–€å©†ç¾…é–€èƒ½ä½œæ˜¯èªªï¼š	è­¬å¦‚æœ‰äººä»¥ç´°çµ²ç¸ˆæ“²è™›ç©ºä¸­é‚„å¢®äºåœ°ï¼Œå¦‚æ˜¯æ„šæ™ºç¶“å…«è¬å››åƒå¤§åŠ«è¼ªè¿´å¾€å¾©ç›¡è‹¦é‚Šéš›ï¼Œæ–¼æ­¤ä¸–é–“å¯¦ç„¡æ²™é–€å©†ç¾…é–€èƒ½ä½œæ˜¯èªªï¼š	013	It is like a person throwing a fine thread into the air and then falling to the ground. In this way, the foolish and wise go through eighty-four thousand great kalpas, revolving and going back and forth, reaching the end of suffering. In this world, there are indeed no Å›ramaá¹‡as or brÄhmaá¹‡as who can say:
['ZH_T23_1442_013:0693b21_17']	ã€æˆ‘åˆ¶æˆ’ç¦ä»¤è«¸å¼Ÿå­å¸¸å‹¤è‹¦ç¯€å …ä¿®æ¢µè¡Œï¼Œæœªç†Ÿä¹‹æ¥­èƒ½ä»¤æˆç†Ÿã€‚	ã€æˆ‘åˆ¶æˆ’ç¦ä»¤è«¸å¼Ÿå­å¸¸å‹¤è‹¦ç¯€å …ä¿®æ¢µè¡Œï¼Œæœªç†Ÿä¹‹æ¥­èƒ½ä»¤æˆç†Ÿã€‚	013	'I have established precepts to restrain my disciples, always diligently practicing austerities and firmly cultivating pure conduct, enabling unripe karma to ripen.
['ZH_T23_1442_013:0693b23_2']	æ¥­æ—¢ç†Ÿå·²èƒ½æ¨çœ¾æƒ¡è‡³è‹¦é‚Šéš›ï¼Œå¿…å®šèƒ½æ–·è«¸æœ‰è‹¦æ¨‚ã€‚	æ¥­æ—¢ç†Ÿå·²èƒ½æ¨çœ¾æƒ¡è‡³è‹¦é‚Šéš›ï¼Œå¿…å®šèƒ½æ–·è«¸æœ‰è‹¦æ¨‚ã€‚	013	When karma has ripened, one can abandon all evil and reach the end of suffering, and will definitely be able to cut off all suffering and happiness.'
['ZH_T23_1442_013:0693b24_2']	ã€èªªåŠ«å¢æ¸›æ­¤äº‹çš†ç„¡ï¼Œç„¶è€Œå¿…é ˆæµè½‰ç”Ÿæ­»ã€‚	ã€èªªåŠ«å¢æ¸›æ­¤äº‹çš†ç„¡ï¼Œç„¶è€Œå¿…é ˆæµè½‰ç”Ÿæ­»ã€‚	013	Speaking of the increase and decrease of eons, this matter is all nonexistent, yet one must still flow through birth and death.
['ZH_T23_1442_013:0693b25_14']	ã€çˆ¾æ™‚å¯¦åŠ›å­èæ˜¯èªå·²ï¼Œä¾¿ä½œæ˜¯å¿µï¼š	ã€çˆ¾æ™‚å¯¦åŠ›å­èæ˜¯èªå·²ï¼Œä¾¿ä½œæ˜¯å¿µï¼š	013	At that time, when Åšreá¹‡ika heard these words, he thought:
['ZH_T23_1442_013:0693b27_8']	ã€Œæ­¤ä¹‹å¤§å¸«ä¾¿èƒŒæ­£è·¯è¡Œæ–¼é‚ªé“ï¼ŒçŒ¶å¦‚éšªé€”å¤šæœ‰æ€–ç•ï¼Œæ™ºè€…æ‰€æ£„ä¸æ‡‰ä¿®ç¿’ã€‚	ã€Œæ­¤ä¹‹å¤§å¸«ä¾¿èƒŒæ­£è·¯è¡Œæ–¼é‚ªé“ï¼ŒçŒ¶å¦‚éšªé€”å¤šæœ‰æ€–ç•ï¼Œæ™ºè€…æ‰€æ£„ä¸æ‡‰ä¿®ç¿’ã€‚	013	This great teacher has turned away from the right path and walks on the wrong path, like a dangerous road with many fears, abandoned by the wise and not to be practiced.
['ZH_T23_1442_013:0693b27_14']	ã€èªªä¼½ä»–æ›°ï¼š	ã€èªªä¼½ä»–æ›°ï¼š	013	 He spoke a verse, saying:
['ZH_T23_1442_013:0693b28_14']	ã€Œæƒ¡æ…§èªªæƒ¡æ³•ï¼Œã€€ã€€å¯¦æ„šç¨±å¤§å¸«ï¼›	ã€Œæƒ¡æ…§èªªæƒ¡æ³•ï¼Œã€€ã€€å¯¦æ„šç¨±å¤§å¸«ï¼›	013	Evil wisdom speaks of evil dharmas, truly foolish ones call it the great teacher;
['ZH_T23_1442_013:0693b29_13']	æ­¤æ³•å°‡ç‚ºæ˜¯ï¼Œã€€ã€€ä½•è€…åéæ³•ï¼Ÿ	æ­¤æ³•å°‡ç‚ºæ˜¯ï¼Œã€€ã€€ä½•è€…åéæ³•ï¼Ÿ	013	Will this dharma become correct, or which one is called non-dharma?
['ZH_T23_1442_013:0693c01_18']	ã€å¦‚æ˜¯çŸ¥å·²ï¼Œå¦‚æ“Šç©ºå™¨ä½†æœ‰è™›è²ï¼Œæ£„ä¹‹è€Œå»ã€‚	ã€å¦‚æ˜¯çŸ¥å·²ï¼Œå¦‚æ“Šç©ºå™¨ä½†æœ‰è™›è²ï¼Œæ£„ä¹‹è€Œå»ã€‚	013	Knowing this, like striking an empty vessel only producing empty sounds, he abandoned it and left.
['ZH_T23_1442_013:0693c03_3']	æ™‚å¯¦åŠ›å­å¾©æ›´å¾€è©£è„šä¿±é™€è¿¦å¤šè¡é‚£å­æ‰€ï¼Œè€Œç™½ä¹‹æ›°ï¼š	æ™‚å¯¦åŠ›å­å¾©æ›´å¾€è©£è„šä¿±é™€è¿¦å¤šè¡é‚£å­æ‰€ï¼Œè€Œç™½ä¹‹æ›°ï¼š	013	At that time, RÄhula went again to KÄtyÄyana, the son of KÄtyÄyana, and said to him:
['ZH_T23_1442_013:0693c03_7']	ã€Œå¤§å¸«ï¼	ã€Œå¤§å¸«ï¼	013	Great teacher!
['ZH_T23_1442_013:0693c03_16']	ä½•è€…æ˜¯ä»æ‰€å®—æ³•ç†ï¼Ÿ	ä½•è€…æ˜¯ä»æ‰€å®—æ³•ç†ï¼Ÿ	013	What is the principle of the Dharma that you uphold?
['ZH_T23_1442_013:0693c04_4']	æ–¼è«¸å¼Ÿå­ä»¥ä½•æ•™èª¨ï¼Ÿ	æ–¼è«¸å¼Ÿå­ä»¥ä½•æ•™èª¨ï¼Ÿ	013	How do you instruct your disciples?
['ZH_T23_1442_013:0693c04_13']	å‹¤ä¿®æ¢µè¡Œç²å¾—ä½•æœï¼Ÿ	å‹¤ä¿®æ¢µè¡Œç²å¾—ä½•æœï¼Ÿ	013	What fruits do they attain by diligently practicing the holy life?
['ZH_T23_1442_013:0693c04_19']	ã€å½¼å¸«ç­”æ›°ï¼š	ã€å½¼å¸«ç­”æ›°ï¼š	013	That teacher replied:
['ZH_T23_1442_013:0693c05_1']	ã€Œå¤ªå­ï¼	ã€Œå¤ªå­ï¼	013	Prince!
['ZH_T23_1442_013:0693c06_9']	æˆ‘ä¹‹æ‰€å®—ï¼Œä½œå¦‚æ˜¯è¦‹ã€ä½œå¦‚æ˜¯èªªï¼Œè‹¥æœ‰äººä¾†è‡³æ–¼æˆ‘æ‰€ï¼Œä½œå¦‚æ˜¯å•ï¼š	æˆ‘ä¹‹æ‰€å®—ï¼Œä½œå¦‚æ˜¯è¦‹ã€ä½œå¦‚æ˜¯èªªï¼Œè‹¥æœ‰äººä¾†è‡³æ–¼æˆ‘æ‰€ï¼Œä½œå¦‚æ˜¯å•ï¼š	013	I uphold this view and teach thus: If someone comes to me and asks like this:
['ZH_T23_1442_013:0693c06_15']	ã€æœ‰å¾Œä¸–è€¶ï¼Ÿ	ã€æœ‰å¾Œä¸–è€¶ï¼Ÿ	013	'Is there an afterlife?
['ZH_T23_1442_013:0693c06_20', 'ZH_T23_1442_013:0693c06_23']	ã€æˆ‘å ±è¨€ï¼šğŸ”½ã€æœ‰ã€‚	ã€æˆ‘å ±è¨€ï¼š ã€æœ‰ã€‚	013	' I would answer:ğŸ”½'Yes.'
['ZH_T23_1442_013:0693c07_1']	ã€ã€ç„¡è€¶ï¼Ÿ	ã€ã€ç„¡è€¶ï¼Ÿ	013	'Is there not?
['ZH_T23_1442_013:0693c07_6']	ã€æˆ‘å ±è¨€ï¼š	ã€æˆ‘å ±è¨€ï¼š	013	' I would answer:
['ZH_T23_1442_013:0693c07_9']	ã€ç„¡ã€‚	ã€ç„¡ã€‚	013	'No,ğŸ”½ğŸ”½
['ZH_T23_1442_013:0693c07_17']	ã€ã€äº¦æœ‰äº¦ç„¡è€¶ï¼Ÿ	ã€ã€äº¦æœ‰äº¦ç„¡è€¶ï¼Ÿ	013	'Is it both that there is and that there is not?
['ZH_T23_1442_013:0693c07_22']	ã€æˆ‘å ±è¨€ï¼š	ã€æˆ‘å ±è¨€ï¼š	013	' I would answer:
['ZH_T23_1442_013:0693c08_1']	ã€äº¦æœ‰äº¦ç„¡ã€‚	ã€äº¦æœ‰äº¦ç„¡ã€‚	013	'It is both that there is and that there is not.'
['ZH_T23_1442_013:0693c08_9']	ã€ã€éæœ‰éç„¡è€¶ï¼Ÿ	ã€ã€éæœ‰éç„¡è€¶ï¼Ÿ	013	'Is it neither that there is nor that there is not?
