segmentnr	original	analyzed	translated
['ZH_T35_1735_059:0951b16_2']	å…«ç„¡ç–²å­ï¼›	å…«ç„¡ç–²å­ï¼›	Eight is being tireless;
['ZH_T35_1735_059:0951b16_7']	ä¹å¦‚èªªè¡Œï¼›	ä¹å¦‚èªªè¡Œï¼›	Nine is practicing as taught;
['ZH_T35_1735_059:0951b16_13']	åçŸ¥è«¸ç¶“è«–ï¼›	åçŸ¥è«¸ç¶“è«–ï¼›	Ten is knowing various scriptures and treatises;
['ZH_T35_1735_059:0951b17_9']	åä¸€å³æˆå°±ä¸–æ™ºæ•…ï¼Œèƒ½æ™®æ›‰çœ¾ç”Ÿã€‚	åä¸€å³æˆå°±ä¸–æ™ºæ•…ï¼Œèƒ½æ™®æ›‰çœ¾ç”Ÿã€‚	Eleven is being able to universally enlighten sentient beings because one has already accomplished worldly wisdom.
['ZH_T35_1735_059:0951b18_12']	å¾Œã€Œä½æŒã€ä¸‹ä¸ƒå¥ï¼Œç¦æ™ºåœ“æ»¿ï¼ŒåˆäºŒæ˜¯ç¦ã€å¾Œäº”æ˜¯æ™ºã€‚	å¾Œã€Œä½æŒã€ä¸‹ä¸ƒå¥ï¼Œç¦æ™ºåœ“æ»¿ï¼ŒåˆäºŒæ˜¯ç¦ã€å¾Œäº”æ˜¯æ™ºã€‚	The seven phrases after upholding are about the perfection of merit and wisdom. The first two are merit and the last five are wisdom.
['ZH_T35_1735_059:0951b19_3']	æ™ºä¸­ï¼Œå‰ä¸‰æ¬Šã€å¾ŒäºŒå¯¦ã€‚	æ™ºä¸­ï¼Œå‰ä¸‰æ¬Šã€å¾ŒäºŒå¯¦ã€‚	Among the five wisdoms, the first three are skillful means and the last two are reality.
['ZH_T35_1735_059:0951b19_16']	ä¸‰ã€Œä½›å­è©è–©ã€ä¸‹çµè®šå¾µé‡‹ã€‚	ä¸‰ã€Œä½›å­è©è–©ã€ä¸‹çµè®šå¾µé‡‹ã€‚	The third is the conclusion and praise with questioning and explanation.
['ZH_T35_1735_059:0951b20_10']	ç¬¬äºŒèº«çœ¾ç¥å¯†åŠ æˆæ³•ï¼Œä¸­ä¸‰ï¼š	ç¬¬äºŒèº«çœ¾ç¥å¯†åŠ æˆæ³•ï¼Œä¸­ä¸‰ï¼š	The second is the secret empowerment of the body assembly gods bestowing the Dharma, which has three parts:
['ZH_T35_1735_059:0951b20_16']	åˆè®šå‹ä»¤æ¬£ã€‚	åˆè®šå‹ä»¤æ¬£ã€‚	First, praising the friend to make one joyful.
['ZH_T35_1735_059:0951b21_10']	æ¬¡ã€Œå¾å…¶è€³ã€ä¸‹æ”¾å…‰åŠ è¢«ã€‚	æ¬¡ã€Œå¾å…¶è€³ã€ä¸‹æ”¾å…‰åŠ è¢«ã€‚	Next, from from his ears is emitting light and empowering.
['ZH_T35_1735_059:0951b22_7']	å¾Œã€Œå–„è²¡å³å¾—ã€ä¸‹å–„è²¡ç²ç›Šï¼Œæ‰€è¬‚åçœ¼ã€‚	å¾Œã€Œå–„è²¡å³å¾—ã€ä¸‹å–„è²¡ç²ç›Šï¼Œæ‰€è¬‚åçœ¼ã€‚	After Sudhana immediately attained is Sudhana's attainment of benefits, namely the ten eyes.
['ZH_T35_1735_059:0951b23_1']	è¨€ä¸æ€è­°èº«è€…ï¼Œåèº«ç„¡ç¤™æ•…ã€‚	è¨€ä¸æ€è­°èº«è€…ï¼Œåèº«ç„¡ç¤™æ•…ã€‚	As for the inconceivable body, it is because the ten bodies are unobstructed.
['ZH_T35_1735_059:0951b23_11']	ä½›å¹³ç­‰è€…ï¼Œä½›ä½›åŒæ•…ã€‚	ä½›å¹³ç­‰è€…ï¼Œä½›ä½›åŒæ•…ã€‚	The equality of the Buddhas is because all Buddhas are the same.
['ZH_T35_1735_059:0951b24_1']	æ•…ç•°æ–¼å‰ï¼Œä½†æ˜æ³•èº«ã€‚	æ•…ç•°æ–¼å‰ï¼Œä½†æ˜æ³•èº«ã€‚	Therefore, it is different from the previous section which only clarifies the Dharma body.
['ZH_T35_1735_059:0951b24_6']	é¤˜å¯æ€ä¹‹ã€‚	é¤˜å¯æ€ä¹‹ã€‚	The rest can be contemplated.
['ZH_T35_1735_059:0951b25_2']	ç¬¬ä¸‰ã€Œæ™‚æœ‰å®ˆè­·ã€ä¸‹æ•™æ±‚å‹ä¹‹æ–¹ã€‚	ç¬¬ä¸‰ã€Œæ™‚æœ‰å®ˆè­·ã€ä¸‹æ•™æ±‚å‹ä¹‹æ–¹ã€‚	The third section, At that time, there was a guardian, below, is the method of seeking friends.
['ZH_T35_1735_059:0951b25_6']	æ–¼ä¸­ä¸‰ï¼š	æ–¼ä¸­ä¸‰ï¼š	In this, there are three parts:
['ZH_T35_1735_059:0951b25_15']	åˆæ•™ã€æ¬¡å•ã€å¾Œç­”ã€‚	åˆæ•™ã€æ¬¡å•ã€å¾Œç­”ã€‚	First, teaching, second, asking, third, answering.
['ZH_T35_1735_059:0951b25_19']	åˆä¸­äºŒï¼š	åˆä¸­äºŒï¼š	In the first part, there are two:
['ZH_T35_1735_059:0951b27_3']	å…ˆæ•™åæ³•å¢å…¶æ™ºã€å¾Œç¤ºä¸‰æ˜§æ¯å…¶äº‚ï¼Œå„æœ‰æ¨™ã€é‡‹ã€çµã€‚	å…ˆæ•™åæ³•å¢å…¶æ™ºã€å¾Œç¤ºä¸‰æ˜§æ¯å…¶äº‚ï¼Œå„æœ‰æ¨™ã€é‡‹ã€çµã€‚	First, teaching ten dharmas to increase wisdom, later showing samÄdhi to stop confusion, each with a heading, explanation, and conclusion.
['ZH_T35_1735_059:0951b27_13']	ä»Šåˆï¼Œé‡‹ä¸­æœ‰åä¸€å¿ƒï¼š	ä»Šåˆï¼Œé‡‹ä¸­æœ‰åä¸€å¿ƒï¼š	Now, in the explanation, there are eleven minds:
['ZH_T35_1735_059:0951b29_1']	ä¸€ç›´ã€äºŒæ‚²ã€ä¸‰æ™ºã€å››é€²ã€äº”ä¿¡ã€å…­æ·±ã€ä¸ƒæ…ˆã€å…«æ·¨ã€ä¹ç›Šã€åå·§ã€åä¸€å¸¸ã€‚	ä¸€ç›´ã€äºŒæ‚²ã€ä¸‰æ™ºã€å››é€²ã€äº”ä¿¡ã€å…­æ·±ã€ä¸ƒæ…ˆã€å…«æ·¨ã€ä¹ç›Šã€åå·§ã€åä¸€å¸¸ã€‚	First, straight, second, compassion, third, wisdom, fourth, progress, fifth, faith, sixth, profound, seventh, kindness, eighth, purity, ninth, benefit, tenth, skill, eleventh, permanence.
['ZH_T35_1735_059:0951c02_1']	å¾Œç¤ºä¸‰æ˜§é‡‹ä¸­ï¼Œæ–¼å¢ƒä¸æ¨é›¢ç­‰è€…ï¼Œå‡¡å¤«æŸ“å¢ƒï¼ŒäºŒä¹˜æ¨å¢ƒï¼Œæ¬Šæ•™ç¸±è§€ç©ºæœ‰äº’é™³ï¼Œä¸¦ç‚ºç¼ºæ¸›ã€‚	å¾Œç¤ºä¸‰æ˜§é‡‹ä¸­ï¼Œæ–¼å¢ƒä¸æ¨é›¢ç­‰è€…ï¼Œå‡¡å¤«æŸ“å¢ƒï¼ŒäºŒä¹˜æ¨å¢ƒï¼Œæ¬Šæ•™ç¸±è§€ç©ºæœ‰äº’é™³ï¼Œä¸¦ç‚ºç¼ºæ¸›ã€‚	Later, showing samÄdhi, in the explanation, not abandoning the object and so forth, ordinary beings are attached to objects, the two vehicles abandon objects, the provisional teachings, although contemplating emptiness and existence, are mutually presented, and are all incomplete.
['ZH_T35_1735_059:0951c03_2']	è‹¥åœ“ä¿®è€…ï¼Œè§¸ç›®å°å¢ƒçª®ç›¡æ³•æºï¼Œä¸å–ä¸æ¨æ•…ã€‚	è‹¥åœ“ä¿®è€…ï¼Œè§¸ç›®å°å¢ƒçª®ç›¡æ³•æºï¼Œä¸å–ä¸æ¨æ•…ã€‚	If one cultivates the perfect teaching, then touching the eyes and facing the objects, one exhausts the source of the Dharma, not grasping and not abandoning.
['ZH_T35_1735_059:0951c06_7']	ã€Šå¤®æ˜ç¶“ã€‹äº‘ã€Œæ‘©è¨¶è¡è€…ï¼Œæ‰€è¬‚å½¼çœ¼æ ¹ï¼Œæ–¼è«¸å¦‚ä¾†å¸¸ï¼Œäº†äº†åˆ†æ˜è¦‹ï¼Œå…·è¶³ç„¡æ¸›ä¿®ã€ç­‰ï¼Œåˆäº‘ã€Œæ‰€è¬‚çœ¼å…¥è™•ï¼Œæ–¼è«¸å¦‚ä¾†å¸¸ï¼Œæ˜è¦‹ä¾†å…¥é–€ï¼Œå…·è¶³ç„¡æ¸›ä¿®ã€ç­‰ã€‚	ã€Šå¤®æ˜ç¶“ã€‹äº‘ã€Œæ‘©è¨¶è¡è€…ï¼Œæ‰€è¬‚å½¼çœ¼æ ¹ï¼Œæ–¼è«¸å¦‚ä¾†å¸¸ï¼Œäº†äº†åˆ†æ˜è¦‹ï¼Œå…·è¶³ç„¡æ¸›ä¿®ã€ç­‰ï¼Œåˆäº‘ã€Œæ‰€è¬‚çœ¼å…¥è™•ï¼Œæ–¼è«¸å¦‚ä¾†å¸¸ï¼Œæ˜è¦‹ä¾†å…¥é–€ï¼Œå…·è¶³ç„¡æ¸›ä¿®ã€ç­‰ã€‚	The Aá¹…gulimÄlÄ«ya SÅ«tra says, The MahÄyÄna is said to be that eye faculty, which towards the TathÄgatas is constant, clearly and distinctly seen, and fully endowed without diminution in cultivation. It also says, That which is the eye faculty is towards the TathÄgatas constant, clearly seeing the entrance into coming, fully endowed without diminution in cultivation.
['ZH_T35_1735_059:0951c06_11']	é¤˜å¯çŸ¥ã€‚	é¤˜å¯çŸ¥ã€‚	The rest can be understood.
['ZH_T35_1735_059:0951c08_3']	çµä¸­ï¼Œè™•è™•é‡å‹è€…ï¼Œæ—¢å®šæ…§é›™éŠï¼Œç„¡å¢ƒä¸å¥‘ï¼Œä¸¦ç‚ºé“å“ï¼Œå‰‡çœŸå‹æ‡¸é€šã€‚	çµä¸­ï¼Œè™•è™•é‡å‹è€…ï¼Œæ—¢å®šæ…§é›™éŠï¼Œç„¡å¢ƒä¸å¥‘ï¼Œä¸¦ç‚ºé“å“ï¼Œå‰‡çœŸå‹æ‡¸é€šã€‚	In the conclusion, encountering friends everywhere means that since samÄdhi and prajÃ±Ä are both cultivated, there is no realm that is not in accord, and all are included in the path factors, then true friends are connected everywhere.
['ZH_T35_1735_059:0951c08_15']	èƒ½å¦‚æ˜¯è¡Œï¼Œç‚ºè­·æ­£æ³•å ‚ä¹Ÿã€‚	èƒ½å¦‚æ˜¯è¡Œï¼Œç‚ºè­·æ­£æ³•å ‚ä¹Ÿã€‚	Being able to practice in this way is the protection of the Dharma hall.
['ZH_T35_1735_059:0951c09_5']	äºŒã€Œèªªæ˜¯èªæ™‚ã€ä¸‹å•ã€‚	äºŒã€Œèªªæ˜¯èªæ™‚ã€ä¸‹å•ã€‚	Second, from When this was said is the question.
['ZH_T35_1735_059:0951c09_17']	ä¸‰ã€Œç¾…å‰ã€ä¸‹ç­”ï¼Œæœ‰å››æ³•ï¼š	ä¸‰ã€Œç¾…å‰ã€ä¸‹ç­”ï¼Œæœ‰å››æ³•ï¼š	Third, from The rÄká¹£asa is the answer, which has four dharmas:
['ZH_T35_1735_059:0951c11_11']	ä¸€ä»¥å‹ç„¡ä¸åœ¨æ•…ã€äºŒä»¥æ³•ç‚ºé«”æ•…ã€ä¸‰èº«åŒå‹éæ•…ã€å››æ™ºèˆ‡å¢ƒåˆæ•…ï¼Œå¦‚å¤¢å¦‚å½±ã€‚	ä¸€ä»¥å‹ç„¡ä¸åœ¨æ•…ã€äºŒä»¥æ³•ç‚ºé«”æ•…ã€ä¸‰èº«åŒå‹éæ•…ã€å››æ™ºèˆ‡å¢ƒåˆæ•…ï¼Œå¦‚å¤¢å¦‚å½±ã€‚	First, because friends are everywhere, second, because the Dharma is taken as the essence, third, because the body is the same as friends everywhere, and fourth, because wisdom is in accord with the realm, like a dream, like a shadow.
['ZH_T35_1735_059:0951c12_10']	åˆå‰ä¸‰å³é›¢å¢ƒç•Œç›¸ï¼Œå››å‰‡é›¢å¿ƒç·£ç›¸ã€‚	åˆå‰ä¸‰å³é›¢å¢ƒç•Œç›¸ï¼Œå››å‰‡é›¢å¿ƒç·£ç›¸ã€‚	Moreover, the first three are the same as the characteristic of the absence of objects, and the fourth is the same as the characteristic of the absence of mental activity.
['ZH_T35_1735_059:0951c13_1']	æ±‚å–„å‹è€…ï¼Œå¹¸æ€æ­¤è¨€ã€‚	æ±‚å–„å‹è€…ï¼Œå¹¸æ€æ­¤è¨€ã€‚	Those seeking good friends should consider these words.
['ZH_T35_1735_059:0951c14_7']	ç¬¬äºŒã€Œçˆ¾æ™‚å–„è²¡å—è¡Œã€ä¸‹è¦‹æ•¬è«®å•ï¼Œå…ˆè¦‹ã€æ¬¡æ•¬ã€å¾Œå•ã€‚	ç¬¬äºŒã€Œçˆ¾æ™‚å–„è²¡å—è¡Œã€ä¸‹è¦‹æ•¬è«®å•ï¼Œå…ˆè¦‹ã€æ¬¡æ•¬ã€å¾Œå•ã€‚	Second, from At that time, Sudhana received the teachings is the section on seeing, venerating, and inquiring. First seeing, then venerating, and finally inquiring.
['ZH_T35_1735_059:0951c14_18']	åˆä¸­ï¼Œå…ˆè¦©ä¾ã€å¾Œè¦‹æ­£ã€‚	åˆä¸­ï¼Œå…ˆè¦©ä¾ã€å¾Œè¦‹æ­£ã€‚	In the beginning, first observing the support, then seeing the true.
['ZH_T35_1735_059:0951c17_11']	ä»Šåˆï¼Œå…ˆå—è¡Œå…¶æ•™ï¼Œèº¡å‰èµ·å¾Œï¼Œè¿‘èº¡ç¾…å‰ä¹‹è¨€ï¼Œé é€šå‰ä¸‰å‹å‹ï¼Œä»¥å‰äºŒç¥ä¸¦æœªæœ‰ç­”æ•…ï¼Œå³ç”±å‰ä¸‰ä½èª¿ç·´æ•…ï¼Œå¾—è¦©æ–¯å‹å ±ã€‚	ä»Šåˆï¼Œå…ˆå—è¡Œå…¶æ•™ï¼Œèº¡å‰èµ·å¾Œï¼Œè¿‘èº¡ç¾…å‰ä¹‹è¨€ï¼Œé é€šå‰ä¸‰å‹å‹ï¼Œä»¥å‰äºŒç¥ä¸¦æœªæœ‰ç­”æ•…ï¼Œå³ç”±å‰ä¸‰ä½èª¿ç·´æ•…ï¼Œå¾—è¦©æ–¯å‹å ±ã€‚	First, receiving and practicing his teachings, linking the previous to the next, closely following the words of the rÄká¹£asa, and extending to the previous three excellent friends, because the previous two spirits did not yet have answers, it is precisely because of the training in the previous three stages that he gets to see this excellent reward.
['ZH_T35_1735_059:0951c18_2']	å¾Œã€Œå³æ™‚ã€ä¸‹æ­£æ˜æ‰€è¦‹ã€‚	å¾Œã€Œå³æ™‚ã€ä¸‹æ­£æ˜æ‰€è¦‹ã€‚	Later, immediately clarifies what was seen.
['ZH_T35_1735_059:0951c18_6']	æ–¼ä¸­ä¸‰ï¼š	æ–¼ä¸­ä¸‰ï¼š	Within this, there are three:
['ZH_T35_1735_059:0951c18_15']	åˆæ˜è“®è¯æ‰€è­‰æ³•ç•Œã€‚	åˆæ˜è“®è¯æ‰€è­‰æ³•ç•Œã€‚	First, clarifying the lotus flower's realization of the Dharma realm.
['ZH_T35_1735_059:0951c19_6']	è‡ªæ€§ç„¡æŸ“ï¼Œæ•…æ›°è“®è¯ã€‚	è‡ªæ€§ç„¡æŸ“ï¼Œæ•…æ›°è“®è¯ã€‚	The self-nature is undefiled, thus called a lotus flower.
['ZH_T35_1735_059:0951c20_2']	ç„¡æ˜æ—¢é–‹ï¼Œä¸é›¢å¿ƒå…§ï¼Œå¦‚å¾åœ°æ¶Œã€‚	ç„¡æ˜æ—¢é–‹ï¼Œä¸é›¢å¿ƒå…§ï¼Œå¦‚å¾åœ°æ¶Œã€‚	Ignorance, once opened, is not apart from within the mind, like emerging from the ground.
['ZH_T35_1735_059:0951c21_3']	äº¦è¡¨æ€§æ·¨è¬è¡Œä¹‹å››ï¼Œå¾æ³•æ€§åœ°è€Œå‡ºç¾æ•…ã€‚	äº¦è¡¨æ€§æ·¨è¬è¡Œä¹‹å››ï¼Œå¾æ³•æ€§åœ°è€Œå‡ºç¾æ•…ã€‚	It also symbolizes the four of inherent purity and myriad practices, appearing from the ground of the Dharma nature.
['ZH_T35_1735_059:0951c21_14']	æ­¤å³åå®šä¸­æ™®è³¢ä¹‹è¯ä¹Ÿã€‚	æ­¤å³åå®šä¸­æ™®è³¢ä¹‹è¯ä¹Ÿã€‚	This is the flower of Samantabhadra in the ten samÄdhis.
['ZH_T35_1735_059:0951c22_6']	äºŒã€Œæ–¼å…¶è‡ºã€ä¸‹æ˜è‡ºä¸Šæ¨“è§€ã€‚	äºŒã€Œæ–¼å…¶è‡ºã€ä¸‹æ˜è‡ºä¸Šæ¨“è§€ã€‚	Second, below on the terrace, it clarifies the tower above the terrace.
['ZH_T35_1735_059:0951c23_5']	è¬‚èƒ½è­‰æ¬Šå¯¦äºŒæ™ºï¼Œä¾æ–¼æ‰€è­‰è€Œé‡ç¾æ•…ã€‚	è¬‚èƒ½è­‰æ¬Šå¯¦äºŒæ™ºï¼Œä¾æ–¼æ‰€è­‰è€Œé‡ç¾æ•…ã€‚	It means being able to realize the two knowledges of skillful means and reality, and to manifest them again based on what is realized.
['ZH_T35_1735_059:0951c23_16']	æ™ºåŒ…ç„¡å¤–ï¼Œäº‘æ™®ç´åæ–¹ã€‚	æ™ºåŒ…ç„¡å¤–ï¼Œäº‘æ™®ç´åæ–¹ã€‚	Knowledge encompasses the external, thus it is said to universally contain the ten directions.
['ZH_T35_1735_059:0951c24_13']	ç¸½æ”äº”ä½è‡ªåˆ†å‹é€²ï¼Œæ•…äº‘åƒæŸ±è¡Œåˆ—ã€‚	ç¸½æ”äº”ä½è‡ªåˆ†å‹é€²ï¼Œæ•…äº‘åƒæŸ±è¡Œåˆ—ã€‚	It comprehensively includes the five stages of one's own progress, thus it is said there are a thousand pillars in a row.
['ZH_T35_1735_059:0952a01_8']	å…¶ä¸€ä¸€äº‹çš†æœ‰æ‰€è¡¨ï¼Œæå­ç¹æ–‡ã€‚	å…¶ä¸€ä¸€äº‹çš†æœ‰æ‰€è¡¨ï¼Œæå­ç¹æ–‡ã€‚	Each of these things has something it represents, but I fear it would be too verbose.
['ZH_T35_1735_059:0952a02_14']	ä¸‰ã€Œå…¶æ¨“è§€ã€ä¸‹æ˜æ¨“ä¸­å¯¶åº§ï¼Œå³æ™ºé«”è‡ªç©ºï¼Œæ•…äº‘æ¨“ä¸­æœ‰åº§ã€‚	ä¸‰ã€Œå…¶æ¨“è§€ã€ä¸‹æ˜æ¨“ä¸­å¯¶åº§ï¼Œå³æ™ºé«”è‡ªç©ºï¼Œæ•…äº‘æ¨“ä¸­æœ‰åº§ã€‚	Third, below the tower, it clarifies the jeweled seat in the tower, which is the empty nature of knowledge itself, thus it is said there is a seat in the tower.
['ZH_T35_1735_059:0952a03_5']	ç©ºå…·æ€§å¾·ï¼Œæ•…å»£é¡¯èŠåš´ã€‚	ç©ºå…·æ€§å¾·ï¼Œæ•…å»£é¡¯èŠåš´ã€‚	Emptiness is endowed with inherent virtues, thus it extensively manifests the adornments.
['ZH_T35_1735_059:0952a03_18']	äºŒã€Œçˆ¾æ™‚å–„è²¡ã€ä¸‹è¦‹å‹æ­£å ±ã€‚	äºŒã€Œçˆ¾æ™‚å–„è²¡ã€ä¸‹è¦‹å‹æ­£å ±ã€‚	Second, below at that time, Sudhana, it clarifies the correct form of the spiritual friend.
['ZH_T35_1735_059:0952a04_2']	æ–¼ä¸­äºŒï¼š	æ–¼ä¸­äºŒï¼š	Within this, there are two parts:
['ZH_T35_1735_059:0952a04_8']	å…ˆçµå‰æ¨™å¾Œã€‚	å…ˆçµå‰æ¨™å¾Œã€‚	First, concluding the previous and introducing the next.
['ZH_T35_1735_059:0952a05_1']	å‰ä½†æ˜ä¸»åº§ï¼Œä»Šé›™çµä¸»ä¼´ã€‚	å‰ä½†æ˜ä¸»åº§ï¼Œä»Šé›™çµä¸»ä¼´ã€‚	Previously, it only clarified the main seat, but now it concludes both the main and the accompanying.
['ZH_T35_1735_059:0952a05_17']	å¾Œã€Œæ‰€è¬‚ã€ä¸‹åˆ¥é¡¯èº«é›²ï¼Œæ–¼ä¸­äº¦äºŒï¼š	å¾Œã€Œæ‰€è¬‚ã€ä¸‹åˆ¥é¡¯èº«é›²ï¼Œæ–¼ä¸­äº¦äºŒï¼š	Later, below namely, it specifically manifests the cloud of bodies, within which there are also two parts:
['ZH_T35_1735_059:0952a06_6']	å…ˆæ˜èº«ç›¸ã€å¾Œé¡¯èº«æ¥­ã€‚	å…ˆæ˜èº«ç›¸ã€å¾Œé¡¯èº«æ¥­ã€‚	First, clarifying the characteristics of the body, and later manifesting the activities of the body.
['ZH_T35_1735_059:0952a06_11']	å‰ä¸­äº¦äºŒï¼š	å‰ä¸­äº¦äºŒï¼š	Within the former, there are also two parts:
['ZH_T35_1735_059:0952a07_9']	å…ˆæ˜è¬é¡é›£æ€èº«ã€å¾Œæ˜ä¸€é¡è¶…å‹èº«ã€‚	å…ˆæ˜è¬é¡é›£æ€èº«ã€å¾Œæ˜ä¸€é¡è¶…å‹èº«ã€‚	First, it clarifies the bodies of myriad kinds that are difficult to conceive, and later it clarifies the bodies of one kind that are superior.
['ZH_T35_1735_059:0952a07_14']	å‰ä¸­äº¦äºŒï¼š	å‰ä¸­äº¦äºŒï¼š	In the former, there are also two:
['ZH_T35_1735_059:0952a08_4']	å…ˆé¡¯åˆ¥ç›¸ã€å¾Œæ˜é€šé«”ã€‚	å…ˆé¡¯åˆ¥ç›¸ã€å¾Œæ˜é€šé«”ã€‚	First, it reveals the distinct characteristics, and later it clarifies the universal essence.
['ZH_T35_1735_059:0952a09_5']	ä»Šåˆï¼Œæœ‰å››åèº«ï¼Œæ–¼ä¸­æˆ–å”¯ç´„äº‹ï¼Œå¦‚æ™®éè‰²èº«ï¼›	ä»Šåˆï¼Œæœ‰å››åèº«ï¼Œæ–¼ä¸­æˆ–å”¯ç´„äº‹ï¼Œå¦‚æ™®éè‰²èº«ï¼›	Now, at the beginning, there are forty bodies, among which some only concern events, such as the universally pervading form body;
['ZH_T35_1735_059:0952a10_16']	æˆ–å”¯ç´„ç†ï¼Œå¦‚åäºŒã€åä¸‰ä¸ç”Ÿä¸æ»…èº«ï¼Œä»¥æœ¬ç„¡ç”Ÿèµ·ï¼Œæ»…äº¦ä¸ç‚ºæ»…æ•…ï¼›	æˆ–å”¯ç´„ç†ï¼Œå¦‚åäºŒã€åä¸‰ä¸ç”Ÿä¸æ»…èº«ï¼Œä»¥æœ¬ç„¡ç”Ÿèµ·ï¼Œæ»…äº¦ä¸ç‚ºæ»…æ•…ï¼›	Some only concern principles, such as the twelfth and thirteenth unborn and unceasing bodies, because they are originally unborn and cessation also does not cause cessation;
['ZH_T35_1735_059:0952a12_7']	æˆ–äº‹ç†äº¤å¾¹ï¼Œå¦‚ç¬¬ä¸‰åäºŒã€ä¸‰åäº”ç„¡ç”Ÿä¸ç”Ÿè‰²èº«ï¼Œä»¥äº‹é¡¯ç†æ•…ã€‚	æˆ–äº‹ç†äº¤å¾¹ï¼Œå¦‚ç¬¬ä¸‰åäºŒã€ä¸‰åäº”ç„¡ç”Ÿä¸ç”Ÿè‰²èº«ï¼Œä»¥äº‹é¡¯ç†æ•…ã€‚	Some are the interpenetration of events and principles, such as the thirty-second and thirty-fifth unborn and unproduced form bodies, because events reveal principles.
['ZH_T35_1735_059:0952a13_4']	æ–¼ä¸­ç„¡ç”Ÿå‰‡ç´„è‡ªé¡˜æ‰€æˆï¼Œç„¡åˆ¥æœ‰ç”Ÿï¼›	æ–¼ä¸­ç„¡ç”Ÿå‰‡ç´„è‡ªé¡˜æ‰€æˆï¼Œç„¡åˆ¥æœ‰ç”Ÿï¼›	Among them, being unborn means that according to one's own vows, there is no separate birth;
['ZH_T35_1735_059:0952a13_17']	ä¸ç”Ÿå‰‡éš¨ä»–è€Œç¾ï¼Œç”Ÿå³ä¸ç”Ÿã€‚	ä¸ç”Ÿå‰‡éš¨ä»–è€Œç¾ï¼Œç”Ÿå³ä¸ç”Ÿã€‚	Not being born means following others and manifesting birth, birth is precisely non-birth.
['ZH_T35_1735_059:0952a14_3']	é¤˜å¯æ€æº–ã€‚	é¤˜å¯æ€æº–ã€‚	The rest can be understood by analogy.
['ZH_T35_1735_059:0952a15_3']	å¾Œã€Œå¦‚æ˜¯èº«è€…ã€ä¸‹æ˜å…¶é€šé«”ï¼Œè¬‚é›¢æœ‰å–è˜Šæ•…ã€‚	å¾Œã€Œå¦‚æ˜¯èº«è€…ã€ä¸‹æ˜å…¶é€šé«”ï¼Œè¬‚é›¢æœ‰å–è˜Šæ•…ã€‚	Later, As for such a body, it clarifies its universal essence, because it is free from the aggregates that are grasped at existence.
['ZH_T35_1735_059:0952a16_3']	äºŒã€Œçˆ¾æ™‚å–„è²¡ã€ä¸‹æ˜ä¸€é¡è¶…å‹èº«ï¼Œç´„å”¯å¥³æ•…ã€‚	äºŒã€Œçˆ¾æ™‚å–„è²¡ã€ä¸‹æ˜ä¸€é¡è¶…å‹èº«ï¼Œç´„å”¯å¥³æ•…ã€‚	Second, At that time, Sudhana clarifies the bodies of one kind that are superior, because it is only about women.
['ZH_T35_1735_059:0952a16_18']	äºŒã€Œç¾å¦‚æ˜¯ç­‰ã€ä¸‹æ˜èº«æ¥­ï¼Œä¸­äºŒï¼š	äºŒã€Œç¾å¦‚æ˜¯ç­‰ã€ä¸‹æ˜èº«æ¥­ï¼Œä¸­äºŒï¼š	Second, from manifesting such... it clarifies the physical actions, which has two parts:
['ZH_T35_1735_059:0952a17_1']	åˆç¸½æ¨™ï¼›	åˆç¸½æ¨™ï¼›	First, a general statement;
['ZH_T35_1735_059:0952a17_15']	å¾Œã€Œè¡Œæ–¼å¹³ç­‰ã€ä¸‹åˆ¥é¡¯ï¼Œäº¦äºŒï¼š	å¾Œã€Œè¡Œæ–¼å¹³ç­‰ã€ä¸‹åˆ¥é¡¯ï¼Œäº¦äºŒï¼š	Later, from practicing equality... it specifically illustrates, which also has two parts:
['ZH_T35_1735_059:0952a18_12']	å…ˆæ˜ååº¦è¡Œï¼Œå”¯ç²¾é€²åœ¨æ–¼å¿å‰ï¼Œé¤˜çš†å¦‚æ¬¡ã€‚	å…ˆæ˜ååº¦è¡Œï¼Œå”¯ç²¾é€²åœ¨æ–¼å¿å‰ï¼Œé¤˜çš†å¦‚æ¬¡ã€‚	First, it clarifies the ten perfections. Only diligence is placed before patience, the rest are in order.
['ZH_T35_1735_059:0952a18_17']	è¬‚åˆæ˜æª€ï¼›	è¬‚åˆæ˜æª€ï¼›	That is, first it clarifies giving;
['ZH_T35_1735_059:0952a19_12']	æ¬¡ã€Œå‡ºç”Ÿã€ä¸‹æˆ’ï¼Œæˆ’èƒ½ç”Ÿé•·æ•…ï¼›	æ¬¡ã€Œå‡ºç”Ÿã€ä¸‹æˆ’ï¼Œæˆ’èƒ½ç”Ÿé•·æ•…ï¼›	Next, from giving birth... it is morality, because morality can give rise to and nurture;
['ZH_T35_1735_059:0952a19_20']	ä¸‰ã€Œä¿®ç¿’ã€ä¸‹é€²ï¼›	ä¸‰ã€Œä¿®ç¿’ã€ä¸‹é€²ï¼›	Third, from cultivating... it is diligence;
['ZH_T35_1735_059:0952a20_4']	å››ã€Œè§€å¯Ÿã€ä¸‹å¿ï¼›	å››ã€Œè§€å¯Ÿã€ä¸‹å¿ï¼›	Fourth, from observing... it is patience;
['ZH_T35_1735_059:0952a20_12']	äº”ã€Œå…·çœ¾ã€ä¸‹å®šï¼›	äº”ã€Œå…·çœ¾ã€ä¸‹å®šï¼›	Fifth, from endowed with... it is concentration;
['ZH_T35_1735_059:0952a20_21']	å…­ã€Œæ’è½‰ã€ä¸‹èˆ¬è‹¥ï¼›	å…­ã€Œæ’è½‰ã€ä¸‹èˆ¬è‹¥ï¼›	Sixth, from constantly turning... it is prajÃ±Ä;
['ZH_T35_1735_059:0952a21_7']	ä¸ƒã€Œè¦‹è«¸å¦‚ä¾†ã€ä¸‹æ–¹ä¾¿ï¼›	ä¸ƒã€Œè¦‹è«¸å¦‚ä¾†ã€ä¸‹æ–¹ä¾¿ï¼›	Seventh, from seeing the tathÄgatas... it is skillful means;
['ZH_T35_1735_059:0952a21_17']	å…«ã€Œæˆå°±å¤§é¡˜ã€ä¸‹é¡˜ï¼›	å…«ã€Œæˆå°±å¤§é¡˜ã€ä¸‹é¡˜ï¼›	Eighth, from accomplishing the great vows... it is vows;
['ZH_T35_1735_059:0952a22_5']	ä¹ã€Œå¿ƒæ’éå…¥ã€ä¸‹åŠ›ï¼›	ä¹ã€Œå¿ƒæ’éå…¥ã€ä¸‹åŠ›ï¼›	Ninth, from the mind constantly pervades... it is power;
['ZH_T35_1735_059:0952a22_15']	åã€Œå¾—ä½›æ™ºå…‰ã€ä¸‹æ™ºã€‚	åã€Œå¾—ä½›æ™ºå…‰ã€ä¸‹æ™ºã€‚	Tenth, from obtaining the Buddha's wisdom light... it is wisdom.
['ZH_T35_1735_059:0952a23_7']	å¾Œã€Œä¿®ç¿’ä¸€åˆ‡å¦‚ä¾†ã€ä¸‹æ˜äºŒåš´è¡Œã€‚	å¾Œã€Œä¿®ç¿’ä¸€åˆ‡å¦‚ä¾†ã€ä¸‹æ˜äºŒåš´è¡Œã€‚	Later, from cultivating all tathÄgatas... it clarifies the practices of the two adornments.
['ZH_T35_1735_059:0952a23_19']	æœªç‚ºä½›æ¯è€…ï¼Œæ˜¯å…¶æœ¬è¡Œæ•…ã€‚	æœªç‚ºä½›æ¯è€…ï¼Œæ˜¯å…¶æœ¬è¡Œæ•…ã€‚	Those who are not yet the Buddha's mother are because of their original practices.
