segmentnr	original	analyzed	translated
['ZH_T49_2039_003:0989b25_5']	ä¸”ä»¥è¿¦è‘‰ä½›æ™‚è‡³äºä»Šã€‚	ä¸”ä»¥è¿¦è‘‰ä½›æ™‚è‡³äºä»Šã€‚	Taking the time from the time of KÄÅ›yapa Buddha to the present,
['ZH_T49_2039_003:0989b25_11']	ç‚ºæ­¤çŸ³ä¹‹å£½ã€‚	ç‚ºæ­¤çŸ³ä¹‹å£½ã€‚	As the lifespan of this stone,
['ZH_T49_2039_003:0989b26_5']	å°šè·æ–¼åŠ«åˆé–‹é—¢æ™‚ç‚ºå…’å­çŸ£ã€‚	å°šè·æ–¼åŠ«åˆé–‹é—¢æ™‚ç‚ºå…’å­çŸ£ã€‚	It is still far from the time of the opening of the world at the beginning of the eon.
['ZH_T49_2039_003:0989b26_18']	ä¸‰å®¶ä¹‹èªªå°šä¸åŠèŒ²å…’çŸ³ä¹‹å¹´ã€‚	ä¸‰å®¶ä¹‹èªªå°šä¸åŠèŒ²å…’çŸ³ä¹‹å¹´ã€‚	The accounts of the three sources are still not as old as the age of this child's stone.
['ZH_T49_2039_003:0989b27_6']	å…¶æ–¼é–‹é—¢ä¹‹èªªã€‚	å…¶æ–¼é–‹é—¢ä¹‹èªªã€‚	As for the account of the opening of the world,
['ZH_T49_2039_003:0989b27_11']	ç–ä¹‹é çŸ£ã€‚	ç–ä¹‹é çŸ£ã€‚	it is far from being detailed.
['ZH_T49_2039_003:0989b29_6']	é¼æ±åŸè‚²ç‹å¡”é¼æ±åŸè‚²ç‹å¡”ä¸‰å¯¶æ„Ÿé€šéŒ„è¼‰ã€‚	é¼æ±åŸè‚²ç‹å¡”é¼æ±åŸè‚²ç‹å¡”ä¸‰å¯¶æ„Ÿé€šéŒ„è¼‰ã€‚	The stupa of King AÅ›oka in the city of Liaodong is recorded in the Saá¹ƒghabhedavastu.
['ZH_T49_2039_003:0989b29_15']	é«˜éº—é¼æ±åŸå‚å¡”è€…ã€‚	é«˜éº—é¼æ±åŸå‚å¡”è€…ã€‚	The stupa beside the city of Liaodong in Goguryeo,
['ZH_T49_2039_003:0989c01_1']	å¤è€å‚³äº‘ã€‚	å¤è€å‚³äº‘ã€‚	according to an old legend,
['ZH_T49_2039_003:0989c01_12']	æ˜”é«˜éº—è–ç‹æŒ‰è¡Œåœ‹ç•Œæ¬¡ã€‚	æ˜”é«˜éº—è–ç‹æŒ‰è¡Œåœ‹ç•Œæ¬¡ã€‚	once when the sage king of Goguryeo was inspecting the country,
['ZH_T49_2039_003:0989c02_3']	è‡³æ­¤åŸè¦‹äº”è‰²é›²è¦†åœ°ã€‚	è‡³æ­¤åŸè¦‹äº”è‰²é›²è¦†åœ°ã€‚	he came to this city and saw five-colored clouds covering the ground.
['ZH_T49_2039_003:0989c02_8']	å¾€å°‹é›²ä¸­ã€‚	å¾€å°‹é›²ä¸­ã€‚	He went to search in the clouds,
['ZH_T49_2039_003:0989c02_15']	æœ‰åƒ§åŸ·éŒ«è€Œç«‹ã€‚	æœ‰åƒ§åŸ·éŒ«è€Œç«‹ã€‚	and saw a monk standing with his staff.
['ZH_T49_2039_003:0989c02_20']	æ—¢è‡³ä¾¿æ»…ã€‚	æ—¢è‡³ä¾¿æ»…ã€‚	As he approached, the monk disappeared.
['ZH_T49_2039_003:0989c03_4']	é çœ‹é‚„ç¾ã€‚	é çœ‹é‚„ç¾ã€‚	Looking from afar, the monk reappeared.
['ZH_T49_2039_003:0989c03_11']	å‚æœ‰åœŸå¡”ä¸‰é‡ã€‚	å‚æœ‰åœŸå¡”ä¸‰é‡ã€‚	Beside him was an earthen stupa with three tiers,
['ZH_T49_2039_003:0989c03_16']	ä¸Šå¦‚è¦†é‡œã€‚	ä¸Šå¦‚è¦†é‡œã€‚	with a lid on top like a cauldron.
['ZH_T49_2039_003:0989c04_1']	ä¸çŸ¥æ˜¯ä½•ã€‚	ä¸çŸ¥æ˜¯ä½•ã€‚	He did not know what it was.
['ZH_T49_2039_003:0989c04_6']	æ›´å¾€è¦“åƒ§ã€‚	æ›´å¾€è¦“åƒ§ã€‚	He went to search for the monk again,
['ZH_T49_2039_003:0989c04_11', 'ZH_T49_2039_003:0989c04_16', 'ZH_T49_2039_003:0989c05_1']	å”¯æœ‰è’è‰ã€‚ğŸ”½æ˜å°‹ä¸€ä¸ˆã€‚ğŸ”½å¾—æ–å¹¶å±¥ã€‚	å”¯æœ‰è’è‰ã€‚ æ˜å°‹ä¸€ä¸ˆã€‚ å¾—æ–å¹¶å±¥ã€‚	but there was only overgrown grass.ğŸ”½He dug one zhang down,ğŸ”½and found a staff and shoes.
['ZH_T49_2039_003:0989c05_6']	åˆæ˜å¾—éŠ˜ã€‚	åˆæ˜å¾—éŠ˜ã€‚	He dug further and found an inscription,
['ZH_T49_2039_003:0989c05_11']	ä¸Šæœ‰æ¢µæ›¸ã€‚	ä¸Šæœ‰æ¢µæ›¸ã€‚	with Sanskrit letters on top.
['ZH_T49_2039_003:0989c05_20']	ä¾è‡£è­˜ä¹‹äº‘æ˜¯ä½›å¡”ã€‚	ä¾è‡£è­˜ä¹‹äº‘æ˜¯ä½›å¡”ã€‚	The attendant officials recognized it and said it was a Buddhist stupa.
['ZH_T49_2039_003:0989c06_5']	ç‹å§”æ›²å•è©°ã€‚	ç‹å§”æ›²å•è©°ã€‚	The king asked in detail,
['ZH_T49_2039_003:0989c06_8']	ç­”æ›°ã€‚	ç­”æ›°ã€‚	and the monk replied,
['ZH_T49_2039_003:0989c06_13']	æ¼¢åœ‹æœ‰ä¹‹ã€‚	æ¼¢åœ‹æœ‰ä¹‹ã€‚	There are such things in the Han kingdom.
['ZH_T49_2039_003:0989c07_10']	å½¼åè’²åœ–ç‹æœ¬ä½œä¼‘å± ç‹ç¥­å¤©é‡‘äººå› ç”Ÿä¿¡ã€‚	å½¼åè’²åœ–ç‹æœ¬ä½œä¼‘å± ç‹ç¥­å¤©é‡‘äººå› ç”Ÿä¿¡ã€‚	The name Putuo was originally Xutu (meaning golden man). The king believed in it because of the golden man sacrificed to heaven.
['ZH_T49_2039_003:0989c07_16']	èµ·æœ¨å¡”ä¸ƒé‡ã€‚	èµ·æœ¨å¡”ä¸ƒé‡ã€‚	He built a wooden pagoda seven stories high.
['ZH_T49_2039_003:0989c07_22']	å¾Œä½›æ³•å§‹è‡³ã€‚	å¾Œä½›æ³•å§‹è‡³ã€‚	Later, when Buddhism first arrived,
['ZH_T49_2039_003:0989c08_3']	å…·çŸ¥å§‹æœ«ã€‚	å…·çŸ¥å§‹æœ«ã€‚	he fully understood the beginning and end.
['ZH_T49_2039_003:0989c08_8']	ä»Šæ›´æé«˜ã€‚	ä»Šæ›´æé«˜ã€‚	Now it is further damaged and high.
['ZH_T49_2039_003:0989c08_13']	æœ¬å¡”æœ½å£ã€‚	æœ¬å¡”æœ½å£ã€‚	The original pagoda is dilapidated.
['ZH_T49_2039_003:0989c09_3']	è‚²ç‹æ‰€çµ±ä¸€é–»æµ®ææ´²ã€‚	è‚²ç‹æ‰€çµ±ä¸€é–»æµ®ææ´²ã€‚	When King AÅ›oka unified the continent of JambudvÄ«pa,
['ZH_T49_2039_003:0989c09_8']	è™•è™•ç«‹å¡”ã€‚	è™•è™•ç«‹å¡”ã€‚	he established stÅ«pas everywhere.
['ZH_T49_2039_003:0989c09_13']	ä¸è¶³å¯æ€ªã€‚	ä¸è¶³å¯æ€ªã€‚	It is not surprising.
['ZH_T49_2039_003:0989c10_3']	åˆå”é¾æœ”ä¸­æœ‰äº‹é¼å·¦ã€‚	åˆå”é¾æœ”ä¸­æœ‰äº‹é¼å·¦ã€‚	Moreover, during the Longshuo era of the Tang dynasty, there was an event in Liaodai.
['ZH_T49_2039_003:0989c10_17']	è¡Œè»è–›ä»è²´è¡Œè‡³éš‹ä¸»è¨é¼å¤åœ°ã€‚	è¡Œè»è–›ä»è²´è¡Œè‡³éš‹ä¸»è¨é¼å¤åœ°ã€‚	The general Xue Rengui passed by the ancient site where the Sui emperor attacked Liaodong.
['ZH_T49_2039_003:0989c11_3']	ä¹ƒè¦‹å±±åƒã€‚	ä¹ƒè¦‹å±±åƒã€‚	He saw a mountain statue.
['ZH_T49_2039_003:0989c11_8']	ç©ºæ› è•­æ¢ã€‚	ç©ºæ› è•­æ¢ã€‚	It was empty and desolate,
['ZH_T49_2039_003:0989c11_13']	çµ•æ–¼è¡Œå¾€ã€‚	çµ•æ–¼è¡Œå¾€ã€‚	with no one passing by.
['ZH_T49_2039_003:0989c11_17']	å•å¤è€ã€‚	å•å¤è€ã€‚	He asked the elders,
['ZH_T49_2039_003:0989c12_3']	äº‘æ˜¯å…ˆä»£æ‰€ç¾ã€‚	äº‘æ˜¯å…ˆä»£æ‰€ç¾ã€‚	who said it was a manifestation of the past.
['ZH_T49_2039_003:0989c13_2']	ä¾¿åœ–å¯«ä¾†äº¬å¸«å…·åœ¨è‹¥å‡½æŒ‰è¥¿æ¼¢èˆ‡ä¸‰åœ‹åœ°ç†å¿—ã€‚	ä¾¿åœ–å¯«ä¾†äº¬å¸«å…·åœ¨è‹¥å‡½æŒ‰è¥¿æ¼¢èˆ‡ä¸‰åœ‹åœ°ç†å¿—ã€‚	He then drew it and brought it to the capital, which is recorded in the box. According to the Western Han and Three Kingdoms Geographical Records,
['ZH_T49_2039_003:0989c13_11']	é¼æ±åŸåœ¨é´¨ç¶ ä¹‹å¤–ã€‚	é¼æ±åŸåœ¨é´¨ç¶ ä¹‹å¤–ã€‚	Liaodong City is outside the Yalu River.
['ZH_T49_2039_003:0989c13_16']	å±¬æ¼¢å¹½å·ã€‚	å±¬æ¼¢å¹½å·ã€‚	It belongs to Youzhou of the Han Dynasty.
['ZH_T49_2039_003:0989c14_5']	é«˜éº—è–ç‹æœªçŸ¥ä½•å›ã€‚	é«˜éº—è–ç‹æœªçŸ¥ä½•å›ã€‚	The sage king of Goguryeo is unknown.
['ZH_T49_2039_003:0989c14_12']	æˆ–äº‘æ±æ˜è–å¸ã€‚	æˆ–äº‘æ±æ˜è–å¸ã€‚	Some say it is the Eastern Sage Emperor.
['ZH_T49_2039_003:0989c14_16']	ç–‘éä¹Ÿã€‚	ç–‘éä¹Ÿã€‚	I suspect it is not so.
['ZH_T49_2039_003:0989c15_10']	æ±æ˜ä»¥å‰æ¼¢å…ƒå¸å»ºæ˜­äºŒå¹´å³ä½ã€‚	æ±æ˜ä»¥å‰æ¼¢å…ƒå¸å»ºæ˜­äºŒå¹´å³ä½ã€‚	Emperor Yuan of the Later Han Dynasty ascended the throne in the second year of Jianzhao.
['ZH_T49_2039_003:0989c16_1']	æˆå¸é´»å˜‰å£¬å¯…å‡éã€‚	æˆå¸é´»å˜‰å£¬å¯…å‡éã€‚	Emperor Cheng ascended to heaven in the Renyin year of Hongjia.
['ZH_T49_2039_003:0989c16_10']	äºæ™‚æ¼¢äº¦æœªè¦‹å…·è‘‰ã€‚	äºæ™‚æ¼¢äº¦æœªè¦‹å…·è‘‰ã€‚	At that time, the Han Dynasty had not yet seen the complete leaves.
['ZH_T49_2039_003:0989c17_4']	ä½•å¾—æµ·å¤–é™ªè‡£å·²èƒ½è­˜æ¢µæ›¸ä¹ã€‚	ä½•å¾—æµ·å¤–é™ªè‡£å·²èƒ½è­˜æ¢µæ›¸ä¹ã€‚	How could the vassal states overseas already be able to recognize Sanskrit?
['ZH_T49_2039_003:0989c17_12']	ç„¶ç¨±ä½›ç‚ºè’²åœ–ç‹ã€‚	ç„¶ç¨±ä½›ç‚ºè’²åœ–ç‹ã€‚	However, calling the Buddha Putuo Wang
['ZH_T49_2039_003:0989c17_19']	ä¼¼åœ¨è¥¿æ¼¢ä¹‹æ™‚ã€‚	ä¼¼åœ¨è¥¿æ¼¢ä¹‹æ™‚ã€‚	seems to be during the Western Han Dynasty.
['ZH_T49_2039_003:0989c18_9']	è¥¿åŸŸæ–‡å­—æˆ–æœ‰è­˜ä¹‹è€…ã€‚	è¥¿åŸŸæ–‡å­—æˆ–æœ‰è­˜ä¹‹è€…ã€‚	There may be those who recognize the script of the Western Regions.
['ZH_T49_2039_003:0989c18_15']	æ•…äº‘æ¢µæ›¸çˆ¾ã€‚	æ•…äº‘æ¢µæ›¸çˆ¾ã€‚	Therefore, it is called Sanskrit.
['ZH_T49_2039_003:0989c19_5']	æŒ‰å¤å‚³è‚²ç‹å‘½é¬¼å¾’ã€‚	æŒ‰å¤å‚³è‚²ç‹å‘½é¬¼å¾’ã€‚	According to ancient records, King AÅ›oka ordered the ghosts to
['ZH_T49_2039_003:0989c19_16']	æ¯æ–¼ä¹å„„äººå±…åœ°ç«‹ä¸€å¡”ã€‚	æ¯æ–¼ä¹å„„äººå±…åœ°ç«‹ä¸€å¡”ã€‚	establish a stupa on the land of every ninety million people.
['ZH_T49_2039_003:0989c20_9']	å¦‚æ˜¯èµ·å…«è¬å››åƒæ–¼é–»æµ®ç•Œã€‚	å¦‚æ˜¯èµ·å…«è¬å››åƒæ–¼é–»æµ®ç•Œã€‚	In this way, he built eighty-four thousand stupas in the world of JambudvÄ«pa.
['ZH_T49_2039_003:0989c20_16']	å…§è—æ–¼å·¨çŸ³ä¸­ã€‚	å…§è—æ–¼å·¨çŸ³ä¸­ã€‚	They were hidden inside huge rocks.
['ZH_T49_2039_003:0989c21_6']	ä»Šè™•è™•æœ‰ç¾ç‘éä¸€ã€‚	ä»Šè™•è™•æœ‰ç¾ç‘éä¸€ã€‚	Now, there are many auspicious signs appearing everywhere.
['ZH_T49_2039_003:0989c21_12']	è“‹çœŸèº«èˆåˆ©ã€‚	è“‹çœŸèº«èˆåˆ©ã€‚	They are indeed the true relics of the Buddha's body.
['ZH_T49_2039_003:0989c21_18']	æ„Ÿæ‡‰é›£æ€çŸ£ã€‚	æ„Ÿæ‡‰é›£æ€çŸ£ã€‚	The response is beyond thought.
['ZH_T49_2039_003:0989c22_1']	è®šæ›°ã€‚	è®šæ›°ã€‚	Praise:
['ZH_T49_2039_003:0989c23_0']	è‚²ç‹å¯¶å¡”éå¡µå¯°ã€€ã€€é›¨æ¿•é›²åŸ‹è˜šçºˆç­	è‚²ç‹å¯¶å¡”éå¡µå¯°ã€€ã€€é›¨æ¿•é›²åŸ‹è˜šçºˆç­	King AÅ›oka's jeweled stupas are found all over the world, weathered by rain and clouds, covered with moss and lichen
['ZH_T49_2039_003:0989c24_0']	æƒ³åƒç•¶å¹´è¡Œè·¯çœ¼ã€€ã€€å¹¾äººæŒ‡é»ç¥­ç¥å¢¦	æƒ³åƒç•¶å¹´è¡Œè·¯çœ¼ã€€ã€€å¹¾äººæŒ‡é»ç¥­ç¥å¢¦	Imagining the eyes of those who traveled there in the past, how many people point out the altar for worshipping the gods?
['ZH_T49_2039_003:0989c26_10']	é‡‘å®˜åŸå©†å¨‘çŸ³å¡”é‡‘å®˜åŸå©†å¨‘çŸ³å¡”é‡‘å®˜è™æºªå¯ºå©†å¨‘çŸ³å¡”è€…ã€‚	é‡‘å®˜åŸå©†å¨‘çŸ³å¡”é‡‘å®˜åŸå©†å¨‘çŸ³å¡”é‡‘å®˜è™æºªå¯ºå©†å¨‘çŸ³å¡”è€…ã€‚	The Bosa Stone Pagoda in Geumgwanseong Fortress
['ZH_T49_2039_003:0989c27_1']	æ˜”æ­¤é‚‘ç‚ºé‡‘å®˜åœ‹æ™‚ã€‚	æ˜”æ­¤é‚‘ç‚ºé‡‘å®˜åœ‹æ™‚ã€‚	In the past, when this village was the country of Geumgwan,
['ZH_T49_2039_003:0989c27_15']	ä¸–ç¥–é¦–éœ²ç‹ä¹‹å¦ƒè¨±çš‡ååé»ƒç‰ã€‚	ä¸–ç¥–é¦–éœ²ç‹ä¹‹å¦ƒè¨±çš‡ååé»ƒç‰ã€‚	Queen Huh, the consort of King Sejo of the Silla Dynasty, was named Hwangyu.
['ZH_T49_2039_003:0989c28_8']	ä»¥æ±æ¼¢å»ºæ­¦äºŒåå››å¹´ç”²ç”³ã€‚	ä»¥æ±æ¼¢å»ºæ­¦äºŒåå››å¹´ç”²ç”³ã€‚	In the 24th year of the Jianwu era of the Eastern Han Dynasty, Jiachen year,
['ZH_T49_2039_003:0989c29_1']	è‡ªè¥¿åŸŸé˜¿è¸°é™€åœ‹æ‰€è¼‰ä¾†ã€‚	è‡ªè¥¿åŸŸé˜¿è¸°é™€åœ‹æ‰€è¼‰ä¾†ã€‚	it was brought from the country of Ayuta in the Western Regions.
['ZH_T49_2039_003:0989c29_10']	åˆå…¬ä¸»æ‰¿äºŒè¦ªä¹‹å‘½ã€‚	åˆå…¬ä¸»æ‰¿äºŒè¦ªä¹‹å‘½ã€‚	At first, the princess, following the orders of her parents,
['ZH_T49_2039_003:0989c29_16']	æ³›æµ·å°‡æŒ‡æ±ã€‚	æ³›æµ·å°‡æŒ‡æ±ã€‚	sailed across the sea, heading east.
['ZH_T49_2039_003:0990a01_2']	é˜»æ³¢ç¥ä¹‹æ€’ã€‚	é˜»æ³¢ç¥ä¹‹æ€’ã€‚	But she was obstructed by the anger of the sea god.
['ZH_T49_2039_003:0990a01_7']	ä¸å…‹è€Œé‚„ã€‚	ä¸å…‹è€Œé‚„ã€‚	She was unable to continue and returned.
['ZH_T49_2039_003:0990a01_11']	ç™½çˆ¶ç‹ã€‚	ç™½çˆ¶ç‹ã€‚	She reported to her father, the king.
['ZH_T49_2039_003:0990a01_18']	çˆ¶ç‹å‘½è¼‰èŒ²å¡”ã€‚	çˆ¶ç‹å‘½è¼‰èŒ²å¡”ã€‚	The father, the king, ordered the loading of this pagoda.
['ZH_T49_2039_003:0990a02_2']	ä¹ƒç²åˆ©æ¶‰ã€‚	ä¹ƒç²åˆ©æ¶‰ã€‚	And so she was able to safely cross the sea.
['ZH_T49_2039_003:0990a02_7']	ä¾†æ³Šå—æ¶¯ã€‚	ä¾†æ³Šå—æ¶¯ã€‚	She arrived and anchored on the southern shore.
['ZH_T49_2039_003:0990a02_17']	æœ‰ç·‹å¸†èŒœæ——ç ç‰ä¹‹ç¾ã€‚	æœ‰ç·‹å¸†èŒœæ——ç ç‰ä¹‹ç¾ã€‚	It had the beauty of a red sail and a red flag, pearls and jade.
['ZH_T49_2039_003:0990a03_2', 'ZH_T49_2039_003:0990a03_14']	ä»Šäº‘ä¸»æµ¦ã€‚ğŸ”½åˆè§£ç¶¾è¢´æ–¼å²¡ä¸Šè™•æ›°ç¶¾å³´ã€‚	ä»Šäº‘ä¸»æµ¦ã€‚ åˆè§£ç¶¾è¢´æ–¼å²¡ä¸Šè™•æ›°ç¶¾å³´ã€‚	It is now called Jubu.ğŸ”½The place where she first untied her patterned skirt on the hill is called Aenghyeon.
['ZH_T49_2039_003:0990a04_6']	èŒœæ——åˆå…¥æµ·æ¶¯æ›°æ——å‡ºé‚Šã€‚	èŒœæ——åˆå…¥æµ·æ¶¯æ›°æ——å‡ºé‚Šã€‚	The place where the red flag first entered the edge of the sea is called Gigeupbyeon.
['ZH_T49_2039_003:0990a04_13']	é¦–éœ²ç‹è˜è¿ä¹‹ã€‚	é¦–éœ²ç‹è˜è¿ä¹‹ã€‚	King Sejo sent a marriage proposal and welcomed her.
['ZH_T49_2039_003:0990a05_4']	åŒå¾¡åœ‹ä¸€ç™¾äº”åé¤˜å¹´ã€‚	åŒå¾¡åœ‹ä¸€ç™¾äº”åé¤˜å¹´ã€‚	She ruled the country together with him for more than 150 years.
['ZH_T49_2039_003:0990a05_18']	ç„¶äºæ™‚æµ·æ±æœªæœ‰å‰µå¯ºå¥‰æ³•ä¹‹äº‹ã€‚	ç„¶äºæ™‚æµ·æ±æœªæœ‰å‰µå¯ºå¥‰æ³•ä¹‹äº‹ã€‚	However, at that time, there were no temples established and no practice of Buddhism in the East Sea.
['ZH_T49_2039_003:0990a06_5']	è“‹åƒæ•™æœªè‡³ã€‚	è“‹åƒæ•™æœªè‡³ã€‚	It seems that the Buddhist teachings had not yet reached there.
['ZH_T49_2039_003:0990a06_12']	è€ŒåœŸäººä¸ä¿¡ä¼ã€‚	è€ŒåœŸäººä¸ä¿¡ä¼ã€‚	The people of the land did not believe in it.
['ZH_T49_2039_003:0990a07_2']	æ•…æœ¬è¨˜ç„¡å‰µå¯ºä¹‹æ–‡ã€‚	æ•…æœ¬è¨˜ç„¡å‰µå¯ºä¹‹æ–‡ã€‚	Therefore, the original record does not have the text about establishing temples.
['ZH_T49_2039_003:0990a07_14']	é€®ç¬¬å…«ä»£éŠçŸ¥ç‹äºŒå¹´å£¬è¾°ã€‚	é€®ç¬¬å…«ä»£éŠçŸ¥ç‹äºŒå¹´å£¬è¾°ã€‚	In the second year of the eighth reign, King Guji, in the year of Jinshen,
['ZH_T49_2039_003:0990a08_1']	ç½®å¯ºæ–¼å…¶åœ°ã€‚	ç½®å¯ºæ–¼å…¶åœ°ã€‚	a temple was established on that land.
['ZH_T49_2039_003:0990a08_15']	åˆå‰µç‹åå¯ºåœ¨é˜¿é“è¨¥ç¥‡ç‹ä¹‹ä¸–ã€‚	åˆå‰µç‹åå¯ºåœ¨é˜¿é“è¨¥ç¥‡ç‹ä¹‹ä¸–ã€‚	And the Queen's Temple was founded in the time of King Ado Nugi.
['ZH_T49_2039_003:0990a08_26']	æ³•èˆˆç‹ä¹‹å‰è‡³ä»Šå¥‰ç¦ç„‰ã€‚	æ³•èˆˆç‹ä¹‹å‰è‡³ä»Šå¥‰ç¦ç„‰ã€‚	It has been revered and blessed until the time of King Dharma.
['ZH_T49_2039_003:0990a09_4']	å…¼ä»¥é®å—å€­ã€‚	å…¼ä»¥é®å—å€­ã€‚	It also serves as a southern guard against the Japanese.
['ZH_T49_2039_003:0990a09_11']	å…·è¦‹æœ¬åœ‹æœ¬è¨˜ã€‚	å…·è¦‹æœ¬åœ‹æœ¬è¨˜ã€‚	It is fully seen in the original record of the country.
['ZH_T49_2039_003:0990a09_18']	å¡”æ–¹å››é¢äº”å±¤ã€‚	å¡”æ–¹å››é¢äº”å±¤ã€‚	The pagoda has four sides and five stories.
['ZH_T49_2039_003:0990a10_4']	å…¶å½«é¤ç”šå¥‡ã€‚	å…¶å½«é¤ç”šå¥‡ã€‚	Its carvings are very wonderful.
['ZH_T49_2039_003:0990a10_10']	çŸ³å¾®èµ¤ç­è‰²ã€‚	çŸ³å¾®èµ¤ç­è‰²ã€‚	The stone has a slight red pattern.
['ZH_T49_2039_003:0990a10_15']	å…¶è³ªè‰¯è„†ã€‚	å…¶è³ªè‰¯è„†ã€‚	Its quality is good and brittle.
['ZH_T49_2039_003:0990a11_1']	éæ­¤æ–¹é¡ä¹Ÿã€‚	éæ­¤æ–¹é¡ä¹Ÿã€‚	It is not of this land.
['ZH_T49_2039_003:0990a11_15']	æœ¬è‰æ‰€äº‘é»é·„å† è¡€ç‚ºé©—è€…æ˜¯ä¹Ÿã€‚	æœ¬è‰æ‰€äº‘é»é·„å† è¡€ç‚ºé©—è€…æ˜¯ä¹Ÿã€‚	The so-called testing with the blood of a spotted cock mentioned in the original herbal book is it.
['ZH_T49_2039_003:0990a12_5']	é‡‘å®˜åœ‹äº¦åé§•æ´›åœ‹ã€‚	é‡‘å®˜åœ‹äº¦åé§•æ´›åœ‹ã€‚	The country of Geumgwan is also called Garak.
['ZH_T49_2039_003:0990a12_10']	å…·è¼‰æœ¬è¨˜ã€‚	å…·è¼‰æœ¬è¨˜ã€‚	It is fully recorded in the original record.
['ZH_T49_2039_003:0990a12_13']	è®šæ›°ã€‚	è®šæ›°ã€‚	Praise says:
['ZH_T49_2039_003:0990a13_0']	è¼‰å­ç·‹å¸†èŒœæ–¾è¼•ã€€ã€€ä¹éˆé®è«æµ·æ¿¤é©š	è¼‰å­ç·‹å¸†èŒœæ–¾è¼•ã€€ã€€ä¹éˆé®è«æµ·æ¿¤é©š	The light red sails and crimson oars are too much to bear, begging for blessings, the sea waves are frightening
['ZH_T49_2039_003:0990a14_0']	è±ˆå¾’åˆ°å²¸æ‰¶é»ƒç‰ã€€ã€€åƒå¤å—å€­éæ€’é¯¨	è±ˆå¾’åˆ°å²¸æ‰¶é»ƒç‰ã€€ã€€åƒå¤å—å€­éæ€’é¯¨	How can it be in vain to reach the shore and support the yellow jade, stopping the angry whale in the south for a thousand years?
['ZH_T49_2039_003:0990a16_3']	é«˜éº—éˆå¡”å¯ºé«˜éº—éˆå¡”å¯ºåƒ§å‚³äº‘ã€‚	é«˜éº—éˆå¡”å¯ºé«˜éº—éˆå¡”å¯ºåƒ§å‚³äº‘ã€‚	The Biography of Monks of the Miraculous Pagoda Temple in Goryeo says:
['ZH_T49_2039_003:0990a16_10']	é‡‹æ™®å¾·å­—æ™ºæ³•ã€‚	é‡‹æ™®å¾·å­—æ™ºæ³•ã€‚	The monk Pude, whose name was Zhifa.
['ZH_T49_2039_003:0990a16_19']	å‰é«˜éº—é¾å²¡ç¸£äººä¹Ÿã€‚	å‰é«˜éº—é¾å²¡ç¸£äººä¹Ÿã€‚	He was a person from Longgang County in the former Goryeo.
['ZH_T49_2039_003:0990a17_5']	è©³è¦‹ä¸‹æœ¬å‚³ã€‚	è©³è¦‹ä¸‹æœ¬å‚³ã€‚	The details are seen below in the original biography.
['ZH_T49_2039_003:0990a17_14']	å¸¸å±…å¹³å£¤åŸæœ‰å±±æ–¹ã€‚	å¸¸å±…å¹³å£¤åŸæœ‰å±±æ–¹ã€‚	He always lived on a mountain opposite Pyongyang City.
['ZH_T49_2039_003:0990a18_2']	è€åƒ§ä¾†è«‹è¬›ç¶“ã€‚	è€åƒ§ä¾†è«‹è¬›ç¶“ã€‚	An old monk came to invite him to lecture on the sutras.
['ZH_T49_2039_003:0990a18_6']	å¸«å›ºè¾­ã€‚	å¸«å›ºè¾­ã€‚	The master firmly declined.
['ZH_T49_2039_003:0990a18_9']	ä¸å…Œã€‚	ä¸å…Œã€‚	He did not agree.
['ZH_T49_2039_003:0990a18_19']	èµ´è¬›æ¶…æ§ƒç¶“å››åé¤˜å·ã€‚	èµ´è¬›æ¶…æ§ƒç¶“å››åé¤˜å·ã€‚	He went to lecture on the Nirvana Sutra for more than forty scrolls.
['ZH_T49_2039_003:0990a19_13']	ç½·å¸­è‡³åŸè¥¿å¤§å¯¶å±±åµ“ç©´ä¸‹ç¦ªè§€ã€‚	ç½·å¸­è‡³åŸè¥¿å¤§å¯¶å±±åµ“ç©´ä¸‹ç¦ªè§€ã€‚	After the lecture ended, he went to a cave under a cliff on Mount Dabao to the west of the city to meditate.
['ZH_T49_2039_003:0990a20_1']	æœ‰ç¥äººä¾†è«‹ã€‚	æœ‰ç¥äººä¾†è«‹ã€‚	A spirit came and invited him.
['ZH_T49_2039_003:0990a20_6']	å®œä½æ­¤åœ°ã€‚	å®œä½æ­¤åœ°ã€‚	You should stay in this place.
['ZH_T49_2039_003:0990a20_13']	ä¹ƒç½®éŒ«æ–æ–¼å‰ã€‚	ä¹ƒç½®éŒ«æ–æ–¼å‰ã€‚	He placed his staff in front of him.
['ZH_T49_2039_003:0990a20_18']	æŒ‡å…¶åœ°æ›°ã€‚	æŒ‡å…¶åœ°æ›°ã€‚	Pointing to the ground, he said:
['ZH_T49_2039_003:0990a21_7']	æ­¤ä¸‹æœ‰å…«é¢ä¸ƒç´šçŸ³å¡”ã€‚	æ­¤ä¸‹æœ‰å…«é¢ä¸ƒç´šçŸ³å¡”ã€‚	Under here, there is an eight-sided, seven-tiered stone pagoda.
['ZH_T49_2039_003:0990a21_12', 'ZH_T49_2039_003:0990a21_17']	æ˜ä¹‹æœç„¶ã€‚ğŸ”½å› ç«‹ç²¾èˆã€‚	æ˜ä¹‹æœç„¶ã€‚ å› ç«‹ç²¾èˆã€‚	He dug it up and it turned out to be true.ğŸ”½He then built a monastery.
['ZH_T49_2039_003:0990a22_5']	æ›°éˆå¡”å¯ºä»¥å±…ä¹‹ã€‚	æ›°éˆå¡”å¯ºä»¥å±…ä¹‹ã€‚	Calling it the Miraculous Pagoda Temple, he lived there.
['ZH_T49_2039_003:0990a25_1']	çš‡é¾å¯ºä¸ˆå…­çš‡é¾å¯ºä¸ˆå…­æ–°ç¾…ç¬¬äºŒåå››çœŸèˆˆç‹å³ä½åå››å¹´ç™¸é…‰äºŒæœˆã€‚	çš‡é¾å¯ºä¸ˆå…­çš‡é¾å¯ºä¸ˆå…­æ–°ç¾…ç¬¬äºŒåå››çœŸèˆˆç‹å³ä½åå››å¹´ç™¸é…‰äºŒæœˆã€‚	The Sixteen-Foot Buddha of Hwangnyongsa Temple, the sixteenth year of the reign of King Jinheung of Silla, the year of Guiyou in the second month.
['ZH_T49_2039_003:0990a25_10']	å°‡ç¯‰ç´«å®®æ–¼é¾å®®å—ã€‚	å°‡ç¯‰ç´«å®®æ–¼é¾å®®å—ã€‚	He planned to build a palace at the south of the Dragon Palace.
['ZH_T49_2039_003:0990a25_17']	æœ‰é»ƒé¾ç¾å…¶åœ°ã€‚	æœ‰é»ƒé¾ç¾å…¶åœ°ã€‚	A yellow dragon appeared on the ground.
['ZH_T49_2039_003:0990a26_4']	ä¹ƒæ”¹ç½®ç‚ºä½›å¯ºã€‚	ä¹ƒæ”¹ç½®ç‚ºä½›å¯ºã€‚	He then changed it to build a Buddhist temple.
['ZH_T49_2039_003:0990a26_9']	è™Ÿé»ƒé¾å¯ºã€‚	è™Ÿé»ƒé¾å¯ºã€‚	It was called Huanglong Temple.
['ZH_T49_2039_003:0990a26_18']	è‡³å·±ä¸‘å¹´å‘¨åœç‰†å®‡ã€‚	è‡³å·±ä¸‘å¹´å‘¨åœç‰†å®‡ã€‚	In the Ji Chou year, the surrounding walls and buildings were built.
['ZH_T49_2039_003:0990a27_5']	è‡³åä¸ƒå¹´æ–¹ç•¢ã€‚	è‡³åä¸ƒå¹´æ–¹ç•¢ã€‚	In the seventeenth year, it was completed.
['ZH_T49_2039_003:0990a27_14']	æœªå¹¾æµ·å—æœ‰ä¸€å·¨èˆ«ã€‚	æœªå¹¾æµ·å—æœ‰ä¸€å·¨èˆ«ã€‚	Soon, a large ship from the South Sea
