segmentnr	original	analyzed	translated
['ZH_T49_2039_003:0993b18_9']	å¡”ä¹‹ç¬¬ä¸‰ç½ä¹Ÿã€‚	å¡”ä¹‹ç¬¬ä¸‰ç½ä¹Ÿã€‚	It was the third disaster of the pagoda.
['ZH_T49_2039_003:0993b18_18']	æ›¹æºªç„¡è¡£å­ç•™è©©äº‘ã€‚	æ›¹æºªç„¡è¡£å­ç•™è©©äº‘ã€‚	The son of Wu Yi of Caoxi left a poem saying:
['ZH_T49_2039_003:0993b19_6']	èå™µçš‡é¾ç½å¡”æ—¥ã€‚	èå™µçš‡é¾ç½å¡”æ—¥ã€‚	I heard that the pagoda of Hwangnyongsa Temple was burned on the same day,
['ZH_T49_2039_003:0993b19_14']	é€£ç‡’ä¸€é¢ç¤ºç„¡é–“ã€‚	é€£ç‡’ä¸€é¢ç¤ºç„¡é–“ã€‚	and that one side was burned continuously, showing no interval.
['ZH_T49_2039_003:0993b19_17']	æ˜¯ä¹Ÿã€‚	æ˜¯ä¹Ÿã€‚	This is it.
['ZH_T49_2039_003:0993b20_11']	è‡ªè‡³å…ƒç”²å­å·²ä¾†å¤§æœä½¿ä½æœ¬åœ‹ã€‚	è‡ªè‡³å…ƒç”²å­å·²ä¾†å¤§æœä½¿ä½æœ¬åœ‹ã€‚	Since the year of Jia Zi of the Yuan Dynasty, the great envoys of the dynasty have assisted the Korean state.
['ZH_T49_2039_003:0993b20_18']	çš‡è¯çˆ­ä¾†ç»ç¦®ã€‚	çš‡è¯çˆ­ä¾†ç»ç¦®ã€‚	The imperial capital has been crowded with visitors paying homage.
['ZH_T49_2039_003:0993b21_4']	å››æ–¹é›²æ°´ã€‚	å››æ–¹é›²æ°´ã€‚	From all directions, monks and pilgrims
['ZH_T49_2039_003:0993b21_9']	è¼»æ¹Šä¾†åƒã€‚	è¼»æ¹Šä¾†åƒã€‚	have gathered to participate.
['ZH_T49_2039_003:0993b21_14']	æˆ–èˆ‰ä¸èˆ‰ã€‚	æˆ–èˆ‰ä¸èˆ‰ã€‚	Whether it is mentioned or not,
['ZH_T49_2039_003:0993b21_20']	çœŸèº«å››æšå¤–ã€‚	çœŸèº«å››æšå¤–ã€‚	in addition to the four true bodies,
['ZH_T49_2039_003:0993b22_4']	è®Šèº«èˆåˆ©ã€‚	è®Šèº«èˆåˆ©ã€‚	the transformed relics
['ZH_T49_2039_003:0993b22_9']	ç¢å¦‚ç ‚ç¤«ã€‚	ç¢å¦‚ç ‚ç¤«ã€‚	are as small as sand and gravel.
['ZH_T49_2039_003:0993b22_14']	ç¾æ–¼ğ¥–ªå¤–ã€‚	ç¾æ–¼ğ¥–ªå¤–ã€‚	They appear outside the coffin,
['ZH_T49_2039_003:0993b22_20']	è€Œç•°é¦™éƒçƒˆã€‚	è€Œç•°é¦™éƒçƒˆã€‚	and the unusual fragrance is intense.
['ZH_T49_2039_003:0993b23_9']	å½Œæ—¥ä¸æ­‡è€…æ¯”æ¯”æœ‰ä¹‹ã€‚	å½Œæ—¥ä¸æ­‡è€…æ¯”æ¯”æœ‰ä¹‹ã€‚	It has been like this day after day.
['ZH_T49_2039_003:0993b24_1']	æ­¤æœ«å­£ä¸€æ–¹ä¹‹å¥‡äº‹ä¹Ÿã€‚	æ­¤æœ«å­£ä¸€æ–¹ä¹‹å¥‡äº‹ä¹Ÿã€‚	This is a rare event in the latter age of the Dharma in this region.
['ZH_T49_2039_003:0993b24_9', 'ZH_T49_2039_003:0993b25_5', 'ZH_T49_2039_003:0993b25_20', 'ZH_T49_2039_003:0993b26_4', 'ZH_T49_2039_003:0993b26_17', 'ZH_T49_2039_003:0993b27_7']	å”å¤§ä¸­äº”å¹´è¾›æœªã€‚ğŸ”½å…¥æœä½¿å…ƒå¼˜æ‰€å°‡ä½›ç‰™ä»Šæœªè©³æ‰€åœ¨ã€‚ğŸ”½æ–°ç¾…æ–‡è–ç‹ä»£å¾Œå”åŒå…‰å…ƒå¹´ç™¸æœªã€‚ğŸ”½æœ¬æœå¤ªç¥–å³ä½å…­å¹´ã€‚ğŸ”½å…¥æœä½¿å°¹è³ªæ‰€å°‡äº”ç™¾ç¾…æ¼¢åƒã€‚ğŸ”½ä»Šåœ¨åŒ—å´‡å±±ç¥å…‰å¯ºã€‚	å”å¤§ä¸­äº”å¹´è¾›æœªã€‚ å…¥æœä½¿å…ƒå¼˜æ‰€å°‡ä½›ç‰™ä»Šæœªè©³æ‰€åœ¨ã€‚ æ–°ç¾…æ–‡è–ç‹ä»£å¾Œå”åŒå…‰å…ƒå¹´ç™¸æœªã€‚ æœ¬æœå¤ªç¥–å³ä½å…­å¹´ã€‚ å…¥æœä½¿å°¹è³ªæ‰€å°‡äº”ç™¾ç¾…æ¼¢åƒã€‚ ä»Šåœ¨åŒ—å´‡å±±ç¥å…‰å¯ºã€‚	In the 5th year of the Daming era of the Tang dynasty, the 5th year of Xinwei.ğŸ”½The Buddha's tooth brought by Yuan Hong, the envoy to the Tang court, is now unknown.ğŸ”½In the 1st year of the Tongguang era of the Later Tang dynasty, the 1st year of Guiwei, during the reign of King Munsong of Silla.ğŸ”½The 6th year of the reign of King Taejo of the Goryeo dynasty.ğŸ”½The 500 arhat statues brought by Yin Ji, the envoy to the Tang court.ğŸ”½They are now at Singwangsa Temple on Mount Buk.ğŸ”½ğŸ”½
['ZH_T49_2039_003:0993b28_17', 'ZH_T49_2039_003:0993b29_6', 'ZH_T49_2039_003:0993b29_10', 'ZH_T49_2039_003:0993b29_18', 'ZH_T49_2039_003:0993c01_11', 'ZH_T49_2039_003:0993c01_17', 'ZH_T49_2039_003:0993c02_3', 'ZH_T49_2039_003:0993c02_11', 'ZH_T49_2039_003:0993c03_1', 'ZH_T49_2039_003:0993c03_8', 'ZH_T49_2039_003:0993c03_15', 'ZH_T49_2039_003:0993c04_2']	å¤§å®‹å®£å’Œå…ƒå¹´å·±å¯äº¥ç¿å»Ÿåäº”å¹´å…¥è²¢ä½¿é„­å…‹æ°¸æä¹‹ç¾ç­‰æ‰€å°‡ä½›ç‰™ã€‚ğŸ”½ä»Šå…§æ®¿ç½®å¥‰è€…æ˜¯ä¹Ÿã€‚ğŸ”½ç›¸å‚³äº‘ã€‚ğŸ”½æ˜”ç¾©æ¹˜æ³•å¸«å…¥å”ã€‚ğŸ”½åˆ°çµ‚å—å±±è‡³ç›¸å¯ºæ™ºå„¼å°Šè€…è™•ã€‚ğŸ”½éš£æœ‰å®£å¾‹å¸«ã€‚ğŸ”½å¸¸å—å¤©ä¾›ã€‚ğŸ”½æ¯é½‹æ™‚å¤©å¨é€é£Ÿã€‚ğŸ”½ä¸€æ—¥å¾‹å¸«è«‹æ¹˜å…¬é½‹ã€‚ğŸ”½æ¹˜è‡³åå®šæ—¢ä¹…ã€‚ğŸ”½å¤©ä¾›éæ™‚ä¸è‡³ã€‚ğŸ”½æ¹˜ä¹ƒç©ºé‰¢è€Œæ­¸ã€‚	å¤§å®‹å®£å’Œå…ƒå¹´å·±å¯äº¥ç¿å»Ÿåäº”å¹´å…¥è²¢ä½¿é„­å…‹æ°¸æä¹‹ç¾ç­‰æ‰€å°‡ä½›ç‰™ã€‚ğŸ”½ä»Šå…§æ®¿ç½®å¥‰è€…æ˜¯ä¹Ÿã€‚ğŸ”½ç›¸å‚³äº‘ã€‚ğŸ”½æ˜”ç¾©æ¹˜æ³•å¸«å…¥å”ã€‚ğŸ”½åˆ°çµ‚å—å±±è‡³ç›¸å¯ºæ™ºå„¼å°Šè€…è™•ã€‚ğŸ”½éš£æœ‰å®£å¾‹å¸«ã€‚ğŸ”½å¸¸å—å¤©ä¾›ã€‚ğŸ”½æ¯é½‹æ™‚å¤©å¨é€é£Ÿã€‚ğŸ”½ä¸€æ—¥å¾‹å¸«è«‹æ¹˜å…¬é½‹ã€‚ğŸ”½æ¹˜è‡³åå®šæ—¢ä¹…ã€‚ğŸ”½å¤©ä¾›éæ™‚ä¸è‡³ã€‚ğŸ”½æ¹˜ä¹ƒç©ºé‰¢è€Œæ­¸ã€‚	In the 5th year of the Daming era of the Tang dynasty, the 15th year of the reign of King Munsong of Silla, the 1st year of the Tongguang era of the Later Tang dynasty, the 6th year of the reign of King Taejo of the Goryeo dynasty, the 1st year of the Xuanhe era of the Great Song dynasty, the 15th year of the reign of King Hyejong of Goryeo, the 1st year of the Xuanhe era of the Great Song dynasty, the 15th year of the reign of King Myeongjong of Goryeo, the 1st year of the Xuanhe era of the Great Song dynasty, the 15th year of the reign of King Myeongjong of Goryeo, the 1st year of the Xuanhe era of the Great Song dynasty, the 15th year of the reign of King Myeongjong of Goryeo, the 1st year of the Xuanhe era of the Great Song dynasty, the 15th year of the reign of King Myeongjong of Goryeo, the 1st year of the Xuanhe era of the Great Song dynasty, the 15th year of the reign of King Myeongjong of Goryeo, the 1st year of the Xuanhe era of the Great Song dynasty, the 15th year of the reign of King Myeongjong of Goryeo, the 1st year of the Xuanhe era of the Great Song dynasty, the 15th year of the reign of King Myeongjong of Goryeo, the 1st year of the Xuanhe era of the Great Song dynasty, the 15th year of the reign of King Myeongjong of Goryeo, the 1st year of the Xuanhe era of the Great Song dynasty, the 15th year of the reign of King Myeongjong of Goryeo, the 1st year of the Xuanhe era of the Great Song dynasty, the 15th year of the reign of King Myeongjong of Goryeo, the 1st year of the Xuanhe era of the Great Song dynasty, the 15th year of the reign of King Myeongjong of Goryeo, the 1st year of the Xuanhe era of the Great Song dynasty, the 15th year of the reign
['ZH_T49_2039_003:0993c04_7']	å¤©ä½¿ä¹ƒè‡³ã€‚	å¤©ä½¿ä¹ƒè‡³ã€‚	The heavenly messengers said:
['ZH_T49_2039_003:0993c04_16']	å¾‹å¸«å•ä»Šæ—¥ä½•æ•…é²ã€‚	å¾‹å¸«å•ä»Šæ—¥ä½•æ•…é²ã€‚	Why are you late today?
['ZH_T49_2039_003:0993c04_20']	å¤©ä½¿æ›°ã€‚	å¤©ä½¿æ›°ã€‚	The heavenly messengers said:
['ZH_T49_2039_003:0993c05_7']	æ»¿æ´æœ‰ç¥å…µé®æ“ã€‚	æ»¿æ´æœ‰ç¥å…µé®æ“ã€‚	The entire cave is blocked by divine troops,
['ZH_T49_2039_003:0993c05_12']	ä¸èƒ½å¾—å…¥ã€‚	ä¸èƒ½å¾—å…¥ã€‚	and we cannot enter.
['ZH_T49_2039_003:0993c06_4']	æ–¼æ˜¯å¾‹å¸«çŸ¥æ¹˜å…¬æœ‰ç¥è¡›ã€‚	æ–¼æ˜¯å¾‹å¸«çŸ¥æ¹˜å…¬æœ‰ç¥è¡›ã€‚	Then the Vinaya master knew that Master Xiang had divine protection,
['ZH_T49_2039_003:0993c06_10']	ä¹ƒæœå…¶é“å‹ã€‚	ä¹ƒæœå…¶é“å‹ã€‚	and he admired the superiority of his Way.
['ZH_T49_2039_003:0993c06_16']	ä»ç•™å…¶ä¾›å…·ã€‚	ä»ç•™å…¶ä¾›å…·ã€‚	He kept the offerings.
['ZH_T49_2039_003:0993c07_6']	ç¿Œæ—¥åˆé‚€å„¼æ¹˜äºŒå¸«é½‹ã€‚	ç¿Œæ—¥åˆé‚€å„¼æ¹˜äºŒå¸«é½‹ã€‚	The next day, he invited Masters Yan and Xiang again for a meal.
['ZH_T49_2039_003:0993c07_11']	å…·é™³å…¶ç”±ã€‚	å…·é™³å…¶ç”±ã€‚	He fully explained the reason.
['ZH_T49_2039_003:0993c07_19']	æ¹˜å…¬å¾å®¹è¬‚å®£æ›°ã€‚	æ¹˜å…¬å¾å®¹è¬‚å®£æ›°ã€‚	Master Xiang said to Xuan in a leisurely manner:
['ZH_T49_2039_003:0993c08_7']	å¸«æ—¢è¢«å¤©å¸æ‰€æ•¬ã€‚	å¸«æ—¢è¢«å¤©å¸æ‰€æ•¬ã€‚	Since you are respected by the Heavenly Emperor,ğŸ”½I have heard that there is a tooth of the Buddha in the palace of Åšakra DevÄnÄm Indra,
['ZH_T49_2039_003:0993c09_3']	ç”èå¸é‡‹å®®æœ‰ä½›å››åé½’ä¹‹ä¸€ç‰™ã€‚	ç”èå¸é‡‹å®®æœ‰ä½›å››åé½’ä¹‹ä¸€ç‰™ã€‚	one of the forty teeth.
['ZH_T49_2039_003:0993c09_12']	ç‚ºæˆ‘ç­‰è¼©è«‹ä¸‹äººé–“ã€‚	ç‚ºæˆ‘ç­‰è¼©è«‹ä¸‹äººé–“ã€‚	Please bring it down to the human world for our sake.
['ZH_T49_2039_003:0993c09_17']	ç‚ºç¦å¦‚ä½•ã€‚	ç‚ºç¦å¦‚ä½•ã€‚	What kind of blessings would it bring?
['ZH_T49_2039_003:0993c10_10']	å¾‹å¸«å¾Œèˆ‡å¤©ä½¿å‚³å…¶æ„æ–¼ä¸Šå¸ã€‚	å¾‹å¸«å¾Œèˆ‡å¤©ä½¿å‚³å…¶æ„æ–¼ä¸Šå¸ã€‚	Later, the Vinaya master conveyed this meaning to the Heavenly Emperor through the heavenly messengers.
['ZH_T49_2039_003:0993c10_17']	å¸é™ä¸ƒæ—¥é€èˆ‡ã€‚	å¸é™ä¸ƒæ—¥é€èˆ‡ã€‚	The Emperor set a limit of seven days to send it.
['ZH_T49_2039_003:0993c11_4']	æ¹˜å…¬è‡´æ•¬è¨–ã€‚	æ¹˜å…¬è‡´æ•¬è¨–ã€‚	After Master Xiang expressed his gratitude,
['ZH_T49_2039_003:0993c11_9']	é‚€å®‰å¤§å…§ã€‚	é‚€å®‰å¤§å…§ã€‚	he invited [the tooth] to stay in the palace.
['ZH_T49_2039_003:0993c11_17']	å¾Œè‡³å¤§å®‹å¾½å®—æœã€‚	å¾Œè‡³å¤§å®‹å¾½å®—æœã€‚	Later, during the reign of Emperor Huizong of the Great Song Dynasty,
['ZH_T49_2039_003:0993c12_2']	å´‡å¥‰å·¦é“ã€‚	å´‡å¥‰å·¦é“ã€‚	he revered the left path.
['ZH_T49_2039_003:0993c12_10']	æ™‚åœ‹äººå‚³åœ–è®–æ›°ã€‚	æ™‚åœ‹äººå‚³åœ–è®–æ›°ã€‚	At that time, the people of the country spread a prophecy:
['ZH_T49_2039_003:0993c12_15']	é‡‘äººæ•—åœ‹ã€‚	é‡‘äººæ•—åœ‹ã€‚	The golden man will destroy the country.
['ZH_T49_2039_003:0993c13_1']	é»ƒå·¾ä¹‹å¾’è«·ã€‚	é»ƒå·¾ä¹‹å¾’è«·ã€‚	The Yellow Turban followers chanted this.
['ZH_T49_2039_003:0993c13_6']	æ—¥å®˜å¥æ›°ã€‚	æ—¥å®˜å¥æ›°ã€‚	The Office of Astronomy reported:
['ZH_T49_2039_003:0993c13_15']	é‡‘äººè€…ä½›æ•™ä¹‹è¬‚ä¹Ÿã€‚	é‡‘äººè€…ä½›æ•™ä¹‹è¬‚ä¹Ÿã€‚	The golden man refers to the teachings of Buddhism.
['ZH_T49_2039_003:0993c14_2']	å°‡ä¸åˆ©æ–¼åœ‹å®¶ã€‚	å°‡ä¸åˆ©æ–¼åœ‹å®¶ã€‚	It will not be beneficial to the state.
['ZH_T49_2039_003:0993c14_9']	è­°å°‡ç ´æ»…é‡‹æ°ã€‚	è­°å°‡ç ´æ»…é‡‹æ°ã€‚	The plan is to destroy Buddhism.
['ZH_T49_2039_003:0993c14_14']	å‘è«¸æ²™é–€ã€‚	å‘è«¸æ²™é–€ã€‚	To bury all the monks.
['ZH_T49_2039_003:0993c14_19']	ç„šç‡’ç¶“å…¸ã€‚	ç„šç‡’ç¶“å…¸ã€‚	To burn the scriptures.
['ZH_T49_2039_003:0993c15_4']	è€Œåˆ¥é€ å°èˆ¡ã€‚	è€Œåˆ¥é€ å°èˆ¡ã€‚	And to build a small boat.
['ZH_T49_2039_003:0993c15_12']	è¼‰ä½›ç‰™æ³›æ–¼å¤§æµ·ã€‚	è¼‰ä½›ç‰™æ³›æ–¼å¤§æµ·ã€‚	To float the Buddha's tooth in the great ocean.
['ZH_T49_2039_003:0993c15_18']	ä»»éš¨ç·£æµæ³Šã€‚	ä»»éš¨ç·£æµæ³Šã€‚	To let it drift with the currents and tides.
['ZH_T49_2039_003:0993c16_9']	äºæ™‚é©æœ‰æœ¬æœä½¿è€…è‡³å®‹ã€‚	äºæ™‚é©æœ‰æœ¬æœä½¿è€…è‡³å®‹ã€‚	At that time, an envoy from our dynasty arrived in Song.
['ZH_T49_2039_003:0993c16_13']	èå…¶äº‹ã€‚	èå…¶äº‹ã€‚	He heard about the matter.
['ZH_T49_2039_003:0993c17_2']	ä»¥å¤©èŠ±èŒ¸äº”åé ˜ã€‚	ä»¥å¤©èŠ±èŒ¸äº”åé ˜ã€‚	With fifty pieces of heavenly flower floss.
['ZH_T49_2039_003:0993c17_8']	ç´µå¸ƒä¸‰ç™¾åŒ¹ã€‚	ç´µå¸ƒä¸‰ç™¾åŒ¹ã€‚	And three hundred bolts of hemp cloth.
['ZH_T49_2039_003:0993c17_16']	è¡Œè³‚æ–¼æŠ¼èˆ¡å…§å²ã€‚	è¡Œè³‚æ–¼æŠ¼èˆ¡å…§å²ã€‚	He bribed the naval commander.
['ZH_T49_2039_003:0993c18_1']	å¯†æˆä½›ç‰™ã€‚	å¯†æˆä½›ç‰™ã€‚	Secretly presented the Buddha's tooth.
['ZH_T49_2039_003:0993c18_6']	ä½†æµç©ºèˆ¡ã€‚	ä½†æµç©ºèˆ¡ã€‚	But let the empty boat drift.
['ZH_T49_2039_003:0993c18_16']	ä½¿è‡£ç­‰æ—¢å¾—ä½›ç‰™ä¾†å¥ã€‚	ä½¿è‡£ç­‰æ—¢å¾—ä½›ç‰™ä¾†å¥ã€‚	The envoys obtained the Buddha's tooth and reported it.
['ZH_T49_2039_003:0993c19_3']	æ–¼æ˜¯ç¿å®—å¤§å–œã€‚	æ–¼æ˜¯ç¿å®—å¤§å–œã€‚	Then Emperor Ruizong was greatly delighted.
['ZH_T49_2039_003:0993c19_14']	å¥‰å®‰äºåå“¡æ®¿å·¦æ–å°æ®¿ã€‚	å¥‰å®‰äºåå“¡æ®¿å·¦æ–å°æ®¿ã€‚	Respectfully enshrined it in the small hall to the left of the Shiyuan Hall.
['ZH_T49_2039_003:0993c20_1']	å¸¸é‘°åŒ™æ®¿é–€ã€‚	å¸¸é‘°åŒ™æ®¿é–€ã€‚	Always locking the hall door.
['ZH_T49_2039_003:0993c20_7']	æ–½é¦™ç‡ˆäºå¤–ã€‚	æ–½é¦™ç‡ˆäºå¤–ã€‚	Offering incense and lamps outside.
['ZH_T49_2039_003:0993c20_16']	æ¯è¦ªå¹¸æ—¥é–‹æ®¿ç»æ•¬ã€‚	æ¯è¦ªå¹¸æ—¥é–‹æ®¿ç»æ•¬ã€‚	Every time the emperor personally visited, he would open the hall to pay respects.
['ZH_T49_2039_003:0993c21_4']	è‡³å£¬è¾°æ­²ç§»å¾¡æ¬¡ã€‚	è‡³å£¬è¾°æ­²ç§»å¾¡æ¬¡ã€‚	By the time of the Jinshin year, the imperial residence was moved.
['ZH_T49_2039_003:0993c21_14']	å…§å®˜æ€±é½ä¸­å¿˜ä¸æ”¶æ’¿ã€‚	å…§å®˜æ€±é½ä¸­å¿˜ä¸æ”¶æ’¿ã€‚	The palace officials were in a hurry and forgot to collect and inspect it.
['ZH_T49_2039_003:0993c22_1']	è‡³ä¸™ç”³å››æœˆã€‚	è‡³ä¸™ç”³å››æœˆã€‚	Until the fourth month of the bingchen year.
['ZH_T49_2039_003:0993c22_16']	å¾¡é¡˜å ‚ç¥å­å¯ºé‡‹è–€å…‰è«‹è‡´æ•¬ä½›ç‰™ã€‚	å¾¡é¡˜å ‚ç¥å­å¯ºé‡‹è–€å…‰è«‹è‡´æ•¬ä½›ç‰™ã€‚	The god of the Imperial Wish Hall, Monk Woongwang of Sijongsa Temple, requested to pay homage to the Buddha's tooth relic.
['ZH_T49_2039_003:0993c23_1']	èäºä¸Šã€‚	èäºä¸Šã€‚	The emperor heard about it.
['ZH_T49_2039_003:0993c23_10']	å‹…ä»¤å…§è‡£éæ’¿å®®ä¸­ã€‚	å‹…ä»¤å…§è‡£éæ’¿å®®ä¸­ã€‚	He ordered the palace officials to search everywhere in the palace.
['ZH_T49_2039_003:0993c23_14']	ç„¡å¾—ä¹Ÿã€‚	ç„¡å¾—ä¹Ÿã€‚	There was none to be found.
['ZH_T49_2039_003:0993c24_13']	æ™‚æŸè‡ºä¾å¾¡å²å´”å†²å‘½è–œä¼¸æ€¥å¾µäºè«¸è¬è€…æˆ¿ã€‚	æ™‚æŸè‡ºä¾å¾¡å²å´”å†²å‘½è–œä¼¸æ€¥å¾µäºè«¸è¬è€…æˆ¿ã€‚	At that time, the attendant censor of Baidai, Cui Chong, ordered Xue Xin to urgently request it from the various officials' rooms.
['ZH_T49_2039_003:0993c25_1']	çš†æœªçŸ¥æ‰€æªã€‚	çš†æœªçŸ¥æ‰€æªã€‚	They all did not know what to do.
['ZH_T49_2039_003:0993c25_9']	å…§è‡£é‡‘æ‰¿è€å¥æ›°ã€‚	å…§è‡£é‡‘æ‰¿è€å¥æ›°ã€‚	The palace official Jin Seung-no reported:
['ZH_T49_2039_003:0993c25_16']	å£¬è¾°å¹´ç§»å¾¡æ™‚ã€‚	å£¬è¾°å¹´ç§»å¾¡æ™‚ã€‚	During the move of the imperial residence in the renshen year.
['ZH_T49_2039_003:0993c26_5']	ç´«é–€æ—¥è¨˜æ¨çœ‹å¾ä¹‹ã€‚	ç´«é–€æ—¥è¨˜æ¨çœ‹å¾ä¹‹ã€‚	The Purple Gate Diary recorded it and followed it.
['ZH_T49_2039_003:0993c26_8']	è¨˜äº‘ã€‚	è¨˜äº‘ã€‚	The record says:
['ZH_T49_2039_003:0993c27_4']	å…¥å…§ä¾å¤§åºœå¿æç™½å…¨å—ä½›ç‰™å‡½äº‘ã€‚	å…¥å…§ä¾å¤§åºœå¿æç™½å…¨å—ä½›ç‰™å‡½äº‘ã€‚	Li Baek-jeon, the Director of the Great Inner Palace, received the Buddha's tooth relic container.
['ZH_T49_2039_003:0993c27_9']	å¬æè©°ä¹‹ã€‚	å¬æè©°ä¹‹ã€‚	He summoned Li and questioned him.
['ZH_T49_2039_003:0993c27_12']	å°æ›°ã€‚	å°æ›°ã€‚	He replied:
['ZH_T49_2039_003:0993c27_20']	è«‹æ­¸å®¶æ›´å°‹ç§è¨˜ã€‚	è«‹æ­¸å®¶æ›´å°‹ç§è¨˜ã€‚	Please return home to search for the private record again.
['ZH_T49_2039_003:0993c28_4']	åˆ°å®¶æ’¿çœ‹ã€‚	åˆ°å®¶æ’¿çœ‹ã€‚	When he got home and checked it,
['ZH_T49_2039_003:0993c29_3']	å¾—å·¦ç•ªè¬è€…é‡‘ç‘é¾ä½›ç‰™å‡½å‡†å—è¨˜ä¾†å‘ˆã€‚	å¾—å·¦ç•ªè¬è€…é‡‘ç‘é¾ä½›ç‰™å‡½å‡†å—è¨˜ä¾†å‘ˆã€‚	he found the record of receiving the Buddha's tooth relic container from the left official Jin Seuryong.
['ZH_T49_2039_003:0993c29_8']	å¬å•ç‘é¾ã€‚	å¬å•ç‘é¾ã€‚	He summoned and questioned Seuryong.
['ZH_T49_2039_003:0993c29_13']	ç„¡è¾­ä»¥å°ã€‚	ç„¡è¾­ä»¥å°ã€‚	He had no words to respond.
['ZH_T49_2039_003:0994a01_4']	åˆä»¥é‡‘æ‰¿è€æ‰€å¥äº‘å£¬è¾°ã€‚	åˆä»¥é‡‘æ‰¿è€æ‰€å¥äº‘å£¬è¾°ã€‚	Moreover, what Jin Seung-no reported said it was in the renshen year.
['ZH_T49_2039_003:0994a01_12']	è‡³ä»Šä¸™ç”³äº”å¹´é–“ã€‚	è‡³ä»Šä¸™ç”³äº”å¹´é–“ã€‚	From then until the bingchen year, it has been five years.
['ZH_T49_2039_003:0994a02_7']	å¾¡ä½›å ‚åŠæ™¯éˆæ®¿ä¸Šå®ˆç­‰å›šç¦å•ã€‚	å¾¡ä½›å ‚åŠæ™¯éˆæ®¿ä¸Šå®ˆç­‰å›šç¦å•ã€‚	The emperor imprisoned the guards of the Buddha Hall and Jingling Hall and questioned them.
['ZH_T49_2039_003:0994a02_13']	ç•¶ä¾é•æœªæ±ºã€‚	ç•¶ä¾é•æœªæ±ºã€‚	He had not yet decided whether to follow or disobey.
['ZH_T49_2039_003:0994a02_17']	éš”ä¸‰æ—¥ã€‚	éš”ä¸‰æ—¥ã€‚	After three days,
['ZH_T49_2039_003:0994a03_11']	å¤œä¸­ç‘é¾å®¶åœ’ç‰†è£æœ‰æŠ•æ“²ç‰©è²ã€‚	å¤œä¸­ç‘é¾å®¶åœ’ç‰†è£æœ‰æŠ•æ“²ç‰©è²ã€‚	in the middle of the night, there was a sound of something thrown over the wall of the Rui Long family's garden.
['ZH_T49_2039_003:0994a03_16']	ä»¥ç«æ’¿çœ‹ã€‚	ä»¥ç«æ’¿çœ‹ã€‚	They checked with fire.
['ZH_T49_2039_003:0994a04_3']	ä¹ƒä½›ç‰™å‡½ä¹Ÿã€‚	ä¹ƒä½›ç‰™å‡½ä¹Ÿã€‚	It was the Buddha's tooth relic box.
['ZH_T49_2039_003:0994a04_12']	å‡½æœ¬å…§ä¸€é‡æ²ˆé¦™åˆã€‚	å‡½æœ¬å…§ä¸€é‡æ²ˆé¦™åˆã€‚	The box originally had a layer of agarwood inside,
['ZH_T49_2039_003:0994a04_18', 'ZH_T49_2039_003:0994a05_5', 'ZH_T49_2039_003:0994a05_12']	æ¬¡é‡ç´”é‡‘åˆã€‚ğŸ”½æ¬¡å¤–é‡ç™½éŠ€å‡½ã€‚ğŸ”½æ¬¡å¤–é‡ç‘ ç’ƒå‡½ã€‚	æ¬¡é‡ç´”é‡‘åˆã€‚ æ¬¡å¤–é‡ç™½éŠ€å‡½ã€‚ æ¬¡å¤–é‡ç‘ ç’ƒå‡½ã€‚	next a pure gold box,ğŸ”½next an outer silver box,ğŸ”½next a lapis lazuli box,
['ZH_T49_2039_003:0994a05_19']	æ¬¡å¤–é‡èºéˆ¿å‡½ã€‚	æ¬¡å¤–é‡èºéˆ¿å‡½ã€‚	next a mother-of-pearl box,
['ZH_T49_2039_003:0994a06_5']	å„å¹…å­å¦‚ä¹‹ã€‚	å„å¹…å­å¦‚ä¹‹ã€‚	each with a cover as such.
['ZH_T49_2039_003:0994a06_12']	ä»Šä½†ç‘ ç’ƒå‡½çˆ¾ã€‚	ä»Šä½†ç‘ ç’ƒå‡½çˆ¾ã€‚	Now there is only the lapis lazuli box.
['ZH_T49_2039_003:0994a07_1']	å–œå¾—ä¹‹å…¥é”äºå…§ã€‚	å–œå¾—ä¹‹å…¥é”äºå…§ã€‚	Rejoicing, he obtained it and presented it to the emperor.
['ZH_T49_2039_003:0994a07_5']	æœ‰å¸è­°ã€‚	æœ‰å¸è­°ã€‚	The authorities discussed it.
['ZH_T49_2039_003:0994a07_16']	é‡‘ç‘é¾åŠå…©æ®¿ä¸Šå®ˆçš†èª…ã€‚	é‡‘ç‘é¾åŠå…©æ®¿ä¸Šå®ˆçš†èª…ã€‚	Jin Rui Long and the guards of the two halls were all executed.
['ZH_T49_2039_003:0994a08_2']	æ™‰é™½åºœå¥äº‘ã€‚	æ™‰é™½åºœå¥äº‘ã€‚	The Jin Yang Prefecture reported, saying:
['ZH_T49_2039_003:0994a08_11']	å› ä½›äº‹ä¸åˆå¤šå‚·äººã€‚	å› ä½›äº‹ä¸åˆå¤šå‚·äººã€‚	Because of the Buddha's affairs, many people should not be harmed.
['ZH_T49_2039_003:0994a08_15']	çš†å…ä¹‹ã€‚	çš†å…ä¹‹ã€‚	They were all pardoned.
['ZH_T49_2039_003:0994a09_10']	æ›´å‹…åå“¡æ®¿ä¸­åº­ç‰¹é€ ä½›ç‰™æ®¿å®‰ä¹‹ã€‚	æ›´å‹…åå“¡æ®¿ä¸­åº­ç‰¹é€ ä½›ç‰™æ®¿å®‰ä¹‹ã€‚	The emperor further ordered that a special Buddha's tooth relic hall be built in the courtyard of the ten-member hall to house it.
['ZH_T49_2039_003:0994a09_16']	ä»¤å°‡å£«å®ˆä¹‹ã€‚	ä»¤å°‡å£«å®ˆä¹‹ã€‚	He ordered the soldiers to guard it.
['ZH_T49_2039_003:0994a10_1']	æ“‡å‰æ—¥ã€‚	æ“‡å‰æ—¥ã€‚	On an auspicious day,
['ZH_T49_2039_003:0994a10_10']	è«‹ç¥å­å¯ºä¸Šæˆ¿è–€å…‰ã€‚	è«‹ç¥å­å¯ºä¸Šæˆ¿è–€å…‰ã€‚	he invited the upper room of Shen Xiao Temple to
['ZH_T49_2039_003:0994a10_16']	é ˜å¾’ä¸‰åäººã€‚	é ˜å¾’ä¸‰åäººã€‚	Leading thirty disciples.
['ZH_T49_2039_003:0994a11_3']	å…¥å…§è¨­é½‹æ•¬ä¹‹ã€‚	å…¥å…§è¨­é½‹æ•¬ä¹‹ã€‚	Entered the palace to set up a vegetarian feast and respectfully honored him.
['ZH_T49_2039_003:0994a12_12']	å…¶æ—¥å…¥ç›´æ‰¿å®£å´”å¼˜ä¸Šå°‡è»å´”å…¬è¡æä»¤é•·å…§ä¾èŒ¶æˆ¿ç­‰ä¾ç«‹äºæ®¿åº­ã€‚	å…¶æ—¥å…¥ç›´æ‰¿å®£å´”å¼˜ä¸Šå°‡è»å´”å…¬è¡æä»¤é•·å…§ä¾èŒ¶æˆ¿ç­‰ä¾ç«‹äºæ®¿åº­ã€‚	On that day, the palace attendant Cui Hong, the general Cui Gongyan, Li Lingchang, the palace attendant tea server, and others stood in the palace courtyard.
['ZH_T49_2039_003:0994a13_1']	ä¾æ¬¡é ‚æˆ´æ•¬ä¹‹ã€‚	ä¾æ¬¡é ‚æˆ´æ•¬ä¹‹ã€‚	Following the order, they respectfully bowed to him.
['ZH_T49_2039_003:0994a13_7']	ä½›ç‰™å€ç©´é–“ã€‚	ä½›ç‰™å€ç©´é–“ã€‚	In the gap between the Buddha's teeth.
