segmentnr	original	analyzed	translated
['ZH_T29_1561_001:0325a08_0']	ä¿±èˆè«–å¯¦ç¾©ç–å·ç¬¬ä¸€æƒ£äºŒè¬å…«åƒåˆ	ä¿±èˆè«–å¯¦ç¾©ç–å·ç¬¬ä¸€æƒ£äºŒè¬å…«åƒåˆ	Commentary on the True Meaning of the AbhidharmakoÅ›a, Volume 1, totaling 28,000 verses
['ZH_T29_1561_001:0325a10_0']	å°Šè€…æ‚‰åœ°ç¾…æœ«åº•é€ å”è¨€å®‰æƒ 	å°Šè€…æ‚‰åœ°ç¾…æœ«åº•é€ å”è¨€å®‰æƒ 	Composed by Venerable ÅšrÄ«lÄtamati, Tang Dynasty, meaning Anhui
['ZH_T29_1561_001:0325a11_0']	ç¨½é¦–è–„ä¼½çœ¾å¾·å±±ï¼Œã€€ã€€ç¨½é¦–é”ç£¨å¤§æ™ºæµ·ï¼Œ	ç¨½é¦–è–„ä¼½çœ¾å¾·å±±ï¼Œã€€ã€€ç¨½é¦–é”ç£¨å¤§æ™ºæµ·ï¼Œ	I bow my head to the mountain of many virtues of the BhagavÄn, I bow my head to the great ocean of wisdom of the Dharma,
['ZH_T29_1561_001:0325a12_17']	ç¨½é¦–åƒ§ä¼½å’Œåˆçœ¾ï¼Œã€€ã€€æ£æ–¯è«–ä¸»åŠå¾å¸«ã€‚	ç¨½é¦–åƒ§ä¼½å’Œåˆçœ¾ï¼Œã€€ã€€æ£æ–¯è«–ä¸»åŠå¾å¸«ã€‚	I bow my head to the harmonious assembly of the Saá¹…gha, to the author of the treatise and my teacher.
['ZH_T29_1561_001:0325a13_0']	æˆ‘å°‡è¢è€€åŠ©é™½å…‰ï¼Œã€€ã€€éš¨åŠ›å¼˜å®£å°æ³•è—ï¼Œ	æˆ‘å°‡è¢è€€åŠ©é™½å…‰ï¼Œã€€ã€€éš¨åŠ›å¼˜å®£å°æ³•è—ï¼Œ	I will use the light of a firefly to assist the sun's radiance, and with my abilities widely proclaim the Abhidharma-piá¹­aka,
['ZH_T29_1561_001:0325a14_17']	ç‚ºåˆ©ç¾¤ç”Ÿæ³•ä¹…ä½ï¼Œã€€ã€€é¡˜ä»¥å¨ç¥è¦‹è­·æŒã€‚	ç‚ºåˆ©ç¾¤ç”Ÿæ³•ä¹…ä½ï¼Œã€€ã€€é¡˜ä»¥å¨ç¥è¦‹è­·æŒã€‚	For the benefit of all beings and the long-lasting of the Dharma, I wish to be protected and upheld by your majestic spiritual powers.
['ZH_T29_1561_001:0325a17_3']	1 åˆ†åˆ¥ç•Œå“1åˆ†åˆ¥ç•Œå“ç¬¬ä¸€ä¸ƒç¾©ï¼Œè¬‚æ™ºåœ“æ»¿ã€æ–·åœ“æ»¿ã€åˆ©ä»–åœ“æ»¿ã€æ–¹ä¾¿åœ“æ»¿ã€æ‡‰ä¾›åœ“æ»¿ã€æœŸå¿ƒåœ“æ»¿ã€æ–¹ä¾¿åœ“æ»¿ã€‚	1 åˆ†åˆ¥ç•Œå“1åˆ†åˆ¥ç•Œå“ç¬¬ä¸€ä¸ƒç¾©ï¼Œè¬‚æ™ºåœ“æ»¿ã€æ–·åœ“æ»¿ã€åˆ©ä»–åœ“æ»¿ã€æ–¹ä¾¿åœ“æ»¿ã€æ‡‰ä¾›åœ“æ»¿ã€æœŸå¿ƒåœ“æ»¿ã€æ–¹ä¾¿åœ“æ»¿ã€‚	, namely, the perfection of wisdom, the perfection of abandonment, the perfection of benefiting others, the perfection of skillful means, the perfection of being worthy of offerings, the perfection of aspiring mind, and the perfection of skillful means.
['ZH_T29_1561_001:0325a19_18']	ç”±æ•¬æ³•æ•…å¸¸æ¨‚è½èï¼Œç”±è½èæ•…ç™¼ç”Ÿèæƒ ï¼Œç”±èæƒ æ•…ç™¼â–¡æ€æƒ æ•…ï¼Œç™¼èµ·ä¿®æƒ æ•…ç”Ÿç„¡æ¼æƒ ã€‚	ç”±æ•¬æ³•æ•…å¸¸æ¨‚è½èï¼Œç”±è½èæ•…ç™¼ç”Ÿèæƒ ï¼Œç”±èæƒ æ•…ç™¼â–¡æ€æƒ æ•…ï¼Œç™¼èµ·ä¿®æƒ æ•…ç”Ÿç„¡æ¼æƒ ã€‚	Because of respecting the Dharma, one always delights in listening to it. Because of listening, one gives rise to the wisdom of hearing. Because of the wisdom of hearing, one gives rise to the wisdom of contemplation. Because of the wisdom of contemplation, one gives rise to the wisdom of cultivation. Because of this, one gives rise to the wisdom free from outflows.
['ZH_T29_1561_001:0325a20_17']	ç”±ç„¡æ¼æƒ èƒ½æ–·è«¸æƒ‘ï¼Œç‚ºè«¸æƒ‘æ–·æ•…å³è­‰ğ¢Œ½ã€‚	ç”±ç„¡æ¼æƒ èƒ½æ–·è«¸æƒ‘ï¼Œç‚ºè«¸æƒ‘æ–·æ•…å³è­‰ğ¢Œ½ã€‚	Because of the wisdom free from outflows, one is able to sever all afflictions. Because of severing the afflictions, one then realizes nirvÄá¹‡a.
['ZH_T29_1561_001:0325a21_6']	æ•…åæ‰€ç‚ºä¹‹åˆ©ç›Šã€‚	æ•…åæ‰€ç‚ºä¹‹åˆ©ç›Šã€‚	Therefore, it is called the benefit of what is to be done.
['ZH_T29_1561_001:0325a22_16']	ä¸ƒç¾©è€…ï¼Œé Œè¨€ä¸€åˆ‡ç¨®å†¥æ»…ï¼Œæ˜¯çŸ¥åœ“æ»¿ã€‚	ä¸ƒç¾©è€…ï¼Œé Œè¨€ä¸€åˆ‡ç¨®å†¥æ»…ï¼Œæ˜¯çŸ¥åœ“æ»¿ã€‚	As for the seven meanings, the verse says: The extinction of all kinds of darkness is the perfection of knowledge.
['ZH_T29_1561_001:0325a23_3']	è«¸æ»…æ˜¯æ–·åœ“æ»¿ã€‚	è«¸æ»…æ˜¯æ–·åœ“æ»¿ã€‚	All extinctions are the perfection of elimination.
['ZH_T29_1561_001:0325a23_17']	æ‹”çœ¾ç”Ÿå‡ºç”Ÿæ­»æ³¥è€…ï¼Œåˆ©ä»–åœ“æ»¿ã€‚	æ‹”çœ¾ç”Ÿå‡ºç”Ÿæ­»æ³¥è€…ï¼Œåˆ©ä»–åœ“æ»¿ã€‚	Pulling sentient beings out of the mud of birth and death is the perfection of benefiting others.
['ZH_T29_1561_001:0325a24_8']	æ•¬ç¦®å¦‚æ˜¯è€…ï¼Œæ‡‰ä¾›åœ“æ»¿ã€‚	æ•¬ç¦®å¦‚æ˜¯è€…ï¼Œæ‡‰ä¾›åœ“æ»¿ã€‚	Respectfully paying homage to such a one is the perfection of being worthy of offerings.
['ZH_T29_1561_001:0325a24_18']	å¦‚ç†å¸«è€…ï¼Œæ–¹ä¾¿åœ“æ»¿ã€‚	å¦‚ç†å¸«è€…ï¼Œæ–¹ä¾¿åœ“æ»¿ã€‚	The teacher of suchness is the perfection of skillful means.
['ZH_T29_1561_001:0325a25_15']	ç”±ä½›ä¸–å°Šæœ‰å‹æ–¹ä¾¿ï¼Œèªªå¦‚ç†æ•™åˆ©æœ‰æƒ…æ•…ã€‚	ç”±ä½›ä¸–å°Šæœ‰å‹æ–¹ä¾¿ï¼Œèªªå¦‚ç†æ•™åˆ©æœ‰æƒ…æ•…ã€‚	Because the World-Honored Buddha has supreme skillful means, he expounds the teachings of suchness to benefit sentient beings.
['ZH_T29_1561_001:0325a26_13']	è«–æˆ‘è€…ç•¶èªªè€…ï¼ŒæœŸå¿ƒåœ“æ»¿ï¼Œæ¬²é€ è«–æ•…ã€‚	è«–æˆ‘è€…ç•¶èªªè€…ï¼ŒæœŸå¿ƒåœ“æ»¿ï¼Œæ¬²é€ è«–æ•…ã€‚	The author of this treatise will explain is the perfection of aspiration, because he wishes to compose the treatise.
['ZH_T29_1561_001:0325a27_7']	å°æ³•è—è€…ï¼Œç«‹ååœ“æ»¿ï¼Œæƒ£æ”ä¸ƒç¾©ã€‚	å°æ³•è—è€…ï¼Œç«‹ååœ“æ»¿ï¼Œæƒ£æ”ä¸ƒç¾©ã€‚	The Abhidharma-piá¹­aka is the perfection of establishing the name, which comprehensively includes the seven meanings.
['ZH_T29_1561_001:0325a27_10']	é Œæ›°ï¼š	é Œæ›°ï¼š	The verse says:
['ZH_T29_1561_001:0325a28_0']	æ™ºæ–·åŠåˆ©ä»–ï¼Œã€€ã€€æ–¹ä¾¿æœŸé€ è«–ï¼Œ	æ™ºæ–·åŠåˆ©ä»–ï¼Œã€€ã€€æ–¹ä¾¿æœŸé€ è«–ï¼Œ	Wisdom, elimination, benefiting others, skillful means, aspiration to compose the treatise,
['ZH_T29_1561_001:0325a29_13']	ç«‹åå°æ³•è—ï¼Œã€€ã€€æƒ£ä¸ƒç¾©æ‡‰çŸ¥ã€‚	ç«‹åå°æ³•è—ï¼Œã€€ã€€æƒ£ä¸ƒç¾©æ‡‰çŸ¥ã€‚	Establishing the name as the Abhidharma-piá¹­aka, one should know the seven meanings in total.
['ZH_T29_1561_001:0325b03_4']	è‰²æ³•ã€å¿ƒæ³•ã€å¿ƒæ‰€æœ‰æ³•ã€ä¸ç›¸æ‡‰æ³•åŠç„¡ç‚ºæ³•ï¼Œæ–¼æ­¤äº”æ³•æ‰€çŸ¥å¢ƒä¸­ï¼Œä¸–çš†ä¸äº†ï¼Œå”¯ä½›ç¨æ‚Ÿï¼Œæ°¸æ–·è«¸æƒ‘æ•…ã€‚	è‰²æ³•ã€å¿ƒæ³•ã€å¿ƒæ‰€æœ‰æ³•ã€ä¸ç›¸æ‡‰æ³•åŠç„¡ç‚ºæ³•ï¼Œæ–¼æ­¤äº”æ³•æ‰€çŸ¥å¢ƒä¸­ï¼Œä¸–çš†ä¸äº†ï¼Œå”¯ä½›ç¨æ‚Ÿï¼Œæ°¸æ–·è«¸æƒ‘æ•…ã€‚	Form dharmas, mind dharmas, mental factors, dharmas not concomitant with the mind, and unconditioned dharmas - in the knowable realm of these five dharmas, the world is all unaware, only the Buddha alone realizes it, because he has permanently severed all delusions.
['ZH_T29_1561_001:0325b04_10']	æ¥µé æ™‚è€…ï¼Œè¬‚éå»æœªä¾†ä¸‰é˜¿åƒ§ç¥‡åŠ«å¤–ï¼Œè²èç¨è¦ºä¸èƒ½çŸ¥ã€‚	æ¥µé æ™‚è€…ï¼Œè¬‚éå»æœªä¾†ä¸‰é˜¿åƒ§ç¥‡åŠ«å¤–ï¼Œè²èç¨è¦ºä¸èƒ½çŸ¥ã€‚	As for the most distant time, it refers to what is beyond the three asaá¹ƒkhyeya kalpas in the past and future, which Å›rÄvakas and pratyekabuddhas are unable to know.
['ZH_T29_1561_001:0325b04_15']	ä½•ä»¥å¾—çŸ¥ï¼Ÿ	ä½•ä»¥å¾—çŸ¥ï¼Ÿ	How do we know this?
['ZH_T29_1561_001:0325b06_13']	å¦‚æ˜”æœ‰ä¸€äººæ–¼èˆåˆ©å­é‚Šæ±‚å‡ºå®¶ï¼Œæ™‚èˆåˆ©å­è§€äºŒé˜¿åƒ§ç¥‡åŠ«æ­¤äººç„¡å‡ºå®¶å–„æ ¹ï¼Œé‚ä¸è¨±ã€‚	å¦‚æ˜”æœ‰ä¸€äººæ–¼èˆåˆ©å­é‚Šæ±‚å‡ºå®¶ï¼Œæ™‚èˆåˆ©å­è§€äºŒé˜¿åƒ§ç¥‡åŠ«æ­¤äººç„¡å‡ºå®¶å–„æ ¹ï¼Œé‚ä¸è¨±ã€‚	In the past, there was a person who sought to go forth in the presence of ÅšÄriputra. At that time, ÅšÄriputra observed that this person had no wholesome roots for going forth for two asaá¹ƒkhyeya kalpas, so he did not allow it.
['ZH_T29_1561_001:0325b08_4']	æ­¤äººè©£ä½›ä»¥æ±‚å‡ºå®¶ï¼Œä¸–å°Šè§€ä¹‹ï¼Œå‡ºåƒ§ç¥‡å¤–æ­¤äººæœ‰å°‘å–„æ ¹ï¼Œé‚è¨±å‡ºå®¶ã€‚	æ­¤äººè©£ä½›ä»¥æ±‚å‡ºå®¶ï¼Œä¸–å°Šè§€ä¹‹ï¼Œå‡ºåƒ§ç¥‡å¤–æ­¤äººæœ‰å°‘å–„æ ¹ï¼Œé‚è¨±å‡ºå®¶ã€‚	This person went to the Buddha and sought to go forth. The World-Honored One observed that beyond one asaá¹ƒkhyeya kalpa, this person had a little wholesome root, so he allowed him to go forth.
['ZH_T29_1561_001:0325b08_8']	èªªåˆè¨€ï¼š	èªªåˆè¨€ï¼š	He spoke a verse, saying:
['ZH_T29_1561_001:0325b09_0']	å½¼äººè§£è„«ç¨®ï¼Œã€€ã€€æˆ‘è§€æ¥µå¾®ç´°ï¼Œ	å½¼äººè§£è„«ç¨®ï¼Œã€€ã€€æˆ‘è§€æ¥µå¾®ç´°ï¼Œ	I observe that the seeds of liberation of this person are extremely subtle,
['ZH_T29_1561_001:0325b10_13']	çŒ¶å¦‚è«¸ç¤¦ä¸­ï¼Œã€€ã€€çœŸé‡‘éš±èŒ²ä½ã€‚	çŒ¶å¦‚è«¸ç¤¦ä¸­ï¼Œã€€ã€€çœŸé‡‘éš±èŒ²ä½ã€‚	Like true gold hidden in ore.
['ZH_T29_1561_001:0325b11_10']	ç›®é€£è§€å…¶æ¯ï¼Œä¸çŸ¥ç”Ÿè™•ã€‚	ç›®é€£è§€å…¶æ¯ï¼Œä¸çŸ¥ç”Ÿè™•ã€‚	MaudgalyÄyana observed his mother but did not know where she had been reborn.
['ZH_T29_1561_001:0325b11_14']	å¾€å•ä½›ã€‚	å¾€å•ä½›ã€‚	He went to ask the Buddha.
['ZH_T29_1561_001:0325b11_17']	ä½›å‘Šï¼š	ä½›å‘Šï¼š	The Buddha said:
['ZH_T29_1561_001:0325b12_10']	æ±æ¯ç”Ÿåœ¨æ‘©åˆ©æ”¯ä¸–ç•Œä¸‰åƒç•Œå¤–ã€‚	æ±æ¯ç”Ÿåœ¨æ‘©åˆ©æ”¯ä¸–ç•Œä¸‰åƒç•Œå¤–ã€‚	Your mother was born in the Maricika world, outside of the three thousand worlds.
['ZH_T29_1561_001:0325b13_8']	å¦‚æ˜¯å¤šç¨®åˆ†åˆ¥ä¸­ï¼Œè²èç­‰æ™ºçš†ä¸äº†é”ã€‚	å¦‚æ˜¯å¤šç¨®åˆ†åˆ¥ä¸­ï¼Œè²èç­‰æ™ºçš†ä¸äº†é”ã€‚	Among these many kinds of distinctions, the wisdom of the Sravakas and others cannot fully comprehend.
['ZH_T29_1561_001:0325b15_12']	ä¿®ç¦åŠæ™ºæ‰€å¾—æœï¼Œçš†ç‚ºåˆ©ä»–éè‡ªåˆ©ï¼ŒçŒ¶æœˆå…‰æ·¨ç…§åæ–¹ï¼Œä¸–å°Šæ‚²é¡˜äº¦å¦‚æ˜¯ã€‚	ä¿®ç¦åŠæ™ºæ‰€å¾—æœï¼Œçš†ç‚ºåˆ©ä»–éè‡ªåˆ©ï¼ŒçŒ¶æœˆå…‰æ·¨ç…§åæ–¹ï¼Œä¸–å°Šæ‚²é¡˜äº¦å¦‚æ˜¯ã€‚	The fruits obtained from cultivating blessings and wisdom are all for benefiting others, not for one's own benefit. It is like the bright moon illuminating the ten directions. The compassionate vows of the World-Honored One are also like this.
['ZH_T29_1561_001:0325b15_16']	åˆé Œäº‘ï¼š	åˆé Œäº‘ï¼š	There is also a verse that says:
['ZH_T29_1561_001:0325b16_0']	è¿´æ–½ä¹‹ç¦åŠåˆ©å·±ï¼Œã€€ã€€è‡ªä¿®è¿´æ–½äºŒç¦å¾·ï¼Œ	è¿´æ–½ä¹‹ç¦åŠåˆ©å·±ï¼Œã€€ã€€è‡ªä¿®è¿´æ–½äºŒç¦å¾·ï¼Œ	The blessings of dedicating and benefiting oneself, and the two merits of cultivating and dedicating oneself,
['ZH_T29_1561_001:0325b17_7']	å¾©å› åˆ©æ¨‚è«¸æœ‰æƒ…ã€‚	å¾©å› åˆ©æ¨‚è«¸æœ‰æƒ…ã€‚	Again, because of benefiting and delighting all sentient beings.
['ZH_T29_1561_001:0325b18_0']	æœè­‰éä»–é‚è‡ªå¾—ï¼Œã€€ã€€è¡Œé¡˜ç¦åŠè¿´æ–½ç¦ï¼Œ	æœè­‰éä»–é‚è‡ªå¾—ï¼Œã€€ã€€è¡Œé¡˜ç¦åŠè¿´æ–½ç¦ï¼Œ	The fruits and evidence are not attained by others, but by oneself. The blessings of practice, vows, and dedication,
['ZH_T29_1561_001:0325b19_7']	è‡ªä»–ä¿±åˆ©ä¸å”æã€‚	è‡ªä»–ä¿±åˆ©ä¸å”æã€‚	Benefiting oneself and others, are not in vain.
['ZH_T29_1561_001:0325b20_16']	å¦‚æ˜¯é›–èªªè‡ªåˆ©å¾å› åŠæœï¼Œäº¦èƒ½åˆ©ä»–äººã€‚	å¦‚æ˜¯é›–èªªè‡ªåˆ©å¾å› åŠæœï¼Œäº¦èƒ½åˆ©ä»–äººã€‚	Although it is said that benefiting oneself comes from causes and effects, it can also benefit others.
['ZH_T29_1561_001:0325b21_1']	æœ‰é Œè¨€ï¼š	æœ‰é Œè¨€ï¼š	There is a verse that says:
['ZH_T29_1561_001:0325b22_0']	ä¹³æ¯ç”˜é¥ç”¨è³‡èº«ï¼Œã€€ã€€ç‚ºå­ç²å®‰éç‚ºå·±ï¼Œ	ä¹³æ¯ç”˜é¥ç”¨è³‡èº«ï¼Œã€€ã€€ç‚ºå­ç²å®‰éç‚ºå·±ï¼Œ	Wet nurses and delicious food are used to nourish the body, for the child's comfort, not for oneself.
['ZH_T29_1561_001:0325b23_17']	ä½›ä¿®ç¦æ™ºè¶£è©æï¼Œã€€ã€€æœ¬ç‚ºåˆ©ç”Ÿéç‚ºè‡ªã€‚	ä½›ä¿®ç¦æ™ºè¶£è©æï¼Œã€€ã€€æœ¬ç‚ºåˆ©ç”Ÿéç‚ºè‡ªã€‚	The Buddha cultivates blessings and wisdom to reach enlightenment, originally for benefiting beings, not for himself.
['ZH_T29_1561_001:0325b24_2']	é Œäº‘ï¼š	é Œäº‘ï¼š	There is a verse that says:
['ZH_T29_1561_001:0325b25_0']	æ™‚é›¨é›–æ™®é™ï¼Œã€€ã€€ç„¡ç¨®èŠ½ä¸ç”Ÿï¼Œ	æ™‚é›¨é›–æ™®é™ï¼Œã€€ã€€ç„¡ç¨®èŠ½ä¸ç”Ÿï¼Œ	without seeds, sprouts do not grow.ğŸ”½Although the Buddha transforms the world,
['ZH_T29_1561_001:0325b26_13']	ä½›é›–åŒ–ä¸–é–“ï¼Œã€€ã€€ç·£é—•ä¸å¾—æœã€‚	ä½›é›–åŒ–ä¸–é–“ï¼Œã€€ã€€ç·£é—•ä¸å¾—æœã€‚	without conditions, one cannot attain the fruit.
['ZH_T29_1561_001:0325b27_2']	åˆé Œï¼š	åˆé Œï¼š	Moreover, it is said:
['ZH_T29_1561_001:0325b28_5']	å–„çŸ¥è­˜è€…èª°ï¼Ÿ	å–„çŸ¥è­˜è€…èª°ï¼Ÿ	Who is a good and virtuous friend?
['ZH_T29_1561_001:0325b29_13']	ã€€ã€€è¬‚ä½›ä»¤ç”Ÿæ™ºï¼Œé›¢æ”¾é€¸æƒ¡è¡Œï¼Œã€€ã€€é•æ­¤å³æ¨é›¢ã€‚	ã€€ã€€è¬‚ä½›ä»¤ç”Ÿæ™ºï¼Œé›¢æ”¾é€¸æƒ¡è¡Œï¼Œã€€ã€€é•æ­¤å³æ¨é›¢ã€‚	It refers to the Buddha who gives rise to wisdom, avoids negligence and evil conduct, and departs from this.
['ZH_T29_1561_001:0325c03_5']	å°æ³•å®œå¦‚ç”Ÿå¾—æƒ ï¼Œèˆ‡èæƒ ç‚ºå› ï¼Œèæƒ èˆ‡æ€ç‚ºå› ï¼Œæ€æƒ èˆ‡ä¿®æƒ ç‚ºå› ï¼Œä¿®æƒ èˆ‡æ¼æƒ ç‚ºå› ï¼Œæ¼æƒ èˆ‡æ¶…æ§ƒç‚ºå› ã€‚	å°æ³•å®œå¦‚ç”Ÿå¾—æƒ ï¼Œèˆ‡èæƒ ç‚ºå› ï¼Œèæƒ èˆ‡æ€ç‚ºå› ï¼Œæ€æƒ èˆ‡ä¿®æƒ ç‚ºå› ï¼Œä¿®æƒ èˆ‡æ¼æƒ ç‚ºå› ï¼Œæ¼æƒ èˆ‡æ¶…æ§ƒç‚ºå› ã€‚	In the Abhidharma, it is appropriate that the wisdom obtained through birth is the cause of the wisdom gained through hearing, the wisdom gained through hearing is the cause of the wisdom gained through contemplation, the wisdom gained through contemplation is the cause of the wisdom gained through cultivation, the wisdom gained through cultivation is the cause of the wisdom gained through the elimination of defilements, and the wisdom gained through the elimination of defilements is the cause of nirvana.
['ZH_T29_1561_001:0325c04_4']	ä»¥æ­¤ç¾©æ•…å¾—åå°æ³•ï¼Œä»¥èƒ½å¢é•·èç­‰æƒ æ•…ã€‚	ä»¥æ­¤ç¾©æ•…å¾—åå°æ³•ï¼Œä»¥èƒ½å¢é•·èç­‰æƒ æ•…ã€‚	For this reason, it is called Abhidharma, because it can increase the wisdom gained through hearing and so forth.
['ZH_T29_1561_001:0325c05_3']	æˆ–è«¸æœ‰ç‚ºæ‚‰çš†æ£„æ¨ï¼Œå”¯æ¨‚æ¶…æ§ƒæ•…åæ®Šå‹ã€‚	æˆ–è«¸æœ‰ç‚ºæ‚‰çš†æ£„æ¨ï¼Œå”¯æ¨‚æ¶…æ§ƒæ•…åæ®Šå‹ã€‚	Or, one abandons all conditioned things, and only delights in nirvana, therefore it is called supreme.
['ZH_T29_1561_001:0325c06_1']	è‹¦é›†é“è«¦ç‚ºæ¶…æ§ƒæƒ ï¼Œä½›æ•™ä¾æ³•ä¸ä¾äººã€‚	è‹¦é›†é“è«¦ç‚ºæ¶…æ§ƒæƒ ï¼Œä½›æ•™ä¾æ³•ä¸ä¾äººã€‚	The truths of suffering, origination, and path are the wisdom of nirvana. The Buddha's teachings rely on the Dharma, not on the person.
['ZH_T29_1561_001:0325c06_4']	é Œæ›°ï¼š	é Œæ›°ï¼š	A verse says:
['ZH_T29_1561_001:0325c07_0']	è‹¥é›¢æ“‡æ³•å®šç„¡é¤˜ï¼Œã€€ã€€èƒ½æ»…è«¸æƒ‘å‹æ–¹ä¾¿ï¼Œ	è‹¥é›¢æ“‡æ³•å®šç„¡é¤˜ï¼Œã€€ã€€èƒ½æ»…è«¸æƒ‘å‹æ–¹ä¾¿ï¼Œ	Apart from discerning dharmas, there is definitely no other superior means to eliminate afflictions,
['ZH_T29_1561_001:0325c08_17']	ç”±æƒ‘ä¸–é–“æ¼‚æœ‰æµ·ï¼Œã€€ã€€å› æ­¤å¾·ä½›èªªå°æ³•ã€‚	ç”±æƒ‘ä¸–é–“æ¼‚æœ‰æµ·ï¼Œã€€ã€€å› æ­¤å¾·ä½›èªªå°æ³•ã€‚	Because of afflictions, the world drifts in the ocean of existence, therefore, the Buddha taught Abhidharma out of this virtue.
['ZH_T29_1561_001:0325c09_2']	è«–æ›°ï¼š	è«–æ›°ï¼š	The treatise says:
['ZH_T29_1561_001:0325c09_15']	è‹¥é›¢æ“‡æ³•ç„¡å‹æ–¹ä¾¿èƒ½æ»…è«¸æƒ‘ã€‚	è‹¥é›¢æ“‡æ³•ç„¡å‹æ–¹ä¾¿èƒ½æ»…è«¸æƒ‘ã€‚	If one is apart from discerning dharmas, there is no superior method that can extinguish afflictions.
['ZH_T29_1561_001:0325c10_1']	ä½›å‘Šé˜¿é›£ï¼š	ä½›å‘Šé˜¿é›£ï¼š	The Buddha told Ä€nanda:
['ZH_T29_1561_001:0325c10_15']	æˆ‘åœ¨ä¾æ–¼æˆ‘ï¼Œæˆ‘æ»…åº¦ç„¡åˆ¥æ‰€ä¾ã€‚	æˆ‘åœ¨ä¾æ–¼æˆ‘ï¼Œæˆ‘æ»…åº¦ç„¡åˆ¥æ‰€ä¾ã€‚	I am the support, after my nirvÄá¹‡a there is no other support.
['ZH_T29_1561_001:0325c11_4']	æ‡‰ä¾æ–ç¶“ï¼Œå‹¿ä»¤å¿˜å¤±ã€‚	æ‡‰ä¾æ–ç¶“ï¼Œå‹¿ä»¤å¿˜å¤±ã€‚	You should rely on the staff sÅ«tra, do not forget it.
['ZH_T29_1561_001:0325c12_2']	ä½›äº‘ï¼š	ä½›äº‘ï¼š	The Buddha said:
['ZH_T29_1561_001:0325c12_16']	è€è€„å‡ºå®¶æŒå¾ä¸‰è—ï¼Œç”šç‚ºé›£å¾—ã€‚	è€è€„å‡ºå®¶æŒå¾ä¸‰è—ï¼Œç”šç‚ºé›£å¾—ã€‚	It is very difficult for an old monk who has gone forth to uphold my Tripiá¹­aka.
['ZH_T29_1561_001:0325c12_19']	ä¸‰è—ï¼š	ä¸‰è—ï¼š	The Tripiá¹­aka:
['ZH_T29_1561_001:0325c13_8']	ä¸€ç¶“ã€äºŒå¾‹ã€ä¸‰é›œè—ã€‚	ä¸€ç¶“ã€äºŒå¾‹ã€ä¸‰é›œè—ã€‚	First, the sÅ«tras; second, the vinaya; third, the miscellaneous canon.
['ZH_T29_1561_001:0325c16_4']	æ˜”è¿¦è‘‰ä½›æ™‚æœ‰ä¸€è‹¾èŠ»ï¼Œè°æ˜åšå­¸å…·é–‘ä¸‰è—ï¼Œç”ä»¥èªæ¥­æ¯€ç½µå‡ºå®¶åœ¨å®¶äººç­‰ç‚ºéµ„éµ‚é­šç‹—è«¸ç¦½ç¸ç­‰ã€‚	æ˜”è¿¦è‘‰ä½›æ™‚æœ‰ä¸€è‹¾èŠ»ï¼Œè°æ˜åšå­¸å…·é–‘ä¸‰è—ï¼Œç”ä»¥èªæ¥­æ¯€ç½µå‡ºå®¶åœ¨å®¶äººç­‰ç‚ºéµ„éµ‚é­šç‹—è«¸ç¦½ç¸ç­‰ã€‚	In the past, during the time of KÄÅ›yapa Buddha, there was a bhiká¹£u who was intelligent and learned, proficient in the Tripiá¹­aka. He once used verbal karma to insult those who had gone forth and lay people, calling them birds and beasts such as owls and dogs.
['ZH_T29_1561_001:0325c17_18']	å‘½çµ‚ä¹‹å¾Œï¼Œæ‰¿æ­¤æ¥­å ±ç”Ÿæ–¼æµ·ä¸­ï¼Œå—å¤§é­šèº«ï¼Œå…¶å½¢ç”šå¤§ï¼Œæœ‰åå…«é ­ï¼Œå…·å—çœ¾è‹¦ã€‚	å‘½çµ‚ä¹‹å¾Œï¼Œæ‰¿æ­¤æ¥­å ±ç”Ÿæ–¼æµ·ä¸­ï¼Œå—å¤§é­šèº«ï¼Œå…¶å½¢ç”šå¤§ï¼Œæœ‰åå…«é ­ï¼Œå…·å—çœ¾è‹¦ã€‚	After his life ended, he received this karmic retribution and was born in the ocean, receiving the body of a large fish. Its form was very large, with eighteen heads, and it experienced numerous sufferings.
['ZH_T29_1561_001:0325c18_6']	ä¸–å°Šå‡ºä¸–çŒ¶æœªå¾—è„«ã€‚	ä¸–å°Šå‡ºä¸–çŒ¶æœªå¾—è„«ã€‚	Even when the World-Honored One appeared in the world, it still had not escaped.
['ZH_T29_1561_001:0325c19_10']	å¾Œæœ‰æ¼äººï¼Œå…¶æ•¸ä¸€åƒï¼Œå›°æ•é­šæ¬¡ç¶²è‘—æ­¤é­šï¼Œæ›³ä¹‹ä¸å‡ºã€‚	å¾Œæœ‰æ¼äººï¼Œå…¶æ•¸ä¸€åƒï¼Œå›°æ•é­šæ¬¡ç¶²è‘—æ­¤é­šï¼Œæ›³ä¹‹ä¸å‡ºã€‚	Later, there were fishermen, numbering a thousand, who were exhausted from fishing. Their net caught this fish, but they could not pull it out.
['ZH_T29_1561_001:0325c20_10']	å¾Œæ•¸åƒäººåŒå…±æ›³å‡ºï¼Œè¦‹å…¶ç•°é¡å¤šé ­å½¢è²Œå¯æ€–ã€‚	å¾Œæ•¸åƒäººåŒå…±æ›³å‡ºï¼Œè¦‹å…¶ç•°é¡å¤šé ­å½¢è²Œå¯æ€–ã€‚	Later, thousands of people together pulled it out, and saw its strange appearance with many heads, terrifying to behold.
['ZH_T29_1561_001:0325c21_19']	ä¸–å°Šè§€è¦‹çŸ¥å…·å ±çµ‚ï¼Œé‚å°‡å¤§çœ¾è‡³å½¼æµ·å²¸æ•·åº§ï¼Œåå·²å‘¼å½¼é­šäº‘ï¼š	ä¸–å°Šè§€è¦‹çŸ¥å…·å ±çµ‚ï¼Œé‚å°‡å¤§çœ¾è‡³å½¼æµ·å²¸æ•·åº§ï¼Œåå·²å‘¼å½¼é­šäº‘ï¼š	The World-Honored One observed and knew that its karmic retribution was complete, and so he brought the great assembly to the seashore, spread out his seat, and sat down. Having done so, he called out to the fish, saying:
['ZH_T29_1561_001:0325c22_2']	ä¸‰è—ï¼	ä¸‰è—ï¼	Tripiá¹­aka master!
['ZH_T29_1561_001:0325c22_15']	æ±è±ˆä¸æ˜¯éå»ä½›æ™‚ä¸‰è—è‹¾èŠ»ï¼Ÿ	æ±è±ˆä¸æ˜¯éå»ä½›æ™‚ä¸‰è—è‹¾èŠ»ï¼Ÿ	Are you not the Tripiá¹­aka bhiká¹£u from the time of the past Buddha?
['ZH_T29_1561_001:0325c23_5']	å½¼é­šèå·²æ¶•æ·šç›ˆç›®ã€‚	å½¼é­šèå·²æ¶•æ·šç›ˆç›®ã€‚	Upon hearing this, the fish's eyes filled with tears.
['ZH_T29_1561_001:0325c24_13']	çˆ¾æ™‚ä¸–å°Šç‚ºèªªå®¿å› ï¼Œå…¶é­šç”Ÿæ‚”æ›´ä¸é£²å™‰ï¼Œå› èŒ²å‘½çµ‚ç”Ÿæ–¼å¤©ä¸Šã€‚	çˆ¾æ™‚ä¸–å°Šç‚ºèªªå®¿å› ï¼Œå…¶é­šç”Ÿæ‚”æ›´ä¸é£²å™‰ï¼Œå› èŒ²å‘½çµ‚ç”Ÿæ–¼å¤©ä¸Šã€‚	At that time, the World-Honored One spoke to him about his past causes and conditions. The fish gave rise to regret and no longer drank or ate, and thus ended his life and was reborn in the heavens.
