segmentnr	original	analyzed	translated
['ZH_T10_0294_003:0867b09_0']	ä½›èªªç¾…æ‘©ä¼½ç¶“å·ä¸‹	ä½›èªªç¾…æ‘©ä¼½ç¶“å·ä¸‹	The Buddha Speaks the RÄma Sutra, Fascicle 2
['ZH_T10_0294_003:0867b11_0']	è¥¿ç§¦æ²™é–€è–å …è­¯	è¥¿ç§¦æ²™é–€è–å …è­¯	Translated by Western Qin Monk Shengjian
['ZH_T10_0294_003:0867b12_0']	çˆ¾æ™‚å–„è²¡ç«¥å­ï¼Œä¸€å¿ƒæ€æƒŸå½¼å¤œå¤©æ•™ï¼Œåˆç™¼	çˆ¾æ™‚å–„è²¡ç«¥å­ï¼Œä¸€å¿ƒæ€æƒŸå½¼å¤œå¤©æ•™ï¼Œåˆç™¼	At that time, the youth Sudhana single-mindedly contemplated the teachings of the night goddess, the first
['ZH_T10_0294_003:0867b13_7']	é“å¿ƒï¼Œåœ“æ»¿æ¸…æ·¨ï¼›	é“å¿ƒï¼Œåœ“æ»¿æ¸…æ·¨ï¼›	arising of the mind of the Way, perfect and pure;
['ZH_T10_0294_003:0867b17_18']	æ€æƒŸæ˜¯å·²ï¼Œå³å¾—æ·±å…¥è«¸è©è–©è—å‡ºç”Ÿè©è–©å¤§é¡˜æ³•æµ·ï¼Œæ·¨è«¸è©è–©æ³¢ç¾…èœœé“ï¼Œçª®ç›¡è©è–©åœ“æ»¿å‹æ·¨è¡Œæ¥­ï¼Œç™¼èµ·æˆå°±æ·±å…¥æ™ºæµ·ï¼Œä»¥ä¸€åˆ‡æ™ºï¼Œæ•‘è­·åæ–¹ä¸€åˆ‡çœ¾ç”Ÿï¼Œé•·é¤Šå¢å»£å¤§æ…ˆæ‚²é›²ï¼Œæ–¼è«¸ä½›å‰ï¼Œå‡ºç”Ÿæ™®è³¢è«¸å¤§é¡˜è¡Œã€‚	æ€æƒŸæ˜¯å·²ï¼Œå³å¾—æ·±å…¥è«¸è©è–©è—å‡ºç”Ÿè©è–©å¤§é¡˜æ³•æµ·ï¼Œæ·¨è«¸è©è–©æ³¢ç¾…èœœé“ï¼Œçª®ç›¡è©è–©åœ“æ»¿å‹æ·¨è¡Œæ¥­ï¼Œç™¼èµ·æˆå°±æ·±å…¥æ™ºæµ·ï¼Œä»¥ä¸€åˆ‡æ™ºï¼Œæ•‘è­·åæ–¹ä¸€åˆ‡çœ¾ç”Ÿï¼Œé•·é¤Šå¢å»£å¤§æ…ˆæ‚²é›²ï¼Œæ–¼è«¸ä½›å‰ï¼Œå‡ºç”Ÿæ™®è³¢è«¸å¤§é¡˜è¡Œã€‚	Having contemplated this, he immediately attained profound entry into the bodhisattva treasury, giving rise to the Dharma ocean of the bodhisattva's great vows, purifying the bodhisattva path of the perfections, exhausting the bodhisattva's perfect and pure practice of superior deeds, giving rise to accomplishment and profound entry into the ocean of wisdom, with omniscience, saving and protecting all beings in the ten directions, nurturing and expanding the clouds of great compassion and kindness, giving rise to the practices of universal virtue in all buddha-lands.
['ZH_T10_0294_003:0867b20_4']	æ¼¸æ¼¸éŠè¡Œï¼Œè‡³æ™®ç”šæ·±å¾®å¦™åŠŸå¾·é›¢å¢å…‰æ˜å¤œå¤©æ‰€ï¼Œé ­é¢æ•¬ç¦®ï¼Œé¶ç„¡æ•¸åŒï¼Œå´ä½ä¸€é¢ï¼Œæ­æ•¬åˆæŒï¼Œç™½è¨€ï¼š	æ¼¸æ¼¸éŠè¡Œï¼Œè‡³æ™®ç”šæ·±å¾®å¦™åŠŸå¾·é›¢å¢å…‰æ˜å¤œå¤©æ‰€ï¼Œé ­é¢æ•¬ç¦®ï¼Œé¶ç„¡æ•¸åŒï¼Œå´ä½ä¸€é¢ï¼Œæ­æ•¬åˆæŒï¼Œç™½è¨€ï¼š	Gradually wandering, he arrived at the place of the night goddess Vast, Profound, Subtle, and Virtuous, Free from Defilement and Light, bowed his head in respect, circumambulated countless times, then stood to one side, respectfully put his palms together, and said:
['ZH_T10_0294_003:0867b20_8']	ã€Œå¤©ç¥ï¼	ã€Œå¤©ç¥ï¼	Celestial spirit!
['ZH_T10_0294_003:0867b21_17']	æˆ‘å·²å…ˆç™¼é˜¿è€¨å¤šç¾…ä¸‰è—ä¸‰è©æå¿ƒï¼Œè€ŒæœªçŸ¥äº‘ä½•ä¿®è©è–©è¡Œï¼Œå…·è¶³è«¸åœ°ï¼Ÿ	æˆ‘å·²å…ˆç™¼é˜¿è€¨å¤šç¾…ä¸‰è—ä¸‰è©æå¿ƒï¼Œè€ŒæœªçŸ¥äº‘ä½•ä¿®è©è–©è¡Œï¼Œå…·è¶³è«¸åœ°ï¼Ÿ	I have already given rise to the mind of supreme, perfect enlightenment, but I do not yet know how to cultivate the bodhisattva practices and perfect the stages.
['ZH_T10_0294_003:0867b21_21']	ã€ç­”è¨€ï¼š	ã€ç­”è¨€ï¼š	 He replied:
['ZH_T10_0294_003:0867b22_6']	ã€Œå–„å“‰ï¼Œå–„å“‰ï¼	ã€Œå–„å“‰ï¼Œå–„å“‰ï¼	Excellent, excellent!
['ZH_T10_0294_003:0867b22_9']	ç«¥å­ï¼	ç«¥å­ï¼	Young man!
['ZH_T10_0294_003:0867b23_12']	ä¹ƒèƒ½ç™¼é˜¿è€¨å¤šç¾…ä¸‰è—ä¸‰è©æå¿ƒï¼Œå•è©è–©è¡Œï¼Œå…·è¶³è«¸åœ°ã€‚	ä¹ƒèƒ½ç™¼é˜¿è€¨å¤šç¾…ä¸‰è—ä¸‰è©æå¿ƒï¼Œå•è©è–©è¡Œï¼Œå…·è¶³è«¸åœ°ã€‚	You are able to give rise to the mind of supreme, perfect enlightenment and ask about the bodhisattva practices and the perfection of the stages.
['ZH_T10_0294_003:0867b23_16']	å–„ç”·å­ï¼	å–„ç”·å­ï¼	Good man!
['ZH_T10_0294_003:0867b24_11']	è©è–©æˆå°±åæ³•ï¼Œå‰‡èƒ½å…·è¶³è©è–©æ‰€è¡Œã€‚	è©è–©æˆå°±åæ³•ï¼Œå‰‡èƒ½å…·è¶³è©è–©æ‰€è¡Œã€‚	If bodhisattvas accomplish ten dharmas, they will be able to perfect the practices of bodhisattvas.
['ZH_T10_0294_003:0867b24_16']	ä½•ç­‰ç‚ºåï¼Ÿ	ä½•ç­‰ç‚ºåï¼Ÿ	What are the ten?
['ZH_T10_0294_003:0867b25_18']	ä¸€è€…ã€æ‚‰å¾—è«¸ä½›ç¾å‰ä¸‰æ˜§ï¼Œè¦‹ä¸€åˆ‡ä½›è‰²èº«äº†äº†åˆ†æ˜ã€‚	ä¸€è€…ã€æ‚‰å¾—è«¸ä½›ç¾å‰ä¸‰æ˜§ï¼Œè¦‹ä¸€åˆ‡ä½›è‰²èº«äº†äº†åˆ†æ˜ã€‚	First, they attain the samÄdhi of all buddhas appearing before them, and clearly and distinctly see the physical bodies of all buddhas.
['ZH_T10_0294_003:0867b27_7']	äºŒè€…ã€å¾—æ·¨çœ¼ä¸‰æ˜§ï¼Œè¦‹ä¸€åˆ‡ä½›ä¸‰åäºŒç›¸ã€å…«åç¨®å¥½ï¼ŒèŠåš´å…¶èº«ã€‚	äºŒè€…ã€å¾—æ·¨çœ¼ä¸‰æ˜§ï¼Œè¦‹ä¸€åˆ‡ä½›ä¸‰åäºŒç›¸ã€å…«åç¨®å¥½ï¼ŒèŠåš´å…¶èº«ã€‚	Second, they attain the samÄdhi of pure eyes, and see the thirty-two marks and eighty minor marks that adorn the bodies of all buddhas.
['ZH_T10_0294_003:0867b28_12']	ä¸‰è€…ã€å¾—ç„¡é‡ç„¡é‚ŠåŠŸå¾·æ·¨çœ¼ï¼Œè¦‹ä¸€åˆ‡ä½›æ·±å¦™åŠŸå¾·æ™ºæ…§å¤§æµ·ã€‚	ä¸‰è€…ã€å¾—ç„¡é‡ç„¡é‚ŠåŠŸå¾·æ·¨çœ¼ï¼Œè¦‹ä¸€åˆ‡ä½›æ·±å¦™åŠŸå¾·æ™ºæ…§å¤§æµ·ã€‚	Third, they attain the pure eyes of immeasurable and boundless merit and virtue, and see the ocean of the profound and wondrous merit, virtue, wisdom, and knowledge of all buddhas.
['ZH_T10_0294_003:0867b29_15']	å››è€…ã€è¦‹ç„¡é‡ç„¡é‚Šä½›å…‰æ˜æµ·ï¼Œæ‚‰èƒ½æ™®ç…§ä¸€åˆ‡æ³•ç•Œã€‚	å››è€…ã€è¦‹ç„¡é‡ç„¡é‚Šä½›å…‰æ˜æµ·ï¼Œæ‚‰èƒ½æ™®ç…§ä¸€åˆ‡æ³•ç•Œã€‚	Fourth, seeing the ocean of immeasurable and boundless light of the buddhas, all able to universally illuminate all dharma realms.
['ZH_T10_0294_003:0867c06_1']	äº”è€…ã€ç„¡é‡ä¸å¯æ€è­°ä½›æ³•å…‰æ˜ï¼Œæ–¼ä¸€æ¯›å­”æ”¾å¤§å…‰æ˜ï¼Œæ™®ç…§ä¸€åˆ‡çœ¾ç”Ÿæ•¸ç­‰ï¼Œä»¤ç¨®ç¨®çœ¾ç”Ÿçš†ç™¼é˜¿è€¨å¤šç¾…ä¸‰è—ä¸‰è©æå¿ƒï¼Œæˆå…‰æ˜æµ·ï¼Œè«¸ä½›å¦‚ä¾†æ™®æ…ˆç­‰å¿ƒï¼Œæ–¼å¿µå¿µé ƒï¼Œåæ–¹ä¸–ç•Œæ–½ä½œä½›äº‹ï¼Œæ–¼è«¸çœ¾ç”Ÿï¼Œéš¨å…¶æ‰€æ‡‰è€Œåº¦è„«ä¹‹ï¼Œä»¤ç„¡é‡çœ¾ç”Ÿçš†å¾—è§£è„«ã€‚	äº”è€…ã€ç„¡é‡ä¸å¯æ€è­°ä½›æ³•å…‰æ˜ï¼Œæ–¼ä¸€æ¯›å­”æ”¾å¤§å…‰æ˜ï¼Œæ™®ç…§ä¸€åˆ‡çœ¾ç”Ÿæ•¸ç­‰ï¼Œä»¤ç¨®ç¨®çœ¾ç”Ÿçš†ç™¼é˜¿è€¨å¤šç¾…ä¸‰è—ä¸‰è©æå¿ƒï¼Œæˆå…‰æ˜æµ·ï¼Œè«¸ä½›å¦‚ä¾†æ™®æ…ˆç­‰å¿ƒï¼Œæ–¼å¿µå¿µé ƒï¼Œåæ–¹ä¸–ç•Œæ–½ä½œä½›äº‹ï¼Œæ–¼è«¸çœ¾ç”Ÿï¼Œéš¨å…¶æ‰€æ‡‰è€Œåº¦è„«ä¹‹ï¼Œä»¤ç„¡é‡çœ¾ç”Ÿçš†å¾—è§£è„«ã€‚	Fifth, the ocean of light of immeasurable and inconceivable buddha-dharmas, emitting a great light from a single pore, universally illuminating the number of all sentient beings, causing various sentient beings to all give rise to the mind of supreme, perfect enlightenment, forming an ocean of light. The buddhas and tathÄgatas universally have a mind of impartial kindness, in each moment of thought, performing buddha-works in the worlds of the ten directions, according to the capacities of sentient beings, liberating them, causing immeasurable sentient beings to all attain liberation.
['ZH_T10_0294_003:0867c07_4']	å…­è€…ã€æ–¼ä¸€ä¸€æ¯›å­”ä¸­ï¼Œæ‚‰è¦‹ä¸€åˆ‡å¯¶ç å…‰æ˜æ‘©å°¼ç‚æµ·ã€‚	å…­è€…ã€æ–¼ä¸€ä¸€æ¯›å­”ä¸­ï¼Œæ‚‰è¦‹ä¸€åˆ‡å¯¶ç å…‰æ˜æ‘©å°¼ç‚æµ·ã€‚	Sixth, within each and every pore, all seeing the ocean of flames of precious pearl light and maá¹‡i jewels.
['ZH_T10_0294_003:0867c09_5']	ä¸ƒè€…ã€æ–¼å¿µå¿µä¸­ï¼Œå‡ºä¸€åˆ‡è«¸ä½›è®ŠåŒ–å¤§æµ·ï¼Œå……æ»¿æ³•ç•Œï¼Œç©¶ç«Ÿä¸€åˆ‡è«¸ä½›å¢ƒç•Œï¼Œæ•™åŒ–çœ¾ç”Ÿè€Œç„¡éšœç¤™ã€‚	ä¸ƒè€…ã€æ–¼å¿µå¿µä¸­ï¼Œå‡ºä¸€åˆ‡è«¸ä½›è®ŠåŒ–å¤§æµ·ï¼Œå……æ»¿æ³•ç•Œï¼Œç©¶ç«Ÿä¸€åˆ‡è«¸ä½›å¢ƒç•Œï¼Œæ•™åŒ–çœ¾ç”Ÿè€Œç„¡éšœç¤™ã€‚	Seventh, in each moment of thought, emanating the great ocean of transformations of all buddhas, filling the dharma realm, ultimately reaching all buddha-realms, teaching and transforming sentient beings without obstruction.
['ZH_T10_0294_003:0867c11_15']	å…«è€…ã€å‡ºä¸€åˆ‡ä½›ç„¡ä½å¾®å¦™éŸ³è²å¤§æµ·ï¼Œè½‰ä¸‰ä¸–ä½›æ¸…æ·¨æ³•è¼ªï¼Œæ¼”èªªä¸€åˆ‡ä¿®å¤šç¾…æµ·åŠæ³•é›²æµ·ï¼Œå…¶ç¾©æ·±é ï¼Œç„¡èƒ½çª®ç›¡ã€‚	å…«è€…ã€å‡ºä¸€åˆ‡ä½›ç„¡ä½å¾®å¦™éŸ³è²å¤§æµ·ï¼Œè½‰ä¸‰ä¸–ä½›æ¸…æ·¨æ³•è¼ªï¼Œæ¼”èªªä¸€åˆ‡ä¿®å¤šç¾…æµ·åŠæ³•é›²æµ·ï¼Œå…¶ç¾©æ·±é ï¼Œç„¡èƒ½çª®ç›¡ã€‚	Eighth, emerging from the ocean of subtle sounds of all Buddhas' abodes, turning the pure Dharma wheel of the Buddhas of the three times, expounding the ocean of sÅ«tras and the ocean of Dharma clouds, their meaning profound and far-reaching, inexhaustible.
['ZH_T10_0294_003:0867c13_3']	ä¹è€…ã€ç©¶ç«Ÿè«¸ä½›éŸ³è²æµ·ï¼Œæ·±å…¥ä¸€åˆ‡å¦‚ä¾†æµ·ï¼Œç©¶ç«Ÿä¸€åˆ‡å¦‚ä¾†æµ·ã€‚	ä¹è€…ã€ç©¶ç«Ÿè«¸ä½›éŸ³è²æµ·ï¼Œæ·±å…¥ä¸€åˆ‡å¦‚ä¾†æµ·ï¼Œç©¶ç«Ÿä¸€åˆ‡å¦‚ä¾†æµ·ã€‚	Ninth, ultimately reaching the ocean of the Buddhas' sounds, deeply entering the ocean of all TathÄgatas, ultimately reaching the ocean of all TathÄgatas.
['ZH_T10_0294_003:0867c14_14']	åè€…ã€æ·±å…¥ç¤ºç¾ä¸æ€è­°ä½›è‡ªåœ¨ç¥åŠ›ï¼ŒåŒ–åº¦çœ¾ç”Ÿä½ç„¡é‡ç„¡é‚Šè«¸ä½›åç¨±æµ·ã€‚	åè€…ã€æ·±å…¥ç¤ºç¾ä¸æ€è­°ä½›è‡ªåœ¨ç¥åŠ›ï¼ŒåŒ–åº¦çœ¾ç”Ÿä½ç„¡é‡ç„¡é‚Šè«¸ä½›åç¨±æµ·ã€‚	Tenth, deeply entering the inconceivable spiritual powers and majestic power of the Buddhas, manifesting to liberate sentient beings, abiding in the ocean of immeasurable and boundless fame of the Buddhas.
['ZH_T10_0294_003:0867c14_18']	å–„ç”·å­ï¼	å–„ç”·å­ï¼	Good man!
['ZH_T10_0294_003:0867c15_6']	æ­¤åè©è–©åæ³•ã€‚	æ­¤åè©è–©åæ³•ã€‚	This is called the ten dharmas of the bodhisattvas.
['ZH_T10_0294_003:0867c16_14']	è‹¥æœ‰è©è–©ï¼Œå…·æ­¤åæ³•ï¼Œå‰‡èƒ½æ»¿è¶³è©è–©è«¸è¡Œï¼Œäº¦èƒ½æ‚‰å‚™æ™®è³¢è¡Œé¡˜ã€‚	è‹¥æœ‰è©è–©ï¼Œå…·æ­¤åæ³•ï¼Œå‰‡èƒ½æ»¿è¶³è©è–©è«¸è¡Œï¼Œäº¦èƒ½æ‚‰å‚™æ™®è³¢è¡Œé¡˜ã€‚	If there are bodhisattvas who possess these ten dharmas, they will be able to fulfill the bodhisattvas' practices and also be able to fully possess Samantabhadra's practices and vows.
['ZH_T10_0294_003:0867c16_19']	ã€Œå–„ç”·å­ï¼	ã€Œå–„ç”·å­ï¼	Good man!
['ZH_T10_0294_003:0867c23_17']	æˆ‘å·²æˆå°±è©è–©å¯‚æ»…å®šæ¨‚ç²¾é€²æ³•é–€ï¼Œä»¥æ­¤å®šåŠ›ï¼Œæ‚‰è¦‹ä¸‰ä¸–åš´æ·¨ä½›å‰ä¸€åˆ‡è«¸ä½›åŠçœ·å±¬æµ·ï¼Œæ‚‰è¦‹ç„¡é‡ç„¡é‚Šè«¸ä½›å¦‚ä¾†ç¥é€šåŠ›æµ·ï¼Œåˆ†åˆ¥äº†çŸ¥è«¸ä½›åè™Ÿè«¸ä½›å¦‚ä¾†è½‰æ³•è¼ªæµ·ï¼ŒçŸ¥å½¼è«¸ä½›å£½å‘½çŸ­ä¿ƒåŠä»¥ç„¡é‡ï¼ŒçŸ¥å½¼è«¸ä½›ç„¡é‡å¾®å¦™æ·¨éŸ³è²æµ·ï¼Œå½¼è«¸å¦‚ä¾†æ¸…æ·¨æ³•èº«ç„¡é‡ç„¡é‚Šå……æ»¿æ³•ç•Œï¼Œäº¦ä¸è‘—å¦‚ä¾†ä¸€åˆ‡è«¸ç›¸ï¼Œè€Œç„¡ç›¸å¥½æƒ³ã€‚	æˆ‘å·²æˆå°±è©è–©å¯‚æ»…å®šæ¨‚ç²¾é€²æ³•é–€ï¼Œä»¥æ­¤å®šåŠ›ï¼Œæ‚‰è¦‹ä¸‰ä¸–åš´æ·¨ä½›å‰ä¸€åˆ‡è«¸ä½›åŠçœ·å±¬æµ·ï¼Œæ‚‰è¦‹ç„¡é‡ç„¡é‚Šè«¸ä½›å¦‚ä¾†ç¥é€šåŠ›æµ·ï¼Œåˆ†åˆ¥äº†çŸ¥è«¸ä½›åè™Ÿè«¸ä½›å¦‚ä¾†è½‰æ³•è¼ªæµ·ï¼ŒçŸ¥å½¼è«¸ä½›å£½å‘½çŸ­ä¿ƒåŠä»¥ç„¡é‡ï¼ŒçŸ¥å½¼è«¸ä½›ç„¡é‡å¾®å¦™æ·¨éŸ³è²æµ·ï¼Œå½¼è«¸å¦‚ä¾†æ¸…æ·¨æ³•èº«ç„¡é‡ç„¡é‚Šå……æ»¿æ³•ç•Œï¼Œäº¦ä¸è‘—å¦‚ä¾†ä¸€åˆ‡è«¸ç›¸ï¼Œè€Œç„¡ç›¸å¥½æƒ³ã€‚	I have already accomplished the bodhisattva's method of the bliss of concentration and diligence. By the power of this concentration, I see the ocean of pure buddha lands and all buddhas and their retinues in the three times, I see the ocean of the immeasurable and boundless spiritual powers of the buddhas, I discern and understand the ocean of the buddhas' names and the buddhas' turning of the Dharma wheel, I know the short lifespans of those buddhas and their immeasurable lifespans, I know the ocean of the immeasurable subtle and pure sounds of those buddhas, the pure Dharma bodies of those tathÄgatas are immeasurable and boundless, filling the Dharma realm, and yet they are not attached to the various characteristics of the tathÄgatas, and have no concept of marks and virtues.
['ZH_T10_0294_003:0867c24_1']	ä½•ä»¥æ•…ï¼Ÿ	ä½•ä»¥æ•…ï¼Ÿ	Why is it so?
['ZH_T10_0294_003:0867c25_8']	è«¸ä½›å¦‚ä¾†ï¼Œç„¡ä¾†å»ç›¸ï¼Œå·²æ»…ä¸€åˆ‡ä¾†å»ç›¸æ•…ï¼Œä¸ä½ä¸‰ä¸–å¦‚å¦‚éš›æ•…ï¼›	è«¸ä½›å¦‚ä¾†ï¼Œç„¡ä¾†å»ç›¸ï¼Œå·²æ»…ä¸€åˆ‡ä¾†å»ç›¸æ•…ï¼Œä¸ä½ä¸‰ä¸–å¦‚å¦‚éš›æ•…ï¼›	The buddhas, the tathÄgatas, have no characteristics of coming and going, because they have already extinguished all characteristics of coming and going, because they do not abide in the realm of suchness of the three times;
['ZH_T10_0294_003:0867c27_8']	äº¦ééå»ã€ä¸ä½ç¾åœ¨ï¼Œæ»…æ–¼ä¸€åˆ‡ä¸–é–“ç›¸ç›¸æ•…ï¼Œä¸å–ä¸€åˆ‡ä¾†å»ç›¸æ•…ï¼Œæ•…åå¦‚ä¾†ï¼Œä¸ä¾†ä¸å»ã€‚	äº¦ééå»ã€ä¸ä½ç¾åœ¨ï¼Œæ»…æ–¼ä¸€åˆ‡ä¸–é–“ç›¸ç›¸æ•…ï¼Œä¸å–ä¸€åˆ‡ä¾†å»ç›¸æ•…ï¼Œæ•…åå¦‚ä¾†ï¼Œä¸ä¾†ä¸å»ã€‚	It is also not past, nor does it abide in the present, because it has extinguished all worldly characteristics, and because it does not grasp any coming or going characteristics, it is called the TathÄgata, who does not come or go.
['ZH_T10_0294_003:0867c28_12']	è«¸ä½›å¦‚ä¾†ï¼Œä¸ç”Ÿä¸èµ·ï¼Œä¸é€€ä¸æ²’ï¼Œä¸æ»…ä¸ç¾ï¼Œæ•…åæ³•èº«ã€‚	è«¸ä½›å¦‚ä¾†ï¼Œä¸ç”Ÿä¸èµ·ï¼Œä¸é€€ä¸æ²’ï¼Œä¸æ»…ä¸ç¾ï¼Œæ•…åæ³•èº«ã€‚	The buddhas, the tathÄgatas, are not born, do not arise, do not regress, do not perish, do not extinguish, and do not manifest, and are therefore called the Dharma body.
['ZH_T10_0294_003:0867c29_17']	è«¸ä½›å¦‚ä¾†ï¼Œä¸èµ·èªæ€§ï¼Œä¸æ»…èªæ€§ï¼Œéä¸€åˆ‡èªè¨€ï¼Œèªè¨€æ–·æ•…ã€‚	è«¸ä½›å¦‚ä¾†ï¼Œä¸èµ·èªæ€§ï¼Œä¸æ»…èªæ€§ï¼Œéä¸€åˆ‡èªè¨€ï¼Œèªè¨€æ–·æ•…ã€‚	The buddhas, the tathÄgatas, do not give rise to the nature of speech, do not extinguish the nature of speech, transcend all speech, and have cut off speech.
['ZH_T10_0294_003:0868a01_15']	éå¯¦æ»…èº«ï¼Œç¤ºç¾æ»…åº¦ï¼ŒçŒ¶å¦‚å¹»æ³•æ€§ä¸å£æ•…ã€‚	éå¯¦æ»…èº«ï¼Œç¤ºç¾æ»…åº¦ï¼ŒçŒ¶å¦‚å¹»æ³•æ€§ä¸å£æ•…ã€‚	They do not truly extinguish the body, but manifest parinirvÄá¹‡a, just like the nature of illusory dharmas is indestructible.
['ZH_T10_0294_003:0868a02_13']	è«¸ä½›å¦‚ä¾†ï¼Œéå¯¦éè™›ï¼Œæ¬²ç‚ºé¥’ç›Šè«¸çœ¾ç”Ÿæ•…ã€‚	è«¸ä½›å¦‚ä¾†ï¼Œéå¯¦éè™›ï¼Œæ¬²ç‚ºé¥’ç›Šè«¸çœ¾ç”Ÿæ•…ã€‚	The buddhas, the tathÄgatas, are neither real nor false, and wish to benefit all sentient beings.
['ZH_T10_0294_003:0868a03_12']	ä¸€åˆ‡å¦‚ä¾†ï¼Œä»¥å¦‚ä¾†é“ç„¡ä¾†ç„¡å»ï¼Œå‡ºèˆˆæ–¼ä¸–ã€‚	ä¸€åˆ‡å¦‚ä¾†ï¼Œä»¥å¦‚ä¾†é“ç„¡ä¾†ç„¡å»ï¼Œå‡ºèˆˆæ–¼ä¸–ã€‚	All tathÄgatas, by the tathÄgata path, without coming or going, appear in the world.
['ZH_T10_0294_003:0868a05_6']	è«¸ä½›å¦‚ä¾†ï¼Œä¸ç”Ÿä¸æ²’ï¼Œä¸æ»…ä¸ä½ï¼Œä¸è‡³æ­¤ï¼Œä¸å¾€å½¼ï¼Œæ³•æ€§æ¸…æ·¨ï¼Œä¸å¯å£æ•…ã€‚	è«¸ä½›å¦‚ä¾†ï¼Œä¸ç”Ÿä¸æ²’ï¼Œä¸æ»…ä¸ä½ï¼Œä¸è‡³æ­¤ï¼Œä¸å¾€å½¼ï¼Œæ³•æ€§æ¸…æ·¨ï¼Œä¸å¯å£æ•…ã€‚	The buddhas, the tathÄgatas, are not born, do not perish, do not extinguish, do not abide, do not come here, do not go there, and the nature of dharmas is pure and indestructible.
['ZH_T10_0294_003:0868a06_4']	è«¸ä½›å¦‚ä¾†ï¼Œç„¡æ€§ç„¡ç›¸ï¼Œé›¢æ–¼ä¸€åˆ‡èªè¨€é“æ•…ã€‚	è«¸ä½›å¦‚ä¾†ï¼Œç„¡æ€§ç„¡ç›¸ï¼Œé›¢æ–¼ä¸€åˆ‡èªè¨€é“æ•…ã€‚	The buddhas, the tathÄgatas, have no nature and no characteristics, because they are apart from all verbal expressions.
['ZH_T10_0294_003:0868a07_13']	è«¸ä½›å¦‚ä¾†ï¼Œä»¥ä¸€å¦‚ç›¸ï¼ŒåŒå…¥æ³•æ€§ï¼Œç„¡é‚Šéš›æ•…ï¼Œç©¶ç«Ÿä¸€åˆ‡æ³•ç•Œæ€§æ•…ã€‚	è«¸ä½›å¦‚ä¾†ï¼Œä»¥ä¸€å¦‚ç›¸ï¼ŒåŒå…¥æ³•æ€§ï¼Œç„¡é‚Šéš›æ•…ï¼Œç©¶ç«Ÿä¸€åˆ‡æ³•ç•Œæ€§æ•…ã€‚	The buddhas, the tathÄgatas, with the characteristic of suchness, are the same in entering the nature of dharmas, because they are boundless, and because they ultimately reach the nature of the entire dharma realm.
['ZH_T10_0294_003:0868a07_18']	ã€Œå–„ç”·å­ï¼	ã€Œå–„ç”·å­ï¼	Good man!
['ZH_T10_0294_003:0868a13_6']	æˆ‘å¦‚æ˜¯äº†çŸ¥æ–¼ä¸€åˆ‡å¦‚ä¾†ï¼Œå”¯å¾—æ­¤å¯‚æ»…å®šæ¨‚ç²¾é€²æ³•é–€ï¼Œç…§æ˜å¢é•·å»£å¤§å–„æ ¹ï¼Œæ·±å…¥éš¨é †å¦‚å¯‚ç”šæ·±æ™®ç¾å¢ƒç•Œï¼Œåˆ†åˆ¥äº†çŸ¥è™›å¦„å¹³ç­‰ç›¸ï¼Œæ¼”èªªç”šæ·±å¹³ç­‰å¤§æ³•ï¼Œä»¥å¤§æ‚²å¿ƒæ™®æ”ä¸€åˆ‡ï¼Œæœªæ›¾æ¨é›¢ï¼Œä¸€å¿ƒå–„å¯‚ï¼Œç„¡èµ·æ»…æƒ³ï¼Œå¢é•·æ­£å—ï¼Œå…¥å¯‚æ»…å®šï¼Œèµ·æ–¼åˆç¦ªã€‚	æˆ‘å¦‚æ˜¯äº†çŸ¥æ–¼ä¸€åˆ‡å¦‚ä¾†ï¼Œå”¯å¾—æ­¤å¯‚æ»…å®šæ¨‚ç²¾é€²æ³•é–€ï¼Œç…§æ˜å¢é•·å»£å¤§å–„æ ¹ï¼Œæ·±å…¥éš¨é †å¦‚å¯‚ç”šæ·±æ™®ç¾å¢ƒç•Œï¼Œåˆ†åˆ¥äº†çŸ¥è™›å¦„å¹³ç­‰ç›¸ï¼Œæ¼”èªªç”šæ·±å¹³ç­‰å¤§æ³•ï¼Œä»¥å¤§æ‚²å¿ƒæ™®æ”ä¸€åˆ‡ï¼Œæœªæ›¾æ¨é›¢ï¼Œä¸€å¿ƒå–„å¯‚ï¼Œç„¡èµ·æ»…æƒ³ï¼Œå¢é•·æ­£å—ï¼Œå…¥å¯‚æ»…å®šï¼Œèµ·æ–¼åˆç¦ªã€‚	I understand all tathÄgatas in this way. I only attain this Dharma door of the bliss of concentration and diligence in quiescence, illuminating and increasing vast wholesome roots, deeply entering and following the very profound realm of universal manifestation in quiescence, discriminating and understanding the characteristics of false equality, expounding the very profound and equal great Dharma, universally embracing all with a mind of great compassion, never abandoning, with a single mind of quiescence, without thoughts of arising and ceasing, increasing right acceptance, entering the concentration of quiescence, and arising from the first meditation.
['ZH_T10_0294_003:0868a14_11']	é™¤æ»…æ„æ¥­ï¼Œå¾—å¯‚æ™ºåŠ›ï¼Œæ”å–çœ¾ç”Ÿï¼Œæ­¡å–œæ‚…æ¨‚ï¼Œå…¥ç¬¬äºŒç¦ªã€‚	é™¤æ»…æ„æ¥­ï¼Œå¾—å¯‚æ™ºåŠ›ï¼Œæ”å–çœ¾ç”Ÿï¼Œæ­¡å–œæ‚…æ¨‚ï¼Œå…¥ç¬¬äºŒç¦ªã€‚	Eliminating mental karma, attaining the power of quiescent wisdom, embracing sentient beings, joyfully delighted, entering the second meditation.
['ZH_T10_0294_003:0868a15_9']	æ¨é›¢ç”Ÿæ­»ï¼Œå¯‚æ»…æ¶…æ§ƒï¼Œè§€çœ¾ç”Ÿæ€§ï¼Œä¿®ç¬¬ä¸‰ç¦ªã€‚	æ¨é›¢ç”Ÿæ­»ï¼Œå¯‚æ»…æ¶…æ§ƒï¼Œè§€çœ¾ç”Ÿæ€§ï¼Œä¿®ç¬¬ä¸‰ç¦ªã€‚	Abandoning birth and death, in the peace of nirvana, observing the nature of sentient beings, cultivating the third dhyana.
['ZH_T10_0294_003:0868a16_10']	ç‚ºæ»…çœ¾ç”Ÿè«¸ç…©æƒ±è‹¦ï¼Œè€Œä¸è¦‹çœ¾ç”Ÿç›¸ï¼Œä¿®ç¬¬å››ç¦ªã€‚	ç‚ºæ»…çœ¾ç”Ÿè«¸ç…©æƒ±è‹¦ï¼Œè€Œä¸è¦‹çœ¾ç”Ÿç›¸ï¼Œä¿®ç¬¬å››ç¦ªã€‚	In order to extinguish the afflictions and suffering of sentient beings, yet not seeing the characteristics of sentient beings, cultivating the fourth dhyana.
['ZH_T10_0294_003:0868a19_14']	å¢é•·ä¸€åˆ‡æ™ºè©æå¿ƒé¡˜ï¼Œå‡ºç”Ÿä¸€åˆ‡è©è–©å®šæµ·å·§å¦™æ–¹ä¾¿ï¼Œæ·±å…¥ä¸€åˆ‡è«¸æ³•é–€æµ·ï¼Œæˆå°±è©è–©éŠæˆ²ç¥é€šï¼Œå‡ºç”Ÿè©è–©è‡ªåœ¨ç¥åŠ›æ˜æ·¨æ™ºæ…§ï¼Œæ·±å…¥æ™®é–€æ³•ç•Œã€‚	å¢é•·ä¸€åˆ‡æ™ºè©æå¿ƒé¡˜ï¼Œå‡ºç”Ÿä¸€åˆ‡è©è–©å®šæµ·å·§å¦™æ–¹ä¾¿ï¼Œæ·±å…¥ä¸€åˆ‡è«¸æ³•é–€æµ·ï¼Œæˆå°±è©è–©éŠæˆ²ç¥é€šï¼Œå‡ºç”Ÿè©è–©è‡ªåœ¨ç¥åŠ›æ˜æ·¨æ™ºæ…§ï¼Œæ·±å…¥æ™®é–€æ³•ç•Œã€‚	Increasing the vow of the mind of enlightenment of omniscience, giving rise to the skillful means of the ocean of all bodhisattva concentrations, deeply entering the ocean of all Dharma gates, accomplishing the bodhisattva's spiritual powers and supernatural transformations, giving rise to the bodhisattva's self-mastery and spiritual powers, with pure wisdom, deeply entering the Dharma realm of universal access.
['ZH_T10_0294_003:0868a20_1']	ã€Œå¾©æ¬¡å–„ç”·å­ï¼	ã€Œå¾©æ¬¡å–„ç”·å­ï¼	Moreover, good man!
