segmentnr	original	analyzed	translated
['ZH_T17_0721_035:0202c15_0']	11æ­£æ³•å¿µè™•ç¶“å·ç¬¬ä¸‰åäº”	11æ­£æ³•å¿µè™•ç¶“å·ç¬¬ä¸‰åäº”	11 Sutra of the Meditations on the Recollections of the Buddhas, Scroll 35ğŸ”½
['ZH_T17_0721_035:0202c17_0']	å…ƒé­å©†ç¾…é–€ç¿æ›‡èˆ¬è‹¥æµæ”¯è­¯	å…ƒé­å©†ç¾…é–€ç¿æ›‡èˆ¬è‹¥æµæ”¯è­¯	Translated by Gautama-prajÃ±Äruci, a BrÄhman of the Yuanwei Dynasty
['ZH_T17_0721_035:0202c18_0']	è§€å¤©å“ä¹‹åå››ä¸‰åä¸‰å¤©ä¹‹åä¸€	è§€å¤©å“ä¹‹åå››ä¸‰åä¸‰å¤©ä¹‹åä¸€	Chapter on Contemplating the Heavens, Part 14, Section 11 on the Thirty-three Heavens
['ZH_T17_0721_035:0202c19_19']	ã€Œå¾©æ¬¡æ¯”ä¸˜çŸ¥æ¥­æœå ±ï¼Œè§€ä¸‰åä¸‰å¤©æ‰€ä½ä¹‹åœ°ã€‚	ã€Œå¾©æ¬¡æ¯”ä¸˜çŸ¥æ¥­æœå ±ï¼Œè§€ä¸‰åä¸‰å¤©æ‰€ä½ä¹‹åœ°ã€‚	Next, the bhiká¹£us, knowing the fruits of karma, contemplate the abodes of the Thirty-three Heavens.
['ZH_T17_0721_035:0202c20_5']	å½¼ä»¥èæ…§è¦‹ï¼š	å½¼ä»¥èæ…§è¦‹ï¼š	They see with their wisdom of hearing:
['ZH_T17_0721_035:0202c20_19']	ä¸‰åä¸‰å¤©äºŒåä¹åœ°ï¼Œåæ›¼é™€ç¾…ã€‚	ä¸‰åä¸‰å¤©äºŒåä¹åœ°ï¼Œåæ›¼é™€ç¾…ã€‚	The Thirty-three Heavens have twenty-nine grounds, named Mandara.
['ZH_T17_0721_035:0202c21_8']	çœ¾ç”Ÿä½•æ¥­ç”Ÿæ­¤å¤©ä¸­ï¼Ÿ	çœ¾ç”Ÿä½•æ¥­ç”Ÿæ­¤å¤©ä¸­ï¼Ÿ	What karma do sentient beings have to be born in this heaven?
['ZH_T17_0721_035:0202c21_14']	å½¼ä»¥èæ…§è¦‹ï¼š	å½¼ä»¥èæ…§è¦‹ï¼š	They see with their wisdom of hearing:
['ZH_T17_0721_035:0202c23_13']	æœ‰å–„äººé †æ³•ä¿®è¡Œï¼Œä»¥æ­£ç›´å¿ƒä¸æƒ±çœ¾ç”Ÿï¼Œå¯¦è¦‹æ¥­æœï¼Œæ¸…æ·¨æŒæˆ’ã€å¸¸æ¨‚æŒæˆ’ï¼Œé›¢æ–¼è«‚æ›²ã€‚	æœ‰å–„äººé †æ³•ä¿®è¡Œï¼Œä»¥æ­£ç›´å¿ƒä¸æƒ±çœ¾ç”Ÿï¼Œå¯¦è¦‹æ¥­æœï¼Œæ¸…æ·¨æŒæˆ’ã€å¸¸æ¨‚æŒæˆ’ï¼Œé›¢æ–¼è«‚æ›²ã€‚	There are good people who practice in accordance with the Dharma, with a sincere mind that does not trouble sentient beings, who truly see the fruits of karma, who purely uphold precepts and always delight in upholding precepts, and who are free from flattery.
['ZH_T17_0721_035:0202c24_3']	å¦‚ç…‰çœŸé‡‘ï¼Œæ¸…æ·¨ç„¡å¢ã€‚	å¦‚ç…‰çœŸé‡‘ï¼Œæ¸…æ·¨ç„¡å¢ã€‚	Like refined true gold, they are pure and without defilements.
['ZH_T17_0721_035:0202c25_2']	æ­£è¦‹ä¿®è¡Œå—æŒå–„æˆ’ï¼Œç•æœªä¾†ä¸–ï¼Œå¸ƒæ–½ä¿®ç¦ã€‚	æ­£è¦‹ä¿®è¡Œå—æŒå–„æˆ’ï¼Œç•æœªä¾†ä¸–ï¼Œå¸ƒæ–½ä¿®ç¦ã€‚	With right view, they practice and uphold good precepts, fearing the future world, and give to cultivate blessings.
['ZH_T17_0721_035:0202c26_14']	æ‰€è¬‚è¦‹æœ‰ä¿®ç¦ªæ¯”ä¸˜æ¬²æ–·é­”ç¸›ï¼Œç››å¤ç†±æ™‚æµæ±—ç†±æ¸´ï¼Œæ–½çŸ³èœœæ¼¿æˆ–æ–½æ‹‚æ‰‡ã€‚	æ‰€è¬‚è¦‹æœ‰ä¿®ç¦ªæ¯”ä¸˜æ¬²æ–·é­”ç¸›ï¼Œç››å¤ç†±æ™‚æµæ±—ç†±æ¸´ï¼Œæ–½çŸ³èœœæ¼¿æˆ–æ–½æ‹‚æ‰‡ã€‚	This refers to seeing bhiká¹£us who cultivate meditation, wishing to sever the bonds of MÄra, sweating and feeling hot and thirsty in the heat of midsummer, giving them rock candy drinks or fans.
['ZH_T17_0721_035:0202c29_2']	å¦‚æ˜¯å–„äººä¸æ®ºçœ¾ç”Ÿï¼Œæˆ–è¦‹çµå¸«ç¾…æ•å­”é›€ã€å±±é·„ç¨®ç¨®çœ¾é³¥ï¼Œçµå¸«æ•å¾—ï¼Œæˆ–é¤Šæˆ–æ®ºï¼Œæˆ–ä»¥çœ¾é³¥ä½œéŠæˆ²å…·ã€‚	å¦‚æ˜¯å–„äººä¸æ®ºçœ¾ç”Ÿï¼Œæˆ–è¦‹çµå¸«ç¾…æ•å­”é›€ã€å±±é·„ç¨®ç¨®çœ¾é³¥ï¼Œçµå¸«æ•å¾—ï¼Œæˆ–é¤Šæˆ–æ®ºï¼Œæˆ–ä»¥çœ¾é³¥ä½œéŠæˆ²å…·ã€‚	Such a good person does not kill living beings. If he sees hunters catching peacocks, mountain chickens, and various birds, and the hunters catching them, raising them, or killing them, or using the birds as playthings,
['ZH_T17_0721_035:0203a01_6']	æ˜¯äººè¦‹ä¹‹ï¼Œæå…¶æ®ºå®³ï¼Œè´–æ­¤ç”Ÿå‘½ï¼Œæ”¾ä¹‹æœ¬è™•ä»¤å¾—å®‰æ¨‚ã€‚	æ˜¯äººè¦‹ä¹‹ï¼Œæå…¶æ®ºå®³ï¼Œè´–æ­¤ç”Ÿå‘½ï¼Œæ”¾ä¹‹æœ¬è™•ä»¤å¾—å®‰æ¨‚ã€‚	this person, seeing this, fears that they will be killed, ransoms the lives of these beings, releases them to their original places, and allows them to attain peace and happiness.
['ZH_T17_0721_035:0203a01_15']	æ˜¯åä¸æ®ºåˆ©ç›Šçœ¾ç”Ÿã€‚	æ˜¯åä¸æ®ºåˆ©ç›Šçœ¾ç”Ÿã€‚	This is called not killing and benefiting sentient beings.
['ZH_T17_0721_035:0203a02_1']	äº‘ä½•ä¸ç›œï¼Ÿ	äº‘ä½•ä¸ç›œï¼Ÿ	What is not stealing?
['ZH_T17_0721_035:0203a02_6']	äº‘ä½•æ¨ç›œï¼Ÿ	äº‘ä½•æ¨ç›œï¼Ÿ	What is abandoning stealing?
['ZH_T17_0721_035:0203a02_19']	è¦‹æ–¼å¾®ç´°æ¥­ä¹‹æœå ±è€Œç”Ÿæ€–ç•ã€‚	è¦‹æ–¼å¾®ç´°æ¥­ä¹‹æœå ±è€Œç”Ÿæ€–ç•ã€‚	Seeing the subtle fruits of karma, one gives rise to fear.
['ZH_T17_0721_035:0203a05_3']	æ˜¯æŒæˆ’äººè‹¥æ²³æ± å²¸é‚Šæˆ–æ–¼ç•°è™•ï¼Œè¦‹æœ‰æ¥Šææˆ–æœ‰èœœæ¼¿ï¼Œç‚ºæ–½è¡Œäººï¼Œæ˜¯äººæ¸´ä¹ï¼Œä¸å–ä¸é£²ï¼Œä»¥æ…ˆå¿ƒæ•…ã€‚	æ˜¯æŒæˆ’äººè‹¥æ²³æ± å²¸é‚Šæˆ–æ–¼ç•°è™•ï¼Œè¦‹æœ‰æ¥Šææˆ–æœ‰èœœæ¼¿ï¼Œç‚ºæ–½è¡Œäººï¼Œæ˜¯äººæ¸´ä¹ï¼Œä¸å–ä¸é£²ï¼Œä»¥æ…ˆå¿ƒæ•…ã€‚	This person who upholds the precepts, whether on the banks of a river or a pond, or in other places, sees toothbrushes or honey water, for the sake of those who are practicing, this person, being thirsty, does not take or drink it, because of his compassionate mind.
['ZH_T17_0721_035:0203a05_8']	æ˜¯åä¸ç›œã€‚	æ˜¯åä¸ç›œã€‚	This is called not stealing.
['ZH_T17_0721_035:0203a06_2']	å¦‚æ˜¯ä¹‹äººå‘½çµ‚ç”Ÿæ–¼ä¸‰åä¸‰å¤©ã€‚	å¦‚æ˜¯ä¹‹äººå‘½çµ‚ç”Ÿæ–¼ä¸‰åä¸‰å¤©ã€‚	Such a person, upon the end of their life, is born in the Heaven of the Thirty-three Celestials.
['ZH_T17_0721_035:0203a08_10']	ã€Œæ—¢ç”Ÿå¤©å·²ï¼Œä¸€åˆ‡è«¸æ¬²çš†æ‚‰å…·è¶³ï¼Œäº”æ¨‚éŸ³è²ï¼ŒéŠæˆ²åœ’æ—ï¼Œç¨®ç¨®çœ¾é³¥å‡ºå¦™éŸ³è²ï¼Œæ–¼è“®èŠ±ä¸­çœ¾èœ‚éŸ³è²ã€é´»é³¥ä¹‹éŸ³ã€‚	ã€Œæ—¢ç”Ÿå¤©å·²ï¼Œä¸€åˆ‡è«¸æ¬²çš†æ‚‰å…·è¶³ï¼Œäº”æ¨‚éŸ³è²ï¼ŒéŠæˆ²åœ’æ—ï¼Œç¨®ç¨®çœ¾é³¥å‡ºå¦™éŸ³è²ï¼Œæ–¼è“®èŠ±ä¸­çœ¾èœ‚éŸ³è²ã€é´»é³¥ä¹‹éŸ³ã€‚	Having been born in the heavens, all desires are fully endowed, with the sounds of the five kinds of music, playing in the gardens and forests, the wonderful sounds of various birds, the sounds of bees in the lotus flowers, and the sounds of wild geese.
['ZH_T17_0721_035:0203a08_19']	æ—ä¸­çœ¾æ¨¹ä¸ƒå¯¶èŠåš´ã€‚	æ—ä¸­çœ¾æ¨¹ä¸ƒå¯¶èŠåš´ã€‚	In the forests, the trees are adorned with the seven treasures.
['ZH_T17_0721_035:0203a09_17']	è«¸è“®èŠ±æ± é¦™æ°´å……æ»¿å¦‚æ¯˜ç‰ç’ƒï¼Œåœ¨ä¸­éŠæˆ²ã€‚	è«¸è“®èŠ±æ± é¦™æ°´å……æ»¿å¦‚æ¯˜ç‰ç’ƒï¼Œåœ¨ä¸­éŠæˆ²ã€‚	In the lotus ponds, the fragrant waters are filled like lapis lazuli, in which one plays.
['ZH_T17_0721_035:0203a11_14']	å…¶å±±å³¯ä¸­ä¸ƒå¯¶ç„°å…‰ã€ä¸ƒå¯¶çŸ³çªŸï¼Œé‡‘éŠ€é —æ¢¨ã€å› é™€é’å¯¶ï¼Œå¦‚æ˜¯ç¨®ç¨®çœ¾é³¥å‡ºå¦™éŸ³è²ã€‚	å…¶å±±å³¯ä¸­ä¸ƒå¯¶ç„°å…‰ã€ä¸ƒå¯¶çŸ³çªŸï¼Œé‡‘éŠ€é —æ¢¨ã€å› é™€é’å¯¶ï¼Œå¦‚æ˜¯ç¨®ç¨®çœ¾é³¥å‡ºå¦™éŸ³è²ã€‚	In the mountain peaks, there are the flames and lights of the seven treasures, and caves of the seven treasures, with gold, silver, crystal, and indranÄ«la gems. Such various birds emit wonderful sounds.
['ZH_T17_0721_035:0203a12_17']	å¦‚æ˜¯çœ¾é³¥ï¼Œä¸ƒå¯¶ç‚ºç¿…è€Œä»¥èŠåš´ï¼Œç¨®ç¨®éŸ³è²èä¹‹æ‚…æ¨‚ã€‚	å¦‚æ˜¯çœ¾é³¥ï¼Œä¸ƒå¯¶ç‚ºç¿…è€Œä»¥èŠåš´ï¼Œç¨®ç¨®éŸ³è²èä¹‹æ‚…æ¨‚ã€‚	Such birds have wings of the seven treasures, with which they are adorned, and their various sounds are heard with joyful pleasure.
['ZH_T17_0721_035:0203a13_16']	ä¸€åˆ‡å¤©çœ¾äº’ç›¸éš¨é †ï¼Œç„¡é‡ç¾éŸ³éåœ’æ—ä¸­ã€‚	ä¸€åˆ‡å¤©çœ¾äº’ç›¸éš¨é †ï¼Œç„¡é‡ç¾éŸ³éåœ’æ—ä¸­ã€‚	All the heavenly multitudes follow each other in harmony, and countless beautiful sounds fill the gardens and forests.
['ZH_T17_0721_035:0203a15_6']	æ–¼å…¶æ—ä¸­å¯æ„›é£²é£Ÿå¾æ²³è€Œæµï¼Œè‹¥å¤©è¦‹ä¹‹ï¼Œç”Ÿå¤§æ­¡å–œï¼Œæ­æœªæ›¾æœ‰ã€‚	æ–¼å…¶æ—ä¸­å¯æ„›é£²é£Ÿå¾æ²³è€Œæµï¼Œè‹¥å¤©è¦‹ä¹‹ï¼Œç”Ÿå¤§æ­¡å–œï¼Œæ­æœªæ›¾æœ‰ã€‚	In the forests, lovely food and drink flow from the rivers. When the gods see this, they give rise to great joy and exclaim that it is unprecedented.
['ZH_T17_0721_035:0203a16_6']	å¦‚æ˜¯æ—ä¸­ç¨®ç¨®çœ¾è‰²ï¼Œç¨®ç¨®èŠåš´ï¼ŒèŠåš´å…¶èº«ã€‚	å¦‚æ˜¯æ—ä¸­ç¨®ç¨®çœ¾è‰²ï¼Œç¨®ç¨®èŠåš´ï¼ŒèŠåš´å…¶èº«ã€‚	In this way, the various colors and various adornments in the forest adorn their bodies.
['ZH_T17_0721_035:0203a17_10']	èˆ‡è«¸ç‰å¥³ç™¾åƒåŒçœ¾ï¼ŒéŠæˆ²å—æ¨‚ï¼Œå—æ–¼å¤©ä¸­ç¨®ç¨®å¿«æ¨‚ã€‚	èˆ‡è«¸ç‰å¥³ç™¾åƒåŒçœ¾ï¼ŒéŠæˆ²å—æ¨‚ï¼Œå—æ–¼å¤©ä¸­ç¨®ç¨®å¿«æ¨‚ã€‚	Together with hundreds of thousands of celestial maidens, they play and enjoy pleasures, experiencing various heavenly delights.
['ZH_T17_0721_035:0203a18_1']	å…¶èº«å…‰æ˜ï¼Œå¨å¾·ç¬¬ä¸€ã€‚	å…¶èº«å…‰æ˜ï¼Œå¨å¾·ç¬¬ä¸€ã€‚	Their bodies emit light, and their majestic virtue is unsurpassed.
['ZH_T17_0721_035:0203a19_6']	å¦‚æ˜¯å¤©å­å—æ¥­æœå ±ï¼Œèˆ‡è«¸å¤©å¥³åœé¶å—æ¨‚ï¼Œå¿ƒç”Ÿæ­¡å–œã€‚	å¦‚æ˜¯å¤©å­å—æ¥­æœå ±ï¼Œèˆ‡è«¸å¤©å¥³åœé¶å—æ¨‚ï¼Œå¿ƒç”Ÿæ­¡å–œã€‚	In this way, the heavenly sons experience the karmic retribution of their actions, enjoying pleasures surrounded by celestial maidens, their minds filled with joy.
['ZH_T17_0721_035:0203a19_16']	æ—¢å—æ¨‚å·²ï¼Œå¦‚æ˜¯æ€æƒŸï¼š	æ—¢å—æ¨‚å·²ï¼Œå¦‚æ˜¯æ€æƒŸï¼š	Having experienced pleasure, they think like this:
['ZH_T17_0721_035:0203a20_13']	ã€æˆ‘ç•¶å¾€è©£æ¯˜ç‰ç’ƒå¯¶èŠåš´æ¬„æ¥¯åœé¶æ—ä¸­ã€‚	ã€æˆ‘ç•¶å¾€è©£æ¯˜ç‰ç’ƒå¯¶èŠåš´æ¬„æ¥¯åœé¶æ—ä¸­ã€‚	'I shall go to the forest surrounded by railings adorned with lapis lazuli jewels.
['ZH_T17_0721_035:0203a23_6']	ã€çœ¾å¯¶èŠåš´ï¼Œç¨®ç¨®çœ¾é³¥å‡ºå¦™éŸ³è²å……æ»¿æ—ä¸­ï¼Œä¸€åˆ‡å¤©çœ¾å¿ƒçš†æ­¡å–œï¼Œäº”æ¨‚éŸ³è²ï¼ŒéŠæˆ²å—æ¨‚ï¼Œèˆ‡è«¸å¤©çœ¾åŠè«¸å¤©å¥³éŠæˆ²æ—ä¸­ã€‚	ã€çœ¾å¯¶èŠåš´ï¼Œç¨®ç¨®çœ¾é³¥å‡ºå¦™éŸ³è²å……æ»¿æ—ä¸­ï¼Œä¸€åˆ‡å¤©çœ¾å¿ƒçš†æ­¡å–œï¼Œäº”æ¨‚éŸ³è²ï¼ŒéŠæˆ²å—æ¨‚ï¼Œèˆ‡è«¸å¤©çœ¾åŠè«¸å¤©å¥³éŠæˆ²æ—ä¸­ã€‚	Adorned with various jewels, various birds emit wonderful sounds filling the forest. The minds of all the heavenly multitudes are filled with joy. With the sounds of the five musical instruments, they play and enjoy pleasures, playing in the forest with the heavenly multitudes and celestial maidens.
['ZH_T17_0721_035:0203a24_2']	æ—ä¸­æœ‰æ± ï¼Œåæ›°æ¸…æ°´ï¼Œæ¸…æ·¨å¯æ„›ã€‚	æ—ä¸­æœ‰æ± ï¼Œåæ›°æ¸…æ°´ï¼Œæ¸…æ·¨å¯æ„›ã€‚	In the forest there is a pond called Clear Water, which is pure and lovely.
['ZH_T17_0721_035:0203a24_16']	è«¸å¤©çœ¾ç­‰ï¼Œæ–¼è“®èŠ±æ± éŠæˆ²å—æ¨‚ã€‚	è«¸å¤©çœ¾ç­‰ï¼Œæ–¼è“®èŠ±æ± éŠæˆ²å—æ¨‚ã€‚	The heavenly multitudes play and enjoy pleasures in the lotus pond.
['ZH_T17_0721_035:0203a27_12']	çˆ¾æ™‚ï¼Œåˆç”Ÿå¤©å­èˆ‡å¤©å¥³çœ¾æ¬²è‡³æ­¤æ—ï¼Œçˆ¾æ™‚è«¸å¤©é™è¦‹å¤©å­æ­Œèˆæˆ²ç¬‘ï¼Œå¾æ­¥è€Œè¡Œï¼Œå¾€è¿å¤©å­ï¼Œè©£æ¸…æ°´æ± ï¼Œæ–¼æ­¤æ± é‚Šæ­¡å¨›å—æ¨‚ã€‚	çˆ¾æ™‚ï¼Œåˆç”Ÿå¤©å­èˆ‡å¤©å¥³çœ¾æ¬²è‡³æ­¤æ—ï¼Œçˆ¾æ™‚è«¸å¤©é™è¦‹å¤©å­æ­Œèˆæˆ²ç¬‘ï¼Œå¾æ­¥è€Œè¡Œï¼Œå¾€è¿å¤©å­ï¼Œè©£æ¸…æ°´æ± ï¼Œæ–¼æ­¤æ± é‚Šæ­¡å¨›å—æ¨‚ã€‚	At that time, the newly born celestial son, together with the celestial maidens, wished to enter this forest. The other celestial beings saw from afar the celestial son singing, dancing, playing, and laughing, slowly walking towards them. They went to welcome the celestial son and went to the clear water pond. By the side of this pond, they joyfully enjoyed themselves and experienced pleasure.
['ZH_T17_0721_035:0203a28_11']	ä»¥æ± åŠ›æ•…ï¼Œéš¨è«¸å¤©å­å¿ƒä¹‹æ‰€å¿µï¼Œä¸€åˆ‡çš†ç¾ã€‚	ä»¥æ± åŠ›æ•…ï¼Œéš¨è«¸å¤©å­å¿ƒä¹‹æ‰€å¿µï¼Œä¸€åˆ‡çš†ç¾ã€‚	By the power of the pond, everything that the celestial sons thought of would appear.
['ZH_T17_0721_035:0203a29_1']	è‹¥å¿µè‰²é¦™ï¼Œçœ¾èœ‚å…·è¶³ã€‚	è‹¥å¿µè‰²é¦™ï¼Œçœ¾èœ‚å…·è¶³ã€‚	If they thought of color and fragrance, the bees would be complete.
['ZH_T17_0721_035:0203a29_11']	è‹¥å¿µå¤©é£²ï¼Œå¤©é£²å³ç”Ÿã€‚	è‹¥å¿µå¤©é£²ï¼Œå¤©é£²å³ç”Ÿã€‚	If they thought of celestial drinks, the celestial drinks would appear.
['ZH_T17_0721_035:0203b01_15']	è‹¥å¿µé ˆé™€ï¼Œè‰²é¦™å‘³å…·äº¦å¾©å¦‚æ˜¯ï¼ŒæŸ”è»Ÿæ·¨æ½”ï¼Œè‰²å¦‚æ»¿æœˆã€‚	è‹¥å¿µé ˆé™€ï¼Œè‰²é¦™å‘³å…·äº¦å¾©å¦‚æ˜¯ï¼ŒæŸ”è»Ÿæ·¨æ½”ï¼Œè‰²å¦‚æ»¿æœˆã€‚	If they thought of sugarcane, its color, aroma, and flavor would be complete in the same way. It was soft, pure, and clean, with a color like the full moon.
['ZH_T17_0721_035:0203b03_14']	è‹¥å¿µæ—æ¨¹ï¼Œå³ç”Ÿç¬¬ä¸€åŠŸå¾·å…·è¶³ç¨®ç¨®æ¨¹æ—ï¼Œéˆ´ç¶²å½Œè¦†ï¼Œå¾®é¢¨å¹å‹•å‡ºå¦™éŸ³è²ï¼Œå¦‚ä¹¾é—¥å©†éŸ³ã€‚	è‹¥å¿µæ—æ¨¹ï¼Œå³ç”Ÿç¬¬ä¸€åŠŸå¾·å…·è¶³ç¨®ç¨®æ¨¹æ—ï¼Œéˆ´ç¶²å½Œè¦†ï¼Œå¾®é¢¨å¹å‹•å‡ºå¦™éŸ³è²ï¼Œå¦‚ä¹¾é—¥å©†éŸ³ã€‚	If they thought of forest trees, the most excellent and virtuous various kinds of trees and forests would appear. Netting of bells covered them, and when gently blown by the breeze, they emitted wonderful sounds like the sounds of gandharvas.
['ZH_T17_0721_035:0203b04_5']	å¾©æ¬¡å¤©çœ¾ä½œå¦‚æ˜¯å¿µï¼š	å¾©æ¬¡å¤©çœ¾ä½œå¦‚æ˜¯å¿µï¼š	Furthermore, the celestial beings had this thought:
['ZH_T17_0721_035:0203b04_11']	ã€æˆ‘ç•¶å…¥æ± ã€‚	ã€æˆ‘ç•¶å…¥æ± ã€‚	'We should enter the pond.'
['ZH_T17_0721_035:0203b05_6']	ã€ä½œæ˜¯å¿µå·²ï¼Œå³å…¥æ± ä¸­ï¼Œæ²’èº«æ·±å…¥ã€‚	ã€ä½œæ˜¯å¿µå·²ï¼Œå³å…¥æ± ä¸­ï¼Œæ²’èº«æ·±å…¥ã€‚	Having had this thought, they immediately entered the pond and submerged their bodies deeply.
['ZH_T17_0721_035:0203b07_11']	è¦‹æ–¼æ± ä¸­ç¨®ç¨®å¯¶ç ä»¥ç‚ºæ¬„æ¥¯ï¼ŒèŠåš´å¯¶æ®¿ï¼Œæˆ–çœŸé‡‘ç™½éŠ€ã€æ¯˜ç‰ç’ƒå¯¶ã€é’å¯¶é —æ¢¨ã€é›œå¯¶ç‚ºåºŠï¼Œæ•·ä»¥å¤©è¡£ã€‚	è¦‹æ–¼æ± ä¸­ç¨®ç¨®å¯¶ç ä»¥ç‚ºæ¬„æ¥¯ï¼ŒèŠåš´å¯¶æ®¿ï¼Œæˆ–çœŸé‡‘ç™½éŠ€ã€æ¯˜ç‰ç’ƒå¯¶ã€é’å¯¶é —æ¢¨ã€é›œå¯¶ç‚ºåºŠï¼Œæ•·ä»¥å¤©è¡£ã€‚	They saw in the pond various jeweled railings, adorned with jeweled palaces, either of true gold, white silver, vaiá¸Å«rya jewels, blue jewels, crystal, or various jewels for beds, covered with heavenly garments.
['ZH_T17_0721_035:0203b09_1']	å¤©å­å¤©å¥³éŠæˆ²å—æ¨‚æ–¼å…¶æ± ä¸­ï¼Œç„¡é‡ç¨®ç¨®ï¼Œä¸çŸ¥å­è¶³æ–¼äº”æ¬²æ¨‚ã€‚	å¤©å­å¤©å¥³éŠæˆ²å—æ¨‚æ–¼å…¶æ± ä¸­ï¼Œç„¡é‡ç¨®ç¨®ï¼Œä¸çŸ¥å­è¶³æ–¼äº”æ¬²æ¨‚ã€‚	The heavenly sons and heavenly maidens played and enjoyed themselves in the pond, with countless varieties, never knowing enough, in the pleasures of the five desires.
['ZH_T17_0721_035:0203b10_1']	ç„¡æœ‰å¦¬å«‰ï¼Œäº’ç›¸æ„›æ•¬ï¼ŒéŠæˆ²æ­Œèˆï¼Œå¨›æ¨‚å—æ¨‚ã€‚	ç„¡æœ‰å¦¬å«‰ï¼Œäº’ç›¸æ„›æ•¬ï¼ŒéŠæˆ²æ­Œèˆï¼Œå¨›æ¨‚å—æ¨‚ã€‚	There was no jealousy, and they loved and respected each other, playing, singing and dancing, enjoying themselves and experiencing pleasure.
['ZH_T17_0721_035:0203b11_13']	æ—¢å‡ºæ± æ°´ï¼Œå¾©å¾€è©£æ–¼å°¼å–®å¤šæ—ï¼Œæ–¼å…¶æ—ä¸­å¤šæœ‰çœ¾é³¥ï¼Œè“®èŠ±æ—æ± å…·è¶³èŠåš´ã€‚	æ—¢å‡ºæ± æ°´ï¼Œå¾©å¾€è©£æ–¼å°¼å–®å¤šæ—ï¼Œæ–¼å…¶æ—ä¸­å¤šæœ‰çœ¾é³¥ï¼Œè“®èŠ±æ—æ± å…·è¶³èŠåš´ã€‚	Having emerged from the pond, they went to the Nandanavana forest, in which there were many birds, lotus ponds and groves, fully adorned.
['ZH_T17_0721_035:0203b13_15']	ç„¡é‡çœ¾é³¥å‡ºå¦™éŸ³è²éæ»¿æ—ä¸­ï¼Œå…¶æ¨¹å¸¸æœ‰ç¨®ç¨®å…‰æ˜ï¼Œå…¶æ—å…·è¶³ç¨®ç¨®åŠŸå¾·ï¼Œçœ¾è“®èŠ±æ± ä»¥ç‚ºèŠåš´ã€‚	ç„¡é‡çœ¾é³¥å‡ºå¦™éŸ³è²éæ»¿æ—ä¸­ï¼Œå…¶æ¨¹å¸¸æœ‰ç¨®ç¨®å…‰æ˜ï¼Œå…¶æ—å…·è¶³ç¨®ç¨®åŠŸå¾·ï¼Œçœ¾è“®èŠ±æ± ä»¥ç‚ºèŠåš´ã€‚	Countless birds emitted wonderful sounds filling the forest. The trees always had various kinds of light. The forest was fully endowed with various merits, adorned with many lotus ponds.
['ZH_T17_0721_035:0203b15_1']	è«¸å¤©çœ¾ç­‰ï¼Œå…¶èº«å…‰æ˜ç¨®ç¨®åŠŸå¾·å…·è¶³å¢ƒç•Œï¼Œå—å¤©å¿«æ¨‚ã€‚	è«¸å¤©çœ¾ç­‰ï¼Œå…¶èº«å…‰æ˜ç¨®ç¨®åŠŸå¾·å…·è¶³å¢ƒç•Œï¼Œå—å¤©å¿«æ¨‚ã€‚	The heavenly multitudes, their bodies with various kinds of light and merits, fully endowed with realms, experienced heavenly bliss.
['ZH_T17_0721_035:0203b16_2']	ã€Œæ„šç™¡å‡¡å¤«ç¬¬ä¸€æ¨‚è€…ï¼Œæ‰€è¬‚å¤©å­å¤©å¥³å¨›æ¨‚å—æ¨‚ã€‚	ã€Œæ„šç™¡å‡¡å¤«ç¬¬ä¸€æ¨‚è€…ï¼Œæ‰€è¬‚å¤©å­å¤©å¥³å¨›æ¨‚å—æ¨‚ã€‚	The first pleasure of foolish ordinary beings is that of heavenly sons and heavenly maidens enjoying and experiencing pleasure together.
['ZH_T17_0721_035:0203b17_8']	æ„šç™¡å‡¡å¤«ç‚ºå©‡å¥³ç¾…ç¶²ä¹‹æ‰€çºç¸›ï¼Œæµè½‰ç”Ÿæ­»ï¼Œäº’ç›¸å¨›æ¨‚ã€‚	æ„šç™¡å‡¡å¤«ç‚ºå©‡å¥³ç¾…ç¶²ä¹‹æ‰€çºç¸›ï¼Œæµè½‰ç”Ÿæ­»ï¼Œäº’ç›¸å¨›æ¨‚ã€‚	Foolish ordinary beings are bound by the net of celestial maidens, transmigrating through birth and death, mutually enjoying each other.
['ZH_T17_0721_035:0203b19_1']	ã€Œä¹…å—æ¨‚å·²ï¼Œå¾©å¾€è©£æ–¼æ‘©å¤šå±±å³¯å®®æ®¿ä¹‹è™•ï¼Œæ˜‡é ˆå½Œå³¯ï¼Œèˆ‡è«¸å¤©å¥³å…±æ˜‡å±±å³¯ã€‚	ã€Œä¹…å—æ¨‚å·²ï¼Œå¾©å¾€è©£æ–¼æ‘©å¤šå±±å³¯å®®æ®¿ä¹‹è™•ï¼Œæ˜‡é ˆå½Œå³¯ï¼Œèˆ‡è«¸å¤©å¥³å…±æ˜‡å±±å³¯ã€‚	After enjoying pleasure for a long time, they again go to the palace on the peak of Mount MÅ«rdhÄna, ascending to the peak of Mount Sumeru, together with the heavenly maidens ascending the mountain peak.
['ZH_T17_0721_035:0203b20_1']	å¾®é¢¨å¹è¡£ï¼Œå¹¡ç„¶éš¨é¢¨ï¼Œçš†å…±ä¸Šæ˜‡æ‘©å¤šå±±å³¯ã€‚	å¾®é¢¨å¹è¡£ï¼Œå¹¡ç„¶éš¨é¢¨ï¼Œçš†å…±ä¸Šæ˜‡æ‘©å¤šå±±å³¯ã€‚	A gentle breeze blows on their clothes, fluttering in the wind, all ascending together to the peak of Mount MÅ«rdhÄna.
['ZH_T17_0721_035:0203b22_1']	çˆ¾æ™‚ï¼Œå¤©å­è¦‹æ­¤å®®æ®¿æ®Šç‰¹å¦™å¥½ï¼Œè“®èŠ±èŠåš´ï¼Œä¸ƒå¯¶å…‰æ˜åš´å¥½å±±å³¯ï¼Œå¦‚å±±åŠŸå¾·å…·è¶³ç›¸æ‡‰ã€‚	çˆ¾æ™‚ï¼Œå¤©å­è¦‹æ­¤å®®æ®¿æ®Šç‰¹å¦™å¥½ï¼Œè“®èŠ±èŠåš´ï¼Œä¸ƒå¯¶å…‰æ˜åš´å¥½å±±å³¯ï¼Œå¦‚å±±åŠŸå¾·å…·è¶³ç›¸æ‡‰ã€‚	At that time, the heavenly sons see this palace, extremely wonderful and marvelous, adorned with lotus flowers, the light of the seven treasures adorning the mountain peak, like the merits and virtues of the mountain fully corresponding.
['ZH_T17_0721_035:0203b23_1']	æ‘©å¤šå±±å³¯å…¶è™•é«˜å³»ï¼Œå¥‡ç‰¹åš´å¥½ï¼Œä¸å¯è­¬å–»ã€‚	æ‘©å¤šå±±å³¯å…¶è™•é«˜å³»ï¼Œå¥‡ç‰¹åš´å¥½ï¼Œä¸å¯è­¬å–»ã€‚	The peak of Mount MÅ«rdhÄna is lofty and steep, extremely wonderful and marvelous, indescribable.
['ZH_T17_0721_035:0203b23_15']	æ–¼æ­¤å³¯ä¸­éŠæˆ²æ­Œèˆï¼Œå¨›æ¨‚å—æ¨‚ã€‚	æ–¼æ­¤å³¯ä¸­éŠæˆ²æ­Œèˆï¼Œå¨›æ¨‚å—æ¨‚ã€‚	In this peak, they play, sing and dance, enjoying and experiencing pleasure.
['ZH_T17_0721_035:0203b24_10']	æ—¢å—æ¨‚å·²ï¼Œè¦‹å¤§å…‰æ˜éå…¶æœ¬ç›¸ã€‚	æ—¢å—æ¨‚å·²ï¼Œè¦‹å¤§å…‰æ˜éå…¶æœ¬ç›¸ã€‚	After enjoying pleasure, they see a great light surpassing their original appearance.
['ZH_T17_0721_035:0203b26_6']	å…¶å±±å³¯ä¸­å…ˆå…·å…‰æ˜çŒ¶å¦‚æ—¥å…‰ï¼Œæ™‚æœ‰ç•°å…‰ä¾†ç…§å±±å³¯ï¼Œå…¶å…‰ç…§å·²ï¼Œéç™¾åƒå€ã€‚	å…¶å±±å³¯ä¸­å…ˆå…·å…‰æ˜çŒ¶å¦‚æ—¥å…‰ï¼Œæ™‚æœ‰ç•°å…‰ä¾†ç…§å±±å³¯ï¼Œå…¶å…‰ç…§å·²ï¼Œéç™¾åƒå€ã€‚	In the mountain peaks, there was already light like sunlight, and then there was a strange light that shone on the mountain peaks, and after the light shone, it was a hundred thousand times brighter.
