segmentnr	original	folio	stemmed
ZH_T41_1822_003:0518c18_8	則皆轉招壽異熟果。	003	則 皆 轉 招 壽 異 熟 果  
ZH_T41_1822_003:0518c19_7	謂是轉現施思之業為所轉業招現命根。	003	謂 是 轉 現 施 思 之 業 為 所 轉 業 招 現 命 根  
ZH_T41_1822_003:0518c20_2	違婆沙四釋及能轉所轉義也。	003	違 婆 沙 四 釋 及 能 轉 所 轉 義 也  
ZH_T41_1822_003:0518c20_13	及違捨壽行文如前已述。	003	及 違 捨 壽 行 文 如 前 已 述  
ZH_T41_1822_003:0518c21_1	亦違自釋。	003	亦 違 自 釋  
ZH_T41_1822_003:0518c21_8	施思既已招命。	003	施 思 既 已 招 命  
ZH_T41_1822_003:0518c22_2	何更用定．願轉　言命是滿。	003	何 更 用 定  願 轉  言 命 是 滿  
ZH_T41_1822_003:0518c22_11	復違婆沙三十一文。	003	復 違 婆 沙 三 十 一 文  
ZH_T41_1822_003:0518c22_18	及正理十六文。	003	及 正 理 十 六 文  
ZH_T41_1822_003:0518c24_5	如後當述　又云命根及同分俱能令六處住時長．短。	003	如 後 當 述  又 云 命 根 及 同 分 俱 能 令 六 處 住 時 長  短  
ZH_T41_1822_003:0518c25_15	不得論意如前已述　問命．及同分誰是引果　答婆沙三十一云。	003	不 得 論 意 如 前 已 述  問 命  及 同 分 誰 是 引 果  答 婆 沙 三 十 一 云  
ZH_T41_1822_003:0519a01_10	復次命根．眾同分是牽引果。	003	復 次 命 根  眾 同 分 是 牽 引 果  
ZH_T41_1822_003:0519a01_17	又正理十六云。	003	又 正 理 十 六 云  
ZH_T41_1822_003:0519a02_11	要意業牽引命．眾同分　又云。	003	要 意 業 牽 引 命  眾 同 分  又 云  
ZH_T41_1822_003:0519a03_7	身．語二業定不能引命．眾同分。	003	身  語 二 業 定 不 能 引 命  眾 同 分  
ZH_T41_1822_003:0519a03_16	不爾便違契經正理。	003	不 爾 便 違 契 經 正 理  
ZH_T41_1822_003:0519a04_7	經言劣界思所引故。	003	經 言 劣 界 思 所 引 故  
ZH_T41_1822_003:0519a05_3	此說欲有命．眾同分　又云。	003	此 說 欲 有 命  眾 同 分  又 云  
ZH_T41_1822_003:0519a07_1	又非次第一一極微牽引命根及眾同分一心起故　正理此文與婆沙三十一同。	003	又 非 次 第 一 一 極 微 牽 引 命 根 及 眾 同 分 一 心 起 故  正 理 此 文 與 婆 沙 三 十 一 同  
ZH_T41_1822_003:0519a07_10	既有正文說命是引。	003	既 有 正 文 說 命 是 引  
ZH_T41_1822_003:0519a07_17	無文說命是滿。	003	無 文 說 命 是 滿  
ZH_T41_1822_003:0519a09_13	不可准義云命滿而違正文　問若爾何故婆沙一百一十四解四業三說。	003	不 可 准 義 云 命 滿 而 違 正 文  問 若爾何故 婆 沙 一 百 一 十 四 解 四 業 三 說  
ZH_T41_1822_003:0519a09_16	一云。	003	一 云  
ZH_T41_1822_003:0519a10_10	生．後二業感眾同分．及滿。	003	生  後 二 業 感 眾 同 分  及 滿  
ZH_T41_1822_003:0519a11_3	現及不定感滿非眾同分。	003	現 及 不 定 感 滿 非 眾 同 分  
ZH_T41_1822_003:0519a11_6	二云。	003	二 云  
ZH_T41_1822_003:0519a11_17	三感眾同分．及滿除現。	003	三 感 眾 同 分  及 滿 除 現  
ZH_T41_1822_003:0519a12_6	現能感滿非眾同分。	003	現 能 感 滿 非 眾 同 分  
ZH_T41_1822_003:0519a12_9	三云。	003	三 云  
ZH_T41_1822_003:0519a13_14	四能感眾同分．及滿　婆沙既對滿說眾同分不言命根。	003	四 能 感 眾 同 分  及 滿  婆 沙 既 對 滿 說 眾 同 分 不 言 命 根  
ZH_T41_1822_003:0519a14_18	故知命唯是滿　答彼文明四業感果引．滿差別。	003	故 知 命 唯 是 滿  答 彼 文 明 四 業 感 果 引  滿 差 別  
ZH_T41_1822_003:0519a15_6	引中舉眾同分。	003	引 中 舉 眾 同 分  
ZH_T41_1822_003:0519a15_11	命可例同。	003	命 可 例 同  
ZH_T41_1822_003:0519a16_11	婆沙三十一正明眾同分．命根是何果故。	003	婆 沙 三 十 一 正 明 眾 同 分  命 根 是 何 果 故  
ZH_T41_1822_003:0519a17_2	具說二種牽引果也。	003	具 說 二 種 牽 引 果 也  
ZH_T41_1822_003:0519a17_9	四業中是准義。	003	四 業 中 是 准 義  
ZH_T41_1822_003:0519a18_1	三十一及正理是正文。	003	三 十 一 及 正 理 是 正 文  
ZH_T41_1822_003:0519a18_11	不可釋正文從准義也。	003	不 可 釋 正 文 從 准 義 也  
ZH_T41_1822_003:0519a18_15	此論云。	003	此 論 云  
ZH_T41_1822_003:0519a19_3	引同分唯三。	003	引 同 分 唯 三  
ZH_T41_1822_003:0519a19_10	即是第二師義。	003	即 是 第 二 師 義  
ZH_T41_1822_003:0519a20_1	由引有命及同分故。	003	由 引 有 命 及 同 分 故  
ZH_T41_1822_003:0519a20_10	言引同分欲簡命根。	003	言 引 同 分 欲 簡 命 根  
ZH_T41_1822_003:0519a20_17	若唯同分是引。	003	若 唯 同 分 是 引  
ZH_T41_1822_003:0519a21_3	但應言引。	003	但 應 言 引  
ZH_T41_1822_003:0519a22_2	何用同分之言　問命及同分俱是引果。	003	何 用 同 分 之 言  問 命 及 同 分 俱 是 引 果  
ZH_T41_1822_003:0519a22_11	何故唯說留捨命行。	003	何 故 唯 說 留 捨 命 行  
ZH_T41_1822_003:0519a23_6	不說留捨同分　答二用別故。	003	不 說 留 捨 同 分  答 二 用 別 故  
ZH_T41_1822_003:0519a23_10	故論云。	003	故 論 云  
ZH_T41_1822_003:0519a24_8	一趣生等諸有情類所有身形諸根業用。	003	一 趣 生 等 諸 有 情 類 所 有 身 形 諸 根 業 用  
ZH_T41_1822_003:0519a24_17	及飲食等互相似因。	003	及 飲 食 等 互 相 似 因  
ZH_T41_1822_003:0519a25_11	并其展轉相樂欲因名眾同分。	003	并 其 展 轉 相 樂 欲 因 名 眾 同 分  
ZH_T41_1822_003:0519a26_12	故有別法能轉煖．識相續住因說名為壽。	003	故 有 別 法 能 轉 煖  識 相 續 住 因 說 名 為 壽  
ZH_T41_1822_003:0519a27_1	又命根增上用。	003	又 命 根 增 上 用  
ZH_T41_1822_003:0519a27_12	謂能令眾同分相續住等。	003	謂 能 令 眾 同 分 相 續 住 等  
ZH_T41_1822_003:0519a28_3	准此故知延．促是命。	003	准 此 故 知 延  促 是 命  
ZH_T41_1822_003:0519a28_10	非是眾同分也。	003	非 是 眾 同 分 也  
ZH_T41_1822_003:0519a28_12	論。	003	論  
ZH_T41_1822_003:0519a29_4	尊者妙音至捨壽行。	003	尊 者 妙 音 至 捨 壽 行  
ZH_T41_1822_003:0519a29_9	如文可解。	003	如 文 可 解  
ZH_T41_1822_003:0519a29_11	論。	003	論  
ZH_T41_1822_003:0519b01_3	應如是說至皆是異熟。	003	應如是說 至 皆 是 異 熟  
ZH_T41_1822_003:0519b01_10	此述論主釋也。	003	此 述 論 主 釋 也  
ZH_T41_1822_003:0519b01_15	如文可解。	003	如 文 可 解  
ZH_T41_1822_003:0519b02_1	正理破云。	003	正 理 破 云  
ZH_T41_1822_003:0519b03_4	而經主言由勝定力引取未曾諸根大種住時勢分。	003	而 經 主 言 由 勝 定 力 引 取 未 曾 諸 根 大 種 住 時 勢 分  
ZH_T41_1822_003:0519b03_13	如此命根非是異熟。	003	如 此 命 根 非 是 異 熟  
ZH_T41_1822_003:0519b04_5	餘是異熟　此言非理。	003	餘 是 異 熟  此 言 非 理  
ZH_T41_1822_003:0519b04_10	所以者何。	003	所以者何  
ZH_T41_1822_003:0519b05_7	且彼唯說諸根大種住時勢分名為命根。	003	且 彼 唯 說 諸 根 大 種 住 時 勢 分 名 為 命 根  
ZH_T41_1822_003:0519b05_12	如後當破。	003	如 後 當 破  
ZH_T41_1822_003:0519b05_17	設許如是。	003	設 許 如 是  
ZH_T41_1822_003:0519b06_7	隨執彼為長養等性。	003	隨 執 彼 為 長 養 等 性  
ZH_T41_1822_003:0519b06_12	皆不應理。	003	皆 不 應 理  
ZH_T41_1822_003:0519b07_4	且不應執是長養性。	003	且 不 應 執 是 長 養 性  
ZH_T41_1822_003:0519b07_13	彼能訪護異熟果故。	003	彼 能 訪 護 異 熟 果 故  
ZH_T41_1822_003:0519b08_4	所防異熟已轉盡故。	003	所 防 異 熟 已 轉 盡 故  
ZH_T41_1822_003:0519b08_17	不應異熟相續斷已獨有長養。	003	不 應 異 熟 相 續 斷 已 獨 有 長 養  
ZH_T41_1822_003:0519b09_4	太過失故。	003	太 過 失 故  
ZH_T41_1822_003:0519b09_13	亦不應執是等流性。	003	亦 不 應 執 是 等 流 性  
ZH_T41_1822_003:0519b10_4	眼等無別等流性故。	003	眼 等 無 別 等 流 性 故  
ZH_T41_1822_003:0519b10_13	無記非善等流果故。	003	無 記 非 善 等 流 果 故  
ZH_T41_1822_003:0519b11_4	又界應成雜亂過故。	003	又 界 應 成 雜 亂 過 故  
ZH_T41_1822_003:0519b11_13	亦不應執是異熟性。	003	亦 不 應 執 是 異 熟 性  
ZH_T41_1822_003:0519b12_4	定非欲界異熟因故。	003	定 非 欲 界 異 熟 因 故  
ZH_T41_1822_003:0519b12_13	又彼自許如是事故。	003	又 彼 自 許 如 是 事 故  
ZH_T41_1822_003:0519b13_4	然其所說迷謬難詳。	003	然 其 所 說 迷 謬 難 詳  
ZH_T41_1822_003:0519b13_9	任更指陳。	003	任 更 指 陳  
ZH_T41_1822_003:0519b14_4	彼名何法而言此命非異熟耶。	003	彼 名 何 法 而 言 此 命 非 異 熟 耶  
ZH_T41_1822_003:0519b14_6	論。	003	論  
ZH_T41_1822_003:0519b15_1	因論生論至二種堪能者。	003	因 論 生 論 至 二 種 堪 能 者  
ZH_T41_1822_003:0519b15_8	釋留壽行所以。	003	釋 留 壽 行 所 以  
ZH_T41_1822_003:0519b15_11	可知。	003	可 知  
ZH_T41_1822_003:0519b15_13	論。	003	論  
ZH_T41_1822_003:0519b16_6	復何因緣至猶如捨眾病。	003	復 何 因 緣 至 猶 如 捨 眾 病  
ZH_T41_1822_003:0519b16_13	釋捨壽行所以。	003	釋 捨 壽 行 所 以  
ZH_T41_1822_003:0519b16_18	如文可解。	003	如 文 可 解  
ZH_T41_1822_003:0519b17_1	論。	003	論  
ZH_T41_1822_003:0519b17_11	此中應知至無煩惱故。	003	此 中 應 知 至 無 煩 惱 故  
ZH_T41_1822_003:0519b18_10	釋留捨壽處．人等也　處唯三洲　趣。	003	釋 留 捨 壽 處  人 等 也  處 唯 三 洲  趣  
ZH_T41_1822_003:0519b18_16	唯是人　依。	003	唯 是 人  依  
ZH_T41_1822_003:0519b19_3	唯男．女　根。	003	唯 男  女  根  
ZH_T41_1822_003:0519b19_9	唯不時解脫。	003	唯 不時解脫  
ZH_T41_1822_003:0519b19_16	慧．俱解脫者。	003	慧  俱 解 脫 者  
ZH_T41_1822_003:0519b20_9	唯俱解脫　得邊際定諸阿羅漢。	003	唯 俱 解 脫  得 邊 際 定 諸 阿 羅 漢  
ZH_T41_1822_003:0519b21_2	辨位　由彼身中有自在定。	003	辨 位  由 彼 身 中 有 自 在 定  
ZH_T41_1822_003:0519b21_11	簡鈍根　無煩惱故。	003	簡 鈍 根  無 煩 惱 故  
ZH_T41_1822_003:0519b21_15	簡有學。	003	簡 有 學  
ZH_T41_1822_003:0519b21_17	論。	003	論  
ZH_T41_1822_003:0519b22_13	經說世尊至由此暫住名為命行。	003	經 說 世 尊 至 由 此 暫 住 名 為 命 行  
ZH_T41_1822_003:0519b23_8	此釋經中壽行命行二名差別。	003	此 釋 經 中 壽 行 命 行 二 名 差 別  
ZH_T41_1822_003:0519b23_13	如文可解。	003	如 文 可 解  
ZH_T41_1822_003:0519b23_15	論。	003	論  
ZH_T41_1822_003:0519b24_8	多言為顯至不應言行。	003	多 言 為 顯 至 不 應 言 行  
ZH_T41_1822_003:0519b24_13	釋多命壽。	003	釋 多 命 壽  
ZH_T41_1822_003:0519b25_5	然有三解　第一解云。	003	然 有 三 解  第 一 解 云  
ZH_T41_1822_003:0519b25_15	此顯命壽留．捨多念。	003	此 顯 命 壽 留  捨 多 念  
ZH_T41_1822_003:0519b26_6	非一剎那有留．捨義故。	003	非 一 剎 那 有 留  捨 義 故  
ZH_T41_1822_003:0519b26_10	婆沙云。	003	婆 沙 云  
ZH_T41_1822_003:0519b27_5	多言顯示所留．所捨非一剎那。	003	多 言 顯 示 所 留  所 捨 非 一 剎 那  
ZH_T41_1822_003:0519b28_10	行言為顯示所留．所捨是無常法　第二有部解云。	003	行 言 為 顯 示 所 留  所 捨 是 無 常 法  第 二 有 部 解 云  
ZH_T41_1822_003:0519b28_13	有說。	003	有 說  
ZH_T41_1822_003:0519b28_18	此多言者。	003	此 多 言 者  
ZH_T41_1822_003:0519b29_15	為遮正量部計有一命壽實體經多時住。	003	為 遮 正 量 部 計 有 一 命 壽 實 體 經 多 時 住  
ZH_T41_1822_003:0519c01_3	初起名生。	003	初 起 名 生  
ZH_T41_1822_003:0519c01_8	終盡名滅。	003	終 盡 名 滅  
ZH_T41_1822_003:0519c01_14	中間名住異。	003	中 間 名 住 異  
ZH_T41_1822_003:0519c02_5	行言為顯留．捨多念。	003	行 言 為 顯 留  捨 多 念  
ZH_T41_1822_003:0519c03_11	命行．壽行念念體別非一命壽經多時住　第三經部師說。	003	命 行  壽 行 念 念 體 別 非 一 命 壽 經 多 時 住  第 三 經 部 師 說  
ZH_T41_1822_003:0519c04_5	多言為顯無一實命壽體。	003	多 言 為 顯 無 一 實 命 壽 體  
ZH_T41_1822_003:0519c04_14	但於五蘊眾多行上。	003	但 於 五 蘊 眾 多 行 上  
ZH_T41_1822_003:0519c05_10	假立如是命．壽二名故說多行。	003	假 立 如 是 命  壽 二 名 故 說 多 行  
ZH_T41_1822_003:0519c05_15	若謂不然。	003	若 謂 不 然  
ZH_T41_1822_003:0519c06_2	不應言行。	003	不 應 言 行  
ZH_T41_1822_003:0519c06_13	但可應言留多命捨多壽。	003	但 可 應 言 留 多 命 捨 多 壽  
ZH_T41_1822_003:0519c07_9	以此行是有為通名非唯命壽。	003	以 此 行 是 有 為 通 名 非 唯 命 壽  
ZH_T41_1822_003:0519c07_11	論。	003	論  
ZH_T41_1822_003:0519c08_4	世尊何故至煩惱魔故。	003	世 尊 何 故 至 煩 惱 魔 故  
ZH_T41_1822_003:0519c08_12	此明世尊留．捨。	003	此 明 世 尊 留  捨  
ZH_T41_1822_003:0519c08_17	如文可解。	003	如 文 可 解  
ZH_T41_1822_003:0519c09_5	婆沙百二十六云。	003	婆 沙 百 二 十 六 云  
ZH_T41_1822_003:0519c09_14	經說世尊留多命行。	003	經 說 世 尊 留 多 命 行  
ZH_T41_1822_003:0519c10_1	捨多壽行。	003	捨 多 壽 行  
ZH_T41_1822_003:0519c10_6	其義云何。	003	其 義 云 何  
ZH_T41_1822_003:0519c10_11	有作是說。	003	有 作 是 說  
ZH_T41_1822_003:0519c11_2	諸佛世尊捨第三分壽。	003	諸佛世尊 捨 第 三 分 壽  
ZH_T41_1822_003:0519c11_7	有作是說。	003	有 作 是 說  
ZH_T41_1822_003:0519c11_17	諸佛世尊捨第五分壽。	003	諸佛世尊 捨 第 五 分 壽  
ZH_T41_1822_003:0519c12_9	若說諸佛捨第三分壽者。	003	若 說 諸 佛 捨 第 三 分 壽 者  
ZH_T41_1822_003:0519c13_8	彼說世尊釋迦牟尼壽量應住一百二十。	003	彼 說 世 尊 釋 迦 牟 尼 壽 量 應 住 一 百 二 十  
ZH_T41_1822_003:0519c13_17	捨後四十但受八十。	003	捨 後 四 十 但 受 八 十  
ZH_T41_1822_003:0519c14_5	問佛出世時。	003	問 佛 出 世 時  
ZH_T41_1822_003:0519c14_14	此洲人壽不過百歲。	003	此 洲 人 壽 不 過 百 歲  
ZH_T41_1822_003:0519c15_8	何故世尊釋迦牟尼壽百二十。	003	何 故 世 尊 釋 迦 牟 尼 壽 百 二 十  
ZH_T41_1822_003:0519c16_7	答如佛色．力．種姓．富貴．徒眾．智見。	003	答 如 佛 色  力  種 姓  富 貴  徒 眾  智 見  
ZH_T41_1822_003:0519c16_12	勝餘有情。	003	勝 餘 有 情  
ZH_T41_1822_003:0519c17_2	壽量亦應過眾人故。	003	壽 量 亦 應 過 眾 人 故  
ZH_T41_1822_003:0519c17_13	若說諸佛捨第五分壽者。	003	若 說 諸 佛 捨 第 五 分 壽 者  
ZH_T41_1822_003:0519c18_12	彼說世尊釋迦牟尼所感壽量應住百年。	003	彼 說 世 尊 釋 迦 牟 尼 所 感 壽 量 應 住 百 年  
ZH_T41_1822_003:0519c19_4	捨後二十但受八十。	003	捨 後 二 十 但 受 八 十  
ZH_T41_1822_003:0519c20_2	問諸佛色．力．種姓．富貴．徒眾．智見。	003	問 諸 佛 色  力  種 姓  富 貴  徒 眾  智 見  
ZH_T41_1822_003:0519c20_7	勝餘有情。	003	勝 餘 有 情  
ZH_T41_1822_003:0519c20_16	何故壽量與眾人等。	003	何 故 壽 量 與 眾 人 等  
ZH_T41_1822_003:0519c21_8	答生在爾所壽量時故。	003	答 生 在 爾 所 壽 量 時 故  
ZH_T41_1822_003:0519c21_17	由此經言捨壽行者。	003	由 此 經 言 捨 壽 行 者  
ZH_T41_1822_003:0519c23_1	謂捨四十或二十歲　正理二十二同婆沙。	003	謂 捨 四 十 或 二 十 歲  正 理 二 十 二 同 婆 沙  
ZH_T41_1822_003:0519c23_3	論。	003	論  
ZH_T41_1822_003:0519c23_13	傍論已竟至皆通二類。	003	傍 論 已 竟 至 皆 通 二 類  
ZH_T41_1822_003:0519c24_5	釋憂根．及信等八根。	003	釋 憂 根  及 信 等 八 根  
ZH_T41_1822_003:0519c24_14	是有記故唯非異熟。	003	是 有 記 故 唯 非 異 熟  
ZH_T41_1822_003:0519c25_6	七色根．意根．除憂四受。	003	七 色 根  意 根  除 憂 四 受  
ZH_T41_1822_003:0519c25_16	十二通異熟．非異熟。	003	十 二 通 異 熟  非 異 熟  
ZH_T41_1822_003:0519c25_18	論。	003	論  
ZH_T41_1822_003:0519c26_9	七有色根至餘皆異熟。	003	七 有 色 根 至 餘 皆 異 熟  
ZH_T41_1822_003:0519c26_12	重釋。	003	重 釋  
ZH_T41_1822_003:0519c26_17	如文可解。	003	如 文 可 解  
ZH_T41_1822_003:0519c27_1	論。	003	論  
ZH_T41_1822_003:0519c27_11	若說憂根至順捨受業。	003	若 說 憂 根 至 順 捨 受 業  
ZH_T41_1822_003:0519c27_14	外難。	003	外 難  
ZH_T41_1822_003:0519c28_2	既有三順受業。	003	既 有 三 順 受 業  
ZH_T41_1822_003:0519c28_10	喜．捨即是異熟。	003	喜  捨 即 是 異 熟  
ZH_T41_1822_003:0519c28_15	故順受業。	003	故 順 受 業  
ZH_T41_1822_003:0519c29_4	亦是順憂異熟業也。	003	亦 是 順 憂 異 熟 業 也  
ZH_T41_1822_003:0519c29_6	論。	003	論  
ZH_T41_1822_003:0519c29_17	依受相應至名順樂受觸。	003	依 受 相 應 至 名 順 樂 受 觸  
ZH_T41_1822_003:0520a01_3	有部通難。	003	有 部 通 難  
ZH_T41_1822_003:0520a01_10	此是相應名順。	003	此 是 相 應 名 順  
ZH_T41_1822_003:0520a01_17	非順異熟果也。	003	非 順 異 熟 果 也  
ZH_T41_1822_003:0520a02_1	論。	003	論  
ZH_T41_1822_003:0520a02_9	若爾至亦應如是。	003	若 爾 至 亦 應 如 是  
ZH_T41_1822_003:0520a02_17	外將喜．捨受例。	003	外 將 喜  捨 受 例  
ZH_T41_1822_003:0520a03_8	亦應唯據相應名順。	003	亦 應 唯 據 相 應 名 順  
ZH_T41_1822_003:0520a03_10	論。	003	論  
ZH_T41_1822_003:0520a04_4	一經說故至理皆無失。	003	一 經 說 故 至 理 皆 無 失  
ZH_T41_1822_003:0520a04_9	有部通也。	003	有 部 通 也  
ZH_T41_1822_003:0520a04_18	言順異熟於我無違。	003	言 順 異 熟 於 我 無 違  
ZH_T41_1822_003:0520a05_10	相應名順亦是於我無違。	003	相 應 名 順 亦 是 於 我 無 違  
ZH_T41_1822_003:0520a05_12	論。	003	論  
ZH_T41_1822_003:0520a06_5	無逃難處至憂非異熟。	003	無 逃 難 處 至 憂 非 異 熟  
ZH_T41_1822_003:0520a06_10	外重徵也。	003	外 重 徵 也  
ZH_T41_1822_003:0520a06_12	論。	003	論  
ZH_T41_1822_003:0520a07_4	以憂分別至異熟不爾。	003	以 憂 分 別 至 異 熟 不 爾  
ZH_T41_1822_003:0520a07_9	有部釋也。	003	有 部 釋 也  
ZH_T41_1822_003:0520a07_11	論。	003	論  
ZH_T41_1822_003:0520a08_5	若爾喜根至生及止息故。	003	若 爾 喜 根 至 生 及 止 息 故  
ZH_T41_1822_003:0520a08_14	外人將喜根例難也。	003	外 人 將 喜 根 例 難 也  
ZH_T41_1822_003:0520a08_16	論。	003	論  
ZH_T41_1822_003:0520a09_8	若許憂根至名果已熟。	003	若 許 憂 根 至 名 果 已 熟  
ZH_T41_1822_003:0520a09_15	有部反難外人。	003	有 部 反 難 外 人  
ZH_T41_1822_003:0520a10_1	論。	003	論  
ZH_T41_1822_003:0520a10_11	亦應如是至名果已熟。	003	亦 應 如 是 至 名 果 已 熟  
ZH_T41_1822_003:0520a11_1	外引喜根例釋。	003	外 引 喜 根 例 釋  
ZH_T41_1822_003:0520a11_3	論。	003	論  
ZH_T41_1822_003:0520a11_13	毘婆沙師至故非異熟。	003	毘婆沙師 至 故 非 異 熟  
ZH_T41_1822_003:0520a12_2	有部引婆沙釋。	003	有 部 引 婆 沙 釋  
ZH_T41_1822_003:0520a12_7	正理論云。	003	正 理 論 云  
ZH_T41_1822_003:0520a12_16	何緣定謂憂非異熟。	003	何 緣 定 謂 憂 非 異 熟  
ZH_T41_1822_003:0520a13_6	此是異熟不應理故。	003	此 是 異 熟 不 應 理 故  
ZH_T41_1822_003:0520a13_11	云何不應。	003	云 何 不 應  
ZH_T41_1822_003:0520a14_2	離欲貪者不隨轉故。	003	離 欲 貪 者 不 隨 轉 故  
ZH_T41_1822_003:0520a14_7	異熟不然。	003	異 熟 不 然  
ZH_T41_1822_003:0520a14_16	設計隨轉應如苦根。	003	設 計 隨 轉 應 如 苦 根  
ZH_T41_1822_003:0520a15_7	阿羅漢等亦可知有。	003	阿 羅 漢 等 亦 可 知 有  
ZH_T41_1822_003:0520a15_12	而實非有。	003	而 實 非 有  
ZH_T41_1822_003:0520a15_17	經所遮故。	003	經 所 遮 故  
ZH_T41_1822_003:0520a16_3	如契經說。	003	如 契 經 說  
ZH_T41_1822_003:0520a16_12	設見大師般涅槃位。	003	設 見 大 師 般 涅 槃 位  
ZH_T41_1822_003:0520a17_3	亦無愁等又無用故。	003	亦 無 愁 等 又 無 用 故  
ZH_T41_1822_003:0520a17_8	善亦不行。	003	善 亦 不 行  
ZH_T41_1822_003:0520a17_17	非能攝益如喜根故。	003	非 能 攝 益 如 喜 根 故  
ZH_T41_1822_003:0520a18_1	論。	003	論  
ZH_T41_1822_003:0520a18_9	若爾至何相知有。	003	若 爾 至 何 相 知 有  
ZH_T41_1822_003:0520a19_1	外人徵喜根有相也。	003	外 人 徵 喜 根 有 相 也  
ZH_T41_1822_003:0520a19_3	論。	003	論  
ZH_T41_1822_003:0520a19_13	隨彼有相至定非異熟。	003	隨 彼 有 相 至 定 非 異 熟  
ZH_T41_1822_003:0520a20_7	此有部釋有喜無憂相也。	003	此 有 部 釋 有 喜 無 憂 相 也  
ZH_T41_1822_003:0520a20_9	論。	003	論  
ZH_T41_1822_003:0520a21_3	眼等八根至是惡異熟。	003	眼 等 八 根 至 是 惡 異 熟  
ZH_T41_1822_003:0520a22_1	此釋異熟諸根於善．惡趣異熟不同。	003	此 釋 異 熟 諸 根 於 善  惡 趣 異 熟 不 同  
ZH_T41_1822_003:0520a22_3	論。	003	論  
ZH_T41_1822_003:0520a22_13	於善趣中至善業引故。	003	於 善 趣 中 至 善 業 引 故  
ZH_T41_1822_003:0520a23_1	此釋伏難。	003	此 釋 伏 難  
ZH_T41_1822_003:0520a23_6	如文可解。	003	如 文 可 解  
ZH_T41_1822_003:0520a24_1	論。	003	論  
ZH_T41_1822_003:0520a24_11	如是已說至幾無異熟。	003	如 是 已 說 至 幾 無 異 熟  
ZH_T41_1822_003:0520a25_7	下一頌第三明有異熟．無異熟門。	003	下 一 頌 第 三 明 有 異 熟  無 異 熟 門  
ZH_T41_1822_003:0520a25_15	論曰至定有異熟。	003	論 曰 至 定 有 異 熟  
ZH_T41_1822_003:0520a26_4	釋頌第一句也。	003	釋 頌 第 一 句 也  
ZH_T41_1822_003:0520a26_6	論。	003	論  
ZH_T41_1822_003:0520a26_15	依唯越義頌說定聲。	003	依 唯 越 義 頌 說 定 聲  
ZH_T41_1822_003:0520a27_3	釋頌定字。	003	釋 頌 定 字  
ZH_T41_1822_003:0520a27_5	論。	003	論  
ZH_T41_1822_003:0520a27_15	謂顯憂根至故越次說。	003	謂 顯 憂 根 至 故 越 次 說  
ZH_T41_1822_003:0520a28_14	釋越次第　先說憂根定有異熟所以。	003	釋 越 次 第  先 說 憂 根 定 有 異 熟 所 以  
ZH_T41_1822_003:0520a29_4	一以唯有異熟。	003	一 以 唯 有 異 熟  
ZH_T41_1822_003:0520a29_11	二以兼具二義。	003	二 以 兼 具 二 義  
ZH_T41_1822_003:0520b01_8	由此二故越次先說憂根定有異熟。	003	由 此 二 故 越 次 先 說 憂 根 定 有 異 熟  
ZH_T41_1822_003:0520b01_10	論。	003	論  
ZH_T41_1822_003:0520b02_3	具二義者至唯散地故。	003	具 二 義 者 至 唯 散 地 故  
ZH_T41_1822_003:0520b02_8	釋二義也。	003	釋 二 義 也  
ZH_T41_1822_003:0520b02_17	唯有異熟有其二義。	003	唯 有 異 熟 有 其 二 義  
ZH_T41_1822_003:0520b03_3	一非無記。	003	一 非 無 記  
ZH_T41_1822_003:0520b03_8	二非無漏。	003	二 非 無 漏  
ZH_T41_1822_003:0520b03_17	憂根具有故先說也。	003	憂 根 具 有 故 先 說 也  
ZH_T41_1822_003:0520b04_1	論。	003	論  
ZH_T41_1822_003:0520b04_11	由此越次至定有異熟。	003	由 此 越 次 至 定 有 異 熟  
ZH_T41_1822_003:0520b05_5	此結先說憂根定有異熟所以。	003	此 結 先 說 憂 根 定 有 異 熟 所 以  
ZH_T41_1822_003:0520b05_7	論。	003	論  
ZH_T41_1822_003:0520b05_17	眼等前八至三無漏故。	003	眼 等 前 八 至 三 無 漏 故  
ZH_T41_1822_003:0520b06_15	釋十一根定無異熟　無異熟有二義。	003	釋 十 一 根 定 無 異 熟  無 異 熟 有 二 義  
ZH_T41_1822_003:0520b07_2	一無記故。	003	一 無 記 故  
ZH_T41_1822_003:0520b07_7	二無漏故。	003	二 無 漏 故  
ZH_T41_1822_003:0520b07_16	眼等八根唯有一義。	003	眼 等 八 根 唯 有 一 義  
ZH_T41_1822_003:0520b08_1	謂無記故。	003	謂 無 記 故  
ZH_T41_1822_003:0520b08_6	無無漏也。	003	無 無 漏 也  
ZH_T41_1822_003:0520b08_15	三無漏根唯有一義。	003	三無漏根 唯 有 一 義  
ZH_T41_1822_003:0520b09_1	謂無漏故。	003	謂 無 漏 故  
ZH_T41_1822_003:0520b09_6	無無記也。	003	無 無 記 也  
ZH_T41_1822_003:0520b09_15	雖有定無異熟之義。	003	雖 有 定 無 異 熟 之 義  
ZH_T41_1822_003:0520b10_2	不兼二故。	003	不 兼 二 故  
ZH_T41_1822_003:0520b10_7	不越次說。	003	不 越 次 說  
ZH_T41_1822_003:0520b10_16	於第二說定無異熟。	003	於 第 二 說 定 無 異 熟  
ZH_T41_1822_003:0520b11_1	論。	003	論  
ZH_T41_1822_003:0520b11_11	餘皆通二至皆通二類。	003	餘 皆 通 二 至 皆 通 二 類  
ZH_T41_1822_003:0520b12_2	准唯有記有漏有異熟。	003	准 唯 有 記 有 漏 有 異 熟  
ZH_T41_1822_003:0520b12_11	唯無記無漏無異熟。	003	唯 無 記 無 漏 無 異 熟  
ZH_T41_1822_003:0520b13_1	釋餘十根通二種也。	003	釋 餘 十 根 通 二 種 也  
ZH_T41_1822_003:0520b13_6	先略後廣。	003	先 略 後 廣  
ZH_T41_1822_003:0520b13_11	此即略也。	003	此 即 略 也  
ZH_T41_1822_003:0520b13_13	論。	003	論  
ZH_T41_1822_003:0520b14_3	意樂喜捨至無異熟。	003	意 樂 喜 捨 至 無 異 熟  
ZH_T41_1822_003:0520b14_14	此釋四根通有漏．無漏。	003	此 釋 四 根 通 有 漏  無 漏  
ZH_T41_1822_003:0520b14_18	通三性。	003	通 三 性  
