segmentnr	original	folio	stemmed
ZH_T16_0656_001:0005a09_2	或時，菩薩復以神足而入三昧，其三昧名號曰普照。	001	或 時  菩 薩 復 以 神 足 而 入 三 昧  其 三 昧 名 號 曰 普 照  
ZH_T16_0656_001:0005a10_5	見於東方江河沙剎諸佛國土，禮事供養不失威儀；	001	見 於 東 方 江 河 沙 剎 諸 佛 國 土  禮 事 供 養 不 失 威 儀  
ZH_T16_0656_001:0005a12_3	如是南方西方北方，各江河沙諸佛國土，悉能供養諸佛世尊，演暢思惟識定瓔珞。	001	如 是 南 方 西 方 北 方  各 江 河 沙 諸 佛 國 土  悉 能 供 養 諸佛世尊  演 暢 思 惟 識 定 瓔 珞  
ZH_T16_0656_001:0005a12_10	「如是，寶王！	001	 如 是  寶 王  
ZH_T16_0656_001:0005a12_19	菩薩入定所感如是。	001	菩 薩 入 定 所 感 如 是  
ZH_T16_0656_001:0005a14_15	且捨十方江河沙剎，一一諸剎滿其中塵，復舉一塵著諸佛剎，斯塵猶盡佛土難量。	001	且 捨 十 方 江 河 沙 剎  一 一 諸 剎 滿 其 中 塵  復 舉 一 塵 著 諸 佛 剎  斯 塵 猶 盡 佛 土 難 量  
ZH_T16_0656_001:0005a22_6	菩薩三昧皆悉覩見一切眾會，亦聞彼佛演說瓔珞神識定意，了諸法本虛寂無主，從初起學乃至道場，思惟發意瓔珞道樹，悉過諸縛婬怒癡病，其心堅固不可移轉，正使天魔將眾億姟，欲來毀壞識定意者，終不為彼之所屈還，不為邪部而見錯悞，意弘如海靡不容受，眾德瓔珞悉為成辦，恒講無常苦空非身，常非有常豈有身耶！	001	菩 薩 三 昧 皆 悉 覩 見 一 切 眾 會  亦 聞 彼 佛 演 說 瓔 珞 神 識 定 意  了 諸 法 本 虛 寂 無 主  從 初 起 學 乃 至 道 場  思 惟 發 意 瓔 珞 道 樹  悉 過 諸 縛 婬 怒 癡 病  其 心 堅 固 不 可 移 轉  正 使 天 魔 將 眾 億 姟  欲 來 毀 壞 識 定 意 者  終 不 為 彼 之 所 屈 還  不 為 邪 部 而 見 錯 悞  意 弘 如 海 靡 不 容 受  眾 德 瓔 珞 悉 為 成 辦  恒 講 無 常 苦 空 非 身  常 非 有 常 豈 有 身 耶  
ZH_T16_0656_001:0005a23_5	諸計常者則離定遠，墮于生死不能自濟。	001	諸 計 常 者 則 離 定 遠  墮 于 生 死 不 能 自 濟  
ZH_T16_0656_001:0005a24_13	「菩薩所修唯務於道，其心恬然永無眾想，不離諸佛所造德業。	001	 菩 薩 所 修 唯 務 於 道  其 心 恬 然 永 無 眾 想  不 離 諸 佛 所 造 德 業  
ZH_T16_0656_001:0005a27_2	意如太山不可移轉，獨步世界而無所畏，以四智辯包納諸法，指示眾生知道慧要，內實質直而無諛諂。	001	意 如 太 山 不 可 移 轉  獨 步 世 界 而 無 所 畏  以 四 智 辯 包 納 諸 法  指 示 眾 生 知 道 慧 要  內 實 質 直 而 無 諛 諂  
ZH_T16_0656_001:0005a27_12	所以然者，用本淨故。	001	所 以 然 者  用 本 淨 故  
ZH_T16_0656_001:0005b01_10	既無眾垢諸冥消索，慧光普照莫不蒙澤，心大弘廣而無邊岸，沐浴意穢令使鮮明，隨世所好悉能成辦，詣佛樹下自修法義。	001	既 無 眾 垢 諸 冥 消 索  慧 光 普 照 莫 不 蒙 澤  心 大 弘 廣 而 無 邊 岸  沐 浴 意 穢 令 使 鮮 明  隨 世 所 好 悉 能 成 辦  詣 佛 樹 下 自 修 法 義  
ZH_T16_0656_001:0005b05_1	於一切法不有狐疑，於諸愍智具足成就，順諸所聞救濟尠知，瓔珞定意拔濟亂者，及諸所習常得寂定，修行賢聖八道之品，立一切人使見正諦，是謂寶王！	001	於一切法 不 有 狐 疑  於 諸 愍 智 具 足 成 就  順 諸 所 聞 救 濟 尠 知  瓔 珞 定 意 拔 濟 亂 者  及 諸 所 習 常 得 寂 定  修 行 賢 聖 八 道 之 品  立 一 切 人 使 見 正 諦  是 謂 寶 王  
ZH_T16_0656_001:0005b05_10	菩薩識定瓔珞之要。	001	菩 薩 識 定 瓔 珞 之 要  
ZH_T16_0656_001:0005b07_2	若有聞持在于懷者，未曾遠離諸佛世尊，得不退轉於無上正真之道。	001	若 有 聞 持 在 于 懷 者  未 曾 遠 離 諸佛世尊  得不退轉 於 無 上 正 真 之 道  
ZH_T16_0656_001:0005b09_1	」佛說是識定瓔珞時，於座上有無量億百千天、龍、鬼神、人與非人，皆發無上正真道意。	001	 佛 說 是 識 定 瓔 珞 時  於 座 上 有 無 量 億 百 千 天  龍  鬼 神  人 與 非 人  皆 發 無 上 正 真 道 意  
ZH_T16_0656_001:0005b09_19	復有異方菩薩六十二千人，得不起法忍。	001	復 有 異 方 菩 薩 六 十 二 千 人  得 不 起 法 忍  
ZH_T16_0656_001:0005b10_17	復有八千清信士女，遠塵離垢得法眼淨；	001	復 有 八 千 清 信 士 女  遠塵離垢 得法眼淨  
ZH_T16_0656_001:0005b11_7	五千比丘漏盡意解；	001	五 千 比 丘 漏 盡 意 解  
ZH_T16_0656_001:0005b11_16	九萬天子離諸貪欲。	001	九 萬 天 子 離 諸 貪 欲  
ZH_T16_0656_001:0005b13_9	3 莊嚴道樹品(一)菩薩瓔珞經莊嚴道樹品第三爾時，世尊告諸賢者：	001	3   莊 嚴 道 樹 品  一  菩 薩 瓔 珞 經 莊 嚴 道 樹 品 第 三 爾 時  世 尊 告 諸 賢 者  
ZH_T16_0656_001:0005b15_11	「吾昔無數阿僧祇劫，積功累行修清淨法，坐臥經行不捨四等，一時、一行、一念之頃修于十法。	001	 吾 昔 無 數 阿僧祇劫  積 功 累 行 修 清 淨 法  坐 臥 經 行 不 捨 四 等  一 時  一 行  一 念 之 頃 修 于 十 法  
ZH_T16_0656_001:0005b15_16	云何為十？	001	云 何 為 十  
ZH_T16_0656_001:0005b19_3	一者、從兜術天降神下生，盡見十方無數佛剎，見諸菩薩一生補處，皆詣道樹修淨瓔珞，當舉右足欲詣道場慈愍眾生，三千大千剎土皆悉震動。	001	一 者  從 兜 術 天 降 神 下 生  盡 見 十 方 無 數 佛 剎  見 諸 菩 薩 一生補處  皆 詣 道 樹 修 淨 瓔 珞  當 舉 右 足 欲 詣 道 場 慈 愍 眾 生  三千大千 剎 土 皆 悉 震 動  
ZH_T16_0656_001:0005b19_8	菩薩自念：	001	菩 薩 自 念  
ZH_T16_0656_001:0005b20_7	『吾昔誓願今日已辦，當壞魔界莊嚴佛土。	001	 吾 昔 誓 願 今 日 已 辦  當 壞 魔 界 莊 嚴 佛 土  
ZH_T16_0656_001:0005b21_9	』是謂菩薩摩訶薩大慈瓔珞進趣道場心不退轉。	001	 是 謂 菩薩摩訶薩 大 慈 瓔 珞 進 趣 道 場 心 不 退 轉  
ZH_T16_0656_001:0005b26_1	「二者、盡見三千大千世界菩薩大士心識所念，又入定意三昧不亂，或見菩薩於空成道，或見閑靜樹下之處，或入水光空界三昧，莊嚴道樹不離大悲，是謂菩薩摩訶薩大悲瓔珞進趣道場心不退轉。	001	 二 者  盡 見 三千大千世界 菩薩大士 心 識 所 念  又 入 定 意 三 昧 不 亂  或 見 菩 薩 於 空 成 道  或 見 閑 靜 樹 下 之 處  或 入 水 光 空 界 三 昧  莊 嚴 道 樹 不 離 大 悲  是 謂 菩薩摩訶薩 大 悲 瓔 珞 進 趣 道 場 心 不 退 轉  
ZH_T16_0656_001:0005c02_2	「三者、菩薩摩訶薩普見三千大千世界，進趣道場不捨喜心，吾今成佛必然不疑，以我法本普潤一切，悉與眾生同黃金色，三十二相八十種好，無央數眾前後圍繞，壞魔羅網成己國土，是謂菩薩摩訶薩修喜瓔珞心不退轉。	001	 三 者  菩薩摩訶薩 普 見 三千大千世界  進 趣 道 場 不 捨 喜 心  吾 今 成 佛 必 然 不 疑  以 我 法 本 普 潤 一 切  悉 與 眾 生 同 黃 金 色  三十二相 八十種好  無 央 數 眾 前 後 圍 繞  壞 魔 羅 網 成 己 國 土  是 謂 菩薩摩訶薩 修 喜 瓔 珞 心 不 退 轉  
ZH_T16_0656_001:0005c06_9	「四者、菩薩摩訶薩欲趣道場詣佛樹下，盡見十方阿僧祇剎，一生補處菩薩大士，盡修護心莊嚴道樹，令無數眾生同己護心，不捨一切瓔珞定意，是謂菩薩摩訶薩進趣道場護心正受心不退轉。	001	 四 者  菩薩摩訶薩 欲 趣 道 場 詣 佛 樹 下  盡 見 十 方 阿 僧 祇 剎  一生補處菩薩 大 士  盡 修 護 心 莊 嚴 道 樹  令 無 數 眾 生 同 己 護 心  不 捨 一 切 瓔 珞 定 意  是 謂 菩薩摩訶薩 進 趣 道 場 護 心 正 受 心 不 退 轉  
ZH_T16_0656_001:0005c10_11	「五者、菩薩摩訶薩復見十方無數剎土，一生補處菩薩大士，皆轉法輪不退轉行，法無言說亦無形貌，一相無相空界無形，空猶無空況有法界，是謂菩薩摩訶薩瓔珞空無無形之法。	001	 五 者  菩薩摩訶薩 復 見 十 方 無 數 剎 土  一生補處菩薩 大 士  皆 轉 法 輪 不 退 轉 行  法 無 言 說 亦 無 形 貌  一相無相 空 界 無 形  空 猶 無 空 況 有 法 界  是 謂 菩薩摩訶薩 瓔 珞 空 無 無 形 之 法  
ZH_T16_0656_001:0005c13_12	「六者、菩薩摩訶薩普觀十方恒沙剎土，通慧眾生諸根淳淑，意向三乘不捨法忍，慈悲喜護行六重法，四無礙慧一向道忍，自知受決。	001	 六 者  菩薩摩訶薩 普 觀 十 方 恒 沙 剎 土  通 慧 眾 生 諸 根 淳 淑  意 向 三 乘 不 捨 法 忍  慈 悲 喜 護 行 六 重 法  四 無 礙 慧 一 向 道 忍  自 知 受 決  
ZH_T16_0656_001:0005c14_16	亦復見他授其決者，或授羅漢辟支佛決，菩薩自念：	001	亦 復 見 他 授 其 決 者  或 授 羅 漢 辟 支 佛 決  菩 薩 自 念  
ZH_T16_0656_001:0005c17_1	『吾從無數阿僧祇劫，捨身受身，皆是幻化非真實法，今得受決，進趣無上正真之道，成最正覺。	001	 吾 從 無 數 阿僧祇劫  捨 身 受 身  皆 是 幻 化 非 真 實 法  今 得 受 決  進 趣 無 上 正 真 之 道  成最正覺  
ZH_T16_0656_001:0005c18_18	』遊空往來無所罣礙，一時、一處得總持定，諸佛所歎苦習盡道，此苦非苦，苦由何生？	001	 遊 空 往 來 無 所 罣 礙  一 時  一 處 得 總 持 定  諸 佛 所 歎 苦 習 盡 道  此 苦 非 苦  苦 由 何 生  
ZH_T16_0656_001:0005c20_13	解苦無苦乃應明慧，習由愛興，愛本無形亦不可見，生本無生，況法有滅？	001	解 苦 無 苦 乃 應 明 慧  習 由 愛 興  愛 本 無 形 亦 不 可 見  生 本 無 生  況 法 有 滅  
ZH_T16_0656_001:0005c22_15	眾生愚惑，從起更樂習是得是，解習無習乃應明慧，諸法無生為磨滅法，盡者無生亦無有盡。	001	眾 生 愚 惑  從 起 更 樂 習 是 得 是  解 習 無 習 乃 應 明 慧  諸 法 無 生 為 磨 滅 法  盡 者 無 生 亦 無 有 盡  
ZH_T16_0656_001:0005c24_12	諸法無盡，眾生愚惑謂盡非盡，於中興想莫貿諸法，盡者實盡，是謂明慧。	001	諸 法 無 盡  眾 生 愚 惑 謂 盡 非 盡  於 中 興 想 莫 貿 諸 法  盡 者 實 盡  是 謂 明 慧  
ZH_T16_0656_001:0005c26_17	道無相貌，非眼境界之所能見，八直平正坦然無礙，是謂明慧，是謂菩薩摩訶薩進趣道樹心不退轉。	001	道 無 相 貌  非 眼 境 界 之 所 能 見  八 直 平 正 坦 然 無 礙  是 謂 明 慧  是 謂 菩薩摩訶薩 進 趣 道 樹 心 不 退 轉  
ZH_T16_0656_001:0006a04_9	「七者、菩薩摩訶薩盡觀三千大千剎土，眾生根源高下大小，或與如來心識同趣，本行共合智無增減，大慈大悲瓔珞其身，布施、持戒、忍辱、精進、禪定、智慧、善權方便，十六妙行百千總持，其心廣大不為褊狹，雖見羅漢辟支佛行，心無染著不從彼受，是謂菩薩摩訶薩莊嚴道樹心不退轉。	001	 七 者  菩薩摩訶薩 盡 觀 三千大千 剎 土  眾 生 根 源 高 下 大 小  或 與 如 來 心 識 同 趣  本 行 共 合 智 無 增 減  大慈大悲 瓔 珞 其 身  布 施  持 戒  忍 辱  精 進  禪 定  智 慧  善權方便  十 六 妙 行 百 千 總 持  其 心 廣 大 不 為 褊 狹  雖 見 羅 漢 辟 支 佛 行  心 無 染 著 不 從 彼 受  是 謂 菩薩摩訶薩 莊 嚴 道 樹 心 不 退 轉  
ZH_T16_0656_001:0006a06_10	「八者、菩薩摩訶薩修行八百總持法門德行法門，菩薩得此法門者，眾行具滿莊嚴道樹。	001	 八 者  菩薩摩訶薩 修 行 八 百 總 持 法 門 德 行 法 門  菩 薩 得 此 法 門 者  眾 行 具 滿 莊 嚴 道 樹  
ZH_T16_0656_001:0006a07_15	復有普忍法門，菩薩得此法門者，普潤一切雨甘露法。	001	復 有 普 忍 法 門  菩 薩 得 此 法 門 者  普 潤 一 切 雨 甘 露 法  
ZH_T16_0656_001:0006a09_1	復有無相法門，菩薩得此法門者，盡入空行不退轉地。	001	復 有 無 相 法 門  菩 薩 得 此 法 門 者  盡 入 空 行 不退轉地  
ZH_T16_0656_001:0006a10_6	復有音響法門，菩薩得此法門者，八等行具不聞異音。	001	復 有 音 響 法 門  菩 薩 得 此 法 門 者  八 等 行 具 不 聞 異 音  
ZH_T16_0656_001:0006a11_11	復有身行法門，菩薩得此法門者，身行清淨不造眾惡。	001	復 有 身 行 法 門  菩 薩 得 此 法 門 者  身 行 清 淨 不 造 眾 惡  
ZH_T16_0656_001:0006a12_15	復有口行法門，菩薩得此法門者，不作四過無他惡行。	001	復 有 口 行 法 門  菩 薩 得 此 法 門 者  不 作 四 過 無 他 惡 行  
ZH_T16_0656_001:0006a14_1	復有意行法門，菩薩得此法門者，意不馳想寂然滅盡。	001	復 有 意 行 法 門  菩 薩 得 此 法 門 者  意 不 馳 想 寂 然 滅 盡  
ZH_T16_0656_001:0006a15_6	復有無念法門，菩薩得此法門者，入滅盡定觀了無形。	001	復 有 無 念 法 門  菩 薩 得 此 法 門 者  入 滅 盡 定 觀 了 無 形  
ZH_T16_0656_001:0006a16_10	復有究竟法門，菩薩得此法門者，從此岸得至彼岸。	001	復 有 究 竟 法 門  菩 薩 得 此 法 門 者  從 此 岸 得 至 彼 岸  
ZH_T16_0656_001:0006a17_15	復有無著法門，菩薩得此法門者，於生死法不起染著。	001	復 有 無 著 法 門  菩 薩 得 此 法 門 者  於 生 死 法 不 起 染 著  
ZH_T16_0656_001:0006a19_2	復有無礙法門，菩薩得此法門者，通達往來不滯生死。	001	復 有 無 礙 法 門  菩 薩 得 此 法 門 者  通 達 往 來 不 滯 生 死  
ZH_T16_0656_001:0006a20_7	復有應聲法門，菩薩得此法門者，隨行進趣不譏彼受。	001	復 有 應 聲 法 門  菩 薩 得 此 法 門 者  隨 行 進 趣 不 譏 彼 受  
ZH_T16_0656_001:0006a21_12	復有神足法門，菩薩得此法門者，變化自由禮事諸佛。	001	復 有 神 足 法 門  菩 薩 得 此 法 門 者  變 化 自 由 禮 事 諸 佛  
ZH_T16_0656_001:0006a22_16	復有清淨法門，菩薩得此法門者，淨於智慧無國土想。	001	復 有 清 淨 法 門  菩 薩 得 此 法 門 者  淨 於 智 慧 無 國 土 想  
ZH_T16_0656_001:0006a24_2	復有空行法門，菩薩得此法門者，解知諸法虛偽不真。	001	復 有 空 行 法 門  菩 薩 得 此 法 門 者  解 知 諸 法 虛 偽 不 真  
ZH_T16_0656_001:0006a25_11	復有幻化法門，菩薩得此法門者，觀了眾生權詐合數不可摸像。	001	復 有 幻 化 法 門  菩 薩 得 此 法 門 者  觀 了 眾 生 權 詐 合 數 不 可 摸 像  
ZH_T16_0656_001:0006a26_16	復有無形法門，菩薩得此法門者，眾生根原不可究盡。	001	復 有 無 形 法 門  菩 薩 得 此 法 門 者  眾 生 根 原 不 可 究 盡  
ZH_T16_0656_001:0006a28_3	復有道種法門，菩薩得此法門者，修三十七道品不斷。	001	復 有 道 種 法 門  菩 薩 得 此 法 門 者  修 三十七道品 不 斷  
ZH_T16_0656_001:0006a29_7	復有意止法門，菩薩得此法門者，觀內外身念念不斷。	001	復 有 意 止 法 門  菩 薩 得 此 法 門 者  觀 內 外 身 念 念 不 斷  
ZH_T16_0656_001:0006b01_12	復有意斷法門，菩薩得此法門者，觀察諸法無若干想。	001	復 有 意 斷 法 門  菩 薩 得 此 法 門 者  觀 察 諸 法 無 若 干 想  
ZH_T16_0656_001:0006b02_16	復有神足法門，菩薩得此法門者，住壽無數阿僧祇劫。	001	復 有 神 足 法 門  菩 薩 得 此 法 門 者  住 壽 無 數 阿僧祇劫  
ZH_T16_0656_001:0006b04_2	復有諸根法門，菩薩得此法門者，道慧甚深牢固無礙。	001	復 有 諸 根 法 門  菩 薩 得 此 法 門 者  道 慧 甚 深 牢 固 無 礙  
ZH_T16_0656_001:0006b05_7	復有神力法門，菩薩得此法門者，安處諸法不可沮壞。	001	復 有 神 力 法 門  菩 薩 得 此 法 門 者  安 處 諸 法 不 可 沮 壞  
ZH_T16_0656_001:0006b06_16	復有覺意法門，菩薩得此法門者，以覺意華不為塵垢之所污染。	001	復 有 覺 意 法 門  菩 薩 得 此 法 門 者  以 覺 意 華 不 為 塵 垢 之 所 污 染  
ZH_T16_0656_001:0006b08_2	復有道品法門，菩薩得此法門者，入定無礙心不錯亂。	001	復 有 道 品 法 門  菩 薩 得 此 法 門 者  入 定 無 礙 心 不 錯 亂  
ZH_T16_0656_001:0006b09_7	復有空慧法門，菩薩得此法門者，安處眾生永離欲怒。	001	復 有 空 慧 法 門  菩 薩 得 此 法 門 者  安 處 眾 生 永 離 欲 怒  
ZH_T16_0656_001:0006b10_12	復有無相法門，菩薩得此法門者，使眾生類懷來道故。	001	復 有 無 相 法 門  菩 薩 得 此 法 門 者  使 眾 生 類 懷 來 道 故  
ZH_T16_0656_001:0006b11_16	復有無願法門，菩薩得此法門者，教化眾生除去願求；	001	復 有 無 願 法 門  菩 薩 得 此 法 門 者  教 化 眾 生 除 去 願 求  
ZH_T16_0656_001:0006b13_13	是謂菩薩摩訶薩八百總持，略說其要，進趣道場莊嚴佛樹，心如金剛不可沮壞。	001	是 謂 菩薩摩訶薩 八 百 總 持  略 說 其 要  進 趣 道 場 莊 嚴 佛 樹  心如金剛 不 可 沮 壞  
ZH_T16_0656_001:0006b19_8	「九者、菩薩摩訶薩觀此三千大千世界，一足、二足、三足、四足至無數足，有愛欲心、無愛欲心、有瞋恚心、無瞋恚心、有愚癡心、無愚癡心、有苦樂心、無苦樂心，一時一起一念之頃皆能分別，為說苦空無我人想，是謂菩薩摩訶薩行無想定進趣道場莊嚴佛樹。	001	 九 者  菩薩摩訶薩 觀 此 三千大千世界  一 足  二 足  三 足  四 足 至 無 數 足  有 愛 欲 心  無 愛 欲 心  有瞋恚心  無 瞋 恚 心  有 愚 癡 心  無 愚 癡 心  有 苦 樂 心  無 苦 樂 心  一 時 一 起 一 念 之 頃 皆 能 分 別  為 說 苦 空 無 我 人 想  是 謂 菩薩摩訶薩 行 無 想 定 進 趣 道 場 莊 嚴 佛 樹  
ZH_T16_0656_001:0006b22_7	「十者、菩薩摩訶薩復觀三千大千世界，當來過去現在之心諸根寂靜，行應無上正真之道，是謂菩薩摩訶薩進趣道場莊嚴佛樹。	001	 十 者  菩薩摩訶薩 復 觀 三千大千世界  當 來 過去現在 之 心 諸 根 寂 靜  行 應 無 上 正 真 之 道  是 謂 菩薩摩訶薩 進 趣 道 場 莊 嚴 佛 樹  
ZH_T16_0656_001:0006b22_15	」佛復告族姓子：	001	 佛 復 告 族 姓 子  
ZH_T16_0656_001:0006b24_8	「菩薩摩訶薩初舉右足行第一步，於其中間修行十法，進趣道場莊嚴佛樹。	001	 菩薩摩訶薩 初 舉 右 足 行 第 一 步  於其中間 修 行 十 法  進 趣 道 場 莊 嚴 佛 樹  
ZH_T16_0656_001:0006b24_13	云何為十？	001	云 何 為 十  
ZH_T16_0656_001:0006b27_1	一者、菩薩摩訶薩當舉右足蹈地之時，自稱名號，三界至尊，過佛恒沙皆行七步，當來諸佛亦皆當然。	001	一 者  菩薩摩訶薩 當 舉 右 足 蹈 地 之 時  自 稱 名 號  三 界 至 尊  過 佛 恒 沙 皆 行 七 步  當 來 諸 佛 亦 皆 當 然  
ZH_T16_0656_001:0006b29_6	吾今現在出現於世，三界獨尊亦無等侶，諸佛標式不可漏脫，是謂菩薩摩訶薩進趣道場莊嚴佛樹。	001	吾 今 現 在 出 現 於 世  三 界 獨 尊 亦 無 等 侶  諸 佛 標 式 不 可 漏 脫  是 謂 菩薩摩訶薩 進 趣 道 場 莊 嚴 佛 樹  
ZH_T16_0656_001:0006c01_6	「復次，菩薩當舉右足蹈地之時，便作是念：	001	 復 次  菩 薩 當 舉 右 足 蹈 地 之 時  便 作 是 念  
ZH_T16_0656_001:0006c02_14	『吾今已逮不退轉地，亦使眾生同我所趣，不捨弘誓廣大之心。	001	 吾 今 已 逮 不退轉地  亦 使 眾 生 同 我 所 趣  不 捨 弘 誓 廣 大 之 心  
ZH_T16_0656_001:0006c03_11	』是謂菩薩摩訶薩莊嚴佛樹進至道場。	001	 是 謂 菩薩摩訶薩 莊 嚴 佛 樹 進 至 道 場  
ZH_T16_0656_001:0006c04_11	「復次，菩薩初舉右足蹈地之時，復作是念：	001	 復 次  菩 薩 初 舉 右 足 蹈 地 之 時  復 作 是 念  
ZH_T16_0656_001:0006c06_1	『過去諸佛，先行是法，當觀一生補處菩薩，紹吾處者名號是誰？	001	 過去諸佛  先 行 是 法  當 觀 一生補處菩薩  紹 吾 處 者 名 號 是 誰  
ZH_T16_0656_001:0006c06_11	』即自右旋顧謂彌勒：	001	 即 自 右 旋 顧 謂 彌 勒  
ZH_T16_0656_001:0006c07_17	『卿後如我成佛不久，百千天人聞皆欣然，異嚮同音稱善無量。	001	 卿 後 如 我 成 佛 不 久  百 千 天 人 聞 皆 欣 然  異 嚮 同 音 稱 善 無 量  
ZH_T16_0656_001:0006c08_1	快哉！	001	快 哉  
ZH_T16_0656_001:0006c08_4	世雄！	001	世 雄  
ZH_T16_0656_001:0006c08_9	佛種不斷。	001	佛 種 不 斷  
ZH_T16_0656_001:0006c10_15	』當於爾時，十一那術諸天、人民見授彌勒印封，皆發無上正真之道，是謂菩薩摩訶薩莊嚴佛樹進至道場。	001	 當 於 爾 時  十 一 那 術 諸 天  人 民 見 授 彌 勒 印 封  皆 發 無 上 正 真 之 道  是 謂 菩薩摩訶薩 莊 嚴 佛 樹 進 至 道 場  
ZH_T16_0656_001:0006c11_15	「復次，菩薩初舉右足蹈地之時，便作是念：	001	 復 次  菩 薩 初 舉 右 足 蹈 地 之 時  便 作 是 念  
ZH_T16_0656_001:0006c13_13	『吾今已逮眾智自在，神慧無礙辯才通達，斯等眾生久抱狐疑，沒溺塵垢不求度脫。	001	 吾 今 已 逮 眾 智 自 在  神 慧 無 礙 辯 才 通 達  斯 等 眾 生 久 抱 狐 疑  沒 溺 塵 垢 不 求 度 脫  
ZH_T16_0656_001:0006c14_12	吾今當以智慧之火，焚燒心中狐疑之叢。	001	吾 今 當 以 智 慧 之 火  焚 燒 心 中 狐 疑 之 叢  
ZH_T16_0656_001:0006c15_9	』是謂菩薩摩訶薩莊嚴佛樹進趣道場。	001	 是 謂 菩薩摩訶薩 莊 嚴 佛 樹 進 趣 道 場  
ZH_T16_0656_001:0006c16_9	「復次，菩薩初舉右足蹈地之時，便復念言：	001	 復 次  菩 薩 初 舉 右 足 蹈 地 之 時  便 復 念 言  
ZH_T16_0656_001:0006c18_15	『吾今已得無為解脫，當復接度有為解脫，過去恒沙諸佛世尊皆悉同我無為解脫，當來諸佛亦獲此法。	001	 吾 今 已 得 無 為 解 脫  當 復 接 度 有 為 解 脫  過 去 恒 沙 諸佛世尊 皆 悉 同 我 無 為 解 脫  當 來 諸 佛 亦 獲 此 法  
ZH_T16_0656_001:0006c18_18	快哉！	001	快 哉  
ZH_T16_0656_001:0006c19_14	福報不有斷滅，妄想已盡無所貪求。	001	福 報 不 有 斷 滅  妄 想 已 盡 無 所 貪 求  
ZH_T16_0656_001:0006c20_11	』是謂菩薩摩訶薩進趣道場莊嚴佛樹。	001	 是 謂 菩薩摩訶薩 進 趣 道 場 莊 嚴 佛 樹  
ZH_T16_0656_001:0006c21_14	「復次，菩薩摩訶薩初舉右足蹈地之時，復生此心：	001	 復 次  菩薩摩訶薩 初 舉 右 足 蹈 地 之 時  復 生 此 心  
ZH_T16_0656_001:0006c22_13	『眾生永處邪見顛倒，不覩三向空無之慧。	001	 眾 生 永 處 邪 見 顛 倒  不 覩 三 向 空 無 之 慧  
ZH_T16_0656_001:0006c25_1	我今當演護心清淨，無覺無觀法性虛寂，知慚知愧眾行之本，苦空非身無人無壽，當以此心普覆一切。	001	我 今 當 演 護 心 清 淨  無 覺 無 觀 法 性 虛 寂  知 慚 知 愧 眾 行 之 本  苦 空 非 身 無 人 無 壽  當 以 此 心 普 覆 一 切  
ZH_T16_0656_001:0006c25_18	』是謂菩薩摩訶薩進趣道場莊嚴佛樹。	001	 是 謂 菩薩摩訶薩 進 趣 道 場 莊 嚴 佛 樹  
ZH_T16_0656_001:0006c28_1	「復次，菩薩初舉右足欲趣浴池，琉璃水精七寶園觀，鳧鴈鴛鴦異類奇鳥，諸天導從不可稱量。	001	 復 次  菩 薩 初 舉 右 足 欲 趣 浴 池  琉 璃 水 精 七 寶 園 觀  鳧 鴈 鴛 鴦 異 類 奇 鳥  諸 天 導 從 不可稱量  
ZH_T16_0656_001:0006c29_17	『我今露形乃非其宜，設當入城村落人眾，謂為裸形不知慚恥，宜求袈裟以障于體。	001	 我 今 露 形 乃 非 其 宜  設 當 入 城 村 落 人 眾  謂 為 裸 形 不 知 慚 恥  宜 求 袈 裟 以 障 于 體  
ZH_T16_0656_001:0007a02_10	』時有天子名曰福蓋，即知菩薩心中所念，尋奉八萬四千金縷織成袈裟。	001	 時 有 天 子 名 曰 福 蓋  即 知 菩 薩 心 中 所 念  尋 奉 八萬四千 金 縷 織 成 袈 裟  
ZH_T16_0656_001:0007a02_15	菩薩自念：	001	菩 薩 自 念  
ZH_T16_0656_001:0007a03_5	『過去諸佛法服云何？	001	 過去諸佛 法 服 云 何  
ZH_T16_0656_001:0007a03_14	進趣行來斯用何法？	001	進 趣 行 來 斯 用 何 法  
ZH_T16_0656_001:0007a04_4	』虛空神天叉手白言：	001	 虛 空 神 天 叉 手 白 言  
ZH_T16_0656_001:0007a05_7	『過去諸佛皆著織成金縷袈裟，亦如今日諸天所獻。	001	 過去諸佛 皆 著 織 成 金 縷 袈 裟  亦 如 今 日 諸 天 所 獻  
ZH_T16_0656_001:0007a06_13	』菩薩即受八萬四千織成金縷袈裟，以道神力而合為一。	001	 菩 薩 即 受 八萬四千 織 成 金 縷 袈 裟  以 道 神 力 而 合 為 一  
ZH_T16_0656_001:0007a09_4	袈裟著體，三十二相八十種好盡皆外現，斯由曩昔施無想報行度無施，是謂菩薩摩訶薩進趣道場莊嚴佛樹。	001	袈 裟 著 體  三十二相 八十種好 盡 皆 外 現  斯 由 曩 昔 施 無 想 報 行 度 無 施  是 謂 菩薩摩訶薩 進 趣 道 場 莊 嚴 佛 樹  
ZH_T16_0656_001:0007a09_20	「復次，菩薩舉右足時，便生此心：	001	 復 次  菩 薩 舉 右 足 時  便 生 此 心  
ZH_T16_0656_001:0007a10_7	『眾生若干性行不同。	001	 眾 生 若 干 性 行 不 同  
