segmentnr	original	folio	stemmed
ZH_T16_0656_001:0007a11_6	吾今當以智慧光明，普照三千大千世界。	001	吾 今 當 以 智慧光明  普 照 三千大千世界  
ZH_T16_0656_001:0007a12_3	』即放頂相光明，普照十方諸佛剎土。	001	 即 放 頂 相 光 明  普 照 十方諸佛 剎 土  
ZH_T16_0656_001:0007a13_11	眾生之類見光明者，悉來雲集詣忍世界，奉事如來香華供養。	001	眾 生 之 類 見 光 明 者  悉 來 雲 集 詣 忍 世 界  奉 事 如 來 香 華 供 養  
ZH_T16_0656_001:0007a15_3	威神所感，使令天地六返震動，是謂菩薩摩訶薩進趣道場莊嚴佛樹。	001	威 神 所 感  使 令 天 地 六 返 震 動  是 謂 菩薩摩訶薩 進 趣 道 場 莊 嚴 佛 樹  
ZH_T16_0656_001:0007a15_19	「復次，菩薩當舉足時，心自生念：	001	 復 次  菩 薩 當 舉 足 時  心 自 生 念  
ZH_T16_0656_001:0007a17_16	『生分已盡更不受胎，三界獨尊無有疇匹，當號為佛、如來、至真、等正覺，十號具足。	001	 生 分 已 盡 更 不 受 胎  三 界 獨 尊 無 有 疇 匹  當 號 為 佛  如 來  至 真  等 正 覺  十 號 具 足  
ZH_T16_0656_001:0007a20_2	』十方剎土諸佛世尊，各各於其國土，告四部眾、天、龍、鬼神、乾沓和、阿須倫、迦留羅、緊陀羅、摩休勒、人與非人：	001	 十 方 剎 土 諸佛世尊  各 各 於 其 國 土  告 四 部 眾  天  龍  鬼 神  乾 沓 和  阿 須 倫  迦 留 羅  緊 陀 羅  摩 休 勒  人 與 非 人  
ZH_T16_0656_001:0007a22_10	『今日忍界釋迦文佛出現于世，眾相具足如星中月，福度眾生天人蒙祐，有欲興敬供養彼佛，宜知是時。	001	 今 日 忍 界 釋 迦 文 佛 出 現 于 世  眾 相 具 足 如 星 中 月  福 度 眾 生 天 人 蒙 祐  有 欲 興 敬 供 養 彼 佛  宜知是時  
ZH_T16_0656_001:0007a25_4	』爾時，十方諸佛世界神通菩薩辯才具足，得總持門，千七百七十七億那術眾，皆來雲集詣此忍界，興致供養華至于膝。	001	 爾 時  十方諸佛 世 界 神 通 菩 薩 辯 才 具 足  得 總 持 門  千 七 百 七 十 七 億 那 術 眾  皆 來 雲 集 詣 此 忍 界  興 致 供 養 華 至 于 膝  
ZH_T16_0656_001:0007a26_10	復有八十萬姟天魔波旬，皆詣忍界，興致供養給事菩薩。	001	復 有 八 十 萬 姟 天 魔 波 旬  皆 詣 忍 界  興 致 供 養 給 事 菩 薩  
ZH_T16_0656_001:0007a27_16	復有百千億姟神力龍王，各各七首，獻奉香湯浴洗菩薩。	001	復 有 百 千 億 姟 神 力 龍 王  各 各 七 首  獻 奉 香 湯 浴 洗 菩 薩  
ZH_T16_0656_001:0007a29_8	斯由曩昔口演甘露無厭足法，是謂菩薩摩訶薩進趣道場莊嚴佛樹。	001	斯 由 曩 昔 口 演 甘 露 無 厭 足 法  是 謂 菩薩摩訶薩 進 趣 道 場 莊 嚴 佛 樹  
ZH_T16_0656_001:0007a29_19	「復次，菩薩內自生念：	001	 復 次  菩 薩 內 自 生 念  
ZH_T16_0656_001:0007b02_7	『眾生著有迷惑來久，設聞空無虛寂之法，意懷恐懼衣毛為竪。	001	 眾 生 著 有 迷 惑 來 久  設 聞 空 無 虛 寂 之 法  意 懷 恐 懼 衣 毛 為 竪  
ZH_T16_0656_001:0007b05_15	佛法深奧不可思議，漸當以次說道根原，分別眾生根原所由，玄鑒三世生法滅法，除去想著無貪悋心，從無數劫積行已來，所以不得道者皆由恩愛。	001	佛 法 深 奧 不可思議  漸 當 以 次 說 道 根 原  分 別 眾 生 根 原 所 由  玄 鑒 三 世 生 法 滅 法  除 去 想 著 無 貪 悋 心  從 無 數 劫 積 行 已 來  所 以 不 得 道 者 皆 由 恩 愛  
ZH_T16_0656_001:0007b06_14	吾今當除恩愛刺本，拔濟眾生安處無為。	001	吾 今 當 除 恩 愛 刺 本  拔 濟 眾 生 安 處 無 為  
ZH_T16_0656_001:0007b07_11	』是謂菩薩摩訶薩進趣道場莊嚴佛樹。	001	 是 謂 菩薩摩訶薩 進 趣 道 場 莊 嚴 佛 樹  
ZH_T16_0656_001:0007b07_19	「如是，族姓子！	001	 如 是  族 姓 子  
ZH_T16_0656_001:0007b09_12	菩薩大士降神出生、墮地舉右足，於其中間思惟十法，莊嚴道樹亦不退轉。	001	菩薩大士 降 神 出 生  墮 地 舉 右 足  於其中間 思 惟 十 法  莊 嚴 道 樹 亦 不 退 轉  
ZH_T16_0656_001:0007b09_20	「復次，族姓子！	001	 復 次  族 姓 子  
ZH_T16_0656_001:0007b11_4	菩薩初生時，墮地行七步欲趣金机，次舉左足內自思惟：	001	菩 薩 初 生 時  墮 地 行 七 步 欲 趣 金 机  次 舉 左 足 內 自 思 惟  
ZH_T16_0656_001:0007b13_7	『諸佛世尊句義無量道法淳粹，應度無極無起滅法，行無生滅不可思議，非是羅漢辟支所及。	001	 諸佛世尊 句 義 無 量 道 法 淳 粹  應 度 無 極 無 起 滅 法  行 無 生 滅 不可思議  非 是 羅 漢 辟 支 所 及  
ZH_T16_0656_001:0007b15_5	道當一意多念非道，道當少欲多欲非道，道當知足多求非道，道當正見邪見非道。	001	道 當 一 意 多 念 非 道  道 當 少 欲 多 欲 非 道  道 當 知 足 多 求 非 道  道 當 正見邪見 非 道  
ZH_T16_0656_001:0007b15_16	』是時，菩薩復作是念：	001	 是 時  菩 薩 復 作 是 念  
ZH_T16_0656_001:0007b16_9	『過去諸佛所行正法，為何謂耶？	001	 過去諸佛 所 行 正 法  為 何 謂 耶  
ZH_T16_0656_001:0007b16_15	』復作是念：	001	 復 作 是 念  
ZH_T16_0656_001:0007b18_6	『過去恒沙諸佛世尊出現於世，以神足力現身威德，十根本義不可思議。	001	 過 去 恒 沙 諸佛世尊 出 現 於 世  以 神 足 力 現 身 威 德  十 根 本 義 不可思議  
ZH_T16_0656_001:0007b18_11	云何為十？	001	云 何 為 十  
ZH_T16_0656_001:0007b18_19	』於是，族姓子！	001	 於 是  族 姓 子  
ZH_T16_0656_001:0007b22_10	菩薩達士先舉左足，遍滿三千虛空境界，不嬈眾生無覺知者，其有眾生覩足相輪，皆發無上正真道意，斯由曩昔禮敬之報，是謂菩薩摩訶薩進趣道場莊嚴佛樹。	001	菩 薩 達 士 先 舉 左 足  遍 滿 三 千 虛 空 境 界  不 嬈 眾 生 無 覺 知 者  其 有 眾 生 覩 足 相 輪  皆 發 無 上 正 真 道 意  斯 由 曩 昔 禮 敬 之 報  是 謂 菩薩摩訶薩 進 趣 道 場 莊 嚴 佛 樹  
ZH_T16_0656_001:0007b22_18	「復次，族姓子！	001	 復 次  族 姓 子  
ZH_T16_0656_001:0007b23_11	爾時，菩薩左足蹈地，心自生念：	001	爾 時  菩 薩 左 足 蹈 地  心 自 生 念  
ZH_T16_0656_001:0007b24_8	『古昔諸佛說法，云何分別句身義味？	001	 古 昔 諸 佛 說 法  云 何 分 別 句 身 義 味  
ZH_T16_0656_001:0007b27_1	云何過去諸佛世尊進止行來威儀法則，以一句義演出無量諸佛法藏，從劫至劫乃至百劫，不能究盡一句之義？	001	云 何 過去諸佛 世 尊 進 止 行 來 威 儀 法 則  以 一 句 義 演 出 無 量 諸 佛 法 藏  從 劫 至 劫 乃 至 百 劫  不 能 究 盡 一 句 之 義  
ZH_T16_0656_001:0007b27_19	如來祕要不可思議，非是小節所能測度。	001	如 來 祕 要 不可思議  非 是 小 節 所 能 測 度  
ZH_T16_0656_001:0007b28_15	』是謂菩薩摩訶薩進趣道場莊嚴佛樹。	001	 是 謂 菩薩摩訶薩 進 趣 道 場 莊 嚴 佛 樹  
ZH_T16_0656_001:0007b29_4	」佛復告族姓子：	001	 佛 復 告 族 姓 子  
ZH_T16_0656_001:0007c01_5	「菩薩爾時放一毛孔光明，遍照無量諸佛剎土。	001	 菩 薩 爾 時 放 一 毛 孔 光 明  遍 照 無 量 諸 佛 剎 土  
ZH_T16_0656_001:0007c04_2	於光明中，演說六度平等大法、空無想願不起法忍，亦使眾生畢志堅固，皆發無上正真道意，是謂菩薩進趣道場莊嚴佛樹。	001	於 光 明 中  演 說 六 度 平 等 大 法  空 無 想 願 不 起 法 忍  亦 使 眾 生 畢 志 堅 固  皆 發 無 上 正 真 道 意  是 謂 菩 薩 進 趣 道 場 莊 嚴 佛 樹  
ZH_T16_0656_001:0007c04_10	「復次，族姓子！	001	 復 次  族 姓 子  
ZH_T16_0656_001:0007c04_20	菩薩爾時，內自思惟：	001	菩 薩 爾 時  內 自 思 惟  
ZH_T16_0656_001:0007c05_16	『吾今當以三昧正受，普遊虛空諸佛法界。	001	 吾 今 當 以 三 昧 正 受  普 遊 虛 空 諸 佛 法 界  
ZH_T16_0656_001:0007c09_1	』爾時，菩薩即入無形想定意，遍遊虛空諸佛法界，左右翼從，天世人民莫覺知者，謂為菩薩進趣金机，是謂菩薩摩訶薩進趣道場莊嚴佛樹。	001	 爾 時  菩 薩 即 入 無 形 想 定 意  遍 遊 虛 空 諸 佛 法 界  左 右 翼 從  天 世 人 民 莫 覺 知 者  謂 為 菩 薩 進 趣 金 机  是 謂 菩薩摩訶薩 進 趣 道 場 莊 嚴 佛 樹  
ZH_T16_0656_001:0007c09_9	「復次，族姓子！	001	 復 次  族 姓 子  
ZH_T16_0656_001:0007c11_10	即化一形，遍滿三千大千世界，復還如故，眾生之類無覺知者，是謂菩薩進趣道場莊嚴佛樹。	001	即 化 一 形  遍 滿 三千大千世界  復 還 如 故  眾 生 之 類 無 覺 知 者  是 謂 菩 薩 進 趣 道 場 莊 嚴 佛 樹  
ZH_T16_0656_001:0007c11_18	「復次，族姓子！	001	 復 次  族 姓 子  
ZH_T16_0656_001:0007c13_6	菩薩爾時，慧明之光遍照三千大千剎土，一一光中皆出音聲：	001	菩 薩 爾 時  慧 明 之 光 遍 照 三千大千 剎 土  一 一 光 中 皆 出 音 聲  
ZH_T16_0656_001:0007c15_7	『今日釋迦文佛、如來、至真、等正覺，於閻浮利地，當轉法輪度未度者，福利眾生名稱遠布。	001	 今 日 釋 迦 文 佛  如 來  至 真  等 正 覺  於 閻 浮 利 地  當 轉 法 輪 度 未 度 者  福 利 眾 生 名 稱 遠 布  
ZH_T16_0656_001:0007c16_2	』是謂菩薩進趣道場莊嚴佛樹。	001	 是 謂 菩 薩 進 趣 道 場 莊 嚴 佛 樹  
ZH_T16_0656_001:0007c16_10	「復次，族姓子！	001	 復 次  族 姓 子  
ZH_T16_0656_001:0007c19_1	菩薩爾時一念之頃，令十方界諸佛世尊，各各舒手扶接菩薩，一切眾會皆悉見之，是謂菩薩進趣道場莊嚴佛樹。	001	菩 薩 爾 時 一 念 之 頃  令 十 方 界 諸佛世尊  各 各 舒 手 扶 接 菩 薩  一 切 眾 會 皆 悉 見 之  是 謂 菩 薩 進 趣 道 場 莊 嚴 佛 樹  
ZH_T16_0656_001:0007c19_9	「復次，族姓子！	001	 復 次  族 姓 子  
ZH_T16_0656_001:0007c22_3	諸佛法藏深奧難測，吾當以次布現三乘緣覺聲聞菩薩之道，聞法覺寤終不中滯，是謂菩薩摩訶薩進趣道場莊嚴佛樹。	001	諸 佛 法 藏 深 奧 難 測  吾 當 以 次 布 現 三 乘 緣 覺 聲 聞 菩薩之道  聞 法 覺 寤 終 不 中 滯  是 謂 菩薩摩訶薩 進 趣 道 場 莊 嚴 佛 樹  
ZH_T16_0656_001:0007c22_11	「復次，族姓子！	001	 復 次  族 姓 子  
ZH_T16_0656_001:0007c23_16	過去三世諸佛世尊，吾今欲成無為大道，皆當證明令我成道。	001	過 去 三世諸佛 世 尊  吾 今 欲 成 無 為 大 道  皆 當 證 明 令 我 成 道  
ZH_T16_0656_001:0007c24_6	諸佛稱善皆在前立：	001	諸 佛 稱 善 皆 在 前 立  
ZH_T16_0656_001:0007c26_6	『汝從阿僧祇劫，苦行無數，布施持戒六度具足，國財妻子無所悋惜，今當成佛廣度眾生。	001	 汝 從 阿僧祇劫  苦 行 無 數  布 施 持 戒 六 度 具 足  國 財 妻 子 無 所 悋 惜  今 當 成 佛 廣 度 眾 生  
ZH_T16_0656_001:0007c27_1	我等扶接上至成佛不使中住。	001	我 等 扶 接 上 至 成 佛 不 使 中 住  
ZH_T16_0656_001:0007c27_18	』是謂菩薩摩訶薩進趣道場莊嚴佛樹。	001	 是 謂 菩薩摩訶薩 進 趣 道 場 莊 嚴 佛 樹  
ZH_T16_0656_001:0007c28_5	「復次，族姓子！	001	 復 次  族 姓 子  
ZH_T16_0656_001:0007c29_10	菩薩分別過去現在未來，空無想願，亦是諸佛所應行法。	001	菩 薩 分 別 過去現在未來  空 無 想 願  亦 是 諸 佛 所 應 行 法  
ZH_T16_0656_001:0008a03_1	從初發意乃至成佛，要當修習三向諸道、四等大慈、八無礙道，瓔珞其身，是謂菩薩摩訶薩進趣道場莊嚴佛樹。	001	從 初 發 意 乃至成佛  要 當 修 習 三 向 諸 道  四 等 大 慈  八 無 礙 道  瓔 珞 其 身  是 謂 菩薩摩訶薩 進 趣 道 場 莊 嚴 佛 樹  
ZH_T16_0656_001:0008a03_9	」佛復告族姓子：	001	 佛 復 告 族 姓 子  
ZH_T16_0656_001:0008a04_12	「菩薩次舉右足當蹈地時，當具足此神足十慧不可思議。	001	 菩 薩 次 舉 右 足 當 蹈 地 時  當 具 足 此 神 足 十 慧 不可思議  
ZH_T16_0656_001:0008a04_17	云何為十？	001	云 何 為 十  
ZH_T16_0656_001:0008a07_2	有神足慧名曰無著，菩薩得此慧者，盡遊諸佛深要法藏，是謂菩薩摩訶薩進趣道場莊嚴佛樹。	001	有 神 足 慧 名 曰 無 著  菩 薩 得 此 慧 者  盡 遊 諸 佛 深 要 法 藏  是 謂 菩薩摩訶薩 進 趣 道 場 莊 嚴 佛 樹  
ZH_T16_0656_001:0008a08_14	「復有神慧名曰無形，菩薩得此神慧者，入無厭定意，諮受十方諸佛言教。	001	 復 有 神 慧 名 曰 無 形  菩 薩 得 此 神 慧 者  入 無 厭 定 意  諮 受 十方諸佛 言 教  
ZH_T16_0656_001:0008a10_12	「復有無二神慧，菩薩得此神慧者，勸進眾生成無上等正覺，不取聲聞辟支佛道。	001	 復 有 無 二 神 慧  菩 薩 得 此 神 慧 者  勸 進 眾 生 成 無 上 等 正 覺  不 取 聲 聞 辟支佛道  
ZH_T16_0656_001:0008a11_18	「復有虛空神慧，菩薩得此神慧者，盡觀世界空無我人。	001	 復 有 虛 空 神 慧  菩 薩 得 此 神 慧 者  盡 觀 世 界 空 無 我 人  
ZH_T16_0656_001:0008a13_14	「復有無相神慧，菩薩得此神慧者，演暢諸法解一相無相，亦無生滅著斷之法。	001	 復 有 無 相 神 慧  菩 薩 得 此 神 慧 者  演 暢 諸 法 解 一相無相  亦 無 生 滅 著 斷 之 法  
ZH_T16_0656_001:0008a15_7	「復有空觀神慧，菩薩得此神慧者，見諸佛土成者敗者，如觀掌珠。	001	 復 有 空 觀 神 慧  菩 薩 得 此 神 慧 者  見 諸 佛 土 成 者 敗 者  如 觀 掌 珠  
ZH_T16_0656_001:0008a16_13	「復有棄壽神慧，菩薩得此神慧者，觀壽緣報捨形受形。	001	 復 有 棄 壽 神 慧  菩 薩 得 此 神 慧 者  觀 壽 緣 報 捨 形 受 形  
ZH_T16_0656_001:0008a18_3	「復有無言說神慧，菩薩得此神慧者，說法無法想，亦無若干念。	001	 復 有 無 言 說 神 慧  菩 薩 得 此 神 慧 者  說 法 無 法 想  亦 無 若 干 念  
ZH_T16_0656_001:0008a19_8	「復有無近遠神慧，菩薩得此神慧者，不見諸法窠窟遠近。	001	 復 有 無 近 遠 神 慧  菩 薩 得 此 神 慧 者  不 見 諸 法 窠 窟 遠 近  
ZH_T16_0656_001:0008a22_6	「復有無生滅神慧，菩薩得此神慧者，分別十二因緣根本，生者滅者悉無所有，是謂菩薩摩訶薩十神足慧進趣道場莊嚴佛樹。	001	 復 有 無 生 滅 神 慧  菩 薩 得 此 神 慧 者  分 別 十二因緣 根 本  生 者 滅 者 悉 無 所 有  是 謂 菩薩摩訶薩 十 神 足 慧 進 趣 道 場 莊 嚴 佛 樹  
ZH_T16_0656_001:0008a22_14	」佛復告族姓子：	001	 佛 復 告 族 姓 子  
ZH_T16_0656_001:0008a23_14	「菩薩初生舉左足時，復當具足十業無量究竟。	001	 菩 薩 初 生 舉 左 足 時  復 當 具 足 十 業 無 量 究 竟  
ZH_T16_0656_001:0008a24_1	云何為十？	001	云 何 為 十  
ZH_T16_0656_001:0008a24_8	於是，族姓子！	001	於 是  族 姓 子  
ZH_T16_0656_001:0008a27_12	諸佛如來之所修行，如來降形出世教化，分別三世十二牽連，三界五道塵垢縛著，沐浴諸結永無塵曀，是謂菩薩修第一業進趣道場莊嚴佛樹。	001	諸佛如來 之 所 修 行  如 來 降 形 出 世 教 化  分 別 三 世 十 二 牽 連  三 界 五 道 塵 垢 縛 著  沐 浴 諸 結 永 無 塵 曀  是 謂 菩 薩 修 第 一 業 進 趣 道 場 莊 嚴 佛 樹  
ZH_T16_0656_001:0008a27_20	「復次，族姓子！	001	 復 次  族 姓 子  
ZH_T16_0656_001:0008a28_17	如來出世化諸眾生，安處三乘隨其所願；	001	如 來 出 世 化 諸 眾 生  安 處 三 乘 隨 其 所 願  
ZH_T16_0656_001:0008a29_12	或有眾生，意趣羅漢不向佛門；	001	或 有 眾 生  意 趣 羅 漢 不 向 佛 門  
ZH_T16_0656_001:0008b01_7	或有眾生，習緣覺行不趣佛道；	001	或 有 眾 生  習 緣 覺 行 不 趣 佛 道  
ZH_T16_0656_001:0008b02_7	或有眾生，修無上道，不向聲聞緣覺辟支；	001	或 有 眾 生  修 無 上 道  不 向 聲 聞 緣 覺 辟 支  
ZH_T16_0656_001:0008b03_2	或有眾生，退於佛道志慕小乘。	001	或 有 眾 生  退 於 佛 道 志 慕 小 乘  
ZH_T16_0656_001:0008b04_19	「爾時，菩薩誘進前人，逮成無上正真之道。	001	 爾 時  菩 薩 誘 進 前 人  逮 成 無 上 正 真 之 道  
ZH_T16_0656_001:0008b07_6	或有眾生，在凡夫地不求方便上及三乘，菩薩勸進成三乘道，是謂菩薩第二之業進趣道場莊嚴佛樹。	001	或 有 眾 生  在 凡 夫 地 不 求 方 便 上 及 三 乘  菩 薩 勸 進 成 三 乘 道  是 謂 菩 薩 第 二 之 業 進 趣 道 場 莊 嚴 佛 樹  
ZH_T16_0656_001:0008b08_14	「如來出世布現言教，以權方便適化眾生，荷負重擔為人重任。	001	 如 來 出 世 布 現 言 教  以 權 方 便 適 化 眾 生  荷 負 重 擔 為 人 重 任  
ZH_T16_0656_001:0008b12_7	或與眾生現作父母兄弟朋友，或現國師尊長道士，或現大富長者、神力鬼王，周給貧困惠施七寶，開說道教成三乘果，是謂菩薩修習三業進趣道場莊嚴佛樹。	001	或 與 眾 生 現 作 父 母 兄 弟 朋 友  或 現 國 師 尊 長 道 士  或 現 大 富 長 者  神 力 鬼 王  周 給 貧 困 惠 施 七 寶  開 說 道 教 成 三 乘 果  是 謂 菩 薩 修 習 三 業 進 趣 道 場 莊 嚴 佛 樹  
ZH_T16_0656_001:0008b14_2	「如來出世轉無上法輪，不失四辯，觀察人心授十善行，分別演暢苦習盡道。	001	 如 來 出 世 轉 無上法輪  不 失 四 辯  觀 察 人 心 授 十 善 行  分 別 演 暢 苦 習 盡 道  
ZH_T16_0656_001:0008b15_18	或生迷惑沒溺三界，行權拔濟永離生死，是謂菩薩修第四業進趣道場莊嚴佛樹。	001	或 生 迷 惑 沒 溺 三 界  行 權 拔 濟 永 離 生 死  是 謂 菩 薩 修 第 四 業 進 趣 道 場 莊 嚴 佛 樹  
ZH_T16_0656_001:0008b17_7	「如來世尊出現於世，恒以大悲加被眾生，如母愛子心不捨離。	001	 如 來 世 尊 出 現 於 世  恒 以 大 悲 加 被 眾 生  如 母 愛 子 心 不 捨 離  
ZH_T16_0656_001:0008b23_7	譬如龍王伊羅鉢多羅，住於須彌金福山邊七寶宮殿，與諸龍女共相娛樂，若欲往至忉利天宮興致供養，化身七萬由延三十二頭，一一頭者邊有七牙，一一牙上有寶浴池，一一池中生七百蓮華，一一蓮華七百玉女，共相娛樂作倡伎樂，彈琴鼓瑟音聲不絕。	001	譬 如 龍 王 伊 羅 鉢 多 羅  住 於 須 彌 金 福 山 邊 七 寶 宮 殿  與 諸 龍 女 共 相 娛 樂  若 欲 往 至 忉 利 天 宮 興 致 供 養  化 身 七 萬 由 延 三 十 二 頭  一 一 頭 者 邊 有 七 牙  一 一 牙 上 有 寶 浴 池  一 一 池 中 生 七 百 蓮 華  一 一 蓮 華 七 百 玉 女  共 相 娛 樂 作 倡 伎 樂  彈 琴 鼓 瑟 音 聲 不 絕  
ZH_T16_0656_001:0008b26_12	復雨七寶乃至于膝，菩薩大士亦復如是，以四等心加被眾生，雨七覺意無窮法財，隨其志趣皆成道果，是謂菩薩修第五業進趣道場莊嚴佛樹。	001	復 雨 七 寶 乃 至 于 膝  菩薩大士 亦復如是  以 四 等 心 加 被 眾 生  雨 七 覺 意 無 窮 法 財  隨 其 志 趣 皆 成 道 果  是 謂 菩 薩 修 第 五 業 進 趣 道 場 莊 嚴 佛 樹  
ZH_T16_0656_001:0008c01_12	「如來世尊以權方便隨時適化，可行知行可坐知坐、可言知言可默知默，遍入眾生心識所念，隨病療救不使增減，普令永處無為之岸，是謂菩薩修第六業進趣道場莊嚴佛樹。	001	 如 來 世 尊 以 權 方 便 隨 時 適 化  可 行 知 行 可 坐 知 坐  可 言 知 言 可 默 知 默  遍 入 眾 生 心 識 所 念  隨 病 療 救 不 使 增 減  普 令 永 處 無 為 之 岸  是 謂 菩 薩 修 第 六 業 進 趣 道 場 莊 嚴 佛 樹  
ZH_T16_0656_001:0008c01_20	「復次，族姓子！	001	 復 次  族 姓 子  
ZH_T16_0656_001:0008c05_2	如來出世，化導眾生不自為身，為一人故經百千劫，代彼受苦不懷厭惓，安處佛慧成無上道，是謂菩薩修第七業進趣道場莊嚴佛樹。	001	如 來 出 世  化 導 眾 生 不 自 為 身  為 一 人 故 經 百 千 劫  代 彼 受 苦 不 懷 厭 惓  安 處 佛 慧 成 無 上 道  是 謂 菩 薩 修 第 七 業 進 趣 道 場 莊 嚴 佛 樹  
ZH_T16_0656_001:0008c08_3	「諸佛興出不壞法界，法性自爾亦非自爾，如爾真際亦不有壞非不有壞，修而不懼亦不恐畏，是謂菩薩修第八業進趣道場莊嚴佛樹。	001	 諸 佛 興 出 不 壞 法 界  法性自爾 亦 非 自 爾  如 爾 真 際 亦 不 有 壞 非 不 有 壞  修 而 不 懼 亦 不 恐 畏  是 謂 菩 薩 修 第 八 業 進 趣 道 場 莊 嚴 佛 樹  
ZH_T16_0656_001:0008c11_10	「如來出世，當復具足一相無相，彈指之頃於過去未來現在法中，出生三世諸佛世尊，實而不異亦不變易，是謂菩薩修第九業進趣道場莊嚴佛樹。	001	 如 來 出 世  當 復 具 足 一相無相  彈 指 之 頃 於 過去未來現在 法 中  出 生 三世諸佛 世 尊  實 而 不 異 亦 不 變 易  是 謂 菩 薩 修 第 九 業 進 趣 道 場 莊 嚴 佛 樹  
ZH_T16_0656_001:0008c14_10	「如來出世慈愍眾生，以一日之數令三世為一劫，其中眾生無覺知者，是謂菩薩初生墮地舉左足修行十業進趣道場莊嚴佛樹。	001	 如 來 出 世 慈 愍 眾 生  以 一 日 之 數 令 三 世 為 一 劫  其 中 眾 生 無 覺 知 者  是 謂 菩 薩 初 生 墮 地 舉 左 足 修 行 十 業 進 趣 道 場 莊 嚴 佛 樹  
ZH_T16_0656_001:0008c14_18	」佛復告族姓子：	001	 佛 復 告 族 姓 子  
ZH_T16_0656_001:0008c17_12	「菩薩初生墮地七步，於其中間復當思惟十法，降伏外道壞魔羅網，諸天侍衛，進趣道場莊嚴佛樹，乃至滅度終不捨離。	001	 菩 薩 初 生 墮 地 七 步  於其中間 復 當 思 惟 十 法  降 伏 外 道 壞 魔 羅 網  諸 天 侍 衛  進 趣 道 場 莊 嚴 佛 樹  乃 至 滅 度 終 不 捨 離  
ZH_T16_0656_001:0008c17_17	云何為十？	001	云 何 為 十  
ZH_T16_0656_001:0008c20_7	於是族姓子，先當降魔，身被慈仁之鎧，手執慧劍，善權前導，頭戴無畏華鬘，摧却憍慢之眾，永除貢高。	001	於 是 族 姓 子  先 當 降 魔  身 被 慈 仁 之 鎧  手 執 慧 劍  善 權 前 導  頭 戴 無 畏 華 鬘  摧 却 憍 慢 之 眾  永 除 貢 高  
ZH_T16_0656_001:0008c20_14	是謂，族姓子！	001	是 謂  族 姓 子  
ZH_T16_0656_001:0008c21_5	先當修此第一難得之法。	001	先 當 修 此 第 一 難 得 之 法  
ZH_T16_0656_001:0008c21_13	「復次，族姓子！	001	 復 次  族 姓 子  
ZH_T16_0656_001:0008c24_3	復當思惟玄妙廣義，斷漏取證，攝彼外道而為上首，加以神足神力無量，設彼現一，我當現二，趣使邪部安處正見。	001	復 當 思 惟 玄 妙 廣 義  斷 漏 取 證  攝 彼 外 道 而 為 上 首  加 以 神 足 神 力 無 量  設 彼 現 一  我 當 現 二  趣 使 邪 部 安 處 正 見  
ZH_T16_0656_001:0008c24_10	是謂，族姓子！	001	是 謂  族 姓 子  
ZH_T16_0656_001:0008c25_3	菩薩當念修此第二難得之法。	001	菩 薩 當 念 修 此 第 二 難 得 之 法  
ZH_T16_0656_001:0008c25_11	「復次，族姓子！	001	 復 次  族 姓 子  
ZH_T16_0656_001:0008c27_6	菩薩大士化度眾生，受法歡喜，必至堅固不趣餘道，是謂菩薩修行第三難得之法。	001	菩薩大士 化 度 眾 生  受 法 歡 喜  必 至 堅 固 不 趣 餘 道  是 謂 菩薩修行 第 三 難 得 之 法  
ZH_T16_0656_001:0008c27_14	「復次，族姓子！	001	 復 次  族 姓 子  
ZH_T16_0656_001:0009a01_8	諸佛世尊恒所行法，日夜四時觀察眾生，彈指之頃周遍十方恒沙剎土，周而復始不著三界，是謂菩薩修行第四難得之法。	001	諸佛世尊 恒 所 行 法  日 夜 四 時 觀 察 眾 生  彈 指 之 頃 周 遍 十 方 恒 沙 剎 土  周 而 復 始 不著三界  是 謂 菩薩修行 第 四 難 得 之 法  
ZH_T16_0656_001:0009a01_16	「復次，族姓子！	001	 復 次  族 姓 子  
ZH_T16_0656_001:0009a03_11	行無礙智，遍滿三千大千世界，雖度眾生不見有度，是謂菩薩修習第五難得之法。	001	行 無 礙 智  遍 滿 三千大千世界  雖 度 眾 生 不 見 有 度  是 謂 菩 薩 修 習 第 五 難 得 之 法  
ZH_T16_0656_001:0009a03_19	「復次，族姓子！	001	 復 次  族 姓 子  
ZH_T16_0656_001:0009a06_19	菩薩大士以神足力，遍遊十方恒沙剎土，遍觀眾生心識所念，或以一身化百千身還合為一，無覺知者，是謂菩薩修行第六難得之法。	001	菩薩大士 以 神 足 力  遍 遊 十 方 恒 沙 剎 土  遍 觀 眾 生 心 識 所 念  或 以 一 身 化 百 千 身 還 合 為 一  無 覺 知 者  是 謂 菩薩修行 第 六 難 得 之 法  
ZH_T16_0656_001:0009a07_7	「復次，族姓子！	001	 復 次  族 姓 子  
ZH_T16_0656_001:0009a09_14	菩薩思惟四無礙慧，亦非羅漢辟支所修，亦非天龍鬼神八部之眾所能及逮，是謂菩薩修行第七難得之法。	001	菩 薩 思 惟 四 無 礙 慧  亦 非 羅 漢 辟 支 所 修  亦 非 天 龍 鬼 神 八 部 之 眾 所 能 及 逮  是 謂 菩薩修行 第 七 難 得 之 法  
