segmentnr	original	folio	stemmed
ZH_T16_0656_001:0003a05_10	復知神通所及得其報應，以其天眼便得徹視，皆由修奉施行禁戒，恒順正見無所毀犯。	001	復 知 神 通 所 及 得 其 報 應  以 其 天 眼 便 得 徹 視  皆 由 修 奉 施 行 禁 戒  恒 順 正 見 無 所 毀 犯  
ZH_T16_0656_001:0003a07_16	修法瓔珞致天耳聽，念行勸助因發道意，或復成就識念神通，憶過去世皆悉自然，為生類故積功累德。	001	修 法 瓔 珞 致 天 耳 聽  念 行 勸 助 因 發 道 意  或 復 成 就 識 念 神 通  憶 過 去 世 皆 悉 自 然  為 生 類 故 積功累德  
ZH_T16_0656_001:0003a09_18	每自剋責不及彼證，懷來神通變化無極，捨諸識著思惟禪定平等無二，斯解因緣報應之果。	001	每 自 剋 責 不 及 彼 證  懷 來 神通變化 無 極  捨 諸 識 著 思 惟 禪 定 平 等 無 二  斯 解 因 緣 報 應 之 果  
ZH_T16_0656_001:0003a13_5	以慧神通消滅眾垢，因其三昧究暢聖法而不二入，盡諸有漏不失道意使人修德，加慕世俗布施之德，雖有施恩不望其報，令無數人喜樂務法。	001	以 慧 神 通 消 滅 眾 垢  因 其 三 昧 究 暢 聖 法 而 不 二 入  盡 諸 有 漏 不 失 道 意 使 人 修 德  加 慕 世 俗 布 施 之 德  雖 有 施 恩 不 望 其 報  令 無 數 人 喜 樂 務 法  
ZH_T16_0656_001:0003a15_3	能知一切靡不通暢，能使奉行菩薩之法，皆由精進不興懈怠，慈愍護彼一切成就。	001	能 知 一 切 靡 不 通 暢  能 使 奉 行 菩 薩 之 法  皆 由 精 進 不 興 懈 怠  慈 愍 護 彼 一切成就  
ZH_T16_0656_001:0003a17_19	用眾生故不惜身命，不貪己身珍寶之貨，所生之處因奉道義，前人所求亦無疑難，聞慧信施不有猶豫，所行言教悉共信用。	001	用 眾 生 故 不惜身命  不 貪 己 身 珍 寶 之 貨  所 生 之 處 因 奉 道 義  前 人 所 求 亦 無 疑 難  聞 慧 信 施 不 有 猶 豫  所 行 言 教 悉 共 信 用  
ZH_T16_0656_001:0003a23_10	「如來至真無所罣礙，所行寂靜亦無放逸，堅固忍辱而樂閑居，復化眾生自責不及，禪思脫門正受不亂，恒遊神通以自娛樂，復以無極光明之勳，適時隨宜分別一切章句義理，消滅諸患無所藏匿，恒常一心開道聖慧，示無數人報應之果。	001	 如 來 至 真 無 所 罣 礙  所 行 寂 靜 亦 無 放 逸  堅 固 忍 辱 而 樂 閑 居  復 化 眾 生 自 責 不 及  禪 思 脫 門 正 受 不 亂  恒 遊 神 通 以 自 娛 樂  復 以 無 極 光 明 之 勳  適 時 隨 宜 分 別 一 切 章 句 義 理  消 滅 諸 患 無 所 藏 匿  恒 常 一 心 開 道 聖 慧  示 無 數 人 報 應 之 果  
ZH_T16_0656_001:0003a25_13	眾德具足，以勇猛力不為所侵，解了三世都無所有，去來今事無有增損，然後乃應智度無極。	001	眾 德 具 足  以 勇 猛 力 不 為 所 侵  解 了 三 世 都無所有  去 來 今 事 無 有 增 損  然 後 乃 應 智 度 無 極  
ZH_T16_0656_001:0003a27_2	以能布施自發道意，欲使眾生一切普安，自散諸結不患己身。	001	以 能 布 施 自 發 道 意  欲 使 眾 生 一 切 普 安  自 散 諸 結 不 患 己 身  
ZH_T16_0656_001:0003a29_4	若人杖捶悉以能忍，亦化他人令行忍辱，具眾德本加以專心，修諸佛教勸諸生類出家學道。	001	若 人 杖 捶 悉 以 能 忍  亦 化 他 人 令 行 忍 辱  具 眾 德 本 加 以 專 心  修 諸 佛 教 勸 諸 生 類 出家學道  
ZH_T16_0656_001:0003b01_3	自觀惡露萬物不淨，輒厭惡趣功勳究竟。	001	自 觀 惡 露 萬 物 不 淨  輒 厭 惡 趣 功 勳 究 竟  
ZH_T16_0656_001:0003b02_12	所行善業其心悅豫，智慧深達而不懷恨，篤信禁戒自致善德。	001	所 行 善 業 其 心 悅 豫  智 慧 深 達 而 不 懷 恨  篤 信 禁 戒 自 致 善 德  
ZH_T16_0656_001:0003b04_19	復以和心慚愧不惑，常御神志不執麁獷，思惟地獄湯火痛苦，歎天受福無極之樂，寂然無憂無復貪欲。	001	復 以 和 心 慚 愧 不 惑  常 御 神 志 不 執 麁 獷  思 惟 地 獄 湯 火 痛 苦  歎 天 受 福 無 極 之 樂  寂 然 無 憂 無 復 貪 欲  
ZH_T16_0656_001:0003b08_2	有所惠施自去三想，心不猗內不受外塵，修行道法眾望休息，分別智慧自悟其心，空無想願建立脫門，除去顛倒無所傷害，是謂普照！	001	有 所 惠 施 自 去 三 想  心 不 猗 內 不 受 外 塵  修 行 道 法 眾 望 休 息  分 別 智 慧 自 悟 其 心  空 無 想 願 建 立 脫 門  除 去 顛 倒 無 所 傷 害  是 謂 普 照  
ZH_T16_0656_001:0003b08_11	菩薩瓔珞心無所著。	001	菩 薩 瓔 珞 心無所著  
ZH_T16_0656_001:0003b09_16	「其意平等空無不遍，不懷妄想，布施以備，調意安庠。	001	 其 意 平 等 空 無 不 遍  不 懷 妄 想  布 施 以 備  調 意 安 庠  
ZH_T16_0656_001:0003b10_14	為人說法不離空義，慈哀一切行不漏失。	001	為 人 說 法 不 離 空 義  慈 哀 一 切 行 不 漏 失  
ZH_T16_0656_001:0003b11_13	觀其眾生所受法識，知其志性而開化之。	001	觀 其 眾 生 所 受 法 識  知 其 志 性 而 開 化 之  
ZH_T16_0656_001:0003b12_12	在所遊處導為一切，遵修聖明而現道義。	001	在 所 遊 處 導 為 一 切  遵 修 聖 明 而 現 道 義  
ZH_T16_0656_001:0003b15_8	無極大哀開度餘人，亦以善權方便之力，入諸外道異學之中，隨彼法則順從祠祀，觀其志趣使得度脫，令諸梵志興福無量。	001	無 極 大 哀 開 度 餘 人  亦 以 善權方便 之 力  入 諸 外 道 異 學 之 中  隨 彼 法 則 順 從 祠 祀  觀 其 志 趣 使 得 度 脫  令 諸 梵 志 興 福 無 量  
ZH_T16_0656_001:0003b18_15	或在惡部盜賊之中，將導牽致而顯其行，緣此化度無數眾生，於往古世功德已備，見皆喜悅莫不恭恪，為雨甘露道法之味，除去眾生瞋恨之結。	001	或 在 惡 部 盜 賊 之 中  將 導 牽 致 而 顯 其 行  緣 此 化 度 無 數 眾 生  於 往 古 世 功 德 已 備  見 皆 喜 悅 莫 不 恭 恪  為 雨 甘 露 道 法 之 味  除 去 眾 生 瞋 恨 之 結  
ZH_T16_0656_001:0003b20_14	若復前人以若干惱而來犯之，不以厭患，而為頒示寂然之法，知其所興非真非實。	001	若 復 前 人 以 若 干 惱 而 來 犯 之  不 以 厭 患  而 為 頒 示 寂 然 之 法  知 其 所 興 非 真 非 實  
ZH_T16_0656_001:0003b21_1	「如是，普照！	001	 如 是  普 照  
ZH_T16_0656_001:0003b22_17	菩薩所修心意瓔珞，而遊其中常樂於此，不見所樂樂無所樂，以真法性而娛樂之。	001	菩 薩 所 修 心 意 瓔 珞  而 遊 其 中 常 樂 於 此  不 見 所 樂 樂 無 所 樂  以 真 法 性 而 娛 樂 之  
ZH_T16_0656_001:0003b24_6	明知眾生根本所趣，救濟使度無眾塵勞，危害之患永使無餘。	001	明 知 眾 生 根 本 所 趣  救 濟 使 度 無 眾 塵 勞  危 害 之 患 永 使 無 餘  
ZH_T16_0656_001:0003b25_14	執御其心平等如空，分別四大所興起滅，欲化眾生而訓誨之。	001	執 御 其 心 平 等 如 空  分 別 四 大 所 興 起 滅  欲 化 眾 生 而 訓 誨 之  
ZH_T16_0656_001:0003b27_3	所說真正無有憎愛，降棄一切邪見之心，堅心瓔珞堅固之幢。	001	所 說 真 正 無 有 憎 愛  降 棄 一 切 邪 見 之 心  堅 心 瓔 珞 堅 固 之 幢  
ZH_T16_0656_001:0003b28_11	若干法品而與共戰，猶如勇猛大軍之將，降伏外敵使入法律。	001	若 干 法 品 而 與 共 戰  猶 如 勇 猛 大 軍 之 將  降 伏 外 敵 使 入 法 律  
ZH_T16_0656_001:0003c01_8	若入習俗施設法教，施便受報持戒生天，所造之德皆有報應，以此濟之令至無為。	001	若 入 習 俗 施 設 法 教  施 便 受 報 持 戒 生 天  所 造 之 德 皆 有 報 應  以 此 濟 之 令 至 無 為  
ZH_T16_0656_001:0003c02_16	夫為菩薩自順瓔珞，心初未曾隨惡友語，然後乃全大士之行。	001	夫 為 菩 薩 自 順 瓔 珞  心 初 未 曾 隨 惡 友 語  然 後 乃 全 大 士 之 行  
ZH_T16_0656_001:0003c04_5	意懷清白終無吾我，持心如山行無缺漏，智遍一切猶月初照。	001	意 懷 清 白 終 無 吾 我  持 心 如 山 行 無 缺 漏  智 遍 一 切 猶 月 初 照  
ZH_T16_0656_001:0003c04_20	若在大眾無能及者，是謂，普照！	001	若 在 大 眾 無能及者  是 謂  普 照  
ZH_T16_0656_001:0003c05_8	菩薩瓔珞周滿一切。	001	菩 薩 瓔 珞 周 滿 一 切  
ZH_T16_0656_001:0003c09_4	「覺了虛寂空無所有，所生之處恒見光明，所聞輒解至成佛道，常念頒宣根門之要，自建立業無所侵害，覩見本性自然起滅，過世八法無所罣礙，身口心意未曾有欺。	001	 覺 了 虛 寂 空無所有  所 生 之 處 恒 見 光 明  所 聞 輒 解 至成佛道  常 念 頒 宣 根 門 之 要  自 建 立 業 無 所 侵 害  覩 見 本 性 自 然 起 滅  過 世 八 法 無 所 罣 礙  身 口 心 意 未 曾 有 欺  
ZH_T16_0656_001:0003c12_1	復以權慧救濟眾生，窮厄之士令其飽足，持心如地不犯三過，日進其道不行放逸，逮不退轉牢固之心，不起法忍而現在前。	001	復 以 權 慧 救 濟 眾 生  窮 厄 之 士 令 其 飽 足  持 心 如 地 不 犯 三 過  日 進 其 道 不 行 放 逸  逮 不 退 轉 牢 固 之 心  不 起 法 忍 而 現 在 前  
ZH_T16_0656_001:0003c14_8	十力不畏覺道正觀，捐棄吾我及人壽命，分別思惟有無之法，感動變化無量佛國，斯由神通而得自在。	001	十 力 不 畏 覺 道 正 觀  捐 棄 吾 我 及 人 壽 命  分 別 思 惟 有 無 之 法  感 動 變 化 無 量 佛 國  斯 由 神 通 而 得 自 在  
ZH_T16_0656_001:0003c17_15	菩薩所宣言辭瓔珞，超越諸見無復希望，心向正道亦無顛倒，辯才無礙而無留滯，周旋往返不生想著，蠲除一切諸縛結使，憍慢自大永滅無餘。	001	菩 薩 所 宣 言 辭 瓔 珞  超 越 諸 見 無 復 希 望  心 向 正 道 亦 無 顛 倒  辯才無礙 而 無 留 滯  周 旋 往 返 不 生 想 著  蠲 除 一 切 諸 縛 結 使  憍 慢 自 大 永滅無餘  
ZH_T16_0656_001:0003c20_3	其聲音響如師子吼，亦如雷震無不聞聲，永立究竟乃至滅度，發於無極瓔珞之雲，演法雷吼法鼓電光。	001	其 聲 音 響 如 師 子 吼  亦 如 雷 震 無 不 聞 聲  永 立 究 竟 乃 至 滅 度  發 於 無 極 瓔 珞 之 雲  演 法 雷 吼 法 鼓 電 光  
ZH_T16_0656_001:0003c22_16	雨解脫味宣七覺意，念法清淨不離三寶，心如明月亦無沾污，通達往來不除正業，具足眾相殊勝之法，是謂，普照！	001	雨 解 脫 味 宣 七 覺 意  念 法 清 淨 不 離 三 寶  心 如 明 月 亦 無 沾 污  通 達 往 來 不 除 正 業  具 足 眾 相 殊 勝 之 法  是 謂  普 照  
ZH_T16_0656_001:0003c23_4	菩薩瓔珞而無窮盡。	001	菩 薩 瓔 珞 而 無 窮 盡  
ZH_T16_0656_001:0003c25_3	上中下善中間通利，懷來炤曜不失禁戒，過去當來諸恒沙聖，靡不嗟歎斯菩薩德。	001	上 中 下 善 中 間 通 利  懷 來 炤 曜 不 失 禁 戒  過 去 當 來 諸 恒 沙 聖  靡 不 嗟 歎 斯 菩 薩 德  
ZH_T16_0656_001:0003c25_9	如是，普照！	001	如 是  普 照  
ZH_T16_0656_001:0003c26_7	賢聖道品妙法之藏，珍寶之門而不可盡。	001	賢 聖 道 品 妙 法 之 藏  珍 寶 之 門 而 不 可 盡  
ZH_T16_0656_001:0003c29_4	」2 識定品(一)菩薩瓔珞經識定品第二爾時，座上有寶王菩薩，即從坐起長跪叉手，前白佛言：	001	 2   識 定 品  一  菩 薩 瓔 珞 經 識 定 品 第 二 爾 時  座 上 有 寶 王 菩 薩  即 從 坐 起 長 跪 叉 手  前 白 佛 言  
ZH_T16_0656_001:0003c29_11	「唯然，世尊！	001	 唯 然  世 尊  
ZH_T16_0656_001:0004a03_10	菩薩所習意識瓔珞，多所開寤靡不蒙度，如今十方恒沙如來，及去來今諸滅度者，云何修學瓔珞戒品，使至彼岸，令眾生類普聞香熏？	001	菩 薩 所 習 意 識 瓔 珞  多 所 開 寤 靡 不 蒙 度  如 今 十 方 恒 沙 如 來  及 去 來 今 諸 滅 度 者  云 何 修 學 瓔 珞 戒 品  使 至 彼 岸  令 眾 生 類 普 聞 香 熏  
ZH_T16_0656_001:0004a03_21	」爾時，世尊告寶王曰：	001	 爾 時  世 尊 告 寶 王 曰  
ZH_T16_0656_001:0004a04_5	「諦聽諦聽！	001	 諦 聽 諦 聽  
ZH_T16_0656_001:0004a04_10	善思念之！	001	善思念之  
ZH_T16_0656_001:0004a04_19	吾今為汝敷演其義。	001	吾 今 為 汝 敷 演 其 義  
ZH_T16_0656_001:0004a05_16	菩薩習行戒品瓔珞，功德香熏自瓔珞身。	001	菩 薩 習 行 戒 品 瓔 珞  功 德 香 熏 自 瓔 珞 身  
ZH_T16_0656_001:0004a06_2	」寶王對曰：	001	 寶 王 對 曰  
ZH_T16_0656_001:0004a06_8	「願樂欲聞。	001	 願 樂 欲 聞  
ZH_T16_0656_001:0004a06_14	」世尊告曰：	001	 世 尊 告 曰  
ZH_T16_0656_001:0004a09_3	「奉遵道法，乃修戒定解脫之慧，勸眾生類篤信於戒，願其志性各充所願，曉了隨宜不失本誓，兼除一切愚惑之心。	001	 奉 遵 道 法  乃 修 戒 定 解 脫 之 慧  勸 眾 生 類 篤 信 於 戒  願 其 志 性 各 充 所 願  曉 了 隨 宜 不 失 本 誓  兼 除 一 切 愚 惑 之 心  
ZH_T16_0656_001:0004a10_11	嚴淨道場具眾品宜，不以麁獷使經其心，志常慕及一生補處。	001	嚴 淨 道 場 具 眾 品 宜  不 以 麁 獷 使 經 其 心  志 常 慕 及 一生補處  
ZH_T16_0656_001:0004a12_17	總持正法深遠之藏，意恒遊戲百千三昧，感動變化無以為喻，一切萬物悉皆無常，難得之寶不可恃怙。	001	總 持 正 法 深 遠 之 藏  意 恒 遊 戲 百 千 三 昧  感 動 變 化 無 以 為 喻  一 切 萬 物 悉 皆 無 常  難 得 之 寶 不 可 恃 怙  
ZH_T16_0656_001:0004a14_6	行權方便而無所住，眾生心惑不解正道，心著吾我不明無常。	001	行 權 方 便 而 無 所 住  眾 生 心 惑 不 解 正 道  心 著 吾 我 不 明 無 常  
ZH_T16_0656_001:0004a17_3	「菩薩誓心為分別說，了一切空虛而不真，雖崇大道不捨二乘，所遊之剎莫不蒙慶，轉加精進倍行道業，於諸經法去其妄想。	001	 菩 薩 誓 心 為 分 別 說  了 一 切 空 虛 而 不 真  雖 崇 大 道 不 捨 二 乘  所 遊 之 剎 莫 不 蒙 慶  轉 加 精 進 倍 行 道 業  於 諸 經 法 去 其 妄 想  
ZH_T16_0656_001:0004a19_1	菩薩法要不離十地，以次上位不越其敘，加以智慧消眾塵勞，不及道者自致道門。	001	菩 薩 法 要 不 離 十 地  以 次 上 位 不 越 其 敘  加 以 智 慧 消 眾 塵 勞  不 及 道 者 自 致 道 門  
ZH_T16_0656_001:0004a19_10	恒念剋責意自念言：	001	恒 念 剋 責 意 自 念 言  
ZH_T16_0656_001:0004a19_16	『施為是誰？	001	 施 為 是 誰  
ZH_T16_0656_001:0004a19_21	受者何人？	001	受 者 何 人  
ZH_T16_0656_001:0004a21_16	』如觀財寶皆無有主，設有毀辱當自制意，後若受報端正殊妙，所遊之處見莫不歡。	001	 如 觀 財 寶 皆 無 有 主  設 有 毀 辱 當 自 制 意  後 若 受 報 端 正 殊 妙  所 遊 之 處 見 莫 不 歡  
ZH_T16_0656_001:0004a24_1	「若見貧匱裸形體者，躬自入海致如意珠，語以正法令知返復，以甘露法消竭眾難，念不馳泆。	001	 若 見 貧 匱 裸 形 體 者  躬 自 入 海 致 如 意 珠  語 以 正 法 令 知 返 復  以 甘 露 法 消 竭 眾 難  念 不 馳 泆  
ZH_T16_0656_001:0004a24_7	是故，寶王！	001	是 故  寶 王  
ZH_T16_0656_001:0004a25_17	菩薩道果之所瓔珞，意得自在，復以勇猛大力之教，建立訓導莫不隨順。	001	菩 薩 道 果 之 所 瓔 珞  意 得 自 在  復 以 勇 猛 大 力 之 教  建 立 訓 導 莫 不 隨 順  
ZH_T16_0656_001:0004a29_4	若行若坐不離十念，心在三尊未曾忽忘，了知地獄苦痛之惱，至心寂靜去塵勞垢，眾惡不犯無能迴轉，應於正理奉修禁法，德光普照皆蒙潤澤。	001	若 行 若 坐 不 離 十 念  心 在 三 尊 未 曾 忽 忘  了 知 地 獄 苦 痛 之 惱  至 心 寂 靜 去 塵 勞 垢  眾 惡 不 犯 無 能 迴 轉  應 於 正 理 奉 修 禁 法  德 光 普 照 皆 蒙 潤 澤  
ZH_T16_0656_001:0004b03_6	自計所有無所貪悋，施佛眾僧不興想著，或以權慧與王交接，輒能使王捐棄高位，若有人來求索頭目眼耳鼻口，即能惠施不逆人意。	001	自 計 所 有 無 所 貪 悋  施 佛 眾 僧 不 興 想 著  或 以 權 慧 與 王 交 接  輒 能 使 王 捐 棄 高 位  若 有 人 來 求 索 頭 目 眼 耳 鼻 口  即 能 惠 施 不 逆 人 意  
ZH_T16_0656_001:0004b06_16	」爾時，座上一切弟子諸菩薩等，聞此功勳瓔珞之德，踊躍歡喜不能自勝，思惟深邃善心生焉，各自興敬僉共供養，散眾名華若干珍寶，一時同聲稱歎其德：	001	 爾 時  座 上 一 切 弟 子 諸 菩 薩 等  聞 此 功 勳 瓔 珞 之 德  踊 躍 歡 喜 不 能 自 勝  思 惟 深 邃 善 心 生 焉  各 自 興 敬 僉 共 供 養  散 眾 名 華 若 干 珍 寶  一 時 同 聲 稱 歎 其 德  
ZH_T16_0656_001:0004b07_15	「我等宿福而遇善利，乃聞殊妙瓔珞之訓。	001	 我 等 宿 福 而 遇 善 利  乃 聞 殊 妙 瓔 珞 之 訓  
ZH_T16_0656_001:0004b09_13	若當眾生聞斯法教，勸發菩薩識定之要，諸福功勳不可稱量，安住所演諦而不虛。	001	若 當 眾 生 聞 斯 法 教  勸 發 菩 薩 識 定 之 要  諸 福 功 勳 不可稱量  安 住 所 演 諦 而 不 虛  
ZH_T16_0656_001:0004b12_6	設有菩薩遭遇此識定瓔珞者，觀了諸法解無處所，識定瓔珞，神心澹然，不復貪食樂念為食，所可勸助興致福業。	001	設 有 菩 薩 遭 遇 此 識 定 瓔 珞 者  觀 了 諸 法 解 無 處 所  識 定 瓔 珞  神 心 澹 然  不 復 貪 食 樂 念 為 食  所 可 勸 助 興 致 福 業  
ZH_T16_0656_001:0004b13_14	「吾於昔佛上五百華，建志弘誓自致成佛，道果不朽興隆正法。	001	 吾 於 昔 佛 上 五 百 華  建 志 弘 誓 自 致 成 佛  道 果 不 朽 興 隆 正 法  
ZH_T16_0656_001:0004b15_3	復以禁戒消除眾垢，救彼眾苦如救頭然，令眾厄難必得濟度。	001	復 以 禁 戒 消 除 眾 垢  救 彼 眾 苦 如 救 頭 然  令 眾 厄 難 必 得 濟 度  
ZH_T16_0656_001:0004b17_11	自念往昔入海求寶，遭摩竭魚及水形山，吾為導主入識定瓔珞，尋有善神將示好道，快樂安隱還至本邦。	001	自 念 往 昔 入 海 求 寶  遭 摩 竭 魚 及 水 形 山  吾 為 導 主 入 識 定 瓔 珞  尋 有 善 神 將 示 好 道  快 樂 安 隱 還 至 本 邦  
ZH_T16_0656_001:0004b20_2	斯由願誓精進不退，入禪正受無若干想，諸佛世尊之所遊堂，勸使眾生生於梵天及無想天，皆是識定瓔珞所致。	001	斯 由 願 誓 精 進 不 退  入 禪 正 受 無 若 干 想  諸佛世尊 之 所 遊 堂  勸 使 眾 生 生 於 梵 天 及 無 想 天  皆 是 識 定 瓔 珞 所 致  
ZH_T16_0656_001:0004b23_16	「若在人間十方國土，隨俗染化講度世道，復以十善諸道果證，利益眾生令達空慧，宣示一切不違聖教，解知本空都無所造，所殖德本不自為己，皆使獲於道法之果。	001	 若 在 人 間 十 方 國 土  隨 俗 染 化 講 度 世 道  復 以 十 善 諸 道 果 證  利 益 眾 生 令 達 空 慧  宣 示 一 切 不 違 聖 教  解 知 本 空 都 無 所 造  所 殖 德 本 不 自 為 己  皆 使 獲 於 道 法 之 果  
ZH_T16_0656_001:0004b27_3	設法傾沒能為重任，若遭苦惱永無憂慼，亦無妄想識著心者，將養身口使不漏失，以權方便深入生死，為說八解正受之味，建立世俗慕崇佛道。	001	設 法 傾 沒 能 為 重 任  若 遭 苦 惱 永 無 憂 慼  亦 無 妄 想 識 著 心 者  將 養 身 口 使 不 漏 失  以 權 方 便 深 入 生 死  為 說 八 解 正 受 之 味  建 立 世 俗 慕 崇 佛 道  
ZH_T16_0656_001:0004b29_1	或演一教或若干品，趣引令入在聖賢律，漸漸牽示而滅度之，能令正法住若干劫。	001	或 演 一 教 或 若 干 品  趣 引 令 入 在 聖 賢 律  漸 漸 牽 示 而 滅 度 之  能 令 正 法 住 若 干 劫  
ZH_T16_0656_001:0004c01_14	有餘眾生，令至無餘寂然泥洹，無生老死受形之患，不依四大地水火風。	001	有 餘 眾 生  令 至 無 餘 寂 然 泥 洹  無 生 老 死 受 形 之 患  不 依 四 大 地水火風  
ZH_T16_0656_001:0004c02_13	諸在邪見愚惑之部，示以正見一道之法。	001	諸 在 邪 見 愚 惑 之 部  示 以 正 見 一 道 之 法  
ZH_T16_0656_001:0004c04_16	「若在閑處修十二法勤苦之行，燕坐樹下而無所猗，思惟禪法唯空為務，一心靜定而無謬錯。	001	 若 在 閑 處 修 十 二 法 勤 苦 之 行  燕 坐 樹 下 而 無 所 猗  思 惟 禪 法 唯 空 為 務  一 心 靜 定 而 無 謬 錯  
ZH_T16_0656_001:0004c07_9	菩薩識定瓔珞之寶，亦不念色有相無相，相自虛寂種好亦爾，分別內外了之為一，三世空寂無去來今，以識定心。	001	菩 薩 識 定 瓔 珞 之 寶  亦 不 念 色 有 相 無 相  相 自 虛 寂 種 好 亦 爾  分 別 內 外 了 之 為 一  三 世 空 寂 無 去 來 今  以 識 定 心  
ZH_T16_0656_001:0004c08_9	復觀五陰性諸衰持入，為從何來、復從何滅？	001	復 觀 五 陰 性 諸 衰 持 入  為 從 何 來  復 從 何 滅  
ZH_T16_0656_001:0004c09_7	一一分別知為巧偽，非有生滅不興希望。	001	一 一 分 別 知 為 巧 偽  非 有 生 滅 不 興 希 望  
ZH_T16_0656_001:0004c11_5	亦復不見有是有非，不因心意得發道教，識興則興識滅則滅，不見相像亦無我想。	001	亦 復 不 見 有 是 有 非  不 因 心 意 得 發 道 教  識 興 則 興 識 滅 則 滅  不 見 相 像 亦 無 我 想  
ZH_T16_0656_001:0004c12_4	亦復不著住立處所，內外六塵亦復如是。	001	亦 復 不 著 住 立 處 所  內 外 六 塵 亦復如是  
ZH_T16_0656_001:0004c13_3	計挍耳目尚無所有，何況當有見聞之事？	001	計 挍 耳 目 尚 無 所 有  何 況 當 有 見 聞 之 事  
ZH_T16_0656_001:0004c13_8	此則不然。	001	此 則 不 然  
ZH_T16_0656_001:0004c16_6	「寶王當知，菩薩瓔珞心識定法，不起不滅亦無終始，緣起則起、緣滅則滅，起不見起、滅不見滅，內自思惟增減之意，無苦樂想。	001	 寶 王 當 知  菩 薩 瓔 珞 心 識 定 法  不起不滅 亦 無 終 始  緣 起 則 起  緣 滅 則 滅  起 不 見 起  滅 不 見 滅  內 自 思 惟 增 減 之 意  無 苦 樂 想  
ZH_T16_0656_001:0004c18_8	所以然者，離吾我念，雖復在欲眾惱之中心無染著，以遠三界欲色無色，意如金剛不可沮壞。	001	所 以 然 者  離 吾 我 念  雖 復 在 欲 眾 惱 之 中 心 無 染 著  以 遠 三 界 欲色無色  意 如 金 剛 不 可 沮 壞  
ZH_T16_0656_001:0004c20_7	知本宿命究竟根元，而斷諸結不以為難，不見有極不見無極，是謂菩薩識定瓔珞。	001	知 本 宿 命 究 竟 根 元  而 斷 諸 結 不 以 為 難  不 見 有 極 不 見 無 極  是 謂 菩 薩 識 定 瓔 珞  
ZH_T16_0656_001:0004c23_3	「隨世訓誨恭奉尊長，不望其報，於百千劫勤修精進，具足成就道慧之法，宣諸菩薩平等持忍，諷誦通利啟受不忘。	001	 隨 世 訓 誨 恭 奉 尊 長  不 望 其 報  於 百 千 劫 勤修精進  具 足 成 就 道 慧 之 法  宣 諸 菩 薩 平 等 持 忍  諷 誦 通 利 啟 受 不 忘  
ZH_T16_0656_001:0004c25_4	如來法身五分之性，一一頒暢言跡不飾，語常含笑心無所著，不起斷滅二見之想。	001	如來法身 五 分 之 性  一 一 頒 暢 言 跡 不 飾  語 常 含 笑 心無所著  不 起 斷 滅 二 見 之 想  
ZH_T16_0656_001:0004c27_16	若在大眾亦無適莫，於空無法亦無想念，內實充滿外現諮受，亦不生意我行過量彼有短乏，離諸利養無所希望。	001	若 在 大 眾 亦 無 適 莫  於 空 無 法 亦 無 想 念  內 實 充 滿 外 現 諮 受  亦 不 生 意 我 行 過 量 彼 有 短 乏  離 諸 利 養 無 所 希 望  
ZH_T16_0656_001:0005a01_17	常自思惟知身無主，從頭至足達了本無，修行六度解無處所，挍計諸法悉是假號知無形質，一切諸法不可覩見，分別音響亦無所聞。	001	常 自 思 惟 知 身 無 主  從 頭 至 足 達 了 本 無  修 行 六 度 解 無 處 所  挍 計 諸 法 悉 是 假 號 知 無 形 質  一切諸法 不 可 覩 見  分 別 音 響 亦 無 所 聞  
ZH_T16_0656_001:0005a02_4	「如是，寶王！	001	 如 是  寶 王  
ZH_T16_0656_001:0005a05_14	菩薩大士修法瓔珞識定法者，見善不喜聞惡不慼，然後乃應精進瓔珞，入百千定恬然無想，天雷地震龍電霹靂，山崩水漂師子鳴吼，心意寂定永無錯亂。	001	菩薩大士 修 法 瓔 珞 識 定 法 者  見 善 不 喜 聞 惡 不 慼  然 後 乃 應 精 進 瓔 珞  入 百 千 定 恬 然 無 想  天 雷 地 震 龍 電 霹 靂  山 崩 水 漂 師 子 鳴 吼  心 意 寂 定 永 無 錯 亂  
ZH_T16_0656_001:0005a07_18	或時菩薩入定正受，乃經一劫及百千劫，形體軟美不復仰食，斯由定意，禪悅為食、八解為漿。	001	或 時 菩 薩 入 定 正 受  乃 經 一 劫 及 百 千 劫  形 體 軟 美 不 復 仰 食  斯 由 定 意  禪 悅 為 食  八 解 為 漿  
