segmentnr	original	stemmed
ZH_T47_1972_001:0292a21_0	淨土或問全	淨 土 或 問 全 
ZH_T47_1972_001:0292a23_0	元師子林天如則著	元 師 子 林 天 如 則 著 
ZH_T47_1972_001:0292a24_0	明雲棲袾宏編	明 雲 棲 袾 宏 編 
ZH_T47_1972_001:0292a26_12	弟子廣信校天如老人方宴默於臥雲之室。	弟 子 廣 信 校 天 如 老 人 方 宴 默 於 臥 雲 之 室  
ZH_T47_1972_001:0292a27_2	有客排闥而入者。	有 客 排 闥 而 入 者  
ZH_T47_1972_001:0292a27_7	禪上人也。	禪 上 人 也  
ZH_T47_1972_001:0292a27_12	因命之坐。	因 命 之 坐  
ZH_T47_1972_001:0292a27_19	坐久夕陽在窓。	坐 久 夕 陽 在 窓  
ZH_T47_1972_001:0292a28_3	篆煙將滅。	篆 煙 將 滅  
ZH_T47_1972_001:0292a28_10	客乃整衣起立。	客 乃 整 衣 起 立  
ZH_T47_1972_001:0292a28_16	從容而問曰。	從 容 而 問 曰  
ZH_T47_1972_001:0292a29_16	竊聞永明壽和尚稟單傳之學於天台韶國師。	竊 聞 永 明 壽 和 尚 稟 單 傳 之 學 於 天 台 韶 國 師  
ZH_T47_1972_001:0292b01_5	是為法眼的孫。	是 為 法 眼 的 孫  
ZH_T47_1972_001:0292b01_13	匡徒於杭之淨慈。	匡 徒 於 杭 之 淨 慈  
ZH_T47_1972_001:0292b02_1	座下常數千指。	座 下 常 數 千 指  
ZH_T47_1972_001:0292b02_11	其機辯才智雷厲風飛。	其 機 辯 才 智 雷 厲 風 飛  
ZH_T47_1972_001:0292b03_3	海內禪林推之為大宗匠。	海 內 禪 林 推 之 為 大 宗 匠  
ZH_T47_1972_001:0292b03_10	柰何說禪之外。	柰 何 說 禪 之 外  
ZH_T47_1972_001:0292b03_17	自修淨土之業。	自 修 淨 土 之 業  
ZH_T47_1972_001:0292b04_11	而且以教人復撰揀示西方等文。	而 且 以 教 人 復 撰 揀 示 西 方 等 文  
ZH_T47_1972_001:0292b04_16	廣傳于世。	廣 傳 于 世  
ZH_T47_1972_001:0292b05_4	及作四料揀偈。	及 作 四 料 揀 偈  
ZH_T47_1972_001:0292b05_8	其略曰。	其 略 曰  
ZH_T47_1972_001:0292b05_14	有禪無淨土。	有 禪 無 淨 土  
ZH_T47_1972_001:0292b06_1	十人九蹉路。	十 人 九 蹉 路  
ZH_T47_1972_001:0292b06_7	無禪有淨土。	無 禪 有 淨 土  
ZH_T47_1972_001:0292b06_13	萬修萬人去。	萬 修 萬 人 去  
ZH_T47_1972_001:0292b07_4	看他此等語言主張淨土。	看 他 此 等 語 言 主 張 淨 土  
ZH_T47_1972_001:0292b07_13	壁立萬仞無少寬容。	壁 立 萬 仞 無 少 寬 容  
ZH_T47_1972_001:0292b08_7	無乃自屈其禪而過讚淨土耶。	無 乃 自 屈 其 禪 而 過 讚 淨 土 耶  
ZH_T47_1972_001:0292b08_12	此疑非小。	此 疑 非 小  
ZH_T47_1972_001:0292b08_19	師其為我辯之。	師 其 為 我 辯 之  
ZH_T47_1972_001:0292b09_2	答曰。	答 曰  
ZH_T47_1972_001:0292b09_7	大哉問也。	大 哉 問 也  
ZH_T47_1972_001:0292b09_16	當知永明非過讚也。	當 知 永 明 非 過 讚 也  
ZH_T47_1972_001:0292b10_5	深有功於宗教者也。	深 有 功 於 宗 教 者 也  
ZH_T47_1972_001:0292b10_13	惜永明但舉其綱。	惜 永 明 但 舉 其 綱  
ZH_T47_1972_001:0292b10_19	而發明未盡。	而 發 明 未 盡  
ZH_T47_1972_001:0292b11_10	故未能盡遣禪者之疑也。	故 未 能 盡 遣 禪 者 之 疑 也  
ZH_T47_1972_001:0292b11_15	余忝學禪。	余 忝 學 禪  
ZH_T47_1972_001:0292b12_1	未諳淨土。	未 諳 淨 土  
ZH_T47_1972_001:0292b12_11	然亦甞涉獵淨土諸書。	然 亦 甞 涉 獵 淨 土 諸 書  
ZH_T47_1972_001:0292b12_16	稍知其概。	稍 知 其 概  
ZH_T47_1972_001:0292b13_6	本是易行易入之方。	本 是 易 行 易 入 之 方  
ZH_T47_1972_001:0292b13_15	亦是難說難信之法。	亦 是 難 說 難 信 之 法  
ZH_T47_1972_001:0292b14_7	所以釋迦慈父現在世時。	所 以 釋 迦 慈 父 現 在 世 時  
ZH_T47_1972_001:0292b14_16	為諸弟子說彌陀經。	為 諸 弟 子 說 彌 陀 經  
ZH_T47_1972_001:0292b15_8	預知末法眾生少能信向。	預 知 末 法 眾 生 少 能 信 向  
ZH_T47_1972_001:0292b16_5	故引六方諸佛出廣長舌說誠實言。	故 引 六 方 諸 佛 出 廣 長 舌 說 誠 實 言  
ZH_T47_1972_001:0292b16_10	以起其信。	以 起 其 信  
ZH_T47_1972_001:0292b16_15	以破其疑。	以 破 其 疑  
ZH_T47_1972_001:0292b16_20	及於經末。	及 於 經 末  
ZH_T47_1972_001:0292b17_5	因諸佛所讚。	因 諸 佛 所 讚  
ZH_T47_1972_001:0292b17_10	乃復自言。	乃 復 自 言  
ZH_T47_1972_001:0292b18_4	當知我於五濁惡世行此難事。	當 知 我 於 五濁惡世 行 此 難 事  
ZH_T47_1972_001:0292b18_16	為一切世間說此難信之法。	為 一切世間 說 此 難 信 之 法  
ZH_T47_1972_001:0292b19_2	是為甚難。	是 為 甚 難  
ZH_T47_1972_001:0292b19_14	此皆苦口丁寧勸人信向矣。	此 皆 苦 口 丁 寧 勸 人 信 向 矣  
ZH_T47_1972_001:0292b20_5	且大悲世尊垂救末劫。	且 大 悲 世 尊 垂 救 末 劫  
ZH_T47_1972_001:0292b20_11	凡金口所宣。	凡 金 口 所 宣  
ZH_T47_1972_001:0292b21_8	一偈一句而人非人等莫不信受奉行。	一 偈 一 句 而 人 非 人 等 莫 不 信受奉行  
ZH_T47_1972_001:0292b21_15	獨於淨土之說。	獨 於 淨 土 之 說  
ZH_T47_1972_001:0292b22_4	則間有疑者何哉。	則 間 有 疑 者 何 哉  
ZH_T47_1972_001:0292b22_15	良由淨土教門至廣至大。	良 由 淨 土 教 門 至 廣 至 大  
ZH_T47_1972_001:0292b23_5	淨土修法至簡至易。	淨 土 修 法 至 簡 至 易  
ZH_T47_1972_001:0292b23_14	以其廣大而簡易故。	以 其 廣 大 而 簡 易 故  
ZH_T47_1972_001:0292b24_3	聞者不能不疑焉。	聞 者 不 能 不 疑 焉  
ZH_T47_1972_001:0292b24_9	所謂廣大者。	所 謂 廣 大 者  
ZH_T47_1972_001:0292b24_18	一切機根攝收都盡。	一 切 機 根 攝 收 都 盡  
ZH_T47_1972_001:0292b25_17	上而至於等覺位中一生補處菩薩亦生淨土。	上 而 至 於 等 覺 位 中 一生補處菩薩 亦 生 淨 土  
ZH_T47_1972_001:0292b27_1	下而至於愚夫愚婦與夫五逆十惡無知之徒。	下 而 至 於 愚 夫 愚 婦 與 夫 五 逆 十 惡 無 知 之 徒  
ZH_T47_1972_001:0292b27_10	臨終但能念佛悔過。	臨 終 但 能 念 佛 悔 過  
ZH_T47_1972_001:0292b27_16	歸心淨土者。	歸 心 淨 土 者  
ZH_T47_1972_001:0292b28_2	悉得往生也。	悉 得 往 生 也  
ZH_T47_1972_001:0292b28_8	所謂簡易者。	所 謂 簡 易 者  
ZH_T47_1972_001:0292b28_17	初無艱難勞苦之行。	初 無 艱 難 勞 苦 之 行  
ZH_T47_1972_001:0292b29_6	又無迷誤差別之緣。	又 無 迷 誤 差 別 之 緣  
ZH_T47_1972_001:0292b29_17	但持阿彌陀佛四字名號。	但 持 阿 彌 陀 佛 四 字 名 號  
ZH_T47_1972_001:0292c01_5	由此得離娑婆。	由 此 得 離 娑 婆  
ZH_T47_1972_001:0292c01_10	得生極樂。	得 生 極 樂  
ZH_T47_1972_001:0292c01_15	得不退轉。	得不退轉  
ZH_T47_1972_001:0292c02_4	直至成佛而後已也。	直 至 成 佛 而 後 已 也  
ZH_T47_1972_001:0292c02_11	其廣大既如彼。	其 廣 大 既 如 彼  
ZH_T47_1972_001:0292c02_18	其簡易又如此。	其 簡 易 又 如 此  
ZH_T47_1972_001:0292c03_9	故雖智者亦不能無疑焉。	故 雖 智 者 亦 不 能 無 疑 焉  
ZH_T47_1972_001:0292c03_14	汝如知此。	汝 如 知 此  
ZH_T47_1972_001:0292c04_10	則知永明之讚深有意焉而非過也。	則 知 永 明 之 讚 深 有 意 焉 而 非 過 也  
ZH_T47_1972_001:0292c05_2	問曰。	問 曰  
ZH_T47_1972_001:0292c05_11	廣大簡易既聞命矣。	廣 大 簡 易 既 聞 命 矣  
ZH_T47_1972_001:0292c05_19	如禪宗悟達之士。	如 禪 宗 悟 達 之 士  
ZH_T47_1972_001:0292c06_6	既曰見性成佛。	既 曰 見 性 成 佛  
ZH_T47_1972_001:0292c06_16	其肯復求淨土之生乎。	其 肯 復 求 淨 土 之 生 乎  
ZH_T47_1972_001:0292c06_19	答曰。	答 曰  
ZH_T47_1972_001:0292c07_5	汝未之知耳。	汝 未 之 知 耳  
ZH_T47_1972_001:0292c07_14	悟達之士政願求生。	悟 達 之 士 政 願 求 生  
ZH_T47_1972_001:0292c07_18	古人云。	古 人 云  
ZH_T47_1972_001:0292c08_3	不生淨土。	不 生 淨 土  
ZH_T47_1972_001:0292c08_8	何土可生。	何 土 可 生  
ZH_T47_1972_001:0292c08_13	汝但未悟。	汝 但 未 悟  
ZH_T47_1972_001:0292c08_18	使汝既悟。	使 汝 既 悟  
ZH_T47_1972_001:0292c09_10	則汝淨土之趨萬牛不能挽矣。	則 汝 淨 土 之 趨 萬 牛 不 能 挽 矣  
ZH_T47_1972_001:0292c10_2	問曰。	問 曰  
ZH_T47_1972_001:0292c10_11	佛祖出世為度眾生。	佛 祖 出 世 為 度 眾 生  
ZH_T47_1972_001:0292c11_1	學者但患大事不明。	學 者 但 患 大 事 不 明  
ZH_T47_1972_001:0292c11_6	大事既明。	大 事 既 明  
ZH_T47_1972_001:0292c11_11	當行佛教。	當 行 佛 教  
ZH_T47_1972_001:0292c11_16	隨類化身。	隨 類 化 身  
ZH_T47_1972_001:0292c12_4	入泥入水不避生死。	入 泥 入 水 不 避 生 死  
ZH_T47_1972_001:0292c12_9	廣度生靈。	廣 度 生 靈  
ZH_T47_1972_001:0292c12_15	今悟達之士。	今 悟 達 之 士  
ZH_T47_1972_001:0292c12_20	求生淨土。	求 生 淨 土  
ZH_T47_1972_001:0292c13_5	則厭苦趨樂。	則 厭 苦 趨 樂  
ZH_T47_1972_001:0292c13_10	不顧他人。	不 顧 他 人  
ZH_T47_1972_001:0292c13_17	此非吾所願也。	此 非 吾 所 願 也  
ZH_T47_1972_001:0292c13_20	答曰。	答 曰  
ZH_T47_1972_001:0292c14_6	見卵而求時夜。	見 卵 而 求 時 夜  
ZH_T47_1972_001:0292c14_12	何太早計耶。	何 太 早 計 耶  
ZH_T47_1972_001:0292c15_11	爾將謂一悟之後習漏永除便得不退轉耶。	爾 將 謂 一 悟 之 後 習 漏 永 除 便 得不退轉 耶  
ZH_T47_1972_001:0292c16_14	爾將謂一悟之後更無遍學佛法修行證果等事耶。	爾 將 謂 一 悟 之 後 更 無 遍 學 佛 法 修 行 證 果 等 事 耶  
ZH_T47_1972_001:0292c18_4	爾將謂一悟之後便可上齊諸佛入生入死不受障緣之所撓耶。	爾 將 謂 一 悟 之 後 便 可 上 齊 諸 佛 入 生 入 死 不 受 障 緣 之 所 撓 耶  
ZH_T47_1972_001:0292c18_8	審如是。	審 如 是  
ZH_T47_1972_001:0292c18_19	則諸大菩薩修六度萬行。	則 諸 大 菩 薩 修 六 度 萬 行  
ZH_T47_1972_001:0292c19_8	動經恒河沙數劫者。	動 經 恒 河 沙 數 劫 者  
ZH_T47_1972_001:0292c19_15	寧無愧於汝耶。	寧 無 愧 於 汝 耶  
ZH_T47_1972_001:0292c20_1	古教有云。	古 教 有 云  
ZH_T47_1972_001:0292c20_10	聲聞尚有出胎之昧。	聲 聞 尚 有 出 胎 之 昧  
ZH_T47_1972_001:0292c20_19	菩薩亦有隔陰之昏。	菩 薩 亦 有 隔 陰 之 昏  
ZH_T47_1972_001:0292c21_14	況近時薄解淺悟而自救不了者乎。	況 近 時 薄 解 淺 悟 而 自 救 不 了 者 乎  
ZH_T47_1972_001:0292c22_7	縱有悟處深遠見地高明。	縱 有 悟 處 深 遠 見 地 高 明  
ZH_T47_1972_001:0292c22_17	行解相應志在度人者。	行 解 相 應 志 在 度 人 者  
ZH_T47_1972_001:0292c23_5	柰何未登不退。	柰 何 未 登 不 退  
ZH_T47_1972_001:0292c23_10	力用未充。	力 用 未 充  
ZH_T47_1972_001:0292c23_19	居此濁惡化此剛強。	居 此 濁 惡 化 此 剛 強  
ZH_T47_1972_001:0292c24_8	此亦先聖之所未許。	此 亦 先 聖 之 所 未 許  
ZH_T47_1972_001:0292c25_5	如以未完不固之舟濟多人於惡海。	如 以 未 完 不 固 之 舟 濟 多 人 於 惡 海  
ZH_T47_1972_001:0292c25_10	自他俱溺。	自 他 俱 溺  
ZH_T47_1972_001:0292c25_15	其理必然。	其 理 必 然  
ZH_T47_1972_001:0292c26_1	故往生論云。	故 往 生 論 云  
ZH_T47_1972_001:0292c26_9	欲遊戲地獄門者。	欲 遊 戲 地 獄 門 者  
ZH_T47_1972_001:0292c26_19	必生彼土得無生忍已。	必 生 彼 土 得無生忍 已  
ZH_T47_1972_001:0292c27_8	還入生死救苦眾生。	還 入 生 死 救 苦 眾 生  
ZH_T47_1972_001:0292c27_17	以此因緣求生淨土。	以 此 因 緣 求 生 淨 土  
ZH_T47_1972_001:0292c28_4	又先聖有云。	又 先 聖 有 云  
ZH_T47_1972_001:0292c28_11	未得不退轉位。	未 得不退轉 位  
ZH_T47_1972_001:0292c28_18	不可混俗度生。	不 可 混 俗 度 生  
ZH_T47_1972_001:0292c29_5	未得無生法忍。	未 得無生法忍  
ZH_T47_1972_001:0292c29_12	要須常不離佛。	要 須 常 不 離 佛  
ZH_T47_1972_001:0293a01_2	譬如嬰兒常不離母。	譬 如 嬰 兒 常 不 離 母  
ZH_T47_1972_001:0293a01_11	又如弱羽只可傅枝。	又 如 弱 羽 只 可 傅 枝  
ZH_T47_1972_001:0293a02_5	今此國中釋迦已滅彌勒未生。	今 此 國 中 釋 迦 已 滅 彌 勒 未 生  
ZH_T47_1972_001:0293a02_16	而況四惡趣苦因果牽纏。	而 況 四 惡 趣 苦 因 果 牽 纏  
ZH_T47_1972_001:0293a03_6	外道邪魔是非扇亂。	外 道 邪 魔 是 非 扇 亂  
ZH_T47_1972_001:0293a03_14	美色淫聲之相惑。	美 色 淫 聲 之 相 惑  
ZH_T47_1972_001:0293a04_3	惡緣穢觸之交侵。	惡 緣 穢 觸 之 交 侵  
ZH_T47_1972_001:0293a04_10	既無現佛可依。	既 無 現 佛 可 依  
ZH_T47_1972_001:0293a04_17	又被境緣所撓。	又 被 境 緣 所 撓  
ZH_T47_1972_001:0293a05_4	初心悟達之人。	初 心 悟 達 之 人  
ZH_T47_1972_001:0293a05_13	尠有不遭其退敗者。	尠 有 不 遭 其 退 敗 者  
ZH_T47_1972_001:0293a06_6	所以世尊殷勤指歸極樂者。	所 以 世 尊 殷 勤 指 歸 極 樂 者  
ZH_T47_1972_001:0293a06_11	良有以也。	良 有 以 也  
ZH_T47_1972_001:0293a07_1	蓋彼彌陀現在說法。	蓋 彼 彌 陀 現 在 說 法  
ZH_T47_1972_001:0293a07_10	樂土境緣種種清淨。	樂 土 境 緣 種 種 清 淨  
ZH_T47_1972_001:0293a07_19	倘依彼佛忍力易成。	倘 依 彼 佛 忍 力 易 成  
ZH_T47_1972_001:0293a08_4	高證佛階。	高 證 佛 階  
ZH_T47_1972_001:0293a08_9	親蒙授記。	親 蒙 授 記  
ZH_T47_1972_001:0293a08_16	然後出化眾生。	然 後 出 化 眾 生  
ZH_T47_1972_001:0293a09_2	去來無礙也。	去 來 無 礙 也  
ZH_T47_1972_001:0293a09_7	以是之故。	以 是 之 故  
ZH_T47_1972_001:0293a09_13	雖上根利器。	雖 上 根 利 器  
ZH_T47_1972_001:0293a09_18	猶願託生。	猶 願 託 生  
ZH_T47_1972_001:0293a10_10	況汝中下之輩初得發明者乎。	況 汝 中 下 之 輩 初 得 發 明 者 乎  
ZH_T47_1972_001:0293a10_14	豈不見。	豈 不 見  
ZH_T47_1972_001:0293a11_2	觀佛三昧經中。	觀 佛 三 昧 經 中  
ZH_T47_1972_001:0293a11_10	文殊自敘宿因謂。	文 殊 自 敘 宿 因 謂  
ZH_T47_1972_001:0293a12_1	得念佛三昧常生淨土。	得 念佛三昧 常 生 淨 土  
ZH_T47_1972_001:0293a12_8	世尊復記之曰。	世 尊 復 記 之 曰  
ZH_T47_1972_001:0293a12_17	汝當往生極樂世界。	汝 當 往 生 極樂世界  
ZH_T47_1972_001:0293a13_2	又不見。	又 不 見  
ZH_T47_1972_001:0293a13_7	華嚴經中。	華 嚴 經 中  
ZH_T47_1972_001:0293a14_1	普賢勸進善財童子海會大眾。	普 賢 勸 進 善 財 童 子 海 會 大 眾  
ZH_T47_1972_001:0293a14_11	以十大願主導歸極樂。	以 十 大 願 主 導 歸 極 樂  
ZH_T47_1972_001:0293a14_15	其偈云。	其 偈 云  
ZH_T47_1972_001:0293a15_4	願我臨欲命終時。	願 我 臨 欲 命 終 時  
ZH_T47_1972_001:0293a15_12	盡除一切諸障礙。	盡 除 一 切 諸 障 礙  
ZH_T47_1972_001:0293a16_2	面見彼佛阿彌陀佛。	面 見 彼 佛 阿 彌 陀 佛  
ZH_T47_1972_001:0293a16_10	即得往生安樂剎。	即 得 往 生 安 樂 剎  
ZH_T47_1972_001:0293a16_13	又云。	又 云  
ZH_T47_1972_001:0293a17_1	彼佛眾會咸清淨。	彼 佛 眾 會 咸 清 淨  
ZH_T47_1972_001:0293a17_9	我時於勝蓮華生。	我 時 於 勝 蓮 華 生  
ZH_T47_1972_001:0293a17_17	親覩如來無量光。	親 覩 如 來 無 量 光  
ZH_T47_1972_001:0293a18_6	現前授我菩提記。	現 前 授 我 菩 提 記  
ZH_T47_1972_001:0293a18_14	蒙彼如來授記已。	蒙 彼 如 來 授 記 已  
ZH_T47_1972_001:0293a19_3	化身無數百俱胝。	化 身 無 數 百 俱 胝  
ZH_T47_1972_001:0293a19_11	智力廣大遍十方。	智 力 廣 大 遍 十 方  
ZH_T47_1972_001:0293a19_19	利樂一切眾生界。	利 樂 一 切 眾 生 界  
ZH_T47_1972_001:0293a20_3	又不見。	又 不 見  
ZH_T47_1972_001:0293a20_9	入楞伽經中。	入 楞 伽 經 中  
ZH_T47_1972_001:0293a20_16	授記龍樹偈云。	授 記 龍 樹 偈 云  
ZH_T47_1972_001:0293a21_2	南天竺國中。	南 天 竺 國 中  
ZH_T47_1972_001:0293a21_8	大名德比丘。	大 名 德 比 丘  
ZH_T47_1972_001:0293a21_14	厥號為龍樹。	厥 號 為 龍 樹  
ZH_T47_1972_001:0293a21_20	能破有無宗。	能 破 有 無 宗  
ZH_T47_1972_001:0293a22_10	世間中顯我無上大乘法。	世 間 中 顯 我 無 上 大 乘 法  
ZH_T47_1972_001:0293a22_16	得初歡喜地。	得 初歡喜地  
ZH_T47_1972_001:0293a23_3	往生安樂國。	往 生 安 樂 國  
ZH_T47_1972_001:0293a23_7	又不見。	又 不 見  
ZH_T47_1972_001:0293a23_12	起信論中。	起 信 論 中  
ZH_T47_1972_001:0293a23_18	馬鳴菩薩有。	馬 鳴 菩 薩 有  
ZH_T47_1972_001:0293a24_2	求生之願。	求 生 之 願  
ZH_T47_1972_001:0293a24_7	無量壽論。	無 量 壽 論  
ZH_T47_1972_001:0293a24_17	天親菩薩有願往之心。	天 親 菩 薩 有 願 往 之 心  
ZH_T47_1972_001:0293a25_1	又不見。	又 不 見  
ZH_T47_1972_001:0293a25_7	大寶積經中。	大 寶 積 經 中  
ZH_T47_1972_001:0293a26_3	印許淨飯王及七萬釋種同生安養。	印 許 淨 飯 王 及 七 萬 釋 種 同 生 安 養  
ZH_T47_1972_001:0293a26_9	十六觀經中。	十 六 觀 經 中  
ZH_T47_1972_001:0293a27_6	指示韋提夫人及五百侍女同覲彌陀。	指 示 韋 提 夫 人 及 五 百 侍 女 同 覲 彌 陀  
ZH_T47_1972_001:0293a27_13	且淨飯韋提等。	且 淨 飯 韋 提 等  
ZH_T47_1972_001:0293a28_3	皆是現得無生法忍。	皆 是 現 得無生法忍  
ZH_T47_1972_001:0293a28_10	西竺似此之流。	西 竺 似 此 之 流  
ZH_T47_1972_001:0293a28_18	不可得而勝數矣。	不 可 得 而 勝 數 矣  
ZH_T47_1972_001:0293a29_10	東土如廬山遠公合社高人。	東 土 如 廬 山 遠 公 合 社 高 人  
ZH_T47_1972_001:0293b01_5	天台賢首諸宗尊者自行化他。	天 台 賢 首 諸 宗 尊 者 自 行 化 他  
ZH_T47_1972_001:0293b01_15	曰僧曰俗同生淨土者。	曰 僧 曰 俗 同 生 淨 土 者  
ZH_T47_1972_001:0293b02_4	又可得而勝數耶。	又 可 得 而 勝 數 耶  
ZH_T47_1972_001:0293b02_15	只如文殊普賢大菩薩也。	只 如 文 殊 普 賢 大 菩 薩 也  
ZH_T47_1972_001:0293b03_5	善財海眾遍參知識。	善 財 海 眾 遍 參 知 識  
ZH_T47_1972_001:0293b03_11	悟同諸聖者。	悟 同 諸 聖 者  
ZH_T47_1972_001:0293b04_2	馬鳴龍樹等亦菩薩也。	馬 鳴 龍 樹 等 亦 菩 薩 也  
ZH_T47_1972_001:0293b04_12	亦禪宗以為大祖師也。	亦 禪 宗 以 為 大 祖 師 也  
ZH_T47_1972_001:0293b05_2	此諸聖人所悟所證。	此 諸 聖 人 所 悟 所 證  
ZH_T47_1972_001:0293b05_9	比今悟達之士。	比 今 悟 達 之 士  
ZH_T47_1972_001:0293b05_14	為何如哉。	為 何 如 哉  
ZH_T47_1972_001:0293b06_2	彼尚願生樂國。	彼 尚 願 生 樂 國  
ZH_T47_1972_001:0293b06_7	親近彌陀。	親 近 彌 陀  
ZH_T47_1972_001:0293b06_14	而汝一悟之後。	而 汝 一 悟 之 後  
ZH_T47_1972_001:0293b06_19	更不求生。	更 不 求 生  
ZH_T47_1972_001:0293b07_9	則龍樹馬鳴普賢文殊等。	則 龍 樹 馬 鳴 普 賢 文 殊 等  
ZH_T47_1972_001:0293b07_16	寧無愧於汝耶。	寧 無 愧 於 汝 耶  
ZH_T47_1972_001:0293b08_10	今汝何不自揣其心自量其力。	今 汝 何 不 自 揣 其 心 自 量 其 力  
ZH_T47_1972_001:0293b08_15	所修所證。	所 修 所 證  
ZH_T47_1972_001:0293b09_9	誠有過于二菩薩二禪祖者乎。	誠 有 過 于 二 菩 薩 二 禪 祖 者 乎  
ZH_T47_1972_001:0293b09_18	所參知識所悟佛性。	所 參 知 識 所 悟 佛 性  
ZH_T47_1972_001:0293b10_10	誠有過於善財海眾者乎。	誠 有 過 於 善 財 海 眾 者 乎  
ZH_T47_1972_001:0293b11_3	所得無性法忍受佛印證。	所 得 無 性 法 忍 受 佛 印 證  
ZH_T47_1972_001:0293b11_14	誠有過於淨飯韋提者乎。	誠 有 過 於 淨 飯 韋 提 者 乎  
ZH_T47_1972_001:0293b12_4	淨飯國王佛之父也。	淨 飯 國 王 佛 之 父 也  
ZH_T47_1972_001:0293b12_14	七萬釋種佛之親屬也。	七 萬 釋 種 佛 之 親 屬 也  
ZH_T47_1972_001:0293b13_5	淨土之生倘無利益。	淨 土 之 生 倘 無 利 益  
ZH_T47_1972_001:0293b13_16	佛忍自誤其父與親屬乎。	佛 忍 自 誤 其 父 與 親 屬 乎  
ZH_T47_1972_001:0293b14_12	向謂得無生法忍者可許混俗度生。	向 謂 得無生法忍 者 可 許 混 俗 度 生  
ZH_T47_1972_001:0293b15_5	今其父王親屬既得此忍。	今 其 父 王 親 屬 既 得 此 忍  
ZH_T47_1972_001:0293b15_11	而尚記往生。	而 尚 記 往 生  
ZH_T47_1972_001:0293b16_2	則汝求護持保養之意。	則 汝 求 護 持 保 養 之 意  
ZH_T47_1972_001:0293b16_9	豈不深且遠乎。	豈 不 深 且 遠 乎  
ZH_T47_1972_001:0293b16_16	多見今之禪者。	多 見 今 之 禪 者  
ZH_T47_1972_001:0293b17_4	不究如來之了義。	不 究 如 來 之 了 義  
ZH_T47_1972_001:0293b17_12	不知達磨之玄機。	不 知 達 磨 之 玄 機  
ZH_T47_1972_001:0293b18_2	空腹高心習為狂妄。	空 腹 高 心 習 為 狂 妄  
ZH_T47_1972_001:0293b18_11	見修淨土則笑之曰。	見 修 淨 土 則 笑 之 曰  
ZH_T47_1972_001:0293b19_2	彼學愚夫愚婦之所為。	彼 學 愚 夫 愚 婦 之 所 為  
ZH_T47_1972_001:0293b19_7	何其鄙哉。	何 其 鄙 哉  
ZH_T47_1972_001:0293b19_12	余嘗論其。	余 嘗 論 其  
ZH_T47_1972_001:0293b20_1	非鄙愚夫愚婦也。	非 鄙 愚 夫 愚 婦 也  
ZH_T47_1972_001:0293b20_14	乃鄙文殊普賢龍樹馬鳴等也。	乃 鄙 文 殊 普 賢 龍 樹 馬 鳴 等 也  
ZH_T47_1972_001:0293b21_2	非特自迷正道。	非 特 自 迷 正 道  
ZH_T47_1972_001:0293b21_7	自失善根。	自 失 善 根  
ZH_T47_1972_001:0293b21_12	自喪慧身。	自 喪 慧 身  
ZH_T47_1972_001:0293b21_17	自亡佛種。	自 亡 佛 種  
ZH_T47_1972_001:0293b22_3	且成謗法之業。	且 成 謗 法 之 業  
ZH_T47_1972_001:0293b22_10	又招鄙聖之殃。	又 招 鄙 聖 之 殃  
ZH_T47_1972_001:0293b22_19	佛祖視為可哀憐者。	佛 祖 視 為 可 哀 憐 者  
ZH_T47_1972_001:0293b23_12	於是永明和尚深憐而痛哀之。	於 是 永 明 和 尚 深 憐 而 痛 哀 之  
ZH_T47_1972_001:0293b24_3	剖出心肝主張淨土。	剖 出 心 肝 主 張 淨 土  
ZH_T47_1972_001:0293b24_8	既以自修。	既 以 自 修  
ZH_T47_1972_001:0293b24_13	又以化世。	又 以 化 世  
ZH_T47_1972_001:0293b25_3	故其臨終預知時至。	故 其 臨 終 預 知 時 至  
ZH_T47_1972_001:0293b25_12	乃有種種殊勝相現。	乃 有 種 種 殊 勝 相 現  
ZH_T47_1972_001:0293b26_2	甚至舍利鱗砌于身。	甚 至 舍 利 鱗 砌 于 身  
ZH_T47_1972_001:0293b26_9	嘗有撫州一僧。	嘗 有 撫 州 一 僧  
ZH_T47_1972_001:0293b26_16	經年旋繞其塔。	經 年 旋 繞 其 塔  
ZH_T47_1972_001:0293b27_1	人問其故。	人 問 其 故  
ZH_T47_1972_001:0293b27_4	僧曰。	僧 曰  
ZH_T47_1972_001:0293b27_9	因病入冥。	因 病 入 冥  
ZH_T47_1972_001:0293b27_17	閻王以陽數未艾。	閻 王 以 陽 數 未 艾  
ZH_T47_1972_001:0293b28_1	得放還生。	得 放 還 生  
ZH_T47_1972_001:0293b28_6	乃見殿左。	乃 見 殿 左  
ZH_T47_1972_001:0293b28_19	供養畫僧一㡧閻王禮拜殷勤。	供 養 畫 僧 一 㡧 閻 王 禮 拜 殷 勤  
ZH_T47_1972_001:0293b29_4	遂叩主吏。	遂 叩 主 吏  
ZH_T47_1972_001:0293b29_7	吏曰。	吏 曰  
ZH_T47_1972_001:0293b29_15	此永明壽禪師也。	此 永 明 壽 禪 師 也  
ZH_T47_1972_001:0293c01_1	其修行精進。	其 修 行 精 進  
ZH_T47_1972_001:0293c01_8	徑生極樂上品。	徑 生 極 樂 上 品  
ZH_T47_1972_001:0293c01_14	王以為希有。	王 以 為 希 有  
ZH_T47_1972_001:0293c02_2	故圖像而禮敬之。	故 圖 像 而 禮 敬 之  
ZH_T47_1972_001:0293c02_14	夫永明既悟達摩直指之禪。	夫 永 明 既 悟 達 摩 直 指 之 禪  
ZH_T47_1972_001:0293c03_5	又能致身於極樂上品。	又 能 致 身 於 極 樂 上 品  
ZH_T47_1972_001:0293c03_14	以此解禪者之執情。	以 此 解 禪 者 之 執 情  
ZH_T47_1972_001:0293c04_4	以此為末法之勸信。	以 此 為 末 法 之 勸 信  
ZH_T47_1972_001:0293c04_18	故余謂其深有功於宗教者此也。	故 余 謂 其 深 有 功 於 宗 教 者 此 也  
ZH_T47_1972_001:0293c05_6	豈特永明為然。	豈 特 永 明 為 然  
ZH_T47_1972_001:0293c05_13	如死心新禪師。	如 死 心 新 禪 師  
ZH_T47_1972_001:0293c06_4	作勸修淨土之文有云。	作 勸 修 淨 土 之 文 有 云  
ZH_T47_1972_001:0293c06_10	彌陀甚易念。	彌 陀 甚 易 念  
ZH_T47_1972_001:0293c06_16	淨土甚易生。	淨 土 甚 易 生  
ZH_T47_1972_001:0293c06_19	又云。	又 云  
ZH_T47_1972_001:0293c07_6	參禪人最好念佛。	參 禪 人 最 好 念 佛  
ZH_T47_1972_001:0293c07_11	根機或鈍。	根 機 或 鈍  
ZH_T47_1972_001:0293c07_19	恐今生未能大悟。	恐 今 生 未 能 大 悟  
ZH_T47_1972_001:0293c08_10	且假彌陀願力接引往生。	且 假 彌 陀 願 力 接 引 往 生  
ZH_T47_1972_001:0293c08_13	又云。	又 云  
ZH_T47_1972_001:0293c09_3	汝若念佛不生淨土。	汝 若 念 佛 不 生 淨 土  
ZH_T47_1972_001:0293c09_12	老僧當墮拔舌地獄。	老 僧 當 墮 拔 舌 地 獄  
ZH_T47_1972_001:0293c10_7	又如真歇了禪師作淨土說有云。	又 如 真 歇 了 禪 師 作 淨 土 說 有 云  
ZH_T47_1972_001:0293c10_16	洞下一宗皆務密修。	洞 下 一 宗 皆 務 密 修  
ZH_T47_1972_001:0293c11_2	其故何哉。	其 故 何 哉  
ZH_T47_1972_001:0293c11_13	良以念佛法門徑路修行。	良 以 念 佛 法 門 徑 路 修 行  
ZH_T47_1972_001:0293c11_18	正按大藏。	正 按 大 藏  
ZH_T47_1972_001:0293c12_4	接上上根器。	接 上 上 根 器  
