segmentnr	original	stemmed
ZH_T47_1972_001:0295a25_1	淨土無修。	淨 土 無 修  
ZH_T47_1972_001:0295a25_6	修因迷有。	修 因 迷 有  
ZH_T47_1972_001:0295a25_11	法無高下。	法 無 高 下  
ZH_T47_1972_001:0295a25_16	高下由根。	高 下 由 根  
ZH_T47_1972_001:0295a26_1	根有多珠。	根 有 多 珠  
ZH_T47_1972_001:0295a26_6	修分多類。	修 分 多 類  
ZH_T47_1972_001:0295a26_15	攝其多類總有三門。	攝 其 多 類 總 有 三 門  
ZH_T47_1972_001:0295a27_1	一曰觀想。	一 曰 觀 想  
ZH_T47_1972_001:0295a27_6	二曰憶念。	二 曰 憶 念  
ZH_T47_1972_001:0295a27_11	三曰眾行。	三 曰 眾 行  
ZH_T47_1972_001:0295a28_3	皆依極樂彌陀以為之主也。	皆 依 極 樂 彌 陀 以 為 之 主 也  
ZH_T47_1972_001:0295a28_9	一曰觀想者。	一 曰 觀 想 者  
ZH_T47_1972_001:0295a28_14	如觀經云。	如 觀 經 云  
ZH_T47_1972_001:0295a29_3	諸佛如來是法界身。	諸佛如來 是 法 界 身  
ZH_T47_1972_001:0295a29_12	入一切眾生心想中。	入 一 切 眾 生 心 想 中  
ZH_T47_1972_001:0295b01_2	是故汝等心想佛時。	是 故 汝 等 心 想 佛 時  
ZH_T47_1972_001:0295b01_16	是心即是三十二相八十隨形好。	是 心 即 是 三十二相 八十隨形好  
ZH_T47_1972_001:0295b02_2	是心作佛。	是 心 作 佛  
ZH_T47_1972_001:0295b02_7	是心是佛。	是 心 是 佛  
ZH_T47_1972_001:0295b02_18	諸佛正遍知海從心想生。	諸 佛 正 遍 知 海 從 心 想 生  
ZH_T47_1972_001:0295b03_11	是故應當一心繫念諦觀彼佛。	是 故 應 當 一 心 繫 念 諦 觀 彼 佛  
ZH_T47_1972_001:0295b03_16	天台疏曰。	天 台 疏 曰  
ZH_T47_1972_001:0295b04_7	諸佛如來下泛明諸佛。	諸佛如來 下 泛 明 諸 佛  
ZH_T47_1972_001:0295b04_17	是故應當下遍觀彌陀。	是 故 應 當 下 遍 觀 彌 陀  
ZH_T47_1972_001:0295b05_9	法界身者報佛法性生也。	法 界 身 者 報 佛 法 性 生 也  
ZH_T47_1972_001:0295b05_18	眾生心淨法身自在。	眾 生 心 淨 法 身 自 在  
ZH_T47_1972_001:0295b06_3	故云入。	故 云 入  
ZH_T47_1972_001:0295b06_13	如白日昇天影現百川。	如 白 日 昇 天 影 現 百 川  
ZH_T47_1972_001:0295b07_5	明佛身自在能隨物現也。	明 佛 身 自 在 能 隨 物 現 也  
ZH_T47_1972_001:0295b07_17	又法界身是佛身無所不遍。	又 法 界 身 是 佛 身 無 所 不 遍  
ZH_T47_1972_001:0295b08_3	法界為體。	法 界 為 體  
ZH_T47_1972_001:0295b08_10	得此觀佛三昧。	得 此 觀 佛 三 昧  
ZH_T47_1972_001:0295b08_15	解入相應。	解 入 相 應  
ZH_T47_1972_001:0295b09_3	故云入心想也。	故 云 入 心 想 也  
ZH_T47_1972_001:0295b09_9	是心作佛者。	是 心 作 佛 者  
ZH_T47_1972_001:0295b09_14	佛本是無。	佛 本 是 無  
ZH_T47_1972_001:0295b09_19	心淨故有。	心 淨 故 有  
ZH_T47_1972_001:0295b10_4	是心是佛者。	是 心 是 佛 者  
ZH_T47_1972_001:0295b10_15	向聞佛本是無心淨故有。	向 聞 佛 本 是 無 心 淨 故 有  
ZH_T47_1972_001:0295b11_1	便謂條然。	便 謂 條 然  
ZH_T47_1972_001:0295b11_6	故云即是。	故 云 即 是  
ZH_T47_1972_001:0295b11_11	始覺名作。	始 覺 名 作  
ZH_T47_1972_001:0295b11_17	終成即是佛。	終 成 即 是 佛  
ZH_T47_1972_001:0295b12_1	妙宗釋曰。	妙 宗 釋 曰  
ZH_T47_1972_001:0295b12_6	欲想佛身。	欲 想 佛 身  
ZH_T47_1972_001:0295b12_11	須知觀體。	須 知 觀 體  
ZH_T47_1972_001:0295b12_16	體是本覺。	體 是 本 覺  
ZH_T47_1972_001:0295b13_1	起成能觀。	起 成 能 觀  
ZH_T47_1972_001:0295b13_12	本覺乃是諸佛法界之身。	本 覺 乃 是 諸 佛 法 界 之 身  
ZH_T47_1972_001:0295b14_10	以諸如來無別所證全證眾生本性故也。	以 諸 如 來 無 別 所 證 全 證 眾 生 本 性 故 也  
ZH_T47_1972_001:0295b14_16	若始覺有功。	若 始 覺 有 功  
ZH_T47_1972_001:0295b15_2	本覺乃顯。	本 覺 乃 顯  
ZH_T47_1972_001:0295b15_11	故云法身從心想生。	故 云 法 身 從 心 想 生  
ZH_T47_1972_001:0295b16_1	又復彌陀與一切佛。	又 復 彌 陀 與 一 切 佛  
ZH_T47_1972_001:0295b16_10	一身一智應用亦然。	一 身 一 智 應 用 亦 然  
ZH_T47_1972_001:0295b16_19	彌陀身顯即諸佛身。	彌 陀 身 顯 即 諸 佛 身  
ZH_T47_1972_001:0295b17_8	諸佛相明即彌陀體。	諸 佛 相 明 即 彌 陀 體  
ZH_T47_1972_001:0295b17_17	是故泛明生諸佛身。	是 故 泛 明 生 諸 佛 身  
ZH_T47_1972_001:0295b18_7	以為觀察彌陀觀體。	以 為 觀 察 彌 陀 觀 體  
ZH_T47_1972_001:0295b18_13	從法界身下。	從 法 界 身 下  
ZH_T47_1972_001:0295b19_2	是約感應道交釋。	是 約 感 應 道 交 釋  
ZH_T47_1972_001:0295b19_9	從又法界身下。	從 又 法 界 身 下  
ZH_T47_1972_001:0295b19_16	約解入相應釋。	約 解 入 相 應 釋  
ZH_T47_1972_001:0295b20_2	融心解云。	融 心 解 云  
ZH_T47_1972_001:0295b20_12	若無初釋則觀非觀佛。	若 無 初 釋 則 觀 非 觀 佛  
ZH_T47_1972_001:0295b21_3	若無次釋則生佛體殊。	若 無 次 釋 則 生 佛 體 殊  
ZH_T47_1972_001:0295b21_8	二釋相成。	二 釋 相 成  
ZH_T47_1972_001:0295b21_13	是今觀法。	是 今 觀 法  
ZH_T47_1972_001:0295b21_18	妙宗又曰。	妙 宗 又 曰  
ZH_T47_1972_001:0295b22_10	今之心觀非直於陰觀本性佛。	今 之 心 觀 非 直 於 陰 觀 本 性 佛  
ZH_T47_1972_001:0295b23_1	乃託他佛顯乎本性。	乃 託 他 佛 顯 乎 本 性  
ZH_T47_1972_001:0295b23_11	故先明應佛入我想心。	故 先 明 應 佛 入 我 想 心  
ZH_T47_1972_001:0295b24_1	次明佛身全是本覺。	次 明 佛 身 全 是 本 覺  
ZH_T47_1972_001:0295b24_6	故應佛顯。	故 應 佛 顯  
ZH_T47_1972_001:0295b24_11	知本性明。	知 本 性 明  
ZH_T47_1972_001:0295b24_16	託外義成。	託 外 義 成  
ZH_T47_1972_001:0295b25_1	唯心觀立。	唯 心 觀 立  
ZH_T47_1972_001:0295b25_6	若論作是。	若 論 作 是  
ZH_T47_1972_001:0295b25_14	即不思議三觀也。	即 不 思 議 三 觀 也  
ZH_T47_1972_001:0295b26_5	以若破若立皆名為作。	以 若 破 若 立 皆 名 為 作  
ZH_T47_1972_001:0295b26_11	空假二觀也。	空 假 二 觀 也  
ZH_T47_1972_001:0295b27_1	不破不立名之為是。	不 破 不 立 名 之 為 是  
ZH_T47_1972_001:0295b27_6	中道觀也。	中 道 觀 也  
ZH_T47_1972_001:0295b27_11	全是而作。	全 是 而 作  
ZH_T47_1972_001:0295b27_17	則三諦俱破。	則 三 諦 俱 破  
ZH_T47_1972_001:0295b28_1	三諦俱立。	三 諦 俱 立  
ZH_T47_1972_001:0295b28_6	全作而是。	全 作 而 是  
ZH_T47_1972_001:0295b28_16	則於三諦俱非破非立。	則 於 三 諦 俱 非 破 非 立  
ZH_T47_1972_001:0295b29_5	即中之空假名作。	即 中 之 空 假 名 作  
ZH_T47_1972_001:0295b29_10	能破三惑。	能 破 三 惑  
ZH_T47_1972_001:0295b29_15	能立三法。	能 立 三 法  
ZH_T47_1972_001:0295c01_4	故感他佛三身圓應。	故 感 他 佛 三 身 圓 應  
ZH_T47_1972_001:0295c01_13	能成我心三身當果。	能 成 我 心 三 身 當 果  
ZH_T47_1972_001:0295c02_7	即空假之中名是則全惑即智。	即 空 假 之 中 名 是 則 全 惑 即 智  
ZH_T47_1972_001:0295c02_12	全障即德。	全 障 即 德  
ZH_T47_1972_001:0295c02_18	故心是應佛。	故 心 是 應 佛  
ZH_T47_1972_001:0295c03_3	心是果佛。	心 是 果 佛  
ZH_T47_1972_001:0295c03_14	故知作是一心修此三觀。	故 知 作 是 一 心 修 此 三 觀  
ZH_T47_1972_001:0295c04_8	十六觀之總體一經之妙宗也。	十 六 觀 之 總 體 一 經 之 妙 宗 也  
ZH_T47_1972_001:0295c04_11	又曰。	又 曰  
ZH_T47_1972_001:0295c05_1	此觀能令四佛土淨。	此 觀 能 令 四 佛 土 淨  
ZH_T47_1972_001:0295c05_10	如是方為此經宗致。	如 是 方 為 此 經 宗 致  
ZH_T47_1972_001:0295c05_14	乃至云。	乃 至 云  
ZH_T47_1972_001:0295c06_8	以此經本為韋提希厭同居穢。	以 此 經 本 為 韋 提 希 厭 同 居 穢  
ZH_T47_1972_001:0295c06_14	求同居淨故。	求 同 居 淨 故  
ZH_T47_1972_001:0295c07_3	談妙觀觀彼依正。	談 妙 觀 觀 彼 依 正  
ZH_T47_1972_001:0295c07_8	三觀若成。	三 觀 若 成  
ZH_T47_1972_001:0295c07_13	麁垢先落。	麁 垢 先 落  
ZH_T47_1972_001:0295c07_18	非有餘淨。	非 有 餘 淨  
ZH_T47_1972_001:0295c08_3	更生何處。	更 生 何 處  
ZH_T47_1972_001:0295c08_16	須知正為生同居淨故說三觀。	須 知 正 為 生 同 居 淨 故 說 三 觀  
ZH_T47_1972_001:0295c09_6	良由觀妙能破三惑。	良 由 觀 妙 能 破 三 惑  
ZH_T47_1972_001:0295c09_15	不獨感於同居淨土。	不 獨 感 於 同 居 淨 土  
ZH_T47_1972_001:0295c10_5	隨其惑斷淺深之處。	隨 其 惑 斷 淺 深 之 處  
ZH_T47_1972_001:0295c10_14	自然感得有餘等三。	自 然 感 得 有 餘 等 三  
ZH_T47_1972_001:0295c10_19	如病須藥。	如 病 須 藥  
ZH_T47_1972_001:0295c11_4	本為身安。	本 為 身 安  
ZH_T47_1972_001:0295c11_13	求得仙方修合服之。	求 得 仙 方 修 合 服 之  
ZH_T47_1972_001:0295c11_18	不但身安。	不 但 身 安  
ZH_T47_1972_001:0295c12_3	兼能輕骨。	兼 能 輕 骨  
ZH_T47_1972_001:0295c12_12	身安可喻生同居淨。	身 安 可 喻 生 同 居 淨  
ZH_T47_1972_001:0295c13_2	輕骨可喻感上三土。	輕 骨 可 喻 感 上 三 土  
ZH_T47_1972_001:0295c13_7	只是一藥。	只 是 一 藥  
ZH_T47_1972_001:0295c13_12	効乃深勝。	効 乃 深 勝  
ZH_T47_1972_001:0295c14_1	如一妙觀能淨四土。	如 一 妙 觀 能 淨 四 土  
ZH_T47_1972_001:0295c14_4	解云。	解 云  
ZH_T47_1972_001:0295c14_13	韋提本欲捨穢取淨。	韋 提 本 欲 捨 穢 取 淨  
ZH_T47_1972_001:0295c14_19	而佛示觀法。	而 佛 示 觀 法  
ZH_T47_1972_001:0295c15_4	捨穢必盡。	捨 穢 必 盡  
ZH_T47_1972_001:0295c15_9	顯淨無遺。	顯 淨 無 遺  
ZH_T47_1972_001:0295c16_2	如月蓋為免舍離果報之病。	如 月 蓋 為 免 舍 離 果 報 之 病  
ZH_T47_1972_001:0295c16_11	故請觀音及乎宣呪。	故 請 觀 音 及 乎 宣 呪  
ZH_T47_1972_001:0295c17_1	乃能消伏三毒之根。	乃 能 消 伏 三 毒 之 根  
ZH_T47_1972_001:0295c17_8	具足五眼之果。	具 足 五 眼 之 果  
ZH_T47_1972_001:0295c17_19	故一心三觀求生淨土者。	故 一 心 三 觀 求 生 淨 土 者  
ZH_T47_1972_001:0295c18_8	以三惑為穢土之因。	以 三 惑 為 穢 土 之 因  
ZH_T47_1972_001:0295c18_17	以三諦為淨土之果。	以 三 諦 為 淨 土 之 果  
ZH_T47_1972_001:0295c19_12	故別惑盡則寂光淨究竟三諦也。	故 別 惑 盡 則 寂 光 淨 究 竟 三 諦 也  
ZH_T47_1972_001:0295c20_8	別惑未盡則實報淨分證三諦也。	別 惑 未 盡 則 實 報 淨 分 證 三 諦 也  
ZH_T47_1972_001:0295c20_11	云云。	云 云  
ZH_T47_1972_001:0295c21_9	如上所明一心三觀能破三惑能淨四土。	如 上 所 明 一 心 三 觀 能 破 三 惑 能 淨 四 土  
ZH_T47_1972_001:0295c22_3	其或未破而生安養同居者。	其 或 未 破 而 生 安 養 同 居 者  
ZH_T47_1972_001:0295c22_8	託勝增修。	託 勝 增 修  
ZH_T47_1972_001:0295c22_18	則有餘等三淨可待矣。	則 有 餘 等 三 淨 可 待 矣  
ZH_T47_1972_001:0295c23_3	且教有云。	且 教 有 云  
ZH_T47_1972_001:0295c23_12	五濁輕重同居淨穢。	五 濁 輕 重 同 居 淨 穢  
ZH_T47_1972_001:0295c24_7	而圓觀輕濁所感同居依正最淨。	而 圓 觀 輕 濁 所 感 同 居 依 正 最 淨  
ZH_T47_1972_001:0295c25_3	比修戒善及餘經眾善感安養土。	比 修 戒 善 及 餘 經 眾 善 感 安 養 土  
ZH_T47_1972_001:0295c25_8	其相天殊。	其 相 天 殊  
ZH_T47_1972_001:0295c26_1	故天台宗以圓觀為定善也。	故 天 台 宗 以 圓 觀 為 定 善 也  
ZH_T47_1972_001:0295c26_7	二曰憶念者。	二 曰 憶 念 者  
ZH_T47_1972_001:0295c26_12	或緣相好。	或 緣 相 好  
ZH_T47_1972_001:0295c26_17	或持名號。	或 持 名 號  
ZH_T47_1972_001:0295c27_1	皆名憶念。	皆 名 憶 念  
ZH_T47_1972_001:0295c27_7	而有理有事。	而 有 理 有 事  
ZH_T47_1972_001:0295c27_16	如華嚴解脫長者云。	如 華 嚴 解 脫 長 者 云  
ZH_T47_1972_001:0295c28_11	我若欲見安樂世界無量壽如來。	我 若 欲 見 安樂世界 無 量 壽 如 來  
ZH_T47_1972_001:0295c28_16	隨意即見。	隨 意 即 見  
ZH_T47_1972_001:0295c29_14	如是十方一切世界所有如來我若欲見。	如 是 十 方 一切世界 所 有 如 來 我 若 欲 見  
ZH_T47_1972_001:0296a01_1	隨意即見。	隨 意 即 見  
ZH_T47_1972_001:0296a01_18	我能了知一切如來國土莊嚴神通等事。	我 能 了 知 一 切 如 來 國 土 莊 嚴 神 通 等 事  
ZH_T47_1972_001:0296a02_4	無所從來。	無所從來  
ZH_T47_1972_001:0296a02_9	亦無所至。	亦 無 所 至  
ZH_T47_1972_001:0296a02_14	無有行處。	無 有 行 處  
ZH_T47_1972_001:0296a02_19	亦無住處。	亦 無 住 處  
ZH_T47_1972_001:0296a03_3	亦如己身。	亦 如 己 身  
ZH_T47_1972_001:0296a03_8	無來無去。	無 來 無 去  
ZH_T47_1972_001:0296a03_13	無行住處。	無 行 住 處  
ZH_T47_1972_001:0296a04_2	然彼如來不來至此。	然 彼 如 來 不 來 至 此  
ZH_T47_1972_001:0296a04_7	我不往彼。	我 不 往 彼  
ZH_T47_1972_001:0296a05_1	知一切佛及與我心皆如夢故。	知 一 切 佛 及 與 我 心 皆 如 夢 故  
ZH_T47_1972_001:0296a05_10	如夢所見從分別生。	如夢所見 從 分 別 生  
ZH_T47_1972_001:0296a05_15	見一切佛。	見 一 切 佛  
ZH_T47_1972_001:0296a06_1	從自心起。	從自心起  
ZH_T47_1972_001:0296a06_6	又知自心。	又 知 自 心  
ZH_T47_1972_001:0296a06_11	如器中水。	如 器 中 水  
ZH_T47_1972_001:0296a06_16	悟解諸法。	悟 解 諸 法  
ZH_T47_1972_001:0296a07_1	如水中影。	如 水 中 影  
ZH_T47_1972_001:0296a07_6	又知自心。	又 知 自 心  
ZH_T47_1972_001:0296a07_11	猶如幻術。	猶 如 幻 術  
ZH_T47_1972_001:0296a07_16	知一切佛。	知 一 切 佛  
ZH_T47_1972_001:0296a08_1	如幻所作。	如 幻 所 作  
ZH_T47_1972_001:0296a08_10	又知自心諸佛菩薩。	又 知 自 心 諸佛菩薩  
ZH_T47_1972_001:0296a08_15	悉皆如響。	悉 皆 如 響  
ZH_T47_1972_001:0296a09_4	譬如空谷隨聲發響。	譬 如 空 谷 隨 聲 發 響  
ZH_T47_1972_001:0296a09_9	悟解自心。	悟 解 自 心  
ZH_T47_1972_001:0296a09_14	隨念見佛。	隨 念 見 佛  
ZH_T47_1972_001:0296a09_19	我如是知。	我 如 是 知  
ZH_T47_1972_001:0296a10_3	如是憶念。	如 是 憶 念  
ZH_T47_1972_001:0296a10_12	所見諸佛皆由自心。	所 見 諸 佛 皆 由 自 心  
ZH_T47_1972_001:0296a10_17	貞元疏曰。	貞 元 疏 曰  
ZH_T47_1972_001:0296a11_7	無所從來下正辨惟心。	無所從來 下 正 辨 惟 心  
ZH_T47_1972_001:0296a11_16	即心無心便入真如。	即 心 無 心 便 入 真 如  
ZH_T47_1972_001:0296a12_2	了彼相虛。	了 彼 相 虛  
ZH_T47_1972_001:0296a12_7	惟心現故。	惟 心 現 故  
ZH_T47_1972_001:0296a12_12	既了惟心。	既 了 惟 心  
ZH_T47_1972_001:0296a12_17	了心即佛。	了 心 即 佛  
ZH_T47_1972_001:0296a13_5	故隨所念無非佛矣。	故 隨 所 念 無 非 佛 矣  
ZH_T47_1972_001:0296a13_10	下列四喻。	下 列 四 喻  
ZH_T47_1972_001:0296a13_15	通顯惟心。	通 顯 惟 心  
ZH_T47_1972_001:0296a13_20	喻無來往。	喻 無 來 往  
ZH_T47_1972_001:0296a14_8	別喻兼明不出入等。	別 喻 兼 明 不 出 入 等  
ZH_T47_1972_001:0296a14_15	四喻皆具四觀。	四 喻 皆 具 四 觀  
ZH_T47_1972_001:0296a15_2	一正是惟心。	一 正 是 惟 心  
ZH_T47_1972_001:0296a15_8	二惟心故空。	二 惟 心 故 空  
ZH_T47_1972_001:0296a15_14	三惟心故假。	三 惟 心 故 假  
ZH_T47_1972_001:0296a16_5	四惟心故中融而無礙。	四 惟 心 故 中 融 而 無 礙  
ZH_T47_1972_001:0296a16_10	即華嚴意。	即 華 嚴 意  
ZH_T47_1972_001:0296a16_17	夢喻不來不去。	夢 喻 不來不去  
ZH_T47_1972_001:0296a17_4	影喻不出不入。	影 喻 不出不入  
ZH_T47_1972_001:0296a17_11	幻喻非有非無。	幻 喻 非有非無  
ZH_T47_1972_001:0296a17_18	響喻非合非散。	響 喻 非 合 非 散  
ZH_T47_1972_001:0296a18_4	又如般舟經。	又 如 般 舟 經  
ZH_T47_1972_001:0296a18_11	教修佛立三昧。	教 修 佛 立 三 昧  
ZH_T47_1972_001:0296a18_16	專念彌陀。	專 念 彌 陀  
ZH_T47_1972_001:0296a19_1	其略云。	其 略 云  
ZH_T47_1972_001:0296a19_6	常念彼佛。	常 念 彼 佛  
ZH_T47_1972_001:0296a20_1	譬如夢見金寶親屬相與娛樂等。	譬 如 夢 見 金 寶 親 屬 相 與 娛 樂 等  
ZH_T47_1972_001:0296a20_5	永明曰。	永 明 曰  
ZH_T47_1972_001:0296a20_12	此喻惟心所作。	此 喻 惟 心 所 作  
ZH_T47_1972_001:0296a21_1	即有而空故無來去。	即 有 而 空 故 無 來 去  
ZH_T47_1972_001:0296a21_7	又如幻非實。	又 如 幻 非 實  
ZH_T47_1972_001:0296a21_13	則心佛兩忘。	則 心 佛 兩 忘  
ZH_T47_1972_001:0296a21_19	而不無幻相。	而 不 無 幻 相  
ZH_T47_1972_001:0296a22_4	則不壞心佛。	則 不 壞 心 佛  
ZH_T47_1972_001:0296a22_13	空有無礙即無去來。	空 有 無 礙 即 無 去 來  
ZH_T47_1972_001:0296a22_18	不妨普見。	不 妨 普 見  
ZH_T47_1972_001:0296a23_3	見即無見。	見 即 無 見  
ZH_T47_1972_001:0296a23_8	常契中道。	常 契 中 道  
ZH_T47_1972_001:0296a23_15	是以佛實不來。	是 以 佛 實 不 來  
ZH_T47_1972_001:0296a24_1	心亦不去。	心 亦 不 去  
ZH_T47_1972_001:0296a24_10	感應道交惟心自見。	感 應 道 交 惟 心 自 見  
ZH_T47_1972_001:0296a24_19	又如楞嚴大勢至云。	又 如 楞 嚴 大 勢 至 云  
ZH_T47_1972_001:0296a25_4	若子憶母。	若 子 憶 母  
ZH_T47_1972_001:0296a25_9	如母憶時。	如 母 憶 時  
ZH_T47_1972_001:0296a25_14	母子歷生。	母 子 歷 生  
ZH_T47_1972_001:0296a25_19	不相違遠。	不 相 違 遠  
ZH_T47_1972_001:0296a26_12	至我本因地以念佛心入無生忍。	至 我 本 因 地 以 念 佛 心 入 無 生 忍  
ZH_T47_1972_001:0296a27_3	霅川以理事判之曰。	霅 川 以 理 事 判 之 曰  
ZH_T47_1972_001:0296a27_12	觀其母子相憶之喻。	觀 其 母 子 相 憶 之 喻  
ZH_T47_1972_001:0296a28_2	則是同居事相而已。	則 是 同 居 事 相 而 已  
ZH_T47_1972_001:0296a28_15	觀其自證無生法忍則念佛心。	觀 其 自 證 無生法忍 則 念 佛 心  
ZH_T47_1972_001:0296a29_5	不可單約事相而解。	不 可 單 約 事 相 而 解  
ZH_T47_1972_001:0296a29_10	念存三觀。	念 存 三 觀  
ZH_T47_1972_001:0296a29_15	佛具三身。	佛 具 三 身  
ZH_T47_1972_001:0296b01_1	心破三惑。	心 破 三 惑  
ZH_T47_1972_001:0296b01_10	無生忍位乃可入焉。	無 生 忍 位 乃 可 入 焉  
ZH_T47_1972_001:0296b01_17	又如彌陀經云。	又 如 彌 陀 經 云  
ZH_T47_1972_001:0296b02_2	執持名號。	執 持 名 號  
ZH_T47_1972_001:0296b02_8	至一心不亂。	至 一心不亂  
ZH_T47_1972_001:0296b02_12	淨覺曰。	淨 覺 曰  
ZH_T47_1972_001:0296b03_5	一心不亂例前妙觀同名正受。	一心不亂 例 前 妙 觀 同 名 正 受  
ZH_T47_1972_001:0296b03_12	即定心定善也。	即 定 心 定 善 也  
ZH_T47_1972_001:0296b03_18	據往人之論。	據 往 人 之 論  
ZH_T47_1972_001:0296b04_3	則有理事。	則 有 理 事  
ZH_T47_1972_001:0296b04_8	若達此心。	若 達 此 心  
ZH_T47_1972_001:0296b04_13	四性不生。	四 性 不 生  
ZH_T47_1972_001:0296b04_19	與空慧相應。	與 空 慧 相 應  
ZH_T47_1972_001:0296b05_3	是理一心。	是 理 一 心  
ZH_T47_1972_001:0296b05_9	若用心存念。	若 用 心 存 念  
ZH_T47_1972_001:0296b05_14	念念不間。	念 念 不 間  
ZH_T47_1972_001:0296b06_1	名事一心也。	名 事 一 心 也  
ZH_T47_1972_001:0296b06_6	真歇亦曰。	真 歇 亦 曰  
ZH_T47_1972_001:0296b06_15	一心不亂兼含理事。	一心不亂 兼 含 理 事  
ZH_T47_1972_001:0296b07_6	若事一心人皆可以行之。	若 事 一 心 人 皆 可 以 行 之  
ZH_T47_1972_001:0296b07_15	由持名號心不亂故。	由 持 名 號 心 不 亂 故  
ZH_T47_1972_001:0296b08_1	如龍得水。	如 龍 得 水  
ZH_T47_1972_001:0296b08_6	似虎靠山。	似 虎 靠 山  
ZH_T47_1972_001:0296b08_11	此即楞嚴。	此 即 楞 嚴  
ZH_T47_1972_001:0296b08_16	憶佛念佛。	憶 佛 念 佛  
ZH_T47_1972_001:0296b09_4	現前當來必定見佛。	現 前 當 來 必 定 見 佛  
ZH_T47_1972_001:0296b09_9	去佛不遠。	去 佛 不 遠  
ZH_T47_1972_001:0296b09_18	不假方便自得心開。	不 假 方 便 自 得 心 開  
ZH_T47_1972_001:0296b10_8	連攝中下二根之義也。	連 攝 中 下 二 根 之 義 也  
ZH_T47_1972_001:0296b10_17	若理一心亦非他法。	若 理 一 心 亦 非 他 法  
ZH_T47_1972_001:0296b11_11	但將阿彌陀佛四字做箇話頭。	但 將 阿 彌 陀 佛 四 字 做 箇 話 頭  
ZH_T47_1972_001:0296b12_2	二六時中直下提撕。	二 六 時 中 直 下 提 撕  
ZH_T47_1972_001:0296b12_8	不以有心念。	不 以 有 心 念  
ZH_T47_1972_001:0296b12_14	不以無心念。	不 以 無 心 念  
ZH_T47_1972_001:0296b13_3	不以亦有亦無心念。	不 以 亦 有 亦 無 心 念  
ZH_T47_1972_001:0296b13_12	不以非有非無心念。	不 以 非有非無 心 念  
ZH_T47_1972_001:0296b14_2	前後際斷一念不生。	前後際斷 一 念 不 生  
ZH_T47_1972_001:0296b14_11	不涉階梯徑超佛地。	不 涉 階 梯 徑 超 佛 地  
ZH_T47_1972_001:0296b14_16	余嘗評之。	余 嘗 評 之  
ZH_T47_1972_001:0296b15_7	不以有心念等文有四節。	不 以 有 心 念 等 文 有 四 節  
ZH_T47_1972_001:0296b15_12	可配三觀。	可 配 三 觀  
ZH_T47_1972_001:0296b15_17	初節配空。	初 節 配 空  
ZH_T47_1972_001:0296b16_2	次節配假。	次 節 配 假  
ZH_T47_1972_001:0296b16_7	第三雙離。	第 三 雙 離  
ZH_T47_1972_001:0296b16_12	第四雙即。	第 四 雙 即  
ZH_T47_1972_001:0296b17_2	雙離雙即可配中觀。	雙 離 雙 即 可 配 中 觀  
ZH_T47_1972_001:0296b17_14	蓋彼中觀亦含遮照之義也。	蓋 彼 中 觀 亦 含 遮 照 之 義 也  
ZH_T47_1972_001:0296b17_19	合而言之。	合 而 言 之  
ZH_T47_1972_001:0296b18_6	無非以修契性。	無 非 以 修 契 性  
ZH_T47_1972_001:0296b18_13	顯其當處即空。	顯 其 當 處 即 空  
ZH_T47_1972_001:0296b19_7	全體即有亦非空有亦是空有。	全 體 即 有 亦 非 空 有 亦 是 空 有  
ZH_T47_1972_001:0296b19_12	不可湊泊。	不 可 湊 泊  
ZH_T47_1972_001:0296b19_17	不可擬議。	不 可 擬 議  
ZH_T47_1972_001:0296b20_2	心路絕處。	心 路 絕 處  
ZH_T47_1972_001:0296b20_7	即名為佛。	即 名 為 佛  
ZH_T47_1972_001:0296b20_18	如上略舉數條通名憶念。	如 上 略 舉 數 條 通 名 憶 念  
ZH_T47_1972_001:0296b21_4	而各分理事。	而 各 分 理 事  
ZH_T47_1972_001:0296b21_9	其理念者。	其 理 念 者  
ZH_T47_1972_001:0296b21_14	與圓觀同。	與 圓 觀 同  
ZH_T47_1972_001:0296b21_19	能破三惑。	能 破 三 惑  
ZH_T47_1972_001:0296b22_3	能淨四土。	能 淨 四 土  
ZH_T47_1972_001:0296b22_10	此攝上上根也。	此 攝 上 上 根 也  
ZH_T47_1972_001:0296b22_17	若其事相念者。	若 其 事 相 念 者  
ZH_T47_1972_001:0296b23_5	近則感同居淨。	近 則 感 同 居 淨  
ZH_T47_1972_001:0296b23_16	遠則可為上三土之因耳。	遠 則 可 為 上 三 土 之 因 耳  
ZH_T47_1972_001:0296b24_6	降此以下事相不等。	降 此 以 下 事 相 不 等  
ZH_T47_1972_001:0296b24_12	如諸經所說。	如 諸 經 所 說  
ZH_T47_1972_001:0296b24_18	或一生繫念。	或 一 生 繫 念  
ZH_T47_1972_001:0296b25_4	或三月繫念。	或 三 月 繫 念  
ZH_T47_1972_001:0296b25_10	或晨朝十念。	或 晨 朝 十 念  
ZH_T47_1972_001:0296b25_16	或七七日念。	或 七 七 日 念  
ZH_T47_1972_001:0296b26_6	或十日十夜六時中念。	或 十 日 十 夜 六 時 中 念  
ZH_T47_1972_001:0296b26_16	或一日一夜不斷專念。	或 一 日 一 夜 不 斷 專 念  
ZH_T47_1972_001:0296b27_12	加以深信之力淨願之力佛加被力。	加 以 深 信 之 力 淨 願 之 力 佛 加 被 力  
ZH_T47_1972_001:0296b27_17	皆生極樂。	皆 生 極 樂  
ZH_T47_1972_001:0296b28_7	又下而至逆惡凡夫。	又 下 而 至 逆 惡 凡 夫  
ZH_T47_1972_001:0296b28_16	臨終十念亦許得生。	臨 終 十 念 亦 許 得 生  
ZH_T47_1972_001:0296b29_7	此攝中根及下下根也。	此 攝 中 根 及 下 下 根 也  
ZH_T47_1972_001:0296b29_13	三曰眾行者。	三 曰 眾 行 者  
ZH_T47_1972_001:0296c01_13	如華嚴經普賢菩薩勸進善財童子海會大眾。	如 華 嚴 經 普 賢 菩 薩 勸 進 善 財 童 子 海 會 大 眾  
ZH_T47_1972_001:0296c01_18	發十大願。	發 十 大 願  
ZH_T47_1972_001:0296c02_6	一者禮敬諸佛。	一 者 禮 敬 諸 佛  
ZH_T47_1972_001:0296c02_13	二者稱讚如來。	二 者 稱 讚 如 來  
ZH_T47_1972_001:0296c03_1	三者廣修供養。	三 者 廣 修 供 養  
ZH_T47_1972_001:0296c03_8	四者懺悔業障。	四 者 懺 悔 業 障  
ZH_T47_1972_001:0296c03_15	五者隨喜功德。	五 者 隨 喜 功 德  
ZH_T47_1972_001:0296c04_3	六者請轉法輪。	六 者 請 轉 法 輪  
ZH_T47_1972_001:0296c04_10	七者請佛住世。	七 者 請 佛 住 世  
ZH_T47_1972_001:0296c04_17	八者當隨佛學。	八 者 當 隨 佛 學  
ZH_T47_1972_001:0296c05_4	九者恒順眾生。	九 者 恒 順 眾 生  
ZH_T47_1972_001:0296c05_11	十者普皆回向。	十 者 普 皆 回 向  
ZH_T47_1972_001:0296c05_18	其一一願皆云。	其 一 一 願 皆 云  
ZH_T47_1972_001:0296c06_3	虛空界盡。	虛 空 界 盡  
ZH_T47_1972_001:0296c06_8	眾生界盡。	眾 生 界 盡  
ZH_T47_1972_001:0296c06_13	眾生業盡。	眾 生 業 盡  
