segmentnr	original	folio	stemmed
ZH_T12_0374_020:0484a21_16	如乾闥婆城，愚癡之人謂為真實，智者了達知其非真。	020	如 乾 闥 婆 城  愚 癡 之 人 謂 為 真 實  智 者 了 達 知 其 非 真  
ZH_T12_0374_020:0484a22_16	殺亦如是，凡夫謂實，諸佛世尊知其非真。	020	殺 亦 如 是  凡 夫 謂 實  諸佛世尊 知 其 非 真  
ZH_T12_0374_020:0484a22_19	大王！	020	大 王  
ZH_T12_0374_020:0484a24_7	如人夢中受五欲樂，愚癡之人謂之為實，智者了達知其非真。	020	如 人 夢 中 受 五 欲 樂  愚 癡 之 人 謂 之 為 實  智 者 了 達 知 其 非 真  
ZH_T12_0374_020:0484a25_6	殺亦如是，凡夫謂實，諸佛世尊知其非真。	020	殺 亦 如 是  凡 夫 謂 實  諸佛世尊 知 其 非 真  
ZH_T12_0374_020:0484a25_10	「大王！	020	 大 王  
ZH_T12_0374_020:0484a26_13	殺法、殺業、殺者、殺果及以解脫，我皆了之，則無有罪。	020	殺 法  殺 業  殺 者  殺 果 及 以 解 脫  我 皆 了 之  則 無 有 罪  
ZH_T12_0374_020:0484a27_2	王雖知殺，云何有罪？	020	王 雖 知 殺  云 何 有 罪  
ZH_T12_0374_020:0484a27_5	大王！	020	大 王  
ZH_T12_0374_020:0484a28_14	譬如有人，主知典酒，如其不飲，則亦不醉，雖復知火，亦不燒然。	020	譬 如 有 人  主 知 典 酒  如 其 不 飲  則 亦 不 醉  雖 復 知 火  亦 不 燒 然  
ZH_T12_0374_020:0484a29_8	王亦如是，雖復知殺，云何有罪？	020	王 亦 如 是  雖 復 知 殺  云 何 有 罪  
ZH_T12_0374_020:0484a29_11	大王！	020	大 王  
ZH_T12_0374_020:0484b02_3	有諸眾生，於日出時作種種罪，於月出時復行劫盜，日月不出則不作罪；	020	有 諸 眾 生  於 日 出 時 作 種 種 罪  於 月 出 時 復 行 劫 盜  日 月 不 出 則 不 作 罪  
ZH_T12_0374_020:0484b03_2	雖因日月令其作罪，然此日月實不得罪。	020	雖 因 日 月 令 其 作 罪  然 此 日 月 實 不 得 罪  
ZH_T12_0374_020:0484b03_17	殺亦如是，雖復因王，王實無罪。	020	殺 亦 如 是  雖 復 因 王  王 實 無 罪  
ZH_T12_0374_020:0484b03_20	大王！	020	大 王  
ZH_T12_0374_020:0484b04_13	如王宮中，常勅屠羊，心初無懼。	020	如 王 宮 中  常 勅 屠 羊  心 初 無 懼  
ZH_T12_0374_020:0484b05_2	云何於父，獨生懼心？	020	云 何 於 父  獨 生 懼 心  
ZH_T12_0374_020:0484b06_1	雖復人畜尊卑差別，寶命畏死，二俱無異。	020	雖 復 人 畜 尊 卑 差 別  寶 命 畏 死  二 俱 無 異  
ZH_T12_0374_020:0484b06_11	何故於羊，心輕無懼？	020	何 故 於 羊  心 輕 無 懼  
ZH_T12_0374_020:0484b06_21	於父先王，生重憂苦？	020	於 父 先 王  生 重 憂 苦  
ZH_T12_0374_020:0484b07_2	大王！	020	大 王  
ZH_T12_0374_020:0484b08_15	世間之人是愛僮僕，不得自在，為愛所使，而行殺害，設有果報乃是愛罪。	020	世 間 之 人 是 愛 僮 僕  不得自在  為 愛 所 使  而 行 殺 害  設 有 果 報 乃 是 愛 罪  
ZH_T12_0374_020:0484b09_4	王不自在，當有何咎？	020	王 不 自 在  當 有 何 咎  
ZH_T12_0374_020:0484b09_7	大王！	020	大 王  
ZH_T12_0374_020:0484b10_1	譬如涅槃，非有非無，而亦是有。	020	譬 如 涅 槃  非有非無  而 亦 是 有  
ZH_T12_0374_020:0484b10_17	殺亦如是，雖非有非無，而亦是有。	020	殺 亦 如 是  雖 非有非無  而 亦 是 有  
ZH_T12_0374_020:0484b11_15	慚愧之人則為非有，無慚愧者則為非無；	020	慚 愧 之 人 則 為 非 有  無 慚 愧 者 則 為 非 無  
ZH_T12_0374_020:0484b12_15	受果報者名之為有，空見之人則為非有；	020	受 果 報 者 名 之 為 有  空 見 之 人 則 為 非 有  
ZH_T12_0374_020:0484b13_14	有見之人則為非無，有有見者亦名為有。	020	有 見 之 人 則 為 非 無  有 有 見 者 亦 名 為 有  
ZH_T12_0374_020:0484b13_18	何以故？	020	何 以 故  
ZH_T12_0374_020:0484b14_17	有有見者得果報故，無有見者則無果報；	020	有 有 見 者 得 果 報 故  無 有 見 者 則 無 果 報  
ZH_T12_0374_020:0484b15_16	常見之人則為非有，無常見者則為非無。	020	常 見 之 人 則 為 非 有  無 常 見 者 則 為 非 無  
ZH_T12_0374_020:0484b16_10	常常見者不得為無，何以故？	020	常 常 見 者 不 得 為 無  何 以 故  
ZH_T12_0374_020:0484b17_13	常常見者，有惡業果故，是故常常見者，不得為無。	020	常 常 見 者  有 惡 業 果 故  是 故 常 常 見 者  不 得 為 無  
ZH_T12_0374_020:0484b18_7	以是義故，雖非有無，而亦是有。	020	以是義故  雖 非 有 無  而 亦 是 有  
ZH_T12_0374_020:0484b18_11	「大王！	020	 大 王  
ZH_T12_0374_020:0484b19_19	夫眾生者，名出入息，斷出入息，故名為殺，諸佛隨俗，亦說為殺。	020	夫 眾 生 者  名 出 入 息  斷 出 入 息  故 名 為 殺  諸 佛 隨 俗  亦 說 為 殺  
ZH_T12_0374_020:0484b20_1	大王！	020	大 王  
ZH_T12_0374_020:0484b21_7	色是無常，色之因緣亦是無常，從無常因生，色云何常？	020	色 是 無 常  色 之 因 緣 亦 是 無 常  從 無 常 因 生  色 云 何 常  
ZH_T12_0374_020:0484b22_15	乃至識是無常，識之因緣亦是無常，從無常因生，識云何常？	020	乃 至 識 是 無 常  識 之 因 緣 亦 是 無 常  從 無 常 因 生  識 云 何 常  
ZH_T12_0374_020:0484b24_7	以無常故苦，以苦故空，以空故無我，若是無常、苦、空、無我，為何所殺？	020	以 無 常 故 苦  以 苦 故 空  以 空 故 無 我  若 是 無 常  苦  空  無 我  為 何 所 殺  
ZH_T12_0374_020:0484b25_15	殺無常者得常涅槃，殺苦得樂，殺空得實，殺於無我而得真我。	020	殺 無 常 者 得 常 涅 槃  殺 苦 得 樂  殺 空 得 實  殺 於 無 我 而 得 真 我  
ZH_T12_0374_020:0484b25_18	大王！	020	大 王  
ZH_T12_0374_020:0484b26_16	若殺無常、苦、空、無我者，則與我同。	020	若 殺 無 常  苦  空  無 我 者  則 與 我 同  
ZH_T12_0374_020:0484b27_17	我亦殺於無常、苦、空無我，不入地獄，汝云何入？	020	我 亦 殺 於 無 常  苦  空 無 我  不 入 地 獄  汝 云 何 入  
ZH_T12_0374_020:0484b29_8	」爾時阿闍世王，如佛所說觀色乃至觀識，作是觀已，即白佛言：	020	 爾 時 阿 闍 世 王  如 佛 所 說 觀 色 乃 至 觀 識  作 是 觀 已  即 白 佛 言  
ZH_T12_0374_020:0484b29_12	「世尊！	020	 世 尊  
ZH_T12_0374_020:0484c01_7	我今始知色是無常乃至識是無常；	020	我 今 始 知 色 是 無 常 乃 至 識 是 無 常  
ZH_T12_0374_020:0484c02_2	我本若能如是知者，則不作罪。	020	我 本 若 能 如 是 知 者  則 不 作 罪  
ZH_T12_0374_020:0484c02_5	世尊！	020	世 尊  
ZH_T12_0374_020:0484c03_3	我昔曾聞，諸佛世尊常為眾生而作父母。	020	我 昔 曾 聞  諸佛世尊 常 為 眾 生 而 作 父 母  
ZH_T12_0374_020:0484c03_18	雖聞是語，猶未審定，今則定知。	020	雖 聞 是 語  猶 未 審 定  今 則 定 知  
ZH_T12_0374_020:0484c04_1	世尊！	020	世 尊  
ZH_T12_0374_020:0484c05_5	我亦曾聞，須彌山王四寶所成，所謂金、銀、琉璃、頗梨；	020	我 亦 曾 聞  須 彌 山 王 四 寶 所 成  所 謂 金  銀  琉 璃  頗 梨  
ZH_T12_0374_020:0484c05_19	若有眾鳥隨所集處，則同其色。	020	若 有 眾 鳥 隨 所 集 處  則 同 其 色  
ZH_T12_0374_020:0484c06_8	雖聞是言，亦不審定。	020	雖 聞 是 言  亦 不 審 定  
ZH_T12_0374_020:0484c07_21	我今來至佛須彌山，則與同色，與同色者，則知諸法無常、苦、空、無我。	020	我 今 來 至 佛 須 彌 山  則 與 同 色  與 同 色 者  則 知 諸 法 無 常  苦  空  無 我  
ZH_T12_0374_020:0484c08_2	世尊！	020	世 尊  
ZH_T12_0374_020:0484c11_8	我見世間，從𦭽蘭子生𦭽蘭樹，不見𦭽蘭生栴檀樹，我今始見從𦭽蘭子生栴檀樹，𦭽蘭子者我身是也，栴檀樹者即是我心、無根、信也。	020	我 見 世 間  從 𦭽 蘭 子 生 𦭽 蘭 樹  不 見 𦭽 蘭 生 栴 檀 樹  我 今 始 見 從 𦭽 蘭 子 生 栴 檀 樹  𦭽 蘭 子 者 我 身 是 也  栴 檀 樹 者 即 是 我 心  無 根  信 也  
ZH_T12_0374_020:0484c12_10	無根者，我初不知恭敬如來，不信法、僧，是名無根。	020	無 根 者  我 初 不 知 恭 敬 如 來  不 信 法  僧  是 名 無 根  
ZH_T12_0374_020:0484c12_13	世尊！	020	世 尊  
ZH_T12_0374_020:0484c14_1	我若不遇如來世尊，當於無量阿僧祇劫在大地獄受無量苦；	020	我 若 不 遇 如 來 世 尊  當 於 無量阿僧祇劫 在 大 地 獄 受 無 量 苦  
ZH_T12_0374_020:0484c15_8	我今見佛，以是見佛所得功德，破壞眾生所有一切煩惱惡心。	020	我 今 見 佛  以 是 見 佛 所得功德  破 壞 眾 生 所有一切 煩 惱 惡 心  
ZH_T12_0374_020:0484c16_2	」佛言：	020	 佛 言  
ZH_T12_0374_020:0484c16_6	「大王！	020	 大 王  
ZH_T12_0374_020:0484c16_12	善哉，善哉！	020	善 哉  善 哉  
ZH_T12_0374_020:0484c17_4	我今知汝必能破壞眾生惡心。	020	我 今 知 汝 必 能 破 壞 眾 生 惡 心  
ZH_T12_0374_020:0484c17_9	」「世尊！	020	  世 尊  
ZH_T12_0374_020:0484c19_9	若我審能破壞眾生諸惡心者，使我常在阿鼻地獄，無量劫中為諸眾生受大苦惱，不以為苦。	020	若 我 審 能 破 壞 眾 生 諸 惡 心 者  使 我 常 在 阿鼻地獄  無 量 劫 中 為 諸 眾 生 受 大 苦 惱  不 以 為 苦  
ZH_T12_0374_020:0484c22_3	」爾時摩伽陀國無量人民悉發阿耨多羅三藐三菩提心，以如是等無量人民發大心故，阿闍世王所有重罪即得微薄。	020	 爾 時 摩伽陀國 無 量 人 民 悉 發 阿耨多羅三藐三菩提 心  以 如 是 等 無 量 人 民 發 大 心 故  阿 闍 世 王 所 有 重 罪 即 得 微 薄  
ZH_T12_0374_020:0484c23_8	王及夫人、後宮婇女，悉皆同發阿耨多羅三藐三菩提心。	020	王 及 夫 人  後 宮 婇 女  悉 皆 同 發 阿耨多羅三藐三菩提 心  
ZH_T12_0374_020:0484c24_1	爾時阿闍世王語耆婆言：	020	爾 時 阿 闍 世 王 語 耆 婆 言  
ZH_T12_0374_020:0484c24_5	「耆婆！	020	 耆 婆  
ZH_T12_0374_020:0484c27_7	我今未死已得天身，捨於短命而得長命，捨無常身而得常身，令諸眾生發阿耨多羅三藐三菩提心，即是天身、長命、常身，即是一切諸佛弟子。	020	我 今 未 死 已 得 天 身  捨 於 短 命 而 得 長 命  捨 無 常 身 而 得 常 身  令 諸 眾 生 發 阿耨多羅三藐三菩提 心  即 是 天 身  長 命  常 身  即 是 一切諸佛 弟 子  
ZH_T12_0374_020:0484c29_5	」說是語已，即以種種寶幢、幡蓋、香花瓔珞、微妙伎樂而供養佛，復以偈頌而讚歎言：	020	 說 是 語 已  即 以 種 種 寶 幢  幡 蓋  香 花 瓔 珞  微 妙 伎 樂 而 供 養 佛  復 以 偈 頌 而 讚 歎 言  
ZH_T12_0374_020:0485a01_0	「實語甚微妙，　　善巧於句義，	020	 實 語 甚 微 妙    善 巧 於 句 義  
ZH_T12_0374_020:0485a02_13	甚深祕密藏，　　為眾故顯示。	020	甚深祕密 藏    為 眾 故 顯 示  
ZH_T12_0374_020:0485a03_0	所有廣博言，　　為眾故略說，	020	所 有 廣 博 言    為 眾 故 略 說  
ZH_T12_0374_020:0485a04_13	具足如是言，　　善能療眾生。	020	具 足 如 是 言    善 能 療 眾 生  
ZH_T12_0374_020:0485a05_0	若有諸眾生，　　得聞是語者，	020	若 有 諸 眾 生    得 聞 是 語 者  
ZH_T12_0374_020:0485a06_13	若信及不信，　　定知是佛說。	020	若 信 及 不 信    定 知 是 佛 說  
ZH_T12_0374_020:0485a07_0	諸佛常軟語，　　為眾故說麁，	020	諸 佛 常 軟 語    為 眾 故 說 麁  
ZH_T12_0374_020:0485a08_13	麁語及軟語，　　皆歸第一義。	020	麁 語 及 軟 語    皆 歸 第 一 義  
ZH_T12_0374_020:0485a09_13	是故我今者，　　歸依於世尊。	020	是 故 我 今 者    歸 依 於 世 尊  
ZH_T12_0374_020:0485a10_0	如來語一味，　　猶如大海水，	020	如 來 語 一 味    猶 如大海水  
ZH_T12_0374_020:0485a11_13	是名第一諦，　　故無無義語。	020	是 名 第 一 諦    故 無 無 義 語  
ZH_T12_0374_020:0485a12_0	如來今所說，　　種種無量法，	020	如 來 今 所 說    種 種 無 量 法  
ZH_T12_0374_020:0485a13_13	男女大小聞，　　同獲第一義。	020	男 女 大 小 聞    同 獲 第 一 義  
ZH_T12_0374_020:0485a14_0	無因亦無果，　　無生及無滅，	020	無 因 亦 無 果    無 生 及 無 滅  
ZH_T12_0374_020:0485a15_13	是名大涅槃，　　聞者破諸果。	020	是 名 大 涅 槃    聞 者 破 諸 果  
ZH_T12_0374_020:0485a16_0	如來為一切，　　常作慈父母，	020	如 來 為 一 切    常 作 慈 父 母  
ZH_T12_0374_020:0485a17_0	當知諸眾生，　　皆是如來子，	020	當 知 諸 眾 生    皆 是 如 來 子  
ZH_T12_0374_020:0485a18_13	世尊大慈悲，　　為眾故苦行。	020	世 尊 大 慈 悲    為 眾 故 苦 行  
ZH_T12_0374_020:0485a19_0	如人著鬼魅，　　狂亂多所作，	020	如 人 著 鬼 魅    狂 亂 多 所 作  
ZH_T12_0374_020:0485a20_0	我今得見佛，　　所得三業善，	020	我 今 得 見 佛    所 得 三 業 善  
ZH_T12_0374_020:0485a21_13	願以此功德，　　迴向無上道。	020	願 以 此 功 德    迴 向 無 上 道  
ZH_T12_0374_020:0485a22_0	我今所供養，　　佛法及眾僧，	020	我 今 所 供 養    佛 法 及 眾 僧  
ZH_T12_0374_020:0485a23_13	願以此功德，　　三寶常在世。	020	願 以 此 功 德    三 寶 常 在 世  
ZH_T12_0374_020:0485a24_0	我今所當得，　　種種諸功德，	020	我 今 所 當 得    種 種 諸 功 德  
ZH_T12_0374_020:0485a25_13	願以此破壞，　　眾生四種魔。	020	願 以 此 破 壞    眾 生 四 種 魔  
ZH_T12_0374_020:0485a26_0	我遇惡知識，　　造作三世罪，	020	我 遇 惡 知 識    造 作 三 世 罪  
ZH_T12_0374_020:0485a27_13	今於佛前悔，　　願後更莫造。	020	今 於 佛 前 悔    願 後 更 莫 造  
ZH_T12_0374_020:0485a28_0	願諸眾生等，　　悉發菩提心，	020	願 諸 眾 生 等    悉 發菩提心  
ZH_T12_0374_020:0485a29_13	繫心常思念，　　十方一切佛。	020	繫 心 常 思 念    十 方 一 切 佛  
ZH_T12_0374_020:0485b01_0	復願諸眾生，　　永破諸煩惱，	020	復 願 諸 眾 生    永 破 諸 煩 惱  
ZH_T12_0374_020:0485b02_13	了了見佛性，　　猶如妙德等。	020	了 了 見 佛 性    猶 如 妙 德 等  
ZH_T12_0374_020:0485b03_9	」爾時世尊讚阿闍世王：	020	 爾 時 世 尊 讚 阿 闍 世 王  
ZH_T12_0374_020:0485b03_16	「善哉，善哉！	020	 善 哉  善 哉  
ZH_T12_0374_020:0485b04_18	若有人能發菩提心，當知是人則為莊嚴諸佛大眾。	020	若 有 人 能 發菩提心  當 知 是 人 則 為 莊 嚴 諸 佛 大 眾  
ZH_T12_0374_020:0485b05_2	大王！	020	大 王  
ZH_T12_0374_020:0485b07_8	汝昔已於毘婆尸佛初發阿耨多羅三藐三菩提心，從是已來至我出世，於其中間未曾墮於地獄受苦。	020	汝 昔 已 於 毘 婆 尸 佛 初 發 阿耨多羅三藐三菩提 心  從 是 已 來 至 我 出 世  於其中間 未 曾 墮 於 地 獄 受 苦  
ZH_T12_0374_020:0485b08_7	大王當知，菩提之心乃有如是無量果報。	020	大 王 當 知  菩提之心 乃 有 如 是 無 量 果 報  
ZH_T12_0374_020:0485b08_10	大王！	020	大 王  
ZH_T12_0374_020:0485b09_4	從今已往常當勤修菩提之心。	020	從 今 已 往 常 當 勤 修 菩提之心  
ZH_T12_0374_020:0485b09_8	何以故？	020	何 以 故  
ZH_T12_0374_020:0485b10_2	從是因緣，當得消滅無量惡故。	020	從 是 因 緣  當 得 消 滅 無 量 惡 故  
ZH_T12_0374_020:0485b11_13	」爾時阿闍世王，及摩伽陀舉國人民從座而起，繞佛三匝，辭退還宮。	020	 爾 時 阿 闍 世 王  及 摩 伽 陀 舉 國 人 民 從座而起  繞 佛 三 匝  辭 退 還 宮  
ZH_T12_0374_020:0485b12_2	天行品者如雜花說。	020	天 行 品 者 如 雜 花 說  
ZH_T12_0374_020:0485b14_4	9 嬰兒行品大般涅槃經嬰兒行品第九「善男子！	020	9   嬰 兒 行 品 大 般 涅 槃 經 嬰 兒 行 品 第 九  善 男 子  
ZH_T12_0374_020:0485b14_11	云何名嬰兒行？	020	云 何 名 嬰 兒 行  
ZH_T12_0374_020:0485b14_15	善男子！	020	善 男 子  
ZH_T12_0374_020:0485b15_10	不能起住、來去、語言，是名嬰兒。	020	不 能 起 住  來 去  語 言  是 名 嬰 兒  
ZH_T12_0374_020:0485b16_8	如來亦爾，不能起者，如來終不起諸法相；	020	如 來 亦 爾  不 能 起 者  如 來 終 不 起 諸 法 相  
ZH_T12_0374_020:0485b17_3	不能住者，如來不著一切諸法；	020	不 能 住 者  如 來 不 著 一切諸法  
ZH_T12_0374_020:0485b17_17	不能來者，如來身行無有動搖；	020	不 能 來 者  如 來 身 行 無 有 動 搖  
ZH_T12_0374_020:0485b18_12	不能去者，如來已到大般涅槃；	020	不 能 去 者  如 來 已 到 大 般 涅 槃  
ZH_T12_0374_020:0485b19_16	不能語者，如來雖為一切眾生演說諸法，實無所說。	020	不 能 語 者  如 來 雖 為 一 切 眾 生 演 說 諸 法  實 無 所 說  
ZH_T12_0374_020:0485b20_1	何以故？	020	何 以 故  
ZH_T12_0374_020:0485b20_11	有所說者，名有為法。	020	有 所 說 者  名 有 為 法  
ZH_T12_0374_020:0485b21_4	如來世尊非是有為，是故無說。	020	如 來 世 尊 非 是 有 為  是 故 無 說  
ZH_T12_0374_020:0485b22_9	又無語者，猶如嬰兒，語言未了，雖復有語，實亦無語。	020	又 無 語 者  猶 如 嬰 兒  語 言 未 了  雖 復 有 語  實 亦 無 語  
ZH_T12_0374_020:0485b24_2	如來亦爾，語未了者，即是諸佛祕密之言，雖有所說，眾生不解，故名無語。	020	如 來 亦 爾  語 未 了 者  即 是 諸 佛 祕 密 之 言  雖 有 所 說  眾 生 不 解  故 名 無 語  
ZH_T12_0374_020:0485b25_16	又嬰兒者，名物不一、未知正語，雖名物不一、未知正語，非不因此而得識物。	020	又 嬰 兒 者  名 物 不 一  未 知 正 語  雖 名 物 不 一  未 知 正 語  非 不 因 此 而 得 識 物  
ZH_T12_0374_020:0485b27_13	如來亦爾，一切眾生方類各異，所言不同，如來方便隨而說之，亦令一切因而得解。	020	如 來 亦 爾  一 切 眾 生 方 類 各 異  所 言 不 同  如 來 方 便 隨 而 說 之  亦 令 一 切 因 而 得 解  
ZH_T12_0374_020:0485b28_3	又嬰兒者，能說大字。	020	又 嬰 兒 者  能 說 大 字  
ZH_T12_0374_020:0485b29_13	如來亦爾，說於大字，所謂婆啝，啝者有為，婆者無為，是名嬰兒。	020	如 來 亦 爾  說 於 大 字  所 謂 婆 啝  啝 者 有 為  婆 者 無 為  是 名 嬰 兒  
ZH_T12_0374_020:0485c02_12	啝者名為無常，婆者名為有常，如來說常，眾生聞已，為常法故，斷於無常，是名嬰兒行。	020	啝 者 名 為 無 常  婆 者 名 為 有 常  如 來 說 常  眾 生 聞 已  為 常 法 故  斷 於 無 常  是 名 嬰 兒 行  
ZH_T12_0374_020:0485c03_8	又嬰兒者，不知苦樂、晝夜、父母。	020	又 嬰 兒 者  不 知 苦 樂  晝 夜  父 母  
ZH_T12_0374_020:0485c05_11	菩薩摩訶薩亦復如是，為眾生故，不知苦樂、無晝夜想，於諸眾生其心平等，故無父母親踈等相。	020	菩薩摩訶薩 亦復如是  為 眾 生 故  不 知 苦 樂  無 晝 夜 想  於 諸 眾 生 其 心 平 等  故 無 父 母 親 踈 等 相  
ZH_T12_0374_020:0485c06_6	又嬰兒者，不能造作大小諸事。	020	又 嬰 兒 者  不 能 造 作 大 小 諸 事  
ZH_T12_0374_020:0485c07_11	菩薩摩訶薩亦復如是，菩薩不造生死作業，是名不作。	020	菩薩摩訶薩 亦復如是  菩 薩 不 造 生 死 作 業  是 名 不 作  
ZH_T12_0374_020:0485c08_13	大事者即五逆也，菩薩摩訶薩終不造作五逆重罪；	020	大 事 者 即 五 逆 也  菩薩摩訶薩 終 不 造 作 五 逆 重 罪  
ZH_T12_0374_020:0485c10_2	小事者即二乘心，菩薩終不退菩提心，而作聲聞辟支佛乘。	020	小 事 者 即 二 乘 心  菩 薩 終 不 退 菩 提 心  而 作 聲 聞 辟 支 佛 乘  
ZH_T12_0374_020:0485c11_11	又嬰兒行者，如彼嬰兒啼哭之時，父母即以楊樹黃葉，而語之言：	020	又 嬰 兒 行 者  如 彼 嬰 兒 啼 哭 之 時  父 母 即 以 楊 樹 黃 葉  而 語 之 言  
ZH_T12_0374_020:0485c12_1	『莫啼莫啼，我與汝金。	020	 莫 啼 莫 啼  我 與 汝 金  
ZH_T12_0374_020:0485c13_4	』嬰兒見已生真金想，便止不啼，然此楊葉實非金也。	020	 嬰 兒 見 已 生 真 金 想  便 止 不 啼  然 此 楊 葉 實 非 金 也  
ZH_T12_0374_020:0485c14_17	木牛木馬、木男木女，嬰兒見已，亦復生於男女等想，即止不啼，實非男女。	020	木 牛 木 馬  木 男 木 女  嬰 兒 見 已  亦 復 生 於 男 女 等 想  即 止 不 啼  實 非 男 女  
ZH_T12_0374_020:0485c15_12	以作如是男女想故，名曰嬰兒。	020	以 作 如 是 男 女 想 故  名 曰 嬰 兒  
ZH_T12_0374_020:0485c18_4	如來亦爾，若有眾生欲造眾惡，如來為說三十三天常樂我淨、端正自恣、於妙宮殿受五欲樂、六根所對無非是樂。	020	如 來 亦 爾  若 有 眾 生 欲 造 眾 惡  如 來 為 說 三十三天 常樂我淨  端 正 自 恣  於 妙 宮 殿 受 五 欲 樂  六 根 所 對 無 非 是 樂  
ZH_T12_0374_020:0485c19_12	眾生聞有如是樂故，心生貪樂，止不為惡，勤作三十三天善業。	020	眾 生 聞 有 如 是 樂 故  心 生 貪 樂  止 不 為 惡  勤 作 三十三天 善 業  
ZH_T12_0374_020:0485c21_1	實是生死無常、無樂、無我、無淨，為度眾生，方便說言常樂我淨。	020	實 是 生 死 無 常  無 樂  無 我  無 淨  為 度 眾 生  方 便 說 言 常樂我淨  
ZH_T12_0374_020:0485c23_8	又嬰兒者，若有眾生厭生死時，如來則為說於二乘，然實無有二乘之實，以二乘故知生死過，見涅槃樂。	020	又 嬰 兒 者  若 有 眾 生 厭 生 死 時  如 來 則 為 說 於 二 乘  然 實 無 有 二 乘 之 實  以 二 乘 故 知 生 死 過  見 涅 槃 樂  
ZH_T12_0374_020:0485c24_20	以是見故，則能自知，有斷、不斷，有真、不真，有修、不修，有得、不得。	020	以 是 見 故  則 能 自 知  有 斷  不 斷  有 真  不 真  有 修  不 修  有 得  不 得  
ZH_T12_0374_020:0485c24_25	「善男子！	020	 善 男 子  
ZH_T12_0374_020:0485c27_3	如彼嬰兒於非金中而生金想，如來亦爾，於不淨中而為說淨，如來已得第一義故則無虛妄。	020	如 彼 嬰 兒 於 非 金 中 而 生 金 想  如 來 亦 爾  於 不 淨 中 而 為 說 淨  如 來 已 得 第 一 義 故 則 無 虛 妄  
ZH_T12_0374_020:0486a01_5	如彼嬰兒，於非牛馬作牛馬想，若有眾生於非道中作真道想，如來亦說非道為道，非道之中實無有道，以能生道微因緣故，說非道為道。	020	如 彼 嬰 兒  於 非 牛 馬 作 牛 馬 想  若 有 眾 生 於 非 道 中 作 真 道 想  如 來 亦 說 非 道 為 道  非 道 之 中 實 無 有 道  以 能 生 道 微 因 緣 故  說 非 道 為 道  
ZH_T12_0374_020:0486a03_4	如彼嬰兒於木男女生男女想，如來亦爾，知非眾生說眾生想，而實無有眾生相也。	020	如 彼 嬰 兒 於 木 男 女 生 男 女 想  如 來 亦 爾  知 非 眾 生 說 眾 生 想  而 實 無 有 眾 生 相 也  
ZH_T12_0374_020:0486a04_12	若佛如來說無眾生，一切眾生則墮邪見，是故如來說有眾生。	020	若 佛 如 來 說 無 眾 生  一 切 眾 生 則 墮 邪 見  是 故 如 來 說 有 眾 生  
ZH_T12_0374_020:0486a05_12	於眾生中作眾生想者，則不能破眾生相也；	020	於 眾 生 中 作 眾 生 想 者  則 不 能 破 眾 生 相 也  
ZH_T12_0374_020:0486a07_13	若於眾生破眾生相者，是則能得大般涅槃，以得如是大涅槃故，止不啼哭，是名嬰兒行。	020	若 於 眾 生 破 眾 生 相 者  是 則 能 得 大 般 涅 槃  以 得 如 是 大 涅 槃 故  止 不 啼 哭  是 名 嬰 兒 行  
ZH_T12_0374_020:0486a07_17	善男子！	020	善 男 子  
ZH_T12_0374_020:0486a09_9	若有男女受持讀誦、書寫解說是五行者，當知是人必定當得如是五行。	020	若 有 男 女 受持讀誦  書 寫 解 說 是 五 行 者  當 知 是 人 必 定 當 得 如 是 五 行  
ZH_T12_0374_020:0486a09_18	」迦葉菩薩白佛言：	020	 迦 葉 菩 薩 白 佛 言  
ZH_T12_0374_020:0486a10_1	「世尊！	020	 世 尊  
ZH_T12_0374_020:0486a10_19	如我解佛所說義者，我亦定當得是五行。	020	如 我 解 佛 所 說 義 者  我 亦 定 當 得 是 五 行  
ZH_T12_0374_020:0486a11_2	」佛言：	020	 佛 言  
ZH_T12_0374_020:0486a11_7	「善男子！	020	 善 男 子  
ZH_T12_0374_020:0486a12_15	不獨汝得如是五行，今此會中九十三萬人亦同於汝，得是五行。	020	不 獨 汝 得 如 是 五 行  今 此 會 中 九 十 三 萬 人 亦 同 於 汝  得 是 五 行  
ZH_T12_0374_020:0486a13_100	」大般涅槃經卷第二十	020	 大 般 涅 槃 經 卷 第 二 十 
