segmentnr	original	stemmed
ZH_T47_1972_001:0296c06_19	眾生煩惱盡。	眾 生 煩 惱 盡  
ZH_T47_1972_001:0296c07_3	我願乃盡。	我 願 乃 盡  
ZH_T47_1972_001:0296c07_18	而虛空界乃至眾生業煩惱不可盡。	而 虛 空 界 乃 至 眾 生 業 煩 惱 不 可 盡  
ZH_T47_1972_001:0296c08_9	故我此願王無有窮盡。	故 我 此 願 王 無 有 窮 盡  
ZH_T47_1972_001:0296c08_18	念念相續無有間斷。	念 念 相 續 無有間斷  
ZH_T47_1972_001:0296c09_8	身語意業無有疲厭。	身語意業 無 有 疲 厭  
ZH_T47_1972_001:0296c09_14	至臨命終時。	至 臨命終時  
ZH_T47_1972_001:0296c10_8	最後剎那一切諸根悉皆散壞。	最 後 剎 那 一 切 諸 根 悉 皆 散 壞  
ZH_T47_1972_001:0296c10_17	一切威勢悉皆退失。	一 切 威 勢 悉 皆 退 失  
ZH_T47_1972_001:0296c12_1	輔相大臣宮殿內外象馬車乘珍寶伏藏無復相隨。	輔 相 大 臣 宮 殿 內 外 象 馬 車 乘 珍 寶 伏 藏 無 復 相 隨  
ZH_T47_1972_001:0296c12_10	惟此願王不相捨離。	惟 此 願 王 不相捨離  
ZH_T47_1972_001:0296c12_19	於一切時引導其前。	於一切時 引 導 其 前  
ZH_T47_1972_001:0296c13_12	一剎那間即得往生極樂世界。	一 剎 那 間 即 得 往 生 極樂世界  
ZH_T47_1972_001:0296c14_3	到已即見阿彌陀佛。	到 已 即 見 阿 彌 陀 佛  
ZH_T47_1972_001:0296c14_12	其人自見生蓮華中。	其 人 自 見 生 蓮 華 中  
ZH_T47_1972_001:0296c14_17	蒙佛授記。	蒙 佛 授 記  
ZH_T47_1972_001:0296c15_2	得授記已。	得 授 記 已  
ZH_T47_1972_001:0296c15_7	經無數劫。	經 無 數 劫  
ZH_T47_1972_001:0296c16_1	普於十方不可說不可說世界。	普 於 十 方 不可說不可說 世 界  
ZH_T47_1972_001:0296c16_6	以智慧力。	以 智 慧 力  
ZH_T47_1972_001:0296c16_15	隨眾生心而為利益。	隨 眾 生 心 而 為 利 益  
ZH_T47_1972_001:0296c17_7	乃至能於煩惱大苦海中。	乃 至 能 於 煩 惱 大 苦 海 中  
ZH_T47_1972_001:0296c18_6	拔濟眾生令其出離皆得往生極樂世界。	拔 濟 眾 生 令 其 出 離 皆 得 往 生 極樂世界  
ZH_T47_1972_001:0296c18_13	又如法華經云。	又 如 法 華 經 云  
ZH_T47_1972_001:0296c18_18	聞是經典。	聞 是 經 典  
ZH_T47_1972_001:0296c19_3	如說修行。	如說修行  
ZH_T47_1972_001:0296c19_8	於此命終。	於 此 命 終  
ZH_T47_1972_001:0296c20_8	即往安樂世界阿彌陀佛大菩薩眾圍繞住處。	即 往 安樂世界 阿 彌 陀 佛 大 菩 薩 眾 圍 繞 住 處  
ZH_T47_1972_001:0296c20_17	生蓮花中寶座之上。	生 蓮 花 中 寶 座 之 上  
ZH_T47_1972_001:0296c21_6	不復為貪欲所惱。	不 復 為 貪 欲 所 惱  
ZH_T47_1972_001:0296c21_17	亦復不為嗔恚愚癡所惱。	亦 復 不 為 嗔 恚 愚 癡 所 惱  
ZH_T47_1972_001:0296c22_11	亦復不為憍慢嫉妬諸垢所惱。	亦 復 不 為 憍 慢 嫉 妬 諸 垢 所 惱  
ZH_T47_1972_001:0296c23_3	得菩薩神通無生法忍。	得 菩 薩 神 通 無生法忍  
ZH_T47_1972_001:0296c23_10	又如大寶積經。	又 如 大 寶 積 經  
ZH_T47_1972_001:0296c23_19	發十種心往生極樂。	發 十 種 心 往 生 極 樂  
ZH_T47_1972_001:0296c24_4	佛告彌勒。	佛 告 彌 勒  
ZH_T47_1972_001:0296c25_7	如是十心非諸凡愚不善丈夫具煩惱者之所能發。	如 是 十 心 非 諸 凡 愚 不 善 丈 夫 具 煩 惱 者 之 所 能 發  
ZH_T47_1972_001:0296c25_12	何者為十。	何 者 為 十  
ZH_T47_1972_001:0296c26_8	一者於諸眾生起於大慈無損害心。	一 者 於 諸 眾 生 起 於 大 慈 無 損 害 心  
ZH_T47_1972_001:0296c27_5	二者於諸眾生起於大悲無逼惱心。	二 者 於 諸 眾 生 起 於 大 悲 無 逼 惱 心  
ZH_T47_1972_001:0296c28_2	三者於佛王法不惜身命樂守護心。	三 者 於 佛 王 法 不惜身命 樂 守 護 心  
ZH_T47_1972_001:0296c28_17	四者於一切法發生勝忍無執著心。	四 者 於一切法 發 生 勝 忍 無 執 著 心  
ZH_T47_1972_001:0296c29_13	五者不貪利養恭敬尊重淨意樂心。	五 者 不 貪 利養恭敬 尊 重 淨 意 樂 心  
ZH_T47_1972_001:0297a01_10	六者求佛種智於一切時無忘失心。	六 者 求 佛 種 智 於一切時 無 忘 失 心  
ZH_T47_1972_001:0297a02_7	七者於諸眾生尊重恭敬無下劣心。	七 者 於 諸 眾 生 尊 重 恭 敬 無 下 劣 心  
ZH_T47_1972_001:0297a03_4	八者不著世論於菩提分生決定心。	八 者 不 著 世 論 於 菩 提 分 生 決 定 心  
ZH_T47_1972_001:0297a04_1	九者種諸善根無有雜染清淨之心。	九 者 種 諸 善 根 無 有 雜 染 清 淨 之 心  
ZH_T47_1972_001:0297a04_16	十者於諸如來捨離諸相起隨念心。	十 者 於 諸 如 來 捨 離 諸 相 起 隨 念 心  
ZH_T47_1972_001:0297a05_6	是名菩薩發十種心。	是 名 菩 薩 發 十 種 心  
ZH_T47_1972_001:0297a05_15	由是心故當得往生。	由 是 心 故 當 得 往 生  
ZH_T47_1972_001:0297a06_7	若人於此十心隨成一心。	若 人 於 此 十 心 隨 成 一 心  
ZH_T47_1972_001:0297a06_16	樂欲往生彼佛世界。	樂 欲 往 生 彼 佛 世 界  
ZH_T47_1972_001:0297a07_6	若不得生無有是處。	若 不 得 生 無 有 是 處  
ZH_T47_1972_001:0297a07_12	又如觀經云。	又 如 觀 經 云  
ZH_T47_1972_001:0297a08_3	欲生彼國者當修三福。	欲 生 彼 國 者 當 修 三 福  
ZH_T47_1972_001:0297a08_10	一者孝養父母。	一 者 孝 養 父 母  
ZH_T47_1972_001:0297a08_15	奉事師長。	奉 事 師 長  
ZH_T47_1972_001:0297a09_1	慈心不殺。	慈 心 不 殺  
ZH_T47_1972_001:0297a09_6	修十善業。	修 十 善 業  
ZH_T47_1972_001:0297a09_17	二者受持三歸具足眾戒。	二 者 受 持 三 歸 具 足 眾 戒  
ZH_T47_1972_001:0297a10_2	不犯威儀。	不 犯 威 儀  
ZH_T47_1972_001:0297a10_9	三者發菩提心。	三 者 發菩提心  
ZH_T47_1972_001:0297a10_14	深信因果。	深 信 因 果  
ZH_T47_1972_001:0297a10_19	讀誦大乘。	讀 誦 大 乘  
ZH_T47_1972_001:0297a11_3	勸進行者。	勸 進 行 者  
ZH_T47_1972_001:0297a12_2	此三種業過去未來現在諸佛淨業正因。	此 三 種 業 過去未來現在 諸 佛 淨 業 正 因  
ZH_T47_1972_001:0297a12_5	疏曰。	疏 曰  
ZH_T47_1972_001:0297a12_11	初業共凡夫。	初 業 共 凡 夫  
ZH_T47_1972_001:0297a12_17	次業共二乘。	次 業 共 二 乘  
ZH_T47_1972_001:0297a13_8	後業乃大乘不共之法也。	後 業 乃 大 乘 不 共 之 法 也  
ZH_T47_1972_001:0297a14_7	又如大本三輩發菩提心及諸經論所明。	又 如 大 本 三 輩 發菩提心 及 諸 經 論 所 明  
ZH_T47_1972_001:0297a14_12	誦經持呪。	誦 經 持 呪  
ZH_T47_1972_001:0297a14_17	建塔造像。	建 塔 造 像  
ZH_T47_1972_001:0297a15_2	禮拜讚頌。	禮 拜 讚 頌  
ZH_T47_1972_001:0297a15_7	奉持齋戒。	奉 持 齋 戒  
ZH_T47_1972_001:0297a15_12	燒香散華。	燒 香 散 華  
ZH_T47_1972_001:0297a15_17	懸繒幡蓋。	懸 繒 幡 蓋  
ZH_T47_1972_001:0297a16_7	凡一行一事足以求生者。	凡 一 行 一 事 足 以 求 生 者  
ZH_T47_1972_001:0297a16_17	資之以信願回向之力。	資 之 以 信 願 回 向 之 力  
ZH_T47_1972_001:0297a17_3	無不生也。	無 不 生 也  
ZH_T47_1972_001:0297a17_8	如上泛引。	如 上 泛 引  
ZH_T47_1972_001:0297a17_13	通名眾行。	通 名 眾 行  
ZH_T47_1972_001:0297a18_4	然願行既有大小之不等。	然 願 行 既 有 大 小 之 不 等  
ZH_T47_1972_001:0297a18_14	而又各有理事之不同。	而 又 各 有 理 事 之 不 同  
ZH_T47_1972_001:0297a19_8	且如華嚴十願寶積十心之類。	且 如 華 嚴 十 願 寶 積 十 心 之 類  
ZH_T47_1972_001:0297a19_14	生於極樂者。	生 於 極 樂 者  
ZH_T47_1972_001:0297a20_8	其所感依正之勝及所見之佛。	其 所 感 依 正 之 勝 及 所 見 之 佛  
ZH_T47_1972_001:0297a20_13	所聞之法。	所 聞 之 法  
ZH_T47_1972_001:0297a21_1	較諸小行常流。	較 諸 小 行 常 流  
ZH_T47_1972_001:0297a21_7	應必懸異也。	應 必 懸 異 也  
ZH_T47_1972_001:0297a22_2	問曰。	問 曰  
ZH_T47_1972_001:0297a22_13	吾聞善財童子圓頓利根。	吾 聞 善 財 童 子 圓 頓 利 根  
ZH_T47_1972_001:0297a22_18	一生取辨。	一 生 取 辨  
ZH_T47_1972_001:0297a23_5	今乃不生華藏。	今 乃 不 生 華 藏  
ZH_T47_1972_001:0297a23_11	而勸生極樂。	而 勸 生 極 樂  
ZH_T47_1972_001:0297a23_16	此何意耶。	此 何 意 耶  
ZH_T47_1972_001:0297a23_19	答曰。	答 曰  
ZH_T47_1972_001:0297a24_7	華嚴疏中自有此問。	華 嚴 疏 中 自 有 此 問  
ZH_T47_1972_001:0297a24_12	彼所答云。	彼 所 答 云  
ZH_T47_1972_001:0297a24_16	有緣故。	有 緣 故  
ZH_T47_1972_001:0297a25_2	歸憑情一故。	歸 憑 情 一 故  
ZH_T47_1972_001:0297a25_8	不離華藏故。	不 離 華 藏 故  
ZH_T47_1972_001:0297a25_13	即本師故。	即 本 師 故  
ZH_T47_1972_001:0297a26_6	謂華藏中所有佛剎皆微塵數。	謂 華 藏 中 所 有 佛 剎 皆 微 塵 數  
ZH_T47_1972_001:0297a26_15	極樂去此十萬億土。	極 樂 去 此 十 萬 億 土  
ZH_T47_1972_001:0297a27_5	並未出於剎種之中。	並 未 出 於 剎 種 之 中  
ZH_T47_1972_001:0297a27_10	故不離也。	故 不 離 也  
ZH_T47_1972_001:0297a27_13	經云。	經 云  
ZH_T47_1972_001:0297a28_9	或有見佛無量壽觀自在等共圍繞。	或 有 見 佛 無 量 壽 觀 自 在 等 共 圍 繞  
ZH_T47_1972_001:0297a28_14	此讚遮那。	此 讚 遮 那  
ZH_T47_1972_001:0297a28_19	隨名異化。	隨 名 異 化  
ZH_T47_1972_001:0297a29_5	故即本師也。	故 即 本 師 也  
ZH_T47_1972_001:0297a29_8	又曰。	又 曰  
ZH_T47_1972_001:0297b01_2	普賢為善財海眾結歸極樂者。	普 賢 為 善 財 海 眾 結 歸 極 樂 者  
ZH_T47_1972_001:0297b02_1	蓋為信解圓宗之人入文殊智修普賢行。	蓋 為 信 解 圓 宗 之 人 入 文 殊 智 修 普 賢 行  
ZH_T47_1972_001:0297b02_10	福慧事理皆稱法界。	福 慧 事 理 皆 稱 法 界  
ZH_T47_1972_001:0297b03_5	此大心人雖妙悟本明頓同諸聖。	此 大 心 人 雖 妙 悟 本 明 頓 同 諸 聖  
ZH_T47_1972_001:0297b03_12	然猶力用未充。	然 猶 力 用 未 充  
ZH_T47_1972_001:0297b04_4	未及如來出世普利眾生。	未 及 如 來 出 世 普 利 眾 生  
ZH_T47_1972_001:0297b04_15	所以暫依淨土親近彌陀。	所 以 暫 依 淨 土 親 近 彌 陀  
ZH_T47_1972_001:0297b05_1	直至成佛。	直 至 成 佛  
ZH_T47_1972_001:0297b05_6	意在此也。	意 在 此 也  
ZH_T47_1972_001:0297b06_2	問曰。	問 曰  
ZH_T47_1972_001:0297b06_7	眾行門中。	眾 行 門 中  
ZH_T47_1972_001:0297b06_18	既云大小不等理事有殊。	既 云 大 小 不 等 理 事 有 殊  
ZH_T47_1972_001:0297b07_7	所感生相亦乃懸異。	所 感 生 相 亦 乃 懸 異  
ZH_T47_1972_001:0297b08_2	然則觀想憶念二門修各不等。	然 則 觀 想 憶 念 二 門 修 各 不 等  
ZH_T47_1972_001:0297b08_11	其所感相同耶異耶。	其 所 感 相 同 耶 異 耶  
ZH_T47_1972_001:0297b08_14	答曰。	答 曰  
ZH_T47_1972_001:0297b08_19	皆不同也。	皆 不 同 也  
ZH_T47_1972_001:0297b09_3	故永明曰。	故 永 明 曰  
ZH_T47_1972_001:0297b09_12	九品往生事非一等。	九 品 往 生 事 非 一 等  
ZH_T47_1972_001:0297b10_2	或遊化國見佛應身。	或 遊 化 國 見 佛 應 身  
ZH_T47_1972_001:0297b10_11	或生報土見佛真體。	或 生 報 土 見 佛 真 體  
ZH_T47_1972_001:0297b11_1	或一夕而便登上地。	或 一 夕 而 便 登 上 地  
ZH_T47_1972_001:0297b11_10	或經劫而方證小乘。	或 經 劫 而 方 證 小 乘  
ZH_T47_1972_001:0297b11_16	或利根鈍根。	或 利 根 鈍 根  
ZH_T47_1972_001:0297b12_2	或定意散意。	或 定 意 散 意  
ZH_T47_1972_001:0297b12_8	或道悟遲速。	或 道 悟 遲 速  
ZH_T47_1972_001:0297b12_14	而機器不同。	而 機 器 不 同  
ZH_T47_1972_001:0297b12_20	或花開早晚。	或 花 開 早 晚  
ZH_T47_1972_001:0297b13_5	而時限有異。	而 時 限 有 異  
ZH_T47_1972_001:0297b13_10	又慈雲曰。	又 慈 雲 曰  
ZH_T47_1972_001:0297b13_15	雖分九品。	雖 分 九 品  
ZH_T47_1972_001:0297b13_20	猶是略分。	猶 是 略 分  
ZH_T47_1972_001:0297b14_8	若更細分亦應無量。	若 更 細 分 亦 應 無 量  
ZH_T47_1972_001:0297b15_2	問曰。	問 曰  
ZH_T47_1972_001:0297b15_13	極樂只是同居本非實報。	極 樂 只 是 同 居 本 非 實 報  
ZH_T47_1972_001:0297b16_6	何謂或生報土見佛真體耶。	何 謂 或 生 報 土 見 佛 真 體 耶  
ZH_T47_1972_001:0297b16_9	答曰。	答 曰  
ZH_T47_1972_001:0297b17_3	爾將謂同居之外別有實報耶。	爾 將 謂 同 居 之 外 別 有 實 報 耶  
ZH_T47_1972_001:0297b17_12	當知三土不離同居。	當 知 三 土 不 離 同 居  
ZH_T47_1972_001:0297b18_5	特身境受用遞遞不相同耳。	特 身 境 受 用 遞 遞 不 相 同 耳  
ZH_T47_1972_001:0297b18_9	如經云。	如 經 云  
ZH_T47_1972_001:0297b19_9	彌陀佛身高六十萬億那由他恒河沙由旬等。	彌 陀 佛 身 高 六 十 萬 億 那 由 他 恒 河 沙 由 旬 等  
ZH_T47_1972_001:0297b19_13	古師曰。	古 師 曰  
ZH_T47_1972_001:0297b19_19	此實報身也。	此 實 報 身 也  
ZH_T47_1972_001:0297b20_4	又霅川曰。	又 霅 川 曰  
ZH_T47_1972_001:0297b20_13	極樂國土四土不同。	極樂國土 四 土 不 同  
ZH_T47_1972_001:0297b21_1	豈但極樂為然。	豈 但 極 樂 為 然  
ZH_T47_1972_001:0297b21_5	荊溪云。	荊 溪 云  
ZH_T47_1972_001:0297b21_10	直觀此土。	直 觀 此 土  
ZH_T47_1972_001:0297b21_15	四土具足。	四 土 具 足  
ZH_T47_1972_001:0297b22_7	如當時華嚴海會不離逝多林。	如 當 時 華 嚴 海 會 不 離 逝 多 林  
ZH_T47_1972_001:0297b22_17	而諸大聲聞不知不見。	而 諸 大 聲 聞 不 知 不 見  
ZH_T47_1972_001:0297b23_3	即此類也。	即 此 類 也  
ZH_T47_1972_001:0297b24_2	問曰。	問 曰  
ZH_T47_1972_001:0297b24_11	既云此土四土具足。	既 云 此 土 四 土 具 足  
ZH_T47_1972_001:0297b25_1	只消就此展轉修行。	只 消 就 此 展 轉 修 行  
ZH_T47_1972_001:0297b25_12	反欲捨此而生彼國何耶。	反 欲 捨 此 而 生 彼 國 何 耶  
ZH_T47_1972_001:0297b25_15	答曰。	答 曰  
ZH_T47_1972_001:0297b26_2	此方雖具四土。	此 方 雖 具 四 土  
ZH_T47_1972_001:0297b26_9	奈何穢業難除。	奈 何 穢 業 難 除  
ZH_T47_1972_001:0297b26_16	夫欲捨穢取淨。	夫 欲 捨 穢 取 淨  
ZH_T47_1972_001:0297b27_4	勢須彼國求生。	勢 須 彼 國 求 生  
ZH_T47_1972_001:0297b27_8	四明云。	四 明 云  
ZH_T47_1972_001:0297b27_19	此土濁重十信方出苦輪。	此 土 濁 重 十 信 方 出 苦 輪  
ZH_T47_1972_001:0297b28_4	彼土境勝。	彼 土 境 勝  
ZH_T47_1972_001:0297b28_11	九品悉皆不退。	九 品 悉 皆 不 退  
ZH_T47_1972_001:0297b28_15	豈不聞。	豈 不 聞  
ZH_T47_1972_001:0297b29_4	大通佛世受教之徒。	大 通 佛 世 受 教 之 徒  
ZH_T47_1972_001:0297b29_11	已經塵點劫來。	已 經 塵 點 劫 來  
ZH_T47_1972_001:0297b29_18	尚在聲聞之地。	尚 在 聲 聞 之 地  
ZH_T47_1972_001:0297c01_3	皆因退轉。	皆 因 退 轉  
ZH_T47_1972_001:0297c01_8	故涉長時。	故 涉 長 時  
ZH_T47_1972_001:0297c01_16	如身子已證六心。	如 身 子 已 證 六 心  
ZH_T47_1972_001:0297c02_3	猶自退落五道。	猶 自 退 落 五 道  
ZH_T47_1972_001:0297c02_11	況悠悠修行者乎。	況 悠 悠 修 行 者 乎  
ZH_T47_1972_001:0297c03_2	蓋由此土多值退緣故。	蓋 由 此 土 多 值 退 緣 故  
ZH_T47_1972_001:0297c04_6	云魚子菴羅華菩薩初發心三事因中多及其結果少。	云 魚 子 菴 羅 華 菩 薩 初 發 心 三 事 因 中 多 及 其 結 果 少  
ZH_T47_1972_001:0297c04_11	若生極樂。	若 生 極 樂  
ZH_T47_1972_001:0297c04_16	藉彼勝緣。	藉 彼 勝 緣  
ZH_T47_1972_001:0297c05_5	博地凡夫便階不退。	博 地 凡 夫 便 階 不 退  
ZH_T47_1972_001:0297c05_14	以是之故求生彼國。	以 是 之 故 求 生 彼 國  
ZH_T47_1972_001:0297c06_2	問曰。	問 曰  
ZH_T47_1972_001:0297c06_11	同居淨土其類甚多。	同 居 淨 土 其 類 甚 多  
ZH_T47_1972_001:0297c06_17	今偏指極樂。	今 偏 指 極 樂  
ZH_T47_1972_001:0297c07_5	而又偏讚其境勝。	而 又 偏 讚 其 境 勝  
ZH_T47_1972_001:0297c07_10	緣勝何耶。	緣 勝 何 耶  
ZH_T47_1972_001:0297c07_13	答曰。	答 曰  
ZH_T47_1972_001:0297c08_4	經云彼國眾生無有眾苦。	經 云 彼 國 眾 生 無 有 眾 苦  
ZH_T47_1972_001:0297c08_9	但受諸樂。	但 受 諸 樂  
ZH_T47_1972_001:0297c08_14	故名極樂。	故 名 極 樂  
ZH_T47_1972_001:0297c09_3	今以娑婆對而比之。	今 以 娑 婆 對 而 比 之  
ZH_T47_1972_001:0297c09_10	此則血肉形軀。	此 則 血 肉 形 軀  
ZH_T47_1972_001:0297c09_15	有生皆苦。	有 生 皆 苦  
ZH_T47_1972_001:0297c10_2	彼則蓮華化生。	彼 則 蓮 華 化 生  
ZH_T47_1972_001:0297c10_7	無生苦也。	無 生 苦 也  
ZH_T47_1972_001:0297c10_14	此則時序代謝。	此 則 時 序 代 謝  
ZH_T47_1972_001:0297c10_19	衰老日侵。	衰 老 日 侵  
ZH_T47_1972_001:0297c11_5	彼則寒暑不遷。	彼 則 寒 暑 不 遷  
ZH_T47_1972_001:0297c11_10	無老苦也。	無 老 苦 也  
ZH_T47_1972_001:0297c11_17	此則四大難調。	此 則 四 大 難 調  
ZH_T47_1972_001:0297c12_3	多生病患。	多 生 病 患  
ZH_T47_1972_001:0297c12_10	彼則化體香潔。	彼 則 化 體 香 潔  
ZH_T47_1972_001:0297c12_15	無病苦也。	無 病 苦 也  
ZH_T47_1972_001:0297c13_2	此則七十者稀。	此 則 七 十 者 稀  
ZH_T47_1972_001:0297c13_7	無常迅速。	無 常 迅 速  
ZH_T47_1972_001:0297c13_14	彼則壽命無量。	彼 則 壽 命 無 量  
ZH_T47_1972_001:0297c13_19	無死苦也。	無 死 苦 也  
ZH_T47_1972_001:0297c14_5	此則親情愛戀。	此 則 親 情 愛 戀  
ZH_T47_1972_001:0297c14_10	有愛必離。	有 愛 必 離  
ZH_T47_1972_001:0297c14_17	彼無父母妻子。	彼 無 父 母 妻 子  
ZH_T47_1972_001:0297c15_4	無愛別離苦也。	無 愛別離苦 也  
ZH_T47_1972_001:0297c15_11	此則仇敵冤讎。	此 則 仇 敵 冤 讎  
ZH_T47_1972_001:0297c15_16	有冤必會。	有 冤 必 會  
ZH_T47_1972_001:0297c16_3	彼則上善聚會。	彼 則 上 善 聚 會  
ZH_T47_1972_001:0297c16_10	無冤憎會苦也。	無 冤 憎 會 苦 也  
ZH_T47_1972_001:0297c16_17	此或困苦饑寒。	此 或 困 苦 饑 寒  
ZH_T47_1972_001:0297c17_2	貪求不足。	貪 求 不 足  
ZH_T47_1972_001:0297c17_9	彼皆衣食珍寶。	彼 皆 衣 食 珍 寶  
ZH_T47_1972_001:0297c17_14	受用現成。	受 用 現 成  
ZH_T47_1972_001:0297c18_1	此或醜穢形骸。	此 或 醜 穢 形 骸  
ZH_T47_1972_001:0297c18_6	根多缺陋。	根 多 缺 陋  
ZH_T47_1972_001:0297c18_13	彼則端嚴相貌。	彼 則 端 嚴 相 貌  
ZH_T47_1972_001:0297c18_18	體有光明。	體 有 光 明  
ZH_T47_1972_001:0297c19_4	此則輪轉生死。	此 則 輪轉生死  
ZH_T47_1972_001:0297c19_11	彼則永證無生。	彼 則 永 證 無 生  
ZH_T47_1972_001:0297c19_18	此有四趣之苦。	此 有 四 趣 之 苦  
ZH_T47_1972_001:0297c20_5	彼無三惡之名。	彼 無 三 惡 之 名  
ZH_T47_1972_001:0297c20_16	此則丘陵坑坎荊棘為林。	此 則 丘 陵 坑 坎 荊 棘 為 林  
ZH_T47_1972_001:0297c21_6	土石諸山穢惡充滿。	土 石 諸 山 穢 惡 充 滿  
ZH_T47_1972_001:0297c21_13	彼則黃金為地。	彼 則 黃 金 為 地  
ZH_T47_1972_001:0297c21_18	寶樹參天。	寶 樹 參 天  
ZH_T47_1972_001:0297c22_3	樓聳七珍。	樓 聳 七 珍  
ZH_T47_1972_001:0297c22_8	花敷四色。	花 敷 四 色  
ZH_T47_1972_001:0297c22_15	此則雙林已滅。	此 則 雙 林 已 滅  
ZH_T47_1972_001:0297c22_20	龍華未來。	龍 華 未 來  
ZH_T47_1972_001:0297c23_10	彼則無量壽尊現在說法。	彼 則 無 量 壽 尊 現 在 說 法  
ZH_T47_1972_001:0297c24_3	此則觀音勢至徒仰嘉名。	此 則 觀 音 勢 至 徒 仰 嘉 名  
ZH_T47_1972_001:0297c24_14	彼則與二上人親為勝友。	彼 則 與 二 上 人 親 為 勝 友  
ZH_T47_1972_001:0297c25_6	此則群魔外道惱亂正修。	此 則 群 魔 外 道 惱 亂 正 修  
ZH_T47_1972_001:0297c25_17	彼則佛化一統魔外絕蹤。	彼 則 佛 化 一 統 魔 外 絕 蹤  
ZH_T47_1972_001:0297c26_9	此則媚色妖婬迷惑行者。	此 則 媚 色 妖 婬 迷 惑 行 者  
ZH_T47_1972_001:0297c27_2	彼則正報清淨實無女人。	彼 則 正 報 清 淨 實 無 女 人  
ZH_T47_1972_001:0297c27_13	此則惡獸魑魅交扇邪聲。	此 則 惡 獸 魑 魅 交 扇 邪 聲  
ZH_T47_1972_001:0297c28_5	彼則水鳥樹林咸宜妙法。	彼 則 水 鳥 樹 林 咸 宜 妙 法  
ZH_T47_1972_001:0297c28_10	二土較量。	二 土 較 量  
ZH_T47_1972_001:0297c28_15	境緣逈別。	境 緣 逈 別  
ZH_T47_1972_001:0297c29_5	而樂邦之勝其數無窮。	而 樂 邦 之 勝 其 數 無 窮  
ZH_T47_1972_001:0297c29_11	未暇悉舉也。	未 暇 悉 舉 也  
ZH_T47_1972_001:0298a01_6	其境勝者可以攝眾生取淨之情。	其 境 勝 者 可 以 攝 眾 生 取 淨 之 情  
ZH_T47_1972_001:0298a02_2	其緣勝者可以助生者修行之力。	其 緣 勝 者 可 以 助 生 者 修 行 之 力  
ZH_T47_1972_001:0298a02_10	雖同居淨類甚多。	雖 同 居 淨 類 甚 多  
ZH_T47_1972_001:0298a03_3	惟極樂修行緣具故偏指也。	惟 極 樂 修 行 緣 具 故 偏 指 也  
ZH_T47_1972_001:0298a04_2	問曰。	問 曰  
ZH_T47_1972_001:0298a04_11	十方如來皆可親近。	十 方 如 來 皆 可 親 近  
ZH_T47_1972_001:0298a05_1	今獨推彌陀者何耶。	今 獨 推 彌 陀 者 何 耶  
ZH_T47_1972_001:0298a05_4	答曰。	答 曰  
ZH_T47_1972_001:0298a05_9	獨推彌陀。	獨 推 彌 陀  
ZH_T47_1972_001:0298a05_14	其故有三。	其 故 有 三  
ZH_T47_1972_001:0298a05_20	一誓願深重。	一 誓 願 深 重  
ZH_T47_1972_001:0298a06_5	二娑婆有緣。	二 娑 婆 有 緣  
ZH_T47_1972_001:0298a06_12	三化道相關也。	三 化 道 相 關 也  
ZH_T47_1972_001:0298a06_16	願重者。	願 重 者  
ZH_T47_1972_001:0298a06_19	經云。	經 云  
ZH_T47_1972_001:0298a07_5	彌陀往昔因中。	彌 陀 往 昔 因 中  
ZH_T47_1972_001:0298a07_14	嘗發種種廣大誓願。	嘗 發 種 種 廣 大 誓 願  
ZH_T47_1972_001:0298a07_18	其略曰。	其 略 曰  
ZH_T47_1972_001:0298a08_5	若我成佛已來。	若 我 成佛已來  
ZH_T47_1972_001:0298a08_14	其有眾生願生我國。	其 有 眾 生 願 生 我 國  
ZH_T47_1972_001:0298a08_19	或聞我名。	或 聞 我 名  
ZH_T47_1972_001:0298a09_4	修諸善本。	修 諸 善 本  
ZH_T47_1972_001:0298a09_9	稱我名號。	稱 我 名 號  
ZH_T47_1972_001:0298a09_14	乃至十念。	乃 至 十 念  
ZH_T47_1972_001:0298a09_19	若不生者。	若 不 生 者  
ZH_T47_1972_001:0298a10_4	誓不取正覺。	誓 不取正覺  
ZH_T47_1972_001:0298a10_9	既生我國。	既 生 我 國  
ZH_T47_1972_001:0298a10_14	若有退轉。	若 有 退 轉  
ZH_T47_1972_001:0298a11_1	不決定成佛者。	不 決 定 成 佛 者  
ZH_T47_1972_001:0298a11_7	誓不取正覺。	誓 不取正覺  
ZH_T47_1972_001:0298a11_13	故華嚴鈔曰。	故 華 嚴 鈔 曰  
ZH_T47_1972_001:0298a11_18	彌陀願重。	彌 陀 願 重  
ZH_T47_1972_001:0298a12_6	偏接娑婆眾生也。	偏 接 娑 婆 眾 生 也  
ZH_T47_1972_001:0298a12_10	有緣者。	有 緣 者  
ZH_T47_1972_001:0298a12_19	我佛釋迦現在世時。	我 佛 釋 迦 現 在 世 時  
ZH_T47_1972_001:0298a13_6	眾生聞佛所教。	眾 生 聞 佛 所 教  
ZH_T47_1972_001:0298a13_11	歸向彌陀。	歸 向 彌 陀  
ZH_T47_1972_001:0298a13_16	固已多矣。	固 已 多 矣  
ZH_T47_1972_001:0298a14_5	觀佛滅後末世眾生。	觀 佛 滅 後 末 世 眾 生  
ZH_T47_1972_001:0298a14_16	無問僧俗男女貴賤貧富。	無 問 僧 俗 男 女 貴 賤 貧 富  
ZH_T47_1972_001:0298a15_3	稍聞佛教者。	稍 聞 佛 教 者  
ZH_T47_1972_001:0298a15_8	無不信向。	無 不 信 向  
ZH_T47_1972_001:0298a15_14	未聞佛教者。	未 聞 佛 教 者  
ZH_T47_1972_001:0298a15_19	亦會稱名。	亦 會 稱 名  
ZH_T47_1972_001:0298a16_9	縱是頑愚暴惡無信之徒。	縱 是 頑 愚 暴 惡 無 信 之 徒  
ZH_T47_1972_001:0298a16_18	或遭厄難危險之處。	或 遭 厄 難 危 險 之 處  
ZH_T47_1972_001:0298a17_8	或發讚歎怨嗟之聲。	或 發 讚 歎 怨 嗟 之 聲  
ZH_T47_1972_001:0298a18_1	不覺信口便叫阿彌陀佛。	不 覺 信 口 便 叫 阿 彌 陀 佛  
ZH_T47_1972_001:0298a18_12	至於兒童女子戲弄之際。	至 於 兒 童 女 子 戲 弄 之 際  
ZH_T47_1972_001:0298a18_17	聚沙摶泥。	聚 沙 摶 泥  
ZH_T47_1972_001:0298a19_2	圖牆畫壁。	圖 牆 畫 壁  
ZH_T47_1972_001:0298a19_9	便作彌陀佛像。	便 作 彌 陀 佛 像  
ZH_T47_1972_001:0298a20_3	甚至於學行未穩學語未成者。	甚 至 於 學 行 未 穩 學 語 未 成 者  
ZH_T47_1972_001:0298a20_12	自然能唱阿彌陀佛。	自 然 能 唱 阿 彌 陀 佛  
ZH_T47_1972_001:0298a20_19	此皆不勸而發。	此 皆 不 勸 而 發  
ZH_T47_1972_001:0298a21_4	不教而能。	不 教 而 能  
ZH_T47_1972_001:0298a21_10	非有緣而何。	非 有 緣 而 何  
ZH_T47_1972_001:0298a21_18	又如無量壽經云。	又 如 無 量 壽 經 云  
ZH_T47_1972_001:0298a22_3	吾說此經。	吾 說 此 經  
ZH_T47_1972_001:0298a22_14	令見無量壽佛及其國土。	令 見 無 量 壽 佛 及 其 國 土  
ZH_T47_1972_001:0298a22_19	所當為者。	所 當 為 者  
ZH_T47_1972_001:0298a23_4	皆可求之。	皆 可 求 之  
ZH_T47_1972_001:0298a23_17	無得以我滅度之後復生疑惑。	無 得 以 我 滅 度 之 後 復 生 疑 惑  
ZH_T47_1972_001:0298a24_7	當來之世經道滅盡。	當來之世 經 道 滅 盡  
