segmentnr	original	stemmed
ZH_T49_2035_018:0237c03_0	佛祖統紀卷第十八	佛 祖 統 紀 卷 第 十 八 
ZH_T49_2035_018:0237c05_0	宋景定四明東湖沙門志磐撰	宋 景 定 四 明 東 湖 沙 門 志 磐 撰 
ZH_T49_2035_018:0237c06_0	諸師列傳第六之八廣智神照南屏下共六十二人	諸 師 列 傳 第 六 之 八 廣 智 神 照 南 屏 下 共 六 十 二 人 
ZH_T49_2035_018:0238a20_7_0	休菴舟法師法嗣廣智下第七世豁菴淨悟法師法	休菴舟法師法嗣廣智下第七世豁菴淨悟法師法
ZH_T49_2035_018:0238a20_7_1	明節法師法嗣閑林子真法師月堂詢法師法嗣逸	明節法師法嗣閑林子真法師月堂詢法師法嗣逸
ZH_T49_2035_018:0238a20_7_2	堂法登法師柏庭善月法師悅菴淨惠法師隱堂正	堂法登法師柏庭善月法師悅菴淨惠法師隱堂正
ZH_T49_2035_018:0238a20_7_3	榮法師石芝宗曉法師南湖善榮行人一菴躬法師	榮法師石芝宗曉法師南湖善榮行人一菴躬法師
ZH_T49_2035_018:0238a20_7_4	法嗣正菴端信法師叔寶良琰法師癡菴垂拱法師	法嗣正菴端信法師叔寶良琰法師癡菴垂拱法師
ZH_T49_2035_018:0238a20_7_5	止菴蓮法師法嗣鏡菴景遷法師契菴如晦法師環	止菴蓮法師法嗣鏡菴景遷法師契菴如晦法師環
ZH_T49_2035_018:0238a20_7_6	菴戒樞法師慧光訥法師法嗣神照下第七世等菴	菴戒樞法師慧光訥法師法嗣神照下第七世等菴
ZH_T49_2035_018:0238a20_7_7	士衡法師虛菴有宏法師復菴妙珪法師中菴師安	士衡法師虛菴有宏法師復菴妙珪法師中菴師安
ZH_T49_2035_018:0238a20_7_8	法師上竺師覺法師石㵎從戒法師晦菴慧明法師	法師上竺師覺法師石㵎從戒法師晦菴慧明法師
ZH_T49_2035_018:0238a20_7_9	桂堂如坦法師佛光照法師法嗣南屏下第七世子	桂堂如坦法師佛光照法師法嗣南屏下第七世子
ZH_T49_2035_018:0238a20_7_10	庭師訓法師東陵智逈法師碧溪德聞法師菊庭信	庭師訓法師東陵智逈法師碧溪德聞法師菊庭信
ZH_T49_2035_018:0238a20_7_11	硜法師海翁時學法師梅㵎太度法師少愚育才法	硜法師海翁時學法師梅㵎太度法師少愚育才法
ZH_T49_2035_018:0238a20_7_12	師行古忘新法師鼎山時舉法師若州景荃法師古	師行古忘新法師鼎山時舉法師若州景荃法師古
ZH_T49_2035_018:0238a20_7_13	巖正因法師毒鼓妙聲法師應菴法言法師梓山思	巖正因法師毒鼓妙聲法師應菴法言法師梓山思
ZH_T49_2035_018:0238a20_7_14	恭法師西山文拱法師雪岑行海法師無極可度法	恭法師西山文拱法師雪岑行海法師無極可度法
ZH_T49_2035_018:0238a20_7_15	師東屏正吾法師石林文人法師東山慧日法師自	師東屏正吾法師石林文人法師東山慧日法師自
ZH_T49_2035_018:0238a20_7_16	聞如願法師北山志在書記方溪文珍知客桐洲坦	聞如願法師北山志在書記方溪文珍知客桐洲坦
ZH_T49_2035_018:0238a20_7_17	法師法嗣古源永清法師潛山文珦法師剡元先法	法師法嗣古源永清法師潛山文珦法師剡元先法
ZH_T49_2035_018:0238a20_7_18	師法嗣南屏下第七世雲夢允澤法師蒙泉源法師	師法嗣南屏下第七世雲夢允澤法師蒙泉源法師
ZH_T49_2035_018:0238a20_7_19	法嗣靈源允憲法師桐溪若濟法師螺溪元悟法師	法嗣靈源允憲法師桐溪若濟法師螺溪元悟法師
ZH_T49_2035_018:0238a20_7_20	梅峯奎法師法嗣具城妙銛法師孤巖如月法師鑑	梅峯奎法師法嗣具城妙銛法師孤巖如月法師鑑
ZH_T49_2035_018:0238a20_7_21	堂義法師法嗣百川如海法師石庭道生法師石帆	堂義法師法嗣百川如海法師石庭道生法師石帆
ZH_T49_2035_018:0238a20_7_22	宗曄法師性菴淨岳法師柏巖文杲法師聖水從覺	宗曄法師性菴淨岳法師柏巖文杲法師聖水從覺
ZH_T49_2035_018:0238a20_7_23	法師總菴心法師法嗣古鏡文杲法師畢菴希法師	法師總菴心法師法嗣古鏡文杲法師畢菴希法師
ZH_T49_2035_018:0238a20_7_24	法嗣海空法英法師南巖雄法師法嗣虛靜祖意法	法嗣海空法英法師南巖雄法師法嗣虛靜祖意法
ZH_T49_2035_018:0238a20_7_25	師休菴舟法師法嗣休菴舟法師法嗣廣智下第七	師休菴舟法師法嗣休菴舟法師法嗣廣智下第七
ZH_T49_2035_018:0238a20_7_26	世法師淨悟字機先。	世法師淨悟字機先。
ZH_T49_2035_018:0238a20_14	溫之樂清李氏。	溫 之 樂 清 李 氏  
ZH_T49_2035_018:0238a20_19	幼知厭俗。	幼 知 厭 俗  
ZH_T49_2035_018:0238a21_8	往依雁山飛泉圓覺。	往 依 雁 山 飛 泉 圓 覺  
ZH_T49_2035_018:0238a21_13	十九具戒。	十 九 具 戒  
ZH_T49_2035_018:0238a22_4	初謁定菴統學教觀。	初 謁 定 菴 統 學 教 觀  
ZH_T49_2035_018:0238a22_11	時休菴居壽昌。	時 休 菴 居 壽 昌  
ZH_T49_2035_018:0238a22_16	篤於講說。	篤 於 講 說  
ZH_T49_2035_018:0238a23_2	往求受業。	往 求 受 業  
ZH_T49_2035_018:0238a23_11	菴問定菴何以示人。	菴 問 定 菴 何 以 示 人  
ZH_T49_2035_018:0238a23_14	師曰。	師 曰  
ZH_T49_2035_018:0238a23_19	演索車義。	演 索 車 義  
ZH_T49_2035_018:0238a24_2	菴曰。	菴 曰  
ZH_T49_2035_018:0238a24_9	寂光土索車否。	寂 光 土 索 車 否  
ZH_T49_2035_018:0238a24_13	師不領。	師 不 領  
ZH_T49_2035_018:0238a25_3	畜疑在膺幾廢寢食。	畜 疑 在 膺 幾 廢 寢 食  
ZH_T49_2035_018:0238a25_13	菴感其用心撫其背曰。	菴 感 其 用 心 撫 其 背 曰  
ZH_T49_2035_018:0238a26_4	疑端發露寶所非遙。	疑 端 發 露 寶 所 非 遙  
ZH_T49_2035_018:0238a26_12	居無何忽有契會。	居 無 何 忽 有 契 會  
ZH_T49_2035_018:0238a27_5	自是宗門疑難迎刃而解。	自 是 宗 門 疑 難 迎 刃 而 解  
ZH_T49_2035_018:0238a27_10	吳越講席。	吳 越 講 席  
ZH_T49_2035_018:0238a27_15	無不縱觀。	無 不 縱 觀  
ZH_T49_2035_018:0238a28_1	志氣高卓。	志 氣 高 卓  
ZH_T49_2035_018:0238a28_6	少有許與。	少 有 許 與  
ZH_T49_2035_018:0238a28_11	每自誨曰。	每 自 誨 曰  
ZH_T49_2035_018:0238a28_16	折鐺煮飯。	折 鐺 煮 飯  
ZH_T49_2035_018:0238a29_1	偃息中林。	偃 息 中 林  
ZH_T49_2035_018:0238a29_6	借虛空口。	借 虛 空 口  
ZH_T49_2035_018:0238a29_11	對萬象說。	對 萬 象 說  
ZH_T49_2035_018:0238a29_16	余亦何媿。	余 亦 何 媿  
ZH_T49_2035_018:0238b01_4	至若所學不充。	至 若 所 學 不 充  
ZH_T49_2035_018:0238b01_9	因人成事。	因 人 成 事  
ZH_T49_2035_018:0238b01_16	執數行紙上語。	執 數 行 紙 上 語  
ZH_T49_2035_018:0238b02_4	聚百十雛道人。	聚 百 十 雛 道 人  
ZH_T49_2035_018:0238b02_17	大廈廣居食前方丈吾弗為也。	大 廈 廣 居 食 前 方 丈 吾 弗 為 也  
ZH_T49_2035_018:0238b03_8	師始於飛泉作興棟宇。	師 始 於 飛 泉 作 興 棟 宇  
ZH_T49_2035_018:0238b03_15	既而勉徇眾請。	既 而 勉 徇 眾 請  
ZH_T49_2035_018:0238b04_4	出主天台淨土。	出 主 天 台 淨 土  
ZH_T49_2035_018:0238b04_13	日勤講說百廢具舉。	日 勤 講 說 百 廢 具 舉  
ZH_T49_2035_018:0238b05_2	晚歸飛泉故居。	晚 歸 飛 泉 故 居  
ZH_T49_2035_018:0238b05_7	課佛為業。	課 佛 為 業  
ZH_T49_2035_018:0238b05_17	及屬疾大書以示眾曰。	及 屬 疾 大 書 以 示 眾 曰  
ZH_T49_2035_018:0238b06_7	求醫問藥撓吾化也。	求 醫 問 藥 撓 吾 化 也  
ZH_T49_2035_018:0238b06_14	吾將默觀其變。	吾 將 默 觀 其 變  
ZH_T49_2035_018:0238b07_3	明旦危坐而蛻。	明 旦 危 坐 而 蛻  
ZH_T49_2035_018:0238b07_16	時開禧丁卯九月二十六日也。	時 開 禧 丁 卯 九 月 二 十 六 日 也  
ZH_T49_2035_018:0238b08_2	闍維之日。	闍 維 之 日  
ZH_T49_2035_018:0238b08_8	耳與齒儼然。	耳 與 齒 儼 然  
ZH_T49_2035_018:0238b08_13	門人文虎。	門 人 文 虎  
ZH_T49_2035_018:0238b09_1	塔于寺之西麓。	塔 于 寺 之 西 麓  
ZH_T49_2035_018:0238b09_10	北㵎居簡為之銘曰。	北 㵎 居 簡 為 之 銘 曰  
ZH_T49_2035_018:0238b09_15	是為豁菴。	是 為 豁 菴  
ZH_T49_2035_018:0238b10_1	聽說總持。	聽 說 總 持  
ZH_T49_2035_018:0238b10_8	兩種不壞之藏。	兩 種 不 壞 之 藏  
ZH_T49_2035_018:0238b10_13	道德所重。	道 德 所 重  
ZH_T49_2035_018:0238b10_18	雖隱而彰。	雖 隱 而 彰  
ZH_T49_2035_018:0238b11_8	吾知夫異代而同心者。	吾 知 夫 異 代 而 同 心 者  
ZH_T49_2035_018:0238b11_16	墮淚於雁山之陽。	墮 淚 於 雁 山 之 陽  
ZH_T49_2035_018:0238b13_4	法明節法師法嗣法明節法師法嗣法師子真。	法 明 節 法 師 法 嗣 法 明 節 法 師 法 嗣 法 師 子 真  
ZH_T49_2035_018:0238b13_8	永嘉人。	永 嘉 人  
ZH_T49_2035_018:0238b13_12	號閑林。	號 閑 林  
ZH_T49_2035_018:0238b13_18	幼從節公學。	幼 從 節 公 學  
ZH_T49_2035_018:0238b14_7	用心勤至悉通其道。	用 心 勤 至 悉 通 其 道  
ZH_T49_2035_018:0238b14_14	遇教義未安處。	遇 教 義 未 安 處  
ZH_T49_2035_018:0238b15_4	與諸友終日議論。	與 諸 友 終 日 議 論  
ZH_T49_2035_018:0238b15_9	既得意已。	既 得 意 已  
ZH_T49_2035_018:0238b15_14	乃坐帳中。	乃 坐 帳 中  
ZH_T49_2035_018:0238b15_19	縱辭演說。	縱 辭 演 說  
ZH_T49_2035_018:0238b16_5	或自問自答。	或 自 問 自 答  
ZH_T49_2035_018:0238b16_10	以自研覈。	以 自 研 覈  
ZH_T49_2035_018:0238b16_16	後繼主法明。	後 繼 主 法 明  
ZH_T49_2035_018:0238b17_4	大弘乃父之業。	大 弘 乃 父 之 業  
ZH_T49_2035_018:0238b17_13	辯才異等老學畏服。	辯 才 異 等 老 學 畏 服  
ZH_T49_2035_018:0238b19_7	月堂詢法師法嗣月堂詢法師法嗣法師法登字聖道。	月 堂 詢 法 師 法 嗣 月 堂 詢 法 師 法 嗣 法 師 法 登 字 聖 道  
ZH_T49_2035_018:0238b19_11	號逸堂。	號 逸 堂  
ZH_T49_2035_018:0238b19_18	四明澥浦林氏。	四 明 澥 浦 林 氏  
ZH_T49_2035_018:0238b20_4	受業寧波。	受 業 寧 波  
ZH_T49_2035_018:0238b20_14	初為優婆塞學於梓菴。	初 為 優 婆 塞 學 於 梓 菴  
ZH_T49_2035_018:0238b21_1	天性慧悟。	天 性 慧 悟  
ZH_T49_2035_018:0238b21_7	凡諸部要文。	凡 諸 部 要 文  
ZH_T49_2035_018:0238b21_12	無所不記。	無 所 不 記  
ZH_T49_2035_018:0238b22_2	諸文要義無所不解。	諸 文 要 義 無 所 不 解  
ZH_T49_2035_018:0238b22_6	既具戒。	既 具 戒  
ZH_T49_2035_018:0238b22_13	入南湖依月堂。	入 南 湖 依 月 堂  
ZH_T49_2035_018:0238b23_3	堂以其宿學蚤成。	堂 以 其 宿 學 蚤 成  
ZH_T49_2035_018:0238b23_9	宜待以異禮。	宜 待 以 異 禮  
ZH_T49_2035_018:0238b23_16	踰年命以懺首。	踰 年 命 以 懺 首  
ZH_T49_2035_018:0238b24_7	嘗與論修性善惡之旨。	嘗 與 論 修 性 善 惡 之 旨  
ZH_T49_2035_018:0238b24_16	師資道合益用親敬。	師 資 道 合 益 用 親 敬  
ZH_T49_2035_018:0238b25_2	守志齋居。	守 志 齋 居  
ZH_T49_2035_018:0238b25_9	二十二年無異。	二 十 二 年 無 異  
ZH_T49_2035_018:0238b26_1	念教門義旨悉有撰述。	念 教 門 義 旨 悉 有 撰 述  
ZH_T49_2035_018:0238b26_6	世競傳錄。	世 競 傳 錄  
ZH_T49_2035_018:0238b26_13	稱為逸堂科云。	稱 為 逸 堂 科 云  
ZH_T49_2035_018:0238b27_1	出主在城天封。	出 主 在 城 天 封  
ZH_T49_2035_018:0238b27_5	遷資教。	遷 資 教  
ZH_T49_2035_018:0238b27_10	晚居清修。	晚 居 清 修  
ZH_T49_2035_018:0238b27_15	一時學者。	一 時 學 者  
ZH_T49_2035_018:0238b28_8	以不預聞講席者為之愧恥。	以 不 預 聞 講 席 者 為 之 愧 恥  
ZH_T49_2035_018:0238b29_7	法師善月字光遠。	法 師 善 月 字 光 遠  
ZH_T49_2035_018:0238b29_14	四明定海方氏。	四 明 定 海 方 氏  
ZH_T49_2035_018:0238c01_3	父偉為邑中名儒。	父 偉 為 邑 中 名 儒  
ZH_T49_2035_018:0238c01_14	母夢月輪墮懷已而有娠。	母 夢 月 輪 墮 懷 已 而 有 娠  
ZH_T49_2035_018:0238c02_4	生之夕白光滿室。	生 之 夕 白 光 滿 室  
ZH_T49_2035_018:0238c02_8	初學語。	初 學 語  
ZH_T49_2035_018:0238c02_16	常合掌道法界字。	常 合 掌 道 法 界 字  
ZH_T49_2035_018:0238c03_1	甫成童。	甫 成 童  
ZH_T49_2035_018:0238c03_8	父編六經授之。	父 編 六 經 授 之  
ZH_T49_2035_018:0238c03_13	以次誦習。	以 次 誦 習  
ZH_T49_2035_018:0238c03_18	如溫故業。	如 溫 故 業  
ZH_T49_2035_018:0238c04_7	十二通春秋大義。	十 二 通 春 秋 大 義  
ZH_T49_2035_018:0238c04_16	母携往正覺寺設供。	母 携 往 正 覺 寺 設 供  
ZH_T49_2035_018:0238c05_4	循殿楹數匝。	循 殿 楹 數 匝  
ZH_T49_2035_018:0238c05_13	寺主道并謂其母曰。	寺 主 道 并 謂 其 母 曰  
ZH_T49_2035_018:0238c06_4	吾夜夢白龍繞此柱。	吾 夜 夢 白 龍 繞 此 柱  
ZH_T49_2035_018:0238c06_10	其徵此兒乎。	其 徵 此 兒 乎  
ZH_T49_2035_018:0238c07_1	於是父母始令出家。	於 是 父 母 始 令 出 家  
ZH_T49_2035_018:0238c07_6	命名善月。	命 名 善 月  
ZH_T49_2035_018:0238c07_23	符先夢也善月光遠皆古佛名十五具戒。	符 先 夢 也 善 月 光 遠 皆 古 佛 名 十 五 具 戒  
ZH_T49_2035_018:0238c08_7	越三月而并師亡。	越 三 月 而 并 師 亡  
ZH_T49_2035_018:0238c08_15	乃往南湖依草菴。	乃 往 南 湖 依 草 菴  
ZH_T49_2035_018:0238c09_6	常以科目繁冗為勞。	常 以 科 目 繁 冗 為 勞  
ZH_T49_2035_018:0238c09_12	草菴誨之曰。	草 菴 誨 之 曰  
ZH_T49_2035_018:0238c10_4	白日看家書有何難解。	白 日 看 家 書 有 何 難 解  
ZH_T49_2035_018:0238c10_9	師為一省。	師 為 一 省  
ZH_T49_2035_018:0238c10_14	來菴來繼。	來 菴 來 繼  
ZH_T49_2035_018:0238c10_19	趨隅日勤。	趨 隅 日 勤  
ZH_T49_2035_018:0238c11_2	菴曰。	菴 曰  
ZH_T49_2035_018:0238c11_14	異時鼓吹吾宗者其在子乎。	異 時 鼓 吹 吾 宗 者 其 在 子 乎  
ZH_T49_2035_018:0238c12_6	梓菴講道月波往謁焉。	梓 菴 講 道 月 波 往 謁 焉  
ZH_T49_2035_018:0238c13_1	聞世相常住之旨益有省發。	聞 世 相 常 住 之 旨 益 有 省 發  
ZH_T49_2035_018:0238c13_10	乃復歸南湖見月堂。	乃 復 歸 南 湖 見 月 堂  
ZH_T49_2035_018:0238c14_2	問如來不斷性惡之說。	問 如 來 不 斷 性 惡 之 說  
ZH_T49_2035_018:0238c14_7	身心豁然。	身 心 豁 然  
ZH_T49_2035_018:0238c14_15	如却關鑰見府庫。	如 却 關 鑰 見 府 庫  
ZH_T49_2035_018:0238c15_2	以所悟白。	以 所 悟 白  
ZH_T49_2035_018:0238c15_9	堂更為演其義。	堂 更 為 演 其 義  
ZH_T49_2035_018:0238c15_18	師拜領而退堂示寂。	師 拜 領 而 退 堂 示 寂  
ZH_T49_2035_018:0238c16_10	師為專使往當湖請竹菴。	師 為 專 使 往 當 湖 請 竹 菴  
ZH_T49_2035_018:0238c16_14	越明年。	越 明 年  
ZH_T49_2035_018:0238c17_2	命師分講。	命 師 分 講  
ZH_T49_2035_018:0238c17_11	風儀清溫談辨雅正。	風 儀 清 溫 談 辨 雅 正  
ZH_T49_2035_018:0238c17_17	竹菴讚之曰。	竹 菴 讚 之 曰  
ZH_T49_2035_018:0238c18_7	吾於首座可謂得人。	吾 於 首 座 可 謂 得 人  
ZH_T49_2035_018:0238c18_14	但恨無繼之者。	但 恨 無 繼 之 者  
ZH_T49_2035_018:0238c19_3	所居古柏獨秀。	所 居 古 柏 獨 秀  
ZH_T49_2035_018:0238c19_9	因自號柏庭。	因 自 號 柏 庭  
ZH_T49_2035_018:0238c20_1	淳熙庚子初主東湖辯利。	淳 熙 庚 子 初 主 東 湖 辯 利  
ZH_T49_2035_018:0238c20_7	遷慈溪寶嚴。	遷 慈 溪 寶 嚴  
ZH_T49_2035_018:0238c20_16	居無何太師史真隱。	居 無 何 太 師 史 真 隱  
ZH_T49_2035_018:0238c21_10	請居月波學士來奔廩食不足。	請 居 月 波 學 士 來 奔 廩 食 不 足  
ZH_T49_2035_018:0238c22_3	真隱聞之喜使使白師曰。	真 隱 聞 之 喜 使 使 白 師 曰  
ZH_T49_2035_018:0238c22_9	師為道延眾。	師 為 道 延 眾  
ZH_T49_2035_018:0238c23_1	欲食來取予不嗇也。	欲 食 來 取 予 不 嗇 也  
ZH_T49_2035_018:0238c23_6	紹興二年。	紹 興 二 年  
ZH_T49_2035_018:0238c23_12	郡率何公澹。	郡 率 何 公 澹  
ZH_T49_2035_018:0238c23_18	以南湖虛席。	以 南 湖 虛 席  
ZH_T49_2035_018:0238c24_4	親裁疏勸請。	親 裁 疏 勸 請  
ZH_T49_2035_018:0238c24_9	講道有方。	講 道 有 方  
ZH_T49_2035_018:0238c24_14	御眾有法。	御 眾 有 法  
ZH_T49_2035_018:0238c25_2	十三年不易節。	十 三 年 不 易 節  
ZH_T49_2035_018:0238c25_9	緇素以是信之。	緇 素 以 是 信 之  
ZH_T49_2035_018:0238c25_14	嘉泰四年。	嘉 泰 四 年  
ZH_T49_2035_018:0238c26_2	退隱衍慶精舍。	退 隱 衍 慶 精 舍  
ZH_T49_2035_018:0238c26_13	一息十載夢老叟耳語曰。	一 息 十 載 夢 老 叟 耳 語 曰  
ZH_T49_2035_018:0238c26_17	六十五。	六 十 五  
ZH_T49_2035_018:0238c27_1	七十一。	七 十 一  
ZH_T49_2035_018:0238c27_6	嘉定六年。	嘉 定 六 年  
ZH_T49_2035_018:0238c27_11	郡將陳卿。	郡 將 陳 卿  
ZH_T49_2035_018:0238c28_2	以南湖有去思為更屈。	以 南 湖 有 去 思 為 更 屈  
ZH_T49_2035_018:0238c28_7	致辭弗克。	致 辭 弗 克  
ZH_T49_2035_018:0238c28_16	雨華更新舊徒再擁。	雨 華 更 新 舊 徒 再 擁  
ZH_T49_2035_018:0238c29_1	未逾月。	未 逾 月  
ZH_T49_2035_018:0238c29_8	上竺以勅書召。	上 竺 以 勅 書 召  
ZH_T49_2035_018:0239a01_1	師謂亟往有似於徇名。	師 謂 亟 往 有 似 於 徇 名  
ZH_T49_2035_018:0239a01_6	堅不為動。	堅 不 為 動  
ZH_T49_2035_018:0239a01_15	眾謂上命不可不恭。	眾 謂 上 命 不 可 不 恭  
ZH_T49_2035_018:0239a02_2	始幡然而往。	始 幡 然 而 往  
ZH_T49_2035_018:0239a02_12	是年正六十五之驗也。	是 年 正 六 十 五 之 驗 也  
ZH_T49_2035_018:0239a02_17	八年夏旱。	八 年 夏 旱  
ZH_T49_2035_018:0239a03_5	詔迎大士於明慶。	詔 迎 大 士 於 明 慶  
ZH_T49_2035_018:0239a03_12	車駕親幸致拜。	車 駕 親 幸 致 拜  
ZH_T49_2035_018:0239a03_17	命師恭禱。	命 師 恭 禱  
ZH_T49_2035_018:0239a04_2	朝注暮洽。	朝 注 暮 洽  
ZH_T49_2035_018:0239a04_6	上大說。	上 大 說  
ZH_T49_2035_018:0239a04_13	特補左街僧錄。	特 補 左 街 僧 錄  
ZH_T49_2035_018:0239a05_3	十二年秋拂衣東歸。	十 二 年 秋 拂 衣 東 歸  
ZH_T49_2035_018:0239a05_11	偃息於城南祖關。	偃 息 於 城 南 祖 關  
ZH_T49_2035_018:0239a05_17	是年七十一。	是 年 七 十 一  
ZH_T49_2035_018:0239a06_10	又知所以驗前夢也明年秋。	又 知 所 以 驗 前 夢 也 明 年 秋  
ZH_T49_2035_018:0239a06_17	郡以西山資教。	郡 以 西 山 資 教  
ZH_T49_2035_018:0239a07_4	卑師佚老。	卑 師 佚 老  
ZH_T49_2035_018:0239a07_10	紹定五年春。	紹 定 五 年 春  
ZH_T49_2035_018:0239a07_17	有旨再領上竺。	有 旨 再 領 上 竺  
ZH_T49_2035_018:0239a08_16	人皆以坡仙師去忽復來鳥語山容開之句。	人 皆 以 坡 仙 師 去 忽 復 來 鳥 語 山 容 開 之 句  
ZH_T49_2035_018:0239a09_2	為之賀。	為 之 賀  
ZH_T49_2035_018:0239a09_10	端平三年得目眚。	端 平 三 年 得 目 眚  
ZH_T49_2035_018:0239a09_15	請老東菴。	請 老 東 菴  
ZH_T49_2035_018:0239a10_1	一旦示疾。	一 旦 示 疾  
ZH_T49_2035_018:0239a10_10	坐床上若相酬酢者。	坐 床 上 若 相 酬 酢 者  
ZH_T49_2035_018:0239a10_18	法孫秀林問何為。	法 孫 秀 林 問 何 為  
ZH_T49_2035_018:0239a11_12	曰吾與荊溪尊者對談祖道耳。	曰 吾 與 荊 溪 尊 者 對 談 祖 道 耳  
ZH_T49_2035_018:0239a12_3	將入寂顧左右曰。	將 入 寂 顧 左 右 曰  
ZH_T49_2035_018:0239a12_13	人患無實德為後世稱。	人 患 無 實 德 為 後 世 稱  
ZH_T49_2035_018:0239a13_6	若但崇虛譽我則不暇。	若 但 崇 虛 譽 我 則 不 暇  
ZH_T49_2035_018:0239a13_11	千載之下。	千 載 之 下  
ZH_T49_2035_018:0239a13_18	謂吾為柏庭叟。	謂 吾 為 柏 庭 叟  
ZH_T49_2035_018:0239a14_7	則吾枯骨為無愧。	則 吾 枯 骨 為 無 愧  
ZH_T49_2035_018:0239a15_1	幸勿為請諡以污我素業。	幸 勿 為 請 諡 以 污 我 素 業  
ZH_T49_2035_018:0239a15_8	言已累足而化。	言 已 累 足 而 化  
ZH_T49_2035_018:0239a16_1	實淳祐元年正月十九日也。	實 淳 祐 元 年 正 月 十 九 日 也  
ZH_T49_2035_018:0239a16_6	留龕七日。	留 龕 七 日  
ZH_T49_2035_018:0239a16_15	貌色鮮白心頂俱煖。	貌 色 鮮 白 心 頂 俱 煖  
ZH_T49_2035_018:0239a17_4	奉全身塔於寺東。	奉 全 身 塔 於 寺 東  
ZH_T49_2035_018:0239a17_10	為壽九十三。	為 壽 九 十 三  
ZH_T49_2035_018:0239a17_16	得夏七十八。	得 夏 七 十 八  
ZH_T49_2035_018:0239a18_4	先是首座智覺。	先 是 首 座 智 覺  
ZH_T49_2035_018:0239a18_10	論請於朝言。	論 請 於 朝 言  
ZH_T49_2035_018:0239a18_16	師道光前哲。	師 道 光 前 哲  
ZH_T49_2035_018:0239a19_2	四眾依仰。	四 眾 依 仰  
ZH_T49_2035_018:0239a19_7	年登九秩。	年 登 九 秩  
ZH_T49_2035_018:0239a19_12	將逼歸真。	將 逼 歸 真  
ZH_T49_2035_018:0239a20_3	請建塔山中以擬歸藏。	請 建 塔 山 中 以 擬 歸 藏  
ZH_T49_2035_018:0239a20_8	上旨允之。	上 旨 允 之  
ZH_T49_2035_018:0239a20_15	故今用此成命。	故 今 用 此 成 命  
ZH_T49_2035_018:0239a21_5	所遺衣髮及四經解。	所 遺 衣 髮 及 四 經 解  
ZH_T49_2035_018:0239a21_15	合藏於南湖祖塔之側。	合 藏 於 南 湖 祖 塔 之 側  
ZH_T49_2035_018:0239a22_1	師所著述。	師 所 著 述  
ZH_T49_2035_018:0239a22_6	楞嚴玄覽。	楞 嚴 玄 覽  
ZH_T49_2035_018:0239a22_11	金剛會解。	金 剛 會 解  
ZH_T49_2035_018:0239a22_16	圓覺略說。	圓 覺 略 說  
ZH_T49_2035_018:0239a23_1	楞伽通義。	楞 伽 通 義  
ZH_T49_2035_018:0239a23_5	因革論。	因 革 論  
ZH_T49_2035_018:0239a23_10	簡境十策。	簡 境 十 策  
ZH_T49_2035_018:0239a23_15	三部格言。	三 部 格 言  
ZH_T49_2035_018:0239a23_20	金錍義解。	金 錍 義 解  
ZH_T49_2035_018:0239a24_4	宗教玄述。	宗 教 玄 述  
ZH_T49_2035_018:0239a24_9	仁王疏記。	仁 王 疏 記  
ZH_T49_2035_018:0239a24_14	附鈔箋要。	附 鈔 箋 要  
ZH_T49_2035_018:0239a24_19	皆行於世。	皆 行 於 世  
ZH_T49_2035_018:0239a25_4	自餘雜製。	自 餘 雜 製  
ZH_T49_2035_018:0239a25_8	名緒餘。	名 緒 餘  
ZH_T49_2035_018:0239a26_1	講餘對客木嘗及世間事。	講 餘 對 客 木 嘗 及 世 間 事  
ZH_T49_2035_018:0239a26_13	唯論前人往行及典誥之辭。	唯 論 前 人 往 行 及 典 誥 之 辭  
ZH_T49_2035_018:0239a27_1	或問何以安心。	或 問 何 以 安 心  
ZH_T49_2035_018:0239a27_7	曰心本不動。	曰 心 本 不 動  
ZH_T49_2035_018:0239a27_13	問法華經藏。	問 法 華 經 藏  
ZH_T49_2035_018:0239a28_1	曰當處全彰。	曰 當 處 全 彰  
ZH_T49_2035_018:0239a28_7	其警策類此。	其 警 策 類 此  
ZH_T49_2035_018:0239a28_12	嗣其道者。	嗣 其 道 者  
ZH_T49_2035_018:0239a29_1	香林清賜為上首。	香 林 清 賜 為 上 首  
ZH_T49_2035_018:0239b01_7	法師淨惠字敏中。	法 師 淨 惠 字 敏 中  
ZH_T49_2035_018:0239b01_11	號悅菴。	號 悅 菴  
ZH_T49_2035_018:0239b01_15	鄞陸氏。	鄞 陸 氏  
ZH_T49_2035_018:0239b02_3	父母禱佛而生。	父 母 禱 佛 而 生  
ZH_T49_2035_018:0239b02_16	幼年夢登寶閣見異人為摩頂。	幼 年 夢 登 寶 閣 見 異 人 為 摩 頂  
ZH_T49_2035_018:0239b03_5	及覺異香滿室。	及 覺 異 香 滿 室  
ZH_T49_2035_018:0239b03_12	以語隱學俊師。	以 語 隱 學 俊 師  
ZH_T49_2035_018:0239b03_17	勉其學釋。	勉 其 學 釋  
ZH_T49_2035_018:0239b04_7	遂依定海正覺出家。	遂 依 定 海 正 覺 出 家  
ZH_T49_2035_018:0239b04_11	既具戒。	既 具 戒  
ZH_T49_2035_018:0239b04_16	往見月堂。	往 見 月 堂  
ZH_T49_2035_018:0239b05_3	因春期入懺。	因 春 期 入 懺  
ZH_T49_2035_018:0239b05_11	聞策導頓悟圓旨。	聞 策 導 頓 悟 圓 旨  
ZH_T49_2035_018:0239b05_17	堂由是器之。	堂 由 是 器 之  
ZH_T49_2035_018:0239b06_9	有度律師用大智新疏。	有 度 律 師 用 大 智 新 疏  
ZH_T49_2035_018:0239b06_16	講觀經於湖心。	講 觀 經 於 湖 心  
ZH_T49_2035_018:0239b07_6	月堂遣師與之辯。	月 堂 遣 師 與 之 辯  
ZH_T49_2035_018:0239b07_15	至談觀心觀佛之旨。	至 談 觀 心 觀 佛 之 旨  
ZH_T49_2035_018:0239b08_2	發難數四。	發 難 數 四  
ZH_T49_2035_018:0239b08_7	度竟屈服。	度 竟 屈 服  
ZH_T49_2035_018:0239b08_14	哲則菴主南湖。	哲 則 菴 主 南 湖  
ZH_T49_2035_018:0239b08_19	始開講席。	始 開 講 席  
ZH_T49_2035_018:0239b09_5	師掩卷危坐。	師 掩 卷 危 坐  
ZH_T49_2035_018:0239b09_12	退而指其瑕玼。	退 而 指 其 瑕 玼  
ZH_T49_2035_018:0239b09_17	哲益敬畏。	哲 益 敬 畏  
ZH_T49_2035_018:0239b10_5	榮隱堂居隱學。	榮 隱 堂 居 隱 學  
ZH_T49_2035_018:0239b10_14	俾師分坐講風大揚。	俾 師 分 坐 講 風 大 揚  
ZH_T49_2035_018:0239b11_3	初主郡城法華。	初 主 郡 城 法 華  
ZH_T49_2035_018:0239b11_8	或以為小。	或 以 為 小  
ZH_T49_2035_018:0239b11_11	師曰。	師 曰  
ZH_T49_2035_018:0239b12_4	此法智師講經之地其可鄙乎。	此 法 智 師 講 經 之 地 其 可 鄙 乎  
ZH_T49_2035_018:0239b12_8	遷治平。	遷 治 平  
ZH_T49_2035_018:0239b13_1	每臨講見疏記援引儒典。	每 臨 講 見 疏 記 援 引 儒 典  
ZH_T49_2035_018:0239b13_7	則止而不讀。	則 止 而 不 讀  
ZH_T49_2035_018:0239b13_12	謂其徒曰。	謂 其 徒 曰  
ZH_T49_2035_018:0239b14_2	此外書也宜自觀之。	此 外 書 也 宜 自 觀 之  
ZH_T49_2035_018:0239b14_6	夏將闌。	夏 將 闌  
ZH_T49_2035_018:0239b14_12	對眾自詫曰。	對 眾 自 詫 曰  
