segmentnr	original	folio	stemmed
ZH_T41_1822_003:0520b15_7	若非無漏非無記者。	003	若 非 無 漏 非 無 記 者  
ZH_T41_1822_003:0520b15_13	一向有異熟。	003	一 向 有 異 熟  
ZH_T41_1822_003:0520b16_1	若無記無漏者。	003	若 無 記 無 漏 者  
ZH_T41_1822_003:0520b16_5	無異熟。	003	無 異 熟  
ZH_T41_1822_003:0520b16_7	論。	003	論  
ZH_T41_1822_003:0520b16_14	苦根至無異熟。	003	苦 根 至 無 異 熟  
ZH_T41_1822_003:0520b17_8	此釋苦根唯有漏通三性。	003	此 釋 苦 根 唯 有 漏 通 三 性  
ZH_T41_1822_003:0520b17_16	唯無記性無異熟。	003	唯 無 記 性 無 異 熟  
ZH_T41_1822_003:0520b18_1	論。	003	論  
ZH_T41_1822_003:0520b18_10	信等五根至無異熟。	003	信 等 五 根 至 無 異 熟  
ZH_T41_1822_003:0520b19_5	此釋五根通漏．無漏唯是善性。	003	此 釋 五 根 通 漏  無 漏 唯 是 善 性  
ZH_T41_1822_003:0520b19_14	若有漏者即有異熟。	003	若 有 漏 者 即 有 異 熟  
ZH_T41_1822_003:0520b20_1	論。	003	論  
ZH_T41_1822_003:0520b20_10	如是已說至幾無記。	003	如 是 已 說 至 幾 無 記  
ZH_T41_1822_003:0520b21_3	下一頌第四三性分別門也。	003	下 一 頌 第 四 三 性 分 別 門 也  
ZH_T41_1822_003:0520b21_10	論曰至故先說。	003	論 曰 至 故 先 說  
ZH_T41_1822_003:0520b22_4	此釋信等八根先說所以。	003	此 釋 信 等 八 根 先 說 所 以  
ZH_T41_1822_003:0520b22_13	二十二根信等是後。	003	二十二根 信 等 是 後  
ZH_T41_1822_003:0520b23_3	次前門中復明信等。	003	次 前 門 中 復 明 信 等  
ZH_T41_1822_003:0520b23_12	故乘前便說信等根。	003	故 乘 前 便 說 信 等 根  
ZH_T41_1822_003:0520b23_14	論。	003	論  
ZH_T41_1822_003:0520b24_6	憂根唯通至無記性。	003	憂 根 唯 通 至 無 記 性  
ZH_T41_1822_003:0520b24_12	釋餘十四根。	003	釋 餘 十 四 根  
ZH_T41_1822_003:0520b24_17	如文可解。	003	如 文 可 解  
ZH_T41_1822_003:0520b25_13	憂根唯通善．不善性不通無記者。	003	憂 根 唯 通 善  不 善 性 不 通 無 記 者  
ZH_T41_1822_003:0520b26_9	婆沙一百四十四釋憂非無記云。	003	婆 沙 一 百 四 十 四 釋 憂 非 無 記 云  
ZH_T41_1822_003:0520b27_1	憂根且非有覆無記。	003	憂 根 且 非 有覆無記  
ZH_T41_1822_003:0520b27_17	由與欲界有身見．邊執見不相應故。	003	由 與 欲 界 有 身 見  邊 執 見 不 相 應 故  
ZH_T41_1822_003:0520b28_3	所以者何。	003	所以者何  
ZH_T41_1822_003:0520b28_8	行相異故。	003	行 相 異 故  
ZH_T41_1822_003:0520b28_16	彼二見歡行相轉。	003	彼 二 見 歡 行 相 轉  
ZH_T41_1822_003:0520b29_3	憂根戚行相轉。	003	憂 根 戚 行 相 轉  
ZH_T41_1822_003:0520b29_12	互相違法不相應故。	003	互 相 違 法 不 相 應 故  
ZH_T41_1822_003:0520c01_3	憂根亦非無覆無記。	003	憂 根 亦 非 無覆無記  
ZH_T41_1822_003:0520c01_18	非威儀．工巧處．異熟生所攝故。	003	非 威 儀  工 巧 處  異 熟 生 所 攝 故  
ZH_T41_1822_003:0520c02_10	問何故憂根非威儀路所攝。	003	問 何 故 憂 根 非 威 儀 路 所 攝  
ZH_T41_1822_003:0520c02_17	答憂根分別轉。	003	答 憂 根 分 別 轉  
ZH_T41_1822_003:0520c03_6	威儀路無分別轉。	003	威 儀 路 無 分 別 轉  
ZH_T41_1822_003:0520c03_15	若威儀路有憂根者。	003	若 威 儀 路 有 憂 根 者  
ZH_T41_1822_003:0520c04_14	設有分別我今應作如是威儀如佛世尊。	003	設 有 分 別 我 今 應 作 如 是 威 儀 如 佛 世 尊  
ZH_T41_1822_003:0520c05_3	或如馬勝。	003	或 如 馬 勝  
ZH_T41_1822_003:0520c05_16	即分別時便應已住如是威儀。	003	即 分 別 時 便 應 已 住 如 是 威 儀  
ZH_T41_1822_003:0520c06_7	然威儀路無此分別。	003	然 威 儀 路 無 此 分 別  
ZH_T41_1822_003:0520c06_16	故威儀路無有憂根。	003	故 威 儀 路 無 有 憂 根  
ZH_T41_1822_003:0520c07_8	問何故憂根非工巧處。	003	問 何 故 憂 根 非 工 巧 處  
ZH_T41_1822_003:0520c07_15	答憂根分別轉。	003	答 憂 根 分 別 轉  
ZH_T41_1822_003:0520c08_4	工巧處無分別轉。	003	工 巧 處 無 分 別 轉  
ZH_T41_1822_003:0520c08_13	若工巧處有憂根者。	003	若 工 巧 處 有 憂 根 者  
ZH_T41_1822_003:0520c10_2	設有分別我今應作如是工巧如佛世尊或如妙業天子。	003	設 有 分 別 我 今 應 作 如 是 工 巧 如 佛 世 尊 或 如 妙 業 天 子  
ZH_T41_1822_003:0520c10_15	即分別時已應成辨如是工巧。	003	即 分 別 時 已 應 成 辨 如 是 工 巧  
ZH_T41_1822_003:0520c11_6	然工巧處無此分別。	003	然 工 巧 處 無 此 分 別  
ZH_T41_1822_003:0520c11_15	故工巧處無有憂根。	003	故 工 巧 處 無 有 憂 根  
ZH_T41_1822_003:0520c12_7	問何故憂根非異熟生。	003	問 何 故 憂 根 非 異 熟 生  
ZH_T41_1822_003:0520c12_14	答憂根分別轉。	003	答 憂 根 分 別 轉  
ZH_T41_1822_003:0520c13_3	異熟生無分別轉。	003	異 熟 生 無 分 別 轉  
ZH_T41_1822_003:0520c13_12	若異熟生有憂根者。	003	若 異 熟 生 有 憂 根 者  
ZH_T41_1822_003:0520c14_11	設有分別我今應受如是異熟如佛世尊。	003	設 有 分 別 我 今 應 受 如 是 異 熟 如 佛 世 尊  
ZH_T41_1822_003:0520c15_1	或如轉輪聖王。	003	或 如 轉輪聖王  
ZH_T41_1822_003:0520c15_14	即分別時便應現受如是異熟。	003	即 分 別 時 便 應 現 受 如 是 異 熟  
ZH_T41_1822_003:0520c16_5	然異熟生無此分別。	003	然 異 熟 生 無 此 分 別  
ZH_T41_1822_003:0520c17_10	故異熟生無有憂根　廣如彼釋　問何故受通三性。	003	故 異 熟 生 無 有 憂 根  廣 如 彼 釋  問 何 故 受 通 三 性  
ZH_T41_1822_003:0520c18_1	念．定．慧不通三性。	003	念  定  慧 不 通 三 性  
ZH_T41_1822_003:0520c18_13	答受全中建立二十二根故。	003	答 受 全 中 建 立 二十二根 故  
ZH_T41_1822_003:0520c19_5	所以說四受通三性。	003	所 以 說 四 受 通 三 性  
ZH_T41_1822_003:0520c20_1	念．定．慧唯善入二十二根故。	003	念  定  慧 唯 善 入 二十二根 故  
ZH_T41_1822_003:0520c20_8	所以不通三性。	003	所 以 不 通 三 性  
ZH_T41_1822_003:0520c20_18	如建立二十二根中說。	003	如 建 立 二十二根 中 說  
ZH_T41_1822_003:0520c21_11	論如是已說至幾無色界繫。	003	論 如 是 已 說 至 幾 無 色 界 繫  
ZH_T41_1822_003:0520c22_3	下一頌第五明界繫門。	003	下 一 頌 第 五 明 界 繫 門  
ZH_T41_1822_003:0520c22_10	論曰至十九根。	003	論 曰 至 十 九 根  
ZH_T41_1822_003:0520c23_4	此明欲界唯有十九根。	003	此 明 欲 界 唯 有 十 九 根  
ZH_T41_1822_003:0520c23_12	除後三無漏根故。	003	除 後 三無漏根 故  
ZH_T41_1822_003:0520c23_14	論。	003	論  
ZH_T41_1822_003:0520c24_8	色界如前至亦通色界繫。	003	色 界 如 前 至 亦 通 色 界 繫  
ZH_T41_1822_003:0520c25_9	明十五根通色界繫　通言欲顯色界亦有。	003	明 十 五 根 通 色 界 繫  通 言 欲 顯 色 界 亦 有  
ZH_T41_1822_003:0520c25_19	兼除女．男．憂．苦。	003	兼 除 女  男  憂  苦  
ZH_T41_1822_003:0520c26_1	論。	003	論  
ZH_T41_1822_003:0520c26_11	除女男者至身醜陋故。	003	除 女 男 者 至 身 醜 陋 故  
ZH_T41_1822_003:0520c27_4	此釋色界無男．女根所以。	003	此 釋 色 界 無 男  女 根 所 以  
ZH_T41_1822_003:0520c28_5	一以離婬欲法故　若爾因何有其鼻．舌。	003	一 以 離 婬 欲 法 故  若 爾 因 何 有 其 鼻  舌  
ZH_T41_1822_003:0520c29_5	為釋伏難故言醜陋不同鼻舌有嚴身用。	003	為 釋 伏 難 故 言 醜 陋 不 同 鼻 舌 有 嚴 身 用  
ZH_T41_1822_003:0520c29_7	論。	003	論  
ZH_T41_1822_003:0520c29_16	若爾何故說彼為男。	003	若爾何故 說 彼 為 男  
ZH_T41_1822_003:0521a01_2	難也。	003	難 也  
ZH_T41_1822_003:0521a01_12	男．女二名由二根得。	003	男  女 二 名 由 二 根 得  
ZH_T41_1822_003:0521a01_17	彼無男根。	003	彼 無 男 根  
ZH_T41_1822_003:0521a02_2	何故名男。	003	何 故 名 男  
ZH_T41_1822_003:0521a02_4	論。	003	論  
ZH_T41_1822_003:0521a02_9	於何處說。	003	於 何 處 說  
ZH_T41_1822_003:0521a02_13	反問也。	003	反 問 也  
ZH_T41_1822_003:0521a02_15	論。	003	論  
ZH_T41_1822_003:0521a03_8	契經中說至男身為梵。	003	契 經 中 說 至 男 身 為 梵  
ZH_T41_1822_003:0521a03_13	引經說也。	003	引 經 說 也  
ZH_T41_1822_003:0521a03_15	論。	003	論  
ZH_T41_1822_003:0521a04_9	別有男相至男身所有者。	003	別 有 男 相 至 男 身 所 有 者  
ZH_T41_1822_003:0521a04_13	此通經。	003	此 通 經  
ZH_T41_1822_003:0521a04_18	雖無男根。	003	雖 無 男 根  
ZH_T41_1822_003:0521a05_10	而有男身眾相故名男也。	003	而 有 男 身 眾 相 故 名 男 也  
ZH_T41_1822_003:0521a06_5	非如欲界無男根即無男相。	003	非 如 欲 界 無 男 根 即 無 男 相  
ZH_T41_1822_003:0521a06_7	論。	003	論  
ZH_T41_1822_003:0521a07_1	無苦根者至不善法故。	003	無 苦 根 者 至 不 善 法 故  
ZH_T41_1822_003:0521a07_15	釋無苦所以身淨妙故無等流苦。	003	釋 無 苦 所 以 身 淨 妙 故 無 等 流 苦  
ZH_T41_1822_003:0521a08_8	無不善法故無異熟苦也。	003	無 不 善 法 故 無 異 熟 苦 也  
ZH_T41_1822_003:0521a08_10	論。	003	論  
ZH_T41_1822_003:0521a09_3	無憂根者至惱害事故。	003	無 憂 根 者 至 惱 害 事 故  
ZH_T41_1822_003:0521a10_14	釋無憂所以也　一以所依身定潤故無憂　二以無憂境故無憂也。	003	釋 無 憂 所 以 也  一 以 所 依 身 定 潤 故 無 憂  二 以 無 憂 境 故 無 憂 也  
ZH_T41_1822_003:0521a11_1	論。	003	論  
ZH_T41_1822_003:0521a11_11	無色如前至信等五根。	003	無 色 如 前 至 信 等 五 根  
ZH_T41_1822_003:0521a12_3	明無色界唯八根也　言。	003	明 無 色 界 唯 八 根 也  言  
ZH_T41_1822_003:0521a12_6	通者。	003	通 者  
ZH_T41_1822_003:0521a12_12	顯下界亦有。	003	顯 下 界 亦 有  
ZH_T41_1822_003:0521a13_1	論。	003	論  
ZH_T41_1822_003:0521a13_11	如是已說至幾非所斷。	003	如 是 已 說 至 幾 非 所 斷  
ZH_T41_1822_003:0521a14_4	下一頌第六三斷分別門也。	003	下 一 頌 第 六 三 斷 分 別 門 也  
ZH_T41_1822_003:0521a14_12	論曰至非無漏故。	003	論 曰 至 非 無 漏 故  
ZH_T41_1822_003:0521a15_3	明四根通三也。	003	明 四 根 通 三 也  
ZH_T41_1822_003:0521a15_17	與見．修煩惱相應故見．修斷。	003	與 見  修 煩 惱 相 應 故 見  修 斷  
ZH_T41_1822_003:0521a16_7	通無漏故亦非所斷。	003	通 無 漏 故 亦 非 所 斷  
ZH_T41_1822_003:0521a17_3	憂根不通無漏故唯見．修所斷。	003	憂 根 不 通 無 漏 故 唯 見  修 所 斷  
ZH_T41_1822_003:0521a17_13	但與見．修惑相應故。	003	但 與 見  修 惑 相 應 故  
ZH_T41_1822_003:0521a17_18	不通非斷。	003	不 通 非 斷  
ZH_T41_1822_003:0521a18_1	論。	003	論  
ZH_T41_1822_003:0521a18_11	七色命苦至皆有漏故。	003	七 色 命 苦 至 皆 有 漏 故  
ZH_T41_1822_003:0521a19_2	此明九根唯修所斷。	003	此 明 九 根 唯 修 所 斷  
ZH_T41_1822_003:0521a19_16	不染污故不與見．修煩惱相應。	003	不 染 污 故 不 與 見  修 煩 惱 相 應  
ZH_T41_1822_003:0521a20_10	及非第六意識所生故非見斷。	003	及 非 第六意識 所 生 故 非 見 斷  
ZH_T41_1822_003:0521a21_2	皆有漏故是修所斷。	003	皆 有 漏 故 是 修 所 斷  
ZH_T41_1822_003:0521a21_7	不通非斷。	003	不 通 非 斷  
ZH_T41_1822_003:0521a21_9	論。	003	論  
ZH_T41_1822_003:0521a22_1	信等五根至及無漏故。	003	信 等 五 根 至 及 無 漏 故  
ZH_T41_1822_003:0521a22_7	釋信等五根。	003	釋 信 等 五 根  
ZH_T41_1822_003:0521a22_16	非染污故不通見斷。	003	非 染 污 故 不 通 見 斷  
ZH_T41_1822_003:0521a23_7	通有漏故是修所斷。	003	通 有 漏 故 是 修 所 斷  
ZH_T41_1822_003:0521a23_16	通無漏故亦非所斷。	003	通 無 漏 故 亦 非 所 斷  
ZH_T41_1822_003:0521a24_1	論。	003	論  
ZH_T41_1822_003:0521a24_11	最後三根至是所斷故。	003	最 後 三 根 至 是 所 斷 故  
ZH_T41_1822_003:0521a25_1	釋後三根唯不斷也。	003	釋 後 三 根 唯 不 斷 也  
ZH_T41_1822_003:0521a26_12	上來六頌六門分別義類差別。	003	上 來 六 頌 六 門 分 別 義 類 差 別  
ZH_T41_1822_003:0521a27_8	自下八頌就得等不同六門分別。	003	自 下 八 頌 就 得 等 不 同 六 門 分 別  
ZH_T41_1822_003:0521a27_10	論。	003	論  
ZH_T41_1822_003:0521a28_1	已說諸門義類差別。	003	已 說 諸 門 義 類 差 別  
ZH_T41_1822_003:0521a28_11	結前　何界已下生後。	003	結 前  何 界 已 下 生 後  
ZH_T41_1822_003:0521a29_13	此下一頌第一明三界四生初得異熟根多少也。	003	此 下 一 頌 第 一 明 三 界 四 生 初 得 異 熟 根 多 少 也  
ZH_T41_1822_003:0521b01_6	論曰至定染污故。	003	論 曰 至 定 染 污 故  
ZH_T41_1822_003:0521b01_13	此明欲界三生。	003	此 明 欲 界 三 生  
ZH_T41_1822_003:0521b02_3	初生唯得二異熟根。	003	初 生 唯 得 二 異 熟 根  
ZH_T41_1822_003:0521b02_13	爾時雖有意．捨二根。	003	爾 時 雖 有 意  捨 二 根  
ZH_T41_1822_003:0521b03_3	唯染污故非異熟根。	003	唯 染 污 故 非 異 熟 根  
ZH_T41_1822_003:0521b03_12	異熟意根無法前得。	003	異 熟 意 根 無 法 前 得  
ZH_T41_1822_003:0521b04_9	漸具根者無眼等四．及女．男也。	003	漸 具 根 者 無 眼 等 四  及 女  男 也  
ZH_T41_1822_003:0521b04_11	論。	003	論  
ZH_T41_1822_003:0521b05_3	化生初位至初得八根。	003	化 生 初 位 至 初 得 八 根  
ZH_T41_1822_003:0521b05_8	明化生也。	003	明 化 生 也  
ZH_T41_1822_003:0521b05_17	准此化生必具諸根。	003	准 此 化 生 必 具 諸 根  
ZH_T41_1822_003:0521b06_1	論。	003	論  
ZH_T41_1822_003:0521b06_11	豈有二形至二形化生。	003	豈 有 二 形 至 二 形 化 生  
ZH_T41_1822_003:0521b06_16	釋通妨也。	003	釋 通 妨 也  
ZH_T41_1822_003:0521b07_11	准此善趣無有二形．化生。	003	准 此 善 趣 無 有 二 形  化 生  
ZH_T41_1822_003:0521b08_2	此上所說唯異熟根。	003	此 上 所 說 唯 異 熟 根  
ZH_T41_1822_003:0521b08_12	若兼染污竝加意．捨。	003	若 兼 染 污 竝 加 意  捨  
ZH_T41_1822_003:0521b08_14	論。	003	論  
ZH_T41_1822_003:0521b09_6	說欲界中至色無色界。	003	說 欲 界 中 至 色無色界  
ZH_T41_1822_003:0521b09_9	結引。	003	結 引  
ZH_T41_1822_003:0521b09_11	論。	003	論  
ZH_T41_1822_003:0521b10_3	欲界欲勝至過色無色。	003	欲 界 欲 勝 至 過 色 無 色  
ZH_T41_1822_003:0521b11_7	釋頌但言欲．色不言界也　然詳此釋似當煩長。	003	釋 頌 但 言 欲  色 不 言 界 也  然 詳 此 釋 似 當 煩 長  
ZH_T41_1822_003:0521b11_9	論。	003	論  
ZH_T41_1822_003:0521b12_3	色界初得至無形者說。	003	色 界 初 得 至 無 形 者 說  
ZH_T41_1822_003:0521b12_8	釋色界也。	003	釋 色 界 也  
ZH_T41_1822_003:0521b12_10	論。	003	論  
ZH_T41_1822_003:0521b13_3	上唯命者至唯命非餘。	003	上 唯 命 者 至 唯 命 非 餘  
ZH_T41_1822_003:0521b13_8	釋無色界。	003	釋 無 色 界  
ZH_T41_1822_003:0521b14_1	頌中上言以定勝生勝故。	003	頌 中 上 言 以 定 勝 生 勝 故  
ZH_T41_1822_003:0521b14_11	非是在欲．色界之上。	003	非 是 在 欲  色 界 之 上  
ZH_T41_1822_003:0521b14_16	無別處故。	003	無 別 處 故  
ZH_T41_1822_003:0521b15_7	餘文可解　正理論云。	003	餘 文 可 解  正 理 論 云  
ZH_T41_1822_003:0521b15_12	由此證知。	003	由 此 證 知  
ZH_T41_1822_003:0521b15_17	命根實有。	003	命 根 實 有  
ZH_T41_1822_003:0521b16_10	此若非有為得何根名生無色。	003	此 若 非 有 為 得 何 根 名 生 無 色  
ZH_T41_1822_003:0521b17_3	非善．染污名業果生。	003	非 善  染 污 名 業 果 生  
ZH_T41_1822_003:0521b17_12	未受彼生容現起故。	003	未 受 彼 生 容 現 起 故  
ZH_T41_1822_003:0521b18_3	又異熟心無續生理。	003	又 異 熟 心 無 續 生 理  
ZH_T41_1822_003:0521b18_12	唯許染心能續生故。	003	唯 許 染 心 能 續 生 故  
ZH_T41_1822_003:0521b19_2	過去未來非有論者。	003	過去未來 非 有 論 者  
ZH_T41_1822_003:0521b19_11	爾時三世異熟皆無。	003	爾 時 三 世 異 熟 皆 無  
ZH_T41_1822_003:0521b19_16	異熟既無。	003	異 熟 既 無  
ZH_T41_1822_003:0521b20_1	生依何說。	003	生 依 何 說  
ZH_T41_1822_003:0521b20_18	必應許有生依實法大乘有賴耶即無過。	003	必 應 許 有 生 依 實 法 大 乘 有 賴 耶 即 無 過  
ZH_T41_1822_003:0521b21_7	經部有過婆沙一百四十七云。	003	經 部 有 過 婆 沙 一 百 四 十 七 云  
ZH_T41_1822_003:0521b21_17	問餘無色根爾時亦得。	003	問 餘 無 色 根 爾 時 亦 得  
ZH_T41_1822_003:0521b22_15	謂意．五受．信等五根此中何故不說。	003	謂 意  五 受  信 等 五 根 此 中 何 故 不 說  
ZH_T41_1822_003:0521b22_19	答有說。	003	答 有 說  
ZH_T41_1822_003:0521b23_9	爾時一切得者此中即說。	003	爾 時 一 切 得 者 此 中 即 說  
ZH_T41_1822_003:0521b23_18	餘無色根雖有得者。	003	餘 無 色 根 雖 有 得 者  
ZH_T41_1822_003:0521b24_4	而非一切。	003	而 非 一 切  
ZH_T41_1822_003:0521b24_9	是故不說。	003	是 故 不 說  
ZH_T41_1822_003:0521b24_18	謂上地沒生下地時。	003	謂 上 地 沒 生 下 地 時  
ZH_T41_1822_003:0521b25_4	雖得彼根。	003	雖 得 彼 根  
ZH_T41_1822_003:0521b25_17	若自地沒還生自地彼皆不得。	003	若 自 地 沒 還 生 自 地 彼 皆 不 得  
ZH_T41_1822_003:0521b26_7	是故不說　述曰。	003	是 故 不 說  述 曰  
ZH_T41_1822_003:0521b27_2	此說先不成就今之得者名得。	003	此 說 先 不 成 就 今 之 得 者 名 得  
ZH_T41_1822_003:0521b27_11	若自地沒還生自地。	003	若 自 地 沒 還 生 自 地  
ZH_T41_1822_003:0521b28_2	先成就故不名為得。	003	先 成 就 故 不 名 為 得  
ZH_T41_1822_003:0521b28_11	從下地沒生上地時。	003	從 下 地 沒 生 上 地 時  
ZH_T41_1822_003:0521b29_2	爾時善．染亦先成就。	003	爾 時 善  染 亦 先 成 就  
ZH_T41_1822_003:0521b29_11	唯異熟根無法前得。	003	唯 異 熟 根 無 法 前 得  
ZH_T41_1822_003:0521c01_13	彼彼生處初獲名得　問若言雖同欲界以報別故。	003	彼 彼 生 處 初 獲 名 得  問 若 言 雖 同 欲 界 以 報 別 故  
ZH_T41_1822_003:0521c02_5	此無記根名初得者。	003	此 無 記 根 名 初 得 者  
ZH_T41_1822_003:0521c02_14	何故得識不得眼云。	003	何 故 得 識 不 得 眼 云  
ZH_T41_1822_003:0521c03_16	如從二．三．四定沒生初靜慮．及欲界時。	003	如 從 二  三  四 定 沒 生初靜慮  及 欲 界 時  
ZH_T41_1822_003:0521c04_5	但得其識不得其眼。	003	但 得 其 識 不 得 其 眼  
ZH_T41_1822_003:0521c05_7	而於前身已得眼故　答前文據十八界作論。	003	而 於 前 身 已 得 眼 故  答 前 文 據 十 八 界 作 論  
ZH_T41_1822_003:0521c06_10	彼於眼界總說不簡異界．異地．及業果別。	003	彼 於 眼 界 總 說 不 簡 異 界  異 地  及 業 果 別  
ZH_T41_1822_003:0521c07_2	此中辨異熟根就業果說。	003	此 中 辨 異 熟 根 就 業 果 說  
ZH_T41_1822_003:0521c07_10	雖於同地先成眼。	003	雖 於 同 地 先 成 眼  
ZH_T41_1822_003:0521c08_2	業果不同名之為得。	003	業 果 不 同 名 之 為 得  
ZH_T41_1822_003:0521c08_5	又說。	003	又 說  
ZH_T41_1822_003:0521c08_16	此中但問初得業所生者。	003	此 中 但 問 初 得 業 所 生 者  
ZH_T41_1822_003:0521c09_6	初受生位餘無色根。	003	初 受 生 位 餘 無 色 根  
ZH_T41_1822_003:0521c10_2	雖有得者而非業生故此不說。	003	雖 有 得 者 而 非 業 生 故 此 不 說  
ZH_T41_1822_003:0521c11_2	後位所得雖業所生而非初得故此不說。	003	後 位 所 得 雖 業 所 生 而 非 初 得 故 此 不 說  
ZH_T41_1822_003:0521c11_11	此論意與後文同也。	003	此 論 意 與 後 文 同 也  
ZH_T41_1822_003:0521c12_1	論。	003	論  
ZH_T41_1822_003:0521c12_11	說異熟根至幾根後滅。	003	說 異 熟 根 至 幾 根 後 滅  
ZH_T41_1822_003:0521c13_6	下一頌第二明最後滅諸根多少。	003	下 一 頌 第 二 明 最 後 滅 諸 根 多 少  
ZH_T41_1822_003:0521c14_3	論曰在無色界至於最後滅。	003	論 曰 在 無 色 界 至 於 最 後 滅  
ZH_T41_1822_003:0521c14_9	此釋無色界。	003	此 釋 無 色 界  
ZH_T41_1822_003:0521c14_16	前先欲後無色。	003	前 先 欲 後 無 色  
ZH_T41_1822_003:0521c15_10	此文先無色後欲者乘前義便。	003	此 文 先 無 色 後 欲 者 乘 前 義 便  
ZH_T41_1822_003:0521c15_15	正理論云。	003	正 理 論 云  
ZH_T41_1822_003:0521c16_6	又無色言遮彼有色。	003	又 無 色 言 遮 彼 有 色  
ZH_T41_1822_003:0521c16_15	有餘師說彼有色故。	003	有餘師說 彼 有 色 故  
ZH_T41_1822_003:0521c17_6	若不說有實物命根。	003	若 不 說 有 實 物 命 根  
ZH_T41_1822_003:0521c17_15	何異熟斷名無色死。	003	何 異 熟 斷 名 無 色 死  
ZH_T41_1822_003:0521c18_10	若言異熟四蘊斷故彼名死者。	003	若 言 異 熟 四 蘊 斷 故 彼 名 死 者  
ZH_T41_1822_003:0521c19_5	善染污心現在前位應亦名死。	003	善 染 污 心 現 在 前 位 應 亦 名 死  
ZH_T41_1822_003:0521c20_1	若言彼地所受異熟猶未盡者。	003	若 言 彼 地 所 受 異 熟 猶 未 盡 者  
ZH_T41_1822_003:0521c20_10	如何不受而有盡期。	003	如 何 不 受 而 有 盡 期  
ZH_T41_1822_003:0521c21_1	善．染污心現在前位。	003	善  染 污 心 現 在 前 位  
ZH_T41_1822_003:0521c22_2	當言彼受何業異熟非不現前可名為受。	003	當 言 彼 受 何 業 異 熟 非 不 現 前 可 名 為 受  
ZH_T41_1822_003:0521c23_2	若謂於彼異熟習氣恒隨轉故名為受者。	003	若 謂 於 彼 異 熟 習 氣 恒 隨 轉 故 名 為 受 者  
ZH_T41_1822_003:0521c23_7	理亦不然。	003	理 亦 不 然  
ZH_T41_1822_003:0521c23_16	所執習氣非極成故。	003	所 執 習 氣 非 極 成 故  
ZH_T41_1822_003:0521c24_2	太過失故。	003	太 過 失 故  
ZH_T41_1822_003:0521c24_11	異熟雖盡習氣隨故。	003	異 熟 雖 盡 習 氣 隨 故  
ZH_T41_1822_003:0521c25_2	如業習氣應無死期。	003	如 業 習 氣 應 無 死 期  
ZH_T41_1822_003:0521c25_11	若異熟盡無習氣者。	003	若 異 熟 盡 無 習 氣 者  
ZH_T41_1822_003:0521c26_2	業亦不應有餘習氣。	003	業 亦 不 應 有 餘 習 氣  
ZH_T41_1822_003:0521c26_15	若言習氣望現異熟如我得者。	003	若 言 習 氣 望 現 異 熟 如 我 得 者  
ZH_T41_1822_003:0521c27_10	應如我得異熟不起習氣則無。	003	應 如 我 得 異 熟 不 起 習 氣 則 無  
ZH_T41_1822_003:0521c28_3	又非異熟習氣隨轉名受。	003	又 非 異 熟 習 氣 隨 轉 名 受  
ZH_T41_1822_003:0521c28_10	異熟非彼性故。	003	異 熟 非 彼 性 故  
ZH_T41_1822_003:0521c29_1	又汝所執習氣理無。	003	又 汝 所 執 習 氣 理 無  
ZH_T41_1822_003:0521c29_10	後當廣辨　抄釋云。	003	後 當 廣 辨  抄 釋 云  
ZH_T41_1822_003:0521c29_18	我宗異熟法上得。	003	我 宗 異 熟 法 上 得  
ZH_T41_1822_003:0522a01_8	異熟若滅得亦隨滅。	003	異 熟 若 滅 得 亦 隨 滅  
ZH_T41_1822_003:0522a01_13	不同業得。	003	不 同 業 得  
ZH_T41_1822_003:0522a01_15	論。	003	論  
ZH_T41_1822_003:0522a02_8	若在色界至而生死故。	003	若 在 色 界 至 而 生 死 故  
ZH_T41_1822_003:0522a02_13	此釋色界。	003	此 釋 色 界  
ZH_T41_1822_003:0522a02_18	如文可解。	003	如 文 可 解  
ZH_T41_1822_003:0522a03_1	論。	003	論  
ZH_T41_1822_003:0522a03_11	若在欲界至唯有前八。	003	若 在 欲 界 至 唯 有 前 八  
ZH_T41_1822_003:0522a03_16	此釋欲界。	003	此 釋 欲 界  
ZH_T41_1822_003:0522a04_3	如文可解。	003	如 文 可 解  
ZH_T41_1822_003:0522a04_5	論。	003	論  
ZH_T41_1822_003:0522a04_14	如是所說依頓命終。	003	如是所說 依 頓 命 終  
ZH_T41_1822_003:0522a05_5	總結上滅依頓終。	003	總 結 上 滅 依 頓 終  
ZH_T41_1822_003:0522a05_7	論。	003	論  
ZH_T41_1822_003:0522a05_17	若漸命終至前後滅義。	003	若 漸 命 終 至 前 後 滅 義  
ZH_T41_1822_003:0522a06_13	釋漸命終滅根多．少如文可解。	003	釋 漸 命 終 滅 根 多  少 如 文 可 解  
ZH_T41_1822_003:0522a06_15	論。	003	論  
ZH_T41_1822_003:0522a07_8	如是所說至而命終者。	003	如是所說 至 而 命 終 者  
ZH_T41_1822_003:0522a07_18	結上頓．漸二種命終。	003	結 上 頓  漸 二 種 命 終  
ZH_T41_1822_003:0522a08_10	但依染．無記心而命終者。	003	但 依 染  無 記 心 而 命 終 者  
ZH_T41_1822_003:0522a09_1	染．無記心滅根數同。	003	染  無 記 心 滅 根 數 同  
ZH_T41_1822_003:0522a09_6	所以合說。	003	所 以 合 說  
ZH_T41_1822_003:0522a09_8	論。	003	論  
ZH_T41_1822_003:0522a09_18	若在三界至如理應知。	003	若 在 三 界 至 如 理 應 知  
ZH_T41_1822_003:0522a10_6	次釋善心命終。	003	次 釋 善 心 命 終  
ZH_T41_1822_003:0522a11_6	隨其所應於前所說捨根位中加信等五。	003	隨其所應 於 前 所 說 捨 根 位 中 加 信 等 五  
ZH_T41_1822_003:0522a12_1	論。	003	論  
ZH_T41_1822_003:0522a12_11	分別根中至何沙門果。	003	分 別 根 中 至 何 沙 門 果  
ZH_T41_1822_003:0522a13_5	下一頌第三明得果用根多少。	003	下 一 頌 第 三 明 得 果 用 根 多 少  
