segmentnr	original	stemmed
ZH_T47_1972_001:0298a25_2	我以慈愍特留此經更住百歲。	我 以 慈 愍 特 留 此 經 更 住 百 歲  
ZH_T47_1972_001:0298a25_11	其有眾生值此經者。	其 有 眾 生 值 此 經 者  
ZH_T47_1972_001:0298a26_1	隨意所願皆可得度。	隨 意 所 願 皆 可 得 度  
ZH_T47_1972_001:0298a26_5	又經云。	又 經 云  
ZH_T47_1972_001:0298a27_9	此經滅後佛法全無但留阿彌陀佛四字名號救度眾生。	此 經 滅 後 佛 法 全 無 但 留 阿 彌 陀 佛 四 字 名 號 救 度 眾 生  
ZH_T47_1972_001:0298a27_18	其有不信而謗毀者。	其 有 不 信 而 謗 毀 者  
ZH_T47_1972_001:0298a28_8	當墮地獄具受眾苦。	當 墮 地 獄 具 受 眾 苦  
ZH_T47_1972_001:0298a28_13	故天台云。	故 天 台 云  
ZH_T47_1972_001:0298a29_7	當知彼佛於此惡世偏有緣耳。	當 知 彼 佛 於 此 惡 世 偏 有 緣 耳  
ZH_T47_1972_001:0298a29_14	相關者先覺謂。	相 關 者 先 覺 謂  
ZH_T47_1972_001:0298b01_4	兩土聖人示居淨穢。	兩 土 聖 人 示 居 淨 穢  
ZH_T47_1972_001:0298b01_14	以折攝二門調伏眾生。	以 折 攝 二 門 調 伏 眾 生  
ZH_T47_1972_001:0298b02_10	此以穢以苦以促以多魔惱而折之。	此 以 穢 以 苦 以 促 以 多 魔 惱 而 折 之  
ZH_T47_1972_001:0298b02_15	俾知所厭。	俾 知 所 厭  
ZH_T47_1972_001:0298b03_11	彼以淨以樂以延以不退轉而攝之。	彼 以 淨 以 樂 以 延 以 不 退 轉 而 攝 之  
ZH_T47_1972_001:0298b03_16	俾知所欣。	俾 知 所 欣  
ZH_T47_1972_001:0298b04_2	既厭且欣。	既 厭 且 欣  
ZH_T47_1972_001:0298b04_8	則化道行矣。	則 化 道 行 矣  
ZH_T47_1972_001:0298b05_7	又我釋迦於三乘授道之外其有度未盡者。	又 我 釋 迦 於 三 乘 授 道 之 外 其 有 度 未 盡 者  
ZH_T47_1972_001:0298b05_12	度在彌陀。	度 在 彌 陀  
ZH_T47_1972_001:0298b06_9	故於諸大乘經丁寧反覆稱讚勸往者。	故 於 諸 大 乘 經 丁 寧 反 覆 稱 讚 勸 往 者  
ZH_T47_1972_001:0298b06_17	蓋化道之相關也。	蓋 化 道 之 相 關 也  
ZH_T47_1972_001:0298b07_5	以是三者之故。	以 是 三 者 之 故  
ZH_T47_1972_001:0298b07_10	乃獨推焉。	乃 獨 推 焉  
ZH_T47_1972_001:0298b08_2	問曰。	問 曰  
ZH_T47_1972_001:0298b08_9	偏指獨推之說。	偏 指 獨 推 之 說  
ZH_T47_1972_001:0298b08_14	旨哉言乎。	旨 哉 言 乎  
ZH_T47_1972_001:0298b09_1	欣厭取捨之方。	欣 厭 取 捨 之 方  
ZH_T47_1972_001:0298b09_6	至哉教矣。	至 哉 教 矣  
ZH_T47_1972_001:0298b09_9	敢問。	敢 問  
ZH_T47_1972_001:0298b10_3	欣厭取捨得無愛憎能所之過乎。	欣 厭 取 捨 得 無 愛 憎 能 所 之 過 乎  
ZH_T47_1972_001:0298b10_6	答曰。	答 曰  
ZH_T47_1972_001:0298b10_12	汝不知言也。	汝 不 知 言 也  
ZH_T47_1972_001:0298b11_3	此非世間之愛憎能所也。	此 非 世 間 之 愛 憎 能 所 也  
ZH_T47_1972_001:0298b11_18	此乃十方如來轉凡成聖之通法也。	此 乃 十 方 如 來 轉 凡 成 聖 之 通 法 也  
ZH_T47_1972_001:0298b12_4	若非厭捨。	若 非 厭 捨  
ZH_T47_1972_001:0298b12_9	何以轉凡。	何 以 轉 凡  
ZH_T47_1972_001:0298b12_14	若非欣取。	若 非 欣 取  
ZH_T47_1972_001:0298b12_19	何以成聖。	何 以 成 聖  
ZH_T47_1972_001:0298b13_7	故自凡夫預乎聖位。	故 自 凡 夫 預 乎 聖 位  
ZH_T47_1972_001:0298b13_15	由聖位以至等覺。	由 聖 位 以 至 等 覺  
ZH_T47_1972_001:0298b14_3	其間等而上之。	其 間 等 而 上 之  
ZH_T47_1972_001:0298b14_8	無非欣厭。	無 非 欣 厭  
ZH_T47_1972_001:0298b14_17	極乎妙覺取捨始亡。	極 乎 妙 覺 取 捨 始 亡  
ZH_T47_1972_001:0298b15_3	故先德云。	故 先 德 云  
ZH_T47_1972_001:0298b15_16	取捨之極與不取捨無有異也。	取 捨 之 極 與 不 取 捨 無 有 異 也  
ZH_T47_1972_001:0298b16_8	況此淨土之法只一化機。	況 此 淨 土 之 法 只 一 化 機  
ZH_T47_1972_001:0298b17_2	而釋迦彌陀之所共立者也。	而 釋 迦 彌 陀 之 所 共 立 者 也  
ZH_T47_1972_001:0298b17_7	此指其往。	此 指 其 往  
ZH_T47_1972_001:0298b17_12	彼受其來。	彼 受 其 來  
ZH_T47_1972_001:0298b17_17	倘非厭捨。	倘 非 厭 捨  
ZH_T47_1972_001:0298b18_1	離此無由。	離 此 無 由  
ZH_T47_1972_001:0298b18_6	倘非欣取。	倘 非 欣 取  
ZH_T47_1972_001:0298b18_11	生彼無分。	生 彼 無 分  
ZH_T47_1972_001:0298b18_16	既捨此矣。	既 捨 此 矣  
ZH_T47_1972_001:0298b19_1	又生彼矣。	又 生 彼 矣  
ZH_T47_1972_001:0298b19_10	藉彼勝緣直至成佛。	藉 彼 勝 緣 直 至 成 佛  
ZH_T47_1972_001:0298b20_1	然愛憎能所功莫大矣。	然 愛 憎 能 所 功 莫 大 矣  
ZH_T47_1972_001:0298b20_7	何過之有故。	何 過 之 有 故  
ZH_T47_1972_001:0298b21_2	問曰。	問 曰  
ZH_T47_1972_001:0298b21_11	取捨之談無敢議矣。	取 捨 之 談 無 敢 議 矣  
ZH_T47_1972_001:0298b22_7	但往生之說能不乖於無生之理乎。	但 往 生 之 說 能 不 乖 於 無 生 之 理 乎  
ZH_T47_1972_001:0298b22_10	答曰。	答 曰  
ZH_T47_1972_001:0298b22_14	天台云。	天 台 云  
ZH_T47_1972_001:0298b23_3	智者熾然求生淨土。	智 者 熾 然 求 生 淨 土  
ZH_T47_1972_001:0298b23_10	達生體不可得。	達 生 體 不 可 得  
ZH_T47_1972_001:0298b23_16	即是真無生。	即 是 真 無 生  
ZH_T47_1972_001:0298b24_5	此謂心淨故佛土淨。	此 謂 心 淨 故 佛 土 淨  
ZH_T47_1972_001:0298b24_12	愚者為生所縛。	愚 者 為 生 所 縛  
ZH_T47_1972_001:0298b24_19	聞生即作生解。	聞 生 即 作 生 解  
ZH_T47_1972_001:0298b25_8	聞無生即作無生解。	聞 無 生 即 作 無 生 解  
ZH_T47_1972_001:0298b26_2	不知生即無生無生即生也。	不 知 生 即 無 生 無 生 即 生 也  
ZH_T47_1972_001:0298b26_6	長蘆曰。	長 蘆 曰  
ZH_T47_1972_001:0298b26_12	以生為生者。	以 生 為 生 者  
ZH_T47_1972_001:0298b26_19	常見之所失也。	常 見 之 所 失 也  
ZH_T47_1972_001:0298b27_6	以無生為無生者。	以 無 生 為 無 生 者  
ZH_T47_1972_001:0298b27_13	斷見之所惑也。	斷 見 之 所 惑 也  
ZH_T47_1972_001:0298b28_4	生而無生無生而生者。	生 而 無 生 無 生 而 生 者  
ZH_T47_1972_001:0298b28_10	第一義諦也。	第一義諦 也  
ZH_T47_1972_001:0298b28_14	天衣曰。	天 衣 曰  
ZH_T47_1972_001:0298b28_20	生則決定生。	生 則 決 定 生  
ZH_T47_1972_001:0298b29_5	去則實不去。	去 則 實 不 去  
ZH_T47_1972_001:0298b29_14	三家之說其旨甚明。	三 家 之 說 其 旨 甚 明  
ZH_T47_1972_001:0298c01_6	今余復以性相二字釋之。	今 余 復 以 性 相 二 字 釋 之  
ZH_T47_1972_001:0298c01_15	妙真如性本自無生。	妙 真 如 性 本 自 無 生  
ZH_T47_1972_001:0298c02_5	因緣和合乃有生相。	因緣和合 乃 有 生 相  
ZH_T47_1972_001:0298c02_13	以其性能現相故。	以 其 性 能 現 相 故  
ZH_T47_1972_001:0298c02_19	曰無生即生。	曰 無 生 即 生  
ZH_T47_1972_001:0298c03_7	以其相由性現故。	以 其 相 由 性 現 故  
ZH_T47_1972_001:0298c03_14	曰生即無生也。	曰 生 即 無 生 也  
ZH_T47_1972_001:0298c04_12	知此則知淨土之生惟心所生無生而生。	知 此 則 知 淨 土 之 生 惟 心 所 生 無 生 而 生  
ZH_T47_1972_001:0298c04_17	理何乖焉。	理 何 乖 焉  
ZH_T47_1972_001:0298c05_2	問曰。	問 曰  
ZH_T47_1972_001:0298c05_11	往生之說其旨昭然。	往 生 之 說 其 旨 昭 然  
ZH_T47_1972_001:0298c06_2	但今之學者不能曉了。	但 今 之 學 者 不 能 曉 了  
ZH_T47_1972_001:0298c06_9	千人萬人疑道。	千 人 萬 人 疑 道  
ZH_T47_1972_001:0298c06_18	極樂遠隔十萬億國。	極 樂 遠 隔 十 萬 億 國  
ZH_T47_1972_001:0298c07_7	臨命終時恐難得到。	臨命終時 恐 難 得 到  
ZH_T47_1972_001:0298c07_14	復何策以曉之。	復 何 策 以 曉 之  
ZH_T47_1972_001:0298c07_17	答曰。	答 曰  
ZH_T47_1972_001:0298c08_2	是可咲也。	是 可 咲 也  
ZH_T47_1972_001:0298c08_15	說了許多心外無土土外無心。	說 了 許 多 心 外 無 土 土 外 無 心  
ZH_T47_1972_001:0298c09_4	到者裏猶道不曉。	到 者 裏 猶 道 不 曉  
ZH_T47_1972_001:0298c09_8	此無他。	此 無 他  
ZH_T47_1972_001:0298c10_7	只是眾生妄認自心在色身之內方寸之間。	只 是 眾 生 妄 認 自 心 在 色 身 之 內 方 寸 之 間  
ZH_T47_1972_001:0298c10_18	不知自家心量元自廣大。	不 知 自 家 心 量 元 自 廣 大  
ZH_T47_1972_001:0298c11_7	豈不聞讚佛偈云。	豈 不 聞 讚 佛 偈 云  
ZH_T47_1972_001:0298c11_16	心包太虛量周沙界。	心 包 太 虛 量 周 沙 界  
ZH_T47_1972_001:0298c12_7	且十方虛空無量無邊。	且 十 方 虛 空 無量無邊  
ZH_T47_1972_001:0298c12_16	被我心量都盧包了。	被 我 心 量 都 盧 包 了  
ZH_T47_1972_001:0298c13_6	恒沙世界無量無數。	恒 沙 世界無量 無 數  
ZH_T47_1972_001:0298c13_15	我之心量一一周遍。	我 之 心 量 一 一 周 遍  
ZH_T47_1972_001:0298c14_1	如此看來。	如 此 看 來  
ZH_T47_1972_001:0298c14_10	十萬億國在我心中。	十 萬 億 國 在 我 心 中  
ZH_T47_1972_001:0298c14_15	其實甚近。	其 實 甚 近  
ZH_T47_1972_001:0298c15_1	何遠之有。	何 遠 之 有  
ZH_T47_1972_001:0298c15_6	命終生時。	命 終 生 時  
ZH_T47_1972_001:0298c15_11	生我心中。	生 我 心 中  
ZH_T47_1972_001:0298c15_16	其實甚易。	其 實 甚 易  
ZH_T47_1972_001:0298c16_1	何難之有。	何 難 之 有  
ZH_T47_1972_001:0298c16_9	豈不見十疑論云。	豈 不 見 十 疑 論 云  
ZH_T47_1972_001:0298c17_7	十萬億剎為對凡夫肉眼生死心量說耳。	十 萬 億 剎 為 對 凡 夫 肉 眼 生 死 心 量 說 耳  
ZH_T47_1972_001:0298c17_17	但使眾生淨土業成者。	但 使 眾 生 淨 土 業 成 者  
ZH_T47_1972_001:0298c18_13	臨終在定之心即是淨土受生之心。	臨 終 在 定 之 心 即 是 淨 土 受 生 之 心  
ZH_T47_1972_001:0298c19_4	動念即是生淨土時。	動 念 即 是 生 淨 土 時  
ZH_T47_1972_001:0298c19_10	為此觀經云。	為 此 觀 經 云  
ZH_T47_1972_001:0298c19_19	彌陀佛國去此不遠。	彌 陀 佛 國 去 此 不 遠  
ZH_T47_1972_001:0298c20_7	又業力不可思議。	又 業 力 不可思議  
ZH_T47_1972_001:0298c20_12	一念即生。	一 念 即 生  
ZH_T47_1972_001:0298c20_17	不須愁遠。	不 須 愁 遠  
ZH_T47_1972_001:0298c21_6	又如人夢身雖在床。	又 如 人 夢 身 雖 在 床  
ZH_T47_1972_001:0298c21_15	而心意識遍至他方。	而 心 意 識 遍 至 他 方  
ZH_T47_1972_001:0298c22_2	生淨土亦然。	生 淨 土 亦 然  
ZH_T47_1972_001:0298c22_7	不須疑也。	不 須 疑 也  
ZH_T47_1972_001:0298c22_10	經云。	經 云  
ZH_T47_1972_001:0298c22_19	一彈指頃即得往生。	一 彈 指 頃 即 得 往 生  
ZH_T47_1972_001:0298c23_1	又云。	又 云  
ZH_T47_1972_001:0298c23_6	屈伸臂頃。	屈 伸 臂 頃  
ZH_T47_1972_001:0298c23_9	又云。	又 云  
ZH_T47_1972_001:0298c23_14	頃刻之間。	頃 刻 之 間  
ZH_T47_1972_001:0298c23_20	故自信錄云。	故 自 信 錄 云  
ZH_T47_1972_001:0298c24_8	十萬億剎頃刻至者。	十 萬 億 剎 頃 刻 至 者  
ZH_T47_1972_001:0298c24_14	自心本妙耳。	自 心 本 妙 耳  
ZH_T47_1972_001:0298c25_2	此等重重喻說。	此 等 重 重 喻 說  
ZH_T47_1972_001:0298c26_4	只是言其生在自己廣大心中甚近而甚易者也。	只 是 言 其 生 在 自 己 廣 大 心 中 甚 近 而 甚 易 者 也  
ZH_T47_1972_001:0298c26_15	我如今且莫說廣大心量。	我 如 今 且 莫 說 廣 大 心 量  
ZH_T47_1972_001:0298c27_9	且只就汝色身之內方寸之間。	且 只 就 汝 色 身 之 內 方 寸 之 間  
ZH_T47_1972_001:0298c27_14	說箇譬喻。	說 箇 譬 喻  
ZH_T47_1972_001:0298c28_4	譬如此方到西天竺。	譬 如 此 方 到 西 天 竺  
ZH_T47_1972_001:0298c28_11	動經十萬餘里。	動 經 十 萬 餘 里  
ZH_T47_1972_001:0298c29_1	一路之間多經國土。	一 路 之 間 多 經 國 土  
ZH_T47_1972_001:0298c29_9	有一人雖未親到。	有 一 人 雖 未 親 到  
ZH_T47_1972_001:0298c29_18	曾聞他人講說一遍。	曾 聞 他 人 講 說 一 遍  
ZH_T47_1972_001:0299a01_3	記憶在心。	記 憶 在 心  
ZH_T47_1972_001:0299a01_12	其人後時坐臥之間。	其 人 後 時 坐 臥 之 間  
ZH_T47_1972_001:0299a02_2	忽動一念思量彼國。	忽 動 一 念 思 量 彼 國  
ZH_T47_1972_001:0299a02_11	思量千里便到千里。	思 量 千 里 便 到 千 里  
ZH_T47_1972_001:0299a02_16	思量萬里。	思 量 萬 里  
ZH_T47_1972_001:0299a03_1	便到萬里。	便 到 萬 里  
ZH_T47_1972_001:0299a03_10	思量天竺便到天竺。	思 量 天 竺 便 到 天 竺  
ZH_T47_1972_001:0299a03_15	以此比之。	以 此 比 之  
ZH_T47_1972_001:0299a04_6	生淨土便是這箇道理。	生 淨 土 便 是 這 箇 道 理  
ZH_T47_1972_001:0299a04_14	豈不是彈指之頃。	豈 不 是 彈 指 之 頃  
ZH_T47_1972_001:0299a04_19	一念便到。	一 念 便 到  
ZH_T47_1972_001:0299a05_6	何難到之有哉。	何 難 到 之 有 哉  
ZH_T47_1972_001:0299a05_17	汝若不修淨業要到極難。	汝 若 不 修 淨 業 要 到 極 難  
ZH_T47_1972_001:0299a06_7	淨業若成要到極易。	淨 業 若 成 要 到 極 易  
ZH_T47_1972_001:0299a06_12	但辨肯心。	但 辨 肯 心  
ZH_T47_1972_001:0299a06_17	決不相賺。	決 不 相 賺  
ZH_T47_1972_001:0299a07_2	問曰。	問 曰  
ZH_T47_1972_001:0299a07_11	不修淨業要生極難。	不 修 淨 業 要 生 極 難  
ZH_T47_1972_001:0299a07_16	此誠言也。	此 誠 言 也  
ZH_T47_1972_001:0299a08_9	何故前舉逆惡凡夫臨終亦生。	何 故 前 舉 逆 惡 凡 夫 臨 終 亦 生  
ZH_T47_1972_001:0299a08_15	吾未聞其詳。	吾 未 聞 其 詳  
ZH_T47_1972_001:0299a09_1	而且有疑。	而 且 有 疑  
ZH_T47_1972_001:0299a09_8	幸詳示而釋之。	幸 詳 示 而 釋 之  
ZH_T47_1972_001:0299a09_11	答曰。	答 曰  
ZH_T47_1972_001:0299a09_15	觀經云。	觀 經 云  
ZH_T47_1972_001:0299a10_1	下品下生者。	下 品 下 生 者  
ZH_T47_1972_001:0299a10_10	或有眾生作不善業。	或 有 眾 生 作 不 善 業  
ZH_T47_1972_001:0299a10_19	五逆十惡具諸不善。	五 逆 十 惡 具 諸 不 善  
ZH_T47_1972_001:0299a11_8	如此愚人以惡業故。	如 此 愚 人 以 惡 業 故  
ZH_T47_1972_001:0299a12_3	應墮惡道經歷多劫受苦無窮。	應 墮 惡 道 經 歷 多 劫 受 苦 無 窮  
ZH_T47_1972_001:0299a12_12	如此愚人臨命終時。	如 此 愚 人 臨命終時  
ZH_T47_1972_001:0299a13_10	遇善知識種種安慰為說妙法教令念佛。	遇 善 知 識 種 種 安 慰 為 說 妙 法 教 令 念 佛  
ZH_T47_1972_001:0299a14_1	此人苦逼不遑念佛。	此 人 苦 逼 不 遑 念 佛  
ZH_T47_1972_001:0299a14_6	善友告言。	善 友 告 言  
ZH_T47_1972_001:0299a14_13	汝若不能念者。	汝 若 不 能 念 者  
ZH_T47_1972_001:0299a15_1	應稱無量壽佛。	應 稱 無 量 壽 佛  
ZH_T47_1972_001:0299a15_10	如是至心令聲不絕。	如 是 至 心 令 聲 不 絕  
ZH_T47_1972_001:0299a16_3	具足十念稱南無阿彌陀佛。	具 足 十 念 稱 南 無 阿 彌 陀 佛  
ZH_T47_1972_001:0299a16_8	稱佛名故。	稱 佛 名 故  
ZH_T47_1972_001:0299a16_13	於念念中。	於念念中  
ZH_T47_1972_001:0299a17_3	除八十億劫生死之罪。	除 八 十 億 劫 生 死 之 罪  
ZH_T47_1972_001:0299a17_8	命終之時。	命 終 之 時  
ZH_T47_1972_001:0299a18_2	見金蓮華猶如日輪住其人前。	見 金 蓮 華 猶 如 日 輪 住 其 人 前  
ZH_T47_1972_001:0299a18_15	如一念頃即得往生極樂世界。	如 一 念 頃 即 得 往 生 極樂世界  
ZH_T47_1972_001:0299a19_10	於蓮華中滿十二大劫蓮華方開。	於 蓮 華 中 滿 十 二 大 劫 蓮 華 方 開  
ZH_T47_1972_001:0299a20_4	觀世音大勢至以大悲音聲。	觀 世 音 大 勢 至 以 大 悲 音 聲  
ZH_T47_1972_001:0299a20_17	為其廣說諸法實相除滅罪法。	為 其 廣 說 諸法實相 除 滅 罪 法  
ZH_T47_1972_001:0299a21_3	聞已歡喜。	聞 已 歡 喜  
ZH_T47_1972_001:0299a21_12	應時即發菩提之心。	應 時 即 發 菩提之心  
ZH_T47_1972_001:0299a21_17	此其詳也。	此 其 詳 也  
ZH_T47_1972_001:0299a22_6	雖十二劫處蓮華中。	雖 十 二 劫 處 蓮 華 中  
ZH_T47_1972_001:0299a22_17	而其受用快樂如忉利天。	而 其 受 用 快 樂 如 忉 利 天  
ZH_T47_1972_001:0299a23_3	故古者云。	故 古 者 云  
ZH_T47_1972_001:0299a23_11	華中快樂如忉利。	華 中 快 樂 如 忉 利  
ZH_T47_1972_001:0299a23_19	不比人間父母胎。	不 比 人 間 父 母 胎  
ZH_T47_1972_001:0299a24_5	逆惡得生者。	逆 惡 得 生 者  
ZH_T47_1972_001:0299a24_10	觀經疏曰。	觀 經 疏 曰  
ZH_T47_1972_001:0299a24_19	以念佛除滅罪障故。	以 念 佛 除 滅 罪 障 故  
ZH_T47_1972_001:0299a25_8	即以念佛為勝緣也。	即 以 念 佛 為 勝 緣 也  
ZH_T47_1972_001:0299a25_13	余詳經意。	余 詳 經 意  
ZH_T47_1972_001:0299a26_3	即是念佛滅罪而生。	即 是 念 佛 滅 罪 而 生  
ZH_T47_1972_001:0299a26_12	然以疏論參而明之。	然 以 疏 論 參 而 明 之  
ZH_T47_1972_001:0299a26_17	則有三義。	則 有 三 義  
ZH_T47_1972_001:0299a27_2	一者或問。	一 者 或 問  
ZH_T47_1972_001:0299a27_18	如何以少時心力而能勝終身造惡耶。	如 何 以 少 時 心 力 而 能 勝 終 身 造 惡 耶  
ZH_T47_1972_001:0299a28_5	曰心雖少時。	曰 心 雖 少 時  
ZH_T47_1972_001:0299a28_11	而其力猛利。	而 其 力 猛 利  
ZH_T47_1972_001:0299a29_1	是心勇決名為大心。	是 心 勇 決 名 為 大 心  
ZH_T47_1972_001:0299a29_8	以捨身事急故。	以 捨 身 事 急 故  
ZH_T47_1972_001:0299b01_3	如人入陣不惜身命名為健人也。	如 人 入 陣 不惜身命 名 為 健 人 也  
ZH_T47_1972_001:0299b01_10	二者此雖造惡。	二 者 此 雖 造 惡  
ZH_T47_1972_001:0299b01_19	或現世曾修三昧故。	或 現 世 曾 修 三 昧 故  
ZH_T47_1972_001:0299b02_8	臨終勸念定心易成。	臨 終 勸 念 定 心 易 成  
ZH_T47_1972_001:0299b02_17	亦是乘急戒緩人也。	亦 是 乘 急 戒 緩 人 也  
ZH_T47_1972_001:0299b03_6	縱現世不修三昧。	縱 現 世 不 修 三 昧  
ZH_T47_1972_001:0299b03_13	亦是宿種今熟。	亦 是 宿 種 今 熟  
ZH_T47_1972_001:0299b04_1	以宿善業強故。	以 宿 善 業 強 故  
ZH_T47_1972_001:0299b04_9	臨終得遇善知識。	臨 終 得 遇 善 知 識  
ZH_T47_1972_001:0299b04_15	十念功成也。	十 念 功 成 也  
ZH_T47_1972_001:0299b05_2	三者若非宿種。	三 者 若 非 宿 種  
ZH_T47_1972_001:0299b05_7	又非現修。	又 非 現 修  
ZH_T47_1972_001:0299b05_14	則其念佛之時。	則 其 念 佛 之 時  
ZH_T47_1972_001:0299b05_19	必有重悔。	必 有 重 悔  
ZH_T47_1972_001:0299b06_3	故永明曰。	故 永 明 曰  
ZH_T47_1972_001:0299b06_8	善惡無定。	善 惡 無 定  
ZH_T47_1972_001:0299b06_13	因緣體空。	因 緣 體 空  
ZH_T47_1972_001:0299b06_18	迹有升沈。	迹 有 升 沈  
ZH_T47_1972_001:0299b07_2	事分優劣。	事 分 優 劣  
ZH_T47_1972_001:0299b07_13	真金一兩勝百兩之疊華。	真 金 一 兩 勝 百 兩 之 疊 華  
ZH_T47_1972_001:0299b08_5	爝火微光爇萬仞之積草。	爝 火 微 光 爇 萬 仞 之 積 草  
ZH_T47_1972_001:0299b09_2	問曰。	問 曰  
ZH_T47_1972_001:0299b09_11	五濁惡世人皆有罪。	五濁惡世 人 皆 有 罪  
ZH_T47_1972_001:0299b09_19	縱未造五逆重罪。	縱 未 造 五 逆 重 罪  
ZH_T47_1972_001:0299b10_8	其餘罪業孰能無之。	其 餘 罪 業 孰 能 無 之  
ZH_T47_1972_001:0299b10_15	苟不懺悔消滅。	苟 不 懺 悔 消 滅  
ZH_T47_1972_001:0299b11_7	但只臨終念佛能往生乎。	但 只 臨 終 念 佛 能 往 生 乎  
ZH_T47_1972_001:0299b11_10	答曰。	答 曰  
ZH_T47_1972_001:0299b11_15	亦得生也。	亦 得 生 也  
ZH_T47_1972_001:0299b12_10	此乃全藉彌陀不思議之大願力也。	此 乃 全 藉 彌 陀 不 思 議 之 大 願 力 也  
ZH_T47_1972_001:0299b12_15	那先經云。	那 先 經 云  
ZH_T47_1972_001:0299b13_7	如持百枚太石置於船上。	如 持 百 枚 太 石 置 於 船 上  
ZH_T47_1972_001:0299b13_16	藉船力故石不沒水。	藉 船 力 故 石 不 沒 水  
ZH_T47_1972_001:0299b14_2	若無其船。	若 無 其 船  
ZH_T47_1972_001:0299b14_7	小石亦沒。	小 石 亦 沒  
ZH_T47_1972_001:0299b15_5	喻彼世人一生造惡臨終念佛不入泥犁。	喻 彼 世 人 一 生 造 惡 臨 終 念 佛 不 入 泥 犁  
ZH_T47_1972_001:0299b15_10	若非念佛。	若 非 念 佛  
ZH_T47_1972_001:0299b15_15	雖作小惡。	雖 作 小 惡  
ZH_T47_1972_001:0299b15_20	亦入泥犁。	亦 入 泥 犁  
ZH_T47_1972_001:0299b16_4	況大惡乎。	況 大 惡 乎  
ZH_T47_1972_001:0299b16_9	船喻佛力。	船 喻 佛 力  
ZH_T47_1972_001:0299b16_14	石喻惡業。	石 喻 惡 業  
ZH_T47_1972_001:0299b17_5	故昔人有帶業而生之說。	故 昔 人 有 帶 業 而 生 之 說  
ZH_T47_1972_001:0299b17_12	四土文中亦云。	四 土 文 中 亦 云  
ZH_T47_1972_001:0299b18_5	具惑染者亦得生同居淨也。	具 惑 染 者 亦 得 生 同 居 淨 也  
ZH_T47_1972_001:0299b18_11	又如僧雄俊。	又 如 僧 雄 俊  
ZH_T47_1972_001:0299b18_16	臨入鑊湯。	臨 入 鑊 湯  
ZH_T47_1972_001:0299b19_5	并汾州人屠牛為業。	并 汾 州 人 屠 牛 為 業  
ZH_T47_1972_001:0299b20_1	臨終見群牛逼觸其身苦痛切己。	臨 終 見 群 牛 逼 觸 其 身 苦 痛 切 己  
ZH_T47_1972_001:0299b20_10	及張鐘馗殺雞為業。	及 張 鐘 馗 殺 雞 為 業  
ZH_T47_1972_001:0299b21_8	臨終見神人驅群雞喙破兩目流血盈床。	臨 終 見 神 人 驅 群 雞 喙 破 兩 目 流 血 盈 床  
ZH_T47_1972_001:0299b21_17	稱佛名號俱生淨土。	稱 佛 名 號 俱 生 淨 土  
ZH_T47_1972_001:0299b22_11	此非佛力而何請復以喻明之。	此 非 佛 力 而 何 請 復 以 喻 明 之  
ZH_T47_1972_001:0299b22_18	如人現犯官法。	如 人 現 犯 官 法  
ZH_T47_1972_001:0299b23_4	應入官內。	應 入 官 內  
ZH_T47_1972_001:0299b23_10	以投託國王。	以 投 託 國 王  
ZH_T47_1972_001:0299b23_15	承王宣召。	承 王 宣 召  
ZH_T47_1972_001:0299b24_8	則官不能拘而復達帝京也。	則 官 不 能 拘 而 復 達 帝 京 也  
ZH_T47_1972_001:0299b24_15	所以西資鈔云。	所 以 西 資 鈔 云  
ZH_T47_1972_001:0299b25_1	得生淨土。	得 生 淨 土  
ZH_T47_1972_001:0299b25_6	是假他力。	是 假 他 力  
ZH_T47_1972_001:0299b25_19	彌陀願攝釋迦勸讚諸佛護念。	彌 陀 願 攝 釋 迦 勸 讚 諸 佛 護 念  
ZH_T47_1972_001:0299b26_4	如渡大海。	如 渡 大 海  
ZH_T47_1972_001:0299b26_9	既得巨舟。	既 得 巨 舟  
ZH_T47_1972_001:0299b26_14	仍有良導。	仍 有 良 導  
ZH_T47_1972_001:0299b27_6	加以便風必能速到彼岸也。	加 以 便 風 必 能 速 到 彼 岸 也  
ZH_T47_1972_001:0299b27_13	若其不肯登舟。	若 其 不 肯 登 舟  
ZH_T47_1972_001:0299b27_19	遲留惡國者。	遲 留 惡 國 者  
ZH_T47_1972_001:0299b28_4	誰之過歟。	誰 之 過 歟  
ZH_T47_1972_001:0299b29_2	問曰。	問 曰  
ZH_T47_1972_001:0299b29_5	前云。	前 云  
ZH_T47_1972_001:0299b29_14	博地凡夫便階不退。	博 地 凡 夫 便 階 不 退  
ZH_T47_1972_001:0299c01_3	此必已無惡業者也。	此 必 已 無 惡 業 者 也  
ZH_T47_1972_001:0299c01_10	今此帶業而生。	今 此 帶 業 而 生  
ZH_T47_1972_001:0299c01_15	能不退乎。	能 不 退 乎  
ZH_T47_1972_001:0299c01_18	答曰。	答 曰  
ZH_T47_1972_001:0299c02_3	例皆不退。	例 皆 不 退  
ZH_T47_1972_001:0299c02_6	經云。	經 云  
ZH_T47_1972_001:0299c02_17	其有生者悉住正定之聚。	其 有 生 者 悉 住 正 定 之 聚  
ZH_T47_1972_001:0299c02_20	又云。	又 云  
ZH_T47_1972_001:0299c03_10	眾生生者皆是阿鞞跋致。	眾 生 生 者 皆 是 阿鞞跋致  
ZH_T47_1972_001:0299c03_16	又十疑論云。	又 十 疑 論 云  
ZH_T47_1972_001:0299c04_6	有五因緣能令不退。	有 五 因 緣 能 令 不 退  
ZH_T47_1972_001:0299c05_4	一者阿彌陀佛大悲願力攝持故不退。	一 者 阿 彌 陀 佛 大 悲 願 力 攝 持 故 不 退  
ZH_T47_1972_001:0299c06_2	二者佛光常照菩提心常增長故不退。	二 者 佛 光 常 照 菩 提 心 常 增 長 故 不 退  
ZH_T47_1972_001:0299c06_17	三者水鳥樹林風聲樂音皆說苦空。	三 者 水 鳥 樹 林 風 聲 樂 音 皆 說 苦 空  
ZH_T47_1972_001:0299c07_14	聞者常起念佛念法念僧之心故不退。	聞 者 常 起 念 佛 念 法 念 僧 之 心 故 不 退  
ZH_T47_1972_001:0299c08_9	四者彼國純諸菩薩以為良友。	四 者 彼 國 純 諸 菩 薩 以 為 良 友  
ZH_T47_1972_001:0299c08_14	無惡緣境。	無 惡 緣 境  
ZH_T47_1972_001:0299c09_2	外無外道鬼魔。	外 無 外 道 鬼 魔  
ZH_T47_1972_001:0299c09_9	內無邪三毒等。	內 無 邪 三 毒 等  
ZH_T47_1972_001:0299c09_19	煩惱畢竟不起故不退。	煩 惱 畢 竟 不 起 故 不 退  
ZH_T47_1972_001:0299c10_10	五者生彼國者壽命永劫。	五 者 生 彼 國 者 壽 命 永 劫  
ZH_T47_1972_001:0299c11_1	共佛齊等故不退也。	共 佛 齊 等 故 不 退 也  
ZH_T47_1972_001:0299c11_6	又古人云。	又 古 人 云  
ZH_T47_1972_001:0299c11_14	不願生淨土則已。	不 願 生 淨 土 則 已  
ZH_T47_1972_001:0299c12_2	願生則無不得生。	願 生 則 無 不 得 生  
ZH_T47_1972_001:0299c12_7	不生則已。	不 生 則 已  
ZH_T47_1972_001:0299c12_15	生則永不退轉也。	生 則 永 不 退 轉 也  
ZH_T47_1972_001:0299c13_2	問曰。	問 曰  
ZH_T47_1972_001:0299c13_7	一生造惡。	一 生 造 惡  
