segmentnr	original	folio	stemmed
ZH_T12_0374_020:0482b12_14	利根之人於現在世能得善根，中根之人後世則得，諸佛世尊不空說法。	020	利 根 之 人 於 現 在 世 能 得 善 根  中根之人 後 世 則 得  諸佛世尊 不 空 說 法  
ZH_T12_0374_020:0482b12_17	大王！	020	大 王  
ZH_T12_0374_020:0482b14_6	譬如淨人，墜墮圊廁，有善知識見而愍之，尋前捉髮而拔出之。	020	譬 如 淨 人  墜 墮 圊 廁  有 善 知 識 見 而 愍 之  尋 前 捉 髮 而 拔 出 之  
ZH_T12_0374_020:0482b16_8	諸佛如來亦復如是，見諸眾生墮三惡道，方便救濟令得出離，是故如來為一闡提而演說法。	020	諸佛如來 亦復如是  見 諸 眾 生 墮 三 惡 道  方 便 救 濟 令 得 出 離  是 故 如 來 為 一 闡 提 而 演 說 法  
ZH_T12_0374_020:0482b16_14	」王語耆婆：	020	 王 語 耆 婆  
ZH_T12_0374_020:0482b17_17	「若使如來審如是者，明當選擇良日吉星，然後乃往。	020	 若 使 如 來 審 如 是 者  明 當 選 擇 良 日 吉 星  然 後 乃 往  
ZH_T12_0374_020:0482b18_3	」耆婆白王：	020	 耆 婆 白 王  
ZH_T12_0374_020:0482b18_7	「大王！	020	 大 王  
ZH_T12_0374_020:0482b19_1	如來法中，無有選擇良日吉星。	020	如 來 法 中  無 有 選 擇 良 日 吉 星  
ZH_T12_0374_020:0482b19_4	大王！	020	大 王  
ZH_T12_0374_020:0482b20_3	如重病人猶不看日、時節、吉凶，惟求良醫。	020	如 重 病 人 猶 不 看 日  時 節  吉 凶  惟 求 良 醫  
ZH_T12_0374_020:0482b21_3	王今病重，求佛良醫，不應選擇良時好日。	020	王 今 病 重  求 佛 良 醫  不 應 選 擇 良 時 好 日  
ZH_T12_0374_020:0482b21_6	大王！	020	大 王  
ZH_T12_0374_020:0482b22_16	如栴檀火及𦭽蘭火，二俱燒相，無有異也，吉日凶日，亦復如是。	020	如 栴 檀 火 及 𦭽 蘭 火  二 俱 燒 相  無 有 異 也  吉 日 凶 日  亦復如是  
ZH_T12_0374_020:0482b23_15	若到佛所，俱得滅罪，惟願大王今日速往。	020	若 到 佛 所  俱 得 滅 罪  惟 願 大 王 今 日 速 往  
ZH_T12_0374_020:0482b24_13	」爾時大王即命一臣名曰吉祥，而告之言：	020	 爾 時 大 王 即 命 一 臣 名 曰 吉 祥  而 告 之 言  
ZH_T12_0374_020:0482b25_17	「大臣當知，吾今欲往佛世尊所，速辦供養所須之具。	020	 大 臣 當 知  吾 今 欲 往 佛 世 尊 所  速 辦 供 養 所 須 之 具  
ZH_T12_0374_020:0482b26_1	」臣言：	020	 臣 言  
ZH_T12_0374_020:0482b26_5	「大王！	020	 大 王  
ZH_T12_0374_020:0482b26_11	善哉，善哉！	020	善 哉  善 哉  
ZH_T12_0374_020:0482b26_20	所須供具一切悉有。	020	所 須 供 具 一 切 悉 有  
ZH_T12_0374_020:0482c02_7	」阿闍世王與其夫人，嚴駕車乘一萬二千，姝壯大象其數五萬，一一象上各載三人，齎持幡蓋、花香、伎樂、種種供具，無不備足，導從馬騎有十八萬，摩伽陀國所有人民尋從王者，其數足滿五十八萬。	020	 阿 闍 世 王 與 其 夫 人  嚴 駕 車 乘 一 萬 二 千  姝 壯 大 象 其 數 五 萬  一 一 象 上 各 載 三 人  齎 持 幡 蓋  花 香  伎 樂  種 種 供 具  無 不 備 足  導 從 馬 騎 有 十 八 萬  摩伽陀國 所 有 人 民 尋 從 王 者  其 數 足 滿 五 十 八 萬  
ZH_T12_0374_020:0482c04_4	爾時拘尸那城所有大眾滿十二由旬，悉皆遙見阿闍世王與其眷屬尋路而來。	020	爾 時 拘 尸 那 城 所 有 大 眾 滿 十 二 由 旬  悉 皆 遙 見 阿 闍 世 王 與 其 眷 屬 尋 路 而 來  
ZH_T12_0374_020:0482c04_13	爾時佛告諸大眾言：	020	爾 時 佛 告 諸 大 眾 言  
ZH_T12_0374_020:0482c05_18	「一切眾生為阿耨多羅三藐三菩提近因緣者，莫先善友。	020	 一 切 眾 生 為 阿耨多羅三藐三菩提 近 因 緣 者  莫 先 善 友  
ZH_T12_0374_020:0482c06_3	何以故？	020	何 以 故  
ZH_T12_0374_020:0482c08_1	阿闍世王若不隨順耆婆語者，來月七日必定命終墮阿鼻獄，是故近因莫若善友。	020	阿 闍 世 王 若 不 隨 順 耆 婆 語 者  來 月 七 日 必 定 命 終 墮 阿 鼻 獄  是 故 近 因 莫 若 善 友  
ZH_T12_0374_020:0482c11_13	」阿闍世王復於前路聞舍婆提毘流離王乘船入海遇火而死，瞿伽離比丘生身入地至阿鼻獄，須那剎多作種種惡到於佛所眾罪得滅，聞是語已語耆婆言：	020	 阿 闍 世 王 復 於 前 路 聞 舍 婆 提 毘 流 離 王 乘 船 入 海 遇 火 而 死  瞿 伽 離 比 丘 生 身 入 地 至 阿 鼻 獄  須 那 剎 多 作 種 種 惡 到 於 佛 所 眾 罪 得 滅  聞 是 語 已 語 耆 婆 言  
ZH_T12_0374_020:0482c12_8	「吾今雖聞如是二語，猶未審定。	020	 吾 今 雖 聞 如 是 二 語  猶 未 審 定  
ZH_T12_0374_020:0482c12_13	汝來耆婆！	020	汝 來 耆 婆  
ZH_T12_0374_020:0482c14_2	吾欲與汝同載一象，設我當入阿鼻地獄，冀汝捉持不令我墮。	020	吾 欲 與 汝 同 載 一 象  設 我 當 入 阿鼻地獄  冀 汝 捉 持 不 令 我 墮  
ZH_T12_0374_020:0482c14_6	何以故？	020	何 以 故  
ZH_T12_0374_020:0482c15_1	吾昔曾聞得道之人不入地獄。	020	吾 昔 曾 聞 得 道 之 人 不 入 地 獄  
ZH_T12_0374_020:0482c16_8	」爾時佛告諸大眾言：	020	 爾 時 佛 告 諸 大 眾 言  
ZH_T12_0374_020:0482c17_7	「阿闍世王猶有疑心，我今當為作決定心。	020	 阿 闍 世 王 猶 有 疑 心  我 今 當 為 作 決 定 心  
ZH_T12_0374_020:0482c18_6	」爾時會中有一菩薩，名持一切，白佛言：	020	 爾 時 會 中 有 一 菩 薩  名 持 一 切  白 佛 言  
ZH_T12_0374_020:0482c18_10	「世尊！	020	 世 尊  
ZH_T12_0374_020:0482c20_17	如佛先說，一切諸法皆無定相，所謂色無定相，乃至涅槃亦無定相，如來今者云何而言，為阿闍世作決定心？	020	如 佛 先 說  一切諸法 皆 無 定 相  所 謂 色 無 定 相  乃至涅槃 亦 無 定 相  如 來 今 者 云 何 而 言  為 阿 闍 世 作 決 定 心  
ZH_T12_0374_020:0482c21_1	」佛言：	020	 佛 言  
ZH_T12_0374_020:0482c21_8	「善哉，善哉！	020	 善 哉  善 哉  
ZH_T12_0374_020:0482c21_12	善男子！	020	善 男 子  
ZH_T12_0374_020:0482c22_4	我今定為阿闍世王作決定心。	020	我 今 定 為 阿 闍 世 王 作 決 定 心  
ZH_T12_0374_020:0482c22_8	何以故？	020	何 以 故  
ZH_T12_0374_020:0482c24_11	若王疑心可破壞者，當知諸法無有定相，是故我為阿闍世王作決定心，當知是心為無決定。	020	若 王 疑 心 可 破 壞 者  當 知 諸 法 無 有 定 相  是 故 我 為 阿 闍 世 王 作 決 定 心  當 知 是 心 為 無 決 定  
ZH_T12_0374_020:0482c24_15	善男子！	020	善 男 子  
ZH_T12_0374_020:0482c25_13	若彼王心是決定者，王之逆罪云何可壞？	020	若 彼 王 心 是 決 定 者  王 之 逆 罪 云 何 可 壞  
ZH_T12_0374_020:0482c26_16	以無定相，其罪可壞，是故我為阿闍世王作決定心。	020	以 無 定 相  其 罪 可 壞  是 故 我 為 阿 闍 世 王 作 決 定 心  
ZH_T12_0374_020:0482c28_18	」爾時大王即到娑羅雙樹間，至於佛所，仰瞻如來三十二相、八十種好，猶如微妙真金之山。	020	 爾 時 大 王 即 到 娑 羅 雙 樹 間  至 於 佛 所  仰 瞻 如 來 三十二相  八十種好  猶 如 微 妙 真 金 之 山  
ZH_T12_0374_020:0482c29_9	爾時世尊出八種聲告言：	020	爾 時 世 尊 出 八 種 聲 告 言  
ZH_T12_0374_020:0482c29_13	「大王。	020	 大 王  
ZH_T12_0374_020:0483a01_13	」時阿闍世左右顧視，「此大眾中誰是大王？	020	 時 阿 闍 世 左 右 顧 視   此 大 眾 中 誰 是 大 王  
ZH_T12_0374_020:0483a02_11	我既罪戾，又無福德，如來不應稱為大王。	020	我 既 罪 戾  又 無 福 德  如 來 不 應 稱 為 大 王  
ZH_T12_0374_020:0483a03_1	」爾時如來即復喚言：	020	 爾 時 如 來 即 復 喚 言  
ZH_T12_0374_020:0483a03_8	「阿闍世大王。	020	 阿 闍 世 大 王  
ZH_T12_0374_020:0483a04_1	」時王聞已，心大歡喜，即作是言：	020	 時 王 聞 已  心大歡喜  即 作 是 言  
ZH_T12_0374_020:0483a05_9	「如來今日顧命語言，真知如來於諸眾生，大悲憐愍，等無差別。	020	 如 來 今 日 顧 命 語 言  真 知 如 來 於 諸 眾 生  大 悲 憐 愍  等 無 差 別  
ZH_T12_0374_020:0483a05_14	」白佛言：	020	 白 佛 言  
ZH_T12_0374_020:0483a05_18	「世尊！	020	 世 尊  
ZH_T12_0374_020:0483a06_17	我今疑心永無遺餘，定知如來真是眾生無上大師。	020	我 今 疑 心 永 無 遺 餘  定 知 如 來 真 是 眾 生 無上大師  
ZH_T12_0374_020:0483a07_12	」爾時迦葉菩薩語持一切菩薩言：	020	 爾 時 迦 葉 菩 薩 語 持 一切菩薩 言  
ZH_T12_0374_020:0483a08_7	「如來已為阿闍世王作決定心。	020	 如 來 已 為 阿 闍 世 王 作 決 定 心  
ZH_T12_0374_020:0483a08_19	」爾時阿闍世王即白佛言：	020	 爾 時 阿 闍 世 王 即 白 佛 言  
ZH_T12_0374_020:0483a09_3	「世尊！	020	 世 尊  
ZH_T12_0374_020:0483a10_6	假使我今得與梵王釋提桓因坐起飲食，猶不欣悅；	020	假 使 我 今 得 與 梵 王 釋提桓因 坐 起 飲 食  猶 不 欣 悅  
ZH_T12_0374_020:0483a10_20	得遇如來一言顧命，深以欣慶。	020	得 遇 如 來 一 言 顧 命  深 以 欣 慶  
ZH_T12_0374_020:0483a13_1	」爾時阿闍世王，即以所持幡蓋、香花、伎樂供養，前禮佛足，右遶三匝，禮敬畢已，却坐一面。	020	 爾 時 阿 闍 世 王  即 以 所 持 幡 蓋  香 花  伎 樂 供 養  前 禮 佛 足  右 遶 三 匝  禮 敬 畢 已  却 坐 一 面  
ZH_T12_0374_020:0483a14_9	爾時佛告阿闍世王言：	020	爾 時 佛 告 阿 闍 世 王 言  
ZH_T12_0374_020:0483a14_13	「大王！	020	 大 王  
ZH_T12_0374_020:0483a15_10	今當為汝說正法要，汝當一心，諦聽！	020	今 當 為 汝 說 正 法 要  汝 當 一 心  諦 聽  
ZH_T12_0374_020:0483a15_13	諦聽！	020	諦 聽  
ZH_T12_0374_020:0483a16_6	凡夫常當繫心觀身，有二十事：	020	凡 夫 常 當 繫 心 觀 身  有 二 十 事  
ZH_T12_0374_020:0483a27_10_0	一、所謂我，此身中空，無無漏，二、無諸善	020	一、所謂我，此身中空，無無漏，二、無諸善
ZH_T12_0374_020:0483a27_10_1	根本，三、我此生死未得調順，四、墮墜深坑	020	根本，三、我此生死未得調順，四、墮墜深坑
ZH_T12_0374_020:0483a27_10_2	無處不畏，五、以何方便得見佛性，六、云何	020	無處不畏，五、以何方便得見佛性，六、云何
ZH_T12_0374_020:0483a27_10_3	修定得見佛性，七、生死常苦無常我淨，八、	020	修定得見佛性，七、生死常苦無常我淨，八、
ZH_T12_0374_020:0483a27_10_4	八難之難難得遠離，九、恒為怨家之所追逐，	020	八難之難難得遠離，九、恒為怨家之所追逐，
ZH_T12_0374_020:0483a27_10_5	十、無有一法能遮諸有，十一、於三惡趣未得	020	十、無有一法能遮諸有，十一、於三惡趣未得
ZH_T12_0374_020:0483a27_10_6	解脫，十二、具足種種諸惡邪見，十三、亦未	020	解脫，十二、具足種種諸惡邪見，十三、亦未
ZH_T12_0374_020:0483a27_10_7	造立度五逆津，十四、生死無際未得其邊，十	020	造立度五逆津，十四、生死無際未得其邊，十
ZH_T12_0374_020:0483a27_10_8	五、不作諸業不得果報，十六、無有我作他人	020	五、不作諸業不得果報，十六、無有我作他人
ZH_T12_0374_020:0483a27_10_9	受果，十七、不作樂因終無樂果，十八、若有	020	受果，十七、不作樂因終無樂果，十八、若有
ZH_T12_0374_020:0483a27_10_10	造業果終不失，十九、因無明生亦因而死，二	020	造業果終不失，十九、因無明生亦因而死，二
ZH_T12_0374_020:0483a27_10_11	十、去來現在常行放逸。	020	十、去來現在常行放逸。
ZH_T12_0374_020:0483a27_13	大王！	020	大 王  
ZH_T12_0374_020:0483a28_12	凡夫之人常於此身，當作如是二十種觀。	020	凡 夫 之 人 常 於 此 身  當 作 如 是 二 十 種 觀  
ZH_T12_0374_020:0483a29_11	作是觀已不樂生死，不樂生死則得正觀。	020	作 是 觀 已 不 樂 生 死  不 樂 生 死 則 得 正 觀  
ZH_T12_0374_020:0483b01_7	爾時次第觀心生相、住相、滅相；	020	爾 時 次 第 觀 心 生 相  住 相  滅 相  
ZH_T12_0374_020:0483b02_4	次第觀心生住滅相，定、慧、進、戒，亦復如是；	020	次 第 觀 心 生 住 滅 相  定  慧  進  戒  亦復如是  
ZH_T12_0374_020:0483b03_13	觀生住滅已，知心相乃至戒相，終不作惡，無有死畏、三惡道畏。	020	觀 生 住 滅 已  知 心 相 乃 至 戒 相  終 不 作 惡  無 有 死 畏  三 惡 道 畏  
ZH_T12_0374_020:0483b04_16	若不繫心觀察如是二十事者，心則放逸，無惡不造。	020	若 不 繫 心 觀 察 如 是 二 十 事 者  心 則 放 逸  無 惡 不 造  
ZH_T12_0374_020:0483b05_1	」阿闍世言：	020	 阿 闍 世 言  
ZH_T12_0374_020:0483b07_2	「如我解佛所說義者，我從昔來，初未曾觀是二十事，故造眾惡，造眾惡故，則有死畏、三惡道畏。	020	 如 我 解 佛 所 說 義 者  我 從 昔 來  初 未 曾 觀 是 二 十 事  故 造 眾 惡  造 眾 惡 故  則 有 死 畏  三 惡 道 畏  
ZH_T12_0374_020:0483b07_5	世尊！	020	世 尊  
ZH_T12_0374_020:0483b08_3	自我招殃，造茲重惡，父王無辜，橫加逆害。	020	自 我 招 殃  造 茲 重 惡  父 王 無 辜  橫 加 逆 害  
ZH_T12_0374_020:0483b09_2	是二十事設觀不觀，必定當墮阿鼻地獄。	020	是 二 十 事 設 觀 不 觀  必 定 當 墮 阿鼻地獄  
ZH_T12_0374_020:0483b09_8	」佛告大王：	020	 佛 告 大 王  
ZH_T12_0374_020:0483b10_15	「一切諸法性相無常、無有決定，王云何言，必定當墮阿鼻地獄？	020	 一切諸法 性 相 無 常  無 有 決 定  王 云 何 言  必 定 當 墮 阿鼻地獄  
ZH_T12_0374_020:0483b11_3	」阿闍世王白佛言：	020	 阿 闍 世 王 白 佛 言  
ZH_T12_0374_020:0483b11_7	「世尊！	020	 世 尊  
ZH_T12_0374_020:0483b12_4	若一切法無定相者，我之殺罪亦應不定；	020	若 一 切 法 無 定 相 者  我 之 殺 罪 亦 應 不 定  
ZH_T12_0374_020:0483b12_18	若殺定者，一切諸法則非不定。	020	若 殺 定 者  一切諸法 則 非 不 定  
ZH_T12_0374_020:0483b13_1	」佛言：	020	 佛 言  
ZH_T12_0374_020:0483b13_5	「大王！	020	 大 王  
ZH_T12_0374_020:0483b13_11	善哉，善哉！	020	善 哉  善 哉  
ZH_T12_0374_020:0483b15_1	諸佛世尊說一切法悉無定相，王復能知殺亦不定，是故當知殺無定相。	020	諸佛世尊 說 一 切 法 悉 無 定 相  王 復 能 知 殺 亦 不 定  是故當知 殺 無 定 相  
ZH_T12_0374_020:0483b15_4	大王！	020	大 王  
ZH_T12_0374_020:0483b16_4	如汝所言，先父無辜橫加逆害者，何者是父？	020	如 汝 所 言  先 父 無 辜 橫 加 逆 害 者  何 者 是 父  
ZH_T12_0374_020:0483b16_18	但於假名眾生五陰，妄生父想。	020	但 於 假 名 眾 生 五 陰  妄 生 父 想  
ZH_T12_0374_020:0483b17_13	於十二入、十八界中，何者是父？	020	於 十 二 入  十 八 界 中  何 者 是 父  
ZH_T12_0374_020:0483b18_2	若色是父，四陰應非；	020	若 色 是 父  四 陰 應 非  
ZH_T12_0374_020:0483b18_12	若四是父，色亦應非。	020	若 四 是 父  色 亦 應 非  
ZH_T12_0374_020:0483b19_6	若色非色合為父者，無有是處。	020	若 色 非 色 合 為 父 者  無 有 是 處  
ZH_T12_0374_020:0483b19_10	何以故？	020	何 以 故  
ZH_T12_0374_020:0483b19_20	色與非色，性無合故。	020	色 與 非 色  性 無 合 故  
ZH_T12_0374_020:0483b20_1	大王！	020	大 王  
ZH_T12_0374_020:0483b21_4	凡夫眾生於是色陰妄生父想，如是色陰亦不可害。	020	凡 夫 眾 生 於 是 色 陰 妄 生 父 想  如 是 色 陰 亦 不 可 害  
ZH_T12_0374_020:0483b21_8	何以故？	020	何 以 故  
ZH_T12_0374_020:0483b22_17	色有十種，是十種中，唯色一種，可見可持、可稱可量、可牽可縛。	020	色 有 十 種  是 十 種 中  唯 色 一 種  可 見 可 持  可 稱 可 量  可 牽 可 縛  
ZH_T12_0374_020:0483b24_9	雖可見縛，其性不住，以不住故不可得見、不可捉持、不可稱量、不可牽縛。	020	雖 可 見 縛  其 性 不 住  以 不 住 故 不 可 得 見  不 可 捉 持  不可稱量  不 可 牽 縛  
ZH_T12_0374_020:0483b24_19	色相如是，云何可殺？	020	色 相 如 是  云 何 可 殺  
ZH_T12_0374_020:0483b25_13	若色是父，可殺可害、獲罪報者；	020	若 色 是 父  可 殺 可 害  獲 罪 報 者  
ZH_T12_0374_020:0483b25_18	餘九應非。	020	餘 九 應 非  
ZH_T12_0374_020:0483b26_7	若九非者，則應無罪。	020	若 九 非 者  則 應 無 罪  
ZH_T12_0374_020:0483b26_10	大王！	020	大 王  
ZH_T12_0374_020:0483b26_15	色有三種：	020	色 有 三 種  
ZH_T12_0374_020:0483b27_2	過去、未來、現在。	020	過 去  未 來  現 在  
ZH_T12_0374_020:0483b27_12	過去、現在則不可害。	020	過 去  現 在 則 不 可 害  
ZH_T12_0374_020:0483b27_16	何以故？	020	何 以 故  
ZH_T12_0374_020:0483b28_8	過去過去故，現在念念滅故；	020	過 去 過 去 故  現 在 念 念 滅 故  
ZH_T12_0374_020:0483b28_17	遮未來故名之為殺。	020	遮 未 來 故 名 之 為 殺  
ZH_T12_0374_020:0483c01_1	如是一色，或有可殺，或不可殺，有殺不殺，色則不定。	020	如 是 一 色  或 有 可 殺  或 不 可 殺  有 殺 不 殺  色 則 不 定  
ZH_T12_0374_020:0483c02_1	若色不定殺亦不定，殺不定故報亦不定。	020	若 色 不 定 殺 亦 不 定  殺 不 定 故 報 亦 不 定  
ZH_T12_0374_020:0483c02_10	云何說言定入地獄？	020	云 何 說 言 定 入 地 獄  
ZH_T12_0374_020:0483c02_14	「大王！	020	 大 王  
ZH_T12_0374_020:0483c03_7	一切眾生所作罪業凡有二種：	020	一 切 眾 生 所 作 罪 業 凡 有 二 種  
ZH_T12_0374_020:0483c03_15	一者輕，二者重。	020	一 者 輕  二 者 重  
ZH_T12_0374_020:0483c04_4	若心口作，則名為輕；	020	若 心 口 作  則 名 為 輕  
ZH_T12_0374_020:0483c04_14	身口心作，則名為重。	020	身 口 心 作  則 名 為 重  
ZH_T12_0374_020:0483c04_17	大王！	020	大 王  
ZH_T12_0374_020:0483c05_12	心念口說，身不作者，所得報輕。	020	心 念 口 說  身 不 作 者  所 得 報 輕  
ZH_T12_0374_020:0483c05_15	大王！	020	大 王  
ZH_T12_0374_020:0483c06_6	昔日口不勅殺，但言削足。	020	昔 日 口 不 勅 殺  但 言 削 足  
ZH_T12_0374_020:0483c06_9	大王！	020	大 王  
ZH_T12_0374_020:0483c07_15	若勅侍臣立斬王首，坐時乃斬猶不得罪，況王不勅云何得罪？	020	若 勅 侍 臣 立 斬 王 首  坐 時 乃 斬 猶 不 得 罪  況 王 不 勅 云 何 得 罪  
ZH_T12_0374_020:0483c08_10	王若得罪，諸佛世尊亦應得罪。	020	王 若 得 罪  諸佛世尊 亦 應 得 罪  
ZH_T12_0374_020:0483c08_14	何以故？	020	何 以 故  
ZH_T12_0374_020:0483c10_4	汝父先王頻婆娑羅，常於諸佛種諸善根，是故今日得居王位。	020	汝 父 先 王 頻婆娑羅  常 於 諸 佛 種 諸 善 根  是 故 今 日 得 居 王 位  
ZH_T12_0374_020:0483c11_12	諸佛若不受其供養則不為王，若不為王，汝則不得為國生害。	020	諸 佛 若 不 受 其 供 養 則 不 為 王  若 不 為 王  汝 則 不 得 為 國 生 害  
ZH_T12_0374_020:0483c12_11	若汝殺父當有罪者，我等諸佛亦應有罪。	020	若 汝 殺 父 當 有 罪 者  我 等 諸 佛 亦 應 有 罪  
ZH_T12_0374_020:0483c13_12	若諸佛世尊無有罪者，汝獨云何而得罪耶？	020	若 諸佛世尊 無 有 罪 者  汝 獨 云 何 而 得 罪 耶  
ZH_T12_0374_020:0483c13_15	大王！	020	大 王  
ZH_T12_0374_020:0483c16_4	頻婆娑羅往有惡心，於毘富羅山遊行獵鹿，周遍壙野悉無所得，唯見一仙五通具足，見已即生瞋恚惡心：	020	頻婆娑羅 往 有 惡 心  於 毘 富 羅 山 遊 行 獵 鹿  周 遍 壙 野 悉 無 所 得  唯 見 一 仙 五 通 具 足  見 已 即 生 瞋 恚 惡 心  
ZH_T12_0374_020:0483c16_19	『我今遊獵所以不得，正坐此人。	020	 我 今 遊 獵 所 以 不 得  正 坐 此 人  
ZH_T12_0374_020:0483c17_12	』驅逐令去，即勅左右而令殺之。	020	 驅 逐 令 去  即 勅 左 右 而 令 殺 之  
ZH_T12_0374_020:0483c18_12	其人臨終，生瞋惡心，退失神通，而作誓言：	020	其 人 臨 終  生 瞋 惡 心  退 失 神 通  而 作 誓 言  
ZH_T12_0374_020:0483c20_4	『我實無辜，汝以心口，橫加戮害，我於來世亦當如是，還以心口而害於汝。	020	 我 實 無 辜  汝 以 心 口  橫 加 戮 害  我 於 來 世 亦 當 如 是  還 以 心 口 而 害 於 汝  
ZH_T12_0374_020:0483c20_20	』時王聞已，即生悔心，供養死屍。	020	 時 王 聞 已  即 生 悔 心  供 養 死 屍  
ZH_T12_0374_020:0483c21_12	是王如是尚得輕受，不墮地獄；	020	是 王 如 是 尚 得 輕 受  不 墮 地 獄  
ZH_T12_0374_020:0483c22_6	況王不爾，而當地獄受果報耶？	020	況 王 不 爾  而 當 地 獄 受 果 報 耶  
ZH_T12_0374_020:0483c23_5	先王自作還自受之，云何令王而得殺罪？	020	先 王 自 作 還 自 受 之  云 何 令 王 而 得 殺 罪  
ZH_T12_0374_020:0483c23_16	如王所言，父王無辜者。	020	如 王 所 言  父 王 無 辜 者  
ZH_T12_0374_020:0483c23_19	大王！	020	大 王  
ZH_T12_0374_020:0483c24_4	云何言無？	020	云 何 言 無  
ZH_T12_0374_020:0483c25_3	夫有罪者則有罪報，無惡業者則無罪報。	020	夫 有 罪 者 則 有 罪 報  無 惡 業 者 則 無 罪 報  
ZH_T12_0374_020:0483c25_17	汝父先王若無辜罪，云何有報？	020	汝 父 先 王 若 無 辜 罪  云 何 有 報  
ZH_T12_0374_020:0483c28_8	頻婆娑羅於現世中，亦得善果及以惡果，是故先王亦復不定，以不定故殺亦不定，殺不定故，云何而言定入地獄？	020	頻婆娑羅 於 現 世 中  亦 得 善 果 及 以 惡 果  是 故 先 王 亦 復 不 定  以 不 定 故 殺 亦 不 定  殺 不 定 故  云 何 而 言 定 入 地 獄  
ZH_T12_0374_020:0483c29_3	「大王！	020	 大 王  
ZH_T12_0374_020:0483c29_12	眾生狂惑凡有四種：	020	眾 生 狂 惑 凡 有 四 種  
ZH_T12_0374_020:0484a01_14	一者貪狂，二者藥狂，三者呪狂，四者本業緣狂。	020	一 者 貪 狂  二 者 藥 狂  三 者 呪 狂  四 者 本 業 緣 狂  
ZH_T12_0374_020:0484a01_17	大王！	020	大 王  
ZH_T12_0374_020:0484a02_19	我弟子中有是四狂，雖多作惡，我終不記是人犯戒。	020	我 弟 子 中 有 是 四 狂  雖 多 作 惡  我 終 不 記 是 人 犯 戒  
ZH_T12_0374_020:0484a03_19	是人所作，不至三惡，若還得心，亦不言犯。	020	是 人 所 作  不 至 三 惡  若 還 得 心  亦 不 言 犯  
ZH_T12_0374_020:0484a04_18	王本貪國，逆害父王，貪狂心作，云何得罪？	020	王 本 貪 國  逆 害 父 王  貪 狂 心 作  云 何 得 罪  
ZH_T12_0374_020:0484a04_21	大王！	020	大 王  
ZH_T12_0374_020:0484a06_8	如人酒醉，逆害其母，既醒寤已，心生悔恨，當知是業亦不得報。	020	如 人 酒 醉  逆 害 其 母  既 醒 寤 已  心 生 悔 恨  當 知 是 業 亦 不 得 報  
ZH_T12_0374_020:0484a07_8	王今貪醉，非本心作，若非本心，云何得罪？	020	王 今 貪 醉  非 本 心 作  若 非 本 心  云 何 得 罪  
ZH_T12_0374_020:0484a07_11	大王！	020	大 王  
ZH_T12_0374_020:0484a09_12	譬如幻師，四衢道頭，幻作種種男女、象馬、瓔珞、衣服，愚癡之人謂為真實，有智之人知非真有。	020	譬 如 幻 師  四 衢 道 頭  幻 作 種 種 男 女  象 馬  瓔 珞  衣 服  愚 癡 之 人 謂 為 真 實  有 智 之 人 知 非 真 有  
ZH_T12_0374_020:0484a10_12	殺亦如是，凡夫謂實，諸佛世尊知其非真。	020	殺 亦 如 是  凡 夫 謂 實  諸佛世尊 知 其 非 真  
ZH_T12_0374_020:0484a10_15	大王！	020	大 王  
ZH_T12_0374_020:0484a12_3	譬如山間響聲，愚癡之人謂之實聲，有智之人知其非真。	020	譬 如 山 間 響 聲  愚 癡 之 人 謂 之 實 聲  有 智 之 人 知 其 非 真  
ZH_T12_0374_020:0484a13_3	殺亦如是，凡夫謂實，諸佛世尊知其非真。	020	殺 亦 如 是  凡 夫 謂 實  諸佛世尊 知 其 非 真  
ZH_T12_0374_020:0484a13_6	大王！	020	大 王  
ZH_T12_0374_020:0484a14_14	如人有怨，詐來親附，愚癡之人謂為實親，智者了達乃知虛詐。	020	如 人 有 怨  詐 來 親 附  愚 癡 之 人 謂 為 實 親  智 者 了 達 乃 知 虛 詐  
ZH_T12_0374_020:0484a15_13	殺亦如是，凡夫謂實，諸佛世尊知其非真。	020	殺 亦 如 是  凡 夫 謂 實  諸佛世尊 知 其 非 真  
ZH_T12_0374_020:0484a15_16	大王！	020	大 王  
ZH_T12_0374_020:0484a17_4	如人執鏡，自見面像，愚癡之人謂為真面，智者了達知其非真。	020	如 人 執 鏡  自 見 面 像  愚 癡 之 人 謂 為 真 面  智 者 了 達 知 其 非 真  
ZH_T12_0374_020:0484a18_4	殺亦如是，凡夫謂實，諸佛世尊知其非真。	020	殺 亦 如 是  凡 夫 謂 實  諸佛世尊 知 其 非 真  
ZH_T12_0374_020:0484a18_7	大王！	020	大 王  
ZH_T12_0374_020:0484a19_10	如熱時炎，愚癡之人謂之是水，智者了達知其非水。	020	如 熱 時 炎  愚 癡 之 人 謂 之 是 水  智 者 了 達 知 其 非 水  
ZH_T12_0374_020:0484a20_10	殺亦如是，凡夫謂實，諸佛世尊知其非真。	020	殺 亦 如 是  凡 夫 謂 實  諸佛世尊 知 其 非 真  
ZH_T12_0374_020:0484a20_13	大王！	020	大 王  
