segmentnr	original	folio	stemmed
ZH_T41_1822_003:0515b20_5	論。	003	論  
ZH_T41_1822_003:0515b20_15	出大便處至起此樂故。	003	出 大 便 處 至 起 此 樂 故  
ZH_T41_1822_003:0515b21_4	前難有雜亂失。	003	前 難 有 雜 亂 失  
ZH_T41_1822_003:0515b21_11	後難無別增上。	003	後 難 無 別 增 上  
ZH_T41_1822_003:0515b21_13	論。	003	論  
ZH_T41_1822_003:0515b22_6	又諸喉齒至不應立根。	003	又 諸 喉 齒 至 不 應 立 根  
ZH_T41_1822_003:0515b22_13	此是太過失也。	003	此 是 太 過 失 也  
ZH_T41_1822_003:0515b22_17	正理云。	003	正 理 云  
ZH_T41_1822_003:0515b24_6	太過失者彼所立根應無限量等　問七十五法何故色唯五根。	003	太 過 失 者 彼 所 立 根 應 無 限 量 等  問 七十五法 何 故 色 唯 五 根  
ZH_T41_1822_003:0515b24_10	心王全。	003	心 王 全  
ZH_T41_1822_003:0515b25_2	通中唯取受．念．定慧四。	003	通 中 唯 取 受  念  定 慧 四  
ZH_T41_1822_003:0515b25_12	善中唯取信．勤二法。	003	善 中 唯 取 信  勤 二 法  
ZH_T41_1822_003:0515b26_2	不相應中唯取命根。	003	不 相 應 中 唯 取 命 根  
ZH_T41_1822_003:0515b26_13	不取餘法　答若依餘師。	003	不 取 餘 法  答 若 依 餘 師  
ZH_T41_1822_003:0515b27_14	此十三法於流轉．還滅有勝用故建立為根。	003	此 十 三 法 於 流 轉  還 滅 有 勝 用 故 建 立 為 根  
ZH_T41_1822_003:0515b28_5	餘用非勝不立根也。	003	餘 用 非 勝 不 立 根 也  
ZH_T41_1822_003:0515b28_11	若依曇無德。	003	若 依 曇 無 德  
ZH_T41_1822_003:0515b29_3	即此十三法是心所依。	003	即 此 十 三 法 是 心 所 依  
ZH_T41_1822_003:0515b29_6	此別。	003	此 別  
ZH_T41_1822_003:0515b29_9	此住。	003	此 住  
ZH_T41_1822_003:0515b29_13	此雜染。	003	此 雜 染  
ZH_T41_1822_003:0515b29_17	此資糧。	003	此 資 糧  
ZH_T41_1822_003:0515c01_3	此淨故立為根。	003	此 淨 故 立 為 根  
ZH_T41_1822_003:0515c01_12	餘法不爾不立為根。	003	餘 法 不 爾 不 立 為 根  
ZH_T41_1822_003:0515c01_17	正理問云。	003	正 理 問 云  
ZH_T41_1822_003:0515c02_11	諸法相望各各別有增上用故。	003	諸 法 相 望 各 各 別 有 增 上 用 故  
ZH_T41_1822_003:0515c02_16	應竝名根。	003	應 竝 名 根  
ZH_T41_1822_003:0515c03_9	答云此極增上別說義成。	003	答 云 此 極 增 上 別 說 義 成  
ZH_T41_1822_003:0515c06_7	如師子王．及村邑主　如前已引此文　問此中將勝能作因對增上果當立為根　豈能親於因緣對果而反不立根耶。	003	如 師 子 王  及 村 邑 主  如 前 已 引 此 文  問 此 中 將 勝 能 作 因 對 增 上 果 當 立 為 根  豈 能 親 於 因 緣 對 果 而 反 不 立 根 耶  
ZH_T41_1822_003:0515c07_1	論。	003	論  
ZH_T41_1822_003:0515c07_11	此中眼等至亦當廣辨。	003	此 中 眼 等 至 亦 當 廣 辨  
ZH_T41_1822_003:0515c08_3	上來六頌建立二十二根。	003	上 來 六 頌 建 立 二十二根  
ZH_T41_1822_003:0515c08_13	下兩頌第二釋根體相。	003	下 兩 頌 第 二 釋 根 體 相  
ZH_T41_1822_003:0515c08_18	於中有二。	003	於 中 有 二  
ZH_T41_1822_003:0515c09_5	先指當餘根。	003	先 指 當 餘 根  
ZH_T41_1822_003:0515c09_15	後釋五受．及三無漏。	003	後 釋 五 受  及 三 無 漏  
ZH_T41_1822_003:0515c10_1	此即初也。	003	此 即 初 也  
ZH_T41_1822_003:0515c10_3	論。	003	論  
ZH_T41_1822_003:0515c10_15	樂等五受至依九立三根者。	003	樂 等 五 受 至 依 九 立 三 根 者  
ZH_T41_1822_003:0515c11_8	後釋五受．及三無漏根。	003	後 釋 五 受  及 三無漏根  
ZH_T41_1822_003:0515c11_13	受有三種。	003	受 有 三 種  
ZH_T41_1822_003:0515c11_17	一攝益。	003	一 攝 益  
ZH_T41_1822_003:0515c12_1	二損惱。	003	二 損 惱  
ZH_T41_1822_003:0515c12_12	三非損非益　又有二種。	003	三 非 損 非 益  又 有 二 種  
ZH_T41_1822_003:0515c12_16	一身受。	003	一 身 受  
ZH_T41_1822_003:0515c13_2	謂五識相應。	003	謂 五 識 相 應  
ZH_T41_1822_003:0515c13_6	二心受。	003	二 心 受  
ZH_T41_1822_003:0515c13_17	謂意識相應　身受攝益。	003	謂 意 識 相 應  身 受 攝 益  
ZH_T41_1822_003:0515c14_9	及第三禪心受攝益名樂受。	003	及 第 三 禪 心 受 攝 益 名 樂 受  
ZH_T41_1822_003:0515c15_13	身受損惱名苦受　心受第二禪已下攝益名喜受。	003	身 受 損 惱 名 苦 受  心 受 第 二 禪 已 下 攝 益 名 喜 受  
ZH_T41_1822_003:0515c16_13	損惱名憂受　通在身．心非損非益名捨受。	003	損 惱 名 憂 受  通 在 身  心 非 損 非 益 名 捨 受  
ZH_T41_1822_003:0515c17_5	論曰至名為苦根。	003	論 曰 至 名 為 苦 根  
ZH_T41_1822_003:0515c17_10	釋苦受也。	003	釋 苦 受 也  
ZH_T41_1822_003:0515c17_12	論。	003	論  
ZH_T41_1822_003:0515c18_8	所言悅者至心悅名樂釋樂受也。	003	所 言 悅 者 至 心 悅 名 樂 釋 樂 受 也  
ZH_T41_1822_003:0515c18_10	論。	003	論  
ZH_T41_1822_003:0515c19_3	即此心悅至名為喜根。	003	即 此 心 悅 至 名 為 喜 根  
ZH_T41_1822_003:0515c19_8	釋喜受也。	003	釋 喜 受 也  
ZH_T41_1822_003:0515c19_10	論。	003	論  
ZH_T41_1822_003:0515c20_3	第三靜慮至唯名喜根。	003	第三靜慮 至 唯 名 喜 根  
ZH_T41_1822_003:0515c20_10	此釋三禪名樂。	003	此 釋 三 禪 名 樂  
ZH_T41_1822_003:0515c20_17	下地名喜所以。	003	下 地 名 喜 所 以  
ZH_T41_1822_003:0515c21_1	論。	003	論  
ZH_T41_1822_003:0515c21_11	意識相應至名曰憂根。	003	意 識 相 應 至 名 曰 憂 根  
ZH_T41_1822_003:0515c21_16	釋憂受也。	003	釋 憂 受 也  
ZH_T41_1822_003:0515c22_1	論。	003	論  
ZH_T41_1822_003:0515c22_15	中謂非悅至應言通二釋捨受也。	003	中 謂 非 悅 至 應 言 通 二 釋 捨 受 也  
ZH_T41_1822_003:0515c23_1	論。	003	論  
ZH_T41_1822_003:0515c23_10	何因此二總立一根。	003	何 因 此 二 總 立 一 根  
ZH_T41_1822_003:0515c23_13	問也。	003	問 也  
ZH_T41_1822_003:0515c23_20	何因悅與不悅。	003	何 因 悅 與 不 悅  
ZH_T41_1822_003:0515c24_5	在身．在心。	003	在 身  在 心  
ZH_T41_1822_003:0515c24_10	受名各別。	003	受 名 各 別  
ZH_T41_1822_003:0515c24_16	非悅非不悅。	003	非 悅 非 不 悅  
ZH_T41_1822_003:0515c25_2	在心．在身。	003	在 心  在 身  
ZH_T41_1822_003:0515c25_7	合為捨受。	003	合 為 捨 受  
ZH_T41_1822_003:0515c25_9	論。	003	論  
ZH_T41_1822_003:0515c26_3	此受在身心至身心合一。	003	此 受 在 身 心 至 身 心 合 一  
ZH_T41_1822_003:0515c26_8	釋妨難也。	003	釋 妨 難 也  
ZH_T41_1822_003:0515c26_10	論。	003	論  
ZH_T41_1822_003:0515c27_2	又苦樂受至故總立根。	003	又 苦 樂 受 至 故 總 立 根  
ZH_T41_1822_003:0515c27_7	更重釋也。	003	更 重 釋 也  
ZH_T41_1822_003:0515c27_9	論。	003	論  
ZH_T41_1822_003:0515c28_1	意樂喜捨至立具知根。	003	意 樂 喜 捨 至 立 具 知 根  
ZH_T41_1822_003:0515c28_13	此釋三無漏根　於中有二。	003	此 釋 三無漏根  於 中 有 二  
ZH_T41_1822_003:0515c28_18	先以九根。	003	先 以 九 根  
ZH_T41_1822_003:0515c29_8	於其三道立為三根。	003	於 其 三 道 立 為 三 根  
ZH_T41_1822_003:0515c29_17	後釋三根得名所由。	003	後 釋 三 根 得 名 所 由  
ZH_T41_1822_003:0516a01_4	此即初也。	003	此 即 初 也  
ZH_T41_1822_003:0516a01_6	論。	003	論  
ZH_T41_1822_003:0516a01_15	如是三名因何而立。	003	如 是 三 名 因 何 而 立  
ZH_T41_1822_003:0516a02_7	自此已下釋三根名。	003	自 此 已 下 釋 三 根 名  
ZH_T41_1822_003:0516a03_7	先問後答　問云因何名未知當知根等。	003	先 問 後 答  問 云 因 何 名 未知當知根 等  
ZH_T41_1822_003:0516a03_9	論。	003	論  
ZH_T41_1822_003:0516a04_4	謂在見道至名未知當知。	003	謂 在 見 道 至 名 未 知 當 知  
ZH_T41_1822_003:0516a04_13	此釋初無漏根名也。	003	此 釋 初 無 漏 根 名 也  
ZH_T41_1822_003:0516a04_18	智名為知。	003	智 名 為 知  
ZH_T41_1822_003:0516a05_4	忍非知故。	003	忍 非 知 故  
ZH_T41_1822_003:0516a05_14	在見道中苦法智忍位。	003	在 見 道 中 苦 法 智 忍 位  
ZH_T41_1822_003:0516a06_6	有八諦未知當知行轉。	003	有 八 諦 未 知 當 知 行 轉  
ZH_T41_1822_003:0516a07_1	至苦法智位有七未知當知行。	003	至 苦 法 智 位 有 七 未 知 當 知 行  
ZH_T41_1822_003:0516a08_2	乃至道類忍位有色．無色道諦未知當知行故。	003	乃 至 道 類 忍 位 有 色  無 色 道 諦 未 知 當 知 行 故  
ZH_T41_1822_003:0516a08_15	故十五心皆名未知當知根也。	003	故 十 五 心 皆 名 未知當知根 也  
ZH_T41_1822_003:0516a09_1	論。	003	論  
ZH_T41_1822_003:0516a09_11	若在修道至名為已知。	003	若 在 修 道 至 名 為 已 知  
ZH_T41_1822_003:0516a10_2	此釋第二無漏根名也。	003	此 釋 第 二 無 漏 根 名 也  
ZH_T41_1822_003:0516a10_12	至道類智已知諦周盡。	003	至 道 類 智 已 知 諦 周 盡  
ZH_T41_1822_003:0516a11_11	無未曾知聖諦之境為求知故起於聖道。	003	無 未 曾 知 聖 諦 之 境 為 求 知 故 起 於 聖 道  
ZH_T41_1822_003:0516a12_3	但為斷除修道惑故。	003	但 為 斷 除 修 道 惑 故  
ZH_T41_1822_003:0516a12_12	於四諦境復數數了。	003	於 四 諦 境 復 數 數 了  
ZH_T41_1822_003:0516a13_3	是故說彼名為已知。	003	是 故 說 彼 名 為 已 知  
ZH_T41_1822_003:0516a13_12	婆沙一百四十三云。	003	婆 沙 一 百 四 十 三 云  
ZH_T41_1822_003:0516a14_3	第十六心頃應如七智。	003	第 十 六 心 頃 應 如 七 智  
ZH_T41_1822_003:0516a14_12	何故獨說為已知根。	003	何 故 獨 說 為 已 知 根  
ZH_T41_1822_003:0516a15_1	非已知而知故。	003	非 已 知 而 知 故  
ZH_T41_1822_003:0516a15_9	答此亦從多分說。	003	答 此 亦 從 多 分 說  
ZH_T41_1822_003:0516a16_2	謂初剎那雖與七智相似。	003	謂 初 剎 那 雖 與 七 智 相 似  
ZH_T41_1822_003:0516a16_11	後諸剎那皆與彼異。	003	後 諸 剎 那 皆 與 彼 異  
ZH_T41_1822_003:0516a17_3	從多分說悉名已知根。	003	從 多 分 說 悉 名 已 知 根  
ZH_T41_1822_003:0516a18_2	一類性故　准此論文前七智唯一剎那。	003	一 類 性 故  准 此 論 文 前 七 智 唯 一 剎 那  
ZH_T41_1822_003:0516a19_4	道類智二乘必有多念　或聲聞．眾出必有多念。	003	道 類 智 二 乘 必 有 多 念  或 聲 聞  眾 出 必 有 多 念  
ZH_T41_1822_003:0516a19_7	准此。	003	准 此  
ZH_T41_1822_003:0516a20_13	重知名已知也　有說此後更無未已知道所陵所覆。	003	重 知 名 已 知 也  有 說 此 後 更 無 未 已 知 道 所 陵 所 覆  
ZH_T41_1822_003:0516a21_6	不以下著上令不得自在。	003	不 以 下 著 上 令 不得自在  
ZH_T41_1822_003:0516a21_11	必當爾故。	003	必 當 爾 故  
ZH_T41_1822_003:0516a21_17	於知言已知。	003	於 知 言 已 知  
ZH_T41_1822_003:0516a22_6	如去時名已去。	003	如 去 時 名 已 去  
ZH_T41_1822_003:0516a22_16	彼亦如是　准此論文。	003	彼 亦 如 是  准 此 論 文  
ZH_T41_1822_003:0516a23_5	未已知道為下。	003	未 已 知 道 為 下  
ZH_T41_1822_003:0516a23_11	已知道為上。	003	已 知 道 為 上  
ZH_T41_1822_003:0516a23_16	忍為其下。	003	忍 為 其 下  
ZH_T41_1822_003:0516a24_2	智為其上。	003	智 為 其 上  
ZH_T41_1822_003:0516a24_7	前為其下。	003	前 為 其 下  
ZH_T41_1822_003:0516a24_12	後為其上。	003	後 為 其 上  
ZH_T41_1822_003:0516a25_3	雖前七即於知說已知。	003	雖 前 七 即 於 知 說 已 知  
ZH_T41_1822_003:0516a25_10	亦得名為已知。	003	亦 得 名 為 已 知  
ZH_T41_1822_003:0516a26_2	後道類忍名為未知。	003	後 道 類 忍 名 為 未 知  
ZH_T41_1822_003:0516a26_9	故名以下著上。	003	故 名 以 下 著 上  
ZH_T41_1822_003:0516a27_1	八智雖皆得名已知。	003	八 智 雖 皆 得 名 已 知  
ZH_T41_1822_003:0516a27_12	七智上有下故不名已知。	003	七 智 上 有 下 故 不 名 已 知  
ZH_T41_1822_003:0516a28_5	第八上無下故名為已知。	003	第 八 上 無 下 故 名 為 已 知  
ZH_T41_1822_003:0516a28_14	雖道類智不能自知。	003	雖 道 類 智 不 能 自 知  
ZH_T41_1822_003:0516a29_6	至第二念方被智知。	003	至 第 二 念 方 被 智 知  
ZH_T41_1822_003:0516a29_12	如須彌一塵。	003	如 須 彌 一 塵  
ZH_T41_1822_003:0516a29_17	大海一渧。	003	大 海 一 渧  
ZH_T41_1822_003:0516b02_3	又就諦作法非就剎那　問修道中觀諦為斷煩惱。	003	又 就 諦 作 法 非 就 剎 那  問 修 道 中 觀 諦 為 斷 煩 惱  
ZH_T41_1822_003:0516b02_11	及為練根法樂等。	003	及 為 練 根 法 樂 等  
ZH_T41_1822_003:0516b03_14	因何但言為斷煩惱　答初果道後必起勝果道。	003	因 何 但 言 為 斷 煩 惱  答 初 果 道 後 必 起 勝 果 道  
ZH_T41_1822_003:0516b04_10	其勝果道即是斷惑之加行也。	003	其 勝 果 道 即 是 斷 惑 之 加 行 也  
ZH_T41_1822_003:0516b05_1	又練根等恐煩惱退。	003	又 練 根 等 恐 煩 惱 退  
ZH_T41_1822_003:0516b05_15	為現法樂亦是斷惑之勝進道故。	003	為 現 法 樂 亦 是 斷 惑 之 勝 進 道 故  
ZH_T41_1822_003:0516b06_6	但言斷惑義即攝餘。	003	但 言 斷 惑 義 即 攝 餘  
ZH_T41_1822_003:0516b06_15	由斯論師唯說斷惑。	003	由 斯 論 師 唯 說 斷 惑  
ZH_T41_1822_003:0516b07_1	論。	003	論  
ZH_T41_1822_003:0516b07_11	在無學道至乃至廣說。	003	在 無 學 道 至 乃至廣說  
ZH_T41_1822_003:0516b07_18	此釋具知根名。	003	此 釋 具 知 根 名  
ZH_T41_1822_003:0516b08_6	　知己已知者。	003	 知 己 已 知 者  
ZH_T41_1822_003:0516b08_11	唯說盡智。	003	唯 說 盡 智  
ZH_T41_1822_003:0516b08_16	即是鈍根。	003	即 是 鈍 根  
ZH_T41_1822_003:0516b09_11	謂得盡智知我已知苦．知集等。	003	謂 得 盡 智 知 我 已 知 苦  知 集 等  
ZH_T41_1822_003:0516b10_17	或得盡智知我已知苦．斷集等　或習此知已成性者。	003	或 得 盡 智 知 我 已 知 苦  斷 集 等  或 習 此 知 已 成 性 者  
ZH_T41_1822_003:0516b11_9	謂得盡智．無生智也。	003	謂 得 盡 智  無 生 智 也  
ZH_T41_1822_003:0516b11_18	此即利根得其二智。	003	此 即 利 根 得 其 二 智  
ZH_T41_1822_003:0516b13_4	我已知苦是盡不復更知是無生智　乃至廣說者。	003	我 已 知 苦 是 盡 不 復 更 知 是 無 生 智  乃至廣說 者  
ZH_T41_1822_003:0516b13_15	謂我已斷集不復更斷等。	003	謂 我 已 斷 集 不 復 更 斷 等  
ZH_T41_1822_003:0516b14_2	正理論云。	003	正 理 論 云  
ZH_T41_1822_003:0516b14_17	第三具知根體知己已知故名為知。	003	第 三 具 知 根 體 知 己 已 知 故 名 為 知  
ZH_T41_1822_003:0516b15_5	習知成性故。	003	習 知 成 性 故  
ZH_T41_1822_003:0516b15_15	或能護知故　抄釋云。	003	或 能 護 知 故  抄 釋 云  
ZH_T41_1822_003:0516b16_13	謂無學道云苦我已知等名知己已知。	003	謂 無 學 道 云 苦 我 已 知 等 名 知 己 已 知  
ZH_T41_1822_003:0516b17_5	此名知習已成性。	003	此 名 知 習 已 成 性  
ZH_T41_1822_003:0516b17_12	是初得謂盡智。	003	是 初 得 謂 盡 智  
ZH_T41_1822_003:0516b17_17	或能護知。	003	或 能 護 知  
ZH_T41_1822_003:0516b18_6	是後位即無生智。	003	是 後 位 即 無 生 智  
ZH_T41_1822_003:0516b18_15	成而能護故名為具。	003	成 而 能 護 故 名 為 具  
ZH_T41_1822_003:0516b19_7	俱舍亦云以初為有知。	003	俱 舍 亦 云 以 初 為 有 知  
ZH_T41_1822_003:0516b19_13	後為習成性。	003	後 為 習 成 性  
ZH_T41_1822_003:0516b20_6	此能有．能習者名為具知。	003	此 能 有  能 習 者 名 為 具 知  
ZH_T41_1822_003:0516b21_6	具知家根名具知根　案此二論意有差別。	003	具 知 家 根 名 具 知 根  案 此 二 論 意 有 差 別  
ZH_T41_1822_003:0516b22_3	若此論以三道慧名未知欲知等。	003	若 此 論 以 三 道 慧 名 未知欲知 等  
ZH_T41_1822_003:0516b22_8	即彼是根。	003	即 彼 是 根  
ZH_T41_1822_003:0516b22_13	就同依釋。	003	就 同 依 釋  
ZH_T41_1822_003:0516b24_3	是即彼是根義但唯是慧　若俱舍意彼之三名目能成行者。	003	是 即 彼 是 根 義 但 唯 是 慧  若 俱 舍 意 彼 之 三 名 目 能 成 行 者  
ZH_T41_1822_003:0516b24_8	就依士釋。	003	就 依 士 釋  
ZH_T41_1822_003:0516b24_17	彼所有根名為彼根。	003	彼 所 有 根 名 為 彼 根  
ZH_T41_1822_003:0516b26_1	即具攝九法　正理論云九根相應合成此事。	003	即 具 攝 九 法  正 理 論 云 九 根 相 應 合 成 此 事  
ZH_T41_1822_003:0516b27_2	故意等八亦得此名　婆沙歷七十五法廢立。	003	故 意 等 八 亦 得 此 名  婆 沙 歷 七十五法 廢 立  
ZH_T41_1822_003:0516b27_7	恐煩不述。	003	恐 煩 不 述  
ZH_T41_1822_003:0516b27_16	然不過此前建立門。	003	然 不 過 此 前 建 立 門  
ZH_T41_1822_003:0516b28_7	無前義者不立為根。	003	無 前 義 者 不 立 為 根  
ZH_T41_1822_003:0516b28_9	論。	003	論  
ZH_T41_1822_003:0516b29_3	彼所有根至當知根等。	003	彼 所 有 根 至 當 知 根 等  
ZH_T41_1822_003:0516b29_10	總結前三根名。	003	總 結 前 三 根 名  
ZH_T41_1822_003:0516c01_1	論。	003	論  
ZH_T41_1822_003:0516c01_10	如是已釋至幾無漏。	003	如 是 已 釋 至 幾 無 漏  
ZH_T41_1822_003:0516c02_8	下第三有十四頌諸門分別　於中有二。	003	下 第 三 有 十 四 頌 諸 門 分 別  於 中 有 二  
ZH_T41_1822_003:0516c02_17	初六頌有六門分別。	003	初 六 頌 有 六 門 分 別  
ZH_T41_1822_003:0516c03_9	後八頌別約諸義分別。	003	後 八 頌 別 約 諸 義 分 別  
ZH_T41_1822_003:0516c04_5	初一頌漏．無漏分別　於中有三。	003	初 一 頌 漏  無 漏 分 別  於 中 有 三  
ZH_T41_1822_003:0516c04_10	一唯無漏。	003	一 唯 無 漏  
ZH_T41_1822_003:0516c04_15	二唯有漏。	003	二 唯 有 漏  
ZH_T41_1822_003:0516c05_4	三通有漏．無漏。	003	三 通 有 漏  無 漏  
ZH_T41_1822_003:0516c05_12	論曰至名異體同。	003	論 曰 至 名 異 體 同  
ZH_T41_1822_003:0516c06_1	此明唯無漏。	003	此 明 唯 無 漏  
ZH_T41_1822_003:0516c06_3	論。	003	論  
ZH_T41_1822_003:0516c06_13	七有色根至色蘊攝故。	003	七 有 色 根 至 色 蘊 攝 故  
ZH_T41_1822_003:0516c07_7	此明有漏詳此釋義不盡。	003	此 明 有 漏 詳 此 釋 義 不 盡  
ZH_T41_1822_003:0516c08_3	無漏無表亦色蘊攝是無漏故。	003	無 漏 無 表 亦 色 蘊 攝 是 無 漏 故  
ZH_T41_1822_003:0516c08_5	論。	003	論  
ZH_T41_1822_003:0516c08_15	意樂喜捨至有漏無漏。	003	意 樂 喜 捨 至 有漏無漏  
ZH_T41_1822_003:0516c09_5	第三漏無漏也。	003	第 三 漏 無 漏 也  
ZH_T41_1822_003:0516c09_7	論。	003	論  
ZH_T41_1822_003:0516c09_17	有餘師說至外異生品。	003	有餘師說 至 外 異 生 品  
ZH_T41_1822_003:0516c10_6	此敘化地部計。	003	此 敘 化 地 部 計  
ZH_T41_1822_003:0516c11_1	則是應婆沙毘婆闍婆提。	003	則 是 應 婆 沙 毘 婆 闍 婆 提  
ZH_T41_1822_003:0516c11_8	此云分別論師。	003	此 云 分 別 論 師  
ZH_T41_1822_003:0516c12_3	彼引經證信等五根唯是無漏。	003	彼 引 經 證 信 等 五 根 唯 是 無 漏  
ZH_T41_1822_003:0516c12_13	以契經唯說聖所有故。	003	以 契 經 唯 說 聖 所 有 故  
ZH_T41_1822_003:0516c13_12	謂說阿羅漢乃至預流向有此信等五根。	003	謂 說 阿 羅 漢 乃 至 預 流 向 有 此 信 等 五 根  
ZH_T41_1822_003:0516c14_5	故知無漏　又世尊說。	003	故 知 無 漏  又 世 尊 說  
ZH_T41_1822_003:0516c15_3	若全無此信等五根我說彼住外異生品者。	003	若 全 無 此 信 等 五 根 我 說 彼 住 外 異 生 品 者  
ZH_T41_1822_003:0516c15_16	又下文全無五根住外異生品。	003	又 下 文 全 無 五 根 住 外 異 生 品  
ZH_T41_1822_003:0516c16_3	故知無漏。	003	故 知 無 漏  
ZH_T41_1822_003:0516c16_12	雖引重文其義是一。	003	雖 引 重 文 其 義 是 一  
ZH_T41_1822_003:0516c16_17	聖有凡無。	003	聖 有 凡 無  
ZH_T41_1822_003:0516c17_1	論。	003	論  
ZH_T41_1822_003:0516c17_11	此非成證至外異生品。	003	此 非 成 證 至 外 異 生 品  
ZH_T41_1822_003:0516c18_1	自下論主破有二。	003	自 下 論 主 破 有 二  
ZH_T41_1822_003:0516c18_13	一通化地部引文證成無漏。	003	一 通 化 地 部 引 文 證 成 無 漏  
ZH_T41_1822_003:0516c19_5	二自引經文證通有漏。	003	二 自 引 經 文 證 通 有 漏  
ZH_T41_1822_003:0516c19_15	此即初也　此非成證。	003	此 即 初 也  此 非 成 證  
ZH_T41_1822_003:0516c20_9	總非　依無漏根說此言故。	003	總 非  依 無 漏 根 說 此 言 故  
ZH_T41_1822_003:0516c21_4	釋所以信等五根通其二種。	003	釋 所 以 信 等 五 根 通 其 二 種  
ZH_T41_1822_003:0516c21_11	謂有漏．無漏。	003	謂 有 漏  無 漏  
ZH_T41_1822_003:0516c21_19	彼說聖有．凡無。	003	彼 說 聖 有  凡 無  
ZH_T41_1822_003:0516c23_2	依無漏根說不依有漏信等五根　云何知然者。	003	依 無 漏 根 說 不 依 有 漏 信 等 五 根  云 何 知 然 者  
ZH_T41_1822_003:0516c23_7	化地部徵。	003	化 地 部 徵  
ZH_T41_1822_003:0516c24_2	云何知依無漏根說　言。	003	云 何 知 依 無 漏 根 說  言  
ZH_T41_1822_003:0516c24_12	先依無漏至說此言故。	003	先 依 無 漏 至 說 此 言 故  
ZH_T41_1822_003:0516c24_14	釋。	003	釋  
ZH_T41_1822_003:0516c25_9	論主釋依無漏信等五根所以也。	003	論 主 釋 依 無 漏 信 等 五 根 所 以 也  
ZH_T41_1822_003:0516c26_9	夫建立聖人唯有為無漏非無為有漏。	003	夫 建 立 聖 人 唯 有 為 無 漏 非 無 為 有 漏  
ZH_T41_1822_003:0516c27_4	彼經既以信等五根建立聖人。	003	彼 經 既 以 信 等 五 根 建 立 聖 人  
ZH_T41_1822_003:0516c27_13	故知唯依無漏根說。	003	故 知 唯 依 無 漏 根 說  
ZH_T41_1822_003:0516c28_5	前說聖有依無漏根。	003	前 說 聖 有 依 無 漏 根  
ZH_T41_1822_003:0516c28_16	既言若全無此信等五根。	003	既 言 若 全 無 此 信 等 五 根  
ZH_T41_1822_003:0516c29_15	故知唯說無漏　或諸異生至外異生品。	003	故 知 唯 說 無 漏  或 諸 異 生 至 外 異 生 品  
ZH_T41_1822_003:0517a01_3	論主第二釋。	003	論 主 第 二 釋  
ZH_T41_1822_003:0517a01_8	如文可解。	003	如 文 可 解  
ZH_T41_1822_003:0517a01_10	論。	003	論  
ZH_T41_1822_003:0517a02_3	又契經說至亦通有漏。	003	又 契 經 說 至 亦 通 有 漏  
ZH_T41_1822_003:0517a02_17	論主引經證信等五根通有漏也。	003	論 主 引 經 證 信 等 五 根 通 有 漏 也  
ZH_T41_1822_003:0517a03_10	佛未轉法輪時未有聖人。	003	佛 未 轉 法 輪 時 未 有 聖 人  
ZH_T41_1822_003:0517a04_6	此時已說有情根上．中．下。	003	此 時 已 說 有 情 根 上  中  下  
ZH_T41_1822_003:0517a04_16	故知說有漏信等五根。	003	故 知 說 有 漏 信 等 五 根  
ZH_T41_1822_003:0517a04_18	論。	003	論  
ZH_T41_1822_003:0517a05_9	又世尊說至品類觀察。	003	又 世 尊 說 至 品 類 觀 察  
ZH_T41_1822_003:0517a06_3	論主引第二經證通有漏。	003	論 主 引 第 二 經 證 通 有 漏  
ZH_T41_1822_003:0517a06_12	信等五根若唯無漏。	003	信 等 五 根 若 唯 無 漏  
ZH_T41_1822_003:0517a07_8	如何實知是集．沒．味．過患。	003	如 何 實 知 是 集  沒  味  過 患  
ZH_T41_1822_003:0517a07_17	此之四行觀有漏故。	003	此 之 四 行 觀 有 漏 故  
ZH_T41_1822_003:0517a08_1	集能招苦。	003	集 能 招 苦  
ZH_T41_1822_003:0517a08_6	沒沈沒處。	003	沒 沈 沒 處  
ZH_T41_1822_003:0517a08_11	味愛味處。	003	味 愛 味 處  
ZH_T41_1822_003:0517a08_16	過患是苦。	003	過 患 是 苦  
ZH_T41_1822_003:0517a09_2	出離是在滅。	003	出 離 是 在 滅  
ZH_T41_1822_003:0517a09_7	餘文可解。	003	餘 文 可 解  
ZH_T41_1822_003:0517a09_9	論。	003	論  
ZH_T41_1822_003:0517a10_3	故信等五根通有漏無漏。	003	故 信 等 五 根 通 有漏無漏  
ZH_T41_1822_003:0517a10_8	總結證也。	003	總 結 證 也  
ZH_T41_1822_003:0517a11_1	論。	003	論  
ZH_T41_1822_003:0517a11_11	如是已說至成非異熟。	003	如 是 已 說 至 成 非 異 熟  
ZH_T41_1822_003:0517a12_8	下一頌第二明是異熟．非異熟門。	003	下 一 頌 第 二 明 是 異 熟  非 異 熟 門  
ZH_T41_1822_003:0517a13_2	論曰唯一命根定是異熟。	003	論 曰 唯 一 命 根 定 是 異 熟  
ZH_T41_1822_003:0517a13_7	此定宗也。	003	此 定 宗 也  
ZH_T41_1822_003:0517a13_13	二十二根中。	003	二十二根 中  
ZH_T41_1822_003:0517a14_16	唯一命根定是異熟　唯遮更通餘根　定遮通非異熟。	003	唯 一 命 根 定 是 異 熟  唯 遮 更 通 餘 根  定 遮 通 非 異 熟  
ZH_T41_1822_003:0517a15_1	論。	003	論  
ZH_T41_1822_003:0517a15_11	若如是者至誰之異熟。	003	若 如 是 者 至 誰 之 異 熟  
ZH_T41_1822_003:0517a15_14	外難。	003	外 難  
ZH_T41_1822_003:0517a15_17	難云。	003	難 云  
ZH_T41_1822_003:0517a16_10	若定是異熟者留多壽行。	003	若 定 是 異 熟 者 留 多 壽 行  
ZH_T41_1822_003:0517a17_4	既由第四定等延此命根。	003	既 由 第 四 定 等 延 此 命 根  
ZH_T41_1822_003:0517a17_13	即此命根是誰異熟。	003	即 此 命 根 是 誰 異 熟  
ZH_T41_1822_003:0517a17_15	論。	003	論  
