segmentnr	original	folio	analyzed
ZH_X42_0736_008:0840b19	者。今引此言。明異前摩觸之境。前則境通死活昏睡	008	者  今 引 此 言  明 異 前 摩 觸 之 境  前 則 境 通 死 活 昏 睡 
ZH_X42_0736_008:0840b20	孩童俱犯。此則唯是活女。情有智能解婬欲意。故此	008	孩 童 俱 犯  此 則 唯 是 活 女  情 有 智 能 解 婬 欲 意  故 此 
ZH_X42_0736_008:0840b21	戒女異前戒女也。麤語非梵行也者。案四分律中。言	008	戒 女 異 前 戒 女 也  麤 語 非 梵 行 也 者  案 四 分 律 中  言 
ZH_X42_0736_008:0840b22	麤語者。惡說大小便道得殘。若說餘處好惡者。得蘭	008	麤 語 者  惡 說 大 小 便 道 得 殘  若 說 餘 處 好 惡 者  得 蘭 
ZH_X42_0736_008:0840b23	也。消蘇著赤衣形露者。案四分調部中云。時有比丘。	008	也  消 蘇 著 赤 衣 形 露 者  案 四 分 調 部 中 云  時 有 比 丘  
ZH_X42_0736_008:0840b24	往白衣家。有女人消蘇形露。比丘見已語言。汝消蘇。	008	往 白 衣 家  有 女 人 消 蘇 形 露  比 丘 見 已 語 言  汝 消 蘇  
ZH_X42_0736_008:0840c01	彼言大德爾。我消蘇。比丘嘿然生疑。佛言說不了了	008	彼 言 大 德 爾  我 消 蘇  比 丘 嘿 然 生 疑  佛 言 說 不 了 了 
ZH_X42_0736_008:0840c02	蘭。復有乞食比丘。往白衣家時。著赤色衣女人形露。	008	蘭  復 有 乞 食 比 丘  往 白 衣 家 時  著 赤 色 衣 女 人 形 露  
ZH_X42_0736_008:0840c03	比丘見已。語言。汝赤衣。彼答言我著赤衣。比丘嘿然	008	比 丘 見 已  語 言  汝 赤 衣  彼 答 言 我 著 赤 衣  比 丘 嘿 然 
ZH_X42_0736_008:0840c04	生疑。佛言不了了故蘭。賓云。比丘意欲名彼女形。為	008	生 疑  佛 言 不 了 了 故 蘭  賓 云  比 丘 意 欲 名 彼 女 形  為 
ZH_X42_0736_008:0840c05	消蘇。為赤衣。然不了了故蘭。彼了知即殘也。此赤衣	008	消 蘇  為 赤 衣  然 不 了 了 故 蘭  彼 了 知 即 殘 也  此 赤 衣 
ZH_X42_0736_008:0840c06	事與前消蘇事別。是兩女人也。立云。其必向若知比	008	事 與 前 消 蘇 事 別  是 兩 女 人 也  立 云  其 必 向 若 知 比 
ZH_X42_0736_008:0840c07	丘此言。是調挵者殘。由不知是調挵故蘭。僧祇云。比	008	丘 此 言  是 調 挵 者 殘  由 不 知 是 調 挵 故 蘭  僧 祇 云  比 
ZH_X42_0736_008:0840c08	丘見女人新染衣形著露者。有比丘乞食。至一家。女	008	丘 見 女 人 新 染 衣 形 著 露 者  有 比 丘 乞 食  至 一 家  女 
ZH_X42_0736_008:0840c09	人著新染色衣坐。正形體露。比丘見已。欲心起。即語	008	人 著 新 染 色 衣 坐  正 形 體 露  比 丘 見 已  欲 心 起  即 語 
ZH_X42_0736_008:0840c10	言姉妹太赤。答言。阿闍梨。此新染衣是。比丘生疑問	008	言 姉 妹 太 赤  答 言  阿 闍 梨  此 新 染 衣 是  比 丘 生 疑 問 
ZH_X42_0736_008:0840c11	佛。佛問何心。答欲心。佛遣一比丘問彼女人解不。比	008	佛  佛 問 何 心  答 欲 心  佛 遣 一 比 丘 問 彼 女 人 解 不  比 
ZH_X42_0736_008:0840c12	丘即問上事。女即具答。比丘後還白佛。佛言解義不	008	丘 即 問 上 事  女 即 具 答  比 丘 後 還 白 佛  佛 言 解 義 不 
ZH_X42_0736_008:0840c13	解味蘭。解者不解義蘭。義味俱解殘。不解越毗尼。言	008	解 味 蘭  解 者 不 解 義 蘭  義 味 俱 解 殘  不 解 越 毗 尼  言 
ZH_X42_0736_008:0840c14	義味者。首疏云。昧者是語。義者是理也。出語表事周	008	義 味 者  首 疏 云  昧 者 是 語  義 者 是 理 也  出 語 表 事 周 
ZH_X42_0736_008:0840c15	圓曰味也。理是語下所表之旨故曰也。義味俱解殘。	008	圓 曰 味 也  理 是 語 下 所 表 之 旨 故 曰 也  義 味 俱 解 殘  
ZH_X42_0736_008:0840c16	互解蘭。俱不解越。若准五分具有彼此互向麤語者。	008	互 解 蘭  俱 不 解 越  若 准 五 分 具 有 彼 此 互 向 麤 語 者  
ZH_X42_0736_008:0840c17	立謂。比丘向女說麤語犯殘可知。比丘受女麤語亦	008	立 謂  比 丘 向 女 說 麤 語 犯 殘 可 知  比 丘 受 女 麤 語 亦 
ZH_X42_0736_008:0840c18	結殘也。謂女於比丘前麤語。染心相領。亦同犯也。依	008	結 殘 也  謂 女 於 比 丘 前 麤 語  染 心 相 領  亦 同 犯 也  依 
ZH_X42_0736_008:0840c19	檢五分。不見此文。恐鈔者錯指耳。案十誦云。比丘在	008	檢 五 分  不 見 此 文  恐 鈔 者 錯 指 耳  案 十 誦 云  比 丘 在 
ZH_X42_0736_008:0840c20	女前。贊歎三瘡門。形色端正。不大不小。及毀呰三瘡	008	女 前  贊 歎 三 瘡 門  形 色 端 正  不 大 不 小  及 毀 呰 三 瘡 
ZH_X42_0736_008:0840c21	門。隨意作如是事皆殘。若女人在比丘前。讚嘆三瘡	008	門  隨 意 作 如 是 事 皆 殘  若 女 人 在 比 丘 前  讚 嘆 三 瘡 
ZH_X42_0736_008:0840c22	門。形色端正。及毀呰言三瘡門形色不好。乃至比丘	008	門  形 色 端 正  及 毀 呰 言 三 瘡 門 形 色 不 好  乃 至 比 丘 
ZH_X42_0736_008:0840c23	前。乞三瘡門中隨意作者。我隨汝意與。是中比丘隨	008	前  乞 三 瘡 門 中 隨 意 作 者  我 隨 汝 意 與  是 中 比 丘 隨 
ZH_X42_0736_008:0840c24	順其心。少多語出。一一語皆犯。下嘆身戒亦同者。謂	008	順 其 心  少 多 語 出  一 一 語 皆 犯  下 嘆 身 戒 亦 同 者  謂 
ZH_X42_0736_008:0841a01	比丘於女前。嘆身索欲犯殘。若女來比丘前。自嘆身	008	比 丘 於 女 前  嘆 身 索 欲 犯 殘  若 女 來 比 丘 前  自 嘆 身 
ZH_X42_0736_008:0841a02	等亦殘也。又戒疏解云。下嘆身戒同者。同此麤語戒。	008	等 亦 殘 也  又 戒 疏 解 云  下 嘆 身 戒 同 者  同 此 麤 語 戒  
ZH_X42_0736_008:0841a03	女必命根不斷。有智解婬欲語者也。不同上觸身戒	008	女 必 命 根 不 斷  有 智 解 婬 欲 語 者 也  不 同 上 觸 身 戒 
ZH_X42_0736_008:0841a04	女。通於死活昏睡等。下明不犯法也。	008	女  通 於 死 活 昏 睡 等  下 明 不 犯 法 也  
ZH_X42_0736_008:0841a05	歎身戒第四　制意者。良以惑染深厚。展轉相纏。自	008	歎 身 戒 第 四  制 意 者  良 以 惑 染 深 厚  展 轉 相 纏  自 
ZH_X42_0736_008:0841a06	歎己身。意規婬欲。出家離染。彌所不應。水內火然。特	008	歎 己 身  意 規 婬 欲  出 家 離 染  彌 所 不 應  水 內 火 然  特 
ZH_X42_0736_008:0841a07	乖宜望。招譏納醜。故制僧殘。釋名者。言多巧伏。美己	008	乖 宜 望  招 譏 納 醜  故 制 僧 殘  釋 名 者  言 多 巧 伏  美 己 
ZH_X42_0736_008:0841a08	之善。意專在欲。言現清淨。蕩逸其情。妄謂歡適。招誘	008	之 善  意 專 在 欲  言 現 清 淨  蕩 逸 其 情  妄 謂 歡 適  招 誘 
ZH_X42_0736_008:0841a09	令施。因說情懷。故言也。	008	令 施  因 說 情 懷  故 言 也  
ZH_X42_0736_008:0841a10	媒人戒第五　此戒亦兩重境想。謂人女人女想。及	008	媒 人 戒 第 五  此 戒 亦 兩 重 境 想  謂 人 女 人 女 想  及 
ZH_X42_0736_008:0841a11	媒嫁嫁嫁想疑等也。媒者謀也。合媾兩情。以成昏禮。	008	媒 嫁 嫁 嫁 想 疑 等 也  媒 者 謀 也  合 媾 兩 情  以 成 昏 禮  
ZH_X42_0736_008:0841a12	計度二姓。用為好合故曰也。首疏問一時多媒嫁多	008	計 度 二 姓  用 為 好 合 故 曰 也  首 疏 問 一 時 多 媒 嫁 多 
ZH_X42_0736_008:0841a13	男女。得幾罪。答准祇文。多少不定。若各各別受男家	008	男 女  得 幾 罪  答 准 祇 文  多 少 不 定  若 各 各 別 受 男 家 
ZH_X42_0736_008:0841a14	語。得多吉羅。各各別向女家說。得多蘭。集多家。一時	008	語  得 多 吉 羅  各 各 別 向 女 家 說  得 多 蘭  集 多 家  一 時 
ZH_X42_0736_008:0841a15	報。得一殘。若一時多受男家語有一吉。別求者。得多	008	報  得 一 殘  若 一 時 多 受 男 家 語 有 一 吉  別 求 者  得 多 
ZH_X42_0736_008:0841a16	蘭。一時通報一殘。若各各別受別說別報。多吉多蘭	008	蘭  一 時 通 報 一 殘  若 各 各 別 受 別 說 別 報  多 吉 多 蘭 
ZH_X42_0736_008:0841a17	多殘。若一時受說。一時報。一吉一蘭一殘。除二道已	008	多 殘  若 一 時 受 說  一 時 報  一 吉 一 蘭 一 殘  除 二 道 已 
ZH_X42_0736_008:0841a18	者。立謂。大小便二道也。媒餘處身分口等但得蘭也。	008	者  立 謂  大 小 便 二 道 也  媒 餘 處 身 分 口 等 但 得 蘭 也  
ZH_X42_0736_008:0841a19	又云媒口亦合犯殘。然今但舉二處者略也。應合言	008	又 云 媒 口 亦 合 犯 殘  然 今 但 舉 二 處 者 略 也  應 合 言 
ZH_X42_0736_008:0841a20	除三道已。然無有媒口之事。故不明也(未詳)。不能男女	008	除 三 道 已  然 無 有 媒 口 之 事  故 不 明 也  未 詳   不 能 男 女 
ZH_X42_0736_008:0841a21	者。謂黃門石女也。白二差人媒一切僧殘者。立謂。四	008	者  謂 黃 門 石 女 也  白 二 差 人 媒 一 切 僧 殘 者  立 謂  四 
ZH_X42_0736_008:0841a22	分調部中。諸比丘白二媒嫁也。若僧同和。一一僧各	008	分 調 部 中  諸 比 丘 白 二 媒 嫁 也  若 僧 同 和  一 一 僧 各 
ZH_X42_0736_008:0841a23	犯殘。若僧物供給媒具。犯盜重也。今時雖不作羯磨。	008	犯 殘  若 僧 物 供 給 媒 具  犯 盜 重 也  今 時 雖 不 作 羯 磨  
ZH_X42_0736_008:0841a24	以眾同和。亦合殘也。若指復為媒者。案十誦文云。若	008	以 眾 同 和  亦 合 殘 也  若 指 復 為 媒 者  案 十 誦 文 云  若 
ZH_X42_0736_008:0841b01	女人一懷妊女。一懷妊男。比丘媒合得蘭。立云。見他	008	女 人 一 懷 妊 女  一 懷 妊 男  比 丘 媒 合 得 蘭  立 云  見 他 
ZH_X42_0736_008:0841b02	有胎。定知生子。許後為媒也。賓云。以其事奢故。結方	008	有 胎  定 知 生 子  許 後 為 媒 也  賓 云  以 其 事 奢 故  結 方 
ZH_X42_0736_008:0841b03	便蘭也。言及自媒者。謂比丘自問女家欲求為婦也。	008	便 蘭 也  言 及 自 媒 者  謂 比 丘 自 問 女 家 欲 求 為 婦 也  
ZH_X42_0736_008:0841b04	以語書指印等者。此中參互作。得四萬四千八百句。	008	以 語 書 指 印 等 者  此 中 參 互 作  得 四 萬 四 千 八 百 句  
ZH_X42_0736_008:0841b05	初純語作四句。一自受男家語。自持語。往女家。自持	008	初 純 語 作 四 句  一 自 受 男 家 語  自 持 語  往 女 家  自 持 
ZH_X42_0736_008:0841b06	語。報男家。二自受男家語。自持語。往女家。遣使持語。	008	語  報 男 家  二 自 受 男 家 語  自 持 語  往 女 家  遣 使 持 語  
ZH_X42_0736_008:0841b07	報男家。三自受男家語。遣使持語。往女家。自持語報	008	報 男 家  三 自 受 男 家 語  遣 使 持 語  往 女 家  自 持 語 報 
ZH_X42_0736_008:0841b08	男家。四自受男家語。遣使持語。往女家。遣使持語報	008	男 家  四 自 受 男 家 語  遣 使 持 語  往 女 家  遣 使 持 語 報 
ZH_X42_0736_008:0841b09	男家。第二段將書怗作四句。一自受男家語。自持書。	008	男 家  第 二 段 將 書 怗 作 四 句  一 自 受 男 家 語  自 持 書  
ZH_X42_0736_008:0841b10	往女家。自持書報男家。二自受男家語。自持書。往女	008	往 女 家  自 持 書 報 男 家  二 自 受 男 家 語  自 持 書  往 女 
ZH_X42_0736_008:0841b11	家。遣使持書。報男家。三自受男家語。遣使持書。往女	008	家  遣 使 持 書  報 男 家  三 自 受 男 家 語  遣 使 持 書  往 女 
ZH_X42_0736_008:0841b12	家。自持書報男家。四自受男家語。遣使持書。往女家。	008	家  自 持 書 報 男 家  四 自 受 男 家 語  遣 使 持 書  往 女 家  
ZH_X42_0736_008:0841b13	持書報男家如是已後乃至指印。現相。來帖。一事已	008	持 書 報 男 家 如 是 已 後 乃 至 指 印  現 相  來 帖  一 事 已 
ZH_X42_0736_008:0841b14	上。有四句。四四成十六。一事中既有十六。成四个十	008	上  有 四 句  四 四 成 十 六  一 事 中 既 有 十 六  成 四 个 十 
ZH_X42_0736_008:0841b15	六句。合成六十四句。又三事相帖作句。亦有四段。一	008	六 句  合 成 六 十 四 句  又 三 事 相 帖 作 句  亦 有 四 段  一 
ZH_X42_0736_008:0841b16	段中。有三事。第一段四句者。一自受男家語。自往問	008	段 中  有 三 事  第 一 段 四 句 者  一 自 受 男 家 語  自 往 問 
ZH_X42_0736_008:0841b17	女家。自性報男家。三句中。俱安自持語。二自受男家	008	女 家  自 性 報 男 家  三 句 中  俱 安 自 持 語  二 自 受 男 家 
ZH_X42_0736_008:0841b18	書。自持書。往女家。自持書。報男家。三自受男家指印。	008	書  自 持 書  往 女 家  自 持 書  報 男 家  三 自 受 男 家 指 印  
ZH_X42_0736_008:0841b19	自持指印。往女家。自持指印。報男家。且除現相。如是	008	自 持 指 印  往 女 家  自 持 指 印  報 男 家  且 除 現 相  如 是 
ZH_X42_0736_008:0841b20	已後。若與現相則。除指印等四。迴作一句中如前。自	008	已 後  若 與 現 相 則  除 指 印 等 四  迴 作 一 句 中 如 前  自 
ZH_X42_0736_008:0841b21	為遣使句中。當分自有四句。於三事中。有四句。三四	008	為 遣 使 句 中  當 分 自 有 四 句  於 三 事 中  有 四 句  三 四 
ZH_X42_0736_008:0841b22	成十二句。一段既有十二。四段則成四十八。并前六	008	成 十 二 句  一 段 既 有 十 二  四 段 則 成 四 十 八  并 前 六 
ZH_X42_0736_008:0841b23	十四。合成一百一十二句也。乃至歸婦。私通。黃門。三	008	十 四  合 成 一 百 一 十 二 句 也  乃 至 歸 婦  私 通  黃 門  三 
ZH_X42_0736_008:0841b24	道。男子。畜生等三趣。各作句如上。女中又有二十種	008	道  男 子  畜 生 等 三 趣  各 作 句 如 上  女 中 又 有 二 十 種 
ZH_X42_0736_008:0841c01	女。謂父護。母護等。合成四萬四千八百句也。其鈔文	008	女  謂 父 護  母 護 等  合 成 四 萬 四 千 八 百 句 也  其 鈔 文 
ZH_X42_0736_008:0841c02	不出現相。但有三事耳。指印者。昔解以指節為印也。	008	不 出 現 相  但 有 三 事 耳  指 印 者  昔 解 以 指 節 為 印 也  
ZH_X42_0736_008:0841c03	賓云。不然。乃是將手指上文橫竪有異。善惡吉凶。皆	008	賓 云  不 然  乃 是 將 手 指 上 文 橫 竪 有 異  善 惡 吉 凶  皆 
ZH_X42_0736_008:0841c04	有表彰。若示橫文凶竪文吉。文表所求。尅不尅等。則	008	有 表 彰  若 示 橫 文 凶 竪 文 吉  文 表 所 求  尅 不 尅 等  則 
ZH_X42_0736_008:0841c05	知女家許不許也。言現相者。先與男女家期契。若見	008	知 女 家 許 不 許 也  言 現 相 者  先 與 男 女 家 期 契  若 見 
ZH_X42_0736_008:0841c06	我來。著弊衣。持空鉢。即知不許。婚事不成等。見我著	008	我 來  著 弊 衣  持 空 鉢  即 知 不 許  婚 事 不 成 等  見 我 著 
ZH_X42_0736_008:0841c07	好衣。持滿鉢。則是所求和合之相也。僧祇勸歸婦早	008	好 衣  持 滿 鉢  則 是 所 求 和 合 之 相 也  僧 祇 勸 歸 婦 早 
ZH_X42_0736_008:0841c08	還等者。首疏引僧祇云。若主人畜多婦妄不均鬪諍。	008	還 等 者  首 疏 引 僧 祇 云  若 主 人 畜 多 婦 妄 不 均 鬪 諍  
ZH_X42_0736_008:0841c09	一婦私求比丘。即為和平。若夫婦鬪諍。不便勸和合	008	一 婦 私 求 比 丘  即 為 和 平  若 夫 婦 鬪 諍  不 便 勸 和 合 
ZH_X42_0736_008:0841c10	皆蘭。若婦女還家。比丘到舍使勸早還者蘭。畏他夫	008	皆 蘭  若 婦 女 還 家  比 丘 到 舍 使 勸 早 還 者 蘭  畏 他 夫 
ZH_X42_0736_008:0841c11	嗔不得合會故也。下明不犯法也。	008	嗔 不 得 合 會 故 也  下 明 不 犯 法 也  
ZH_X42_0736_008:0841c13	四分律鈔批卷第八本	008	四 分 律 鈔 批 卷 第 八 本 
ZH_X42_0736_008:0841c17	四分律鈔批卷第八末	008	四 分 律 鈔 批 卷 第 八 末 
ZH_X42_0736_008:0841c19	無主房戒第六　初明制意。出家之士。理無滯着。隨	008	無 主 房 戒 第 六  初 明 制 意  出 家 之 士  理 無 滯 着  隨 
ZH_X42_0736_008:0841c20	事將擬。即堪修道。有信施量時而受。縱有經營。安身	008	事 將 擬  即 堪 修 道  有 信 施 量 時 而 受  縱 有 經 營  安 身 
ZH_X42_0736_008:0841c21	便罷。今乃廣作。煩勞不少。是以聖制。次釋名者。身獨	008	便 罷  今 乃 廣 作  煩 勞 不 少  是 以 聖 制  次 釋 名 者  身 獨 
ZH_X42_0736_008:0841c22	運造。故曰無主。專任在己。故曰僧不處分。大非法限。	008	運 造  故 曰 無 主  專 任 在 己  故 曰 僧 不 處 分  大 非 法 限  
ZH_X42_0736_008:0841c23	故稱過量。故曰無主僧不處分過量房戒。過起廣野	008	故 稱 過 量  故 曰 無 主 僧 不 處 分 過 量 房 戒  過 起 廣 野 
ZH_X42_0736_008:0841c24	中諸比丘。由造私房。乞求無度。俗生猒弊。濫及賢良。	008	中 諸 比 丘  由 造 私 房  乞 求 無 度  俗 生 猒 弊  濫 及 賢 良  
ZH_X42_0736_008:0842a01	是以迦葉。後時入村乞食。居士迯叛。謂乞人來處從	008	是 以 迦 葉  後 時 入 村 乞 食  居 士 迯 叛  謂 乞 人 來 處 從 
ZH_X42_0736_008:0842a02	我曹。乞索財物。迦葉恠問方曉其源。還白世尊。即便	008	我 曹  乞 索 財 物  迦 葉 恠 問 方 曉 其 源  還 白 世 尊  即 便 
ZH_X42_0736_008:0842a03	出界。到暮非人復來。白佛。由伐神樹傷損神子。佛復	008	出 界  到 暮 非 人 復 來  白 佛  由 伐 神 樹 傷 損 神 子  佛 復 
ZH_X42_0736_008:0842a04	但舉非人來白。不言迦葉以護人心故也。	008	但 舉 非 人 來 白  不 言 迦 葉 以 護 人 心 故 也  
ZH_X42_0736_008:0842a05	長己貪結者。立云。既多乞求。遂乖少欲知足之道。貪	008	長 己 貪 結 者  立 云  既 多 乞 求  遂 乖 少欲知足 之 道  貪 
ZH_X42_0736_008:0842a06	煩惱故。曰長貪結也。檀越施雖無厭。而受者應知之	008	煩 惱 故  曰 長 貪 結 也  檀 越 施 雖 無 厭  而 受 者 應 知 之 
ZH_X42_0736_008:0842a07	也。律緣起中。佛敘昔從鳥乞毛事(云云)。准祇第六云。	008	也  律 緣 起 中  佛 敘 昔 從 鳥 乞 毛 事  云 云   准 祇 第 六 云  
ZH_X42_0736_008:0842a08	暮鳥集時。比丘言。汝釋軍多鳥。各乞一毛。我今須用	008	暮 鳥 集 時  比 丘 言  汝 釋 軍 多 鳥  各 乞 一 毛  我 今 須 用 
ZH_X42_0736_008:0842a09	眾鳥。少時無聲寂然。不得已。各拔一毛著地。晨朝復	008	眾 鳥  少 時 無 聲 寂 然  不 得 已  各 拔 一 毛 著 地  晨 朝 復 
ZH_X42_0736_008:0842a10	乞。時眾鳥。即便移去。異處一宿。不樂彼尋復來還。比	008	乞  時 眾 鳥  即 便 移 去  異 處 一 宿  不 樂 彼 尋 復 來 還  比 
ZH_X42_0736_008:0842a11	丘復乞。一一復與。眾鳥念言。今此沙門。奇異喜乞。恐	008	丘 復 乞  一 一 復 與  眾 鳥 念 言  今 此 沙 門  奇 異 喜 乞  恐 
ZH_X42_0736_008:0842a12	我不久毛衣都盡。段肉在地。不能復飛。當如之何。便	008	我 不 久 毛 衣 都 盡  段 肉 在 地  不 能 復 飛  當 如 之 何  便 
ZH_X42_0736_008:0842a13	共議言。我等當去。不復宜還。惱亂人非人者。多事乞。	008	共 議 言  我 等 當 去  不 復 宜 還  惱 亂 人 非 人 者  多 事 乞  
ZH_X42_0736_008:0842a14	壞俗深信。故曰惱人。斬伐樹木。壞鬼神樹。夭傷彼命。	008	壞 俗 深 信  故 曰 惱 人  斬 伐 樹 木  壞 鬼 神 樹  夭 傷 彼 命  
ZH_X42_0736_008:0842a15	惱非人也。單就伐樹邊。立惱亂三趣也。斫此神樹。傷	008	惱 非 人 也  單 就 伐 樹 邊  立 惱 亂 三 趣 也  斫 此 神 樹  傷 
ZH_X42_0736_008:0842a16	害神兒。惱非人趣也。世人藉此樹覆蔭涼樂。律明此	008	害 神 兒  惱 非 人 趣 也  世 人 藉 此 樹 覆 蔭 涼 樂  律 明 此 
ZH_X42_0736_008:0842a17	樹下。容五百乘車。世人經過。用為止息。此人趣也。一	008	樹 下  容 五 百 乘 車  世 人 經 過  用 為 止 息  此 人 趣 也  一 
ZH_X42_0736_008:0842a18	切虫鳥。依之為舍。此惱傍生趣也。或自損行違慈道	008	切 虫 鳥  依 之 為 舍  此 惱 傍 生 趣 也  或 自 損 行 違 慈 道 
ZH_X42_0736_008:0842a19	者。專事造房。廢修出業。名自損行也。賓云。或自損者。	008	者  專 事 造 房  廢 修 出 業  名 自 損 行 也  賓 云  或 自 損 者  
ZH_X42_0736_008:0842a20	據難處也。容有師子虎狼食噉比丘也。平治土地。殺	008	據 難 處 也  容 有 師 子 虎 狼 食 噉 比 丘 也  平 治 土 地  殺 
ZH_X42_0736_008:0842a21	傷虫蟻。是曰違慈道也。上釋五過義竟。	008	傷 虫 蟻  是 曰 違 慈 道 也  上 釋 五 過 義 竟  
ZH_X42_0736_008:0842a22	已下正明其緣。六緣成犯。第四過量不處分想者。首	008	已 下 正 明 其 緣  六 緣 成 犯  第 四 過 量 不 處 分 想 者  首 
ZH_X42_0736_008:0842a23	問曰。處分羯磨防妨難不。答不防。若爾說淨應不防	008	問 曰  處 分 羯 磨 防 妨 難 不  答 不 防  若 爾 說 淨 應 不 防 
ZH_X42_0736_008:0842a24	長。解此中若有防難。本不聽處分。要無方聽。是以處	008	長  解 此 中 若 有 防 難  本 不 聽 處 分  要 無 方 聽  是 以 處 
ZH_X42_0736_008:0842b01	分不防難。說淨是懸防過限。是以說淨得防長。正由	008	分 不 防 難  說 淨 是 懸 防 過 限  是 以 說 淨 得 防 長  正 由 
ZH_X42_0736_008:0842b02	處分不防難故。處分竟猶得難生。說淨正防長故。說	008	處 分 不 防 難 故  處 分 竟 猶 得 難 生  說 淨 正 防 長 故  說 
ZH_X42_0736_008:0842b03	淨竟。必無長過。是以不並。此戒四重境想。一無主。二	008	淨 竟  必 無 長 過  是 以 不 並  此 戒 四 重 境 想  一 無 主  二 
ZH_X42_0736_008:0842b04	不處分。三無妨。四無難。	008	不 處 分  三 無 妨  四 無 難  
ZH_X42_0736_008:0842b05	多論末後二摶泥未竟輕偷蘭者。立明。表事未成故。	008	多 論 末 後 二 摶 泥 未 竟 輕 偷 蘭 者  立 明  表 事 未 成 故  
ZH_X42_0736_008:0842b06	不結根本也。必決心罷雖摶泥在者。同下善見亦殘。	008	不 結 根 本 也  必 決 心 罷 雖 摶 泥 在 者  同 下 善 見 亦 殘  
ZH_X42_0736_008:0842b07	案僧祇文。團泥者。謂用團泥覆屋。非謂泥壁。知之也。	008	案 僧 祇 文  團 泥 者  謂 用 團 泥 覆 屋  非 謂 泥 壁  知 之 也  
ZH_X42_0736_008:0842b08	若自身受用吉者。立明。自作犯殘。後若受用又得吉	008	若 自 身 受 用 吉 者  立 明  自 作 犯 殘  後 若 受 用 又 得 吉 
ZH_X42_0736_008:0842b09	也。	008	也  
ZH_X42_0736_008:0842b10	平治如皷面乃至長六搩手廣四搩不須乞處分者。	008	平 治 如 皷 面 乃 至 長 六 搩 手 廣 四 搩 不 須 乞 處 分 者  
ZH_X42_0736_008:0842b11	立謂。此善見文。其量小於四分也。	008	立 謂  此 善 見 文  其 量 小 於 四 分 也  
ZH_X42_0736_008:0842b12	僧祇佛搩手長二尺四寸者。心疏云。此僧祇律翻在	008	僧 祇 佛 搩 手 長 二 尺 四 寸 者  心 疏 云  此 僧 祇 律 翻 在 
ZH_X42_0736_008:0842b13	宋朝。正當元魏之代所用一尺。當於宋家尺二。聞傳	008	宋 朝  正 當 元 魏 之 代 所 用 一 尺  當 於 宋 家 尺 二  聞 傳 
ZH_X42_0736_008:0842b14	佛教。從北自南。則有魏尺當於佛磔(謂則將佛礫依於魏尺也)。所	008	佛 教  從 北 自 南  則 有 魏 尺 當 於 佛 磔  謂 則 將 佛 礫 依 於 魏 尺 也   所 
ZH_X42_0736_008:0842b15	以五分二尺則為定者。此律翻在東晉。于時道生智	008	以 五 分 二 尺 則 為 定 者  此 律 翻 在 東 晉  于 時 道 生 智 
ZH_X42_0736_008:0842b16	嚴。並是名士。既明曆緯。又善方言。所以通於東西。定	008	嚴  並 是 名 士  既 明 曆 緯  又 善 方 言  所 以 通 於 東 西  定 
ZH_X42_0736_008:0842b17	於尺秤。誠有由矣。南尺本是姬周所用。從秦漢魏並	008	於 尺 秤  誠 有 由 矣  南 尺 本 是 姬 周 所 用  從 秦 漢 魏 並 
ZH_X42_0736_008:0842b18	無改張。普氏南遷斯法永定。元魏撥亂。文籍焚除。無	008	無 改 張  普 氏 南 遷 斯 法 永 定  元 魏 撥 亂  文 籍 焚 除  無 
ZH_X42_0736_008:0842b19	所依准。故隋世立用古尺二。今觀魏一尺。即唐雜令	008	所 依 准  故 隋 世 立 用 古 尺 二  今 觀 魏 一 尺  即 唐 雜 令 
ZH_X42_0736_008:0842b20	還如此。	008	還 如 此  
ZH_X42_0736_008:0842b21	凡人一肘半者。立云。長尺八九寸。由翻經有南北二	008	凡 人 一 肘 半 者  立 云  長 尺 八 九 寸  由 翻 經 有 南 北 二 
ZH_X42_0736_008:0842b22	國者。立謂。江寧即南朝也。洛陽即北朝。故曰二國也。	008	國 者  立 謂  江 寧 即 南 朝 也  洛 陽 即 北 朝  故 曰 二 國 也  
ZH_X42_0736_008:0842b23	南朝三藏。翻譯。多明小尺。即姬周尺也。北朝三藏。所	008	南 朝 三 藏  翻 譯  多 明 小 尺  即 姬 周 尺 也  北 朝 三 藏  所 
