segmentnr	original	folio	analyzed
ZH_X87_1614_002:0074c10	玄泰山謠(石霜諸法嗣　傳燈十六)泰南衲所居蘭若在衡山	002	玄 泰 山 謠  石 霜 諸 法 嗣  傳 燈 十 六  泰 南 衲 所 居 蘭 若 在 衡 山 
ZH_X87_1614_002:0074c11	之東。號七寶臺。誓不立門徒。四方後進依附皆用	002	之 東  號 七 寶 臺  誓 不 立 門 徒  四 方 後 進 依 附 皆 用 
ZH_X87_1614_002:0074c12	交友之禮。甞以衡山多被山民斬木燒[入/米/田]。為害滋	002	交 友 之 禮  甞 以 衡 山 多 被 山 民 斬 木 燒 [入米田]  為 害 滋 
ZH_X87_1614_002:0074c13	甚。乃作畬山謠。遠邇傳播達于九重。有詔禁止。故	002	甚  乃 作 畬 山 謠  遠 邇 傳 播 達 于 九 重  有 詔 禁 止  故 
ZH_X87_1614_002:0074c14	嶽中蘭若無復延燎。師之力也。畬山謠。畬山兒。無	002	嶽 中 蘭 若 無 復 延 燎  師 之 力 也  畬 山 謠  畬 山 兒  無 
ZH_X87_1614_002:0074c15	所知。年年斫斷青山嵋。就中最好衡嶽色。杉松利	002	所 知  年 年 斫 斷 青 山 嵋  就 中 最 好 衡 嶽 色  杉 松 利 
ZH_X87_1614_002:0074c16	斧摧貞枝。靈禽野鶴無因依。白雲廻避青煙飛。猿	002	斧 摧 貞 枝  靈 禽 野 鶴 無 因 依  白 雲 廻 避 青 煙 飛  猿 
ZH_X87_1614_002:0074c17	猱路絕岩崖出。芝术失根茆草肥。年年斫罷仍栽	002	猱 路 絕 岩 崖 出  芝 术 失 根 茆 草 肥  年 年 斫 罷 仍 栽 
ZH_X87_1614_002:0074c18	鋤。千秋終是難復初。又道今年種不多。來年更斫	002	鋤  千 秋 終 是 難 復 初  又 道 今 年 種 不 多  來 年 更 斫 
ZH_X87_1614_002:0074c19	當陽坡。國家壽嶽當如此。不知此理如之何。	002	當 陽 坡  國 家 壽 嶽 當 如 此  不 知 此 理 如 之 何  
ZH_X87_1614_002:0074c20	紹銑設舘(北禪賢法嗣　僧寶中)潭州奧化紹銑禪師。時南	002	紹 銑 設 舘  北 禪 賢 法 嗣  僧 寶 中  潭 州 奧 化 紹 銑 禪 師  時 南 
ZH_X87_1614_002:0074c21	禪師道價方增。荊湖衲子犇趍入江南者。出長沙	002	禪 師 道 價 方 增  荊 湖 衲 子 犇 趍 入 江 南 者  出 長 沙 
ZH_X87_1614_002:0074c22	百里無託宿所。多為盜劫掠。路因不通。師半五十	002	百 里 無 託 宿 所  多 為 盜 劫 掠  路 因 不 通  師 半 五 十 
ZH_X87_1614_002:0074c23	為舘。請僧主之以接納。使得宿食而去。諸方高其	002	為 舘  請 僧 主 之 以 接 納  使 得 宿 食 而 去  諸 方 高 其 
ZH_X87_1614_002:0074c24	為人。	002	為 人  
ZH_X87_1614_002:0075a01	福國戕橋	002	福 國 戕 橋 
ZH_X87_1614_002:0075a02	六祖負金(傳燈五)江西志徹禪師者。江西人也。姓張	002	六 祖 負 金  傳 燈 五  江 西 志 徹 禪 師 者  江 西 人 也  姓 張 
ZH_X87_1614_002:0075a03	氏。名行昌。少任俠。自南北分化。二宗主雖亡彼我。	002	氏  名 行 昌  少 任 俠  自 南 北 分 化  二 宗 主 雖 亡 彼 我  
ZH_X87_1614_002:0075a04	而徒侶競起愛憎。時北宗門人自立秀師為第六	002	而 徒 侶 競 起 愛 憎  時 北 宗 門 人 自 立 秀 師 為 第 六 
ZH_X87_1614_002:0075a05	祖。而忌能大師傳衣為天下所聞。然祖是菩薩。預	002	祖  而 忌 能 大 師 傳 衣 為 天 下 所 聞  然 祖 是 菩 薩  預 
ZH_X87_1614_002:0075a06	知其事。即置金十兩於方丈。時行昌受北宗門人	002	知 其 事  即 置 金 十 兩 於 方 丈  時 行 昌 受 北 宗 門 人 
ZH_X87_1614_002:0075a07	之囑。懷刃入祖室將欲加害。祖舒頸而就。行昌揮	002	之 囑  懷 刃 入 祖 室 將 欲 加 害  祖 舒 頸 而 就  行 昌 揮 
ZH_X87_1614_002:0075a08	刃者三都無所損。祖曰。正劒不邪邪劒不正。只負	002	刃 者 三 都 無 所 損  祖 曰  正 劒 不 邪 邪 劒 不 正  只 負 
ZH_X87_1614_002:0075a09	汝金不負汝命。行昌驚仆久而方蘇。求哀悔過即	002	汝 金 不 負 汝 命  行 昌 驚 仆 久 而 方 蘇  求 哀 悔 過 即 
ZH_X87_1614_002:0075a10	願出家。祖遂與金云。汝且去。恐徒眾飜害於汝。汝	002	願 出 家  祖 遂 與 金 云  汝 且 去  恐 徒 眾 飜 害 於 汝  汝 
ZH_X87_1614_002:0075a11	可他日易形而來。吾當攝受。行昌稟旨宵遁終捉	002	可 他 日 易 形 而 來  吾 當 攝 受  行 昌 稟 旨 宵 遁 終 捉 
ZH_X87_1614_002:0075a12	僧出家具戒精進。一日憶祖之言。遠來禮勤。問答	002	僧 出 家 具 戒 精 進  一 日 憶 祖 之 言  遠 來 禮 勤  問 答 
ZH_X87_1614_002:0075a13	機緣相契。祖曰汝今徹也。宜名志徹。師禮謝而去。	002	機 緣 相 契  祖 曰 汝 今 徹 也  宜 名 志 徹  師 禮 謝 而 去  
ZH_X87_1614_002:0075a14	神光償債(會元一)二祖者。武牢人也。姓姬氏。父寂。未	002	神 光 償 債  會 元 一  二 祖 者  武 牢 人 也  姓 姬 氏  父 寂  未 
ZH_X87_1614_002:0075a15	有子時甞自念言。我家崇善豈令無子。禱之既久。	002	有 子 時 甞 自 念 言  我 家 崇 善 豈 令 無 子  禱 之 既 久  
ZH_X87_1614_002:0075a16	一夕感異光照室。其母因而懷姙。及長遂以照室	002	一 夕 感 異 光 照 室  其 母 因 而 懷 姙  及 長 遂 以 照 室 
ZH_X87_1614_002:0075a17	之瑞名之曰光。自幼志氣不群。愽涉詩書。尤精玄	002	之 瑞 名 之 曰 光  自 幼 志 氣 不 群  愽 涉 詩 書  尤 精 玄 
ZH_X87_1614_002:0075a18	理。而不事家產好遊山水。後覽佛書超然自得。即	002	理  而 不 事 家 產 好 遊 山 水  後 覽 佛 書 超 然 自 得  即 
ZH_X87_1614_002:0075a19	抵洛陽龍門香山。依室靜禪師出家。受具於永穆	002	抵 洛 陽 龍 門 香 山  依 室 靜 禪 師 出 家  受 具 於 永 穆 
ZH_X87_1614_002:0075a20	寺。浮游講肆徧學大小乘義。年三十二却返香山。	002	寺  浮 游 講 肆 徧 學 大 小 乘 義  年 三 十 二 却 返 香 山  
ZH_X87_1614_002:0075a21	終日宴坐又經八載。於寂默中倐見一神人謂曰。	002	終 日 宴 坐 又 經 八 載  於 寂 默 中 倐 見 一 神 人 謂 曰  
ZH_X87_1614_002:0075a22	將欲受果何滯此耶。大道匪遙汝南矣。祖知神助	002	將 欲 受 果 何 滯 此 耶  大 道 匪 遙 汝 南 矣  祖 知 神 助 
ZH_X87_1614_002:0075a23	因改名神光。翌日覺頭痛如刺其師欲治之。空中	002	因 改 名 神 光  翌 日 覺 頭 痛 如 刺 其 師 欲 治 之  空 中 
ZH_X87_1614_002:0075a24	有聲曰。此乃換骨非常痛也。祖遂以見神事白于	002	有 聲 曰  此 乃 換 骨 非 常 痛 也  祖 遂 以 見 神 事 白 于 
ZH_X87_1614_002:0075b01	師。師視其頂骨即如五峯秀出矣。乃曰汝相吉祥	002	師  師 視 其 頂 骨 即 如 五 峯 秀 出 矣  乃 曰 汝 相 吉 祥 
ZH_X87_1614_002:0075b02	當有所證。神令汝南者。斯則少林達磨大士。必汝	002	當 有 所 證  神 令 汝 南 者  斯 則 少 林 達 磨 大 士  必 汝 
ZH_X87_1614_002:0075b03	之師也。祖受教造于少室。達磨遂因與易名曰惠	002	之 師 也  祖 受 教 造 于 少 室  達 磨 遂 因 與 易 名 曰 惠 
ZH_X87_1614_002:0075b04	可。傳授之。後於筦城縣匡救寺之三門談無上道。	002	可  傳 授 之  後 於 筦 城 縣 匡 救 寺 之 三 門 談 無 上 道  
ZH_X87_1614_002:0075b05	聽者林會。時辨和法師於其寺講涅槃經。其徒聞	002	聽 者 林 會  時 辨 和 法 師 於 其 寺 講 涅 槃 經  其 徒 聞 
ZH_X87_1614_002:0075b06	師闡法稍稍引去。和不勝其憤。乃興謗于邑。寄翟	002	師 闡 法 稍 稍 引 去  和 不 勝 其 憤  乃 興 謗 于 邑  寄 翟 
ZH_X87_1614_002:0075b07	仲侃。侃惑其說。加師以非法債。師以怡然委順。識	002	仲 侃  侃 惑 其 說  加 師 以 非 法 債  師 以 怡 然 委 順  識 
ZH_X87_1614_002:0075b08	真者謂之償債。○皓月供奉問長沙岑云。了即業	002	真 者 謂 之 償 債   皓 月 供 奉 問 長 沙 岑 云  了 即 業 
ZH_X87_1614_002:0075b09	障本來空。未了應須償宿債。師子尊者二祖大師	002	障 本 來 空  未 了 應 須 償 宿 債  師 子 尊 者 二 祖 大 師 
ZH_X87_1614_002:0075b10	為甚麼却償債。岑云。大德不識本來空。如何是本	002	為 甚 麼 却 償 債  岑 云  大 德 不 識 本 來 空  如 何 是 本 
ZH_X87_1614_002:0075b11	來空。云業障是。如何是業障是。云本來空是。供奉	002	來 空  云 業 障 是  如 何 是 業 障 是  云 本 來 空 是  供 奉 
ZH_X87_1614_002:0075b12	無語。長沙乃示偈云。假有元非有。假滅亦非無。涅	002	無 語  長 沙 乃 示 偈 云  假 有 元 非 有  假 滅 亦 非 無  涅 
ZH_X87_1614_002:0075b13	槃償債義。一性更無殊。	002	槃 償 債 義  一 性 更 無 殊  
ZH_X87_1614_002:0075b14	洛浦投師(傳燈十六)見前夾嶺鳳巢之處○和補曰。會	002	洛 浦 投 師  傳 燈 十 六  見 前 夾 嶺 鳳 巢 之 處  和 補 曰  會 
ZH_X87_1614_002:0075b15	元第六云。師游歷罷。直往夾山卓庵。經年不訪夾	002	元 第 六 云  師 游 歷 罷  直 往 夾 山 卓 庵  經 年 不 訪 夾 
ZH_X87_1614_002:0075b16	山。山乃修書令僧馳往。師接得便坐却。再展手索。	002	山  山 乃 修 書 令 僧 馳 往  師 接 得 便 坐 却  再 展 手 索  
ZH_X87_1614_002:0075b17	僧無對。師便打曰。歸去舉似和上。僧回舉似。山曰	002	僧 無 對  師 便 打 曰  歸 去 舉 似 和 上  僧 回 舉 似  山 曰 
ZH_X87_1614_002:0075b18	這僧若開書三日內必來。若不開書斯人救不救	002	這 僧 若 開 書 三 日 內 必 來  若 不 開 書 斯 人 救 不 救 
ZH_X87_1614_002:0075b19	也。師果三日後到。見夾山不禮拜。乃當面叉手而	002	也  師 果 三 日 後 到  見 夾 山 不 禮 拜  乃 當 面 叉 手 而 
ZH_X87_1614_002:0075b20	立。山曰。鷄栖鳳巢非其同類。出去。自遠趨風請師	002	立  山 曰  鷄 栖 鳳 巢 非 其 同 類  出 去  自 遠 趨 風 請 師 
ZH_X87_1614_002:0075b21	一接。山曰。目前無闍梨。此間無老僧。師便喝。山曰。	002	一 接  山 曰  目 前 無 闍 梨  此 間 無 老 僧  師 便 喝  山 曰  
ZH_X87_1614_002:0075b22	住住。且莫草草忩忩。雲月是同。溪山各異。	002	住 住  且 莫 草 草 忩 忩  雲 月 是 同  溪 山 各 異  
ZH_X87_1614_002:0075b23	沙彌求戒(傳燈十四)高沙彌初參藥山。山問甚麼處來。	002	沙 彌 求 戒  傳 燈 十 四  高 沙 彌 初 參 藥 山  山 問 甚 麼 處 來  
ZH_X87_1614_002:0075b24	曰南嶽來。山云何處去。曰江陵受戒去。山云受戒	002	曰 南 嶽 來  山 云 何 處 去  曰 江 陵 受 戒 去  山 云 受 戒 
ZH_X87_1614_002:0075c01	圖箇甚麼。曰圖免生死。曰。有一人不受戒亦免生	002	圖 箇 甚 麼  曰 圖 免 生 死  曰  有 一 人 不 受 戒 亦 免 生 
ZH_X87_1614_002:0075c02	死。汝還知否。曰恁麼則佛戒何用。山曰猶掛唇齒	002	死  汝 還 知 否  曰 恁 麼 則 佛 戒 何 用  山 曰 猶 掛 唇 齒 
ZH_X87_1614_002:0075c03	在。便召維那云。者跛脚沙彌不任僧務。安排向後	002	在  便 召 維 那 云  者 跛 脚 沙 彌 不 任 僧 務  安 排 向 後 
ZH_X87_1614_002:0075c04	庵著。山謂道吾雲岩曰。適來一箇沙彌却有來由。	002	庵 著  山 謂 道 吾 雲 岩 曰  適 來 一 箇 沙 彌 却 有 來 由  
ZH_X87_1614_002:0075c05	道吾曰也須勘過始得。山乃再問諦云。見說長安	002	道 吾 曰 也 須 勘 過 始 得  山 乃 再 問 諦 云  見 說 長 安 
ZH_X87_1614_002:0075c06	甚閙。曰我國晏然。山曰汝徒看經得請益得。曰總	002	甚 閙  曰 我 國 晏 然  山 曰 汝 徒 看 經 得 請 益 得  曰 總 
ZH_X87_1614_002:0075c07	不與麼。山曰大有人不與麼不得。曰。不道他無。只	002	不 與 麼  山 曰 大 有 人 不 與 麼 不 得  曰  不 道 他 無  只 
ZH_X87_1614_002:0075c08	是不肯承當。	002	是 不 肯 承 當  
ZH_X87_1614_002:0075c09	蔣山三障(慈明圓法嗣　傳燈廿三)舒王初丁大母夫人憂。讀	002	蔣 山 三 障  慈 明 圓 法 嗣  傳 燈 廿 三  舒 王 初 丁 大 母 夫 人 憂  讀 
ZH_X87_1614_002:0075c10	經山中。與蔣山贊元禪師游。如昆弟。問祖師意旨。	002	經 山 中  與 蔣 山 贊 元 禪 師 游  如 昆 弟  問 祖 師 意 旨  
ZH_X87_1614_002:0075c11	師不答。王益扣之。師曰。公般若有障三。有近道之	002	師 不 答  王 益 扣 之  師 曰  公 般 若 有 障 三  有 近 道 之 
ZH_X87_1614_002:0075c12	質一。更一兩生來恐純熟。王曰願聞其說。師云。公	002	質 一  更 一 兩 生 來 恐 純 熟  王 曰 願 聞 其 說  師 云  公 
ZH_X87_1614_002:0075c13	受氣剛大。世緣深。以剛大氣遭深世緣。必以身任	002	受 氣 剛 大  世 緣 深  以 剛 大 氣 遭 深 世 緣  必 以 身 任 
ZH_X87_1614_002:0075c14	天下之重。懷經濟之志。用舍不能必。則心未平。以	002	天 下 之 重  懷 經 濟 之 志  用 舍 不 能 必  則 心 未 平  以 
ZH_X87_1614_002:0075c15	未平之心持經世之志。何時能一念萬年哉一。又	002	未 平 之 心 持 經 世 之 志  何 時 能 一 念 萬 年 哉 一  又 
ZH_X87_1614_002:0075c16	多怒二。而學問尚理於道為所知愚三。此其三也。	002	多 怒 二  而 學 問 尚 理 於 道 為 所 知 愚 三  此 其 三 也  
ZH_X87_1614_002:0075c17	特視名利如脫髮。有擔薄如頭陀。此為近道。且當	002	特 視 名 利 如 脫 髮  有 擔 薄 如 頭 陀  此 為 近 道  且 當 
ZH_X87_1614_002:0075c18	以教乘滋茂之可也。王再拜受教。	002	以 教 乘 滋 茂 之 可 也  王 再 拜 受 教  
ZH_X87_1614_002:0075c19	華藏四[得-彳]	002	華 藏 四 [得彳] 
ZH_X87_1614_002:0075c20	鎮州蘿蔔(會元四)僧問趙州。承聞和尚親見南泉是	002	鎮 州 蘿 蔔  會 元 四  僧 問 趙 州  承 聞 和 尚 親 見 南 泉 是 
ZH_X87_1614_002:0075c21	否。州曰鎮州出大蘿蔔頭。	002	否  州 曰 鎮 州 出 大 蘿 蔔 頭  
ZH_X87_1614_002:0075c22	普化生菜(傳燈十)普化一日在僧堂前喫生菜。臨濟	002	普 化 生 菜  傳 燈 十  普 化 一 日 在 僧 堂 前 喫 生 菜  臨 濟 
ZH_X87_1614_002:0075c23	見云大似一頭驢。普化便作驢鳴。濟云這賊。普化	002	見 云 大 似 一 頭 驢  普 化 便 作 驢 鳴  濟 云 這 賊  普 化 
ZH_X87_1614_002:0075c24	云賊賊。便出去。	002	云 賊 賊  便 出 去  
ZH_X87_1614_002:0076a01	永嘉一宿(會元二)溫州玄覺禪師詣曹溪。初到振	002	永 嘉 一 宿  會 元 二  溫 州 玄 覺 禪 師 詣 曹 溪  初 到 振 
ZH_X87_1614_002:0076a02	錫携瓶遶祖三匝卓然而立。祖曰。夫沙門者具三	002	錫 携 瓶 遶 祖 三 匝 卓 然 而 立  祖 曰  夫 沙 門 者 具 三 
ZH_X87_1614_002:0076a03	千威儀八萬細行。大德自何方而來。生大我慢。師	002	千 威 儀 八 萬 細 行  大 德 自 何 方 而 來  生 大 我 慢  師 
ZH_X87_1614_002:0076a04	云。生死事大。無常迅速。祖曰。何不體取無生。了無	002	云  生 死 事 大  無 常 迅 速  祖 曰  何 不 體 取 無 生  了 無 
ZH_X87_1614_002:0076a05	速乎。云。體即無生。了本無速。祖曰如是如是。于時	002	速 乎  云  體 即 無 生  了 本 無 速  祖 曰 如是如是  于 時 
ZH_X87_1614_002:0076a06	大眾愕然。師方具威儀參禮。須臾告辭。祖曰返太	002	大 眾 愕 然  師 方 具 威 儀 參 禮  須 臾 告 辭  祖 曰 返 太 
ZH_X87_1614_002:0076a07	速乎。師云本自非動豈有速耶。祖曰汝甚得無生	002	速 乎  師 云 本 自 非 動 豈 有 速 耶  祖 曰 汝 甚 得 無 生 
ZH_X87_1614_002:0076a08	之意。師曰無生豈有意耶。祖曰無意誰當分別。師	002	之 意  師 曰 無 生 豈 有 意 耶  祖 曰 無 意 誰 當 分 別  師 
ZH_X87_1614_002:0076a09	云分別亦非意。祖歎曰。善哉善哉。少留一宿。時謂	002	云 分 別 亦 非 意  祖 歎 曰  善哉善哉  少 留 一 宿  時 謂 
ZH_X87_1614_002:0076a10	之一宿覺。翌日回永嘉。	002	之 一 宿 覺  翌 日 回 永 嘉  
ZH_X87_1614_002:0076a11	雲盖半載(石霜諸法嗣　會元六)潭州雲盖山志元圓淨禪	002	雲 盖 半 載  石 霜 諸 法 嗣  會 元 六  潭 州 雲 盖 山 志 元 圓 淨 禪 
ZH_X87_1614_002:0076a12	師。遊方時問雲居曰。志元不奈何時如何。居曰祇	002	師  遊 方 時 問 雲 居 曰  志 元 不 奈 何 時 如 何  居 曰 祇 
ZH_X87_1614_002:0076a13	為闍梨功力不到。師不禮拜。直造石霜亦如前問。	002	為 闍 梨 功 力 不 到  師 不 禮 拜  直 造 石 霜 亦 如 前 問  
ZH_X87_1614_002:0076a14	霜云。非但闍梨。老僧亦不奈何。師云和尚為甚麼	002	霜 云  非 但 闍 梨  老 僧 亦 不 奈 何  師 云 和 尚 為 甚 麼 
ZH_X87_1614_002:0076a15	不奈何。霜曰。老僧若奈何。拈過汝不奈何。師便禮	002	不 奈 何  霜 曰  老 僧 若 奈 何  拈 過 汝 不 奈 何  師 便 禮 
ZH_X87_1614_002:0076a16	拜。僧問石霜。萬戶俱閉即不問。萬戶俱開時如何。	002	拜  僧 問 石 霜  萬 戶 俱 閉 即 不 問  萬 戶 俱 開 時 如 何  
ZH_X87_1614_002:0076a17	霜云堂中事作麼生。僧無對。經半年方始下一點	002	霜 云 堂 中 事 作 麼 生  僧 無 對  經 半 年 方 始 下 一 點 
ZH_X87_1614_002:0076a18	語曰。無人接得渠師去。乃禮拜乞為舉。霜不肯。師	002	語 曰  無 人 接 得 渠 師 去  乃 禮 拜 乞 為 舉  霜 不 肯  師 
ZH_X87_1614_002:0076a19	乃抱霜上方丈曰。和尚若不道。打和尚去在。霜曰	002	乃 抱 霜 上 方 丈 曰  和 尚 若 不 道  打 和 尚 去 在  霜 曰 
ZH_X87_1614_002:0076a20	得在。師頻禮拜。霜曰無人識得渠。師於言下頓省。	002	得 在  師 頻 禮 拜  霜 曰 無 人 識 得 渠  師 於 言 下 頓 省  
ZH_X87_1614_002:0076a21	王岳四玄	002	王 岳 四 玄 
ZH_X87_1614_002:0076a22	溈仰三昧(人天眼目)朗州古堤和尚。仰山到參。堤曰。去。	002	溈 仰 三 昧  人 天 眼 目  朗 州 古 堤 和 尚  仰 山 到 參  堤 曰  去  
ZH_X87_1614_002:0076a23	汝無佛性。山叉手近前三步應諾。堤笑曰。子甚麼	002	汝 無 佛 性  山 叉 手 近 前 三 步 應 諾  堤 笑 曰  子 甚 麼 
ZH_X87_1614_002:0076a24	處得此三昧來。山曰。我從耽源處得名。溈山處得	002	處 得 此 三 昧 來  山 曰  我 從 耽 源 處 得 名  溈 山 處 得 
ZH_X87_1614_002:0076b01	地。堤曰莫是溈山的子麼。山曰。世諦即不無。佛法	002	地  堤 曰 莫 是 溈 山 的 子 麼  山 曰  世 諦 即 不 無  佛 法 
ZH_X87_1614_002:0076b02	即不敢。山却問和尚從甚處得此三昧。堤曰我從	002	即 不 敢  山 却 問 和 尚 從 甚 處 得 此 三 昧  堤 曰 我 從 
ZH_X87_1614_002:0076b03	章敬處得此三昧。山歎曰不可思議。來者難為湊	002	章 敬 處 得 此 三 昧  山 歎 曰 不可思議  來 者 難 為 湊 
ZH_X87_1614_002:0076b04	伯。○義海　仰山坐次。有僧來作禮。山不顧。其僧	002	伯   義 海  仰 山 坐 次  有 僧 來 作 禮  山 不 顧  其 僧 
ZH_X87_1614_002:0076b05	乃問師識字否。山曰隨分。僧右旋一匝曰是甚麼	002	乃 問 師 識 字 否  山 曰 隨 分  僧 右 旋 一 匝 曰 是 甚 麼 
ZH_X87_1614_002:0076b06	字。山於地上書十字酬之。僧又左旋一匝曰是甚	002	字  山 於 地 上 書 十 字 酬 之  僧 又 左 旋 一 匝 曰 是 甚 
ZH_X87_1614_002:0076b07	麼字。山改十字作○字。僧乃劃此[○@卍]相以兩手拓	002	麼 字  山 改 十 字 作  字  僧 乃 劃 此 [卍] 相 以 兩 手 拓 
ZH_X87_1614_002:0076b08	如修羅掌日月勢。曰是甚麼字。山乃劃此卍相對	002	如 修 羅 掌 日 月 勢  曰 是 甚 麼 字  山 乃 劃 此 卍 相 對 
ZH_X87_1614_002:0076b09	之。僧乃作婁至德勢。山曰。如是如是。此是諸佛之	002	之  僧 乃 作 婁 至 德 勢  山 曰  如是如是  此 是 諸 佛 之 
ZH_X87_1614_002:0076b10	所護念。汝亦如是。吾亦如是。善自護持。其僧禮謝	002	所 護 念  汝 亦 如 是  吾 亦 如 是  善 自 護 持  其 僧 禮 謝 
ZH_X87_1614_002:0076b11	騰空而去。時有一道者見。經五日後遂問山。山曰	002	騰 空 而 去  時 有 一 道 者 見  經 五 日 後 遂 問 山  山 曰 
ZH_X87_1614_002:0076b12	汝還見否。道者曰某甲見出門騰空而去。山曰。此	002	汝 還 見 否  道 者 曰 某 甲 見 出 門 騰 空 而 去  山 曰  此 
ZH_X87_1614_002:0076b13	是西天羅漢。故來探吾道。道者曰某雖覩此三昧	002	是 西 天 羅 漢  故 來 探 吾 道  道 者 曰 某 雖 覩 此 三 昧 
ZH_X87_1614_002:0076b14	不辨其理。山曰吾以義為汝解釋。此是八種三昧。	002	不 辨 其 理  山 曰 吾 以 義 為 汝 解 釋  此 是 八 種 三 昧  
ZH_X87_1614_002:0076b15	是覺海變為義海。躰則同然。此義合有因有果即	002	是 覺 海 變 為 義 海  躰 則 同 然  此 義 合 有 因 有 果 即 
ZH_X87_1614_002:0076b16	時異時總別不離隱身三昧也。	002	時 異 時 總 別 不 離 隱 身 三 昧 也  
ZH_X87_1614_002:0076b17	桐峯虎聲(臨濟法嗣　傳燈)僧到桐峯主處便問。這裡忽	002	桐 峯 虎 聲  臨 濟 法 嗣  傳 燈  僧 到 桐 峯 主 處 便 問  這 裡 忽 
ZH_X87_1614_002:0076b18	逢大虫時又作麼生。庵主作虎聲。僧作怕勢。庵主	002	逢 大 虫 時 又 作 麼 生  庵 主 作 虎 聲  僧 作 怕 勢  庵 主 
ZH_X87_1614_002:0076b19	呵呵大笑。僧云這老賊。庵主云爭奈老僧何。僧便	002	呵 呵 大 笑  僧 云 這 老 賊  庵 主 云 爭 奈 老 僧 何  僧 便 
ZH_X87_1614_002:0076b20	休去。	002	休 去  
ZH_X87_1614_002:0076b21	投子牛在舒州投子山大同禪師。因一婆上山云	002	投 子 牛 在 舒 州 投 子 山 大 同 禪 師  因 一 婆 上 山 云 
ZH_X87_1614_002:0076b22	家中失却牛請師一卜。師召婆。婆應諾。師云牛在。	002	家 中 失 却 牛 請 師 一 卜  師 召 婆  婆 應 諾  師 云 牛 在  
ZH_X87_1614_002:0076b23	婆乃歡喜而去。	002	婆 乃 歡 喜 而 去  
ZH_X87_1614_002:0076b24	鏡清失利(雪峰法嗣　會元七)越州鏡清寺道怤順德禪師。	002	鏡 清 失 利  雪 峰 法 嗣  會 元 七  越 州 鏡 清 寺 道 怤 順 德 禪 師  
ZH_X87_1614_002:0076c01	新到參。師拈起拂子。僧曰。久響鏡清。猶有這箇在。	002	新 到 參  師 拈 起 拂 子  僧 曰  久 響 鏡 清  猶 有 這 箇 在  
ZH_X87_1614_002:0076c02	師曰鏡清今日失利。師問荷玉甚處來。曰天台來。	002	師 曰 鏡 清 今 日 失 利  師 問 荷 玉 甚 處 來  曰 天 台 來  
ZH_X87_1614_002:0076c03	師曰阿誰問汝天台。曰和尚何得龍頭虵尾。師云	002	師 曰 阿 誰 問 汝 天 台  曰 和 尚 何 得 龍 頭 虵 尾  師 云 
ZH_X87_1614_002:0076c04	鏡清今日失利。師看經次。僧問和尚看甚麼經。師	002	鏡 清 今 日 失 利  師 看 經 次  僧 問 和 尚 看 甚 麼 經  師 
ZH_X87_1614_002:0076c05	云我與古人鬪百草。師却問汝會麼。曰少年也曾	002	云 我 與 古 人 鬪 百 草  師 却 問 汝 會 麼  曰 少 年 也 曾 
ZH_X87_1614_002:0076c06	恁麼來。師云如今作麼生。僧舉拳。師云我輸汝也。	002	恁 麼 來  師 云 如 今 作 麼 生  僧 舉 拳  師 云 我 輸 汝 也  
ZH_X87_1614_002:0076c07	問辨不得提不起時如何。師曰爭得到這裏。曰恁	002	問 辨 不 得 提 不 起 時 如 何  師 曰 爭 得 到 這 裏  曰 恁 
ZH_X87_1614_002:0076c08	麼則禮拜去也。師云鏡清今日失利。師見僧學書	002	麼 則 禮 拜 去 也  師 云 鏡 清 今 日 失 利  師 見 僧 學 書 
ZH_X87_1614_002:0076c09	廼問學甚麼書。曰請和尚鑑。師云一点未分三分	002	廼 問 學 甚 麼 書  曰 請 和 尚 鑑  師 云 一 点 未 分 三 分 
ZH_X87_1614_002:0076c10	著地。曰今日又似遇人又似不遇人。師云鏡清今	002	著 地  曰 今 日 又 似 遇 人 又 似 不 遇 人  師 云 鏡 清 今 
ZH_X87_1614_002:0076c11	日失利。問新年頭还有佛法也無。師曰有。曰如何	002	日 失 利  問 新 年 頭 还 有 佛 法 也 無  師 曰 有  曰 如 何 
ZH_X87_1614_002:0076c12	是新年頭佛法。師云元正啟祚萬物咸新。曰謝師	002	是 新 年 頭 佛 法  師 云 元 正 啟 祚 萬 物 咸 新  曰 謝 師 
ZH_X87_1614_002:0076c13	答話。師曰鏡清今日失利。上堂。眾集定。師拋下拄	002	答 話  師 曰 鏡 清 今 日 失 利  上 堂  眾 集 定  師 拋 下 拄 
ZH_X87_1614_002:0076c14	杖曰。大眾動著也二十棒。不動著也二十棒。時有	002	杖 曰  大 眾 動 著 也 二 十 棒  不 動 著 也 二 十 棒  時 有 
ZH_X87_1614_002:0076c15	僧出。拈得頭上戴出去。師曰鏡清今日失利。	002	僧 出  拈 得 頭 上 戴 出 去  師 曰 鏡 清 今 日 失 利  
ZH_X87_1614_002:0076c16	趙州下載(會元四)趙州上堂。兄弟若從南方來者即	002	趙 州 下 載  會 元 四  趙 州 上 堂  兄 弟 若 從 南 方 來 者 即 
ZH_X87_1614_002:0076c17	與下載。若從北方來者即與上載。所以道。近上人	002	與 下 載  若 從 北 方 來 者 即 與 上 載  所 以 道  近 上 人 
ZH_X87_1614_002:0076c18	問道即失。近下人問道即得道。	002	問 道 即 失  近 下 人 問 道 即 得 道  
ZH_X87_1614_002:0076c19	歸宗插標(禪林類聚十八)和補曰。歸宗常禪師因普請入	002	歸 宗 插 標  禪 林 類 聚 十 八  和 補 曰  歸 宗 常 禪 師 因 普 請 入 
