segmentnr	original	folio	analyzed
ZH_X42_0736_008:0832b18	生物者。立云。古來有師云。同犯重。即引律中鼠偷胡	008	生 物 者  立 云  古 來 有 師 云  同 犯 重  即 引 律 中 鼠 偷 胡 
ZH_X42_0736_008:0832b19	桃。比丘取之得鼠雖偷胡桃來。其主全未覺失。護心	008	桃  比 丘 取 之 得 鼠 雖 偷 胡 桃 來  其 主 全 未 覺 失  護 心 
ZH_X42_0736_008:0832b20	猶謹。今約本主結。不望鼠邊科也。鼻奈耶律。盜畜生	008	猶 謹  今 約 本 主 結  不 望 鼠 邊 科 也  鼻 奈 耶 律  盜 畜 生 
ZH_X42_0736_008:0832b21	物犯重。故彼律第一云。師子竹園外。殺鹿而食。飲血	008	物 犯 重  故 彼 律 第 一 云  師 子 竹 園 外  殺 鹿 而 食  飲 血 
ZH_X42_0736_008:0832b22	而服。餘殘若比丘取食。乃至下直五錢而食。為成棄	008	而 服  餘 殘 若 比 丘 取 食  乃 至 下 直 五 錢 而 食  為 成 棄 
ZH_X42_0736_008:0832b23	捐不受者。僧不共住也。盜餘鳥獸物亦爾。文繁不敘。	008	捐 不 受 者  僧 不 共 住 也  盜 餘 鳥 獸 物 亦 爾  文 繁 不 敘  
ZH_X42_0736_008:0832b24	五分十誦多論並犯吉羅。五分第一云。畜生物不與	008	五 分 十 誦 多 論 並 犯 吉 羅  五 分 第 一 云  畜 生 物 不 與 
ZH_X42_0736_008:0832c01	取。取皆吉(皆者五眾也)十誦五十七。取虎殘吉。由不斷望	008	取  取 皆 吉  皆 者 五 眾 也  十 誦 五 十 七  取 虎 殘 吉  由 不 斷 望 
ZH_X42_0736_008:0832c02	故。師子殘可取。以斷望故。多論第二云。一切鳥獸殘	008	故  師 子 殘 可 取  以 斷 望 故  多 論 第 二 云  一 切 鳥 獸 殘 
ZH_X42_0736_008:0832c03	取吉。師子無犯。此律條部文云。於鼠穴中得藥及帛。	008	取 吉  師 子 無 犯  此 律 條 部 文 云  於 鼠 穴 中 得 藥 及 帛  
ZH_X42_0736_008:0832c04	佛言。畜生無用無犯。而不應取如是物(蓋不應者吉也)。善見	008	佛 言  畜 生 無 用 無 犯  而 不 應 取 如 是 物  蓋 不 應 者 吉 也   善 見 
ZH_X42_0736_008:0832c05	取畜物無犯。彼論第十云。畜生物者。迦樓羅龍王為	008	取 畜 物 無 犯  彼 論 第 十 云  畜 生 物 者  迦 樓 羅 龍 王 為 
ZH_X42_0736_008:0832c06	初。若化為人。殺鹿而食。不得奪取。恐殺比丘。若食竟。	008	初  若 化 為 人  殺 鹿 而 食  不 得 奪 取  恐 殺 比 丘  若 食 竟  
ZH_X42_0736_008:0832c07	比丘駈去。然後取食無罪(無罪者。此亦部別也)。此上皆據無別	008	比 丘 駈 去  然 後 取 食 無 罪  無 罪 者  此 亦 部 別 也   此 上 皆 據 無 別 
ZH_X42_0736_008:0832c08	護主。若有人護。理望人結。	008	護 主  若 有 人 護  理 望 人 結  
ZH_X42_0736_008:0832c09	一切鳥獸殘吉者。謂如今山野中見鳥獸殘菓子。比	008	一 切 鳥 獸 殘 吉 者  謂 如 今 山 野 中 見 鳥 獸 殘 菓 子  比 
ZH_X42_0736_008:0832c10	丘輙取。皆吉。上來三段不同。並釋第一有主物義竟。	008	丘 輙 取  皆 吉  上 來 三 段 不 同  並 釋 第 一 有 主 物 義 竟  
ZH_X42_0736_008:0832c11	二明有主想者。上明有主物。物雖有主若作無主想。	008	二 明 有 主 想 者  上 明 有 主 物  物 雖 有 主 若 作 無 主 想  
ZH_X42_0736_008:0832c12	本迷無罪。轉想容有前心蘭故。次第三明有主想也。	008	本 迷 無 罪  轉 想 容 有 前 心 蘭 故  次 第 三 明 有 主 想 也  
ZH_X42_0736_008:0832c13	始終不轉無罪者。立謂。雖是有主物。想謂無主。雖舉	008	始 終 不 轉 無 罪 者  立 謂  雖 是 有 主 物  想 謂 無 主  雖 舉 
ZH_X42_0736_008:0832c14	離處。以本迷故。迷心未轉。至罷無罪。發心取時曰始。	008	離 處  以 本 迷 故  迷 心 未 轉  至 罷 無 罪  發 心 取 時 曰 始  
ZH_X42_0736_008:0832c15	舉離本處名終。於此時間迷心不返。故曰始終不轉	008	舉 離 本 處 名 終  於 此 時 間 迷 心 不 返  故 曰 始 終 不 轉 
ZH_X42_0736_008:0832c16	也。前後互轉互得輕重者。立謂。本擬盜人主物。結方	008	也  前 後 互 轉 互 得 輕 重 者  立 謂  本 擬 盜 人 主 物  結 方 
ZH_X42_0736_008:0832c17	便蘭。臨至境所。轉想作非畜想取。又得後心吉羅。謂	008	便 蘭  臨 至 境 所  轉 想 作 非 畜 想 取  又 得 後 心 吉 羅  謂 
ZH_X42_0736_008:0832c18	非畜家方便也。此則轉重為輕。若先擬盜非畜物。結	008	非 畜 家 方 便 也  此 則 轉 重 為 輕  若 先 擬 盜 非 畜 物  結 
ZH_X42_0736_008:0832c19	方便吉。臨至物邊。轉想作人主物取。得人家方便蘭。	008	方 便 吉  臨 至 物 邊  轉 想 作 人 主 物 取  得 人 家 方 便 蘭  
ZH_X42_0736_008:0832c20	此則轉輕為重。此上二句皆不結根本。由心不稱境	008	此 則 轉 輕 為 重  此 上 二 句 皆 不 結 根 本  由 心 不 稱 境 
ZH_X42_0736_008:0832c21	故。又解。本作有主想。臨至物邊。作無主想取。但得方	008	故  又 解  本 作 有 主 想  臨 至 物 邊  作 無 主 想 取  但 得 方 
ZH_X42_0736_008:0832c22	便蘭。若本作無主想。臨至物邊。轉作有主想取。望本	008	便 蘭  若 本 作 無 主 想  臨 至 物 邊  轉 作 有 主 想 取  望 本 
ZH_X42_0736_008:0832c23	心無罪。望舉物時犯重。故言互結輕重也。	008	心 無 罪  望 舉 物 時 犯 重  故 言 互 結 輕 重 也  
ZH_X42_0736_008:0832c24	上釋第二有主想義竟。已下第三明有盜心也。盜由	008	上 釋 第 二 有 主 想 義 竟  已 下 第 三 明 有 盜 心 也  盜 由 
ZH_X42_0736_008:0833a01	心結不望境之是非者。立謂。雖是無主物。若作有主	008	心 結 不 望 境 之 是 非 者  立 謂  雖 是 無 主 物  若 作 有 主 
ZH_X42_0736_008:0833a02	物取。得方便蘭。雖是有主物。始終迷心。作無主物想	008	物 取  得 方 便 蘭  雖 是 有 主 物  始 終 迷 心  作 無 主 物 想 
ZH_X42_0736_008:0833a03	取。不犯。故知由心也。不問物境是有主非有主。故曰	008	取  不 犯  故 知 由 心 也  不 問 物 境 是 有 主 非 有 主  故 曰 
ZH_X42_0736_008:0833a04	不問境是非也。	008	不 問 境 是 非 也  
ZH_X42_0736_008:0833a05	十誦六種盜心謂苦切取者。立謂。打鬪他人。或苦言	008	十 誦 六 種 盜 心 謂 苦 切 取 者  立 謂  打 鬪 他 人  或 苦 言 
ZH_X42_0736_008:0833a06	切勒。非理罵辱。意令前人。以物相謝也。言輕慢取者。	008	切 勒  非 理 罵 辱  意 令 前 人  以 物 相 謝 也  言 輕 慢 取 者  
ZH_X42_0736_008:0833a07	謂恃己陵他。倚藉豪強。高門大姓。輕慢貧弱。取他財	008	謂 恃 己 陵 他  倚 藉 豪 強  高 門 大 姓  輕 慢 貧 弱  取 他 財 
ZH_X42_0736_008:0833a08	物是也。或輕欺前人。對面捉物而去。以無心畏他故	008	物 是 也  或 輕 欺 前 人  對 面 捉 物 而 去  以 無 心 畏 他 故 
ZH_X42_0736_008:0833a09	也。以他名字取者。立謂。稱他大德。貴勝賢善。云我是	008	也  以 他 名 字 取 者  立 謂  稱 他 大 德  貴 勝 賢 善  云 我 是 
ZH_X42_0736_008:0833a10	其門徒眷屬。令他敬重。意規財利是也。又解。如稱為	008	其 門 徒 眷 屬  令 他 敬 重  意 規 財 利 是 也  又 解  如 稱 為 
ZH_X42_0736_008:0833a11	佛法僧等乞得物入己是也。或稱為某處名聞大德。	008	佛 法 僧 等 乞 得 物 入 己 是 也  或 稱 為 某 處 名 聞 大 德  
ZH_X42_0736_008:0833a12	乞求衣藥得物入己是也。或如今時比丘。與官人往	008	乞 求 衣 藥 得 物 入 己 是 也  或 如 今 時 比 丘  與 官 人 往 
ZH_X42_0736_008:0833a13	還。希他囑請。送物入己是也。言觝突取者。置借不還。	008	還  希 他 囑 請  送 物 入 己 是 也  言 觝 突 取 者  置 借 不 還  
ZH_X42_0736_008:0833a14	謂買他物。借他物。後不肯還是也。受寄取者。他所寄	008	謂 買 他 物  借 他 物  後 不 肯 還 是 也  受 寄 取 者  他 所 寄 
ZH_X42_0736_008:0833a15	物。在己邊。後覓不還是也。言除出息取不犯者。以兩	008	物  在 己 邊  後 覓 不 還 是 也  言 除 出 息 取 不 犯 者  以 兩 
ZH_X42_0736_008:0833a16	情和。可依世俗法收利。故不犯。	008	情 和  可 依 世 俗 法 收 利  故 不 犯  
ZH_X42_0736_008:0833a17	強奪者。他元不與。強奪將去也。言輭語取者。謂詐現	008	強 奪 者  他 元 不 與  強 奪 將 去 也  言 輭 語 取 者  謂 詐 現 
ZH_X42_0736_008:0833a18	善相。從他得物也。施已還取者。謂將物惠他。後悔便	008	善 相  從 他 得 物 也  施 已 還 取 者  謂 將 物 惠 他  後 悔 便 
ZH_X42_0736_008:0833a19	奪也。又云非唯與竟。奪而成犯。但作絕心施他。物猶	008	奪 也  又 云 非 唯 與 竟  奪 而 成 犯  但 作 絕 心 施 他  物 猶 
ZH_X42_0736_008:0833a20	己邊。後若不與。皆犯重也。	008	己 邊  後 若 不 與  皆 犯 重 也  
ZH_X42_0736_008:0833a21	曲心至恐怖取等者。立謂。邪曲也。曲斷方便。以求其	008	曲 心 至 恐 怖 取 等 者  立 謂  邪 曲 也  曲 斷 方 便  以 求 其 
ZH_X42_0736_008:0833a22	物。又解。以不直心。更相容為相阿曲取他物是也。但	008	物  又 解  以 不 直 心  更 相 容 為 相 阿 曲 取 他 物 是 也  但 
ZH_X42_0736_008:0833a23	是一切非直心取。皆名曲心。言嗔心者。立謂。嗔責前	008	是 一 切 非 直 心 取  皆 名 曲 心  言 嗔 心 者  立 謂  嗔 責 前 
ZH_X42_0736_008:0833a24	人。令他與財物也。亦可燒埋壞色俱名嗔心也。言恐	008	人  令 他 與 財 物 也  亦 可 燒 埋 壞 色 俱 名 嗔 心 也  言 恐 
ZH_X42_0736_008:0833b01	怖心者。立謂。虗示威嚴。令他怖畏與物也。	008	怖 心 者  立 謂  虗 示 威 嚴  令 他 怖 畏 與 物 也  
ZH_X42_0736_008:0833b02	四分十種一黑闇心者。疏云。謂痴心也。愚於教行。不	008	四 分 十 種 一 黑 闇 心 者  疏 云  謂 痴 心 也  愚 於 教 行  不 
ZH_X42_0736_008:0833b03	肯修學。故於盜境。生可學迷是也。二邪心取者。戒疏	008	肯 修 學  故 於 盜 境  生 可 學 迷 是 也  二 邪 心 取 者  戒 疏 
ZH_X42_0736_008:0833b04	云。即邪命也。貪心規度。為財說法。即是以利求利。惡	008	云  即 邪 命 也  貪 心 規 度  為 財 說 法  即 是 以 利 求 利  惡 
ZH_X42_0736_008:0833b05	求多求。外現清白。內實邪濁。故五分云。諂心取財是	008	求 多 求  外 現 清 白  內 實 邪 濁  故 五 分 云  諂 心 取 財 是 
ZH_X42_0736_008:0833b06	盜也。立謂。只是今時齋講。說法轉經。專心求利。無長	008	盜 也  立 謂  只 是 今 時 齋 講  說 法 轉 經  專 心 求 利  無 長 
ZH_X42_0736_008:0833b07	福之心是也。四恐怖心者。立謂。有二種。初謂或說法	008	福 之 心 是 也  四 恐 怖 心 者  立 謂  有 二 種  初 謂 或 說 法 
ZH_X42_0736_008:0833b08	怖取者。謂說阿鼻地獄可畏等事。令他布施也。戒疏	008	怖 取 者  謂 說 阿鼻地獄 可 畏 等 事  令 他 布 施 也  戒 疏 
ZH_X42_0736_008:0833b09	云。或說地獄等惡報。或說云。官勢力而得財者是也。	008	云  或 說 地 獄 等 惡 報  或 說 云  官 勢 力 而 得 財 者 是 也  
ZH_X42_0736_008:0833b10	言或自懷疑怖者。立謂。向俗人云。貧道比來。多有病	008	言 或 自 懷 疑 怖 者  立 謂  向 俗 人 云  貧 道 比 來  多 有 病 
ZH_X42_0736_008:0833b11	苦。或精神恍惚。恐死不遠。心悕他物。以為湯藥等也。	008	苦  或 精 神 恍 惚  恐 死 不 遠  心 悕 他 物  以 為 湯 藥 等 也  
ZH_X42_0736_008:0833b12	六決定取者。立謂。如空處盜物是也。七寄物取以少	008	六 決 定 取 者  立 謂  如 空 處 盜 物 是 也  七 寄 物 取 以 少 
ZH_X42_0736_008:0833b13	還他者。立謂。如有人將物寄比丘。後或還他一半或	008	還 他 者  立 謂  如 有 人 將 物 寄 比 丘  後 或 還 他 一 半 或 
ZH_X42_0736_008:0833b14	少許。或全不還也。八恐怯取謂示身相者。立謂。張目	008	少 許  或 全 不 還 也  八 恐 怯 取 謂 示 身 相 者  立 謂  張 目 
ZH_X42_0736_008:0833b15	大聲。令他生怖。而與我物也。疏云。示以身相。令生怖	008	大 聲  令 他 生 怖  而 與 我 物 也  疏 云  示 以 身 相  令 生 怖 
ZH_X42_0736_008:0833b16	畏故。取彼財物。如十誦中。輕慢觝突而取他物是也。	008	畏 故  取 彼 財 物  如 十 誦 中  輕 慢 觝 突 而 取 他 物 是 也  
ZH_X42_0736_008:0833b17	九見便便取因利求利者。立謂。如落花師。為他說法。	008	九 見 便 便 取 因 利 求 利 者  立 謂  如 落 花 師  為 他 說 法  
ZH_X42_0736_008:0833b18	則取財物是也。心疏云。伺他慢藏。陽作陰伏之類也。	008	則 取 財 物 是 也  心 疏 云  伺 他 慢 藏  陽 作 陰 伏 之 類 也  
ZH_X42_0736_008:0833b19	深云。此謂見他睡時。迴眼則取也。言因利求利者。心	008	深 云  此 謂 見 他 睡 時  迴 眼 則 取 也  言 因 利 求 利 者  心 
ZH_X42_0736_008:0833b20	疏云。貪心規利。為財說法。即是以法利益前人心。求	008	疏 云  貪 心 規 利  為 財 說 法  即 是 以 法 利 益 前 人 心  求 
ZH_X42_0736_008:0833b21	財利也。慈云。如語他布施生天。令他得利。而得財者	008	財 利 也  慈 云  如 語 他 布 施 生 天  令 他 得 利  而 得 財 者 
ZH_X42_0736_008:0833b22	是也。	008	是 也  
ZH_X42_0736_008:0833b23	足得垣墻防擬妄境者。謂前件事相。約此為防護。不	008	足 得 垣 墻 防 擬 妄 境 者  謂 前 件 事 相  約 此 為 防 護  不 
ZH_X42_0736_008:0833b24	使毀犯。義言如垣墻也。如今垣墻。防其賊盜。今此戒	008	使 毀 犯  義 言 如 垣 墻 也  如 今 垣 墻  防 其 賊 盜  今 此 戒 
ZH_X42_0736_008:0833c01	相。亦謂防其盜過也。深云。無覆曰垣。有覆曰墻。應師	008	相  亦 謂 防 其 盜 過 也  深 云  無 覆 曰 垣  有 覆 曰 墻  應 師 
ZH_X42_0736_008:0833c02	云。垣即墻也。	008	云  垣 即 墻 也  
ZH_X42_0736_008:0833c03	上釋第三有盜心義。從此已下。第四正明是重物也。	008	上 釋 第 三 有 盜 心 義  從 此 已 下  第 四 正 明 是 重 物 也  
ZH_X42_0736_008:0833c04	答有三解者。立明。彼論中。自有問答。三解不同。	008	答 有 三 解 者  立 明  彼 論 中  自 有 問 答  三 解 不 同  
ZH_X42_0736_008:0833c05	初依彼王舍國法者。立明。佛問頻婆娑羅王。大王國	008	初 依 彼 王 舍 國 法 者  立 明  佛 問 頻婆娑羅 王  大 王 國 
ZH_X42_0736_008:0833c06	內。何罪令死。王言。婬他婦女。殺人。盜五錢已上。及於	008	內  何 罪 令 死  王 言  婬 他 婦 女  殺 人  盜 五 錢 已 上  及 於 
ZH_X42_0736_008:0833c07	大眾中妄語。作此四事。則犯死罪。佛因依此國法。制	008	大 眾 中 妄 語  作 此 四 事  則 犯 死 罪  佛 因 依 此 國 法  制 
ZH_X42_0736_008:0833c08	四重戒。此是初一解。約古大銅錢也。二隨有佛法處	008	四 重 戒  此 是 初 一 解  約 古 大 銅 錢 也  二 隨 有 佛 法 處 
ZH_X42_0736_008:0833c09	等者。立云。此解與上有異也。引直約隨國土所用。金	008	等 者  立 云  此 解 與 上 有 異 也  引 直 約 隨 國 土 所 用  金 
ZH_X42_0736_008:0833c10	銀銅鐵胡膠錫鑞竹木等錢。隨方土所用。五錢為限。	008	銀 銅 鐵 胡 膠 錫 鑞 竹 木 等 錢  隨 方 土 所 用  五 錢 為 限  
ZH_X42_0736_008:0833c11	又云依王舍國盜五錢得死罪等者。立云。此是第三	008	又 云 依 王 舍 國 盜 五 錢 得 死 罪 等 者  立 云  此 是 第 三 
ZH_X42_0736_008:0833c12	解也。謂隨方斷死罪為限。如王舍盜五犯死。約此而	008	解 也  謂 隨 方 斷 死 罪 為 限  如 王 舍 盜 五 犯 死  約 此 而 
ZH_X42_0736_008:0833c13	制。今此方若盜五未死者。不得依五斷犯重。要隨此	008	制  今 此 方 若 盜 五 未 死 者  不 得 依 五 斷 犯 重  要 隨 此 
ZH_X42_0736_008:0833c14	國。齊幾斷死。用為限也。今時此方。斷死不定。或時盜	008	國  齊 幾 斷 死  用 為 限 也  今 時 此 方  斷 死 不 定  或 時 盜 
ZH_X42_0736_008:0833c15	一丈斷死。或時盜一匹二匹。方斷死。豈得約此為定。	008	一 丈 斷 死  或 時 盜 一 匹 二 匹  方 斷 死  豈 得 約 此 為 定  
ZH_X42_0736_008:0833c16	雖然如此。此約斷死明也。若欲攝護宜從急也。下自	008	雖 然 如 此  此 約 斷 死 明 也  若 欲 攝 護 宜 從 急 也  下 自 
ZH_X42_0736_008:0833c17	明之。論師以後義應是者。依檢多論文云。盜至五錢	008	明 之  論 師 以 後 義 應 是 者  依 檢 多 論 文 云  盜 至 五 錢 
ZH_X42_0736_008:0833c18	得重罪者。初或言金錢。或言銀錢。或言銅錢。或言鐵	008	得 重 罪 者  初 或 言 金 錢  或 言 銀 錢  或 言 銅 錢  或 言 鐵 
ZH_X42_0736_008:0833c19	錢。無有定也。又云盜至五錢得夷者。謂閻浮提內。及	008	錢  無 有 定 也  又 云 盜 至 五 錢 得 夷 者  謂 閻 浮 提 內  及 
ZH_X42_0736_008:0833c20	東西二天下。有佛法處。准王舍國法。以五錢為限。又	008	東 西 二 天 下  有 佛 法 處  准 王 舍 國 法  以 五 錢 為 限  又 
ZH_X42_0736_008:0833c21	言五錢成重罪者。佛依王舍國法結戒。故限至五錢	008	言 五 錢 成 重 罪 者  佛 依 王 舍 國 法 結 戒  故 限 至 五 錢 
ZH_X42_0736_008:0833c22	結夷。如是各隨國法。依而制夷罪。觀律師意。以後義	008	結 夷  如 是 各 隨 國 法  依 而 制 夷 罪  觀 律 師 意  以 後 義 
ZH_X42_0736_008:0833c23	為定(文正此說)。立云。論文雖判後解為定。今鈔意取第二	008	為 定  文 正 此 說   立 云  論 文 雖 判 後 解 為 定  今 鈔 意 取 第 二 
ZH_X42_0736_008:0833c24	解。謂隨方用五錢為定義也。故戒疏云。多論文中。盜	008	解  謂 隨 方 用 五 錢 為 定 義 也  故 戒 疏 云  多 論 文 中  盜 
ZH_X42_0736_008:0834a01	相通濫。初解本錢。何由可曉(指論家三解中初解也)。後解隨國	008	相 通 濫  初 解 本 錢  何 由 可 曉  指 論 家 三 解 中 初 解 也   後 解 隨 國 
ZH_X42_0736_008:0834a02	現斷入死。言亦通濫。難可依承。如此唐律。強盜滿尺	008	現 斷 入 死  言 亦 通 濫  難 可 依 承  如 此 唐 律  強 盜 滿 尺 
ZH_X42_0736_008:0834a03	則是極刑。竊盜三十匹。罪至伇流。縱多盜者。不加至	008	則 是 極 刑  竊 盜 三 十 匹  罪 至 伇 流  縱 多 盜 者  不 加 至 
ZH_X42_0736_008:0834a04	死。論令准此。刑無死名。比丘多竊。少有強者。縱有強	008	死  論 令 准 此  刑 無 死 名  比 丘 多 竊  少 有 強 者  縱 有 強 
ZH_X42_0736_008:0834a05	奪。計尺死刑。盜五十匹。又非死例。准俗制道。盜相叵	008	奪  計 尺 死 刑  盜 五 十 匹  又 非 死 例  准 俗 制 道  盜 相 叵 
ZH_X42_0736_008:0834a06	論。如僧祇云。王無定法。斷盜不定。若依四分。但云五	008	論  如 僧 祇 云  王 無 定 法  斷 盜 不 定  若 依 四 分  但 云 五 
ZH_X42_0736_008:0834a07	錢。錢則八種。並同一制。可如多論中間一解。隨國用	008	錢  錢 則 八 種  並 同 一 制  可 如 多 論 中 間 一 解  隨 國 用 
ZH_X42_0736_008:0834a08	錢准五為限。則諍論自息也。	008	錢 准 五 為 限  則 諍 論 自 息 也  
ZH_X42_0736_008:0834a09	律論互釋不同者。立謂。諸律與論。釋此錢數多少不	008	律 論 互 釋 不 同 者  立 謂  諸 律 與 論  釋 此 錢 數 多 少 不 
ZH_X42_0736_008:0834a10	同也。多論雖有三解。未可全依。十誦古大銅錢。誠難	008	同 也  多 論 雖 有 三 解  未 可 全 依  十 誦 古 大 銅 錢  誠 難 
ZH_X42_0736_008:0834a11	可准。祇文四錢三角。固不可承。以善見解云。還同五	008	可 准  祇 文 四 錢 三 角  固 不 可 承  以 善 見 解 云  還 同 五 
ZH_X42_0736_008:0834a12	錢故也。今則取四分為定。謂隨方用五錢處。盜五結	008	錢 故 也  今 則 取 四 分 為 定  謂 隨 方 用 五 錢 處  盜 五 結 
ZH_X42_0736_008:0834a13	重。與多論中三解第二稍同。不取前諸律論文也。判	008	重  與 多 論 中 三 解 第 二 稍 同  不 取 前 諸 律 論 文 也  判 
ZH_X42_0736_008:0834a14	罪宜通攝護從急者。立謂。若斷他犯。可從寬通以斷	008	罪 宜 通 攝 護 從 急 者  立 謂  若 斷 他 犯  可 從 寬 通 以 斷 
ZH_X42_0736_008:0834a15	之。若自護從急。下至草葉等也。	008	之  若 自 護 從 急  下 至 草 葉 等 也  
ZH_X42_0736_008:0834a16	十誦彼云盜五者。即古大銅錢。一文當此十六文也。	008	十 誦 彼 云 盜 五 者  即 古 大 銅 錢  一 文 當 此 十 六 文 也  
ZH_X42_0736_008:0834a17	計彼五文。當今八十文。豈得依彼為定。宜依當處五	008	計 彼 五 文  當 今 八 十 文  豈 得 依 彼 為 定  宜 依 當 處 五 
ZH_X42_0736_008:0834a18	文也。	008	文 也  
ZH_X42_0736_008:0834a19	僧祇王無定法斷盜不定當取瓶沙古法四錢三角	008	僧 祇 王 無 定 法 斷 盜 不 定 當 取 瓶 沙 古 法 四 錢 三 角 
ZH_X42_0736_008:0834a20	重者。依檢僧祇云。佛問瓶沙王法。大王治國。盜齊幾	008	重 者  依 檢 僧 祇 云  佛 問 瓶 沙 王 法  大 王 治 國  盜 齊 幾 
ZH_X42_0736_008:0834a21	錢至死。王答佛曰。十九錢為一罽利沙槃。一罽利沙	008	錢 至 死  王 答 佛 曰  十 九 錢 為 一 罽 利 沙 槃  一 罽 利 沙 
ZH_X42_0736_008:0834a22	槃。分為四分。若取一分。若取直一分。罪應至死。今隨	008	槃  分 為 四 分  若 取 一 分  若 取 直 一 分  罪 應 至 死  今 隨 
ZH_X42_0736_008:0834a23	所盜。義以此為准。准此廢上律論以後為勝者。立謂。	008	所 盜  義 以 此 為 准  准 此 廢 上 律 論 以 後 為 勝 者  立 謂  
ZH_X42_0736_008:0834a24	上多論三解。及十誦古大銅錢此並太寬。今故廢不	008	上 多 論 三 解  及 十 誦 古 大 銅 錢 此 並 太 寬  今 故 廢 不 
ZH_X42_0736_008:0834b01	用也。宜依五分。五錢為勝。與上多論第二師解同。縱	008	用 也  宜 依 五 分  五 錢 為 勝  與 上 多 論 第 二 師 解 同  縱 
ZH_X42_0736_008:0834b02	四錢三角。善見解之亦同五錢者。案祇中。十九錢為	008	四 錢 三 角  善 見 解 之 亦 同 五 錢 者  案 祇 中  十 九 錢 為 
ZH_X42_0736_008:0834b03	一罽利沙槃分。一罽沙槃分為四分。若取一分犯夷。	008	一 罽 利 沙 槃 分  一 罽 沙 槃 分 為 四 分  若 取 一 分 犯 夷  
ZH_X42_0736_008:0834b04	案見論文云。五摩娑迦為一分者。爾時王舍城二十	008	案 見 論 文 云  五 摩 娑 迦 為 一 分 者  爾 時 王 舍 城 二 十 
ZH_X42_0736_008:0834b05	摩娑迦。成一迦利娑槃分。迦利娑槃為四分。一分是	008	摩 娑 迦  成 一 迦 利 娑 槃 分  迦 利 娑 槃 為 四 分  一 分 是 
ZH_X42_0736_008:0834b06	五摩娑迦。若盜滿五摩娑迦犯夷。	008	五 摩 娑 迦  若 盜 滿 五 摩 娑 迦 犯 夷  
ZH_X42_0736_008:0834b07	善見若堈中等者。立謂。引此文意。證前攝護宜急。斷	008	善 見 若 堈 中 等 者  立 謂  引 此 文 意  證 前 攝 護 宜 急  斷 
ZH_X42_0736_008:0834b08	罪宜寬文也。又觀五事等者。案見論云。智慧律師。為	008	罪 宜 寬 文 也  又 觀 五 事 等 者  案 見 論 云  智 慧 律 師  為 
ZH_X42_0736_008:0834b09	他判罪。應觀五處。然後判斷。一處。二時。三新。四故。五	008	他 判 罪  應 觀 五 處  然 後 判 斷  一 處  二 時  三 新  四 故  五 
ZH_X42_0736_008:0834b10	等。初言處者。立謂。此處盜。彼處貿。依本盜處所直結	008	等  初 言 處 者  立 謂  此 處 盜  彼 處 貿  依 本 盜 處 所 直 結 
ZH_X42_0736_008:0834b11	罪。二時者。立謂。貴時盜。賤時貨。或賤時盜。貴時貨。亦	008	罪  二 時 者  立 謂  貴 時 盜  賤 時 貨  或 賤 時 盜  貴 時 貨  亦 
ZH_X42_0736_008:0834b12	依本盜時價結罪。三新者。謂盜時新。貨時故。亦依本	008	依 本 盜 時 價 結 罪  三 新 者  謂 盜 時 新  貨 時 故  亦 依 本 
ZH_X42_0736_008:0834b13	新。四故者。反上新義也。五等者。謂盜得時。及賣時。物	008	新  四 故 者  反 上 新 義 也  五 等 者  謂 盜 得 時  及 賣 時  物 
ZH_X42_0736_008:0834b14	價既等。還依此等數斷也。	008	價 既 等  還 依 此 等 數 斷 也  
ZH_X42_0736_008:0834b15	十誦伽論錢有貴賤時不妨錢貴盜一入重者。十誦	008	十 誦 伽 論 錢 有 貴 賤 時 不 妨 錢 貴 盜 一 入 重 者  十 誦 
ZH_X42_0736_008:0834b16	憂波離問佛。頗有盜三錢犯夷耶。佛言錢貴時。又問	008	憂 波 離 問 佛  頗 有 盜 三 錢 犯 夷 耶  佛 言 錢 貴 時  又 問 
ZH_X42_0736_008:0834b17	頗有盜五錢不犯夷耶。佛言有錢賤時。言遇值賤時	008	頗 有 盜 五 錢 不 犯 夷 耶  佛 言 有 錢 賤 時  言 遇 值 賤 時 
ZH_X42_0736_008:0834b18	百千犯輕者。立明。如今木皮鐵錢。時所不用。盜但得	008	百 千 犯 輕 者  立 明  如 今 木 皮 鐵 錢  時 所 不 用  盜 但 得 
ZH_X42_0736_008:0834b19	蘭。	008	蘭  
