segmentnr	original	folio	analyzed
ZH_X25_0510_001:0912b08	悟問意。故告之曰。凡一切色身外相。皆是虗妄不	001	悟 問 意  故 告 之 曰  凡 一 切 色 身 外 相  皆 是 虗 妄 不 
ZH_X25_0510_001:0912b09	寔。所謂有形終歸壞。無相乃名真也。乃習丹道者。	001	寔  所 謂 有 形 終 歸 壞  無 相 乃 名 真 也  乃 習 丹 道 者  
ZH_X25_0510_001:0912b10	專在色身上摸索。縱活千年。終歸於盡。究何益哉。	001	專 在 色 身 上 摸 索  縱 活 千 年  終 歸 於 盡  究 何 益 哉  
ZH_X25_0510_001:0912b11	若見諸相非相。則見如來。若人見一切色相。而不	001	若 見 諸 相 非 相  則 見 如 來  若 人 見 一 切 色 相  而 不 
ZH_X25_0510_001:0912b12	存有相之見。即能見真性如來矣。	001	存 有 相 之 見  即 能 見 真 性 如 來 矣  
ZH_X25_0510_001:0912b13	○正信希有分第六言人聞此經典。而能諦信不	001	 正 信 希 有 分 第 六 言 人 聞 此 經 典  而 能 諦 信 不 
ZH_X25_0510_001:0912b14	疑。是人善根深厚。方得具此正信。真乃希有之士	001	疑  是 人 善 根 深 厚  方 得 具 此 正 信  真 乃 希 有 之 士 
ZH_X25_0510_001:0912b15	也。	001	也  
ZH_X25_0510_001:0912b16	須菩提白佛言。世尊。頗有眾生。得聞如是言說章句。	001	須 菩 提 白 佛 言  世 尊  頗 有 眾 生  得 聞 如 是 言 說 章 句  
ZH_X25_0510_001:0912b17	生實信不。須菩提意謂。今我等親炙於佛。得聞如	001	生 實 信 不  須 菩 提 意 謂  今 我 等 親 炙 於 佛  得 聞 如 
ZH_X25_0510_001:0912b18	是之妙法。固應諦信遵行。第恐後之聞者。未必遂	001	是 之 妙 法  固 應 諦 信 遵 行  第 恐 後 之 聞 者  未 必 遂 
ZH_X25_0510_001:0912b19	能生信。故啟白於佛。而言將來頗復有人得聞佛	001	能 生 信  故 啟 白 於 佛  而 言 將 來 頗 復 有 人 得 聞 佛 
ZH_X25_0510_001:0912b20	說如是妙法之章句。亦能不滋疑懼。而生真寔信	001	說 如 是 妙 法 之 章 句  亦 能 不 滋 疑 懼  而 生 真 寔 信 
ZH_X25_0510_001:0912b21	心否。	001	心 否  
ZH_X25_0510_001:0912b22	佛告須菩提。莫作是說。佛以聖賢雖不常有。然佛	001	佛 告 須 菩 提  莫 作 是 說  佛 以 聖 賢 雖 不 常 有  然 佛 
ZH_X25_0510_001:0912b23	法豈遂滅絕。何可蔑視將來。遂無人信受。故告須	001	法 豈 遂 滅 絕  何 可 蔑 視 將 來  遂 無 人 信 受  故 告 須 
ZH_X25_0510_001:0912b24	菩提曰。汝莫漫作是說。	001	菩 提 曰  汝 莫 漫 作 是 說  
ZH_X25_0510_001:0912c01	如來滅後。後五百歲。有持戒修福者。五百歲有五	001	如來滅後  後 五 百 歲  有 持 戒 修 福 者  五 百 歲 有 五 
ZH_X25_0510_001:0912c02	個。盖言運會變遷之期也。言雖如來入滅之後。最	001	個  盖 言 運 會 變 遷 之 期 也  言 雖 如 來 入 滅 之 後  最 
ZH_X25_0510_001:0912c03	後五百歲中。必有大心凡夫。能擔荷大乘正法。而	001	後 五 百 歲 中  必 有 大 心 凡 夫  能 擔 荷 大 乘 正 法  而 
ZH_X25_0510_001:0912c04	堅持戒律。勤修福德者焉。此如來。佛自謂也。	001	堅 持 戒 律  勤 修 福 德 者 焉  此 如 來  佛 自 謂 也  
ZH_X25_0510_001:0912c05	於此章句。能生信心。以此為實。是人於我今所說	001	於 此 章 句  能 生 信 心  以 此 為 實  是 人 於 我 今 所 說 
ZH_X25_0510_001:0912c06	之章句。聞之而必能生正信之心。以我此言為真	001	之 章 句  聞 之 而 必 能 生 正 信 之 心  以 我 此 言 為 真 
ZH_X25_0510_001:0912c07	寔非誑。	001	寔 非 誑  
ZH_X25_0510_001:0912c08	當知是人。不於一佛二佛三四五佛而種善根。已於	001	當 知 是 人  不 於 一 佛 二 佛 三 四 五 佛 而 種 善 根  已 於 
ZH_X25_0510_001:0912c09	無量千萬佛所。種諸善根。然此聞而生信者。寔非	001	無 量 千 萬 佛 所  種 諸 善 根  然 此 聞 而 生 信 者  寔 非 
ZH_X25_0510_001:0912c10	根行淺薄之徒。當知此人。已曾歷劫薰修。善根深	001	根 行 淺 薄 之 徒  當 知 此 人  已 曾 歷 劫 薰 修  善 根 深 
ZH_X25_0510_001:0912c11	厚。且不僅於一佛二佛。以至四五佛處。種植善根	001	厚  且 不 僅 於 一 佛 二 佛  以 至 四 五 佛 處  種 植 善 根 
ZH_X25_0510_001:0912c12	而來曾於無量佛所。種植善根而來矣。	001	而 來 曾 於 無 量 佛 所  種 植 善 根 而 來 矣  
ZH_X25_0510_001:0912c13	聞是章句。乃至一念生淨信者。惟其善根深植。故	001	聞 是 章 句  乃 至 一 念 生 淨 信 者  惟 其 善 根 深 植  故 
ZH_X25_0510_001:0912c14	聞我說如是之章句。而即生信心焉。然是人則固	001	聞 我 說 如 是 之 章 句  而 即 生 信 心 焉  然 是 人 則 固 
ZH_X25_0510_001:0912c15	善根深植矣。抑知更有一念之頃。聞說是法。能生	001	善 根 深 植 矣  抑 知 更 有 一 念 之 頃  聞 說 是 法  能 生 
ZH_X25_0510_001:0912c16	真淨信心者。其所植善根。亦非淺鮮。	001	真 淨 信 心 者  其 所 植 善 根  亦 非 淺 鮮  
ZH_X25_0510_001:0912c17	須菩提。如來悉知悉見。是諸眾生。得如是無量福德。	001	須 菩 提  如 來 悉 知 悉 見  是 諸 眾 生  得 如 是 無量福德  
ZH_X25_0510_001:0912c18	佛呼須菩提而言。彼聞法生信者。佛以智慧覺照。	001	佛 呼 須 菩 提 而 言  彼 聞 法 生 信 者  佛 以 智 慧 覺 照  
ZH_X25_0510_001:0912c19	盡能知見此等眾生。以善根深植之故。必能各如	001	盡 能 知 見 此 等 眾 生  以 善 根 深 植 之 故  必 能 各 如 
ZH_X25_0510_001:0912c20	其信心而得福德。皆無量矣。所謂信心生一念。諸	001	其 信 心 而 得 福 德  皆 無 量 矣  所 謂 信 心 生 一 念  諸 
ZH_X25_0510_001:0912c21	佛盡皆知也。	001	佛 盡 皆 知 也  
ZH_X25_0510_001:0912c22	何以故。夫聞法生信。而獲福無量者。果何故哉。	001	何 以 故  夫 聞 法 生 信  而 獲 福 無 量 者  果 何 故 哉  
ZH_X25_0510_001:0912c23	是諸眾生。無復我相。人相。眾生相。壽者相。盖此等	001	是 諸 眾 生  無 復 我 相  人 相  眾 生 相  壽 者 相  盖 此 等 
ZH_X25_0510_001:0912c24	眾生。由善根深植。已探法要。而其心已不復有我	001	眾 生  由 善 根 深 植  已 探 法 要  而 其 心 已 不 復 有 我 
ZH_X25_0510_001:0913a01	人等四相之見矣。	001	人 等 四 相 之 見 矣  
ZH_X25_0510_001:0913a02	無法相。亦無非法相。是人不惟不著我人等相。并	001	無 法 相  亦 無 非 法 相  是 人 不 惟 不 著 我 人 等 相  并 
ZH_X25_0510_001:0913a03	不於正法而生取執之相。亦不以非法而生舍離	001	不 於 正 法 而 生 取 執 之 相  亦 不 以 非 法 而 生 舍 離 
ZH_X25_0510_001:0913a04	之相。心境如如絕無纖翳。	001	之 相  心 境 如 如 絕 無 纖 翳  
ZH_X25_0510_001:0913a05	何以故。夫其諸相永離者。此何故哉。	001	何 以 故  夫 其 諸 相 永 離 者  此 何 故 哉  
ZH_X25_0510_001:0913a06	是諸眾生。若心取相。則為著。我人眾生壽者。盖此	001	是 諸 眾 生  若 心 取 相  則 為 著  我 人 眾 生 壽 者  盖 此 
ZH_X25_0510_001:0913a07	等眾生。其心若於一處而生取著之相。則一著。永	001	等 眾 生  其 心 若 於 一 處 而 生 取 著 之 相  則 一 著  永 
ZH_X25_0510_001:0913a08	著即為著我人等四相者矣。	001	著 即 為 著 我 人 等 四 相 者 矣  
ZH_X25_0510_001:0913a09	若取法相。即著我人眾生壽者。言不惟餘相不應	001	若 取 法 相  即 著 我 人 眾 生 壽 者  言 不 惟 餘 相 不 應 
ZH_X25_0510_001:0913a10	取著。乃至正法。雖固由之入道。於此而若生取執。	001	取 著  乃 至 正 法  雖 固 由 之 入 道  於 此 而 若 生 取 執  
ZH_X25_0510_001:0913a11	則亦猶著我人等四相矣。	001	則 亦 猶 著 我 人 等 四 相 矣  
ZH_X25_0510_001:0913a12	何以故。若取非法相。即著我人眾生壽者。夫所謂	001	何 以 故  若 取 非 法 相  即 著 我 人 眾 生 壽 者  夫 所 謂 
ZH_X25_0510_001:0913a13	一切離相者。果何故哉。盖取執即能害道。不惟正	001	一 切 離 相 者  果 何 故 哉  盖 取 執 即 能 害 道  不 惟 正 
ZH_X25_0510_001:0913a14	法不宜取著即非法亦不宜生厭離。若以非法而	001	法 不 宜 取 著 即 非 法 亦 不 宜 生 厭 離  若 以 非 法 而 
ZH_X25_0510_001:0913a15	生厭離之心。則為取非法相。既有此相。即亦猶著	001	生 厭 離 之 心  則 為 取 非 法 相  既 有 此 相  即 亦 猶 著 
ZH_X25_0510_001:0913a16	夫四相也。	001	夫 四 相 也  
ZH_X25_0510_001:0913a17	是故。不應取法。不應取非法。以故學道之人。其心	001	是 故  不 應 取 法  不 應 取 非 法  以 故 學 道 之 人  其 心 
ZH_X25_0510_001:0913a18	不應以正法而生取著。尤不應以非法而生厭離。	001	不 應 以 正 法 而 生 取 著  尤 不 應 以 非 法 而 生 厭 離  
ZH_X25_0510_001:0913a19	二者皆為著相。故皆不應取。	001	二 者 皆 為 著 相  故 皆 不 應 取  
ZH_X25_0510_001:0913a20	以是義故。如來常說汝等比丘。知我說法。如筏喻者。	001	以是義故  如 來 常 說 汝 等 比 丘  知 我 說 法  如 筏 喻 者  
ZH_X25_0510_001:0913a21	夫以不應著相之故。故我常向汝等比丘說。須知。	001	夫 以 不 應 著 相 之 故  故 我 常 向 汝 等 比 丘 說  須 知  
ZH_X25_0510_001:0913a22	我平日。為汝等說法。不過為人解粘去縛。曾無寔	001	我 平 日  為 汝 等 說 法  不 過 為 人 解 粘 去 縛  曾 無 寔 
ZH_X25_0510_001:0913a23	法與人。正如以筏度人之喻。不可便認以為真法。	001	法 與 人  正 如 以 筏 度 人 之 喻  不 可 便 認 以 為 真 法  
ZH_X25_0510_001:0913a24	而生取執也。筏者。竹簰。所以濟渡。經云。過河須用	001	而 生 取 執 也  筏 者  竹 簰  所 以 濟 渡  經 云  過 河 須 用 
ZH_X25_0510_001:0913b01	筏。到岸不須船。以喻如來說法度人。既已得悟。法	001	筏  到 岸 不 須 船  以 喻 如 來 說 法 度 人  既 已 得 悟  法 
ZH_X25_0510_001:0913b02	亦應舍離也。	001	亦 應 舍 離 也  
ZH_X25_0510_001:0913b03	法尚應捨。何況非法。學者於聞法悟道之後。即正	001	法 尚 應 捨  何 況 非 法  學 者 於 聞 法 悟 道 之 後  即 正 
ZH_X25_0510_001:0913b04	法尚當捨離。方免礙道。何況本非正法。可不急捨。	001	法 尚 當 捨 離  方 免 礙 道  何 況 本 非 正 法  可 不 急 捨  
ZH_X25_0510_001:0913b05	而存計議乎。	001	而 存 計 議 乎  
ZH_X25_0510_001:0913b06	○無得無說分第七言如來在昔聞法證果。雖有	001	 無 得 無 說 分 第 七 言 如 來 在 昔 聞 法 證 果  雖 有 
ZH_X25_0510_001:0913b07	得而寔無得。即今說法度人。亦有說而寔無說。總	001	得 而 寔 無 得  即 今 說 法 度 人  亦 有 說 而 寔 無 說  總 
ZH_X25_0510_001:0913b08	欲破人執相之見耳。	001	欲 破 人 執 相 之 見 耳  
ZH_X25_0510_001:0913b09	須菩提。於意云何。此如來反復破人著。相之見故	001	須 菩 提  於意云何  此 如 來 反 復 破 人 著  相 之 見 故 
ZH_X25_0510_001:0913b10	復以己躬下事示人。堅人深信。因呼須菩提而告	001	復 以 己 躬 下 事 示 人  堅 人 深 信  因 呼 須 菩 提 而 告 
ZH_X25_0510_001:0913b11	之曰。於汝意中以為何如耶。	001	之 曰  於 汝 意 中 以 為 何 如 耶  
ZH_X25_0510_001:0913b12	如來得阿耨多羅三藐三菩提耶。如來有所說法耶。	001	如 來 得阿耨多羅三藐三菩提 耶  如 來 有 所 說 法 耶  
ZH_X25_0510_001:0913b13	此如來。佛自謂也。言我在昔歷劫修行。得成正覺。	001	此 如 來  佛 自 謂 也  言 我 在 昔 歷 劫 修 行  得 成 正 覺  
ZH_X25_0510_001:0913b14	豈真有無上正等正覺之法可得耶。即今與汝等	001	豈 真 有 無 上 正 等 正 覺 之 法 可 得 耶  即 今 與 汝 等 
ZH_X25_0510_001:0913b15	隨宜說法。又豈有寔法可與人耶。佛致詰辭。總欲	001	隨宜說法  又 豈 有 寔 法 可 與 人 耶  佛 致 詰 辭  總 欲 
ZH_X25_0510_001:0913b16	破人執著。之見耳。	001	破 人 執 著  之 見 耳  
ZH_X25_0510_001:0913b17	須菩提言。如我解佛所說義。無有定法名阿耨多羅	001	須 菩 提 言  如 我 解 佛 所 說 義  無 有 定 法 名 阿 耨 多 羅 
ZH_X25_0510_001:0913b18	三藐三菩提。解。去聲。後同。○解悟也。須菩提了解	001	三藐三菩提  解  去 聲  後 同   解 悟 也  須 菩 提 了 解 
ZH_X25_0510_001:0913b19	佛旨。故言我今解悟佛語。之意。寔無有一定呆法。	001	佛 旨  故 言 我 今 解 悟 佛 語  之 意  寔 無 有 一 定 呆 法  
ZH_X25_0510_001:0913b20	可名之為無上正等正覺而盡人皆堪修證者。盖	001	可 名 之 為 無 上 正 等 正 覺 而 盡 人 皆 堪 修 證 者  盖 
ZH_X25_0510_001:0913b21	修行證果。各有時節因緣。如一方決不能療萬病	001	修 行 證 果  各 有 時 節 因 緣  如 一 方 決 不 能 療 萬 病 
ZH_X25_0510_001:0913b22	也。	001	也  
ZH_X25_0510_001:0913b23	亦無有定法如來可說。夫既無定法可名。亦自無	001	亦 無 有 定 法 如 來 可 說  夫 既 無 定 法 可 名  亦 自 無 
ZH_X25_0510_001:0913b24	定法可說。	001	定 法 可 說  
ZH_X25_0510_001:0913c01	何以故。如來所說法。皆不可取。不可說。夫所謂法	001	何 以 故  如 來 所 說 法  皆 不 可 取  不 可 說  夫 所 謂 法 
ZH_X25_0510_001:0913c02	無定向者。此何故哉。盖我佛所說之法。固皆度人	001	無 定 向 者  此 何 故 哉  盖 我 佛 所 說 之 法  固 皆 度 人 
ZH_X25_0510_001:0913c03	之具。然不可心生取著。而成法縛。惟當心領神會。	001	之 具  然 不 可 心 生 取 著  而 成 法 縛  惟 當 心 領 神 會  
ZH_X25_0510_001:0913c04	不堪吐露向人。	001	不 堪 吐 露 向 人  
ZH_X25_0510_001:0913c05	非法非非法。法無定相。故云非法。然如來說法利	001	非 法 非 非 法  法 無 定 相  故 云 非 法  然 如 來 說 法 利 
ZH_X25_0510_001:0913c06	生。普令得度。不可謂之無法故云非非法。	001	生  普 令 得 度  不 可 謂 之 無 法 故 云 非 非 法  
ZH_X25_0510_001:0913c07	所以者何。一切賢聖。皆以無為法而有差別。差音	001	所以者何  一 切 賢 聖  皆 以 無 為 法 而有差別  差 音 
ZH_X25_0510_001:0913c08	雌。○自阿那含以下為賢。阿羅漢以上為聖。世間	001	雌   自 阿 那 含 以 下 為 賢  阿 羅 漢 以 上 為 聖  世 間 
ZH_X25_0510_001:0913c09	為有為法。皆係識神用事。出世為無為法。因任自	001	為 有 為 法  皆 係 識 神 用 事  出 世 為 無 為 法  因 任 自 
ZH_X25_0510_001:0913c10	然。無處用力。差等差也。言所以謂法無定者何哉。	001	然  無 處 用 力  差 等 差 也  言 所 以 謂 法 無 定 者 何 哉  
ZH_X25_0510_001:0913c11	盖一切出世賢聖。莫不皆由無為正法而證道。但	001	盖 一 切 出 世 賢 聖  莫 不 皆 由 無 為 正 法 而 證 道  但 
ZH_X25_0510_001:0913c12	其根性有淺深。故證果亦有差別耳。	001	其 根 性 有 淺 深  故 證 果 亦 有 差 別 耳  
ZH_X25_0510_001:0913c13	○依法出生分第八謂以此經法修持。自利利人	001	 依 法 出 生 分 第 八 謂 以 此 經 法 修 持  自 利 利 人 
ZH_X25_0510_001:0913c14	即能出離羣生於濁世。而徑登彼岸矣。	001	即 能 出 離 羣 生 於 濁 世  而 徑 登 彼 岸 矣  
ZH_X25_0510_001:0913c15	須菩提。於意云何。佛欲顯持經獲福之勝。故呼須	001	須 菩 提  於意云何  佛 欲 顯 持 經 獲 福 之 勝  故 呼 須 
ZH_X25_0510_001:0913c16	菩提而告之曰。於汝意中以為何如耶。	001	菩 提 而 告 之 曰  於 汝 意 中 以 為 何 如 耶  
ZH_X25_0510_001:0913c17	若人滿三千大千世界七寶。以用布施。三千大千	001	若 人 滿 三千大千世界 七 寶  以用布施  三千大千 
ZH_X25_0510_001:0913c18	世界。乃一佛教化之所。盖一個日月運行之所。為	001	世 界  乃 一 佛 教 化 之 所  盖 一 個 日 月 運 行 之 所  為 
ZH_X25_0510_001:0913c19	一世界。如此千個世界。為一個小千世界。一千個	001	一 世 界  如 此 千 個 世 界  為 一 個 小千世界  一 千 個 
ZH_X25_0510_001:0913c20	小千世界。為一個中千世界。一千個中千世界。為	001	小千世界  為 一 個 中千世界  一 千 個 中千世界  為 
ZH_X25_0510_001:0913c21	一個大千世界。所謂三千大千者。乃舉小千中千	001	一 個 大千世界  所 謂 三千大千 者  乃 舉 小 千 中 千 
ZH_X25_0510_001:0913c22	大千而言。寔則一個大千世界也。七寶。謂金。銀。琉	001	大 千 而 言  寔 則 一 個 大千世界 也  七 寶  謂 金  銀  琉 
ZH_X25_0510_001:0913c23	璃。玻璃。車渠。赤珠。馬腦也。言若有人布滿大千世	001	璃  玻 璃  車 渠  赤 珠  馬 腦 也  言 若 有 人 布 滿 大 千 世 
ZH_X25_0510_001:0913c24	界七寶。而以之布施邀福。則所施甚大矣。	001	界 七 寶  而 以 之 布 施 邀 福  則 所 施 甚 大 矣  
ZH_X25_0510_001:0914a01	是人所得福德。甯為多不。甯猶詎也。言是人布施	001	是 人 所 得 福 德  甯 為 多 不  甯 猶 詎 也  言 是 人 布 施 
ZH_X25_0510_001:0914a02	如此之大。其所得福報。詎多否耶。	001	如 此 之 大  其 所 得 福 報  詎 多 否 耶  
ZH_X25_0510_001:0914a03	須菩提言。甚多。世尊。須菩提以此人布施之大。則	001	須 菩 提 言  甚 多  世 尊  須 菩 提 以 此 人 布 施 之 大  則 
ZH_X25_0510_001:0914a04	其獲福固應無量。故以甚多答之。	001	其 獲 福 固 應 無 量  故 以 甚 多 答 之  
ZH_X25_0510_001:0914a05	何以故。是福德即非福德性。是故如來說福德多。	001	何 以 故  是 福 德 即 非 福 德 性  是 故 如 來 說 福 德 多  
ZH_X25_0510_001:0914a06	福。德性。自性福德也。盖依經修證。見自本性乃為	001	福  德 性  自 性 福 德 也  盖 依 經 修 證  見 自 本 性 乃 為 
ZH_X25_0510_001:0914a07	自性福德。言所謂寶施得福之多者。何哉。但因離	001	自 性 福 德  言 所 謂 寶 施 得 福 之 多 者  何 哉  但 因 離 
ZH_X25_0510_001:0914a08	性布施。僅得有為福德。而非見性福德。此乃如來	001	性 布 施  僅 得 有 為 福 德  而 非 見 性 福 德  此 乃 如 來 
ZH_X25_0510_001:0914a09	所說福德多之意也。	001	所 說 福 德 多 之 意 也  
ZH_X25_0510_001:0914a10	若復有人。於此經中受持。乃至四句偈等。偈。音計。	001	若 復 有 人  於 此 經 中 受 持  乃 至 四 句 偈 等  偈  音 計  
ZH_X25_0510_001:0914a11	○持者。執持不捨之意。偈。猶詩也。佛言若更有人。	001	 持 者  執 持 不 捨 之 意  偈  猶 詩 也  佛 言 若 更 有 人  
ZH_X25_0510_001:0914a12	而不求有為福德。惟修見性工夫。能於我所說此	001	而 不 求 有 為 福 德  惟 修 見 性 工 夫  能 於 我 所 說 此 
ZH_X25_0510_001:0914a13	經之章句。受持讀誦。雖至少而僅持四句偈等。自	001	經 之 章 句  受持讀誦  雖 至 少 而 僅 持 四 句 偈 等  自 
ZH_X25_0510_001:0914a14	來言四句偈者。聚訟紛紜。迄無定論。有謂指無我	001	來 言 四 句 偈 者  聚 訟 紛 紜  迄 無 定 論  有 謂 指 無 我 
ZH_X25_0510_001:0914a15	相四句者。有謂凡所有相四句者。有謂若以色見	001	相 四 句 者  有 謂 凡 所 有 相 四 句 者  有 謂 若 以 色 見 
ZH_X25_0510_001:0914a16	我四句者。有謂一切有為法四句者。所指雖殊。總	001	我 四 句 者  有 謂 一 切 有 為 法 四 句 者  所 指 雖 殊  總 
ZH_X25_0510_001:0914a17	不出無相之旨。究有何異。而必欲爭執彼此哉。況	001	不 出 無 相 之 旨  究 有 何 異  而 必 欲 爭 執 彼 此 哉  況 
ZH_X25_0510_001:0914a18	此經正破執相。乃於四句偈而反欲指以寔之。是	001	此 經 正 破 執 相  乃 於 四 句 偈 而 反 欲 指 以 寔 之  是 
ZH_X25_0510_001:0914a19	破相而仍著相也。惡乎可。或又謂佛秘而不言者。	001	破 相 而 仍 著 相 也  惡 乎 可  或 又 謂 佛 秘 而 不 言 者  
ZH_X25_0510_001:0914a20	是大不然。試思佛說三藏十二部。多方指示。乃於	001	是 大 不 然  試 思 佛 說 三 藏 十 二 部  多 方 指 示  乃 於 
ZH_X25_0510_001:0914a21	四句偈而獨秘之。有是理哉。按經中凡言四句偈	001	四 句 偈 而 獨 秘 之  有 是 理 哉  按 經 中 凡 言 四 句 偈 
ZH_X25_0510_001:0914a22	者。上則有乃至字。下則有等字。細玩語意。所謂乃	001	者  上 則 有 乃 至 字  下 則 有 等 字  細 玩 語 意  所 謂 乃 
ZH_X25_0510_001:0914a23	至等者。盖少之之辭。言雖少而乃至四句偈耳。此	001	至 等 者  盖 少 之 之 辭  言 雖 少 而 乃 至 四 句 偈 耳  此 
ZH_X25_0510_001:0914a24	特泛言之也。顧欲磪指以寔之。不與無相之經旨。	001	特 泛 言 之 也  顧 欲 磪 指 以 寔 之  不 與 無 相 之 經 旨  
ZH_X25_0510_001:0914b01	相拂戾哉。不可以不辯。	001	相 拂 戾 哉  不 可 以 不 辯  
ZH_X25_0510_001:0914b02	為他人說。其福勝彼。言若人既自持經獲益。又能	001	為 他 人 說  其 福 勝 彼  言 若 人 既 自 持 經 獲 益  又 能 
ZH_X25_0510_001:0914b03	推己及人。為人講說。而化導之。則修證功深。自他	001	推 己 及 人  為 人 講 說  而 化 導 之  則 修 證 功 深  自 他 
ZH_X25_0510_001:0914b04	俱利。視彼寶施之福德。固不侔矣。盖寶施獲福固	001	俱 利  視 彼 寶 施 之 福 德  固 不 侔 矣  盖 寶 施 獲 福 固 
ZH_X25_0510_001:0914b05	為多。然徒增頑福。難出輪迴。譬如無量家資。而坐	001	為 多  然 徒 增 頑 福  難 出 輪 迴  譬 如 無 量 家 資  而 坐 
ZH_X25_0510_001:0914b06	享銷耗。財雖多。終有。竭也持誦經文雖甚少。然半	001	享 銷 耗  財 雖 多  終 有  竭 也 持 誦 經 文 雖 甚 少  然 半 
ZH_X25_0510_001:0914b07	偈明心。頓超塵劫。譬如為山累土。而日漸增高。力	001	偈 明 心  頓 超 塵 劫  譬 如 為 山 累 土  而 日 漸 增 高  力 
ZH_X25_0510_001:0914b08	雖微。終有成也。兩兩相形。其為優劣。不待智者而	001	雖 微  終 有 成 也  兩 兩 相 形  其 為 優 劣  不 待 智 者 而 
ZH_X25_0510_001:0914b09	明矣佛慈明誨。可不信行。哉。	001	明 矣 佛 慈 明 誨  可 不 信 行  哉  
ZH_X25_0510_001:0914b10	何以故。須菩提。一切諸佛。及諸佛阿耨多羅三藐三	001	何 以 故  須 菩 提  一切諸佛  及 諸 佛 阿 耨 多 羅 三 藐 三 
ZH_X25_0510_001:0914b11	菩提法。皆從此經出。言持經獲福之所以殊勝者。	001	菩 提 法  皆 從 此 經 出  言 持 經 獲 福 之 所 以 殊 勝 者  
ZH_X25_0510_001:0914b12	果何故哉須菩提知否。自來一切修成諸佛。及諸	001	果 何 故 哉 須 菩 提 知 否  自 來 一 切 修 成 諸 佛  及 諸 
ZH_X25_0510_001:0914b13	佛所修無上正覺之法。無不皆從此經中流出。故	001	佛 所 修 無上正覺 之 法  無 不 皆 從 此 經 中 流 出  故 
ZH_X25_0510_001:0914b14	稱般若為佛母焉。	001	稱 般 若 為 佛 母 焉  
ZH_X25_0510_001:0914b15	須菩提。所謂佛法者。即非佛法。佛恐聞此經法殊	001	須 菩 提  所 謂 佛 法 者  即 非 佛 法  佛 恐 聞 此 經 法 殊 
ZH_X25_0510_001:0914b16	勝。又生法執。故呼須菩提而告之曰。所謂無上正	001	勝  又 生 法 執  故 呼 須 菩 提 而 告 之 曰  所 謂 無 上 正 
ZH_X25_0510_001:0914b17	覺之佛法者。乃睹色聞聲。各有悟入之由。並非有	001	覺 之 佛 法 者  乃 睹 色 聞 聲  各 有 悟 入 之 由  並 非 有 
ZH_X25_0510_001:0914b18	一定死法。可名之為佛法也。	001	一 定 死 法  可 名 之 為 佛 法 也  
ZH_X25_0510_001:0914b19	○一相無相分第九一相者。諸法寔相也。言諸法	001	 一相無相 分 第 九 一 相 者  諸 法 寔 相 也  言 諸 法 
ZH_X25_0510_001:0914b20	雖云有寔相。而究無定相。是不宜取執也明矣。	001	雖 云 有 寔 相  而 究 無 定 相  是 不 宜 取 執 也 明 矣  
ZH_X25_0510_001:0914b21	須菩提。於意云何。須陀洹能作是念。我得須陀洹果	001	須 菩 提  於意云何  須 陀 洹 能 作 是 念  我 得 須陀洹果 
ZH_X25_0510_001:0914b22	不。洹。音浣下同。○須陀洹。華言預流。謂此人見惑	001	不  洹  音 浣 下 同   須 陀 洹  華 言 預 流  謂 此 人 見 惑 
ZH_X25_0510_001:0914b23	已斷。得預聖人之流也。見惑謂見事物而心生計	001	已 斷  得 預 聖 人 之 流 也  見 惑 謂 見 事 物 而 心 生 計 
ZH_X25_0510_001:0914b24	議也。佛欲示人離相證道之旨。故呼須菩提而問	001	議 也  佛 欲 示 人 離 相 證 道 之 旨  故 呼 須 菩 提 而 問 
ZH_X25_0510_001:0914c01	之曰。於汝意中以為何如耶。聲聞乘有四果。初果	001	之 曰  於 汝 意 中 以 為 何 如 耶  聲 聞 乘 有 四 果  初 果 
ZH_X25_0510_001:0914c02	名須陀洹。證是果者。其心以為我今已得須陀洹	001	名 須 陀 洹  證 是 果 者  其 心 以 為 我 今 已 得 須 陀 洹 
