segmentnr	original	folio	analyzed
ZH_X25_0510_001:0914c03	果否。聲聞屬二乘。謂聞說法音聲而證果也。	001	果 否  聲 聞 屬 二 乘  謂 聞 說 法 音 聲 而 證 果 也  
ZH_X25_0510_001:0914c04	須菩提言。不也。世尊。須菩提乃此中過來之人。故	001	須 菩 提 言  不 也  世 尊  須 菩 提 乃 此 中 過 來 之 人  故 
ZH_X25_0510_001:0914c05	聞佛問。而知證是果者。其心必不存一得果之心。	001	聞 佛 問  而 知 證 是 果 者  其 心 必 不 存 一 得 果 之 心  
ZH_X25_0510_001:0914c06	故以不也答之。	001	故 以 不 也 答 之  
ZH_X25_0510_001:0914c07	何以故。須陀洹名為入流而無所入。須陀洹所以	001	何 以 故  須 陀 洹 名 為 入 流 而 無 所 入  須 陀 洹 所 以 
ZH_X25_0510_001:0914c08	不存得果之心者。何故哉。盖須陀洹但有。入流之	001	不 存 得 果 之 心 者  何 故 哉  盖 須 陀 洹 但 有  入 流 之 
ZH_X25_0510_001:0914c09	名。而無入流之相也。	001	名  而 無 入 流 之 相 也  
ZH_X25_0510_001:0914c10	不入色聲香味觸法。是名須陀洹。須陀洹既不為	001	不 入 色聲香味觸 法  是 名 須 陀 洹  須 陀 洹 既 不 為 
ZH_X25_0510_001:0914c11	得果著相。即於六塵境界。都無染著所以名為須	001	得 果 著 相  即 於 六 塵 境 界  都 無 染 著 所 以 名 為 須 
ZH_X25_0510_001:0914c12	陀洹也。	001	陀 洹 也  
ZH_X25_0510_001:0914c13	須菩提。於意云何。斯陀含能作是念。我得斯陀含果	001	須 菩 提  於意云何  斯 陀 含 能 作 是 念  我 得 斯陀含果 
ZH_X25_0510_001:0914c14	不。此佛歷舉四果。而徵問之也。斯陀含。華言一來。	001	不  此 佛 歷 舉 四 果  而 徵 問 之 也  斯 陀 含  華 言 一 來  
ZH_X25_0510_001:0914c15	此人於欲界九品思惑。已斷六品。更須欲界一度	001	此 人 於 欲 界 九 品 思 惑  已 斷 六 品  更 須 欲 界 一 度 
ZH_X25_0510_001:0914c16	受生。故云一來也。思惑。謂觸念生心也。佛呼須菩	001	受 生  故 云 一 來 也  思 惑  謂 觸 念 生 心 也  佛 呼 須 菩 
ZH_X25_0510_001:0914c17	提而再詰之曰。聲聞乘二果名斯陀含。證此果者。	001	提 而 再 詰 之 曰  聲 聞 乘 二 果 名 斯 陀 含  證 此 果 者  
ZH_X25_0510_001:0914c18	其心以為我今已得斯陀含果否。	001	其 心 以 為 我 今 已 得 斯陀含果 否  
ZH_X25_0510_001:0914c19	須菩提言。不也。世尊。須菩提以初果之人。且不作	001	須 菩 提 言  不 也  世 尊  須 菩 提 以 初 果 之 人  且 不 作 
ZH_X25_0510_001:0914c20	得果之念。況等而上之哉。故亦以不也。答之。	001	得 果 之 念  況 等 而 上 之 哉  故 亦 以 不 也  答 之  
ZH_X25_0510_001:0914c21	何以故。斯陀含名一往來而實無往來。是名斯陀含。	001	何 以 故  斯 陀 含 名 一 往 來 而 實 無 往 來  是 名 斯 陀 含  
ZH_X25_0510_001:0914c22	言斯陀含所以不存得果之念者何哉。盖斯陀含	001	言 斯 陀 含 所 以 不 存 得 果 之 念 者 何 哉  盖 斯 陀 含 
ZH_X25_0510_001:0914c23	雖有往來之名。而心無往來之相。是以名為斯陀	001	雖 有 往 來 之 名  而 心 無 往 來 之 相  是 以 名 為 斯 陀 
ZH_X25_0510_001:0914c24	含也。	001	含 也  
ZH_X25_0510_001:0915a01	須菩提。於意云何。阿那含能作是念。我得阿那含果	001	須 菩 提  於意云何  阿 那 含 能 作 是 念  我 得 阿那含果 
ZH_X25_0510_001:0915a02	不。那。音羅。下同。○阿那含。華言不來。此人於欲界	001	不  那  音 羅  下 同   阿 那 含  華 言 不 來  此 人 於 欲 界 
ZH_X25_0510_001:0915a03	九品思惑斷盡。不來欲界受生。故云不來也。佛又	001	九 品 思 惑 斷 盡  不 來 欲 界 受 生  故 云 不 來 也  佛 又 
ZH_X25_0510_001:0915a04	呼須菩提而詰之曰。聲聞乘三果名阿那含。證是	001	呼 須 菩 提 而 詰 之 曰  聲 聞 乘 三 果 名 阿 那 含  證 是 
ZH_X25_0510_001:0915a05	果者。其心以為我今已得阿那含果否。	001	果 者  其 心 以 為 我 今 已 得 阿那含果 否  
ZH_X25_0510_001:0915a06	須菩提言。不也。世尊。須菩提以阿那含亦不存得	001	須 菩 提 言  不 也  世 尊  須 菩 提 以 阿 那 含 亦 不 存 得 
ZH_X25_0510_001:0915a07	果之念。故仍以不也答之。	001	果 之 念  故 仍 以 不 也 答 之  
ZH_X25_0510_001:0915a08	何以故。阿那含名為不來而實無不來。是名阿那含。	001	何 以 故  阿 那 含 名 為 不 來 而 實 無 不 來  是 名 阿 那 含  
ZH_X25_0510_001:0915a09	言阿那含所以不存得果之念者何哉。盖其名雖	001	言 阿 那 含 所 以 不 存 得 果 之 念 者 何 哉  盖 其 名 雖 
ZH_X25_0510_001:0915a10	謂為不來。而心且無不來之相。是以名為阿那含	001	謂 為 不 來  而 心 且 無 不 來 之 相  是 以 名 為 阿 那 含 
ZH_X25_0510_001:0915a11	也。	001	也  
ZH_X25_0510_001:0915a12	須菩提。於意云何。阿羅漢能作是念。我得阿羅漢道	001	須 菩 提  於意云何  阿 羅 漢 能 作 是 念  我 得阿羅漢 道 
ZH_X25_0510_001:0915a13	不。阿羅漢。華言無學。此人於三界煩惱。悉已斷盡。	001	不  阿 羅 漢  華 言 無 學  此 人 於 三 界 煩 惱  悉 已 斷 盡  
ZH_X25_0510_001:0915a14	究竟真理。無法可學。故云無學。又阿羅漢將入佛	001	究 竟 真 理  無 法 可 學  故 云 無 學  又 阿 羅 漢 將 入 佛 
ZH_X25_0510_001:0915a15	乘。故不言果而言道也。佛又呼須菩提而詰之曰。	001	乘  故 不 言 果 而 言 道 也  佛 又 呼 須 菩 提 而 詰 之 曰  
ZH_X25_0510_001:0915a16	聲聞乘四果名阿羅漢。證是果者。其亦以為我今	001	聲 聞 乘 四 果 名 阿 羅 漢  證 是 果 者  其 亦 以 為 我 今 
ZH_X25_0510_001:0915a17	已得阿羅漢道否。	001	已 得阿羅漢 道 否  
ZH_X25_0510_001:0915a18	須菩提言。不也世尊。須菩提以阿羅漢煩惱斷盡。	001	須 菩 提 言  不 也 世 尊  須 菩 提 以 阿 羅 漢 煩 惱 斷 盡  
ZH_X25_0510_001:0915a19	豈更存得道之念。故仍以不也答之。	001	豈 更 存 得 道 之 念  故 仍 以 不 也 答 之  
ZH_X25_0510_001:0915a20	何以故。寔無有法名阿羅漢。言阿羅漢所以不存	001	何 以 故  寔 無 有 法 名 阿 羅 漢  言 阿 羅 漢 所 以 不 存 
ZH_X25_0510_001:0915a21	得道之念者何哉。盖阿羅漢固得無相之法。然寔	001	得 道 之 念 者 何 哉  盖 阿 羅 漢 固 得 無相之法  然 寔 
ZH_X25_0510_001:0915a22	無得法之心。而名之為阿羅漢也。	001	無 得 法 之 心  而 名 之 為 阿 羅 漢 也  
ZH_X25_0510_001:0915a23	世尊。若阿羅漢作是念。我得阿羅漢道。即為著我人	001	世 尊  若 阿 羅 漢 作 是 念  我 得阿羅漢 道  即 為 著 我 人 
ZH_X25_0510_001:0915a24	眾生壽者。須菩提白佛而言。若阿羅漢心作是念。	001	眾 生 壽 者  須 菩 提 白 佛 而 言  若 阿 羅 漢 心 作 是 念  
ZH_X25_0510_001:0915b01	謂我已得阿羅漢正道。則其心已著相。既著得道	001	謂 我 已 得阿羅漢 正 道  則 其 心 已 著 相  既 著 得 道 
ZH_X25_0510_001:0915b02	之相。即亦猶著我人等四相也。又何云阿羅漢哉。	001	之 相  即 亦 猶 著 我 人 等 四 相 也  又 何 云 阿 羅 漢 哉  
ZH_X25_0510_001:0915b03	世尊。佛說我得無諍三昧。人中最為第一。是第一離	001	世 尊  佛 說 我 得 無諍三昧  人 中 最 為 第 一  是 第 一 離 
ZH_X25_0510_001:0915b04	欲阿羅漢。三昧。華言正受猶云妙理也。須菩提復	001	欲 阿 羅 漢  三 昧  華 言 正 受 猶 云 妙 理 也  須 菩 提 復 
ZH_X25_0510_001:0915b05	以自己所得。印證於佛。故稱世尊而言。佛見我與	001	以 自 己 所 得  印 證 於 佛  故 稱 世 尊 而 言  佛 見 我 與 
ZH_X25_0510_001:0915b06	物無諍。而稱我為已得無諍三昧。於人中最為第	001	物 無 諍  而 稱 我 為 已 得 無諍三昧  於 人 中 最 為 第 
ZH_X25_0510_001:0915b07	一可貴。是第一等能脫離五欲之阿羅漢也。盖非	001	一 可 貴  是 第 一 等 能 脫 離 五 欲 之 阿 羅 漢 也  盖 非 
ZH_X25_0510_001:0915b08	離欲無諍。亦不能進道矣。	001	離 欲 無 諍  亦 不 能 進 道 矣  
ZH_X25_0510_001:0915b09	我不作是念。我是離欲阿羅漢。然佛雖稱我為離	001	我 不 作 是 念  我 是 離 欲 阿 羅 漢  然 佛 雖 稱 我 為 離 
ZH_X25_0510_001:0915b10	欲阿羅漢。我寔未甞作是念。而云我是離欲阿羅	001	欲 阿 羅 漢  我 寔 未 甞 作 是 念  而 云 我 是 離 欲 阿 羅 
ZH_X25_0510_001:0915b11	漢也。	001	漢 也  
ZH_X25_0510_001:0915b12	世尊。我若作是念。我得阿羅漢道。世尊則不說須菩	001	世 尊  我 若 作 是 念  我 得阿羅漢 道  世 尊 則 不 說 須 菩 
ZH_X25_0510_001:0915b13	提是樂阿蘭那行者。行。音恨。○阿蘭那。華言無諍。	001	提 是 樂 阿 蘭 那 行 者  行  音 恨   阿 蘭 那  華 言 無 諍  
ZH_X25_0510_001:0915b14	須菩提復稱世尊而言。我若曾作此念。而云我得	001	須 菩 提 復 稱 世 尊 而 言  我 若 曾 作 此 念  而 云 我 得 
ZH_X25_0510_001:0915b15	阿羅漢道者。世尊便不說須菩提。是喜好無諍之	001	阿羅漢道 者  世 尊 便 不 說 須 菩 提  是 喜 好 無 諍 之 
ZH_X25_0510_001:0915b16	行者矣。	001	行 者 矣  
ZH_X25_0510_001:0915b17	以須菩提實無所行。而名須菩提是樂阿蘭那行。	001	以 須 菩 提 實 無 所 行  而 名 須 菩 提 是 樂 阿 蘭 那 行  
ZH_X25_0510_001:0915b18	無所行之行。如字。○無所行。行所無事也。言佛所	001	無 所 行 之 行  如 字   無 所 行  行 所 無 事 也  言 佛 所 
ZH_X25_0510_001:0915b19	以稱須菩提得無諍三昧者。以須菩提雖有修證。	001	以 稱 須 菩 提 得 無諍三昧 者  以 須 菩 提 雖 有 修 證  
ZH_X25_0510_001:0915b20	寔亦行所無事耳。故佛說我是喜好無諍之行者。	001	寔 亦 行 所 無 事 耳  故 佛 說 我 是 喜 好 無 諍 之 行 者  
ZH_X25_0510_001:0915b21	然我寔無喜好之心存於中也。	001	然 我 寔 無 喜 好 之 心 存 於 中 也  
ZH_X25_0510_001:0915b22	○莊嚴淨土分第十法以無得為得。心以無住為	001	 莊 嚴 淨 土 分 第 十 法 以 無 得 為 得  心 以 無 住 為 
ZH_X25_0510_001:0915b23	住。清淨自然。並不著相執有。此為莊嚴自心淨土。	001	住  清 淨 自 然  並 不 著 相 執 有  此 為 莊 嚴 自 心 淨 土  
ZH_X25_0510_001:0915b24	非若設像。供養之為莊嚴也。	001	非 若 設 像  供 養 之 為 莊 嚴 也  
ZH_X25_0510_001:0915c01	佛告須菩提。於意云何。佛欲以己之往事示人。使	001	佛 告 須 菩 提  於意云何  佛 欲 以 己 之 往 事 示 人  使 
ZH_X25_0510_001:0915c02	之堅信。故告須菩提曰。於汝意中以為何如耶。	001	之 堅 信  故 告 須 菩 提 曰  於 汝 意 中 以 為 何 如 耶  
ZH_X25_0510_001:0915c03	如來昔在然燈佛所。於法有所得不。此如來。佛自	001	如 來 昔 在 然 燈 佛 所  於 法 有 所 得 不  此 如 來  佛 自 
ZH_X25_0510_001:0915c04	謂也。然燈佛釋迦之師也。言如我昔日在本師處。	001	謂 也  然 燈 佛 釋 迦 之 師 也  言 如 我 昔 日 在 本 師 處  
ZH_X25_0510_001:0915c05	聞法頓證。其時本師果有秘法授我。而真有所得	001	聞 法 頓 證  其 時 本 師 果 有 秘 法 授 我  而 真 有 所 得 
ZH_X25_0510_001:0915c06	乎。	001	乎  
ZH_X25_0510_001:0915c07	不也世尊。須菩提以佛佛相傳。雖有得法之名。然	001	不 也 世 尊  須 菩 提 以 佛 佛 相 傳  雖 有 得 法 之 名  然 
ZH_X25_0510_001:0915c08	皆自修自度。非有秘法與人。不假修為。便堪證果。	001	皆 自 修 自 度  非 有 秘 法 與 人  不 假 修 為  便 堪 證 果  
ZH_X25_0510_001:0915c09	故即以不也答之。	001	故 即 以 不 也 答 之  
ZH_X25_0510_001:0915c10	如來在然燈佛所。於法寔無所得。言佛昔在本師	001	如 來 在 然 燈 佛 所  於 法 寔 無 所 得  言 佛 昔 在 本 師 
ZH_X25_0510_001:0915c11	處。雖云得法。其寔得無所得耳。○。	001	處  雖 云 得 法  其 寔 得 無 所 得 耳    
ZH_X25_0510_001:0915c12	須菩提。於意云何。菩薩莊嚴佛土不。土。讀作杜。盖	001	須 菩 提  於意云何  菩 薩 莊 嚴 佛 土 不  土  讀 作 杜  盖 
ZH_X25_0510_001:0915c13	東西異音耳佛又恐人不求見性。專以造寺塑像	001	東 西 異 音 耳 佛 又 恐 人 不 求 見 性  專 以 造 寺 塑 像 
ZH_X25_0510_001:0915c14	種種裝飾而為莊嚴。故呼須菩提而詰之曰。汝意	001	種 種 裝 飾 而 為 莊 嚴  故 呼 須 菩 提 而 詰 之 曰  汝 意 
ZH_X25_0510_001:0915c15	以為何如耶。諸菩薩曾以外相莊嚴。而為莊嚴佛	001	以 為 何 如 耶  諸 菩 薩 曾 以 外 相 莊 嚴  而 為 莊 嚴 佛 
ZH_X25_0510_001:0915c16	土否。	001	土 否  
ZH_X25_0510_001:0915c17	不也。世尊。須菩提以諸菩薩。決不以外相莊嚴而	001	不 也  世 尊  須 菩 提 以 諸 菩 薩  決 不 以 外 相 莊 嚴 而 
ZH_X25_0510_001:0915c18	為莊嚴自心佛土。故以不也答之。	001	為 莊 嚴 自 心 佛 土  故 以 不 也 答 之  
ZH_X25_0510_001:0915c19	何云故。莊嚴佛土者。即非莊嚴。是名莊嚴。夫我所	001	何 云 故  莊 嚴 佛 土 者  即 非 莊 嚴  是 名 莊 嚴  夫 我 所 
ZH_X25_0510_001:0915c20	謂菩薩不事外相莊嚴者。何故哉盖莊嚴佛土者。	001	謂 菩 薩 不 事 外 相 莊 嚴 者  何 故 哉 盖 莊 嚴 佛 土 者  
ZH_X25_0510_001:0915c21	非有莊嚴之迹。乃各自淨其心。是則名之為莊嚴	001	非 有 莊 嚴 之 迹  乃 各 自 淨 其 心  是 則 名 之 為 莊 嚴 
ZH_X25_0510_001:0915c22	耳。	001	耳  
ZH_X25_0510_001:0915c23	是故。須菩提。諸菩薩摩訶薩。應如是生清淨心。佛	001	是 故  須 菩 提  諸 菩薩摩訶薩  應 如 是 生 清 淨 心  佛 
ZH_X25_0510_001:0915c24	以須菩提所言莊嚴之意。深契其旨。故即是之而	001	以 須 菩 提 所 言 莊 嚴 之 意  深 契 其 旨  故 即 是 之 而 
ZH_X25_0510_001:0916a01	又呼之曰。須知諸菩薩及大菩薩等。應以所云如	001	又 呼 之 曰  須 知 諸 菩 薩 及 大 菩 薩 等  應 以 所 云 如 
ZH_X25_0510_001:0916a02	是之法而生其清淨之心。清淨心者。謂心不起絲	001	是 之 法 而 生 其 清 淨 之 心  清 淨 心 者  謂 心 不 起 絲 
ZH_X25_0510_001:0916a03	毫雜念也。生字尤為要妙。佛恐學人但求心淨。一	001	毫 雜 念 也  生 字 尤 為 要 妙  佛 恐 學 人 但 求 心 淨  一 
ZH_X25_0510_001:0916a04	向沉空守寂。宛如槁木死灰。則又落偏枯。而非中	001	向 沉 空 守 寂  宛 如 槁 木 死 灰  則 又 落 偏 枯  而 非 中 
ZH_X25_0510_001:0916a05	道。故特云生清淨心。便覺活潑潑地。	001	道  故 特 云 生 清 淨 心  便 覺 活 潑 潑 地  
ZH_X25_0510_001:0916a06	不應住色生心。不應住聲香味觸法生心。言菩薩	001	不 應 住 色 生 心  不 應 住 聲香味觸 法 生 心  言 菩 薩 
ZH_X25_0510_001:0916a07	之心。既不宜落空。亦不宜附物。雖曰生心。不當於	001	之 心  既 不 宜 落 空  亦 不 宜 附 物  雖 曰 生 心  不 當 於 
ZH_X25_0510_001:0916a08	六塵上有所粘著也。	001	六 塵 上 有 所 粘 著 也  
ZH_X25_0510_001:0916a09	應無所住而生其心。盖不惟不應於塵境上生心。	001	應 無 所 住 而 生 其 心  盖 不 惟 不 應 於 塵 境 上 生 心  
ZH_X25_0510_001:0916a10	即一切境緣。均不應有所粘著。此為無住生心之	001	即 一 切 境 緣  均 不 應 有 所 粘 著  此 為 無 住 生 心 之 
ZH_X25_0510_001:0916a11	妙法耳。我佛教人。如此入細。千古傳心妙訣。無逾	001	妙 法 耳  我 佛 教 人  如 此 入 細  千 古 傳 心 妙 訣  無 逾 
ZH_X25_0510_001:0916a12	於此。可謂要言不煩。宜乎六祖一聞此語。便爾悟	001	於 此  可 謂 要 言 不 煩  宜 乎 六 祖 一 聞 此 語  便 爾 悟 
ZH_X25_0510_001:0916a13	入。吾輩可弗勉諸。	001	入  吾 輩 可 弗 勉 諸  
ZH_X25_0510_001:0916a14	須菩提。譬如有人。身如須彌山王。於意云何。是身為	001	須 菩 提  譬 如 有 人  身 如須彌山 王  於意云何  是 身 為 
ZH_X25_0510_001:0916a15	大不。須彌山高出天外。間隔四天下。其大無比。故	001	大 不  須 彌 山 高 出 天 外  間 隔 四 天 下  其 大 無 比  故 
ZH_X25_0510_001:0916a16	稱山王。佛欲人自見法身之大。故設辭以問須菩	001	稱 山 王  佛 欲 人 自 見 法 身 之 大  故 設 辭 以 問 須 菩 
ZH_X25_0510_001:0916a17	提曰。假如有人。其色身如須彌山王之大。汝意以	001	提 曰  假 如 有 人  其 色 身 如須彌山 王 之 大  汝 意 以 
ZH_X25_0510_001:0916a18	為何如。是人之身。亦曾為大否。	001	為 何 如  是 人 之 身  亦 曾 為 大 否  
ZH_X25_0510_001:0916a19	須菩提言。甚大。世尊。何以故。佛說非身。是名大身。	001	須 菩 提 言  甚 大  世 尊  何 以 故  佛 說 非 身  是 名 大 身  
ZH_X25_0510_001:0916a20	須菩提知佛問意。而言若以色身而論。則如須彌	001	須 菩 提 知 佛 問 意  而 言 若 以 色 身 而 論  則 如 須 彌 
ZH_X25_0510_001:0916a21	之身。可云甚大矣。然所謂大者。何故哉是特以色	001	之 身  可 云 甚 大 矣  然 所 謂 大 者  何 故 哉 是 特 以 色 
ZH_X25_0510_001:0916a22	身言之耳。若佛所謂法身者。廣大如虗空。非有相。	001	身 言 之 耳  若 佛 所 謂 法 身 者  廣 大 如 虗 空  非 有 相  
ZH_X25_0510_001:0916a23	非無相。非色身之身。故云非身。是則可名為大身	001	非 無 相  非 色 身 之 身  故 云 非 身  是 則 可 名 為 大 身 
ZH_X25_0510_001:0916a24	耳。豈區區色身之比哉。	001	耳  豈 區 區 色 身 之 比 哉  
ZH_X25_0510_001:0916b01	○無為福勝分第十一謂以七寶行施。固雖甚多。	001	 無 為 福 勝 分 第 十 一 謂 以 七 寶 行 施  固 雖 甚 多  
ZH_X25_0510_001:0916b02	但享世間頑福。其福有量。若持經化導。終至成道。	001	但 享 世 間 頑 福  其 福 有 量  若 持 經 化 導  終 至 成 道  
ZH_X25_0510_001:0916b03	永享無為真福。其福轉勝也。	001	永 享 無 為 真 福  其 福 轉 勝 也  
ZH_X25_0510_001:0916b04	須菩提。如恒河中所有沙數。如是沙等恒河。於意云	001	須 菩 提  如 恒 河 中 所 有 沙 數  如 是 沙 等 恒 河  於 意 云 
ZH_X25_0510_001:0916b05	何。是諸恒河沙。甯為多不。佛又申言持說。之獲福。	001	何  是 諸 恒 河 沙  甯 為 多 不  佛 又 申 言 持 說  之 獲 福  
ZH_X25_0510_001:0916b06	勝於寶施。故呼須菩提而詰之曰。假如以恒河中	001	勝 於 寶 施  故 呼 須 菩 提 而 詰 之 曰  假 如 以 恒 河 中 
ZH_X25_0510_001:0916b07	所有之沙數。一沙復作一恒河。汝意以為此沙數	001	所 有 之 沙 數  一 沙 復 作 一 恒 河  汝 意 以 為 此 沙 數 
ZH_X25_0510_001:0916b08	恒河之沙曾為多否。此極言其無量也。恒河。西域	001	恒 河 之 沙 曾 為 多 否  此 極 言 其 無 量 也  恒 河  西 域 
ZH_X25_0510_001:0916b09	河名。週四十里。其沙甚細。佛每於此說法。故欲言	001	河 名  週 四 十 里  其 沙 甚 細  佛 每 於 此 說 法  故 欲 言 
ZH_X25_0510_001:0916b10	多。輙取河沙以為喻。甯猶曾也。	001	多  輙 取 河 沙 以 為 喻  甯 猶 曾 也  
ZH_X25_0510_001:0916b11	須菩提言。甚多。世尊。須菩提以恒沙之多。何可數	001	須 菩 提 言  甚 多  世 尊  須 菩 提 以 恒 沙 之 多  何 可 數 
ZH_X25_0510_001:0916b12	計。故以甚多答之。	001	計  故 以 甚 多 答 之  
ZH_X25_0510_001:0916b13	但諸恒河。尚多無數。何況其沙。言但計一河沙數	001	但 諸 恒 河  尚 多 無 數  何 況 其 沙  言 但 計 一 河 沙 數 
ZH_X25_0510_001:0916b14	之恒河。其多且已無數。何況眾河之沙而能計其	001	之 恒 河  其 多 且 已 無 數  何 況 眾 河 之 沙 而 能 計 其 
ZH_X25_0510_001:0916b15	數哉。	001	數 哉  
ZH_X25_0510_001:0916b16	須菩提。我今實言告汝。若有善男子善女人。以七寶	001	須 菩 提  我 今 實 言 告 汝  若 有 善 男 子 善 女 人  以 七 寶 
ZH_X25_0510_001:0916b17	滿爾所恒河沙數三千大千世界。以用布施。得福多	001	滿 爾 所 恒 河 沙 數 三千大千世界  以用布施  得 福 多 
ZH_X25_0510_001:0916b18	不。佛以須菩提。言眾恒河沙之多。不可數計。故呼	001	不  佛 以 須 菩 提  言 眾 恒 河 沙 之 多  不 可 數 計  故 呼 
ZH_X25_0510_001:0916b19	之曰。我今以真實之言告汝。設有善信男女於此。	001	之 曰  我 今 以 真 實 之 言 告 汝  設 有 善 信 男 女 於 此  
ZH_X25_0510_001:0916b20	以七寶布滿爾頃所謂眾河沙數之大千世界。以	001	以 七 寶 布 滿 爾 頃 所 謂 眾 河 沙 數 之 大千世界  以 
ZH_X25_0510_001:0916b21	為布施其所得福。曾為多否。第八分中曾言大千	001	為 布 施 其 所 得 福  曾 為 多 否  第 八 分 中 曾 言 大 千 
ZH_X25_0510_001:0916b22	世界寶施。不及持說之福。今復言眾河沙數之大	001	世 界 寶 施  不 及 持 說 之 福  今 復 言 眾 河 沙 數 之 大 
ZH_X25_0510_001:0916b23	千世界寶施。則其多尤難計量。而獲福亦更無窮	001	千 世 界 寶 施  則 其 多 尤 難 計 量  而 獲 福 亦 更 無 窮 
ZH_X25_0510_001:0916b24	矣。佛屢設喻。極顯持說之勝耳。	001	矣  佛 屢 設 喻  極 顯 持 說 之 勝 耳  
ZH_X25_0510_001:0916c01	須菩提言。甚多。世尊。須菩提以設有如許寶施。獲	001	須 菩 提 言  甚 多  世 尊  須 菩 提 以 設 有 如 許 寶 施  獲 
ZH_X25_0510_001:0916c02	福豈有限量。故以甚多答之。	001	福 豈 有 限 量  故 以 甚 多 答 之  
ZH_X25_0510_001:0916c03	佛告須菩提。若善男子善女人。於此經中。乃至授持	001	佛 告 須 菩 提  若 善 男 子 善 女 人  於 此 經 中  乃 至 授 持 
ZH_X25_0510_001:0916c04	四句偈等。為他人說而此福德。勝前福德。佛以寶	001	四 句 偈 等  為 他 人 說 而 此 福 德  勝 前 福 德  佛 以 寶 
ZH_X25_0510_001:0916c05	施獲福。終不及持說之勝。故告須菩提曰。若有善	001	施 獲 福  終 不 及 持 說 之 勝  故 告 須 菩 提 曰  若 有 善 
ZH_X25_0510_001:0916c06	信男女。受持此經中章句。乃至僅持四句偈等。且	001	信 男 女  受 持 此 經 中 章 句  乃 至 僅 持 四 句 偈 等  且 
ZH_X25_0510_001:0916c07	與人解說。使之信受。此人所得福德。已超勝於前	001	與 人 解 說  使 之 信 受  此 人 所 得 福 德  已 超 勝 於 前 
ZH_X25_0510_001:0916c08	寶施之福德矣。夫持說之殊勝若此。人胡不勉而	001	寶 施 之 福 德 矣  夫 持 說 之 殊 勝 若 此  人 胡 不 勉 而 
ZH_X25_0510_001:0916c09	行之。	001	行 之  
ZH_X25_0510_001:0916c10	○尊重正教分第十二言持說此經之處。自天人	001	 尊 重 正 教 分 第 十 二 言 持 說 此 經 之 處  自 天 人 
ZH_X25_0510_001:0916c11	以迄修羅。並皆呵護。是彼等亦知尊重正教也。	001	以 迄 修 羅  並 皆 呵 護  是 彼 等 亦 知 尊 重 正 教 也  
ZH_X25_0510_001:0916c12	復次。須菩提。隨說是經乃至四句偈等。此承上章。	001	復 次  須 菩 提  隨 說 是 經 乃 至 四 句 偈 等  此 承 上 章  
ZH_X25_0510_001:0916c13	申言持說之勝。不惟獲福無量。故復呼須菩提曰。	001	申 言 持 說 之 勝  不 惟 獲 福 無 量  故 復 呼 須 菩 提 曰  
ZH_X25_0510_001:0916c14	若人隨意解說此經之章句。或少而至四句偈者。	001	若 人 隨 意 解 說 此 經 之 章 句  或 少 而 至 四 句 偈 者  
ZH_X25_0510_001:0916c15	當知此處。一切世間天人阿修羅。皆應供養如佛塔	001	當 知 此 處  一切世間 天 人 阿 修 羅  皆 應 供 養 如 佛 塔 
ZH_X25_0510_001:0916c16	廟。供養並去聲。○阿修羅有四種。一屬天趣。能與	001	廟  供 養 並 去 聲   阿 修 羅 有 四 種  一 屬 天 趣  能 與 
ZH_X25_0510_001:0916c17	帝釋爭衡。一屬人趣。一屬鬼趣一屬畜生趣藏佛	001	帝 釋 爭 衡  一 屬 人 趣  一 屬 鬼 趣 一 屬 畜 生 趣 藏 佛 
ZH_X25_0510_001:0916c18	舍利之處為塔。奉佛形像之處為廟。言持說此經	001	舍 利 之 處 為 塔  奉 佛 形 像 之 處 為 廟  言 持 說 此 經 
ZH_X25_0510_001:0916c19	之人之處所有諸世間中。若天。若人。若修羅等。皆	001	之 人 之 處 所 有 諸 世 間 中  若 天  若 人  若 修 羅 等  皆 
ZH_X25_0510_001:0916c20	當恭敬供養。如奉佛之塔廟焉。盖彼等之所供養	001	當 恭敬供養  如 奉 佛 之 塔 廟 焉  盖 彼 等 之 所 供 養 
ZH_X25_0510_001:0916c21	者。以此無上希有之法。難見難逢。故猝遇之。而生	001	者  以 此 無 上 希 有 之 法  難 見 難 逢  故 猝 遇 之  而 生 
ZH_X25_0510_001:0916c22	欽敬也。	001	欽 敬 也  
ZH_X25_0510_001:0916c23	何況有人。盡能受持讀誦。對文曰讀背文曰誦。夫	001	何 況 有 人  盡 能 受持讀誦  對 文 曰 讀 背 文 曰 誦  夫 
