segmentnr	original	folio	analyzed
ZH_X76_1516_009:0095a16	歷代編年釋氏通鑑卷第九	009	歷 代 編 年 釋 氏 通 鑑 卷 第 九 
ZH_X76_1516_009:0095a18	宋括山一菴釋　本覺　編集	009	宋 括 山 一 菴 釋  本 覺  編 集 
ZH_X76_1516_009:0095a19	明六觀居士　畢延玠　較訂	009	明 六 觀 居 士  畢 延 玠  較 訂 
ZH_X76_1516_009:0095a20	　　唐	009	  唐 
ZH_X76_1516_009:0095a21	元宗	009	元 宗 
ZH_X76_1516_009:0095a22	癸丑(開元元年)	009	癸 丑  開 元 元 年  
ZH_X76_1516_009:0095a23	菩提流志。譯寶積經。并舊譯。合成一部百二十卷。至	009	菩 提 流 志  譯 寶 積 經  并 舊 譯  合 成 一 部 百 二 十 卷  至 
ZH_X76_1516_009:0095a24	是功畢。流志自是更不譯經。唯專持誦。時修禪觀○	009	是 功 畢  流 志 自 是 更 不 譯 經  唯 專 持 誦  時 修 禪 觀  
ZH_X76_1516_009:0095b01	七月義淨法師示寂。壽七十九。勑給葬事。淨譯經論	009	七 月 義 淨 法 師 示 寂  壽 七 十 九  勑 給 葬 事  淨 譯 經 論 
ZH_X76_1516_009:0095b02	五十六部。凡二百三十卷。又別撰儀傳等九卷。淨雖	009	五 十 六 部  凡 二 百 三 十 卷  又 別 撰 儀 傳 等 九 卷  淨 雖 
ZH_X76_1516_009:0095b03	遍番三藏。而偏攻律部。教授學徒○七月。六祖辭徒	009	遍 番 三 藏  而 偏 攻 律 部  教 授 學 徒  七 月  六 祖 辭 徒 
ZH_X76_1516_009:0095b04	眾。歸新州故宅國恩寺。其徒泣曰。師歸當復來否。祖	009	眾  歸 新 州 故 宅 國 恩 寺  其 徒 泣 曰  師 歸 當 復 來 否  祖 
ZH_X76_1516_009:0095b05	曰。葉落歸根。來時無口。又問。師之法眼。何人傳受。祖	009	曰  葉 落 歸 根  來 時 無 口  又 問  師 之 法 眼  何 人 傳 受  祖 
ZH_X76_1516_009:0095b06	曰。有道者得。無心者通。至國恩寺。以八月三日。示眾	009	曰  有 道 者 得  無 心 者 通  至 國 恩 寺  以 八 月 三 日  示 眾 
ZH_X76_1516_009:0095b07	曰。吾受忍大師衣法。今為汝等說法。不付其衣。汝等	009	曰  吾 受 忍 大 師 衣 法  今 為 汝 等 說 法  不 付 其 衣  汝 等 
ZH_X76_1516_009:0095b08	信根已熟。堪任大事。偈曰。心地含諸種。普雨悉皆萌。	009	信 根 已 熟  堪 任 大 事  偈 曰  心 地 含 諸 種  普 雨 悉 皆 萌  
ZH_X76_1516_009:0095b09	頓悟花情已。菩提果自成。即跏趺而逝。壽七十六。廣	009	頓 悟 花 情 已  菩 提 果 自 成  即 跏 趺 而 逝  壽 七 十 六  廣 
ZH_X76_1516_009:0095b10	州都督韋據。率新韶二郡官吏。迎奉全身。歸曹溪寶	009	州 都 督 韋 據  率 新 韶 二 郡 官 吏  迎 奉 全 身  歸 曹 溪 寶 
ZH_X76_1516_009:0095b11	林寺建塔。真身今尚存焉。	009	林 寺 建 塔  真 身 今 尚 存 焉  
ZH_X76_1516_009:0095b12	甲寅(二)	009	甲 寅  二  
ZH_X76_1516_009:0095b13	帝宣問左街僧錄神光法師曰。佛於眾生。有何恩德。	009	帝 宣 問 左 街 僧 錄 神 光 法 師 曰  佛 於 眾 生  有 何 恩 德  
ZH_X76_1516_009:0095b14	致捨君親妻子。而師事之。說若有理。朕當建立。說若	009	致 捨 君 親 妻 子  而 師 事 之  說 若 有 理  朕 當 建 立  說 若 
ZH_X76_1516_009:0095b15	無理。朕當削除。奏曰。佛於眾生。恩過天地。明踰日月。	009	無 理  朕 當 削 除  奏 曰  佛 於 眾 生  恩 過 天 地  明 踰 日 月  
ZH_X76_1516_009:0095b16	德重父母。義越君臣。帝曰。天地日月。具造化之功。父	009	德 重 父 母  義 越 君 臣  帝 曰  天 地 日 月  具 造 化 之 功  父 
ZH_X76_1516_009:0095b17	母君臣。具生成之德。何以言佛竝過此乎。光曰。天能	009	母 君 臣  具 生 成 之 德  何 以 言 佛 竝 過 此 乎  光 曰  天 能 
ZH_X76_1516_009:0095b18	盖不能載。地能載不能盖。日則照晝不照夜。月則照	009	盖 不 能 載  地 能 載 不 能 盖  日 則 照 晝 不 照 夜  月 則 照 
ZH_X76_1516_009:0095b19	夜不照晝。父只能生不能養。母只能養不能生。君有	009	夜 不 照 晝  父 只 能 生 不 能 養  母 只 能 養 不 能 生  君 有 
ZH_X76_1516_009:0095b20	道則臣忠。君無道則臣侫。以此而推。德則不全。佛於	009	道 則 臣 忠  君 無 道 則 臣 侫  以 此 而 推  德 則 不 全  佛 於 
ZH_X76_1516_009:0095b21	眾生恩則不爾。言盖則四生普覆。論載則六道俱承。	009	眾 生 恩 則 不 爾  言 盖 則 四 生 普 覆  論 載 則 六 道 俱 承  
ZH_X76_1516_009:0095b22	論明則照耀十方。論明則光輝三有。論慈則提拔苦	009	論 明 則 照 耀 十 方  論 明 則 光 輝 三 有  論 慈 則 提 拔 苦 
ZH_X76_1516_009:0095b23	海。論悲則度脫幽冥。論聖則眾聖中王。論神則六通	009	海  論 悲 則 度 脫 幽 冥  論 聖 則 眾 聖 中 王  論 神 則 六 通 
ZH_X76_1516_009:0095b24	自在。所以存亡普救。貴賤皆携。唯願陛下回心敬仰。	009	自 在  所 以 存 亡 普 救  貴 賤 皆 携  唯 願 陛 下 回 心 敬 仰  
ZH_X76_1516_009:0095c01	帝悅曰。佛恩如此。非師莫宣。朕願回心。生生敬仰。	009	帝 悅 曰  佛 恩 如 此  非 師 莫 宣  朕 願 回 心  生 生 敬 仰  
ZH_X76_1516_009:0095c02	乙卯(三)	009	乙 卯  三  
ZH_X76_1516_009:0095c03	八月。帝遣禮部郎中張洽。賷詔詣當陽山。起沙門一	009	八 月  帝 遣 禮 部 郎 中 張 洽  賷 詔 詣 當 陽 山  起 沙 門 一 
ZH_X76_1516_009:0095c04	行赴闕。有旨安置光泰殿。帝數訪以安國撫民之要。	009	行 赴 闕  有 旨 安 置 光 泰 殿  帝 數 訪 以 安 國 撫 民 之 要  
ZH_X76_1516_009:0095c05	或謂一行優於憶誦。帝一日命出宮籍示之。行閱畢。	009	或 謂 一 行 優 於 憶 誦  帝 一 日 命 出 宮 籍 示 之  行 閱 畢  
ZH_X76_1516_009:0095c06	令內侍執本。對帝復之。不差一字。帝驚異。顧謂左右	009	令 內 侍 執 本  對 帝 復 之  不 差 一 字  帝 驚 異  顧 謂 左 右 
ZH_X76_1516_009:0095c07	曰。聖人也。自是頻召咨質佛心之要。行雍容敬沃。聖	009	曰  聖 人 也  自 是 頻 召 咨 質 佛 心 之 要  行 雍 容 敬 沃  聖 
ZH_X76_1516_009:0095c08	眷日隆。天下以帝從之問道。呼為天師(舊唐史)。	009	眷 日 隆  天 下 以 帝 從 之 問 道  呼 為 天 師  舊 唐 史   
ZH_X76_1516_009:0095c09	丙辰(四)	009	丙 辰  四  
ZH_X76_1516_009:0095c10	天竺三藏法師輪波迦羅(此云善無畏)。至京。帝初夢梵僧	009	天 竺 三藏法師 輪 波 迦 羅  此 云 善 無 畏   至 京  帝 初 夢 梵 僧 
ZH_X76_1516_009:0095c11	風度[王*(十/(罩-卓+衣))]異。因追畫工。授以形段。圖于殿壁。及畏至入	009	風 度 [王十罩卓衣] 異  因 追 畫 工  授 以 形 段  圖 于 殿 壁  及 畏 至 入 
ZH_X76_1516_009:0095c12	對。帝熟視。乃夢中所見僧也。悚然異之。舘于西明寺。	009	對  帝 熟 視  乃 夢 中 所 見 僧 也  悚 然 異 之  舘 于 西 明 寺  
ZH_X76_1516_009:0095c13	寧薛諸王。皆降禮欽重(舊唐史)○嵩岳元珪禪師示寂。	009	寧 薛 諸 王  皆 降 禮 欽 重  舊 唐 史   嵩 岳 元 珪 禪 師 示 寂  
ZH_X76_1516_009:0095c14	師得法于安國師。壽七十一○宋璟為廣州節度。入	009	師 得 法 于 安 國 師  壽 七 十 一  宋 璟 為 廣 州 節 度  入 
ZH_X76_1516_009:0095c15	曹溪禮祖塔。誓曰。弟子願畢世。外護大法。祈一祥瑞	009	曹 溪 禮 祖 塔  誓 曰  弟 子 願 畢 世  外 護 大 法  祈 一 祥 瑞 
ZH_X76_1516_009:0095c16	表信。言訖。微香襲人。甘雨傾注。璟忻躍賦詩而去。未	009	表 信  言 訖  微 香 襲 人  甘 雨 傾 注  璟 忻 躍 賦 詩 而 去  未 
ZH_X76_1516_009:0095c17	幾召入。與姚崇相繼執政。世稱姚宋。為中興賢相云	009	幾 召 入  與 姚 崇 相 繼 執 政  世 稱 姚 宋  為 中 興 賢 相 云 
ZH_X76_1516_009:0095c18	(通論)。	009	 通 論   
ZH_X76_1516_009:0095c19	丁巳(五)	009	丁 巳  五  
ZH_X76_1516_009:0095c20	善無畏。譯求聞持法○八月。律師道岸卒。帝制圖形	009	善 無 畏  譯 求 聞 持 法  八 月  律 師 道 岸 卒  帝 制 圖 形 
ZH_X76_1516_009:0095c21	林光宮○房琯宰桐廬縣。與道士刑和璞出遊。過夏	009	林 光 宮  房 琯 宰 桐 廬 縣  與 道 士 刑 和 璞 出 遊  過 夏 
ZH_X76_1516_009:0095c22	口村。入佛寺坐古松下。璞使人鑿地。得甕中所藏婁	009	口 村  入 佛 寺 坐 古 松 下  璞 使 人 鑿 地  得 甕 中 所 藏 婁 
ZH_X76_1516_009:0095c23	師德與永禪師書。笑謂琯曰。頗憶此耶。琯因悵然。悟	009	師 德 與 永 禪 師 書  笑 謂 琯 曰  頗 憶 此 耶  琯 因 悵 然  悟 
ZH_X76_1516_009:0095c24	前生為永禪師也。	009	前 生 為 永 禪 師 也  
ZH_X76_1516_009:0096a01	戊午(六)	009	戊 午  六  
ZH_X76_1516_009:0096a02	天竺沙門勒佉。緬承廬山東林鴈門風範。乃涉遠而	009	天 竺 沙 門 勒 佉  緬 承 廬 山 東 林 鴈 門 風 範  乃 涉 遠 而 
ZH_X76_1516_009:0096a03	至。一入山。首末六年。常坐不臥。手引禽食。其北嶺佛	009	至  一 入 山  首 末 六 年  常坐不臥  手 引 禽 食  其 北 嶺 佛 
ZH_X76_1516_009:0096a04	駄舍利塔院。置四百餘載。前後居僧皆患水遠。師至	009	駄 舍 利 塔 院  置 四 百 餘 載  前 後 居 僧 皆 患 水 遠  師 至 
ZH_X76_1516_009:0096a05	止一年。乃精誠幽感。遂致靈泉泌涌。色白輕美。冬夏	009	止 一 年  乃 精 誠 幽 感  遂 致 靈 泉 泌 涌  色 白 輕 美  冬 夏 
ZH_X76_1516_009:0096a06	無竭(廬山記)。	009	無 竭  廬 山 記   
ZH_X76_1516_009:0096a07	己未(七)	009	己 未  七  
ZH_X76_1516_009:0096a08	庚申(八)	009	庚 申  八  
ZH_X76_1516_009:0096a09	天竺三藏跋日羅菩提(此云金剛智)至京。有旨迎入大慈	009	天 竺 三 藏 跋 日 羅 菩 提  此 云 金 剛 智  至 京  有 旨 迎 入 大 慈 
ZH_X76_1516_009:0096a10	恩寺。廣弘秘教。建曼荼羅。依法作成。皆感靈瑞。一行	009	恩 寺  廣 弘 秘 教  建 曼 荼 羅  依 法 作 成  皆 感 靈 瑞  一 行 
ZH_X76_1516_009:0096a11	禪師。每諮稟之。五月值旱。詔智禱雨。智結壇圖七俱	009	禪 師  每 諮 稟 之  五 月 值 旱  詔 智 禱 雨  智 結 壇 圖 七 俱 
ZH_X76_1516_009:0096a12	胝像。約以像開眸即雨。至三日像果開眸。有物自壇	009	胝 像  約 以 像 開 眸 即 雨  至 三 日 像 果 開 眸  有 物 自 壇 
ZH_X76_1516_009:0096a13	布雲彌空。斯須而雨。帝降詔褒美。	009	布 雲 彌 空  斯 須 而 雨  帝 降 詔 褒 美  
ZH_X76_1516_009:0096a14	辛酉(九)	009	辛 酉  九  
ZH_X76_1516_009:0096a15	釋智嚴。譯修行等經六卷○天竺寶思惟遷寂。壽百	009	釋 智 嚴  譯 修 行 等 經 六 卷  天 竺 寶 思 惟 遷 寂  壽 百 
ZH_X76_1516_009:0096a16	餘歲○四月朝廷以麟德曆不驗。詔禪師一行。改撰	009	餘 歲  四 月 朝 廷 以 麟 德 曆 不 驗  詔 禪 師 一 行  改 撰 
ZH_X76_1516_009:0096a17	新曆。行推大衍數。立術以應之。道士刑和璞。謂太史	009	新 曆  行 推 大 衍 數  立 術 以 應 之  道 士 刑 和 璞  謂 太 史 
ZH_X76_1516_009:0096a18	令尹愔曰。一行其聖人乎。昔洛下閎造太初曆。嘗記	009	令 尹 愔 曰  一 行 其 聖 人 乎  昔 洛 下 閎 造 太 初 曆  嘗 記 
ZH_X76_1516_009:0096a19	曰。八百年後。當差一日。必有聖人紏正之。今年期差	009	曰  八 百 年 後  當 差 一 日  必 有 聖 人 紏 正 之  今 年 期 差 
ZH_X76_1516_009:0096a20	滿。而一行推數以紏數家之繆。閎言不誣矣。愔亦以	009	滿  而 一 行 推 數 以 紏 數 家 之 繆  閎 言 不 誣 矣  愔 亦 以 
ZH_X76_1516_009:0096a21	為然。	009	為 然  
ZH_X76_1516_009:0096a22	壬戌(十)	009	壬 戌  十  
ZH_X76_1516_009:0096a23	七月旱。帝遣使詔三藏無畏請雨。畏持滿鉢水。以小	009	七 月 旱  帝 遣 使 詔 三 藏 無 畏 請 雨  畏 持 滿 鉢 水  以 小 
ZH_X76_1516_009:0096a24	刀攪之。誦呪數番。即有物如蚪龍。從鉢矯首水面。畏	009	刀 攪 之  誦 呪 數 番  即 有 物 如 蚪 龍  從 鉢 矯 首 水 面  畏 
ZH_X76_1516_009:0096b01	呪遣之。白氣自鉢騰涌。語詔使曰。速歸。雨即至矣。詔	009	呪 遣 之  白 氣 自 鉢 騰 涌  語 詔 使 曰  速 歸  雨 即 至 矣  詔 
ZH_X76_1516_009:0096b02	使馳出。頃刻風雷震電。詔使趨入奏。御衣巾已透濕	009	使 馳 出  頃 刻 風 雷 震 電  詔 使 趨 入 奏  御 衣 巾 已 透 濕 
ZH_X76_1516_009:0096b03	霖雨。彌日而息。又嘗霖霪逾時。詔畏止之。畏揑泥媼	009	霖 雨  彌 日 而 息  又 嘗 霖 霪 逾 時  詔 畏 止 之  畏 揑 泥 媼 
ZH_X76_1516_009:0096b04	五軀。向之作梵語。若斥罵者。即刻而霽。其神驗類如	009	五 軀  向 之 作 梵 語  若 斥 罵 者  即 刻 而 霽  其 神 驗 類 如 
ZH_X76_1516_009:0096b05	此。帝敬之若神。	009	此  帝 敬 之 若 神  
ZH_X76_1516_009:0096b06	癸亥(十一)	009	癸 亥  十 一  
ZH_X76_1516_009:0096b07	金剛智。譯瑜伽念誦法。及七俱胝陀羅尼(今在藏)○十	009	金 剛 智  譯 瑜 伽 念 誦 法  及 七 俱 胝 陀 羅 尼  今 在 藏   十 
ZH_X76_1516_009:0096b08	月。禪師一行。製黃道儀成。帝自為之銘。詔安武成殿。	009	月  禪 師 一 行  製 黃 道 儀 成  帝 自 為 之 銘  詔 安 武 成 殿  
ZH_X76_1516_009:0096b09	以示百官。其儀準圓天之像。具列宿赤道度數。注水	009	以 示 百 官  其 儀 準 圓 天 之 像  具 列 宿 赤 道 度 數  注 水 
ZH_X76_1516_009:0096b10	激輪。令其自轉。一晝夜而天運周。外絡二輪。綴以日	009	激 輪  令 其 自 轉  一 晝 夜 而 天 運 周  外 絡 二 輪  綴 以 日 
ZH_X76_1516_009:0096b11	月。令得運行。每天東行一周。日西行一度。月行十三	009	月  令 得 運 行  每 天 東 行 一 周  日 西 行 一 度  月 行 十 三 
ZH_X76_1516_009:0096b12	度。以木匱為地平。令儀半在地下。晦明朔望有準。立	009	度  以 木 匱 為 地 平  令 儀 半 在 地 下  晦 明 朔 望 有 準  立 
ZH_X76_1516_009:0096b13	木人二於地平。其一前置鼓以候刻。至一刻則自擊	009	木 人 二 於 地 平  其 一 前 置 鼓 以 候 刻  至 一 刻 則 自 擊 
ZH_X76_1516_009:0096b14	之。其一前置鍾以候辰。至辰則自撞之。皆略施輪軸。	009	之  其 一 前 置 鍾 以 候 辰  至 辰 則 自 撞 之  皆 略 施 輪 軸  
ZH_X76_1516_009:0096b15	交錯相持。稱其為神功(竝舊唐史)。	009	交 錯 相 持  稱 其 為 神 功  竝 舊 唐 史   
ZH_X76_1516_009:0096b16	甲子(十二)	009	甲 子  十 二  
ZH_X76_1516_009:0096b17	菩提流志。隨駕入洛。勑安置長壽寺○善無畏。隨駕	009	菩 提 流 志  隨 駕 入 洛  勑 安 置 長 壽 寺  善 無 畏  隨 駕 
ZH_X76_1516_009:0096b18	入洛。於大福先寺。譯毗盧遮那蘇息地。羯羅等經。三	009	入 洛  於 大 福 先 寺  譯 毗 盧 遮 那 蘇 息 地  羯 羅 等 經  三 
ZH_X76_1516_009:0096b19	部十三卷。竝總持妙門。禪師一行三藏寶月等。參預	009	部 十 三 卷  竝 總 持 妙 門  禪 師 一 行 三 藏 寶 月 等  參 預 
ZH_X76_1516_009:0096b20	其事。畏好禪觀。每勸學者習之○沙門牛雲不慧。詣	009	其 事  畏 好 禪 觀  每 勸 學 者 習 之  沙 門 牛 雲 不 慧  詣 
ZH_X76_1516_009:0096b21	五臺山禮文殊。殊現老人身。為钁胸中淤肉。自是卞	009	五 臺 山 禮 文 殊  殊 現 老 人 身  為 钁 胸 中 淤 肉  自 是 卞 
ZH_X76_1516_009:0096b22	悟。為時導師(通論)○溫州淨居寺尼玄機。景雲中得度。	009	悟  為 時 導 師  通 論   溫 州 淨 居 寺 尼 玄 機  景 雲 中 得 度  
ZH_X76_1516_009:0096b23	常習定於平陽大日山石窟中。或者云。嘗與兄宿覺	009	常 習 定 於 平 陽 大 日 山 石 窟 中  或 者 云  嘗 與 兄 宿 覺 
ZH_X76_1516_009:0096b24	同參六祖。因著圓明歌。與證道歌。相表裏。後倒立而	009	同 參 六 祖  因 著 圓 明 歌  與 證 道 歌  相 表 裏  後 倒 立 而 
ZH_X76_1516_009:0096c01	化。法屬以生死顛倒語呵之。應聲而仆。將葬之夕。風	009	化  法 屬 以 生 死 顛 倒 語 呵 之  應 聲 而 仆  將 葬 之 夕  風 
ZH_X76_1516_009:0096c02	雷陰黯。若有神物移之。越二日。有自大日來者云。是	009	雷 陰 黯  若 有 神 物 移 之  越 二 日  有 自 大 日 來 者 云  是 
ZH_X76_1516_009:0096c03	夕空中有蕭罄聲。機之柩已厝是峯上。其徒迎舍利	009	夕 空 中 有 蕭 罄 聲  機 之 柩 已 厝 是 峯 上  其 徒 迎 舍 利 
ZH_X76_1516_009:0096c04	歸葬于寺。建浮屠。號圓明塔。趙清獻公。立碑載其事	009	歸 葬 于 寺  建 浮 屠  號 圓 明 塔  趙 清 獻 公  立 碑 載 其 事 
ZH_X76_1516_009:0096c05	(永寧編)。	009	 永 寧 編   
ZH_X76_1516_009:0096c06	乙丑(十三)	009	乙 丑  十 三  
ZH_X76_1516_009:0096c07	嵩岳破竈墮和尚。隱居嵩山。山有廟甚靈。廟唯安一	009	嵩 岳 破 竈 墮 和 尚  隱 居 嵩 山  山 有 廟 甚 靈  廟 唯 安 一 
ZH_X76_1516_009:0096c08	竈。祭無虗日。師入廟以杖擊竈云。此泥瓦合成。聖從	009	竈  祭 無 虗 日  師 入 廟 以 杖 擊 竈 云  此 泥 瓦 合 成  聖 從 
ZH_X76_1516_009:0096c09	何來。靈從何起。又擊三下。竈乃傾破墮落。須臾一青	009	何 來  靈 從 何 起  又 擊 三 下  竈 乃 傾 破 墮 落  須 臾 一 青 
ZH_X76_1516_009:0096c10	衣人。設拜師前曰。我本此竈神。久受業報。蒙師說無	009	衣 人  設 拜 師 前 曰  我 本 此 竈 神  久 受 業 報  蒙 師 說 無 
ZH_X76_1516_009:0096c11	生法。得脫此生天。特來禮謝。神再拜而去。少頃徒眾	009	生 法  得 脫 此 生 天  特 來 禮 謝  神 再 拜 而 去  少 頃 徒 眾 
ZH_X76_1516_009:0096c12	問師。竈神得何徑旨。便得生天。師曰。我只向伊道是	009	問 師  竈 神 得 何 徑 旨  便 得 生 天  師 曰  我 只 向 伊 道 是 
ZH_X76_1516_009:0096c13	泥瓦合成。別無道理為伊。眾無語。師良久云會麼。眾	009	泥 瓦 合 成  別 無 道 理 為 伊  眾 無 語  師 良 久 云 會 麼  眾 
ZH_X76_1516_009:0096c14	云不會。師曰。本有之性。為什麼不會。眾僧乃禮拜。師	009	云 不 會  師 曰  本 有 之 性  為 什 麼 不 會  眾 僧 乃 禮 拜  師 
ZH_X76_1516_009:0096c15	曰。破也墮也。於是其眾皆悟玄旨。	009	曰  破 也 墮 也  於 是 其 眾 皆 悟 玄 旨  
ZH_X76_1516_009:0096c16	丙寅(十四)	009	丙 寅  十 四  
ZH_X76_1516_009:0096c17	日本國沙門榮叡等。至楊州。奉僧伽梨十領。其上綴	009	日 本 國 沙 門 榮 叡 等  至 楊 州  奉 僧 伽 梨 十 領  其 上 綴 
ZH_X76_1516_009:0096c18	以山川異物之狀。盖其國主附之。以施中國沙門。時	009	以 山 川 異 物 之 狀  盖 其 國 主 附 之  以 施 中 國 沙 門  時 
ZH_X76_1516_009:0096c19	律師鑒真。受其衣。歎外國人有佛種性。欲往化之。會	009	律 師 鑒 真  受 其 衣  歎 外 國 人 有 佛 種 性  欲 往 化 之  會 
ZH_X76_1516_009:0096c20	叡等勸請。遂附舶而東至日本。彼王枉駕迎勞。舘于	009	叡 等 勸 請  遂 附 舶 而 東 至 日 本  彼 王 枉 駕 迎 勞  舘 于 
ZH_X76_1516_009:0096c21	毗盧殿。未幾請真授歸戒。夫人羣臣。皆以次稟授。日	009	毗 盧 殿  未 幾 請 真 授 歸 戒  夫 人 羣 臣  皆 以 次 稟 授  日 
ZH_X76_1516_009:0096c22	本自是始有律教。	009	本 自 是 始 有 律 教  
ZH_X76_1516_009:0096c23	丁卯(十五)	009	丁 卯  十 五  
ZH_X76_1516_009:0096c24	十一月。三藏菩提流志示寂。春秋一百五十六。前後	009	十 一 月  三 藏 菩 提 流 志 示 寂  春 秋 一 百 五 十 六  前 後 
ZH_X76_1516_009:0097a01	總譯五十三部。合一百一十卷。自天后長壽中。至京	009	總 譯 五 十 三 部  合 一 百 一 十 卷  自 天 后 長 壽 中  至 京 
ZH_X76_1516_009:0097a02	三十餘年。華嚴寶積等經。皆出其手。帝及公卿。敬之	009	三 十 餘 年  華 嚴 寶 積 等 經  皆 出 其 手  帝 及 公 卿  敬 之 
ZH_X76_1516_009:0097a03	如生佛。葬日特給鹵簿羽儀。塔于龍門西原。追贈鴻	009	如 生 佛  葬 日 特 給 鹵 簿 羽 儀  塔 于 龍 門 西 原  追 贈 鴻 
ZH_X76_1516_009:0097a04	臚大卿。諡賜曰開元一切遍知三藏。名德之盛。古未	009	臚 大 卿  諡 賜 曰 開 元 一 切 遍 知 三 藏  名 德 之 盛  古 未 
ZH_X76_1516_009:0097a05	有焉○十一月。禪師一行。沐浴端坐而逝。春秋四十	009	有 焉  十 一 月  禪 師 一 行  沐 浴 端 坐 而 逝  春 秋 四 十 
ZH_X76_1516_009:0097a06	五。帝哭之哀甚。輟朝三日。停龕三七日。行容貌如生。	009	五  帝 哭 之 哀 甚  輟 朝 三 日  停 龕 三 七 日  行 容 貌 如 生  
ZH_X76_1516_009:0097a07	帝親製碑。書之于石。出內庫五十萬。建塔銅人原。諡	009	帝 親 製 碑  書 之 于 石  出 內 庫 五 十 萬  建 塔 銅 人 原  諡 
ZH_X76_1516_009:0097a08	曰大慧禪師。帝嘗問國祚幾何。有留難否。行曰。鑾輿	009	曰 大 慧 禪 師  帝 嘗 問 國 祚 幾 何  有 留 難 否  行 曰  鑾 輿 
ZH_X76_1516_009:0097a09	有萬里之行。社稷終吉。帝驚問其故。不答。退以小金	009	有 萬 里 之 行  社 稷 終 吉  帝 驚 問 其 故  不 答  退 以 小 金 
ZH_X76_1516_009:0097a10	合進之曰。至萬里即開。帝一日發合視之。盖當歸少	009	合 進 之 曰  至 萬 里 即 開  帝 一 日 發 合 視 之  盖 當 歸 少 
ZH_X76_1516_009:0097a11	許。及祿山亂。駕幸成都。至萬里橋忽悟。末幾果歸。昭	009	許  及 祿 山 亂  駕 幸 成 都  至 萬 里 橋 忽 悟  末 幾 果 歸  昭 
ZH_X76_1516_009:0097a12	宗初封吉王。而唐以昭宗而滅。故云終吉。有里媼素	009	宗 初 封 吉 王  而 唐 以 昭 宗 而 滅  故 云 終 吉  有 里 媼 素 
ZH_X76_1516_009:0097a13	供行。而媼子坐罪將之刑。媼悲泣請救。行憐之。令弟	009	供 行  而 媼 子 坐 罪 將 之 刑  媼 悲 泣 請 救  行 憐 之  令 弟 
ZH_X76_1516_009:0097a14	子捕生物。得雉豕七。行日藏其一於甕中。為梵語呪	009	子 捕 生 物  得 雉 豕 七  行 日 藏 其 一 於 甕 中  為 梵 語 呪 
ZH_X76_1516_009:0097a15	之七日。北斗盡沒。朝廷震驚。太史奏。將有變請禳之。	009	之 七 日  北 斗 盡 沒  朝 廷 震 驚  太 史 奏  將 有 變 請 禳 之  
ZH_X76_1516_009:0097a16	帝以問行。對曰。此無他。盖妖魔也。凡嗔心壞一切善。	009	帝 以 問 行  對 曰  此 無 他  盖 妖 魔 也  凡 嗔 心 壞 一 切 善  
ZH_X76_1516_009:0097a17	慈心降一切魔。若肆赦天下。則妖不能為。帝然之。遂	009	慈 心 降 一 切 魔  若 肆 赦 天 下  則 妖 不 能 為  帝 然 之  遂 
ZH_X76_1516_009:0097a18	大赦。媼子由是得免。行日出一豕。則一星現。至七日	009	大 赦  媼 子 由 是 得 免  行 日 出 一 豕  則 一 星 現  至 七 日 
ZH_X76_1516_009:0097a19	而斗復如故。其秘術多此類(舊唐史)。	009	而 斗 復 如 故  其 秘 術 多 此 類  舊 唐 史   
ZH_X76_1516_009:0097a20	戊辰(十六)	009	戊 辰  十 六  
ZH_X76_1516_009:0097a21	詔張說等。編次一行大衍曆施用。三月駕幸溫湯。道	009	詔 張 說 等  編 次 一 行 大 衍 曆 施 用  三 月 駕 幸 溫 湯  道 
ZH_X76_1516_009:0097a22	由一行塔所。帝為駐蹕徘徊。令品官詣塔。告以出豫	009	由 一 行 塔 所  帝 為 駐 蹕 徘 徊  令 品 官 詣 塔  告 以 出 豫 
ZH_X76_1516_009:0097a23	之意。賜帛五十疋。令蒔塔前松栢。其為聖眷如此(本傳)。	009	之 意  賜 帛 五 十 疋  令 蒔 塔 前 松 栢  其 為 聖 眷 如 此  本 傳   
ZH_X76_1516_009:0097a24	己巳(十七)	009	己 巳  十 七  
ZH_X76_1516_009:0097b01	燕國公張說薨。說為唐宗臣。為文精壯。尤善釋典。著	009	燕 國 公 張 說 薨  說 為 唐 宗 臣  為 文 精 壯  尤 善 釋 典  著 
ZH_X76_1516_009:0097b02	般若心經序曰。萬行起於心。心者人之主。三乘歸於	009	般 若 心 經 序 曰  萬 行 起 於 心  心 者 人 之 主  三 乘 歸 於 
ZH_X76_1516_009:0097b03	一。一者法之宗。知心無所得是真得。見一無不通是	009	一  一 者 法 之 宗  知 心 無 所 得 是 真 得  見 一 無 不 通 是 
ZH_X76_1516_009:0097b04	玄通(云云)。又製法池院法堂贊曰。是佛虗空相。是法	009	玄 通  云 云   又 製 法 池 院 法 堂 贊 曰  是 佛 虗 空 相  是 法 
ZH_X76_1516_009:0097b05	微妙光。定慧不相離。是僧和合義。人空法亦空。二空	009	微 妙 光  定 慧 不 相 離  是 僧 和 合 義  人 空 法 亦 空  二 空 
ZH_X76_1516_009:0097b06	亦復空。住心三空寶。是名三歸處。見若不染色。知若	009	亦 復 空  住 心 三 空 寶  是 名 三 歸 處  見 若 不 染 色  知 若 
ZH_X76_1516_009:0097b07	不取識。是名真實見。亦名解脫知。佛觀離生滅。諸法	009	不 取 識  是 名 真 實 見  亦 名 解 脫 知  佛 觀 離 生 滅  諸 法 
ZH_X76_1516_009:0097b08	等如是。	009	等 如 是  
ZH_X76_1516_009:0097b09	庚午(十八)	009	庚 午  十 八  
ZH_X76_1516_009:0097b10	金剛智。又出曼殊五字心。及觀音瑜伽要○唐朝傳	009	金 剛 智  又 出 曼 殊 五 字 心  及 觀 音 瑜 伽 要  唐 朝 傳 
